,ticker,comment,username,score,permalink,neg,neu,pos,compound
0,ASML," ASML is one play here, they’re a Dutch company but they have critical US operations and sell their equipment to US companies who make the chips. I would be very surprised if they didn’t see any of that money either directly or indirectly",Hulque94,19,/r/investing/comments/opjbxe/us_developing_plans_to_spend_52_billion_on_chips/h661q1m/,0.065,0.836,0.099,0.138
1,AMAT," The best plays for now are AMAT, LRCX, ASML, and KLAC.  

That money is going to go straight in the above companies pockets.",JayArlington,8,/r/investing/comments/opjbxe/us_developing_plans_to_spend_52_billion_on_chips/h6636fa/,0.0,0.712,0.288,0.7964
2,ASML," The best plays for now are AMAT, LRCX, ASML, and KLAC.  

That money is going to go straight in the above companies pockets.",JayArlington,8,/r/investing/comments/opjbxe/us_developing_plans_to_spend_52_billion_on_chips/h6636fa/,0.0,0.712,0.288,0.7964
3,KLAC," The best plays for now are AMAT, LRCX, ASML, and KLAC.  

That money is going to go straight in the above companies pockets.",JayArlington,8,/r/investing/comments/opjbxe/us_developing_plans_to_spend_52_billion_on_chips/h6636fa/,0.0,0.712,0.288,0.7964
4,LRCX," The best plays for now are AMAT, LRCX, ASML, and KLAC.  

That money is going to go straight in the above companies pockets.",JayArlington,8,/r/investing/comments/opjbxe/us_developing_plans_to_spend_52_billion_on_chips/h6636fa/,0.0,0.712,0.288,0.7964
5,IIVI," Not just the SC manufacturers, but their secondary suppliers as well. They will set up new fabs, those need all of the lithographic supplies, lasers, automation, etc. 

IIVI is my play. Burgeoning capital goods sector will help drive future earnings, especially with recent purchase of Coherent.",Camp_Camp_Camp_Camp,1,/r/investing/comments/opjbxe/us_developing_plans_to_spend_52_billion_on_chips/h667uvk/,0.0,0.822,0.178,0.8519
6,SC," Not just the SC manufacturers, but their secondary suppliers as well. They will set up new fabs, those need all of the lithographic supplies, lasers, automation, etc. 

IIVI is my play. Burgeoning capital goods sector will help drive future earnings, especially with recent purchase of Coherent.",Camp_Camp_Camp_Camp,1,/r/investing/comments/opjbxe/us_developing_plans_to_spend_52_billion_on_chips/h667uvk/,0.0,0.822,0.178,0.8519
7,QCOM, Can someone explain how QCOM benefits? They are fabless.,Stuck_in_a_thing,1,/r/investing/comments/opjbxe/us_developing_plans_to_spend_52_billion_on_chips/h669763/,0.0,0.755,0.245,0.3818
8,ASML, I am a proud Dutch ASML holder and will continue to be but it has done really well lately and I feel like their big advantage in the shortage is now priced in,balabelmonte,1,/r/investing/comments/opjbxe/us_developing_plans_to_spend_52_billion_on_chips/h6677ux/,0.065,0.651,0.284,0.8121
9,INTC," Here's the thing:

>Intel's 10nm transistor density is pretty competitive with TSMC's latest 7nm nodes.

TSMC's latest isn't 7nm. **It's 5nm.**

*And* the apparently they're *killing it* on 5nm yields.

*And* they're on track to produce meaningful quantities of 4nm [this year.](https://www.tomshardware.com/news/tsmc-on-track-for-n4-risk-production-in-q3-2021)

*And* they've got 3nm, 2nm, and 1nm *solidly in the pipeline, with concrete progress shown and a gameplan for executing*.

TSMC is a monster, and INTC is struggling to keep up.",Recoil42,11,/r/investing/comments/opjbxe/us_developing_plans_to_spend_52_billion_on_chips/h661072/,0.036,0.838,0.127,0.7351
10,IMO," They've outspent TSMC in almost every turn the past decade and yet here we are.

IMO their main problems are a) complacency b) inflexible business model.

More money would make both of their problems worse, not better.",miscsubs,5,/r/investing/comments/opjbxe/us_developing_plans_to_spend_52_billion_on_chips/h65xpld/,0.248,0.752,0.0,-0.8722
11,USA," >Another thing people kind of forget when it comes to TSMC is that Apple has secured the lion share of their production, which gives Apple too much leverage over TSMC and could be an issue as time moves on.

I see the reverse dynamic: 

There are plenty of other companies that would take up TSMC production, given the chance. Apple has **paid a premium** to take up the lion's share of production. They're now **fully materially invested** in TSMC, which means the world's most profitable, valuable tech company is now invested in their continued success and strengthening that relationship.

That politically makes the USA very interested in the further success and stability of Taiwan, which is also of massive benefit to TSMC.",Recoil42,18,/r/investing/comments/opjbxe/us_developing_plans_to_spend_52_billion_on_chips/h661ntm/,0.015,0.743,0.242,0.9844
12,ASM," leadership is the issue and why nvda/amd/tsmc are crushing it in comparison.

gelsinger is a pretty solid choice for ceo, but not loving the fact they put a software guy in charge of ATG. should have gotten someone with a background in litho/dep, maybe tried to poach from ASM/TEL/LAM/AMAT.",runsongas,1,/r/investing/comments/opjbxe/us_developing_plans_to_spend_52_billion_on_chips/h663djm/,0.116,0.818,0.066,-0.5528
13,USA," I agree that its a good thing for TSMC currently, but as an investor it is priced in already and any issues with the Apple/TSMC relationship will hurt TSMC. Putting all your eggs in apples basket just makes TSMC potentially weaker in negotiating contracts or if apple drops them when someone else catches up.   


TSMC is here to stay though. They are building big factories in the USA for reasons you stated. Politically Intel will always have the edge though since they are an American company. 

Last big wrinkle that makes me nervous about TSMC is China is always posturing to take Taiwan back. If they every make a move on that it will be a bad day for that stock.",donktastic,1,/r/investing/comments/opjbxe/us_developing_plans_to_spend_52_billion_on_chips/h669rb1/,0.121,0.85,0.028,-0.9343
14,AAPL," All RED now, AAPL up by 1.16%",Bozzooo,17,/r/investing/comments/opczg6/stock_market_news_live_updates_wall_street_looks/h65483k/,0.0,1.0,0.0,0.0
15,MNMD, I'm in MNMD for the long run. Going for medical purpose which show true potential and will only grow as more states open up.,Doodoss,17,/r/investing/comments/oozoxf/investing_in_psychedelics_stocks/h61zhn8/,0.0,0.891,0.109,0.4215
16,ATAI," ATAI looks the best by far, not sure what the exit catalyst is though. Buy…wait…pray?",blind_ekorre,4,/r/investing/comments/oozoxf/investing_in_psychedelics_stocks/h62cxrs/,0.102,0.678,0.219,0.5003
17,ATAI, ATAI owns 20% of CMPS so you get double exposure.,EricTheRed78,4,/r/investing/comments/oozoxf/investing_in_psychedelics_stocks/h63q5rl/,0.0,1.0,0.0,0.0
18,CMPS, ATAI owns 20% of CMPS so you get double exposure.,EricTheRed78,4,/r/investing/comments/oozoxf/investing_in_psychedelics_stocks/h63q5rl/,0.0,1.0,0.0,0.0
19,TRIP," My favourite companies in the space:

NUMI, CYBN, TRIP, MMED, BRAXIA. MASSIVE emerging trend. I love high risk- high reward industries. Honestly take profits when you can & just DCA back into the companies you believe in long term. Will take time for the industry to form but we should have a few bull runs along the way.",CognitiveJay,3,/r/investing/comments/oozoxf/investing_in_psychedelics_stocks/h636ly8/,0.026,0.827,0.147,0.7469
20,CMPS," All: I studied in both medical school and business school. Psychiatric care is growing exponentially. The way I view it is: 

1. Entheogens will win out: boosting companies such as MMED (and others that utilize plant based products) catapulting some of the smaller unlisted companies into IPOs.

2. Companies such as CMPS, which utilized synthesized versions of the molecules (I believe they own the only patent for synthetic psilocybin), will forge breakthroughs and, in an effort to profit the most (as seen with the Spravato Enantiomer (mirror molecule of Ketamine), the companies will patent what is readily provided and available. This has already backfired due to the cost, bureaucratic red tape with insurance companies, etc and time commitment needed, as well as Covid and Telehealth, so many psychiatrists are prescribing generic racemic ketamine nasal sprays that are working wonders for people for far less than the $580+ per treatment Spravato. 

3. Similar to Cannabis, big Pharma will stay on their lane an act as an ""oversight"" committee for the natural growers of entheogens. Much of this would rely on the political climate. Big business or Mother Earth type battle. We have millions of vets whom we have proven we could help through clinical studies. In a matter of 2 years, with the correct climate, we could start see MG these treatments made accessible to all. The DOD published a groundbreaking study showing that synthetic psilocybin (made utilizing synthesis to extract the hallucinogenic properties) was far less effective and the experience of the user is necessary for efficacy. 

I am bullish on all of these stocks. CPMS is UK based, but have operations in the US and Canada. MMED has several trial clinics that are faring well, 

*There is an ETF $PSY that focuses on spreading out ones investments among the various psychopharmacology firms.",Popo0017,2,/r/investing/comments/oozoxf/investing_in_psychedelics_stocks/h63okmx/,0.006,0.923,0.072,0.9225
21,MG," All: I studied in both medical school and business school. Psychiatric care is growing exponentially. The way I view it is: 

1. Entheogens will win out: boosting companies such as MMED (and others that utilize plant based products) catapulting some of the smaller unlisted companies into IPOs.

2. Companies such as CMPS, which utilized synthesized versions of the molecules (I believe they own the only patent for synthetic psilocybin), will forge breakthroughs and, in an effort to profit the most (as seen with the Spravato Enantiomer (mirror molecule of Ketamine), the companies will patent what is readily provided and available. This has already backfired due to the cost, bureaucratic red tape with insurance companies, etc and time commitment needed, as well as Covid and Telehealth, so many psychiatrists are prescribing generic racemic ketamine nasal sprays that are working wonders for people for far less than the $580+ per treatment Spravato. 

3. Similar to Cannabis, big Pharma will stay on their lane an act as an ""oversight"" committee for the natural growers of entheogens. Much of this would rely on the political climate. Big business or Mother Earth type battle. We have millions of vets whom we have proven we could help through clinical studies. In a matter of 2 years, with the correct climate, we could start see MG these treatments made accessible to all. The DOD published a groundbreaking study showing that synthetic psilocybin (made utilizing synthesis to extract the hallucinogenic properties) was far less effective and the experience of the user is necessary for efficacy. 

I am bullish on all of these stocks. CPMS is UK based, but have operations in the US and Canada. MMED has several trial clinics that are faring well, 

*There is an ETF $PSY that focuses on spreading out ones investments among the various psychopharmacology firms.",Popo0017,2,/r/investing/comments/oozoxf/investing_in_psychedelics_stocks/h63okmx/,0.006,0.923,0.072,0.9225
22,UK," All: I studied in both medical school and business school. Psychiatric care is growing exponentially. The way I view it is: 

1. Entheogens will win out: boosting companies such as MMED (and others that utilize plant based products) catapulting some of the smaller unlisted companies into IPOs.

2. Companies such as CMPS, which utilized synthesized versions of the molecules (I believe they own the only patent for synthetic psilocybin), will forge breakthroughs and, in an effort to profit the most (as seen with the Spravato Enantiomer (mirror molecule of Ketamine), the companies will patent what is readily provided and available. This has already backfired due to the cost, bureaucratic red tape with insurance companies, etc and time commitment needed, as well as Covid and Telehealth, so many psychiatrists are prescribing generic racemic ketamine nasal sprays that are working wonders for people for far less than the $580+ per treatment Spravato. 

3. Similar to Cannabis, big Pharma will stay on their lane an act as an ""oversight"" committee for the natural growers of entheogens. Much of this would rely on the political climate. Big business or Mother Earth type battle. We have millions of vets whom we have proven we could help through clinical studies. In a matter of 2 years, with the correct climate, we could start see MG these treatments made accessible to all. The DOD published a groundbreaking study showing that synthetic psilocybin (made utilizing synthesis to extract the hallucinogenic properties) was far less effective and the experience of the user is necessary for efficacy. 

I am bullish on all of these stocks. CPMS is UK based, but have operations in the US and Canada. MMED has several trial clinics that are faring well, 

*There is an ETF $PSY that focuses on spreading out ones investments among the various psychopharmacology firms.",Popo0017,2,/r/investing/comments/oozoxf/investing_in_psychedelics_stocks/h63okmx/,0.006,0.923,0.072,0.9225
23,CMPS, CMPS is the best psychedelic stock out there. Do some research.,danielunited,1,/r/investing/comments/oozoxf/investing_in_psychedelics_stocks/h63h9ec/,0.0,0.704,0.296,0.6369
24,CMPS," Once the stigma of it being related to LSD fades long term and more studies are produced this will be a hot piece of pharma. CMPS, SEEL, RVVTF, MNMD all in the space currently and all are speculative at this point.",rpoh73189,1,/r/investing/comments/oozoxf/investing_in_psychedelics_stocks/h645t2y/,0.0,0.965,0.035,0.1027
25,MNMD," Once the stigma of it being related to LSD fades long term and more studies are produced this will be a hot piece of pharma. CMPS, SEEL, RVVTF, MNMD all in the space currently and all are speculative at this point.",rpoh73189,1,/r/investing/comments/oozoxf/investing_in_psychedelics_stocks/h645t2y/,0.0,0.965,0.035,0.1027
26,SEEL," Once the stigma of it being related to LSD fades long term and more studies are produced this will be a hot piece of pharma. CMPS, SEEL, RVVTF, MNMD all in the space currently and all are speculative at this point.",rpoh73189,1,/r/investing/comments/oozoxf/investing_in_psychedelics_stocks/h645t2y/,0.0,0.965,0.035,0.1027
27,ATAI, ATAI,Momos-Blasters,1,/r/investing/comments/oozoxf/investing_in_psychedelics_stocks/h64urn0/,0.0,1.0,0.0,0.0
28,UK," [Epilodex](https://www.epidiolex.com) got FDA approval. The UK based company enjoyed enormous growth over a period of 20 years and finally got bought out at ~$220 / share.

Can’t remember the valuation, but it was somewhere in the range of… nevermind, it was $7.2B USD",NextTrillion,1,/r/investing/comments/oozoxf/investing_in_psychedelics_stocks/h6643k9/,0.0,0.83,0.17,0.6808
29,MNMD," Awesome.  Yeah, I have some MNMD and CLXPF.  Thinking about getting some atai, too.  I agree, though, based on the research I'm reading about the efficacy of some of these drugs.  Particularly as it pertains to treating veterans with PTSD.  Pretty exciting stuff, indeed. :)",LibertarianTreehug,8,/r/investing/comments/oozoxf/investing_in_psychedelics_stocks/h61zcyb/,0.0,0.67,0.33,0.9531
30,MAPS," Bro you’re clearly not following the legislation. Oregon measure 109, & I believe 8 other states have changed the legal framework for psychedelics. & many more states are currently in the process, I can link resources if wanted.

Canada allowed NUMI to grow Psilocybin mushrooms legally through SAP. In 2 months they will be serving up too a thousand patients for MDMA & Psilocybin therapy.  Health Canada approved the ground-breaking exemption for a Section 56 application enabling access to legal psychedelic-assisted therapy for the first time in approximately 40 years. 

Companies like MAPS have been doing research for over 30 years on various psychedelics. I’m not even mad that people are sleeping on this space. Will take time for public perception to change but It’s already happening quickly.

Truffles are also legal in the Netherlands. & health Canada has already accepted & received Truffles from RLH this year through SAP.",CognitiveJay,6,/r/investing/comments/oozoxf/investing_in_psychedelics_stocks/h637vvl/,0.0,0.894,0.106,0.856
31,SAP," Bro you’re clearly not following the legislation. Oregon measure 109, & I believe 8 other states have changed the legal framework for psychedelics. & many more states are currently in the process, I can link resources if wanted.

Canada allowed NUMI to grow Psilocybin mushrooms legally through SAP. In 2 months they will be serving up too a thousand patients for MDMA & Psilocybin therapy.  Health Canada approved the ground-breaking exemption for a Section 56 application enabling access to legal psychedelic-assisted therapy for the first time in approximately 40 years. 

Companies like MAPS have been doing research for over 30 years on various psychedelics. I’m not even mad that people are sleeping on this space. Will take time for public perception to change but It’s already happening quickly.

Truffles are also legal in the Netherlands. & health Canada has already accepted & received Truffles from RLH this year through SAP.",CognitiveJay,6,/r/investing/comments/oozoxf/investing_in_psychedelics_stocks/h637vvl/,0.0,0.894,0.106,0.856
32,MNMD, MNMD and LKYSF were the first two I bought.  I am also in BRAXF and RVVTF.,JTakaMakaveli,6,/r/investing/comments/oozoxf/investing_in_psychedelics_stocks/h62u3j8/,0.0,1.0,0.0,0.0
33,RSI," Anyone know of an app that will tell me the RSI of each stock in my watchlist? I know fundamentals are king, but I think there is some value to RSI. I also don't want to manually Google the RSI of the 100+ stocks on my watchlist",swimtomars,1,/r/investing/comments/opa2wb/daily_advice_thread_all_basic_help_or_advice/h64nsow/,0.029,0.905,0.067,0.4151
34,SPRT, Hello everyone. This week I purchased 8/20 $5 call for SPRT and im currently up 110%. I’m still new to this and I feel like I never sell at the right time. Would now be a good time to sell ? I’ve only had these calls for a short period and the expiration is about three weeks away. Any advice would be appreciated !,squishy-1,1,/r/investing/comments/opa2wb/daily_advice_thread_all_basic_help_or_advice/h64o28s/,0.0,0.857,0.143,0.8398
35,PLTR, Yes sell now. Honestly the be biggest mistake I make with options is getting greedy and not taking my profits. I was up a ton on PLTR and YOLO but didn't take profits and lost it all. Double your money is good money for stocks in a short time,donktastic,3,/r/investing/comments/opa2wb/daily_advice_thread_all_basic_help_or_advice/h654jup/,0.196,0.635,0.17,-0.1269
36,USA," Thanks, u/jammerjoint, u/LiqCourage, and u/FromBayToBurg.

I guess more about me: My time horizon is 5-10 years out, just have no need for the additional cash on hand right now hence wanting to invest more into taxable account.

Most of my comp is RSUs, but I sell immediately and diversify away from the company. 

I am pretty overly exposed to USA tech and have some EMQQ and international stocks, but moved away from those during USA bull market. I should likely leverage myself back into some of them.",0xC0ffe3,1,/r/investing/comments/opa2wb/daily_advice_thread_all_basic_help_or_advice/h6677zf/,0.034,0.872,0.093,0.743
37,DIDI," Puts on DIDI

https://finance.yahoo.com/news/china-weighs-serious-penalties-didi-113850821.html",TheseYoung6546,2,/r/investing/comments/opa3e5/daily_general_discussion_and_spitballin_thread/h63zaff/,0.0,1.0,0.0,0.0
38,DE," Looking into DE. Unless my very novice understanding of their financials is completely off base, they look like a great value, and the company is insanely cash rich. But, it looks like that hadn't factored into the stock price until the last 18 months or so, as it was a super slow gainer before. 

Can anyone with better understanding explain a possible ""why"" for me? Is this a case of the rising markets carrying all stocks? Has the company been a hidden value for that long, or does it tend to sit on its cash?

Better yet, where can I find this kind of information on my own?",edwardgentile,2,/r/investing/comments/opa3e5/daily_general_discussion_and_spitballin_thread/h64gt6e/,0.0,0.764,0.236,0.9811
39,RAND," Browsing around some Fintech companies, I decided to look at what the ARKF ETF was holding. At the bottom of their list, I saw this.45 - SOUTH AFRICAN RAND  - (CUSIP) ZAR - (shares) 137 - ( Market value) 9.39 - ( allocation ) 0.00

What in the world is this? Why would they have R9.39 ( about $0.50 ) in South African currency in their Fintech ETF just randomly sitting there?

[https://ark-funds.com/wp-content/fundsiteliterature/holdings/ARK\_FINTECH\_INNOVATION\_ETF\_ARKF\_HOLDINGS.pdf](https://ark-funds.com/wp-content/fundsiteliterature/holdings/ARK_FINTECH_INNOVATION_ETF_ARKF_HOLDINGS.pdf)  


Edit: It's $9.39, not the other way around. But, still. Wut?",DTF_Truck,2,/r/investing/comments/opa3e5/daily_general_discussion_and_spitballin_thread/h66a3gf/,0.0,1.0,0.0,0.0
40,SPRT, SPRT doing so well this last week. So happy I got calls,squishy-1,1,/r/investing/comments/opa3e5/daily_general_discussion_and_spitballin_thread/h64nlao/,0.0,0.572,0.428,0.774
41,ABBV," I’m looking for advice on dividends. I hold ABBV, OKE, MO, AGNC and O. Any input on these? Anything else I should consider like maybe a dividend ETF?",LilPeePee93,1,/r/investing/comments/opa3e5/daily_general_discussion_and_spitballin_thread/h64k5q7/,0.0,0.894,0.106,0.4329
42,AGNC," I’m looking for advice on dividends. I hold ABBV, OKE, MO, AGNC and O. Any input on these? Anything else I should consider like maybe a dividend ETF?",LilPeePee93,1,/r/investing/comments/opa3e5/daily_general_discussion_and_spitballin_thread/h64k5q7/,0.0,0.894,0.106,0.4329
43,MO," I’m looking for advice on dividends. I hold ABBV, OKE, MO, AGNC and O. Any input on these? Anything else I should consider like maybe a dividend ETF?",LilPeePee93,1,/r/investing/comments/opa3e5/daily_general_discussion_and_spitballin_thread/h64k5q7/,0.0,0.894,0.106,0.4329
44,OKE," I’m looking for advice on dividends. I hold ABBV, OKE, MO, AGNC and O. Any input on these? Anything else I should consider like maybe a dividend ETF?",LilPeePee93,1,/r/investing/comments/opa3e5/daily_general_discussion_and_spitballin_thread/h64k5q7/,0.0,0.894,0.106,0.4329
45,RSI," Anyone know of an app that will tell me the RSI of each stock in my watchlist? I know fundamentals are king, but I think there is some value to RSI. I also don't want to manually Google the RSI of the 100+ stocks on my watchlist",swimtomars,1,/r/investing/comments/opa3e5/daily_general_discussion_and_spitballin_thread/h64nrq9/,0.029,0.905,0.067,0.4151
46,VFF," Opinions on Pot stocks?  Looking at VFF and TCNNF.  

VFF is a Canadian-based grower with a price in the $9.50 range and a median target price of $17.66, which looks attractive.  But, they also carry a P/E of 480, more than a little bit rich.  

TCNNF is an otc stock, based in Florida.  It is priced around $33.60, with a median target of 68.89, but that appears to be based on a pending acquisition, which will allow it to expand market share in the medicinal pot field.  It carries a more reasonable (rel to VFF) P/E of $58.20.",Successful_retired_7,1,/r/investing/comments/opa3e5/daily_general_discussion_and_spitballin_thread/h65gcer/,0.0,0.854,0.146,0.9265
47,ASPS," I'm about breakeven on GTBIF.  Contemplating if I should sell them (to invest in dips in PLTR, SOFI, UWMC, BABA, ASPS, ET)  or keeping the faith with Morningstar which has a fair value estimate with high-uncertainty of $55 on GTBIF.",chuckwow,1,/r/investing/comments/opa3e5/daily_general_discussion_and_spitballin_thread/h66ci7u/,0.0,0.824,0.176,0.7579
48,BABA," I'm about breakeven on GTBIF.  Contemplating if I should sell them (to invest in dips in PLTR, SOFI, UWMC, BABA, ASPS, ET)  or keeping the faith with Morningstar which has a fair value estimate with high-uncertainty of $55 on GTBIF.",chuckwow,1,/r/investing/comments/opa3e5/daily_general_discussion_and_spitballin_thread/h66ci7u/,0.0,0.824,0.176,0.7579
49,PLTR," I'm about breakeven on GTBIF.  Contemplating if I should sell them (to invest in dips in PLTR, SOFI, UWMC, BABA, ASPS, ET)  or keeping the faith with Morningstar which has a fair value estimate with high-uncertainty of $55 on GTBIF.",chuckwow,1,/r/investing/comments/opa3e5/daily_general_discussion_and_spitballin_thread/h66ci7u/,0.0,0.824,0.176,0.7579
50,SOFI," I'm about breakeven on GTBIF.  Contemplating if I should sell them (to invest in dips in PLTR, SOFI, UWMC, BABA, ASPS, ET)  or keeping the faith with Morningstar which has a fair value estimate with high-uncertainty of $55 on GTBIF.",chuckwow,1,/r/investing/comments/opa3e5/daily_general_discussion_and_spitballin_thread/h66ci7u/,0.0,0.824,0.176,0.7579
51,UWMC," I'm about breakeven on GTBIF.  Contemplating if I should sell them (to invest in dips in PLTR, SOFI, UWMC, BABA, ASPS, ET)  or keeping the faith with Morningstar which has a fair value estimate with high-uncertainty of $55 on GTBIF.",chuckwow,1,/r/investing/comments/opa3e5/daily_general_discussion_and_spitballin_thread/h66ci7u/,0.0,0.824,0.176,0.7579
52,RSI," [Trading View](https://tradingview.com) - you can save your watchlist and it also saves your favourite chart view - I have mine set with the RSI and 20/50 Day averages. 

You’d still have to go through them one-by-one but at least they are saved and you don’t have to enter them in every time.",RobinMWaite,2,/r/investing/comments/opa3e5/daily_general_discussion_and_spitballin_thread/h65z8jp/,0.0,0.89,0.11,0.7003
53,GRWG, I like GRWG,Crk416,2,/r/investing/comments/opa3e5/daily_general_discussion_and_spitballin_thread/h65qxlv/,0.0,0.286,0.714,0.3612
