,ticker,comment,neg,neu,pos,compound
120,FT,"So Market Snacks with a focus on disruption?  I think your challenge will be most newer / unproven tech is exactly that, unproven.  We don’t know if Bitcoin will be at $100k in few years (maybe one year, lol) or whether it will get replaced by the next thing (a la yahoo search), the hype cycle is mostly dreams and fluff in the beginning, by the time we know MSFT or Google is here to stay (won the game) everyone’s already over-invested.  I sort of view investing in tech akin to VC, you have to make many bets, many will be wrong, a few big winners will make you outsized returns, the way to make real money is getting in early before the price is wrong.  Although I’m no trader, I’m a buy-and-hold guy.  Interested to see other perspectives. 

https://en.m.wikipedia.org/wiki/Hype_cycle

Are you thinking of collating from sites like wired, ars technica, economist, FT, WSJ, plus some more specific publications around robotics and the like?  Perhaps blogs / Twitter of industry leaders who know their shit?",0.078,0.84,0.082,-0.3049
121,MSFT,"So Market Snacks with a focus on disruption?  I think your challenge will be most newer / unproven tech is exactly that, unproven.  We don’t know if Bitcoin will be at $100k in few years (maybe one year, lol) or whether it will get replaced by the next thing (a la yahoo search), the hype cycle is mostly dreams and fluff in the beginning, by the time we know MSFT or Google is here to stay (won the game) everyone’s already over-invested.  I sort of view investing in tech akin to VC, you have to make many bets, many will be wrong, a few big winners will make you outsized returns, the way to make real money is getting in early before the price is wrong.  Although I’m no trader, I’m a buy-and-hold guy.  Interested to see other perspectives. 

https://en.m.wikipedia.org/wiki/Hype_cycle

Are you thinking of collating from sites like wired, ars technica, economist, FT, WSJ, plus some more specific publications around robotics and the like?  Perhaps blogs / Twitter of industry leaders who know their shit?",0.078,0.84,0.082,-0.3049
122,VC,"So Market Snacks with a focus on disruption?  I think your challenge will be most newer / unproven tech is exactly that, unproven.  We don’t know if Bitcoin will be at $100k in few years (maybe one year, lol) or whether it will get replaced by the next thing (a la yahoo search), the hype cycle is mostly dreams and fluff in the beginning, by the time we know MSFT or Google is here to stay (won the game) everyone’s already over-invested.  I sort of view investing in tech akin to VC, you have to make many bets, many will be wrong, a few big winners will make you outsized returns, the way to make real money is getting in early before the price is wrong.  Although I’m no trader, I’m a buy-and-hold guy.  Interested to see other perspectives. 

https://en.m.wikipedia.org/wiki/Hype_cycle

Are you thinking of collating from sites like wired, ars technica, economist, FT, WSJ, plus some more specific publications around robotics and the like?  Perhaps blogs / Twitter of industry leaders who know their shit?",0.078,0.84,0.082,-0.3049
123,CCIV,"Data analytics. Sniff all latest news, blogs by scrubbing the entire WWW with some key words and see what they are and what is already too late. Alexa before Amzn bought it can sniff out the number of hits, where they come from and relevance search.

Example: CCIV and some rumors.  How many times it appeared? Where, location how credible are the sources and people who tipped off.",0.0,0.981,0.019,0.0772
124,WWW,"Data analytics. Sniff all latest news, blogs by scrubbing the entire WWW with some key words and see what they are and what is already too late. Alexa before Amzn bought it can sniff out the number of hits, where they come from and relevance search.

Example: CCIV and some rumors.  How many times it appeared? Where, location how credible are the sources and people who tipped off.",0.0,0.981,0.019,0.0772
125,BR,https://i.imgur.com/2FL5iBR.jpg,0.0,1.0,0.0,0.0
126,QQQJ,Pull up their holdings. So go to google and type in QQQJ holdings. Or MOON holdings. If you go to ARKs website you can sign up for a daily email of what they purchased and sold that day.,0.0,1.0,0.0,0.0
127,BB,After WSB is done with GME then BB will be next.,0.0,1.0,0.0,0.0
128,GME,After WSB is done with GME then BB will be next.,0.0,1.0,0.0,0.0
129,BB,Think you've found a hidden gem. Better get in before anybody else finds out about BB.,0.0,0.828,0.172,0.4404
130,BB,"BB closed on its highs of the day, and will likely be gunned to the high 16's next week.  I am of the mind that [NOK is going to run with it.](https://www.youtube.com/watch?v=x3pdJ7G9WR8&t=2s&ab_channel=KingCAMBO%3ATHETRADERSTHINKTANK)",0.0,1.0,0.0,0.0
131,NOK,"BB closed on its highs of the day, and will likely be gunned to the high 16's next week.  I am of the mind that [NOK is going to run with it.](https://www.youtube.com/watch?v=x3pdJ7G9WR8&t=2s&ab_channel=KingCAMBO%3ATHETRADERSTHINKTANK)",0.0,1.0,0.0,0.0
132,BB,Yes that’s partly my concern. I know WSB are tinkering with BB and that worries me. I think BB has potential to be a good bet but WSB may throw off some ability to gauge real performance,0.049,0.776,0.175,0.5927
133,BB,Have you been on WSB lately? Everyone knows about BB,0.0,1.0,0.0,0.0
134,BB,"Their QNX is heading towards 200 million cars too. Although I have a good few thousand shares in BB, I'm holding my breath until the WSB hype fades. I'd be happy with 12 USD near term, with 20 before year end.",0.0,0.804,0.196,0.8316
135,BB,"I’m aware they’re talking about it but their opinions and feedback isn’t really very trustworthy is it. I was hoping for some grounded and considered feedback on BB and thought that maybe, just maybe, this may be a better place",0.0,0.725,0.275,0.9361
136,OVID,"Small caps dove deeper into the March 2020 COVID crater.  Coming out of the crater they're playing catch-up.  It really is that simple.

You see this same thing happen in pretty much every major market correction.",0.0,0.872,0.128,0.6124
137,MSTR,"Ah yes, results is out, another one is MSTR",0.0,0.748,0.252,0.4019
138,DD,"Very interesting DD. Share price seems to have shot up as a result of good earnings, reckon it's worth waiting for the buzz to die down before jumping in?",0.105,0.619,0.276,0.6549
139,GME,Is it too late to get in on the GME short squeeze or do you guys think it will keep going up? Aware that I'm behind the trend here but just wanted to hear opinions on how high it could get.,0.0,1.0,0.0,0.0
140,BB,"I have about 700usd in GME, and I have another 700 to invest. Go all in in GME or buy some BB or PLTR stock?

Also what is a call? Like buying a call.",0.0,0.91,0.09,0.4329
141,GME,"I have about 700usd in GME, and I have another 700 to invest. Go all in in GME or buy some BB or PLTR stock?

Also what is a call? Like buying a call.",0.0,0.91,0.09,0.4329
142,PLTR,"I have about 700usd in GME, and I have another 700 to invest. Go all in in GME or buy some BB or PLTR stock?

Also what is a call? Like buying a call.",0.0,0.91,0.09,0.4329
143,UK,Just starting out as I get Into my 30s with a very small amount (£600) gained through some saving over lockdown. I'm based in the UK. Looking for a few options that will make a decent amount over the next few years so I can get the ball rolling. Perhaps anything that will benifit in the recovery from the pandemic? Using Interactive investment platform. Any suggestions would be welcome. Thank you.,0.0,0.886,0.114,0.7964
144,NIO,"Good morning, I’m pretty new to stocks and am wanting to expand my portfolio. I have Nio and Goev right now and want to by Nvidia Disney Bb and maybe some more NIO, what do you guys think, I have a high risk tolerance and don’t care to lose money that much",0.079,0.673,0.248,0.8519
145,TDA,"Good morning r/investing!  Seeking some advice on where the pros have their IRA.

(Current Assets:  \~$500K in Fidelity, \~$50K in Vanguard, \~$8K in a non retirement 'funmoney' TDA account)

**Fidelity**:

Pros:  The people I have talked to on the phone are nice.   They have a desktop client, even if it looks from the 80s.  Actual in-person location, even if I have never used one.  

Cons:  Cannot set (sell) limit orders at greater than 50% last price\*.  Cannot use funds in account to sell cash secured puts for a lower entry.    
\* This is really irking me, because during the day I am at work, not on my IRA.  I want to be able to set it and forget it.

**Vanguard:**

Pros:  I love that they are investor owned. 

Cons:  Egads that website for making trades is horrible!   (Haven't played with it too much)

**TDA**:  

Pros:  ThinkorSwim - I am liking the client, the ability to set conditional & chained orders, and the mobile apps as well.  

Cons:  fees?  (haven't found too many, other than the normal delays in waiting for cash to settle)

&#x200B;

So, for the others out there, what broker(s) do you use for your rollover IRAs?  I am considering opening one up at TDA and abandoning Fidelity, but want second opinions.  Thanks for the input!",0.039,0.852,0.109,0.9103
146,BB,Any predictions for BB over the next week?,0.0,1.0,0.0,0.0
147,UK,Is there a UK version of the Robinhood app? Like I know theres not a robinhooduk but is there any other apps that are just as good that I can use to invest in stocks?,0.0,0.83,0.17,0.7149
148,BB,Would this be a good time to buy some calls in BB for this upcoming week? I am super new to this.,0.0,0.726,0.274,0.7783
149,UK,I'm 21 from the UK I'm about to finish university this year and move right into a job. I have around 8k in my banks savings. I'm not a risky person and I've always been smart with money but just having it sit in one place bugs me so I want to get into stocks. By stocks I honestly have no experience what so ever and only have a very basic understanding of it. I would like to learn about investing in stocks. Any videos or written tutorials or any apps you suggest I would really appreciate it.,0.027,0.811,0.161,0.9135
150,ABR,"Hello, Ioooking to identify a good REIT in the US to invest in. Preferably one that is undervalued due to the rising potential for inability to pay rent, but has a strong balance sheet covered by the massive growth in real estate prices nationally. If there is one focused on the west coast I'd be interested there, but also recognize that cash flow assets are generally sitting outside of those HCOL areas. Any ideas?

I currently have some NYMT AND ABR positions.",0.033,0.765,0.202,0.9497
151,NYMT,"Hello, Ioooking to identify a good REIT in the US to invest in. Preferably one that is undervalued due to the rising potential for inability to pay rent, but has a strong balance sheet covered by the massive growth in real estate prices nationally. If there is one focused on the west coast I'd be interested there, but also recognize that cash flow assets are generally sitting outside of those HCOL areas. Any ideas?

I currently have some NYMT AND ABR positions.",0.033,0.765,0.202,0.9497
152,TD,"I’m deciding between using Fidelity or TD Ameritrade but as someone who only plans to invest in stocks and ETFs for the long term and maybe a little options trading, does it really make a difference which brokerage I choose or is it just based on preference at that point",0.0,1.0,0.0,0.0
153,ICLN,"24 yo, wanting to know any good cheap ETF’s anyone could recommend. I have an account for riskier plays and “meme” stocks, but I want to start funneling money into more long term holds. Currently only in ICLN and look to buy in when ARKX (I believe it’s X) IPO’s. Any recommendations would be nice",0.048,0.777,0.175,0.7579
154,ICLN,"29 YO medical resident with 10K emergency fund (in savings account), 31K in vanguard index 500, only 6300 in Roth IRA (maxed 2020), nothing currently in employer sponsored retirement fund as they don’t match. Thinking about allocating everything in Roth IRA to stocks like apple or Disney, until now none of it was invested. Planning to redistribute my vanguard index 500 into higher yield ETFs like ARKF and ICLN. Is it smart to invest that much outside my retirement fund and use my Roth IRA for stocks? I’ve been a resident since 2018 and only stared adding to my Roth IRA in the 2020 year and plan to max it throughout 2021, did I set myself back by not doing this earlier? Thanks for the help! I’ve never invested aside from slowly adding to my index 500 since college.",0.018,0.888,0.095,0.8847
155,GME,"I’m quite new to investing and have been drawn in by all the GME drama. I wanted to know whether I should invest right now? 

I see that a lot of people are saying yes in other threads, but they aren’t giving clear evidence or reasons why. If you believe that I should invest right now, could you please explain why? Thanks",0.0,0.77,0.23,0.9383
156,GME," All this hype around GME has got me wondering, is there anything that could possibly prevent a short squeeze at this point? (Except GME issuing more shares which I find highly unlikely) Why do short holders have to cover at all/want to cover at all? I know short holders keep bleeding money the longer time goes on but is there any way the squeeze can still be prevented from happening? I'd like to go in on monday and buy some more shares but all memes aside I'd also like to know how big the chance is of this squeeze not happening.",0.0,0.845,0.155,0.929
157,UK,UK based,0.0,1.0,0.0,0.0
158,CPA,"Yes. 

You might want to talk with a CPA about taxes since you might be required to pay quarterly, assuming you are in the US.",0.053,0.795,0.152,0.3818
159,MSCI,"Hey,

I would recommend you to choose an etf, with an monthly payment plan. MSCI World, so the Risk is relatively low.",0.179,0.721,0.1,-0.2449
160,VGLT,"EDV holds long term bonds with zero coupons. A zero coupon bond with a yield of *r*, 100 par, and *t* years to maturity has a price of 100 / (1+*r*)^*t* . When a 30yr zero's yield falls from 4% to 1%, its price rises from 30.83 to 74.19, a whopping 141% increase. Zero-coupon bonds have longer effective duration than regular bonds with coupons, so EDV moves more in price than other bond funds, even compared to other 20-30 yr bond funds like VGLT.",0.0,0.904,0.096,0.7845
161,EOD,"Pretty much. You can let the option expire which means it gets executed at the EOD price. You can exercise the option at any given time and the corresponding price, or you can sell the contract to someone who is willing to buy. The price you sell the option could be higher or lower depending on how the market has changed. 

It differs between US and Europe.",0.031,0.923,0.045,0.25
162,FV,"There are lots of online calculators that you can just plug the numbers into, or use the FV excel function.

Also 4.25% dividends plus 7% appreciation is 11.25% total return, this is a bit high.

However if you are asking how to do it manually check out this as it explains the formula pretty well

[https://www.thecalculatorsite.com/articles/finance/future-value-formula.php](https://www.thecalculatorsite.com/articles/finance/future-value-formula.php)",0.0,0.815,0.185,0.891
163,UK,I'm in a similar situation I live in the UK I'm 21 I have saved 8k and I dont just want to sit on it.  my goal is to get a house asap. If you get anywhere out me know maybe we can help eachover out,0.027,0.85,0.123,0.646
164,TDA,"Pretty much based on personal preference. However TDA was bought buy schwab so eventually your TDA account will be moved to a schwab account(still probably over a year out)

So if you start trading on TDA and get used to the website and tools you may have to then move to schwab and get used to their website/tools",0.0,0.945,0.055,0.4939
165,VXUS,"Index funds are the way to go. For tax reasons, you shouldn’t own international stocks in your Roth or 401(k), so consider adding international exposure to your taxable account through VXUS.

Also, nice job maxing the Roth and putting such a significant percentage away in the 401(k)!",0.0,0.9,0.1,0.5983
166,GE,"For one, you’ll put yourself at risk of something like this: [GE slashes 119-year old dividend to a penny](https://www.cnn.com/2018/10/30/investing/ge-dividend-cut-earnings-culp/index.html). All your eggs in once basket.

Also dividends are taxed. So you’ll owe the government some $.

And is your math right? $100k / $28.93 = 3456 shares of AT&T. They pay $0.52/share four times a year so: 3456 \* $0.52 \* 4 = $7188 dividends paid per year which is **$599 per month.** That’s less that the $650 you said and doesn't even subtract taxes.

One suggestion is instead of being invested in just one company, you can invest in hundreds all at once. Example: Vanguard Dividend Appreciation ETF (VIG). There’s many other example ETFs that pay dividends and are lower risk than putting everything into one single stock.",0.083,0.857,0.06,-0.0
167,ALL,"Don't dump ALL in it, that's risky. Since you're still young, try putting some of those into growth stocks and let the capital grow. If you're lazy to do homework on picling stocks, dump it into ETF",0.099,0.74,0.161,0.3956
168,DD,"You're not going to get much help in this subreddit regarding that drama I think.  Stick to WSB, do a lot of research (there really has been some sharp DD recently on all of this in WSB), and then make your own decision.",0.0,0.937,0.063,0.4019
169,GME,I guess I know a little more than super new. Is what everyone is doing is buying OTM calls on GME to make as much short run as possible with calls? I am looking to buy some barely OTM calls since I am bullish with GME this week. I am on RH and it doesn’t have an option for me to even buy any OTM. Is that because there is none available?,0.0,0.938,0.062,0.6457
170,RH,I guess I know a little more than super new. Is what everyone is doing is buying OTM calls on GME to make as much short run as possible with calls? I am looking to buy some barely OTM calls since I am bullish with GME this week. I am on RH and it doesn’t have an option for me to even buy any OTM. Is that because there is none available?,0.0,0.938,0.062,0.6457
171,OVID,"I started VOO with the idea of smaller businesses being hurt during COVID would pull VTI down a bit. If that is wrong and you can explain why that is, definitely explain - I’m here to learn. 

Have been looking into it but haven’t made the plunge yet. What would you recommend for international? Emerging markets? Or what exactly. I don’t know enough to really make an informed investment there",0.059,0.865,0.076,0.2982
172,INT,"Thank you for the shout out! 

So something like VOO and just let it do its thing as I continue to add $500 each month sounds about right and VXUS if I wanted to add some INT exposure?",0.0,0.859,0.141,0.6778
173,VXUS,"Thank you for the shout out! 

So something like VOO and just let it do its thing as I continue to add $500 each month sounds about right and VXUS if I wanted to add some INT exposure?",0.0,0.859,0.141,0.6778
174,RH,"That or more likely you’re not a high enough level in RH yet. 

WSB buys in the money and out of the money and then tries to flip them quickly. They also pump buying shares because that in turn pumps their call values.",0.0,0.891,0.109,0.5994
175,IXUS,">with the idea of smaller businesses being hurt during COVID would pull VTI down a bit

That ended up costing you. According to my Fidelity app (easiest for me to check quickly on my phone right now), VTSAX (US total market) has a 1 year return of 20.99%, VFIAX (S&P 500) only had 18.37%. This lines up pretty well with what I remember the FSKAX vs FXAIX comparison ended up with the other day.

>What would you recommend for international?

I just do a basic combined international index: VTIAX/VXUS, IXUS, FTIHX, FZILX, etc. Roughly 25%-33% of these would be emerging.",0.034,0.889,0.077,0.5267
176,OVID,">with the idea of smaller businesses being hurt during COVID would pull VTI down a bit

That ended up costing you. According to my Fidelity app (easiest for me to check quickly on my phone right now), VTSAX (US total market) has a 1 year return of 20.99%, VFIAX (S&P 500) only had 18.37%. This lines up pretty well with what I remember the FSKAX vs FXAIX comparison ended up with the other day.

>What would you recommend for international?

I just do a basic combined international index: VTIAX/VXUS, IXUS, FTIHX, FZILX, etc. Roughly 25%-33% of these would be emerging.",0.034,0.889,0.077,0.5267
177,VXUS,">with the idea of smaller businesses being hurt during COVID would pull VTI down a bit

That ended up costing you. According to my Fidelity app (easiest for me to check quickly on my phone right now), VTSAX (US total market) has a 1 year return of 20.99%, VFIAX (S&P 500) only had 18.37%. This lines up pretty well with what I remember the FSKAX vs FXAIX comparison ended up with the other day.

>What would you recommend for international?

I just do a basic combined international index: VTIAX/VXUS, IXUS, FTIHX, FZILX, etc. Roughly 25%-33% of these would be emerging.",0.034,0.889,0.077,0.5267
178,BB,how about GME and BB.,0.0,1.0,0.0,0.0
179,GME,how about GME and BB.,0.0,1.0,0.0,0.0
180,DD,"Honestly this isn’t a good sub to find that stuff, not much quality DD here just people who will tell you to buy VTI and bonds. And nothing wrong with that just fyi.",0.0,0.732,0.268,0.8502
181,INTC,I'm long INTC. Everyone hates them but I think they will get back or change directions in the next 3 years. It's definitely a long term play.,0.066,0.709,0.225,0.6908
182,GME,GME will go over 100 Monday - Tuesday,0.0,1.0,0.0,0.0
183,CEO,$LLNW just got a new CEO. Earnings are Feb 11th I believe. We'll see if he will bring anything new to the table.,0.0,1.0,0.0,0.0
184,LLNW,$LLNW just got a new CEO. Earnings are Feb 11th I believe. We'll see if he will bring anything new to the table.,0.0,1.0,0.0,0.0
185,NOK,NOK,0.0,1.0,0.0,0.0
186,GM,"GM was one of those companies, but they’ve had a good few months due to ev news",0.0,0.796,0.204,0.5927
187,CSCO,In my opinion: GM & INTC Definitely. As well as CSCO,0.0,0.625,0.375,0.5859
188,GM,In my opinion: GM & INTC Definitely. As well as CSCO,0.0,0.625,0.375,0.5859
189,INTC,In my opinion: GM & INTC Definitely. As well as CSCO,0.0,0.625,0.375,0.5859
190,BBBY,BBBY,0.0,1.0,0.0,0.0
191,AMRS,"AMRS.  It just mooned quite a bit from entering the Chinese market, but the market cap is still only around $2 billion.  Bought 1,000 shares at $3.41 last year.",0.0,0.906,0.094,0.4215
192,BBBY,"BBBY.  GM.  
Cisco seems freaking dead but maybe some sliver of hope, it’s making acquisitions. If you asking for possible turnarounds.",0.172,0.682,0.146,0.0772
193,GM,"BBBY.  GM.  
Cisco seems freaking dead but maybe some sliver of hope, it’s making acquisitions. If you asking for possible turnarounds.",0.172,0.682,0.146,0.0772
194,INTC,INTC will be fine.  I have them.  They make Neurophonic chips which captures data at the edge.  They are faster chips then current,0.0,0.921,0.079,0.2023
195,AMD,"That's a long time to try to figure out if Intel can change course.  AMD is just going to continue to gobble up market share.  I expect things to get a whole lot worse for Intel over the next two years, and the time to buy would be when the ""turnaround"" is a year off, not three.",0.055,0.906,0.039,-0.2263
196,GME,"If I think a stock has potential and recommending to my friend, am I ""pumping"" the stock?

WSB's message is never ""let's all buy GME so it gets higher"", they know they don't actually have the power to move the market by themselves, it's more recognizing a trend and hopping on it like ""GME squeeze is inevitable let's get on board"".

However given WSB's publicity at this point, their stance definitely helps send out the message and accelerating the process. But this is all still based on the fact that GME does has a real risk of short squeeze regardless of WSB found out about it or not.",0.019,0.882,0.099,0.836
197,BB,"I know what people are saying but it's just pure speculation based on memes. They are failed dinosaur corp trying to become niche security provider. The thing people forget is that there are shit ton security software providers of all sorts. Many of them new startups with great products with no legacy crap. How does BB compare to other companies in the sector? Noone cares, it's all about finding sub $10 share company with compelling story you can dream about and them pumping it. Having that said, I have to be fair. It will pump. If you want to make good short term trade, exploit momentum and jump out before it collapses. Yea BB is good for that. However, if you are looking for long term investment to hold for several years, this is not it.",0.128,0.667,0.205,0.9231
198,BB,And I bet you know nothing about BB outside what you was told on WSB. Now be a good boy and buy some calls.,0.0,0.879,0.121,0.4404
199,GME,"Its essentially like buying GME @ 20$ right now, LE'GO",0.0,0.762,0.238,0.3612
200,GO,"Its essentially like buying GME @ 20$ right now, LE'GO",0.0,0.762,0.238,0.3612
