,ticker,comment,username,score,permalink,neg,neu,pos,compound
330,CTRM," [my current plays- ScreenShot ](https://www.dropbox.com/s/sacrxk6kxe16cc9/2021-03-11%2011.57.44.png?dl=0)

My current plays ;)

PLTR, FCEL, CTRM, GGTTF",kaheakamauu,1,/r/pennystocks/comments/m2l134/daily_plays_march_11_2021/gqlz70s/,0.0,0.629,0.371,0.5994
331,FCEL," [my current plays- ScreenShot ](https://www.dropbox.com/s/sacrxk6kxe16cc9/2021-03-11%2011.57.44.png?dl=0)

My current plays ;)

PLTR, FCEL, CTRM, GGTTF",kaheakamauu,1,/r/pennystocks/comments/m2l134/daily_plays_march_11_2021/gqlz70s/,0.0,0.629,0.371,0.5994
332,PLTR," [my current plays- ScreenShot ](https://www.dropbox.com/s/sacrxk6kxe16cc9/2021-03-11%2011.57.44.png?dl=0)

My current plays ;)

PLTR, FCEL, CTRM, GGTTF",kaheakamauu,1,/r/pennystocks/comments/m2l134/daily_plays_march_11_2021/gqlz70s/,0.0,0.629,0.371,0.5994
333,CTXR, What do you mean? CTXR and HITIF are literally the only 2 stocks I own out of 11 that have stayed green for me in the past 3 weeks,Greeenpoe,7,/r/pennystocks/comments/m2l134/daily_plays_march_11_2021/gqk1bco/,0.0,1.0,0.0,0.0
334,DNN, DNN go up please hahaha,yunggyett,17,/r/pennystocks/comments/m2l134/daily_plays_march_11_2021/gqjx8i0/,0.0,0.337,0.663,0.7096
335,ZSAN, ZSAN jheeze that's a blast from the past,Greeenpoe,4,/r/pennystocks/comments/m2l134/daily_plays_march_11_2021/gqk1e1m/,0.0,1.0,0.0,0.0
336,CSTR," You hit it bang on, High Tide swung up. CSTR pulled back.",Big_E_82,2,/r/pennystocks/comments/m2l134/daily_plays_march_11_2021/gqm11yf/,0.0,1.0,0.0,0.0
337,CTXR," If CTXR hits $15 a share, I’ll have made 100% profit on my initial investment and everything moving forward in stocks would be profit.",Marino4K,6,/r/pennystocks/comments/m2l134/daily_plays_march_11_2021/gqls815/,0.0,0.714,0.286,0.7906
338,ASRT," Your wife, who is my girlfriend, is also threatening to leave me after she saw my position in regards to ASRT.",SpartaWillBurn,4,/r/pennystocks/comments/m2l134/daily_plays_march_11_2021/gqlzlaq/,0.195,0.805,0.0,-0.5574
339,ASRT, ASRT is going into the floor today through tomorrow. No one that's been doing this very long would hold through earnings unless you're long on the stock. If anything buy the dip when it settles,Garthim,1,/r/pennystocks/comments/m2l134/daily_plays_march_11_2021/gql5wa9/,0.061,0.939,0.0,-0.296
340,HEPA," Came here to ask about HEPA. Few minutes ago, it was up 15%? It’s back to 12% now but has been climbing all day. Any idea why? I’m not complaining, it’s a pleasant surprise - just wondering if something happened.",ambermariebama,1,/r/pennystocks/comments/m2l134/daily_plays_march_11_2021/gqlp7wb/,0.082,0.806,0.113,-0.0964
341,ASRT," *poke* *poke* c'mon ASRT, do something",co_fragment,5,/r/pennystocks/comments/m2l134/daily_plays_march_11_2021/gqkyi4c/,0.0,1.0,0.0,0.0
342,DD," I’m on the $NSPX train.  Will be for the foreseeable future.  😁.  It’s slow right now.  Earnings report should come out next week, but I expect a giant spike.  If you look at what happened when the last press release came out in Feb, that’s kinda what happens with it because of the low float.  Check out their stuff on Yahoo finance for recent press releases.  Not an advisor.  Do your good DD.  GL!",adudereadingthings,1,/r/pennystocks/comments/m2l134/daily_plays_march_11_2021/gqkxikb/,0.033,0.864,0.103,0.7609
343,TDA," TDA - 
>Order rejected:	Opening transactions for this security are not accepted.",stopbeingadumbass,2,/r/pennystocks/comments/m2l134/daily_plays_march_11_2021/gqkroho/,0.322,0.504,0.173,-0.3322
344,ENTX," > ENTX

why?",CuriousAbout_This,1,/r/pennystocks/comments/m2l134/daily_plays_march_11_2021/gqkt4jx/,0.0,1.0,0.0,0.0
345,TD, TD Ameritrade?  No... you just need settled funds in order to buy them.,deez00s,3,/r/pennystocks/comments/m2l134/daily_plays_march_11_2021/gqlkch9/,0.0,1.0,0.0,0.0
346,IMO," HITIF will probably spike whenever US Congress moves for decriminalizing but otherwise everything is already priced in IMO. 

Posters repeating some $3 to $4 mantra are BSing pumpers.",GoHuskies1984,13,/r/pennystocks/comments/m2l134/daily_plays_march_11_2021/gqkalb2/,0.0,1.0,0.0,0.0
347,ZSAN, Im a ZSAN bag holder,christopherzee,2,/r/pennystocks/comments/m2l134/daily_plays_march_11_2021/gqkjgjm/,0.0,1.0,0.0,0.0
348,CTXR, Well yh I guess when you analyse it like that but Reddit is Reddit I guess you gotta take the hype with a pinch of salt but I get what you mean was up nearly 70% at one point on CTXR but that was the initial pump I spose....but either way don't dismay brother we shall be rolling in fields on green soon enougj,Greeenpoe,5,/r/pennystocks/comments/m2l134/daily_plays_march_11_2021/gqk3ili/,0.0,0.899,0.101,0.6483
349,TD, TD Ameritrade,stopbeingadumbass,1,/r/pennystocks/comments/m2l134/daily_plays_march_11_2021/gqkrvne/,0.0,1.0,0.0,0.0
350,RS, I got bent over backwards on that RS today. Sorry if u bought this morning. Hopefully people see it now though,Jmac065,1,/r/pennystocks/comments/m2l134/daily_plays_march_11_2021/gqlovof/,0.062,0.81,0.129,0.34
351,UK," Oh yes I'm in on the UK side of things, our ticker is 88e but same company. Posted this earlier, chance of a multi bagger, got 75k shares but gonna add a few more tomorrow as the hype is definitely starting.",spicy_chimp5,3,/r/pennystocks/comments/m2wnih/eeenf_88_energy_limited_started_drilling_yesterday/gqlzlhj/,0.0,0.766,0.234,0.8658
352,IMO," 288,000 shares @ .0082 up 64.15% Currently 

Thanks to this Sub

Fair price to be included in a Oil expedition IMO 

Obviously if they hit Oil its all worth it 👌

Not financial advice, I throw money away easily too",Boosazle,7,/r/pennystocks/comments/m2wnih/eeenf_88_energy_limited_started_drilling_yesterday/gqm0fsc/,0.0,0.726,0.274,0.8658
353,GO," Ok, you had me at GO, ill put more in at a dip 😃",Boosazle,1,/r/pennystocks/comments/m2wnih/eeenf_88_energy_limited_started_drilling_yesterday/gqm4sdd/,0.187,0.667,0.147,-0.1531
354,HPQ, HPQ gonna benefit from this a lot hopefully,Professional_Ad_1845,10,/r/pennystocks/comments/m2dx2l/dd_on_pyrogenesis_canada_nasdaq_up_list_happening/gqip8gw/,0.0,0.467,0.533,0.6908
355,DD," Nice DD, I love to get behind Canadian clean energy companies! I was wondering though, what is the projected growth for EOM and EOY (short and longer term)! Thanks",Danialmo,1,/r/pennystocks/comments/m2dx2l/dd_on_pyrogenesis_canada_nasdaq_up_list_happening/gqjf51x/,0.0,0.54,0.46,0.9508
356,RH," It's not yet tradeable on RH , Webull
Why so ?",buysellWTH,1,/r/pennystocks/comments/m2dx2l/dd_on_pyrogenesis_canada_nasdaq_up_list_happening/gqkx7xo/,0.0,1.0,0.0,0.0
357,PYR," I think there must be a delay in brokers syncing with the updated NASDAQ listing. The shares I own have transferred to PYR, but I’ve heard several people with the same issue as you. The price isn’t running away so you still have plenty of entry opportunity!",Nesiew94,1,/r/pennystocks/comments/m2dx2l/dd_on_pyrogenesis_canada_nasdaq_up_list_happening/gqkxo82/,0.034,0.85,0.116,0.6049
358,PT, Well my personal PT is 2-3$ EOY. And thats on the conservative side.  With legalisation in the US the sky is the limit.,GrayenLive,3,/r/pennystocks/comments/m2y13e/hitif_thecannalyst_ama_why_raj_grover_is_the_man/gqm22m0/,0.0,0.913,0.087,0.2732
359,API," They've got patents on their method both in Canada and the US.

There's other biosynthesis companies out there for sure, WLLW just seems to be the furthest along and one step away from commercialization. They've already scaled up production of CBG by using AMRI's API manufacturing facilities.

Good lookin out though",kaneda2004,5,/r/pennystocks/comments/m2xtsc/wllw_willow_bioscience_the_biosynthetic_weed_play/gqm31w1/,0.0,0.904,0.096,0.6369
360,SP," You get vaccinated right? Almost everything nowadays is genetically modified or synthetically produced. WLLW is expanding in the field of cannabis into completely untouched territory. Being able to synthesize cannabinoids from yeast could not only generate ridiculous margins. There is nothing about their products that’s worrying, what’s worrying is how their SP is grossly undervalued. As OP states, they could easily trade over $15, which is what I expect they will do by the EOY. Mark this post if you want and we will see which way it goes. This is from the perspective of someone heavily involved in the market and with a Biological science and chemistry background.",realredfury,3,/r/pennystocks/comments/m2xtsc/wllw_willow_bioscience_the_biosynthetic_weed_play/gqm3ju8/,0.059,0.89,0.051,-0.224
361,THC," Contemplate this: Packaged goods manufacturers (beverage, edible, topical, etc) need active pharmaceutical ingredients that are of a precise purity and potency. WLLW can provide those API's 50x to 500x more efficiently than growing plants and extracting the exact same cannabinoids.

Yes people won't be smoking pure THC powder, but these biosynthetics give the same molecule, perfectly pure, for less than doing it au naturale.

This isn't about replacing the existing cannabis market, it's about creating a brand new biosynthetic market.",kaneda2004,2,/r/pennystocks/comments/m2xtsc/wllw_willow_bioscience_the_biosynthetic_weed_play/gqlt7u9/,0.0,0.82,0.18,0.9297
362,TRCH," I’m in at .54, lol.  I’ll sell at $1.50 since TRCH is high because of their oil reserves mostly.  The merger news too.  But TRCH is a .35 company after merger but trading $2+ because they are sitting on oil.",Jimwin911,3,/r/pennystocks/comments/m2hsv6/mdmp_ran_over_1100_yesterday_crazy_normally_i/gqktav7/,0.0,0.952,0.048,0.2263
363,TFSA," hiya, as a noob with $50 in a wealth simple TFSA, how do I find this stock? I'm having trouble x.x",packers42069,1,/r/pennystocks/comments/m2hsv6/mdmp_ran_over_1100_yesterday_crazy_normally_i/gqkjapb/,0.176,0.679,0.145,0.0772
364,IMO," Look at note 3! https://backend.otcmarkets.com/otcapi/company/financial-report/273522/content
Convertible bonds at 0.01$. This is a pump and dump IMO.",businesstraveler-123,1,/r/pennystocks/comments/m2hsv6/mdmp_ran_over_1100_yesterday_crazy_normally_i/gqls4y4/,0.171,0.829,0.0,-0.4389
365,GTE, I just sold my GTE stocks to buy MDMP I bought in at $0.50 and I made $100! So far its up 150%. I don't see it dipping!,OverLord4Life,4,/r/pennystocks/comments/m2hsv6/mdmp_ran_over_1100_yesterday_crazy_normally_i/gql2zca/,0.0,1.0,0.0,0.0
366,TD, You have to use a real broker like Fidelity TD or E trade,TheInternetTrader,7,/r/pennystocks/comments/m2hsv6/mdmp_ran_over_1100_yesterday_crazy_normally_i/gqkjjrd/,0.0,0.8,0.2,0.3612
367,RH, Doesn't it end up on the shit brokers like RH if it goes above $1?,Tacoman404,1,/r/pennystocks/comments/m2hsv6/mdmp_ran_over_1100_yesterday_crazy_normally_i/gqlv2e5/,0.0,0.619,0.381,0.8402
368,ARE," I just mentioned it, because there ARE people who follow his word, and the stock price will probably reflect that sentiment.",Ravoren,2,/r/pennystocks/comments/m2aptz/sanp_santos_mining_corp_news_today_share_price/gqinmyx/,0.0,1.0,0.0,0.0
369,TD, Same cost on TD Ameritrade,uberhanzi,3,/r/pennystocks/comments/m2aptz/sanp_santos_mining_corp_news_today_share_price/gqio2pi/,0.0,1.0,0.0,0.0
370,ATOS," Good news, been holding ATOS since January. Made back my initial investment from one of the earlier presentation hypes (something about Fauci lol).

Holding 102 shares now and just excited to see how they pan out long term.",wildwookie05,8,/r/pennystocks/comments/m2shu0/atossa_therapeutics_atos_announces_receipt_of_fda/gqkzgw6/,0.0,0.824,0.176,0.7579
371,PCTI," Been waiting for conformation on this. This is fantastic! When they are able to get PCTI rolling on the equipment supply side, it will be easy self-contained profit from start to finish.",echofinder,6,/r/pennystocks/comments/m2vktt/ozsc_obtains_site_control/gqlfmqd/,0.0,0.75,0.25,0.8655
372,PDAC," OZSC, Huge potential. 
Also own PDAC warrants..(Li cycle, better than AMBL). Should see some consolidation within the yr.",OwenCarter,2,/r/pennystocks/comments/m2vktt/ozsc_obtains_site_control/gqlu0j4/,0.0,0.755,0.245,0.6369
373,PCTI," PCTI manufactures big-dick electrical battery/storage equipment; the kind of stuff one would need to utilize solar/battery storage at the industrial or utility level. They've been doing it for THIRTY YEARS, but it's always been a niche market. The push for green energy is likely to change that.",echofinder,5,/r/pennystocks/comments/m2vktt/ozsc_obtains_site_control/gqll71c/,0.0,0.944,0.056,0.3919
374,CB," If you have 10 shares at CB 1.50, you’ll have 1 share at CB 15. It won’t materially have any change.",Boomtown626,13,/r/pennystocks/comments/m2dnqn/looks_like_theres_a_reverse_split_in_the_horizon/gqikg61/,0.0,0.804,0.196,0.5267
375,RS, Unless your broker allows fractional shares you would be forced out of your position.  The shares you hold would just be sold automatically at the current price at the time the RS occurs.,Paleontologist-Flaky,6,/r/pennystocks/comments/m2dnqn/looks_like_theres_a_reverse_split_in_the_horizon/gqjydml/,0.08,0.802,0.118,0.1027
376,ASRT, Who else praying on ASRT,DandierChip,17,/r/pennystocks/comments/m2hpio/the_lounge_thoughts_noob_stuff_low_effort_brokers/gqjghdt/,0.0,0.615,0.385,0.3612
377,CTRM," As always, holding my load in ZOM, CTXR, HITI, and CTRM. But tomorrow can we get some more green please, I want this load to blow 😃",realredfury,15,/r/pennystocks/comments/m2hpio/the_lounge_thoughts_noob_stuff_low_effort_brokers/gqj9r8m/,0.0,0.847,0.153,0.484
378,CTXR," As always, holding my load in ZOM, CTXR, HITI, and CTRM. But tomorrow can we get some more green please, I want this load to blow 😃",realredfury,15,/r/pennystocks/comments/m2hpio/the_lounge_thoughts_noob_stuff_low_effort_brokers/gqj9r8m/,0.0,0.847,0.153,0.484
379,ZOM," As always, holding my load in ZOM, CTXR, HITI, and CTRM. But tomorrow can we get some more green please, I want this load to blow 😃",realredfury,15,/r/pennystocks/comments/m2hpio/the_lounge_thoughts_noob_stuff_low_effort_brokers/gqj9r8m/,0.0,0.847,0.153,0.484
380,ASRT, ASRT will spike the exact moment I sell. I know it deep down.,Saint_Skeeter,13,/r/pennystocks/comments/m2hpio/the_lounge_thoughts_noob_stuff_low_effort_brokers/gqkvwva/,0.0,1.0,0.0,0.0
381,ATOS, Check out ATOS..check out news release,Neally006,4,/r/pennystocks/comments/m2hpio/the_lounge_thoughts_noob_stuff_low_effort_brokers/gqkvmtv/,0.0,1.0,0.0,0.0
382,DD," Anyone else looking at $NBRV? I'm doing some DD on them now to see if it's a play for tomorrow morning.

Their earnings report comes out tomorrow morning (3/11) with a call scheduled for after close. Some things that I think might create some movement.... they're super oversold at the moment (RSI: 26.39), they are 15% below prior low, and 35% below the SMA50. Feeling like maybe this doesn't have much lower to go before they get a rebound? 

Zacks Equity published a story yesterday ([NBRV is in Oversold Territory: What's Next](https://finance.yahoo.com/news/nabriva-therapeutics-nbrv-oversold-territory-122712589.html)). It had a small bump but closed -4.89%.

Some risks: They issued $25.4M direct offering back on 3/1 that tanked the stock another 19% They just got a new CFO back on 2/26 that also drove down the price.",Suskey524,3,/r/pennystocks/comments/m2hpio/the_lounge_thoughts_noob_stuff_low_effort_brokers/gqj9qp5/,0.032,0.888,0.08,0.5113
383,AVEO, AVEO,CommunicationNo5868,3,/r/pennystocks/comments/m2hpio/the_lounge_thoughts_noob_stuff_low_effort_brokers/gqjy5om/,0.0,1.0,0.0,0.0
384,LKCO," $LKCO delisting from NASDAQ on 3/15 just got pushed to May.  DoD Blacklist info coming 3/12 @ 2pm.  Judge presiding over LKCO and other Chinese companies in similar situation has been very favorable.  This stock is going to MOVE today.  High risk, high reward (and pot loss).",DonkeyClownVacation,3,/r/pennystocks/comments/m2hpio/the_lounge_thoughts_noob_stuff_low_effort_brokers/gqkla75/,0.04,0.824,0.136,0.7178
385,BKEP,"  BKEP is primarily involved in providing transportation, storage, processing, and related services to producers and marketers of crude oil and asphalt products. The company has operations mainly in the United States. BKEP has gained 147.5% over the past year to close yesterday’s trading session at $2.50.

The company  recently completed the sale of its crude oil pipeline and trucking segments for $132 million. The company will now focus on operating as a pure-play terminal company.

Solid continuous gains, bought at $2, could easily keep pushing upwards....",bradal,2,/r/pennystocks/comments/m2hpio/the_lounge_thoughts_noob_stuff_low_effort_brokers/gqja21y/,0.076,0.802,0.121,0.34
386,ASRT, ASRT shit itself,LeFlea,2,/r/pennystocks/comments/m2hpio/the_lounge_thoughts_noob_stuff_low_effort_brokers/gqkrbet/,0.643,0.357,0.0,-0.5574
387,MARA, Why are ARBKF and BFARF stagnant while RIOT and MARA are on the rise? Am I missing something on these?,BigBuBBAEsq,2,/r/pennystocks/comments/m2hpio/the_lounge_thoughts_noob_stuff_low_effort_brokers/gql68ce/,0.288,0.712,0.0,-0.7841
388,RIOT, Why are ARBKF and BFARF stagnant while RIOT and MARA are on the rise? Am I missing something on these?,BigBuBBAEsq,2,/r/pennystocks/comments/m2hpio/the_lounge_thoughts_noob_stuff_low_effort_brokers/gql68ce/,0.288,0.712,0.0,-0.7841
389,KODK, Not quite a penny stock but one near and dear to many. KODK in play again.,Germanicusss,2,/r/pennystocks/comments/m2hpio/the_lounge_thoughts_noob_stuff_low_effort_brokers/gql7g0d/,0.0,0.667,0.333,0.7579
390,TMBR," Don't look now but TMBR is finally on a run, been heavy on it for weeks and it's been trying but today it's on a rocket ride. Up like 40% and finally well in the green on this one after it being my problem child ruining my gains. Now it's just a matter of when to sell",hearsedriverjon,2,/r/pennystocks/comments/m2hpio/the_lounge_thoughts_noob_stuff_low_effort_brokers/gqlmqj7/,0.094,0.748,0.158,0.4767
391,DPW," DPW is going on a ride too, look at the 5 day chart it's moving about 20 degrees straight up in a nice steady marching line. Running out of time to get in before this one goes. Up UP UP! Last call on the rocket lol",hearsedriverjon,2,/r/pennystocks/comments/m2hpio/the_lounge_thoughts_noob_stuff_low_effort_brokers/gqlph1e/,0.0,0.837,0.163,0.7777
392,ASRT, ASRT has some good buying pressure.,Mrke1,2,/r/pennystocks/comments/m2hpio/the_lounge_thoughts_noob_stuff_low_effort_brokers/gqm4389/,0.242,0.44,0.319,0.1779
393,EOD," MDMP: A tragedy in 3 parts.

Part 1: in at .33, take profits at .70

Part 2: in again at .82, hoping to break 1.00

Part 3: lose all profits by EOD. 


Why am I like this.",ireallydontcare52,2,/r/pennystocks/comments/m2hpio/the_lounge_thoughts_noob_stuff_low_effort_brokers/gqmat83/,0.154,0.606,0.24,0.4588
394,APHA, Damn why did tlry and APHA just rocket?,AmbassadorDull1520,2,/r/pennystocks/comments/m2hpio/the_lounge_thoughts_noob_stuff_low_effort_brokers/gqlqsd4/,0.278,0.722,0.0,-0.4019
395,CTXR," Hoping our big Green Day’s can stay where they are. I’m not really chasing any penny plays anymore just finding good ones to sell covered calls on and dipping my toes in some DD 

I liked $ENVB two days ago aH and boom yesterday happened. Today I’m gonna hope PXS does same I dipped in to that. 


Other than that still slowly buying dips on ZOM and CTXR and swinging them to artificially “lower” my buy price because buying and selling for a quick $30 means I paid $30 less to own same amount of shares if you think about it that way.",LeoFireGod,1,/r/pennystocks/comments/m2hpio/the_lounge_thoughts_noob_stuff_low_effort_brokers/gqj9e4w/,0.0,0.856,0.144,0.9274
396,DD," Hoping our big Green Day’s can stay where they are. I’m not really chasing any penny plays anymore just finding good ones to sell covered calls on and dipping my toes in some DD 

I liked $ENVB two days ago aH and boom yesterday happened. Today I’m gonna hope PXS does same I dipped in to that. 


Other than that still slowly buying dips on ZOM and CTXR and swinging them to artificially “lower” my buy price because buying and selling for a quick $30 means I paid $30 less to own same amount of shares if you think about it that way.",LeoFireGod,1,/r/pennystocks/comments/m2hpio/the_lounge_thoughts_noob_stuff_low_effort_brokers/gqj9e4w/,0.0,0.856,0.144,0.9274
397,PXS," Hoping our big Green Day’s can stay where they are. I’m not really chasing any penny plays anymore just finding good ones to sell covered calls on and dipping my toes in some DD 

I liked $ENVB two days ago aH and boom yesterday happened. Today I’m gonna hope PXS does same I dipped in to that. 


Other than that still slowly buying dips on ZOM and CTXR and swinging them to artificially “lower” my buy price because buying and selling for a quick $30 means I paid $30 less to own same amount of shares if you think about it that way.",LeoFireGod,1,/r/pennystocks/comments/m2hpio/the_lounge_thoughts_noob_stuff_low_effort_brokers/gqj9e4w/,0.0,0.856,0.144,0.9274
398,ZOM," Hoping our big Green Day’s can stay where they are. I’m not really chasing any penny plays anymore just finding good ones to sell covered calls on and dipping my toes in some DD 

I liked $ENVB two days ago aH and boom yesterday happened. Today I’m gonna hope PXS does same I dipped in to that. 


Other than that still slowly buying dips on ZOM and CTXR and swinging them to artificially “lower” my buy price because buying and selling for a quick $30 means I paid $30 less to own same amount of shares if you think about it that way.",LeoFireGod,1,/r/pennystocks/comments/m2hpio/the_lounge_thoughts_noob_stuff_low_effort_brokers/gqj9e4w/,0.0,0.856,0.144,0.9274
399,DD," I found INCC off a my first screener, but don’t trust my pick skills just yet. Does anyone have any DD or insight on it?",ArcticRiot,1,/r/pennystocks/comments/m2hpio/the_lounge_thoughts_noob_stuff_low_effort_brokers/gqklq3r/,0.0,0.832,0.168,0.6652
400,ZSAN, What's good today ladies and gents? I see ZSAN and MDMP moving.. anything else to add to the pile here?,Reasonable_Pepper_40,1,/r/pennystocks/comments/m2hpio/the_lounge_thoughts_noob_stuff_low_effort_brokers/gqkx3y5/,0.0,0.847,0.153,0.504
401,JMIA," After seeing VPER’s SEC filing, I just loaded up on JMIA.",johnbburg,1,/r/pennystocks/comments/m2hpio/the_lounge_thoughts_noob_stuff_low_effort_brokers/gql26si/,0.0,1.0,0.0,0.0
402,NAK, Nice little uptrend for NAK,AmbassadorDull1520,1,/r/pennystocks/comments/m2hpio/the_lounge_thoughts_noob_stuff_low_effort_brokers/gqlt8zj/,0.0,0.588,0.412,0.4215
403,DD," For anyone that knows how to do good DD, could you look into ASDND/ASDN for me? My strategy says it’s a good pick, but I’m not confident in my picks lately.",ArcticRiot,1,/r/pennystocks/comments/m2hpio/the_lounge_thoughts_noob_stuff_low_effort_brokers/gqlyyn5/,0.1,0.786,0.114,-0.1386
404,GNUS, TXMD might be the move. Also looking at ZOM and GNUS. Give me some feedback.,VastRefinery08,1,/r/pennystocks/comments/m2hpio/the_lounge_thoughts_noob_stuff_low_effort_brokers/gqm3au8/,0.0,1.0,0.0,0.0
405,TXMD, TXMD might be the move. Also looking at ZOM and GNUS. Give me some feedback.,VastRefinery08,1,/r/pennystocks/comments/m2hpio/the_lounge_thoughts_noob_stuff_low_effort_brokers/gqm3au8/,0.0,1.0,0.0,0.0
406,ZOM, TXMD might be the move. Also looking at ZOM and GNUS. Give me some feedback.,VastRefinery08,1,/r/pennystocks/comments/m2hpio/the_lounge_thoughts_noob_stuff_low_effort_brokers/gqm3au8/,0.0,1.0,0.0,0.0
407,GSM, I am investing my 1400 check in TELL and GSM,ShopBitter,1,/r/pennystocks/comments/m2hpio/the_lounge_thoughts_noob_stuff_low_effort_brokers/gqmbzml/,0.0,1.0,0.0,0.0
408,TELL, I am investing my 1400 check in TELL and GSM,ShopBitter,1,/r/pennystocks/comments/m2hpio/the_lounge_thoughts_noob_stuff_low_effort_brokers/gqmbzml/,0.0,1.0,0.0,0.0
409,ENTX, Bought ENTX 7K shares at $5.35 and it dropped looks okay after hour any predictions for tomorrow!,sunny1387,1,/r/pennystocks/comments/m2hpio/the_lounge_thoughts_noob_stuff_low_effort_brokers/gqmcpvj/,0.0,0.774,0.226,0.5255
410,ASRT," ASRT please do something, or else I am going to sell before 4",cat_warrior,1,/r/pennystocks/comments/m2hpio/the_lounge_thoughts_noob_stuff_low_effort_brokers/gqknl9u/,0.0,0.813,0.187,0.3182
411,HIMX, I have HIMX,NPRjunkieDC,1,/r/pennystocks/comments/m2hpio/the_lounge_thoughts_noob_stuff_low_effort_brokers/gqkezo1/,0.0,1.0,0.0,0.0
412,TD," Sounds like it may be a trading fee averaged in. How many did you buy?  TD Ameritrade has a $6.99 trading fee when you buy and sell. 

For this reason when I buy penny stocks,I buy a large quantity so that the fees effect on the average is nearly negligible.",someoneshouldbefired,6,/r/pennystocks/comments/m2hpio/the_lounge_thoughts_noob_stuff_low_effort_brokers/gql7nz5/,0.0,0.947,0.053,0.3612
413,RH," I recently switched to TD Ameritrade from RH and it is a night and day difference! Learning how to use ThinkOrSwim can be overwhelming, but once you get the hang of it, it's a gold mine! 

Lots of brokers (other than RH) allow you to Paper Trade for a while too which is highly recommended! It gives you a chance to learn their platform and practice your stock picking skills before you have real money on the line.

Do keep in mind though that for OTCMkts stocks there is a $6.99 transaction fee on TD Ameritrade. I think Fidelity does $0 fees for OTC stocks but I don't know if there are any others. A fair number of Penny Stocks trade on OTC so it's worth looking into whether you think you'll be trading a lot of OTCs prior to choosing your broker.",Suskey524,2,/r/pennystocks/comments/m2hpio/the_lounge_thoughts_noob_stuff_low_effort_brokers/gqlu9w7/,0.0,0.891,0.109,0.9265
