,ticker,comment,username,score,permalink,neg,neu,pos,compound
896,GME," I’ve got to say I’m pretty glad I don’t read 10 posts a day from shitlickers going “Please Elon tweet now” as if he was the GME Gandalf. 

To be clear I’m holding 125 shares and I’m a total noob here, but fuck me it’s pathetic.",TheManagerDustBunny,51,/r/wallstreetbets/comments/mbb9n8/daily_discussion_thread_for_march_23_2021/grwwiwi/,0.2,0.662,0.138,-0.7506
897,GME," I don’t understand why this sub accepts GME as a logical investment, but not C çïV AHEM",Danile2401,-15,/r/wallstreetbets/comments/mbgdeq/bought_the_dip_averaged_down_gme_waiting_for_that/grxr7yc/,0.0,0.887,0.113,0.1655
898,VERY, VERY NICE,Shitpopo,1,/r/wallstreetbets/comments/mbgdeq/bought_the_dip_averaged_down_gme_waiting_for_that/gryhlaf/,0.0,0.244,0.756,0.4754
899,HOPE, HOPE YA BOUGHT THE TASTY DISCOUNT :),BarberTricky171,1,/r/wallstreetbets/comments/mbgdeq/bought_the_dip_averaged_down_gme_waiting_for_that/gryoqhv/,0.0,0.43,0.57,0.7672
900,GME," Imagine being the other guy in the options deal.  Free money for the FDs and if GME hits 800, you’re making bank anyway",BillMahersPorkCigar,41,/r/wallstreetbets/comments/mbgdeq/bought_the_dip_averaged_down_gme_waiting_for_that/gry6sow/,0.0,0.87,0.13,0.5106
901,PM," I will be messaging you in 1 month on [**2021-04-27 15:47:40 UTC**](http://www.wolframalpha.com/input/?i=2021-04-27%2015:47:40%20UTC%20To%20Local%20Time) to remind you of [**this link**](https://www.reddit.com/r/wallstreetbets/comments/mbgdeq/bought_the_dip_averaged_down_gme_waiting_for_that/grxv3jv/?context=3)

[**2 OTHERS CLICKED THIS LINK**](https://www.reddit.com/message/compose/?to=RemindMeBot&subject=Reminder&message=%5Bhttps%3A%2F%2Fwww.reddit.com%2Fr%2Fwallstreetbets%2Fcomments%2Fmbgdeq%2Fbought_the_dip_averaged_down_gme_waiting_for_that%2Fgrxv3jv%2F%5D%0A%0ARemindMe%21%202021-04-27%2015%3A47%3A40%20UTC) to send a PM to also be reminded and to reduce spam.

^(Parent commenter can ) [^(delete this message to hide from others.)](https://www.reddit.com/message/compose/?to=RemindMeBot&subject=Delete%20Comment&message=Delete%21%20mbgdeq)

*****

|[^(Info)](https://www.reddit.com/r/RemindMeBot/comments/e1bko7/remindmebot_info_v21/)|[^(Custom)](https://www.reddit.com/message/compose/?to=RemindMeBot&subject=Reminder&message=%5BLink%20or%20message%20inside%20square%20brackets%5D%0A%0ARemindMe%21%20Time%20period%20here)|[^(Your Reminders)](https://www.reddit.com/message/compose/?to=RemindMeBot&subject=List%20Of%20Reminders&message=MyReminders%21)|[^(Feedback)](https://www.reddit.com/message/compose/?to=Watchful1&subject=RemindMeBot%20Feedback)|
|-|-|-|-|",RemindMeBot,1,/r/wallstreetbets/comments/mbgdeq/bought_the_dip_averaged_down_gme_waiting_for_that/grxv7q7/,0.105,0.895,0.0,-0.6322
902,BE," Hmm... I wonder why hedge funds are doing in mass... Not way it could be securing literal free gains with zero risk here...

NOPE THEY MUST ONLY BE SHORTING THE STOCK!!",disfordixon,9,/r/wallstreetbets/comments/mbgdeq/bought_the_dip_averaged_down_gme_waiting_for_that/gryx8xe/,0.057,0.709,0.234,0.7568
903,REG," Let the truth be free about REG SHO SEC loop whole that allows HF to Naked Short with NO ACCOUNTABILITY which is the real lie. How else can there but x number times more shares held then outstanding. 

What % could shorts like Melvin Capital pay to borrow shares as in a legal short sale. Anyone know?",Mouse_Numerous,2,/r/wallstreetbets/comments/mbnby6/thats_how_i_wanna_see_it/gryzwn8/,0.051,0.63,0.318,0.9563
904,GME, GME on di out jump the dip,tgone40,1,/r/wallstreetbets/comments/mbnby6/thats_how_i_wanna_see_it/grz6fjf/,0.0,1.0,0.0,0.0
905,GME, They lost money on a lot of their long positions that they had to sell off in order to cover their GME position.,XxpapiXx69,3,/r/wallstreetbets/comments/mbnby6/thats_how_i_wanna_see_it/grz85nm/,0.099,0.901,0.0,-0.3182
906,AMC, Yeah but can you now add GME and AMC over the other faces? ಠ_ಠ,leo98918,2,/r/wallstreetbets/comments/mbnby6/thats_how_i_wanna_see_it/grz7lpd/,0.0,0.89,0.11,0.1531
907,GME, Yeah but can you now add GME and AMC over the other faces? ಠ_ಠ,leo98918,2,/r/wallstreetbets/comments/mbnby6/thats_how_i_wanna_see_it/grz7lpd/,0.0,0.89,0.11,0.1531
908,GB, Who are you talking about? I’m talking about putting gabe on there to get GB,Leroy_jenkinzzzz,3,/r/wallstreetbets/comments/mbnby6/thats_how_i_wanna_see_it/grz4rbb/,0.0,1.0,0.0,0.0
909,GME," Wsb seems suspiciously quiet atm. 

Edit: Apparently etoro discussions about GME are also silenced..everything is reported as spam.",besorgsmir,63,/r/wallstreetbets/comments/mbf9fu/wsb_discussion_since_yesterday/grxh9cj/,0.245,0.755,0.0,-0.6369
910,NIO, fucK NIO,Shitpopo,3,/r/wallstreetbets/comments/mbf9fu/wsb_discussion_since_yesterday/gryhqwr/,0.778,0.222,0.0,-0.5423
911,AMC, AMC would probably be right up there with gme if the mods ain’t delete every post on it🤡,BarryAllensShoes,27,/r/wallstreetbets/comments/mbf9fu/wsb_discussion_since_yesterday/grxh2i1/,0.0,1.0,0.0,0.0
912,IVR," UWMC, IVR, MITT, RKT 🚀 to the 🌙 

Real estate market is still booming with highest prices ever. Rates are slowly returning. Inflation is not a concern. These reits and mortgage services are guna be raking in more profit than ever before, for years, due to the 2020 market. Don’t miss out on the reits recovery.",ye_YES,1,/r/wallstreetbets/comments/mbf9fu/wsb_discussion_since_yesterday/gryeom3/,0.029,0.914,0.057,0.3804
913,MITT," UWMC, IVR, MITT, RKT 🚀 to the 🌙 

Real estate market is still booming with highest prices ever. Rates are slowly returning. Inflation is not a concern. These reits and mortgage services are guna be raking in more profit than ever before, for years, due to the 2020 market. Don’t miss out on the reits recovery.",ye_YES,1,/r/wallstreetbets/comments/mbf9fu/wsb_discussion_since_yesterday/gryeom3/,0.029,0.914,0.057,0.3804
914,RKT," UWMC, IVR, MITT, RKT 🚀 to the 🌙 

Real estate market is still booming with highest prices ever. Rates are slowly returning. Inflation is not a concern. These reits and mortgage services are guna be raking in more profit than ever before, for years, due to the 2020 market. Don’t miss out on the reits recovery.",ye_YES,1,/r/wallstreetbets/comments/mbf9fu/wsb_discussion_since_yesterday/gryeom3/,0.029,0.914,0.057,0.3804
915,UWMC," UWMC, IVR, MITT, RKT 🚀 to the 🌙 

Real estate market is still booming with highest prices ever. Rates are slowly returning. Inflation is not a concern. These reits and mortgage services are guna be raking in more profit than ever before, for years, due to the 2020 market. Don’t miss out on the reits recovery.",ye_YES,1,/r/wallstreetbets/comments/mbf9fu/wsb_discussion_since_yesterday/gryeom3/,0.029,0.914,0.057,0.3804
916,GME, Let’s just rename this group GME Bets and go restart WSB.... this shit is trash.... ps: ban,MackNGeez,1,/r/wallstreetbets/comments/mbf9fu/wsb_discussion_since_yesterday/grz0ufq/,0.344,0.656,0.0,-0.8338
917,GME," I just bought in at a good dip, I've been waiting for one for a few days since it's seeming ripe. Sad to see the state of the sub since I peeked in in the beginning of this whole GME deal.",HexagonSun7036,14,/r/wallstreetbets/comments/mbf9fu/wsb_discussion_since_yesterday/gry0gnd/,0.076,0.854,0.071,-0.0516
918,GME," GME is a Ponzai stock, amc was a pump by Chinese shills that made a fortune with the hype... 

Check my post history as I’ve called everything exactly to the T and got downvoted to oblivion cause I was ruining everybody’s hopium high.. I specifically called GME bottoming at $40 before surging and called when everyone was going to get liquidated right before the initial crash",MDMAdness999,-9,/r/wallstreetbets/comments/mbf9fu/wsb_discussion_since_yesterday/gry607h/,0.075,0.925,0.0,-0.5719
919,AMC, Nah it’s cause AMC isn’t the play.,Crate_Mate,-6,/r/wallstreetbets/comments/mbf9fu/wsb_discussion_since_yesterday/gry2d6s/,0.159,0.568,0.273,0.25
920,AMC," You’ve been in WSB for so long you can’t see a once in a lifetime opportunity if it came in your mouth. Keep your $ in AMC, you don’t deserve it.",Crate_Mate,-2,/r/wallstreetbets/comments/mbf9fu/wsb_discussion_since_yesterday/gry5hjk/,0.0,0.906,0.094,0.4215
921,AMC," I don’t buy stock in companies that are 10 billion in debt, lack positive company fundamentals, have a history of issuing shares to raise money and writing their leadership fat bonus checks. AMC is the next blockbuster.",Crate_Mate,1,/r/wallstreetbets/comments/mbf9fu/wsb_discussion_since_yesterday/gry2zl5/,0.102,0.617,0.281,0.8555
922,AMC," I'm not in AMC. I just saw you being an unaware newbie trying to push your shit on others, so I told you so.

Edit: You are aware that it wasn't the brand new ""GME for life, nothing else in WSB!!"" users that started this shit, right? You bandwagoned on (which is totally fine) but don't start pretending that you know so much better than the people that were already here and already made their money on it.",GasolinePizza,4,/r/wallstreetbets/comments/mbf9fu/wsb_discussion_since_yesterday/gry66ij/,0.096,0.852,0.051,-0.1927
923,GME, I’m less concerned about the GME squeeze and more concerned about people literally throwing their money away on a shit company that’s just gonna rob them.,Crate_Mate,-6,/r/wallstreetbets/comments/mbf9fu/wsb_discussion_since_yesterday/gry7l9y/,0.238,0.762,0.0,-0.802
924,PLTR, This confirms my bias. PLTR to the moon 2025,creamyalligatorpears,172,/r/wallstreetbets/comments/mb1sin/pltr_financials_and_growth_potential/grvjrz4/,0.149,0.851,0.0,-0.1027
925,PLTR," I thought this was helpful. I have a small position in PLTR myself. One suggestion could be to discuss some risks to PLTR. For example, risks that PLTR is unable to expand their business, or if competitors catch up. Just a suggestion, your post is already really helpful!",Pikachu87,10,/r/wallstreetbets/comments/mb1sin/pltr_financials_and_growth_potential/grw6o0q/,0.082,0.759,0.159,0.6114
926,PLTR, I liked PLTR soo much that I decided to apply to work for them. It's too bad that I'm retarded :[,Tall_Character3685,28,/r/wallstreetbets/comments/mb1sin/pltr_financials_and_growth_potential/grvntsu/,0.364,0.536,0.1,-0.8126
927,PLTR," By this point I get nervous when ever I see a WSB DD post and just want to sell, but I honestly like PLTR. Ugh.",Wholesome_Stuff,5,/r/wallstreetbets/comments/mb1sin/pltr_financials_and_growth_potential/grwwvx8/,0.177,0.54,0.283,0.4854
928,PLTR," Good point on the long dated nature of PLTR's cash flows and its higher sensitivity to rising yields and interest rates.

With revenue growth, SNOW is growing off a much lower base so it makes sense that they grow faster than PLTR. Also, SNOW's platform has proven its scalability while PLTR hasn't so that would add a bit more speed to SNOW. When PLTR can show that it can scale then I think we're in for very strong revenue growth. Of course, an investment in PLTR is not without risk, in fact there are many risks with this investment that may have been factored into the multiples.

""Palantir should be reporting around 320m $ + Net Income and in 5 years those pre-IPO stock compensation agreements will all have expired."" - Nice one. I have about $380m in my model in FY25.",Available-Row7494,4,/r/wallstreetbets/comments/mb1sin/pltr_financials_and_growth_potential/grx644o/,0.039,0.819,0.142,0.937
929,SNOW," Good point on the long dated nature of PLTR's cash flows and its higher sensitivity to rising yields and interest rates.

With revenue growth, SNOW is growing off a much lower base so it makes sense that they grow faster than PLTR. Also, SNOW's platform has proven its scalability while PLTR hasn't so that would add a bit more speed to SNOW. When PLTR can show that it can scale then I think we're in for very strong revenue growth. Of course, an investment in PLTR is not without risk, in fact there are many risks with this investment that may have been factored into the multiples.

""Palantir should be reporting around 320m $ + Net Income and in 5 years those pre-IPO stock compensation agreements will all have expired."" - Nice one. I have about $380m in my model in FY25.",Available-Row7494,4,/r/wallstreetbets/comments/mb1sin/pltr_financials_and_growth_potential/grx644o/,0.039,0.819,0.142,0.937
930,PLTR," The Ferrari Formula 1 team is using PLTR to speed up the analysis of its data this season. F1 is literally an arms race and this can/will become a real-world testbed of PLTR's technology that the world can witness in real time. Should it prove critical in increasing the performance of Ferrari, this could really speed up the commercial awareness and growth of PLTR.",Jet88,5,/r/wallstreetbets/comments/mb1sin/pltr_financials_and_growth_potential/grxdui2/,0.035,0.924,0.04,0.0772
931,PLTR, PLTR will shine like a 💎💎 and 🚀🚀,Suspicious_Ad7571,8,/r/wallstreetbets/comments/mb1sin/pltr_financials_and_growth_potential/grvtqq2/,0.0,0.706,0.294,0.3612
932,PLTR, Too much reading I just scrolled down to see your position then I buy PLTR,balkso,6,/r/wallstreetbets/comments/mb1sin/pltr_financials_and_growth_potential/grvouss/,0.0,1.0,0.0,0.0
933,DD," Maybe I'm an Ape, but what's up with the copy paste formatting DD for PLTR and GME the last 3 days looking identical from 1 month old accounts?",VeoDigital,13,/r/wallstreetbets/comments/mb1sin/pltr_financials_and_growth_potential/grvhsld/,0.0,1.0,0.0,0.0
934,GME," Maybe I'm an Ape, but what's up with the copy paste formatting DD for PLTR and GME the last 3 days looking identical from 1 month old accounts?",VeoDigital,13,/r/wallstreetbets/comments/mb1sin/pltr_financials_and_growth_potential/grvhsld/,0.0,1.0,0.0,0.0
935,PLTR," Maybe I'm an Ape, but what's up with the copy paste formatting DD for PLTR and GME the last 3 days looking identical from 1 month old accounts?",VeoDigital,13,/r/wallstreetbets/comments/mb1sin/pltr_financials_and_growth_potential/grvhsld/,0.0,1.0,0.0,0.0
936,PLTR," Just wanted to throw out there that in your opening statement you mention Soros as a backer but he publicly stated he was going to liquidate all their PLTR shares after lockup.

They filed their 13F 2 days before the lockup expiration so we'll have to wait until May to see how much he dumped.",Hei_Fox,2,/r/wallstreetbets/comments/mb1sin/pltr_financials_and_growth_potential/grvz38a/,0.062,0.889,0.049,-0.1901
937,AI," I don't know much about investing but their software is fucking cool.. straight out CSI movie shit. 

Probably had a bump too with Covid response, use cases around contact tracing, used heavily in Law enforcement etc.

Data and AI tech will got to the moon..",whiteycnbr,2,/r/wallstreetbets/comments/mb1sin/pltr_financials_and_growth_potential/grwd09x/,0.101,0.842,0.057,-0.4823
938,PLTR," Solid content, especially for new PLTR blood🛸",likethisstock,2,/r/wallstreetbets/comments/mb1sin/pltr_financials_and_growth_potential/grx69mg/,0.0,0.789,0.211,0.1531
939,DD, It’s nice to see solid DD again,StonkWonker,2,/r/wallstreetbets/comments/mb1sin/pltr_financials_and_growth_potential/grxbr4o/,0.0,0.532,0.468,0.5267
940,PLTR, Please be right PLTR has been butt fucking me for the past while,hihiyt,5,/r/wallstreetbets/comments/mb1sin/pltr_financials_and_growth_potential/grvu3zm/,0.0,0.839,0.161,0.3182
941,DD, Thx for your DD. It's a lot of text. i need probadly some days to read and understand 🤣😅,konhana,3,/r/wallstreetbets/comments/mb1sin/pltr_financials_and_growth_potential/grvmzi2/,0.0,0.865,0.135,0.3612
942,DD," Need to correct Boeing to Airbus, btw. Otherwise, great DD. Been adding on this dip and hoping to add another 500 shares this week. Positions: 3k shares, 4/30 $35C  6/18 $26C.",scallion11,2,/r/wallstreetbets/comments/mb1sin/pltr_financials_and_growth_potential/grvobj2/,0.0,0.705,0.295,0.8834
943,PLTR," I'll buy in as soon as PLTR drops back to 22.xx. Why? There is good resistance at 22.5, so IF I drop 10k on it, it be better at the bottom. In a play that might need at least 6-12 months to pay off, that's key.

&#x200B;

Obviously it could moon because hype or whatever before, but we dont know that.",TrumXReddit,3,/r/wallstreetbets/comments/mb1sin/pltr_financials_and_growth_potential/grwmnnj/,0.046,0.864,0.09,0.4041
944,DD," Dude this is top notch, I wanna learn to do DD like this.",treefellonme,1,/r/wallstreetbets/comments/mb1sin/pltr_financials_and_growth_potential/grw0cx7/,0.0,0.699,0.301,0.5106
945,PLTR, I like PLTR 🚀🚀🚀🚀🚀🚀🚀🚀🚀,spliffsandshit,1,/r/wallstreetbets/comments/mb1sin/pltr_financials_and_growth_potential/grwhy0z/,0.0,0.444,0.556,0.3612
946,DD," Great post, thanks for the links to other DD",JohnLakeman99,1,/r/wallstreetbets/comments/mb1sin/pltr_financials_and_growth_potential/grwslw8/,0.0,0.5,0.5,0.7906
947,PLTR, This is the confirmation bias I needed. PLTR to $100!!,themindspeaks,1,/r/wallstreetbets/comments/mb1sin/pltr_financials_and_growth_potential/grxooyn/,0.199,0.801,0.0,-0.2462
948,DD, Thank you for your serious DD.  It means a lot me!  Sharing with my family and friends who have become a huge fan of PLTR\~,AmphibianBubbly3521,1,/r/wallstreetbets/comments/mb1sin/pltr_financials_and_growth_potential/grxqscr/,0.041,0.538,0.421,0.8999
949,DD," I love this DD but my concern is with salesforce, aren't they a big competitor in this space too? 340 shares @ 26.90 pltr moon moon etc etc",dudesonly69,1,/r/wallstreetbets/comments/mb1sin/pltr_financials_and_growth_potential/grxwcts/,0.0,0.81,0.19,0.6597
950,PLTR," PLTR is a fucking joke, but there's no convincing you idiots, is there?",canufeelthelove,-11,/r/wallstreetbets/comments/mb1sin/pltr_financials_and_growth_potential/grvyjnm/,0.164,0.526,0.31,0.3604
951,DCF, Well done posting the formula for DCF valuation and then not using it. Very smart very cool.,Saltfaces,0,/r/wallstreetbets/comments/mb1sin/pltr_financials_and_growth_potential/grwqxvq/,0.0,0.638,0.362,0.7876
952,DD, Good enough DD for me if you are satisfied I’m all in,andudetoo,19,/r/wallstreetbets/comments/mb1sin/pltr_financials_and_growth_potential/grvq3to/,0.0,0.637,0.363,0.6908
953,DD," I keep saying it, but the current sentiment on PLTR looks the same as when MU was the darling child of wsb that most of the sub lose their allowance on. Non-stop DD about how amazing they are in every aspect, how they're so undervalued, and over and over the calls would expire worthless. I'm holding a decent amount of shares but I think I'll sell some of you retards more OTM calls while PLTR takes a few years to finally get there.",MagicalChemicalz,18,/r/wallstreetbets/comments/mb1sin/pltr_financials_and_growth_potential/grw9dcp/,0.078,0.782,0.14,0.7783
954,MU," I keep saying it, but the current sentiment on PLTR looks the same as when MU was the darling child of wsb that most of the sub lose their allowance on. Non-stop DD about how amazing they are in every aspect, how they're so undervalued, and over and over the calls would expire worthless. I'm holding a decent amount of shares but I think I'll sell some of you retards more OTM calls while PLTR takes a few years to finally get there.",MagicalChemicalz,18,/r/wallstreetbets/comments/mb1sin/pltr_financials_and_growth_potential/grw9dcp/,0.078,0.782,0.14,0.7783
955,PLTR," I keep saying it, but the current sentiment on PLTR looks the same as when MU was the darling child of wsb that most of the sub lose their allowance on. Non-stop DD about how amazing they are in every aspect, how they're so undervalued, and over and over the calls would expire worthless. I'm holding a decent amount of shares but I think I'll sell some of you retards more OTM calls while PLTR takes a few years to finally get there.",MagicalChemicalz,18,/r/wallstreetbets/comments/mb1sin/pltr_financials_and_growth_potential/grw9dcp/,0.078,0.782,0.14,0.7783
956,PLTR," Yeah, was thinking of that. If you go on the sec website (sec.gov) and look for the PLTR filing, you‘ll find a chapter „Risk Factors“ where they go over the potential risks.",kronos-arcanum,5,/r/wallstreetbets/comments/mb1sin/pltr_financials_and_growth_potential/grwrdwc/,0.063,0.871,0.066,0.0258
957,MSFT," Part of PLTRs advantage is that they pick and choose their clients, and they tend to go for the big complicated jobs no one else can even consider touching.

They also have less competition than, say, snowflake, who, thanks to their approach to data analysis, can even count companies like Google and MSFT as competition.

I've been looking for a major bear case for PLTR for a while now and the closest I've got was lack of profitability.",Nemisis_the_2nd,10,/r/wallstreetbets/comments/mb1sin/pltr_financials_and_growth_potential/grweqf1/,0.054,0.833,0.113,0.6124
958,PLTR," Part of PLTRs advantage is that they pick and choose their clients, and they tend to go for the big complicated jobs no one else can even consider touching.

They also have less competition than, say, snowflake, who, thanks to their approach to data analysis, can even count companies like Google and MSFT as competition.

I've been looking for a major bear case for PLTR for a while now and the closest I've got was lack of profitability.",Nemisis_the_2nd,10,/r/wallstreetbets/comments/mb1sin/pltr_financials_and_growth_potential/grweqf1/,0.054,0.833,0.113,0.6124
959,PLTR," That‘s a nice take! Didn‘t know about the Ferrari F1 team & PLTR, thanks for sharing!",kronos-arcanum,3,/r/wallstreetbets/comments/mb1sin/pltr_financials_and_growth_potential/grxdzla/,0.0,0.548,0.452,0.8436
960,PLTR," Uhm, I don‘t really see your point. I‘ve been doing PLTR DD for the past few days and thought I‘d share it with you guys (check my last post).",kronos-arcanum,25,/r/wallstreetbets/comments/mb1sin/pltr_financials_and_growth_potential/grvhyfj/,0.0,0.925,0.075,0.296
961,PLTR," Yeah, I read the Fund‘s philosophy, they basically buy „undervalued“ stocks and dump em. Nevertheless some other big funds with some pretty overweight positions.

Edit: He‘s dumping them for ethical reasons though. The dude shorted the Thai Baht and the GBP to shits, literally screwing over millions of people but is concerned about his investment in PLTR 😂",kronos-arcanum,9,/r/wallstreetbets/comments/mb1sin/pltr_financials_and_growth_potential/grvz8r1/,0.139,0.767,0.094,-0.2144
962,AMC," This is the kind of DD that we need more of: it confirms my bias while also being detailed and thorough.

Can you do one for AMC too? My ego needs reassuring.",Nemisis_the_2nd,4,/r/wallstreetbets/comments/mb1sin/pltr_financials_and_growth_potential/grwebyj/,0.041,0.88,0.079,0.3182
963,DD," This is the kind of DD that we need more of: it confirms my bias while also being detailed and thorough.

Can you do one for AMC too? My ego needs reassuring.",Nemisis_the_2nd,4,/r/wallstreetbets/comments/mb1sin/pltr_financials_and_growth_potential/grwebyj/,0.041,0.88,0.079,0.3182
964,NHS," Agreed. One point I forgot to mention is that currently PLTR‘s revenues consist of mainly UK, USA, Germany and France (33% rest of the world - which I assume most of that being in Japan). Now aside from the USA Military contracts I don‘t think (correct me if I‘m wrong) that they have any military contracts with other countries - government contracts, yes, NHS in the UK for example. So if other NATO countries start using PLTR for their military operations (if PLTR is even in the position to expand to those countries without jeopardizing their relations to the US military) government expenses are set to grow massively. On the commercial side, I think they‘re heading in the right direction.",kronos-arcanum,2,/r/wallstreetbets/comments/mb1sin/pltr_financials_and_growth_potential/grx97ec/,0.0,0.94,0.06,0.7269
965,PLTR," Agreed. One point I forgot to mention is that currently PLTR‘s revenues consist of mainly UK, USA, Germany and France (33% rest of the world - which I assume most of that being in Japan). Now aside from the USA Military contracts I don‘t think (correct me if I‘m wrong) that they have any military contracts with other countries - government contracts, yes, NHS in the UK for example. So if other NATO countries start using PLTR for their military operations (if PLTR is even in the position to expand to those countries without jeopardizing their relations to the US military) government expenses are set to grow massively. On the commercial side, I think they‘re heading in the right direction.",kronos-arcanum,2,/r/wallstreetbets/comments/mb1sin/pltr_financials_and_growth_potential/grx97ec/,0.0,0.94,0.06,0.7269
966,UK," Agreed. One point I forgot to mention is that currently PLTR‘s revenues consist of mainly UK, USA, Germany and France (33% rest of the world - which I assume most of that being in Japan). Now aside from the USA Military contracts I don‘t think (correct me if I‘m wrong) that they have any military contracts with other countries - government contracts, yes, NHS in the UK for example. So if other NATO countries start using PLTR for their military operations (if PLTR is even in the position to expand to those countries without jeopardizing their relations to the US military) government expenses are set to grow massively. On the commercial side, I think they‘re heading in the right direction.",kronos-arcanum,2,/r/wallstreetbets/comments/mb1sin/pltr_financials_and_growth_potential/grx97ec/,0.0,0.94,0.06,0.7269
