,ticker,comment,username,score,permalink,neg,neu,pos,compound
0,ZOM, Been holding onto ZOM for so long! So excited to see where this goes!,adg2627,161,/r/pennystocks/comments/m67xhl/zom_sells_first_truforma_unit/gr49030/,0.0,0.786,0.214,0.5485
1,ZOM," ZOM fucked this up for everybody with this ""early release"" of 1 unit

Beem carefully planning this out for a month, just for them to kick me in the dick. At basically break even right now. This was supposed to be my big March play.

DICK MOVE ZOM!!!",napoelonDynaMighty,7,/r/pennystocks/comments/m67xhl/zom_sells_first_truforma_unit/gr5nh24/,0.219,0.713,0.068,-0.8936
2,BOOM," I checked my Schwab account and knew something went down. I somehow managed to do something right for once Lol...

Had it set to sell at 2.50 thinking I’d never see that. BOOM... I’m so dang happy I set that sell price and left my accounts alone for the last week lol",TexasNotQuite40,3,/r/pennystocks/comments/m67xhl/zom_sells_first_truforma_unit/gr5ir3q/,0.037,0.84,0.124,0.6983
3,AMC," Thought about selling at break even yesterday and put it in AMC, but too lazy too think",uuuuniverse,2,/r/pennystocks/comments/m67xhl/zom_sells_first_truforma_unit/gr52hex/,0.169,0.831,0.0,-0.5023
4,ZOM, Biopharma isn't my cup of tea and I know ZOM is very popular. But geez this stock's current price is 3850.00% compared to its 52 week low. But the stock is available since 2016.,anyfactor,1,/r/pennystocks/comments/m67xhl/zom_sells_first_truforma_unit/gr5a7xy/,0.058,0.857,0.085,0.2484
5,ZOM, I’ve been looking at ZOM for a few weeks now debating on selling but I guess I’ll hold just a little while longer,Skweebie,1,/r/pennystocks/comments/m67xhl/zom_sells_first_truforma_unit/gr5gcoj/,0.0,1.0,0.0,0.0
6,ZOM," Was there to see the price hit ""the"" bottom, and was in it till $1, just before the Carol Baskin video that sparked the first rocket. I only wanted to step out of the rocket for a second and it went off without me! I'm glad y'all are making profits though. It took a while for ZOM to play out but it was worth watching it come back up.",WhatnotSoforth,5,/r/pennystocks/comments/m67xhl/zom_sells_first_truforma_unit/gr583ul/,0.025,0.885,0.09,0.5502
7,ZOM, I sold off 867 shares of ZOM at $0.08 at the end of October. 🥺,iliketapestries,13,/r/pennystocks/comments/m67xhl/zom_sells_first_truforma_unit/gr4qlx5/,0.0,0.845,0.155,0.296
8,ZOM," Yeah, the sudden ZOM FUD on here is weird.

It's mainly from people boasting ""I had Zom at $.040 cents and sold at $1. Zom is done now"" 

Not sure why there's this weird pettiness where old ZOM is spreading FUD to people in at $2 and want to see it go to $3 . All this weird finger pointing and calling people bagholders, is weird. 

I think proceeding with caution is the move, but I don't care of others sell, the way some on here seem to care so much about who is holding for the moment. Weirdo stuff lol",napoelonDynaMighty,8,/r/pennystocks/comments/m67xhl/zom_sells_first_truforma_unit/gr5x5dl/,0.189,0.754,0.057,-0.8967
9,CCJ," 15500 shares at .82 average. Most confident growth stock share I own. $5 share is a conservative price in my opinion.

Also own URNM, UUUU, CCJ, NXE on this uranium play. But DNN my biggest holding.",oilers169,158,/r/pennystocks/comments/m5ya5k/dnn_denison_mines_corp_undervalued_company_what/gr2ylnn/,0.0,0.646,0.354,0.9242
10,DNN," 15500 shares at .82 average. Most confident growth stock share I own. $5 share is a conservative price in my opinion.

Also own URNM, UUUU, CCJ, NXE on this uranium play. But DNN my biggest holding.",oilers169,158,/r/pennystocks/comments/m5ya5k/dnn_denison_mines_corp_undervalued_company_what/gr2ylnn/,0.0,0.646,0.354,0.9242
11,NXE," 15500 shares at .82 average. Most confident growth stock share I own. $5 share is a conservative price in my opinion.

Also own URNM, UUUU, CCJ, NXE on this uranium play. But DNN my biggest holding.",oilers169,158,/r/pennystocks/comments/m5ya5k/dnn_denison_mines_corp_undervalued_company_what/gr2ylnn/,0.0,0.646,0.354,0.9242
12,UUUU," 15500 shares at .82 average. Most confident growth stock share I own. $5 share is a conservative price in my opinion.

Also own URNM, UUUU, CCJ, NXE on this uranium play. But DNN my biggest holding.",oilers169,158,/r/pennystocks/comments/m5ya5k/dnn_denison_mines_corp_undervalued_company_what/gr2ylnn/,0.0,0.646,0.354,0.9242
13,DNN," I'm jealous of your position. I bought DNN at peak price in January and have been holding ever since. I saw all the $2.5 unusual call activity for 3/19 and April and figured there must be something going on that I don't understand. However, I lacked the conviction (and capital) to average down and benefit from the <$1 prices. 

Now, between being added to the TSX and their huge acquisition of physical uranium, I think I understand why people were betting big on DNN. I had planned on it being a long term investment, especially as the mine didn't even begin operation until 2024, but now they have a full supply of uranium and a full head of steam.

We will see how quickly this goes up, but I think it hits $2 before long.",PsycheRevived,38,/r/pennystocks/comments/m5ya5k/dnn_denison_mines_corp_undervalued_company_what/gr2wymp/,0.016,0.955,0.029,0.1655
14,DD, President elect? Is this old DD or your into conspiracies?,gkthomas213,114,/r/pennystocks/comments/m5ya5k/dnn_denison_mines_corp_undervalued_company_what/gr37hep/,0.0,1.0,0.0,0.0
15,DNN," I’m heavily invested myself and share your sentiments. I got in when it was peaking at $1.45, but got my average down to $1.04 when it hit the dips. I can see $2.50 real soon and will then be holding long term. With the Canadian launch on Monday it’s going to be a nice green week for DNN.",Gregamundo,37,/r/pennystocks/comments/m5ya5k/dnn_denison_mines_corp_undervalued_company_what/gr2x1io/,0.0,0.909,0.091,0.6486
16,DD, That feeling when you see more DD posts about a stock you bought 200 shares @ $1 last week 😁,lburwell99,32,/r/pennystocks/comments/m5ya5k/dnn_denison_mines_corp_undervalued_company_what/gr36y22/,0.0,0.802,0.198,0.4019
17,DD,"  good DD, the only problem i have with this is, ""It’s a fact that nuclear energy is cheap"".

That is absolutely false to make a substantial ROI in nuclear it takes years. New nuclear and nuclear refurbishments costs billions and it is the most expensive in the energy sector in terms of initial costs that almost always go over budget. That being said, the rise of green energy and small modular reactors is real but that is still years in the making so I would assume to see some small gains in Uranium stocks in the short term but nothing substantial for quite some time.

&#x200B;

I am still gonna purchase DMM. I like the stock, I work in the nuclear industry and I am Canadian. I have a personal interest in the growth of this industry and do believe it can do well long term.",poopslikepee,7,/r/pennystocks/comments/m5ya5k/dnn_denison_mines_corp_undervalued_company_what/gr3t614/,0.012,0.813,0.174,0.9672
18,DD, DNN is my biggest holding at 2500 shares. Not a lot but pretty new to investing and when I was doing my DD it screamed at me.,sierraviridian17,16,/r/pennystocks/comments/m5ya5k/dnn_denison_mines_corp_undervalued_company_what/gr32u1t/,0.213,0.734,0.053,-0.6996
19,DNN, DNN is my biggest holding at 2500 shares. Not a lot but pretty new to investing and when I was doing my DD it screamed at me.,sierraviridian17,16,/r/pennystocks/comments/m5ya5k/dnn_denison_mines_corp_undervalued_company_what/gr32u1t/,0.213,0.734,0.053,-0.6996
20,DNN, DNN and UUUU make up a good portion of my portfolio,StockSnipa,3,/r/pennystocks/comments/m5ya5k/dnn_denison_mines_corp_undervalued_company_what/gr3im81/,0.0,0.756,0.244,0.4404
21,UUUU, DNN and UUUU make up a good portion of my portfolio,StockSnipa,3,/r/pennystocks/comments/m5ya5k/dnn_denison_mines_corp_undervalued_company_what/gr3im81/,0.0,0.756,0.244,0.4404
22,DNN," DNN is the play, holding for $5+",jroche1987,3,/r/pennystocks/comments/m5ya5k/dnn_denison_mines_corp_undervalued_company_what/gr3vqhb/,0.0,0.714,0.286,0.34
23,DD," Couple of things I would add to the DD ....

1)   DNN has been around mining - pulling U from the earth for 50 + years, no production since about mid 2000 - Used to own EFR and spun it out back then (as well as other assets around the world to focus on Canadian properties). A few comments below were wondering ...

2)   Right now in Georgia (USA) there are 2 modern large reactors under construction, there is a miss-conception voiced below that nuclear is finished in the USA which is the largest single nuclear powered country in the world.

3)   Currently there are 54 modern large reactors in construction around the world.

4)   It is a fact that no one died as a result of the nuclear meltdowns at Fukushima, many thousands however dies from the tidal wave, no one is known to have died from the radiation release/meltdown.

5)   Wind and solar are heavily subsidized, nuclear is not - that fact seldom comes to light when esg's make cost comparisons, the play field is always tilted to the esg's end of the field.

6)   There are over 440 operable commercial reactors in the world, that does not count military reactors operating in ships and submarines.

7)   The Chinese can build a new modern high capacity nuclear reactor in about 5 years from start to finish.",Chief_Bosn,4,/r/pennystocks/comments/m5ya5k/dnn_denison_mines_corp_undervalued_company_what/gr5huv5/,0.061,0.912,0.027,-0.8225
24,DNN," Couple of things I would add to the DD ....

1)   DNN has been around mining - pulling U from the earth for 50 + years, no production since about mid 2000 - Used to own EFR and spun it out back then (as well as other assets around the world to focus on Canadian properties). A few comments below were wondering ...

2)   Right now in Georgia (USA) there are 2 modern large reactors under construction, there is a miss-conception voiced below that nuclear is finished in the USA which is the largest single nuclear powered country in the world.

3)   Currently there are 54 modern large reactors in construction around the world.

4)   It is a fact that no one died as a result of the nuclear meltdowns at Fukushima, many thousands however dies from the tidal wave, no one is known to have died from the radiation release/meltdown.

5)   Wind and solar are heavily subsidized, nuclear is not - that fact seldom comes to light when esg's make cost comparisons, the play field is always tilted to the esg's end of the field.

6)   There are over 440 operable commercial reactors in the world, that does not count military reactors operating in ships and submarines.

7)   The Chinese can build a new modern high capacity nuclear reactor in about 5 years from start to finish.",Chief_Bosn,4,/r/pennystocks/comments/m5ya5k/dnn_denison_mines_corp_undervalued_company_what/gr5huv5/,0.061,0.912,0.027,-0.8225
25,EFR," Couple of things I would add to the DD ....

1)   DNN has been around mining - pulling U from the earth for 50 + years, no production since about mid 2000 - Used to own EFR and spun it out back then (as well as other assets around the world to focus on Canadian properties). A few comments below were wondering ...

2)   Right now in Georgia (USA) there are 2 modern large reactors under construction, there is a miss-conception voiced below that nuclear is finished in the USA which is the largest single nuclear powered country in the world.

3)   Currently there are 54 modern large reactors in construction around the world.

4)   It is a fact that no one died as a result of the nuclear meltdowns at Fukushima, many thousands however dies from the tidal wave, no one is known to have died from the radiation release/meltdown.

5)   Wind and solar are heavily subsidized, nuclear is not - that fact seldom comes to light when esg's make cost comparisons, the play field is always tilted to the esg's end of the field.

6)   There are over 440 operable commercial reactors in the world, that does not count military reactors operating in ships and submarines.

7)   The Chinese can build a new modern high capacity nuclear reactor in about 5 years from start to finish.",Chief_Bosn,4,/r/pennystocks/comments/m5ya5k/dnn_denison_mines_corp_undervalued_company_what/gr5huv5/,0.061,0.912,0.027,-0.8225
26,USA," Couple of things I would add to the DD ....

1)   DNN has been around mining - pulling U from the earth for 50 + years, no production since about mid 2000 - Used to own EFR and spun it out back then (as well as other assets around the world to focus on Canadian properties). A few comments below were wondering ...

2)   Right now in Georgia (USA) there are 2 modern large reactors under construction, there is a miss-conception voiced below that nuclear is finished in the USA which is the largest single nuclear powered country in the world.

3)   Currently there are 54 modern large reactors in construction around the world.

4)   It is a fact that no one died as a result of the nuclear meltdowns at Fukushima, many thousands however dies from the tidal wave, no one is known to have died from the radiation release/meltdown.

5)   Wind and solar are heavily subsidized, nuclear is not - that fact seldom comes to light when esg's make cost comparisons, the play field is always tilted to the esg's end of the field.

6)   There are over 440 operable commercial reactors in the world, that does not count military reactors operating in ships and submarines.

7)   The Chinese can build a new modern high capacity nuclear reactor in about 5 years from start to finish.",Chief_Bosn,4,/r/pennystocks/comments/m5ya5k/dnn_denison_mines_corp_undervalued_company_what/gr5huv5/,0.061,0.912,0.027,-0.8225
27,IMO, i love Pennies that have options...15 contracts at $2strike for Jan 22... for only $910...steal of the day IMO,Win_Existing,8,/r/pennystocks/comments/m5ya5k/dnn_denison_mines_corp_undervalued_company_what/gr335du/,0.0,0.802,0.198,0.6369
28,EA," Does anyone have past experience with a mining company going through a Canadian enivronmental assessment? It may be ""in-situ recovery"" but pumping anything into the ground sounds like a tough sell when it comes to an EA. Then again, Canada is a giant producer of oil sands, so maybe the EA won't be that stringent.",MvrnShkr,3,/r/pennystocks/comments/m5ya5k/dnn_denison_mines_corp_undervalued_company_what/gr3eqco/,0.032,0.907,0.06,0.3612
29,DNN, I don't think DNN will pass 1.50 before 3/19 1.5 Calls expire.  I'm predicting it will be manipulated and prevent 3/19 calls from printing.,gwoody807,12,/r/pennystocks/comments/m5ya5k/dnn_denison_mines_corp_undervalued_company_what/gr3aw1r/,0.105,0.85,0.045,-0.3612
30,DD, Thanks for the DD. Are you invested in other uranium companies such as UUUU or UEC?,djscuba1012,2,/r/pennystocks/comments/m5ya5k/dnn_denison_mines_corp_undervalued_company_what/gr2wcjc/,0.0,0.838,0.162,0.4404
31,UUUU, Thanks for the DD. Are you invested in other uranium companies such as UUUU or UEC?,djscuba1012,2,/r/pennystocks/comments/m5ya5k/dnn_denison_mines_corp_undervalued_company_what/gr2wcjc/,0.0,0.838,0.162,0.4404
32,URG, URG too?,agfueler,1,/r/pennystocks/comments/m5ya5k/dnn_denison_mines_corp_undervalued_company_what/gr3qskz/,0.0,1.0,0.0,0.0
33,DD," Awesome, I'm averaged at 3202 @0.58 I've been wanting to do a DD post for a while but work is ridiculous now, 80 hours a week. Thanks for this. I got 2800$ and this post makes me want to buy more!",Ed_Trucks_Head,1,/r/pennystocks/comments/m5ya5k/dnn_denison_mines_corp_undervalued_company_what/gr45hbv/,0.073,0.743,0.183,0.5983
34,DNN, I’ve been holding DNN for months. Glad to see it finally started to turn green these past few days.,UserNameImade,1,/r/pennystocks/comments/m5ya5k/dnn_denison_mines_corp_undervalued_company_what/gr46o70/,0.0,0.857,0.143,0.4588
35,DD," looks interesting, will do my own DD but great base from what you included.",BRlEN,1,/r/pennystocks/comments/m5ya5k/dnn_denison_mines_corp_undervalued_company_what/gr4gucz/,0.0,0.615,0.385,0.8176
36,BWXT, LEU and BWXT are two underrated uranium plays. Check em!,play_it_safe,1,/r/pennystocks/comments/m5ya5k/dnn_denison_mines_corp_undervalued_company_what/gr4pyb3/,0.0,0.797,0.203,0.3164
37,LEU, LEU and BWXT are two underrated uranium plays. Check em!,play_it_safe,1,/r/pennystocks/comments/m5ya5k/dnn_denison_mines_corp_undervalued_company_what/gr4pyb3/,0.0,0.797,0.203,0.3164
38,IMO," IMO Tomorrow may go down in history books..stimulus comes out and people of all ages are going to flood the market , cause more people to put money in... pandemic is about to be over, look at Texas and all the other states opening up, covid shots, cures, trust, govt.... Lets get this 💰",SoCalLove324,1,/r/pennystocks/comments/m5ya5k/dnn_denison_mines_corp_undervalued_company_what/gr5xni4/,0.0,0.939,0.061,0.5106
39,DD, Your so-called DD report is a copy and paste job of information released on March 4.,PusherRed88,1,/r/pennystocks/comments/m5ya5k/dnn_denison_mines_corp_undervalued_company_what/gr5y4co/,0.0,1.0,0.0,0.0
40,CCO," Does anyone realize that over the last two years, sasks largest uranium producer has closed two mines because their was no demand for uranium. Cameco has and is currently holding off mining as they have
an incredibly sized surplus and are jusy waiting for the market to raise. An 1000 employee camp is on maintenance and havent moned anything in years. I find it hard to believe that a small scale operation would even want to mine when there isnt really a need for this within the province. Just my thought.. My family has been involved in Cameco for close to 20 years. I realize CCO is not a penny stock but they have had a large control over the market for many many years",ZIGGY-T91,0,/r/pennystocks/comments/m5ya5k/dnn_denison_mines_corp_undervalued_company_what/gr46vnj/,0.034,0.957,0.01,-0.2263
41,URG, I bought URG at $1.04 hoping it was going to be a runner but has yet to take off.,Coonman28,3,/r/pennystocks/comments/m5ya5k/dnn_denison_mines_corp_undervalued_company_what/gr3tbh6/,0.0,0.894,0.106,0.2263
42,DD," So I saw an article somewhere with an interesting theory-- DNN is lying about their production capability because it's near impossible to achieve.

EDIT: Here you go: [https://archive.is/mL616](https://archive.is/mL616) . The big thing to note is that all this hype around them is 100% projection. They don't actually plan to start mining until 2024. So I don't know how you can do a 'certain' DD before they're even close. All of the hype is based on some executive's powerpoint presentation.",randompittuser,8,/r/pennystocks/comments/m5ya5k/dnn_denison_mines_corp_undervalued_company_what/gr45etv/,0.043,0.923,0.034,-0.1779
43,DNN," So I saw an article somewhere with an interesting theory-- DNN is lying about their production capability because it's near impossible to achieve.

EDIT: Here you go: [https://archive.is/mL616](https://archive.is/mL616) . The big thing to note is that all this hype around them is 100% projection. They don't actually plan to start mining until 2024. So I don't know how you can do a 'certain' DD before they're even close. All of the hype is based on some executive's powerpoint presentation.",randompittuser,8,/r/pennystocks/comments/m5ya5k/dnn_denison_mines_corp_undervalued_company_what/gr45etv/,0.043,0.923,0.034,-0.1779
44,DNN," DNN may take years to play out. I love it, I own it, and I add whenever I can. There are very few stocks I own and for the long term, but DNN is one of them.",goodbeer11,3,/r/pennystocks/comments/m5ya5k/dnn_denison_mines_corp_undervalued_company_what/gr45h9r/,0.0,0.875,0.125,0.5106
45,DNN," It’s a copy paste from the nei article on december 2020.


Additionally I don’t really buy this notion of nuclear energy down the road. 

>  According to the US Energy Information Agency, the average nuclear power generating cost is about $100 per megawatt-hour. Compare this with $50 per megawatt-hour for solar and $30 to $40 per megawatt-hour for onshore wind. The financial group Lazard recently said that renewable energy costs are now “at or below the marginal cost of conventional generation”—that is, fossil fuels—and much lower than nuclear.

Next, the bill proposed by the Wyoming senator actually isn’t that favorable to DNN because of the this

> “American uranium should fuel America’s nuclear reactors.

>“Wyoming is the leading uranium producer in the United States.",Cedosg,29,/r/pennystocks/comments/m5ya5k/dnn_denison_mines_corp_undervalued_company_what/gr3xqei/,0.017,0.888,0.095,0.8402
46,DD," What if these guys are just copy/pasting DD into here to build an account with history of upvoted DD, then sell the account to someone who wants to push stuff",HungJurror,8,/r/pennystocks/comments/m5ya5k/dnn_denison_mines_corp_undervalued_company_what/gr49xd5/,0.0,1.0,0.0,0.0
47,DD," It makes me bearish on the nuclear, I was just thinking, why would anyone do a DD on Uranium when it's obvious that it is going down in favor of the ""renewables"".

&#x200B;

I haven't heard any good news regarding nuclear power lately. I am pro nuclear power bc it's much more energy-dense and environmentally friendly.",stonkmasterz69,8,/r/pennystocks/comments/m5ya5k/dnn_denison_mines_corp_undervalued_company_what/gr3nqy1/,0.042,0.855,0.103,0.5414
48,UUUU, Have some into UUUU. What about you?,JoacoFerna24,4,/r/pennystocks/comments/m5ya5k/dnn_denison_mines_corp_undervalued_company_what/gr2xddz/,0.0,1.0,0.0,0.0
49,NXE," I bought NXE a couple days before they took a bad hit so I’m in the red with them, but they’ve consistently made positive profits since that hit (it went down alongside the rest of the market, nothing unusual about its fall)",notFidelCastro2019,7,/r/pennystocks/comments/m5ya5k/dnn_denison_mines_corp_undervalued_company_what/gr3cybw/,0.048,0.766,0.186,0.8176
50,URG," I’m in at 1.05 too on URG, seems to flow with competing uranium stocks",OrganicRelics,3,/r/pennystocks/comments/m5ya5k/dnn_denison_mines_corp_undervalued_company_what/gr4dfew/,0.0,1.0,0.0,0.0
51,DD," Great DD. I'm invested in both them and Energy Fuels.
Any argument for picking one or the other?",Interesting_Bird_874,2,/r/pennystocks/comments/m5ya5k/dnn_denison_mines_corp_undervalued_company_what/gr3sf3i/,0.105,0.633,0.262,0.5719
52,DNN, sure my friend...options are more complicated than what im about to say but a call option...like the ones i bought...give me the right but not the obligation to buy 100 shares per contract ( i have 15 contracts) of a stock at a predetermined and agreed upon price.  in my example that price is $2...the reason i would do this instead of buying the stock at $1.30?  i have control of 1500 shares in my example or $900 ish...1500 shares outright would be $1900...so i use the other $1000 to but something else and im still have alot of leverage with DNN.   However...please read any of the gazillions of info about options out there before you attempt to play with them...they are very complicated if you let them be...they have many more factors and they do not trade $1 for $1.   what i mean is that if dnn goes to $2.3 tommorow....i will not make the $1 per share that you all do if you own the stock...ill make in the avenue of 50-75%.  but like i said before...i have lowered my risk to $900 vs $1900 should the stock tank....oh last part ...did i mention to please google options to get the full story?  there is a time component to options in that they have an experition...which in my case is jan 22....hope this helps a little...not all stocks have options so its awesome to find pennies that do....i mean 1500 shares for $900 bucks with 9 months more to play...,Win_Existing,22,/r/pennystocks/comments/m5ya5k/dnn_denison_mines_corp_undervalued_company_what/gr358ju/,0.017,0.84,0.143,0.9868
53,DNN, UEC but now you got me interested in DNN. I’ll look into it Thanks 🙏🏽,djscuba1012,2,/r/pennystocks/comments/m5ya5k/dnn_denison_mines_corp_undervalued_company_what/gr2xm5q/,0.0,0.637,0.363,0.8126
54,UEC, UEC but now you got me interested in DNN. I’ll look into it Thanks 🙏🏽,djscuba1012,2,/r/pennystocks/comments/m5ya5k/dnn_denison_mines_corp_undervalued_company_what/gr2xm5q/,0.0,0.637,0.363,0.8126
55,TV," 84 actually 7 days a week 12 hours a day. If your question is. do I want to kill myself? Yes, absolutely I do.

To clarify, it's not as bad as it sounds. It's a cushy job. I sleep at work all the time. I sit around and trade stocks and watch TV all day. Also, I can convert my OT into regular PTO. So, if I work 80 hours, I can convert my 40 hours of OT into 40 hours of regular paid time off. Which means if I wanted to, I could work 2  80 hour weeks and take 2 weeks off every month.",Ed_Trucks_Head,1,/r/pennystocks/comments/m5ya5k/dnn_denison_mines_corp_undervalued_company_what/gr4anr7/,0.048,0.883,0.07,0.0387
56,NXE, Is it still sensible to get into buying NXE at $3.79,vouch4meplz,2,/r/pennystocks/comments/m5ya5k/dnn_denison_mines_corp_undervalued_company_what/gr3qewl/,0.0,1.0,0.0,0.0
57,NYC," I agree. We need to get a shitload of solar and wind for sure, but you can't power NYC with solar. We need either some kind of brilliant storage option, or consistent generation regardless of weather.",sovnade,3,/r/pennystocks/comments/m5ya5k/dnn_denison_mines_corp_undervalued_company_what/gr4i118/,0.0,0.792,0.208,0.7998
58,DNN," Right. I guess my thinking is that if you’re long on the company and have the money, buy shares now. Your option play that you plan on exercising is basically just reducing your risk on a bet that the stock would run well above $2 by expiry. 

So I guess if you have the cash and you’re confident DNN will be well over $2, buy shares now. If you’re not as sure or not liquid, buy options. Or, buy more contracts than you plan on exercising, exercise some, sell the rest for premium",sATLite,1,/r/pennystocks/comments/m5ya5k/dnn_denison_mines_corp_undervalued_company_what/gr4dpfd/,0.041,0.818,0.142,0.8457
