,ticker,comment,username,score,permalink,neg,neu,pos,compound
101,FSD," Get real dude.

9k USD for what’s essentially a fugazi is not “exorbitant?” There’s not even any certainty that Tesla will win the FSD race or that it is something that will be solved anytime soon. 

If you do some research you can also find that many consumer groups have been calling for FTC investigations into Tesla’s self driving comments and revenues over the years.",mcoclegendary,2,/r/stocks/comments/nf8jnv/california_dmv_investigates_teslas_selfdriving/gylf7dn/,0.025,0.889,0.086,0.6322
102,FSD," People here are claiming Tesla's FSD is an accident avoidance system, it's pretty fucking clear nobody here has actually sat in a Tesla and used autopilot at any point, nevermind the FSD beta

It isn't autonomous, but to say it's an accident avoidance system is just ignorant",The_EA_Nazi,2,/r/stocks/comments/nf8jnv/california_dmv_investigates_teslas_selfdriving/gyll0cx/,0.249,0.681,0.071,-0.8808
103,FSD," Like I said, I'm not gonna start a discussion based on emotions. What's the point?

> and revenues over the years.

Also this is not true. Tesla has a very extensive deferred revenue system for the FSD software to prevent exactly that. They have yet to recognize $1.6B of their total FSD sales.",Ehralur,1,/r/stocks/comments/nf8jnv/california_dmv_investigates_teslas_selfdriving/gym4w8q/,0.045,0.886,0.069,0.069
104,MT, MT is a major steel supplier for just about any industry that uses steel. I work for a Canadian steel corporation and a large amount of our steel comes from them,Danofireleg33,33,/r/stocks/comments/newz73/i_have_been_acquiring_joann_fabrics_stock_because/gyj0cur/,0.0,1.0,0.0,0.0
105,GRWG," GRWG 
They sell growing supplies",papipandulce,9,/r/stocks/comments/newz73/i_have_been_acquiring_joann_fabrics_stock_because/gyjcyye/,0.0,0.702,0.298,0.1779
106,HD," The Home Depot (HD) and Lowe's (LOW) literally sell shovels and picks, presumably some of which are bought by gold miners. In fact, HD even has its own house brand, Husky. Although these days most gold mining takes place with heavy equipment made by companies like Caterpillar (CAT). 

THIS IS NOT FINANCIAL ADVICE",TheDirtyDagger,102,/r/stocks/comments/newz73/i_have_been_acquiring_joann_fabrics_stock_because/gyixzid/,0.0,0.954,0.046,0.3612
107,AER," AER, SABR",MrDionWaiters,5,/r/stocks/comments/newz73/i_have_been_acquiring_joann_fabrics_stock_because/gyilj3z/,0.0,1.0,0.0,0.0
108,SABR," AER, SABR",MrDionWaiters,5,/r/stocks/comments/newz73/i_have_been_acquiring_joann_fabrics_stock_because/gyilj3z/,0.0,1.0,0.0,0.0
109,CVS," Just spitballing... 

People are going back to work and school more and more, but the pandemic is still here. Life and health insurance companies? How are they doing? I would figure they've already had a boom.

Grocery stores/pharmacies? CVS, Harris Teeter, etc. Local shopping places. Deliveries should be getting better and better as things resume normalcy.

Fast food places. People will be getting back out more casually.

Hollywood might be getting back into high(er) gear now, so if there are any public companies related to the film industry.",KungFuHamster,4,/r/stocks/comments/newz73/i_have_been_acquiring_joann_fabrics_stock_because/gyimdp6/,0.0,0.886,0.114,0.894
110,CRCT, CRCT. New IPO. Exact same rationale as for JOAN,play_it_safe,2,/r/stocks/comments/newz73/i_have_been_acquiring_joann_fabrics_stock_because/gyiq4ql/,0.0,1.0,0.0,0.0
111,JOAN, CRCT. New IPO. Exact same rationale as for JOAN,play_it_safe,2,/r/stocks/comments/newz73/i_have_been_acquiring_joann_fabrics_stock_because/gyiq4ql/,0.0,1.0,0.0,0.0
112,STX," This is not financial advice.

STX and WDC for hard drive demand for cryptocurrency mining for Chia. I wasn't around for NVDA's huge pump in 2017/18's mining boost but just look at the charts.",WTSurbanrivals,1,/r/stocks/comments/newz73/i_have_been_acquiring_joann_fabrics_stock_because/gyiuanz/,0.07,0.83,0.1,0.2617
113,WDC," This is not financial advice.

STX and WDC for hard drive demand for cryptocurrency mining for Chia. I wasn't around for NVDA's huge pump in 2017/18's mining boost but just look at the charts.",WTSurbanrivals,1,/r/stocks/comments/newz73/i_have_been_acquiring_joann_fabrics_stock_because/gyiuanz/,0.07,0.83,0.1,0.2617
114,TSN," The one that comes to mind is TSN. Tyson Chicken, cuz almost everyone is eating chicken no matter what’s goin on in the world.",thekingbun,1,/r/stocks/comments/newz73/i_have_been_acquiring_joann_fabrics_stock_because/gyjb0cu/,0.087,0.87,0.043,-0.2732
115,AMAT," Sartorius and TMO for biotech „shovels“
Asm int, ASML and AMAT for tech „shovels“
They are all doing really well",Visible-Coach,1,/r/stocks/comments/newz73/i_have_been_acquiring_joann_fabrics_stock_because/gyjsri1/,0.0,0.888,0.112,0.3384
116,ASML," Sartorius and TMO for biotech „shovels“
Asm int, ASML and AMAT for tech „shovels“
They are all doing really well",Visible-Coach,1,/r/stocks/comments/newz73/i_have_been_acquiring_joann_fabrics_stock_because/gyjsri1/,0.0,0.888,0.112,0.3384
117,TMO," Sartorius and TMO for biotech „shovels“
Asm int, ASML and AMAT for tech „shovels“
They are all doing really well",Visible-Coach,1,/r/stocks/comments/newz73/i_have_been_acquiring_joann_fabrics_stock_because/gyjsri1/,0.0,0.888,0.112,0.3384
118,ROL," ROL (Orkin)
Cicadas are coming...",w3lik3th3stock,1,/r/stocks/comments/newz73/i_have_been_acquiring_joann_fabrics_stock_because/gyk59tw/,0.0,1.0,0.0,0.0
119,BB, BB fits well in this category. Their software development platform is becoming the standard (or at least adopted by many major OEM)  in the IOT.  Revenue will follow this growing market.,Quebecer1,1,/r/stocks/comments/newz73/i_have_been_acquiring_joann_fabrics_stock_because/gykp5o8/,0.0,0.879,0.121,0.4543
120,FCX," FCX, largest publicly traded copper miner.",Manstrife,1,/r/stocks/comments/newz73/i_have_been_acquiring_joann_fabrics_stock_because/gyl8kdf/,0.0,1.0,0.0,0.0
121,NWL," I bet on NWL for the home project boom. It did quite well. No matter where you get your materials, craft rooms and workshops need an endless supply of shelves and plastic organizing bins. (Also, NWL owns Sharpie and Xacto.)",lilyfelix,1,/r/stocks/comments/newz73/i_have_been_acquiring_joann_fabrics_stock_because/gylaauq/,0.059,0.852,0.089,0.0717
122,LESL, LESL pool store that’s expanding rapidly and playing on the pool boom created by people getting stuck at home and realizing they need a pool. They make a ton of revenue off repairs and selling products plus they just jack up the prices hard when things like chlorine tablets are at a shortage. Bought them at IPO at $20 and continuing to accumulate on dips. Exact opposite of working hard with a pick and shovel though lol,StockNCryptoGodfathr,1,/r/stocks/comments/newz73/i_have_been_acquiring_joann_fabrics_stock_because/gylrkaa/,0.084,0.803,0.112,0.5106
123,JOAN," > I would love to get recommendations for any other stocks that you think fit in this category.


You won’t like this but none. 


> Like the Post says I have been steady acquiring Joann fabrics (JOAN) stocks because it is a pick and shovel stock. If you are unfamiliar with the topic, what that means is in a gold rush you don’t go digging for gold you sell the picks and shovels to dig gold. Tech stocks can be way overvalued, so instead of buying Etsy or EBay, one might buy JOAN because it sells to those who sell on those platforms. 



Yeah but people aren’t traveling 1000s of miles to buy yarn so they can knit socks and sell it on EBay. Most people sell used items on EBay anyway. 


Honestly I do not think this logic works in the stock market. It works at the local retail level or online retail level but not with stocks. Think back to where the term came from, the gold rush. People traveled thousands of miles to go mine gold and when they got to the west coast they had to buy equipment from the few people that sold them. Stuff was expensive in the west because stuff was scarce, and the people who came to the west had no other choice but to buy from the local shops in town. The pans they used cost them $8 or about $250 in today’s money. A pair of boots would go for $6 or about $185 today. Rice sold for $8 a pound or about $250 a pound today. As you can see the town shops in the west definitely had the upper hand back then. This being said, the cost of a pan didn’t go up in Virginia, it was only in the small mining towns. So it also takes into account regional aspects as well. 


TL;DR As a whole buying the latest trend almost never works out in the stock market as a long term strategy.",The_Texidian,1,/r/stocks/comments/newz73/i_have_been_acquiring_joann_fabrics_stock_because/gym3yau/,0.016,0.916,0.068,0.9512
124,XL, XL Fleet (XL). Makes electric power systems to be used on other cars and heavy duty trucks.,KaulantakBhairav,0,/r/stocks/comments/newz73/i_have_been_acquiring_joann_fabrics_stock_because/gyjzi8v/,0.0,1.0,0.0,0.0
125,KLIC," Check out KLIC a supplier for semiconductor makers. Not as well known as the bigger names, but they've been growing very well for the last 7 months. With little to no debt I see it riding the wave with all of the suppliers in the industry.",WoodpeckerAlarmed239,0,/r/stocks/comments/newz73/i_have_been_acquiring_joann_fabrics_stock_because/gyk2dce/,0.181,0.777,0.042,-0.7017
126,MT, Yeah Dofasco is rolling full steam ahead. It’s going to be a full year of pushing earnings highs for MT. The only problem is MT is a massive corporation there are sections in Europe (IT) who have not been doing as well regardless of the commodity price. We shall see what happens!,w3lik3th3stock,4,/r/stocks/comments/newz73/i_have_been_acquiring_joann_fabrics_stock_because/gyk5kc5/,0.05,0.866,0.085,0.2244
127,HD, Isn't HD and LOW more of a retailer one though? I would've thought that big mining and natural resources companies went through a wholesaler.,cruxianpal,0,/r/stocks/comments/newz73/i_have_been_acquiring_joann_fabrics_stock_because/gyjh2cx/,0.0,0.796,0.204,0.5936
128,LOW, Isn't HD and LOW more of a retailer one though? I would've thought that big mining and natural resources companies went through a wholesaler.,cruxianpal,0,/r/stocks/comments/newz73/i_have_been_acquiring_joann_fabrics_stock_because/gyjh2cx/,0.0,0.796,0.204,0.5936
129,ASML," I can second this, ASML is one of the single most important companies on earth rn and it barely gets any attention",picholasnicholas,3,/r/stocks/comments/newz73/i_have_been_acquiring_joann_fabrics_stock_because/gyk71ey/,0.0,0.905,0.095,0.2716
130,ASX," ASX too, they make semiconductor packaging (the black outer part you see on circuit boards) for 90% of the worlds electronics companies.",Longboarding-Is-Life,2,/r/stocks/comments/newz73/i_have_been_acquiring_joann_fabrics_stock_because/gyj9fhn/,0.0,1.0,0.0,0.0
131,AMKR, AMKR is another safe and kind of boring semi,wordofherb,1,/r/stocks/comments/newz73/i_have_been_acquiring_joann_fabrics_stock_because/gykv83r/,0.208,0.56,0.232,0.079
132,BWA, BWA as well,Longboarding-Is-Life,3,/r/stocks/comments/newz73/i_have_been_acquiring_joann_fabrics_stock_because/gyjaozk/,0.0,0.488,0.512,0.2732
133,MG," The don't use MG, but they most likely use products made by a company that Scott's owns. General Hydroponics is one of the most popular nutrient lines used by cannabis growers, owned by Scott's Miracle Grown.  Scott's is also the largest manufacturer of hydroponic farming equipment.",Jebbeard,1,/r/stocks/comments/newz73/i_have_been_acquiring_joann_fabrics_stock_because/gyllocq/,0.0,0.822,0.178,0.8844
134,SMG," If you look into their R&D and innovation arm, it looks very much like a company poised to supply the cannabis market once it starts booming.  SMG was my play years ago because I didn't want the risk of a direct marijuana play but still wanted to dip my toe in.  Still happy with the results so far.",Halleloumi,8,/r/stocks/comments/newz73/i_have_been_acquiring_joann_fabrics_stock_because/gyiz6oo/,0.018,0.744,0.238,0.8987
135,SMG," Your correct and wrong at the same time my guy. They are a pick and shovel , because they are a soil company and hydroponics company (subsidiaries) and as the marijuana industry grows , what are they going to be buying a f*ck ton of? Soil and hydroponics. articles on SMG are what gave me the concept of picks and shovel stocks.",koshermodels,5,/r/stocks/comments/newz73/i_have_been_acquiring_joann_fabrics_stock_because/gyiy1ng/,0.052,0.948,0.0,-0.4767
136,EVER," LOL.

I’m not sure I believe this logic- Of course, we all understand the need for storage has grown exponentially across all sectors of industry and society, but...

Cryptomining is math-, not storage-driven.  

Proof-of-work requires FLOPS, not bytes.

Proof-of-stake, likely the future of blockchain going forward, requires even less resources.

I have serious doubts blockchain could EVER be a notable driver of the storage market.

The ENTIRE BTC-coyne (spelled like that to avoid the dreaded automod) blockchain is currently only 1/3 of a Terrabyte. Uncompressed.  It’s a safe assumption lots of redditor’s porn collections outpace that by miles. 🤷🏽‍♂️",AlaskaPeteMeat,1,/r/stocks/comments/newz73/i_have_been_acquiring_joann_fabrics_stock_because/gyl2n3z/,0.132,0.786,0.083,-0.5103
137,MU," WDC is good if you want a more diversified play since they own SanDisk, one of the worlds largest SSD manufactures, while STX is almost all hard drives.MU is a good ssd play.",Longboarding-Is-Life,1,/r/stocks/comments/newz73/i_have_been_acquiring_joann_fabrics_stock_because/gyja34s/,0.029,0.648,0.323,0.8843
138,SSD," WDC is good if you want a more diversified play since they own SanDisk, one of the worlds largest SSD manufactures, while STX is almost all hard drives.MU is a good ssd play.",Longboarding-Is-Life,1,/r/stocks/comments/newz73/i_have_been_acquiring_joann_fabrics_stock_because/gyja34s/,0.029,0.648,0.323,0.8843
139,STX," WDC is good if you want a more diversified play since they own SanDisk, one of the worlds largest SSD manufactures, while STX is almost all hard drives.MU is a good ssd play.",Longboarding-Is-Life,1,/r/stocks/comments/newz73/i_have_been_acquiring_joann_fabrics_stock_because/gyja34s/,0.029,0.648,0.323,0.8843
140,WDC," WDC is good if you want a more diversified play since they own SanDisk, one of the worlds largest SSD manufactures, while STX is almost all hard drives.MU is a good ssd play.",Longboarding-Is-Life,1,/r/stocks/comments/newz73/i_have_been_acquiring_joann_fabrics_stock_because/gyja34s/,0.029,0.648,0.323,0.8843
141,MT," This is true, MT is a multinational company. Hopefully business here in North America offset what's happening elsewhere",Danofireleg33,2,/r/stocks/comments/newz73/i_have_been_acquiring_joann_fabrics_stock_because/gyl0dpn/,0.0,0.732,0.268,0.6705
142,HUGE, Scrapbooking is HUGE.,KungFuHamster,1,/r/stocks/comments/newz73/i_have_been_acquiring_joann_fabrics_stock_because/gyldx5v/,0.0,0.397,0.603,0.4648
143,PH," Also most cannabis nutrients are tailored for cannabis plants. They go through a two part cycle, a vegetative one first where the plant just grows, and a flowering stage where the buds are formed. Both stages have their own nutrient and light requirements, and most cannabis tailored nutrients tell you how much to put in for various life stages. 

You can totally grow cannabis plants on regular nutrients tho. You just run the risk of lower yeild, and in some cases messing up PH/nutrient requirements for your plants. Seeds are expensive so going that route is usually considered a waste.",PM_ME_CATS_420,1,/r/stocks/comments/newz73/i_have_been_acquiring_joann_fabrics_stock_because/gyldjye/,0.071,0.929,0.0,-0.7269
144,TD," Sure it is, I own 500 shares. It’s a pink sheet OTC stock, can be found on TD or Fidelity under CURLF. The hope is that they pass new banking regulations and they can uplist to the NASDAQ or NYSE soon.

https://mjstocktrader.com/cannabis-investor-portal/",gobias,2,/r/stocks/comments/newz73/i_have_been_acquiring_joann_fabrics_stock_because/gyk5vz2/,0.0,0.833,0.167,0.7506
145,GRWG, GRWG. The Home Depot of marijuana (and hydro farming in general).,NK4L,2,/r/stocks/comments/newz73/i_have_been_acquiring_joann_fabrics_stock_because/gyjd0rf/,0.0,1.0,0.0,0.0
146,ETSY," If you're getting shitty fabric, sure. Lots of craftspeople rely on Joann's and other fabric retailers because you can actually go feel the cloth before you buy it. ETSY thrives off this shit",TheSleepingNinja,1,/r/stocks/comments/newz73/i_have_been_acquiring_joann_fabrics_stock_because/gylxaoj/,0.196,0.747,0.057,-0.7615
147,SO," It’s crazy, it’s a mature company that is undervalued and is printing money out of the Etsy and Shopify explosion. I urge you to take a strong look at Joanns fabrics, because sure, while you may not use Joanns fabrics, your mother and SO who just bought something from a small artist / business online? Best believe the vendor who sold to them probably purchased their supplies from joanns",koshermodels,10,/r/stocks/comments/newz73/i_have_been_acquiring_joann_fabrics_stock_because/gyj294b/,0.032,0.797,0.17,0.8807
148,ASML," No. Semiconductor foundries (ASML's customers) have dedicated an absurd amount of money to chip capacity expansion in the near-to-mid-term.  TSMC is spending $100B over the next 3 years, Samsung I believe they said either $100B or $200B over the next decade, and Intel is building new fabs right now for $20B plus more investments are likely on the way. A substantial proportion of capacity expansion is spent on equipment (what ASML sells) because it's wildly expensive to get equipment that can fabricate leading-edge semiconductors. I believe one tool can cost $10M-$20M and that price goes up substantially with each new iteration of chips - look up Moore's Second Law. 

Another reason the stocks are priced like this is because semiconductor equipment is so fucking complicated that each market is dominated by one or two companies which usually combine for 90% market share, meaning hella pricing power. Also pro tip don't look at trailing PE of 50 but forward PE of 38 or so. Companies aren't valued based on what they did last year but what they're going to do in the future.",p_giggles,3,/r/stocks/comments/newz73/i_have_been_acquiring_joann_fabrics_stock_because/gykq23m/,0.028,0.935,0.037,-0.0912
149,HP," Yeah there was a whistle-blower that showed they catch fire when a high pitched note is played.

Still, HP ink is a scam...",Stacksmchenry,3,/r/stocks/comments/newz73/i_have_been_acquiring_joann_fabrics_stock_because/gyk6l8n/,0.1,0.708,0.192,0.296
150,SMG," I don't understand your comment on tobacco but again, SMG innovation and research arm has lots of products like lights and hydro.  It's not just a bunch of soil...  Although I'd still like the company even if it were, gardening is back in fashion.",Halleloumi,4,/r/stocks/comments/newz73/i_have_been_acquiring_joann_fabrics_stock_because/gyj1lbz/,0.0,0.798,0.202,0.872
151,DD," WMT is the company I keep telling myself I should invest in, and then I never do because I never have time to do the proper deep DD into them.

If anyone is going to be the #2 in being a general ""buy anything you want"" online website it's flat out probably going to be Walmart due to the major advantages they already have.",ShadowLiberal,1,/r/stocks/comments/nf9uhx/walmart_earnings_beat_estimates_as_retailer_sees/gylvzq1/,0.0,0.938,0.062,0.4215
152,WMT," WMT is the company I keep telling myself I should invest in, and then I never do because I never have time to do the proper deep DD into them.

If anyone is going to be the #2 in being a general ""buy anything you want"" online website it's flat out probably going to be Walmart due to the major advantages they already have.",ShadowLiberal,1,/r/stocks/comments/nf9uhx/walmart_earnings_beat_estimates_as_retailer_sees/gylvzq1/,0.0,0.938,0.062,0.4215
153,WMT," I've started to build a position in WMT for the future, I've only got 24 shares so far.",bernie638,7,/r/stocks/comments/nf9uhx/walmart_earnings_beat_estimates_as_retailer_sees/gykc50u/,0.0,0.879,0.121,0.296
154,USA," I hate that literally everything in the USA has a tipping feature.


So stupid.",mjr2015,8,/r/stocks/comments/nf9uhx/walmart_earnings_beat_estimates_as_retailer_sees/gyl83ut/,0.425,0.575,0.0,-0.8122
155,WMT," Not bad but,  that's about a third of what I want,  been buying a little with my paycheck contributions and now it's going to be more expensive,  while one of my full positions that I've had for over a decade (VOD) heads south so I lost more than I gain today and have to find good buying points for WMT.  No real complaints though,  I think it's still a good buy for the future if/when they become a bank also.   That's what I'm really waiting for (still a couple of years away) so I thought I had more time to leisurely buy more.",bernie638,2,/r/stocks/comments/nf9uhx/walmart_earnings_beat_estimates_as_retailer_sees/gykemtz/,0.094,0.758,0.147,0.6961
156,WM," and going over to WM store is ALWAYS much better than going to the Amazon, right?",Sometime44,1,/r/stocks/comments/nf9uhx/walmart_earnings_beat_estimates_as_retailer_sees/gylgv14/,0.0,0.753,0.247,0.5574
157,WM," I agree, but all companies do that--from WM and Amazon to the locally owned corner convenience store. They'd be crazy not to.",Sometime44,1,/r/stocks/comments/nf9uhx/walmart_earnings_beat_estimates_as_retailer_sees/gylilkc/,0.124,0.723,0.153,-0.0772
158,AAPL," I can say diversification has protected me against my ignorance. Or looked at another way, it has protected me against losing more than I could handle. Although it still cost me $36,000 to learn this lesson.

I think most retail investors should diversify. SPY is a type of diversification. To a lesser degree, even theme-based ETFs are a form of diversification. Granted, certain stocks, like MSFT or AMZN, are less prone to unrecoverable loss, but there is always a possibility. I'm just old enough to remember AAPL being worthless, so yah, no stock is immune to loss.

Additionally, even the smartest investors or traders diversify.",517UATION,15,/r/stocks/comments/neytcm/diversification_is_for_the_ignorant/gyj92um/,0.13,0.725,0.145,0.198
159,AMZN," I can say diversification has protected me against my ignorance. Or looked at another way, it has protected me against losing more than I could handle. Although it still cost me $36,000 to learn this lesson.

I think most retail investors should diversify. SPY is a type of diversification. To a lesser degree, even theme-based ETFs are a form of diversification. Granted, certain stocks, like MSFT or AMZN, are less prone to unrecoverable loss, but there is always a possibility. I'm just old enough to remember AAPL being worthless, so yah, no stock is immune to loss.

Additionally, even the smartest investors or traders diversify.",517UATION,15,/r/stocks/comments/neytcm/diversification_is_for_the_ignorant/gyj92um/,0.13,0.725,0.145,0.198
160,MSFT," I can say diversification has protected me against my ignorance. Or looked at another way, it has protected me against losing more than I could handle. Although it still cost me $36,000 to learn this lesson.

I think most retail investors should diversify. SPY is a type of diversification. To a lesser degree, even theme-based ETFs are a form of diversification. Granted, certain stocks, like MSFT or AMZN, are less prone to unrecoverable loss, but there is always a possibility. I'm just old enough to remember AAPL being worthless, so yah, no stock is immune to loss.

Additionally, even the smartest investors or traders diversify.",517UATION,15,/r/stocks/comments/neytcm/diversification_is_for_the_ignorant/gyj92um/,0.13,0.725,0.145,0.198
161,NCLH," If I diversified a month several industries and sectors right now, my balance wouldn’t go much of anywhere. At least not quickly. I may as well just throw it all into VTI and track the whole market because that’s the epitome of diversification. 

Instead I’m all in on UAL and NCLH because i figure when business and leisure travel kicks off again these will quickly resume their former trend line and I will double my net worth.",certifiedintelligent,3,/r/stocks/comments/neytcm/diversification_is_for_the_ignorant/gyjarqy/,0.0,0.946,0.054,0.4588
162,UAL," If I diversified a month several industries and sectors right now, my balance wouldn’t go much of anywhere. At least not quickly. I may as well just throw it all into VTI and track the whole market because that’s the epitome of diversification. 

Instead I’m all in on UAL and NCLH because i figure when business and leisure travel kicks off again these will quickly resume their former trend line and I will double my net worth.",certifiedintelligent,3,/r/stocks/comments/neytcm/diversification_is_for_the_ignorant/gyjarqy/,0.0,0.946,0.054,0.4588
163,DD," I think we all have seen our biggest wins with single picks that we understood and saw the value in. Buffet spends the time to understand a company fully and view the economic factors that will push it to new values. This takes a dedication that most of us don't do so we diversify to cover up for our lack of DD. I expect if we all stripped away the flash of a company and understood the values we would probably have a lot less companies in our portfolios and probably be further ahead but most of us make decisions much more on the fly and subsequently need to diversify. (I have 50% of my value in one stock, 30% between four others and 20% on pure gambles because they are fun. I have weeks of DD on the main stock and at most a couple days on the 4 in the second group. Most of the gambles are 2 hours or less on custodianship plays or touts from brokers.) Doesn't work for everyone but works for me...",ToastTurtle,1,/r/stocks/comments/neytcm/diversification_is_for_the_ignorant/gykupc9/,0.016,0.887,0.097,0.9274
