,ticker,comment,username,score,permalink,neg,neu,pos,compound
0,CTXR, Most of my stocks are red today except CTXR and DIS.,Leobk05,39,/r/pennystocks/comments/lptr3i/is_anyone_else_having_a_second_week_of_red_and/gocxdg1/,0.0,1.0,0.0,0.0
1,DIS, Most of my stocks are red today except CTXR and DIS.,Leobk05,39,/r/pennystocks/comments/lptr3i/is_anyone_else_having_a_second_week_of_red_and/gocxdg1/,0.0,1.0,0.0,0.0
2,CCIV, I should’ve cashed out on a lot of stuff 2 Mondays ago. Seeing red for the past 2 weeks. Only a few great plays are keeping me from going the titanic route. 1 CCIV call I bought back in early January is keeping me afloat,YebelTheRebel,16,/r/pennystocks/comments/lptr3i/is_anyone_else_having_a_second_week_of_red_and/god4vfz/,0.0,0.855,0.145,0.7269
3,TD, I just assumed I was paying TD Ameritrade's utility bills and then basically donating my money to companies,Memez-N-Gainz,6,/r/pennystocks/comments/lptr3i/is_anyone_else_having_a_second_week_of_red_and/godmc1y/,0.0,1.0,0.0,0.0
4,CLSN, Except my CLSN 🚊,Amilthelegend,3,/r/pennystocks/comments/lptr3i/is_anyone_else_having_a_second_week_of_red_and/godkbzv/,0.0,1.0,0.0,0.0
5,DD, Lose* not loose. Relax you’ll be fine just do your DD and don’t YOLO into shit stocks,YourUncleIroh,3,/r/pennystocks/comments/lptr3i/is_anyone_else_having_a_second_week_of_red_and/godfl81/,0.244,0.488,0.268,-0.1055
6,DD," I did my DD and got a RH low price stock and unfortunately didn't get to watch it because I was with my dad. At opening, it skyrocketed and I was up $600 when I was watching. Unfortunately then 11 am hit and the shorters and pump/dumpers all climbed on. I was actually planning on doing a day trade on it because of the DD but spending time with my dad is more important than the $600 swing. I left it now for the week and will hope I at least get a little out of it after it fell back to the starting point. C'est la Vie.",tommygunz007,2,/r/pennystocks/comments/lptr3i/is_anyone_else_having_a_second_week_of_red_and/godvf0a/,0.047,0.89,0.062,0.5483
7,RH," I did my DD and got a RH low price stock and unfortunately didn't get to watch it because I was with my dad. At opening, it skyrocketed and I was up $600 when I was watching. Unfortunately then 11 am hit and the shorters and pump/dumpers all climbed on. I was actually planning on doing a day trade on it because of the DD but spending time with my dad is more important than the $600 swing. I left it now for the week and will hope I at least get a little out of it after it fell back to the starting point. C'est la Vie.",tommygunz007,2,/r/pennystocks/comments/lptr3i/is_anyone_else_having_a_second_week_of_red_and/godvf0a/,0.047,0.89,0.062,0.5483
8,TNXP, Like 3rd week in a row for me. Most of my stop losses kicked in and now I'm only left with TNXP,CharredScallions,2,/r/pennystocks/comments/lptr3i/is_anyone_else_having_a_second_week_of_red_and/godiahq/,0.201,0.701,0.097,-0.3947
9,BB," I took profits on every position last week cuz I felt that we're due for a big ol red time, loaded up today on some blue caps, bought a bit of PULM and RIGL and logged out. No point in looking, this week's gonna be shit as well. Still holding those BB bags with honor tho.",wawrzuu,2,/r/pennystocks/comments/lptr3i/is_anyone_else_having_a_second_week_of_red_and/godcmjf/,0.095,0.77,0.134,0.34
10,PULM," I took profits on every position last week cuz I felt that we're due for a big ol red time, loaded up today on some blue caps, bought a bit of PULM and RIGL and logged out. No point in looking, this week's gonna be shit as well. Still holding those BB bags with honor tho.",wawrzuu,2,/r/pennystocks/comments/lptr3i/is_anyone_else_having_a_second_week_of_red_and/godcmjf/,0.095,0.77,0.134,0.34
11,RIGL," I took profits on every position last week cuz I felt that we're due for a big ol red time, loaded up today on some blue caps, bought a bit of PULM and RIGL and logged out. No point in looking, this week's gonna be shit as well. Still holding those BB bags with honor tho.",wawrzuu,2,/r/pennystocks/comments/lptr3i/is_anyone_else_having_a_second_week_of_red_and/godcmjf/,0.095,0.77,0.134,0.34
12,AGTC, I hear people talking about buying the dip on AGTC but I can’t find info on what any of the big investors are doing. Aside from this weeks announcements does anyone have more info on what’s to come for AGTC?,nomatophobia12,1,/r/pennystocks/comments/lptr3i/is_anyone_else_having_a_second_week_of_red_and/godxl95/,0.0,1.0,0.0,0.0
13,AMC, Mixed today.  AMC helped ease the pain.,rbershok,1,/r/pennystocks/comments/lptr3i/is_anyone_else_having_a_second_week_of_red_and/godxbke/,0.306,0.463,0.231,-0.2023
14,NGD," I do have a couple of red and a couple of green. Lol NGD, RYCEY are ok tnxp and syn they are trying their best",Stock_moon,1,/r/pennystocks/comments/lptr3i/is_anyone_else_having_a_second_week_of_red_and/godv32v/,0.0,0.674,0.326,0.8481
15,CSTR, Luckily LTNC and CSTR came through today. Kept me green.,pepesilvia_esq,1,/r/pennystocks/comments/lptr3i/is_anyone_else_having_a_second_week_of_red_and/godtyys/,0.0,0.732,0.268,0.5106
16,DD, CTRX is green and moving up! Do some DD and see!,JudgeApocalypse,1,/r/pennystocks/comments/lptr3i/is_anyone_else_having_a_second_week_of_red_and/godtbwn/,0.0,1.0,0.0,0.0
17,JPM, Made some cash on JPM  and F this morning.  other than that all is red yes all is red,I_Peel_Cats,1,/r/pennystocks/comments/lptr3i/is_anyone_else_having_a_second_week_of_red_and/godsfjw/,0.0,0.863,0.137,0.4019
18,MWK," Closed out of most of my pennies a couple weeks ago whilst they were still on a high to play it safe for a few weeks by going mostly into blue chips. 

Not even the blue chips are safe this last couple of weeks. 

Up on RR, Ford and MWK. Down on everything else. 

£1500 from my height 2 weeks ago wiped. 

Hoping the market is just getting the red out the way with and we'll see green throughout summer.",ahoneybadger3,1,/r/pennystocks/comments/lptr3i/is_anyone_else_having_a_second_week_of_red_and/godr8sb/,0.0,0.867,0.133,0.875
19,PLUG, PLUG is down 10% for me,beneneboi,1,/r/pennystocks/comments/lptr3i/is_anyone_else_having_a_second_week_of_red_and/godqz8g/,0.0,1.0,0.0,0.0
20,DOW," Correction week last week, then news today that the DOW was down last week drops it further down today. 

It'll bounce back itself but this is why weekly/monthlies are inherently risky.

I saw today that stimmy will be ready in about 3 weeks. If you don't have anything expiring before that I wouldn't stress it and just hold.

This is not financial advice I am a cat.",FinntheHue,1,/r/pennystocks/comments/lptr3i/is_anyone_else_having_a_second_week_of_red_and/godqg6t/,0.033,0.875,0.093,0.6184
21,AMC, AMC is the only green i have seen in 2 weeks...,fupacabra420,1,/r/pennystocks/comments/lptr3i/is_anyone_else_having_a_second_week_of_red_and/godnfkz/,0.0,1.0,0.0,0.0
22,SP, Nasdaq and SP are down for the second week . The stimulus checks are supposedly causing inflation .,Begininandwinnin,1,/r/pennystocks/comments/lptr3i/is_anyone_else_having_a_second_week_of_red_and/godn617/,0.0,1.0,0.0,0.0
23,AMC, Well.. at least my AMC and Gee Emm Ee is green.,chrispy_bacon,1,/r/pennystocks/comments/lptr3i/is_anyone_else_having_a_second_week_of_red_and/godmmng/,0.0,1.0,0.0,0.0
24,NVDA, Yes. Even my stock that isn't penny stock is red today like NVDA.,Unicornsarefluffyyy,1,/r/pennystocks/comments/lptr3i/is_anyone_else_having_a_second_week_of_red_and/godlvg5/,0.0,0.679,0.321,0.6369
25,CTXR, Some red some green. Did great on CTXR actually. And overall more green than red.,Fart_Huffer_,1,/r/pennystocks/comments/lptr3i/is_anyone_else_having_a_second_week_of_red_and/godlfca/,0.0,0.773,0.227,0.6249
26,ASRT, Yeah i feel this. Only things that are green right now are MRS and ASRT,Undeadzombiedog,1,/r/pennystocks/comments/lptr3i/is_anyone_else_having_a_second_week_of_red_and/godkgc2/,0.0,0.855,0.145,0.296
27,AUY, CTXR has exploding DNN had a lil bounce back today AUY is up it's not all bad in my.portfolio,nincoblanco,1,/r/pennystocks/comments/lptr3i/is_anyone_else_having_a_second_week_of_red_and/godkdis/,0.0,0.856,0.144,0.431
28,CTXR, CTXR has exploding DNN had a lil bounce back today AUY is up it's not all bad in my.portfolio,nincoblanco,1,/r/pennystocks/comments/lptr3i/is_anyone_else_having_a_second_week_of_red_and/godkdis/,0.0,0.856,0.144,0.431
29,DNN, CTXR has exploding DNN had a lil bounce back today AUY is up it's not all bad in my.portfolio,nincoblanco,1,/r/pennystocks/comments/lptr3i/is_anyone_else_having_a_second_week_of_red_and/godkdis/,0.0,0.856,0.144,0.431
30,CTXR, My apologies I only speak CTXR.,turnip-taker,1,/r/pennystocks/comments/lptr3i/is_anyone_else_having_a_second_week_of_red_and/godj4z3/,0.0,1.0,0.0,0.0
31,DD," What are you guys talking about? 

CBDT - empower clinics is on fire today -

Kwe micro systems is up today

LITT - Roadman investments is up today -

what are you guys buying? and these area still great buys... do better DD everyone",True_Warning_7073,1,/r/pennystocks/comments/lptr3i/is_anyone_else_having_a_second_week_of_red_and/godis59/,0.051,0.791,0.157,0.7149
32,ZKIN, Nonstop bleeding. ZKIN and PVDG are the one green spots in a sea of red.,Excited4MB,1,/r/pennystocks/comments/lptr3i/is_anyone_else_having_a_second_week_of_red_and/godhzlh/,0.0,1.0,0.0,0.0
33,DD, If you’re constantly seeing red it’s because your using someone else’s DD as your own. Do your own critical research and follow your gut. This sub and all other investments subs are filled with fantastically researched terrible advice.,CoupleComplete9545,1,/r/pennystocks/comments/lptr3i/is_anyone_else_having_a_second_week_of_red_and/godhti5/,0.13,0.87,0.0,-0.6597
34,JAGX, The only opportunity I see right now is JAGX 3mo bullflag just waiting on bulls,Sean-H-,1,/r/pennystocks/comments/lptr3i/is_anyone_else_having_a_second_week_of_red_and/godhqua/,0.0,0.823,0.177,0.4215
35,DIS," A lot of red, but things like DIS, F, RCL and GPS up nicely for me today. Still down overall, though.  And in the penny stock arena ... what's up with USRM ... really jumped today!",EastPennHawk,1,/r/pennystocks/comments/lptr3i/is_anyone_else_having_a_second_week_of_red_and/godhq8f/,0.0,0.817,0.183,0.8122
36,GPS," A lot of red, but things like DIS, F, RCL and GPS up nicely for me today. Still down overall, though.  And in the penny stock arena ... what's up with USRM ... really jumped today!",EastPennHawk,1,/r/pennystocks/comments/lptr3i/is_anyone_else_having_a_second_week_of_red_and/godhq8f/,0.0,0.817,0.183,0.8122
37,RCL," A lot of red, but things like DIS, F, RCL and GPS up nicely for me today. Still down overall, though.  And in the penny stock arena ... what's up with USRM ... really jumped today!",EastPennHawk,1,/r/pennystocks/comments/lptr3i/is_anyone_else_having_a_second_week_of_red_and/godhq8f/,0.0,0.817,0.183,0.8122
38,DD," Trust in your DD. Im down on 7 positions, and green on 8 right now. Make sure you keep your pennies diversified. Im in cannabis, tech, cyber security, pharmaceutical. It's a waiting game to win. People are Dumping right now. Give it time",arthurkthnx,1,/r/pennystocks/comments/lptr3i/is_anyone_else_having_a_second_week_of_red_and/godhnjf/,0.047,0.713,0.24,0.8591
39,DNN," Stop limit sell hit on SEEL, LKCO, SNGX, DNN, and a few others I'm afraid to admit I bought in the first place.

Has not been a good month for me. All I've been doing is watching my PLTR turn red and green back and forth, and watching my HITI drop, and drop (while buying more HITI)


LKCO is the only one I made any profits on so far this month.",MutaKingPrime,1,/r/pennystocks/comments/lptr3i/is_anyone_else_having_a_second_week_of_red_and/godhjk4/,0.118,0.819,0.063,-0.4777
40,LKCO," Stop limit sell hit on SEEL, LKCO, SNGX, DNN, and a few others I'm afraid to admit I bought in the first place.

Has not been a good month for me. All I've been doing is watching my PLTR turn red and green back and forth, and watching my HITI drop, and drop (while buying more HITI)


LKCO is the only one I made any profits on so far this month.",MutaKingPrime,1,/r/pennystocks/comments/lptr3i/is_anyone_else_having_a_second_week_of_red_and/godhjk4/,0.118,0.819,0.063,-0.4777
41,PLTR," Stop limit sell hit on SEEL, LKCO, SNGX, DNN, and a few others I'm afraid to admit I bought in the first place.

Has not been a good month for me. All I've been doing is watching my PLTR turn red and green back and forth, and watching my HITI drop, and drop (while buying more HITI)


LKCO is the only one I made any profits on so far this month.",MutaKingPrime,1,/r/pennystocks/comments/lptr3i/is_anyone_else_having_a_second_week_of_red_and/godhjk4/,0.118,0.819,0.063,-0.4777
42,SEEL," Stop limit sell hit on SEEL, LKCO, SNGX, DNN, and a few others I'm afraid to admit I bought in the first place.

Has not been a good month for me. All I've been doing is watching my PLTR turn red and green back and forth, and watching my HITI drop, and drop (while buying more HITI)


LKCO is the only one I made any profits on so far this month.",MutaKingPrime,1,/r/pennystocks/comments/lptr3i/is_anyone_else_having_a_second_week_of_red_and/godhjk4/,0.118,0.819,0.063,-0.4777
43,SNGX," Stop limit sell hit on SEEL, LKCO, SNGX, DNN, and a few others I'm afraid to admit I bought in the first place.

Has not been a good month for me. All I've been doing is watching my PLTR turn red and green back and forth, and watching my HITI drop, and drop (while buying more HITI)


LKCO is the only one I made any profits on so far this month.",MutaKingPrime,1,/r/pennystocks/comments/lptr3i/is_anyone_else_having_a_second_week_of_red_and/godhjk4/,0.118,0.819,0.063,-0.4777
44,CCIV," Me too. CCIV has been going well, SQ was in the green for a minute, but everything else is taking a nose dive.",cwj25,1,/r/pennystocks/comments/lptr3i/is_anyone_else_having_a_second_week_of_red_and/godhaxn/,0.0,0.928,0.072,0.1406
45,SQ," Me too. CCIV has been going well, SQ was in the green for a minute, but everything else is taking a nose dive.",cwj25,1,/r/pennystocks/comments/lptr3i/is_anyone_else_having_a_second_week_of_red_and/godhaxn/,0.0,0.928,0.072,0.1406
46,DD," Been in the red for three weeks DD -8%, today, first time in the green. I aim to sleep well tonight",PiratesOfTheArctic,1,/r/pennystocks/comments/lptr3i/is_anyone_else_having_a_second_week_of_red_and/godh729/,0.0,0.9,0.1,0.2732
47,DD, I decided to hold everything that isn't up 30% or I haven't recouped my original investment on. Waiting it out for now. Hope y'alls DD was good lol.,JustMy2Centences,1,/r/pennystocks/comments/lptr3i/is_anyone_else_having_a_second_week_of_red_and/godljft/,0.06,0.676,0.264,0.7676
48,CCIV, CCIV single handedly saved my portefolio,fmmt97,4,/r/pennystocks/comments/lptr3i/is_anyone_else_having_a_second_week_of_red_and/godky2u/,0.0,0.641,0.359,0.4215
49,CTXR," This morning, I invested $2200 into CTXR and $350 into AABB. I still like CTXR and it has great upside, which is why I bought it, but it peaked at 2.9 earlier in the day and is now down at $2.45. If I sold AABB now, I'd have a gain of $265.

I wish I had inversed the transactions, putting $2200 into AABB. They said $0.6 target price end of week, they didn't tell me it would be end of day!!",PsycheRevived,3,/r/pennystocks/comments/lptr3i/is_anyone_else_having_a_second_week_of_red_and/godageb/,0.0,0.843,0.157,0.9191
50,CTXR, CTXR been treating me good I bought more at 2.5.,azurix,6,/r/pennystocks/comments/lptr3i/is_anyone_else_having_a_second_week_of_red_and/godi9ir/,0.0,0.734,0.266,0.4404
51,CTXR, I hope CTXR gives us good news soon regarding their trials,xeneize93,7,/r/pennystocks/comments/lptr3i/is_anyone_else_having_a_second_week_of_red_and/goda3cl/,0.0,0.58,0.42,0.7003
52,CTXR, Kicking myself for not taking a larger position in CTXR earlier. Threw pocket change at it. Seems to be stabilizing now. I would take profits at 25%+ myself if I had a larger position.,Tacoman404,6,/r/pennystocks/comments/lptr3i/is_anyone_else_having_a_second_week_of_red_and/godf60w/,0.0,0.909,0.091,0.4404
53,CTXR," I didn't even notice the sea of red until now, because I'm mostly invested in CTXR, AABB and TRCH. I feel better about CTXR and TRCH giving back some profits after seeing what other stocks are doing today!",PsycheRevived,7,/r/pennystocks/comments/lptr3i/is_anyone_else_having_a_second_week_of_red_and/godanj8/,0.0,0.795,0.205,0.8172
54,TRCH," I didn't even notice the sea of red until now, because I'm mostly invested in CTXR, AABB and TRCH. I feel better about CTXR and TRCH giving back some profits after seeing what other stocks are doing today!",PsycheRevived,7,/r/pennystocks/comments/lptr3i/is_anyone_else_having_a_second_week_of_red_and/godanj8/,0.0,0.795,0.205,0.8172
55,CTXR, Unless you bought into CTXR @ 2.60 like me lol,ShortTermLongForm,1,/r/pennystocks/comments/lptr3i/is_anyone_else_having_a_second_week_of_red_and/godmwxq/,0.0,0.569,0.431,0.6486
56,CLSN, Summer CLSN and POWW calls keeping me sane today,Cobek,2,/r/pennystocks/comments/lptr3i/is_anyone_else_having_a_second_week_of_red_and/godxvei/,0.0,1.0,0.0,0.0
57,POWW, Summer CLSN and POWW calls keeping me sane today,Cobek,2,/r/pennystocks/comments/lptr3i/is_anyone_else_having_a_second_week_of_red_and/godxvei/,0.0,1.0,0.0,0.0
58,CCJ," Except the one I picked.
CCJ",AruiMD,1,/r/pennystocks/comments/lptr3i/is_anyone_else_having_a_second_week_of_red_and/godqngu/,0.0,1.0,0.0,0.0
59,DD," Same...at least slowly losing my ass is .2% here and .5% there...I mean I did have a couple days over the last few weeks that were -5%...I've cut ties with some of the P&D's I fell for, couple stocks I was profit drunk on and bought for god knows what reason with minimal DD and realized profit on a couple that were too good to pass up since then...So...hopefully that'll be the last of my -5% days..",Upper-Director-38,10,/r/pennystocks/comments/lptr3i/is_anyone_else_having_a_second_week_of_red_and/godellc/,0.124,0.749,0.126,0.0516
60,CTXR," I didn't get in on CTXR, but GMEV is saving me right now",AtomicKittenz,2,/r/pennystocks/comments/lptr3i/is_anyone_else_having_a_second_week_of_red_and/godccvo/,0.0,1.0,0.0,0.0
61,ASRT, I liquidated my crappier positions and bought another 800 ASRT and sold CC on all of them when the premiums were .30 for $3 in April.,doodsgamer,1,/r/pennystocks/comments/lptr3i/is_anyone_else_having_a_second_week_of_red_and/goduxt9/,0.0,1.0,0.0,0.0
62,CC, I liquidated my crappier positions and bought another 800 ASRT and sold CC on all of them when the premiums were .30 for $3 in April.,doodsgamer,1,/r/pennystocks/comments/lptr3i/is_anyone_else_having_a_second_week_of_red_and/goduxt9/,0.0,1.0,0.0,0.0
63,SP," You lose when you are holding stinkers too. You need to get into a mindset where you take opportunity cost into account. Your money needs to work for you. Don't keep it trapped in bad situations. 

If there's no catalyst on the horizon, get out. Don't wait on some miracle out of the blue to push the SP back up in a penny stock.",steveissuperman,9,/r/pennystocks/comments/lptr3i/is_anyone_else_having_a_second_week_of_red_and/godier2/,0.141,0.734,0.125,-0.0577
64,NIO," It's like a neverending dip.

I've already bought like 3 dips of NIO and it's still dippin ![gif](emote|free_emotes_pack|flip_out)",Crowleyer,8,/r/pennystocks/comments/lptr3i/is_anyone_else_having_a_second_week_of_red_and/godu89t/,0.0,0.726,0.274,0.6476
65,CRTX, Same. Bought more CRTX when it dropped a bit and then it dropped another 20 cents lol,shifty_peanut,1,/r/pennystocks/comments/lptr3i/is_anyone_else_having_a_second_week_of_red_and/godudoh/,0.0,0.843,0.157,0.4215
66,FICO," Spending power= magin+cash


Works kinda like a FICO score... if they can keep you on a slow bleed, theyll give you a lil more rope, so you can hang yourself tighter",Trey-wmLA,1,/r/pennystocks/comments/lptr3i/is_anyone_else_having_a_second_week_of_red_and/godtlxd/,0.0,0.924,0.076,0.2975
67,BNGO," I'm sure the people who sold at $2 thought BNGO had already spiked. But sometimes the ""spike"" is merely a bump before the real spike.",Cobek,1,/r/pennystocks/comments/lptr3i/is_anyone_else_having_a_second_week_of_red_and/godxa4l/,0.0,0.909,0.091,0.3182
68,AAL," AAL, play, crsr, ccl, nclh,",carlpanda,1,/r/pennystocks/comments/lptr3i/is_anyone_else_having_a_second_week_of_red_and/godvl3g/,0.0,0.625,0.375,0.34
69,UK," Its even better when you're trading in the UK and get to trade at 16:30 rather than 8:30. 

Finish work at 16:00 just so I can sit down and get ready for the market madness.",OffensiveBranflakes,15,/r/pennystocks/comments/lpe00g/ever_since_i_started_trading_sunday_scaries_are/gobra8c/,0.074,0.789,0.137,0.3612
70,DD, bruh. I DD all weekend and spring out of bed early on Monday mornings now with actual excitement. It's not right. lol,ipreen4satan,2,/r/pennystocks/comments/lpe00g/ever_since_i_started_trading_sunday_scaries_are/gocgpg8/,0.095,0.774,0.13,0.2187
71,DD,"   

[https://www.brewbilt.com/](https://www.brewbilt.com/) 

let me know what you think after you do the DD",Unforeseen_2021,0,/r/pennystocks/comments/lpe00g/ever_since_i_started_trading_sunday_scaries_are/gocan5z/,0.0,1.0,0.0,0.0
72,FB," Firstly, I hate this stonk and I think it is worthless. However, this text is not him telling you to pump the stock. That is like saying when Mark Zuckerberg requests to go on CNBC they CNBC is pumping FB for him. Why wouldn't they try to get coverage?",Potential-Guide-9562,195,/r/pennystocks/comments/lp7hzy/can_we_stop_with_the_innd_posts_its_literally_a/go9xl4u/,0.124,0.829,0.047,-0.6249
73,CEO," I saw another post where they literally told potential investors on a tweet (asking for info on 'new' retailers)  ""we cant tell you. Its business 101"". Their CEO is a maggot already got in trouble for securities fraud. Id rather put my money in GAYMF",evanarc,62,/r/pennystocks/comments/lp7hzy/can_we_stop_with_the_innd_posts_its_literally_a/go9tenq/,0.136,0.818,0.046,-0.6486
74,DD," I bought in and sold for a small profit after doing some more DD I found out that the company is actually some sort of marketing firm, or rebranded from one. How do you go from marketing to developing hearing aids? The way they speak on social media sounds like a teenager runs their PR. I actually came on here to post my DD and found out someone an hour earlier did the same lol. Glad I sold my stock.",MasterPip,8,/r/pennystocks/comments/lp7hzy/can_we_stop_with_the_innd_posts_its_literally_a/go9xcfw/,0.0,0.862,0.138,0.8807
75,CEO," I love how people are digging up pictures from 2 years ago and when the CEO has already acknowledged the major mistakes they made back then. 

But in saying that I do agree people should just stop posting about this stock in general and let it do it’s thing either way.",0oopsss,3,/r/pennystocks/comments/lp7hzy/can_we_stop_with_the_innd_posts_its_literally_a/goc2r5g/,0.085,0.794,0.121,0.4588
76,DD, How can you tell if a DD is just a PnD?,drewkiino,2,/r/pennystocks/comments/lp7hzy/can_we_stop_with_the_innd_posts_its_literally_a/goav6h2/,0.0,1.0,0.0,0.0
77,DD," The number of times on here that I have followed a link in a ""DD"" for it to not only say nothing related to what the poster said if not outright contradict them is hilarious.  Do your own DD, its really easy; check their leadership's Linkedin profiles; do they mention this company at all? Where does it say they work currently? Do they have profiles? Where have they worked? 3 scam shell companies that got shutdown prior to this?

 Hmmm. Do they have a website? Does that website look like a dream board for a marketer; Covered in Buzzwords with weird unrelated ""high advertisement"" crap everywhere? If its an actually functioning website pretend you are the target market, they claim to sell software for medical companies? Can you quickly find a demo, an example, a description of why it's better than the competition, or at the very least a real contact number/email for their salesperson? 

Just those two things alone that are applicable to, I would say 60-70% of the companies posted on here would eliminate a huge chunk of pump and dump stocks posted.",LionOfWinter,1,/r/pennystocks/comments/lp7hzy/can_we_stop_with_the_innd_posts_its_literally_a/goc25un/,0.073,0.825,0.103,0.7018
78,CEO," I'm going to let you guys in on a little secret. This at the end of the day was a good money making stock . . . it was just a terrible stock -shrug-.   


Here's where you messed up: You believed a CEO who was hyping you as hard as possible to reach a set target -cough- .10 cents -cough- You ever wonder why a CEO would try so hard to pump you guys to a VERY SPECIFIC price range?  Can you guess what happened the literal second you hit roughly 10 cents? Dilution and crash.  As long as you played the game and got out around 7-8 cents you were going to be fine. They wanted you to hit 10 cents.   


If this stock does hit 1 dollar in may . . . that's cool, I guess. However, this CEO's entire family has been attached to fraud, and the level of dilution he just did does not justify his company's current status.   Hell, they're not even a current company from my understanding.   


I wanted to believe in this company because of my deaf cousin. The second I watched his video, and also how hard he was pumping and winky facing for .10 cents . . . it made me exit. I made very pretty penny, so it was a good short time play. However, you guys REALLY need to look at CEO behavior. This guy definitely deserves prison, but I digress.  If you make money long term, that's great . . . but  I seriously doubt this is the guy to do it.",Emilie_Cauchemar,1,/r/pennystocks/comments/lp7hzy/can_we_stop_with_the_innd_posts_its_literally_a/gocnbo7/,0.083,0.834,0.082,0.3306
