,ticker,comment,username,score,permalink,neg,neu,pos,compound
0,CCIV, Could have bought CCIV at $60 and finished the job.,iamadrunk_scumbag,2,/r/RobinHoodPennyStocks/comments/lyvbtq/thought_you_people_might_like_this_rarely_do_i/gpwlyxs/,0.0,1.0,0.0,0.0
1,DD, That’s a very achievable goal with good DD and a little luck! Hopefully you smash way past that goal!,panicatthed,33,/r/RobinHoodPennyStocks/comments/lync84/know_your_goals_weekly_update_1/gptqbgc/,0.0,0.537,0.463,0.8808
2,CC, Im investing for the same reason. Though I haven't taken any educational loans because I go to a CC. But I know once I transfer to Michigan its gonna be expensive.,DoneDeal-_-,4,/r/RobinHoodPennyStocks/comments/lync84/know_your_goals_weekly_update_1/gpu0etl/,0.0,1.0,0.0,0.0
3,DD," I remember so well the feeling of being debt free. Took me 3 years after graduating, had a full time job and was doing uber at nights. wasn't trading back then.
 Wish I was, but then not sure if I would have been successful.

Now I'm aiming to be debt free again, this time it's my mortgage. I have a good spread of stocks in my portfolio, I'm sure I'll be able to pay off my mortgage this year, all $300k of it.

Just got very lucky with finding a gem of a stock. Search for empower clinics, I've been in since last year. The company has a lot of potential, great and transparent, do you DD, they have a subreddit as well.",hawkheat,1,/r/RobinHoodPennyStocks/comments/lync84/know_your_goals_weekly_update_1/gq0mc1l/,0.081,0.683,0.236,0.9749
4,ASRT, I've been trading for about 6 weeks now. I've had numerous positions but I have a large position with ZOM and ASRT right now.,reeeidiculous,1,/r/RobinHoodPennyStocks/comments/lync84/know_your_goals_weekly_update_1/gpw3qlc/,0.0,1.0,0.0,0.0
5,ZOM, I've been trading for about 6 weeks now. I've had numerous positions but I have a large position with ZOM and ASRT right now.,reeeidiculous,1,/r/RobinHoodPennyStocks/comments/lync84/know_your_goals_weekly_update_1/gpw3qlc/,0.0,1.0,0.0,0.0
6,RH," I have hundreds in buying power that settled from trades this Tuesday that is already available to transfer to my bank account. What are you saying? RH is gonna limit trades on fucking penny stocks? You're literally in a RH sub, how about you get the fuck out.",reeeidiculous,3,/r/RobinHoodPennyStocks/comments/lync84/know_your_goals_weekly_update_1/gpw425v/,0.079,0.921,0.0,-0.594
7,AGTC, no kidding. if AGTC jumps maybe that will get me closer on the way to achieving that,drpooiscute,3,/r/RobinHoodPennyStocks/comments/lync84/know_your_goals_weekly_update_1/gpv6xdb/,0.118,0.806,0.075,-0.2023
8,AGTC," Nice, this should bring some volume and hopefully some sustainable gains. Honestly I’m a bit surprised and very happy that AGTC managed to maintain support around $5 during the past couple weeks.",OneSaltyBanana,15,/r/RobinHoodPennyStocks/comments/lyrjev/since_agtc_is_below_5_again_thought_id_share_this/gpunm5i/,0.0,0.552,0.448,0.9552
9,AGTC, I bought April 16th calls on Wednesday. I’m just hoping AGTC has some form of recovery this month.,CreakingOfARustyGate,5,/r/RobinHoodPennyStocks/comments/lyrjev/since_agtc_is_below_5_again_thought_id_share_this/gpunmtc/,0.0,0.851,0.149,0.4215
10,PM," I will be messaging you in 2 days on [**2021-03-08 03:26:24 UTC**](http://www.wolframalpha.com/input/?i=2021-03-08%2003:26:24%20UTC%20To%20Local%20Time) to remind you of [**this link**](https://np.reddit.com/r/RobinHoodPennyStocks/comments/lyrjev/since_agtc_is_below_5_again_thought_id_share_this/gpux6lf/?context=3)

[**CLICK THIS LINK**](https://np.reddit.com/message/compose/?to=RemindMeBot&subject=Reminder&message=%5Bhttps%3A%2F%2Fwww.reddit.com%2Fr%2FRobinHoodPennyStocks%2Fcomments%2Flyrjev%2Fsince_agtc_is_below_5_again_thought_id_share_this%2Fgpux6lf%2F%5D%0A%0ARemindMe%21%202021-03-08%2003%3A26%3A24%20UTC) to send a PM to also be reminded and to reduce spam.

^(Parent commenter can ) [^(delete this message to hide from others.)](https://np.reddit.com/message/compose/?to=RemindMeBot&subject=Delete%20Comment&message=Delete%21%20lyrjev)

*****

|[^(Info)](https://np.reddit.com/r/RemindMeBot/comments/e1bko7/remindmebot_info_v21/)|[^(Custom)](https://np.reddit.com/message/compose/?to=RemindMeBot&subject=Reminder&message=%5BLink%20or%20message%20inside%20square%20brackets%5D%0A%0ARemindMe%21%20Time%20period%20here)|[^(Your Reminders)](https://np.reddit.com/message/compose/?to=RemindMeBot&subject=List%20Of%20Reminders&message=MyReminders%21)|[^(Feedback)](https://np.reddit.com/message/compose/?to=Watchful1&subject=RemindMeBot%20Feedback)|
|-|-|-|-|",RemindMeBot,1,/r/RobinHoodPennyStocks/comments/lyrjev/since_agtc_is_below_5_again_thought_id_share_this/gpux9gu/,0.109,0.891,0.0,-0.6322
11,CTXR," Invested around $6ish, then broke even and got out. 100% on CTXR so I won there.",tt001222,-7,/r/RobinHoodPennyStocks/comments/lyrjev/since_agtc_is_below_5_again_thought_id_share_this/gpv5v7v/,0.136,0.633,0.231,0.4481
12,EYES, What the hell is EYES,Icm99,2,/r/RobinHoodPennyStocks/comments/lyozjy/made_a_51_profit_today/gpxvr3b/,0.535,0.465,0.0,-0.6808
13,EYES, It did for me. I wasn’t able to sell EYES and now I have to hold it over the weekend. And I really don’t see it running again. Fuck me.,OneSaltyBanana,3,/r/RobinHoodPennyStocks/comments/lyozjy/made_a_51_profit_today/gpu170j/,0.119,0.881,0.0,-0.5423
14,EYES, EYES,gordon_gekko1976,1,/r/RobinHoodPennyStocks/comments/lyozjy/made_a_51_profit_today/gptylqh/,0.0,1.0,0.0,0.0
15,PDT, Same lol even tho it’s showing two day trades for me it still gave me the PDT warning ffs had to watch it all burn,warriorsfor2021,2,/r/RobinHoodPennyStocks/comments/lyozjy/made_a_51_profit_today/gpujbrv/,0.2,0.71,0.09,-0.5267
16,AGTC," AGTC will be there, also SENS .",NeitherMedicine4327,14,/r/RobinHoodPennyStocks/comments/lyu9ob/citius_pharmaceuticals_to_feature_product/gpvc0d3/,0.0,1.0,0.0,0.0
17,SENS," AGTC will be there, also SENS .",NeitherMedicine4327,14,/r/RobinHoodPennyStocks/comments/lyu9ob/citius_pharmaceuticals_to_feature_product/gpvc0d3/,0.0,1.0,0.0,0.0
18,CTXR," If it stays under 2 in about a week (will have the $)  im putting all i can comfortably afford into CTXR,  currently sitting on 500 with a mediocre position of 1.90.",King_Brodi,2,/r/RobinHoodPennyStocks/comments/lyu9ob/citius_pharmaceuticals_to_feature_product/gpyydpo/,0.0,0.906,0.094,0.4215
19,DD, Stop the corny memes. Post some DD,napoelonDynaMighty,1,/r/RobinHoodPennyStocks/comments/lys4a3/when_go_into_friday_hoping_it_will_turn_green/gpw3ks1/,0.268,0.732,0.0,-0.296
20,CTXR," Nice.  I'm in 438 at $.95.  Should have averaged down earlier today but went all in on CTXR when it hit 1.52.

I hope this hits $1 soon.  I'll be tempted to unload for small profits and wait for another dip.",JeepMunkee,1,/r/RobinHoodPennyStocks/comments/lyovdl/asrt_yolo_day_2_update_2_after_hours_030521/gpu8diz/,0.0,0.794,0.206,0.8625
21,FB, Bad news for FB...,happymuskateer,1,/r/RobinHoodPennyStocks/comments/lyt20o/wednesday_and_thursday_almost_killed_me_friday/gpuzkdp/,0.538,0.462,0.0,-0.5423
22,NIO," Institutional investors, they buy and sell large quantities of stocks at the same time. Also, the prices got so low and attractive at some point that people couldn’t resist buying. I mean, NIO at $32 is a steal.",Leading-Version-7671,9,/r/RobinHoodPennyStocks/comments/lyp6qq/same_time/gpu98cw/,0.141,0.784,0.075,-0.4171
23,RH, I have playing around with the  free RH SPPI stock for a month. Even had a 100 of them at one time. A made a dollar or two off of it...lol.,The-Night-Raven,2,/r/RobinHoodPennyStocks/comments/lyp6qq/same_time/gpu061j/,0.0,0.825,0.175,0.6249
24,AGTC," There’s were a few catalysts in March for stocks I hold (ASRT, AGTC, ZOM), so I held. Was tempted to sell ZOM to break even so I could buy at a cheaper price since Their product release is end of March, there’s still lots of time in between, but the dip kept dipping and at a loss currently. ZOM 650/$2.20",barry-savitar-allen,4,/r/RobinHoodPennyStocks/comments/lz7piq/stimulus_checks_passed_will_be_interesting_to_see/gpzv8zw/,0.053,0.947,0.0,-0.4497
25,ZOM," There’s were a few catalysts in March for stocks I hold (ASRT, AGTC, ZOM), so I held. Was tempted to sell ZOM to break even so I could buy at a cheaper price since Their product release is end of March, there’s still lots of time in between, but the dip kept dipping and at a loss currently. ZOM 650/$2.20",barry-savitar-allen,4,/r/RobinHoodPennyStocks/comments/lz7piq/stimulus_checks_passed_will_be_interesting_to_see/gpzv8zw/,0.053,0.947,0.0,-0.4497
26,GME, Been Holdinf GME since 40$ a share first and second time. Bullish 🚀🥱👐🏽💎,FirmInfluence5689,0,/r/RobinHoodPennyStocks/comments/lz7piq/stimulus_checks_passed_will_be_interesting_to_see/gq00fzp/,0.0,0.833,0.167,0.296
27,ASRT," Super curious what this week for ASRT looks like. 
I avoided it initially because I missed it on the recent run and didn’t want to FOMO. 

Bought in 6969 shares @.82 on Friday. 

Could just be my bias, but think with positive market sentiment this thing reaches to 1.15 again no problem. 
With the ER and following presentation it could go up maybe even higher 1.3-1.5 on those.

Can’t wait for the presentation and see what their outlook and plans are. Will hold some sort of position for a while in this one.",happyhappy7,3,/r/RobinHoodPennyStocks/comments/lz7piq/stimulus_checks_passed_will_be_interesting_to_see/gq02z42/,0.105,0.753,0.143,0.4497
28,TMBR, TMBR might raise a bit. News announced next week. Not an advice,keyb0ard_ninj4,2,/r/RobinHoodPennyStocks/comments/lz7piq/stimulus_checks_passed_will_be_interesting_to_see/gq07kv8/,0.0,1.0,0.0,0.0
29,CEO," https://investor.assertiotx.com/index.php/news-releases/news-release-details/assertio-holdings-inc-present-virtual-roth-conference-monday

March 15th.

Think that this will be pretty big for them. Coming out of the settlement in February and new CEO/President at turn of the year. (Had been with assertio for a few years tho)

Plus a couple potential drugs in the near pipeline. Plenty of DD done on Reddit, and I’m not one for stonks, etc. but at current prices I think this is a great value play. This isn’t a hype or P&D (but it has pump potential if that makes sense)
Next 10 days are gonna be interesting, but I feel very comfortable sitting on this for a while",happyhappy7,2,/r/RobinHoodPennyStocks/comments/lz7piq/stimulus_checks_passed_will_be_interesting_to_see/gq07po3/,0.0,0.801,0.199,0.9732
30,DD," https://investor.assertiotx.com/index.php/news-releases/news-release-details/assertio-holdings-inc-present-virtual-roth-conference-monday

March 15th.

Think that this will be pretty big for them. Coming out of the settlement in February and new CEO/President at turn of the year. (Had been with assertio for a few years tho)

Plus a couple potential drugs in the near pipeline. Plenty of DD done on Reddit, and I’m not one for stonks, etc. but at current prices I think this is a great value play. This isn’t a hype or P&D (but it has pump potential if that makes sense)
Next 10 days are gonna be interesting, but I feel very comfortable sitting on this for a while",happyhappy7,2,/r/RobinHoodPennyStocks/comments/lz7piq/stimulus_checks_passed_will_be_interesting_to_see/gq07po3/,0.0,0.801,0.199,0.9732
31,ASRT, Go ASRT go. Please,GiovannisPersian,15,/r/RobinHoodPennyStocks/comments/lyqg7y/daily_discussion_thread/gpudy96/,0.0,0.566,0.434,0.3182
32,AGTC, Kicking myself for not buying that nice dip on AGTC today,kptrulee,14,/r/RobinHoodPennyStocks/comments/lyqg7y/daily_discussion_thread/gpuinen/,0.189,0.811,0.0,-0.3252
33,CTXR," Slightly scaled my positions back to get some spare buying power (ZOM, CTXR, TRCH, ASRT) but otherwise am still standing strong on these. Especially encouraging to see basically all of them rebound in the same way which just shows they're being dragged down by the wider market. Hopefully next week is kinder to pennies like these. 

Looking forward, gonna see if I can get any spare time to try to get the tip off on stuff that might run next week. No matter how the market winds up, there's always something that manages to break the mold. If nothing else though I gotta be more staunch in not looking at my own portfolio on down days. Even if I don't sell, doing that will make me miss opportunities in the moment.",OKJMaster44,5,/r/RobinHoodPennyStocks/comments/lyqg7y/daily_discussion_thread/gpugbuk/,0.04,0.791,0.169,0.9688
34,TRCH," Slightly scaled my positions back to get some spare buying power (ZOM, CTXR, TRCH, ASRT) but otherwise am still standing strong on these. Especially encouraging to see basically all of them rebound in the same way which just shows they're being dragged down by the wider market. Hopefully next week is kinder to pennies like these. 

Looking forward, gonna see if I can get any spare time to try to get the tip off on stuff that might run next week. No matter how the market winds up, there's always something that manages to break the mold. If nothing else though I gotta be more staunch in not looking at my own portfolio on down days. Even if I don't sell, doing that will make me miss opportunities in the moment.",OKJMaster44,5,/r/RobinHoodPennyStocks/comments/lyqg7y/daily_discussion_thread/gpugbuk/,0.04,0.791,0.169,0.9688
35,MICT," Heyoooo, the week at least ended on a positive note! Still down, but I trust MICT will recover quickly.",ThreenGumb,4,/r/RobinHoodPennyStocks/comments/lyqg7y/daily_discussion_thread/gpu9jpo/,0.0,0.681,0.319,0.793
36,CTXR, CTXR made a decent push AH,the_gurper,7,/r/RobinHoodPennyStocks/comments/lyqg7y/daily_discussion_thread/gpum3j7/,0.0,1.0,0.0,0.0
37,XOM, Just doing calls on XOM still. Working in my favor.,MrCarey,1,/r/RobinHoodPennyStocks/comments/lyqg7y/daily_discussion_thread/gpupzvy/,0.0,0.769,0.231,0.4019
38,DD," There is no singular answer for this unless you're looking for brainless ""ZOM 🚀"" type of responses. There is plenty of DD in this sub. I check unbiastock.com to get an idea of what subs are talking about what and start my research from there. GL",Itsboomhomie,2,/r/RobinHoodPennyStocks/comments/lyqg7y/daily_discussion_thread/gpzsl8v/,0.046,0.892,0.063,0.2103
39,GL," There is no singular answer for this unless you're looking for brainless ""ZOM 🚀"" type of responses. There is plenty of DD in this sub. I check unbiastock.com to get an idea of what subs are talking about what and start my research from there. GL",Itsboomhomie,2,/r/RobinHoodPennyStocks/comments/lyqg7y/daily_discussion_thread/gpzsl8v/,0.046,0.892,0.063,0.2103
40,AGTC, AGTC and OBSV for a mid to long term hold are my personal favs,kadyrovtsy,1,/r/RobinHoodPennyStocks/comments/lyqg7y/daily_discussion_thread/gq07lun/,0.0,1.0,0.0,0.0
41,OBSV, AGTC and OBSV for a mid to long term hold are my personal favs,kadyrovtsy,1,/r/RobinHoodPennyStocks/comments/lyqg7y/daily_discussion_thread/gq07lun/,0.0,1.0,0.0,0.0
42,SOS, Any updates on the situation?  I saw SOS released a statement but it pretty much said “we’ll release a better statement soon”,JeffAnthonyLajoie,2,/r/RobinHoodPennyStocks/comments/lyqg7y/daily_discussion_thread/gpulqyy/,0.0,0.676,0.324,0.8462
43,AMC," Yep, we can put that right on top of the GME, AMC, BB checks. /s

I wish the market made more sense.

edit- BB, not NOK",Appropriate_Tap_7045,1,/r/RobinHoodPennyStocks/comments/lyqg7y/daily_discussion_thread/gpue1j1/,0.0,0.767,0.233,0.6908
44,BB," Yep, we can put that right on top of the GME, AMC, BB checks. /s

I wish the market made more sense.

edit- BB, not NOK",Appropriate_Tap_7045,1,/r/RobinHoodPennyStocks/comments/lyqg7y/daily_discussion_thread/gpue1j1/,0.0,0.767,0.233,0.6908
45,GME," Yep, we can put that right on top of the GME, AMC, BB checks. /s

I wish the market made more sense.

edit- BB, not NOK",Appropriate_Tap_7045,1,/r/RobinHoodPennyStocks/comments/lyqg7y/daily_discussion_thread/gpue1j1/,0.0,0.767,0.233,0.6908
46,NOK," Yep, we can put that right on top of the GME, AMC, BB checks. /s

I wish the market made more sense.

edit- BB, not NOK",Appropriate_Tap_7045,1,/r/RobinHoodPennyStocks/comments/lyqg7y/daily_discussion_thread/gpue1j1/,0.0,0.767,0.233,0.6908
47,USA," What do you guys use to file? I've heard of Free Tax USA, TurboTax, TaxAct but have never filed for stock taxes. Any recommendations, ~~any of em free~~?",Giraffetiddies,2,/r/RobinHoodPennyStocks/comments/lyp08a/another_dumb_tax_question/gpu0ddw/,0.0,0.915,0.085,0.3632
48,AGI," I did my taxes with Tax Slayer, had student loan interest and security trading bundled with it for absolutely free. If your AGI is less than 72k, there are a handful of 100% free filing websites you can use. https://apps.irs.gov/app/freeFile/",rosedragoon,2,/r/RobinHoodPennyStocks/comments/lyp08a/another_dumb_tax_question/gpu89oh/,0.0,0.73,0.27,0.9116
49,RH," if you got a 1099-MISC in the top of your 1099 from RH, turbotax doesn't import it right. i just deleted mine because it wasn't letting me e-file, it was .05 so shouldn't matter i hope.",Bear_buh_dare,1,/r/RobinHoodPennyStocks/comments/lyp08a/another_dumb_tax_question/gpzsv2t/,0.112,0.837,0.05,-0.3009
50,AGI," Copy pasting my comment: I did my taxes with Tax Slayer, had student loan interest and security trading bundled with it for absolutely free. If your AGI is less than 72k, there are a handful of 100% free filing websites you can use. https://apps.irs.gov/app/freeFile/",rosedragoon,4,/r/RobinHoodPennyStocks/comments/lyp08a/another_dumb_tax_question/gpu8cry/,0.0,0.751,0.249,0.9116
51,EYES," Bought and sold EYES at just the right time. Made a 51% profit. Since I went in on EYES you can say I have an ""eye"" for the market. Great win today !! Sitting pretty for the weekend. Can't wait until Monday.  I would post pic but the image button has been removed so I can't post it.",gordon_gekko1976,6,/r/RobinHoodPennyStocks/comments/lymzp7/weekly_gainloss_porn_and_discussion_thread/gptyb2k/,0.0,0.836,0.164,0.8217
52,AGTC, yeah... losses were brutal this week. AGTC makes up like 90% of my portfolio tho so let’s get it!,drpooiscute,2,/r/RobinHoodPennyStocks/comments/lymzp7/weekly_gainloss_porn_and_discussion_thread/gpu3oim/,0.277,0.625,0.098,-0.68
53,AM," It's like clockwork every day. Good to okay opening, then at around 10 AM central -11:30 shit tanks then rallies for the rest of the day. My biggest mistakes were selling at the mid day drops, if it starts dropping then keep an eye on it and trust it'll come back. If you were looking for an exit already then no problem selling when it starts, but if you planned on holding then hold through it",Potato_Soup_,2,/r/RobinHoodPennyStocks/comments/lymzp7/weekly_gainloss_porn_and_discussion_thread/gpv58yk/,0.091,0.821,0.088,-0.0516
54,DD," Thanks u/itsrattlesnake :) appreciate it!! I’m shooting for a solid DD least every two weeks. 

Hang in there, these yield driven reallocations typically resolve as soon as yields stabilize. If next week is stable we will be on the way back up :)",bypassthalamus,4,/r/RobinHoodPennyStocks/comments/lymzp7/weekly_gainloss_porn_and_discussion_thread/gpycx39/,0.0,0.653,0.347,0.9484
55,ARDS," [CTXR](https://i.imgur.com/N7MJUr3.jpg)

I'm looking to get to 1000 shares before April. At 480 currently. Have really strong faith long-term in these guys. They announced that they're working on a treatment for covid-related respiratory issues that I guess stemmed from their ARDS treatment.

Their ARDS treatment will enter FDA trials next year. ARDS is acute respiratory distress syndrome and can be caused by sepsis or moderate to severe smoke inhalation, like we see with people pulled from fires. There is no FDA approved treatment for ARDS currently. If approved, they will be the first and only.

This year we'll see the MinoLok phase 3 results, which sound like they'll be amazing. We'll get information on how well their hemorrhoid treatment looks. If their hemorrhoid treatment gets FDA approval, they'll be the first and only prescription hemorrhoid treatment in the US. That would likely happen next year I think but we'll definitely get some insight into it this year. And this year we'll get some info about their MinoWrap, the product that helps with infections stemming from post-mastectomy breast reconstructions.

I have no idea where this stock will be at the end of the year but this is one I'm looking to hold for the next 5+ years at least. This has a lot of potential and if MinoLok is a huge success for them, it's going to be very interesting seeing what other products they can come up with.",ict_brian,4,/r/RobinHoodPennyStocks/comments/lys8z7/still_holding_ctxr_pc_on_the_9th_with_pipeline/gpuws5f/,0.028,0.823,0.149,0.9817
56,ARDS," Damn I’m about to look all of this up. Mino-Lok is just scratching the surface. I knew this specific product has significant value. They keep saying this will enter a $1.5 billion market. Their market cap is currently $225 mil. This is can’t not be priced in. I’m steady building a larger position. 

Most interested in this ARDS treatment.",Sure6995,2,/r/RobinHoodPennyStocks/comments/lys8z7/still_holding_ctxr_pc_on_the_9th_with_pipeline/gpuyj0o/,0.044,0.84,0.116,0.5413
57,ARDS," We'll know more on the 9th/10th because they're going to talk about their treatment for covid-related respiratory issues at some point as well. So I think they'll probably cover the ARDS separately, if not first and then tie it in during the presentation.

Here's their Feb 2021 letter to shareholders: https://www.citiuspharma.com/wp-content/uploads/2021/02/CTXR_Shareholder_Letter_Feb2021.pdf

The letter to shareholders has some really interesting information about what they're working on. The ARDS treatment could be even bigger than MinoLok.",ict_brian,2,/r/RobinHoodPennyStocks/comments/lys8z7/still_holding_ctxr_pc_on_the_9th_with_pipeline/gpuzqsv/,0.0,0.933,0.067,0.624
58,RH," Thanks, but not on RH.",zzman1894,3,/r/RobinHoodPennyStocks/comments/lz0l79/iqst_looks_very_promising/gpxuouf/,0.0,0.672,0.328,0.2382
59,AGTC, AGTC,WELLFUCKMESIDEWAYZ24,2,/r/RobinHoodPennyStocks/comments/lza1oe/whats_everyone_yoloing_their_stimulus_on/gq0hm3h/,0.0,1.0,0.0,0.0
60,AGTC, AGTC,kkabi1,1,/r/RobinHoodPennyStocks/comments/lza1oe/whats_everyone_yoloing_their_stimulus_on/gq0ou8c/,0.0,1.0,0.0,0.0
61,SOS, Sounds like they need an SOS,terrible_badguy,4,/r/RobinHoodPennyStocks/comments/lyqnpx/lawsuit_filed_against_sos_ltd_for_securities/gpubh9u/,0.0,0.667,0.333,0.3612
62,SOS," I unfortunately am chained to this ship lol

But luckily the firm seems like  ""stock"" ambulance chasers--- They're the ones trying to sue DFV, and stir the waters on any stock with any question marks. SOS is one of many companies that they are calling out this week.

the sketchiness continues.",Appropriate_Tap_7045,5,/r/RobinHoodPennyStocks/comments/lyqnpx/lawsuit_filed_against_sos_ltd_for_securities/gpugseq/,0.042,0.807,0.151,0.7351
63,DD," good for you, its all downhill from here....

Belmont, HB, and Culper have all contacted the SEC, forwarded the info to them and are currently communicating. The ships sinking.  All the SOS bulls have basically turned into a cult who just bury their heads in the sand when you present them with information. This ""anti anything short"" wave going on is super toxic....and dumb. Not every short is predatory,  More often than not they expose legitimate fraud. And this is no exception. Ive done serious deeeeeep DD on SOS. No Bueno.",NeonIcahnn,-1,/r/RobinHoodPennyStocks/comments/lyqnpx/lawsuit_filed_against_sos_ltd_for_securities/gpuxoop/,0.145,0.776,0.079,-0.7056
64,SOS," good for you, its all downhill from here....

Belmont, HB, and Culper have all contacted the SEC, forwarded the info to them and are currently communicating. The ships sinking.  All the SOS bulls have basically turned into a cult who just bury their heads in the sand when you present them with information. This ""anti anything short"" wave going on is super toxic....and dumb. Not every short is predatory,  More often than not they expose legitimate fraud. And this is no exception. Ive done serious deeeeeep DD on SOS. No Bueno.",NeonIcahnn,-1,/r/RobinHoodPennyStocks/comments/lyqnpx/lawsuit_filed_against_sos_ltd_for_securities/gpuxoop/,0.145,0.776,0.079,-0.7056
