,ticker,comment,username,score,permalink,neg,neu,pos,compound
479,GME," That's a very unfair comment.  You do not know me at all.  I could just as easily acuse you of being short the stock.  But I do not know you either.   

The due diligence stands for itself.  Either it is accurate or it is not.  Each person can read it and decide if it has merit.   If calcuations are right, their right.  It doesn't matter who is offering the material.  Let's be honest, for every post on social media pertaining to stocks, someone has a long position and someone has a short position.  All posts therefore come from one perspective or the other.

I do **not** work for Rite Aid.  If I did, engaging in discussion of due diligence pertaining to the stock would be illegal.  

Did DFV / Roaring Kitty work for GameStop.  No.  He saw value and he promoted his thesis based on the merits of the due diligence work he did on GME.

I am just an individual investor, no different from any other on reddit.",Michael_Therami,8,/r/stocks/comments/m9y6y7/rite_aid_no_matter_how_you_cut_it_it_is_the_right/grpil9y/,0.07,0.826,0.105,0.7456
480,RAD," Perhaps the article appeared in a different subreddit, but this is the first time I've posted this Seeking Alpha article, ""***Rite Aid, No Matter How You Cut It, It Is The Right Stock***"" here in r/stocks

As for my previous due diligence piece that I posted weeks ago ""Right Time for Rite Aid"", the author of the Seeking Alpha piece clearly lifted some of the research directly from my reddit post.  Oscar Wilde said, ""Imitation is the sincerest form of flattery..."" so I will accept the compliment and feel flattered.

Considering the amount of discussion generated on the topic underneath the post, it appears that some have appreciated the introduction of the subject here in this subreddit.  I am sorry if you have read the piece elsewhere previously.  However, in the future, if you see a post involving subject matter that you recognize, wouldn't it just be easier to move on to the next post versus trolling and posting disparaging comments about it and the OP.

If you search all of r/stocks from top to bottom, I highly doubt that you will find many posts concerning RAD over the past six months.   Therefore, I would kindly ask that you allow those of us who wish to engage in discourse concerning Rite Aid to do so in the comment section under this post.  I thank you for your consideration concerning this request.",Michael_Therami,1,/r/stocks/comments/m9y6y7/rite_aid_no_matter_how_you_cut_it_it_is_the_right/grqen55/,0.056,0.763,0.181,0.9864
481,DD," I feel you, it's a weak ""argument"". Just a glance at the other side of the coin so to speak. 

But I don't see the harm in letting a potential investor know that Rite Aid barely has a customer presence in one of the top 10 most populated cities in the US.

Tbh I might throw $500 @ 8 shares and see where it goes just based on this DD and a bit more of my own research into Elixir. It's nice to keep in mind real life experiences when investing though, that's all.",dredio62,0,/r/stocks/comments/m9y6y7/rite_aid_no_matter_how_you_cut_it_it_is_the_right/grqfl2t/,0.032,0.863,0.105,0.6956
482,MSFT, No hold MSFT IMHO,Various-Breath2517,53,/r/stocks/comments/m9pvsy/should_i_sell_msft_for_a_newer_growth_stock/groe927/,0.423,0.577,0.0,-0.296
483,MSFT," I sold MSFT a long time ago to chase better returns.  I would have been better off holding it and adding to it as an anchor position in my portfolio.  Microsoft is the best tech stock in the world.  It's moat, diverse revenue, and longevity is unmatched.",TrioxinTwoFortyFive,47,/r/stocks/comments/m9pvsy/should_i_sell_msft_for_a_newer_growth_stock/grongxh/,0.025,0.78,0.195,0.8658
484,MSFT, This depends on the risk you are willing to take. But if you take a look at markets last weeks the time of randomly buying some tech stock and gaining 5x in a few month might be over. MSFT has tanked a bit but has done better through the last correction than some others.,hitchhiker3131,7,/r/stocks/comments/m9pvsy/should_i_sell_msft_for_a_newer_growth_stock/grop9m7/,0.028,0.868,0.104,0.6369
485,MLHR," Microsoft shares are money making machine. Buy shares in multiples of 100. Forget them, they will hive you a steady growth of 7-12% year. You can make money every week by selling covered calls. But if you have few shares and want some other growth stock recommendations, i would recommend these tickers to hold for 1 year : PINS, MU, TOL, MLHR, SNE. You can do your own research on these tickers",Stonk_Jumper,27,/r/stocks/comments/m9pvsy/should_i_sell_msft_for_a_newer_growth_stock/grocadv/,0.025,0.774,0.201,0.8934
486,MU," Microsoft shares are money making machine. Buy shares in multiples of 100. Forget them, they will hive you a steady growth of 7-12% year. You can make money every week by selling covered calls. But if you have few shares and want some other growth stock recommendations, i would recommend these tickers to hold for 1 year : PINS, MU, TOL, MLHR, SNE. You can do your own research on these tickers",Stonk_Jumper,27,/r/stocks/comments/m9pvsy/should_i_sell_msft_for_a_newer_growth_stock/grocadv/,0.025,0.774,0.201,0.8934
487,PINS," Microsoft shares are money making machine. Buy shares in multiples of 100. Forget them, they will hive you a steady growth of 7-12% year. You can make money every week by selling covered calls. But if you have few shares and want some other growth stock recommendations, i would recommend these tickers to hold for 1 year : PINS, MU, TOL, MLHR, SNE. You can do your own research on these tickers",Stonk_Jumper,27,/r/stocks/comments/m9pvsy/should_i_sell_msft_for_a_newer_growth_stock/grocadv/,0.025,0.774,0.201,0.8934
488,SNE," Microsoft shares are money making machine. Buy shares in multiples of 100. Forget them, they will hive you a steady growth of 7-12% year. You can make money every week by selling covered calls. But if you have few shares and want some other growth stock recommendations, i would recommend these tickers to hold for 1 year : PINS, MU, TOL, MLHR, SNE. You can do your own research on these tickers",Stonk_Jumper,27,/r/stocks/comments/m9pvsy/should_i_sell_msft_for_a_newer_growth_stock/grocadv/,0.025,0.774,0.201,0.8934
489,TOL," Microsoft shares are money making machine. Buy shares in multiples of 100. Forget them, they will hive you a steady growth of 7-12% year. You can make money every week by selling covered calls. But if you have few shares and want some other growth stock recommendations, i would recommend these tickers to hold for 1 year : PINS, MU, TOL, MLHR, SNE. You can do your own research on these tickers",Stonk_Jumper,27,/r/stocks/comments/m9pvsy/should_i_sell_msft_for_a_newer_growth_stock/grocadv/,0.025,0.774,0.201,0.8934
490,MSFT, I sold all of mine and rolled it into PSTH when PSTH just dropped to 24.00. MSFT had been trading sideways for too long and it was my only ok option for getting quick money for the PSTH dip. The analysts are saying MSFT is going to move up and there are recent insiders buying. Oh well. Hopefully in the long run I made a wise move - but I wish I could have held it (but I needed the money).,TontineSoleSurvivor,2,/r/stocks/comments/m9pvsy/should_i_sell_msft_for_a_newer_growth_stock/grp5uug/,0.0,0.867,0.133,0.8225
491,PSTH, I sold all of mine and rolled it into PSTH when PSTH just dropped to 24.00. MSFT had been trading sideways for too long and it was my only ok option for getting quick money for the PSTH dip. The analysts are saying MSFT is going to move up and there are recent insiders buying. Oh well. Hopefully in the long run I made a wise move - but I wish I could have held it (but I needed the money).,TontineSoleSurvivor,2,/r/stocks/comments/m9pvsy/should_i_sell_msft_for_a_newer_growth_stock/grp5uug/,0.0,0.867,0.133,0.8225
492,MSFT," Since 1986 my account rep has always advised me to buy and never sell MSFT or APPL. No matter what else I do, those two stocks have made the most gains for me over the years. To sell now would make me feel less protected in the market.",SingleLonelyMan,2,/r/stocks/comments/m9pvsy/should_i_sell_msft_for_a_newer_growth_stock/grpbazf/,0.043,0.833,0.124,0.4939
493,MSFT," hold & sell covered calls.
if you dont have enough to sell a covered call on, just hold & forget about it.  Ive been holding MSFT since it was $23",HeckleHelix,2,/r/stocks/comments/m9pvsy/should_i_sell_msft_for_a_newer_growth_stock/grpdepd/,0.068,0.932,0.0,-0.2263
494,ATVI," Can’t go wrong with MSFT.

That being said, I sold mine and bought ATVI. Longer runway imo with still great growth",Social_History,1,/r/stocks/comments/m9pvsy/should_i_sell_msft_for_a_newer_growth_stock/grpkty5/,0.116,0.634,0.25,0.5574
495,MSFT," Can’t go wrong with MSFT.

That being said, I sold mine and bought ATVI. Longer runway imo with still great growth",Social_History,1,/r/stocks/comments/m9pvsy/should_i_sell_msft_for_a_newer_growth_stock/grpkty5/,0.116,0.634,0.25,0.5574
496,AAPL," Yes, I have sold MSFT for higher growth names and stocks that are mid caps because the fact is that MSFT and AAPL really don't have multibagger potential anymore because they are around 2 trillion dollar companies. Smaller market cap companies like PINS, CRM, ADBE, TWTR, INTU all have the potential to triple, quadruple etc due to lower market caps.",The_Folkhero,1,/r/stocks/comments/m9pvsy/should_i_sell_msft_for_a_newer_growth_stock/grqoe4i/,0.034,0.844,0.122,0.6808
497,ADBE," Yes, I have sold MSFT for higher growth names and stocks that are mid caps because the fact is that MSFT and AAPL really don't have multibagger potential anymore because they are around 2 trillion dollar companies. Smaller market cap companies like PINS, CRM, ADBE, TWTR, INTU all have the potential to triple, quadruple etc due to lower market caps.",The_Folkhero,1,/r/stocks/comments/m9pvsy/should_i_sell_msft_for_a_newer_growth_stock/grqoe4i/,0.034,0.844,0.122,0.6808
498,CRM," Yes, I have sold MSFT for higher growth names and stocks that are mid caps because the fact is that MSFT and AAPL really don't have multibagger potential anymore because they are around 2 trillion dollar companies. Smaller market cap companies like PINS, CRM, ADBE, TWTR, INTU all have the potential to triple, quadruple etc due to lower market caps.",The_Folkhero,1,/r/stocks/comments/m9pvsy/should_i_sell_msft_for_a_newer_growth_stock/grqoe4i/,0.034,0.844,0.122,0.6808
499,INTU," Yes, I have sold MSFT for higher growth names and stocks that are mid caps because the fact is that MSFT and AAPL really don't have multibagger potential anymore because they are around 2 trillion dollar companies. Smaller market cap companies like PINS, CRM, ADBE, TWTR, INTU all have the potential to triple, quadruple etc due to lower market caps.",The_Folkhero,1,/r/stocks/comments/m9pvsy/should_i_sell_msft_for_a_newer_growth_stock/grqoe4i/,0.034,0.844,0.122,0.6808
500,MSFT," Yes, I have sold MSFT for higher growth names and stocks that are mid caps because the fact is that MSFT and AAPL really don't have multibagger potential anymore because they are around 2 trillion dollar companies. Smaller market cap companies like PINS, CRM, ADBE, TWTR, INTU all have the potential to triple, quadruple etc due to lower market caps.",The_Folkhero,1,/r/stocks/comments/m9pvsy/should_i_sell_msft_for_a_newer_growth_stock/grqoe4i/,0.034,0.844,0.122,0.6808
501,PINS," Yes, I have sold MSFT for higher growth names and stocks that are mid caps because the fact is that MSFT and AAPL really don't have multibagger potential anymore because they are around 2 trillion dollar companies. Smaller market cap companies like PINS, CRM, ADBE, TWTR, INTU all have the potential to triple, quadruple etc due to lower market caps.",The_Folkhero,1,/r/stocks/comments/m9pvsy/should_i_sell_msft_for_a_newer_growth_stock/grqoe4i/,0.034,0.844,0.122,0.6808
502,TWTR," Yes, I have sold MSFT for higher growth names and stocks that are mid caps because the fact is that MSFT and AAPL really don't have multibagger potential anymore because they are around 2 trillion dollar companies. Smaller market cap companies like PINS, CRM, ADBE, TWTR, INTU all have the potential to triple, quadruple etc due to lower market caps.",The_Folkhero,1,/r/stocks/comments/m9pvsy/should_i_sell_msft_for_a_newer_growth_stock/grqoe4i/,0.034,0.844,0.122,0.6808
503,CC, The premiums for CC on MSFT are so low though,drdois,6,/r/stocks/comments/m9pvsy/should_i_sell_msft_for_a_newer_growth_stock/groih0l/,0.233,0.767,0.0,-0.4101
504,MSFT, The premiums for CC on MSFT are so low though,drdois,6,/r/stocks/comments/m9pvsy/should_i_sell_msft_for_a_newer_growth_stock/groih0l/,0.233,0.767,0.0,-0.4101
505,AAPL," Well sir you should know people who can buy AAPL shares in multiples of 100 don’t take their advice from reddit. 

Regardless thanks for the advice. Much appreciated!!",ihtesid,1,/r/stocks/comments/m9pvsy/should_i_sell_msft_for_a_newer_growth_stock/grqdl4q/,0.0,0.684,0.316,0.8774
506,AAPL," Sure its $104 in ""free money"" but it costs you $23k to get that free money.  Annualized premium is 23% which is not a very good return on capital.

I like MSFT as a buy/hold forever, but if your seeking premiums, its not the best in the game. For instance, the same Delta CC on AAPL nets 39% return on capital.",negativeoxy,6,/r/stocks/comments/m9pvsy/should_i_sell_msft_for_a_newer_growth_stock/grp291e/,0.112,0.727,0.161,0.364
507,CC," Sure its $104 in ""free money"" but it costs you $23k to get that free money.  Annualized premium is 23% which is not a very good return on capital.

I like MSFT as a buy/hold forever, but if your seeking premiums, its not the best in the game. For instance, the same Delta CC on AAPL nets 39% return on capital.",negativeoxy,6,/r/stocks/comments/m9pvsy/should_i_sell_msft_for_a_newer_growth_stock/grp291e/,0.112,0.727,0.161,0.364
508,MSFT," Sure its $104 in ""free money"" but it costs you $23k to get that free money.  Annualized premium is 23% which is not a very good return on capital.

I like MSFT as a buy/hold forever, but if your seeking premiums, its not the best in the game. For instance, the same Delta CC on AAPL nets 39% return on capital.",negativeoxy,6,/r/stocks/comments/m9pvsy/should_i_sell_msft_for_a_newer_growth_stock/grp291e/,0.112,0.727,0.161,0.364
509,AAPL," Wait... 39% return in a year with very little risk?  So if AAPL is trading at $120 and you buy 100 shares, you are in for $12,000

39% of $12000 is $4,680

$4,680/52 = $90

So roughly speaking $125 AAPL call option expiring next Friday will get you $90?  

Is my math roughly correct?  

Also, if yes... isn’t it too good to be true?  Where is the catch here?  Is there a catch? 🧐",Dowdell2008,1,/r/stocks/comments/m9pvsy/should_i_sell_msft_for_a_newer_growth_stock/grp44us/,0.027,0.858,0.115,0.7766
510,AAPL," Do you consider AAPL to be any higher risk than MSFT?  The point I was making is that if premium is your goal, there are better stocks for it.",negativeoxy,3,/r/stocks/comments/m9pvsy/should_i_sell_msft_for_a_newer_growth_stock/grp6kdg/,0.068,0.839,0.094,0.2023
511,AAPL," Its the same catch as always when comparing premiums for two underlyings: AAPL has a higher IV and all the characteristics that come along with that elevated IV.  AAPL is at 35.87%, MSFT is at 24.79% (on close dated weeklies).",negativeoxy,2,/r/stocks/comments/m9pvsy/should_i_sell_msft_for_a_newer_growth_stock/grp6whf/,0.0,1.0,0.0,0.0
512,MSFT," Its the same catch as always when comparing premiums for two underlyings: AAPL has a higher IV and all the characteristics that come along with that elevated IV.  AAPL is at 35.87%, MSFT is at 24.79% (on close dated weeklies).",negativeoxy,2,/r/stocks/comments/m9pvsy/should_i_sell_msft_for_a_newer_growth_stock/grp6whf/,0.0,1.0,0.0,0.0
513,AAPL," Yes, you make a good point, but AAPL is a bit higher risk, (not by much). If my priority was safety I'd get MSFT.",yodaspicehandler,3,/r/stocks/comments/m9pvsy/should_i_sell_msft_for_a_newer_growth_stock/grpapfl/,0.094,0.639,0.266,0.5927
514,MSFT," Yes, you make a good point, but AAPL is a bit higher risk, (not by much). If my priority was safety I'd get MSFT.",yodaspicehandler,3,/r/stocks/comments/m9pvsy/should_i_sell_msft_for_a_newer_growth_stock/grpapfl/,0.094,0.639,0.266,0.5927
515,ASX, Looking at the ASX financials and am not sure I am following (I am not as knowledgeable about the semi-conductor industry). Can you help me understand the undervalued aspect for it?,thepenthousemc,2,/r/stocks/comments/m9nb0o/value_investing_finding_the_intrinsic_value_of_a/gro0er6/,0.06,0.857,0.083,0.1872
516,BDSI, A lot of insider selling on BDSI. Wassup?,finney1013,1,/r/stocks/comments/m9nb0o/value_investing_finding_the_intrinsic_value_of_a/grpb037/,0.0,1.0,0.0,0.0
517,BDSI," Source?


https://www.marketbeat.com/stocks/NASDAQ/BDSI/insider-trades/


From what i see, there was a lot of selling around Q4 2019, since then the selling is very low volume",Floofyboy,1,/r/stocks/comments/m9nb0o/value_investing_finding_the_intrinsic_value_of_a/grpc55f/,0.107,0.893,0.0,-0.3384
518,AMZN," I dunno.  I think you can.  

I personally have long positions in both WFC and KHC from last year.  Both are up +10% in the past few months alone.  Those are both 'Buffet style investments'.  I think Buffet actually owns KHC.

And it's pretty easy to buy the shares compared to something like AMZN.  So, you don't need a ton of capital to get into them.

I wouldn't say stuff like this is restricted to only hedge funds.

It just depends on what kind of portfolio you want.

These kind of companies are definitely not the hot and sexy EV stocks where investors are predicting spectacular growth.  They are boring companies; one is bank and one makes ketchup and mustard.

However, they do generate money.  In addition, they both have had problems in past few years.  So, their stock price has taken a beating.  And, currently, they are trying to fix things and get back on track.

I think Buffet also owns SNOW.  So, if you want a hot new growth company, you can look at SNOW.  It's been taking a beating too with the NASDAQ sell off.  You might be able to get in <200 if the sell off continues.  If Buffet is right and SNOW becomes a Google over the next 25 years and you are 18, you'll be retiring early.

Again, not investment advice and you'll have to make your own decisions.  However, I think it is totally possible to have a Buffet style portfolio as a retail investor.",TrottingGelato,1,/r/stocks/comments/m9nb0o/value_investing_finding_the_intrinsic_value_of_a/gro5uqc/,0.059,0.838,0.103,0.8625
519,KHC," I dunno.  I think you can.  

I personally have long positions in both WFC and KHC from last year.  Both are up +10% in the past few months alone.  Those are both 'Buffet style investments'.  I think Buffet actually owns KHC.

And it's pretty easy to buy the shares compared to something like AMZN.  So, you don't need a ton of capital to get into them.

I wouldn't say stuff like this is restricted to only hedge funds.

It just depends on what kind of portfolio you want.

These kind of companies are definitely not the hot and sexy EV stocks where investors are predicting spectacular growth.  They are boring companies; one is bank and one makes ketchup and mustard.

However, they do generate money.  In addition, they both have had problems in past few years.  So, their stock price has taken a beating.  And, currently, they are trying to fix things and get back on track.

I think Buffet also owns SNOW.  So, if you want a hot new growth company, you can look at SNOW.  It's been taking a beating too with the NASDAQ sell off.  You might be able to get in <200 if the sell off continues.  If Buffet is right and SNOW becomes a Google over the next 25 years and you are 18, you'll be retiring early.

Again, not investment advice and you'll have to make your own decisions.  However, I think it is totally possible to have a Buffet style portfolio as a retail investor.",TrottingGelato,1,/r/stocks/comments/m9nb0o/value_investing_finding_the_intrinsic_value_of_a/gro5uqc/,0.059,0.838,0.103,0.8625
520,SNOW," I dunno.  I think you can.  

I personally have long positions in both WFC and KHC from last year.  Both are up +10% in the past few months alone.  Those are both 'Buffet style investments'.  I think Buffet actually owns KHC.

And it's pretty easy to buy the shares compared to something like AMZN.  So, you don't need a ton of capital to get into them.

I wouldn't say stuff like this is restricted to only hedge funds.

It just depends on what kind of portfolio you want.

These kind of companies are definitely not the hot and sexy EV stocks where investors are predicting spectacular growth.  They are boring companies; one is bank and one makes ketchup and mustard.

However, they do generate money.  In addition, they both have had problems in past few years.  So, their stock price has taken a beating.  And, currently, they are trying to fix things and get back on track.

I think Buffet also owns SNOW.  So, if you want a hot new growth company, you can look at SNOW.  It's been taking a beating too with the NASDAQ sell off.  You might be able to get in <200 if the sell off continues.  If Buffet is right and SNOW becomes a Google over the next 25 years and you are 18, you'll be retiring early.

Again, not investment advice and you'll have to make your own decisions.  However, I think it is totally possible to have a Buffet style portfolio as a retail investor.",TrottingGelato,1,/r/stocks/comments/m9nb0o/value_investing_finding_the_intrinsic_value_of_a/gro5uqc/,0.059,0.838,0.103,0.8625
521,WFC," I dunno.  I think you can.  

I personally have long positions in both WFC and KHC from last year.  Both are up +10% in the past few months alone.  Those are both 'Buffet style investments'.  I think Buffet actually owns KHC.

And it's pretty easy to buy the shares compared to something like AMZN.  So, you don't need a ton of capital to get into them.

I wouldn't say stuff like this is restricted to only hedge funds.

It just depends on what kind of portfolio you want.

These kind of companies are definitely not the hot and sexy EV stocks where investors are predicting spectacular growth.  They are boring companies; one is bank and one makes ketchup and mustard.

However, they do generate money.  In addition, they both have had problems in past few years.  So, their stock price has taken a beating.  And, currently, they are trying to fix things and get back on track.

I think Buffet also owns SNOW.  So, if you want a hot new growth company, you can look at SNOW.  It's been taking a beating too with the NASDAQ sell off.  You might be able to get in <200 if the sell off continues.  If Buffet is right and SNOW becomes a Google over the next 25 years and you are 18, you'll be retiring early.

Again, not investment advice and you'll have to make your own decisions.  However, I think it is totally possible to have a Buffet style portfolio as a retail investor.",TrottingGelato,1,/r/stocks/comments/m9nb0o/value_investing_finding_the_intrinsic_value_of_a/gro5uqc/,0.059,0.838,0.103,0.8625
522,JNJ," JNJ and MSFT are the only two large US companies with a AAA credit rating. JNJ is a storied, diversified set of dynamic businesses that represent both stable consumer goods and higher growth biotech, etc. However, they are also currently undervalued and pay a healthy dividend. Of all the individual stocks one could pick, this is one of the all around easiest choices in my book. Due to its market cap, it’s going to be a top holding in a broad index fund like VOO; however, it’s only going to be around 1.3% of the total weight. Whether to allocate more to it depends on your various objectives and risk tolerance, and those are questions only you can answer. In my view, the main reason not to own it is if you have a better reason or reasons in favor of other things, and there could be many of those. I hold about 20% of my portfolio in stock picks I like for various reasons. JNJ is one of them.",MorningCoffeeMug21,10,/r/stocks/comments/m9h83x/reason_to_own_jnj_vs_voo_or_something/grmywg7/,0.019,0.815,0.166,0.9738
523,MSFT," JNJ and MSFT are the only two large US companies with a AAA credit rating. JNJ is a storied, diversified set of dynamic businesses that represent both stable consumer goods and higher growth biotech, etc. However, they are also currently undervalued and pay a healthy dividend. Of all the individual stocks one could pick, this is one of the all around easiest choices in my book. Due to its market cap, it’s going to be a top holding in a broad index fund like VOO; however, it’s only going to be around 1.3% of the total weight. Whether to allocate more to it depends on your various objectives and risk tolerance, and those are questions only you can answer. In my view, the main reason not to own it is if you have a better reason or reasons in favor of other things, and there could be many of those. I hold about 20% of my portfolio in stock picks I like for various reasons. JNJ is one of them.",MorningCoffeeMug21,10,/r/stocks/comments/m9h83x/reason_to_own_jnj_vs_voo_or_something/grmywg7/,0.019,0.815,0.166,0.9738
524,ABBV," Hey bro. How about ABBV, BMO and JNJ?  Any thoughts?",Dowdell2008,1,/r/stocks/comments/m9h83x/reason_to_own_jnj_vs_voo_or_something/gro51tp/,0.0,1.0,0.0,0.0
525,BMO," Hey bro. How about ABBV, BMO and JNJ?  Any thoughts?",Dowdell2008,1,/r/stocks/comments/m9h83x/reason_to_own_jnj_vs_voo_or_something/gro51tp/,0.0,1.0,0.0,0.0
526,IMO, I have hundreds.  The more diversity the better IMO.,rivers-end,-1,/r/stocks/comments/ma2gj3/is_this_too_many/grqa4xv/,0.0,0.689,0.311,0.4877
527,AMZN," Next few decades? AMZN, MSFT, GOOG.",Gooch__Gobbler,15,/r/stocks/comments/m9gxbw/favorite_stock_pick/grmw7kv/,0.0,1.0,0.0,0.0
528,GOOG," Next few decades? AMZN, MSFT, GOOG.",Gooch__Gobbler,15,/r/stocks/comments/m9gxbw/favorite_stock_pick/grmw7kv/,0.0,1.0,0.0,0.0
