,ticker,comment,username,score,permalink,neg,neu,pos,compound
43,DD," *""unlimited supply, and economic rules change every 6 months""* is a rather misleading statement; if I were reading a DD document I'd throw my hands up there. This is r\/investing, not r\/cryptocurrency :)

Ethereum's supply isn't capped like Bitcoin, but it's not some wild unknown - the supply increases due to the block reward, which is set by the protocol itself.  That's currently fixed at 2 ETH / block, which comes out to around 4.3% supply inflation per year.  Bitcoin by comparison is at (I think?) around 1.7% supply inflation per year for the next while, which is notably lower.

It's true that Ethereum's protocol is subject to change, but so is Bitcoin's -- what's important with a cryptocurrency is what the community consensus is about what changes are allowable, and what ones aren't.  Bitcoin has a commendably very clear narrative about it's economic policy -- PoW, 21 million tokens, no changes allowed ever.  

Ethereum's is a bit different, but can be summed as: ""PoS, with minimum viable issuance for security"".  That hasn't ever changed, and while the specifics may alter during updates, to say ""the rules change every 6 months"" is misleading: While the block reward has been changed a few times since inception, it has *always* been a decrease, never an increase.  As an example: there was a recent proposal from some miners to up the block reward, and it was soundly rejected by the rest of the community.  Stonks go up, block rewards go *down*.

Which leads me to the next two parts on Ethereum's roadmap: EIP-1559, and Proof-of-Stake.  Coming sometime around July is the ""London"" upgrade, which will include a change titled EIP-1559 -- This has a few effects, but economically, it will burn a % of each transaction fee going forward, forever. Estimates are that this will apply 0-1.5% deflationary pressure (depending on fees).  Think of it like a perpetual stock buy-back.

The next part is Ethereum transitioning to Proof of Stake -- the timeline is still being finalized, but the ""beacon chain"" consensus layer is already live, with over $6 billion staked so far, and target is 2021-Q4 - 2022-Q1.  Once that layer takes over, Ethereum's issuance will drop to 0.5%-1%, competitive with Bitcoin.

As part of the ""minimum viable issuance for security"" policy, community concensus is rapidly forming that these policies *will* be permanent: Because when 1559 & PoS are combined, Ethereum supply will actually *decrease* YoY, while at the same time being able to indefinitely pay for security (through block rewards). This opposed to Bitcoin's policy, where eventually block rewards will decrease so far that it's security will *require* higher and higher fees to compensate (if people don't pay enough, the chain may become vulnerable to reorg attack). 

And yes, Ethereum's fees are an issue.  But it's an open market, not a fundamental set by the protocol - people are just getting in a bidding war to get on-chain.  And there's plenty of things being done long-term to address this.  EIP-1559 isn't just about the ""burn"", it also reworks the fee market to fight bidding wars, centralization, and smooth out spikes in demand.  PoS makes blocks more predictable (and slightly faster), reducing urgency that makes people want to bid higher.  ""Layer 2"" technologies are rolling out now.  Capacity increases (statelessness, sharding) are already having grants issued. 

**tl;dr** I'd argue the ""minimum viable issuance for security"" outlined above makes Ethereum an idea store of value and unit of account, as it contains both a control on supply inflation, AND a mechanism to indefinitely ensure network security (which is required for long term trust).",ryebit,1,/r/investing/comments/mr2m8u/coinbase_deep_dive_diligence_part_1_of_2/gulq7hp/,0.122,0.782,0.096,-0.9333
44,ETH," *""unlimited supply, and economic rules change every 6 months""* is a rather misleading statement; if I were reading a DD document I'd throw my hands up there. This is r\/investing, not r\/cryptocurrency :)

Ethereum's supply isn't capped like Bitcoin, but it's not some wild unknown - the supply increases due to the block reward, which is set by the protocol itself.  That's currently fixed at 2 ETH / block, which comes out to around 4.3% supply inflation per year.  Bitcoin by comparison is at (I think?) around 1.7% supply inflation per year for the next while, which is notably lower.

It's true that Ethereum's protocol is subject to change, but so is Bitcoin's -- what's important with a cryptocurrency is what the community consensus is about what changes are allowable, and what ones aren't.  Bitcoin has a commendably very clear narrative about it's economic policy -- PoW, 21 million tokens, no changes allowed ever.  

Ethereum's is a bit different, but can be summed as: ""PoS, with minimum viable issuance for security"".  That hasn't ever changed, and while the specifics may alter during updates, to say ""the rules change every 6 months"" is misleading: While the block reward has been changed a few times since inception, it has *always* been a decrease, never an increase.  As an example: there was a recent proposal from some miners to up the block reward, and it was soundly rejected by the rest of the community.  Stonks go up, block rewards go *down*.

Which leads me to the next two parts on Ethereum's roadmap: EIP-1559, and Proof-of-Stake.  Coming sometime around July is the ""London"" upgrade, which will include a change titled EIP-1559 -- This has a few effects, but economically, it will burn a % of each transaction fee going forward, forever. Estimates are that this will apply 0-1.5% deflationary pressure (depending on fees).  Think of it like a perpetual stock buy-back.

The next part is Ethereum transitioning to Proof of Stake -- the timeline is still being finalized, but the ""beacon chain"" consensus layer is already live, with over $6 billion staked so far, and target is 2021-Q4 - 2022-Q1.  Once that layer takes over, Ethereum's issuance will drop to 0.5%-1%, competitive with Bitcoin.

As part of the ""minimum viable issuance for security"" policy, community concensus is rapidly forming that these policies *will* be permanent: Because when 1559 & PoS are combined, Ethereum supply will actually *decrease* YoY, while at the same time being able to indefinitely pay for security (through block rewards). This opposed to Bitcoin's policy, where eventually block rewards will decrease so far that it's security will *require* higher and higher fees to compensate (if people don't pay enough, the chain may become vulnerable to reorg attack). 

And yes, Ethereum's fees are an issue.  But it's an open market, not a fundamental set by the protocol - people are just getting in a bidding war to get on-chain.  And there's plenty of things being done long-term to address this.  EIP-1559 isn't just about the ""burn"", it also reworks the fee market to fight bidding wars, centralization, and smooth out spikes in demand.  PoS makes blocks more predictable (and slightly faster), reducing urgency that makes people want to bid higher.  ""Layer 2"" technologies are rolling out now.  Capacity increases (statelessness, sharding) are already having grants issued. 

**tl;dr** I'd argue the ""minimum viable issuance for security"" outlined above makes Ethereum an idea store of value and unit of account, as it contains both a control on supply inflation, AND a mechanism to indefinitely ensure network security (which is required for long term trust).",ryebit,1,/r/investing/comments/mr2m8u/coinbase_deep_dive_diligence_part_1_of_2/gulq7hp/,0.122,0.782,0.096,-0.9333
45,SQ," Incorrect. Coin is as of now an exchange much like Amazon was ecommerce but give it a few years they will start to expand their offerings much like how SQ is not just a point of sale provider anymore.

One mistake many people evaluating companies in tech is that they evaluate it like non tech companies. Expanding offering isn't a difficult matter when your product scale easily.",Coz131,-3,/r/investing/comments/mr2m8u/coinbase_deep_dive_diligence_part_1_of_2/gukqsnr/,0.054,0.709,0.236,0.9202
46,COIN," I making comparisons relative to recently IPOed high growth tech companies.

NDAQ and ICE (and TWLO and SNOW for that matter) make their money primarily on backend b2b services, while COIN makes their money both on backend b2b services AND on direct to consumer products with 53million current users. NDAQ and ICE have no similar business that I am aware of. COIN is more like NDAQ + Fidelity with double the users.",pinnr,1,/r/investing/comments/mr2m8u/coinbase_deep_dive_diligence_part_1_of_2/gulqxw5/,0.03,0.897,0.073,0.4927
47,ICE," I making comparisons relative to recently IPOed high growth tech companies.

NDAQ and ICE (and TWLO and SNOW for that matter) make their money primarily on backend b2b services, while COIN makes their money both on backend b2b services AND on direct to consumer products with 53million current users. NDAQ and ICE have no similar business that I am aware of. COIN is more like NDAQ + Fidelity with double the users.",pinnr,1,/r/investing/comments/mr2m8u/coinbase_deep_dive_diligence_part_1_of_2/gulqxw5/,0.03,0.897,0.073,0.4927
48,NDAQ," I making comparisons relative to recently IPOed high growth tech companies.

NDAQ and ICE (and TWLO and SNOW for that matter) make their money primarily on backend b2b services, while COIN makes their money both on backend b2b services AND on direct to consumer products with 53million current users. NDAQ and ICE have no similar business that I am aware of. COIN is more like NDAQ + Fidelity with double the users.",pinnr,1,/r/investing/comments/mr2m8u/coinbase_deep_dive_diligence_part_1_of_2/gulqxw5/,0.03,0.897,0.073,0.4927
49,SNOW," I making comparisons relative to recently IPOed high growth tech companies.

NDAQ and ICE (and TWLO and SNOW for that matter) make their money primarily on backend b2b services, while COIN makes their money both on backend b2b services AND on direct to consumer products with 53million current users. NDAQ and ICE have no similar business that I am aware of. COIN is more like NDAQ + Fidelity with double the users.",pinnr,1,/r/investing/comments/mr2m8u/coinbase_deep_dive_diligence_part_1_of_2/gulqxw5/,0.03,0.897,0.073,0.4927
50,TWLO," I making comparisons relative to recently IPOed high growth tech companies.

NDAQ and ICE (and TWLO and SNOW for that matter) make their money primarily on backend b2b services, while COIN makes their money both on backend b2b services AND on direct to consumer products with 53million current users. NDAQ and ICE have no similar business that I am aware of. COIN is more like NDAQ + Fidelity with double the users.",pinnr,1,/r/investing/comments/mr2m8u/coinbase_deep_dive_diligence_part_1_of_2/gulqxw5/,0.03,0.897,0.073,0.4927
51,IRS," >I think your question betrays a certain naivety about the nature of surveillance in the world, how foreign govs/companies can be compelled by the US government to open the books, and maybe the tax code too. The IRS already has pretty sophisticated chain analytics. All trades, even to stablecoins, are taxable events.

There's nothing naive about questioning the IRS' ability to track crypto. As it stands, they can do very little in that area. It's very easy for you to say ""they are sophisticated and can track it."" But it is the very nature of crypto to be discrete, they are built that way. Again, the mechanics behind tracking funds moving across more secured crypto(s) are not as easy as it sounds. The IRS isn't just fighting foreign exchanges to get access to get data, they are fighting the cryptos/blockchains themselves.

>If you are ok never spending any of your gains in a western country or for products that would be shipped to one, then you can make that sacrifice I suppose. Whenever you try to repatriate the funds, you're going to have to come up with a tax basis too.

What if people slowly move the funds to minimize taxes by staying under a certain tax bracket?

edit to add a quote from the IRS commissioner yesterday: ""In testimony before the Senate Finance Committee, Rettig said Tuesday the U.S. fails to collect as much as $1 trillion in taxes owed each year in part due to the explosion in cryptocurrencies, **which are difficult for the agency to track and tax**.""",_aware,1,/r/investing/comments/mr2m8u/coinbase_deep_dive_diligence_part_1_of_2/gulo6cp/,0.033,0.834,0.134,0.9706
52,UI," Anything to back this up? Just because someone is large and established does not mean they don't have the talent. Fidelity has a strong UI, depth of product, and financials to back them up. Robinhood has a simple UI which people love but can't always facilitate trades and traders are running away from them after their outages and limitations over the last year.",shooterlax01,4,/r/investing/comments/mr2m8u/coinbase_deep_dive_diligence_part_1_of_2/guldlp1/,0.026,0.9,0.074,0.4738
53,REAL, Robinhood doesn’t even give you REAL CRYPTO. How do people think RH is an actual competitor lol. Also there are 1000% fees baked into the orders that RH fills for you in crypto the same way it happens with stocks.,mj9806,1,/r/investing/comments/mr2m8u/coinbase_deep_dive_diligence_part_1_of_2/gull45j/,0.0,0.933,0.067,0.4215
54,RH, Robinhood doesn’t even give you REAL CRYPTO. How do people think RH is an actual competitor lol. Also there are 1000% fees baked into the orders that RH fills for you in crypto the same way it happens with stocks.,mj9806,1,/r/investing/comments/mr2m8u/coinbase_deep_dive_diligence_part_1_of_2/gull45j/,0.0,0.933,0.067,0.4215
55,IRS," What is being priced in Bitcoin? Easy, the entire crypto market. Every single altcoin trades on a BTC pair. Everyone always look at the BTC/alt ratio. If it goes down over time (and let's be honest it does 99% of the time for 99% of alts) you would have been better of just holding Bitcoin. As for the fees and medium of exchange, lightning is here and works (yes, just look at Strike, Jack Maller's app). I'll give it to you for the IRS rules, but that's not Bitcoin's fault. 

I get that you can build anything on Ethereum, that's great. But the foundation everything is being built on is so fragile (I haven't checked in details yet but it seems there's an issue with the Berlin upgrade right now as I'm writing this, for example). It's also massively centralized with only a handful full nodes but that's another story. 

But anyways, I don't think anything is remotely close to disrupt Bitcoin. Ethereum can still live on the side it's fine, again competing in a different playing field.",toSaturnAndBeyond,2,/r/investing/comments/mr2m8u/coinbase_deep_dive_diligence_part_1_of_2/gulr8lq/,0.007,0.891,0.103,0.9496
56,NDAQ, You can’t just assume these things. That’s speculation not investing. That’s like me saying that you can’t value NDAQ as an exchange because they’re a tech company.,bossOnothin,4,/r/investing/comments/mr2m8u/coinbase_deep_dive_diligence_part_1_of_2/gul8kr3/,0.074,0.842,0.084,0.0747
57,UI," Just want to say that as someone who is forced to use Fidelity for my 401k I think their UI sucks ass and if I had a choice I would've dropped them long ago. It's confusing, buggy, and I can rarely figure out how to do what I actually want to do without way more time investment than is reasonable. That said, I know that the business as a whole is solid, their UI just makes me want to pull my hair out.",TheMaximumUnicorn,2,/r/investing/comments/mr2m8u/coinbase_deep_dive_diligence_part_1_of_2/gulgibo/,0.131,0.803,0.066,-0.8126
58,UI," There was a top tier bank investment banker in a Bitcoin Clubhouse room last night asking for tips to get her colleagues to understand the value of crypto. Most of them are still in eye rolling stage. 

The space is moving so fast. By the time legacy brokerages are trading a few cryptos Coinbase is going to be wrapping defi protocols seamlessly into their UI, half of which their venture arm vetted and seeded, with the best insurance offerings because they understand the technology the best, and probably doing the back end custody and liquidity for those banks, etc. Their institutional support people will be 100x more knowledgeable, and have access to 100x deeper liquidity. 

Banks are going to jump in but they're laughably behind. Fidelity is the only one with some conservative institutional offerings. Others are on Clubhouse asking for help.

The market isn't static. Like Amazon they're going to create new sectors and they're best positioned to do it.

Clubhouse is a treasure trove right now. Folks from Fidelity, Galaxy, Kraken, core devs, VC firms like a16z, talking about crypto and the future almost every day.",notapersonaltrainer,1,/r/investing/comments/mr2m8u/coinbase_deep_dive_diligence_part_1_of_2/gulx1f3/,0.022,0.828,0.15,0.9765
59,VC," There was a top tier bank investment banker in a Bitcoin Clubhouse room last night asking for tips to get her colleagues to understand the value of crypto. Most of them are still in eye rolling stage. 

The space is moving so fast. By the time legacy brokerages are trading a few cryptos Coinbase is going to be wrapping defi protocols seamlessly into their UI, half of which their venture arm vetted and seeded, with the best insurance offerings because they understand the technology the best, and probably doing the back end custody and liquidity for those banks, etc. Their institutional support people will be 100x more knowledgeable, and have access to 100x deeper liquidity. 

Banks are going to jump in but they're laughably behind. Fidelity is the only one with some conservative institutional offerings. Others are on Clubhouse asking for help.

The market isn't static. Like Amazon they're going to create new sectors and they're best positioned to do it.

Clubhouse is a treasure trove right now. Folks from Fidelity, Galaxy, Kraken, core devs, VC firms like a16z, talking about crypto and the future almost every day.",notapersonaltrainer,1,/r/investing/comments/mr2m8u/coinbase_deep_dive_diligence_part_1_of_2/gulx1f3/,0.022,0.828,0.15,0.9765
60,NDAQ," NDAQ is a legacy company that does not wish to expand beyond their market. Newcomers are here to take profit where it exist. Just look at how many tech companies are coming into traditional finance. Coinbase isn't the first nor will the be the last and if coinbase does not do it they will be overtaken by others.

I might be wrong about coinbase but honestly it's not hard to see the trends in the industry currently.",Coz131,1,/r/investing/comments/mr2m8u/coinbase_deep_dive_diligence_part_1_of_2/gulrg53/,0.063,0.846,0.091,0.4997
61,ALL," I do get your point but I'm only giving you my own perspective on things as I see it as a Gen X..... Imagine how later generations view it who are piling into crypto with no thought at all for traditional stocks! 

The point I'm making is times and investing IS changing before our very eyes.... if you see it as only high risk, that is your right as well. After all its YOUR capital you are deploying, so its your choice where you put it! 

As for alternative income streams from crypto investments, of course there is. I can stake and receive an on going return with some projects and that return often FAR exceeds any dividend from traditional stocks. 

Yes there is high risk in crypto but like I said because its such an emerging space, as long as you pick good projects, good teams behind them and most importantly projects with real world applications, then be prepared to hold through any major downturns.... chances are good you will be profitable in the long run regardless of market manipulation! Not always but on the whole. 2018 I got hit hard in crypto and took a 75% loss on my initial capital invested. Instead of selling and realising the loss, I just held until 2021. As of last night I'm sitting at 625% increase on that initial investment and I don't have a single cent in Bitcoin. 

People have been saying since bitcoin first started it was a ""bubble"" (I was even 1 of those people!). Thing is, once I actually started looking into the space and researching projects, the value becomes apparent! There are projects that are fundamentally changing how we will do things in the future because of what they are delivering to the marketplace! It really is no different then I'm sure you sit down and assess traditional stocks and companies. To be honest, that's the way I view crypto tokens/coins as well. Im not just buying some coin in the hope it magically goes up in value, I buy it because I want exposure to the ""company"" and the project that it represents. Its a added bonus that it can also be used as a form of payment! 

I see the crypto space as very similar to the dot com period. EVERYONE wanted a piece of this new internet thing and if you were a company that claimed it was ""online"", chances are it got CRAZY valuations! 
Then we had the clean out that had to come (the bubble burst) and all the junk got cleaned out..... but what grew out of that was some of the BIGGEST companies in the world with truly staggering valuations! 

That's what I see happening long term with crypto as well. There will be projects that fundamentally change the way the world works, how money works, how commerce and trade works..... and those valuations will make Amazon, Google and the like look like they have training wheels on.  

There are a HEAP of empty coins that are just straight up scams..... I'm sure the same thing exists or used to exist in penny stocks? But there are still good penny stocks that grow to become major companies and have real value. Its no different in the crypto space! 

To my way of thinking, why would ANYONE invest in traditional stocks any more when the returns are so limited plus the deck is stacked against you by institutional market participants who have access to more information and somehow ""legally"" manipulate prices at will for their own gain at retails loss...... all that risk for say 4% dividend and whatever upside your lucky enough that they let you have.

I see traditional stocks as the nuclear option at this stage because of the blatant manipulation and a regulation framework that protects the institutional participants and their manipulation but will turn around and hold retail investors accountable! 

Ever since 2008 I've lost ALL trust in the traditional system. REAL inflation is sky rocketing, debt is increasing and the same actors are once again betting big knowing that when it all blows up, the government will step in and socialise their losses once again! 

Capitalism is about living and dyeing by the choices YOU make! By creating this concept of to big to fail, we have created a system that encourages stagnation! Out of death, innovative, agile new businesses should grow...... instead what we have is doubling down each time on a failed system that will eventually implode under its own debt load!
The current system is addicted to ever increasing DEBT! I don't believe that cycle can be broken now, its been doubled down on to many times to back out now. 

I see the crypto space AS the innovation that's needed to break away from the failed system, a generational ""reset"" so to speak. Is it going to get messy and a giant bubble pops along the way....... 100%! I actually think we will experience major corrections every few years that traditional investors would view as bubbles popping and market crashes if it happened in the stock market but in crypto it will just be a correction. But when the real bubble busts in crypto, I think its going to be something else all together! And then all that capital will funnel into the projects of substance!

That's just my opinion though but I know that opinion is felt more in each younger generation. Younger generations embrace crypto at a much higher rate. They are a lot more comfortable with the tech and the concepts being reached for and its just a more natural direction for them to gravitate to. 

I'm just relating my own perspective and the perspective that I hear repeated by younger generations. I'm not saying I am right or that anyone else has to listen to it.... but if enough people all have the same perspective, it doesn't take long to see that change can happen and a new reality exists. 

Only time will show if its incorrect...... or correct.",Still_Lobster_8428,-4,/r/investing/comments/mr2m8u/coinbase_deep_dive_diligence_part_1_of_2/gulbgvf/,0.076,0.796,0.129,0.9956
