,ticker,comment,username,score,permalink,neg,neu,pos,compound
131,ASRT," Lots of picks will get 10-15% to recover from last week. Personally, I believe in CTRM and ASRT.",QuantopiaNL,1,/r/pennystocks/comments/lzyjvc/a_few_picks_that_i_think_will_get_1015_this_week/gq55aml/,0.0,1.0,0.0,0.0
132,CTRM," Lots of picks will get 10-15% to recover from last week. Personally, I believe in CTRM and ASRT.",QuantopiaNL,1,/r/pennystocks/comments/lzyjvc/a_few_picks_that_i_think_will_get_1015_this_week/gq55aml/,0.0,1.0,0.0,0.0
133,WATT, WATT looks good on a stock forecast for 12 months. High of 7 low of 6.,Mysterious-Carry6233,1,/r/pennystocks/comments/lzyjvc/a_few_picks_that_i_think_will_get_1015_this_week/gq4tnsb/,0.124,0.706,0.171,0.2023
134,DD," No DD, it’s down 20% from last week and 34% for the month, like many Penny stocks, so I have the feeling that we get a 10-15% rebound this week across the board for most of the solid ones.",Mysterious-Carry6233,1,/r/pennystocks/comments/lzyjvc/a_few_picks_that_i_think_will_get_1015_this_week/gq4y7fd/,0.053,0.799,0.148,0.4455
135,RWLK, KAVL is great too + RWLK,NPRjunkieDC,1,/r/pennystocks/comments/lzyjvc/a_few_picks_that_i_think_will_get_1015_this_week/gq54jyc/,0.0,0.494,0.506,0.6249
136,DD, I tried ordering a basketball sized tennis ball for my dog... it was regular size and the chemical smell from it was so bad. That’s my DD.,gnarlyburnt,7,/r/pennystocks/comments/lzxp6x/anyone_buying_wish_next_week_monday_070321/gq4ngje/,0.158,0.842,0.0,-0.6696
137,GF, I feel you. I once ordered leather pants with a zipper on the ass for my ex GF. It looked pretty good irl aswell.,EDoro,5,/r/pennystocks/comments/lzxp6x/anyone_buying_wish_next_week_monday_070321/gq4nptc/,0.127,0.652,0.221,0.3818
138,DD," Recognise that penny stocks are inherently volitile and small changes in price can have big percentage changes to your portfolio. Trade with a plan with buy in and exit strategies (for both gain and losses). Research before buy, don't just accept a DD at face value. Use charts, trend lines and indicators to guide your decisions, read guides or books if you don't know how and there are decent free charting tools out there if your broker sucks. Keep your charts updated as well as your view point on the stock. Don't trade emotionally, don't chase losses, don't marry your position, do stick to your strategy. Use only money that you can afford and try enjoy the process instead of hinging your life dreams on the outcome.",apeloco,1,/r/pennystocks/comments/lzg4h9/beginners_advice/gq36rdz/,0.033,0.828,0.138,0.9284
139,TV," I'm not a financial advisor & this isn't financial advice, but my wife's boyfriend played a lawyer on TV. He said legalese always makes you sound legit.",countrypride,3,/r/pennystocks/comments/lzyobs/please_enough_of_the_not_a_financial_advisor/gq4yjvk/,0.0,0.881,0.119,0.4767
140,DD," If you are just talking about stuff, you don’t need to say it.  If you say specifics like “buy this stock” then even registered financial advisors will say “not investment advice” unless they are actually in an agreement with you and know the full scope of your situation.  You can write up a 10 page DD and at the end say “I’m buying this stock” and be in the clear, but if you say “you should by this stock,” then you should also CYA.

At the same time, you can certainly sue me, i guess, but first you have to know who i am.  This is a pretty anonymous place.  As long as you aren’t giving it personal details, nobody is gonna be able to sue you anyways.",FlatBrokeEconomist,1,/r/pennystocks/comments/lzyobs/please_enough_of_the_not_a_financial_advisor/gq4xdbe/,0.0,0.88,0.12,0.9343
141,NYC," Man, if I could get Au Pied du Cochon Cabane a Sucre delivered to NYC ...",lambretta76,1,/r/pennystocks/comments/lzwwi8/this_may_sound_stupid_but_are_there_any_sugar/gq4lxr5/,0.0,1.0,0.0,0.0
142,DD," Fort is sketchy. If you do your DD they float in and out for crypto to fund other business ventures. They aren’t dedicated to mining and they have been out of the game for a while and just recently speculative coming back into it. 

Their site hasn’t been updated since 2019. Their office is an apartment in Vancouver. 

The only reason it increased over the past month is because of the absurd volume it received with pumping crypto the one week in February. It had zero catalyst but people seen a crypto business under a dollar and caused it to go wild. 

Take it as you will. But I’m staying away. Only Canadian crypto worthwhile is HUT8, BitFarms, HIVE and DMGI.",kellendontcare,5,/r/pennystocks/comments/lzsrf6/high_voltile_penny_stocks_fort/gq3sm8y/,0.0,0.936,0.064,0.705
143,DD, Worst DD ever with no explanation of a catalyst. Btc goes up stock goes up? Why? Because they have something to do with btc? Get the fuck out of here ahahhaha.,AIwaysLearning,2,/r/pennystocks/comments/lzsrf6/high_voltile_penny_stocks_fort/gq3teic/,0.277,0.723,0.0,-0.8844
144,DD, Exactly. Delete your post. It sucks. Learn how to do real DD,AIwaysLearning,4,/r/pennystocks/comments/lzsrf6/high_voltile_penny_stocks_fort/gq3urrd/,0.185,0.815,0.0,-0.3612
