,ticker,comment,username,score,permalink,neg,neu,pos,compound
0,DD," Good DD, but the user growth really isn't that impressive. I read the whole S1 too. That's just how many people total have an account, so of course it will grow somewhat linearly.

The monthly transacting users (read: active users) count has barely increased since the peak in 2018.

I wouldn't buy Coinbase above $125 or so a share. I think fees will decrease, the crypto market is overvalued, they have no moat. I'm a happy Coinbase Pro user for what it's worth.",FollowMe22,47,/r/investing/comments/mr2m8u/coinbase_deep_dive_diligence_part_1_of_2/gukdvll/,0.069,0.704,0.228,0.9389
1,COIN," FWIW, ARK bought 750k shares of COIN.",bigturbine,17,/r/investing/comments/mr2m8u/coinbase_deep_dive_diligence_part_1_of_2/guk8ce6/,0.0,0.732,0.268,0.296
2,COIN, Why would someone buy COIN instead of actual BTC? So much of COIN's quarter to quarter success relies on crypto markets which revolve around BTC. There are many more risks to holding COIN (mainly the competitive pressures) that BTC doesn't face.,Savik519,48,/r/investing/comments/mr2m8u/coinbase_deep_dive_diligence_part_1_of_2/gujvt34/,0.052,0.83,0.118,0.4601
3,COIN," SNOW and TWLO are sitting around $65b marketcap, which maybe completely ridiculous, but Coinbase should clearly be worth more in comparison since it has 10x the revenue and more growth potential. ZOOM is at $97b with less quarterly revenue and SNAP is at $93b also with less quarterly revenue. At least comparing to other recent tech IPOs I'd expect COIN to be worth around $80-100b.",pinnr,16,/r/investing/comments/mr2m8u/coinbase_deep_dive_diligence_part_1_of_2/guk6gzv/,0.026,0.811,0.163,0.8805
4,SNAP," SNOW and TWLO are sitting around $65b marketcap, which maybe completely ridiculous, but Coinbase should clearly be worth more in comparison since it has 10x the revenue and more growth potential. ZOOM is at $97b with less quarterly revenue and SNAP is at $93b also with less quarterly revenue. At least comparing to other recent tech IPOs I'd expect COIN to be worth around $80-100b.",pinnr,16,/r/investing/comments/mr2m8u/coinbase_deep_dive_diligence_part_1_of_2/guk6gzv/,0.026,0.811,0.163,0.8805
5,SNOW," SNOW and TWLO are sitting around $65b marketcap, which maybe completely ridiculous, but Coinbase should clearly be worth more in comparison since it has 10x the revenue and more growth potential. ZOOM is at $97b with less quarterly revenue and SNAP is at $93b also with less quarterly revenue. At least comparing to other recent tech IPOs I'd expect COIN to be worth around $80-100b.",pinnr,16,/r/investing/comments/mr2m8u/coinbase_deep_dive_diligence_part_1_of_2/guk6gzv/,0.026,0.811,0.163,0.8805
6,TWLO," SNOW and TWLO are sitting around $65b marketcap, which maybe completely ridiculous, but Coinbase should clearly be worth more in comparison since it has 10x the revenue and more growth potential. ZOOM is at $97b with less quarterly revenue and SNAP is at $93b also with less quarterly revenue. At least comparing to other recent tech IPOs I'd expect COIN to be worth around $80-100b.",pinnr,16,/r/investing/comments/mr2m8u/coinbase_deep_dive_diligence_part_1_of_2/guk6gzv/,0.026,0.811,0.163,0.8805
7,DD, This is amazing DD thank you take a silver!,SanoKei,3,/r/investing/comments/mr2m8u/coinbase_deep_dive_diligence_part_1_of_2/gukeomo/,0.0,0.476,0.524,0.7644
8,DD, I don't fully agree with your valuation but it's nice to see level headed DD around Coinbase.,Ap3X_GunT3R,5,/r/investing/comments/mr2m8u/coinbase_deep_dive_diligence_part_1_of_2/guk9uxt/,0.086,0.723,0.191,0.4654
9,IRS," As someone who dabbles in crypto and use multiple exchanges, as well as majoring in a relevant field(comp sci), I personally wouldn't recommend buying into coinbase until it falls below $100. Here are my reasons:

1. The only thing that sets coinbase apart from its competition, for me as a NYer at least, is that they are the only US based exchange that lets me have an account and cash out into fiat. However, that is as far as coinbase goes when it comes to trading. There are many other international exchanges that charge lower fees, have more features/options, and allow unregulated/untaxed transactions like cryptos are intended for. This advantage only applies to 3 out of the 50 states in the US. That means other exchanges, OGs like binance and kucoin as well as newcomers, are competing in every part of the world outside of these 3 states.
2. Inevitable regulations will be here any moment. Let's not delude ourselves into thinking that the federal and state governments won't start pushing new laws to regulate and tax the crypto market. Coinbase, being on the front page of it all, will undoubtedly take the brunt of the impact since it is based in the US. With regulations/taxes, coinbase will transform into a more tranditional stock broker for crypto. They will report your gains/losses to the IRS, track your public keys and transactions, etc. This is everything crypto is meant to prevent; so it won't look good to crypto owners, who have so many exchanges to choose from.
3. Coinbase was recently busted for illegal trading practices.
4. Many people look at coinbase as the face of crypto, but it is not the biggest by any means. Feel free to go to coinmarketcap and sort exchanges by volume. The fact that you need to scroll down a bunch to find coinbase should tell you all you need to know.

Obviously none of this is financial advice. But I don't see how anyone, with any sort of crypto experience, can believe that coinbase is truly worth more than 40B, nevermind 100B. If you want to gamble with the inflated valuations, that's up to you.",_aware,9,/r/investing/comments/mr2m8u/coinbase_deep_dive_diligence_part_1_of_2/gukmwxb/,0.019,0.919,0.062,0.9131
10,COIN, I think COIN is overvalued. My price tag for now is $200-$250,Rizhaya,-1,/r/investing/comments/mr2m8u/coinbase_deep_dive_diligence_part_1_of_2/gukmps0/,0.0,1.0,0.0,0.0
11,DD, Thanks for the DD. I bought commons today.,CollegeInsider2000,1,/r/investing/comments/mr2m8u/coinbase_deep_dive_diligence_part_1_of_2/gukes1y/,0.0,0.674,0.326,0.4404
12,COIN," COIN is the main entrance for people getting in first contact with crypto. And „main stream“ applications of crypto are pushing into the market, just like Sorare and others.
Coinbase is the first place you’re going if you just want to buy a football player on Sorare.
So I think COIN is a solid investment for a more modest price.",Motschekiebchen,1,/r/investing/comments/mr2m8u/coinbase_deep_dive_diligence_part_1_of_2/gukwd1d/,0.0,0.908,0.092,0.5267
13,COIN," Coinbase is overvalued. It’s gonna face some serious competition in the next 10 years and will be forced to lower fees etc. 

Having used it myself for the first couple months i was in crypto, it worked fine but locked me out of my account requesting ID verification and when i verified it nothing happened. 

COIN should be trading at maximum a P/S of 10. Its revenue will decrease when the crypto bear market comes.",hatetheproject,1,/r/investing/comments/mr2m8u/coinbase_deep_dive_diligence_part_1_of_2/gukzwdq/,0.064,0.917,0.019,-0.3291
14,ID," Coinbase is overvalued. It’s gonna face some serious competition in the next 10 years and will be forced to lower fees etc. 

Having used it myself for the first couple months i was in crypto, it worked fine but locked me out of my account requesting ID verification and when i verified it nothing happened. 

COIN should be trading at maximum a P/S of 10. Its revenue will decrease when the crypto bear market comes.",hatetheproject,1,/r/investing/comments/mr2m8u/coinbase_deep_dive_diligence_part_1_of_2/gukzwdq/,0.064,0.917,0.019,-0.3291
15,COIN," Since I'm not American, I must ask: why aren't other exchanges available in the US? Is it because they run their own tokens (BNB, CRO) and that may be seen as something akin to printing currency?

The fact that I'm not American and not exposed to American regulators is the reason why I'm not buying COIN (although I tried to get some at a low price yesterday to ride the hype). I use Binance, which is much larger, and [Crypto.com](https://Crypto.com), which is growing much faster and [expected to surpass Coinbase in the next 18-24 months](https://twitter.com/cryptocom/status/1382529246237581313). Unless I'm too oblivious about the US market, their competition in the States is inevitable and they offer a more consumer-friendly service, imo, especially [crypto.com](https://crypto.com) (easy to use app, card with a generous cashback, fast consumer service).",fanboy_killer,1,/r/investing/comments/mr2m8u/coinbase_deep_dive_diligence_part_1_of_2/gul47hb/,0.016,0.934,0.05,0.5396
16,DD," Would be nice if real DD was as effective as it used to be. Today it’s more hype and trends. 

I guess for loooong holds its a good way to buy. Just have to hope your out is at a time when the market isn’t going mad",Enackers,1,/r/investing/comments/mr2m8u/coinbase_deep_dive_diligence_part_1_of_2/gulcy59/,0.059,0.724,0.217,0.8176
17,COIN, COIN is just a hype play at these valuations.,abacabbmk,1,/r/investing/comments/mr2m8u/coinbase_deep_dive_diligence_part_1_of_2/guldz1b/,0.0,0.745,0.255,0.34
18,COIN," Great wrote up. I do find it laughable that “valuation” is even in the conversation these days. We’ve seen a car company with minuscule revenue/earnings become one the highest market cap companies in the world. We’ve seen nft’s which is basically a hyperlink to a png sell for millions, we’ve seen GME, and so many other examples of why much discussed here doesn’t matter.

Narrative and price battle is what matters. So the question 1) will the yolo boys take COIN to the moon once options start trading by buying otm calls and making MM load up on shares; and 2) once this happens will the shorts come in and create a price battle?

Current narrative suggest both these things will happen, so there is a lot of asymmetry to trading COIN.",Crazy150,1,/r/investing/comments/mr2m8u/coinbase_deep_dive_diligence_part_1_of_2/guleg5q/,0.038,0.86,0.102,0.6908
19,GME," Great wrote up. I do find it laughable that “valuation” is even in the conversation these days. We’ve seen a car company with minuscule revenue/earnings become one the highest market cap companies in the world. We’ve seen nft’s which is basically a hyperlink to a png sell for millions, we’ve seen GME, and so many other examples of why much discussed here doesn’t matter.

Narrative and price battle is what matters. So the question 1) will the yolo boys take COIN to the moon once options start trading by buying otm calls and making MM load up on shares; and 2) once this happens will the shorts come in and create a price battle?

Current narrative suggest both these things will happen, so there is a lot of asymmetry to trading COIN.",Crazy150,1,/r/investing/comments/mr2m8u/coinbase_deep_dive_diligence_part_1_of_2/guleg5q/,0.038,0.86,0.102,0.6908
20,COIN," For me, it's a pass for 3 reasons:

1) Even in a world of crazy valuations, this is a crazy starting valuation.  As someone pointed out down below, it's trading at the same market cap as Goldman Sachs, who made $17B in profit last year compared to COIN's $600M.  Now, it very well may be worth its current valuation, but what room is there for upside over the next couple of years?

2) A crypto bear market -- which we know is inevitably coming -- will probably decrease revenues for COIN more than it would for a traditional exchange because of lower volumes.  A cryto bear market isn't going to maintain the same volumes you see in traditional stocks -- instead of shorting, etc., I think you'll see a lot of people just sit on the sidelines.

3) Increased coming competition from other exchanges, plus Uniswap.  The more popular crypto becomes -- which is how COIN capitalizes on its first mover advantage -- the more that advantage goes away as new entrants come into the market place.

I could see myself getting in if the price were ~$150 or so, but not up at ~$350.",throwmeawaypoopy,1,/r/investing/comments/mr2m8u/coinbase_deep_dive_diligence_part_1_of_2/gulqinb/,0.031,0.883,0.085,0.8653
21,HUGE," Yeah but once they build it and Coinbase's competitors poach talent from them, the secrets are out.

Competition is HUGE and they must have similar infrastructure. If they don't yet, they will. They have pretty much the same business model as other brokers for the stock market, and we know how many players are in that game.

But like you said, the success of this company is also tied to the success of BTC in a way. 

So many unknowns and not enough history to predict future success and sustainability - no one truly knows what that looks like, so much of this becomes a gamble.",notwiththatattidude,0,/r/investing/comments/mr2m8u/coinbase_deep_dive_diligence_part_1_of_2/gulx2lc/,0.021,0.687,0.292,0.9901
22,ETH," >(mainly the competitive pressures) that BTC doesn't face.

Oh you must have not heard of ""The Flippening"" 

ETH will lead the alt coin army and DETHRONE btc!

Shout out to all the ETH Supremacist",LucidInsomnia,25,/r/investing/comments/mr2m8u/coinbase_deep_dive_diligence_part_1_of_2/guka1c0/,0.0,0.902,0.098,0.3595
23,COIN," SNOW, ZOOM and TWLO would not be COIN public comps",Lagcol,4,/r/investing/comments/mr2m8u/coinbase_deep_dive_diligence_part_1_of_2/gukqfts/,0.0,1.0,0.0,0.0
24,SNOW," SNOW, ZOOM and TWLO would not be COIN public comps",Lagcol,4,/r/investing/comments/mr2m8u/coinbase_deep_dive_diligence_part_1_of_2/gukqfts/,0.0,1.0,0.0,0.0
25,TWLO," SNOW, ZOOM and TWLO would not be COIN public comps",Lagcol,4,/r/investing/comments/mr2m8u/coinbase_deep_dive_diligence_part_1_of_2/gukqfts/,0.0,1.0,0.0,0.0
26,UI," >I see banks joining the party very soon. This game is going to change soon.

There was a top tier bank investment banker in a Bitcoin Clubhouse room tonight asking for tips to get her colleagues to take another look at crypto.

The space is moving so fast. By the time legacy brokerages are trading a few cryptos Coinbase is going to be wrapping defi protocols seamlessly into their UI, half of which their venture arm vetted and seeded, with the best insurance offerings because they understand the technology the best, and probably doing the back end custody and liquidity for those banks, etc. 

Banks are going to jump in but they're laughably behind other than Fidelity. Some are on Clubhouse asking for help. 

The market isn't static. Like Amazon they're going to create new sectors and they're best positioned to do it.

Clubhouse is a treasure trove right now. Folks from Fidelity, Galaxy, Kraken, core devs, VC firms like a16z, talking about crypto and the future almost every day.",notapersonaltrainer,3,/r/investing/comments/mr2m8u/coinbase_deep_dive_diligence_part_1_of_2/gukrxnj/,0.024,0.82,0.156,0.9746
27,VC," >I see banks joining the party very soon. This game is going to change soon.

There was a top tier bank investment banker in a Bitcoin Clubhouse room tonight asking for tips to get her colleagues to take another look at crypto.

The space is moving so fast. By the time legacy brokerages are trading a few cryptos Coinbase is going to be wrapping defi protocols seamlessly into their UI, half of which their venture arm vetted and seeded, with the best insurance offerings because they understand the technology the best, and probably doing the back end custody and liquidity for those banks, etc. 

Banks are going to jump in but they're laughably behind other than Fidelity. Some are on Clubhouse asking for help. 

The market isn't static. Like Amazon they're going to create new sectors and they're best positioned to do it.

Clubhouse is a treasure trove right now. Folks from Fidelity, Galaxy, Kraken, core devs, VC firms like a16z, talking about crypto and the future almost every day.",notapersonaltrainer,3,/r/investing/comments/mr2m8u/coinbase_deep_dive_diligence_part_1_of_2/gukrxnj/,0.024,0.82,0.156,0.9746
28,VC," I buy anything they invest in that isn't listed yet. Those coins are almost guaranteed to list on Coinbase eventually and get a huge price bump. 

People don't understand yet that with digital assets there is no accredited investor firewall anymore. You can get into these vetted technologies alongside the VC funds a year before they're listed on cefi exchanges.",notapersonaltrainer,1,/r/investing/comments/mr2m8u/coinbase_deep_dive_diligence_part_1_of_2/gulw4vb/,0.037,0.897,0.066,0.2023
29,IMO," > Their main competition is from other crypto companies like Kraken and Binance

IMO the main competition in the long term will be coming from blockchain based solutions - decentralized exchanges, leverage instruments and derivatives.",mcgravier,7,/r/investing/comments/mr2m8u/coinbase_deep_dive_diligence_part_1_of_2/gukw3qv/,0.0,0.881,0.119,0.4939
30,COIN, But also PayPal and SQ don’t offer nearly as much as what COIN offers. COIN fees are also way less than SQ and Paypal. COIN is a way more immersive and in depth platform for crypto than SQ and PayPal with less fees and also appeals to institutions and businesses.,mj9806,9,/r/investing/comments/mr2m8u/coinbase_deep_dive_diligence_part_1_of_2/gukgx26/,0.0,1.0,0.0,0.0
31,SQ, But also PayPal and SQ don’t offer nearly as much as what COIN offers. COIN fees are also way less than SQ and Paypal. COIN is a way more immersive and in depth platform for crypto than SQ and PayPal with less fees and also appeals to institutions and businesses.,mj9806,9,/r/investing/comments/mr2m8u/coinbase_deep_dive_diligence_part_1_of_2/gukgx26/,0.0,1.0,0.0,0.0
32,COIN, Exactly! The metrics are very worldly with Tesla (teasing out # of delivered vehicles) whereas Coinbase has demonstrated other worldly metrics of exponential profits and user growth. COIN definitely has potential to levitate like Tesla did and that's why I bought a few thousand worth today at 350 and plan on buying a few grand more on Friday.,The_Folkhero,3,/r/investing/comments/mr2m8u/coinbase_deep_dive_diligence_part_1_of_2/gujv8jb/,0.0,0.751,0.249,0.9312
33,COIN," Maybe they will all drop, who knows, but that’s where I see COIN sitting relative to other tech stocks at today’s valuations.",pinnr,3,/r/investing/comments/mr2m8u/coinbase_deep_dive_diligence_part_1_of_2/gukduwb/,0.072,0.928,0.0,-0.1406
34,IRS," I'm not saying that I personally will. But I can't speak for others. 

Here's a quick question: how will the IRS track a person who swaps their investment into a stable coin, thereby cashing out without converting to fiat, and keeps all the gains on a reputable foreign exchange? If you know crypto, you know it's very hard or outright impossible. The IRS will only see the money that you move into a US-based exchange to convert to fiat, if you even need to go through one at all.",_aware,3,/r/investing/comments/mr2m8u/coinbase_deep_dive_diligence_part_1_of_2/guku2vk/,0.023,0.909,0.068,0.5941
35,ETH," Well Uniswap is the worse shit I ever used, imo Coinbase is overvalued af but UNI aint not real opponent for them. I recently bought some ERC20 altcoins and because of the high ETH transaction fee atm in combination with the UNI approach I paid 90$ transaction fee total.",Little_Bar2433,4,/r/investing/comments/mr2m8u/coinbase_deep_dive_diligence_part_1_of_2/gul8f49/,0.089,0.879,0.032,-0.4215
36,COIN, For retail investors Robinhood is much easier and completely fee free. I would think that's going to be a big competition and COIN fees are going to go down drastically.,pogosticx,5,/r/investing/comments/mr2m8u/coinbase_deep_dive_diligence_part_1_of_2/guklztl/,0.0,0.803,0.197,0.749
37,COIN," COIN is not a tech stock. It’s an exchange and should be compared to NDAQ and ICE, which are both valued much cheaper despite being much bigger.",bossOnothin,5,/r/investing/comments/mr2m8u/coinbase_deep_dive_diligence_part_1_of_2/gukpcfh/,0.0,0.896,0.104,0.4404
38,ICE," COIN is not a tech stock. It’s an exchange and should be compared to NDAQ and ICE, which are both valued much cheaper despite being much bigger.",bossOnothin,5,/r/investing/comments/mr2m8u/coinbase_deep_dive_diligence_part_1_of_2/gukpcfh/,0.0,0.896,0.104,0.4404
39,NDAQ," COIN is not a tech stock. It’s an exchange and should be compared to NDAQ and ICE, which are both valued much cheaper despite being much bigger.",bossOnothin,5,/r/investing/comments/mr2m8u/coinbase_deep_dive_diligence_part_1_of_2/gukpcfh/,0.0,0.896,0.104,0.4404
40,IRS," I think your question betrays a certain naivety about the nature of surveillance in the world, how foreign govs/companies can be compelled by the US government to open the books, and maybe the tax code too. The IRS already has pretty sophisticated chain analytics. All trades, even to stablecoins, are taxable events. 

If you are ok never spending any of your gains in a western country or for products that would be shipped to one, then you can make that sacrifice I suppose. Whenever you try to repatriate the funds, you're going to have to come up with a tax basis too.",FriendlyNeighborCEO,2,/r/investing/comments/mr2m8u/coinbase_deep_dive_diligence_part_1_of_2/gul08uz/,0.032,0.832,0.136,0.8481
41,CB," I mean, RobinHood has been selling crypto for a while now and it hasn’t even made a dent in CB revenue—even though everyone claimed RobinHood was the “coinbase killer” when they first started selling crypto. Also not being able to send or receive BTC makes RobinHood as a CB competitor kind of laughable",This_is_a_rubbery,21,/r/investing/comments/mr2m8u/coinbase_deep_dive_diligence_part_1_of_2/guknxrs/,0.022,0.978,0.0,-0.024
42,IRS," You can’t say that bitcoin is a reliable store of value right now. Maybe in the future, but it’s still too volatile and unpredictable at the current moment. Bitcoin failed as a medium of exchange because of high fees, long transaction times, and IRS tax laws. Bitcoin is definitively not a unit of account. What is being priced in bitcoin? Ethereum may not posses any of those properties either, but what’s great about platforms is that you can build anything on top of them. USDC could actually be used in the real world once Ethereum gets fees under control, and they will eventually. Any kind of crypto with any kind of monetary policy that you want can be built on top of Ethereum. That’s what makes Ethereum so valuable in my opinion. You need to think of Ethereum as a platform for other currencies and tokens and not as a currency itself. You will never be able to build anything on bitcoin to the extent that you can on Ethereum.",Michael12390,8,/r/investing/comments/mr2m8u/coinbase_deep_dive_diligence_part_1_of_2/gul9r66/,0.025,0.872,0.103,0.9222
