,ticker,comment,username,score,permalink,neg,neu,pos,compound
59,DNN," yeah my take was that im not long...im medium on DNN.  ill give it some time, hence the long expiry.  if it doesn t play out, now worries.  if it does, ill probably sell the contract vs buy the shares anyways.  im an options trader...i have very few shares unless they are dividend monsters...like fbgrx...other than that i like to use my money to leverage as much as i can...so for $910 i have 1500 dnn....and the extra $1000 i would have had to use to but the shares i can grab anything, like TC options which i grabbed yesterday...so i have TC and DNN for the price of same amount of shares of just DNN.  thats just the way i like to play the game. to each thier own and i hope we all make some scratch...",Win_Existing,2,/r/pennystocks/comments/m5ya5k/dnn_denison_mines_corp_undervalued_company_what/gr5j5zb/,0.039,0.776,0.186,0.9618
60,TC," yeah my take was that im not long...im medium on DNN.  ill give it some time, hence the long expiry.  if it doesn t play out, now worries.  if it does, ill probably sell the contract vs buy the shares anyways.  im an options trader...i have very few shares unless they are dividend monsters...like fbgrx...other than that i like to use my money to leverage as much as i can...so for $910 i have 1500 dnn....and the extra $1000 i would have had to use to but the shares i can grab anything, like TC options which i grabbed yesterday...so i have TC and DNN for the price of same amount of shares of just DNN.  thats just the way i like to play the game. to each thier own and i hope we all make some scratch...",Win_Existing,2,/r/pennystocks/comments/m5ya5k/dnn_denison_mines_corp_undervalued_company_what/gr5j5zb/,0.039,0.776,0.186,0.9618
61,DD," I own a few pumped penny stocks.  Kind of lessons learned but I'm still holding them as one day I can feel it, they're going to come alive.  No DD, just a feeling.  Kind of like, I don't have any other choice to hold.",I-Eat-Bacon,24,/r/pennystocks/comments/m5w6m5/penny_stock_pumper_caught_sec_obtains_emergency/gr33rlo/,0.061,0.758,0.182,0.6808
62,NOK," I just really like all my stocks ❤️

Edit: except NOK, fuck u",El-compita,1,/r/pennystocks/comments/m5w6m5/penny_stock_pumper_caught_sec_obtains_emergency/gr3doc8/,0.229,0.589,0.183,-0.1796
63,DD," Give eeenf a look, do your own DD but after seeing the number of share bought by insiders ???? Over the last couple of months, somethings definitely brewing. Oil stock took a tough hit today but it still gained, ftxp and amaz are looking like good buys now.",Alarmed-Orange-5963,-24,/r/pennystocks/comments/m5w6m5/penny_stock_pumper_caught_sec_obtains_emergency/gr2qglc/,0.029,0.65,0.321,0.9553
64,CHEK," I have a few like that, and several others that panned out like AABB, CHEK, SNSS,SEGI, GAXY, etc.  As long as you're not buying shit near all time highs eventually stuff is going to come around and make you some money.",Nulaak,6,/r/pennystocks/comments/m5w6m5/penny_stock_pumper_caught_sec_obtains_emergency/gr35ztn/,0.0,0.82,0.18,0.786
65,TTOO," It is. I commented the other day about busting someone pumping TTOO. His claimed option position was 10x higher than the actual option volume that day, which is the day he claimed to have bought them. I wish I woulda got his user name but he deleted his post as soon as I called him out on it.",u2020vw69,48,/r/pennystocks/comments/m5w6m5/penny_stock_pumper_caught_sec_obtains_emergency/gr2yna4/,0.0,0.966,0.034,0.2144
66,TV," You can have an opinion on a stock and be wrong. It's not illegal/wrong/unethical.

Jim Cramer does it daily on national TV.

What if AABB ends up a junk company? Does that make you guys liable in this thread? Could I file a complaint with the SEC on you guys? LOL",2hrs_a_Day,3,/r/pennystocks/comments/m5w6m5/penny_stock_pumper_caught_sec_obtains_emergency/gr3r8fg/,0.109,0.824,0.066,-0.3197
67,DD," There’s good intention, and there’s bad intention. As a reporter, or blogger, it is your duty to the public to do your DD, and make sure everything is correct, before making claims publicly. There was a DD that came out to counteract with his after the alleged false claims.",DreamingGurl88,2,/r/pennystocks/comments/m5w6m5/penny_stock_pumper_caught_sec_obtains_emergency/gr5h1xw/,0.066,0.835,0.099,0.1779
68,DD," Been in High Tide for a while now, so I’m diggin this DD",saintbri27,16,/r/pennystocks/comments/m68w93/i_analyze_mentions_and_sentiment_of_stocks_across/gr4r9mq/,0.0,1.0,0.0,0.0
69,DD," Yet another great DD on HITIF; however, this stock has been discussed ad nauseam here and the stock itself is really struggling getting above 0.7. I want the best for that company but it really needs even more volume to help it break out.",luclinEQ,10,/r/pennystocks/comments/m68w93/i_analyze_mentions_and_sentiment_of_stocks_across/gr50qdu/,0.041,0.756,0.204,0.8019
70,DD, Do your own DD though! Buy with conviction or don't buy at all :),nobjos,16,/r/pennystocks/comments/m68w93/i_analyze_mentions_and_sentiment_of_stocks_across/gr4po7o/,0.0,0.798,0.202,0.5093
71,DD, It’s DDception DD on how much DD there has been lmao,-_Jester_,2,/r/pennystocks/comments/m68w93/i_analyze_mentions_and_sentiment_of_stocks_across/gr59x4w/,0.0,0.719,0.281,0.5994
72,DD," > 

Why ? nothing worse than leaving a unrelated ticker in the comments with no DD",ButtNuster,21,/r/pennystocks/comments/m68w93/i_analyze_mentions_and_sentiment_of_stocks_across/gr4bhfx/,0.14,0.698,0.162,0.091
73,DD," Love to see this kind of sentiment in here! Conviction is needed to weather market dips and hold for the long term. 

And thanks for including risks in the DD.",orangesine,3,/r/pennystocks/comments/m68w93/i_analyze_mentions_and_sentiment_of_stocks_across/gr5vwss/,0.058,0.74,0.203,0.7424
74,TRIP," The Canadian symbol TRIP is such a good name for them. I've been holding these guys since 7 cents over a year ago, so really excited to see them keep growing.",RoastMasterShawn,13,/r/pennystocks/comments/m68yx9/red_light_holland_truff_receives_health_canada/gr4jv66/,0.0,0.768,0.232,0.763
75,DD," The italian translation for Scam is Truffa, which is too close to the ticker of this company... my DD ends here

(Shh, Ehy... it's a joke)",albertodona9,-6,/r/pennystocks/comments/m68yx9/red_light_holland_truff_receives_health_canada/gr4i4km/,0.134,0.866,0.0,-0.5719
76,CMPS," Can't seem to get that either. The only one I've picked up so far is CMPS, which I found here as well.",OursIsTheFury,1,/r/pennystocks/comments/m68yx9/red_light_holland_truff_receives_health_canada/gr5a579/,0.0,0.905,0.095,0.2732
77,TRIP, I bought into TRIP and it has only gone down :( Doesnt matter as Im long on psychedelic stocks anyways and hold MMED and FTRP.,Ipsylos,8,/r/pennystocks/comments/m67q8k/why_truff_or_tripcn_is_in_a_league_of_its_own_dd/gr477xu/,0.153,0.847,0.0,-0.4541
78,RLH," Exactly why I doubled down this most recent dip, also after seeing MINE get so much of a pump, you can only imagine how well a more legit company like RLH at such a good pricepoint will look to new investors as they take notice of this sector",BuildingSuper,14,/r/pennystocks/comments/m67q8k/why_truff_or_tripcn_is_in_a_league_of_its_own_dd/gr45mcj/,0.0,0.841,0.159,0.7759
79,DOW," Am I the only one seeing the company is overvalued?

They have lost $5.06 for every $100 spent on asset(ROA).

Volatility of 14.85, which is 8.53 times more volatile than DOW. 

Listed with a strong sell rating.

Chance of distress high.",DapperSalamander,13,/r/pennystocks/comments/m67q8k/why_truff_or_tripcn_is_in_a_league_of_its_own_dd/gr4g3m1/,0.124,0.761,0.115,-0.1027
80,DD," Disclaimer: I do own the stock, but i will trow some thoughts out on this immense positive DD.  


First: The branding being the most important (RedBull used as example all the time).  
wel... I am sorry, but in my opinion they have to get a designer that is able to capture the culture. The logo is so cheap (old and new one). It doesn't communicate at all something a community can stand behind. I recognise this is a matter of taste, but i think if you want to be the redbull of psychedelics you better step up your game. I am just afraid that Todd's taste (or lack of it) it the issue here, so i am afraid we are stuck with this for the long run.  
But because of this i don't want to put so much weight on this aspect. I actually think most of their branding and cringe-meme attempts is super annoying.  


Second: The digital therapeutics case. Yes most psychedelic companies ar putting attention on this (Mindmed, Mydecine, RedLight) but i like to remind myself: this is for the veeeeeery long term, so i don't expect this to be the 'game changer’ in this year or the next.  


Third: Brazil.  
Yeah ok, first to export to Brazil, but i have the feeling this was 1 doctor that prescribed it to 1 client. So it will also take YEARS before this is of any value to the company.   
They focus a lot on the 'first one doing this, or that' but i would love to see a more detailed plan how to capitalise this.  


in other words, in for the long run, no short term profits at all.",Cumbia_Gandalf,2,/r/pennystocks/comments/m67q8k/why_truff_or_tripcn_is_in_a_league_of_its_own_dd/gr4p1h8/,0.044,0.798,0.158,0.9877
81,ZOM," Not exactly two new products as I read it, but the remaining two test platforms for Truforma. 3 of 5 are available at launch. If they launched March 30th, all 5 likely would have been available then. Still bullish on ZOM for sales news in the coming weeks/months.",Your_Product_Here,20,/r/pennystocks/comments/m68aoe/zom_has_2_more_products_coming_out_in_the_next/gr4ekph/,0.0,0.961,0.039,0.1901
82,ONE," THEY FUCKED US!

What do you mean? Early release, by selling ONE UNIT

DICK MOVE ZOM!!!!",napoelonDynaMighty,4,/r/pennystocks/comments/m68aoe/zom_has_2_more_products_coming_out_in_the_next/gr5o0yn/,0.425,0.575,0.0,-0.9069
83,ZOM," It’s not two new products, it’s the left over 2/5 tests for truforma. I don’t have hope it’ll do much for ZOM",warf3re,0,/r/pennystocks/comments/m68aoe/zom_has_2_more_products_coming_out_in_the_next/gr57vbr/,0.0,0.873,0.127,0.4404
84,ZOM," Interesting to see, posts have been so positive for ZOM over the last week or so but today's posters seem to tell a much different story. Had ZOM on my watch, glad I didn't buy.",CMAHawaii,0,/r/pennystocks/comments/m68aoe/zom_has_2_more_products_coming_out_in_the_next/gr5s9ho/,0.0,0.776,0.224,0.8252
85,DNN," Have you considered selling a covered call?  The July 16th call at the $1.50 strike is selling for $0.35 / share, the Oct 15th version is selling for $0.50 / share. 

My DNN position as of yesterday's close: [https://i.imgur.com/oz1hoDN.png](https://i.imgur.com/oz1hoDN.png)

1. If the stock price goes up, that's awesome and I sell my stock at the strike price for a profit and keep the premium.
2. If the stock price goes down, that's awesome, I keep my stock and profit from the premium with the bonus I can sell more calls after expiration for more premium.  

My Risks:

* Stock price blows past my strike prices, I miss out on potential profits vs. not having sold the call.
* Stock price falls to $0 and I'm left holding the bag and can't sell any more calls in the future, however this is the same risk as owning any stock.",James-Lerch,1,/r/pennystocks/comments/m64pi5/dnn_denison_announces_funding_of_project_finance/gr5emgo/,0.066,0.778,0.156,0.9534
86,PCG,"  The information contained on this may be 'Paid Advertising' for purposes of Section 17(b) of the Securities Act of 1933, as amended (together with the rules and regulations there under, the ""Securities Act""). PCG may be compensated by respective clients for publicizing information relating to its client's securities.",Almeja-Man,13,/r/pennystocks/comments/m60hmv/sngx_is_undervalued_pcg_says_15/gr3uyc5/,0.0,0.824,0.176,0.8126
87,SNGX," Plugged in some quick numbers for SNGX to the Ben Graham’s intrinsic value formula:

Current Price: $1.83

EPS for last four quarters (according to NASDAQ.com): $0.45

Expected growth rate (my est.): 30%

Corp. bond. yield: 4.22

Intrinsic Value per Share: 32.1

Undervalued at %94.3

*Note: this is not financial advice. I am not responsible for any gain/loss because of this writeup*",RandomProgrammerGuy,3,/r/pennystocks/comments/m60hmv/sngx_is_undervalued_pcg_says_15/gr3xtvm/,0.029,0.826,0.144,0.7676
88,CTXR," I'm excited for CTXR, but impatient, especially with days like today.",PsycheRevived,6,/r/pennystocks/comments/m6ea7f/3_month_chart_for_ctxr_low_pt_4_high_8_glad_to/gr5or1u/,0.173,0.495,0.331,0.3706
89,DD, Oooohhh pretty crayons. Thank you for this excellent DD. Much yes.,XshinigamipapiX,2,/r/pennystocks/comments/m6ea7f/3_month_chart_for_ctxr_low_pt_4_high_8_glad_to/gr5ypi6/,0.0,0.354,0.646,0.9149
90,CTXR, If you sell at 300 you will get rich quick. If you get peer pressured into holding until 40 you wont. Same thing goes with CTXR SENS and whatever else runs up. Diamond hands are punished hard in the current market by the looks of it.,Fullyrecededhairline,45,/r/pennystocks/comments/m63ww5/looking_to_get_rich_quick/gr3oh9h/,0.118,0.769,0.113,0.1779
91,EYES, This is the tough part after seeing things like EYES. I saw eyes at 10 am up 100% and said I would steer clear.. Now up 900%.,danrennt98,12,/r/pennystocks/comments/m63ww5/looking_to_get_rich_quick/gr46thj/,0.056,0.852,0.093,0.25
92,VERY," Realized this when a friend of mine constantly told me his plays. I thought he was being nice trying to help me out since he's done VERY well with stocks and crypto. Lined up his text messages with the stock charts and found that he tells me what to buy when it's on a current run, not the weeks before when he buys in cheap. He uses friends to buy high to keep it going. Little fucker.",mdh579,9,/r/pennystocks/comments/m63ww5/looking_to_get_rich_quick/gr49zck/,0.046,0.762,0.192,0.8983
93,VISL, Finally a VISL post haha I love this company,WillingBlacksmith473,3,/r/pennystocks/comments/m6dmu2/visl_76_gains_coming_bhat_update/gr577ab/,0.0,0.41,0.59,0.802
94,VISL," In for 300 at $3.49 for VISL.  Stalked the price as the market dropped today, almost bought at $3.40 but looked for a floor and felt safe after it crossed $3.47 again after dropping to $3.40.  Stop loss TBD and floor is concerning, but it’s a fun gamble nonetheless.",outgoinghermit,3,/r/pennystocks/comments/m6dmu2/visl_76_gains_coming_bhat_update/gr5jjww/,0.101,0.754,0.145,0.5499
95,BHAT, BHAT AR Porn need I say more?,ISpacexe,2,/r/pennystocks/comments/m6dmu2/visl_76_gains_coming_bhat_update/gr5dqi3/,0.0,1.0,0.0,0.0
96,VISL, Thanks bro I been in VISL as a mid swing added some shares @ 3.40. Hugh henne has a good thesis from atlas trading good outlook on the company long term as they got their hands in telecommunications now. Thanks for the chart 👍,SingitOrLoveit,2,/r/pennystocks/comments/m6dmu2/visl_76_gains_coming_bhat_update/gr5sec4/,0.0,0.711,0.289,0.9153
97,VISL, VISL was down today.  I think you need to learn how to read.,PusherRed88,-2,/r/pennystocks/comments/m6dmu2/visl_76_gains_coming_bhat_update/gr5xrot/,0.0,1.0,0.0,0.0
98,AR, They have a lot of AR projects but in the long run their porn project will probably make them.,ISpacexe,1,/r/pennystocks/comments/m6dmu2/visl_76_gains_coming_bhat_update/gr5nof0/,0.0,1.0,0.0,0.0
99,DD," Good on you for making DD

I've clicked all the links and I still don't really know what the compamy does. Not sure how they can attract investors or even clients if that's the case.",Sourdoughsucker,8,/r/pennystocks/comments/m6a58v/sngx_good_news_just_in_and_my_personal_opinion/gr4ojgk/,0.051,0.808,0.141,0.5327
100,SNGX, Thanks for sharing. Just took a position in SNGX today. I quite like this stock.,etrulzz,3,/r/pennystocks/comments/m6a58v/sngx_good_news_just_in_and_my_personal_opinion/gr4pt7m/,0.0,0.541,0.459,0.8173
101,ASRT," Waiting for the day when my two headache stocks, ASRT and AITX, can be sold for a profit.",FatCatLounge,34,/r/pennystocks/comments/m632gx/daily_plays_march_16_2021/gr407md/,0.0,0.847,0.153,0.4404
102,CTXR, CTXR and ZOM,Henry_TG,19,/r/pennystocks/comments/m632gx/daily_plays_march_16_2021/gr405t2/,0.0,1.0,0.0,0.0
103,ZOM, CTXR and ZOM,Henry_TG,19,/r/pennystocks/comments/m632gx/daily_plays_march_16_2021/gr405t2/,0.0,1.0,0.0,0.0
104,PM, ZOM has finally blessed us. TRUFORMA is officially on the market. +10% PM. Today is the day.,Switzrific,35,/r/pennystocks/comments/m632gx/daily_plays_march_16_2021/gr3z5aq/,0.0,0.804,0.196,0.5994
105,ZOM, ZOM has finally blessed us. TRUFORMA is officially on the market. +10% PM. Today is the day.,Switzrific,35,/r/pennystocks/comments/m632gx/daily_plays_march_16_2021/gr3z5aq/,0.0,0.804,0.196,0.5994
106,CTXR, CTXR hold my beer,Curtdakid,50,/r/pennystocks/comments/m632gx/daily_plays_march_16_2021/gr3knb1/,0.0,1.0,0.0,0.0
107,ASRT, Tf is happening with ASRT,chillaf,9,/r/pennystocks/comments/m632gx/daily_plays_march_16_2021/gr4ersg/,0.0,1.0,0.0,0.0
108,FOR," RED DAY YALL. 

BUY THE DIPS. 

THANKS FOR THE CHEAP SHARES.",PM_Me_Accounts_rGay,6,/r/pennystocks/comments/m632gx/daily_plays_march_16_2021/gr4g3rw/,0.0,0.638,0.362,0.6249
109,DNN, Gonna buy some more DNN and TSNPD!,Freefarm101,17,/r/pennystocks/comments/m632gx/daily_plays_march_16_2021/gr3lgj9/,0.0,1.0,0.0,0.0
110,AMC," I sold AMC for plus 50% yesterday for the second time, but I really don't have any plays in mind for the funds yet. Holding ZOM, TAKOF, CCL , EVOK, and OCGN. Probably bag holding ASRT and ETFM.",ACP1934,5,/r/pennystocks/comments/m632gx/daily_plays_march_16_2021/gr3rqsi/,0.058,0.942,0.0,-0.2755
111,ASRT," I sold AMC for plus 50% yesterday for the second time, but I really don't have any plays in mind for the funds yet. Holding ZOM, TAKOF, CCL , EVOK, and OCGN. Probably bag holding ASRT and ETFM.",ACP1934,5,/r/pennystocks/comments/m632gx/daily_plays_march_16_2021/gr3rqsi/,0.058,0.942,0.0,-0.2755
112,CCL," I sold AMC for plus 50% yesterday for the second time, but I really don't have any plays in mind for the funds yet. Holding ZOM, TAKOF, CCL , EVOK, and OCGN. Probably bag holding ASRT and ETFM.",ACP1934,5,/r/pennystocks/comments/m632gx/daily_plays_march_16_2021/gr3rqsi/,0.058,0.942,0.0,-0.2755
113,EVOK," I sold AMC for plus 50% yesterday for the second time, but I really don't have any plays in mind for the funds yet. Holding ZOM, TAKOF, CCL , EVOK, and OCGN. Probably bag holding ASRT and ETFM.",ACP1934,5,/r/pennystocks/comments/m632gx/daily_plays_march_16_2021/gr3rqsi/,0.058,0.942,0.0,-0.2755
114,OCGN," I sold AMC for plus 50% yesterday for the second time, but I really don't have any plays in mind for the funds yet. Holding ZOM, TAKOF, CCL , EVOK, and OCGN. Probably bag holding ASRT and ETFM.",ACP1934,5,/r/pennystocks/comments/m632gx/daily_plays_march_16_2021/gr3rqsi/,0.058,0.942,0.0,-0.2755
115,ZOM," I sold AMC for plus 50% yesterday for the second time, but I really don't have any plays in mind for the funds yet. Holding ZOM, TAKOF, CCL , EVOK, and OCGN. Probably bag holding ASRT and ETFM.",ACP1934,5,/r/pennystocks/comments/m632gx/daily_plays_march_16_2021/gr3rqsi/,0.058,0.942,0.0,-0.2755
116,ZOM, Got into ZOM at 1.30 just got out at 2.81 will be buying more if it gets below 2.30,Moshpit68,16,/r/pennystocks/comments/m632gx/daily_plays_march_16_2021/gr3wwso/,0.0,1.0,0.0,0.0
117,DNN," Good to buy DNN at open you think? I don't like the idea of buying after a rise, but I feel like this one wasn't a pump and dump.",ayywusgood,15,/r/pennystocks/comments/m632gx/daily_plays_march_16_2021/gr3re3a/,0.141,0.701,0.158,0.1295
118,CTXR, CTXR and HITIF and the ones I believe in currently,Judge_Bread_UK,33,/r/pennystocks/comments/m632gx/daily_plays_march_16_2021/gr3nj2p/,0.0,1.0,0.0,0.0
119,BNGO," Holding NOK, NVCN,ZOM, as well as BNGO.  Feel good on all except NVCN.",Dash-99,5,/r/pennystocks/comments/m632gx/daily_plays_march_16_2021/gr3xm5d/,0.0,0.688,0.312,0.6124
120,NOK," Holding NOK, NVCN,ZOM, as well as BNGO.  Feel good on all except NVCN.",Dash-99,5,/r/pennystocks/comments/m632gx/daily_plays_march_16_2021/gr3xm5d/,0.0,0.688,0.312,0.6124
121,NVCN," Holding NOK, NVCN,ZOM, as well as BNGO.  Feel good on all except NVCN.",Dash-99,5,/r/pennystocks/comments/m632gx/daily_plays_march_16_2021/gr3xm5d/,0.0,0.688,0.312,0.6124
122,SNGX, SNGX,jab116,4,/r/pennystocks/comments/m632gx/daily_plays_march_16_2021/gr47gd9/,0.0,1.0,0.0,0.0
123,ON, EVERYONE TALKING ABOUT $EEENF PLEASE CHECK YOUR FEES BEFORE BUYING! $50 CHARGE ON SCHWAB!,MrCarey,5,/r/pennystocks/comments/m632gx/daily_plays_march_16_2021/gr4q5b5/,0.0,0.782,0.218,0.5599
124,CTXR," Bought some ZOM on the dip, holding CTXR.",JB_Heat,4,/r/pennystocks/comments/m632gx/daily_plays_march_16_2021/gr4fws4/,0.0,1.0,0.0,0.0
125,ZOM," Bought some ZOM on the dip, holding CTXR.",JB_Heat,4,/r/pennystocks/comments/m632gx/daily_plays_march_16_2021/gr4fws4/,0.0,1.0,0.0,0.0
126,ZOM, Come on ZOM,Houghton1983,4,/r/pennystocks/comments/m632gx/daily_plays_march_16_2021/gr4kfsr/,0.0,1.0,0.0,0.0
127,CTXR, CTXR off a cliff oh man,Bones_Of_Ayyo,5,/r/pennystocks/comments/m632gx/daily_plays_march_16_2021/gr5hxtz/,0.0,1.0,0.0,0.0
128,ZSAN, Curious why ZSAN just jumped 25% right after close,Koppdiesel,4,/r/pennystocks/comments/m632gx/daily_plays_march_16_2021/gr5u8wg/,0.0,0.777,0.223,0.3182
129,CTXR, CTXR finally looking decent again,neveyah_coates72,10,/r/pennystocks/comments/m632gx/daily_plays_march_16_2021/gr3poet/,0.0,1.0,0.0,0.0
130,CIDM," Sitting on CIDM. Long hold, est btwn $3-5 by summer as far as I can factor.",runner_up_runner,3,/r/pennystocks/comments/m632gx/daily_plays_march_16_2021/gr3x6u8/,0.0,1.0,0.0,0.0
131,DNN, DNN and FUNFF if it goes below 1 again. Maybe some AITX dip as well.,gatorjim5,3,/r/pennystocks/comments/m632gx/daily_plays_march_16_2021/gr3yhlc/,0.0,0.861,0.139,0.2732
132,SSY, SSY lifting off,Discasaurus,3,/r/pennystocks/comments/m632gx/daily_plays_march_16_2021/gr4cuas/,0.0,1.0,0.0,0.0
133,SNGX, SNGX is a rocket today,jab116,3,/r/pennystocks/comments/m632gx/daily_plays_march_16_2021/gr4qw4i/,0.0,1.0,0.0,0.0
134,ZOM," Added shares to positions in ZOM, HITIF, TLSS and opened a position in 3LRR today",c0nsume0,3,/r/pennystocks/comments/m632gx/daily_plays_march_16_2021/gr50f6o/,0.0,0.855,0.145,0.296
135,ZOM, Today is red day for my ZOM. I’m sure tomorrow will be a good Green Day for all.,Houghton1983,3,/r/pennystocks/comments/m632gx/daily_plays_march_16_2021/gr53mm4/,0.0,0.743,0.257,0.6369
136,ZOM," Smart move for ZOM to launch early, everyone was waiting to dump on the 31st.. guess we’ll just hold it long term.",jbc313,3,/r/pennystocks/comments/m632gx/daily_plays_march_16_2021/gr59j2v/,0.103,0.791,0.107,0.0258
137,SNGX," SNGX, wtf is this dip? This morning it was great until some asshole sold 200k shares",jab116,3,/r/pennystocks/comments/m632gx/daily_plays_march_16_2021/gr5fkp3/,0.165,0.563,0.273,0.3612
138,ZSAN, Gain on ZSAN all of a sudden today. Can't find any news regarding the price spike. Anyone got any idea?,TomCei,3,/r/pennystocks/comments/m632gx/daily_plays_march_16_2021/gr5zcyt/,0.0,0.841,0.159,0.5267
139,ASRT," Not sure what to do with ASRT now. Both catalysts are gone, there were no huge news, the price is still under $1. ASRT was one of the top mentioned stocks in this sub, but now it seems that people are abandoning it",universal_language,8,/r/pennystocks/comments/m632gx/daily_plays_march_16_2021/gr3y9nc/,0.136,0.799,0.064,-0.5316
140,DDD," DDD and AONE- undervalued 3D printer plays 

CTRX on a dip, will scoop some up around 1.8

TRCH, waiting for a slow decline before it bottoms at 2. Will load the boat for the merger

WWR, hoping to capitalize on hype and ride it to 8-9

MARA/RIOT- waiting for a dip and loading",1Angry_Banana,6,/r/pennystocks/comments/m632gx/daily_plays_march_16_2021/gr3ua4m/,0.0,0.88,0.12,0.6597
141,MARA," DDD and AONE- undervalued 3D printer plays 

CTRX on a dip, will scoop some up around 1.8

TRCH, waiting for a slow decline before it bottoms at 2. Will load the boat for the merger

WWR, hoping to capitalize on hype and ride it to 8-9

MARA/RIOT- waiting for a dip and loading",1Angry_Banana,6,/r/pennystocks/comments/m632gx/daily_plays_march_16_2021/gr3ua4m/,0.0,0.88,0.12,0.6597
142,TRCH," DDD and AONE- undervalued 3D printer plays 

CTRX on a dip, will scoop some up around 1.8

TRCH, waiting for a slow decline before it bottoms at 2. Will load the boat for the merger

WWR, hoping to capitalize on hype and ride it to 8-9

MARA/RIOT- waiting for a dip and loading",1Angry_Banana,6,/r/pennystocks/comments/m632gx/daily_plays_march_16_2021/gr3ua4m/,0.0,0.88,0.12,0.6597
143,WWR," DDD and AONE- undervalued 3D printer plays 

CTRX on a dip, will scoop some up around 1.8

TRCH, waiting for a slow decline before it bottoms at 2. Will load the boat for the merger

WWR, hoping to capitalize on hype and ride it to 8-9

MARA/RIOT- waiting for a dip and loading",1Angry_Banana,6,/r/pennystocks/comments/m632gx/daily_plays_march_16_2021/gr3ua4m/,0.0,0.88,0.12,0.6597
144,AESE, AESE  Long term play,king_zlayer,3,/r/pennystocks/comments/m632gx/daily_plays_march_16_2021/gr3moya/,0.0,0.556,0.444,0.34
145,ZOM, ZOM announced first commercial sale of truforma and the price is going crazy premarket.. are you guys selling today or waiting till the 31st?,jbc313,4,/r/pennystocks/comments/m632gx/daily_plays_march_16_2021/gr3wftz/,0.094,0.906,0.0,-0.34
146,CTXR," I think I'm going to cut my losses this week. CTXR and PULM were bad short term moves and I have no interesting in long penny stock positions. Just when things start looking better, they go back to dragging me down.",IIIlllIIlIlIlIIllII,4,/r/pennystocks/comments/m632gx/daily_plays_march_16_2021/gr5obt5/,0.214,0.672,0.114,-0.5994
147,PULM," I think I'm going to cut my losses this week. CTXR and PULM were bad short term moves and I have no interesting in long penny stock positions. Just when things start looking better, they go back to dragging me down.",IIIlllIIlIlIlIIllII,4,/r/pennystocks/comments/m632gx/daily_plays_march_16_2021/gr5obt5/,0.214,0.672,0.114,-0.5994
