,ticker,comment,neg,neu,pos,compound
0,GDP,"It's a bubble overall, and particularly in certain sectors and definitely certain companies.

Even if you think there are good reasons to explain why the prices have risen, stock pricing eventually all goes back to its ability to produce returns for investors.  When prices rise so high that future earnings do not provide a return to match the kind of risk that investors are taking, at some point you will get a correction.

Explanations like increased money supply or GDP growth do not dispel the idea of a bubble since if it was just inflation or increased economic actrivity, then you'd expect future earnings would also rise and your P/E would not get so out of whack.

Explanations like more people getting in on the market does not dispel the idea of a bubble since you still have the problem of the price getting way too high for the future earnings.  More people getting into the market explains *how* the bubble is being created, not that the bubble doesn't exist.

Similarly, explanations like a lack of reasonable alternatives due to low bond yields again explain how the bubble is being created, but still does not address the core problem of future earnings not being enough to justify the price.  Yes, lack of alternatives will increase investors' tolerance for lower returns from stocks, but only to a certain extent because of the level of risk.  You wouldn't accept a 1% return on stocks over a 0% return from bonds if there was a chance of a 50% drop on the stock price due to it being overvalued.  You'd hold more of your money in commodities or even cash, or swap over into better value stocks.

Having said all that, I still do not expect the bull run to end any time soon.  Investors are still very bullish with the post-COVID recovery and all of the stimulus being pushed into the economy.",0.071,0.803,0.126,0.9222
1,OVID,"It's a bubble overall, and particularly in certain sectors and definitely certain companies.

Even if you think there are good reasons to explain why the prices have risen, stock pricing eventually all goes back to its ability to produce returns for investors.  When prices rise so high that future earnings do not provide a return to match the kind of risk that investors are taking, at some point you will get a correction.

Explanations like increased money supply or GDP growth do not dispel the idea of a bubble since if it was just inflation or increased economic actrivity, then you'd expect future earnings would also rise and your P/E would not get so out of whack.

Explanations like more people getting in on the market does not dispel the idea of a bubble since you still have the problem of the price getting way too high for the future earnings.  More people getting into the market explains *how* the bubble is being created, not that the bubble doesn't exist.

Similarly, explanations like a lack of reasonable alternatives due to low bond yields again explain how the bubble is being created, but still does not address the core problem of future earnings not being enough to justify the price.  Yes, lack of alternatives will increase investors' tolerance for lower returns from stocks, but only to a certain extent because of the level of risk.  You wouldn't accept a 1% return on stocks over a 0% return from bonds if there was a chance of a 50% drop on the stock price due to it being overvalued.  You'd hold more of your money in commodities or even cash, or swap over into better value stocks.

Having said all that, I still do not expect the bull run to end any time soon.  Investors are still very bullish with the post-COVID recovery and all of the stimulus being pushed into the economy.",0.071,0.803,0.126,0.9222
2,DD,I’ve seen several folks posting DD about how we’re not in a bubble...most suspicious.,0.0,0.85,0.15,0.2755
3,DOW,"Does anyone know what the average P/S and P/B ratio is for the DOW and S&P 500 right now?

That would be another thing to look at for sure",0.0,0.924,0.076,0.3182
4,AI,"I’d argue that nobody actually knows because humanity’s actions are too complicated to predict accurately... at least by a human. Unless you have perfect information, I doubt even a super intelligent AI would be able to predict it perfectly.",0.099,0.604,0.298,0.8979
5,GDP,"Have to admit I did not read this post seriously or in full but

>So, in some sense market's real growth has been simply the GDP growth.

US GDP growth in 2020 has been negative and S&P growth has been record breaking. I don't know how can you arrive at above conclusion.",0.099,0.668,0.233,0.8225
6,IMO,"This market has a ways to go IMO, but market divergences may become more apparent.

The top 5-6 tech companies fueled just about all the gains last year in growth.  

Last 12 months of Growth Returns - ~35% (VUG)
Last 12 months of Value Returns - ~1.26% (VTV)

Thats one of the biggest disparities in the history of the market, and over the last 10+ years, Growth has outperformed too at around double Value cumulatively.

Value should stage a bit of a comeback.  Leaning Value and Small Cal, with Emerging Market focus to play a falling dollar.

M2 is irrelevant right now because monetary velocity is low, and banks are holding massive reserves.

PE is historically high, but no one has framed that in contexy of what happened last year - of course EPS decreased during the pandemic for most companies.  PE may normalize this year as EPS goes up.",0.044,0.77,0.186,0.9751
7,PE,"This market has a ways to go IMO, but market divergences may become more apparent.

The top 5-6 tech companies fueled just about all the gains last year in growth.  

Last 12 months of Growth Returns - ~35% (VUG)
Last 12 months of Value Returns - ~1.26% (VTV)

Thats one of the biggest disparities in the history of the market, and over the last 10+ years, Growth has outperformed too at around double Value cumulatively.

Value should stage a bit of a comeback.  Leaning Value and Small Cal, with Emerging Market focus to play a falling dollar.

M2 is irrelevant right now because monetary velocity is low, and banks are holding massive reserves.

PE is historically high, but no one has framed that in contexy of what happened last year - of course EPS decreased during the pandemic for most companies.  PE may normalize this year as EPS goes up.",0.044,0.77,0.186,0.9751
8,PE,"I never know what to comment on this subb because every now and then I get randomly blocked but I'll just say that the only times that the Shiller PE went above 30 in the last 100 years major trouble followed. 

&#x200B;

3 of those 4 times were in the last 2 years alone.",0.142,0.858,0.0,-0.765
9,GO,tl;dr: [This is fine.](https://media.giphy.com/media/QMHoU66sBXqqLqYvGO/giphy.gif),0.0,1.0,0.0,0.0
10,GDP,"Measuring the markets to GDP is exactly what the Buffet Indicator does. Which guages the market as the most overvalued it has ever been since daily measures started in 1980, at +82% valuation as of Jan 14th.",0.0,1.0,0.0,0.0
11,CD,"It looks fine. Kind of interesting.

The M2 supply is from fixed income, CD, T-bill all of which offer close to zero interest. Not to forget how much trillion dollars came off the stimulus, and printing press. More is coming this way.  If Yellen can keep interest at zero or below we got a vibrant economy until the fiscal policy creates too much free money floating cause an inflationary problem.

All in all, the data looks convincing for now.",0.029,0.721,0.251,0.9582
12,GDP,"This is a great angle on something I've been saying for a while now.  All the Fed can do is alter the money supply, and expansionary levers break at the zero lower bound because there's not much in the way of yield available in the real economy.  New money doesn't circulate.  This is compounded by the fact that real economic malaise is also present and has been for some time - so even if there was some room for expansionary policy, it would be lipstick on a pig.  Check this out:

https://fred.stlouisfed.org/graph/fredgraph.png?g=AdgE

So if you're printing on overdrive but institutions aren't lending, what happens?  In Canada, they don't really have other options, so they lend anyway and we get (for example) a housing bubble that has been continuing to grow since the US one popped.  In the US, however, the repeal of Glass-Steagall means if banks don't feel like lending, they can take all that new money and roll it into financial markets instead, where money velocity tends to be lower.  And as we all know, the beauty of financial market math is that the mere act of money flowing in causes valuations to increase regardless of what the economy actually does.

>So, in some sense market's real growth has been simply the GDP growth.

This is literally what it ""should"" be, if you believe Buffet's favorite indicator has some heft to it.  But I suspect we're in a new regime, one for which that indicator no longer applies. Nevertheless, your numbers are a great observation and can help benchmark what is to come.",0.044,0.848,0.108,0.9698
13,GDP,"Might be interesting to normalize for the amount of GDP accounted for by the S&P 500. I.e. if the S&P accounted for a smaller portion of the U.S. economy in ‘87, then it would make sense for the proportion of M2 accounted for to be smaller",0.0,0.942,0.058,0.4019
14,ARE,For every one of those posts there are ten saying we ARE in a bubble.,0.0,1.0,0.0,0.0
15,GDP,"But that is the point. The real growth of stock market (if you factor out M2 supply) is \~2%, which is what GDP growth is in real terms. Remaining 6% is inflation due to increased money supply.",0.0,0.823,0.177,0.743
16,SJW,This guy understands liberal media and SJW journalism.,0.0,1.0,0.0,0.0
17,PM,"I will be messaging you in 2 hours on [**2021-01-21 15:53:42 UTC**](http://www.wolframalpha.com/input/?i=2021-01-21%2015:53:42%20UTC%20To%20Local%20Time) to remind you of [**this link**](https://np.reddit.com/r/investing/comments/l1upan/heres_the_evidence_that_were_not_in_a_bubble/gk26k4q/?context=3)

[**CLICK THIS LINK**](https://np.reddit.com/message/compose/?to=RemindMeBot&subject=Reminder&message=%5Bhttps%3A%2F%2Fwww.reddit.com%2Fr%2Finvesting%2Fcomments%2Fl1upan%2Fheres_the_evidence_that_were_not_in_a_bubble%2Fgk26k4q%2F%5D%0A%0ARemindMe%21%202021-01-21%2015%3A53%3A42%20UTC) to send a PM to also be reminded and to reduce spam.

^(Parent commenter can ) [^(delete this message to hide from others.)](https://np.reddit.com/message/compose/?to=RemindMeBot&subject=Delete%20Comment&message=Delete%21%20l1upan)

*****

|[^(Info)](https://np.reddit.com/r/RemindMeBot/comments/e1bko7/remindmebot_info_v21/)|[^(Custom)](https://np.reddit.com/message/compose/?to=RemindMeBot&subject=Reminder&message=%5BLink%20or%20message%20inside%20square%20brackets%5D%0A%0ARemindMe%21%20Time%20period%20here)|[^(Your Reminders)](https://np.reddit.com/message/compose/?to=RemindMeBot&subject=List%20Of%20Reminders&message=MyReminders%21)|[^(Feedback)](https://np.reddit.com/message/compose/?to=Watchful1&subject=RemindMeBot%20Feedback)|
|-|-|-|-|",0.109,0.891,0.0,-0.6322
18,IMO,"IMO, it's even more specific - it's companies valued like tech that aren't really tech that are overvalued.  Look at the FAANGs, the best examples of true tech companies, which have absurd margins because their costs are so low.  That's what tech is for me - when technology allows scaling beyond other businesses.

Compare Apple with Tesla - Apple's gross margin on an iPhone is 60-70% while Tesla's most popular car, the Model 3, has a gross margin around 10%.  This means Apple is basically printing money with every one of their phones they sell, and can afford to take big risks, try new businesses, etc, while Tesla struggles to break even.  It's not really a fixable problem - it's just a lot cheaper to make a phone compared to what people are willing to pay for it than a car.

The same goes for the other FAANGs - Google, Facebook, Amazon's costs to host pale in comparison to the money they bring in for ads/hosting fees.  Compare that to some of these companies with ridiculous P/E and thin margins - that are valued like the early days of the big tech companies, but without the same scaling advantages.  2 of my go-to examples are Vail Resorts (MTN) and Chipotle (CMG) - each having P/E around 200.  Their costs aren't going to barely increase like tech companies growing with huge revenue increases.  Yes, they can grow a ton, but their margins are never going to be as big as the tech companies they're valued like.",0.045,0.806,0.149,0.9801
19,IMO,"IMO those bubble stocks will drive the recession we are heading into. The people investing in them are by and large blue collar/robin hood guys. As the bubble collapses they are the ones that are going to get hit.   


something about Joe Kennedy and a shoeshine boy",0.102,0.898,0.0,-0.6124
20,FCF,"Which tech?

Take Amazon. >70% increase since pre-crisis highs. P/E is 97.4.

But Amazon's P/FCF is 64, which is in range of its historical median of 59. Amazon's internal management metric is maximizing cash flow, so I would argue this is the appropriate metric on which to value it.

It's still an expensive stock, no question. But you need to use the right metrics to value stocks before you decide how expensive they are.",0.06,0.83,0.109,0.4445
21,OVID,Why was the COVID crash not the straw that broke the camel's back?,0.333,0.667,0.0,-0.6705
22,GDP,Valuations relative to GDP aren't as useful of a metric as it once was as companies have increased % of revenues derived from overseas. Last year Apple had like 62% of the revenue come from ex-US.,0.063,0.816,0.121,0.2946
23,PLUG,"100%... the ROI on tools, knowledge, and certification surpasses TSLA and PLUG combined.",0.0,1.0,0.0,0.0
24,TSLA,"100%... the ROI on tools, knowledge, and certification surpasses TSLA and PLUG combined.",0.0,1.0,0.0,0.0
25,EV,"I guess we have different definition of a bubble, I do believe the market is highly over-valued, but that doesn't directly = a bubble, to me, to call something a bubble it would need to have a potential trigger that would ""pop"" it. So I guess we are due for a couple of corrections, for the market in general, and in the Tech / EV sectors specifically. But I wouldn't bet on a single week -20% on the SPY, DJI, or NQ levels of correction.",0.0,1.0,0.0,0.0
26,CMG,"You are right.  CMG is a good example I've often seen but not brought up since it doesn't neatly fall into ""tech"" like Peleton or Zoom....but IDK why the Street is pricing in future monumental growth for Chipotle when it seems like the growth has already occurred.",0.088,0.655,0.256,0.8749
27,TSLA,If you divide the S&P 500 by TSLA then multiply the daily price by 1/46 (because the 46th President of the USA is a Democrat) then it is clear we are actually in a severe bear market due to the correlation between rising dog owner private debt and a rising 23 year 4 month treasury yield through the quantitative easing by the central bank of Senegal.,0.074,0.832,0.093,0.0772
28,USA,If you divide the S&P 500 by TSLA then multiply the daily price by 1/46 (because the 46th President of the USA is a Democrat) then it is clear we are actually in a severe bear market due to the correlation between rising dog owner private debt and a rising 23 year 4 month treasury yield through the quantitative easing by the central bank of Senegal.,0.074,0.832,0.093,0.0772
29,USA,">having stocks, precious metals or any other form of investment that the FED cannot print more of, is a hedge against looming inflation.

People have been predicting looming inflation from quantitative easing for literally 10 years in the USA, and for even longer in Japan. Yet we've had the exact ***opposite*** of this in spite of record and rising quantitative easing, which is now global.

Just a thought, but perhaps it may be good to revisit the view that the fed's asset purchases will cause inflation  after 10 years of this not being the case?

Fiscal stimulus on the other hand... that's quite different.",0.042,0.846,0.112,0.8294
30,NIO,"Exactly. The slow and boring stuff basically. Solid staples with established supply chain rarely drop in value over time, and if they do it's hardly significant. But they don't get the hype so people don't pay attention to them during bull runs.

Now Tesla/NIO, etc? Yeah I'm staying out of all that",0.075,0.776,0.15,0.328
31,ETH,"Don't call it a crypto podcast.

It is an ETH/BTC maximalist podcast.",0.0,1.0,0.0,0.0
32,USA,"> People have been predicting looming inflation from quantitative easing for literally 10 years in the USA, and for even longer in Japan. Yet we've had the exact opposite of this in spite of record and rising quantitative easing, which is now global.

Are you sure? Have you been to a grocery store or any retail store in the last 10 years?",0.074,0.826,0.1,0.1926
33,TSLA,"It isn't just being spooked that is the problem.

The argument of this whole post is that the market follows the money supply.  That isn't unreasonable - if the Fed pumps out trillions in cash, it stands to reason that quite a bit of that will end up in stocks.

The problem then is inflation.  If you start to get inflation, then the Fed has to stop increasing the money supply.  That means the market collapses.  That will be partially due to actual prices falling, and it will be partially a result of the dollar itself getting weaker (TSLA = $1000/share isn't as impressive when Milk = $25/gal.)",0.17,0.83,0.0,-0.9477
34,GME,">tfw you buy GME at 16.8 in early jan.

Never change /r/investing. You are the necessary Dr Jekyll to my Mr Hyde-my-portfolio",0.0,1.0,0.0,0.0
35,TSLA,"You might get gold there for this statement.


Also, please clarify, divide by TSLA stock price, or market cap, or price of their most popular car? Instructions unclear!

(I can't divide by TSLA because it's not a number, .....yet!)

/s just in case.",0.068,0.805,0.127,0.5796
36,GME,"Lol ""meme"" GME is no meme muthafucka.",0.22,0.5,0.28,0.1531
37,IMO,"I am a perma-bull, dont really try to time the market at all, but your question is a pretty funny one because if there are little to no bears left and there are little to no reasons to be bearish, that in and of itself is a bearish signal.  ""Be fearful when others are greedy"" applies to this exact point in time IMO.  

Now that doesnt mean you should sell everything, but we could easily see a 20%+ pullback in certain sectors or stocks on any type of bad news.  When everyone is bullish, bad news is amplified due to there being more money able to be pulled out and less money able to be put in and it could cause a significant drop.",0.165,0.725,0.11,-0.8428
38,UK,"UK view here: when I look at a lot of company valuations, they are higher than they were pre-pandemic yet they've had no earnings for a year, are saddled with more debt and we're being told by the government to expect the economy to not fully reopen until 2022. And yet they are still valued higher than they were when no one knew what a corona virus was. As much as I'm sure there is a lot of pent up demand for holidays etc, and there's a lot of money being printed, things are starting to look a bit odd.  


I had a large cash position in March and piled into some growth/tech funds. I'm now slowly shifting to defensive, total return funds. I don't think the bubble is going to pop tomorrow, but taking a bit of profit and preparing for it seems wise.",0.055,0.846,0.099,0.8153
39,REI,"With the moratorium on evictions likely to continue and small landlords unable to absorb the mortgage payments while receiving no rent their may be a small spike in foreclosures.

Also REITs will see a drop in income due to less rental income. Or if it’s a commercial REIT, the final knife being driven into commercial real estate by state enforced closures. 

So if this causes a panic, we could see a short term pullback.  But it won’t be as bad as 2007 unless some big lender was concentrated in loaning to REI and has to declare bankruptcy. 

Also the recent rise in gas prices, while good for US job growth may slow spending a little.  

If Biden starts to make some noise about rolling back Trumps tax reforms that could trigger a pullback also. 

But to be honest, I don’t think timing the market works. Build a portfolio for any market, and while you won’t hit a home run slow and steady wins the race. If the market drops just dollar cost average down.",0.08,0.852,0.069,-0.25
40,ADES,">I am curious if there are any more bears left. 

There are but they are mostly dying or bleeding red from their blood losses.

I always feel bears are stupid and on the wrong side since market theory/history is that pies are growing. However current situation is tons of massive worldwide stimulus, worldwide central bank printing, ease of ""free"" RH investing, everyone stuck at home, and insanely bullish sentiment means that bears are getting killed to the point they are extinct or barely holding on.

On the flip side, I do feel bears are a necessary part of the market eco-system just like how fungi, viruses, rats, bugs, plankton, or scavengers are necessary in their eco-systems. Bears have the unenviable job of being the ones that take massive risks with possible 100% or more wipeout losses in what are often short term or semi-long TRADES in markets that are in theory constantly growing and moving upward.

Problem is when the bears get slaughtered hard right now. Even big institutional bears are getting slaughtered on shorting weak/meme stocks by meme gambling addicts/kids on WSB. In fact, they are hunting for short squeezes now. You know you're in a bubble or are due for a correction when there is no one to stop the bulls from running wild. Since bulls never stop themselves they'll keep charging until they destroy themselves like those island rabbits that overbred and wiped themselves out. 

Not saying that we're going to see a bubble burst and the economy collapse (I'm a bull after all), but bears get slaughtered and hunted down is a telltale sign of bull dominance which is one of many indicators of frothiness and take up defense. I would short a few overheated stocks if not for the the current stimulus and cheap cash making it impossible to short anything.",0.145,0.798,0.057,-0.9876
41,RH,">I am curious if there are any more bears left. 

There are but they are mostly dying or bleeding red from their blood losses.

I always feel bears are stupid and on the wrong side since market theory/history is that pies are growing. However current situation is tons of massive worldwide stimulus, worldwide central bank printing, ease of ""free"" RH investing, everyone stuck at home, and insanely bullish sentiment means that bears are getting killed to the point they are extinct or barely holding on.

On the flip side, I do feel bears are a necessary part of the market eco-system just like how fungi, viruses, rats, bugs, plankton, or scavengers are necessary in their eco-systems. Bears have the unenviable job of being the ones that take massive risks with possible 100% or more wipeout losses in what are often short term or semi-long TRADES in markets that are in theory constantly growing and moving upward.

Problem is when the bears get slaughtered hard right now. Even big institutional bears are getting slaughtered on shorting weak/meme stocks by meme gambling addicts/kids on WSB. In fact, they are hunting for short squeezes now. You know you're in a bubble or are due for a correction when there is no one to stop the bulls from running wild. Since bulls never stop themselves they'll keep charging until they destroy themselves like those island rabbits that overbred and wiped themselves out. 

Not saying that we're going to see a bubble burst and the economy collapse (I'm a bull after all), but bears get slaughtered and hunted down is a telltale sign of bull dominance which is one of many indicators of frothiness and take up defense. I would short a few overheated stocks if not for the the current stimulus and cheap cash making it impossible to short anything.",0.145,0.798,0.057,-0.9876
42,USA,">China is finally coming to an end as China and US move towards friendship once again.

China and the USA have never, and will never, be friends. China was the friend of the oligarchs that wanted cheap manufacturing costs. China has gone from 'cheap manufacturer' to 'nearly #1 economy in the world' in the span of 20 - 30 years.

They are increasingly militaristic and assertive in their 'control' ideology (look at Hong Kong, South Pacific Islands, etc). 

**Why should someone be bearish?**

Just look at any asset class, including things like paintings, antiques, etc. They're universally inflated in cost. People are desperate to put their cash into something that has upside value.

When everyone is putting their money everywhere, that signals a massive bubble in nearly every sector. Giving everyone 'free money' that's making < $75,000 year will prop up non-discretionary purchases (consumer staples), but isn't going to prop up the rest of the inflated sectors.

The March 'correction' wasn't a correction. It was a selloff for temporary fear of the virus. This does not count as a 'selloff' in the traditional sense. We recovered far too fast, and will fall far harder in the near future.

**My advice**

Continue contributions to long term retirement funds. Otherwise, keep your powder dry. The greed is off the charts now, and every 23 y/o new graduate feels like Warren Buffet because they haven't lost money yet. **They will lose soon**. Then, we buy.",0.058,0.868,0.074,-0.0088
43,GDP,"Debt to GDP ratios at historic highs, CAPE Ratio twice its historic norm, highest margin debt in history, excessive bullishness shown by the PCCE, massive megaphone pattern from 2018 to now on SPX chart, markets overbought on most timeframes, divergence on multiple stochastic technical indicators",0.104,0.896,0.0,-0.6124
