,ticker,comment,username,score,permalink,neg,neu,pos,compound
622,UAL," AAL is a tough one, at the end of the day they still have over $50B worth of debt to deal with. That and between their main competitors of UAL and DAL they're the only one who's market cap is at pre covid levels. DAL and UAL are both around 70% or so.

They've been the most aggressive of the 3 but that's because they need to be. Plus they're relying on Jet Blue and Alaska to supplement their northeast and northwest flying. I don't really see AAL going past $27 or so. Their stock was already tanking before covid hit

I'm personally sticking with Delta, United and Spirit for recovery",DenseVegetable2581,1,/r/wallstreetbets/comments/njq4z0/airline_sector_dd/gz944jd/,0.039,0.898,0.063,0.5794
623,LUV," Bought LUV last March on the basis that they would be better positioned to survive the downturn. Single type of aircraft means significantly streamlined maintenance, making it easier to store aircraft and put them back in service. Also, figured domestic travel would come back sooner than international. 

Think I got lucky on a couple things too: MAX is back at the perfect time and this is going to generate significant savings for Southwest in terms of per-seat-mile costs, especially as fuel prices continue ticking up. Also, Covid has shown us how unimportant working in person is, as well as meeting in person, and I think this is going to hit the big 3 hard compared to Southwest, which is less reliant on business travel.",Delta728,1,/r/wallstreetbets/comments/njq4z0/airline_sector_dd/gz9qex2/,0.028,0.841,0.131,0.9119
624,MAX," Bought LUV last March on the basis that they would be better positioned to survive the downturn. Single type of aircraft means significantly streamlined maintenance, making it easier to store aircraft and put them back in service. Also, figured domestic travel would come back sooner than international. 

Think I got lucky on a couple things too: MAX is back at the perfect time and this is going to generate significant savings for Southwest in terms of per-seat-mile costs, especially as fuel prices continue ticking up. Also, Covid has shown us how unimportant working in person is, as well as meeting in person, and I think this is going to hit the big 3 hard compared to Southwest, which is less reliant on business travel.",Delta728,1,/r/wallstreetbets/comments/njq4z0/airline_sector_dd/gz9qex2/,0.028,0.841,0.131,0.9119
625,AAL, I wouldn't touch AAL with my wife's boyfriend's pole. It's being badly run by the same guy that has bankrupted other airlines how many times now? It's just a matter of time before DUI Dougy bankrupts another airline.,EvilBunnyLord,1,/r/wallstreetbets/comments/njq4z0/airline_sector_dd/gza3r5q/,0.081,0.89,0.029,-0.4588
626,GME, Some of you are gonna hate this but OP made a good bear call on GME so far [https://www.markovchained.com/profiles/view/reddit:MikeTouchedMyDitka](https://www.markovchained.com/profiles/view/reddit:MikeTouchedMyDitka),MinhNguyenPFL,0,/r/wallstreetbets/comments/njq4z0/airline_sector_dd/gz925w3/,0.106,0.721,0.173,0.3612
627,DAL, DAL is a good pick for long term growth. I think all airlines are set to boom,tommygunz007,0,/r/wallstreetbets/comments/njq4z0/airline_sector_dd/gz9iifj/,0.0,0.703,0.297,0.6705
628,DD, Yes it is. I will post my DD on those tomorrow. Good luck on LUV.,MikeTouchedMyDitka,4,/r/wallstreetbets/comments/njq4z0/airline_sector_dd/gz8vckv/,0.0,0.561,0.439,0.8225
629,LUV, Yes it is. I will post my DD on those tomorrow. Good luck on LUV.,MikeTouchedMyDitka,4,/r/wallstreetbets/comments/njq4z0/airline_sector_dd/gz8vckv/,0.0,0.561,0.439,0.8225
630,SAVE," Don't need no random autist on WSB telling me to buy SAVE. 

Look at SAVE's performance that past 12 months and that's all you need to know.",fuck__pd,2,/r/wallstreetbets/comments/njq4z0/airline_sector_dd/gz9qggi/,0.0,0.811,0.189,0.7023
631,DD," Agreed. Garbage DD. Thanks for reading me their market cap, ratios, and revenue!",Rolltide-tolietpaper,4,/r/wallstreetbets/comments/njq4z0/airline_sector_dd/gza6v6w/,0.0,0.675,0.325,0.6476
632,DD," I think your first mistake was expecting “quality DD” on WSB lmao. But seriously, I’m not going to go that deep Into it for free. If you want DD that delves this deep, pay for it or do it yourself.",MikeTouchedMyDitka,-5,/r/wallstreetbets/comments/njq4z0/airline_sector_dd/gz92ato/,0.115,0.707,0.179,0.6124
633,UAL, I agree with this. The awesome thing about UAL as a recovery play is that even if it’s only at 80% of pre covid metrics by late 2022 it’s still a money maker.,MikeTouchedMyDitka,3,/r/wallstreetbets/comments/njq4z0/airline_sector_dd/gz8z21d/,0.0,0.75,0.25,0.8402
634,LUV," Thanks for pointing that out! I phrased it wrong and said UAL was 100% less instead of LUV is 100% more. Pretty embarrassing. I’m scrolling through your past comments and just about every single one of them is negative. Go outside, have some fun and enjoy life.",MikeTouchedMyDitka,3,/r/wallstreetbets/comments/njq4z0/airline_sector_dd/gz8uwlt/,0.156,0.63,0.213,0.5433
635,UAL," Thanks for pointing that out! I phrased it wrong and said UAL was 100% less instead of LUV is 100% more. Pretty embarrassing. I’m scrolling through your past comments and just about every single one of them is negative. Go outside, have some fun and enjoy life.",MikeTouchedMyDitka,3,/r/wallstreetbets/comments/njq4z0/airline_sector_dd/gz8uwlt/,0.156,0.63,0.213,0.5433
636,PT, Same I’m PT for EOY is $15,BrianBryant66,0,/r/wallstreetbets/comments/nk210c/reverse_repo_our_banking_system_is_drowning_in/gzar7je/,0.0,1.0,0.0,0.0
637,GME, GME duh,Thomas_River,12,/r/wallstreetbets/comments/nk210c/reverse_repo_our_banking_system_is_drowning_in/gzaokxc/,0.0,1.0,0.0,0.0
638,IMO, IMO something nobody is talking about is that the banks are drowning in cash and they’re parking it in... wait for it... 0% yield bonds? WTF? Why not park it in equities? Unless... they see equities as below 0% yield?,PeopleCalledRomanes,7,/r/wallstreetbets/comments/nk210c/reverse_repo_our_banking_system_is_drowning_in/gzapn6t/,0.123,0.877,0.0,-0.7574
639,USA," If prime rate goes up, the USA can’t afford it. 
So the next question is, what happens to military funding, social security, Medicare, etc. 

Which is why inflation is the likely answer. But it’s looking more like stagflation with the supply chains destroyed. 

At least we aren’t the only country with financial problems. Pretty much everyone is in the same boat. 
I read some articles around 2019 that hinted at China playing games with their internal rates and currency to make the picture more rosy than it really is.",PRNbourbon,6,/r/wallstreetbets/comments/nk210c/reverse_repo_our_banking_system_is_drowning_in/gzakxrr/,0.077,0.806,0.117,0.4659
640,SPCE, HOLD for longer and you can buy the SPCE ticket!,Kind-Relationship559,3,/r/wallstreetbets/comments/nk7t0p/400_up_on_spce_20_call_option_exp_on_64/gzbi96b/,0.0,1.0,0.0,0.0
641,PLTR, How does one buy calls on PLTR and profit from them?  Asking for a friend.,Bottom_Wobbles,6,/r/wallstreetbets/comments/nk5ptm/pltr_gains/gzb62ng/,0.0,0.663,0.337,0.7269
642,NIO, I’ve done the exact same as you almost 12k portfolio total 90%+ in NIO,Cold-Honeydew1569,5,/r/wallstreetbets/comments/nk45u1/nio_yolo/gzaune4/,0.0,1.0,0.0,0.0
643,NIO, I’m with you on this one…it’s a strong play right now. The joint agreements they just signed and this new CEO targeting a higher end market. The volume is there… NIO 🚀,Opposite-Shoulder-44,3,/r/wallstreetbets/comments/nk45u1/nio_yolo/gzay1cb/,0.0,0.769,0.231,0.7783
644,NIO, I had 450 NIO at less than $10/share and then sold at 2.75. The lesson is never sell.,rair21,3,/r/wallstreetbets/comments/nk45u1/nio_yolo/gzb5m5g/,0.0,1.0,0.0,0.0
645,NIO, I am in NIO yolo $60K LETS GO,NIO_YOLO,2,/r/wallstreetbets/comments/nk45u1/nio_yolo/gzb8c9v/,0.0,0.741,0.259,0.2732
646,BTX, Short squeeze at BTX,Gordy71502,1,/r/wallstreetbets/comments/nk7ezr/spce_literally_gonna_go_to_the_moon/gzbcu8r/,0.0,1.0,0.0,0.0
647,ASO, ASO has almost doubled already in the last 6 months... Does it really still have upward pressure?,cantadmittoposting,3,/r/wallstreetbets/comments/njh97r/aso_dd_in_preparation_for_dks_earnings/gz7s0zb/,0.128,0.872,0.0,-0.296
648,DD," Solid DD thank you..I do agree with you it does have room for a lot more growth and the comparisons your making is spot on for that space, Ive had my eye on the stock for a few months now and I might grab up some with some profits, but I may wait till the Quarterly earnings come out first..doesnt even matter if they hit a home run with it the price still goes down now a days in this stupid market",JoeyBrash,3,/r/wallstreetbets/comments/njh97r/aso_dd_in_preparation_for_dks_earnings/gz81a70/,0.065,0.818,0.117,-0.1664
649,ASO," This is what Big 5 did.

Achieves Record First Quarter Sales and Earnings Results

Same Store Sales Increased 31.8% in FY 2021 First Quarter versus Guidance of 20%

EPS of $0.96 for FY 2021 First Quarter versus Guidance Range of $0.47 to $0.53

Ends FY 2021 First Quarter with $100.1 Million in Cash and Cash Equivalents, No Debt

Increases Quarterly Cash Dividend by 20% to $0.18 per Share

Declares Special Cash Dividend of $1.00 per Share

My point is attempting to price in a specific sector. If money is flowing in like that for Big 5, then Dick's, Academy Sports, Hibbett etc. are likely seeing that money as well. With that said, if Dick's earnings are good, smarter money than us is going to start evaluating the value of sporting goods stores and I believe ASO is well positioned for a run up.",jbro12345,1,/r/wallstreetbets/comments/njh97r/aso_dd_in_preparation_for_dks_earnings/gz8it3s/,0.03,0.815,0.155,0.9477
650,ASO," Been seeing that in retail too
 - kohls got destroyed and everything was great 
but the outdoor market seems to continue to be on fire
ASO 10/15 40c
DKS 9/17 80c",chuckoneil,1,/r/wallstreetbets/comments/njh97r/aso_dd_in_preparation_for_dks_earnings/gz7yylz/,0.15,0.777,0.073,-0.3919
651,DKS," Been seeing that in retail too
 - kohls got destroyed and everything was great 
but the outdoor market seems to continue to be on fire
ASO 10/15 40c
DKS 9/17 80c",chuckoneil,1,/r/wallstreetbets/comments/njh97r/aso_dd_in_preparation_for_dks_earnings/gz7yylz/,0.15,0.777,0.073,-0.3919
652,DD, And the best DD award goes to..,Hyptisx,1,/r/wallstreetbets/comments/njh97r/aso_dd_in_preparation_for_dks_earnings/gz9kfsn/,0.0,0.394,0.606,0.8271
653,DD, Korean? Did you do DD for Coupang as well? Their Amazon tanked like 75%,BuZZemPat,-1,/r/wallstreetbets/comments/njpdlv/kt_wait_for_24x_your_money_while_collecting_a_44/gz8uc94/,0.0,0.623,0.377,0.6868
654,KT," I believe KT owns 30%+ through a subsidiary. It was bit hard for me to find the exact up-to-date information on it.... but using that number, you’re looking at roughly 30% of its current market cap and that’s IF it IPO’s at the current estimate. They have some time to make it shine.",floridabuds,2,/r/wallstreetbets/comments/njpdlv/kt_wait_for_24x_your_money_while_collecting_a_44/gz8slko/,0.023,0.949,0.028,0.0644
655,DD," Not Korean, but lived in Korea for a couple years. Did not do DD on Coupang.",floridabuds,1,/r/wallstreetbets/comments/njpdlv/kt_wait_for_24x_your_money_while_collecting_a_44/gz9vdap/,0.0,1.0,0.0,0.0
656,KT," KT is probably an ADR, which sometimes have a non-1:1 ratio with the company listing in its home market.",heslion,2,/r/wallstreetbets/comments/njpdlv/kt_wait_for_24x_your_money_while_collecting_a_44/gz9comr/,0.0,1.0,0.0,0.0
657,IBKR, Go IBKR users. 🙌🏼,Forward-Ad4744,3,/r/wallstreetbets/comments/nk6bxz/my_wife_tells_her_friends_i_am_an_investor_tsla/gzb5utt/,0.0,1.0,0.0,0.0
658,TSLA," her “friends” = train runners 🤣

oof, TSLA puts. some folks just love working the dumpster behind their Wendy’s",fallweathercamping,3,/r/wallstreetbets/comments/nk6bxz/my_wife_tells_her_friends_i_am_an_investor_tsla/gzb7vsy/,0.077,0.721,0.202,0.5574
659,IPOE," IPOE, turning into SOFI 6/1",coryarmstrong6,2,/r/wallstreetbets/comments/njxl46/sofi_is_a_wonderful_longterm_playimo/gzat2z2/,0.0,1.0,0.0,0.0
660,AMC, Apes would be excited to see the gama squeeze short thats going on right now. Buy GME buy AMC buy ipoe.... kinda has a ring to it,itsmeblc,1,/r/wallstreetbets/comments/njxl46/sofi_is_a_wonderful_longterm_playimo/gzb3a7g/,0.0,0.912,0.088,0.34
661,GME, Apes would be excited to see the gama squeeze short thats going on right now. Buy GME buy AMC buy ipoe.... kinda has a ring to it,itsmeblc,1,/r/wallstreetbets/comments/njxl46/sofi_is_a_wonderful_longterm_playimo/gzb3a7g/,0.0,0.912,0.088,0.34
662,CLOV," I've plowed over $12K into pltr, sklz, CLOV, ddd, aone,bfly, iova & acic when the market was red. I don't think I have room to take a loss with ipoe. I wouldn't mind picking it up at $16 or $17 but close to $20?...nah.",RobertLewis01,1,/r/wallstreetbets/comments/njxl46/sofi_is_a_wonderful_longterm_playimo/gzavmt8/,0.042,0.958,0.0,-0.1655
663,SPCE," SPCE for 100, Alex.",ShickyMicky,20,/r/wallstreetbets/comments/nk6ucy/what_are_your_moves_tomorrow_may_25_2021/gzb7ljd/,0.0,1.0,0.0,0.0
664,AMC," Lol @ the guys who got mad at me last week when I told them AMC puts were a bad idea because it bleeds 10x slower than it spikes, get fooked",walter1021,21,/r/wallstreetbets/comments/nk6ucy/what_are_your_moves_tomorrow_may_25_2021/gzbdqb6/,0.194,0.725,0.081,-0.5994
665,SPCE, SPCE calls,iamtheonewhoknockseh,19,/r/wallstreetbets/comments/nk6ucy/what_are_your_moves_tomorrow_may_25_2021/gzb7q3i/,0.0,1.0,0.0,0.0
666,SPCE," SPCE, don't be afraid to hold, in Branson's birthday it will rise with him to the mooooon🚀",afrancesco99,18,/r/wallstreetbets/comments/nk6ucy/what_are_your_moves_tomorrow_may_25_2021/gzb85a4/,0.0,1.0,0.0,0.0
667,AMD, Nasdaq could go up 15% tomorrow and AMD would be flat. Fucking amd bro,Kotoyoto,19,/r/wallstreetbets/comments/nk6ucy/what_are_your_moves_tomorrow_may_25_2021/gzbd68x/,0.0,1.0,0.0,0.0
668,SPCE, Loving all the SPCE yolos I'm seeing right now. It's making me double down!,Ilovedastonks,17,/r/wallstreetbets/comments/nk6ucy/what_are_your_moves_tomorrow_may_25_2021/gzbbs5g/,0.0,0.756,0.244,0.636
669,SPCE," me buying SPCE at $20 in November, goes up to $60, Sells at $16. 🤡🤡🤡",Woksauce1,17,/r/wallstreetbets/comments/nk6ucy/what_are_your_moves_tomorrow_may_25_2021/gzbepbg/,0.0,1.0,0.0,0.0
670,SPCE, 130 mil volume on SPCE which has about a 170 mil share float. To. The. Fuckin. MOOON,bsthedog,16,/r/wallstreetbets/comments/nk6ucy/what_are_your_moves_tomorrow_may_25_2021/gzb7qlc/,0.0,0.872,0.128,0.296
671,SPCE, SPCE it is then?,Ok_Communication3637,15,/r/wallstreetbets/comments/nk6ucy/what_are_your_moves_tomorrow_may_25_2021/gzbe7x8/,0.0,1.0,0.0,0.0
672,SPCE, So can you SPCE cadets plz advise: do I need to worry about 🛸 UFOs & what type of tinfoil hat 🎩 worked best??? Thnx,LordHuxley99,12,/r/wallstreetbets/comments/nk6ucy/what_are_your_moves_tomorrow_may_25_2021/gzb9vdw/,0.108,0.668,0.224,0.4836
673,SPCE, I actually believe in SPCE to run more For some reason this sub and fomoers love it. Remember feb 2020 retards,walshsofia,9,/r/wallstreetbets/comments/nk6ucy/what_are_your_moves_tomorrow_may_25_2021/gzbgo37/,0.0,0.819,0.181,0.6369
674,RIDE," This RIDE call is a complete train wreck, lol",get_MEAN_yall,9,/r/wallstreetbets/comments/nk6ucy/what_are_your_moves_tomorrow_may_25_2021/gzbi1m0/,0.248,0.513,0.239,-0.0258
675,ID, I finally realized why Face ID doesn’t work so good for robinhood: I’m always crying when I open it,pizzaprince90,38,/r/wallstreetbets/comments/nk6ucy/what_are_your_moves_tomorrow_may_25_2021/gzbauxz/,0.142,0.687,0.171,0.1633
676,SPCE, Wasn't Cathie Wood locking in SPCE losses recently? Lmfao if you look at the 6 month chart she timed the bottom perfectly 😂💀,phoenixmusicman,25,/r/wallstreetbets/comments/nk6ucy/what_are_your_moves_tomorrow_may_25_2021/gzbc6md/,0.092,0.646,0.262,0.7184
677,SPCE, Hopefully my SPCE profits will earn me a trip to space,YungGuap225,8,/r/wallstreetbets/comments/nk6ucy/what_are_your_moves_tomorrow_may_25_2021/gzbfufe/,0.0,0.588,0.412,0.6808
678,PLTR, Gotta ride PLTR,Outside-Abalone4458,8,/r/wallstreetbets/comments/nk6ucy/what_are_your_moves_tomorrow_may_25_2021/gzbhb09/,0.0,1.0,0.0,0.0
679,RBLX, More RBLX puts bc this clown makeup is permanent baby 🤡,SlothyPotato,6,/r/wallstreetbets/comments/nk6ucy/what_are_your_moves_tomorrow_may_25_2021/gzb7z0x/,0.0,1.0,0.0,0.0
680,SPCE, SPCE riding the rocket ship to 100 when Richard Chadson flies,iamtheonewhoknockseh,7,/r/wallstreetbets/comments/nk6ucy/what_are_your_moves_tomorrow_may_25_2021/gzbh2i3/,0.0,1.0,0.0,0.0
681,TSLA, Did the TSLA 🌈🐻 go extinct? They seem awfully quiet today.,TFrank28,7,/r/wallstreetbets/comments/nk6ucy/what_are_your_moves_tomorrow_may_25_2021/gzbi1id/,0.0,1.0,0.0,0.0
682,RIDE, Where’s that RIDE cuck boy I was arguing with who had calls. He’s in downtown shamblesville,TheHumanCalculator_,7,/r/wallstreetbets/comments/nk6ucy/what_are_your_moves_tomorrow_may_25_2021/gzbiblo/,0.176,0.824,0.0,-0.4588
683,TSLA," TSLA is currently forming the MOACAH

(Mother Of All Cup And Handles)",DPurp4,7,/r/wallstreetbets/comments/nk6ucy/what_are_your_moves_tomorrow_may_25_2021/gzbipe8/,0.0,1.0,0.0,0.0
684,SPCE, Riding SPCE to the Moon 🚀 and squeezing the 🐻 out,Kind-Relationship559,7,/r/wallstreetbets/comments/nk6ucy/what_are_your_moves_tomorrow_may_25_2021/gzbiuj9/,0.0,1.0,0.0,0.0
685,PLTR, I sold all my PLTR today. You guys are welcome.,perzbenz,5,/r/wallstreetbets/comments/nk6ucy/what_are_your_moves_tomorrow_may_25_2021/gzb9io6/,0.0,0.727,0.273,0.4588
686,UI," Bears headed to the unemployment line but their Governor says no more enhanced UI

Couldn’t be me",PalekSow,6,/r/wallstreetbets/comments/nk6ucy/what_are_your_moves_tomorrow_may_25_2021/gzb9vfj/,0.241,0.759,0.0,-0.5789
687,SPCE, The only true retards are the ones that sell SPCE before the Branson flight in July,InternalStomach5009,6,/r/wallstreetbets/comments/nk6ucy/what_are_your_moves_tomorrow_may_25_2021/gzba1nh/,0.0,0.843,0.157,0.4215
688,AAPL," AAPL is going to be a bag until the judge reaches a decision. Wow, it happened, I’m a bagholder.",Objective_Forever_24,6,/r/wallstreetbets/comments/nk6ucy/what_are_your_moves_tomorrow_may_25_2021/gzbdbpv/,0.0,0.737,0.263,0.6124
689,DKNG, So DKNG went up 10% based on the news that it was looking to acquire bleacher report last year,fe2sio4,6,/r/wallstreetbets/comments/nk6ucy/what_are_your_moves_tomorrow_may_25_2021/gzbg4ne/,0.0,1.0,0.0,0.0
690,SPCE, on SPCE flying to Ape camp on the moon ![gif](emote|free_emotes_pack|give_upvote),captainflashh,6,/r/wallstreetbets/comments/nk6ucy/what_are_your_moves_tomorrow_may_25_2021/gzbjq32/,0.0,1.0,0.0,0.0
691,SPCE, SPCE gonna pop again tomorrow 🚀🌗,Gminsta,15,/r/wallstreetbets/comments/nk6ucy/what_are_your_moves_tomorrow_may_25_2021/gzb8k96/,0.0,1.0,0.0,0.0
692,RBLX, Diamond handing this RBLX short position. This overweight pig needs to die already.,FORK_IN_MY_URETHRA,5,/r/wallstreetbets/comments/nk6ucy/what_are_your_moves_tomorrow_may_25_2021/gzb7zcg/,0.34,0.532,0.128,-0.6124
693,RIDE, Sold RIDE calls and just found out they didn’t fill. Fooook meeeeeee,sloop703,5,/r/wallstreetbets/comments/nk6ucy/what_are_your_moves_tomorrow_may_25_2021/gzb83bc/,0.0,1.0,0.0,0.0
694,BABA," BABA is like a 40 degree day, every fucking day.",karamka0,5,/r/wallstreetbets/comments/nk6ucy/what_are_your_moves_tomorrow_may_25_2021/gzb96ud/,0.0,0.762,0.238,0.3612
695,SPCE," How far will SPCE run, any thoughts?",Regenbooggeit,5,/r/wallstreetbets/comments/nk6ucy/what_are_your_moves_tomorrow_may_25_2021/gzbflye/,0.0,1.0,0.0,0.0
696,BABA, Fuckin shit can everyone stop posting about BABA. I need it to stay in the fucking trash can for 4 more days until I get my next paycheck so I can dump another months earnings into this puppy dog.,bsr92,5,/r/wallstreetbets/comments/nk6ucy/what_are_your_moves_tomorrow_may_25_2021/gzbggbv/,0.213,0.787,0.0,-0.8261
697,JD, JD really be teasing me after hours with 0 volume 3% up,yushey__,5,/r/wallstreetbets/comments/nk6ucy/what_are_your_moves_tomorrow_may_25_2021/gzbhv0d/,0.136,0.864,0.0,-0.1477
698,NIO," In 7th grade I was sexting a girl and my game was “do you wear thong underwear” 

Balls deep in NIO",gravityshift12,13,/r/wallstreetbets/comments/nk6ucy/what_are_your_moves_tomorrow_may_25_2021/gzbj3d5/,0.0,1.0,0.0,0.0
699,RBLX, RBLX has got to be the most retarded stock ever right?,bwn69,11,/r/wallstreetbets/comments/nk6ucy/what_are_your_moves_tomorrow_may_25_2021/gzb83ea/,0.285,0.715,0.0,-0.6115
700,RIDE, RIDE earnings report is awful. They need more money to do less. No wonder they are inviting investors for a tour this summer.,harts-tongue-fern,3,/r/wallstreetbets/comments/nk6ucy/what_are_your_moves_tomorrow_may_25_2021/gzb8svn/,0.187,0.725,0.088,-0.3832
701,AMD," Very legal, very cool AMD.",_name_unavailable,4,/r/wallstreetbets/comments/nk6ucy/what_are_your_moves_tomorrow_may_25_2021/gzba9i7/,0.0,0.392,0.608,0.5646
702,RIDE, I'm convinced Lordstown is just a bunch of people in a building sitting around playing video games and drinking beer. RIDE sucks,spyaintnobitch,4,/r/wallstreetbets/comments/nk6ucy/what_are_your_moves_tomorrow_may_25_2021/gzbaagh/,0.104,0.708,0.188,0.25
703,AAPL, lol AAPL,Gaston44,4,/r/wallstreetbets/comments/nk6ucy/what_are_your_moves_tomorrow_may_25_2021/gzbanpf/,0.0,0.263,0.737,0.4215
704,NKLA, RIDE stock be like NKLA hold my beer we are even bigger pile of shit.,left_turn_signal,4,/r/wallstreetbets/comments/nk6ucy/what_are_your_moves_tomorrow_may_25_2021/gzbaoer/,0.188,0.681,0.131,-0.2732
705,RIDE, RIDE stock be like NKLA hold my beer we are even bigger pile of shit.,left_turn_signal,4,/r/wallstreetbets/comments/nk6ucy/what_are_your_moves_tomorrow_may_25_2021/gzbaoer/,0.188,0.681,0.131,-0.2732
706,PLTR," SPY 430
QQQ 350
TSLA 700
PLTR 20

THIS WEEK",PalekSow,4,/r/wallstreetbets/comments/nk6ucy/what_are_your_moves_tomorrow_may_25_2021/gzbf26m/,0.0,1.0,0.0,0.0
707,TSLA," SPY 430
QQQ 350
TSLA 700
PLTR 20

THIS WEEK",PalekSow,4,/r/wallstreetbets/comments/nk6ucy/what_are_your_moves_tomorrow_may_25_2021/gzbf26m/,0.0,1.0,0.0,0.0
708,GME," just remember, it's hot girl summer. reopening, baby. some value plays are still cheap and no i'm not talking about GME. $TAP $CCL $AAL",Apprehensive-Cow-441,4,/r/wallstreetbets/comments/nk6ucy/what_are_your_moves_tomorrow_may_25_2021/gzbfgaw/,0.08,0.761,0.159,0.296
709,RIDE," Fuck it. Grabbed some RIDE in afterhours at 8.82, feel like the massive amount of shorts taking profit should be enough to hold them up after such a pullback even with shitty earnings. I don't need money anyways...",MiscellaneousClutter,4,/r/wallstreetbets/comments/nk6ucy/what_are_your_moves_tomorrow_may_25_2021/gzbfxss/,0.16,0.719,0.121,-0.4019
710,RH, RH gave me IPO access. Buy FIGS?,harrybond,4,/r/wallstreetbets/comments/nk6ucy/what_are_your_moves_tomorrow_may_25_2021/gzbiksy/,0.0,1.0,0.0,0.0
711,ATH," SPY at ATH tomorrow or DRILLING

PLACE YOUR BETS",PalekSow,15,/r/wallstreetbets/comments/nk6ucy/what_are_your_moves_tomorrow_may_25_2021/gzb7j1s/,0.0,1.0,0.0,0.0
712,RIDE, RIDE is dead,gecemg,9,/r/wallstreetbets/comments/nk6ucy/what_are_your_moves_tomorrow_may_25_2021/gzb8hyz/,0.683,0.317,0.0,-0.6486
713,SPCE, Got some SPCE calls on morning dip thank you,FaithlessnessFree331,10,/r/wallstreetbets/comments/nk6ucy/what_are_your_moves_tomorrow_may_25_2021/gzba3q1/,0.0,0.762,0.238,0.3612
714,SPCE, Isn’t SPCE still the play? Don’t fight this trend.,walshsofia,14,/r/wallstreetbets/comments/nk6ucy/what_are_your_moves_tomorrow_may_25_2021/gzbgayk/,0.217,0.583,0.2,-0.0516
715,SPCE, SPCE to 100 this week!! Pre-market is going to be amazing tomorrow,Ilovedastonks,18,/r/wallstreetbets/comments/nk6ucy/what_are_your_moves_tomorrow_may_25_2021/gzb7to8/,0.0,0.715,0.285,0.658
716,SPCE, SPCE yolo calls,mikhailsuris97,9,/r/wallstreetbets/comments/nk6ucy/what_are_your_moves_tomorrow_may_25_2021/gzbc590/,0.0,0.488,0.512,0.2732
717,SPCE, Just FOMOd into SPCE,madmax299,12,/r/wallstreetbets/comments/nk6ucy/what_are_your_moves_tomorrow_may_25_2021/gzba7ho/,0.0,1.0,0.0,0.0
718,AMC, AMC running AH,brarjatt-,7,/r/wallstreetbets/comments/nk6ucy/what_are_your_moves_tomorrow_may_25_2021/gzb91kf/,0.0,1.0,0.0,0.0
719,ANY, ELON MUSK FUCKING FIGHT ME I WILL COME TO YOU AND I PROMISE IT WON'T TAKE MUCH OF YOUR VALUABLE TIME FOR ME TO FUCK YOU UP BILLIONS DON'T MAKE YOU ANY LESS OF A BITCH,shroomenheimer,11,/r/wallstreetbets/comments/nk6ucy/what_are_your_moves_tomorrow_may_25_2021/gzba6oc/,0.229,0.646,0.125,-0.672
720,IT, ELON MUSK FUCKING FIGHT ME I WILL COME TO YOU AND I PROMISE IT WON'T TAKE MUCH OF YOUR VALUABLE TIME FOR ME TO FUCK YOU UP BILLIONS DON'T MAKE YOU ANY LESS OF A BITCH,shroomenheimer,11,/r/wallstreetbets/comments/nk6ucy/what_are_your_moves_tomorrow_may_25_2021/gzba6oc/,0.229,0.646,0.125,-0.672
721,RIDE, RIDE is KILL,VTWut,3,/r/wallstreetbets/comments/nk6ucy/what_are_your_moves_tomorrow_may_25_2021/gzb7sr2/,0.731,0.269,0.0,-0.7531
722,RIDE, Bye bye RIDE stock... You'll inexplicably recover by Friday,cantadmittoposting,3,/r/wallstreetbets/comments/nk6ucy/what_are_your_moves_tomorrow_may_25_2021/gzbatz4/,0.0,1.0,0.0,0.0
723,AMD, I don't understand why amd is sliding down YTD yet NVDA is 🚀. Then I realized nvda income is like 2.5x bigger than AMD.,Sandvicheater,3,/r/wallstreetbets/comments/nk6ucy/what_are_your_moves_tomorrow_may_25_2021/gzbdtnf/,0.0,0.894,0.106,0.3612
724,NVDA, I don't understand why amd is sliding down YTD yet NVDA is 🚀. Then I realized nvda income is like 2.5x bigger than AMD.,Sandvicheater,3,/r/wallstreetbets/comments/nk6ucy/what_are_your_moves_tomorrow_may_25_2021/gzbdtnf/,0.0,0.894,0.106,0.3612
725,CLF, Bagholding CLF shares is really hard rn. Damn,limonfiesta,3,/r/wallstreetbets/comments/nk6ucy/what_are_your_moves_tomorrow_may_25_2021/gzbeegq/,0.393,0.422,0.186,-0.352
