,ticker,comment,username,score,permalink,neg,neu,pos,compound
0,ATOS, ATOS is climbing!,robot3201,52,/r/pennystocks/comments/lax6gn/atos_breast_cancer_study_produces_substantially/glqiq8f/,0.0,1.0,0.0,0.0
1,BNGO," Anyone think this could reach BNGO levels....? They're also developing a Covid nasal spray, apparently.",AcroyearOfSPartak,4,/r/pennystocks/comments/lax6gn/atos_breast_cancer_study_produces_substantially/glr39rg/,0.0,0.922,0.078,0.0258
2,CEO, This could also help $GENE which got it's roots from this arena. Red Chip has the CEO interview on there. FD. I own this stock and talking my book.,Numerous-Run,3,/r/pennystocks/comments/lax6gn/atos_breast_cancer_study_produces_substantially/glraemm/,0.0,0.909,0.091,0.4019
3,LOVE, Got in at 2.62 yesterday. I LOVE THE STOCK!,dontpmnudes,2,/r/pennystocks/comments/lax6gn/atos_breast_cancer_study_produces_substantially/glrqghm/,0.0,0.573,0.427,0.7371
4,SRAX, SRAX TO THE MOON  🚀,Atthemoneyjosh,2,/r/pennystocks/comments/lax6gn/atos_breast_cancer_study_produces_substantially/glrqm7u/,0.0,1.0,0.0,0.0
5,CLRB, CLRB look into it!,Existing_Wolverine77,2,/r/pennystocks/comments/lax6gn/atos_breast_cancer_study_produces_substantially/glru8lu/,0.0,1.0,0.0,0.0
6,BNGO, BNGO......watch it go up and up!!!!,Lovemyfamily12345,2,/r/pennystocks/comments/lax6gn/atos_breast_cancer_study_produces_substantially/glruaod/,0.0,1.0,0.0,0.0
7,ATOS," Sold at 2.94$, it will dip again, I will buy again and I will ride ATOS again.

Just gotta move across my country first so I need some cash... be back soon boys!",Ylvio,2,/r/pennystocks/comments/lax6gn/atos_breast_cancer_study_produces_substantially/glrwb2c/,0.0,1.0,0.0,0.0
8,TD, I went to buy but it won't let me. Says under review ! TD always on some next bs,Puzzleheaded_Persia,1,/r/pennystocks/comments/lax6gn/atos_breast_cancer_study_produces_substantially/glrrqfr/,0.0,1.0,0.0,0.0
9,ATOS," [Covid nasal spray also protects against common cold](https://medicalxpress.com/news/2021-02-nasal-covid-effective-common-cold.html)

Research published in European Respiratory Journal on a similar spray being developed in Australia. Should be a nice catalyst if the ATOS spray can be shown to do the same.",Putmein-coach,1,/r/pennystocks/comments/lax6gn/atos_breast_cancer_study_produces_substantially/glrx46s/,0.0,0.87,0.13,0.6249
10,IMMP, IMMP best breast cancer drug,MRDon2,1,/r/pennystocks/comments/lax6gn/atos_breast_cancer_study_produces_substantially/glrnpy6/,0.379,0.259,0.362,-0.0516
11,DS, Nokia Sndl DS,1y100million,0,/r/pennystocks/comments/lax6gn/atos_breast_cancer_study_produces_substantially/glrs1df/,0.0,1.0,0.0,0.0
12,ET," 11AM ET, I believe.",LegalizeCrystalGanja,1,/r/pennystocks/comments/lax6gn/atos_breast_cancer_study_produces_substantially/glqxhjc/,0.0,1.0,0.0,0.0
13,BNGO, I made 15x on BNGO in only a couple weeks. Hoping to do the same here.,ImpressiveVisual4845,1,/r/pennystocks/comments/lax6gn/atos_breast_cancer_study_produces_substantially/glsa96u/,0.0,0.823,0.177,0.4215
14,SAVA," I remember those two because I researched them, bought them, and made money on them.

EDIT: While I'm here, I own SAVA, too. While you're on the sidelines saying ""nothing ever works"" I'll make money.",_DOA_,4,/r/pennystocks/comments/lax6gn/atos_breast_cancer_study_produces_substantially/glrmstm/,0.0,1.0,0.0,0.0
15,GO, LET'S GO $HITIF,SaltMesteren,13,/r/pennystocks/comments/lajwr6/cannabis_federal_legalization_proposal_early_part/glpeq84/,0.0,1.0,0.0,0.0
16,DD, Do a DD on High Tide Inc (HITIF/HITI) and you’ll realize it’s a nobrainer.,blackcloaklifestyle,4,/r/pennystocks/comments/lajwr6/cannabis_federal_legalization_proposal_early_part/glpm2oc/,0.0,1.0,0.0,0.0
17,SNDL," ![gif](giphy|31xiBzMAH75KtpfsJA)

Great SNDL bought",Easy-Blackberry5169,17,/r/pennystocks/comments/lajwr6/cannabis_federal_legalization_proposal_early_part/glog8l8/,0.0,0.406,0.594,0.6588
18,SNDL, SNDL 100% !!!!,Anonmp30,25,/r/pennystocks/comments/lajwr6/cannabis_federal_legalization_proposal_early_part/glof10r/,0.0,1.0,0.0,0.0
19,CRBP, CRBP...short squeeze setup today. Its gonna be a fun ride,kmaf08,2,/r/pennystocks/comments/lajwr6/cannabis_federal_legalization_proposal_early_part/glq3cbh/,0.0,0.708,0.292,0.5106
20,USA," I agree, now's the time to start stockpiling these stocks.  Support all the companies in the USA.  I found one that is cheap and hopefully will explode for some massive gains when the legislation passes.   MCOA--Marijuana Company of America at 0.0082.    BUY LOW SELL HIGH.",Stock_Wizard283,6,/r/pennystocks/comments/lajwr6/cannabis_federal_legalization_proposal_early_part/glon1w7/,0.055,0.743,0.201,0.7556
21,FAF, FAF,Stinky1-800,1,/r/pennystocks/comments/lajwr6/cannabis_federal_legalization_proposal_early_part/gloit03/,0.0,1.0,0.0,0.0
22,SNDL, I'm holding positions in SNDL and FLWR,Fragrant-Purpose7115,1,/r/pennystocks/comments/lajwr6/cannabis_federal_legalization_proposal_early_part/glp7dwc/,0.0,1.0,0.0,0.0
23,SNDL," I have SNDL, what would be some other good ones? I’ve heard “canopy growth” (CGC)is pretty good.",buckbuck12,1,/r/pennystocks/comments/lajwr6/cannabis_federal_legalization_proposal_early_part/glp9rtu/,0.0,0.591,0.409,0.8402
24,SSPK, Anyone know about SSPK and weed maps?,AdPale1019,1,/r/pennystocks/comments/lajwr6/cannabis_federal_legalization_proposal_early_part/glpafqy/,0.0,1.0,0.0,0.0
25,ACB," More Cannabis stocks are also ACB, CRON, HEXO, CGC.",Invisible-Hand-Touch,1,/r/pennystocks/comments/lajwr6/cannabis_federal_legalization_proposal_early_part/glpohna/,0.0,1.0,0.0,0.0
26,CGC," More Cannabis stocks are also ACB, CRON, HEXO, CGC.",Invisible-Hand-Touch,1,/r/pennystocks/comments/lajwr6/cannabis_federal_legalization_proposal_early_part/glpohna/,0.0,1.0,0.0,0.0
27,CRON," More Cannabis stocks are also ACB, CRON, HEXO, CGC.",Invisible-Hand-Touch,1,/r/pennystocks/comments/lajwr6/cannabis_federal_legalization_proposal_early_part/glpohna/,0.0,1.0,0.0,0.0
28,HEXO," More Cannabis stocks are also ACB, CRON, HEXO, CGC.",Invisible-Hand-Touch,1,/r/pennystocks/comments/lajwr6/cannabis_federal_legalization_proposal_early_part/glpohna/,0.0,1.0,0.0,0.0
29,GRWG, Could GRWG also rise in the upcoming days?,ViniestMitten91,1,/r/pennystocks/comments/lajwr6/cannabis_federal_legalization_proposal_early_part/glpxybt/,0.0,1.0,0.0,0.0
30,SNDL," Holding onto SNDL with the hopes of some movement. Hearing that HITIF is fairly undervalued, anyone jumping onto it? Seems like a good time to buy.",Brad_JP,1,/r/pennystocks/comments/lajwr6/cannabis_federal_legalization_proposal_early_part/glpyxg2/,0.0,0.728,0.272,0.802
31,SNDL, Think we all should now grab some SNDL stocks ;-),Germanystrade,1,/r/pennystocks/comments/lajwr6/cannabis_federal_legalization_proposal_early_part/glq8bv3/,0.0,0.818,0.182,0.25
32,SNDL, SNDL,Individual_Web2419,1,/r/pennystocks/comments/lajwr6/cannabis_federal_legalization_proposal_early_part/glqqglg/,0.0,1.0,0.0,0.0
33,IRT," New member, first post.  IRT the above article, anyone have insight with **Hemp, Inc (HEMP)?**",bhagen02,1,/r/pennystocks/comments/lajwr6/cannabis_federal_legalization_proposal_early_part/glr4z7c/,0.0,1.0,0.0,0.0
34,BOOM, I am sitting on 150 HITIF shares and hope they will BOOM alot. My fiancé told me not to buy but I will tell her BOOOOOOM!,Teaishealthy7,13,/r/pennystocks/comments/lajwr6/cannabis_federal_legalization_proposal_early_part/glprbuz/,0.0,0.851,0.149,0.4295
35,UK, Do you know of any apps in the UK that has this stock?,TrickRecord33,1,/r/pennystocks/comments/lajwr6/cannabis_federal_legalization_proposal_early_part/glp6wl4/,0.0,1.0,0.0,0.0
36,SNDL," >HITIF

What apps have it?

&#x200B;

Revolut and etoro aint got this and SNDL and ive been looking.

&#x200B;

as a complete newbie trader, how tf do you guys manage with all these apps",TrickRecord33,5,/r/pennystocks/comments/lajwr6/cannabis_federal_legalization_proposal_early_part/glp0gdo/,0.0,1.0,0.0,0.0
37,THC," Don't forget about all of the minor cannabinoids. CBG, CBN, Delta8 THC from Hemp.  They are all going to be in the market in real products.",edibleresearch,1,/r/pennystocks/comments/lajwr6/cannabis_federal_legalization_proposal_early_part/glq6xdy/,0.0,0.938,0.062,0.1695
38,SNDL, Tading212 has SNDL,SimoHayha360,1,/r/pennystocks/comments/lajwr6/cannabis_federal_legalization_proposal_early_part/glpzsje/,0.0,1.0,0.0,0.0
39,SNDL," Nah I also have SNDL, I wanted to suggest the ones under a penny as well.",358823,1,/r/pennystocks/comments/lajwr6/cannabis_federal_legalization_proposal_early_part/glq9127/,0.097,0.759,0.145,0.1779
40,USA," Pretty sure the hype behind HITI/HITIF is due to the fact that 23% of their sales are already coming from the USA and have a website ready for USA orders once legalization happens. Also, they are close to doubling their physical store count in Canada. 

\*\*\*I do not know much about stocks. This is not financial advice. Be sure to fact check and do your own research on everything I said.",Galactic_Explosion,8,/r/pennystocks/comments/lajwr6/cannabis_federal_legalization_proposal_early_part/glq88ot/,0.0,0.863,0.137,0.8519
41,UK," > SoFi Invest

The app has some really bad reviews. I try to avoid anything below 3 stars because it just scares me. I'm in the UK btw.",TrickRecord33,1,/r/pennystocks/comments/lajwr6/cannabis_federal_legalization_proposal_early_part/glp47vu/,0.276,0.724,0.0,-0.8122
42,SNDL," Maybe it's because i'm from the UK, but US stocks seem pretty spread between the apps. For example i found SNDL on a couple apps - but can't seem to find HITIF",TrickRecord33,3,/r/pennystocks/comments/lajwr6/cannabis_federal_legalization_proposal_early_part/glp7dmp/,0.0,0.867,0.133,0.6486
43,UK," Maybe it's because i'm from the UK, but US stocks seem pretty spread between the apps. For example i found SNDL on a couple apps - but can't seem to find HITIF",TrickRecord33,3,/r/pennystocks/comments/lajwr6/cannabis_federal_legalization_proposal_early_part/glp7dmp/,0.0,0.867,0.133,0.6486
44,AAPL, close enough ticker to AAPL. For that reason I am in,KenSpliffeyJr,78,/r/pennystocks/comments/lauf79/last_change_to_get_in_on_alpp_before_it_uplists/glqjyhe/,0.0,1.0,0.0,0.0
45,RH," Where can you buy it? I can't find it on RH, SoFi or Public.",atx311,3,/r/pennystocks/comments/lauf79/last_change_to_get_in_on_alpp_before_it_uplists/glqnt94/,0.0,1.0,0.0,0.0
46,UK, What is a good platform in the UK to invest in this?,bthreader,4,/r/pennystocks/comments/lauf79/last_change_to_get_in_on_alpp_before_it_uplists/glqunfg/,0.0,0.775,0.225,0.4404
47,TD," Can't buy OTC with TD DI, but I'm buying ALPP as soon as it's listed!",aloofinecstasy,2,/r/pennystocks/comments/lauf79/last_change_to_get_in_on_alpp_before_it_uplists/glqxisk/,0.0,1.0,0.0,0.0
48,BY, ALPP IS GONNA MOON BY FRIday,Letsearnmoney18,2,/r/pennystocks/comments/lauf79/last_change_to_get_in_on_alpp_before_it_uplists/glrqxuh/,0.0,1.0,0.0,0.0
49,DD, Thanks for the DD. In with 126 for 2.4 before it hitted the 4,Shoddy-Review-4731,2,/r/pennystocks/comments/lauf79/last_change_to_get_in_on_alpp_before_it_uplists/gls1s6p/,0.0,0.805,0.195,0.4404
50,DD, This stock is going to create A LOT OF MILLIONAIRES for those that buy and hold.  Do your DD and grab those shares while you can under $5.  IMO,Hour-Cantaloupe1860,2,/r/pennystocks/comments/lauf79/last_change_to_get_in_on_alpp_before_it_uplists/glqjizk/,0.0,0.858,0.142,0.5106
51,IMO, This stock is going to create A LOT OF MILLIONAIRES for those that buy and hold.  Do your DD and grab those shares while you can under $5.  IMO,Hour-Cantaloupe1860,2,/r/pennystocks/comments/lauf79/last_change_to_get_in_on_alpp_before_it_uplists/glqjizk/,0.0,0.858,0.142,0.5106
52,DD, Where’s the 15-23 DD,dbrennan1112,1,/r/pennystocks/comments/lauf79/last_change_to_get_in_on_alpp_before_it_uplists/glrdkex/,0.0,1.0,0.0,0.0
53,DS, Sndl nok DS,1y100million,1,/r/pennystocks/comments/lauf79/last_change_to_get_in_on_alpp_before_it_uplists/glrs4qw/,0.0,1.0,0.0,0.0
54,RH, This must be another one that RH is hiding from the consumers bc I can't find it on there!!,SnooCakes409,-1,/r/pennystocks/comments/lauf79/last_change_to_get_in_on_alpp_before_it_uplists/glqqtxu/,0.141,0.859,0.0,-0.4184
55,OCGN, OCGN hugeeee potential!!!!!,Themarketwiz,-1,/r/pennystocks/comments/lauf79/last_change_to_get_in_on_alpp_before_it_uplists/glrxyf9/,0.0,1.0,0.0,0.0
56,DD, The real DD is always in the comments,ReconTankSpam4Lyfe,64,/r/pennystocks/comments/lauf79/last_change_to_get_in_on_alpp_before_it_uplists/glquvns/,0.0,1.0,0.0,0.0
57,DD, Read DD itc 💪,kpidhayny,6,/r/pennystocks/comments/lauf79/last_change_to_get_in_on_alpp_before_it_uplists/glqsfjy/,0.0,1.0,0.0,0.0
58,RH," Might not have it, I’m not on WeBull but RH doesn’t have it either, I have my shares on Fidelity.",robxcos,4,/r/pennystocks/comments/lauf79/last_change_to_get_in_on_alpp_before_it_uplists/glqmnvg/,0.0,0.865,0.135,0.4215
59,TDA, TDA,jadedmonk,4,/r/pennystocks/comments/lauf79/last_change_to_get_in_on_alpp_before_it_uplists/glr27mu/,0.0,1.0,0.0,0.0
60,PM," I will be messaging you in 7 days on [**2021-02-09 16:01:52 UTC**](http://www.wolframalpha.com/input/?i=2021-02-09%2016:01:52%20UTC%20To%20Local%20Time) to remind you of [**this link**](https://np.reddit.com/r/pennystocks/comments/lauf79/last_change_to_get_in_on_alpp_before_it_uplists/glqthsy/?context=3)

[**4 OTHERS CLICKED THIS LINK**](https://np.reddit.com/message/compose/?to=RemindMeBot&subject=Reminder&message=%5Bhttps%3A%2F%2Fwww.reddit.com%2Fr%2Fpennystocks%2Fcomments%2Flauf79%2Flast_change_to_get_in_on_alpp_before_it_uplists%2Fglqthsy%2F%5D%0A%0ARemindMe%21%202021-02-09%2016%3A01%3A52%20UTC) to send a PM to also be reminded and to reduce spam.

^(Parent commenter can ) [^(delete this message to hide from others.)](https://np.reddit.com/message/compose/?to=RemindMeBot&subject=Delete%20Comment&message=Delete%21%20lauf79)

*****

|[^(Info)](https://np.reddit.com/r/RemindMeBot/comments/e1bko7/remindmebot_info_v21/)|[^(Custom)](https://np.reddit.com/message/compose/?to=RemindMeBot&subject=Reminder&message=%5BLink%20or%20message%20inside%20square%20brackets%5D%0A%0ARemindMe%21%20Time%20period%20here)|[^(Your Reminders)](https://np.reddit.com/message/compose/?to=RemindMeBot&subject=List%20Of%20Reminders&message=MyReminders%21)|[^(Feedback)](https://np.reddit.com/message/compose/?to=Watchful1&subject=RemindMeBot%20Feedback)|
|-|-|-|-|",RemindMeBot,1,/r/pennystocks/comments/lauf79/last_change_to_get_in_on_alpp_before_it_uplists/glqtlcl/,0.105,0.895,0.0,-0.6322
61,RH," It's an OTC, RH doesn't support them. You should get off that platform anyway.",CarneAsuuhDude,4,/r/pennystocks/comments/lauf79/last_change_to_get_in_on_alpp_before_it_uplists/glqt1b7/,0.148,0.852,0.0,-0.3089
62,RH, Yeah I need to get out of RH and jump into Schwab been saying that forever just need to do it,Adelman01,7,/r/pennystocks/comments/lauf79/last_change_to_get_in_on_alpp_before_it_uplists/glqvv92/,0.0,0.896,0.104,0.296
63,UK," Looking at the reviews, I don't think that app is for me, I'll get charged currency fees for UK to US for a start, and subscribe monthly for stop-loss option?",CrazyWelshy,1,/r/pennystocks/comments/lauf79/last_change_to_get_in_on_alpp_before_it_uplists/glrqows/,0.062,0.938,0.0,-0.2023
64,RH," Do it, anything else is honestly so much better than RH.
I can’t speak much for Fidelity since I don’t have an account with them, but I know for sure people think they have some of the best customer service out there, and their platform is pretty easy to use too.
As for Schwab, I have both a Roth IRA and a cash brokerage account. They’ve served me well for the years I’ve used them, and like I said they get really good quotes.
I also have a Webull margin account that I opened recently so I can start getting into margin trading.
There’s an endless list of places you can go, and I PROMISE you, they’re all better than RH",Underpaid-Clerk,4,/r/pennystocks/comments/lauf79/last_change_to_get_in_on_alpp_before_it_uplists/glr182k/,0.0,0.713,0.287,0.9909
65,DD, It was at $3.6 when I wrote this DD,IllusionaryHaze,3,/r/pennystocks/comments/lauf79/last_change_to_get_in_on_alpp_before_it_uplists/glqz602/,0.0,1.0,0.0,0.0
66,IBKR," Oh damn that's true, IBKR then?",ZenoGeno,2,/r/pennystocks/comments/lauf79/last_change_to_get_in_on_alpp_before_it_uplists/glqo9ux/,0.284,0.421,0.295,0.0258
67,RH," Cool man. Thank you. I’m thinking Schwab, I’ve heard good things and I also heard they would eat the charge transfer cost from stupid RH (hope that’s true).",Adelman01,1,/r/pennystocks/comments/lauf79/last_change_to_get_in_on_alpp_before_it_uplists/glrdhz6/,0.1,0.674,0.226,0.5106
68,DD," I bought this 0.0001 as a meme and i was aware of the risks of a pump and dump as i’m sure many people who hold shares are. As u/Newcastle247 says this is a moon shot for most people who aren’t too serious about it but could pay off massively. No DD is going to make me take any gains off my initial £32 investment for my 450k shares.

Edit: I was aware of the court case upon initial investment but we all know how these cases can be.",Poolside007,37,/r/pennystocks/comments/lauqep/hcmc_info_sources_for_all_the_hype/glqd0ni/,0.097,0.804,0.099,0.3071
69,HMHC," I appreciate the lookout! HMHC definitely been mentioned in a lot of articles.

![gif](giphy|6q29hxDKvJvPy|downsized)",theDowneastBoy,8,/r/pennystocks/comments/lauqep/hcmc_info_sources_for_all_the_hype/glql4qj/,0.0,0.626,0.374,0.717
70,PM, Let's say PM settles or HCMC wins the lawsuit.  What is a reasonable payout for something like this?  Is there any information on the possible financial benefit to HCMC?,ResponsibilityIcy746,3,/r/pennystocks/comments/lauqep/hcmc_info_sources_for_all_the_hype/glr9zs0/,0.054,0.677,0.27,0.8253
71,IMO," The higher this stock moves...say to .10....means the less shares people will buy. Those that hold millions of shares will continue to put pressure on this stock so it will never see .20 cents and never 1 unless there is a reverse split. There is over 100 billion shares priced at .00001
Over $2 mill company.....this runs to 1 and it is worth over 100 bill....not happening. Get in, make a few dollars and get out. If the get $1 bill from PM which is doubtful and will most likely take years....then the company will buy back stock or issue that reverse split. IMO
Like it or not....we are big dreamers for $.10 or even bigger for $1",dimar05,3,/r/pennystocks/comments/lauqep/hcmc_info_sources_for_all_the_hype/gls2f7q/,0.038,0.879,0.083,0.5455
72,PM," The higher this stock moves...say to .10....means the less shares people will buy. Those that hold millions of shares will continue to put pressure on this stock so it will never see .20 cents and never 1 unless there is a reverse split. There is over 100 billion shares priced at .00001
Over $2 mill company.....this runs to 1 and it is worth over 100 bill....not happening. Get in, make a few dollars and get out. If the get $1 bill from PM which is doubtful and will most likely take years....then the company will buy back stock or issue that reverse split. IMO
Like it or not....we are big dreamers for $.10 or even bigger for $1",dimar05,3,/r/pennystocks/comments/lauqep/hcmc_info_sources_for_all_the_hype/gls2f7q/,0.038,0.879,0.083,0.5455
73,PM," Google- pacermonitor 
Search- healthier choices
The PM lawsuit is the second result.
 No information has been posted since January 28 but the docket was updated 8 hours ago",TestingTheCat1973,2,/r/pennystocks/comments/lauqep/hcmc_info_sources_for_all_the_hype/glq64g9/,0.109,0.891,0.0,-0.2617
74,TD," What does everyone use here??? I’ve trade TD ameritrade, Fidelity, and webull. Webull doesn’t offer the stock for me and TD and Fidelity both are on bullshit. I deposited money into both from my bank account and can’t buy bc I have to wait 3 days for my funds to settle but by that time, i’ll miss out i’m sure. Is there any other faster way to invest in this?",embattlelive,2,/r/pennystocks/comments/lauqep/hcmc_info_sources_for_all_the_hype/glqw5v8/,0.073,0.886,0.041,-0.3204
75,TD," Man, I have accounts with Webull, Fidelity, and TD Ameritrade. Where are you.gius buying these OTC stocks? None of the aforementioned will allow it.",bigkevob54,2,/r/pennystocks/comments/lauqep/hcmc_info_sources_for_all_the_hype/glqxfkv/,0.0,0.921,0.079,0.2263
76,TD, TD is allowing trades again.,TonyMacaroknee,2,/r/pennystocks/comments/lauqep/hcmc_info_sources_for_all_the_hype/glr6bhb/,0.0,1.0,0.0,0.0
77,TD," HCMC , I try to buy today thru TD but get denied. Yesterday morning too... What’s going on? Anyone have the same issue with TD Ameritrade buying this stocks?",JackieLove7,2,/r/pennystocks/comments/lauqep/hcmc_info_sources_for_all_the_hype/glrm250/,0.139,0.861,0.0,-0.6381
78,NOK, I had the same problem with TD I finally got in at .0019 and .0014. Now I’ll hold and see what happens. TD shuts platform down a lot. Tried to sell some NOK last Wednesday no way lost the profit due to platform closures. Anyway I’ll watch HCMC and hopefully NOK rebounds.,dc6179,2,/r/pennystocks/comments/lauqep/hcmc_info_sources_for_all_the_hype/glrtczt/,0.127,0.775,0.099,-0.1531
79,TD, I had the same problem with TD I finally got in at .0019 and .0014. Now I’ll hold and see what happens. TD shuts platform down a lot. Tried to sell some NOK last Wednesday no way lost the profit due to platform closures. Anyway I’ll watch HCMC and hopefully NOK rebounds.,dc6179,2,/r/pennystocks/comments/lauqep/hcmc_info_sources_for_all_the_hype/glrtczt/,0.127,0.775,0.099,-0.1531
80,SNDL," After seeing it pumped on this sub non-stop so when it fell today 25%+ got in at 0.14.
Same way I got into SNDL + TSLL",NPRjunkieDC,2,/r/pennystocks/comments/lauqep/hcmc_info_sources_for_all_the_hype/gls0y0m/,0.0,1.0,0.0,0.0
81,SNDL," etrade is allowing to buy HCMC and many other OTC stocks to include JAMN, HMNY, SNDL and VALPQ.  

Would love it if someone could give some insight or news on HMNY, there is nothing i can find on this stock for a bit.  Are they still operating??",yup_1980,2,/r/pennystocks/comments/lauqep/hcmc_info_sources_for_all_the_hype/gls1fk3/,0.0,0.906,0.094,0.6767
82,TD, I can't seem to buy it on TD Ameritrade. Any thoughts,Bianca0717,1,/r/pennystocks/comments/lauqep/hcmc_info_sources_for_all_the_hype/glrt4s4/,0.0,1.0,0.0,0.0
83,TD, TD Direct Investing (Canada) restricting trade on this ? I can’t seem to purchase any. Anyone else having problems like this? Limit orders not working at all.,Vinncity,1,/r/pennystocks/comments/lauqep/hcmc_info_sources_for_all_the_hype/gls2eyh/,0.188,0.729,0.083,-0.4871
84,SNDL, SNDL is a trend now. 💰 🤑 💸 💲,PressureAmbitious999,0,/r/pennystocks/comments/lauqep/hcmc_info_sources_for_all_the_hype/glqmglr/,0.0,1.0,0.0,0.0
85,EV," **Who want to bet on IT ?? This is my question**

2021 is becoming a tipping point for the electric vehicle (EV) industry. EV inventories are making huge gains, while traditional oil and gas companies are taking over. The popularity of EVs is having a trickle-down effect in the supply chain, which means great potential for battery inventories.

&#x200B;

Without batteries, there is no EV industry. Smart investors are increasingly interested in battery-related equities, including companies that extract and refine lithium-the key element in lithium-ion batteries. Lithium is often referred to as ""white gold"" or ""white oil"" in reference to its value and its central position in the green energy revolution. Voltabox offers batteries with the ability to easily integrate them into the vehicle chassis.

&#x200B;

The battery system manufacturer Voltabox has introduced a new technological concept that allows the production of lithium-ion batteries in almost every conceivable free form. This technological concept, called Flow-Shape-Design (FSD), is based on the solidification of plastic materials to enclose the battery.

&#x200B;

This innovative technology will allow the vehicle manufacturer to distribute the load ""weight"" to allow the point of gravity to be adjusted. This is to have a pleasant driving experience.

&#x200B;

&#x200B;

The market launch of the new technology is scheduled for summer 2021 when Voltabox wants to start delivering its own FSD modules and customer-specific FSD battery systems. In addition, the company aims to spread this technology through licenses in selected markets. For this purpose, they have filed several patents and have already protected utility models and trademarks. Discussions on the use of the technology are now gradually being initiated with customers, according to the manufacturer, who also expects to issue the first licenses to battery manufacturers and OEMs starting next summer.

&#x200B;

**Actually 4.6 hopefully jump to 460 in a few weeks**  

who  want to bet on it ?",SnowRelevant,0,/r/pennystocks/comments/lauqep/hcmc_info_sources_for_all_the_hype/gls4zic/,0.007,0.849,0.144,0.9906
