,ticker,comment,neg,neu,pos,compound
0,GME,I wish warren buffet just fucks around and drops a casual $25M buying GME $60c weeklies,0.167,0.591,0.242,0.1027
1,GME,"Honestly I'm torn on this one. My account is small, less than 500$ and I don't have the knowledge or ability to trade any options. What exactly is the move with GME from this point forward? Do I buy shares plain and simple?",0.043,0.79,0.168,0.7059
2,GME,"For all you GME holders, what price you selling at?",0.0,1.0,0.0,0.0
3,GME,"Am I missing something? Can't institutions just stop selling option contracts? 

Why are option contracts still being offered given the market gap in available shares to offset the risk? Or are they still being offered because gambling and expectation for GME to dunk?",0.111,0.803,0.086,-0.2896
4,GME,"Here's a shower thought. If an entity or whatever you would like to call it, wsb for example, searched out highly leveraged stocks like GME and decided as a group effort to just start buying up, A would it cause any shift like a small squeeze and B would it be legal?",0.0,0.827,0.173,0.7906
5,UK,How can someone in UK get involved with this potentially massive return?,0.0,1.0,0.0,0.0
6,BB,I've seen stuff that BB is next....is that true? I haven't bought options in awhile but damn am I jealous of you GME warriors,0.265,0.668,0.067,-0.7684
7,GME,I've seen stuff that BB is next....is that true? I haven't bought options in awhile but damn am I jealous of you GME warriors,0.265,0.668,0.067,-0.7684
8,GME,Holy shit GME gang even got to the r/stocks bois. Knowing there’s support even among you fine upstanding gentlemen is the bullish shit yet.,0.227,0.631,0.142,-0.5719
9,GME,Okay so somebody tell me. Should I buy GME stocks on Monday or not? :D can’t buy options due to being European,0.134,0.787,0.079,-0.3279
10,GME,What is a genuinely realistic PT for GME in the coming weeks? Absolutely bewildered from all the numbers I’ve seen bandied about.,0.0,1.0,0.0,0.0
11,PT,What is a genuinely realistic PT for GME in the coming weeks? Absolutely bewildered from all the numbers I’ve seen bandied about.,0.0,1.0,0.0,0.0
12,GME,"Sucks to suck fuck you MM's 


###GME $100",0.64,0.36,0.0,-0.836
13,CBOE,"I had some thoughts just then, theoretical at this point but still: what happens if the SEC/FTC/FML/CBOE/whoever the fuck is responsible let's MM/option writers settle in cash as this is unprecedented? Right now the theory relies on them actually having to purchase the underlying stock, no? So if they don't have to buy then the gamma squeeze could potentially be stopped, no?",0.183,0.776,0.041,-0.8831
14,FTC,"I had some thoughts just then, theoretical at this point but still: what happens if the SEC/FTC/FML/CBOE/whoever the fuck is responsible let's MM/option writers settle in cash as this is unprecedented? Right now the theory relies on them actually having to purchase the underlying stock, no? So if they don't have to buy then the gamma squeeze could potentially be stopped, no?",0.183,0.776,0.041,-0.8831
15,GME,"So for someone who didnt really understand what you said is the following correct?:  


If WSB keep bullying wallstreet by constantly buying GME will that keep making the stock price grow until eventually wallstreet will give in and sell to cover losses making the price for GME to go even higher making retail investors + WSB get a nice return",0.102,0.854,0.043,-0.5859
16,GME,"I bought GME on a whim at 42, at managed to check my account right at 71.50. couldn't help but exit, but I think I go back in Monday with the profits.",0.052,0.826,0.122,0.4975
17,GME,"First of all I'm pretty much a noob at trading with only a few dozen shares, including GME bought Friday. What's the plan for Monday besides ""buy all you can and hold""? I'm expecting prices to lower slightly much like Friday so is it realistic to expect to go down to say 50 and them buy? Or safer to just place orders today?",0.049,0.793,0.158,0.8206
18,GME,So you’re saying I should throw my $1k savings into GME cause 🚀🚀🚀🚀🌕🌕🌕🌕,0.0,1.0,0.0,0.0
19,GME,"Can I get a more TLDR? Barely traded options so far, only regular stocks. Should we all buy Calls on GME on Monday?",0.0,1.0,0.0,0.0
20,GME,"What no one is considering is what if GME just issues more shares? Perfect time to raise money. There is still significant risk in this play and nothing is a sure thing, except USTs.",0.146,0.606,0.249,0.6608
21,GME,We’re talking about options in r/stocks. Gotta love GME GANG! Rise up retards 🙌🙌🙌,0.0,0.743,0.257,0.6696
22,GME,"> MM can't hedge properly because there are not enough GME shares to buy to properly financially hedge (accounting for the interest rate to borrow)

Can anyone ELI5 how they use short selling to hedge?",0.051,0.867,0.081,0.276
23,CBOE,"I would expect CBOE to add 61 -> 100 dollar strikes this weekend for Jan 29 while this wont kill the gamma squeeze it will dampen it. and well if they dont add more strikes, get rekt GME to moon.",0.109,0.764,0.127,0.2115
24,GME,"I would expect CBOE to add 61 -> 100 dollar strikes this weekend for Jan 29 while this wont kill the gamma squeeze it will dampen it. and well if they dont add more strikes, get rekt GME to moon.",0.109,0.764,0.127,0.2115
25,TD,"1/29 call options on TD go up to $115

So 🚀🚀 to $115?",0.0,1.0,0.0,0.0
26,DD,"I got in at 16 and change, sold at 13 after the bad earnings report. Bought back in at 20, sold the day it shot up to 40. I thought it was a flash thing and got out at 34. Realized it wasn't and got back in at 39. Yesterday, I accidentally sold 25 shares at 55 when I meant to buy. So pissed. Also bought and sold some calls along the way so I had some cash to buy more shares. And I still have cash to pick up more on Monday. I expect there to be a dip early. 

But it's been fun watching the Citron stuff go down via WSB. That clown's stream getting postponed because of that inauguration that just happened out of the blue, then not working the next day, putting the video on YouTube the next day (comments disabled, of course), then seeing the price shoot up again yesterday, and guy goes silent. 

You really have to be careful with WSB because for the few big screenshots of ""sick gains"", there are hundreds who tried to replicate but timed them wrong, as evidenced by the almost equally common ""I lost everything"" posts. 

Kind of funny though to see GME making its way to this sub, which tends to focus on long term growth rather than quick money stunts. 

But I expect in the future to see more attention paid to bad DD on WSB, from those hoping to catch another GME early on. All the reason to be more careful with you cash, unless you're just in it for the gamble and can afford to lose.",0.094,0.841,0.065,-0.8572
27,GME,"I got in at 16 and change, sold at 13 after the bad earnings report. Bought back in at 20, sold the day it shot up to 40. I thought it was a flash thing and got out at 34. Realized it wasn't and got back in at 39. Yesterday, I accidentally sold 25 shares at 55 when I meant to buy. So pissed. Also bought and sold some calls along the way so I had some cash to buy more shares. And I still have cash to pick up more on Monday. I expect there to be a dip early. 

But it's been fun watching the Citron stuff go down via WSB. That clown's stream getting postponed because of that inauguration that just happened out of the blue, then not working the next day, putting the video on YouTube the next day (comments disabled, of course), then seeing the price shoot up again yesterday, and guy goes silent. 

You really have to be careful with WSB because for the few big screenshots of ""sick gains"", there are hundreds who tried to replicate but timed them wrong, as evidenced by the almost equally common ""I lost everything"" posts. 

Kind of funny though to see GME making its way to this sub, which tends to focus on long term growth rather than quick money stunts. 

But I expect in the future to see more attention paid to bad DD on WSB, from those hoping to catch another GME early on. All the reason to be more careful with you cash, unless you're just in it for the gamble and can afford to lose.",0.094,0.841,0.065,-0.8572
28,GME,Everyone thinks we're stupid till they realize we're not. GME to Alpha Centauri,0.221,0.779,0.0,-0.5267
29,GME,"I knew about GME, the short interest, Ryan Cohen, everything in the summer and chose not to go in when it was $5. WSB then hopped onto it at $16ish. I finally bought in at 19, held for 6 weeks and stupidly sold at 30ish. 

Fuck.",0.131,0.808,0.061,-0.5423
30,DD,"I have learned more about stocks and trading from WSB DD posts than any other subreddit that I am subbed to (this one, r/stockmarket, r/investing, etc). Even if I didn't invest, although I did, I have learned a TON just reading. Best DD around and knowledge about the stock market are people at WSB. It is true that there is a lot of meme humor though, but those posts are easy to identify and differentiate from good DD posts if you don't want to see them


I wish I got in earlier with the Tesla craze! I hear that WSB was pumping that one in 2020, and look how it did...",0.028,0.817,0.155,0.9367
31,GME,GME singlehandedly saved my portfolio. Well on my way to buying a house now LMAO.,0.0,0.536,0.464,0.8602
32,GME,"Group 1: If you short a stock it means at some point in the future you have to buy it back.

Group 2: Likewise, if you sell a call and the call is in the money then that buyer will eventually exercise the option and you'll have to provide the stock. Unless the stock dips enough.

Group 3: If you sell a call and the call is out of the money then the option might expire worthless so you might not have to eventually provide a stock to someone.

Now also imagine that the number of GME shares that people are actually willing to sell to those guys is **less** than what's needed.

More demand than supply means that the price will go up. As it goes up, group 1 is getting fucked and group 2 is starting to get scared that they're really going to have to buy the stock. So group 1 tries to get out of their mess buy ""unshorting"", aka buying stock.

That's brings the price up so group 2 is starting to freak out because it's looking more and more like they will need to eventually buy that stock. So now they are buying stock before it gets too expensive.

That pushes it higher and now group 3 is looking to buy. Pushes even higher.

The infinite part is because you can end up in a situation where the number of stocks that need to be bought is more than the number that exist.

The gamma squeeze is when the people that own the stocks also buy some call options. That makes groups 2 and 3 bigger, which hikes up the price for the group doing the squeeze.

The brain trust behind the GME infinite gamma squeeze is a bunch of reddit users.",0.057,0.901,0.041,-0.7867
33,GME,It's easy to lose money on these GME calls even when they're ITM because the IV is just so damn high. IV crush is no joke.,0.285,0.57,0.145,-0.5982
34,TSLA,Sold TSLA at 400 pre split if that makes you feel better,0.0,0.791,0.209,0.4404
35,MC,"WSB is pretty far in kahoots with $1000. I’ve even seen as high as $5000. Many of them are looking to u/DeepFuckingValue as their MC. Personally I bought in at $23.25. Sell limit placed at about $1000 for 10 shares initially, as far as that, haven’t decided on when to sell the rest. I might average up each $500/1000 or so until I’m out.

EDIT: though unorganized, the consensus is that they want to absolutely gouge MMs and big institutions cause they’ve cost people jobs, livelihoods, money, futures, etc. I relate really heavily with that.",0.0,0.911,0.089,0.765
36,GME,"End game: half of GME longs are rich, the other half are bag holders to the extreme.",0.0,0.816,0.184,0.5574
37,GME,Ya I don't think WSB has heard of GME,0.0,1.0,0.0,0.0
38,BB,I would just buy shares for BB. Not enough shares in the market for squeeze. The stock is very undervauled and for some reason stagnated in 2020. It a stock which should be in the 50-75 dollar range. But it is sitting at 14 dollars. Don't hold for too long.,0.0,0.913,0.087,0.5267
39,BB,"There isnt much short interest in BB as far as i can tell, so no 'short squeeze' which i suppose is bullish anyway. There seems to be alot of buzz, Ive always personally been a fan of blackberry software, QNX is in all sorts of stuff (IoT) and they have changed their business model to software/cyber security provider which is a hot topic right now. I remember they were always pretty close to government aswell because of their superior security/privacy and after the solarwinds problem this could be their year to get back to the recognised brand... seriously i wish i had gone in hard on them after solarwinds, but im dumb yeah",0.105,0.791,0.104,-0.0447
40,DD,There's been tons of pretty sharp DD done around on all the subreddits.  It takes time to read it all and then make your own decision.,0.0,0.887,0.113,0.4939
41,CHWY,"I think it helps not to look at the price. EV puts things into better perspective. 

EV currently is around 5bn. 

I think the best comp for GME at the moment is CHWY. Sure they sell different products and gme is still classified as a “brick and mortar retailer”, but GME is basically cohen’s next big project.

Given CHWY was cohen’s brain child. It’s reasonable to expect GME will develop a similar business model like CHWY in 4-5 years time. 

CHWY’s EV is around 45bn, 9 times that of GME. Revenue is 6.5bn which gives EV/revenue of around 6.7x. 

GME’s revenue is 5bn which gives EV/revenue of around 1.0x. 

GME is expected to turn EBIT positive within 2 years. Their ecommerce share of total revenue is close to 1/3 already. Given low interest rates are to stay for a couple of years, future and present values are very close. That means the fair value of GME should greatly take into account their future value, which is worth a lot.

For me, a very reasonable EV is 15bn (3 times of current EV). That’s not even accounting for the short squeeze or gamma squeeze, or cohen cult following (see elon musk).",0.012,0.813,0.175,0.9865
42,EV,"I think it helps not to look at the price. EV puts things into better perspective. 

EV currently is around 5bn. 

I think the best comp for GME at the moment is CHWY. Sure they sell different products and gme is still classified as a “brick and mortar retailer”, but GME is basically cohen’s next big project.

Given CHWY was cohen’s brain child. It’s reasonable to expect GME will develop a similar business model like CHWY in 4-5 years time. 

CHWY’s EV is around 45bn, 9 times that of GME. Revenue is 6.5bn which gives EV/revenue of around 6.7x. 

GME’s revenue is 5bn which gives EV/revenue of around 1.0x. 

GME is expected to turn EBIT positive within 2 years. Their ecommerce share of total revenue is close to 1/3 already. Given low interest rates are to stay for a couple of years, future and present values are very close. That means the fair value of GME should greatly take into account their future value, which is worth a lot.

For me, a very reasonable EV is 15bn (3 times of current EV). That’s not even accounting for the short squeeze or gamma squeeze, or cohen cult following (see elon musk).",0.012,0.813,0.175,0.9865
43,GME,"I think it helps not to look at the price. EV puts things into better perspective. 

EV currently is around 5bn. 

I think the best comp for GME at the moment is CHWY. Sure they sell different products and gme is still classified as a “brick and mortar retailer”, but GME is basically cohen’s next big project.

Given CHWY was cohen’s brain child. It’s reasonable to expect GME will develop a similar business model like CHWY in 4-5 years time. 

CHWY’s EV is around 45bn, 9 times that of GME. Revenue is 6.5bn which gives EV/revenue of around 6.7x. 

GME’s revenue is 5bn which gives EV/revenue of around 1.0x. 

GME is expected to turn EBIT positive within 2 years. Their ecommerce share of total revenue is close to 1/3 already. Given low interest rates are to stay for a couple of years, future and present values are very close. That means the fair value of GME should greatly take into account their future value, which is worth a lot.

For me, a very reasonable EV is 15bn (3 times of current EV). That’s not even accounting for the short squeeze or gamma squeeze, or cohen cult following (see elon musk).",0.012,0.813,0.175,0.9865
44,GDP,"It’s true. Zero downside, zero risk. Fair value of GME shares is higher than the GDP of the United States.",0.139,0.439,0.422,0.8126
45,GME,"It’s true. Zero downside, zero risk. Fair value of GME shares is higher than the GDP of the United States.",0.139,0.439,0.422,0.8126
46,GME,"In my opinion, WSB and Citron are just the most visible players. Retail investors at the end of Dec were around 17%. That's most definitely gone up since then, but I doubt it's past 25%. I think WSB is adding a lot of pressure on the situation, though. The shorts just over leveraged their positions. And shorting GME was such a no brainer that it went overboard and here we are.

Edit: they won't sell to cover losses, they'll have to buy to cover losses, sending the price higher. They owe 140% of the shares. Only 100% of the shares exist. They have to pay higher and higher prices to exit at a loss. But if they can wait for all the other shorts to close, eventually the price would drop and they can limit those losses. So they're not only playing chicken with WSB, but with each other.",0.171,0.784,0.045,-0.9638
47,GME,"Nah, wsb has been bullish on GME due to Ryan Cohen for a while now, Shitron just added fuel to the fire.",0.167,0.833,0.0,-0.4215
48,GME,"Your risk with buying a call is the price of the option. Buy a call for $1,100, the most you can lose is $1,100. You can sell it at any time (assuming there is open interest, and there is with GME).

But maybe don't learn about options on GME.",0.097,0.845,0.058,-0.2648
49,DD,"The price is around $65 right now. All DD is saying that the squeeze has yet to happen. Also, some really good thesis’ are suggesting the stock is way undervalued if you hold long term. Checkout gmedd.com",0.0,0.919,0.081,0.4927
50,TSLA,Said people in summer of 2020 about TSLA lmao,0.0,0.672,0.328,0.5994
51,TD,I only see up to $75 on TD right now.,0.0,1.0,0.0,0.0
52,MT,"The dd was good though. And to be honest I'd say a lot of the shit being pumped now has good dd.

They have been pumping MT a steel company for a month, and if you look up how steel has been doing it does seem like this will do very well at the end of February earnings. Blackberry sounded retarded until I read the dd and some articles outside of wsb. Actually does sound like its under valued.

Now I'm not willing to go all in either one but I definitely picked up shares.

Edit

I will say I am pretty skeptical of the couple guys pushing ford.",0.044,0.738,0.218,0.952
53,GME,You should check out roaring kitty on YouTube he’s the dude from WSB and that invested 50K calls on GME last year. He has like 13 million now and honestly his streams are really informative!,0.0,0.851,0.149,0.6996
54,DD,"I learnt more from 2 ays of WSB memes and sea shanties than I ever have on this sub which seems full of fake accounts, trolls and people giving shit opinions with no DD",0.232,0.705,0.063,-0.7579
55,IRL,"From knowing a lot of IRL wallstreet bros old and young, I’m telling you, it’s the same shit in real life. Smart idiots.",0.137,0.76,0.103,-0.2263
56,GME,"Lmaoooo buddy told me ""GME at 9 bucks looks good, should i buy?"" I told him its up to him but personally i wouldn't because theres no value. I didnt invest, he didnt invest 🤡🤡🤡",0.0,0.785,0.215,0.7493
57,BB,"Between GME, PLTR and BB I’ve had a very good couple of months. 

Good luck!",0.0,0.54,0.46,0.855
58,GME,"Between GME, PLTR and BB I’ve had a very good couple of months. 

Good luck!",0.0,0.54,0.46,0.855
59,PLTR,"Between GME, PLTR and BB I’ve had a very good couple of months. 

Good luck!",0.0,0.54,0.46,0.855
60,TSE,"No idea what XETRA is, but either TSE or NYSE is the same shares, just 2 different exchanges (so no it doesn’t)",0.175,0.714,0.111,-0.1531
61,GME,"Just buy regular GME stock on Monday don’t fuck with options starting off. 
I have 20 shares of GME at $25. Over doubled my money already",0.122,0.801,0.077,-0.3182
62,BBBY,There will be more.. BBBY might be the next pump and dump.  It’s steady going up for weeks.,0.133,0.867,0.0,-0.3818
63,GME,"What do you think they're planning this weekend? What could conceivably happen to screw people getting in on Monday morning?

I grew up poor and constantly afraid of scams, hidden fine print, etc. I can't stop playing scenarios in my head where I put money in and then something happens like Robinhood deactivates the accounts of people buying GME or whatever. Not trying to be negative, but how do I assuage these fears?",0.173,0.768,0.059,-0.8378
64,GME,Are you joking or is that a probable price target for GME in the future?,0.0,0.872,0.128,0.2263
65,GME,"Wait, so why would GME reach $1k? Just because of retail buying shares?",0.0,0.75,0.25,0.3939
66,GME,"And, on top of that, GME calls are selling for a huge premium right now.  They are very costly, so that offsets the losses somewhat.",0.154,0.702,0.144,-0.0754
67,DD,"I’ve actually read a ton, and I’m ready to go in with a very small amount of f-you money I won’t miss if I lose. I am just not 100% sure from reading other people’s DD if buying stocks is as “good” as options, for this whole endavour. I am usually a long time investor, only investing in companies that I know and/or understand and believe in their fundamental “business”. I don’t usually do market plays i guess, so i’ve never took part in a short squeeze so i am not sure whether owning the underlying asset or just options (which again, I also don’t dabble in) is different in this case. GME is obviously not a long term investment at 60-70$, so i guess the question is, is there a difference in this play between owning options or owning the stock. (Although I guess I don’t really see how it would be)",0.057,0.876,0.067,0.3666
68,GME,"I’ve actually read a ton, and I’m ready to go in with a very small amount of f-you money I won’t miss if I lose. I am just not 100% sure from reading other people’s DD if buying stocks is as “good” as options, for this whole endavour. I am usually a long time investor, only investing in companies that I know and/or understand and believe in their fundamental “business”. I don’t usually do market plays i guess, so i’ve never took part in a short squeeze so i am not sure whether owning the underlying asset or just options (which again, I also don’t dabble in) is different in this case. GME is obviously not a long term investment at 60-70$, so i guess the question is, is there a difference in this play between owning options or owning the stock. (Although I guess I don’t really see how it would be)",0.057,0.876,0.067,0.3666
69,GME,"Don’t tell me that, I had a reminder in my phone to buy a GME option at open, and I disregarded it",0.133,0.867,0.0,-0.3818
70,GME,"Not quite a pump and dump although the end result is the same : holders will be on the other side.

That said, a lot of people who bought in did so for the long term play. If Cohen and co can turn GME into an ecommerce and pc part business, then 80-160$ long term is a totally reasonable estimate. Its like if blockbuster was willing to adapt to the changing times by bringing in new leadership with experience in the netflix model. No one at this company is banking on the short squeeze. I am trying to time the squeeze, but if I miss it I don't mind holding for a few years as the company gets its footing.

This is more like a game of chicken.
Options are forcing the shorts to take their losses.
Shareholders then sell to the shorts for ever increasing-prices.
So long as you are one of the sellers before the peak, you're theoretical profits are infinite, when in reality the upper bound is just wherever the share price is on the last short seller closing out their position. People screaming 420.69, sell at 400. People screaming 100, sell at 95, etc. If it happens, they have to buy back their shorts at whatever the price is. Period.",0.068,0.862,0.071,0.1576
71,GME,"yes sorry, it indeed is a buy as wallstreet/citron shorted GME

thank you for the explanation",0.07,0.649,0.281,0.5994
72,GME,"LOL that’s the funniest part to me. Stocks get halted after big moves all the time, but all of a sudden it’s a conspiracy. Shit GME was halted at $10 when the Microsoft news came out. Seems the price ended up fine after that. I’m jacked to the tits on GME but man I really don’t understand the need to make up stories.",0.163,0.744,0.093,-0.7954
73,GME,"A 60 call option has a premium of 11.76 per share so buying 1 contract would cost 1176 in total. Assuming GME went up to 70, so 10 dollars in profit times 100 shares: 1000 minus the premium we pay which is 1176 that means a loss 176, no?

Just got into learning how call options work please correct me if im wrong",0.129,0.733,0.138,0.1531
74,DD,There's great DD all over for how this is a once in a lifetime opportunity.  This isn't manipulation this is just smart investing :^),0.0,0.538,0.462,0.9272
75,GME,Everytime there has been a sell wall built up over the last week on GME it has been absolutely shattered like it was nothing.,0.125,0.773,0.102,-0.1567
76,TSLA,"""We are investors who put safety and family first, and when we believe this has been compromised, it is our duty to walk away from a stock.” - Shitron

What kind of a spineless cunt blames being wrong about a stock because his children were (allegedly) bullied.

He fucked up. Be a man and admit it and move on. He managed to do man up about his TSLA mistake.",0.247,0.696,0.057,-0.946
