,ticker,comment,username,score,permalink,neg,neu,pos,compound
0,IQ," Because our government has been bought and paid for by billionaires. These crooks own the government. They steal their billions using illegal and manipulative methods. They then donate to corrupt politicians so that those politicians win(the politicians are good at convincing the public they are the good guy but money and illegal voting also go a long way). Over time you end up with a lot of dumb ass corrupt politicians in power that are easily bribed, and that is what happens. That is what happened. This shit has been going on for 100+ years but probably in the last 60 is when it took off(starting in the 60's and really turning the corner in the 70's).  Drugs, hookers, mansions, trips, etc... all used to entice these politicians(remember that either they were already rich or somewhat poor so either they already played the game or were easily swayed buy the riches). The problems started stacking up bigger and bigger. And now we are here....

The government isn't going to fix itself, it can't, how could it? It's like asking a child to build the space shuttle. It can't even if it wanted to. It doesn't know how.  Most politicians are literally morons(Avg IQ < 100, ok, I know a moron is technically like < 70 but in some sense many of them are when you include modern advancements like the internet and society). They never actually learn any real world skills that enable them to truly government an advanced society in a positive way(They might learn the political game and have to be two faced but they don't learn about psychology, mathematics, science, etc). Of course they all think they are geniuses because they won their election... but they just go on to fuck shit up. Take any politician you can find, NONE of them are qualified! NONE! There are people out there that are truly intelligent and could make a real difference. 10x more intelligent than all the politicians combined. But if they ran they would not win since the billionaires would see them as a threat and throw as much money as needed to stop them(they know they can get the money back easily so it's not a big deal, it's not a waste but an investment).

This is the kind of shit that happens. The slaves don't think about this shit because they generally are too busy working and just trying to survive and have been manipulated to waste their lives on meaningless shit(i.e., they are dumbed down intentionally).  Notice how hard it is to get any criminal politician, cop, bureaucrat, billionaire, or anyone part of the system to be held accountable even in the minorist of ways. Even things that used to be logical such as: If someone steals money they have to pay back more and go to jail. Now that only applies the slaves.

What happens if that when you end up with a group of people that work together there is a distillation and concentration of the core mentalities. This is how cults are formed. ""Dissidents"" are kicked out/excluded/ostracized/belittled/etc. Over time all organizations turn in to cults because of this. This is ""crystallization"" and it's the same thing that happens with crystal formation(Because the same abstract dynamical processes are at play) and many other natural phenomena. It's not a bad thing except cults generally are just an echo chamber and any contradictions/falsehoods that show up by the leaders can't be challenged by the followers(since leaders do not want to be challenged nor lose their position(rather it being about who can actually best lead)). So, we have these very basic problems that cause major issues in societies and our governments are the biggest manipulators of society... and they have these problems but no politician is intelligent enough to understand them but even if a few were, they would be ignored by the ignore morons. 

&#x200B;

It's just the way it is. As humanity gets more intelligent it will try to shed off the ignorance of the past... that is what is happening now. It is a very slow and sometimes very unstable process. IF humanity lasts and has no major negative setbacks(like nuclear war, biowar, etc) then it will eventually figure this shit out(a lot of it is already known/discovered but it just hasn't been absorbed in to the ""DNA"" of humanity yet). Most people have an intuitive sense when things are wrong but no intellectual sense, this makes them less effective at creating proper change but they generally do go in the right direction given enough time(sorta like a biased random walk).

For example, If someone suggests that our politicians need to be intelligence tested, show a wide variety of knowledge and experiences, force their policies to be stress tested, and have restrictive limits put on them, no one wants all that. No one really wants to require politicians to be properly educated. The morons do this to themselves. They want their cake and eat it too. The morons want to remain morons(go party, fuck, have fun, drink, fuck some more, have kids, get rich doing nothing, fuck some more) and they want their politicians to be like them. Socrates and Plato new over 2500's ago the kinds of things needed, yet man kind still hasn't learned these basic principles(because the morons refuse to educate themselves because fucking is easier and more fun).  For those people that want a better work and try themselves to do better, they unfortunately are stuck in a world dictated by the masses. This is why education should be the #1 focus by humanity. All our energies should be pored in to it. Free education for all. Only shelter, energy, and food come first. Educate the masses of morons(pay them to get educated and make it a life long process) and things will start to change drastically. Almost all the problems man today have been analyzed for millennia by millions of humans. The answers are more or less out there, but it requires the masses to at least learn about the questions first.",EternalDissonance,8,/r/stocks/comments/m9z8ai/hedge_fund_manager_steve_cohen_who_bailed_out/grq6sm1/,0.155,0.721,0.125,-0.989
1,GME, I hope this GME saga fucking ruins citadel and Melvin and I hope every single person that has contributed to the downfall of businesses they drove into the ground loses their job and has to actually feel what it is like to struggle at real life. Fuck them all to the moon and back.,DaBi5cu1t,24,/r/stocks/comments/m9z8ai/hedge_fund_manager_steve_cohen_who_bailed_out/grpwbnf/,0.175,0.697,0.128,-0.4576
2,AMC," I'm addicted to the American Greed series. It baffles me how people just hand their life savings over to someone. Most do very little time while there are examples made of some. I'm only saying this bc I know what I'm doing for the next 53 minutes. Thanks for the post. I agree, it's a big game rigged in favor of the rich. This is while I'm holding my 1 gme and few AMC shares until I see you APES on the MOON 🦍❤💪",amideady3t_,3,/r/stocks/comments/m9z8ai/hedge_fund_manager_steve_cohen_who_bailed_out/grq8toz/,0.056,0.761,0.183,0.8979
3,GME, r/GME is gonna love this. Great that you’re bringing attention back to the inner workings of some of the market makers. See you on the moon 🖖🏻,Impossible_Drawing84,2,/r/stocks/comments/m9z8ai/hedge_fund_manager_steve_cohen_who_bailed_out/grqh6d2/,0.0,0.734,0.266,0.8772
4,TV, I see you just learned the history of Steve Cohen. Shocking! Watch Billions. It is a TV “loosely based on” him.,seattle-diarrhea-dad,2,/r/stocks/comments/m9z8ai/hedge_fund_manager_steve_cohen_who_bailed_out/grqmefo/,0.143,0.857,0.0,-0.4574
5,PAYA, Hot tip: he just bought a huge stake in PAYA a few weeks ago. There were also a large number of $15 4/16 calls opened around the same time. Do with that what you will.,chripuck,2,/r/stocks/comments/m9z8ai/hedge_fund_manager_steve_cohen_who_bailed_out/grqo96u/,0.0,0.893,0.107,0.3818
6,TV, Wow thanks for the link. I looovveeee Frontline and PBS. This escaped my radar. As someone who's watching Billions TV show which is based on this guy I can't wait to catch-up on that Frontline doc,PsychologicalLoad1,1,/r/stocks/comments/m9z8ai/hedge_fund_manager_steve_cohen_who_bailed_out/grqrom8/,0.0,0.827,0.173,0.7717
7,AMC, This is what we at AMC and GME are fighting for come join our struggle with your diamond hands,natebuffay22,1,/r/stocks/comments/m9z8ai/hedge_fund_manager_steve_cohen_who_bailed_out/grqpy62/,0.197,0.615,0.189,-0.0516
8,GME, This is what we at AMC and GME are fighting for come join our struggle with your diamond hands,natebuffay22,1,/r/stocks/comments/m9z8ai/hedge_fund_manager_steve_cohen_who_bailed_out/grqpy62/,0.197,0.615,0.189,-0.0516
9,GME," There will be tarring and feathering if the rightful rewards from the risk that GME investors have taken, is interfered with.",Cheap_Confidence_657,1,/r/stocks/comments/m9z8ai/hedge_fund_manager_steve_cohen_who_bailed_out/grqj9ym/,0.087,0.785,0.128,0.25
10,PAC," Because Wall Street is basically a cabal of - no, really, will say it, Jewish mafia cabal, and they control trillions, the Super PAC dark money funds,  and the worlds largest money laundering machine, Las Vegas. They never go to jail, they just get some BS public humiliation and a fine. They never ever truly hurt one another, even Bernie Madoff got it easy....",STFUand420,-2,/r/stocks/comments/m9z8ai/hedge_fund_manager_steve_cohen_who_bailed_out/grqatg3/,0.116,0.766,0.118,0.0439
11,GME," Exactly what they did to DeepFuckingValue. The bunch of clown's went after us retailers as manipulation of the markets while they have a big party laughing at us through their corruption that they do to help each other. The equity market is controlled and manipulated, after the GME accident I realized how little control we have in anything we can invest besides crypto. All media outlets covered the GME accident through us retailers yet nobody mentioned about halt trading with Citadel or hedgefunds doing risky trades. What a fucking joke we live through for a few bucks to provide for our families while these rich assholes just keep the same system in favor of them for forever.",MiggleGiggles15,20,/r/stocks/comments/m9z8ai/hedge_fund_manager_steve_cohen_who_bailed_out/grpykda/,0.123,0.748,0.129,0.2006
12,IRS, Yup. I read an article not long ago about how the IRS doesn't go after millionaires or very large companies because they don't have the capital to fight them in court. So basically they just let them do what they want and audit the little guys because they can bully them,emeown,8,/r/stocks/comments/m9z8ai/hedge_fund_manager_steve_cohen_who_bailed_out/grpz0rf/,0.107,0.869,0.024,-0.6705
13,PAC," Wikipedia 

“In 2015, Steven Cohen and his wife, Alexandra, donated $2.25 million to a Super PAC called America Leads that supported Chris Christie's presidential candidacy.

In 2017, Cohen contributed $1 million to Donald Trump's inauguration.”",hhh888hhhh,1,/r/stocks/comments/m9z8ai/hedge_fund_manager_steve_cohen_who_bailed_out/grqpepo/,0.0,0.838,0.162,0.7351
14,PAC," Wikipedia 
“In 2015, Steven Cohen and his wife, Alexandra, donated $2.25 million to a Super PAC called America Leads that supported Chris Christie's presidential candidacy.

In 2017, Cohen contributed $1 million to Donald Trump's inauguration.”",hhh888hhhh,1,/r/stocks/comments/m9z8ai/hedge_fund_manager_steve_cohen_who_bailed_out/grqpicw/,0.0,0.838,0.162,0.7351
15,IR," I lived a year of that man and his douchebag hf buddies calling and emailing my office a dozen times a day at the company where I was IR when they tried to short us into bankruptcy. He is absolutely behind it all. He is a micro manager and knows about everything going on and drives it. He uses everyone and everything, he is above the law and would rob a dying homeless man on the street if he thought no one was watching.",backrow29,8,/r/stocks/comments/m9z8ai/hedge_fund_manager_steve_cohen_who_bailed_out/grq1z5z/,0.117,0.883,0.0,-0.8689
16,AI," This makes me wonder if things like auditing would be a great future candidate to deploy AI.  Because unless you intentionally program it to have some kind of bias, it should be free of concerns over self-interest.

Of course, in the end there would always be huimans involved in the process and so that part could get corrupted, but it might be harder to hide it all the time.",ptwonline,9,/r/stocks/comments/m9z8ai/hedge_fund_manager_steve_cohen_who_bailed_out/grqeujw/,0.047,0.865,0.089,0.4684
17,AMC," I think these hedge fund 1% guys knew something before the pandemic started  and doubled down before the SHTF.  High level apes caught wind of this then started the AMC and GME campaigns to fuck them over big. Kinda like those politicians in congress shorting all their hotel stocks before the pandemic started. That was completely swept under rug and never heard of again. These fuckers knew.  So in a nutshell the “club” informs its members of the plan and what to do to get filthy rich the process   of an imminent collapse. Just a little theory of mine . So move along , nothing to see here boys.   I’m gonna binge on a bushel of bananas now.",PJD31111,21,/r/stocks/comments/m9z8ai/hedge_fund_manager_steve_cohen_who_bailed_out/grq0hp3/,0.086,0.867,0.047,-0.6997
18,GME," I think these hedge fund 1% guys knew something before the pandemic started  and doubled down before the SHTF.  High level apes caught wind of this then started the AMC and GME campaigns to fuck them over big. Kinda like those politicians in congress shorting all their hotel stocks before the pandemic started. That was completely swept under rug and never heard of again. These fuckers knew.  So in a nutshell the “club” informs its members of the plan and what to do to get filthy rich the process   of an imminent collapse. Just a little theory of mine . So move along , nothing to see here boys.   I’m gonna binge on a bushel of bananas now.",PJD31111,21,/r/stocks/comments/m9z8ai/hedge_fund_manager_steve_cohen_who_bailed_out/grq0hp3/,0.086,0.867,0.047,-0.6997
19,GME," He walked away with billions which is so crazy should have all been confiscated! But, anyone would prob do the same pay the fine and keep the juicy profit, He actually bought the Mets with those profits and was a big part of the GME Melvin bailout- he deleted his Twitter for a while cuz he was getting harassed.",Angeleyestrades,3,/r/stocks/comments/m9z8ai/hedge_fund_manager_steve_cohen_who_bailed_out/grqfsgs/,0.144,0.743,0.113,-0.2751
20,TV," Yea I think he's going to get scapegoated to be honest. Jon Corzine literally stole money from client accounts, destroyed MF Global and didn't go to jail lol.  I watched Bill Ackman cry on TV and say that Hilton was going to zero...as he was buying up shares of Hilton lol",iLoveTheTendies,10,/r/stocks/comments/m9z8ai/hedge_fund_manager_steve_cohen_who_bailed_out/grpz179/,0.104,0.712,0.184,0.5859
21,AI, They already use AI to a small extent for auditing. They can find irregularities pretty easily which can then be looked into by a human.,President_JoeBiden,2,/r/stocks/comments/m9z8ai/hedge_fund_manager_steve_cohen_who_bailed_out/grqmsg7/,0.0,0.789,0.211,0.6808
22,AI," If you're not careful enough, that AI would exploit this conflict of interest even better. 
Think of two AI's, the auditor and the auditee in contact, cooking books perfectly and ensuring both stay in business.",ionicbeam,1,/r/stocks/comments/m9z8ai/hedge_fund_manager_steve_cohen_who_bailed_out/grqnp8e/,0.12,0.613,0.267,0.8285
23,IR," I was at a publicly held company in the Homebuilding space and when that failed went to one of the largest brands in the world as IR. I have a lot of first hand knowledge about what happened with the housing market, lending, trading and the street. My life and career from 1993 to 2012 when I left the cap markets space is filled with details and direct first hand experience. 

Cohen was protected by Icahn and Cooperman. These people are rotten to their core and none are innocent.

Edit: mistyped year. Forgot a stint along the way. It all blends together.",backrow29,7,/r/stocks/comments/m9z8ai/hedge_fund_manager_steve_cohen_who_bailed_out/grq32gm/,0.08,0.834,0.086,0.169
24,CPA," He's barred from managing other LP / other people's capital (Point72 is technically a family office / initially capitalized purely by Stevie - my background is in accounting and corporate M&A, so I unfortunately just know enough law to get by to navigate to the important parts of PSAs/contracts + whatever I had to learn to pass the CPA exam back in like 2013) if I recall correctly. Not sure what sort of developments have been made since then since P72 is probably at a HF Prestige tier just below the Tiger Cub funds and maybe Bridgewater/Citadel, all the while bearing the scarlet letter of ""family office""",trill_collins__,0,/r/stocks/comments/m9z8ai/hedge_fund_manager_steve_cohen_who_bailed_out/grqmu5f/,0.049,0.909,0.042,-0.197
25,AMC, It wasn’t supposed to come back up. They were supposed to make hundreds of millions in tax free profits bankrupting multiple brick and mortar businesses. AMC was the big one.Just look at all the meme stocks. AMC was the most vulnerable by far.,PJD31111,1,/r/stocks/comments/m9z8ai/hedge_fund_manager_steve_cohen_who_bailed_out/grqlb6l/,0.045,0.827,0.128,0.6133
26,BIG," WAFFLES, BIG TASTY WAFFLES",canuckpilot93,9,/r/stocks/comments/m9w38j/if_you_knew_that_well_enter_a_recession_and_hit/grpkq1p/,0.0,1.0,0.0,0.0
27,AMZN," Obviously this depends on what sector/company crashes the hardest, but the companies with excellent balance sheets and strong future revenue streams will perform. 

TSM, MSFT, AMZN, TSLA for starters.

Then $$ in general index funds (SPY, VEQT) which will provide stability and almost guaranteed growth after a crash.",guy_w_dijon_on_shirt,52,/r/stocks/comments/m9w38j/if_you_knew_that_well_enter_a_recession_and_hit/grpe9kb/,0.06,0.728,0.211,0.873
28,MSFT," Obviously this depends on what sector/company crashes the hardest, but the companies with excellent balance sheets and strong future revenue streams will perform. 

TSM, MSFT, AMZN, TSLA for starters.

Then $$ in general index funds (SPY, VEQT) which will provide stability and almost guaranteed growth after a crash.",guy_w_dijon_on_shirt,52,/r/stocks/comments/m9w38j/if_you_knew_that_well_enter_a_recession_and_hit/grpe9kb/,0.06,0.728,0.211,0.873
29,TSLA," Obviously this depends on what sector/company crashes the hardest, but the companies with excellent balance sheets and strong future revenue streams will perform. 

TSM, MSFT, AMZN, TSLA for starters.

Then $$ in general index funds (SPY, VEQT) which will provide stability and almost guaranteed growth after a crash.",guy_w_dijon_on_shirt,52,/r/stocks/comments/m9w38j/if_you_knew_that_well_enter_a_recession_and_hit/grpe9kb/,0.06,0.728,0.211,0.873
30,TSM," Obviously this depends on what sector/company crashes the hardest, but the companies with excellent balance sheets and strong future revenue streams will perform. 

TSM, MSFT, AMZN, TSLA for starters.

Then $$ in general index funds (SPY, VEQT) which will provide stability and almost guaranteed growth after a crash.",guy_w_dijon_on_shirt,52,/r/stocks/comments/m9w38j/if_you_knew_that_well_enter_a_recession_and_hit/grpe9kb/,0.06,0.728,0.211,0.873
31,KO," Aristocrat dividend payers like KO JNJ MMM and other sectors. Never sell, reinvest and retire early",strongkhal,5,/r/stocks/comments/m9w38j/if_you_knew_that_well_enter_a_recession_and_hit/grpidia/,0.0,0.857,0.143,0.3612
32,MMM," Aristocrat dividend payers like KO JNJ MMM and other sectors. Never sell, reinvest and retire early",strongkhal,5,/r/stocks/comments/m9w38j/if_you_knew_that_well_enter_a_recession_and_hit/grpidia/,0.0,0.857,0.143,0.3612
33,TSLA," ARK ETFs, TSLA and ABML(OTC, for buyer awareness) ... those would be my top 3.

Full ... disclosure ... I actually just moved \~$77k from 401k(limited trading options) to my IRA(all trading options) and did something close to the below:  


$23k - $TSLA

$18k - $ABML

$10000 - $ARKK

$7500 - $ARKW

$7500 - $VACQ(Rocket Lab SPAC)

$4000 - $TRCH (one Im happy to have but would not strongly advocate)

Leaving me another \~$7k to buy any additional dips.  


I'm not a financial advisor and my risk tolerance is on the higher end.  Do your own research and come to your own conclusions.  


Good luck no matter your choice.",Anonymouse_25,23,/r/stocks/comments/m9w38j/if_you_knew_that_well_enter_a_recession_and_hit/grpj47b/,0.067,0.798,0.135,0.7832
34,ES," If I knew it was the bottom?
8 long ES contracts and call it a day",spreadsgetyouhead,3,/r/stocks/comments/m9w38j/if_you_knew_that_well_enter_a_recession_and_hit/grp8qwx/,0.0,1.0,0.0,0.0
35,AAPL," If we were already at rock bottom, I would put 25% into bonds, mutual funds and gold. 75% split up between VOO, QQQ, AAPL, GOOGL, HACK, Ibuy. Out of that 75% I would move 10% frequently but let the rest hold.

Edit: I would also buy NVDA and some form of digital currency. This would be part of the 75%",Eatsomeplants,3,/r/stocks/comments/m9w38j/if_you_knew_that_well_enter_a_recession_and_hit/grpjsco/,0.0,1.0,0.0,0.0
36,GOOGL," If we were already at rock bottom, I would put 25% into bonds, mutual funds and gold. 75% split up between VOO, QQQ, AAPL, GOOGL, HACK, Ibuy. Out of that 75% I would move 10% frequently but let the rest hold.

Edit: I would also buy NVDA and some form of digital currency. This would be part of the 75%",Eatsomeplants,3,/r/stocks/comments/m9w38j/if_you_knew_that_well_enter_a_recession_and_hit/grpjsco/,0.0,1.0,0.0,0.0
37,NVDA," If we were already at rock bottom, I would put 25% into bonds, mutual funds and gold. 75% split up between VOO, QQQ, AAPL, GOOGL, HACK, Ibuy. Out of that 75% I would move 10% frequently but let the rest hold.

Edit: I would also buy NVDA and some form of digital currency. This would be part of the 75%",Eatsomeplants,3,/r/stocks/comments/m9w38j/if_you_knew_that_well_enter_a_recession_and_hit/grpjsco/,0.0,1.0,0.0,0.0
38,BLUE," BLUE. Not gonna pump, but so incredibly low risk given upcoming events it will make 20%",wayneio,2,/r/stocks/comments/m9w38j/if_you_knew_that_well_enter_a_recession_and_hit/grpfft6/,0.332,0.668,0.0,-0.7888
39,JPM," Blue Chips, Microsoft, JPM, Visa, Amazon, some Tesla, maybe some XOM or REIT's but if you knew it was going down you could make a killing on puts and then buy stocks to hold on the way back up!",VirtualHaze92,2,/r/stocks/comments/m9w38j/if_you_knew_that_well_enter_a_recession_and_hit/grpleq0/,0.146,0.823,0.031,-0.793
40,XOM," Blue Chips, Microsoft, JPM, Visa, Amazon, some Tesla, maybe some XOM or REIT's but if you knew it was going down you could make a killing on puts and then buy stocks to hold on the way back up!",VirtualHaze92,2,/r/stocks/comments/m9w38j/if_you_knew_that_well_enter_a_recession_and_hit/grpleq0/,0.146,0.823,0.031,-0.793
41,TSLA," 25,000 into VWAGY, 10,000 into TSLA, 25,000 into a growth ETF like VUG/Moon, 20,000 into Amazon, and 20,000 into Emerging markets",Ok_Brilliant4181,2,/r/stocks/comments/m9w38j/if_you_knew_that_well_enter_a_recession_and_hit/grpluyq/,0.0,0.714,0.286,0.7003
42,TSM," Tesla, Apple, Amazon, Microsoft.

If I'm aiming for the moon, TSM.",Asking4Afren,2,/r/stocks/comments/m9w38j/if_you_knew_that_well_enter_a_recession_and_hit/grpsppk/,0.0,0.855,0.145,0.1779
43,AMC," GME - Play games heck with stock market
AMC - watch and spend good time, 
Macys - Shop
Insurance",shankarjain40,3,/r/stocks/comments/m9w38j/if_you_knew_that_well_enter_a_recession_and_hit/grpfbkc/,0.0,0.725,0.275,0.6486
44,GME," GME - Play games heck with stock market
AMC - watch and spend good time, 
Macys - Shop
Insurance",shankarjain40,3,/r/stocks/comments/m9w38j/if_you_knew_that_well_enter_a_recession_and_hit/grpfbkc/,0.0,0.725,0.275,0.6486
45,GME, Blackstone is bought shares in GME. I found an article regarding Blackstone and Fidelty. I found it suspicious that we were getting people telling  others to put the shares to Fidelty. https://www.investmentnews.com/blackstone-partners-with-fidelity-on-new-alt-focused-mutual-fund-53184,Ok_Freedom6493,76,/r/stocks/comments/m9w38j/if_you_knew_that_well_enter_a_recession_and_hit/grpn2bf/,0.074,0.796,0.13,0.2263
46,DD," But half of these questions are people being too lazy to do their own DD and want others to tell them what to buy.

It’s like a self fulfilling prophecy if they end up losing money BECAUSE BUT BUT BIGdong420 told me to buy!!",aQuestionableDebtor,122,/r/stocks/comments/m9w38j/if_you_knew_that_well_enter_a_recession_and_hit/grpl22x/,0.09,0.847,0.063,-0.3036
47,TSM, TSM,HiddenKai104,77,/r/stocks/comments/m9w38j/if_you_knew_that_well_enter_a_recession_and_hit/grplwo1/,0.0,1.0,0.0,0.0
48,ASML," ASML, dutch based company that sells chip making machines. They basically have a monopoly in their market. Dutch secret service advised them not to sell to china, thats how good they are.",buggsbunnysgarage,65,/r/stocks/comments/m9w38j/if_you_knew_that_well_enter_a_recession_and_hit/grpt0rt/,0.0,0.912,0.088,0.4404
49,GME, The GME squeeze is about to crash the whole market,shamelessamos92,442,/r/stocks/comments/m9w38j/if_you_knew_that_well_enter_a_recession_and_hit/grplf89/,0.231,0.769,0.0,-0.4019
50,GME, GME is about to cause the 2021 Short Crisis in the very near future,shamelessamos92,73,/r/stocks/comments/m9w38j/if_you_knew_that_well_enter_a_recession_and_hit/grpjigo/,0.24,0.76,0.0,-0.6249
51,AT, But he said it would be AT the bottom. Lol you’re buying puts when the market only has room for up,Rangeninc,2,/r/stocks/comments/m9w38j/if_you_knew_that_well_enter_a_recession_and_hit/grq8maw/,0.0,0.877,0.123,0.4215
