,ticker,comment,neg,neu,pos,compound
140,DD,"Heres a DD done by a Redditor: [https://www.reddit.com/r/Vitards/comments/kx8vp0/my\_lumn\_dd\_from\_wsb/](https://www.reddit.com/r/Vitards/comments/kx8vp0/my_lumn_dd_from_wsb/)

Listen to the podcast: [https://www.youtube.com/watch?v=wzPAHXkX6tM&t=1640s](https://www.youtube.com/watch?v=wzPAHXkX6tM&t=1640s)

This play is low risk, extremely high reward. One of my favorites.",0.132,0.567,0.301,0.746
141,PLTR,Going to start wheeling some PLTR or something to get some premium so I can buy more ARKX :D,0.0,0.798,0.202,0.6498
142,NAV,"Unlike an IPO, market makers can use the NAV to price ETFs.  So any large price swings get corrected by shorting to the NAV.",0.0,1.0,0.0,0.0
143,PM,"I will be messaging you in 1 month on [**2021-03-17 21:32:02 UTC**](http://www.wolframalpha.com/input/?i=2021-03-17%2021:32:02%20UTC%20To%20Local%20Time) to remind you of [**this link**](https://np.reddit.com/r/investing/comments/l21phu/ark_space_exploration_etf_arkx_n1a_filing/gk3u4wd/?context=3)

[**CLICK THIS LINK**](https://np.reddit.com/message/compose/?to=RemindMeBot&subject=Reminder&message=%5Bhttps%3A%2F%2Fwww.reddit.com%2Fr%2Finvesting%2Fcomments%2Fl21phu%2Fark_space_exploration_etf_arkx_n1a_filing%2Fgk3u4wd%2F%5D%0A%0ARemindMe%21%202021-03-17%2021%3A32%3A02%20UTC) to send a PM to also be reminded and to reduce spam.

^(Parent commenter can ) [^(delete this message to hide from others.)](https://np.reddit.com/message/compose/?to=RemindMeBot&subject=Delete%20Comment&message=Delete%21%20l21phu)

*****

|[^(Info)](https://np.reddit.com/r/RemindMeBot/comments/e1bko7/remindmebot_info_v21/)|[^(Custom)](https://np.reddit.com/message/compose/?to=RemindMeBot&subject=Reminder&message=%5BLink%20or%20message%20inside%20square%20brackets%5D%0A%0ARemindMe%21%20Time%20period%20here)|[^(Your Reminders)](https://np.reddit.com/message/compose/?to=RemindMeBot&subject=List%20Of%20Reminders&message=MyReminders%21)|[^(Feedback)](https://np.reddit.com/message/compose/?to=Watchful1&subject=RemindMeBot%20Feedback)|
|-|-|-|-|",0.109,0.891,0.0,-0.6322
144,GME,Hard decision. Right now put it all in GME to fight the good fight,0.338,0.513,0.149,-0.4019
145,GME,I don't believe in GME to handle one red cent of my money.,0.0,1.0,0.0,0.0
146,BB,"Suddenly it's in the spotlight because of BB, while for the last years that exact exposure was highly criticized. Funny how quickly things can turnaround.

Either way, I don't hold FRFHF because of BB. It's a fantastic company, great culture across the board and operations wise they have a nice combined ratio in the insurance business. Prem has a lot of skin in the game and is a true and respected value investor. They have exposure to value plays and to regions that will experience massive growth (India & African countries) with a their time horizon that looks beyond the next quarters. Buy and hold.",0.023,0.712,0.265,0.9804
147,OVID,"The acquisition has serious risk in the UK approval process. I think the flatness is pricing in that risk.
The automobile business is many years away from profitability. Many more years now that COVID caused a slowdown in the auto market. 

Personal opinion: I do believe that an approval will cause a pop.",0.097,0.757,0.146,0.5859
148,UK,"The acquisition has serious risk in the UK approval process. I think the flatness is pricing in that risk.
The automobile business is many years away from profitability. Many more years now that COVID caused a slowdown in the auto market. 

Personal opinion: I do believe that an approval will cause a pop.",0.097,0.757,0.146,0.5859
149,NVDA,"With or without the ARM deal, I'm extremely bullish on NVDA either way. But I think the ARM deal is far from a done deal.",0.0,1.0,0.0,0.0
150,NVDA,The trading range has been frustrating after having such a strong performance most of the year. I'm more concerned with what might happen if/when the ARM transaction doesn't happen. Personally I think NVDA will do better with a final decision on ARM either way.,0.062,0.807,0.132,0.5106
151,IMO,"My view is this was a dumb acquisition. Sorry for the ramblings below - it's still early and I need more coffee:

I like both ARM and NVDA but the two of them being in one company hampers ARM's core strength: They're a design house, not an SOC vendor. There are a lot of ARM vendors out there precisely because of that - they don't have to approach ARM as a potential competitor that they need to do business with. They know their business interests are aligned.

NVDA buying ARM changes this dynamic. Sure, the regulators will ask NVDA to put all kinds of firewalls around ARM not to affect other ARM vendors. But even that won't be enough IMO.

Meanwhile, if NVDA wants to utilize ARM's personnel to design their own SOCs (say, like Apple), well, that works well if you're not planning to sell your chips (say, like Apple!) A marketable core needs to have the tradeoffs you need when you sell to multiple customers. So I don't see why NVDA would need direct access to ARM to design and sell a custom SOC or anything like that. Doesn't make much sense to me.

Mergers usually fail to realize the rosy projections. Especially in this industry...",0.036,0.82,0.144,0.9755
152,NVDA,"My view is this was a dumb acquisition. Sorry for the ramblings below - it's still early and I need more coffee:

I like both ARM and NVDA but the two of them being in one company hampers ARM's core strength: They're a design house, not an SOC vendor. There are a lot of ARM vendors out there precisely because of that - they don't have to approach ARM as a potential competitor that they need to do business with. They know their business interests are aligned.

NVDA buying ARM changes this dynamic. Sure, the regulators will ask NVDA to put all kinds of firewalls around ARM not to affect other ARM vendors. But even that won't be enough IMO.

Meanwhile, if NVDA wants to utilize ARM's personnel to design their own SOCs (say, like Apple), well, that works well if you're not planning to sell your chips (say, like Apple!) A marketable core needs to have the tradeoffs you need when you sell to multiple customers. So I don't see why NVDA would need direct access to ARM to design and sell a custom SOC or anything like that. Doesn't make much sense to me.

Mergers usually fail to realize the rosy projections. Especially in this industry...",0.036,0.82,0.144,0.9755
153,UK,"Appreciate the insight. On what grounds could the UK antitrust deny it?

What happens if some countries approve and others deny? How does Nvidia resolves that mess?",0.229,0.643,0.129,-0.533
154,NVDA,I think NVDA would be trading higher right now had the ARM acquisition never been a thing. Market doesnt like uncertainty.,0.1,0.804,0.096,-0.0191
155,UK,"That is also a huge risk. In ARM’s case, in my opinion, UK is the higher risk. 
ARM holdings in China are separate anyway.",0.158,0.755,0.087,-0.2263
156,IP,"The grounds that it removes ownership of IP from UK to outside UK.
If others approve but UK says no, the terms of the acquisition would describe how the two companies move ahead. Usually involves NVIDIA (buyer) paying some $$ to ARM (buyee?).

ARM is headquartered in the UK, their approval is mandatory. NVIDIA could offer some compromises like promising jobs in the UK or investment. If resolved, usually that’s how it is resolved.",0.032,0.776,0.191,0.9136
157,UK,"The grounds that it removes ownership of IP from UK to outside UK.
If others approve but UK says no, the terms of the acquisition would describe how the two companies move ahead. Usually involves NVIDIA (buyer) paying some $$ to ARM (buyee?).

ARM is headquartered in the UK, their approval is mandatory. NVIDIA could offer some compromises like promising jobs in the UK or investment. If resolved, usually that’s how it is resolved.",0.032,0.776,0.191,0.9136
158,NVDA,I think the UK will allow it if NVDA keeps the jobs or brings some more over.  The UK is posturing for a better deal.,0.0,0.814,0.186,0.5859
159,UK,I think the UK will allow it if NVDA keeps the jobs or brings some more over.  The UK is posturing for a better deal.,0.0,0.814,0.186,0.5859
160,LUV,"I’ve been buying NCLH and LUV for the pure leisure play. May have to wait for vaccines to hit but once people have their shots, that pent up demand is gonna let loose.",0.129,0.824,0.047,-0.4588
161,NCLH,"I’ve been buying NCLH and LUV for the pure leisure play. May have to wait for vaccines to hit but once people have their shots, that pent up demand is gonna let loose.",0.129,0.824,0.047,-0.4588
162,BKNG,"Haven't looked too deep into this but I'd take a look at travel agencies and group travel. I think FCTG (Australia), FGETF (US OTC) is one to look at as a recovery play because they're into leisure travel as well as corporate and wholesale. I don't know which one they're a bigger player in but even as an American I've used StudentUniverse which they own.  I think I remember there being some controversy with not paying customers back when trips were cancelled due to COVID and also stiffing employees so the only group they have left to piss off is probably investors.

EXPE and BKNG are already above pre-pandemic levels so I think other people may already be thinking that way.",0.05,0.902,0.048,-0.0772
163,EXPE,"Haven't looked too deep into this but I'd take a look at travel agencies and group travel. I think FCTG (Australia), FGETF (US OTC) is one to look at as a recovery play because they're into leisure travel as well as corporate and wholesale. I don't know which one they're a bigger player in but even as an American I've used StudentUniverse which they own.  I think I remember there being some controversy with not paying customers back when trips were cancelled due to COVID and also stiffing employees so the only group they have left to piss off is probably investors.

EXPE and BKNG are already above pre-pandemic levels so I think other people may already be thinking that way.",0.05,0.902,0.048,-0.0772
164,OVID,"Haven't looked too deep into this but I'd take a look at travel agencies and group travel. I think FCTG (Australia), FGETF (US OTC) is one to look at as a recovery play because they're into leisure travel as well as corporate and wholesale. I don't know which one they're a bigger player in but even as an American I've used StudentUniverse which they own.  I think I remember there being some controversy with not paying customers back when trips were cancelled due to COVID and also stiffing employees so the only group they have left to piss off is probably investors.

EXPE and BKNG are already above pre-pandemic levels so I think other people may already be thinking that way.",0.05,0.902,0.048,-0.0772
165,CCL,I've been making moves on CCL,0.0,1.0,0.0,0.0
166,ALGT,ALGT,0.0,1.0,0.0,0.0
167,LUV,What percentage of LUV is business vs leisure? Curious to know how much the business travelers subsidize the leisure ticket prices.,0.0,0.897,0.103,0.3182
168,NYC,I agree with you - I am a consultant and spent at least 100 days on the road and staying in nice hotels. I can tell you that my company won’t be doing that next year. We will travel for sales call when necessary but not for internal meetings. I would travel to NYC at least every other week. I won’t make most of those trips. The lack of business travel will hurt companies that are dependent on it - that is why I am looking for more leisure-centric companies.,0.086,0.873,0.041,-0.7096
169,DFS,"From my experience the ""problem"" gamblers don't do DFS due to ""low"" return. They almost exclusively to sportsbook betting, which will most likely be a large percentage of Draftkings value once online sportsbook gambling goes mainstream.",0.0,0.934,0.066,0.34
170,DK,"Thanks for this. I looked at the page where that info is listed; it's interesting. They also have a 'responsible gaming' page with decent links and processes. It would be great if these pages were more prominently visible on their site/app, and if they had a proactive program where they reach out to users who are seemingly impulsive and/or dropping large sums of money with poor results (not sure if they do or not), but I would expect not. Of course, I understand their being a public company, the mindset and strategy is probably to avoid getting in their own way as much as possible in the most financially optimal and sustainable way.

Since there is a segment of wealthy gamblers who are well aware that they're not winning players who understand their prospect/likelihood of losing money as an acceptable part of the entertainment and excitement of gambling, the data provided by DK is not quite what I'm looking for. I was more looking for gamblers who are risking money they makes a meaningful difference in their life.",0.074,0.747,0.18,0.9532
171,TA,"1.)Invest in what you know. Search for competitors. Find them. Compare balance sheets, financials, TA, and FA. Choose. 

2.) Be curious about sectors you don't know or understand. Then you'll know more. 

3.) Now you're back to step 1.",0.0,0.943,0.057,0.3182
172,QS,"For me, I have two approaches for new opportunities - I open my eyes - what is trending (new stores, news items, etc) - then I google to see if they make sense to me - this is how I found Ulta and O'Reilly Auto Parts - started seeing a lot of new stores made nice profit and got out of Ulta when I saw too many stores. I kept hearing about autonomous driving so I investigated but saw too many issues with Lidar and though Waymo was just too far ahead of everyone.

Secondly, I look at the ""smart"" money like Bill Gates - [Breakthrough Energy](https://www.breakthroughenergy.org/investing-in-innovation/bev-portfolio) \- what are they investing in and then look for similar companies - this is how I played the momentum game with QS that I am now out with a nice profit.",0.0,0.853,0.147,0.9555
173,SO,"If Alphabet and Facebook are broken up today, I will definitely scoop up YouTube and Instagram.

Historically speaking, shareholders did exceedingly well after [Standard Oil](https://en.wikipedia.org/wiki/Standard_Oil#Breakup) and [AT&T](https://en.wikipedia.org/wiki/AT%26T_Corporation#The_Break-up) were broken up in 1911 and 1984 respectively. According to [this source](https://www.e-education.psu.edu/egee120/node/226):

>Finally, a year after the dissolution of Standard Oil, shares for the successor companies doubled, and, in the case of Indiana, tripled. The value of all the old SO stocks doubled, and Rockefeller's worth increased to $900 million",0.069,0.715,0.216,0.8442
174,CFO,"In all honesty it is trash. Lots of  took over rumors by Amzn to deliver goods. Important meeting announcement.  The announcement is about the owner retiring. His daughter is the CFO. The place is a farming machine shop. Its tiny town is across from a local fire station with just a few homes.   Each $ spike lasts a few days absolutely certain about being sold bs take over. I imagine the stock today is worth a fraction of what should be  trading for. Likely, you will enter at historical peak and have to sell it at loss.

There is another drone company in Washington, many of its engineers and developers went to work for MSFT and rumor has been MSFT will finalize the design ship in large qty. However, this engineering company is close to bankrupt...

Well, I have given you my unbiased opinion. You do what you want with it.",0.038,0.879,0.083,0.7089
175,MSFT,"In all honesty it is trash. Lots of  took over rumors by Amzn to deliver goods. Important meeting announcement.  The announcement is about the owner retiring. His daughter is the CFO. The place is a farming machine shop. Its tiny town is across from a local fire station with just a few homes.   Each $ spike lasts a few days absolutely certain about being sold bs take over. I imagine the stock today is worth a fraction of what should be  trading for. Likely, you will enter at historical peak and have to sell it at loss.

There is another drone company in Washington, many of its engineers and developers went to work for MSFT and rumor has been MSFT will finalize the design ship in large qty. However, this engineering company is close to bankrupt...

Well, I have given you my unbiased opinion. You do what you want with it.",0.038,0.879,0.083,0.7089
176,EV,"Rumors of working with Amazon? Brother, if Amazon wanted to use drones they'd just build their own. Notice how they've been buying up planes and delivery vans so they can use less FedEx and UPS? Now financing Rivian for EV delivery vans.

You do what you want, but tread lightly. If Amazon wants to do drone delivery they have more than enough capital and ability to put this company 6 ft under.",0.0,0.878,0.122,0.7359
177,EH,"Who are the competitors? Been eyeing the drone sector but don’t know many tickers...
UAVS and EH (Ehang) have been popping off lately tho
Anyone know good companies in the drone space?",0.0,0.88,0.12,0.6381
178,UAVS,"Who are the competitors? Been eyeing the drone sector but don’t know many tickers...
UAVS and EH (Ehang) have been popping off lately tho
Anyone know good companies in the drone space?",0.0,0.88,0.12,0.6381
179,CEO,"I’ve invested in this company in the past, and they ain’t going anywhere... even the CEO released a statement saying they don’t know why the stock went up",0.0,1.0,0.0,0.0
180,AI,"These are used for film too. But enthusiast drones are easy to make, and brands come and go. Drone AI is what really matters.",0.0,0.756,0.244,0.6997
181,AI,Yessir they have drone AI,0.0,1.0,0.0,0.0
182,ICLN,"Middle aged USA, looking to grow extra money over medium to long term.  I consider my retirement and emergency funds to be in good shape, and I have $16k to invest.  I can afford to lose value and ride it out, and I prefer to avoid the effort of stock picking for now.  I've picked out a blend of ICLN, VBTLX, VDIGX, VOO, and VXUS.  Looking for recommendations on balance ratios and comments on fund choices.",0.095,0.838,0.067,-0.296
183,USA,"Middle aged USA, looking to grow extra money over medium to long term.  I consider my retirement and emergency funds to be in good shape, and I have $16k to invest.  I can afford to lose value and ride it out, and I prefer to avoid the effort of stock picking for now.  I've picked out a blend of ICLN, VBTLX, VDIGX, VOO, and VXUS.  Looking for recommendations on balance ratios and comments on fund choices.",0.095,0.838,0.067,-0.296
184,VXUS,"Middle aged USA, looking to grow extra money over medium to long term.  I consider my retirement and emergency funds to be in good shape, and I have $16k to invest.  I can afford to lose value and ride it out, and I prefer to avoid the effort of stock picking for now.  I've picked out a blend of ICLN, VBTLX, VDIGX, VOO, and VXUS.  Looking for recommendations on balance ratios and comments on fund choices.",0.095,0.838,0.067,-0.296
185,KLR,"I posted a little while ago about KLR. Check out the stock. It’s a CPaaS company like TWLO (market cap:50B+). Their market cap is 330M and the volume is slightly building up leading to the impression that shares are being accumulated. This company could easily be valued at 2-3B considering their potential for future growth or even on prospects of an acquisition.

Edit: Position 3000 shares @9.28.",0.0,0.748,0.252,0.9423
186,TWLO,"I posted a little while ago about KLR. Check out the stock. It’s a CPaaS company like TWLO (market cap:50B+). Their market cap is 330M and the volume is slightly building up leading to the impression that shares are being accumulated. This company could easily be valued at 2-3B considering their potential for future growth or even on prospects of an acquisition.

Edit: Position 3000 shares @9.28.",0.0,0.748,0.252,0.9423
187,XL,"With the XL pipeline being cancelled by Biden, how will the $CAD dollar do? Will it start to lose value?

I have 6 figures CAD I was planning on converting to USD in late match after my HISA matures, but I may pull out now and convert to USD if its anticipated that CAD will lose strength.",0.119,0.784,0.098,0.1179
188,AMD,"22, USA, in college, employed part time, investing roughly $50 a month, recently started, trying to learn quickly, don't need this money any time soon, ok with considerable risk, small amount of credit card debt.

I put $10 into acasti pharma yesterday morning and I'm up to about $15 already. I also put $10 into AMD and $10 into tattooed chef today, but I'm second guessing if I should pull out of something and put more into acasti. RSI keeps going over 70 but then corrects/compensates back, still seems to be going up.

1. Should I add more and dip out of one of the other 2?
2. Is 25% a good trailing stop amount?",0.052,0.883,0.065,0.3632
189,RSI,"22, USA, in college, employed part time, investing roughly $50 a month, recently started, trying to learn quickly, don't need this money any time soon, ok with considerable risk, small amount of credit card debt.

I put $10 into acasti pharma yesterday morning and I'm up to about $15 already. I also put $10 into AMD and $10 into tattooed chef today, but I'm second guessing if I should pull out of something and put more into acasti. RSI keeps going over 70 but then corrects/compensates back, still seems to be going up.

1. Should I add more and dip out of one of the other 2?
2. Is 25% a good trailing stop amount?",0.052,0.883,0.065,0.3632
190,USA,"22, USA, in college, employed part time, investing roughly $50 a month, recently started, trying to learn quickly, don't need this money any time soon, ok with considerable risk, small amount of credit card debt.

I put $10 into acasti pharma yesterday morning and I'm up to about $15 already. I also put $10 into AMD and $10 into tattooed chef today, but I'm second guessing if I should pull out of something and put more into acasti. RSI keeps going over 70 but then corrects/compensates back, still seems to be going up.

1. Should I add more and dip out of one of the other 2?
2. Is 25% a good trailing stop amount?",0.052,0.883,0.065,0.3632
191,QQQ,"Aggressive, long term growth - ARKK vs QQQ vs FTEC vs VGT? The ER of ARK funds kind of worry me (and the history of not out performing index funds)",0.144,0.779,0.078,-0.2944
192,DD,"Gonna try again because it wasn’t answered they last time: DD to N&H for reverse Morris into IFF. Take the deal or no? If partial, at what ratio?

I can render my shares of DD to N&H which convert to IFF in feb. Looks like DD is overvalued right now. IFF good fundamentals. So wait for whatever isn’t fully converted in the deal to get shares in both or tender some percentage of the stock for conversion. 

Used to split offs where you don’t have to think about it and decide.",0.023,0.873,0.104,0.7882
193,IFF,"Gonna try again because it wasn’t answered they last time: DD to N&H for reverse Morris into IFF. Take the deal or no? If partial, at what ratio?

I can render my shares of DD to N&H which convert to IFF in feb. Looks like DD is overvalued right now. IFF good fundamentals. So wait for whatever isn’t fully converted in the deal to get shares in both or tender some percentage of the stock for conversion. 

Used to split offs where you don’t have to think about it and decide.",0.023,0.873,0.104,0.7882
194,USA,"I could really use some guidance on best next move for investing and wealth growth:

32 years old/USA, married with two small children (2 yrs and 4 yrs). No debt besides mortgages. Approximately $200K annual total household income. One investment condo, cash flow included in house hold income. I have a 401K and roth IRA maxed out. My husband's company doesn't offer 401K, but he is maxing out his IRA at $6k/year.

Currently live in a SFH with $178K mortgage, $300K value. Possibility to walk away with $100K cash if we sell. We are under contract on new SFH. Will have $250K mortgage, $400K value.

After new purchase, we will have $200K cash left to invest and our old SFH which we can either sell to add another $100K cash totaling $300K cash.

Does anyone have any advice on next moves for us? Should we rent our SFH that we are moving out of to see some cash flow. I would expect an additional $6000 a year in cash flow if we were to rent, but I'm nervous since the house was renovated and we weren't expecting it to be a rental when we bought it and renovated. Or, should we sell and invest the extra $100K we would net from the sale and invest in stock market?

What about the other $200K cash we are sitting on with no clear direction on what the best options are for us.

Thank you in advance for your suggestions and any advice!",0.033,0.875,0.092,0.9469
195,MSFT,"Looking to diversify my non-retirement portfolio a bit, particularly with a lower-risk investment as I just pulled out of my bond holdings given their poor performance this year.

I am:

* American, 25 years old
* Investing $2000/month in non-retirement (and $1800/month in retirement + $900 employer match)
* Current non-retirement holdings:
   * 92 shares VFIAX
   * 107 shares VWIGX
   * 144 vested shares MSFT (433 unvested)
* No debts, paying $1800/month in rent

Basically looking for bond-like low risk, low reward holding to replace an actual bond holding while interest rates are so high. I am also new to all this however, so if you have any general advice I'd love to hear that too.",0.095,0.748,0.157,0.8176
