,ticker,comment,neg,neu,pos,compound
221,XPEV,"You are in a position to tolerate some more risk. 

Meme stocks and such have often already gone up a lot by the time I find it (I don’t spend much time on these subs I guess). Anyway, I’m somewhat risk averse but I’ve doubled my investments in the last year, before that things were ticking up nicely. I increased my holdings in what I already had, bought a few new companies but not many. 

I just looked in to companies that would benefit from, or be part of, efforts to solve problems - renewable energy, sustainable infrastructure, emissions tech, some healthcare stocks, a few stocks that have decent dividends, and some ETFs to spread risk. 
Some I found by chance and made a lot on: APPN, OKTA...

Throughout my searches, using a free trial of Simply Wall Street, then Zachs, etc I invested in some that doubled...HASI, NUI, ACES, SUP, SPI, RUN, SBE, XPEV....
Previously sold OSTK (3,000% return on that, I had intended to buy Wayfair...), VSLR, NIO.

Your investment strategy can be whatever you want it to be in the end, I’ve invested in what I’ve found interesting, care about, pharmaceutical companies developing medication that could help my wife....it doesn’t have to be a certain way. Could I have made more if I spent more time looking at the markets, [yield curve](https://valuationmasterclass.com/the-relationship-between-the-curve-and-the-stock-market/), [patterns in stocks](https://www.cmcmarkets.com/en/trading-guides/stock-chart-patterns), probably. 

In the end it’s up to you how much time and attention you want to put into it all. But I wouldn’t put it all in a single company or sector.",0.037,0.819,0.144,0.9821
222,RKT,why RKT though?,0.0,1.0,0.0,0.0
223,RE,"Why RKT? I used to work in mortgages and rates are at historical lows. And we are in a seller's RE market,, which means more aggressive loans. The 2020 earnings will be a fluke. Theoretically there is nowhere but down for RKT. Open to other opinions.",0.065,0.935,0.0,-0.2135
224,RKT,"Why RKT? I used to work in mortgages and rates are at historical lows. And we are in a seller's RE market,, which means more aggressive loans. The 2020 earnings will be a fluke. Theoretically there is nowhere but down for RKT. Open to other opinions.",0.065,0.935,0.0,-0.2135
225,GME,"Buy some GME on Monday, then. There's still time. Anything under $100 is a great deal for this stock.",0.0,0.806,0.194,0.6249
226,GME,"You’re 21. You can afford to take risks, buy GME and don’t look back",0.139,0.861,0.0,-0.2732
227,EV,"I think it’s great your starting early, but if you’re well versed in the world of options and stocks - why are you only buying dips of RKT?
  
Nothing wrong with it, I own some shares at an $18 average but it’s a really small percent of my portfolio and I almost just forget about it because its not making me money right now.
  
At your age you have the ability to take on risk, you should be doing more market research. If you have the know how on stocks and options, then the part you might be missing is over all market research and social trends.
  
I would MUCH rather see you buying dips on return to normal stocks, airlines, casinos, cruises, travel industry as a whole and restaurants.
  
Or the EV sector, there are a ton of high upside / high risk SPACs coming out that could shape the EV world over the next 8 years in a Biden Admin. Charging, batteries, actual EV companies, lithium companies and more.
  
You have the knowledge but your zeroed in on one stock that is not moving and making you money. Stop.
  
You have 168 shares, I would even say sell 68 shares and move that money into a different sector that you KNOW is moving now or will be moving soon.
  
Time to apply the skills with market/social research. Best of luck to you mate, I have a feeling you’ll be just fine, getting a huge jump start - you’ll find your groove.",0.048,0.816,0.136,0.9743
228,GME,"I’m in the exact same shoes, but maybe a little further behind. I’m just setting up my first IRA, I’m married, 23 and in college still. 

My solution was to dedicate to myself some “fun” money. Originally this was to play around with stocks to see what it was like, but now it give me the freedom to get my market fix and make $500 on GME when I want to take risks, while holding more responsible ETFs in our retirement accounts. We gave me $1000 to play around with. Significant, but I’m not worried sick over it.",0.022,0.716,0.262,0.9808
229,EVER,"Not gunna give you a pat on the back because youre risk averse.

I'm 20 years old but I have a new car to pay for, a student loan, and shit to buy. I also want money to spare to keep invested because without investments I don't feel financial progress.

Due to all these demands on me, and my young age (as are you) I am a risk taker. You should think about why you don't take risk when you're young, especially when you dont have much to show for yourself on top of the fact you don't have liabilities like a mortgage or a family. 

Be a risk taker. I'm in the midst of a yolo play right now with margin and a call option, but I've doubled my money in January alone. I'm about to 3x it I have a feeling.

This is a time NEVER BEFORE SEEN in the markets. Take advantage of it, or keep moping around until correction hits. I want the best for you man, sometimes it takes a kick in the pants tho.",0.139,0.743,0.118,-0.596
230,RKT,"Well I agree with diversification. But I also believe that there’s nothing wrong with buying up a company you believe in. Take a look at RKT, maybe you’ll end up buying a few shares!",0.0,0.722,0.278,0.8246
231,AMD,"This isn't true, my investing style is to get into a lot of risky stuff, and it largely pays off

For example, my portfolio was AMD, TSM, LYFT in 2019 (not counting large bonds ETFs which all went up due to interest rates dropping)

LYFT was crap, but I sold it at a loss, made good gains with the other two

I just need enough good companies to offset bad beets",0.151,0.696,0.154,0.3036
232,LYFT,"This isn't true, my investing style is to get into a lot of risky stuff, and it largely pays off

For example, my portfolio was AMD, TSM, LYFT in 2019 (not counting large bonds ETFs which all went up due to interest rates dropping)

LYFT was crap, but I sold it at a loss, made good gains with the other two

I just need enough good companies to offset bad beets",0.151,0.696,0.154,0.3036
233,TSM,"This isn't true, my investing style is to get into a lot of risky stuff, and it largely pays off

For example, my portfolio was AMD, TSM, LYFT in 2019 (not counting large bonds ETFs which all went up due to interest rates dropping)

LYFT was crap, but I sold it at a loss, made good gains with the other two

I just need enough good companies to offset bad beets",0.151,0.696,0.154,0.3036
234,BB,Wow. Wallstreetbets is heavy here.  GME and BB,0.0,0.648,0.352,0.5859
235,GME,Wow. Wallstreetbets is heavy here.  GME and BB,0.0,0.648,0.352,0.5859
236,AAL,I have 100 shares of AAL at the moment as well. Bought them a while back betting on recovery.,0.0,0.777,0.223,0.5106
237,QQQ,"I would just do an index fund (QQQ, OEF) but you do you!",0.0,1.0,0.0,0.0
238,RKT,"That’s good, keep going I think. I re thought it and honestly if I were you I would sell all 168 shares of RKT. It’s about what, $3300?
  
A lot better places you could park that $3300 right now I think that will get you better returns.
  
UWMC is one of the largest mortgage companies in the world, I think RKT is number 1 in US but UWMC may be larger worldwide - they just went public via reverse merger with a SPAC. They are a little more then half the price of RKT, but are offering a .40 cent dividend, I think UWMC has the possibility for more returns with that. People are going to start to realize that and dump money in.
  
I don’t advise UWMC, there are far better places to put money but it’s just some perspective when compared to RKT.",0.024,0.873,0.103,0.7935
239,RKT,I understand that you want me to diversify because that’s the standard way to do it. But I think RKT is a good company which will eventually rise. You don’t have to call it the dumbest move just because you don’t agree with me,0.07,0.787,0.143,0.34
240,RKT,"Diversification is indeed the standard way to invest, just like wearing a parachute is the standard way to jump out of a plane.  Putting all of your money in one company is a stupid risk, regardless of the company - not because you're taking too much risk, but because you're taking risk in a stupid way.  Sorry to be blunt, but it's just true.

There's a scene in one of the old Austin Powers movies where he's playing blackjack and decides to stand with a 5 and a 2 or something.  When told he should probably hit he replies ""I like to live dangerously"".  Owning only one stock is the investing equivalent of this.

The problem is that there are very few profitable investment theses that apply to only one company.  If you write down your precise argument for why RKT is the best possible stock, the one of two things will happen.  Either you will write down something too specific ""mortgage companies founded in Detroit in 1985"", in which case your thesis is untestable and you're just guessing.

Otherwise you'll write down a testable argument, and you'll find that it applies to 10 other companies.  According to your theory, you can simultaneously reduce the amount of risk in your portfolio and drive up expected returns by buying those other 10 companies too.  That is the equivalent of hitting with 5-2.",0.106,0.811,0.083,-0.4083
241,PM,My company used Nasdaq PM in a tender offer to coincide with our latest finding round. It was a chance to sell some of the illiquid company stock to an outside investor at a set price. I had an overall pleasant experience. Not sure if it’s available at a individual level or what other services they provide.,0.035,0.871,0.094,0.5168
242,PCG,"Also invested into PG&E but I have no clue how you came to the number of ""it'll be at least $30."" You have a calculation or just trying to push the stock, INVEST IN PCG",0.079,0.879,0.041,-0.3291
243,IBKR,"Webull, Etoro and IBKR all accept Indian residents.",0.0,0.729,0.271,0.3818
244,GME,Technical + GME gainz from WSB..,0.0,1.0,0.0,0.0
245,BB,"Don’t think it was WSB, yes back in Nov but they haven’t been pumping it really recently. A few people mentioned it but focus was on GME and BB",0.0,0.936,0.064,0.2144
246,GME,"Don’t think it was WSB, yes back in Nov but they haven’t been pumping it really recently. A few people mentioned it but focus was on GME and BB",0.0,0.936,0.064,0.2144
247,HL,I also use HL. You can buy and sell online and with the mobile app. The same for most other providers. I had LS80 in my portfolio so definitely won't be an issue. Selling is also super easy.,0.0,0.762,0.238,0.8831
248,HL,HL customer here and have bought/sold Vanguard funds through HL and also directly from Vanguard in the past. You buy/sell through HL's website or mobile app. There's no paperwork that needs to be sent.,0.062,0.937,0.0,-0.296
249,HL,No paper work is required on HL. You just buy and sell on the website or your phone app.,0.109,0.891,0.0,-0.296
250,OVID,"I don’t really need two homes. The thought process would be that in 2-5 years we can sell our current house. We bought it for $30k less than asking because of COVID. It is a new build, and in an up and coming neighborhood, so I can see the value of this going way up. When it comes time to sell the house, who knows what the interest rates are going to be, and how much the houses and area I’m looking at are going to go up.",0.0,0.939,0.061,0.6597
251,RE,"30k less bc of covid? Where? Covid made real estate a sellers market. I worked in mortgages and have fam in RE, just yesterday my cousin showed a trash house and got 65 appointments for it. (Am on LI)",0.0,1.0,0.0,0.0
252,CEO,"You may not have been born yet when Sun Microsystems ran up to 10 x sales and was $64/share, but here is what Scott McNeely the CEO of Sun had to say about 10 x sales.

***Scott McNeely was the CEO of Sun Microsystems, one of the darlings of that bubble. At its peak his stock hit valuation of ten-times revenues. A couple of years afterward he had this to say about that time (via Bloomberg):***

&#x200B;

***At 10 times revenues, to give you a 10-year payback, I have to pay you 100% of revenues for 10 straight years in dividends. That assumes I can get that by my shareholders. That assumes I have zero cost of goods sold, which is very hard for a computer company. That assumes zero expenses, which is really hard with 39,000 employees. That assumes I pay no taxes, which is very hard. And that assumes you pay no taxes on your dividends, which is kind of illegal. And that assumes with zero R&D for the next 10 years, I can maintain the current revenue run rate. Now, having done that, would any of you like to buy my stock at $64? Do you realize how ridiculous those basic assumptions are? You don’t need any transparency. You don’t need any footnotes. What were you thinking?***",0.11,0.847,0.043,-0.9144
253,SHOP,"Fairly valued like is there a lot of room for growth if you bought in now, or actual fair value as in Buffet is about to buy up the company? SHOP is definitely going to 1500 in the near future.",0.0,0.682,0.318,0.9246
254,BIGC,BIGC is in buy territory now,0.0,1.0,0.0,0.0
255,FB,"Algorithmic trading based off of technicals, which is what has driven the entire market for a while.

But also, SHOP hasn't really moved much since July. I don't think the full understanding of their new partnerships with Walmart, Pinterest, Snapchat, FB, TikTok and more has really been felt, and it will be felt after Q4 earnings in February.

SHOP moved a lot in anticipation of what it might do with covid, but it has actually improved a lot as a company since July.",0.0,0.934,0.066,0.6542
256,SHOP,"Algorithmic trading based off of technicals, which is what has driven the entire market for a while.

But also, SHOP hasn't really moved much since July. I don't think the full understanding of their new partnerships with Walmart, Pinterest, Snapchat, FB, TikTok and more has really been felt, and it will be felt after Q4 earnings in February.

SHOP moved a lot in anticipation of what it might do with covid, but it has actually improved a lot as a company since July.",0.0,0.934,0.066,0.6542
257,GPI,"On January 14, 2021, Graphic Packaging International, LLC, a Delaware limited liability company (“

GPI

”) borrowed an aggregate principal amount of $425 million pursuant to the terms of the incremental term loan facility ",0.107,0.893,0.0,-0.4019
258,MS,Not until you have a social security card. I did my MS in the US and had to make one for my internship and that enabled me to start trading here.,0.0,0.921,0.079,0.34
259,USA,You are tax paying resident in USA. So RBI rules won't apply to you.,0.0,1.0,0.0,0.0
260,PLUG,certainly hope so.   I have 3k shares of PLUG at a 7.04 avg price,0.0,0.537,0.463,0.7759
261,BE,"BE has been servicing this industry for years and is well established.  When I said ""area"", I meant market segment not location.

Here is their [website](http://bloomenergy.com).  I actually think PLUG is the weakest player in the  category.  There are also a number of private players servicing this segment.",0.069,0.86,0.071,-0.2263
262,PLUG,"BE has been servicing this industry for years and is well established.  When I said ""area"", I meant market segment not location.

Here is their [website](http://bloomenergy.com).  I actually think PLUG is the weakest player in the  category.  There are also a number of private players servicing this segment.",0.069,0.86,0.071,-0.2263
263,TDA,"Actually, my 401K let me move up to 50% of the fund to its partnered TDA 401K account (calling it self directed brokerage).  

I was very excited to do so but found out that it is still limited to mutual funds only.

No stocks or ETFs allowed.  Still better than a handful of mutual funds in my 401K plan but very disappointed that it has to be mutual funds.

That is why I am looking for other options where I can pick and choose my own investment like Roth IRA.",0.099,0.811,0.091,-0.2006
264,BNGO,BNGO is not falling. ARK is soaking their entire share offering.,0.0,0.712,0.288,0.3907
265,IZEA,"You're not betting against IZEA, are you?

Easiest is probably to buy put options for a month or two out.  If the stock drops, you make money.  If you stock doesn't drop to the strike price, your $2,000 goes away.",0.036,0.855,0.11,0.4791
266,GME,">EDIT: Guys this has nothing to do with any of the stocks you mentioned. This is a penny stock, Not GME or any other meme stock. 

Many OTC and pinksheets are htb so just check with your broker if it's even shortable.",0.0,1.0,0.0,0.0
267,GME,"If you’re gonna short GME you can just send me the money now if you want, saves me waiting",0.0,0.933,0.067,0.0772
268,GME,Im in at GME @ 36,0.0,1.0,0.0,0.0
269,GME,"No, im in at GME @ 36",0.306,0.694,0.0,-0.296
270,BNGO,Nope not BNGO,0.0,1.0,0.0,0.0
271,GME,Im in GME at 36,0.0,1.0,0.0,0.0
272,DD,"I'm somewhat new to investing, been at it for awhile I just see a lot of talk about what companies are presenting earnings and been wondering what true DD looks like for those serious about trying to get in before a rise. Stock dropping after a company reporting doing so well has not made sense to me. Coin flip it is I guess",0.021,0.853,0.127,0.7745
273,DD,"There are still plenty of numbers and statistics to look at when deciding whether or not to invest in a given compang. The best DD can still be wrong but doesn't mean it's not worth doing. 

I do agree with that classic statement though. I'm in it for the long haul",0.074,0.82,0.107,0.4217
274,GME,Tryna get in on the GME gains?,0.0,0.714,0.286,0.34
275,ACH,"TD Ameritrade lets you do up to $250,000 through a direct ACH transfer from your bank account during banking business hours, which is available for (almost) instant trading (maybe 2-3 minutes, haven't timed it). Keep in mind that you can't do certain things like buy options or trade stocks under $5 (penny stocks) until it actually clears.

Idk what kind of numbers you're looking at for a deposit amount. If you're talking about pulling a sizable chunk of change directly from your bank account you might get a halt from your bank and a call to verify the

During the GME run, I was quickly doing individual withdrawals of $500 at a time to increase my position.",0.028,0.919,0.053,0.4378
276,GME,"TD Ameritrade lets you do up to $250,000 through a direct ACH transfer from your bank account during banking business hours, which is available for (almost) instant trading (maybe 2-3 minutes, haven't timed it). Keep in mind that you can't do certain things like buy options or trade stocks under $5 (penny stocks) until it actually clears.

Idk what kind of numbers you're looking at for a deposit amount. If you're talking about pulling a sizable chunk of change directly from your bank account you might get a halt from your bank and a call to verify the

During the GME run, I was quickly doing individual withdrawals of $500 at a time to increase my position.",0.028,0.919,0.053,0.4378
277,TD,"TD Ameritrade lets you do up to $250,000 through a direct ACH transfer from your bank account during banking business hours, which is available for (almost) instant trading (maybe 2-3 minutes, haven't timed it). Keep in mind that you can't do certain things like buy options or trade stocks under $5 (penny stocks) until it actually clears.

Idk what kind of numbers you're looking at for a deposit amount. If you're talking about pulling a sizable chunk of change directly from your bank account you might get a halt from your bank and a call to verify the

During the GME run, I was quickly doing individual withdrawals of $500 at a time to increase my position.",0.028,0.919,0.053,0.4378
278,TD,"From my TD Ameritrade Deposits page: 

***^(When will my deposit post to my account?)***  
*^(We immediately credit your account for deposits made before the cutoff time. You can then trade most securities.)*

***^(When will my deposit clear?)***  
*^(A deposit may take up to four business days to clear after it posts to your account.)* 

There was a good point made about restrictions on new accounts by Fidelity - idk if TD has the same thing or not.",0.017,0.878,0.105,0.7941
279,QQQ,"At your age you have a long time horizon, I wouldn’t put more than 50% in VAS - again the lack of exposure to tech. IOO is mostly US companies so probably better to go w/ QQQ",0.061,0.854,0.085,0.2212
280,BABA,"You may be right but jeez BABA pulled out from them a long time ago, there must be a reason.",0.0,1.0,0.0,0.0
281,CLDR,"I agree.  Snowflake and Cloud Provider native solutions like Google's Big Query are eating their lunch and Teradata's lunch.

The people innovating are not running CLDR.


Edit:  to be clear on why. I've worked with many enterprises modernizing to the cloud.

CLDR is founded on a tech called Hadoop.  There are much simpler ways to manage data and compute for machine learning now days. CLDR may do well for a bit as there is inertia to modernize and retrain.",0.0,0.862,0.138,0.8555
282,QCLN," TAN, QCLN, ARKG, LIT",0.0,1.0,0.0,0.0
283,QQQ,"QQQ, TQQQ

ARKK, ARKQ, ARKF, ARKW, ARKG",0.0,1.0,0.0,0.0
284,TQQQ,"QQQ, TQQQ

ARKK, ARKQ, ARKF, ARKW, ARKG",0.0,1.0,0.0,0.0
285,CFA,You should look up protected puts and covered calls while you’re brainstorming tho. Maybe pick up a book from the CFA study course if you’re not settled on a career,0.0,0.903,0.097,0.4404
286,GME,"i don't know if i should laugh or cry at the fact that WSB encouraged you to buy GME as your first stock ever and now after a $31profit you want to throw everything into Robinhood.

if you're looking into doing something for your retirement. I would suggest looking into an IRA or Roth IRA. Skip Robinhood unless you want to have an account and money to play with and don't mind losing it all.",0.039,0.796,0.165,0.8011
287,ICLN,"I’m in a similar boat to you. I put $1.3k in and now have $1.6k after a month, which I consider mostly luck. If you want mostly safe stocks that beat the bank rates look at established ETFs. I’m not the best judge of what’s good out there but I have a few shares in ICLN (Clean fuel etf) and the (TMFC) Motley Fool ETF because I think they’ve been doing well lately and are cheap. Look up growth ETFs that perform close to or outperform the market.",0.064,0.766,0.169,0.7824
288,ACWX,"The first step: You should go ahead and open an IRA for your retirement. The current IRA contribution limit is $6000 per year. The biggest factor in growing your wealth is time (compounding compounding compounding). I assume you are around age 19-21. The tax advantage of the IRA means that contributing $6000/year starting at age 19 instead of age 21 (only 2 extra years of investment) leads to a difference of almost $200k at retirement. I used this calculator but there are several others:

[https://www.calculator.net/ira-calculator.html](https://www.calculator.net/ira-calculator.html)

As for what to put into it, there are many good ETFs and Mutual Funds that will diversify you for your retirement account. Many people start out with something that tracks the major indices like the S&P500. I have found the following diversified ETFs and Mutual Funds have outperformed their benchmark indices over most time periods (i.e. they have high returns) and also are highly-rated in ESG (Environmental, Social, and Governance, if you are into that):

PARMX

AMAGX

SUSA

ESGD

PAXLX

PXINX

PXWEX

NUSC

EFIV (this just started last year so it doesn't have a returns track record, but I like the idea of an S&P500 index modified to drop the worst-performing companies on an ESG rating scale)

DOMOX

PRBLX

If you don't want to worry about ESG (although I researched these funds very thoroughly), you can also invest in the straight indices:

IVV

IWM

ACWX

After you have done this and taken care of your retirement account for the year, if you want to use the rest of your inheritance ""play money"" on wallstreetbets, that's absolutely fine. You could score big, who knows, but you could also lose everything. If you're ok with that, have fun :-)

If you want general stock recommendations, I recommend the Motley Fool podcast series. I started listening to them when I didn't know a single thing, and fell in love. They explain things in layman's terms and the podcasts give you an idea of what to look for in a stock. They actually motivated me to change careers and get my Masters in Finance lol.

edit: I saw that you said ""in the event that tuition rises"". Any money that you \*might\* need in the next 3-5 years should be kept in cash. Just keep that in mind :-)",0.034,0.821,0.146,0.9934
