,ticker,comment,username,score,permalink,neg,neu,pos,compound
0,BIG," *The Big Short 2*

THIS SUMMER ON THE BIG SCREEN (with deep voice)",Sweet-Zookeepergame,55,/r/stocks/comments/new7su/michael_burry_of_the_big_short_reveals_a_530/gyjjqz6/,0.0,1.0,0.0,0.0
1,ON," *The Big Short 2*

THIS SUMMER ON THE BIG SCREEN (with deep voice)",Sweet-Zookeepergame,55,/r/stocks/comments/new7su/michael_burry_of_the_big_short_reveals_a_530/gyjjqz6/,0.0,1.0,0.0,0.0
2,TSLA," probably the right time the crypto investors are angry at musk

He also used TSLA to buy Bitcoin then pumped it to make TSLA look more profitable than what it was.

just published on bloomberg

[https://finance.yahoo.com/news/burry-big-short-fame-places-232801094.html](https://finance.yahoo.com/news/burry-big-short-fame-places-232801094.html)",thatonewulf,136,/r/stocks/comments/new7su/michael_burry_of_the_big_short_reveals_a_530/gyioedn/,0.081,0.84,0.079,-0.0276
3,MA," Wow!  TSLA has been all over the place the past few weeks.  Technically, it is below it's 5, 10, 20, 50, 100 and 200 MA.  So, it should fall.  How far, we will see?!?  But then again, it is TSLA.  So that means it will go to 700",Arcieri-03,33,/r/stocks/comments/new7su/michael_burry_of_the_big_short_reveals_a_530/gyihmd1/,0.0,0.934,0.066,0.5178
4,TSLA," Wow!  TSLA has been all over the place the past few weeks.  Technically, it is below it's 5, 10, 20, 50, 100 and 200 MA.  So, it should fall.  How far, we will see?!?  But then again, it is TSLA.  So that means it will go to 700",Arcieri-03,33,/r/stocks/comments/new7su/michael_burry_of_the_big_short_reveals_a_530/gyihmd1/,0.0,0.934,0.066,0.5178
5,TSLA," I'm long TSLA and i love all these bearish news we're getting. 

Historically, the stock performs best when FUD is at it's peak.",Kraftots,5,/r/stocks/comments/new7su/michael_burry_of_the_big_short_reveals_a_530/gyk9srp/,0.094,0.628,0.278,0.7627
6,IMO," “The market can stay irrational longer than you can stay solvent”. 

I like Burry, he’s a genius, and Tesla is grossly overvalued IMO, but the company has been doing a really good job avoiding the forecasted crash by coasting on hype. I’m really curious as to why Burry thinks it’s going to come crashing down *now*.",mkvriscy,4,/r/stocks/comments/new7su/michael_burry_of_the_big_short_reveals_a_530/gyjdzkz/,0.155,0.701,0.144,0.0602
7,GM," I would short it if I could afford the interest payments for a substantial amount of time too. Who knows when the bubble is going to burst? It could go on long enough to bankrupt me.

Can anyone actually make a bullish case for Tesla at this point? Their assets are 56 billion and their market cap is 555 billion. Their revenue is 52b. They have under 2% of the vehicle market. Compare this to GM who's got over 200 billion in assets, generates 120b+ in revenue, and their market cap is a mere 86b. It's just fucking nonsense.

So what you're saying at this point if you buy Tesla instead of GM is: ""I am more confident Muskdaddy can harvest $10 of value from $1 than GM can harvest $0.43 of value from $1.""

I think Elon Musk is pretty good and GM is not great, but I don't think he's 20x better. That's a HUGE target for GM to hit. Keep in mind, when we're talking about management of very large companies it's a pretty narrow band of difference in management capabilities. Shareholders and boards will pay top dollar for management that can harvest 1.1x or 1.2x more value from a dollar than their competitors. We're talking about the Alan Mulally's of the world. CEO's credited with turning around 2 or 3 companies.

The greatest businessmen of all time such as Rockefeller, Ford, Carnegie, Vanderbilt... these guys harvested between 2 and 3 times more value from a dollar than their contemporaries. And that made them the richest, most powerful men in the world capable of making and unmaking *entire nations* in their era. Rockefeller got a billion dollars in *1916*! Using inflation he was 2 Jeff Bezos's in his time. Just stupid wealthy.

You are saying Elon Musk is 10x as good as Rockefeller, Ford, Carnegie, and Vanderbilt. How? How can you justify that? Blows my mind.",Astralahara,1,/r/stocks/comments/new7su/michael_burry_of_the_big_short_reveals_a_530/gyk7xhr/,0.036,0.778,0.186,0.9944
8,HUGE," I would short it if I could afford the interest payments for a substantial amount of time too. Who knows when the bubble is going to burst? It could go on long enough to bankrupt me.

Can anyone actually make a bullish case for Tesla at this point? Their assets are 56 billion and their market cap is 555 billion. Their revenue is 52b. They have under 2% of the vehicle market. Compare this to GM who's got over 200 billion in assets, generates 120b+ in revenue, and their market cap is a mere 86b. It's just fucking nonsense.

So what you're saying at this point if you buy Tesla instead of GM is: ""I am more confident Muskdaddy can harvest $10 of value from $1 than GM can harvest $0.43 of value from $1.""

I think Elon Musk is pretty good and GM is not great, but I don't think he's 20x better. That's a HUGE target for GM to hit. Keep in mind, when we're talking about management of very large companies it's a pretty narrow band of difference in management capabilities. Shareholders and boards will pay top dollar for management that can harvest 1.1x or 1.2x more value from a dollar than their competitors. We're talking about the Alan Mulally's of the world. CEO's credited with turning around 2 or 3 companies.

The greatest businessmen of all time such as Rockefeller, Ford, Carnegie, Vanderbilt... these guys harvested between 2 and 3 times more value from a dollar than their contemporaries. And that made them the richest, most powerful men in the world capable of making and unmaking *entire nations* in their era. Rockefeller got a billion dollars in *1916*! Using inflation he was 2 Jeff Bezos's in his time. Just stupid wealthy.

You are saying Elon Musk is 10x as good as Rockefeller, Ford, Carnegie, and Vanderbilt. How? How can you justify that? Blows my mind.",Astralahara,1,/r/stocks/comments/new7su/michael_burry_of_the_big_short_reveals_a_530/gyk7xhr/,0.036,0.778,0.186,0.9944
9,TSLA," He previously mentioned back in Feb that he was taking a short position in TSLA back when it was around $850, so I imagine since then, he's ITM",blackiechan25,1,/r/stocks/comments/new7su/michael_burry_of_the_big_short_reveals_a_530/gyktlax/,0.0,1.0,0.0,0.0
10,FB," Someone in an FB group made a joke that the strike price is $300. Can't tell if that's better or worse than $800 GME calls lol.

Either way, this dude might be in for WSB reckoning. I have little doubt Tesla will get a rally. And the worst part is, this jackass is probably banking on that happening.",IronCorvus,1,/r/stocks/comments/new7su/michael_burry_of_the_big_short_reveals_a_530/gykuhzh/,0.205,0.681,0.114,-0.7397
11,GME," Someone in an FB group made a joke that the strike price is $300. Can't tell if that's better or worse than $800 GME calls lol.

Either way, this dude might be in for WSB reckoning. I have little doubt Tesla will get a rally. And the worst part is, this jackass is probably banking on that happening.",IronCorvus,1,/r/stocks/comments/new7su/michael_burry_of_the_big_short_reveals_a_530/gykuhzh/,0.205,0.681,0.114,-0.7397
12,TSLA," Lmao Burry does this like once a month. He did this before the split, after the split, before S&P inclusion, after S&P inclusion, and is now rerevealing his position. Someone actually did an analysis on his short position history with TSLA and he was literally down like 80% of his total investment. It's neat that he's finally winning and he'll be rich regardless but like Buffett, Burry gets way too much credit within the investor community.",kcufjustin,1,/r/stocks/comments/new7su/michael_burry_of_the_big_short_reveals_a_530/gykvbk3/,0.0,0.77,0.23,0.9519
13,HE," Hijacking your comment for visibility:

HE DOES NOT OWN 530 MILLION IN PUTS. 

13F reports *notional* value, meaning his puts cover *530 million worth of shares*. 800,100*667.93.

He owns 8001 contracts. We don’t know strike, expiry, or value of the position, but we do know he bought them by March 31st. If you poke through the OI on the options chain, you can narrow down where his position sits (OI>8001) if he went same strike/expiry. Position was likely a couple dozen million IMO. They are profitable now, if he held. 

This has been incredibly poorly represented in the media.

Edit: typo, some added info",TheDolleyLlama,933,/r/stocks/comments/new7su/michael_burry_of_the_big_short_reveals_a_530/gyjh7pz/,0.012,0.908,0.081,0.7543
14,IMO," Hijacking your comment for visibility:

HE DOES NOT OWN 530 MILLION IN PUTS. 

13F reports *notional* value, meaning his puts cover *530 million worth of shares*. 800,100*667.93.

He owns 8001 contracts. We don’t know strike, expiry, or value of the position, but we do know he bought them by March 31st. If you poke through the OI on the options chain, you can narrow down where his position sits (OI>8001) if he went same strike/expiry. Position was likely a couple dozen million IMO. They are profitable now, if he held. 

This has been incredibly poorly represented in the media.

Edit: typo, some added info",TheDolleyLlama,933,/r/stocks/comments/new7su/michael_burry_of_the_big_short_reveals_a_530/gyjh7pz/,0.012,0.908,0.081,0.7543
15,OI," Hijacking your comment for visibility:

HE DOES NOT OWN 530 MILLION IN PUTS. 

13F reports *notional* value, meaning his puts cover *530 million worth of shares*. 800,100*667.93.

He owns 8001 contracts. We don’t know strike, expiry, or value of the position, but we do know he bought them by March 31st. If you poke through the OI on the options chain, you can narrow down where his position sits (OI>8001) if he went same strike/expiry. Position was likely a couple dozen million IMO. They are profitable now, if he held. 

This has been incredibly poorly represented in the media.

Edit: typo, some added info",TheDolleyLlama,933,/r/stocks/comments/new7su/michael_burry_of_the_big_short_reveals_a_530/gyjh7pz/,0.012,0.908,0.081,0.7543
16,IMO," Yes, battle of the autist’s started almost 4 months ago. It’s only getting attention again because Burry’s position seems to be turning profitable. IMO Burry will be correct in the short term but Tesla is almost certainly here to stay... especially with this new legal loophole they’ve found in cryptocurrency price manipulation. I’m going to buy the dip.",bewbs_and_stuff,9,/r/stocks/comments/new7su/michael_burry_of_the_big_short_reveals_a_530/gyk65jl/,0.072,0.799,0.129,0.384
17,TSLA," so far it seems to be that way.

And with Elon's crusade against bitcoin, it seems he lose some followers. Yeah, i knew he is still influential even admist this controversial, but i suspect any Teslabro already max their TSLA purchase anyway. The incremental buying to carry the price up will be quite difficult this time.",wilstreak,86,/r/stocks/comments/new7su/michael_burry_of_the_big_short_reveals_a_530/gyimdym/,0.16,0.782,0.058,-0.7422
18,TSLA," I thought about this when TSLA was closer to $1000, but I didn't like the premium it took to short them.  But I think it's a good bet to short them.",24736569420,14,/r/stocks/comments/new7su/michael_burry_of_the_big_short_reveals_a_530/gyihu77/,0.085,0.793,0.122,0.2926
19,GOOD," I'm sure it is nowhere near $500M, but the premiums have been and remain very juicy. He is paying GOOD money to maintain his position.",candidly1,-1,/r/stocks/comments/new7su/michael_burry_of_the_big_short_reveals_a_530/gykhx6h/,0.0,0.777,0.223,0.7649
20,OG, He's an OG Dragon Ball fan. It's over 8000!,Dzanidra,3,/r/stocks/comments/new7su/michael_burry_of_the_big_short_reveals_a_530/gyk7z1a/,0.0,0.755,0.245,0.3802
21,ICE," Which competition are we referring to? All EVs are competing against ICE vehicles, not each other.",4chanbetterkek,-1,/r/stocks/comments/new7su/michael_burry_of_the_big_short_reveals_a_530/gyjpg1y/,0.0,1.0,0.0,0.0
22,TSLA, I mean like he definitely is up big time. He has been short since Q1 2021 and TSLA has been declining since than. So yeah he is definitely making money.,JRshoe1997,34,/r/stocks/comments/new7su/michael_burry_of_the_big_short_reveals_a_530/gyj7qri/,0.0,0.706,0.294,0.8553
23,WELL, Tell me something that has been WELL represented by the media in recent memory...,workdayslacker,3,/r/stocks/comments/new7su/michael_burry_of_the_big_short_reveals_a_530/gykt2tw/,0.0,0.821,0.179,0.4278
24,MU," I was looking at TSLA puts 2-3 months ago, and they were ~$1.25 to $1.35 for strikes between -15% and -20% of the current at 3-4 months out. They were pretty cheap for a bit there. Tbh, I kid of regret not pulling the trigger. But, I threw puts at SHOP and MU. So, I can't be too bummed.     
       
Edit: it was actually 2-3 months ago. I'm old and lose track of time. ¯\\\_(ツ)_/¯",gizamo,3,/r/stocks/comments/new7su/michael_burry_of_the_big_short_reveals_a_530/gykwf2r/,0.097,0.875,0.028,-0.6249
25,SHOP," I was looking at TSLA puts 2-3 months ago, and they were ~$1.25 to $1.35 for strikes between -15% and -20% of the current at 3-4 months out. They were pretty cheap for a bit there. Tbh, I kid of regret not pulling the trigger. But, I threw puts at SHOP and MU. So, I can't be too bummed.     
       
Edit: it was actually 2-3 months ago. I'm old and lose track of time. ¯\\\_(ツ)_/¯",gizamo,3,/r/stocks/comments/new7su/michael_burry_of_the_big_short_reveals_a_530/gykwf2r/,0.097,0.875,0.028,-0.6249
26,TSLA," I was looking at TSLA puts 2-3 months ago, and they were ~$1.25 to $1.35 for strikes between -15% and -20% of the current at 3-4 months out. They were pretty cheap for a bit there. Tbh, I kid of regret not pulling the trigger. But, I threw puts at SHOP and MU. So, I can't be too bummed.     
       
Edit: it was actually 2-3 months ago. I'm old and lose track of time. ¯\\\_(ツ)_/¯",gizamo,3,/r/stocks/comments/new7su/michael_burry_of_the_big_short_reveals_a_530/gykwf2r/,0.097,0.875,0.028,-0.6249
27,TSLA," “Any Teslabro already max their TSLA purchase anyway” 

Not true for me ( I m very bullish in longterm with TSLA). If it keeps going down I ll start selling other assets to buy TSLA as I d consider it an amazing opportunity... even now below 600$ it is good opportunity I believe. 

I strongly believe it will not take long before it returns to high 700s and also between eoy and the next year I know it ll reach 1000",filipposkt,5,/r/stocks/comments/new7su/michael_burry_of_the_big_short_reveals_a_530/gyk9jrt/,0.029,0.795,0.176,0.877
28,TSLA," Lets be honest.  TSLA should have been a short before it split!  They are not a profitable company on its car sales only.  That being said, it is an iconic company and the younger generation loves it.",Arcieri-03,9,/r/stocks/comments/new7su/michael_burry_of_the_big_short_reveals_a_530/gyiilro/,0.058,0.767,0.175,0.7083
29,AI," But... is Michael Burry just a one-hit wonder? Oftentimes that is the case with people that get famous...

The AI apparently sold TSLA near the top, according to the article!",treelife365,1,/r/stocks/comments/new7su/michael_burry_of_the_big_short_reveals_a_530/gymbvz7/,0.0,0.93,0.07,0.2714
30,TSLA," But... is Michael Burry just a one-hit wonder? Oftentimes that is the case with people that get famous...

The AI apparently sold TSLA near the top, according to the article!",treelife365,1,/r/stocks/comments/new7su/michael_burry_of_the_big_short_reveals_a_530/gymbvz7/,0.0,0.93,0.07,0.2714
31,TSLA, He bought protective puts on his TSLA shares? A high PE company that would be very negatively impacted by rising interest rates and inflation? The same inflation Burry was screaming about in twitter for months? You don't say...,ghostfacekhilla,1,/r/stocks/comments/new7su/michael_burry_of_the_big_short_reveals_a_530/gyldtpg/,0.061,0.803,0.136,0.4836
32,GME, I think he has been short since his original GME position But don’t think he had 60% in at the time,AnywhereImpossible63,1,/r/stocks/comments/new7su/michael_burry_of_the_big_short_reveals_a_530/gykn8u3/,0.0,0.92,0.08,0.1655
33,FCF," The problem with Tesla is the fact that it has already priced-in about 6 years of growth because of hype. A company like Tesla can't stay at a 600 P/E, and 70 P/FCF if the sole reason holding them at such high valuation is hype around a CEO and a social sentiment for the future. See what happened to railroads stocks in the early 1900s, and the car stocks in the 1950s. 

If you think these metrics are able to be maintained, honestly, tell me how. Even Amazon, a company spending billions year over year in R&D, was considered by many (at 100-200 PE) to be overvalued as fuck even after proving they were a cash-cow with AWS, Amazon website, etc. They are even 2x as profitable as Tesla!

 I'm far from thinking that Telsa is dying. But thinking it will become a SUSTAINABLE trillion dollar+ company while:

1. Having a 3% profitability

2. Crazy priced-in valuations (because of hype and 'a sentiment for the future

3. The need to issue 5% more share PER YEAR to sustain operations AND ALSO regulatory credits (money given by the government for developping non-polluting technology 

4. Having an almost bigger market cap than the 12 largests automakers in the world that sell over 90% of the cars 

5. Not really having a monopoly in the EV sector

Tesla is not only an automaker, but without this source of revenue, the company WILL not be able to sustain its growth. So the people saying 'your point is not relevant, Tesla doesn't only make cars' are wrong.

I'm not anti-Tesla, I'm just against betting for the future when it has been proved and demonstrated than jumping on the trend, after it has already exploded, will net you lower returns over the years. You bet money last year? Nice. Betting this year? Meh, it is a bubble only waiting to explode. In the short term, I guess it could rise. 1-2 years maybe? But give it 10-20 years and I guarantee you Tesla will not be where you're expecting it to be. 

Only a 8% compound annual growth rate would put the company at a 2.8T valuation. How would they achieve that? Hell, I think they never will. But whatever, I'm a gay-bear.",TheNumberTw0,3,/r/stocks/comments/new7su/michael_burry_of_the_big_short_reveals_a_530/gykp9e2/,0.056,0.859,0.085,0.8221
34,ICE, Oh so you’re talking about companies that are going to be losing money trying to sell ICE vehicles while taking a loss trying to keep up with Tesla’s.,4chanbetterkek,1,/r/stocks/comments/new7su/michael_burry_of_the_big_short_reveals_a_530/gykrb43/,0.164,0.836,0.0,-0.5994
35,MO, I’d say it’s less attention seeking behavior and more to inform the public. That’s been his MO consistently.,yesiryasure,3,/r/stocks/comments/new7su/michael_burry_of_the_big_short_reveals_a_530/gyjllx4/,0.0,1.0,0.0,0.0
36,TSLA," Sure. I bought a few more TSLA at last dip $555 a few mos ago, I was happy. Seems to be headed up again. 

Fear and emotion should play a minimal role in your investment strategy. Have a plan and stick to it until there is a new plan. Don’t panic sell or buy.",Boomslangalang,1,/r/stocks/comments/new7su/michael_burry_of_the_big_short_reveals_a_530/gyleczg/,0.114,0.738,0.148,0.2263
37,MU," When I did my monthly eval to determine if I made the right choice, it wasn't anywhere near 100x. Lol. IIRC, it was under 60%. So, if your math is right, it's likely I'm misremembering the numbers (that's also likely even if your math is terrible, but it seems right. Idk?). Anyway, it did beat out my SHOP puts, but not my MU puts. SHOP's IV is always crazy. MU wasn't at all. Those were dirt cheap for some reason.",gizamo,2,/r/stocks/comments/new7su/michael_burry_of_the_big_short_reveals_a_530/gyl91k5/,0.098,0.879,0.023,-0.7469
38,SHOP," When I did my monthly eval to determine if I made the right choice, it wasn't anywhere near 100x. Lol. IIRC, it was under 60%. So, if your math is right, it's likely I'm misremembering the numbers (that's also likely even if your math is terrible, but it seems right. Idk?). Anyway, it did beat out my SHOP puts, but not my MU puts. SHOP's IV is always crazy. MU wasn't at all. Those were dirt cheap for some reason.",gizamo,2,/r/stocks/comments/new7su/michael_burry_of_the_big_short_reveals_a_530/gyl91k5/,0.098,0.879,0.023,-0.7469
39,RH," Your being naive to think they will leave crypto in my opinion, with all the manipulation in the market most of those RH users you speak of will take thier money to crypto has faith is lost in the US market.",whippedcreamgaming,1,/r/stocks/comments/new7su/michael_burry_of_the_big_short_reveals_a_530/gyjz0wz/,0.167,0.773,0.06,-0.4588
40,DD," Always, but DD isn't DD just because of timing. It's because of basic market factors, research, & theories/conclusions.",DirtyDummy,4,/r/stocks/comments/new7su/michael_burry_of_the_big_short_reveals_a_530/gyjqdm9/,0.0,1.0,0.0,0.0
41,OG," Oh no, like I said, I agree. I thought Tesla was overvalued at 60. It's a luxury car company that makes really cool cars. If it ever generates the same level of profits as Cadillac or Mazeratti, it will be a tremendous achievement on Musk's part and probably worth 1/10th of what it is today. 

But like I said, it's the OG Gamestop. You have tons of people out there that think Musk is going to put a Doge Coin on Mars or whatever. The CEO literally tweeted ""I think Tesla might be a little overvalued"" and it still went up. So I just think this is a random time to short it. It could tank this year or Musk will figure out a way to string people along again like he always does",bighomiej69,5,/r/stocks/comments/new7su/michael_burry_of_the_big_short_reveals_a_530/gyj1cr9/,0.012,0.873,0.115,0.8909
42,RH," Yeah i believe that is because crypto has been good to them so far.

Those RH user dont actually care about crypto and its part as global financial system, they just participate because fomo.",wilstreak,4,/r/stocks/comments/new7su/michael_burry_of_the_big_short_reveals_a_530/gyk47yj/,0.07,0.795,0.135,0.3553
43,DD, Do some DD. Definitely still shorted to hell. You'll find that out when the voting numbers come back and retail owns 300-400% of the float,BrawlStrap,0,/r/stocks/comments/new7su/michael_burry_of_the_big_short_reveals_a_530/gyl15dp/,0.152,0.759,0.089,-0.4404
44,ICE," Been hearing about the army of competition for 5+ years lol. At this point I’ll believe it when I see it. The cheap EV competition will do pretty well until Tesla released their budget model. Like I said originally, there’s plenty of market share to go around, you’re not going to replace billions upon billions of ICE vehicles in a couple of years. But I’ll take the company I feel is more focused on EVs and only EVs in this space paired with the best technology.",4chanbetterkek,0,/r/stocks/comments/new7su/michael_burry_of_the_big_short_reveals_a_530/gyl6pa5/,0.0,0.802,0.198,0.948
45,PLTR, It's truly snowing in hell today. Positive news for PLTR *and* the stock is moving up while everything treads water.,soulstonedomg,237,/r/stocks/comments/nfg2gz/billionaire_investor_and_hedge_fund_manager/gylioji/,0.164,0.605,0.231,0.2263
46,PLTR, But everyone says on here PLTR is a terrible company and insanely overvalued? Why is such a successful investor buying so many shares at this time if that is the case?,LJMele,152,/r/stocks/comments/nfg2gz/billionaire_investor_and_hedge_fund_manager/gylhiir/,0.107,0.668,0.225,0.6836
47,CCL," I have PLTR so was happy with the first part until reading he sold CCL.  


I own a lot of cruise stocks.",BANKMAN9117,49,/r/stocks/comments/nfg2gz/billionaire_investor_and_hedge_fund_manager/gylg8ro/,0.0,0.819,0.181,0.6096
48,PLTR," I have PLTR so was happy with the first part until reading he sold CCL.  


I own a lot of cruise stocks.",BANKMAN9117,49,/r/stocks/comments/nfg2gz/billionaire_investor_and_hedge_fund_manager/gylg8ro/,0.0,0.819,0.181,0.6096
49,PLTR," One thing about billionaires...or three maybe...they like money, they love making money and they hate losing.  PLTR is a winner and winners win.",thebabylonbull,12,/r/stocks/comments/nfg2gz/billionaire_investor_and_hedge_fund_manager/gyln503/,0.163,0.388,0.45,0.9022
50,PLTR," Transactions like these literally happen everyday, why on earth do you guys care lmao. This isn't even 1% of the company, and yet because everyone else is bagholding PLTR, it's news. I like Palantir, and I held the stock until offloading them at 40, but this is so pathetic lmao.",mithyyyy,4,/r/stocks/comments/nfg2gz/billionaire_investor_and_hedge_fund_manager/gylr7qr/,0.107,0.677,0.216,0.5842
51,PLTR," Admittedly I'm bearish on PLTR, but keep in mind that just because big money bets on something, doesn't mean they can't be wrong. Bill Hwang was a billionaire. The global financial crisis of '08 was largely perpetrated on the actions of billionaires. They make mistakes just as grave as anyone else. Trust your own judgment.",Peshhhh,0,/r/stocks/comments/nfg2gz/billionaire_investor_and_hedge_fund_manager/gylyons/,0.178,0.709,0.113,-0.6725
52,PLTR, Is it time to sell some of the arkk positions and go heavier on PLTR I think so,MrSteelio,1,/r/stocks/comments/nfg2gz/billionaire_investor_and_hedge_fund_manager/gylwyaw/,0.0,1.0,0.0,0.0
53,PLTR, PLTR is a game changer. I would open a position on $65 Jan23 calls in case you don't want to buy shares but want some exposure.,mojojojo2069,-7,/r/stocks/comments/nfg2gz/billionaire_investor_and_hedge_fund_manager/gylkk81/,0.102,0.832,0.067,0.0402
54,PLTR," If you sold PLTR for anything less than $43, you're a donkey",kotsumu,3,/r/stocks/comments/nfg2gz/billionaire_investor_and_hedge_fund_manager/gym4k5g/,0.0,1.0,0.0,0.0
