,ticker,comment,username,score,permalink,neg,neu,pos,compound
0,CPA," Not an accountant or lawyer BUT, you can roll gains into a Qualified Opportunity Fund to defer gains until 12/31/2026. Hold in that fund for 5 years and your cost basis increases by 10%. 

You would have to invest 180 days after this sale though

Hold for 10’years + and any gains on the appreciation of your initial investment upon sell are tax free.

Do your DD on QOFs, not advice. Talk to a CPA or someone with a bigger ballsack than me.",ManicBJT,3205,/r/wallstreetbets/comments/oqcvd6/does_half_of_this_really_go_to_tax/h6b8tlb/,0.029,0.742,0.229,0.9643
1,DD," Not an accountant or lawyer BUT, you can roll gains into a Qualified Opportunity Fund to defer gains until 12/31/2026. Hold in that fund for 5 years and your cost basis increases by 10%. 

You would have to invest 180 days after this sale though

Hold for 10’years + and any gains on the appreciation of your initial investment upon sell are tax free.

Do your DD on QOFs, not advice. Talk to a CPA or someone with a bigger ballsack than me.",ManicBJT,3205,/r/wallstreetbets/comments/oqcvd6/does_half_of_this_really_go_to_tax/h6b8tlb/,0.029,0.742,0.229,0.9643
2,IRS, Not if you don't tell the IRS.,Not-Jeffery-Epstein,581,/r/wallstreetbets/comments/oqcvd6/does_half_of_this_really_go_to_tax/h6av245/,0.0,1.0,0.0,0.0
3,IRS, If you take some profits the IRS wants some,HelpfulTear,3,/r/wallstreetbets/comments/oqcvd6/does_half_of_this_really_go_to_tax/h6awkez/,0.0,0.734,0.266,0.4404
4,IRS, Yes. Audits by the IRS loves it when you sell.,XRPJealous1,3,/r/wallstreetbets/comments/oqcvd6/does_half_of_this_really_go_to_tax/h6b8b93/,0.0,0.556,0.444,0.7506
5,CPA," Ask a CPA, but iirc, the IRS only wants 32% of that. 24% for head of household or married and filing jointly.

Again, ask a CPA, because I am not one. Like at all.",frazzled_confusion,2,/r/wallstreetbets/comments/oqcvd6/does_half_of_this_really_go_to_tax/h6cbog4/,0.082,0.918,0.0,-0.395
6,IRS," Ask a CPA, but iirc, the IRS only wants 32% of that. 24% for head of household or married and filing jointly.

Again, ask a CPA, because I am not one. Like at all.",frazzled_confusion,2,/r/wallstreetbets/comments/oqcvd6/does_half_of_this_really_go_to_tax/h6cbog4/,0.082,0.918,0.0,-0.395
7,IRS," Step 1: prepare butthole for prison, since the IRS receives copies of your Robinhood tax forms from Robinhood, not from you.

Step 2. Withdrawal, delete app, break phone.",Jcook_14,309,/r/wallstreetbets/comments/oqcvd6/does_half_of_this_really_go_to_tax/h6cd1y6/,0.109,0.855,0.036,-0.4939
8,DD," QOF are extremely expensive to setup unless you can dip your dick into something a bunch of rich fellas are already starting. If you can find one, do your DD, and realize there’s a reason the Gov is giving you a huge break to invest in these hard hit areas.",bodiddlysquat26,4,/r/wallstreetbets/comments/oqcvd6/does_half_of_this_really_go_to_tax/h6d4j3f/,0.085,0.764,0.151,0.5574
9,GME," I had to. It was options when GME first spiked. 

I'm just gonna marry my gf to have to pay less. But it's probably still a lot.

Fuck this, I pay for services I can't even use.",ErrorProxy,1177,/r/wallstreetbets/comments/oqcvd6/does_half_of_this_really_go_to_tax/h6auvhs/,0.201,0.799,0.0,-0.7615
10,MA," Welcome to MA where short term gains are taxed an additional 12% on top of federal income tax.

Edit: Other incomes are taxed at 5%. 12% is basically only for ""punishing"" active traders.",cai_lw,275,/r/wallstreetbets/comments/oqcvd6/does_half_of_this_really_go_to_tax/h6bf49s/,0.0,0.746,0.254,0.836
11,IRS, If I sell my position in the forest and the IRS isn’t around to hear it... do I win?,TheIRSEvader,69,/r/wallstreetbets/comments/oqcvd6/does_half_of_this_really_go_to_tax/h6bxnqr/,0.0,0.808,0.192,0.5859
12,IRS," If your institution issues you a 1099 they will also report yiur gain to the IRS. The IRS will match those reports with the tax returns that have been filed. 

They will notice the discrepancy and follow up with a request for you to pay up.",DbThrowawayZ62,106,/r/wallstreetbets/comments/oqcvd6/does_half_of_this_really_go_to_tax/h6b4x7y/,0.03,0.897,0.073,0.4588
13,GME, Giant spike six months ago. It was GME.,HOBOwithaTREBUCHET,180,/r/wallstreetbets/comments/oqcvd6/does_half_of_this_really_go_to_tax/h6bk4z1/,0.0,1.0,0.0,0.0
14,IRS, Once again proving the point of **why the hell do we have to file taxes if the IRS already knows how much we owe/are owed.**,Sylentwolf8,5,/r/wallstreetbets/comments/oqcvd6/does_half_of_this_really_go_to_tax/h6de775/,0.161,0.839,0.0,-0.6808
15,DD, DD obviously stands for huge tits.,MaxwellIsSmall,1014,/r/wallstreetbets/comments/oqcvd6/does_half_of_this_really_go_to_tax/h6c3d8s/,0.232,0.488,0.28,0.1027
16,IRS, We all work for the IRS for part of the year.,recumbent_mike,47,/r/wallstreetbets/comments/oqcvd6/does_half_of_this_really_go_to_tax/h6d4ihh/,0.0,1.0,0.0,0.0
17,IRS," I'm not sure if inheritance counts as a ""transaction"", but IRS explicitly states that transactions with relatives are not eligible for these funds, so I think they're specifically trying to avoid that loophole.",Youre_Government,3,/r/wallstreetbets/comments/oqcvd6/does_half_of_this_really_go_to_tax/h6cs7cs/,0.129,0.871,0.0,-0.5075
18,ALL, Wait- LOL why marry your GF- that’s a sure fire way to lose ALL of it.,JayMant88,30,/r/wallstreetbets/comments/oqcvd6/does_half_of_this_really_go_to_tax/h6av2th/,0.233,0.502,0.266,0.186
19,IRS," Get married. Then you can give the wife half, the IRS the rest. And you get nothing!",Rrrrandle,16,/r/wallstreetbets/comments/oqcvd6/does_half_of_this_really_go_to_tax/h6b30qg/,0.0,1.0,0.0,0.0
20,IRS, The IRS has actually caught on to the forest loophole. Now you need to make your trades in space where no one can hear you trade to avoid taxes.,KJew,10,/r/wallstreetbets/comments/oqcvd6/does_half_of_this_really_go_to_tax/h6dap9l/,0.14,0.86,0.0,-0.5267
21,IRS," Considering that IRS has this information already, why do they make us file it by ourselves too?

_Edit: corrected phrasing._",springsprint,3,/r/wallstreetbets/comments/oqcvd6/does_half_of_this_really_go_to_tax/h6d3kas/,0.0,1.0,0.0,0.0
22,NH," Been trying to figure out what state to move to.  I shall be choosing from this list.  NH, SD or Wyoming all sound interesting.",insanemetal187,3,/r/wallstreetbets/comments/oqcvd6/does_half_of_this_really_go_to_tax/h6cigjf/,0.0,0.76,0.24,0.7672
23,SD," Been trying to figure out what state to move to.  I shall be choosing from this list.  NH, SD or Wyoming all sound interesting.",insanemetal187,3,/r/wallstreetbets/comments/oqcvd6/does_half_of_this_really_go_to_tax/h6cigjf/,0.0,0.76,0.24,0.7672
24,DD," Yeah. More like 14,000# GVWR or  6000# GVWR AND a minimum 6' cargo space behind the last passenger seat.  That last bit makes SUVs and consumer automobiles ineligible. You can thank all the R/E agents for that closed loophole. 

OTOH, an F150 SuperCrew with a 6.5' bed is a mighty fine way to bump up your DD CO2 useage, carry 5 passengers comfortably, and still make the cut!",overzeetop,4,/r/wallstreetbets/comments/oqcvd6/does_half_of_this_really_go_to_tax/h6ct4fa/,0.029,0.8,0.171,0.8513
25,IRS," i was taxed near 40% on my gains in california. i thought i was gonna make a cool $25,000.... NOPE. IRS done said fuck you and took near half. made me sad af but at the end of the day i was still up with something",itsiceyo,7,/r/wallstreetbets/comments/oqcvd6/does_half_of_this_really_go_to_tax/h6c99sz/,0.096,0.829,0.075,-0.2382
26,IRS," Scamming the IRS won’t just get you behind the Wendy’s dumpster, you’ll be giving BJ’s in a prison dumpster",Nofapdeity,61,/r/wallstreetbets/comments/oqcvd6/does_half_of_this_really_go_to_tax/h6bh8qq/,0.284,0.611,0.105,-0.4767
27,AMT," Yea, but triple that and you're at fucked at AMT",i_use_this_for_work,2,/r/wallstreetbets/comments/oqcvd6/does_half_of_this_really_go_to_tax/h6cysns/,0.404,0.596,0.0,-0.7964
28,IRS, Plus banks in Cayman report to the States all your balances sooo... That's a lot of effort for it to still end up at the IRS,RonDiDon,20,/r/wallstreetbets/comments/oqcvd6/does_half_of_this_really_go_to_tax/h6d350w/,0.0,1.0,0.0,0.0
29,IRS, This finance shit is so easy. I QOFed on my DDs so fuck off IRS you got nothing on me,Jackie_Jormp-Jomp,118,/r/wallstreetbets/comments/oqcvd6/does_half_of_this_really_go_to_tax/h6cjd5j/,0.297,0.586,0.117,-0.7094
30,IRS," Lol no, you'll get a letter saying you they believe you owe X in back taxes because of Y and Z.  Then you can provide documents if you think it's some other lower number (and if you can prove it the IRS will cede normally).  Otherwise you just pay your back taxes, maybe a fine and move on with your life.

I worked at a forensic accounting firm for a few years.  Only know of one client who had to spend a night in jail who was a real piece of work.",insta_throw_away,5,/r/wallstreetbets/comments/oqcvd6/does_half_of_this_really_go_to_tax/h6cuup9/,0.065,0.868,0.067,0.0258
31,GME, Can confirm. Bought a house in WA and it's gone up in value almost as fast as GME.,TEAMZypsir,9,/r/wallstreetbets/comments/oqcvd6/does_half_of_this_really_go_to_tax/h6ccl62/,0.0,0.87,0.13,0.34
32,AMT," Ah yes, that AMT - the trip wire to keep 5%ers from getting into the 1%. :-D",overzeetop,3,/r/wallstreetbets/comments/oqcvd6/does_half_of_this_really_go_to_tax/h6d6rpj/,0.0,0.675,0.325,0.7739
33,IRS, Now IRS sounds like a disease,Stratoz_,5,/r/wallstreetbets/comments/oqcvd6/does_half_of_this_really_go_to_tax/h6d4c9c/,0.0,0.615,0.385,0.3612
34,ALL," Yeah, of course you save money when cash under the table is an option. However in ALL other circumstances you make more money by being paid more even if those additional dollars might be taxed at a higher percentage.",Index820,9,/r/wallstreetbets/comments/oqcvd6/does_half_of_this_really_go_to_tax/h6c8cfn/,0.0,0.87,0.13,0.6597
35,IMO," IMO it's because finances is just complicated enough that unintelligent people have little practical chance of being able to understand it all, and intelligent people can oftentimes understand enough intuitively to get by without having to think about it much.

So to the people that are capable of understanding it, it's this somewhat complicated, really tedious task that will make them more money, how much they're not sure but they know it's money, but they have enough money to be comfortable and they don't wanna research right now.",HalfysReddit,26,/r/wallstreetbets/comments/oqcvd6/does_half_of_this_really_go_to_tax/h6cz9fu/,0.037,0.862,0.101,0.7294
36,IMO, To be fair you cannot “know” something you were never taught. To act like not understand tax brackets makes you unintelligent is pretty retarded IMO.,theRealTattoodBeard,5,/r/wallstreetbets/comments/oqcvd6/does_half_of_this_really_go_to_tax/h6d30u6/,0.193,0.576,0.231,0.0772
37,IRS," The IRS limits your net loss to $3,000 (for individuals and married filing jointly) or $1,500 (for married filing separately). Any unused capital losses are rolled over to future years. If you exceed the $3,000 threshold for a given year, don't worry.",whitesquirrle,4,/r/wallstreetbets/comments/oqcvd6/does_half_of_this_really_go_to_tax/h6b7sme/,0.11,0.837,0.053,-0.3806
38,ROLL, ROLL FOR INITIATIVE!!,Captain-Boof-Daddy,3,/r/wallstreetbets/comments/oqcvd6/does_half_of_this_really_go_to_tax/h6cp2gk/,0.0,1.0,0.0,0.0
39,IRS, I’ve been trying this. The IRS won’t return my calls :(,micalbertl,3,/r/wallstreetbets/comments/oqcvd6/does_half_of_this_really_go_to_tax/h6d5xpt/,0.225,0.775,0.0,-0.4404
40,GME, I told them about my GME play and none of them realized *why* someone would want to lose thousands of dollars by betting on a brick and mortar game store in 2021!,StarGaurdianBard,8,/r/wallstreetbets/comments/oqcvd6/does_half_of_this_really_go_to_tax/h6c62yv/,0.08,0.801,0.118,0.0
41,GDP," Yeah but taxes aren’t generally divided up into what you’re paying for. Social security being the standout in the group here. You can’t decide to pay or not pay for the military, it’s just badgered from what’s there/going to be there. 

The national debt is a very misunderstood topic since most people see it the same way you see debt from a credit card. The reality is is that’s vastly more complicated and more in common with your mortgage (healthy economic activity) than your credit card. 

National debt is mostly owned by Americans. This is done through bonds a lot of the time. And they’re considered safe long term investments. To pay the debt off would be to halt investment in the US government, which is bad. This also applies to forgoing countries who see the US dollar as a safe form of investment. 

The coronavirus has tested the strength of the US debt. It’s far more sound than economists gave it credit for. The debt didn’t default even after GDP dropped like a lead balloon last year. 

Now we can get into a discussion on what the money was spent on and if that was a good idea or not, but that’s really a different topic I think we can both agree on that haha!",DJButterscotch,134,/r/wallstreetbets/comments/oqcvd6/does_half_of_this_really_go_to_tax/h6bwzu3/,0.126,0.713,0.161,0.899
42,LOVE, Jim Cramer was talking about Dick’s Sporting Goods the other night and yelled out “I LOVE DICKS!”,Dyert,367,/r/wallstreetbets/comments/oqdet7/jim_cramer_is_a_master_clown/h6b3mug/,0.0,0.754,0.246,0.7371
43,AIHS," DIDI drivers will move to AIHS. Senmiao has a better platform app and now that DIDI's app is removed, all newbies are going to Senmiao.",KJxbox,2,/r/wallstreetbets/comments/oqdet7/jim_cramer_is_a_master_clown/h6bhw17/,0.0,0.888,0.112,0.4404
44,DIDI," DIDI drivers will move to AIHS. Senmiao has a better platform app and now that DIDI's app is removed, all newbies are going to Senmiao.",KJxbox,2,/r/wallstreetbets/comments/oqdet7/jim_cramer_is_a_master_clown/h6bhw17/,0.0,0.888,0.112,0.4404
45,GME, I remember when Cramer basically called the GME peak and told everyone to sell 🤡,justforkicks69420,2,/r/wallstreetbets/comments/oqdet7/jim_cramer_is_a_master_clown/h6bqcje/,0.0,1.0,0.0,0.0
46,CLOV," Cramer told guy on phone yesterday not to Buy CLOV.

guess whos confident to buy more Clov now?????",lloydeph6,3,/r/wallstreetbets/comments/oqdet7/jim_cramer_is_a_master_clown/h6b8dga/,0.0,0.803,0.197,0.6322
47,CLF, I saw this. Though I'd do the opposite since I've lost money listening to him with Ford & CLF. Finally paid off. $600 tendies.,Technical-Ad-3967,1,/r/wallstreetbets/comments/oqdet7/jim_cramer_is_a_master_clown/h6bidko/,0.099,0.901,0.0,-0.3182
48,COIN," Between DIDI and COIN, Cramer pulled a hard core DP on his followers and I am not talking about the fun DP behind wendy's",bamadesi,1,/r/wallstreetbets/comments/oqdet7/jim_cramer_is_a_master_clown/h6bmsfc/,0.057,0.81,0.134,0.4404
49,DIDI," Between DIDI and COIN, Cramer pulled a hard core DP on his followers and I am not talking about the fun DP behind wendy's",bamadesi,1,/r/wallstreetbets/comments/oqdet7/jim_cramer_is_a_master_clown/h6bmsfc/,0.057,0.81,0.134,0.4404
50,DIDI," He did say the key word ""if you want to -speculate-."" I get people have a Cramer hate, but yeah. He can't help that DIDI failed to disclose it's risk in the IPO (Which it legally has to).",Hani95,1,/r/wallstreetbets/comments/oqdet7/jim_cramer_is_a_master_clown/h6bpqzh/,0.263,0.619,0.118,-0.8311
51,ATH, I heard Cramer say that the s&p was not going to be beat down any more. WTF IT IS AT ATH. That is the greatest sell signal of the decade! Monday I  am all in ! Sell sell sell !!!!,ZookeepergameOk3622,1,/r/wallstreetbets/comments/oqdet7/jim_cramer_is_a_master_clown/h6brlda/,0.133,0.774,0.093,-0.4203
52,IS, I heard Cramer say that the s&p was not going to be beat down any more. WTF IT IS AT ATH. That is the greatest sell signal of the decade! Monday I  am all in ! Sell sell sell !!!!,ZookeepergameOk3622,1,/r/wallstreetbets/comments/oqdet7/jim_cramer_is_a_master_clown/h6brlda/,0.133,0.774,0.093,-0.4203
53,DB, He’s a tool. Likes to hear himself. Master DB,Zealousideal_Book151,1,/r/wallstreetbets/comments/oqdet7/jim_cramer_is_a_master_clown/h6byzoa/,0.0,0.714,0.286,0.4215
54,DIDI, So....... Buy DIDI right? Asking for a friend.,WillTheDreadWolf,1,/r/wallstreetbets/comments/oqdet7/jim_cramer_is_a_master_clown/h6c6jpg/,0.0,0.652,0.348,0.4939
55,COIN, Don't forget that he also like COIN to 475,kft99,1,/r/wallstreetbets/comments/oqdet7/jim_cramer_is_a_master_clown/h6cad1t/,0.0,0.627,0.373,0.4881
56,AMC, Lol. What did he say about AMC and CLOV again?,Topic-Jolly,1,/r/wallstreetbets/comments/oqdet7/jim_cramer_is_a_master_clown/h6chui0/,0.0,0.763,0.237,0.4215
57,CLOV, Lol. What did he say about AMC and CLOV again?,Topic-Jolly,1,/r/wallstreetbets/comments/oqdet7/jim_cramer_is_a_master_clown/h6chui0/,0.0,0.763,0.237,0.4215
58,GOOD," Everything he said was factually correct? He even says ""IF THEY STAY ON THE GOOD SIDE OF THE CCP"" which Didi did not.",Charmeleonn,1,/r/wallstreetbets/comments/oqdet7/jim_cramer_is_a_master_clown/h6ci26t/,0.0,0.858,0.142,0.5622
59,ON," Everything he said was factually correct? He even says ""IF THEY STAY ON THE GOOD SIDE OF THE CCP"" which Didi did not.",Charmeleonn,1,/r/wallstreetbets/comments/oqdet7/jim_cramer_is_a_master_clown/h6ci26t/,0.0,0.858,0.142,0.5622
60,DIDI, Everybody mad at the Chinese government for doing their job. DIDI had every warning and greedily pushed ahead with the IPO without complying with the regulatory rules. Props to the Chinese government for not being anybody bitch,HelpfulSocialist,1,/r/wallstreetbets/comments/oqdet7/jim_cramer_is_a_master_clown/h6cuqep/,0.191,0.74,0.069,-0.6628
61,DIDI," but, hey, DIDI indeed beat then bought all Uber's assets and operations in China.

In the deep there's still a little bit of truth.",WidepeepoHappysad,1,/r/wallstreetbets/comments/oqdet7/jim_cramer_is_a_master_clown/h6d0fbb/,0.0,0.82,0.18,0.558
62,UK, As someone who lives in the UK I honestly thought this guy was satire. I didn’t realise he was a financial reporter 🤣,JimbosilverbugUK,1,/r/wallstreetbets/comments/oqdet7/jim_cramer_is_a_master_clown/h6dgpj6/,0.0,0.857,0.143,0.4588
63,DD, The same type of people who listen to DD on any stock website or the dozens of subreddits on here including this one.,NotInsane_Yet,4,/r/wallstreetbets/comments/oqdet7/jim_cramer_is_a_master_clown/h6bnzfg/,0.0,1.0,0.0,0.0
64,AMC," I made money off of Baba last year, then I held it for a month and said fuck this, it isn't moving at all. Bought AMC and made out good. Now I'm holding CLF and ION.",Master_Proposal_3614,-1,/r/wallstreetbets/comments/oqdet7/jim_cramer_is_a_master_clown/h6brprw/,0.094,0.829,0.078,-0.1531
65,CLF," I made money off of Baba last year, then I held it for a month and said fuck this, it isn't moving at all. Bought AMC and made out good. Now I'm holding CLF and ION.",Master_Proposal_3614,-1,/r/wallstreetbets/comments/oqdet7/jim_cramer_is_a_master_clown/h6brprw/,0.094,0.829,0.078,-0.1531
66,DIDI," I mean DIDI should have known it was a bad idea to IPO after they were told it would be best to delay IPO. Now in Cramer’s defense, there’s no way he could have known that. But he should have known better than to pump a Chinese IPO when recent news had suggested they were really cracking down on multiple companies. 

https://www.wsj.com/articles/chinese-regulators-suggested-didi-delay-its-u-s-ipo-11625510600

*Edited to correct some grammar and link.",thegamersfix,24,/r/wallstreetbets/comments/oqdet7/jim_cramer_is_a_master_clown/h6bsvtu/,0.075,0.82,0.105,0.4939
67,DD," How is investment advice market manipulation, unless he’s getting fed insider information then it’s just like DD posts on Reddit or online articles giving opinions on stocks",tristinr1,1,/r/wallstreetbets/comments/oqdet7/jim_cramer_is_a_master_clown/h6ds2y9/,0.071,0.772,0.158,0.4019
68,LMAO," Never gets old.
One of the last thing he said, the s&p is going higher LMAO",estoxzeroo,2,/r/wallstreetbets/comments/oqdet7/jim_cramer_is_a_master_clown/h6dvmud/,0.0,0.764,0.236,0.6841
69,TV, OK but regardless a CCP shill would never support Taiwanese independence on TV.,LovableContrarian,26,/r/wallstreetbets/comments/oqdet7/jim_cramer_is_a_master_clown/h6c2dry/,0.194,0.673,0.132,-0.2312
70,DD," I was thinking the other day that an ""Accuracy Bot"" or ""Reliability Bot"" would be cool for the ppl who often post DD/TA, but I dont think there'd be a practical way to implement one. Then again Im a truck driver so operating a toaster oven is almost beyond my skillset",VATruckerJJ,389,/r/wallstreetbets/comments/oqngq7/manipulation_girls_do_it_shit_posters_do_it/h6cpcjq/,0.0,0.965,0.035,0.1655
71,DD," All these stocks have printed in the past, just don’t be the retard to buy at the top. If you’re relying on DD’s posted here learn to understand which ones are good and which ones are garbage.

1. Does the OP of the DD sound like a bagholder? Is he giving biased points and has the stock already been pumped? Most likely he bought at the top before he had done his research, and conducted it after bagholding.

2. Does the DD post clear and legitimate catalysts and not just rumours? Here’s some to be wary of: stock buyback, short interest, etc

3. Does the DD present a bullish AND bearish thesis? Everything comes with risk/reward and these need to be stated to come to a justified decision.

As a matter of fact, sometimes the best times to position yourself in a stock are at times of uncertainty. If someone claims to KNOW that some retarded ticker is gonna print you millions, they don’t. Nobody knows. 

All we can do is speculate. But with that being said I have read some incredible DD on this subreddit and a lot of them tend to be the ones with the lesser upvotes.

Avoid the bagholder DD, and do your own. At the very least look at their financials. Doesn’t even have to be complicated. Just go on Nasdaq and find their quarterly EPS. If it’s positive, good, if it’s negative, find out why. If the ‘why’ is bad take it off the watchlist.",ilovefiftyfifty,146,/r/wallstreetbets/comments/oqngq7/manipulation_girls_do_it_shit_posters_do_it/h6d53wa/,0.075,0.825,0.1,0.4234
72,BCRX," Check the OP's positions and compare to the current price.

If they're $15 out of the money on a 0DTE option they're probably trying to pump the stock to save their ass.

&#x200B;

If they bought 10,000 shares at X price check when the stock was that price. If they've been in the red for the last 2 months they're probably trying to get rid of the bag.

&#x200B;

Does the DD have any actual DD in it? Or is it just ""You should buy this because I think it's good""? Does it show financials, does it present the bear case and risks for a balanced view?

&#x200B;

For example I bought a few shares of BCRX after reading this DD

[https://www.reddit.com/r/wallstreetbets/comments/mtzhp2/bcrx\_dd\_the\_embarrassment\_of\_riches/](https://www.reddit.com/r/wallstreetbets/comments/mtzhp2/bcrx_dd_the_embarrassment_of_riches/)

&#x200B;

Notice how long that was? I paid $11.16 and it's currently at $17.35.

&#x200B;

Now see this recent Ford DD (quick disclaimer, I just picked a recent DD at random and skimmed it, it may in fact be good DD but I'm too lazy to check right now, also it's too recent to compare the price action)

[https://new.reddit.com/r/wallstreetbets/comments/oq86ru/f\_to\_pay\_your\_respects\_ford\_dd/](https://new.reddit.com/r/wallstreetbets/comments/oq86ru/f_to_pay_your_respects_ford_dd/)

Pretty short huh?

&#x200B;

Does the price target and time frame seem realistic? Take every price target with a large pinch of salt, also check what the analyst price targets are for comparison.

&#x200B;

Does the OP have a record of previous good DD? Check their profile or the links in the visualmod post that get's stickied in every thread.

&#x200B;

Is OP's account very new? Are they spamming various investing subs about a particular stock?

&#x200B;

&#x200B;

Finally, apply a bit of common sense.",Random_Guy_47,78,/r/wallstreetbets/comments/oqngq7/manipulation_girls_do_it_shit_posters_do_it/h6cs8y1/,0.042,0.898,0.061,0.6322
