,ticker,comment,username,score,permalink,neg,neu,pos,compound
335,UWMC," My point is that they thought they were going to be added, then possibly in error they decided not to add UWMC. Possibly they will change their mind and add them, but no one knows. What I said is true, UWMC stock has never been part of the Russell 1000 or 3000.",UncleZiggy,2,/r/stocks/comments/m9gtaw/what_are_some_stocks_that_are_on_your_watch_list/grpg0pf/,0.083,0.852,0.066,0.0129
336,CC," Because selling put has only 2 outcomes:  (1) you don't get the shares and (2) you get the shares at higher than the market price.  You make the call if the premium collected is worth it for you.

In general, CSP and CC under-perform a bull market especially when tax policy is taken into account.  CSP and CC are a solid part of a steady income strategy but they are not the best longer-term investment strategy.",paq12x,4,/r/stocks/comments/m9w24q/if_i_have_decided_i_will_buy_a_certain_stock_if/grp8a0f/,0.096,0.868,0.036,-0.6898
337,DD," Looks like a lot of people on here are saying ""Because you could have made more if you bought at the bottom"" which is a really unhealthy and unrealistic way to do stocks. If you do your DD and know what price you're willing to buy at, then you're fine selling the put. Buy yes, to add on what everyone here is saying, you run the risk of not buying at the bottom, exactly if you sent the buy limit at that price, then it keeps going down.",BrokenYozeff,10,/r/stocks/comments/m9w24q/if_i_have_decided_i_will_buy_a_certain_stock_if/grpco24/,0.062,0.864,0.075,0.0534
338,CC," No, that's incorrect. A CC is a bullish strategy. A short 200p = 100 shares + short 200c. They're equal, every time. This is basic options knowledge, readable from just about every book or website.",OKImHere,-2,/r/stocks/comments/m9w24q/if_i_have_decided_i_will_buy_a_certain_stock_if/grphaqb/,0.068,0.864,0.068,0.0
339,CAJ," >Im not arguing with a guy that 1, doesn't understand put-call parity, 2, thinks losing money from a stock dip is a good thing and making money from a rise is a bad thing. Good day.

You're not ""arguing"" because you have a misunderstanding of market dynamics, much less options.

It is better to be in covered call on a long term underlying position when a stock price moderately dips, then when it rises beyond the strike price. You retain the stock, gain the premium and have the ability to dollar cost average down. 

If it swings wildly either way, however, it is better to be in no CC position at all.

For example, my own recent real-world mistake with a CC: In January, wrote two $20 calls on Canon ($CAJ), when it was ~$18, for a Feb 19 expiration. I expected it was growing slowly and wouldn't hit that target. Instead, it went to $22.30 and the options executed. 

With a premium of .55, those covered calls alone ended up costing me $350 in potential profits. CAJ hasn't dropped enough to allow me to rebuy in profitably; currently holding right at $22.

This is why CCs aren't bullish, no matter that there is a modicum of ""profit"" involved. They are a short hedge (literally are called a ""*short call*"") -- and risky in stocks that go up more than anticipated.

If one is bullish on a stock, and expect it to go up, a cash covered  put is the better play. Which was how I slightly ""fixed"" my Canon position, when it rose faster than expected: by creating a short straddle, at near the strike price. I gained the premium for the short put, to offset the short call ""loss.""",4ppleF4n,1,/r/stocks/comments/m9w24q/if_i_have_decided_i_will_buy_a_certain_stock_if/grq7omz/,0.076,0.791,0.133,0.9552
340,CC," >Im not arguing with a guy that 1, doesn't understand put-call parity, 2, thinks losing money from a stock dip is a good thing and making money from a rise is a bad thing. Good day.

You're not ""arguing"" because you have a misunderstanding of market dynamics, much less options.

It is better to be in covered call on a long term underlying position when a stock price moderately dips, then when it rises beyond the strike price. You retain the stock, gain the premium and have the ability to dollar cost average down. 

If it swings wildly either way, however, it is better to be in no CC position at all.

For example, my own recent real-world mistake with a CC: In January, wrote two $20 calls on Canon ($CAJ), when it was ~$18, for a Feb 19 expiration. I expected it was growing slowly and wouldn't hit that target. Instead, it went to $22.30 and the options executed. 

With a premium of .55, those covered calls alone ended up costing me $350 in potential profits. CAJ hasn't dropped enough to allow me to rebuy in profitably; currently holding right at $22.

This is why CCs aren't bullish, no matter that there is a modicum of ""profit"" involved. They are a short hedge (literally are called a ""*short call*"") -- and risky in stocks that go up more than anticipated.

If one is bullish on a stock, and expect it to go up, a cash covered  put is the better play. Which was how I slightly ""fixed"" my Canon position, when it rose faster than expected: by creating a short straddle, at near the strike price. I gained the premium for the short put, to offset the short call ""loss.""",4ppleF4n,1,/r/stocks/comments/m9w24q/if_i_have_decided_i_will_buy_a_certain_stock_if/grq7omz/,0.076,0.791,0.133,0.9552
341,CC," 
>You're not ""arguing"" because you have a misunderstanding of market dynamics, much less options

You literally can't read a pl graph. You literally gave an example of you losing money and prefering that.

>It is better to be in covered call on a long term underlying position when a stock price moderately dips, then when it rises beyond the strike price. 

No. It's not. That's worse. You have less money. Most people like having more money. You'd have less. That's bad. Get that through your head. Losing money is bad.

>If it swings wildly either way, however, it is better to be in no CC position at all.

Which isn't the topic. The topic is how wrong you are to say a CC is bearish.

>For example, my own recent real-world mistake with a CC: In January, wrote two $20 calls on Canon ($CAJ), when it was ~$18, for a Feb 19 expiration. I expected it was growing slowly and wouldn't hit that target. Instead, it went to $22.30 and the options executed. 

Oh no! You made $200 plus premium! That must've been hard! 

>This is why CCs aren't bullish, no matter that there is a modicum of ""profit"" involved. They are a short hedge (literally are called a ""*short call*"") --

There you go everyone. He admits it. He doesn't like profit. 

 >and risky in stocks that go up more than anticipated.

Yeah, the risk is I sell my shares for maximum profit. No wonder you don't like it. 

>They are a short hedge (literally are called a ""*short call*"")

A covered call is not the same thing as a short call. Those are two different things. No wonder you dont get this basic fact. You don't even know what a covered call is. You think it's a naked call. Jesus Christ.

Please everyone, for your own sanity and bank account, ignore this guy. He doesn't have a clue about the words he's using and can't do basic math.",OKImHere,1,/r/stocks/comments/m9w24q/if_i_have_decided_i_will_buy_a_certain_stock_if/grq9gq3/,0.138,0.779,0.083,-0.9388
342,ATH," UDOW isn’t back at its old ATH and yet the Dow itself is comfortably past its pre-COVID ATH as of this moment (for an index this big, you’d consider over 10% to be comfortably). 

That’s where you see the time decay. SPXL is only a little over 7% above it’s pre-COVID ATH for another example while SPX is a little over 15% above it.

These are good swing trades (that can last for as long as you feel the market trend is up which could last months), long term holds on the other hand, nope because time decay will likely get you unless you’ve found the alternate universe where there are no corrections.",95Daphne,11,/r/stocks/comments/m9nopu/3x_leveraged_long_stocks_how_did_they_recover_so/gro5iai/,0.063,0.864,0.073,0.3182
343,ETN," Not sure if same, but I own MREIT, and their are leveraged ETN that pay you double (20%).

Due to the price of most mREIT falling more than 50% during last year crash, the ETN was closed, as it became worthless. It was though designed for high income.",one8e4,1,/r/stocks/comments/m9nopu/3x_leveraged_long_stocks_how_did_they_recover_so/groyj7w/,0.234,0.766,0.0,-0.8956
344,ATH," Well, they did get crushed. SPXL drew down 75%. Had it not been a straight line recovery, SPXL probably would not have recovered to highs as fast as SPX.  

Also, SPXL is up about 17.5 or so since Jan 2020. You’d think a 3X product would simply multiply returns/losses by 3X over a given time period. The decay plus the affects that large drawdowns have on leveraged products is why SPXL isn’t up 3x SPX which would be about 60% or so since Jan 2020.

Most people sell once they draw down, hence irrevocable losses. If you’re cool with Vol, leverage isn’t bad. In a perfect world you buy these at a bottom and sell once they reach their ATH again.",PoopKing5,1,/r/stocks/comments/m9nopu/3x_leveraged_long_stocks_how_did_they_recover_so/grq3ohq/,0.103,0.826,0.071,-0.6329
345,QS," I've decided not to spend too much time on EV companies.  I'm speculating that the money play will be in battery tech and battery companies.  Mainly those working in the solid state battery field.  They are aiming to highly recyclable, and wont use cobalt.  Batteries will be installed at homes, power grids, EV, etc since wind/solar/hydro will need storage. 

Long term, I even see Tesla not as an EV company, but mainly a battery company, and clean energy company due to increase in EV competition.   Regardless of EV competition, every EV will will need batteries!  

&#x200B;

my short list of battery companies ( not all are public).

QS

Solid Power

Bollore SE

Sila Nano",notspeedy01,4,/r/stocks/comments/m9wmmk/trying_to_wrap_my_brain_around_electric_vehicles/grpawz6/,0.0,0.88,0.12,0.907
346,SE," I've decided not to spend too much time on EV companies.  I'm speculating that the money play will be in battery tech and battery companies.  Mainly those working in the solid state battery field.  They are aiming to highly recyclable, and wont use cobalt.  Batteries will be installed at homes, power grids, EV, etc since wind/solar/hydro will need storage. 

Long term, I even see Tesla not as an EV company, but mainly a battery company, and clean energy company due to increase in EV competition.   Regardless of EV competition, every EV will will need batteries!  

&#x200B;

my short list of battery companies ( not all are public).

QS

Solid Power

Bollore SE

Sila Nano",notspeedy01,4,/r/stocks/comments/m9wmmk/trying_to_wrap_my_brain_around_electric_vehicles/grpawz6/,0.0,0.88,0.12,0.907
347,GM," One thing that a lot of people miss in the EV history. The first truly popular and somewhat successful “EV” was the Chevrolet Volt. Yes it had a gas tank, but many owners could run it on electric 100% of the time unless going on a long trip. 

The part that most people don’t know about is that it cost GM roughly $90k to make one and they sold it for about half of that. 

How? Government subsidies. Not a huge surprise but that’s a big part of the future of EVs. Seeing it already in Europe. 

Most people don’t care about the disadvantages of cobalt or lithium, they care about the personal cost. Once an automaker can make an electric car that’s more affordable (seems like Tesla and GM might be getting close), people will buy it. 

Good point about the grid though. That’s gonna be a big mess. They’ll probably have to add more nuclear (like Europe)",mr-poop-stain-6-,4,/r/stocks/comments/m9wmmk/trying_to_wrap_my_brain_around_electric_vehicles/grpd92u/,0.072,0.788,0.14,0.9198
348,USA," I’m taking a different strategy for the EV craze that will inevitably happen.  I’m accumulating stocks in mining operations that produce Nickel, Lithium, Manganese, Cobalt, and Copper.  Additionally, I’m investing in companies that are into battery recycling. Increasing the demand on these commodities will most likely increase their price.  I’m interested in operations in Canada, USA, Mexico, South America, and Australia.",Hefty-Catch-4251,4,/r/stocks/comments/m9wmmk/trying_to_wrap_my_brain_around_electric_vehicles/grpexh6/,0.048,0.87,0.082,0.4902
349,FANG," I invested in LAC(lithium), TECK (copper), HYLN and TSLA. Also hedging with FANG and VDE! 

Bring on the next decade!",thekingbun,3,/r/stocks/comments/m9wmmk/trying_to_wrap_my_brain_around_electric_vehicles/grpm3v2/,0.0,1.0,0.0,0.0
350,HYLN," I invested in LAC(lithium), TECK (copper), HYLN and TSLA. Also hedging with FANG and VDE! 

Bring on the next decade!",thekingbun,3,/r/stocks/comments/m9wmmk/trying_to_wrap_my_brain_around_electric_vehicles/grpm3v2/,0.0,1.0,0.0,0.0
351,TECK," I invested in LAC(lithium), TECK (copper), HYLN and TSLA. Also hedging with FANG and VDE! 

Bring on the next decade!",thekingbun,3,/r/stocks/comments/m9wmmk/trying_to_wrap_my_brain_around_electric_vehicles/grpm3v2/,0.0,1.0,0.0,0.0
352,TSLA," I invested in LAC(lithium), TECK (copper), HYLN and TSLA. Also hedging with FANG and VDE! 

Bring on the next decade!",thekingbun,3,/r/stocks/comments/m9wmmk/trying_to_wrap_my_brain_around_electric_vehicles/grpm3v2/,0.0,1.0,0.0,0.0
353,OC," This post reminds me of a discussion I overheard between two old codgers when I first started trading/investing.



OC 1:  I don't know about these new machines.  Automobiles?  They are constantly breaking down.  Can't go more than a mile before something goes wrong.  So, can't really go outside the city .

OC 2:  Sure.  Range anxiety is real.  And I can get a horse anywhere.  Automobiles, at least the one you can afford, is built by one company.  You get rid of your horses and the company goes out of business, doubles or triples prices, etc.  What then?

OC 1:  And they run on what?  Gasoline?  Who makes this stuff.  There is one farmer with a still in this state.  And it's made out of oil which is dug from the ground.  What if that runs out?  I mean how many dinosaurs were there in the world?  500?  1000, max.


OC 2:  And where are they all made?  Hardly an awesome state and too close to Canada.  


OC 1:  Also, aren't they real dirty.  The shit that comes out of the tailpipe is terrible.  At least the horse's shit is organic and can be recycled.  According to Martha, the automobile smoke will wreck the earth.  Yeah, I'm sticking with my horse.

OC 2:  Me, too.  We are two woke codgers.



I telegrammed my broker and bought me some Ford and Standard Oil.",txrazorhog,3,/r/stocks/comments/m9wmmk/trying_to_wrap_my_brain_around_electric_vehicles/grpmqkh/,0.079,0.877,0.045,-0.8494
354,IMO," Check out the company Ambri. Backed by bill gates, created by MIT professor and his students, liquid metal battery formed mostly by the rare earth mineral Antimony. World changing technology if it becomes adopted. Allows for all batteries to essentially be run by renewable energy, and exceeds the limits of lithium ion batteries by far. This battery will be used for much more than EV’s IMO. Better Charging, battery life, etc... 
then check out $UAMY, the only company in the US that mines for antimony :)",Zoomer2215,2,/r/stocks/comments/m9wmmk/trying_to_wrap_my_brain_around_electric_vehicles/grpdm6m/,0.0,0.879,0.121,0.8442
355,ICE," Ok so here’s my 2c... electric vehicles, from an environmental point of view aren’t that good. There’s a terrible amount of pollution from manufacturing at all levels of the process. But in terms of stock prices, it’s irrelevant unfortunately. It’s simply about where the sentiment goes. All manufacturers are investing in EVs because governments are pushing for it. So manufacturers are a bit of a gamble because they will simply transfer production from ICE to EV. Suppliers however, might be a better bet. But what do I know? 🤷",SoreLoserOfDumbtown,0,/r/stocks/comments/m9wmmk/trying_to_wrap_my_brain_around_electric_vehicles/grp9mfj/,0.06,0.852,0.087,0.3612
356,IMO, It’s the law in some areas of the US. Some people are not going to have a choice. IMO hydrogen is the future. LIN is a leader and the stock is much 🥰.,Old-Lavishness-9546,1,/r/stocks/comments/m9wmmk/trying_to_wrap_my_brain_around_electric_vehicles/grpektn/,0.0,1.0,0.0,0.0
357,LIN, It’s the law in some areas of the US. Some people are not going to have a choice. IMO hydrogen is the future. LIN is a leader and the stock is much 🥰.,Old-Lavishness-9546,1,/r/stocks/comments/m9wmmk/trying_to_wrap_my_brain_around_electric_vehicles/grpektn/,0.0,1.0,0.0,0.0
358,AI," This. The money in Tesla is in the AI and UI, while being ""green"" is a nice selling point.",SmtnBtfl,4,/r/stocks/comments/m9wmmk/trying_to_wrap_my_brain_around_electric_vehicles/grp9ttj/,0.0,0.859,0.141,0.4215
359,UI," This. The money in Tesla is in the AI and UI, while being ""green"" is a nice selling point.",SmtnBtfl,4,/r/stocks/comments/m9wmmk/trying_to_wrap_my_brain_around_electric_vehicles/grp9ttj/,0.0,0.859,0.141,0.4215
360,ICE," "" Why are the current EV companies valued higher than the previous car market that existed. ""

Ford total debt is around 160 billion, Tesla total debt 11 billion,  that's an example right there.  Tesla only produces EV while Ford and other legacy makers have existing ICE production factory's that will pile more debt as they try to play catch up with Tesla",repagator8,2,/r/stocks/comments/m9wmmk/trying_to_wrap_my_brain_around_electric_vehicles/grpyb8h/,0.109,0.814,0.077,-0.296
361,IMO," I don't see that happening, driverless taxis everywhere. In cities, yes, and that would also create problems, but we still have suburban and rural living going on and zero infrastructure to live without cars. Driverless taxis just won't cut it, IMO.",Pat32G,1,/r/stocks/comments/m9wmmk/trying_to_wrap_my_brain_around_electric_vehicles/grqqjtb/,0.043,0.828,0.129,0.4159
362,ICE," Hybrid is actually a very sensible option.  I like the volt a lot as well as the older Fisker.  Yes they gave gas tanks but they're not like the Prius or other vehicles that have ICE drivetrains with added electric motors.  The volt has an electric drivetrain with smaller battery bank and an engine that charges the batteries for extended range.  The Chrysler Pacifica is good also because it has two electric motors in the transmission, no reverse gear and no altinator.  One of the motors acts as a generator and reverse is electric only.  

The conundrum with all electric vehicles is people are worried about range anxiety yet at the same time the average daily commute is like 40km.  Why have a huge battery capable of 400+ km when you rarely or never need it?  Smaller battery for daily driving and an ICE range extender makes a lot more sense.",hammerosi,3,/r/stocks/comments/m9wmmk/trying_to_wrap_my_brain_around_electric_vehicles/grpk5rv/,0.078,0.786,0.136,0.8649
363,GM," Agreed.  There are very promising Canadian companies that will have a a major impact on the North American market, not only in mining and processing of cobalt, but also the recycling of black mass of old EV batteries.  I am very high on First Cobalt as a key player in the next 2-5 years with their environmentally friendly metallurgic processes, their ownership of cobalt rich land in Idaho, their R&D on black mass, and their proximity to Ford, GM (Lordstown) Honda and Toyota.  Their leadership is sound and they are being financed by the Canadian government.  Worth a look, IMO.",TheRealPoofers,3,/r/stocks/comments/m9wmmk/trying_to_wrap_my_brain_around_electric_vehicles/grpj5pj/,0.0,0.856,0.144,0.9337
364,IMO," Agreed.  There are very promising Canadian companies that will have a a major impact on the North American market, not only in mining and processing of cobalt, but also the recycling of black mass of old EV batteries.  I am very high on First Cobalt as a key player in the next 2-5 years with their environmentally friendly metallurgic processes, their ownership of cobalt rich land in Idaho, their R&D on black mass, and their proximity to Ford, GM (Lordstown) Honda and Toyota.  Their leadership is sound and they are being financed by the Canadian government.  Worth a look, IMO.",TheRealPoofers,3,/r/stocks/comments/m9wmmk/trying_to_wrap_my_brain_around_electric_vehicles/grpj5pj/,0.0,0.856,0.144,0.9337
365,ICE," The law is that new car sales can’t be ICE cars after 2030. People could still buy used cars or go out of state to buy new cars. Also, that’s a long time and laws can change.",merriless,1,/r/stocks/comments/m9wmmk/trying_to_wrap_my_brain_around_electric_vehicles/grpgre9/,0.0,1.0,0.0,0.0
366,ICE," I'll say right now if every ICE car instantly switched to electric it would be a problem everywhere.  But the power grid concerns aren't really all that worrisome.  We currently waste ridiculous amounts of power on things like lighting up office buildings and stores when no one is there.  For one, there's a lot of reallocation that could be done.  For another, as electric vehicles become more common the power grid and supply will simply have to keep up one way or another.  With more options like tidal power, landfill recovery, etc, one at or another we'll figure it out.",hammerosi,3,/r/stocks/comments/m9wmmk/trying_to_wrap_my_brain_around_electric_vehicles/grpikrx/,0.121,0.834,0.046,-0.8
367,ICE, Lol you make it sound like they failed at making ICE. You bought a performance car and were upset that it required more maintenance than a toyota corolla,FancyGonzo,1,/r/stocks/comments/m9wmmk/trying_to_wrap_my_brain_around_electric_vehicles/grpudj5/,0.178,0.663,0.16,-0.1531
368,OC," >I just don't see infrastructure investment.

OC 1:  And where's the infrastructure investment?  You can't drive these automobiles on the roads we have outside the city.  They'll be wrecked.  You need roads made out of bitumen.  And there isn't enough of that to build roads outside the cities.  This country is huge.

OC 2:  Oh, yeah.  Even if they do take off they won't every be used for more than tooling around town.  Also the infrastructure for gasoline stations?  Nothing.

OC 1:  Of course, no one is going to build gasoline stations until there are enough cars.  And people aren't going to buy cars until there are more gasoline stations.

OC 2:  Sure.  Chicken and egg, amirite?",txrazorhog,2,/r/stocks/comments/m9wmmk/trying_to_wrap_my_brain_around_electric_vehicles/grpp71u/,0.018,0.922,0.06,0.6298
369,AEP," AEP and a number of other electric companies (Duke, Dominion, etc.) have formed a coalition to create EV infrastructure to handle the future growth.  From the March 3rd Columbus Dispatch (AEP headquarters), 

“The utilities have formed the Electric Highway Coalition to give drivers of electric vehicles access to a network of fast-charging stations in a major region of the country that stretches from southwest Michigan to Texas throughout the Southeast and up the Atlantic Coast to Virginia. The utilities will set up the charging stations in their service territories...”

The infrastructure will be there.  Also, charging station companies are growing and GM is assisting in the development of EVGo charging stations.  The U.S. in the infancy of a major change and I believe now is the time to jump in.",TheRealPoofers,1,/r/stocks/comments/m9wmmk/trying_to_wrap_my_brain_around_electric_vehicles/grpr8uo/,0.0,0.94,0.06,0.6908
370,GM," AEP and a number of other electric companies (Duke, Dominion, etc.) have formed a coalition to create EV infrastructure to handle the future growth.  From the March 3rd Columbus Dispatch (AEP headquarters), 

“The utilities have formed the Electric Highway Coalition to give drivers of electric vehicles access to a network of fast-charging stations in a major region of the country that stretches from southwest Michigan to Texas throughout the Southeast and up the Atlantic Coast to Virginia. The utilities will set up the charging stations in their service territories...”

The infrastructure will be there.  Also, charging station companies are growing and GM is assisting in the development of EVGo charging stations.  The U.S. in the infancy of a major change and I believe now is the time to jump in.",TheRealPoofers,1,/r/stocks/comments/m9wmmk/trying_to_wrap_my_brain_around_electric_vehicles/grpr8uo/,0.0,0.94,0.06,0.6908
371,GOEV," Canoo (GOEV) should absolutely be on this list- modular vehicle platform, repairable, expandable, customizable battery packs and a new model of vehicle ownership. I spread my money around the EV sector but I hood highest hopes for GOEV. 
I think we’re going to see a fall from glory for Tesla in the next decade",LasOlas07,5,/r/stocks/comments/m9wmmk/trying_to_wrap_my_brain_around_electric_vehicles/grpir0t/,0.0,0.848,0.152,0.8573
