,ticker,comment,neg,neu,pos,compound
0,GME,It means big money is already inside GME.,0.0,1.0,0.0,0.0
1,GME,"Disclaimer: This is not investment advice. Do your own research.

A short squeeze on GME now has a very high probability of materializing. Due to naked shorting and greed (short interest above 100%), institutional shorts are trapped. The only way to solve this will be with a direct deal with GME board. In my view, they will ask for 2x-10x current price. This will give them enough funds to do important M&A and turnaround the company. Ryan is a very smart billionaire. They are not reaching to the media (e.g. Cramer) until the shorts realize they have no way out, but pay 10B-40B in a 10%-30% share offering.

&#x200B;

more info: [https://www.youtube.com/watch?v=BSiBZiqb3tU&feature=youtu.be&ab\_channel=StockMarketsWithBruce](https://www.youtube.com/watch?v=BSiBZiqb3tU&feature=youtu.be&ab_channel=StockMarketsWithBruce)",0.074,0.84,0.086,0.3422
2,RC,"Read his letter to the board too. It pretty much threatmantically said he doesn't want to be the only one from RC Ventures on the board. 

>Please be advised that RC Ventures is not interested in receiving a lone seat on GameStop’s ten-member Board. It is not enticing to become an isolated stockholder advocate on a Board that has overlooked years of digital revenue opportunities and presided over massive value destruction without assuming full accountability. We want GameStop’s leaders to do their jobs and implement a strategy for bringing the Company into the 21st century.",0.134,0.788,0.079,-0.4023
3,GME,"Watching what has happened with GME has been wild.  I understand there’s a short squeeze.    But the gambling going on that drove this stock is insane.   The company itself IS NOT worth its current market value.    

So when will it come crashing down?   Lots of people thinks it’s gonna keep going up.   But at the end of the day this companies current business model isn’t going to succeed.   Not trying to be negative here.  I believe in long term in investing and maybe that’s why I don’t understand the hype.   It seems like a short term game everyone I playing hoping they don’t get burned.",0.072,0.814,0.114,0.5624
4,XXII,I wish they did this to something I owned lol like XXII. Lol,0.0,0.393,0.607,0.8689
5,CEO,We’re there any history case where a activist investor became board then became CEO ?  Thanks,0.0,0.818,0.182,0.4404
6,PT,"I inverse your PT with

$960.24",0.0,1.0,0.0,0.0
7,DD,It's great DD like this that keeps me coming back to /r/investing.,0.0,0.602,0.398,0.765
8,GME,"Microsoft signed a partnership deal back in October for Xbox sales. Also, GME is looking to be a player in the custom PC build market. That combined with Cohen bringing E-commerce experience has made the stock a bull play. 

This is all separate from the short squeeze happening currently. Totally fascinating IMO.",0.0,0.884,0.116,0.7346
9,IMO,"Microsoft signed a partnership deal back in October for Xbox sales. Also, GME is looking to be a player in the custom PC build market. That combined with Cohen bringing E-commerce experience has made the stock a bull play. 

This is all separate from the short squeeze happening currently. Totally fascinating IMO.",0.0,0.884,0.116,0.7346
10,EVER,"So based on FA you believe GME to be undervalued.. have you EVER looked at their balance sheets YOY..? What planet are you on? 

Look at their cash flows. Look at their EBITDA. Huge year over year losses for multiple years in a row. 

Sure things COULD theoretically be turned around if the company essentially does a complete 180 operationally, which is sort of the Ryan Cohen expectation from what I can tell. But fundamental analysis shows you a currently overvalued stock based on their anticipated future cash flows. IMO.",0.03,0.916,0.055,0.3094
11,GME,"So based on FA you believe GME to be undervalued.. have you EVER looked at their balance sheets YOY..? What planet are you on? 

Look at their cash flows. Look at their EBITDA. Huge year over year losses for multiple years in a row. 

Sure things COULD theoretically be turned around if the company essentially does a complete 180 operationally, which is sort of the Ryan Cohen expectation from what I can tell. But fundamental analysis shows you a currently overvalued stock based on their anticipated future cash flows. IMO.",0.03,0.916,0.055,0.3094
12,IMO,"So based on FA you believe GME to be undervalued.. have you EVER looked at their balance sheets YOY..? What planet are you on? 

Look at their cash flows. Look at their EBITDA. Huge year over year losses for multiple years in a row. 

Sure things COULD theoretically be turned around if the company essentially does a complete 180 operationally, which is sort of the Ryan Cohen expectation from what I can tell. But fundamental analysis shows you a currently overvalued stock based on their anticipated future cash flows. IMO.",0.03,0.916,0.055,0.3094
13,CEO,"Literally anything. He can fire the CEO. Only thing more powerful is shareholders and if he convinces 51% of shares to vote for him he controls the company.

Remember that Steve Jobs was once fired from Apple because the board decided to.",0.12,0.74,0.14,-0.0018
14,CEO,Fire the current CEO,0.444,0.556,0.0,-0.34
15,GME,"Couldn't tell ya.

In any case, a market correction seems to be becoming more and more likely, and in the event of that, I don't think you'll see any holdouts... gamma squeeze or not.  That's why being in GME right now is like playing with fire, IMO.  I'm still in it, but I recognize that the risk for a return to the $30s is enormous now.

And, there was a ton of volume on Friday.  I think it's hard to know what the actual SI currently stands at.  Ortex might provide valuable insight, but I know it's estimated numbers for mid summer of last year were somewhat off, so I take the estimate with a little grain of salt.",0.051,0.887,0.062,0.3291
16,IMO,"Couldn't tell ya.

In any case, a market correction seems to be becoming more and more likely, and in the event of that, I don't think you'll see any holdouts... gamma squeeze or not.  That's why being in GME right now is like playing with fire, IMO.  I'm still in it, but I recognize that the risk for a return to the $30s is enormous now.

And, there was a ton of volume on Friday.  I think it's hard to know what the actual SI currently stands at.  Ortex might provide valuable insight, but I know it's estimated numbers for mid summer of last year were somewhat off, so I take the estimate with a little grain of salt.",0.051,0.887,0.062,0.3291
17,SI,"Couldn't tell ya.

In any case, a market correction seems to be becoming more and more likely, and in the event of that, I don't think you'll see any holdouts... gamma squeeze or not.  That's why being in GME right now is like playing with fire, IMO.  I'm still in it, but I recognize that the risk for a return to the $30s is enormous now.

And, there was a ton of volume on Friday.  I think it's hard to know what the actual SI currently stands at.  Ortex might provide valuable insight, but I know it's estimated numbers for mid summer of last year were somewhat off, so I take the estimate with a little grain of salt.",0.051,0.887,0.062,0.3291
18,DD,Someone posted some GME DD on another sub and included [this video.](https://www.youtube.com/watch?v=GLzTU87MJMM)GME talk starts around 17:00 & goes until about 40:00. You can also read some of the investment theses out there. Sounds like a realistic FMV is around $160 based on GME’s current financials.,0.0,0.944,0.056,0.3612
19,GME,Someone posted some GME DD on another sub and included [this video.](https://www.youtube.com/watch?v=GLzTU87MJMM)GME talk starts around 17:00 & goes until about 40:00. You can also read some of the investment theses out there. Sounds like a realistic FMV is around $160 based on GME’s current financials.,0.0,0.944,0.056,0.3612
20,GME,"$420 = weed

$69 = sex

its a meme, GME is a meme stock, the price target is a meme target",0.0,1.0,0.0,0.0
21,DCF,It's the value that falls out when you actually build out a 10Y DCF.,0.0,0.833,0.167,0.34
22,ALLY,"IV is insanely high right now for GME options. IV on most monthly options are about 200%+. You are paying a REALLY high premium on GME options, since contract sellers are pricing in extreme price movements. 

This means if GME is not having a 10% - 20% day, and only goes up 3% - 5% then you are losing money on your call options due to Theta. If you held shares, a 3%-5% day is, well, 3%-5% gain. Even worse, if GME had a red day, your call option could easily lose up to 50% or more of its value due to the extreme IV. It’s a risky bet, that’s all I’m saying. 

At the end of the day, it’s all about risk management. Just understand how IV, Delta and Theta work before you buy your contract.",0.085,0.827,0.088,0.1189
23,GME,"IV is insanely high right now for GME options. IV on most monthly options are about 200%+. You are paying a REALLY high premium on GME options, since contract sellers are pricing in extreme price movements. 

This means if GME is not having a 10% - 20% day, and only goes up 3% - 5% then you are losing money on your call options due to Theta. If you held shares, a 3%-5% day is, well, 3%-5% gain. Even worse, if GME had a red day, your call option could easily lose up to 50% or more of its value due to the extreme IV. It’s a risky bet, that’s all I’m saying. 

At the end of the day, it’s all about risk management. Just understand how IV, Delta and Theta work before you buy your contract.",0.085,0.827,0.088,0.1189
24,GME,"Make sure to look at the IV (implied volatility) before purchasing options.  I'm oversimplifying it greatly, but in quickest terms it can be used as a measure of how inflated the option price is.  Last I checked GME were around 200-300+%  Weeklies almost touched 400% which was insane to see.  At one point a put option for the 65 strike for next week was selling for $1205!  I mean think about that compared to the $6500 the shares are worth at that price, absolute craziness reached.

So let's say you purchased an option for $1205.  You could possibly guess the correct direction AND the correct timing, but if the IV drops (should volatility drop) you could still lose big because you had purchased the option during a time of great inflation.   Consider that most non-meme stocks have IVs of around 25%-50% and IV can change quickly.",0.077,0.832,0.09,0.2714
25,EOD,This is not true. All sites that track daily outstanding shorts list GME as having 70M shorts by EOD Friday. The big run ups wed last week and fri were gamma squeezes.,0.064,0.826,0.11,0.3956
26,GME,This is not true. All sites that track daily outstanding shorts list GME as having 70M shorts by EOD Friday. The big run ups wed last week and fri were gamma squeezes.,0.064,0.826,0.11,0.3956
27,CEO,"I think there's strong opportunity for change now though. Cash on hand, new CEO, Microsoft deal, etc. Hopefully they can make it through with this new opportunity.",0.0,0.587,0.413,0.93
28,GME,Are they going to put Ryan Cohen in a display case and charge WSB cucks $1000 a pop to come look at him? If so GME finally has a real revenue generator on their hands.,0.0,1.0,0.0,0.0
29,FB,"Yeah for sure there will always be those that prefer physical copies but there's Amazon etc for that. I can't recall the last time I went to a store to browse. Their buyback on used games is a joke but I suppose they make bank on it, but now there's FB marketplace for better deals for everyone. And their main markup as far as I know were insurance on the games. 

I'm honestly surprised it hasn't been Blockbustered a long time ago, especially after covid.",0.0,0.795,0.205,0.946
30,GME,"That's exactly the point of value stocks though. For them yo make a turnaround a generate, wait for it... VALUE. 

GME is on the right track.",0.0,0.799,0.201,0.6739
31,GME,"I am a newb, unemployed, live with my parents and have 8k in savings. I have a great education (and 20k in student debt), and am confident I can get a job within the next few months. Today I'm deciding to gamble 2k on GME.

I placed a limit buy order at $80/share, queued up for 9am Monday through Robinhood. Am I doing it right? Was also considering using webull instead because I can get in at 4am.

Not asking for \*advice\* on what trades to make just wondering  if I am doing it the right way.",0.0,0.92,0.08,0.8074
32,GME,"Options do help the short squeeze as well. That was what happened on Friday. 

- GME opened Friday at $43.
- Options expire on Friday. 
- A LOT of people have GME options. 
- GME stock price kept rising Friday turning call options ITM. 
- People who sold naked OTM calls on Friday (let’s say $50 strike) are now panicking to buy shares to cover for the OTM call options they sold, in case GME went above $50. 
- This pushed up the price even more, turning it into a self-fulfilling prophecy.
- This then affects the people who are selling even further OTM calls ($60 strike), since the price were creeping above $50 and hitting $60.
- Repeat the last 2 steps.",0.025,0.916,0.059,0.4767
33,GME,How is GME a ‘tech company?’,0.0,1.0,0.0,0.0
34,GME,Value stock is when the stock price is trading below the fundamentals. This is absolutely not the case with gamestop. GME has potentially changed to a growth stock where it's future potential is starting to get priced into the share price. But it's also going through a short squeeze.,0.0,0.859,0.141,0.7351
35,GME,"Stocks aren't priced according to the company's past or present, no matter how harshly you judge them to be. Prices are based the company's potential for the future.

Everything all the bears are saying about GameStop was true about Chewy. You could already order pet supplies online from Amazon, Walmart, Target, etc. How could Chewy possibly compete? And now Chewy dominates that market because they connect with customers in a way that a sterile big box retailer cannot.

GME's ecommerce is up more than 300% from last quarter. Their overall revenues were down 3%, but that is because they closed 11% of their stores. If you look at individual stores they actually outperformed comparable retailers.

All eyes are on Lord Cohen to turn GME into the gamer's version of Chewy. The short squeeze is to punish all the boomer hedge funds who went ""hurr durr b&m is dead hurr...""",0.077,0.889,0.034,-0.8945
36,CEO,I think there’s a fair chance the plan is for him to be CEO and his two Chewy associates to be CFO and COO. One of them quit his CFO position at another company in Dec 2020. I don’t think he would do that just to become a GME board member. Cohen and the other were already available. There’s also a fair chance he becomes chairman of the board as the current chair is leaving her position. I believe that is likely part of the overall deal agreed with Cohen.,0.0,0.881,0.119,0.8271
37,CFO,I think there’s a fair chance the plan is for him to be CEO and his two Chewy associates to be CFO and COO. One of them quit his CFO position at another company in Dec 2020. I don’t think he would do that just to become a GME board member. Cohen and the other were already available. There’s also a fair chance he becomes chairman of the board as the current chair is leaving her position. I believe that is likely part of the overall deal agreed with Cohen.,0.0,0.881,0.119,0.8271
38,COO,I think there’s a fair chance the plan is for him to be CEO and his two Chewy associates to be CFO and COO. One of them quit his CFO position at another company in Dec 2020. I don’t think he would do that just to become a GME board member. Cohen and the other were already available. There’s also a fair chance he becomes chairman of the board as the current chair is leaving her position. I believe that is likely part of the overall deal agreed with Cohen.,0.0,0.881,0.119,0.8271
39,GME,I think there’s a fair chance the plan is for him to be CEO and his two Chewy associates to be CFO and COO. One of them quit his CFO position at another company in Dec 2020. I don’t think he would do that just to become a GME board member. Cohen and the other were already available. There’s also a fair chance he becomes chairman of the board as the current chair is leaving her position. I believe that is likely part of the overall deal agreed with Cohen.,0.0,0.881,0.119,0.8271
40,TSLA,Definitely. First non TSLA shareholder meeting I'm going to be interested in.,0.0,0.649,0.351,0.6597
41,CEO,"I'm not sure you understand that the CEO works for the board. Popular media seems to make people think the CEO is the top boss, he's just the manager over operations ultimately.

Edit: a bunch of people giving me specific scenarios where this isn't true. It was a generalization meant for people who still think the CEO de facto owns a company. They are an employee too. You can also be a majority stakeholder janitor too.",0.055,0.856,0.089,0.4031
42,BB,I set my first stop buy on BB on Sunday night for like 9.75 I think? And it opened at 9.85...... I thought it went through and didn't realize till like noon what happened. But then it had done up to like $12. I'm never setting stops so tight again.,0.041,0.79,0.168,0.695
43,GME,"Absolutely, I have it rather loose. Enough to take profit but not high enough to be triggered on a weird day (though everyday of GME is weird)",0.134,0.796,0.071,-0.1901
44,DD,"Poster above you may have came off in the wrong way, but it makes more sense why he said it like that if you understand exactly why that price target is funny. 

It’s because “420” and “69” are meme numbers. There’s no legitimate DD that was done to come to that price target. Just jokes.",0.075,0.776,0.149,0.6956
45,IBKR,IBKR has no shares available to short.,0.234,0.532,0.234,0.0
46,BP,That halt yesterday had my BP up a little bit and I don’t even have skin in the game. Crazy,0.124,0.876,0.0,-0.34
47,CEO,I imagine that’s partially because the rise in separate classes of voting stock have resulted in many tech (and other) companies effectively having a founder unilaterally decide to have himself or herself serve as the CEO and chairman of the board.,0.0,0.929,0.071,0.4404
48,CEO,"Actually the COO is the manager of operations. But yeah, CEO manages the company overall (Ops, Finance, Development, Sales, etc.). Unless the CEO is also chairman his job depends on keeping the chairman and the board as a whole happy...and the board's job is to make sure executive management is making the shareholders money.",0.0,0.919,0.081,0.5423
49,COO,"Actually the COO is the manager of operations. But yeah, CEO manages the company overall (Ops, Finance, Development, Sales, etc.). Unless the CEO is also chairman his job depends on keeping the chairman and the board as a whole happy...and the board's job is to make sure executive management is making the shareholders money.",0.0,0.919,0.081,0.5423
50,CEO,This isn't universally true. It depends on the company. There are plenty of companies where a founder CEO still has a controlling stake in the company. There are also plenty of companies where the board just rubber stamps CEO decisions. The dynamic can vary a lot.,0.051,0.893,0.057,0.069
51,DM,"Dude posted his actual email on Reddit for OF nudes despite the OP asking them to DM instead, extremely special people like him are helping the case.",0.0,0.751,0.249,0.788
52,ARE," I legit have no stop losses. Every single trade I treat it as I'll lose everything so I just live stress free.

ALSO BB FLY ME TO THE MOON WE ARE JUST FEULING UP",0.3,0.56,0.14,-0.7063
53,BB," I legit have no stop losses. Every single trade I treat it as I'll lose everything so I just live stress free.

ALSO BB FLY ME TO THE MOON WE ARE JUST FEULING UP",0.3,0.56,0.14,-0.7063
54,FLY," I legit have no stop losses. Every single trade I treat it as I'll lose everything so I just live stress free.

ALSO BB FLY ME TO THE MOON WE ARE JUST FEULING UP",0.3,0.56,0.14,-0.7063
55,APHA,"Just bought in at $61/share.  I'm a newbie too.  Only bought $350.00 dollars worth.  Money I can afford to lose.

Question is what is a good price to get out?  

I've also got another $350.00 to spend.

Thinking about pursuing APHA or MU. 

Is it better to spend the rest on GME or put it in something else?",0.044,0.826,0.131,0.6553
56,GME,"Just bought in at $61/share.  I'm a newbie too.  Only bought $350.00 dollars worth.  Money I can afford to lose.

Question is what is a good price to get out?  

I've also got another $350.00 to spend.

Thinking about pursuing APHA or MU. 

Is it better to spend the rest on GME or put it in something else?",0.044,0.826,0.131,0.6553
57,MU,"Just bought in at $61/share.  I'm a newbie too.  Only bought $350.00 dollars worth.  Money I can afford to lose.

Question is what is a good price to get out?  

I've also got another $350.00 to spend.

Thinking about pursuing APHA or MU. 

Is it better to spend the rest on GME or put it in something else?",0.044,0.826,0.131,0.6553
58,GME,"I know what those mean, I’m in my 40’s, I just didn’t pick up on the joke. Sorry. 

I honestly wanted to know how he thought $GME was gonna 7x! Lol",0.039,0.714,0.247,0.7901
59,GME,"No, this isn’t really the valuation of this stock. What’s happening here with GME is a short squeeze.

So you need to understand what “shorting” means. Most people understand the stock market as “buy low, sell high.” Shorting is the opposite of that in a way. When you short a stock, you expect the stock price to decline. You are borrowing the stock, and you promise to pay back that stock in the future. If you’re correct, and the stock you shorted kept declining in price, then you made money because you paid back at lower price than when you borrowed. If you guessed wrong, and the stock you shorted ended up doing well, then you lost money, because you’re paying back at higher than the price you borrowed it at. The principle is “sell high, buy low” basically.

GME happens to be a declining business, and GME is the single most shorted stock currently. With recent news of Ryan Cohen joining GME, people are thinking he will turn the company around, and they started buying GME stock. This was the catalyst for the short squeeze.

A short squeeze happens when a stock that was shorted a lot (GME) goes up in price quickly (Ryan Cohen news) and short sellers are panicking to buy the stock because they need to pay it back. This pushes the price up even further, thus making other short sellers having to buy back the stock at an even higher price, which pushes the stock price higher and higher. Repeat the process until all short positions are covered. 

It’s a supply-demand case. There are strong demand to buy GME stock (short sellers have to buy it back to pay what they borrowed), but little supply (people who own GME stock refusing to sell or keep buying because they understand how to short squeeze). It’s a losing battle for the people who shorted the stock, because they are paying interest on what they borrowed, so they are bleeding money waiting for GME price to drop. As long as the GME stock owners won’t budge and keep holding simply by sitting on their shares, GME price will go up, because short sellers are obligated to buy back GME stock eventually, even at a ridiculous price. With high demand and low supply, the sellers are in control and they can set the price much much MUCH higher than the stock is worth. They are squeezing short sellers dry. 

If you want to buy GME now and take advantage of the short squeeze, do some more research first because you need to know when to exit. If you are interested in buying GME long term, wait until the short squeeze is over. Once all short positions are covered, people will sell and take profit, which will crash the stock price to its appropriate evaluation. 

Edit: Also tagged /u/Munchay87",0.078,0.871,0.051,-0.8225
60,GME,"Of course owning shares and not selling is the best way to short squeeze because short sellers are now slaves to stock owners. I was just saying a lot of people having call options added the pressure for naked option sellers to rush out to buy the stock to cover, and that also pushes the price upwards, punishing short sellers. 

Nobody can really tell what will happen this week or this Friday. It could happen again, or if the GME hype fizzled out, or if it was an overall red day due to bad news or whatever, then a lot of call options will expire worthless.",0.106,0.839,0.055,-0.7003
61,BP,Why did the BP go up?,0.0,1.0,0.0,0.0
62,GME,"Tl;dr

There are more active shorts/calls than available stock. As they get closer to expiring, large institutions are going to have to cover those moves by buying shares. If no one is willing to sell, the price gets squeezed up. Previous squeezes have sent stock up 1000% or more.

Most are speculating the squeeze hasnt even started yet and the stock is correcting upwards with all the cohen news. If that's true, it's not unreasonable to think GME hits $200, $300 or perhaps much higher.",0.024,0.888,0.088,0.6997
63,GME,"To be fair, someone posted the popularity of various GME limit sell positions & $420.69 was the among if not the most popular",0.095,0.705,0.2,0.4312
64,FCF,Not yet. Current focus is still on top-line growth and FCF. They have a very healthy multiple of 7.12 P/S vs. \~0.9 for GME,0.0,0.79,0.21,0.6801
65,GME,Not yet. Current focus is still on top-line growth and FCF. They have a very healthy multiple of 7.12 P/S vs. \~0.9 for GME,0.0,0.79,0.21,0.6801
