,ticker,comment,username,score,permalink,neg,neu,pos,compound
182,NOW," Imo, oil plays are get in NOW. All this talk of Biden and Green energy make oil plays so cheap. But Oil will rebound hopefully by eoy. Future predictions confirm this.",PM_Me_Accounts_rGay,1,/r/pennystocks/comments/m2pb5c/88_energy_confirms_spud_of_merlin_exploration/gqkv6i7/,0.0,0.754,0.246,0.7783
183,DD," So once it does the reverse split our holdings will change? My 150 will become 75? If so, would you say it's best to invest whatever I can afford at current prices? I like the company too, been looking into it for about 2 weeks. I don't have proper DD skills just yet but in my modest opinion it looks like a good investment",Time-Tap-987,1,/r/pennystocks/comments/m2ess5/interesting_tweet_by_nouveau_monde_graphite_what/gqljv0g/,0.0,0.821,0.179,0.8999
184,DD," Understood, I am slowly gaining knowledge about doing proper DD. Where can I view this info (split ratio) so I too can keep tabs on it. 
Learning what stats to watch and why has been the biggest hurdle so far. I can look into a company (profiles, PR, google maps, etc.) but I haven't gotten a grasp on the financials yet. With the help of kind souls like yourself I get little gems I get to bookmark for reference until I can just recall the info. 
Thanks for taking the time to explain!",Time-Tap-987,1,/r/pennystocks/comments/m2ess5/interesting_tweet_by_nouveau_monde_graphite_what/gqlobup/,0.0,0.817,0.183,0.9548
185,ATOS," Same: HITIF

Positions: SPT, RDSB, MPW, ATOS, KT, O, HITIF, BDSI, NOK, PMCB, TRVN, various ETFs and an Index fund.",TotallyTardigrade,15,/r/pennystocks/comments/m2g6i6/lets_play_a_critical_thinking_game_pick_one_and/gqiykel/,0.0,1.0,0.0,0.0
186,BDSI," Same: HITIF

Positions: SPT, RDSB, MPW, ATOS, KT, O, HITIF, BDSI, NOK, PMCB, TRVN, various ETFs and an Index fund.",TotallyTardigrade,15,/r/pennystocks/comments/m2g6i6/lets_play_a_critical_thinking_game_pick_one_and/gqiykel/,0.0,1.0,0.0,0.0
187,KT," Same: HITIF

Positions: SPT, RDSB, MPW, ATOS, KT, O, HITIF, BDSI, NOK, PMCB, TRVN, various ETFs and an Index fund.",TotallyTardigrade,15,/r/pennystocks/comments/m2g6i6/lets_play_a_critical_thinking_game_pick_one_and/gqiykel/,0.0,1.0,0.0,0.0
188,MPW," Same: HITIF

Positions: SPT, RDSB, MPW, ATOS, KT, O, HITIF, BDSI, NOK, PMCB, TRVN, various ETFs and an Index fund.",TotallyTardigrade,15,/r/pennystocks/comments/m2g6i6/lets_play_a_critical_thinking_game_pick_one_and/gqiykel/,0.0,1.0,0.0,0.0
189,NOK," Same: HITIF

Positions: SPT, RDSB, MPW, ATOS, KT, O, HITIF, BDSI, NOK, PMCB, TRVN, various ETFs and an Index fund.",TotallyTardigrade,15,/r/pennystocks/comments/m2g6i6/lets_play_a_critical_thinking_game_pick_one_and/gqiykel/,0.0,1.0,0.0,0.0
190,SPT," Same: HITIF

Positions: SPT, RDSB, MPW, ATOS, KT, O, HITIF, BDSI, NOK, PMCB, TRVN, various ETFs and an Index fund.",TotallyTardigrade,15,/r/pennystocks/comments/m2g6i6/lets_play_a_critical_thinking_game_pick_one_and/gqiykel/,0.0,1.0,0.0,0.0
191,TRVN," Same: HITIF

Positions: SPT, RDSB, MPW, ATOS, KT, O, HITIF, BDSI, NOK, PMCB, TRVN, various ETFs and an Index fund.",TotallyTardigrade,15,/r/pennystocks/comments/m2g6i6/lets_play_a_critical_thinking_game_pick_one_and/gqiykel/,0.0,1.0,0.0,0.0
192,CTXR," CTXR. I get the ""concerns"" or potential doubts, but the pros make them look minuscule.",Service-Fickle,20,/r/pennystocks/comments/m2g6i6/lets_play_a_critical_thinking_game_pick_one_and/gqj0clk/,0.11,0.89,0.0,-0.1531
193,OPTT," I'm holding some OZSC, although there are some concerning comments about it on iHub.

5 years? Probably OPTT. I think renewables, particularly hydrokinetics, are severely underdeveloped at the moment.

Don't listen to me though, I ate nothing but asparagus, brussel sprouts and avocado today, and now I have the most potent gas.",MushyWasHere,6,/r/pennystocks/comments/m2g6i6/lets_play_a_critical_thinking_game_pick_one_and/gqj6lem/,0.043,0.957,0.0,-0.2805
194,AGTC, AGTC or ZOM,Historical-Solid-504,5,/r/pennystocks/comments/m2g6i6/lets_play_a_critical_thinking_game_pick_one_and/gqj5apj/,0.0,1.0,0.0,0.0
195,ZOM, AGTC or ZOM,Historical-Solid-504,5,/r/pennystocks/comments/m2g6i6/lets_play_a_critical_thinking_game_pick_one_and/gqj5apj/,0.0,1.0,0.0,0.0
196,PLTR," PLTR non penny choice

ZOM penny choice",Kierooonn,9,/r/pennystocks/comments/m2g6i6/lets_play_a_critical_thinking_game_pick_one_and/gqjj8r6/,0.0,1.0,0.0,0.0
197,ZOM," PLTR non penny choice

ZOM penny choice",Kierooonn,9,/r/pennystocks/comments/m2g6i6/lets_play_a_critical_thinking_game_pick_one_and/gqjj8r6/,0.0,1.0,0.0,0.0
198,SENS, SENS 100%,Azcards115,4,/r/pennystocks/comments/m2g6i6/lets_play_a_critical_thinking_game_pick_one_and/gqjirhd/,0.0,1.0,0.0,0.0
199,CTXR," Oooh good question..... I'm thinking SXOOF, CTXR, and/or TSNPD/HMBL",NegotiableVeracity9,2,/r/pennystocks/comments/m2g6i6/lets_play_a_critical_thinking_game_pick_one_and/gqj7g0d/,0.0,0.734,0.266,0.4404
200,TDOC," Not a penny stock, but TDOC.",acebot10,2,/r/pennystocks/comments/m2g6i6/lets_play_a_critical_thinking_game_pick_one_and/gqj7m95/,0.0,1.0,0.0,0.0
201,BNGO," I am thorn in between BNGO and ALPP. if I have to choose one of them, I would have to say BNGO",Kvbrc,1,/r/pennystocks/comments/m2g6i6/lets_play_a_critical_thinking_game_pick_one_and/gqj2u1y/,0.0,1.0,0.0,0.0
202,SCR, SCR,Whyyyyoy,1,/r/pennystocks/comments/m2g6i6/lets_play_a_critical_thinking_game_pick_one_and/gqjfsso/,0.0,1.0,0.0,0.0
203,CLSK, CLSK,MachineBuns,1,/r/pennystocks/comments/m2g6i6/lets_play_a_critical_thinking_game_pick_one_and/gqjmf23/,0.0,1.0,0.0,0.0
204,GOL," There's no penny stock I'd choose to hold exclusively. If it's any stock, probably BRK/B. Any ETF, probably VBR. The closest thing to a penny stock, probably GOL.",bfricka,1,/r/pennystocks/comments/m2g6i6/lets_play_a_critical_thinking_game_pick_one_and/gqjorwk/,0.078,0.922,0.0,-0.296
205,MTNB," MTNB .....Their nano technology process for meds is going to be huge and while the results from one of their latest studies showed no ""significant"" difference overall it was significantly better than the competition in the most important categories.
I expect great news next quarter but what do I know I'm not a financial advisor

I have MNTB CTXR NOK RIOT but heavy on MTNB",JoeyOceano-69,1,/r/pennystocks/comments/m2g6i6/lets_play_a_critical_thinking_game_pick_one_and/gqjp0d9/,0.108,0.782,0.109,-0.441
206,NOK," MTNB .....Their nano technology process for meds is going to be huge and while the results from one of their latest studies showed no ""significant"" difference overall it was significantly better than the competition in the most important categories.
I expect great news next quarter but what do I know I'm not a financial advisor

I have MNTB CTXR NOK RIOT but heavy on MTNB",JoeyOceano-69,1,/r/pennystocks/comments/m2g6i6/lets_play_a_critical_thinking_game_pick_one_and/gqjp0d9/,0.108,0.782,0.109,-0.441
207,CTXR, CTXR,sous_vide_slippers,1,/r/pennystocks/comments/m2g6i6/lets_play_a_critical_thinking_game_pick_one_and/gqjzwh5/,0.0,1.0,0.0,0.0
208,SFT, SFT huge market opportunity currently $8.58 so may not classify as a penny stock!,Tribute362,1,/r/pennystocks/comments/m2g6i6/lets_play_a_critical_thinking_game_pick_one_and/gqkg7ux/,0.0,0.671,0.329,0.6588
209,WIMI," WIMI, I think is the next big stock...it has the potential, it will hit $100 soon ....",ism786,1,/r/pennystocks/comments/m2g6i6/lets_play_a_critical_thinking_game_pick_one_and/gqla36i/,0.0,1.0,0.0,0.0
210,FLT," FLT - TSX-V 

Drone delivery is going to be huge in my humble opinion. Company partnered with Air Canada, who is looking to expand its income diversity after what happened 2020-2021. So they have big backers. 

Still a small stock (less then 2 cad) so monke brain over here can by a decent amount of shares for bargain bin prices. 

Share seems to be below a good evaluation, considering that they are still a relatively new company in a very new industry. 

The industry prospects seem to be far more greater than just delivery (ie Amazon and Fedex) but could expand into farming, the oil industry, security sector, recreation, and maybe even flying cars. 

Company has some decent financials (not profitable) but last time I checked they have a few million in cash to keep them afloat. Minimal debt as well (most of it is invested in land or machinery, so dissolvable assets) and the operational costs are minimal.

They just got their first job. And I think they are sending supplies to a remote indigenous community somewhere here in Ontario. 

Stock has grown from 0.88 cad to 1.87 cad over the past few months. 

*not investment advise and the numbers and facts could be off, I’m just going off memory",T0rr1nw0rX,1,/r/pennystocks/comments/m2g6i6/lets_play_a_critical_thinking_game_pick_one_and/gqla9xz/,0.015,0.875,0.11,0.9208
211,NPK," Verde Agritech, NPK on TSX. 
Already lots written on Reddit as well as other investment boards, Stockhouse actually has a decent board on it, regarding the long game potential which is what I'm holding for. Diamond hands, as are the vast majority of the other investors.

Short-term looking at a nice breakout pattern with very little resistance to $1.75-2.00",Monkeyg8tor,1,/r/pennystocks/comments/m2g6i6/lets_play_a_critical_thinking_game_pick_one_and/gqlzkal/,0.0,0.881,0.119,0.743
212,TMDI, Without a doubt TMDI. Might be a sleeper for now but it won't stay that way.,G-Gnomes,1,/r/pennystocks/comments/m2g6i6/lets_play_a_critical_thinking_game_pick_one_and/gqm7bii/,0.0,0.893,0.107,0.1419
213,TSLA," Can it be an ETF? VTI

If it has to be an Equity- BRK.B

But I don’t expect any one stock to lead to financial security in 5 years. Even if I yolo’d. But I have seen someone YOLO into TSLA and that was beautiful. And more recently IQST.",Lisa-Rene,1,/r/pennystocks/comments/m2g6i6/lets_play_a_critical_thinking_game_pick_one_and/gqm8ee3/,0.0,0.821,0.179,0.8455
214,NPK," Verde Agritech, NPK on TSX. Take some monkeys over and have a look.",Monkeyg8tor,1,/r/pennystocks/comments/m2g6i6/lets_play_a_critical_thinking_game_pick_one_and/gqlzx12/,0.0,1.0,0.0,0.0
215,OPTT, have u peeped CWGYF? they're doing similar things to OPTT but they are based in Australia and I can't figure out which one has more potential,yunggoatlol,3,/r/pennystocks/comments/m2g6i6/lets_play_a_critical_thinking_game_pick_one_and/gqjmap0/,0.0,1.0,0.0,0.0
216,BNGO," Hi thorn in between BNGO and ALPP, I'm Dad! :)",dadbot_3000,12,/r/pennystocks/comments/m2g6i6/lets_play_a_critical_thinking_game_pick_one_and/gqj2utm/,0.0,0.732,0.268,0.5093
217,AT, Trial results to be published early April IIRC. CEO had a video conference the other day and he said they will be publishing positive news soon. I'm bullish so keeping until early April AT LEAST,DerpJungler,2,/r/pennystocks/comments/m2g6i6/lets_play_a_critical_thinking_game_pick_one_and/gqk8iqs/,0.0,0.902,0.098,0.5574
218,UK," I was thinking they would use the money to expand into Europe or the UK. Is that a bad guess? Also do you know if  it is necessary everywhere (US, Europe, Canada,etc) for dispensaries to be non-profit?",sofakingredarthead,1,/r/pennystocks/comments/m2g6i6/lets_play_a_critical_thinking_game_pick_one_and/gqj12b3/,0.099,0.843,0.059,-0.3736
219,GM," When GM bankrupted, ""restructured"" or wtfe they called it, my balance went to zero, then a week or 2 later the ticker just disappeared off the ledger",Trey-wmLA,1,/r/pennystocks/comments/m2g6i6/lets_play_a_critical_thinking_game_pick_one_and/gqm5e6g/,0.073,0.927,0.0,-0.2263
220,TDOC," I agree. There's no doubt that telemedicine will explode in even a short horizon. My only concern is that large insurance companies may want to invest in their own telehealth solution instead of contracting with TDOC. But I think their already dominant position creates an ""if you can't beat 'em, join 'em"" type attitude. 

Plus with Better Help and Livongo in their portfolio, it shows that they are dreaming big.",acebot10,2,/r/pennystocks/comments/m2g6i6/lets_play_a_critical_thinking_game_pick_one_and/gql8nr9/,0.084,0.74,0.176,0.7361
221,CTXR, Thanks for the info. I got a big piece of my portfolio on CTXR and I'm holding until we learn more about their trial results.,DerpJungler,3,/r/pennystocks/comments/m2g6i6/lets_play_a_critical_thinking_game_pick_one_and/gqkd4ja/,0.0,0.884,0.116,0.4404
222,CTXR," Yeah, outside of my index funds, CTXR is like 80% of my portfolio right now.  Fingers crossed.",PandaCod3r,3,/r/pennystocks/comments/m2g6i6/lets_play_a_critical_thinking_game_pick_one_and/gqkfpi5/,0.0,0.761,0.239,0.5719
223,DD," Very good DD, is it to late to join the party or is there still time to hop in for the take off?",Saud25524,8,/r/pennystocks/comments/m2dkuc/ilus_fire_safety_and_ev_technology_filings/gqiijs2/,0.0,0.712,0.288,0.796
224,DD," Hey everyone, thanks for the DD, been in the market for 10 years now and still find it hard to pull the trigger on a stock. This DD from OP is on point. I really appreciate the hard work and time you put in to share your opinion of this. I’m happy to ride the lightning along side you all. Cheers and good luck friends.",DeepDarkRev,2,/r/pennystocks/comments/m2dkuc/ilus_fire_safety_and_ev_technology_filings/gqktxqb/,0.035,0.665,0.3,0.9686
225,EDIT," ""Pink Current soon"". Been waiting for LTNC SANP and other scam companies to make good on a similar promise
EDIT not saying ILUS is a scam, but ""pink current soon"" is commonly used to feign credibility for P&D",evanarc,1,/r/pennystocks/comments/m2dkuc/ilus_fire_safety_and_ev_technology_filings/gqlx8f6/,0.117,0.794,0.089,-0.2732
226,DD," I appreciate it man, very good DD. Hopefully this gets some steam behind it.",DeepDarkRev,1,/r/pennystocks/comments/m2dkuc/ilus_fire_safety_and_ev_technology_filings/gql2c5i/,0.0,0.53,0.47,0.8341
227,IMO," Yeah I went through the company’s timeline on Twitter. As much as I personally hate Twitter, it’s still a good insight of flow of information. IMO. As long as they stay true to their agenda, I’m all for it.",DeepDarkRev,1,/r/pennystocks/comments/m2dkuc/ilus_fire_safety_and_ev_technology_filings/gql2qk5/,0.085,0.734,0.181,0.4939
228,DD, Lol it's not the price. I just don't want to buy the wrong thing in the morning. Buy ILUS under its current name how its listed on ETrade is all I'm trying to get confirmed. Thanks for your DD also. Impressive work🍺🍻🍺,The-Starving-Pig-BBQ,1,/r/pennystocks/comments/m2dkuc/ilus_fire_safety_and_ev_technology_filings/gqitjfr/,0.088,0.73,0.182,0.6886
229,ST," Lol because of SEC shenanigans and a ST market shake down we’re at our current level. It belongs in the 15-16s. Please, I’ve been trading for 2 years now with a 7 figure account and have been in since 1/4 a penny. Don’t talk bs",throwziploaway,1,/r/pennystocks/comments/m2dkuc/ilus_fire_safety_and_ev_technology_filings/gqllrc3/,0.039,0.845,0.116,0.5267
230,PT," Companies across different sectors can't be valued the same. Manufacturing companies aren't valued the same as Fintech companies.

I said the most we can expect anytime soon is .30, however I said if their revenue is higher than we expect then we can have some fun.

I'm not sure why you're thinking I'm against ILUS. I've been in them since the day the Nick published the original news letter and I'm holding out for dollars too. 

I'm just not going to give a wildly ambitious PT to people as there's enough idiots pumping this as it is.",Allstar9393,2,/r/pennystocks/comments/m2dkuc/ilus_fire_safety_and_ev_technology_filings/gqkqcks/,0.065,0.85,0.084,0.4453
231,DD," thanks to the link to the DD, bought 63 shares excited to see what happens. Think this will be a fun ride.",qistwo,2,/r/pennystocks/comments/m2e6dq/mdmp_possible_300_percent/gqivg4i/,0.0,0.612,0.388,0.8689
232,DD," >EEENF

Interesting.  Has anyone posted DD on them yet?",Truxxis,2,/r/pennystocks/comments/m2e6dq/mdmp_possible_300_percent/gqknxvb/,0.0,0.748,0.252,0.4019
233,DD," Nice DD, but I think your conclusion is flawed.  Seeing their net drop 55% from 18-19 and one can presume 20 wont be pretty.  Additionally those reverse split/resplit movements never look good to investors and changing their ticker in such a short time doesnt feel as much like a rebirth as a cover-up. If you want to hold for 5 years, you might see your $4-5 exit",HeelBangs,2,/r/pennystocks/comments/m2t21z/prcx_why_prcx_is_atrociously_undervalued_update/gql614p/,0.128,0.78,0.092,-0.5575
234,PT," Bear case - 

It’s China. I’ve lived there, have been visiting there since I was like 12, and even studied Chinese for several years in high school and uni - so I’m coming from a place of personal experience as a non-Chinese person with some real Chinese experience. 

The government changes pace overnight with decisions made at the speed of light. It’s not like the west, where decisions are made after weeks or months of discussions. 

If the party decides coal is out, coal is out. You’re done. 

If the party decides your mine belongs to them, they’ll determine a valuation and hand you a check and take the keys. That’s it. No conversation. 

If the party decides your mine is no longer considered clean, you can’t mine anymore. You’re done. 

If the party decides the CEO is an opponent he can be arrested and his assets seized. PRCX is done. 

I think there’s a lot of value in investing in China, but I would only do it with someone who lives there and someone who is friendly with the party. And even then, I would he very careful. 

Position - 9k shares on PRCX and bullish. My PT is $1.5, the price the Wandi mine was bought for ($60M in shares valued at $1.5 ea).",everyday_malakia,7,/r/pennystocks/comments/m2t21z/prcx_why_prcx_is_atrociously_undervalued_update/gqlj8wy/,0.023,0.812,0.165,0.9804
235,PT," IIRC that was the former company, whose ticker PRCXtreme took over. 

A good PT is what the Wandi mine owner sold the mine for - $60m in shares, valuing the shares at $1.50 ea. That’s realistic. 

But fuck yeah I want it to hit $65.",everyday_malakia,5,/r/pennystocks/comments/m2t21z/prcx_why_prcx_is_atrociously_undervalued_update/gqligxq/,0.068,0.677,0.255,0.7717
236,ASRT, ASRT earnings today.,Teach-,36,/r/pennystocks/comments/m2l134/daily_plays_march_11_2021/gqk9fgg/,0.0,1.0,0.0,0.0
237,ALL," Look CTXR and HITIF need to get their shit together and take off for as much as people post about these motherfuckers. 

I’m invested, I’m fueling the rocket, now get me too the moon you fuckass. 

ALL ABOARD!!!!!",OhhWowzers,98,/r/pennystocks/comments/m2l134/daily_plays_march_11_2021/gqjrplw/,0.114,0.886,0.0,-0.6973
238,CTXR," Look CTXR and HITIF need to get their shit together and take off for as much as people post about these motherfuckers. 

I’m invested, I’m fueling the rocket, now get me too the moon you fuckass. 

ALL ABOARD!!!!!",OhhWowzers,98,/r/pennystocks/comments/m2l134/daily_plays_march_11_2021/gqjrplw/,0.114,0.886,0.0,-0.6973
239,CCIV," I’m into 
LLKKF , KIWA , SYME , GST , CCIV , DNN  , WNDW , VVCIF, ZSAN , MXC , KNB 
Pretty much a mix bag lol 
Do I know what I’m doing ......NO
Do I enjoy the chase ..... YES",LuluBocca,10,/r/pennystocks/comments/m2l134/daily_plays_march_11_2021/gqjt6qr/,0.0,0.673,0.327,0.9124
240,DNN," I’m into 
LLKKF , KIWA , SYME , GST , CCIV , DNN  , WNDW , VVCIF, ZSAN , MXC , KNB 
Pretty much a mix bag lol 
Do I know what I’m doing ......NO
Do I enjoy the chase ..... YES",LuluBocca,10,/r/pennystocks/comments/m2l134/daily_plays_march_11_2021/gqjt6qr/,0.0,0.673,0.327,0.9124
241,MXC," I’m into 
LLKKF , KIWA , SYME , GST , CCIV , DNN  , WNDW , VVCIF, ZSAN , MXC , KNB 
Pretty much a mix bag lol 
Do I know what I’m doing ......NO
Do I enjoy the chase ..... YES",LuluBocca,10,/r/pennystocks/comments/m2l134/daily_plays_march_11_2021/gqjt6qr/,0.0,0.673,0.327,0.9124
242,ZSAN," I’m into 
LLKKF , KIWA , SYME , GST , CCIV , DNN  , WNDW , VVCIF, ZSAN , MXC , KNB 
Pretty much a mix bag lol 
Do I know what I’m doing ......NO
Do I enjoy the chase ..... YES",LuluBocca,10,/r/pennystocks/comments/m2l134/daily_plays_march_11_2021/gqjt6qr/,0.0,0.673,0.327,0.9124
243,CTXR," Need some green... ZOM, CTXR, HITIF, TAKOF, ABRKF. Still holding TLSS and CBBT. The usual.",JackKSY,8,/r/pennystocks/comments/m2l134/daily_plays_march_11_2021/gqju3rz/,0.0,1.0,0.0,0.0
244,ZOM," Need some green... ZOM, CTXR, HITIF, TAKOF, ABRKF. Still holding TLSS and CBBT. The usual.",JackKSY,8,/r/pennystocks/comments/m2l134/daily_plays_march_11_2021/gqju3rz/,0.0,1.0,0.0,0.0
245,CSTR," Expecting another pullback on CSTR and will leap all over that when it happens. (Personal entry point $0.35-$0.40). 

High Tide may have some positive upswing after Raj Grover did an AMA on reddit. Plus the industry could potentially have a greener day than usual after Mexico passed the 2nd last legalization bill.",Mman222,17,/r/pennystocks/comments/m2l134/daily_plays_march_11_2021/gqjs832/,0.0,0.933,0.067,0.5574
246,CTXR," This year after FDA approval CTXR will hit $15 a share. That is when I will sell and take out around $100,000. I will then be looking for my next play to flip that into $200,000 around this time next year.",NOKIASTONK,9,/r/pennystocks/comments/m2l134/daily_plays_march_11_2021/gqlg3o9/,0.0,0.82,0.18,0.7717
247,ASRT, ASRT literally been barcoding the past week if this doesn't break out soon my wife's going to leave me,Portraitofadam,8,/r/pennystocks/comments/m2l134/daily_plays_march_11_2021/gqlq0wi/,0.062,0.938,0.0,-0.0516
248,ASRT," Nice to see HITIF moving up today.  Holding it along with ASRT, CLSN, and CTXR.",Terrible-Respond2412,8,/r/pennystocks/comments/m2l134/daily_plays_march_11_2021/gqlhll8/,0.0,0.833,0.167,0.4215
249,CLSN," Nice to see HITIF moving up today.  Holding it along with ASRT, CLSN, and CTXR.",Terrible-Respond2412,8,/r/pennystocks/comments/m2l134/daily_plays_march_11_2021/gqlhll8/,0.0,0.833,0.167,0.4215
250,CTXR," Nice to see HITIF moving up today.  Holding it along with ASRT, CLSN, and CTXR.",Terrible-Respond2412,8,/r/pennystocks/comments/m2l134/daily_plays_march_11_2021/gqlhll8/,0.0,0.833,0.167,0.4215
251,DNN," DNN is a long term stock. But can I get a little bit of positive movement,..",yunggyett,14,/r/pennystocks/comments/m2l134/daily_plays_march_11_2021/gqjx7h5/,0.0,0.782,0.218,0.5165
252,SENS, SENS has a nice run right now.,Houghton1983,7,/r/pennystocks/comments/m2l134/daily_plays_march_11_2021/gqlu5or/,0.0,0.641,0.359,0.4215
253,ATOS," ATOS baby to the moon, hold people",AllSeeingEye7,5,/r/pennystocks/comments/m2l134/daily_plays_march_11_2021/gql02nh/,0.0,1.0,0.0,0.0
254,ASRT, ASRT should see a good run today with earnings being released after market close.,CantThinkk,16,/r/pennystocks/comments/m2l134/daily_plays_march_11_2021/gqjwwg6/,0.0,0.805,0.195,0.4404
255,OXSQ," Currently Have CBDL, BIEL, SIML, OXSQ,  ADMQ, ETFM, GTEH in my penny stock account, and penny stocks ALLM, HNMY and RXMD in my long term account.  Hoping for green today.",Kevdogg329,5,/r/pennystocks/comments/m2l134/daily_plays_march_11_2021/gqkdpae/,0.0,0.912,0.088,0.4215
256,ASRT, ASRT is a enigma,AwkwardPhilosopher0,4,/r/pennystocks/comments/m2l134/daily_plays_march_11_2021/gqky5nw/,0.0,1.0,0.0,0.0
257,ATOS, Just added ATOS to my portfolio,c0nsume0,4,/r/pennystocks/comments/m2l134/daily_plays_march_11_2021/gqlj7w2/,0.0,1.0,0.0,0.0
258,ARTL," NVIV .. ONTX .. OGEN .. ARTL ..
Threw 1k at each, feeling confident for by next week EOW",thatGuySteve007,3,/r/pennystocks/comments/m2l134/daily_plays_march_11_2021/gqjstoa/,0.0,0.783,0.217,0.5719
259,NVIV," NVIV .. ONTX .. OGEN .. ARTL ..
Threw 1k at each, feeling confident for by next week EOW",thatGuySteve007,3,/r/pennystocks/comments/m2l134/daily_plays_march_11_2021/gqjstoa/,0.0,0.783,0.217,0.5719
260,OGEN," NVIV .. ONTX .. OGEN .. ARTL ..
Threw 1k at each, feeling confident for by next week EOW",thatGuySteve007,3,/r/pennystocks/comments/m2l134/daily_plays_march_11_2021/gqjstoa/,0.0,0.783,0.217,0.5719
261,ONTX," NVIV .. ONTX .. OGEN .. ARTL ..
Threw 1k at each, feeling confident for by next week EOW",thatGuySteve007,3,/r/pennystocks/comments/m2l134/daily_plays_march_11_2021/gqjstoa/,0.0,0.783,0.217,0.5719
262,AESE," HITIF, SGMD, DNN, DKMR, and ASTI! AESE and TSNPD (HUMBL) are others ones I'm holding as well but they're at 2-3$ range. Going long with all of these.",Freefarm101,3,/r/pennystocks/comments/m2l134/daily_plays_march_11_2021/gqjwu4q/,0.0,0.936,0.064,0.2124
263,DNN," HITIF, SGMD, DNN, DKMR, and ASTI! AESE and TSNPD (HUMBL) are others ones I'm holding as well but they're at 2-3$ range. Going long with all of these.",Freefarm101,3,/r/pennystocks/comments/m2l134/daily_plays_march_11_2021/gqjwu4q/,0.0,0.936,0.064,0.2124
264,SENS," I’m seeing a pattern here. 

AITX. Red... always red 

SENS. Tiny red then green.",Houghton1983,3,/r/pennystocks/comments/m2l134/daily_plays_march_11_2021/gqkzfa5/,0.0,1.0,0.0,0.0
265,ASRT, I have a bad feeling about ASRT,projecks15,3,/r/pennystocks/comments/m2l134/daily_plays_march_11_2021/gql4yh8/,0.438,0.375,0.188,-0.4588
266,TXMD, Lol I sold out of TXMD yesterday. You're welcome everyone.,RickSanchezAASponsor,3,/r/pennystocks/comments/m2l134/daily_plays_march_11_2021/gqlb8vn/,0.0,0.547,0.453,0.7003
267,ALL," ALL HITIF owners and people thinking about buying most see this video

[https://youtu.be/Bmhl0nWSzDE](https://youtu.be/Bmhl0nWSzDE)

starting at 11:50ish ... this stock will be making millionaires out of anyone that buys in big!",18AMG-GT,3,/r/pennystocks/comments/m2l134/daily_plays_march_11_2021/gqlfbwm/,0.0,1.0,0.0,0.0
268,SENS, SENS in the green,Houghton1983,3,/r/pennystocks/comments/m2l134/daily_plays_march_11_2021/gqlzzo8/,0.0,1.0,0.0,0.0
