,ticker,comment,neg,neu,pos,compound
0,PLTR,"I recently bought a full-year Prime membership for the first time.  
  
I paid for it with the money I made from selling PLTR calls haha",0.0,0.87,0.13,0.4588
1,AMZN,"Let's all sell AMZN shares because Biden is going to regulate big tech! 

The fomo to come back into Amazon is going to be awesome.",0.0,0.726,0.274,0.807
2,OVID,"So essentially, the Amazon Air fleet which Amazon is slowly acquiring and building (and run through Atlas Air and ATSG) is being paid for by monthly subscriptions! Good on them. A small % of the 25Bn will buy lots of retired 767s now stored due to COVID downturn. Amazon Air will be a force in logistics.",0.0,0.844,0.156,0.7954
3,AMZN,"AMZN is also a good value right now. Its PE ratio is lower than its running average, and its' about to report a 100B+ quarter. 

It's crazy how slept-on this stock is, given the gargantuan amount of actual revenue coming in, not to mention the market share growth + loss of small competitors",0.115,0.717,0.168,0.4939
4,PE,"AMZN is also a good value right now. Its PE ratio is lower than its running average, and its' about to report a 100B+ quarter. 

It's crazy how slept-on this stock is, given the gargantuan amount of actual revenue coming in, not to mention the market share growth + loss of small competitors",0.115,0.717,0.168,0.4939
5,USA,Damn a whole 3rd of the USA,0.351,0.649,0.0,-0.4019
6,TV,If only they would improve the video player now for their TV apps. It feels so clunky to navigate compared to Netflix.,0.0,0.879,0.121,0.4404
7,AAPL,"AAPL and msft should be pretty safe, they will focus on Amzn goog and fb. At least you will see AOC and a few others constantly bashing these 3 companies when they have a chance. Andrew yang will likely keep using taxing Amazon to afford his nyc UBI angenda constantly.",0.0,0.814,0.186,0.8316
8,AMZN,"Normally I really would agree with you, but after the year that it's been and the christmas numbers, AMZN has just taken one hell of a market share bite and I think Q4 is really going to show this, as well as the beginning of the india story.",0.117,0.749,0.134,-0.2642
9,UI,Agree the UI could definitely use a tune up - it works well on the FireStick for the most part but wish that they broke apart films easier for sorting purposes seems like a lot of great films can go unnoticed,0.067,0.542,0.392,0.9516
10,UK,"I have Prime in the UK. And it's usually 1-day delivery and sometimes even same-day for office products. When i had it in the US it was always 2, maybe 3 days but I guess it depends on where you live.",0.0,1.0,0.0,0.0
11,AAPL,which put will be worst if being executed ? selling an AMZN put or selling an AAPL put ?,0.218,0.782,0.0,-0.6662
12,AMZN,which put will be worst if being executed ? selling an AMZN put or selling an AAPL put ?,0.218,0.782,0.0,-0.6662
13,UK,Yeah at least in the UK you can add like 6 people or something,0.0,0.701,0.299,0.5719
14,AMZN,I strongly doubt Bezos gives a shit about that.  I don’t think AMZN will ever split.,0.335,0.549,0.115,-0.6124
15,TV,"I was personally really disappointed they had a hell of a cast for it too just felt like a big blur - I hope that they can do it justice and give it a 3 - 5 season show. I wouldn't mind seeing Amazon also try playing around with something like ""The Adomeda Strain"" or ""World War Z"" as well in a TV adaptation",0.206,0.579,0.215,-0.1055
16,FOR,THE OTHER SITES CHARGE FOR SHIPPING,0.0,1.0,0.0,0.0
17,PING,THE OTHER SITES CHARGE FOR SHIPPING,0.0,1.0,0.0,0.0
18,TSLA,"Overestimating the intelligence of a large (and significant) swath of the investing population - lots of people (esp new flooding to the markers) think Amazon ""is more expensive"" than TSLA just because the unit stock price is higher",0.0,0.876,0.124,0.5859
19,DASH,"Seriously, one of my friends has a couple HUNDRED THOUSAND invested plus some more on margin, and yet was comparing the likes of UBER/DASH, NIO/LI/XPEV based on their share prices alone. And I had to explain to them twice that Apple has a higher market cap than Amazon despite the vast difference in price. I couldn't believe it.",0.06,0.78,0.159,0.7269
20,LI,"Seriously, one of my friends has a couple HUNDRED THOUSAND invested plus some more on margin, and yet was comparing the likes of UBER/DASH, NIO/LI/XPEV based on their share prices alone. And I had to explain to them twice that Apple has a higher market cap than Amazon despite the vast difference in price. I couldn't believe it.",0.06,0.78,0.159,0.7269
21,NIO,"Seriously, one of my friends has a couple HUNDRED THOUSAND invested plus some more on margin, and yet was comparing the likes of UBER/DASH, NIO/LI/XPEV based on their share prices alone. And I had to explain to them twice that Apple has a higher market cap than Amazon despite the vast difference in price. I couldn't believe it.",0.06,0.78,0.159,0.7269
22,UBER,"Seriously, one of my friends has a couple HUNDRED THOUSAND invested plus some more on margin, and yet was comparing the likes of UBER/DASH, NIO/LI/XPEV based on their share prices alone. And I had to explain to them twice that Apple has a higher market cap than Amazon despite the vast difference in price. I couldn't believe it.",0.06,0.78,0.159,0.7269
23,XPEV,"Seriously, one of my friends has a couple HUNDRED THOUSAND invested plus some more on margin, and yet was comparing the likes of UBER/DASH, NIO/LI/XPEV based on their share prices alone. And I had to explain to them twice that Apple has a higher market cap than Amazon despite the vast difference in price. I couldn't believe it.",0.06,0.78,0.159,0.7269
24,GAIN,"I bought a present for my girlfriend that I live with and archived it. The very next day I logged on it showed ""BUY THIS AGAIN."" 

Tried to get rid of it so I bought another item. Didn't work. The present stayed up there for like 3 weeks...",0.0,0.943,0.057,0.3612
25,WWR,"As Papa Musk has pointed out, batteries are the bottleneck on renewable energy right now. Maybe that's why lithium-related stonks keep popping. $WWR up over 40% just in one day today (Jan 19, 2021). Why?",0.0,0.942,0.058,0.2732
26,IEA,IEA (Infrastructure and Energy Alternatives) safe play here. Very undervalued.,0.0,0.486,0.514,0.7506
27,BEP,GEVO NEE PLUG ICLN ENPH BEP and so many others are going to benefit from this.,0.0,0.833,0.167,0.4588
28,ENPH,GEVO NEE PLUG ICLN ENPH BEP and so many others are going to benefit from this.,0.0,0.833,0.167,0.4588
29,GEVO,GEVO NEE PLUG ICLN ENPH BEP and so many others are going to benefit from this.,0.0,0.833,0.167,0.4588
30,ICLN,GEVO NEE PLUG ICLN ENPH BEP and so many others are going to benefit from this.,0.0,0.833,0.167,0.4588
31,NEE,GEVO NEE PLUG ICLN ENPH BEP and so many others are going to benefit from this.,0.0,0.833,0.167,0.4588
32,PLUG,GEVO NEE PLUG ICLN ENPH BEP and so many others are going to benefit from this.,0.0,0.833,0.167,0.4588
33,ICLN,Just what I’ve been waiting on #ICLN,0.0,1.0,0.0,0.0
34,ICLN,ICLN pleas fly again,0.0,1.0,0.0,0.0
35,GO,LETS GO PLUG,0.0,1.0,0.0,0.0
36,PLUG,LETS GO PLUG,0.0,1.0,0.0,0.0
37,ICLN,"In the midst of PLUG and ICLN creeps $TPC, revenue highest in a decade, contracted to  build Cali high speed railway, one of biggest winners from a infrastructure deal 
 

>	Tutor said that he believes the company doesn't have much competition for large, complex civil projects and expects that to be the case ""well into the future.""

>Tutor did, however, tell analysts that bidding has been delayed on some large projects that rely on federal funding but believes that federal lawmakers will act relatively quickly to resume those after the presidential election has been decided. 

>	Tutor Perini is still waiting to hear back from the Honolulu Authority for Rapid Transportation (HART) about its reported $2 billion bid to complete the $9 billion Honolulu Rail project. The city has decided not to back the agreed-upon public-private partnership delivery method, leaving HART to move forward with procurement. HART officials have indicated that it will try to negotiate down the two bids it received for the project. 



https://www.constructiondive.com/news/tutor-perini-posts-14b-q3-revenue-highest-in-more-than-a-decade/588450/",0.009,0.96,0.031,0.3818
38,PLUG,"In the midst of PLUG and ICLN creeps $TPC, revenue highest in a decade, contracted to  build Cali high speed railway, one of biggest winners from a infrastructure deal 
 

>	Tutor said that he believes the company doesn't have much competition for large, complex civil projects and expects that to be the case ""well into the future.""

>Tutor did, however, tell analysts that bidding has been delayed on some large projects that rely on federal funding but believes that federal lawmakers will act relatively quickly to resume those after the presidential election has been decided. 

>	Tutor Perini is still waiting to hear back from the Honolulu Authority for Rapid Transportation (HART) about its reported $2 billion bid to complete the $9 billion Honolulu Rail project. The city has decided not to back the agreed-upon public-private partnership delivery method, leaving HART to move forward with procurement. HART officials have indicated that it will try to negotiate down the two bids it received for the project. 



https://www.constructiondive.com/news/tutor-perini-posts-14b-q3-revenue-highest-in-more-than-a-decade/588450/",0.009,0.96,0.031,0.3818
39,TPC,"In the midst of PLUG and ICLN creeps $TPC, revenue highest in a decade, contracted to  build Cali high speed railway, one of biggest winners from a infrastructure deal 
 

>	Tutor said that he believes the company doesn't have much competition for large, complex civil projects and expects that to be the case ""well into the future.""

>Tutor did, however, tell analysts that bidding has been delayed on some large projects that rely on federal funding but believes that federal lawmakers will act relatively quickly to resume those after the presidential election has been decided. 

>	Tutor Perini is still waiting to hear back from the Honolulu Authority for Rapid Transportation (HART) about its reported $2 billion bid to complete the $9 billion Honolulu Rail project. The city has decided not to back the agreed-upon public-private partnership delivery method, leaving HART to move forward with procurement. HART officials have indicated that it will try to negotiate down the two bids it received for the project. 



https://www.constructiondive.com/news/tutor-perini-posts-14b-q3-revenue-highest-in-more-than-a-decade/588450/",0.009,0.96,0.031,0.3818
40,GIK,Is this good for GIK,0.0,0.58,0.42,0.4404
41,PECK,Buying more $PECK,0.0,1.0,0.0,0.0
42,OBSV,"Keep an eye on OBSV, it’s going to bounce hard and then take off",0.097,0.903,0.0,-0.1027
43,ENPH,I went all in on green energy in my Roth IRA when COVID hit. Still holding. Mostly ENPH.,0.0,0.884,0.116,0.2732
44,OVID,I went all in on green energy in my Roth IRA when COVID hit. Still holding. Mostly ENPH.,0.0,0.884,0.116,0.2732
45,IEA,Invest as much as you can on $IEA and thank me later. We are going to the moon soon.,0.0,0.878,0.122,0.3612
46,GME,Y'all YOLOing GME then or what?,0.0,1.0,0.0,0.0
47,ENPH,"K time for them to recover from Friday, that shit was painful holding ENPH, TAN, PBW, ICLN and NIO lol",0.257,0.632,0.111,-0.5719
48,ICLN,"K time for them to recover from Friday, that shit was painful holding ENPH, TAN, PBW, ICLN and NIO lol",0.257,0.632,0.111,-0.5719
49,NIO,"K time for them to recover from Friday, that shit was painful holding ENPH, TAN, PBW, ICLN and NIO lol",0.257,0.632,0.111,-0.5719
50,AC,Honestly I'm sick of this. Ever been to Dubai? They built a fucking indoor ski slope in the desert. Yet I have to switch off my AC to save the planet? GTFO.,0.09,0.733,0.178,0.504
51,USA,"On a per capita consumption basis (i.e. accounting for how much people actually 'use' rather than purely what is produced in a country), the USA has the 7th highest CO2 emissions in the world. It's behind Luxembourg, Qatar, Kuwait, Brunei, Singapore, and Saudi Arabia — all either tiny, very rich or oil-based nations. No one is saying that emissions from other countries are not a problem, but the USA is a massive contributor to climate change both on a per capita and actual basis. China produces just over 1/3 the emissions per capita of the USA, and India produces around 1/10.",0.016,0.942,0.042,0.356
52,GEVO,GEVO 🚀🚀🚀,0.0,1.0,0.0,0.0
53,GEVO,What is GEVO even I see it everywhere,0.0,1.0,0.0,0.0
54,ICLN,"Planes trains and automobiles still primarily gas tho.  🌈🐻
ICLN TAN ARKK ARKG SPWR SUNW",0.0,1.0,0.0,0.0
55,SPWR,"Planes trains and automobiles still primarily gas tho.  🌈🐻
ICLN TAN ARKK ARKG SPWR SUNW",0.0,1.0,0.0,0.0
56,SUNW,"Planes trains and automobiles still primarily gas tho.  🌈🐻
ICLN TAN ARKK ARKG SPWR SUNW",0.0,1.0,0.0,0.0
57,ICLN,ICLN,0.0,1.0,0.0,0.0
58,ICLN,"Haha my man same, ICLN, TAN, STPK, ACES",0.0,0.7,0.3,0.4588
59,STPK,"Haha my man same, ICLN, TAN, STPK, ACES",0.0,0.7,0.3,0.4588
60,AMC,Half the shit on the market is dogshit in earnings and it's up at close today. AMC is up today 31%,0.153,0.847,0.0,-0.5574
61,EV,"Do you have any idea how much growth there is in this industry? We are moving completely off fossil fuels. Until every power plant in America runs off clean energy, and every house runs off solar, and every car is an EV, this industry will continue to grow.",0.0,0.859,0.141,0.7506
62,CSIQ,QCLN NOVA CSIQ,0.0,1.0,0.0,0.0
63,NOVA,QCLN NOVA CSIQ,0.0,1.0,0.0,0.0
64,QCLN,QCLN NOVA CSIQ,0.0,1.0,0.0,0.0
65,PLUG,PLUG 🚀🚀🚀,0.0,1.0,0.0,0.0
66,TSLA,"Ya thats a no. 

You expect TSLA to grow almost 3x its current valuation when its already over valued in 1 year?  Elon will be worth around 700 billion?

What you smokin buddy.",0.062,0.792,0.146,0.4515
67,SEDG,And SEDG...,0.0,1.0,0.0,0.0
68,AMC,Literally talked to my friend last night about AMC but is didn’t have the guts,0.0,0.87,0.13,0.2732
69,EV,"I'm with you. But EV is 2% of the market currently. So this has a huge opportunity to run up in the future. But how much future is has been priced in. Nio went from $2 to 50 this year alone. They are trading at a very high premium. I don't have to tell you about tesla. At some point the earning will need to catch up to the premium. Hence my question how much have we already priced into the stock/etf. 
I believe in 2 5 10 years stock is much higher. I'm just asking at what point do we think we've priced in future growth. It's been going up hard all year and earnings hasn't changed in these stocks. They have catching up to do.",0.027,0.911,0.063,0.6771
70,ICLN,"Ah yes, the old logical fallacy that stocks that have gone up will continue to go up. 

I might be wrong but I wouldn't be so dismissive of the idea that there isn't much growth to be had in green energy in 2021. There are plenty of headwinds. 

For the record, I'm long ICLN and QCLN",0.081,0.843,0.076,-0.0839
71,QCLN,"Ah yes, the old logical fallacy that stocks that have gone up will continue to go up. 

I might be wrong but I wouldn't be so dismissive of the idea that there isn't much growth to be had in green energy in 2021. There are plenty of headwinds. 

For the record, I'm long ICLN and QCLN",0.081,0.843,0.076,-0.0839
72,TSLA,"https://en.wikipedia.org/wiki/Perpetual_motion

I was being sarcastic, but I acknowledge it's getting hard to differentiate parody from actual TSLA bulls at this point.",0.154,0.846,0.0,-0.2732
73,AMC,"I made the mistake today of investing in stocks with improved earnings today, smh should have put it all into AMC of course /s",0.169,0.719,0.112,-0.1531
74,ICLN,Might I suggest ICLN,0.0,1.0,0.0,0.0
75,EV,The infrastructure for renewables is still in its infancy and theres still issues regarding solar energy storage and the challenge of the Duck curve. People are anticipating clean energy like its gonna take over soon and everyones gonna drive an EV by next year,0.0,0.785,0.215,0.8271
76,USA,"I never suggested it was good in 100% of the USA.

The reality is that the future is going to look nothing like 1950, which is what the Trump people wanted to go back to and no one in the entire world particularly wants.  People don't want nuclear, either, given the significant safety issues surround it, as well as the life of waste.",0.116,0.751,0.133,0.3111
77,ICE,"Climate change needs to be addressed globally. It's not enough to say ""Well x and x country is not doing this so we do nothing"". Lead and the world follows. Further both China and India are also investing heavily in renewables with plans on phasing out ICE vehicles similar to the UK and California.",0.0,0.96,0.04,0.2732
78,UK,"Climate change needs to be addressed globally. It's not enough to say ""Well x and x country is not doing this so we do nothing"". Lead and the world follows. Further both China and India are also investing heavily in renewables with plans on phasing out ICE vehicles similar to the UK and California.",0.0,0.96,0.04,0.2732
79,AMC,My plan was to sell call options on them. You’re looking at a 7-10% weekly return selling OTM weeklies. Before we find out of AMC is going bankrupt or riding a post covid rocket you’d being sitting on free stock anyways.,0.082,0.843,0.075,-0.0772
80,ICLN,SMOG ICLN QCLN TAN seem like some solid options to me,0.195,0.532,0.273,0.0431
81,QCLN,SMOG ICLN QCLN TAN seem like some solid options to me,0.195,0.532,0.273,0.0431
82,TM,"Ah yes, the typical snobbish canuck who thinks he knows more about the subject than he actually does because you leafs are superior^TM.

It is known. /s LOL",0.057,0.755,0.188,0.6523
83,USA,"To address climate change and protect our planet we need to generate more electricity using green sources, take aggressive measures to preserve forests and oceans, reduce waste, farm more sustainably, and reforest millions of acres lost over the last century. Your mentality is weird because you're suggesting only the USA is trying to address all these measures thus it is futile. This is wrong. 

All these are being addressed globally. Life isn't so bleak. 

&#x200B;

1. [https://www.weforum.org/agenda/2021/01/planet-coalition-environment-conservation-protection-france-climate-change](https://www.weforum.org/agenda/2021/01/planet-coalition-environment-conservation-protection-france-climate-change)
2. [https://trilliontrees.org/home](https://trilliontrees.org/home)",0.162,0.809,0.029,-0.8689
84,GM,Bought several times during the dip when GM was in the low 20's.  It's been my favorite stock to own.  Can't wait to see what the dividend looks like when it comes back,0.056,0.798,0.146,0.5267
85,ROBO,"Great news for investors who were able to purchase at $20! I got in at $40 back in November regret not increasing my position when it down to $38. 

Anyone know who makes all the sensors for the self-driving technology? Maybe this would be a good time to invest in the ROBO etf? 🤔",0.048,0.821,0.131,0.7052
86,TSLA,"Good news.

I'd rather see EVs roll out successfully from many large companies which is good for consumer price, consumer choice and adoption.

Sorry TSLA holders who don't want any competition",0.067,0.693,0.24,0.8165
87,GM,All I see is Microsoft’s failure on Ford’s sync system and both MS and GM having to navigate every patent that Apple and Tesla have so they can get to market,0.102,0.898,0.0,-0.5106
88,MS,All I see is Microsoft’s failure on Ford’s sync system and both MS and GM having to navigate every patent that Apple and Tesla have so they can get to market,0.102,0.898,0.0,-0.5106
89,EV,Fuck GM for SAAB... I want the SAAB Chinese EV version of the 93. But cannot get it in EU.,0.161,0.78,0.06,-0.4939
90,GM,Fuck GM for SAAB... I want the SAAB Chinese EV version of the 93. But cannot get it in EU.,0.161,0.78,0.06,-0.4939
91,EV,Microsoft and GM are scary team in this field. Let's be honest Tesla may be a more innovative company but GM has the manufacturing capabilities of pumping out EV cars better than any company on the planet to the consumer masses. Look for Microsoft to acquire Microvision a company that they have worked with in the past on their Hololens 2 and use the LIDAR technology in autonomous cars. Microvisions LIDAR tech will soon show to surpass other LIDAR companies like Luminar and Velodyne with what they're coming out with by the end of this quarter. IMO this team could take a strong lead in this market.,0.018,0.844,0.137,0.9287
92,GM,Microsoft and GM are scary team in this field. Let's be honest Tesla may be a more innovative company but GM has the manufacturing capabilities of pumping out EV cars better than any company on the planet to the consumer masses. Look for Microsoft to acquire Microvision a company that they have worked with in the past on their Hololens 2 and use the LIDAR technology in autonomous cars. Microvisions LIDAR tech will soon show to surpass other LIDAR companies like Luminar and Velodyne with what they're coming out with by the end of this quarter. IMO this team could take a strong lead in this market.,0.018,0.844,0.137,0.9287
93,IMO,Microsoft and GM are scary team in this field. Let's be honest Tesla may be a more innovative company but GM has the manufacturing capabilities of pumping out EV cars better than any company on the planet to the consumer masses. Look for Microsoft to acquire Microvision a company that they have worked with in the past on their Hololens 2 and use the LIDAR technology in autonomous cars. Microvisions LIDAR tech will soon show to surpass other LIDAR companies like Luminar and Velodyne with what they're coming out with by the end of this quarter. IMO this team could take a strong lead in this market.,0.018,0.844,0.137,0.9287
94,GM,"Good news for GM and the space as a whole but I see this as a bad investment from MSFT. All the talent wants to work for TSLA, I doubt there's any engineers that even have GM in their top 10 companies to work for. They're never catching up",0.143,0.716,0.141,-0.2846
95,MSFT,"Good news for GM and the space as a whole but I see this as a bad investment from MSFT. All the talent wants to work for TSLA, I doubt there's any engineers that even have GM in their top 10 companies to work for. They're never catching up",0.143,0.716,0.141,-0.2846
96,TSLA,"Good news for GM and the space as a whole but I see this as a bad investment from MSFT. All the talent wants to work for TSLA, I doubt there's any engineers that even have GM in their top 10 companies to work for. They're never catching up",0.143,0.716,0.141,-0.2846
97,GM,driverless GM suv. now that is something even tesla model x riders wouldn't mind.,0.0,1.0,0.0,0.0
98,GM,"NICE I INVESTED 20k into GM

^(it was a simulation competition but still nice)",0.0,0.829,0.171,0.3108
99,NICE,"NICE I INVESTED 20k into GM

^(it was a simulation competition but still nice)",0.0,0.829,0.171,0.3108
100,GM,"Old tech company bets on older car company to bring about the future?

I like MS but GM can suck it. They get bailed out every recession/crash because their business model is old as fuck. No innovation coming from them.",0.226,0.673,0.102,-0.8047
101,MS,"Old tech company bets on older car company to bring about the future?

I like MS but GM can suck it. They get bailed out every recession/crash because their business model is old as fuck. No innovation coming from them.",0.226,0.673,0.102,-0.8047
102,GM,GM is terrible,0.608,0.392,0.0,-0.4767
103,GM,GM sucks and will fail.  Microsoft only investing because Gates doesn’t like/is jealous of Musk.,0.429,0.571,0.0,-0.8402
104,GM,Prediction: GM and Ford will not exist in 20 years. Just like Nokia and Blackberry.,0.0,0.848,0.152,0.3612
105,REAL,"Every sector will eventually be augmented and disrupted with software, it just so happens that EVs make this easier for it to happen in automotive. And I mean REAL software, not baby entertainment UIs, etc.",0.062,0.851,0.086,0.2306
106,GM,Why on EARTH would you want GM to pay a dividend?? They should be reinvesting all of that money to catch up to Tesla in technology.,0.068,0.883,0.05,-0.1179
107,GM,"I wish I held on to my $20 stocks. Sold around 40 bc I didn't have long term goals. GM has horrible issues in marketing and admin / bureaucracy stuff but probably has some of the best engineers. If the engineers could let loose on more cars like they did with the Hummer, GM would definitely be a top auto maker again. Rn they're just trying to max profits while they can bc ICE makes a ton more money than EVs.",0.056,0.72,0.225,0.9495
108,ICE,"I wish I held on to my $20 stocks. Sold around 40 bc I didn't have long term goals. GM has horrible issues in marketing and admin / bureaucracy stuff but probably has some of the best engineers. If the engineers could let loose on more cars like they did with the Hummer, GM would definitely be a top auto maker again. Rn they're just trying to max profits while they can bc ICE makes a ton more money than EVs.",0.056,0.72,0.225,0.9495
109,GM,"I agree I am going to wait it out a few days but am skeptical to enter in the space at all honestly but wanted to get the information out there for folk to decide. There will be a winner for sure it is just trying to pick the right one.

The issue with a company like say Tesla for example (and this tech in general) is they had to tear down their entire autonomous tech and start from scratch all over again (and think more companies will have to follow that). All the data models were lost from that and they have to build it up again. Additionally, if he ever takes Starlink / SpaceX program public it will tank it.

For GM it looks like the market reacted to this already in the premarket so I will wait personally a day or two and only enter in for 10 shares if that. Good on you for having the foresight to get in around $20",0.033,0.818,0.149,0.9688
110,GM,"Agreed and there were some huge calls on $GM that smell like the usual ""someone somewhere knew something.""",0.0,0.685,0.315,0.7096
