,ticker,comment,username,score,permalink,neg,neu,pos,compound
0,CRSR," Yep, just bought CRSR because of this.",Gabochuky,18,/r/investing/comments/oz6a2y/trader_do_you_buy_stocks_right_after_a_large_drop/h7y1fxp/,0.0,0.732,0.268,0.296
1,PINS, I sure did with PINS,codeartha,5,/r/investing/comments/oz6a2y/trader_do_you_buy_stocks_right_after_a_large_drop/h7yeppb/,0.0,0.566,0.434,0.3182
2,CRSR," Depends on the company, i bought the CRSR earnings dip the other day and made some profit.",Even-Function,5,/r/investing/comments/oz6a2y/trader_do_you_buy_stocks_right_after_a_large_drop/h7xtn91/,0.0,0.838,0.162,0.4404
3,MX," On a more topical note, MX sold off like 9% today due to supply chain issues.  They literally could not get enough wafers to meet demand and it hurt their sales.  

If CFIUS doesn't block their acquisition on 9/13, there's a 50% upside.  If they take the higher offer on the table, upside is like 80%.",LouSanous,2,/r/investing/comments/oz6a2y/trader_do_you_buy_stocks_right_after_a_large_drop/h7y7ig8/,0.08,0.799,0.121,0.3624
4,FSLY, I loaded the truck with FSLY shares when it tanked to $36 after earnings and have been handsomely rewarded since then,us1549,2,/r/investing/comments/oz6a2y/trader_do_you_buy_stocks_right_after_a_large_drop/h7ya4n6/,0.0,0.672,0.328,0.8074
5,AMZN," Just did that CRSP (beat, but tanked), with NVAX (missed but EU deal closed) and AMZN.

I'm up 20ish % in a week.",SorryLifeguard7,2,/r/investing/comments/oz6a2y/trader_do_you_buy_stocks_right_after_a_large_drop/h7xyqlf/,0.0,1.0,0.0,0.0
6,CRSP," Just did that CRSP (beat, but tanked), with NVAX (missed but EU deal closed) and AMZN.

I'm up 20ish % in a week.",SorryLifeguard7,2,/r/investing/comments/oz6a2y/trader_do_you_buy_stocks_right_after_a_large_drop/h7xyqlf/,0.0,1.0,0.0,0.0
7,NVAX," Just did that CRSP (beat, but tanked), with NVAX (missed but EU deal closed) and AMZN.

I'm up 20ish % in a week.",SorryLifeguard7,2,/r/investing/comments/oz6a2y/trader_do_you_buy_stocks_right_after_a_large_drop/h7xyqlf/,0.0,1.0,0.0,0.0
8,PKI," lol in today's market you buy stocks after a large drop in share price due to a massive earnings beat. 

Check out TSX: PKI.

Beat on earnings, beat on revenue, raised guidance, down 4%.

Fuck this market.",BreastMilkPopsicles,2,/r/investing/comments/oz6a2y/trader_do_you_buy_stocks_right_after_a_large_drop/h7xtryd/,0.135,0.745,0.12,-0.1531
9,SAM, What about SAM,on606,1,/r/investing/comments/oz6a2y/trader_do_you_buy_stocks_right_after_a_large_drop/h7yedfl/,0.0,1.0,0.0,0.0
10,FVRR," Did this with FVRR, not doing so hot right now.",ryry1237,1,/r/investing/comments/oz6a2y/trader_do_you_buy_stocks_right_after_a_large_drop/h7yeoav/,0.0,1.0,0.0,0.0
11,GM," Doubled down on GM yesterday. So yes, usually haha",humblepharmer,1,/r/investing/comments/oz6a2y/trader_do_you_buy_stocks_right_after_a_large_drop/h7ygqr3/,0.0,0.528,0.472,0.7397
12,SCHW," It really depends if the overreaction is justified or not and also the track record of the company. If you follow some stocks, its kind of a trend that after every overreaction (from earnings), there will be a correction in the following weeks or months until the next earning and then it might repeat itself. Sometimes, there is no correction and will trade sideways until next earnings because investors is looking to see if the company will recover or not. This really depend on the sentiment and perception on the company.

Its hard to know when the drop is going to stop. I normally wait a day or two before going in a certain stock. Because I rather buy calls than hold a stock for too long. If a stock drops by too much, I rather buy a call 1 month from expiration and it has worked well so far.

Like Today, there is a rally from all the banks. Banks have been down since July (after Jpow speech). I expected a rally but I sold some calls yesterday (SCHW) at 20% profit and the calls I sold today (JPM), I made a good 60% in the morning. While, I could have hold it a bit for the afternoon. If I held the calls for SCHW till today, I would have made easily more than 150%. Oh well...",zethras,1,/r/investing/comments/oz6a2y/trader_do_you_buy_stocks_right_after_a_large_drop/h7yjt3l/,0.039,0.88,0.08,0.8998
13,INTC," I'm not a trader much but the only time I did it was a year ago when INTC tanked big time when they announced delays for what comes after 14NM.  Stock dropped from 20% or something and redropped even lower 1 month later and I doubled down.  Huge cash cow trading at 8 PE ratio? Whatever I'll buy a bunch.

It came back in a couple months to their usual range and sold happily.  Not a huge trade but I felt pretty confident.",sacdecorsair,1,/r/investing/comments/oz6a2y/trader_do_you_buy_stocks_right_after_a_large_drop/h7ymsom/,0.059,0.755,0.185,0.9218
14,AAPL," I think this is a workable strategy from a long-term investing standpoint, but my record is very mixed trying to trade on these dips. I can think of lots of similar dips in otherwise promising names that still haven't recovered their top, including: INTC, ETSY, TSM, PINS, UI, MU etc. I think these dips are best thought of as a change in fundamentals around which a long-term strategy can be built. Trade in stocks you're comfortable holding at that price. AAPL dipped for 6 months before popping. AMD and AMKR also dipped further after their previous earnings dip before recovering it all and then some.",msnf,1,/r/investing/comments/oz6a2y/trader_do_you_buy_stocks_right_after_a_large_drop/h7ynigz/,0.017,0.856,0.127,0.9314
15,AMD," I think this is a workable strategy from a long-term investing standpoint, but my record is very mixed trying to trade on these dips. I can think of lots of similar dips in otherwise promising names that still haven't recovered their top, including: INTC, ETSY, TSM, PINS, UI, MU etc. I think these dips are best thought of as a change in fundamentals around which a long-term strategy can be built. Trade in stocks you're comfortable holding at that price. AAPL dipped for 6 months before popping. AMD and AMKR also dipped further after their previous earnings dip before recovering it all and then some.",msnf,1,/r/investing/comments/oz6a2y/trader_do_you_buy_stocks_right_after_a_large_drop/h7ynigz/,0.017,0.856,0.127,0.9314
16,AMKR," I think this is a workable strategy from a long-term investing standpoint, but my record is very mixed trying to trade on these dips. I can think of lots of similar dips in otherwise promising names that still haven't recovered their top, including: INTC, ETSY, TSM, PINS, UI, MU etc. I think these dips are best thought of as a change in fundamentals around which a long-term strategy can be built. Trade in stocks you're comfortable holding at that price. AAPL dipped for 6 months before popping. AMD and AMKR also dipped further after their previous earnings dip before recovering it all and then some.",msnf,1,/r/investing/comments/oz6a2y/trader_do_you_buy_stocks_right_after_a_large_drop/h7ynigz/,0.017,0.856,0.127,0.9314
17,ETSY," I think this is a workable strategy from a long-term investing standpoint, but my record is very mixed trying to trade on these dips. I can think of lots of similar dips in otherwise promising names that still haven't recovered their top, including: INTC, ETSY, TSM, PINS, UI, MU etc. I think these dips are best thought of as a change in fundamentals around which a long-term strategy can be built. Trade in stocks you're comfortable holding at that price. AAPL dipped for 6 months before popping. AMD and AMKR also dipped further after their previous earnings dip before recovering it all and then some.",msnf,1,/r/investing/comments/oz6a2y/trader_do_you_buy_stocks_right_after_a_large_drop/h7ynigz/,0.017,0.856,0.127,0.9314
18,INTC," I think this is a workable strategy from a long-term investing standpoint, but my record is very mixed trying to trade on these dips. I can think of lots of similar dips in otherwise promising names that still haven't recovered their top, including: INTC, ETSY, TSM, PINS, UI, MU etc. I think these dips are best thought of as a change in fundamentals around which a long-term strategy can be built. Trade in stocks you're comfortable holding at that price. AAPL dipped for 6 months before popping. AMD and AMKR also dipped further after their previous earnings dip before recovering it all and then some.",msnf,1,/r/investing/comments/oz6a2y/trader_do_you_buy_stocks_right_after_a_large_drop/h7ynigz/,0.017,0.856,0.127,0.9314
19,MU," I think this is a workable strategy from a long-term investing standpoint, but my record is very mixed trying to trade on these dips. I can think of lots of similar dips in otherwise promising names that still haven't recovered their top, including: INTC, ETSY, TSM, PINS, UI, MU etc. I think these dips are best thought of as a change in fundamentals around which a long-term strategy can be built. Trade in stocks you're comfortable holding at that price. AAPL dipped for 6 months before popping. AMD and AMKR also dipped further after their previous earnings dip before recovering it all and then some.",msnf,1,/r/investing/comments/oz6a2y/trader_do_you_buy_stocks_right_after_a_large_drop/h7ynigz/,0.017,0.856,0.127,0.9314
20,PINS," I think this is a workable strategy from a long-term investing standpoint, but my record is very mixed trying to trade on these dips. I can think of lots of similar dips in otherwise promising names that still haven't recovered their top, including: INTC, ETSY, TSM, PINS, UI, MU etc. I think these dips are best thought of as a change in fundamentals around which a long-term strategy can be built. Trade in stocks you're comfortable holding at that price. AAPL dipped for 6 months before popping. AMD and AMKR also dipped further after their previous earnings dip before recovering it all and then some.",msnf,1,/r/investing/comments/oz6a2y/trader_do_you_buy_stocks_right_after_a_large_drop/h7ynigz/,0.017,0.856,0.127,0.9314
21,TSM," I think this is a workable strategy from a long-term investing standpoint, but my record is very mixed trying to trade on these dips. I can think of lots of similar dips in otherwise promising names that still haven't recovered their top, including: INTC, ETSY, TSM, PINS, UI, MU etc. I think these dips are best thought of as a change in fundamentals around which a long-term strategy can be built. Trade in stocks you're comfortable holding at that price. AAPL dipped for 6 months before popping. AMD and AMKR also dipped further after their previous earnings dip before recovering it all and then some.",msnf,1,/r/investing/comments/oz6a2y/trader_do_you_buy_stocks_right_after_a_large_drop/h7ynigz/,0.017,0.856,0.127,0.9314
22,UI," I think this is a workable strategy from a long-term investing standpoint, but my record is very mixed trying to trade on these dips. I can think of lots of similar dips in otherwise promising names that still haven't recovered their top, including: INTC, ETSY, TSM, PINS, UI, MU etc. I think these dips are best thought of as a change in fundamentals around which a long-term strategy can be built. Trade in stocks you're comfortable holding at that price. AAPL dipped for 6 months before popping. AMD and AMKR also dipped further after their previous earnings dip before recovering it all and then some.",msnf,1,/r/investing/comments/oz6a2y/trader_do_you_buy_stocks_right_after_a_large_drop/h7ynigz/,0.017,0.856,0.127,0.9314
23,ALTO," I buy leaps when there's an irrational drop. If it's a company I like for the long term, it'll return to the mean and then more. Best time to do it. I just did it this week on a few stocks I love for long term (PSFE and ALTO, up 15% on both this week)",Ryanm715,1,/r/investing/comments/oz6a2y/trader_do_you_buy_stocks_right_after_a_large_drop/h7yrxd3/,0.075,0.737,0.188,0.8268
24,INTC," doesn't always work.. INTC.. extremely profitable company gapped down in April after it reported earnings.. it closed that day around $58.50, (after closing the night before around $62)

Its been trending lower ever since and is now around $54, four months later",Bman409,1,/r/investing/comments/oz6a2y/trader_do_you_buy_stocks_right_after_a_large_drop/h7yzbjw/,0.048,0.881,0.07,0.2484
25,ZNGA, So ZNGA is a great buy right now. Got it!,Big-Papa-Dickerd,1,/r/investing/comments/oz6a2y/trader_do_you_buy_stocks_right_after_a_large_drop/h7z02zw/,0.0,0.632,0.368,0.6864
26,FVRR, Yes. Did this with FVRR.,kaniyajo,1,/r/investing/comments/oz6a2y/trader_do_you_buy_stocks_right_after_a_large_drop/h7z3xhz/,0.0,0.597,0.403,0.4019
27,ZY," Yes,I buyed ZY yesterday, cost was 8.9$ and sell today with 16$ because company in deep ass.
I think it's worth some time.",yuriy_yarvi,0,/r/investing/comments/oz6a2y/trader_do_you_buy_stocks_right_after_a_large_drop/h7yvi40/,0.138,0.787,0.075,-0.3818
28,AMZN, Did that with AMZN when it dropped after their latest earnings. Feels like there was an overreaction and it should pop back up. Hope I'm right,Hodl2,112,/r/investing/comments/oz6a2y/trader_do_you_buy_stocks_right_after_a_large_drop/h7xqq7w/,0.056,0.764,0.179,0.5719
29,BCRX," Ya, BCRX yesterday was a great example of a clear opportunity from a temporary unjustified post-earnings selloff",Habooboo5,3,/r/investing/comments/oz6a2y/trader_do_you_buy_stocks_right_after_a_large_drop/h7ypdjf/,0.0,0.537,0.463,0.8591
30,AMZN, AMZN this quarter is the quintessential example. What a psychotic drop.,Green_Lantern_4vr,2,/r/investing/comments/oz6a2y/trader_do_you_buy_stocks_right_after_a_large_drop/h7yvw7u/,0.189,0.811,0.0,-0.2732
31,AMZN," FSLY -20% into -5% runup yesterday comes to mind.

Dear lord I missed that boat... FSLY is literally the cloud behind everything, including AMZN and the website we're posting on right now. Was watching for a morning flush but that was stupid, usually these overreactions don't have a flush as the dip is very severe and almost shocks investors/traders.

EDIT: SO DAMN SALTY ABOUT THIS THINKING ABOUT IT AGAIN was literally eyeing calls up to FOMC easy 50% already and running",Inori92,2,/r/investing/comments/oz6a2y/trader_do_you_buy_stocks_right_after_a_large_drop/h7z93iz/,0.2,0.741,0.059,-0.9386
32,FSLY," FSLY -20% into -5% runup yesterday comes to mind.

Dear lord I missed that boat... FSLY is literally the cloud behind everything, including AMZN and the website we're posting on right now. Was watching for a morning flush but that was stupid, usually these overreactions don't have a flush as the dip is very severe and almost shocks investors/traders.

EDIT: SO DAMN SALTY ABOUT THIS THINKING ABOUT IT AGAIN was literally eyeing calls up to FOMC easy 50% already and running",Inori92,2,/r/investing/comments/oz6a2y/trader_do_you_buy_stocks_right_after_a_large_drop/h7z93iz/,0.2,0.741,0.059,-0.9386
33,SO," FSLY -20% into -5% runup yesterday comes to mind.

Dear lord I missed that boat... FSLY is literally the cloud behind everything, including AMZN and the website we're posting on right now. Was watching for a morning flush but that was stupid, usually these overreactions don't have a flush as the dip is very severe and almost shocks investors/traders.

EDIT: SO DAMN SALTY ABOUT THIS THINKING ABOUT IT AGAIN was literally eyeing calls up to FOMC easy 50% already and running",Inori92,2,/r/investing/comments/oz6a2y/trader_do_you_buy_stocks_right_after_a_large_drop/h7z93iz/,0.2,0.741,0.059,-0.9386
34,FSLY, FSLY,RobinhoodFag,3,/r/investing/comments/oz6a2y/trader_do_you_buy_stocks_right_after_a_large_drop/h7ypgm0/,0.0,1.0,0.0,0.0
35,TA," This is the best way to use TA IMO, to check setups",Dmitriy_DG3D,1,/r/investing/comments/oz6a2y/trader_do_you_buy_stocks_right_after_a_large_drop/h7z4gxt/,0.0,0.724,0.276,0.6369
36,CRSR," I've done it so many times with CRSR but it keeps trending lower. I can't justify putting in any more because my holding is already too high of a percentage of my portfolio. I just need to wait out for one of those freak spikes that puts me in the green for a few hours and then dump it. Of course, it will probably rally to $60+ after that because this has been my MO with most stocks I've sat on in the red for months and then sold as soon as I saw any profit.",YourMatt,13,/r/investing/comments/oz6a2y/trader_do_you_buy_stocks_right_after_a_large_drop/h7yi0p6/,0.1,0.862,0.038,-0.7351
37,MO," I've done it so many times with CRSR but it keeps trending lower. I can't justify putting in any more because my holding is already too high of a percentage of my portfolio. I just need to wait out for one of those freak spikes that puts me in the green for a few hours and then dump it. Of course, it will probably rally to $60+ after that because this has been my MO with most stocks I've sat on in the red for months and then sold as soon as I saw any profit.",YourMatt,13,/r/investing/comments/oz6a2y/trader_do_you_buy_stocks_right_after_a_large_drop/h7yi0p6/,0.1,0.862,0.038,-0.7351
38,FSLY, My FSLY $40 calls I bought near open yesterday are up over 100% and don't expire until mid December. I'm hoping it gets back up to $60+ over the next month. Should be a 5 bagger easily if it does.,cry0plasma,2,/r/investing/comments/oz6a2y/trader_do_you_buy_stocks_right_after_a_large_drop/h7yw5iu/,0.0,0.871,0.129,0.6369
39,AMZN," I get where you're coming from and generally agree, but it's worth noting that you could have kept that money in an index fund for those 6 months and be ahead of the person who just held onto AMZN, while also avoiding some volatility.",ProfOnTheMove,25,/r/investing/comments/oz6a2y/trader_do_you_buy_stocks_right_after_a_large_drop/h7yitye/,0.067,0.844,0.089,0.0
40,CWH," My highest convictions stocks are all less popular. Top 3 are CWH, TWOU, and DISCK.

CWH: Has been crushing earnings. P/E <8. Priced like their at the top of their earnings cycle, but demand isn't slowing, they are buying back shares, they are eating up RV dealerships nationwide, and they are dominating all aspects of RV ownership.

TWOU: Has rapid growth and shifting towards profitability. The EdX acquisition also magnifies their potential.

DISCK: Great earnings, shift to streaming is going well and augmented by profitability of their t.v. market, and the pending Time Warner deal is transformational. I strongly believe that this will spike when the deal is finalized, due to how undervalued both TW and DISCK are currently.",homeless_alchemist,16,/r/investing/comments/oytnbj/what_are_some_of_your_less_popular_stocks_that/h7vqdk0/,0.046,0.747,0.207,0.9653
41,DISCK," My highest convictions stocks are all less popular. Top 3 are CWH, TWOU, and DISCK.

CWH: Has been crushing earnings. P/E <8. Priced like their at the top of their earnings cycle, but demand isn't slowing, they are buying back shares, they are eating up RV dealerships nationwide, and they are dominating all aspects of RV ownership.

TWOU: Has rapid growth and shifting towards profitability. The EdX acquisition also magnifies their potential.

DISCK: Great earnings, shift to streaming is going well and augmented by profitability of their t.v. market, and the pending Time Warner deal is transformational. I strongly believe that this will spike when the deal is finalized, due to how undervalued both TW and DISCK are currently.",homeless_alchemist,16,/r/investing/comments/oytnbj/what_are_some_of_your_less_popular_stocks_that/h7vqdk0/,0.046,0.747,0.207,0.9653
42,TW," My highest convictions stocks are all less popular. Top 3 are CWH, TWOU, and DISCK.

CWH: Has been crushing earnings. P/E <8. Priced like their at the top of their earnings cycle, but demand isn't slowing, they are buying back shares, they are eating up RV dealerships nationwide, and they are dominating all aspects of RV ownership.

TWOU: Has rapid growth and shifting towards profitability. The EdX acquisition also magnifies their potential.

DISCK: Great earnings, shift to streaming is going well and augmented by profitability of their t.v. market, and the pending Time Warner deal is transformational. I strongly believe that this will spike when the deal is finalized, due to how undervalued both TW and DISCK are currently.",homeless_alchemist,16,/r/investing/comments/oytnbj/what_are_some_of_your_less_popular_stocks_that/h7vqdk0/,0.046,0.747,0.207,0.9653
43,TWOU," My highest convictions stocks are all less popular. Top 3 are CWH, TWOU, and DISCK.

CWH: Has been crushing earnings. P/E <8. Priced like their at the top of their earnings cycle, but demand isn't slowing, they are buying back shares, they are eating up RV dealerships nationwide, and they are dominating all aspects of RV ownership.

TWOU: Has rapid growth and shifting towards profitability. The EdX acquisition also magnifies their potential.

DISCK: Great earnings, shift to streaming is going well and augmented by profitability of their t.v. market, and the pending Time Warner deal is transformational. I strongly believe that this will spike when the deal is finalized, due to how undervalued both TW and DISCK are currently.",homeless_alchemist,16,/r/investing/comments/oytnbj/what_are_some_of_your_less_popular_stocks_that/h7vqdk0/,0.046,0.747,0.207,0.9653
44,ASTS, ASTS. Holding for a decade at least,7000RPM,15,/r/investing/comments/oytnbj/what_are_some_of_your_less_popular_stocks_that/h7vvvx2/,0.0,1.0,0.0,0.0
45,CNK," SFM (Sprouts Farmers Market)

POAHY (Porsche Holdings SE)

WYNN, and CNK (Cinemark), *and* PLAY (Dave & Busters) but these are more recovery plays than really long term… will see how recovery goes next oh, 6-12 months, and how their long term prospects are looking then. 

Handful of precious metal miners too, mostly focused on gold, some on silver, and one copper. Could be holding these for a while, mostly plan on rebalancing to keep a set allocation to these, a bit of an inflation hedge (though I know it’s not that simple, not the perfect hedge, etc… but with all the $$$ printing going on I want some chips on the table for possibility of gold at new all time highs, and on historical charts when gold really goes up, it *really* goes up, imagine it hitting $3,000-$5,000/oz)",sunnbeta,5,/r/investing/comments/oytnbj/what_are_some_of_your_less_popular_stocks_that/h7vwo25/,0.027,0.852,0.121,0.9133
46,PLAY," SFM (Sprouts Farmers Market)

POAHY (Porsche Holdings SE)

WYNN, and CNK (Cinemark), *and* PLAY (Dave & Busters) but these are more recovery plays than really long term… will see how recovery goes next oh, 6-12 months, and how their long term prospects are looking then. 

Handful of precious metal miners too, mostly focused on gold, some on silver, and one copper. Could be holding these for a while, mostly plan on rebalancing to keep a set allocation to these, a bit of an inflation hedge (though I know it’s not that simple, not the perfect hedge, etc… but with all the $$$ printing going on I want some chips on the table for possibility of gold at new all time highs, and on historical charts when gold really goes up, it *really* goes up, imagine it hitting $3,000-$5,000/oz)",sunnbeta,5,/r/investing/comments/oytnbj/what_are_some_of_your_less_popular_stocks_that/h7vwo25/,0.027,0.852,0.121,0.9133
47,SFM," SFM (Sprouts Farmers Market)

POAHY (Porsche Holdings SE)

WYNN, and CNK (Cinemark), *and* PLAY (Dave & Busters) but these are more recovery plays than really long term… will see how recovery goes next oh, 6-12 months, and how their long term prospects are looking then. 

Handful of precious metal miners too, mostly focused on gold, some on silver, and one copper. Could be holding these for a while, mostly plan on rebalancing to keep a set allocation to these, a bit of an inflation hedge (though I know it’s not that simple, not the perfect hedge, etc… but with all the $$$ printing going on I want some chips on the table for possibility of gold at new all time highs, and on historical charts when gold really goes up, it *really* goes up, imagine it hitting $3,000-$5,000/oz)",sunnbeta,5,/r/investing/comments/oytnbj/what_are_some_of_your_less_popular_stocks_that/h7vwo25/,0.027,0.852,0.121,0.9133
48,WYNN," SFM (Sprouts Farmers Market)

POAHY (Porsche Holdings SE)

WYNN, and CNK (Cinemark), *and* PLAY (Dave & Busters) but these are more recovery plays than really long term… will see how recovery goes next oh, 6-12 months, and how their long term prospects are looking then. 

Handful of precious metal miners too, mostly focused on gold, some on silver, and one copper. Could be holding these for a while, mostly plan on rebalancing to keep a set allocation to these, a bit of an inflation hedge (though I know it’s not that simple, not the perfect hedge, etc… but with all the $$$ printing going on I want some chips on the table for possibility of gold at new all time highs, and on historical charts when gold really goes up, it *really* goes up, imagine it hitting $3,000-$5,000/oz)",sunnbeta,5,/r/investing/comments/oytnbj/what_are_some_of_your_less_popular_stocks_that/h7vwo25/,0.027,0.852,0.121,0.9133
49,ODFL, ODFL,JKMA63,3,/r/investing/comments/oytnbj/what_are_some_of_your_less_popular_stocks_that/h7vkak2/,0.0,1.0,0.0,0.0
50,BP, BP,LeChronnoisseur,5,/r/investing/comments/oytnbj/what_are_some_of_your_less_popular_stocks_that/h7w7k1j/,0.0,1.0,0.0,0.0
51,TMO, TMO (Thermofisher Scientific),Nosemyfart,10,/r/investing/comments/oytnbj/what_are_some_of_your_less_popular_stocks_that/h7vvnde/,0.0,1.0,0.0,0.0
52,BTI," BTI - It seems strange to me that one of the highest quality blue chips on earth is trading at such low valuations. And it's not like this company is shrinking, they have grown at 3.5% cagr for the past 5 years and conservative forward estimates place it at 1-4% CAGR for the next 5 years.",uhhuhfr,11,/r/investing/comments/oytnbj/what_are_some_of_your_less_popular_stocks_that/h7vogpq/,0.107,0.893,0.0,-0.6136
53,ARRY," ARRY 
Stitch fix (I pulled investment out already)
Canadian solar.",grmoto,3,/r/investing/comments/oytnbj/what_are_some_of_your_less_popular_stocks_that/h7vq5p8/,0.0,1.0,0.0,0.0
