,ticker,comment,username,score,permalink,neg,neu,pos,compound
0,ATOS, How is AITX and ATOS going to look! I think the arrow is upside down when I check. Shit,ShanghaiWilliam,1,/r/RobinHoodPennyStocks/comments/mf9kat/look_the_arrow_went_up/gso4irb/,0.196,0.804,0.0,-0.5983
1,BNGO," Yeah and nah,Don’t really miss it because even if I was  just getting started at that time it used to feel like it was just way too easy,Follow a
couple of you-tubers do a half ass dd and it it even felt close to a legit company  Dump your half account  and boom up 80 percent tomorrow.

It was for sure not sustainable,What we are
going through is healthy period of sideways trading and personally I feel like swing trading isn’t really worth it during this period.I just have positions in few stocks with BNGO CTXR PLTR and half my portfolio in VTI.I haven’t opened a position in penny or small cap stocks for a while.",Astab321,8,/r/RobinHoodPennyStocks/comments/mfg3kz/the_good_old_days/gsnitmo/,0.065,0.817,0.118,0.6597
2,PLTR," Yeah and nah,Don’t really miss it because even if I was  just getting started at that time it used to feel like it was just way too easy,Follow a
couple of you-tubers do a half ass dd and it it even felt close to a legit company  Dump your half account  and boom up 80 percent tomorrow.

It was for sure not sustainable,What we are
going through is healthy period of sideways trading and personally I feel like swing trading isn’t really worth it during this period.I just have positions in few stocks with BNGO CTXR PLTR and half my portfolio in VTI.I haven’t opened a position in penny or small cap stocks for a while.",Astab321,8,/r/RobinHoodPennyStocks/comments/mfg3kz/the_good_old_days/gsnitmo/,0.065,0.817,0.118,0.6597
3,GME," I also am a former degenerate... I now how a great job and over 35 GME shares 😎
And buying more tomorrow morning 😜",CinCity06,0,/r/RobinHoodPennyStocks/comments/mfg3kz/the_good_old_days/gsnkjuy/,0.0,0.717,0.283,0.743
4,RH, When trump is pres again you’ll have the good old days of green lines back on your RH account,RadicalFarCenter,-16,/r/RobinHoodPennyStocks/comments/mfg3kz/the_good_old_days/gsndmfq/,0.0,0.861,0.139,0.4404
5,GNUS," Honestly trading for basically from April last year up to early February was easy mode. Really am envious of my brother who had enough free time due to being out of college to start fiddling with trading last year cause there was so many opportunities to make trades overall. 

I didn't start ambitiously investing on my own save for the Roth I started in October until early January which was just before the mega bull run ended. I was just getting into pennies in particular late January before the corrections began and it's been tough going. That said I also have to realize this is needed because too many tickers were getting gassed up to crazy levels. I initially bought ZOM at around 1.57 and was shocked to hear months later it used to be like 40 cents or something.

I fully agree that right now might be a good time ot largely take a break from most penny tickers cause the market is just a bit too all over the place. Once I am done with GNUS this week I'll probably keep a greater chunk of my speculating account in cash while maybe trying to fool with crypto a bit or park some money in an ETF to slowly build a little capital while I wait for good penny opportunities to show themselves again. I have way more money in longer term accounts and a market like this makes me grateful for that since most of the stuff in those accounts will more reliably bounce back.",OKJMaster44,3,/r/RobinHoodPennyStocks/comments/mfg3kz/the_good_old_days/gso6na7/,0.042,0.821,0.137,0.9771
6,ZOM," Honestly trading for basically from April last year up to early February was easy mode. Really am envious of my brother who had enough free time due to being out of college to start fiddling with trading last year cause there was so many opportunities to make trades overall. 

I didn't start ambitiously investing on my own save for the Roth I started in October until early January which was just before the mega bull run ended. I was just getting into pennies in particular late January before the corrections began and it's been tough going. That said I also have to realize this is needed because too many tickers were getting gassed up to crazy levels. I initially bought ZOM at around 1.57 and was shocked to hear months later it used to be like 40 cents or something.

I fully agree that right now might be a good time ot largely take a break from most penny tickers cause the market is just a bit too all over the place. Once I am done with GNUS this week I'll probably keep a greater chunk of my speculating account in cash while maybe trying to fool with crypto a bit or park some money in an ETF to slowly build a little capital while I wait for good penny opportunities to show themselves again. I have way more money in longer term accounts and a market like this makes me grateful for that since most of the stuff in those accounts will more reliably bounce back.",OKJMaster44,3,/r/RobinHoodPennyStocks/comments/mfg3kz/the_good_old_days/gso6na7/,0.042,0.821,0.137,0.9771
7,ZOM, I'm in big on ZOM hoping it takes off. Right now it's trading lower then what the offering was a couple months ago.,BLKTP,13,/r/RobinHoodPennyStocks/comments/mfagf8/whats_ahead_for_the_week_what_are_you_watching/gsmepkp/,0.088,0.8,0.112,0.1531
8,ASRT, Praying to everything that ASRT makes a slight comeback,BogBogTheGreat,9,/r/RobinHoodPennyStocks/comments/mfagf8/whats_ahead_for_the_week_what_are_you_watching/gsna8ss/,0.0,0.737,0.263,0.3612
9,CTXR, Holding CTXR and GNUS. Really kind of pinned against the wall with them because I bought what I assumed was the dip just for it to slide further on friday. Hoping Monday brings green results.,FiendForPopeyes,9,/r/RobinHoodPennyStocks/comments/mfagf8/whats_ahead_for_the_week_what_are_you_watching/gsmoh66/,0.0,0.92,0.08,0.4215
10,GNUS, Holding CTXR and GNUS. Really kind of pinned against the wall with them because I bought what I assumed was the dip just for it to slide further on friday. Hoping Monday brings green results.,FiendForPopeyes,9,/r/RobinHoodPennyStocks/comments/mfagf8/whats_ahead_for_the_week_what_are_you_watching/gsmoh66/,0.0,0.92,0.08,0.4215
11,AGTC," BNGO, AGTC and CIDM",JasonVersetti,8,/r/RobinHoodPennyStocks/comments/mfagf8/whats_ahead_for_the_week_what_are_you_watching/gsmtnlw/,0.0,1.0,0.0,0.0
12,BNGO," BNGO, AGTC and CIDM",JasonVersetti,8,/r/RobinHoodPennyStocks/comments/mfagf8/whats_ahead_for_the_week_what_are_you_watching/gsmtnlw/,0.0,1.0,0.0,0.0
13,CIDM," BNGO, AGTC and CIDM",JasonVersetti,8,/r/RobinHoodPennyStocks/comments/mfagf8/whats_ahead_for_the_week_what_are_you_watching/gsmtnlw/,0.0,1.0,0.0,0.0
14,CLEU," CLEU, HOFV, WKEY",Interesting-Note-972,3,/r/RobinHoodPennyStocks/comments/mfagf8/whats_ahead_for_the_week_what_are_you_watching/gsmhxzj/,0.0,1.0,0.0,0.0
15,HOFV," CLEU, HOFV, WKEY",Interesting-Note-972,3,/r/RobinHoodPennyStocks/comments/mfagf8/whats_ahead_for_the_week_what_are_you_watching/gsmhxzj/,0.0,1.0,0.0,0.0
16,WKEY," CLEU, HOFV, WKEY",Interesting-Note-972,3,/r/RobinHoodPennyStocks/comments/mfagf8/whats_ahead_for_the_week_what_are_you_watching/gsmhxzj/,0.0,1.0,0.0,0.0
17,FAMI," SHIP just had good earnings and said to wait for more news this week. Holding through the week. Not sure if the Suez carrier buzz will affect it but I’m considering it in regards to risk. 

Watching SONM since it’s at support levels and communications might be a hot sector next week. Needs volume to move though. 

FAMI had a huge jump in volume last week after closing a recent offering. No price movement though but I’m thinking it could pop. 

I’m also in SESN but that’s a longer hold of mine. It just had a run and I’m only just dipping my toes back in now.",BigTortoise,3,/r/RobinHoodPennyStocks/comments/mfagf8/whats_ahead_for_the_week_what_are_you_watching/gsmiw9c/,0.062,0.862,0.076,0.3651
18,SESN," SHIP just had good earnings and said to wait for more news this week. Holding through the week. Not sure if the Suez carrier buzz will affect it but I’m considering it in regards to risk. 

Watching SONM since it’s at support levels and communications might be a hot sector next week. Needs volume to move though. 

FAMI had a huge jump in volume last week after closing a recent offering. No price movement though but I’m thinking it could pop. 

I’m also in SESN but that’s a longer hold of mine. It just had a run and I’m only just dipping my toes back in now.",BigTortoise,3,/r/RobinHoodPennyStocks/comments/mfagf8/whats_ahead_for_the_week_what_are_you_watching/gsmiw9c/,0.062,0.862,0.076,0.3651
19,SHIP," SHIP just had good earnings and said to wait for more news this week. Holding through the week. Not sure if the Suez carrier buzz will affect it but I’m considering it in regards to risk. 

Watching SONM since it’s at support levels and communications might be a hot sector next week. Needs volume to move though. 

FAMI had a huge jump in volume last week after closing a recent offering. No price movement though but I’m thinking it could pop. 

I’m also in SESN but that’s a longer hold of mine. It just had a run and I’m only just dipping my toes back in now.",BigTortoise,3,/r/RobinHoodPennyStocks/comments/mfagf8/whats_ahead_for_the_week_what_are_you_watching/gsmiw9c/,0.062,0.862,0.076,0.3651
20,SONM," SHIP just had good earnings and said to wait for more news this week. Holding through the week. Not sure if the Suez carrier buzz will affect it but I’m considering it in regards to risk. 

Watching SONM since it’s at support levels and communications might be a hot sector next week. Needs volume to move though. 

FAMI had a huge jump in volume last week after closing a recent offering. No price movement though but I’m thinking it could pop. 

I’m also in SESN but that’s a longer hold of mine. It just had a run and I’m only just dipping my toes back in now.",BigTortoise,3,/r/RobinHoodPennyStocks/comments/mfagf8/whats_ahead_for_the_week_what_are_you_watching/gsmiw9c/,0.062,0.862,0.076,0.3651
21,HYMC, HYMC dropped 40% last week. Was a top mover on RH. Bought some call options near the low just hoping for a bounce,bspartz85,3,/r/RobinHoodPennyStocks/comments/mfagf8/whats_ahead_for_the_week_what_are_you_watching/gsmrhx8/,0.085,0.729,0.186,0.3612
22,RH, HYMC dropped 40% last week. Was a top mover on RH. Bought some call options near the low just hoping for a bounce,bspartz85,3,/r/RobinHoodPennyStocks/comments/mfagf8/whats_ahead_for_the_week_what_are_you_watching/gsmrhx8/,0.085,0.729,0.186,0.3612
23,AEZS," Watching AEZS and CTRM.

Might buy SNDL of it gets close to $1.",JeepMunkee,7,/r/RobinHoodPennyStocks/comments/mfagf8/whats_ahead_for_the_week_what_are_you_watching/gsmebx7/,0.0,1.0,0.0,0.0
24,CTRM," Watching AEZS and CTRM.

Might buy SNDL of it gets close to $1.",JeepMunkee,7,/r/RobinHoodPennyStocks/comments/mfagf8/whats_ahead_for_the_week_what_are_you_watching/gsmebx7/,0.0,1.0,0.0,0.0
25,SNDL," Watching AEZS and CTRM.

Might buy SNDL of it gets close to $1.",JeepMunkee,7,/r/RobinHoodPennyStocks/comments/mfagf8/whats_ahead_for_the_week_what_are_you_watching/gsmebx7/,0.0,1.0,0.0,0.0
26,NAKD, Hoping NAKD makes a little spring break run,OperationScary9942,7,/r/RobinHoodPennyStocks/comments/mfagf8/whats_ahead_for_the_week_what_are_you_watching/gsmr4mc/,0.0,0.682,0.318,0.4215
27,CSCW, I have about 3.3K shares of CSCW. Great news recently with potential. I’m excited to see it hit $2 a share again this week.,Hugo_Stiglitz32,2,/r/RobinHoodPennyStocks/comments/mfagf8/whats_ahead_for_the_week_what_are_you_watching/gsn0d0r/,0.0,0.623,0.377,0.872
28,JFU, JFU for the next week and a half.,BagBoyEntertainment,1,/r/RobinHoodPennyStocks/comments/mfagf8/whats_ahead_for_the_week_what_are_you_watching/gsmx1k7/,0.0,1.0,0.0,0.0
29,AEZS," AEZS and SNDL. I’ve built up a good amount of shares over the past few months (12800 AEZS at 1.14) (9k SNDL at 1.41, will prob get another 1k this week) and I’ve started selling covered calls to bring in some income.",NippleTanahashi,1,/r/RobinHoodPennyStocks/comments/mfagf8/whats_ahead_for_the_week_what_are_you_watching/gsno1g9/,0.0,0.884,0.116,0.6249
30,SNDL," AEZS and SNDL. I’ve built up a good amount of shares over the past few months (12800 AEZS at 1.14) (9k SNDL at 1.41, will prob get another 1k this week) and I’ve started selling covered calls to bring in some income.",NippleTanahashi,1,/r/RobinHoodPennyStocks/comments/mfagf8/whats_ahead_for_the_week_what_are_you_watching/gsno1g9/,0.0,0.884,0.116,0.6249
31,GNUS, I mean I may be stupid but GNUS has earnings and a pretty big announcement this week partnering with Marvel. I like this stock a lot and it's been the only consistently good performing stock in my portfolio the last couple weeks.,YourLocalPugDealer,1,/r/RobinHoodPennyStocks/comments/mfagf8/whats_ahead_for_the_week_what_are_you_watching/gsnfp5w/,0.045,0.649,0.306,0.9313
32,CIDM, I think CIDM is still calming down a fair bit from its nft spike. It was already having a crackerjack year but I feel like there’s some rationalizing going on,Kidsturk,2,/r/RobinHoodPennyStocks/comments/mfagf8/whats_ahead_for_the_week_what_are_you_watching/gsn5grc/,0.0,0.773,0.227,0.6956
33,BNGO," Fucking BNGO and OCGN are so back and forth. Lucky to have avoided most of the negative swings, but damn if they aren’t annoying to get a feel for",Upping_The_Stakes,1,/r/RobinHoodPennyStocks/comments/mfagf8/whats_ahead_for_the_week_what_are_you_watching/gsnfrul/,0.312,0.636,0.053,-0.8549
34,OCGN," Fucking BNGO and OCGN are so back and forth. Lucky to have avoided most of the negative swings, but damn if they aren’t annoying to get a feel for",Upping_The_Stakes,1,/r/RobinHoodPennyStocks/comments/mfagf8/whats_ahead_for_the_week_what_are_you_watching/gsnfrul/,0.312,0.636,0.053,-0.8549
35,ZOM, It look like ZOM sell product before release. Sell 1st product 2 week ago. Price peak 2 week ago. Think the ship is gone. *Ooga booga*,FiendForPopeyes,9,/r/RobinHoodPennyStocks/comments/mfagf8/whats_ahead_for_the_week_what_are_you_watching/gsmolyg/,0.0,0.902,0.098,0.3612
36,SNDL, Made my first $1k off SNDL when it pushed to $4. I think it will always be a Rollercoaster!,JeepMunkee,1,/r/RobinHoodPennyStocks/comments/mfagf8/whats_ahead_for_the_week_what_are_you_watching/gsmq5sg/,0.0,1.0,0.0,0.0
37,GNUS, Same. Really regret buying GNUS when I did and praying for a decent exit point this week. Once I am outta that I am basically back in all cash.,OKJMaster44,1,/r/RobinHoodPennyStocks/comments/mfebpm/a_lot_of_hard_work_last_week_for_not_a_lot_back/gsocrwr/,0.108,0.804,0.087,-0.1513
38,GNUS, Hoping for a GNUS run with the Marvel deal to be announced tomorrow or Tuesday.,jackson5005bro,6,/r/RobinHoodPennyStocks/comments/mfd9vd/daily_discussion_thread/gsncur4/,0.0,0.682,0.318,0.6808
39,GNUS," Mostly cash atm outside of GNUS. I have no idea what pennies even have momentum anymore. So many are either flatlining or going down right now. 

I guess the one perk to all this is that many pennies that got gassed up way too much are now getting their prices checked back to an affordable range again. Many tickers like NSPR (however good they may be) are back under a dollar now.",OKJMaster44,1,/r/RobinHoodPennyStocks/comments/mfd9vd/daily_discussion_thread/gsoh9tp/,0.03,0.897,0.073,0.4939
40,NSPR," Mostly cash atm outside of GNUS. I have no idea what pennies even have momentum anymore. So many are either flatlining or going down right now. 

I guess the one perk to all this is that many pennies that got gassed up way too much are now getting their prices checked back to an affordable range again. Many tickers like NSPR (however good they may be) are back under a dollar now.",OKJMaster44,1,/r/RobinHoodPennyStocks/comments/mfd9vd/daily_discussion_thread/gsoh9tp/,0.03,0.897,0.073,0.4939
41,BBIG," I’m in CIDM, GNUS and BBIG",KyleLetsss34,1,/r/RobinHoodPennyStocks/comments/mfd9vd/daily_discussion_thread/gsoj8x8/,0.0,1.0,0.0,0.0
42,CIDM," I’m in CIDM, GNUS and BBIG",KyleLetsss34,1,/r/RobinHoodPennyStocks/comments/mfd9vd/daily_discussion_thread/gsoj8x8/,0.0,1.0,0.0,0.0
43,GNUS," I’m in CIDM, GNUS and BBIG",KyleLetsss34,1,/r/RobinHoodPennyStocks/comments/mfd9vd/daily_discussion_thread/gsoj8x8/,0.0,1.0,0.0,0.0
44,PT, Any thoughts on $yvr?  In the NFT space. Short squeeze candidate. PT of $22 on cnn. Looks promising on a couple angles. Stumbled across it on social media when it spiked last week.,MeesterReech,1,/r/RobinHoodPennyStocks/comments/mfd9vd/daily_discussion_thread/gsols2n/,0.0,0.92,0.08,0.4019
45,CPHI," True. CPHI is a low float Chinese stock that seems to be pumped frequently under Biden’s Administration. Last Friday, it was just .84, and after market hours, it went to 1.19. This morning, it hit 3.33, but now is at 2.1. Volume’s still up for potential growth.",GoofySkull,4,/r/RobinHoodPennyStocks/comments/mfknfk/cphi_enuff_said_biden_china_stocks/gso2cka/,0.031,0.863,0.106,0.5789
