,ticker,comment,username,score,permalink,neg,neu,pos,compound
422,RSI," I bought 17 grand in $300 9/17 puts at the end of the day today.  The sales are planned, but there has been only selling for a long time now.  Absolutely no insider buying. RSI is at 85 on the daily.  I doubt we get many new buyers at this level or higher, everyone knows this thing is out of control and I can't imagine theres much more positive news coming to push it further.  In my opinion, the runup of mega tech this week priced in exceptional earnings next week.  We saw FB and GOOG pop in sympathy with SNAP.  We know those earnings are going to be amazing, so the surprise is gone.  Microsoft is up 20% in a month and a half, GOOG is up 23% in the last 2 months, etc.   I think we're going to see a selloff like we did back in April right after tech earnings week, and MRNA is going to tank hard along with everything else.",NdSeIr,14,/r/wallstreetbets/comments/oqcbw2/moderna_ceo_cashing_out_is_it_a_red_flag/h6bkvat/,0.046,0.83,0.125,0.9434
423,SNAP," I bought 17 grand in $300 9/17 puts at the end of the day today.  The sales are planned, but there has been only selling for a long time now.  Absolutely no insider buying. RSI is at 85 on the daily.  I doubt we get many new buyers at this level or higher, everyone knows this thing is out of control and I can't imagine theres much more positive news coming to push it further.  In my opinion, the runup of mega tech this week priced in exceptional earnings next week.  We saw FB and GOOG pop in sympathy with SNAP.  We know those earnings are going to be amazing, so the surprise is gone.  Microsoft is up 20% in a month and a half, GOOG is up 23% in the last 2 months, etc.   I think we're going to see a selloff like we did back in April right after tech earnings week, and MRNA is going to tank hard along with everything else.",NdSeIr,14,/r/wallstreetbets/comments/oqcbw2/moderna_ceo_cashing_out_is_it_a_red_flag/h6bkvat/,0.046,0.83,0.125,0.9434
424,TA," I'd be terrified to short Moderna, and then watch it fly past 400 because let's be honest, nothing in the market makes sense anymore. Fuck TA and all other news and signals, it's just ludicrous. 

But am I eyeballing puts? Absolutely.",iosappsrock,7,/r/wallstreetbets/comments/oqcbw2/moderna_ceo_cashing_out_is_it_a_red_flag/h6bcqfx/,0.146,0.806,0.048,-0.5187
425,SPCE," I was just looking at their valuation and thinking how insane it is given their product lineup.  Puts on them are tempting, but I've never been a big fan of buying puts for some reason ( Except for SPCE puts around the flight since that was the most obvious free money opportunity ever ).  Might take a closer look, though.",KimuraFTW,3,/r/wallstreetbets/comments/oqcbw2/moderna_ceo_cashing_out_is_it_a_red_flag/h6bjwxv/,0.066,0.802,0.132,0.7411
426,MRNA, MRNA is a massive short. Problem is it can stay irrational for a bit. Wouldn’t be buying this one at all.,Rocky_The_Champion,2,/r/wallstreetbets/comments/oqcbw2/moderna_ceo_cashing_out_is_it_a_red_flag/h6ddrtc/,0.231,0.769,0.0,-0.6249
427,TSLA," it climbed recently because they got added to the S&P 500… which forced a lot of index funds to add MRNA’s shares to their index. same thing happened to TSLA when they were added to the S&P. it’s going to keep climbing until all these indexes finish buying shares 

it also climbed because of the delta variant",hardtoexplainnnnn,2,/r/wallstreetbets/comments/oqcbw2/moderna_ceo_cashing_out_is_it_a_red_flag/h6bptew/,0.05,0.877,0.073,0.1027
428,NKLA," I dont buy puts on any company in this market. One of my worst losses is puts on NKLA, an out and out fraudulent company. When that went tits up, I'm done until someone takes JPOWs printer away",RussetGold,1,/r/wallstreetbets/comments/oqcbw2/moderna_ceo_cashing_out_is_it_a_red_flag/h6d3g7q/,0.265,0.735,0.0,-0.8979
429,FB," MRNA will need a market selloff to drop. That's the only way MRNA drops right now too. You'll know by this week if we see SPY back to its 50-day moving average. I have FB 370 calls, but I'm only playing this one up to its earnings. There's no holding it through earnings at all the way these tech stocks have moved. You might even make money on MSFT puts, and then swapping to calls 2-3 days after the report.",option-trader,1,/r/wallstreetbets/comments/oqcbw2/moderna_ceo_cashing_out_is_it_a_red_flag/h6d74q1/,0.053,0.92,0.027,-0.2846
430,MRNA," MRNA will need a market selloff to drop. That's the only way MRNA drops right now too. You'll know by this week if we see SPY back to its 50-day moving average. I have FB 370 calls, but I'm only playing this one up to its earnings. There's no holding it through earnings at all the way these tech stocks have moved. You might even make money on MSFT puts, and then swapping to calls 2-3 days after the report.",option-trader,1,/r/wallstreetbets/comments/oqcbw2/moderna_ceo_cashing_out_is_it_a_red_flag/h6d74q1/,0.053,0.92,0.027,-0.2846
431,MSFT," MRNA will need a market selloff to drop. That's the only way MRNA drops right now too. You'll know by this week if we see SPY back to its 50-day moving average. I have FB 370 calls, but I'm only playing this one up to its earnings. There's no holding it through earnings at all the way these tech stocks have moved. You might even make money on MSFT puts, and then swapping to calls 2-3 days after the report.",option-trader,1,/r/wallstreetbets/comments/oqcbw2/moderna_ceo_cashing_out_is_it_a_red_flag/h6d74q1/,0.053,0.92,0.027,-0.2846
432,MRNA," Exactly, look at the price now: it's around 350.
A P/E ratio of around 280 and a forward P/E of 20 with expectations of earnings going down year after year once covid is dealt with... It's not like they have some kind of somewhat stable, predictable growth trajectory unless other products in their pipeline get approved eventually. And by now there are plenty of other covid vaccines available as well, so a third/fourth/fifth wave wont make them that much more money either I'd guess.

You know something is way overpriced when even the most bullish of the permabull sell side analysts have a PT of roughly 10% under the current price (avg. being around 200, low end 100).

Sure, MRNA may still go up a bit on nothing but FOMO - this being wsb after all. But going long at this price looks like a surefire way to become bagholder for a long, long time.",foundnoname,2,/r/wallstreetbets/comments/oqcbw2/moderna_ceo_cashing_out_is_it_a_red_flag/h6cmysu/,0.037,0.893,0.069,0.45
433,PT," Exactly, look at the price now: it's around 350.
A P/E ratio of around 280 and a forward P/E of 20 with expectations of earnings going down year after year once covid is dealt with... It's not like they have some kind of somewhat stable, predictable growth trajectory unless other products in their pipeline get approved eventually. And by now there are plenty of other covid vaccines available as well, so a third/fourth/fifth wave wont make them that much more money either I'd guess.

You know something is way overpriced when even the most bullish of the permabull sell side analysts have a PT of roughly 10% under the current price (avg. being around 200, low end 100).

Sure, MRNA may still go up a bit on nothing but FOMO - this being wsb after all. But going long at this price looks like a surefire way to become bagholder for a long, long time.",foundnoname,2,/r/wallstreetbets/comments/oqcbw2/moderna_ceo_cashing_out_is_it_a_red_flag/h6cmysu/,0.037,0.893,0.069,0.45
434,TSLA," Actually, you need to check your info. Stocks tend to do very well leading up to index addition, and then poorly afterwards. It’s well known that the indexers will have to buy, so people trade that, bidding it up before addition. After forced buying ends, new additions tend to perform very poorly. See TSLA.",MrRikleman,1,/r/wallstreetbets/comments/oqcbw2/moderna_ceo_cashing_out_is_it_a_red_flag/h6deaze/,0.051,0.868,0.081,0.1989
435,MRNA," Well, He has Aug 20 $300 puts. MRNA is not going to drop below $300 on its own from now until August 20. It's going to need the market's help. On its own, what you say may come true 3-4 years from now after everyone in it realizes that what you said is actually true. As for OP, MRNA isn't touching $300 unless the market tumbles too.",option-trader,0,/r/wallstreetbets/comments/oqcbw2/moderna_ceo_cashing_out_is_it_a_red_flag/h6d6r0u/,0.0,0.835,0.165,0.8811
436,MRNA," PFE also has a float more than 15x the size of MRNA and is valued 66% more. Also, the fact that there is much more to PFE than its covid vaccine while for MRNA that is the main driver means that a demand for vaccines and new contracts for MRNA means a lot more to their value as a company than it does PFE. 

I’m with you on looking for a pullback, but I’m personally waiting on some signs of exhaustion and reversal, which looked like it was coming Tuesday, then buyers came back in force to close out the week. Waiting to see what Monday holds.",1000bctrades,2,/r/wallstreetbets/comments/oqcbw2/moderna_ceo_cashing_out_is_it_a_red_flag/h6b4p1h/,0.041,0.894,0.065,0.3678
437,PFE," PFE also has a float more than 15x the size of MRNA and is valued 66% more. Also, the fact that there is much more to PFE than its covid vaccine while for MRNA that is the main driver means that a demand for vaccines and new contracts for MRNA means a lot more to their value as a company than it does PFE. 

I’m with you on looking for a pullback, but I’m personally waiting on some signs of exhaustion and reversal, which looked like it was coming Tuesday, then buyers came back in force to close out the week. Waiting to see what Monday holds.",1000bctrades,2,/r/wallstreetbets/comments/oqcbw2/moderna_ceo_cashing_out_is_it_a_red_flag/h6b4p1h/,0.041,0.894,0.065,0.3678
438,PFE," They also have studies in Israel pegging efficacy against delta at 39%, PFE that is",ScarabLordOmar,1,/r/wallstreetbets/comments/oqcbw2/moderna_ceo_cashing_out_is_it_a_red_flag/h6b8y1n/,0.0,1.0,0.0,0.0
439,MRNA," That's one hell of a risky assumption IMHO. MRNA ist a 350 now, 300 is only a 14% drop. Considering it dropped 14% to < 300 in a matter of minutes last Tuesday on nothing but an unconfirmed Twitter rumor or something before ramping up another 20% from Wednesday into Fridays close... Swings like that are just another day ending in Y with MRNA.
Also, they're reporting on Aug 5th. Personally, I wouldn't be surprised if they either dropped back to 150 by 20th or ramp to 500 on more FOMO. Hell, MRNA hasn't been trading at > 300 at any time before this week. But what do I know, stonks only go up right?",foundnoname,2,/r/wallstreetbets/comments/oqcbw2/moderna_ceo_cashing_out_is_it_a_red_flag/h6docgg/,0.123,0.828,0.049,-0.8661
440,MRNA, Stephane Bancel MRNA CEO made 6 individual sales in December 1st-17th with EUA approval coming on 18th,ScarabLordOmar,3,/r/wallstreetbets/comments/oqcbw2/moderna_ceo_cashing_out_is_it_a_red_flag/h6b8p7p/,0.0,0.829,0.171,0.4767
441,MRNA," That'll be harder, because of MRNA's inclusion into the SP500, many large funds had to buy it, and that's been keeping the stock elevated. You would need the market's help to push MRNA down back below $300 by August 20. As the news die down, you might be able to see MRNA slowly trend back to $300, but that takes time like 2-3 months, because there are always bounces within the trend.",option-trader,1,/r/wallstreetbets/comments/oqcbw2/moderna_ceo_cashing_out_is_it_a_red_flag/h6dgapm/,0.032,0.901,0.067,0.3919
442,AMC," I do practically the same thing except a tad bit less diversified.

90% gme
8% AMC
2% daily spy calls",Complete_Break1319,1,/r/wallstreetbets/comments/oqdkg8/so_you_made_some_money_on_a_yolo_and_now_you_want/h6eehr9/,0.0,1.0,0.0,0.0
443,TD," Platforms have this (scanners, etc) built in. Not an endorsement, but I know for sure ETrade and TD Ameritrade both do.",ArthurSipka,1,/r/wallstreetbets/comments/oqdkg8/so_you_made_some_money_on_a_yolo_and_now_you_want/h6crkak/,0.066,0.802,0.132,0.3546
444,CLNE," Right now, CLNE is holding major support at around 7.50   you can see that this support held 9 months ago and from there it continued up.  If it breaks down from here and continues to move down, only you know if you could stomach more pain or just cut your loss (it's what I would do) take some time off, and go to the next trade. Much luck!",SilverWolfVs1,3,/r/wallstreetbets/comments/oqe2eb/clne_bag_holders_whats_your_end_of_year_prediction/h6c0mp0/,0.104,0.782,0.113,0.1776
445,GF," Massively beneficial company in it's first deployment phase, if amazon contract is a success expect massive increase is value, probably won't happen this year but when the US actually invests in green energy, this will be poised to dominate the market, they can turn every truck in the us carbon neutral without having to overhaul every engine. People on wsb have no patience. Moon might not be tomorrow, but you can feel good about investing in a decent company. 

Not financial advice, GF works in RNG, knows this is a strong company in early growth phase.",Illuscio,5,/r/wallstreetbets/comments/oqe2eb/clne_bag_holders_whats_your_end_of_year_prediction/h6dcidw/,0.041,0.727,0.232,0.9601
446,RNG," Massively beneficial company in it's first deployment phase, if amazon contract is a success expect massive increase is value, probably won't happen this year but when the US actually invests in green energy, this will be poised to dominate the market, they can turn every truck in the us carbon neutral without having to overhaul every engine. People on wsb have no patience. Moon might not be tomorrow, but you can feel good about investing in a decent company. 

Not financial advice, GF works in RNG, knows this is a strong company in early growth phase.",Illuscio,5,/r/wallstreetbets/comments/oqe2eb/clne_bag_holders_whats_your_end_of_year_prediction/h6dcidw/,0.041,0.727,0.232,0.9601
447,AMC, Holding onto 100 shares. I’ve been writing covered calls but at this point I’m so far away from my cost basis ($10.99) the premiums just aren’t worth it. Considering selling and using the loss to offset gains from AMC and GME. Losses aren’t a bad thing if it helps you cover taxes from gains I guess….,CouchF0X,2,/r/wallstreetbets/comments/oqe2eb/clne_bag_holders_whats_your_end_of_year_prediction/h6c0jiv/,0.159,0.65,0.191,0.0772
448,GME, Holding onto 100 shares. I’ve been writing covered calls but at this point I’m so far away from my cost basis ($10.99) the premiums just aren’t worth it. Considering selling and using the loss to offset gains from AMC and GME. Losses aren’t a bad thing if it helps you cover taxes from gains I guess….,CouchF0X,2,/r/wallstreetbets/comments/oqe2eb/clne_bag_holders_whats_your_end_of_year_prediction/h6c0jiv/,0.159,0.65,0.191,0.0772
449,PT, PT $25 🦍,HoochiePants,2,/r/wallstreetbets/comments/oqe2eb/clne_bag_holders_whats_your_end_of_year_prediction/h6bjnd1/,0.0,1.0,0.0,0.0
450,CLNE," > lord this stock is a turd. And I’m a huge idiot for buying calls on it. I can’t be the only one with a hole burning in my account. Do you think thi

I'm selling Covered Calls on CLNE and making really really quickly.   
Please Send help.",PlumJuiceDrink,2,/r/wallstreetbets/comments/oqe2eb/clne_bag_holders_whats_your_end_of_year_prediction/h6cjn92/,0.066,0.778,0.156,0.5487
451,CLNE," Correct! Meme stocks are all pump and dumps, and if you get in at the right time, great. If not, don't get your hopes up. Yes, the ""big two"" may yet see future pumps out of sheer cult following, but the smaller ones have all already had massive 200-500% pumps and they will never recover those highs. 

The reason these companies are shorted is because they're trash companies with poor profit. 

I was dumb enough to buy UWMC, and thank God I sold out at like 7% loss or I would be down about 30% right now. 

CLNE is trash, UWMC is trash, TLRY is unbelievably trash. All of them really. 

And honestly, why buy pump and dump stocks when you can buy spy puts and calls and make free money anyway. Lol",iosappsrock,6,/r/wallstreetbets/comments/oqe2eb/clne_bag_holders_whats_your_end_of_year_prediction/h6bbn2f/,0.113,0.702,0.185,0.9152
452,TLRY," Correct! Meme stocks are all pump and dumps, and if you get in at the right time, great. If not, don't get your hopes up. Yes, the ""big two"" may yet see future pumps out of sheer cult following, but the smaller ones have all already had massive 200-500% pumps and they will never recover those highs. 

The reason these companies are shorted is because they're trash companies with poor profit. 

I was dumb enough to buy UWMC, and thank God I sold out at like 7% loss or I would be down about 30% right now. 

CLNE is trash, UWMC is trash, TLRY is unbelievably trash. All of them really. 

And honestly, why buy pump and dump stocks when you can buy spy puts and calls and make free money anyway. Lol",iosappsrock,6,/r/wallstreetbets/comments/oqe2eb/clne_bag_holders_whats_your_end_of_year_prediction/h6bbn2f/,0.113,0.702,0.185,0.9152
453,UWMC," Correct! Meme stocks are all pump and dumps, and if you get in at the right time, great. If not, don't get your hopes up. Yes, the ""big two"" may yet see future pumps out of sheer cult following, but the smaller ones have all already had massive 200-500% pumps and they will never recover those highs. 

The reason these companies are shorted is because they're trash companies with poor profit. 

I was dumb enough to buy UWMC, and thank God I sold out at like 7% loss or I would be down about 30% right now. 

CLNE is trash, UWMC is trash, TLRY is unbelievably trash. All of them really. 

And honestly, why buy pump and dump stocks when you can buy spy puts and calls and make free money anyway. Lol",iosappsrock,6,/r/wallstreetbets/comments/oqe2eb/clne_bag_holders_whats_your_end_of_year_prediction/h6bbn2f/,0.113,0.702,0.185,0.9152
454,BE," Lol youre fine,  you literally have ~18 months left on the option and PLTR was trading above your BE barely a month ago. Just sell FD’s to
hedge your downside in the meantime",Appropriate_Tap_7045,56,/r/wallstreetbets/comments/oqvsxh/palantir_leap_calls_how_fucked_am_i/h6e61xx/,0.056,0.815,0.129,0.3818
455,PLTR," Lol youre fine,  you literally have ~18 months left on the option and PLTR was trading above your BE barely a month ago. Just sell FD’s to
hedge your downside in the meantime",Appropriate_Tap_7045,56,/r/wallstreetbets/comments/oqvsxh/palantir_leap_calls_how_fucked_am_i/h6e61xx/,0.056,0.815,0.129,0.3818
456,PLTR," OP: I bought PLTR Leaps.

Me: Oh cool, so now you can sell a bunch of covered calls for premium each week.

OP: 

Me: You are selling covered calls... right?",BeardlessPete,1,/r/wallstreetbets/comments/oqvsxh/palantir_leap_calls_how_fucked_am_i/h6ef235/,0.0,0.922,0.078,0.3182
457,OXY," I see. I will look into long vertical spreads. From what i understand, I own a 9/17 OXY $31 call. So If i sell a 8/20 $33 call I get the premium and if the 8/20 $33 calls expires ITM I get a Profit of 33-31= $200. If it expires OTM Nothing happens and i get free premium. Now what I dont get is how the long dated call acts as collateral for the shorter dated call I write. So by 8/20 if OXY is above $33 I will have to cover my 8/20 $33 call. Does that means my 9/17 $31 call will get automatically exercised so I have shares to cover? The problem is I dont have the capital to exercise my 9/17 $31 call.",WSuni8,2,/r/wallstreetbets/comments/oqvsxh/palantir_leap_calls_how_fucked_am_i/h6ed7lu/,0.023,0.904,0.073,0.7165
458,TLRY," It's solid speculation but it's based on the premise that TLRY will see a resurgence. What do you anticipate the catalyst being that will drive the share price increase? Other than news that legalization legislation will get a vote, I don't see anything in the shirt term that will drive TLRY on another run. It's a good play, math checks out, but I'm not sure the growth is there.",sufcitybbq,1,/r/wallstreetbets/comments/oqfz3b/tlry_vertical_option_play_for_1550_possible/h6bgmam/,0.068,0.751,0.181,0.8308
459,TLRY," So do you think if I still want to bet on another spike happening for TLRY and sell then, I should stick with the LEAPs I already have instead of converting them to verticals?",gggggggghhhhhhhhh,1,/r/wallstreetbets/comments/oqfz3b/tlry_vertical_option_play_for_1550_possible/h6biygc/,0.0,0.958,0.042,0.0772
460,ATH," Stick with single calls, they will be much more flexible than a spread.  I’m not great at this tho.

I opened 68.5/69c on SNAP for 7/30 0.25

The price immediately dropped a couple dollars that day and stayed down until earnings.  Today even at ATH they were only worth 80% of what they could be.

You can exercise your call anytime you want.  And then you can sell those shares.  That’s why it will be valuable to you if you think there is a spike.  Or anyone else.  That’s why it will respond in price in a 1:1 basis above BE.",Meow_Star_,3,/r/wallstreetbets/comments/oqfz3b/tlry_vertical_option_play_for_1550_possible/h6blhcf/,0.032,0.865,0.103,0.6596
461,BE," Stick with single calls, they will be much more flexible than a spread.  I’m not great at this tho.

I opened 68.5/69c on SNAP for 7/30 0.25

The price immediately dropped a couple dollars that day and stayed down until earnings.  Today even at ATH they were only worth 80% of what they could be.

You can exercise your call anytime you want.  And then you can sell those shares.  That’s why it will be valuable to you if you think there is a spike.  Or anyone else.  That’s why it will respond in price in a 1:1 basis above BE.",Meow_Star_,3,/r/wallstreetbets/comments/oqfz3b/tlry_vertical_option_play_for_1550_possible/h6blhcf/,0.032,0.865,0.103,0.6596
462,SNAP," Stick with single calls, they will be much more flexible than a spread.  I’m not great at this tho.

I opened 68.5/69c on SNAP for 7/30 0.25

The price immediately dropped a couple dollars that day and stayed down until earnings.  Today even at ATH they were only worth 80% of what they could be.

You can exercise your call anytime you want.  And then you can sell those shares.  That’s why it will be valuable to you if you think there is a spike.  Or anyone else.  That’s why it will respond in price in a 1:1 basis above BE.",Meow_Star_,3,/r/wallstreetbets/comments/oqfz3b/tlry_vertical_option_play_for_1550_possible/h6blhcf/,0.032,0.865,0.103,0.6596
463,OR," with all the evictions coming up and people getting all their stuff thrown out to the garbage looks like I have a decision keep having my life with my job and new car and eating better then 90% of Americans and having sex once a month gambling on stocks

OR

start shooting up Crystal Meth
again and dumpster dive 24/7
and having sex with everyone all the time with no stress no responsibility",yolandis_cervix,19,/r/wallstreetbets/comments/oqqgb3/tenants_at_risk_for_eviction_as_pandemic/h6dp446/,0.113,0.818,0.069,-0.34
464,CLF, South Africa going crazy yo: https://youtu.be/JevGPfr7TvE I might sell my shit and wait for a flash crash and buy back into CLF yo.,Master_Proposal_3614,2,/r/wallstreetbets/comments/oqqgb3/tenants_at_risk_for_eviction_as_pandemic/h6ee0r6/,0.326,0.674,0.0,-0.8271
465,CLNE, CLNE cleaned me out better than a colonoscopy prep. But its fine because I liked the company! 🤣🤣🤣,StoryRadiant1919,6,/r/wallstreetbets/comments/oqwy9x/its_hilarious_to_me_when_people_say_theyre_buying/h6egn47/,0.0,0.615,0.385,0.7988
466,AMC," But I really do like AMC and Taco Bell, and sorry sir but my best decisions were made when I was drunk. This is the way!",AlRanger06,5,/r/wallstreetbets/comments/oqwy9x/its_hilarious_to_me_when_people_say_theyre_buying/h6efx87/,0.133,0.583,0.284,0.8025
467,CLOV," I hate CLOV, but I love money.. so I own a lot of clov and I’m short 500 $9 aug 20 puts",professorPut,0,/r/wallstreetbets/comments/oqwy9x/its_hilarious_to_me_when_people_say_theyre_buying/h6efsxz/,0.097,0.663,0.24,0.6652
468,DD," Your DD is trash based on zero discussion of competitors in the small-to-medium payload space and zero discussion of metrics. Rocket Lab shits all over Astra based on launch track record and government contracts alone, I'm not even invested in the space and I know that.",ihasanemail,3,/r/wallstreetbets/comments/oqsj1z/astra_space_astr/h6eaiwb/,0.106,0.894,0.0,-0.6249
469,DD, This is poorly written DD by an obvious bagholder,geniusmanchild,3,/r/wallstreetbets/comments/oqsj1z/astra_space_astr/h6e05fc/,0.0,1.0,0.0,0.0
470,DD, Appreciate the DD. But this shit is going sideways forever. I might just get bored and sell all.,TraderNineZero,4,/r/wallstreetbets/comments/oqx6ju/crsr_another_valuation_opinion/h6eiy0t/,0.35,0.574,0.076,-0.826
471,DD," So yeah, we prop up the price again for the ??? (I lost count) time, so my boys over at Eager fuckery can sell their part yet again at a higher price.. yeah fuck that, I'm bag holding crsr at 37 USD average now. Don't really mind it since I love the company, but kinda out of merit for this one until I see some real DD =/",FameTrigger,1,/r/wallstreetbets/comments/oqx6ju/crsr_another_valuation_opinion/h6emf78/,0.092,0.753,0.154,0.5701
472,ET, Almost all of them. ET is likely getting out big as expected of a PE firm that's 5-6x their money,longGERN,1,/r/wallstreetbets/comments/oqx6ju/crsr_another_valuation_opinion/h6eg7b6/,0.0,1.0,0.0,0.0
473,DD," Submitting this was painful as seen by my multiple attempts in the previous DD, so I really hope it’s of use to some of you.",BeardedBro_,9,/r/wallstreetbets/comments/oqkuqt/an_analysis_of_the_national_defense_authorization/h6cb9eu/,0.102,0.775,0.122,0.1459
474,BA, BA and LMT LEAP it is. Holly shit now woman can be draft too ...🤔,dennis8542,7,/r/wallstreetbets/comments/oqkuqt/an_analysis_of_the_national_defense_authorization/h6cbkql/,0.205,0.795,0.0,-0.5574
475,LMT, BA and LMT LEAP it is. Holly shit now woman can be draft too ...🤔,dennis8542,7,/r/wallstreetbets/comments/oqkuqt/an_analysis_of_the_national_defense_authorization/h6cbkql/,0.205,0.795,0.0,-0.5574
