,ticker,comment,username,score,permalink,neg,neu,pos,compound
74,USA," ![gif](emote|free_emotes_pack|upvote)**Absolutly!** ![gif](emote|free_emotes_pack|upvote)

I buyed as well HALO Col. INC., also the Aspermont Stock. These 2 stocks are the coming big one's

About HALO - Now USA got Biden, and i know HALO is an canadian company, but the good thing is that Biden will try to make the THC great again. 

So, at this point i want to say, that i believe in HALO's work and the coming future for it. 

![gif](emote|free_emotes_pack|upvote)**If you think the same, give this post an hard up vote.**![gif](emote|free_emotes_pack|upvote)

&#x200B;

![gif](giphy|h26f7dQPNqXRjAb54O)",BanginTrade23,0,/r/pennystocks/comments/lzbhda/i_do_apologize_sir/gq1slud/,0.018,0.829,0.153,0.9196
75,CEO," The recent was 20k bought, then its sell after sell until Arnold Alred. Total sell off is 2,250,000 within the 3-4 month range but data could be missing or not updated. No matter how you cut it there is more massive sell off than there is buy and that’s especially bad not only for the stock price but because the CEO does not appear to be buying in order to stop the bleed.

So unless you are planning on bag holding for a year or more then it’s really not good news.",FallenZulu,1,/r/pennystocks/comments/lzbhda/i_do_apologize_sir/gq4h1zn/,0.173,0.805,0.022,-0.9408
76,FR," FR Dude, I felt so doubtful before but now I am  have just decided to let it ride.",lukefasc,2,/r/pennystocks/comments/lzdmb5/big_dick_gains/gq24h36/,0.121,0.879,0.0,-0.2635
77,EYES," People who held onto EYES, you did it. 

I’m interested for tomorrow with the FDA approval where I’m sure the price will not drop for a while.",waitmyhonor,6,/r/pennystocks/comments/lzj18r/the_lounge_thoughts_noob_stuff_low_effort_brokers/gq3i5cn/,0.0,0.689,0.311,0.8366
78,CTXR," Trying not to laugh at my own goofiness at the moment. Been waiting a month for CTXR to pop when oil etfs like ERX has gained $10+ in a damn month..

Also for you Weed stockers..CircleK just bought a big chunk of debt via share stake in Fire and Flower Holdings (FFLWF)...When you think about all the retail locations that CircleK owns, the potential is there for a great partnership.",CadderlySoaring,4,/r/pennystocks/comments/lzj18r/the_lounge_thoughts_noob_stuff_low_effort_brokers/gq4eajr/,0.132,0.726,0.143,0.2206
79,DD," Hey there. Noob here. I've been isolating for quite a while and decided I wanted to start trading to fill my time (so much more productive than browsing amazon haha) and to start building capital. I started with some penny stocks in my WS personal account and now I'd like to pack my WS TFSA with some less-risky long-term growth potential to offset my risk. Curious if anyone has some advice on some companies/assets I can/should DD (also, why do you like them?). Also, would love some advice on what the better options are in this mission with regards to things like bonds/hedges/dividends/etc.... To start I have a couple grand I'd like to use in the TFSA and then I plan to funnel the rest in through earnings throughout the year until my room is full. I know that this is a penny stocks sub, but as I've read penny traders commonly offset risk with lower-risk longterm investments, I felt this was a good place to start my research. Any advice in this matter would be much appreciated. Cheers!",SimpleBarman,5,/r/pennystocks/comments/lzj18r/the_lounge_thoughts_noob_stuff_low_effort_brokers/gq3qath/,0.028,0.795,0.177,0.972
80,TFSA," Hey there. Noob here. I've been isolating for quite a while and decided I wanted to start trading to fill my time (so much more productive than browsing amazon haha) and to start building capital. I started with some penny stocks in my WS personal account and now I'd like to pack my WS TFSA with some less-risky long-term growth potential to offset my risk. Curious if anyone has some advice on some companies/assets I can/should DD (also, why do you like them?). Also, would love some advice on what the better options are in this mission with regards to things like bonds/hedges/dividends/etc.... To start I have a couple grand I'd like to use in the TFSA and then I plan to funnel the rest in through earnings throughout the year until my room is full. I know that this is a penny stocks sub, but as I've read penny traders commonly offset risk with lower-risk longterm investments, I felt this was a good place to start my research. Any advice in this matter would be much appreciated. Cheers!",SimpleBarman,5,/r/pennystocks/comments/lzj18r/the_lounge_thoughts_noob_stuff_low_effort_brokers/gq3qath/,0.028,0.795,0.177,0.972
81,DD," Any thoughts on Stocktwits selling bullish/bearish hashtags?  I heard about it last week, but I suck at technology, so it couldn’t find the thread, but someone finally posted it this morning so I could read it.  I’m a noob on SW, and it’s actually been helpful in my finding additional DD on one stock I really like, but damn.  That’s really disappointing they’re pulling this kinda bullhonky.",adudereadingthings,3,/r/pennystocks/comments/lzj18r/the_lounge_thoughts_noob_stuff_low_effort_brokers/gq3ixx0/,0.179,0.725,0.096,-0.754
82,CEO," Draganfly is the best pure play drone company to invest in. 

18 patents with their latest being a center of gravity focused vertical take off and landing, meaning the cargo stays completely horizontal during take off and landing. They patented this meaning they invented and now own the technology and it works.

Partnership with Apple co founder Steve Wozniak and his education company WozEd

Partnership with AgEagle (UAVS) through Micasense

Partnership with cold chain distribution who works with big pharma companies for vaccine distribution 

Nasdaq up listing coming soon

Have been working on their drones since 1998. 

Transparent CEO who is very easy to listen to. 

YouTube.com/draganfly 

YouTube.com/cameronchell

https://youtu.be/HXY6ZyBz6HU

Draganfly.com way cleaner more transparent website and this company just has the drone solution to pretty much anything, while they still work to find solutions as companies come to them with problems. Way ahead of every other drone company in their technology in my opinion, except possibly Amazon

But in around 2 in my opinion this has 5 x upside potential for the year especially once they get the nasdaq uplisting",imakenomoneyLOL,2,/r/pennystocks/comments/lzj18r/the_lounge_thoughts_noob_stuff_low_effort_brokers/gq3lozm/,0.014,0.866,0.12,0.9538
83,ACRX, Hopefully Zom and Bngo recovers this weeks. Also hoping ACRX shows some positivity in its life,ShibinFU,2,/r/pennystocks/comments/lzj18r/the_lounge_thoughts_noob_stuff_low_effort_brokers/gq2pbgf/,0.0,0.596,0.404,0.8316
84,ZOM," I think that the biggest reason that the ZOM will succeed is the fact that loads of people use dogs as substitutes for kids, and that the number of such pet owners will increase throughout the world.",Silver-Huckleberry-9,2,/r/pennystocks/comments/lzj18r/the_lounge_thoughts_noob_stuff_low_effort_brokers/gq3jx1c/,0.0,0.829,0.171,0.7003
85,CHPT, Thoughts on CHPT... Is it a buy right now?,ClappN_CheeX,1,/r/pennystocks/comments/lzj18r/the_lounge_thoughts_noob_stuff_low_effort_brokers/gq2pzie/,0.0,1.0,0.0,0.0
86,TDA, Can someone help me out with Schwab? I’ve had TDA for the awhile but I opened Schwab to save on the transaction fees. I’ve had it funded for a week but it’s always claiming there’s not enough money to buy penny stocks. I bought a different one just to see if I could and it let me. Is there a long delay each time there’s an attempted transaction?,jimdotcom413,1,/r/pennystocks/comments/lzj18r/the_lounge_thoughts_noob_stuff_low_effort_brokers/gq2qfxv/,0.043,0.862,0.095,0.5514
87,DD," I agree, which isn’t to say there aren’t some great long term holds out there, but tbh if those were shooting up it was more likely getting pumped than on fundamentals.

I only have one penny stock in my portfolio at the moment. I have looked at some others on here and when doing some DD seem they’re in debt, barely turning a profit (if at all) and the stock price is shooting way above. So far all of them have crashed down to less than they were before. Tempting to try and ride the way but rather not bag hold penny stocks. At least with other established companies in comfortable believing they won’t go out of business within the year.",Narradisall,2,/r/pennystocks/comments/lzj18r/the_lounge_thoughts_noob_stuff_low_effort_brokers/gq2y2mf/,0.026,0.879,0.096,0.8374
88,DD," Ark-invest.com is probably the best thing you can offset your pennies with. Start by doing your DD on Cathie wood and the things she has to say about disruptive innovation and where the future is headed, which is what she and the investment company based their investments on. Has gained a huge following recently and many have based their investments solely around her and her companies ideologies on investing, which has definitely taken a new age approach in disruptive technology opposed to the previous way of investing based on earnings and such, which is obviously still a thing but Cathie has given us a new era.",imakenomoneyLOL,1,/r/pennystocks/comments/lzj18r/the_lounge_thoughts_noob_stuff_low_effort_brokers/gq3sht2/,0.031,0.88,0.09,0.6597
89,BNGO," I’m not scared just no cash, I’d be buying the dips. BNGO, NIO, and Plug might be good stocks  to buy right now, they were 60$, now they’re 40$. BNGO was 15$, now it’s at 8$.
I’d wait a few minutes for another pullback though we might not be done.",DreamingGurl88,1,/r/pennystocks/comments/lzj18r/the_lounge_thoughts_noob_stuff_low_effort_brokers/gq4tirv/,0.0,0.865,0.135,0.7347
90,NIO," I’m not scared just no cash, I’d be buying the dips. BNGO, NIO, and Plug might be good stocks  to buy right now, they were 60$, now they’re 40$. BNGO was 15$, now it’s at 8$.
I’d wait a few minutes for another pullback though we might not be done.",DreamingGurl88,1,/r/pennystocks/comments/lzj18r/the_lounge_thoughts_noob_stuff_low_effort_brokers/gq4tirv/,0.0,0.865,0.135,0.7347
91,CO," I actually took some time to look at your suggestion. I am in complete agreement with you. This is exactly the kind of stock I'm looking for That I've listed below your post.  Lower PE, Doesn't have billions of shares and a decent  Float. I might very well test the waters with this on Monday and look to add throughout the week as we see what it does. Its price has been really erratic with a couple spikes... Not sure what that's about but I'm hoping post CO vid that this levels out and will start seeing a spike in their  Price. I would think they should be at least A10 PE Yes not more which should mean this should be well over double. Thanks for bringing it to the attention. I think I'll post this On the other smaller reddit penny stock labia",Bdbert1199,1,/r/pennystocks/comments/lzj18r/the_lounge_thoughts_noob_stuff_low_effort_brokers/gq2vvta/,0.021,0.849,0.131,0.9477
92,SENS," I like ZHUD. I want them to crater so I can buy in super cheap but probably not gonna happen. I’ll still buy in after the blood bath is over, because I love me some clean-energy stocks, especially when they’re backed by a state-owned, fascist/pseudo-capitalist regime. Lots of potential there indeed. 

SENS somewhat matches your criteria. I’m also bullish on CWGYF. I like supporting green energy OTCs. If I lose then meh. But if I make a stupid good bet and win, it’s lambos for the fam.",Hobbitfeetinmyass,1,/r/pennystocks/comments/lzj18r/the_lounge_thoughts_noob_stuff_low_effort_brokers/gq2r8lh/,0.09,0.613,0.297,0.9678
93,EYES," Imo consolidation is after a big run up volume tapers off and it finds a bottom where people are willing to buy the stock at and set some buying walls so it holds whatever position it consolidated at. Sideways trending is pretty much as it sounds, basically not really going up or going down much for long periods of time, due to no volume people just don’t want to buy the stock company is at a standstill something like that. Like the Japanese stock exchange has been sideways trending for years and years. Where something like you would say the EYES stock on Friday consolidated around the 5-6 after that huge run up to 9 and therefore after consolidation had another nice run up to the 7 8s. Consolidation is a day trading term while sideways trending you don’t really hear too much of as most stocks don’t usually trade sideways or not really moving much up or down for extended periods of time. Or something like that",imakenomoneyLOL,5,/r/pennystocks/comments/lzj18r/the_lounge_thoughts_noob_stuff_low_effort_brokers/gq41kan/,0.013,0.875,0.112,0.9371
94,CEO," Here's what I don't understand about doing some research on MRNJ: For a company that was dealing with Btc back in 2018 how is the sp only .0025? I read up on the CEO and he's been instrumental at growing businesses, along with his shared patent back in 2009, but to be in the btc game back in Jan of 2018 you'd think this company would've soared. It's good to see that they are getting current with their filings, which I'm still looking into but if they used their own philosophy back in 2018 and actually applied it and held onto btc then you'd like this company would be pretty valuable. 

&#x200B;

Definitely like this AZFL play as well. Trying to do some research on it as well. Thanks for the tips!",TopGolfMike,2,/r/pennystocks/comments/lzj18r/the_lounge_thoughts_noob_stuff_low_effort_brokers/gq4avfw/,0.0,0.755,0.245,0.989
95,DD," Agreed. Only have one penny right now. Not gonna say what it is because I'm not advertising anything.

Also if I read one more DD post that starts with ""Hey I'm a noob, and I've only been trading since late January/GME""  ....

It's everybody for themselves now. We all gotta do our own DD, because the quality on here is shit now. Seems like all the people who do substantive DD are taking a break from Reddit until post-GME retail craze is over

In the meantime it's just gonna be a lot of people advertising pump and dumps, that have already been dumped as the next breakout, get rich now company",napoelonDynaMighty,4,/r/pennystocks/comments/lzj18r/the_lounge_thoughts_noob_stuff_low_effort_brokers/gq2ypfr/,0.099,0.832,0.069,-0.3818
96,DD," I’ve seen quite a bit of groupthink for sure.  There’s some very naivety going as those folks tie success in the market directly to the number of followers of a particular stock.  Lots of pumpers followed up with a lot of trolls.  I’ve found some good DD that I wasn’t able to find other locations, tho.  It’s kind of like reading the news these days.  Find the facts within the story and ignore the noise.",adudereadingthings,1,/r/pennystocks/comments/lzj18r/the_lounge_thoughts_noob_stuff_low_effort_brokers/gq4kjwc/,0.031,0.813,0.155,0.8363
97,CEO," Conversation with the CEO of winkf and CEO of DFLY here: 

https://youtu.be/ytUcsc5ZgJU",imakenomoneyLOL,2,/r/pennystocks/comments/lzj18r/the_lounge_thoughts_noob_stuff_low_effort_brokers/gq4ib5y/,0.0,1.0,0.0,0.0
98,SENS," Thanks for responding. From what I can tell both of those are what I was talking about as having very little revenue and huge expenses right now or very young. Looks like SENS  Already had their run  And is on the down side. 

They might have something new or great future potential but right now I wouldn't classify these as in the scope of what I'm looking for. I know a lot of people are looking for the .0001  Stock that hits it's just right for a 1000% short term return...... But in my history I found that it's too hard to find which one actually Becomes fashionable when I'm in it or I lose out on other potential OTC that have the profitable criteria I'm looking for. 

They don't always turn out a 1000% return but like I have said, I had enough last year that gave me between 2 and 800% return in under 6 months.",Bdbert1199,2,/r/pennystocks/comments/lzj18r/the_lounge_thoughts_noob_stuff_low_effort_brokers/gq2s78a/,0.033,0.87,0.098,0.8499
99,SCKT," No. I always check pre-market night before or early morning.  SCKT was up 120% few weeks ago and missed it cuz didn't check all tickers.
I've had over 100 tickers that I sold but still show quote",NPRjunkieDC,1,/r/pennystocks/comments/lzj18r/the_lounge_thoughts_noob_stuff_low_effort_brokers/gq47vha/,0.088,0.912,0.0,-0.296
100,DL," Word. We’re good. I have a finance buddy who may be able help. He’s a rich dick who doesn’t have to play by the rules, but he’ll talk for hours on the DL if I can catch him when he’s bored.",Hobbitfeetinmyass,1,/r/pennystocks/comments/lzj18r/the_lounge_thoughts_noob_stuff_low_effort_brokers/gq2ykc1/,0.11,0.711,0.179,0.25
101,ALL, Yep. 100% hate the childish memes. **PETITION TO END ALL MEMES**,Hobbitfeetinmyass,1,/r/pennystocks/comments/lzumpk/sub_filters/gq4yyjq/,0.366,0.497,0.137,-0.5719
102,DD," Memes are not DD, and studies have shown the juvenile mindset needed to enjoy memes. 

Granted the odd meme may “luck out” and be about a decent stock, but the 1% chance of that is reality.

We don’t invest to “lighten the mood” we are here to make money, period. If you want to play games and horse around I’m sure there is a playgroup you can join with the other toddlers. The rest of us will continue to maturely grow our fortune.",CapialAdvantage,1,/r/pennystocks/comments/lzumpk/sub_filters/gq4tcpc/,0.018,0.802,0.18,0.9144
103,IBKR," If you're talking about IBKR, you can sell it, you just need to do it on the TWS.",ReferenceBrief,1,/r/pennystocks/comments/lzdiek/best_triple_0_plays_0001/gq4fo9l/,0.0,1.0,0.0,0.0
104,DD, Hmmn sounds like it'd be worth a quick DD,marcSdark,5,/r/pennystocks/comments/lzdiek/best_triple_0_plays_0001/gq1m0sp/,0.0,0.577,0.423,0.5267
105,DD," So maybe slow your roll a bit. Set a low buy limit order and wait. I’m definitely all in here but a fellow ape helped me out with some DD.  We both like this stock but we think CBDD is a better play. Lower volatility and higher P/E. CBDDs latest earnings report isn’t out yet, which is kinda suspect.  I’m gonna call their main office on Monday to get some more info. Still should be a nice play if I get favorable news. 
I’ll update when I know more.",Hobbitfeetinmyass,1,/r/pennystocks/comments/lzdiek/best_triple_0_plays_0001/gq4wro1/,0.066,0.708,0.226,0.9538
106,TSLA," People are going to be looking for value stocks after seeing TSLA drop so significantly from a P/E ratio of 1200. Along with the fact that LUVU are investing in increasing production and sales, further undervaluing their share price. Before this market dip no one gave a shit about P/E ratios, now they're going to start to.

In March LUVU share price was around $0.03, in December it was around $0.08, now in March it's around $0.12. I don't think it will increase in value *now,* but I believe it may increase in value over the next year. I think this is a potential long term grower, and could potentially get uplisted.",eternalmandrake,2,/r/pennystocks/comments/lzhske/luvu_is_still_highly_undervalued/gq2tko9/,0.047,0.829,0.124,0.7814
107,DD," ABQQ if you want to take the risk. They already went double this week and dropped back down but before the pandemic they were selling at around $10 with a high of $20. They now sit within .11 to .16.

But from my own DD they are actively trying to make revenue and making smart plays so it’s not a typical Chinese scam.",FallenZulu,2,/r/pennystocks/comments/lzqqwg/stocks_without_a_10x_already/gq4k4qp/,0.022,0.778,0.2,0.9117
108,TD," I got into APPZ, MDIN, IGNT, DKTS recently. TD screener showed these stonks having a nice profit margin being .000 stonks. But I'm just an ape cracked out on bananas, so I have no financial advice except to not listen to me.",LouStools68,2,/r/pennystocks/comments/lzqqwg/stocks_without_a_10x_already/gq3k62z/,0.056,0.815,0.129,0.4976
109,AMC, Buy AMC before it goes nuts! 🥜,Cantstopwontstop8,-24,/r/pennystocks/comments/lzqqwg/stocks_without_a_10x_already/gq3hu88/,0.341,0.659,0.0,-0.3802
110,UK," They will survive, or be bailed out. UK PM has even stated so himself. Also tied into energy and Military. They are not going anywhere I believe",SillyBar6,1,/r/pennystocks/comments/lzqqwg/stocks_without_a_10x_already/gq50y3q/,0.0,0.923,0.077,0.2732
111,GL," You keep saying sales are going up and sold out etc. But their revenues went from 1.1m in march to 250k in September. There's convenience stores doing better numbers. GL, wish you all the best as well.",MikeMillsO_o,1,/r/pennystocks/comments/lzqqwg/stocks_without_a_10x_already/gq43jia/,0.0,0.682,0.318,0.9317
112,USA, Not a penny stock. But $MSOS is a 100% USA weed etf,Take_Notice_Walk,2,/r/pennystocks/comments/lzbyrl/what_are_the_best_weed_stocks_specially_united/gq1i8tz/,0.0,1.0,0.0,0.0
113,APH, APH,Strangedreamest,1,/r/pennystocks/comments/lzbyrl/what_are_the_best_weed_stocks_specially_united/gq1qhct/,0.0,1.0,0.0,0.0
114,DM," FLOAT and VOLUME

Unrelated: check out STHC!  DM me if interested or have questions!  GL",powerfulSRE,-1,/r/pennystocks/comments/lzhsu1/what_numbers_grab_your_attention/gq322jo/,0.0,0.673,0.327,0.7443
115,GL," FLOAT and VOLUME

Unrelated: check out STHC!  DM me if interested or have questions!  GL",powerfulSRE,-1,/r/pennystocks/comments/lzhsu1/what_numbers_grab_your_attention/gq322jo/,0.0,0.673,0.327,0.7443
116,DAC, I have 80 mostly pennystocks.  My favorite are INTV + IQST + KAVL + ADOM or NASDAQ RWLK + DAC + FLNT + RADA + PERI,NPRjunkieDC,-8,/r/pennystocks/comments/lzhsu1/what_numbers_grab_your_attention/gq2f8aj/,0.0,0.85,0.15,0.4588
117,FLNT, I have 80 mostly pennystocks.  My favorite are INTV + IQST + KAVL + ADOM or NASDAQ RWLK + DAC + FLNT + RADA + PERI,NPRjunkieDC,-8,/r/pennystocks/comments/lzhsu1/what_numbers_grab_your_attention/gq2f8aj/,0.0,0.85,0.15,0.4588
118,PERI, I have 80 mostly pennystocks.  My favorite are INTV + IQST + KAVL + ADOM or NASDAQ RWLK + DAC + FLNT + RADA + PERI,NPRjunkieDC,-8,/r/pennystocks/comments/lzhsu1/what_numbers_grab_your_attention/gq2f8aj/,0.0,0.85,0.15,0.4588
119,RADA, I have 80 mostly pennystocks.  My favorite are INTV + IQST + KAVL + ADOM or NASDAQ RWLK + DAC + FLNT + RADA + PERI,NPRjunkieDC,-8,/r/pennystocks/comments/lzhsu1/what_numbers_grab_your_attention/gq2f8aj/,0.0,0.85,0.15,0.4588
120,RWLK, I have 80 mostly pennystocks.  My favorite are INTV + IQST + KAVL + ADOM or NASDAQ RWLK + DAC + FLNT + RADA + PERI,NPRjunkieDC,-8,/r/pennystocks/comments/lzhsu1/what_numbers_grab_your_attention/gq2f8aj/,0.0,0.85,0.15,0.4588
121,APHA," APHA is a great example imo. It shot up from $15 to $32 overnight.  Then paper hands/institutional investors cashed out, causing it to tank *hard* over night for no fundamental reason.  It climbed back up and stayed at around $18/20 for weeks, then the blood bath happened. It held strong around $17/18-ish for days. Then dropped to $14-ish on Friday. I bought more at $14.80 because I love mj stocks and the upcoming merger with Tilray is gonna send it to the moon and payoff APHA holders bigly. It ticked back up to $16 at close. If it drops again I’ll buy more. They have a shit load of money, a solid expansion plan, a massive demand for product, and I like the stock.",Hobbitfeetinmyass,-2,/r/pennystocks/comments/lzhj9t/is_averaging_better_than_selling_for_a_minimal/gq2j8q4/,0.077,0.806,0.117,0.7458
122,RS, Do you mean RS as in runescape?,learning2drive_,0,/r/pennystocks/comments/lzhj9t/is_averaging_better_than_selling_for_a_minimal/gq2nsfu/,0.0,1.0,0.0,0.0
123,VC," Blockchain is much more then just crypto coins. The technology behind it is very cool, and will enable alot of very interesting things. The companies developing all these different coins  are companies just like any other. The idea that is all decentralized yada yada is great and all but its only half the story. The average salary of a blockchain engineer is over 150k a year, money is pouring and it has been delivering. The better VC funds have been getting 10x, 20x regularly on select investments. Exposure to that kind of return is pretty great, look at the only other public VC  KR1, they are up 20x right now.",Sullamen,3,/r/pennystocks/comments/lzijc9/coinsilium_cingf_blockchain_nft_play/gq2xzla/,0.0,0.822,0.178,0.9678
124,DD, Yes this is a major issue with this DD,danrennt98,3,/r/pennystocks/comments/lzg1d0/trying_to_make_sense_of_sens/gq3hulp/,0.0,0.722,0.278,0.4019
125,ASRT, ASRT all the way!,AwkwardPhilosopher0,10,/r/pennystocks/comments/lzyjvc/a_few_picks_that_i_think_will_get_1015_this_week/gq4wv2e/,0.0,1.0,0.0,0.0
126,CTRM," CTRM I agree--- took a large tumble, and still has the $1+ in it...

Also--- check out IDEX and WATT as well--- these could shoot up early this week too.",Rick_WP77,3,/r/pennystocks/comments/lzyjvc/a_few_picks_that_i_think_will_get_1015_this_week/gq4t74f/,0.082,0.918,0.0,-0.34
127,IDEX," CTRM I agree--- took a large tumble, and still has the $1+ in it...

Also--- check out IDEX and WATT as well--- these could shoot up early this week too.",Rick_WP77,3,/r/pennystocks/comments/lzyjvc/a_few_picks_that_i_think_will_get_1015_this_week/gq4t74f/,0.082,0.918,0.0,-0.34
128,WATT," CTRM I agree--- took a large tumble, and still has the $1+ in it...

Also--- check out IDEX and WATT as well--- these could shoot up early this week too.",Rick_WP77,3,/r/pennystocks/comments/lzyjvc/a_few_picks_that_i_think_will_get_1015_this_week/gq4t74f/,0.082,0.918,0.0,-0.34
129,NAKD, Do you have any rationale to back the idea that NAKD will be up this week? or is it just a feeling,Amarinthine,2,/r/pennystocks/comments/lzyjvc/a_few_picks_that_i_think_will_get_1015_this_week/gq4xv01/,0.0,0.93,0.07,0.128
130,OGEN, Don’t think OGEN has finished dropping just yet. May be wrong but I wouldn’t jump in too quickly,Unfortunate_Timings,1,/r/pennystocks/comments/lzyjvc/a_few_picks_that_i_think_will_get_1015_this_week/gq4tkkn/,0.114,0.886,0.0,-0.2617
