,ticker,comment,username,score,permalink,neg,neu,pos,compound
107,CLOV," Meme stocks drained me out….here is my advise to those who maybe planning to get into meme stocks

Hey there…I realised over 3.6k USD in losses from meme stock dabbling and FOMOing in general 

Just wanted to share about the mistakes I made to feel a little better about the hefty price I paid to learn.

I invested in AMC. 58 positions at 72….yeah the top. And I watched it all the while being desperate as it fell to 58. (This was the day they decided to add more stocks; they were warning about it prior apparently and I didn’t research properly aka ape analysis on WSB…so rip)

12*58 = -696 USD

I got desperate. Prior to that I had lost about 1.4K USD on stocks I did not understand at all…stocks which were soaring crazy for one day and crashed there after, like SLGG (-400USD) and ATOS/NEOS (-400USD estimated). I wanted to make it all back in one trade (MAJOR MISTAKE)

Threw it all into CLOV. Guess when…

@27 with around 30-40 positions 

The day opened, the stock crashed. Now I could have sold it but no, I hodl-ed 

It just kept crashing and I being the ape hodler I am bought the dip 

Averaged it down to 24 with 158 positions ….but the stock just tumbled and I bit the bullet when it was at 15


My lessons 
1) Investment should not be money that means a lot to you. I have come to terms with my losses now but honestly if I could go back; I rather not have lost that money. That feeling will be around forever 

2) Don’t invest in things you don’t get . Now I am no bio student and I didn’t even know what pharmaceuticals did until I threw my money in. Don’t get it; don’t put money in it.

3) Don’t blindly throw your money into soaring stocks. I think I can safely say that as a general rule of thumb don’t throw money into something that is surging a lot. SEARCH UP, find out why and only if you find it’s price is worth what it is, then buy.

4) Cut losses early. I watched my portfolio shrink rather than taking action to cut those losses. I gave into desperation and herd mentality. I hodled like an idiot. I sincerely regret it now but let’s face it, that ain’t gonna reverse what happened. Remember NO ONE cares more about your money more than you do so if you want to cut losses do so. You are obliged to no one in no manner for the financial decisions that you make.

5) Diversify. I was an idiot I to make it an all in decision in something as volatile as a meme stock. We all want to have some fun with all this lockdowns and pandemic related restrictions. So it’s still okay to invest in meme stocks but please put your fun money rather than actual money that means alot. Even if the stock is the next Amazon, you won’t know it till it happens so don’t all in on anything.

6) Don’t aim to recover. You will lose more. Aim to make money more on trades than you lose on trades. The idea of Recovering just brings unnecessary emotions that makes you make terrible decisions. 

It was painful. I couldn’t sleep for days and I felt really numb and paralysed on the day I bit those losses and told my loved ones about it . Thankfully, it’s money I could recover . Now I have started to joke about it with my friends, but that feeling at that point was hell and I sincerely  hope no one has to deal with that. I still do feel embarrassed sometimes to bring it up (haven’t told all my friends,too ashamed ) so some of those unpleasant feelings will last a lifetime.

So yea I hope my expensive lessons will act as a contrarian for your when your making highly risky decisions about investing in meme stocks (like that all in that I did )

Trade safely guys",Constant_Home_9464,5,/r/investing/comments/oatbpi/daily_general_discussion_and_spitballin_thread/h3l0qa0/,0.15,0.74,0.11,-0.9841
108,SLGG," Meme stocks drained me out….here is my advise to those who maybe planning to get into meme stocks

Hey there…I realised over 3.6k USD in losses from meme stock dabbling and FOMOing in general 

Just wanted to share about the mistakes I made to feel a little better about the hefty price I paid to learn.

I invested in AMC. 58 positions at 72….yeah the top. And I watched it all the while being desperate as it fell to 58. (This was the day they decided to add more stocks; they were warning about it prior apparently and I didn’t research properly aka ape analysis on WSB…so rip)

12*58 = -696 USD

I got desperate. Prior to that I had lost about 1.4K USD on stocks I did not understand at all…stocks which were soaring crazy for one day and crashed there after, like SLGG (-400USD) and ATOS/NEOS (-400USD estimated). I wanted to make it all back in one trade (MAJOR MISTAKE)

Threw it all into CLOV. Guess when…

@27 with around 30-40 positions 

The day opened, the stock crashed. Now I could have sold it but no, I hodl-ed 

It just kept crashing and I being the ape hodler I am bought the dip 

Averaged it down to 24 with 158 positions ….but the stock just tumbled and I bit the bullet when it was at 15


My lessons 
1) Investment should not be money that means a lot to you. I have come to terms with my losses now but honestly if I could go back; I rather not have lost that money. That feeling will be around forever 

2) Don’t invest in things you don’t get . Now I am no bio student and I didn’t even know what pharmaceuticals did until I threw my money in. Don’t get it; don’t put money in it.

3) Don’t blindly throw your money into soaring stocks. I think I can safely say that as a general rule of thumb don’t throw money into something that is surging a lot. SEARCH UP, find out why and only if you find it’s price is worth what it is, then buy.

4) Cut losses early. I watched my portfolio shrink rather than taking action to cut those losses. I gave into desperation and herd mentality. I hodled like an idiot. I sincerely regret it now but let’s face it, that ain’t gonna reverse what happened. Remember NO ONE cares more about your money more than you do so if you want to cut losses do so. You are obliged to no one in no manner for the financial decisions that you make.

5) Diversify. I was an idiot I to make it an all in decision in something as volatile as a meme stock. We all want to have some fun with all this lockdowns and pandemic related restrictions. So it’s still okay to invest in meme stocks but please put your fun money rather than actual money that means alot. Even if the stock is the next Amazon, you won’t know it till it happens so don’t all in on anything.

6) Don’t aim to recover. You will lose more. Aim to make money more on trades than you lose on trades. The idea of Recovering just brings unnecessary emotions that makes you make terrible decisions. 

It was painful. I couldn’t sleep for days and I felt really numb and paralysed on the day I bit those losses and told my loved ones about it . Thankfully, it’s money I could recover . Now I have started to joke about it with my friends, but that feeling at that point was hell and I sincerely  hope no one has to deal with that. I still do feel embarrassed sometimes to bring it up (haven’t told all my friends,too ashamed ) so some of those unpleasant feelings will last a lifetime.

So yea I hope my expensive lessons will act as a contrarian for your when your making highly risky decisions about investing in meme stocks (like that all in that I did )

Trade safely guys",Constant_Home_9464,5,/r/investing/comments/oatbpi/daily_general_discussion_and_spitballin_thread/h3l0qa0/,0.15,0.74,0.11,-0.9841
109,ASTS, Well it looks like institutional investors just got wind of ASTS. Us retail investors flew under the market for months accumulating and now something big is about to start.,7000RPM,-1,/r/investing/comments/oatbpi/daily_general_discussion_and_spitballin_thread/h3jyn2y/,0.0,0.854,0.146,0.5574
110,MRNA," I think so, I bought just five shares of MRNA @ $125, and I keep thinking i need to sell them,  but it just keeps going up.   At some point,  maybe today,  I will sell, but I've been saying that for a couple of weeks (maybe I should name my shares Westley).",bernie638,2,/r/investing/comments/oatbpi/daily_general_discussion_and_spitballin_thread/h3jwbrb/,0.0,0.905,0.095,0.5267
111,BX," ET has bounced with other pipeline cos, but I have zero interest in owning MLPs at all (and really can't see owning an MLP again; I think it's probably a shrinking asset class in the years ahead - private equity cos like BX have benefitted from switching to C corps from MLPs) and if I did I'd invest with management that I'd trust more (which in the MLP oil and gas sector is maybe two companies.) 

https://sl-advisors.com/mlp-humor-a-target-rich-environment",dvdmovie1,2,/r/investing/comments/oatbpi/daily_general_discussion_and_spitballin_thread/h3l5y6x/,0.0,0.781,0.219,0.9612
112,ET," ET has bounced with other pipeline cos, but I have zero interest in owning MLPs at all (and really can't see owning an MLP again; I think it's probably a shrinking asset class in the years ahead - private equity cos like BX have benefitted from switching to C corps from MLPs) and if I did I'd invest with management that I'd trust more (which in the MLP oil and gas sector is maybe two companies.) 

https://sl-advisors.com/mlp-humor-a-target-rich-environment",dvdmovie1,2,/r/investing/comments/oatbpi/daily_general_discussion_and_spitballin_thread/h3l5y6x/,0.0,0.781,0.219,0.9612
113,MLP," ET has bounced with other pipeline cos, but I have zero interest in owning MLPs at all (and really can't see owning an MLP again; I think it's probably a shrinking asset class in the years ahead - private equity cos like BX have benefitted from switching to C corps from MLPs) and if I did I'd invest with management that I'd trust more (which in the MLP oil and gas sector is maybe two companies.) 

https://sl-advisors.com/mlp-humor-a-target-rich-environment",dvdmovie1,2,/r/investing/comments/oatbpi/daily_general_discussion_and_spitballin_thread/h3l5y6x/,0.0,0.781,0.219,0.9612
114,VIAC, VIAC is legit,Misha315,1,/r/investing/comments/oatbpi/daily_general_discussion_and_spitballin_thread/h3lwsz2/,0.0,1.0,0.0,0.0
115,AMD, AMD had rally to $90 after results this spring. Then dropped to ~70$ and had climbed back now. So its just recovering from nonsense dip,ItsDuckTime,4,/r/investing/comments/oatbpi/daily_general_discussion_and_spitballin_thread/h3k98xm/,0.101,0.899,0.0,-0.4019
116,NTLA," > NTLA is outta control. 

91 RSI - way overbought. I bought a *little* bit a couple of days ago thinking that I was admittedly chasing and that it would pullback and that I'd get the opportunity to gradually build a position. Two days later I'm thinking about selling.",dvdmovie1,3,/r/investing/comments/oatbpi/daily_general_discussion_and_spitballin_thread/h3kz2dt/,0.0,0.936,0.064,0.4215
117,RSI," > NTLA is outta control. 

91 RSI - way overbought. I bought a *little* bit a couple of days ago thinking that I was admittedly chasing and that it would pullback and that I'd get the opportunity to gradually build a position. Two days later I'm thinking about selling.",dvdmovie1,3,/r/investing/comments/oatbpi/daily_general_discussion_and_spitballin_thread/h3kz2dt/,0.0,0.936,0.064,0.4215
118,AMC," You didn't buy 58 ""positions"" of AMC. You bought 58 ""shares"".  Your ""position"" was long 58 shares of AMC at $72 cost basis",jimmy_jacques,4,/r/investing/comments/oatbpi/daily_general_discussion_and_spitballin_thread/h3ls5sh/,0.0,0.909,0.091,0.296
119,SOFI," Latest short interest data on $sofi is 6/15. It's only 3.56% of shares outstanding. Shares short is 28.8M shares. Shares outstanding is 799.63M. The float is 56.45M shares. 

You may want to check your math.

https://finance.yahoo.com/quote/SOFI/key-statistics?p=SOFI",greytoc,4,/r/investing/comments/oatbpi/daily_general_discussion_and_spitballin_thread/h3k0drs/,0.0,0.537,0.463,0.9652
120,GL, Nice move this morning. I had that on my watchlist. Guess I should have jumped in! GL,Cool-Strain-5036,2,/r/investing/comments/oatbpi/daily_general_discussion_and_spitballin_thread/h3k132b/,0.0,0.68,0.32,0.729
121,MMAT," MMAT.

Not financial advice, just a regular guy with knowledge of nothing.*",JusTtheWorst2er1,0,/r/investing/comments/oatbpi/daily_general_discussion_and_spitballin_thread/h3lcl0u/,0.0,1.0,0.0,0.0
122,TD," Strange.  I actually got the 148.13% from TD Ameritrade when I looked up the stock.  Maybe just a misprint on their part.   

Thank you for clarifying",Srqwarren,0,/r/investing/comments/oatbpi/daily_general_discussion_and_spitballin_thread/h3k2a4r/,0.071,0.83,0.099,0.1779
123,DD, Never too late! So much DD on the subreddit and their investor presentation. Personally I don’t plan on selling until 2030 no matter what the price does in the short term,7000RPM,2,/r/investing/comments/oatbpi/daily_general_discussion_and_spitballin_thread/h3k1gox/,0.079,0.886,0.035,-0.3382
124,MRNA," Yeah,  there is definitely arguments that it could double again from here, there are a lot of people in the world and since the mRNA is much more effective against delta variant it's possible that more countries decide that buying the MRNA vaccine is cheaper than another lock down.   Booster shots are a possibility if other variants  show up. That's why I haven't sold yet even though once a week I've entered all the info into the sell order and then backed out before hitting submit.   I'm not used to owning stocks that go up quickly and I don't have a good sell price target.",bernie638,1,/r/investing/comments/oatbpi/daily_general_discussion_and_spitballin_thread/h3kqzck/,0.047,0.865,0.087,0.5085
125,NTLA," ""they have a nobel prize winning product at hand""

Biotech is a very difficult sector to invest in and I don't have a background in healthcare. It's very much a sector where I invest in companies where I feel that - again, having no background - they have a compelling technology/platform where they can potentially go ""back to the well"" rather than requiring M & A to fill a pipeline. If a biotech with a cash cow starts to see that slow, hot can turn cold very quickly.

I did well with biotech last year but I realized that - while I felt strongly about some of the picks that I did make - I benefitted from massive inflows into the sector during a very risk on year and that those sorts of inflows weren't sustainable so a lot of those things were sold. When speculative growth tanked earlier this year, biotech - where many companies definitely aren't profitable - was certainly impacted.

And even in a risk on period like last year, I did keep some limit to biotech because while I may be fascinated with the innovations, again - I don't have a background in healthcare. With less devoted to more speculative growth this year, biotech still remains a % of my portfolio, but a very minor one where I'm comfortable with some speculation in situations where I want to participate but I'm not going to have huge positions without a healthcare background. The hope is that there is some degree of learn-through-investing about healthcare along the way.

""they have a nobel prize winning product at hand""

If you have a healthcare background and think that NTLA has a nobel-worthy product with what was just announced, great - would be great if the case but I'm not going to make those claims. I found it very interesting and it fits with the kind of biotech situations that I like and thought that I'd have an opportunity to add further at lower levels but (shrug.) 

"" If you look 5-10 years into the future""

Usually I'd say I don't like predicting 10 years into the future but lately even 5 seems a strain.

"" is it a good buy?""

Someone can have a long-term view on what they buy but where you buy still does definitely matter. I thought I was chasing a couple of days ago and was going to space out buys for what I thought would be a pullback and it kept going instead. Now up 100% or so and with a 91 RSI I have to think that it's certainly over-extended here. You can definitely buy something that you think is a hot 5-10 year theme, but if you buy in the midst of a lot of hype, you can be long-term right but baghold for a while.",dvdmovie1,2,/r/investing/comments/oatbpi/daily_general_discussion_and_spitballin_thread/h3l56bv/,0.044,0.745,0.211,0.9978
126,RSI," ""they have a nobel prize winning product at hand""

Biotech is a very difficult sector to invest in and I don't have a background in healthcare. It's very much a sector where I invest in companies where I feel that - again, having no background - they have a compelling technology/platform where they can potentially go ""back to the well"" rather than requiring M & A to fill a pipeline. If a biotech with a cash cow starts to see that slow, hot can turn cold very quickly.

I did well with biotech last year but I realized that - while I felt strongly about some of the picks that I did make - I benefitted from massive inflows into the sector during a very risk on year and that those sorts of inflows weren't sustainable so a lot of those things were sold. When speculative growth tanked earlier this year, biotech - where many companies definitely aren't profitable - was certainly impacted.

And even in a risk on period like last year, I did keep some limit to biotech because while I may be fascinated with the innovations, again - I don't have a background in healthcare. With less devoted to more speculative growth this year, biotech still remains a % of my portfolio, but a very minor one where I'm comfortable with some speculation in situations where I want to participate but I'm not going to have huge positions without a healthcare background. The hope is that there is some degree of learn-through-investing about healthcare along the way.

""they have a nobel prize winning product at hand""

If you have a healthcare background and think that NTLA has a nobel-worthy product with what was just announced, great - would be great if the case but I'm not going to make those claims. I found it very interesting and it fits with the kind of biotech situations that I like and thought that I'd have an opportunity to add further at lower levels but (shrug.) 

"" If you look 5-10 years into the future""

Usually I'd say I don't like predicting 10 years into the future but lately even 5 seems a strain.

"" is it a good buy?""

Someone can have a long-term view on what they buy but where you buy still does definitely matter. I thought I was chasing a couple of days ago and was going to space out buys for what I thought would be a pullback and it kept going instead. Now up 100% or so and with a 91 RSI I have to think that it's certainly over-extended here. You can definitely buy something that you think is a hot 5-10 year theme, but if you buy in the midst of a lot of hype, you can be long-term right but baghold for a while.",dvdmovie1,2,/r/investing/comments/oatbpi/daily_general_discussion_and_spitballin_thread/h3l56bv/,0.044,0.745,0.211,0.9978
127,AAPL," Equity means like stocks.  And right, all you have are equities, you might as well have only VTI pretty much as there are a lot of overlap between most of those funds if you look under the hood of them.

There are really only a few financial asset classes that are worthwhile and you can probably already think of them.  Stocks, bonds, gold, cryptocurrency.  You already got some equity exposure, maybe add VT (probably all you actually need for equity exposure) to get some international equity exposure.  Maybe add some TLT for some bond exposure, some IAU for gold exposure, and find some way to get some BTC exposure.  Also, in case the inflation thesis ends up bogus (which it probably is), keep some cash.

Though, Try to keep it simple still.  That said, I'm not a big fan of diversification myself (think of all the richest people you can think of, are they rich because of diversification?  More often than not, no), and I'm not a fan of the equity markets at these levels.  I am a fan of rebalancing (and having different assets to rebalance into), and if you have things that move with different correlations (or non correlation), it is much easier because markets are nearly impossible to time well which is I think the lesson of John C. Bogle, -just buy literally everything.

Currently I'm probably at .5% BTC (was shooting for 1%, it went against me for now), .1% gold, 5% treasuries, 10% equities, 84% cash (but I have an amount of cash I cannot afford to lose, and am in the camp that thinks risk assets will become increasingly as underpriced as they are overpriced now soon because of deflation caused by QE and low interest rates).

For the past 7 years I've been running something aggressive probably like  -1% cash, 50% equities, .5% gold, .5% treasuries, 50% BTC.  (basically borrowing against my gold and treasuries to load up on BTC and praying for inflation that has been unfortunately persistently lower than they hope \[but now the situation is why am I risking dollars at all ""to preserve purchasing power"" if inflation is like 1%?  that's only like -10k on 1million dollars /yr\]) and it's worked out well (though not everyone can get small tactical 0% interest loans to invest to keep a negative exposure to USD).  My best trade was a 2k investment in DOGE that went up 3,500% (not as much as I could have made by a lot but highlights the benefit of diversification, that one home run often will make up for whatever you could possibly have on the line), my best nominal trade was with BTC because of how much more exposure I had (though I would have probably done equally well had I kept my AAPL and ARKK positions, nice things if you like idiosyncratic risk which I am a fan of), so keep an open mind.

There also exists real estate, though I know nothing about that, because I always viewed it as basically a dividend play ultimately which I'm also not a fan of.  I think most people here go with O?  If I recall.",zachmoe,1,/r/investing/comments/oajtwg/proper_stock_allocation/h3i01px/,0.043,0.837,0.119,0.9882
128,YOU, I got some YOU shares at $31 and now i’m up almost 35%,Comprehensive_Rock89,1,/r/investing/comments/oanlb1/clear_secure_ipo_thoughts/h3kfx2h/,0.0,0.833,0.167,0.296
129,ID," It’s not that contact free.  The only less contact I see is not having to hand your ID to the TSA rep.    You don’t even hand them boarding passes anymore.  

Once through that they go through the same metal detector and use the same bins as all of the precheck customers.",theskyalreadyfell217,4,/r/investing/comments/oanlb1/clear_secure_ipo_thoughts/h3j4o4b/,0.145,0.855,0.0,-0.7881
130,GSK," I’m 24 living in the UK w/ 20k ITB. I will need the money in 5 years for a house or something and my risk tolerance is probably 95-100. I have 5k in bits and pieces, Microsoft, IAG, GSK and some others too. What do I do with the 20k to best increase it’s value in five years time ?",BeanRaider,1,/r/investing/comments/oatb4a/daily_advice_thread_all_basic_help_or_advice/h3jmr2k/,0.034,0.788,0.178,0.8402
131,IAG," I’m 24 living in the UK w/ 20k ITB. I will need the money in 5 years for a house or something and my risk tolerance is probably 95-100. I have 5k in bits and pieces, Microsoft, IAG, GSK and some others too. What do I do with the 20k to best increase it’s value in five years time ?",BeanRaider,1,/r/investing/comments/oatb4a/daily_advice_thread_all_basic_help_or_advice/h3jmr2k/,0.034,0.788,0.178,0.8402
132,UK," I’m 24 living in the UK w/ 20k ITB. I will need the money in 5 years for a house or something and my risk tolerance is probably 95-100. I have 5k in bits and pieces, Microsoft, IAG, GSK and some others too. What do I do with the 20k to best increase it’s value in five years time ?",BeanRaider,1,/r/investing/comments/oatb4a/daily_advice_thread_all_basic_help_or_advice/h3jmr2k/,0.034,0.788,0.178,0.8402
133,EDF," *DENVER, June 29, 2021 /PRNewswire/ -- Virtus Investment Partners, Inc. (""Virtus"") (NASDAQ: VRTS) and Stone Harbor Investment Partners LP (""Stone Harbor"") announced yesterday that they have entered into an agreement for Virtus to acquire 100% of Stone Harbor.*

I have a substantial amount in EDF. As of today its down 3 cents.  Should I sell or wait to see what the offer is going to be to buy up the stock?  Last time I saw this type of situation there was an offer quickly GLOG and doubled my investment.

Sell, Hold or Buy?",ForceMental,1,/r/investing/comments/oatb4a/daily_advice_thread_all_basic_help_or_advice/h3kcikc/,0.0,0.941,0.059,0.6553
