,ticker,comment,username,score,permalink,neg,neu,pos,compound
0,BIG," I’m new to investing, and am already establishing this pattern: 

1. Establish position. 
2. Within days, it dips. 
3. Reddit chicken littles. It’s all over. This is the BIG ONE!!! 
4. I buy the dip. 
5. Green. 
6. Repeat from 2.",BetweenCoffeeNSleep,29,/r/stocks/comments/mwkisk/which_is_worse_watching_your_gains_evaporate/gvixmew/,0.0,1.0,0.0,0.0
1,TSLA, Not buying TSLA at 200 thinking it was already crazy high and should drop anytime,Ok_Performer2244,16,/r/stocks/comments/mwkisk/which_is_worse_watching_your_gains_evaporate/gvix0kq/,0.257,0.743,0.0,-0.5423
2,DD, Watching a stock i had thousands of shares of launch after all my research and DD get shorted to shit before i knew about this part of the game and the FUD scared me. I wake up atleast once a month and say “fucken Nio”,cold_eskimo,1,/r/stocks/comments/mwkisk/which_is_worse_watching_your_gains_evaporate/gviyhuk/,0.196,0.757,0.046,-0.7983
3,GME," When you said, im done with this stock after big gains and you sell it, but then it goes up again and you re-buy because you are too attached to the stock and want to ride it like you did the last time. And then it tanks so hard and you lose the previous gains. Worst feeling. GME right now.",Maverikfreak,1,/r/stocks/comments/mwkisk/which_is_worse_watching_your_gains_evaporate/gvjyfn6/,0.154,0.696,0.151,-0.5022
4,TSLA," I made the mistake selling TSLA to early last week. Bought a 3 between 599-617, set my sell limit to 725. Pissed when it went 779. Can’t wait for it to fall again. I’m gonna be ready!",SteakNotCake,1,/r/stocks/comments/mwkisk/which_is_worse_watching_your_gains_evaporate/gviwurk/,0.171,0.767,0.062,-0.6588
5,DLTR," Watching a stock run above your buy limit before you can establish a position. Examples include DPZ, DLTR, and IHG.",Runningflame570,1,/r/stocks/comments/mwkisk/which_is_worse_watching_your_gains_evaporate/gvj24qx/,0.0,1.0,0.0,0.0
6,DPZ," Watching a stock run above your buy limit before you can establish a position. Examples include DPZ, DLTR, and IHG.",Runningflame570,1,/r/stocks/comments/mwkisk/which_is_worse_watching_your_gains_evaporate/gvj24qx/,0.0,1.0,0.0,0.0
7,IHG," Watching a stock run above your buy limit before you can establish a position. Examples include DPZ, DLTR, and IHG.",Runningflame570,1,/r/stocks/comments/mwkisk/which_is_worse_watching_your_gains_evaporate/gvj24qx/,0.0,1.0,0.0,0.0
8,CPA, depends on the magnitude of the loss or gain--  do think posting online about companies online makes me more emotionally attached to my trades..  Would I have cut my losses with NEO if my fellow apes here not such good confirmation bias palls?  Gotta be on guard for group think --  Road Corning down from 27 to under $2 a share.  Bought at $19-- Could have sold for a gain but cuz I thought $7 down in 1 day was a bit much...  And it just trended down and down.  My wife has a CPA but she says she has never seen a  company do the books like she was taught in school.  So she isn't a fan of stocks.  Corning did eventually recover... But I traded out prior so I got it both ways on that stock so that may be the worst... And my profilo(sp so far off spell check isn't helpin) is big enough that my watch list is usually things I have buy orders on...  Had a buy order on DRN and it didn't trend down that low.  And I keep watching it rally.  Did the same thing with industrials.  Tried to be patient but instead of trending down to my patent entry it been trending up and up...  But don't feel bad for me I'm up 73% from a year ago...,Dragon22wastaken,1,/r/stocks/comments/mwkisk/which_is_worse_watching_your_gains_evaporate/gvj7imx/,0.06,0.892,0.048,0.0985
9,NEO, depends on the magnitude of the loss or gain--  do think posting online about companies online makes me more emotionally attached to my trades..  Would I have cut my losses with NEO if my fellow apes here not such good confirmation bias palls?  Gotta be on guard for group think --  Road Corning down from 27 to under $2 a share.  Bought at $19-- Could have sold for a gain but cuz I thought $7 down in 1 day was a bit much...  And it just trended down and down.  My wife has a CPA but she says she has never seen a  company do the books like she was taught in school.  So she isn't a fan of stocks.  Corning did eventually recover... But I traded out prior so I got it both ways on that stock so that may be the worst... And my profilo(sp so far off spell check isn't helpin) is big enough that my watch list is usually things I have buy orders on...  Had a buy order on DRN and it didn't trend down that low.  And I keep watching it rally.  Did the same thing with industrials.  Tried to be patient but instead of trending down to my patent entry it been trending up and up...  But don't feel bad for me I'm up 73% from a year ago...,Dragon22wastaken,1,/r/stocks/comments/mwkisk/which_is_worse_watching_your_gains_evaporate/gvj7imx/,0.06,0.892,0.048,0.0985
10,GME," It's not a loss until you sell, I dont care about seeing red days anymore, I'm kinda numb at this point. I really, really, really hate seeing a security take off that I had purchased and sold at a much lower price. The three that come to mind: Tesla at $170 pre-split, GME at $19 just days before the gamma squeeze, and worst of all was hundreds of bitcoin at less than a dollar. If I never sold I would be retired by now.",OddAtmosphere6303,1,/r/stocks/comments/mwkisk/which_is_worse_watching_your_gains_evaporate/gvjb69m/,0.177,0.771,0.052,-0.8989
11,REAL," i think watching a stock run after selling, personally. the fomo is REAL.",whydoihave4cats,1,/r/stocks/comments/mwkisk/which_is_worse_watching_your_gains_evaporate/gvjb6y9/,0.0,1.0,0.0,0.0
12,NIO," Watching a stock after selling by far. I bought about 100 shares of NIO, did some reading into it, thought it might be a bust, sold for $1.50 a share. Little did I know...",AFB27,1,/r/stocks/comments/mwkisk/which_is_worse_watching_your_gains_evaporate/gvjcg8t/,0.0,0.86,0.14,0.5267
13,GME, Hindsight is 20/20. You should have bought and held GME.,QuietMathematician2,1,/r/stocks/comments/mwkisk/which_is_worse_watching_your_gains_evaporate/gvjdaw0/,0.0,1.0,0.0,0.0
14,PLTR, Gains evaporating by far!    Happened with my PLTR.  Bought in at 9.XX.   Had a limit sell set for $32.   Removed it.   🤦🏻‍♂️,drewmonkey,1,/r/stocks/comments/mwkisk/which_is_worse_watching_your_gains_evaporate/gvje8qs/,0.0,0.881,0.119,0.4003
15,DD," How about this twist, you get asked about a stock on your watchlist, you share your DD but you don’t make the play yourself.

And now you get celebratory texts from your little brother every week about how well **OUR** stock is doing.

Little bro is up almost 50% on FNKO since the start of march, I am not. (I steered him towards it as a safe way to get exposure to eN eF Tees)

I’m proud af.",KrazieKanuck,1,/r/stocks/comments/mwkisk/which_is_worse_watching_your_gains_evaporate/gvjjjbr/,0.0,0.82,0.18,0.9366
16,FNKO," How about this twist, you get asked about a stock on your watchlist, you share your DD but you don’t make the play yourself.

And now you get celebratory texts from your little brother every week about how well **OUR** stock is doing.

Little bro is up almost 50% on FNKO since the start of march, I am not. (I steered him towards it as a safe way to get exposure to eN eF Tees)

I’m proud af.",KrazieKanuck,1,/r/stocks/comments/mwkisk/which_is_worse_watching_your_gains_evaporate/gvjjjbr/,0.0,0.82,0.18,0.9366
17,SKLZ," Definitely watching a stock run after selling, let's be honest. SKLZ will be in my dreams for a while.",IAmCarpet,1,/r/stocks/comments/mwkisk/which_is_worse_watching_your_gains_evaporate/gvjl1u0/,0.0,0.617,0.383,0.8271
18,GPRO," Second one

Seeing GPRO gain one day after selling (and holding for months) hurt lots",DonDove,1,/r/stocks/comments/mwkisk/which_is_worse_watching_your_gains_evaporate/gvjtyr3/,0.172,0.657,0.172,0.0
19,NEXT," Tried Stinky Pinkies for a few months. Bought one, it was okay, went up 4, 5, 6%, after a few weeks I sold for the grand total of like $52.00 gain.

THE. NEXT. FUCKING. DAY. the thing blew up. I missed out on $2600.00.

Punch me.",Scumbaggedfriends,1,/r/stocks/comments/mwkisk/which_is_worse_watching_your_gains_evaporate/gvju7dp/,0.091,0.699,0.21,0.7269
20,BA," I FOMO""D nkla and smc. Missed out on BA when it was single digits. So  I will go with all of the above...lol",jhynes29,1,/r/stocks/comments/mwkisk/which_is_worse_watching_your_gains_evaporate/gvjvevd/,0.099,0.901,0.0,-0.296
21,DD," The watchlist ones are the worst for me... I did some DD, I compared taking a position in terms of my overall portfolio etc and then didn't pull the trigger for whatever reason (time, money tied up in other investments, etc). 

To see the WL picks run and not be part of it, after having done the homework... That's worse than the other scenarios, because watching gains disappear is unavoidable and may be temporary. 

A stock running, after selling, is always a possibility but if you have made the decision to sell based on your own criteria (take profits, use the cash for other opportunities, etc) then you were still the person makings the decision.

But like all things in life, you regret the chances you didn't take!",BunHead86,1,/r/stocks/comments/mwkisk/which_is_worse_watching_your_gains_evaporate/gvjvt1z/,0.07,0.823,0.106,0.7133
22,GME, I bought 4/16 $9 GME calls in September because their stock normally rose during new console release dates( new Xbox was being released in November) and sold them when the stock hit $15. Obviously kicking myself now. But the gains are good at that point.,Chow31,1,/r/stocks/comments/mwkisk/which_is_worse_watching_your_gains_evaporate/gvjz0qm/,0.0,0.858,0.142,0.7876
23,ABNB, I was following options for ABNB closely for the last couple of days. Wednesday i figured was the bottom and I wanted to get in. Decided to wait for confirmation instead and didn’t buy. Would’ve been a 200% gain within 2 days. That hurts so much more than the premium that I could’ve potentially lost.,unfuckthisfuckery,1,/r/stocks/comments/mwkisk/which_is_worse_watching_your_gains_evaporate/gvk0vxh/,0.099,0.839,0.062,-0.25
24,AMC, GME and AMC have fucking numbed me from the pain of watching profits evaporate. I mean I’m a totally different person because of it. I’m of the same mentality as you about watching it run after I sold. I just laugh. What gets me the most is watching one run on my watch list. That’s generally my biggest problem and one I absolutely hate yet appreciate at the same time.,iOSh4cktiV8or,1,/r/stocks/comments/mwkisk/which_is_worse_watching_your_gains_evaporate/gvk2e7c/,0.153,0.728,0.119,-0.4063
25,GME, GME and AMC have fucking numbed me from the pain of watching profits evaporate. I mean I’m a totally different person because of it. I’m of the same mentality as you about watching it run after I sold. I just laugh. What gets me the most is watching one run on my watch list. That’s generally my biggest problem and one I absolutely hate yet appreciate at the same time.,iOSh4cktiV8or,1,/r/stocks/comments/mwkisk/which_is_worse_watching_your_gains_evaporate/gvk2e7c/,0.153,0.728,0.119,-0.4063
26,DD," Making some DD in a stock, be sure in your decision, make the deposit in your account, wait for the deposit, wait for the deposit, wait for the deposit, see the stock you wanted skyrocket, complain with your broker, get your deposit in to your account put it in another stock and see  your gains evaporate as it goes down 😂",pipiripaw,1,/r/stocks/comments/mwkisk/which_is_worse_watching_your_gains_evaporate/gvk4nvf/,0.04,0.886,0.074,0.296
27,LTC," I was thinking of selling my LTC today and just take the gains, and now I'm watching as I lose over $1000 in a day... that's what I get for not trusting my gut.",Code2008,1,/r/stocks/comments/mwkisk/which_is_worse_watching_your_gains_evaporate/gvj76qv/,0.144,0.786,0.07,-0.3732
28,LMND," I've had two real good timings the last few months.

First was buying LMND at like 63 and then Motley Fool pumped it and it went up 20% in a day or two or something.

Next one was RKT. I bought as a long term hold. Then a couple days later they announced the 1$ dividend and the short interest. Went up over 100%, decided to sell at like 90% gain. It fell most of the way back down so I felt good.",Fine_Priest,1,/r/stocks/comments/mwkisk/which_is_worse_watching_your_gains_evaporate/gvjo35w/,0.032,0.779,0.189,0.9231
29,RKT," I've had two real good timings the last few months.

First was buying LMND at like 63 and then Motley Fool pumped it and it went up 20% in a day or two or something.

Next one was RKT. I bought as a long term hold. Then a couple days later they announced the 1$ dividend and the short interest. Went up over 100%, decided to sell at like 90% gain. It fell most of the way back down so I felt good.",Fine_Priest,1,/r/stocks/comments/mwkisk/which_is_worse_watching_your_gains_evaporate/gvjo35w/,0.032,0.779,0.189,0.9231
30,TSLA," How do long term investors deal with this?

I'm long TSLA and my portfolio took a big hit this past month. Still holding of course.",thematchalatte,1,/r/stocks/comments/mwkisk/which_is_worse_watching_your_gains_evaporate/gvjgobp/,0.0,1.0,0.0,0.0
31,SNAP, SNAP rocketed to $45 in November. I’m so used to pump & dumps / bubbles that I set a stop loss at 10% thinking it wouldn’t actually trigger it. Somehow it did and I sold almost half my shares. Made a good profit on the sale but now they’re at 60. I’ve been pissed at myself every day since.,CollegeStudentTrades,1,/r/stocks/comments/mwkisk/which_is_worse_watching_your_gains_evaporate/gvjn60o/,0.175,0.739,0.086,-0.7602
32,SPCE," my number one rule, when i sell, i'm out, unless it was a daytrade or something materially changed. I sold SPCE at 28, watched it toil around at 30, cried as it jumped to 60 and now laughing as it is at 22",username--_--,18,/r/stocks/comments/mwkisk/which_is_worse_watching_your_gains_evaporate/gvjc3u2/,0.059,0.839,0.102,0.2263
33,AM, I bought ENPH earlier this month at 165. So happy I could finally sell this AM @ 166.90. I’ll wait until it dips again near 140’s and buy.,SteakNotCake,2,/r/stocks/comments/mwkisk/which_is_worse_watching_your_gains_evaporate/gvix2e1/,0.0,0.857,0.143,0.6115
34,ENPH, I bought ENPH earlier this month at 165. So happy I could finally sell this AM @ 166.90. I’ll wait until it dips again near 140’s and buy.,SteakNotCake,2,/r/stocks/comments/mwkisk/which_is_worse_watching_your_gains_evaporate/gvix2e1/,0.0,0.857,0.143,0.6115
35,ATH, I watched TSLA go from $80 to it’s ATH this way,JustARegularOldName,11,/r/stocks/comments/mwkisk/which_is_worse_watching_your_gains_evaporate/gvk65xp/,0.0,1.0,0.0,0.0
36,TSLA, I watched TSLA go from $80 to it’s ATH this way,JustARegularOldName,11,/r/stocks/comments/mwkisk/which_is_worse_watching_your_gains_evaporate/gvk65xp/,0.0,1.0,0.0,0.0
37,DD," If every stock you buy has enough hype on reddit that people can chicken little, you may want to recognize that you're not doing your own market research and DD, rather just following the crowd.

If you're trying to ride a meme that's fine, but if you're thinking about solid long term holdings this is likely not the way",WSBrad,5,/r/stocks/comments/mwkisk/which_is_worse_watching_your_gains_evaporate/gvk5ubd/,0.0,0.927,0.073,0.3222
38,NFLX," Yep.  I'm in that sold tsla group too.   In at $150, out at $225 pre split.

Figured: naw.  They can't be worth more than ford can they???   

Well fuck.   I also bought NFLX at $90 and sold at $150.   Lmao.  Oh well.",rainman_104,1,/r/stocks/comments/mwkisk/which_is_worse_watching_your_gains_evaporate/gvjd3oc/,0.101,0.686,0.213,0.6882
39,QS, I sold QS for gains of 20% at $20 ( pre merger ).   Kinda missed the gravy boat there eh.,rainman_104,2,/r/stocks/comments/mwkisk/which_is_worse_watching_your_gains_evaporate/gvjcxlc/,0.094,0.788,0.118,0.1263
40,AMD, I did that with AMD at $98 intraday and damn near everything I've picked since then is up 10-20%. At least I sold 10% of my TSLA stake at around $880 per.,Runningflame570,73,/r/stocks/comments/mwkisk/which_is_worse_watching_your_gains_evaporate/gvj2h0p/,0.085,0.915,0.0,-0.4019
41,TSLA, I did that with AMD at $98 intraday and damn near everything I've picked since then is up 10-20%. At least I sold 10% of my TSLA stake at around $880 per.,Runningflame570,73,/r/stocks/comments/mwkisk/which_is_worse_watching_your_gains_evaporate/gvj2h0p/,0.085,0.915,0.0,-0.4019
42,ALL," Yeah, I did this with my 4/23 FCEL puts, yesterday. I was up like $70 on it. Because I had been doing pretty good with my new method of guessing a profit average on stocks, I got a little (too) comfortable. I decided yesterday to wait until morning to pull it because I calculated it going down to an extra profit of about $50. Well, it opened high today and I lost ALL the profit PLUS about half of my original invest. 😖",Fair_Mousse4592,4,/r/stocks/comments/mwkisk/which_is_worse_watching_your_gains_evaporate/gvj7525/,0.025,0.68,0.295,0.9706
43,FCEL," Yeah, I did this with my 4/23 FCEL puts, yesterday. I was up like $70 on it. Because I had been doing pretty good with my new method of guessing a profit average on stocks, I got a little (too) comfortable. I decided yesterday to wait until morning to pull it because I calculated it going down to an extra profit of about $50. Well, it opened high today and I lost ALL the profit PLUS about half of my original invest. 😖",Fair_Mousse4592,4,/r/stocks/comments/mwkisk/which_is_worse_watching_your_gains_evaporate/gvj7525/,0.025,0.68,0.295,0.9706
44,PLUS," Yeah, I did this with my 4/23 FCEL puts, yesterday. I was up like $70 on it. Because I had been doing pretty good with my new method of guessing a profit average on stocks, I got a little (too) comfortable. I decided yesterday to wait until morning to pull it because I calculated it going down to an extra profit of about $50. Well, it opened high today and I lost ALL the profit PLUS about half of my original invest. 😖",Fair_Mousse4592,4,/r/stocks/comments/mwkisk/which_is_worse_watching_your_gains_evaporate/gvj7525/,0.025,0.68,0.295,0.9706
45,JNJ," I was up 420% on 4/20 w/ JNJ calls... not a lot of money at stake, but what an amazing ROI. I was thinking... but the might actually print... sold at a 25% loss today hahaha",IAmPandaRock,6,/r/stocks/comments/mwkisk/which_is_worse_watching_your_gains_evaporate/gvjarei/,0.07,0.69,0.24,0.8462
46,EOD," Oh Palantir i was gonna close out my call position at $61/contract today at noon. Got greedy and set it for $65 watched it plummet for 20 min straight....i think by EOD I was looking at closing for like $23/contract at a loss instead. Fk it, let it ride I guess",supertoxic09,3,/r/stocks/comments/mwkisk/which_is_worse_watching_your_gains_evaporate/gvjc2yg/,0.09,0.861,0.049,-0.2732
47,JNJ," I was up 420% on 4/20 w/ JNJ calls... not a lot of money at stake, but what an amazing ROI. I was thinking... but the might actually print... sold at a 25% loss today hahaha",IAmPandaRock,1,/r/stocks/comments/mwkisk/which_is_worse_watching_your_gains_evaporate/gvjardx/,0.07,0.69,0.24,0.8462
48,PLTR, PLTR is that you?,ThinkOrDrink,40,/r/stocks/comments/mwkisk/which_is_worse_watching_your_gains_evaporate/gvj3biy/,0.0,1.0,0.0,0.0
49,GME," I sold GME at $344 during the second run up in March. Life changing money, dropped 5 minutes later and never got back up. Best decision (luck!) ever.

Guess those still bagholding just can’t stop fantasizing about this going to the moon lol",natery5,31,/r/stocks/comments/mwkisk/which_is_worse_watching_your_gains_evaporate/gvjf1bd/,0.046,0.8,0.154,0.7263
50,AAPL," Busted. I put money into upstarts AAPL and SPY without looking into them. Thank you for setting me straight.

Edited to add: 90% of my portfolio is AAPL, SPY, SCHD. The chicken littles primarily impact the other 10%, which is my speculative positions. Having said that, I’ve averaged down in AAPL when the rotation to reopening plays and subsequent re-rotation into value happened, as well.",BetweenCoffeeNSleep,4,/r/stocks/comments/mwkisk/which_is_worse_watching_your_gains_evaporate/gvk8oxe/,0.0,0.825,0.175,0.8519
51,AMD, I bought TSLA and AMD at their peaks right before tech stocks began to crash...,Shindiglehleh,124,/r/stocks/comments/mwkisk/which_is_worse_watching_your_gains_evaporate/gvj2mqk/,0.0,1.0,0.0,0.0
52,TSLA, I bought TSLA and AMD at their peaks right before tech stocks began to crash...,Shindiglehleh,124,/r/stocks/comments/mwkisk/which_is_worse_watching_your_gains_evaporate/gvj2mqk/,0.0,1.0,0.0,0.0
53,AMD," I bought AMD, TSM, ARKG, ARKK, ARKW, ICLN and PBW with my GME gains in early February.",brubakerp,23,/r/stocks/comments/mwkisk/which_is_worse_watching_your_gains_evaporate/gvjb7dt/,0.0,0.862,0.138,0.34
54,GME," I bought AMD, TSM, ARKG, ARKK, ARKW, ICLN and PBW with my GME gains in early February.",brubakerp,23,/r/stocks/comments/mwkisk/which_is_worse_watching_your_gains_evaporate/gvjb7dt/,0.0,0.862,0.138,0.34
55,TSM," I bought AMD, TSM, ARKG, ARKK, ARKW, ICLN and PBW with my GME gains in early February.",brubakerp,23,/r/stocks/comments/mwkisk/which_is_worse_watching_your_gains_evaporate/gvjb7dt/,0.0,0.862,0.138,0.34
56,PLTR, Lol I bought PLTR $25 call right before noon.... Bam in the red In 5 min. Just glad I went 4mnth out instead of this month lol that'll be a great opportunity to go deeper red lmao,supertoxic09,8,/r/stocks/comments/mwkisk/which_is_worse_watching_your_gains_evaporate/gvjcd7t/,0.0,0.582,0.418,0.9607
57,GME," Correct me if I'm wrong, but wasn't that a regular trading halt? 

But yeah, that day fucking sucked. It's still affected me to this day- if I had held, I'd be in the green even now. But that was kind of where I learned a valuable lesson about just hanging on and holding. Even though I sold at a rather minor profit, if I had held it would've been better. I remember slumping to the fucking floor after that. I bought again after, and now that's what I still hold. I've averaged down, but well... so has GME lol.

An early investing experience.",jellytothebones,9,/r/stocks/comments/mwkisk/which_is_worse_watching_your_gains_evaporate/gvj6abz/,0.075,0.758,0.167,0.9073
58,MLM, Almost as desperate as MLM housewives at this point,RedAtomic,2,/r/stocks/comments/mwkisk/which_is_worse_watching_your_gains_evaporate/gvk6zjm/,0.424,0.576,0.0,-0.6315
59,GME, I effed up with GME too (although not with an utterly insane amount) and this is how I’ve moved forward. Took it as my first big learning experience and remind myself there will never stop being opportunities. Just gotta stay the course until one comes up that you’re ready to capitalize on.,OKJMaster44,3,/r/stocks/comments/mwkisk/which_is_worse_watching_your_gains_evaporate/gvjsqa3/,0.092,0.831,0.078,-0.1996
60,GME," Jesus, and I feel like I should have done better than the couple thousand I made off the first wave given the heart palpitations it inflicted on me...

That said, I bought back in during the 2nd wave and sold it immediately as the feeling on being on the GME ride again was overall not a fun memory",curveball3110giants,1,/r/stocks/comments/mwkisk/which_is_worse_watching_your_gains_evaporate/gvk0i8q/,0.046,0.836,0.118,0.4936
61,BB," BB, however, is not doing great.

Signed, bagholder @19",BlitzTech,12,/r/stocks/comments/mwkisk/which_is_worse_watching_your_gains_evaporate/gvki7ir/,0.292,0.708,0.0,-0.5096
62,CMPS," In my estimation, only part of the question should be whether this “industry” will succeed (I say emphatically yes). The other part is, at what cost?

If you truly believe in the therapeutic benefits and the possibility of helping millions cope with mental illness in a more holistic and complete way than the traditional pharmaceutical approach, then please consider which companies you choose to invest in and support.

Companies like CMPS have been identified as bad actors in this space, lobbying against decriminalization and legalization reform, e.g. Oregon. Attempting to patent “set & setting” as a treatment approach...

I believe in the power of competition (i.e. capitalism) to innovate, but I also believe in nuance and thoughtful regulation as needed. I made the mistake of jumping into CMPS out of excitement that I could financially participate in a space I ethically and ideologically support so much. I didn’t perform appropriate due diligence. Perhaps you don’t care about ethical conflicts in your investing, but if you do, please consider consciously choosing what to support!",ZuBad603,2,/r/stocks/comments/mwz1wo/will_shroom_stocks_be_the_next_weed_boom_mind/gvlnlb7/,0.06,0.728,0.212,0.9815
63,CMPS, I love CMPS,ExistentialCricket,5,/r/stocks/comments/mwz1wo/will_shroom_stocks_be_the_next_weed_boom_mind/gvkzzrh/,0.0,0.192,0.808,0.6369
64,ACB," There was a weed boom?  Weed stocks have been complete dogs.  And are way beyond being proven with any fundamentals.  They're just memes at this point.

I worked in management at a very large cannabis company trying to be the 100,000th ""we're going to be the Starbucks of cannabis"" and frankly, no one is anywhere near close to this.  

It's all wishful thinking at this point.  There's too many other securities with boots on the ground that are federally legal and operating for me to even think about that stuff yet.  I did like two swing trades on ACB just because the numbers made sense and pumped and dumped.  

Looking forward to our society as a whole when we stop treating mushroom and marijuana cultivators and users like murderers.  But financially, it's just not there yet for me.",Vikingdiapers,1,/r/stocks/comments/mwz1wo/will_shroom_stocks_be_the_next_weed_boom_mind/gvll9c8/,0.055,0.899,0.046,-0.3291
