,ticker,comment,username,score,permalink,neg,neu,pos,compound
0,GME," Seems like most people here think this is because of the GME and meme stocks lol, this is from March 2020...",TechieFire,67,/r/investing/comments/ob2ayy/robinhood_to_pay_70m_for_false_information_and/h3lbs59/,0.0,0.782,0.218,0.6486
1,DOW," I left Robinhood on March 1st, 2020. The DOW rose 1,294 points, or 5.1% that day, but Robinhood's app conveniently went down. At the time it was the best one-day point gain on record.  

People were claiming it was an error coding in the extra leap year day on Feb 29th at the time, but looking at their recent shenanigans, I highly doubt that excuse. I cancelled my account immediately. If they couldn't let me trade on a large upswing, I couldn't trust them with my money. Glad I learned that lesson early on.",sicknic,5,/r/investing/comments/ob2ayy/robinhood_to_pay_70m_for_false_information_and/h3lg6yx/,0.121,0.73,0.148,0.6063
2,GME, Idk how anyone still uses RH. Probably because the gamification of trading on that app has everyone addicted.  RH cost me so much money during that GME thing that I closed my account and will never use that platform again.,ftwin,3,/r/investing/comments/ob2ayy/robinhood_to_pay_70m_for_false_information_and/h3l9cu2/,0.036,0.964,0.0,-0.1027
3,RH, Idk how anyone still uses RH. Probably because the gamification of trading on that app has everyone addicted.  RH cost me so much money during that GME thing that I closed my account and will never use that platform again.,ftwin,3,/r/investing/comments/ob2ayy/robinhood_to_pay_70m_for_false_information_and/h3l9cu2/,0.036,0.964,0.0,-0.1027
4,GME," ""and ordered the stock trading app to pay nearly $13 million in restitution to thousands of clients.""

Okay, I didn't make much money off GME, but I was in it and I lost money because I couldn't get out when robbinhood was down. How do I file for my measly cut of the 13mm?  And also, why the fuck does FINRA get 57mm, but the people that actually got hurt get 13mm?",HamburgerParadise,1,/r/investing/comments/ob2ayy/robinhood_to_pay_70m_for_false_information_and/h3lmgvf/,0.209,0.773,0.018,-0.9438
5,RH," The Fidelity app open Beta option or whatever you want to call it looks suspiciously a lot like RH...

&#x200B;

I mean, I get it. The UI is superior to everything else, like it or not. Definitely stuff gets gamefied and there's those dopamine hits with fireworks and whatever but I can't deny the interface is better. I use both RH and Fidelity and I find myself wishing that Fidelity's was like RH most of the time.",oceanic-feeling,1,/r/investing/comments/ob2ayy/robinhood_to_pay_70m_for_false_information_and/h3lsnud/,0.042,0.732,0.227,0.925
6,UI," The Fidelity app open Beta option or whatever you want to call it looks suspiciously a lot like RH...

&#x200B;

I mean, I get it. The UI is superior to everything else, like it or not. Definitely stuff gets gamefied and there's those dopamine hits with fireworks and whatever but I can't deny the interface is better. I use both RH and Fidelity and I find myself wishing that Fidelity's was like RH most of the time.",oceanic-feeling,1,/r/investing/comments/ob2ayy/robinhood_to_pay_70m_for_false_information_and/h3lsnud/,0.042,0.732,0.227,0.925
7,UK," Lol t212 shitting themselve knowing they Scape goat number 2.  UK folk bout to get paid moass or not if they fuck with our shares, they're gone",mottlymonical,1,/r/investing/comments/ob2ayy/robinhood_to_pay_70m_for_false_information_and/h3ltf12/,0.082,0.648,0.27,0.6542
8,GME," So this is only the March 2019 outage and not the GME buy button lawsuit.  

Can't wait to see the Year end fine total.  How the heck they can go public is hilarious.  I Joe their stick completely tanks",WiseAce1,1,/r/investing/comments/ob2ayy/robinhood_to_pay_70m_for_false_information_and/h3lxiup/,0.046,0.845,0.109,0.3818
9,RH," Where's my Doge money I lost when they ""went down""? This happened before the big Musk thing. Where is all the cash from my day trades that I couldn't do because only buying was allowed? Fuck RH. Biggest question: Where does this $70M go? Not to us.",ILoveBentonsBacon,-1,/r/investing/comments/ob2ayy/robinhood_to_pay_70m_for_false_information_and/h3ldkrf/,0.128,0.872,0.0,-0.7461
10,RH, A lot of downvoted comments in here that are very critical of RH or celebrating this fine,q0mb9l236oxkae43ih6p,0,/r/investing/comments/ob2ayy/robinhood_to_pay_70m_for_false_information_and/h3li19z/,0.122,0.611,0.268,0.4779
11,TME," Only have my TME calls left on the platform. Once I cash those, I'll be completely off the platform",KaboomOxyCln,2,/r/investing/comments/ob2ayy/robinhood_to_pay_70m_for_false_information_and/h3laulh/,0.0,1.0,0.0,0.0
12,UI," Unfortunately it's a lot simpler to give oversight than to practice it. People *love* a clean and accessible UI, it's what sticks to customers. Anyone who's on there at this point is probably willingly subjecting themselves to the scummy business practices. Not me though, as I trade OTC where it's all hard to use anyway. *Cries in MBH Corp*",thelonelyteaparty,1,/r/investing/comments/ob2ayy/robinhood_to_pay_70m_for_false_information_and/h3lf5bh/,0.064,0.891,0.045,-0.0258
13,UI," Because people like using the platform. Pretty simple really, can't believe over the last 4 years no one has ripped off their UI.",TotesHittingOnY0u,1,/r/investing/comments/ob2ayy/robinhood_to_pay_70m_for_false_information_and/h3lmv7y/,0.082,0.706,0.212,0.5423
14,GME," Most people who were in on GME started investing in January 2021.

Remember how *pissed* people were the RH went down during the COVID Crash? Feels like many years ago, now.",TotesHittingOnY0u,15,/r/investing/comments/ob2ayy/robinhood_to_pay_70m_for_false_information_and/h3lonx5/,0.079,0.848,0.073,-0.0516
15,RH," Most people who were in on GME started investing in January 2021.

Remember how *pissed* people were the RH went down during the COVID Crash? Feels like many years ago, now.",TotesHittingOnY0u,15,/r/investing/comments/ob2ayy/robinhood_to_pay_70m_for_false_information_and/h3lonx5/,0.079,0.848,0.073,-0.0516
16,GME," > RH cost me so much money during that GME thing that I closed my account and will never use that platform again.

You made your own fate by partaking in that",q0mb9l236oxkae43ih6p,4,/r/investing/comments/ob2ayy/robinhood_to_pay_70m_for_false_information_and/h3lhvbp/,0.0,1.0,0.0,0.0
17,RH," > RH cost me so much money during that GME thing that I closed my account and will never use that platform again.

You made your own fate by partaking in that",q0mb9l236oxkae43ih6p,4,/r/investing/comments/ob2ayy/robinhood_to_pay_70m_for_false_information_and/h3lhvbp/,0.0,1.0,0.0,0.0
18,UI, User friendly UI and all the features anyone really needs. It's not rocket science why people flock to the brokerage with the best mobile app in 2021. It blows my mind no one has ripped it off yet.,TotesHittingOnY0u,1,/r/investing/comments/ob2ayy/robinhood_to_pay_70m_for_false_information_and/h3lovto/,0.049,0.785,0.166,0.7351
19,VC, VC companies will pump more money into Robinhood. They won't let it go under.,ChocolateTsar,2,/r/investing/comments/ob2ayy/robinhood_to_pay_70m_for_false_information_and/h3lvs26/,0.0,1.0,0.0,0.0
20,GME," >The settlement regards the technical failures Robinhood experienced in March 2020


This has nothing to do with GME.",O0O00O000O00O0O,1,/r/investing/comments/ob2ayy/robinhood_to_pay_70m_for_false_information_and/h3lu5h0/,0.15,0.85,0.0,-0.4588
21,TDA," I envy the portfolio return screen because it shows the return based off of what you have put in, if I deposit 500$ in my TDA account it shows that as an appreciation and that’s not correct and actually quite annoying. Otherwise tho that platform is utter garbage",MandoInThaBando,8,/r/investing/comments/ob2ayy/robinhood_to_pay_70m_for_false_information_and/h3lhq8b/,0.099,0.837,0.064,-0.2006
22,TD," I still don't see why anyone even new to investing would use it. Just because it's easy to use does not justify the loss of your money. If it's the only dominant player in the market, I can understand. But we have had established brokers like TD, Fidelity, e-Trade, IB.",soareyousaying,7,/r/investing/comments/ob2ayy/robinhood_to_pay_70m_for_false_information_and/h3leyk3/,0.0,0.871,0.129,0.6889
23,RH," webull is a much better RH,

fidelity, TD are good, but some tools are hard to use.",indicatorform,2,/r/investing/comments/ob2ayy/robinhood_to_pay_70m_for_false_information_and/h3lbf9c/,0.086,0.703,0.211,0.3182
24,TD," webull is a much better RH,

fidelity, TD are good, but some tools are hard to use.",indicatorform,2,/r/investing/comments/ob2ayy/robinhood_to_pay_70m_for_false_information_and/h3lbf9c/,0.086,0.703,0.211,0.3182
25,RH, Some of us got in stupid early with doge into RH not realizing we don’t actually own any coins so now a bit tough to leave with our profits locked up,Rightseathopeful,2,/r/investing/comments/ob2ayy/robinhood_to_pay_70m_for_false_information_and/h3l8irc/,0.18,0.737,0.082,-0.3535
26,TD," Except you can do all the same things with TastyWorks, E-Trade, TD, Schwab, etc and also get the benefit of having a platform that works",ImagineAllTheKarma,5,/r/investing/comments/ob2ayy/robinhood_to_pay_70m_for_false_information_and/h3lg3rh/,0.0,0.885,0.115,0.4588
27,RH, I don't understand. Are you saying you have a doge position on RH that they won't let you liquidate?,jimmycarr1,5,/r/investing/comments/ob2ayy/robinhood_to_pay_70m_for_false_information_and/h3l8wdh/,0.0,1.0,0.0,0.0
28,TD," This is the problem, I've tried switching to Fidelity, TD, Etrade, but they're all miserable and the UI looks like it was designed on Windows 95.",n0lefin,83,/r/investing/comments/ob2ayy/robinhood_to_pay_70m_for_false_information_and/h3ldqu2/,0.19,0.71,0.1,-0.4404
29,UI," This is the problem, I've tried switching to Fidelity, TD, Etrade, but they're all miserable and the UI looks like it was designed on Windows 95.",n0lefin,83,/r/investing/comments/ob2ayy/robinhood_to_pay_70m_for_false_information_and/h3ldqu2/,0.19,0.71,0.1,-0.4404
30,RH," Ease of use will ALWAYS be the biggest factor of popularity imo. It's how streaming got popular, ehy crypto is being adopted more and why RH still continues to be popular. Make something easy to use and it markets itself.",Jfk_headshot,7,/r/investing/comments/ob2ayy/robinhood_to_pay_70m_for_false_information_and/h3ll793/,0.0,0.713,0.287,0.9201
31,GME," This, I moved my portfolio after the GME debacle but still have the app to look at charts and track my portfolio",whiskeynwaitresses,2,/r/investing/comments/ob2ayy/robinhood_to_pay_70m_for_false_information_and/h3lpvfg/,0.0,1.0,0.0,0.0
32,UI, but what about the commission free trading and cool UI and graphs and stuff,TheLilith_0,1,/r/investing/comments/ob2ayy/robinhood_to_pay_70m_for_false_information_and/h3lrlfr/,0.0,0.619,0.381,0.8126
33,RH," I don't wonder why people use it. I've been using RH as my taxable brokerage account for 4 years now lmao

Fidelity is the alternative for people who want to move away from investing apps",TechieFire,1,/r/investing/comments/ob2ayy/robinhood_to_pay_70m_for_false_information_and/h3lpq59/,0.0,0.856,0.144,0.6369
34,IMO, With more features comes complexity. I agree they are not as smooth as Robinhood but IMO Fidelity mobile and web are not complicated and simple for ordering.,pugRescuer,17,/r/investing/comments/ob2ayy/robinhood_to_pay_70m_for_false_information_and/h3lezx4/,0.0,0.935,0.065,0.1901
35,RH, Use an investing app and Yahoo Finance together. Also I got my money out of RH but still use it to keep lists and lookup tickers. You don't have to have money in it for market research. Yahoo finance is more reliable and has more insight though. It also has message boards for each ticker.,DystopianFigure,6,/r/investing/comments/ob2ayy/robinhood_to_pay_70m_for_false_information_and/h3ljzej/,0.0,1.0,0.0,0.0
36,UI, Ya but fixing your UI/UX is very easy compared to fixing the underpinnings of your business. I would choose Fidelity any day of the week over the Robinhood. When it comes to your financial security I can't believe I have to say this but the UI of your investing app is not top priority.,megamanxoxo,3,/r/investing/comments/ob2ayy/robinhood_to_pay_70m_for_false_information_and/h3lpeqq/,0.033,0.838,0.129,0.758
37,RH," I like WeBull for seeing a bunch of technical data that RH calls ""level 2"" and use SOFI if I want an easy interface",itzdylanbro,5,/r/investing/comments/ob2ayy/robinhood_to_pay_70m_for_false_information_and/h3ljda5/,0.0,0.729,0.271,0.6908
38,SOFI," I like WeBull for seeing a bunch of technical data that RH calls ""level 2"" and use SOFI if I want an easy interface",itzdylanbro,5,/r/investing/comments/ob2ayy/robinhood_to_pay_70m_for_false_information_and/h3ljda5/,0.0,0.729,0.271,0.6908
39,UI," Oh man I think Fidelity’s UI is pretty good. To be fair tho, I only trade on the computer bc I need to log the trade on a compliance website",twittalessrudy,2,/r/investing/comments/ob2ayy/robinhood_to_pay_70m_for_false_information_and/h3lkv9j/,0.0,0.732,0.268,0.8126
40,TD," For TD try Think or Swim, it’s slightly better",voneahhh,1,/r/investing/comments/ob2ayy/robinhood_to_pay_70m_for_false_information_and/h3lkwqx/,0.0,0.754,0.246,0.3832
41,TD," Have you tried Interactive Brokers?

I use that for trading, but use TD for the nice interface and charting.",t-ara-fan,1,/r/investing/comments/ob2ayy/robinhood_to_pay_70m_for_false_information_and/h3luo1j/,0.0,0.821,0.179,0.5719
42,RH, The least educated investors on Reddit would of course be using RH. If not them then who?,godstriker8,2,/r/investing/comments/ob2ayy/robinhood_to_pay_70m_for_false_information_and/h3lx8t2/,0.0,1.0,0.0,0.0
43,RH, Yet you see screenshots from RH on there everyday. They're not the brightest tools in the shed.,jelect,1,/r/investing/comments/ob2ayy/robinhood_to_pay_70m_for_false_information_and/h3lwxy2/,0.168,0.832,0.0,-0.4973
44,RH," I learned how to do basic investing with Robinhood. Used it exclusively for 6 years. Moved everything to Fidelity once I realized how risky it was to leave anything in RH, and now I love Fidelity Active Trader Pro. 

I now realize how much I disliked the portfolio graph in Robinhood. Down red days that showed my value plummeting gave me so much stress. Fidelity doesn’t have a portfolio chart (except in the beta version of their app) so it’s just tickers and numbers. It’s made me way less emotional about investing. Seeing -$1,000 with no graph attached to it is way less stress-inducing for me. I can’t speak for others but I’m really glad I switched. I’m a better investor now because of it.",Bambam9032,8,/r/investing/comments/ob2ayy/robinhood_to_pay_70m_for_false_information_and/h3lrwic/,0.063,0.815,0.122,0.8626
45,DHI," >Is systematic leverage as high as it was in '08?

No. Lending standards were crazy loose in '08, and are pretty tight now. This will prevent a crash. Everyone who is able to buy a house in the current market can afford it (assuming their life situation does not take a dramatic turn for the worse after purchase).  At most, I'd expect a moderate easing of prices as supply catches up to demand, prices become too high for people to afford, and interest rates rise. Most likely is that prices will continue to go up, but slower.

P.S.  


I own DHI, a homebuilder.",Kaawumba,87,/r/investing/comments/oawyqu/is_there_a_correction_looming_in_housing_prices/h3k45g1/,0.097,0.839,0.064,-0.3506
46,RE," Housing (and other assets ) have been on a tear because money is cheap to rent these days.  That needs to flow somewhere.  Absurd startup companies ?  Over-priced real estate ?  crazy P/Es on equities ?   One may argue that RE is over and above this forcing function and a small correction is due, but until the fed stops pumping ( which they may never do ), RE will continue.",manzanita2,3,/r/investing/comments/oawyqu/is_there_a_correction_looming_in_housing_prices/h3k56sx/,0.088,0.891,0.02,-0.5408
47,UK," In the UK demand is sky high and supply cannot keep up, entire buildings of apartments are sold before they're even built.

I know a couple who put their house up for sale and they had an acceptable offer within 24 hours, and the house they wanted to move to themselves sold within 3 days.

When demand is so high I can't see anyway at all that prices will come down.",SpaceBollzz,3,/r/investing/comments/oawyqu/is_there_a_correction_looming_in_housing_prices/h3l2z6y/,0.043,0.924,0.033,0.0772
48,DD," The Blackstone Group, the US's largest PE group has been on a buying spree of residential SFH real estate.  These folks have a huge amount of resources to research and DD the market and their investments.  So while we're all staring at all time high housing prices, we also have to take into account that big money is still seeing these prices as a viable entry point.",drewbakka,2,/r/investing/comments/oawyqu/is_there_a_correction_looming_in_housing_prices/h3ksp9d/,0.0,0.965,0.035,0.3182
49,APR," Short answer; no. 

Long answer: the increase in prices and perceived decrease in sales also corresponds with a decrease in new build houses being completed. Lack of labour, materials and funding caused by the covid lockdowns have hit the supply of new build houses entering the market. 

This has severely limited supply, resulting in the high prices. This means when the houses come to market, the prices will fall right, the supply increases again resulting on the price falling, simple economics. 

Except these new builds will be sold at an inflated price to cover the additional costs of labour and materials and account for the delays to construction.  If you take out $100 million loan to build 1000 new homes and your loan is 3% APR and each house costs 5% more because of the costs of materials and labour, but you were smart, so you budgeted for that. But the project has been delayed by 4 months as you struggle to find suppliers. It's not just the 5% cost of the houses, but also the interest on the additional 4 month where you can't pay off your loans because you haven't built the houses yet. 

So the new builds won't bring the prices down, but they will give more people the opportunity to buy. Its a sellers market, the developers can name their price. After all, people will always need somewhere to live. While speculative investors and people hedging against inflation will fill in the gaps. 

What it will do is increase the number of house sales back up to pre pandemic levels, which is the trigger that suggests a correction is incoming. 

And that ignores government intervention in the markets. If house prices start to fall over the medium to long term, banks stop offering mortgages, and start increasing interests rates. After all, they need to cover their own asses, and a depreciating house isn't going to work for them if the owner defaults on the mortgage. So what happens is the government moves in to prop up house prices. Offering help to buy schemes, offering loan guarantees. Offering straight up cash to help people buy homes. 

Why do they do this instead of just letting the crash happen? The majority of Americans own their own home, or has a mortgage. If the government let the housing market crash, that would be millions of people homeless and millions more losing the majority of their perceived wealth which is tied up in their home. No democratic government is going to let that happen. Until renters outnumber homeowners, you won't find a government willing to let the housing market crash. In the mean time they will try so hard to increase the number of homeowners through the aforementioned help to buy schemes in order to show on the surface at least that they care. While propping up the housing market for themselves, their wealthy friends and the millions of Americans that own their own homes.",Bendetto4,1,/r/investing/comments/oawyqu/is_there_a_correction_looming_in_housing_prices/h3lwnth/,0.07,0.827,0.103,0.9652
50,RE," I tend to agree about there not being some huge correction. But, RE is all about location. I think what we're seeing is similar to salaries. The super high areas pre-COVID are coming down a bit, while the places that were low are coming up because of WFH. I think a similar trend will happen in RE. Even if only 20% of people stay WFH, any of those people who live where the winters are bad are likely thinking about a moving south and/or to the coast.

I live in the south and houses are being sold the same day they go on market to people from the northeast looking to escape the winters.",mdatwood,2,/r/investing/comments/oawyqu/is_there_a_correction_looming_in_housing_prices/h3ktsnk/,0.075,0.849,0.077,0.0693
51,IMO," The WSJ has reported throughout the pandemic that millions of homeowners are behind on mortgage payments. Could actually be a pretty big deal IMO. It looks like the fed may attempt to continue to help these folks by passing some additional rules to make it harder to evict folks, but I think a mass eviction event is going to happen.

https://www.wsj.com/amp/articles/homeowners-behind-on-mortgages-to-be-offered-help-u-s-agency-says-11624913661",laylaandlunabear,28,/r/investing/comments/oawyqu/is_there_a_correction_looming_in_housing_prices/h3kcu8x/,0.063,0.848,0.089,-0.0772
52,DHI," In places like the high density parts of California, NIMBYism and red tape. In other areas, primarily homebuilder caution. Homebuilders remember 2008 and are afraid of it happening again. Material and labor costs are overblown as a problem for big, conservative operations like DHI, because the sale prices are so high.  


If you are trying to build a home on your own, that is an entirely different discussion.",Kaawumba,10,/r/investing/comments/oawyqu/is_there_a_correction_looming_in_housing_prices/h3kn1c5/,0.038,0.891,0.071,0.3182
53,UK," I don't know how well that holds true these days tbh. Landlords use renters to pay off their mortgages so you almost always end up paying more out as a renter, at least in the UK. Additionally, house prices shot up another 14% last year which is the biggest increase we've seen since 2004.

For me though, the main problem with renting is when you come to retire. Our salaries are very low here compared to the US (and pensions are paltry compared to what they used to be) and the idea of that is that you have fewer expenses as a pensioner. The main expense you have as a human is rent/mortgage but if you have a mortgage, that's paid off by the time you retire, which significantly reduces your outgoings. If you're renting on the other hand you're going to have less money coming in because you're on a shitty pension, but ever inflating living costs because you've had to rent forever.",_DeanRiding,21,/r/investing/comments/oawyqu/is_there_a_correction_looming_in_housing_prices/h3kmxcm/,0.065,0.888,0.046,-0.2967
54,NYC," >It was generally cheaper to rent a home of the same size (i.e. people will pay a premium to own a home)

That's not true, at least not for the US anymore. In almost any major city (or even smaller towns) and surrounding areas, unless you live in an absolute dump of an area, rent is always more expensive than mortgage for an equivalent house. We just bought a house and our monthly mortgage payment (30 years at 3% fixed) is about $1,370, and yet to rent a house of the same size and backyard space, etc. would cost over $2,500 a month. Before buying this house, we were in a tiny little 2-bedroom apartment in a much worse area (not the absolute ghetto but significantly worse than where we live now) and the rent was almost $1,100 a month. And we don't even live in an expensive part of the country. Now I'm sure there are specific instances where buying may be too expensive, like SF or NYC, but for most of the continental US, I'd say buying is still probably cheaper in the long run.",perennialpurist,2,/r/investing/comments/oawyqu/is_there_a_correction_looming_in_housing_prices/h3le9pp/,0.058,0.909,0.033,-0.3952
55,SF," >It was generally cheaper to rent a home of the same size (i.e. people will pay a premium to own a home)

That's not true, at least not for the US anymore. In almost any major city (or even smaller towns) and surrounding areas, unless you live in an absolute dump of an area, rent is always more expensive than mortgage for an equivalent house. We just bought a house and our monthly mortgage payment (30 years at 3% fixed) is about $1,370, and yet to rent a house of the same size and backyard space, etc. would cost over $2,500 a month. Before buying this house, we were in a tiny little 2-bedroom apartment in a much worse area (not the absolute ghetto but significantly worse than where we live now) and the rent was almost $1,100 a month. And we don't even live in an expensive part of the country. Now I'm sure there are specific instances where buying may be too expensive, like SF or NYC, but for most of the continental US, I'd say buying is still probably cheaper in the long run.",perennialpurist,2,/r/investing/comments/oawyqu/is_there_a_correction_looming_in_housing_prices/h3le9pp/,0.058,0.909,0.033,-0.3952
56,UK, I think they have similar schemes in the UK as well - although they are rare. I believe they're called Rent to Buy or something.,_DeanRiding,2,/r/investing/comments/oawyqu/is_there_a_correction_looming_in_housing_prices/h3kejoc/,0.0,0.909,0.091,0.2732
