,ticker,comment,username,score,permalink,neg,neu,pos,compound
0,IQ," I'm here for gain porn, loss porn, and low IQ plans for cornering rare vegetable markets.... Or any other market I didn't know existed

Edit: lots of really strong terrible ideas here boyos. Enough to fill the C suite of a fortune 500 company. I've got some research to do into honey fed rabbits which I'm going to buy with my winnings from shorting an entire country.",wingbatbear,4320,/r/wallstreetbets/comments/njizhs/when_did_this_subreddit_become_therapy/gz809wp/,0.102,0.76,0.138,0.574
1,CLOV, I made $73 on a quick CLOV options play.  Left my family behind because I'm a rich boy now.,powerbrows,629,/r/wallstreetbets/comments/njizhs/when_did_this_subreddit_become_therapy/gz7zmwj/,0.0,0.7,0.3,0.7184
2,DD, I honestly hope I never hear the term short squeeze ever again. Shit is like a cult. I only wanna see fresh DD and loss porn.,2high4life,7,/r/wallstreetbets/comments/njizhs/when_did_this_subreddit_become_therapy/gz8vm4g/,0.181,0.491,0.328,0.5859
3,GME," Come back when GME hits the 100,000% gain otherwise I don’t want to see it on here. We got GME specific subs we don’t need to swarm WSB",Alternative_Court542,7,/r/wallstreetbets/comments/njizhs/when_did_this_subreddit_become_therapy/gz918e8/,0.0,0.842,0.158,0.5719
4,GME," I have been coming to this sub since 2015, on several different accounts (paranoid med student who doesn't want to get cancelled). Anyways, it got like this when the number of Degenerates on here surpassed like 800k. We quintupled the number of subscribers after the GME thing, and sure welcome everyone, but the culture has been diluted. Lets bring back some of that good ole' WSB degeneracy",FedPrinter69420,35,/r/wallstreetbets/comments/njizhs/when_did_this_subreddit_become_therapy/gz83ri9/,0.015,0.801,0.184,0.8477
5,GME," Well, I invested all of my savings in GME before my wife and her girlfriend left me.  Now that is a stinger in the heart.  And, to make it worse, she took the strap-on with her.",ChrisR109,41,/r/wallstreetbets/comments/njizhs/when_did_this_subreddit_become_therapy/gz7v5qb/,0.083,0.86,0.056,-0.25
6,FOR, THANK YOU FOR THIS !!! Bunch of fucking softies in this bitch,kapkapsmack212,14,/r/wallstreetbets/comments/njizhs/when_did_this_subreddit_become_therapy/gz88gst/,0.289,0.537,0.174,-0.4841
7,GME," This sub became a support group and echo chamber after the GME episodes.

FFS, the general sentiment before was ""NO OPTION, NO CARE"", now buying shares is considered a YOLO lmao",simplenicc,12,/r/wallstreetbets/comments/njizhs/when_did_this_subreddit_become_therapy/gz8p4t8/,0.236,0.5,0.264,0.0603
8,GME, You should peruse the GME specific subs sometimes... They legit think they're superheroes in hand to hand combat with Darkseid and Thanos the Hedge Fund monsters. While holding 6 shares.,Great_Chairman_Mao,11,/r/wallstreetbets/comments/njizhs/when_did_this_subreddit_become_therapy/gz8ka7w/,0.067,0.694,0.239,0.7351
9,DTE," Although, I welcome loss porn under 6 figures as long as it was something idiotic like deep OTM FDs with 4 DTE",meanpeopelsuck19,3,/r/wallstreetbets/comments/njizhs/when_did_this_subreddit_become_therapy/gz8nj3s/,0.223,0.568,0.208,-0.1027
10,GME, I just hate all the GME posts.  Like really! Is this the only stock? The shit blew up already it was done on the first week or two.  Enough!,jwarnyc,3,/r/wallstreetbets/comments/njizhs/when_did_this_subreddit_become_therapy/gz8vafv/,0.223,0.707,0.071,-0.7494
11,GME, WSB has been ruined by this GME bullshit. I keep waiting for it to blow over but it's gotten to the insane conspiracy cult level now.  It's a goddamn travesty.,xpdx,9,/r/wallstreetbets/comments/njizhs/when_did_this_subreddit_become_therapy/gz8rxsn/,0.498,0.502,0.0,-0.9712
12,GME, This sub turned to shit a long time ago. But it was at least recognizable before GME,CallinCthulhu,18,/r/wallstreetbets/comments/njizhs/when_did_this_subreddit_become_therapy/gz8cl5p/,0.133,0.867,0.0,-0.3182
13,GME," GME has always been about selling a dream.  There is no gambling because GME can not fail, it (the holy squeeze) can only be pushed back by the very powerful yet somehow completely inept bad guys.

But it isn't a cult dude.",PortlandoCalrissian,8,/r/wallstreetbets/comments/njizhs/when_did_this_subreddit_become_therapy/gz8l7xz/,0.09,0.787,0.123,0.1236
14,AMC, It's literally all GME and AMC and <whatever other bullshit bagholdering stock of the day> now. Completely useless.,mackfactor,4,/r/wallstreetbets/comments/njizhs/when_did_this_subreddit_become_therapy/gz8s5ku/,0.301,0.699,0.0,-0.7841
15,GME, It's literally all GME and AMC and <whatever other bullshit bagholdering stock of the day> now. Completely useless.,mackfactor,4,/r/wallstreetbets/comments/njizhs/when_did_this_subreddit_become_therapy/gz8s5ku/,0.301,0.699,0.0,-0.7841
16,GME," I walked to school in the snow, uphill both ways. That was when i decided to invest in GME. 
I still walk to school but at least i got a participation award.",TheJacen,4,/r/wallstreetbets/comments/njizhs/when_did_this_subreddit_become_therapy/gz8du29/,0.0,0.846,0.154,0.6956
17,GME, Jokes on you! I invested in GME AFTER they left me! Hah hah hah… ![gif](emote|free_emotes_pack|cry),ZhangtheGreat,2,/r/wallstreetbets/comments/njizhs/when_did_this_subreddit_become_therapy/gz8cgax/,0.0,0.819,0.181,0.4359
18,AMC, So far AMC put me in negative,tax--evasion,2,/r/wallstreetbets/comments/njizhs/when_did_this_subreddit_become_therapy/gz8j4is/,0.381,0.619,0.0,-0.5719
19,AMC, AMC looking for squeeze this week ![gif](emote|free_emotes_pack|put_back),SlimDuckCurry,2,/r/wallstreetbets/comments/njizhs/when_did_this_subreddit_become_therapy/gz8pazj/,0.0,1.0,0.0,0.0
20,DD," Sorry, I was too busy doing my DD on the untapped African white-bellied pangolin scale market in Uganda to notice any drama in this sub.",abutteredbiscuit,2,/r/wallstreetbets/comments/njizhs/when_did_this_subreddit_become_therapy/gz8pqn6/,0.053,0.947,0.0,-0.0772
21,GME, I invested in GME before my wife and her boyfriend left me.,CheekyMonkeee,2,/r/wallstreetbets/comments/njizhs/when_did_this_subreddit_become_therapy/gz8q2rk/,0.0,1.0,0.0,0.0
22,GME," Bring it to the point. Just say, PLEASE write less about GME, I beg you.",Spiritual-Author1500,2,/r/wallstreetbets/comments/njizhs/when_did_this_subreddit_become_therapy/gz8yvev/,0.0,0.811,0.189,0.4648
23,GME, i've got 7 figure gains and 7 figure losses all in GME. it's not over. Not even close.,irishdud1,2,/r/wallstreetbets/comments/njizhs/when_did_this_subreddit_become_therapy/gz8z1tz/,0.141,0.733,0.126,-0.0772
24,GME," I invested in GME before my wife and her boyfriend left me.


R.I.P  OP.",Randytheadventurer,2,/r/wallstreetbets/comments/njizhs/when_did_this_subreddit_become_therapy/gz8zdyq/,0.0,1.0,0.0,0.0
25,MVIS," I see pussies posting unrealized three and four figure losses. Oh woe is me for I have neither the stomach or intelligence required to better my funds. JFC.

We joke about being stupid or whatever but the truth is that it's a way to shed some of the negative head space that occurs with losses. If you would cry about it, laugh about it instead, there will always be someone else with a higher loss.

Shit I took 20k in unrealized losses on the MVIS knife dropping. You know what I did? I sold worthless calls to other tards to the tune of 18k.

So for all you young/new bloods that came in because you saw a rocket on the news and didn't have any sense. Welcome to the casino, where bears make money, bulls make money, and stupid fucking paper handed shaky fear pigs get cut up for breakfast. Figure out which one you want to be and stick to it. If you don't know what to do the market will sort you the fuck out real quick.",SIMPressions,2,/r/wallstreetbets/comments/njizhs/when_did_this_subreddit_become_therapy/gz8zuf7/,0.24,0.675,0.086,-0.9892
26,GME," Thank you! I joined this sub 2 -2.5 years ago and left a few months back, because it became dumb. I want to see loss and gain porn, straight gambling. IDGAF about people’s feelings or GME tattoos.",Tron--187,2,/r/wallstreetbets/comments/njizhs/when_did_this_subreddit_become_therapy/gz934s1/,0.133,0.643,0.224,0.4199
27,DD," No jokes, I used to see a recommendation everyday on this subreddit. Without any DD, I would YOLO all my account into that one stock and either rack up a 500% return or go negative. 

Now it's all just memes...memes don't pay the bills.",blunt__nation,2,/r/wallstreetbets/comments/njizhs/when_did_this_subreddit_become_therapy/gz95jm9/,0.125,0.744,0.13,-0.1952
28,GME," My wife and her boyfriend left me to return to Bulgaria after I lost my $175 in GME stock, our life savings...",PeteyMcPetey,2,/r/wallstreetbets/comments/njizhs/when_did_this_subreddit_become_therapy/gz9hsdz/,0.103,0.897,0.0,-0.3182
29,TIL, TIL some people think WSB is weekndgunnit for stocks,in50mn14c,2,/r/wallstreetbets/comments/njizhs/when_did_this_subreddit_become_therapy/gz9ouj6/,0.0,1.0,0.0,0.0
30,GME," People thought they smelled easy money, after GME. Really what they were smelling was degenerate gamblers hemorrhaging money on FD's.",PublicAccessNetwork,2,/r/wallstreetbets/comments/njizhs/when_did_this_subreddit_become_therapy/gzaeltr/,0.0,0.868,0.132,0.4404
31,BIG," I think when >>other subreddits became... Cult. And really packed with shit, too.

As for myself, I am an XXXXX holder in the new microscopic pets business. Small view but promising BIG gains.",DeepThroatCumblast,2,/r/wallstreetbets/comments/njizhs/when_did_this_subreddit_become_therapy/gzaevi1/,0.066,0.755,0.179,0.6391
32,SPCE," When I arrived it was nothing but yolos, and tickers with great names like SPCE, or UFO",Mike_strikes,2,/r/wallstreetbets/comments/njizhs/when_did_this_subreddit_become_therapy/gzajr6z/,0.0,0.611,0.389,0.872
33,GME, I'm about to post a 8 figure gain on my GME account... Does that count?,TurboMan74,2,/r/wallstreetbets/comments/njizhs/when_did_this_subreddit_become_therapy/gzao1ik/,0.0,0.779,0.221,0.5267
34,GME, The sub has been monotone and boring ever since GME mooned.,Jeroen_Jrn,2,/r/wallstreetbets/comments/njizhs/when_did_this_subreddit_become_therapy/gzap656/,0.187,0.813,0.0,-0.3182
35,SPCE, SPCE APES to the mooooooon  literally!,captainflashh,2,/r/wallstreetbets/comments/njizhs/when_did_this_subreddit_become_therapy/gzaw0hz/,0.0,1.0,0.0,0.0
36,GME," Buy GME! Let me share a story about I invested in GME before my wife and her boyfriend left me.

It started during an afternoon ......",LimeEfficient,2,/r/wallstreetbets/comments/njizhs/when_did_this_subreddit_become_therapy/gz864p0/,0.0,0.902,0.098,0.3595
37,IQ," >low IQ plans for cornering rare vegetable markets

Lost me there. Have you seen the gourd futures? They're like 10x

WSB puts of up rare veggie commodity DDs that would put the CMEB and investment bankers to shame.",zxc123zxc123,2,/r/wallstreetbets/comments/njizhs/when_did_this_subreddit_become_therapy/gz8t572/,0.126,0.816,0.058,-0.4404
38,CLOV, We found the one guy that made money on CLOV,stejerd,222,/r/wallstreetbets/comments/njizhs/when_did_this_subreddit_become_therapy/gz87tjc/,0.0,1.0,0.0,0.0
39,CLOV, How???? There’s no monitor in existence with a refresh rate so fast that it’ll catch a CLOV uptick before it drops.,FrustraBation,7,/r/wallstreetbets/comments/njizhs/when_did_this_subreddit_become_therapy/gz93qjx/,0.149,0.851,0.0,-0.4871
40,TWNK, I’m up $8 on a single TWNK call so I guess you could say I’m a professional.,NotChristina,2,/r/wallstreetbets/comments/njizhs/when_did_this_subreddit_become_therapy/gz9ggv2/,0.0,1.0,0.0,0.0
41,GME, You spin that into a GME story and you got yourself a few thousand upvotes,ryanhuntermcb,138,/r/wallstreetbets/comments/njizhs/when_did_this_subreddit_become_therapy/gz7n0c0/,0.0,1.0,0.0,0.0
42,GME, I mean getting your wife and her boyfriend to leave you over GME is pretty retarded,hpdefaults,2,/r/wallstreetbets/comments/njizhs/when_did_this_subreddit_become_therapy/gz9qxqo/,0.244,0.597,0.159,-0.1779
43,OG," Such subs exist even today, you are not the only OG to want WSB back the way it was.",TechWiz717,3,/r/wallstreetbets/comments/njizhs/when_did_this_subreddit_become_therapy/gz8u93l/,0.0,0.933,0.067,0.0772
44,GME," Yeah it's just fucking sad now. ""My dog has cancer and when GME moons I'll finally be able to treat her the way she treated me.."" like shut the fuck up I dont care about your cancer dog and i dont care about your 500 dollars of gme you bought at the top.",A_Bored_Canadian,3,/r/wallstreetbets/comments/njizhs/when_did_this_subreddit_become_therapy/gz9peth/,0.294,0.576,0.129,-0.9293
45,MLM, I’ve been working on a business plan for indoor beekeeping - I’m leaning towards using a MLM distribution model so quick gain market share in the suburbs.,TheRiverInEgypt,6,/r/wallstreetbets/comments/njizhs/when_did_this_subreddit_become_therapy/gz8l30x/,0.104,0.7,0.196,0.4109
46,GME, GME to the mooooon 🚀🚀🚀,p00nslyr_86,24,/r/wallstreetbets/comments/njizhs/when_did_this_subreddit_become_therapy/gz7zrgb/,0.0,1.0,0.0,0.0
47,AMC," Can anyone explain what the difference between the GME and AMC movement is at this point ? I know for a fact this whole movement will lose steam, I see people who hold GME are pretending they’re going to get 6 figure share payouts any day now... 

Why are people so confident in AMC this time around ?",Repulsive-Instance-6,6,/r/wallstreetbets/comments/njizhs/when_did_this_subreddit_become_therapy/gz8cl8p/,0.046,0.817,0.137,0.6571
48,GME," Can anyone explain what the difference between the GME and AMC movement is at this point ? I know for a fact this whole movement will lose steam, I see people who hold GME are pretending they’re going to get 6 figure share payouts any day now... 

Why are people so confident in AMC this time around ?",Repulsive-Instance-6,6,/r/wallstreetbets/comments/njizhs/when_did_this_subreddit_become_therapy/gz8cl8p/,0.046,0.817,0.137,0.6571
49,GME, Atleast its a real GME share,Tobeboss98,34,/r/wallstreetbets/comments/njizhs/when_did_this_subreddit_become_therapy/gz7uf14/,0.0,0.645,0.355,0.296
50,APR, I received my shares for $420 dollars each. I'm so retarded I didn't sell them when they went to 300$ during the second runup. I was so certain it would jump to at least 10k a share that I financed a 5 million dollar yacht for my wife at 20% APR. Now my wife's boyfriend won't even let me film them anymore.,Rolltide-tolietpaper,14,/r/wallstreetbets/comments/njizhs/when_did_this_subreddit_become_therapy/gz7zsb5/,0.075,0.811,0.114,0.1027
51,SNDL, 2 shares of SNDL,Butthole--pleasures,163,/r/wallstreetbets/comments/njizhs/when_did_this_subreddit_become_therapy/gz89e0k/,0.0,0.476,0.524,0.296
52,AMC," >
Why are people so confident in AMC this time around ?

1) They got burned on GME and think that qualifies as ""experience"" and now they know better and AMC is to the moon

2) ) They missed out on GME and think that qualifies as ""experience"" and now they know better and AMC is to the moon

3)Sofa king cool",tony_boxacannoli,8,/r/wallstreetbets/comments/njizhs/when_did_this_subreddit_become_therapy/gz8eko7/,0.032,0.789,0.179,0.8755
53,GME," >
Why are people so confident in AMC this time around ?

1) They got burned on GME and think that qualifies as ""experience"" and now they know better and AMC is to the moon

2) ) They missed out on GME and think that qualifies as ""experience"" and now they know better and AMC is to the moon

3)Sofa king cool",tony_boxacannoli,8,/r/wallstreetbets/comments/njizhs/when_did_this_subreddit_become_therapy/gz8eko7/,0.032,0.789,0.179,0.8755
54,AMC, I have 1 call for it to go to 40. Which I know it won't but I have more puts on AMC once it got to 14 for Sept at 5 and I think that's gonna cashout nicely,Numerous_Atmosphere1,2,/r/wallstreetbets/comments/njizhs/when_did_this_subreddit_become_therapy/gz8j8n4/,0.0,0.89,0.11,0.5927
55,NOK," So calls on NOK it is 

🤣",tallnskinnymikey,2,/r/wallstreetbets/comments/njizhs/when_did_this_subreddit_become_therapy/gz8bg7j/,0.0,1.0,0.0,0.0
56,TURN," it looks like she's getting cues when to turn around... ""Ratings just dropped, MAKE HER TURN AROUND. \[turns around\] Okay they're back up. \[faces camera\] RATINGS TANKED TURN AROUND. \[turns back around\]""",maddogking31,3,/r/wallstreetbets/comments/nk3jy3/wsb_presents_chad_money/gzba9pi/,0.0,0.872,0.128,0.5267
57,SO," SO beautiful, I think I just fell in love... now if only this woman would get out of the way",thatguyjeff89,2,/r/wallstreetbets/comments/nk3jy3/wsb_presents_chad_money/gzb9z43/,0.0,0.775,0.225,0.7119
58,MOD, MOD HER,ionlyhold,2,/r/wallstreetbets/comments/nk3jy3/wsb_presents_chad_money/gzbbwba/,0.0,1.0,0.0,0.0
59,DD, I'm suddenly bullish on $JUGS and $ASS can someone get some DD on those!?,8008Z4EV4,2,/r/wallstreetbets/comments/nk3jy3/wsb_presents_chad_money/gzbgoj8/,0.0,1.0,0.0,0.0
60,SPCE, lol SPCE,casualinteger,2,/r/wallstreetbets/comments/nk3jy3/wsb_presents_chad_money/gzbj1kh/,0.0,0.263,0.737,0.4215
61,COIN, Good stuff but COIN is going to the moon,Smells_Like_Money,1,/r/wallstreetbets/comments/nk3jy3/wsb_presents_chad_money/gzb2gxk/,0.0,0.804,0.196,0.2382
62,IT," PLEASE BUY SPCE, NEARLY EVERY POST ON WSB IS ABOUT IT. And sell GAMESTOP STOCK NOW!! 😉",Spiritual-Author1500,1,/r/wallstreetbets/comments/nk3jy3/wsb_presents_chad_money/gzb7xey/,0.0,0.806,0.194,0.5599
63,ON," PLEASE BUY SPCE, NEARLY EVERY POST ON WSB IS ABOUT IT. And sell GAMESTOP STOCK NOW!! 😉",Spiritual-Author1500,1,/r/wallstreetbets/comments/nk3jy3/wsb_presents_chad_money/gzb7xey/,0.0,0.806,0.194,0.5599
64,REAL, REAL chad money comes from investing in $CHAD ! 🚀,Roqztar,1,/r/wallstreetbets/comments/nk3jy3/wsb_presents_chad_money/gzbfcha/,0.0,1.0,0.0,0.0
65,ON,  BULLISH ON THAT $ASS,Gamma_Wolf_69,1,/r/wallstreetbets/comments/nk3jy3/wsb_presents_chad_money/gzbhshp/,0.0,1.0,0.0,0.0
66,BIT," your translator is ""JUST A BIT OUT SIDE""!!!!!!!!!!!!!!!!!!!!!!!!!",Short-Let-4776,1,/r/wallstreetbets/comments/nk3jy3/wsb_presents_chad_money/gzbj59f/,0.0,1.0,0.0,0.0
67,UK, No I'm from Birmingham UK and tbh I have terrible piles so maybe look elsewhere,Mental_Amphibian4499,0,/r/wallstreetbets/comments/nk3jy3/wsb_presents_chad_money/gzao51i/,0.306,0.694,0.0,-0.6486
68,IRL, I'm not putting my hard earned tendies to an OF thot. I'll get some IRL pussy in Mexico and some cocaine to go with it.,tunesandthoughts,13,/r/wallstreetbets/comments/nk3jy3/wsb_presents_chad_money/gzbfdfr/,0.0,0.949,0.051,0.0762
69,HAS," ...I mean, honestly that HAS to be true",darkspd89,83,/r/wallstreetbets/comments/nk3jy3/wsb_presents_chad_money/gzazy50/,0.0,0.508,0.492,0.7003
70,DTE, They better teach their students how to properly leverage their student loans on 0 DTE Call Options,TheGrindIRL,1,/r/wallstreetbets/comments/njztgv/econ_teachers_in_20_years/gzb9cf3/,0.0,0.838,0.162,0.4404
71,AMC," Except he won’t be a teacher cause he will be rich AF if he followed the advice right now

AMC/GME to fucking Pluto",natebuffay22,1,/r/wallstreetbets/comments/njztgv/econ_teachers_in_20_years/gzbjmtr/,0.0,0.854,0.146,0.5574
72,IBKR," >ignoring emergency funds

You won't need one if you keep buying the dip. Or take out a 1.5% margin loan from IBKR in an emergency.",wishtrepreneur,4,/r/wallstreetbets/comments/njztgv/econ_teachers_in_20_years/gzau6bt/,0.191,0.809,0.0,-0.6369
73,LMAO, LMAO,fictionheadthegreat,2,/r/wallstreetbets/comments/njztgv/econ_teachers_in_20_years/gzb0pv9/,0.0,0.0,1.0,0.5994
74,GME, Fleece 'em!  Sell GME short at 227 and buy to cover at 195.  The take a plunge and short it at 192 buying at 140.  But the Floor is now 157: C-level.  550 million paid for 3.5 mill shares says 157 a share will be defended.  My vacation money and to buy 300 GME at 20.,StandardBorn1216,1,/r/wallstreetbets/comments/njztgv/econ_teachers_in_20_years/gzbfd54/,0.0,0.898,0.102,0.7088
75,SPCE," Bought SPCE at $54, pick me up pls 🤡",YouFailedx3,84,/r/wallstreetbets/comments/njtd5w/today_we_go_green_apes_spce/gz9mloo/,0.0,0.843,0.157,0.0772
76,SPCE," I'm with you, SPCE will be green again soon for me hopefully🚀🚀🚀",Raahaan,45,/r/wallstreetbets/comments/njtd5w/today_we_go_green_apes_spce/gz95tpb/,0.0,1.0,0.0,0.0
77,SPCE, SPCE was a supporting actor during the last meme rocket and went to $60.  If it becomes the Lead Actor it could go to $600,XAEA12Y,7,/r/wallstreetbets/comments/njtd5w/today_we_go_green_apes_spce/gz9kvcd/,0.0,0.888,0.112,0.4404
78,SPCE, SPCE should hit $50 today.,wise-smart,7,/r/wallstreetbets/comments/njtd5w/today_we_go_green_apes_spce/gz9pm60/,0.0,1.0,0.0,0.0
79,IT," IT should be tits up by now, congrats and fuck u ![gif](emote|free_emotes_pack|thumbs_up)",Commercial-Scheme551,3,/r/wallstreetbets/comments/njtd5w/today_we_go_green_apes_spce/gza7o8f/,0.333,0.468,0.199,-0.3164
80,SPCE, Let's go!!!!! SPCE to the MOON!!!!,Donlorenzo_23,3,/r/wallstreetbets/comments/njtd5w/today_we_go_green_apes_spce/gzb0p72/,0.0,1.0,0.0,0.0
81,SPCE, Hey I want to buy SPCE on margin too,Specimen_7,11,/r/wallstreetbets/comments/njtd5w/today_we_go_green_apes_spce/gz96afl/,0.0,0.843,0.157,0.0772
82,SPCE, starting to feel super hard fomo about SPCE now.,Eme_Pi_Lekte_Ri,5,/r/wallstreetbets/comments/njtd5w/today_we_go_green_apes_spce/gza9gtd/,0.114,0.569,0.317,0.5423
83,SPCE, I just dropped 200k on SPCE. I can't f\*\*cken post on this subreddit IDK why.,lunablueheeler,4,/r/wallstreetbets/comments/njtd5w/today_we_go_green_apes_spce/gzacr56/,0.151,0.849,0.0,-0.2808
84,SPCE, Is SPCE still shorted? If so it could be a little squeeze action because of the influx of new buyers since the test flight was successful.,jesse_6285,2,/r/wallstreetbets/comments/njtd5w/today_we_go_green_apes_spce/gzanthe/,0.0,0.863,0.137,0.5859
85,SPCE, Bought SPCE at $15. LET'S GOOOOOO,_MeatLoafLover,2,/r/wallstreetbets/comments/njtd5w/today_we_go_green_apes_spce/gzayuzo/,0.0,1.0,0.0,0.0
86,AMC," “How do you do fellow kids” — OP

Apes is for GME only, maaaaybe AMC too.",DanknugzBlazeit420,2,/r/wallstreetbets/comments/njtd5w/today_we_go_green_apes_spce/gz9hc16/,0.0,1.0,0.0,0.0
87,GME," “How do you do fellow kids” — OP

Apes is for GME only, maaaaybe AMC too.",DanknugzBlazeit420,2,/r/wallstreetbets/comments/njtd5w/today_we_go_green_apes_spce/gz9hc16/,0.0,1.0,0.0,0.0
88,GME, GME is the past.  SPCE is the future.,XAEA12Y,5,/r/wallstreetbets/comments/njtd5w/today_we_go_green_apes_spce/gz9kecp/,0.0,1.0,0.0,0.0
89,SPCE, GME is the past.  SPCE is the future.,XAEA12Y,5,/r/wallstreetbets/comments/njtd5w/today_we_go_green_apes_spce/gz9kecp/,0.0,1.0,0.0,0.0
90,AMC, AMC 🚀🚀,RightStatistician311,3,/r/wallstreetbets/comments/njtd5w/today_we_go_green_apes_spce/gz9hv6m/,0.0,1.0,0.0,0.0
91,GME, Anything besides GME is a silly distraction.,Ecstatic-Magician89,-1,/r/wallstreetbets/comments/njtd5w/today_we_go_green_apes_spce/gza4dne/,0.338,0.519,0.143,-0.3612
92,SPCE, Im new and learning. Should I buy stock in SPCE while it's under $30? Or are you guys up to thiswe other shenanigans like shorts and puts?,IcarusPrime1,1,/r/wallstreetbets/comments/njtd5w/today_we_go_green_apes_spce/gzbgbrf/,0.0,0.897,0.103,0.4329
93,DD, This entire subreddit is full of idiots who do no DD and follow like sheep,swagmasterblaster420,1,/r/wallstreetbets/comments/njtd5w/today_we_go_green_apes_spce/gzbhcme/,0.124,0.734,0.141,0.0772
94,AMC," GME AND AMC ONLY.....go make new community for ppl who care about SPCE.
Good luck on recovering your loses!✊🏽",PTex21,-7,/r/wallstreetbets/comments/njtd5w/today_we_go_green_apes_spce/gz9fyis/,0.0,0.63,0.37,0.8553
95,GME," GME AND AMC ONLY.....go make new community for ppl who care about SPCE.
Good luck on recovering your loses!✊🏽",PTex21,-7,/r/wallstreetbets/comments/njtd5w/today_we_go_green_apes_spce/gz9fyis/,0.0,0.63,0.37,0.8553
96,SPCE," GME AND AMC ONLY.....go make new community for ppl who care about SPCE.
Good luck on recovering your loses!✊🏽",PTex21,-7,/r/wallstreetbets/comments/njtd5w/today_we_go_green_apes_spce/gz9fyis/,0.0,0.63,0.37,0.8553
97,GME, Not GME. Not Ape.,THETAFURYBLESSEDBLAD,-3,/r/wallstreetbets/comments/njtd5w/today_we_go_green_apes_spce/gza7ks7/,0.0,1.0,0.0,0.0
98,VG," Hold it. If the flights start, there is a huge demand for it despite how SpaceX turns out. There are people that will still shell out for VG ticket. 

Main challenge was test flight and approval. Now it’s going to be scaling. Demand isn’t a problem. 

They’ll be fine I think.",AmbitiousPig,10,/r/wallstreetbets/comments/njtd5w/today_we_go_green_apes_spce/gza7fg6/,0.103,0.743,0.154,0.4215
99,SPCE, The SPCE must flow,BattlinBud,2,/r/wallstreetbets/comments/njtd5w/today_we_go_green_apes_spce/gzb9ng0/,0.0,1.0,0.0,0.0
100,TSLA," Could make the same argument for TSLA a few years ago since they were only truly affordable for people making over 100k a year. Even now, avg middle class worker making 65k a year shouldn't be buying a 60k car & doing so is financially irresponsible.",FreakingOutTheNGHBRD,2,/r/wallstreetbets/comments/njtd5w/today_we_go_green_apes_spce/gz9z9sw/,0.122,0.816,0.062,-0.4144
101,AMC," PLTR, AMC, MVIS...",doubleyodtarot,-4,/r/wallstreetbets/comments/njtd5w/today_we_go_green_apes_spce/gz9gi6m/,0.0,1.0,0.0,0.0
102,MVIS," PLTR, AMC, MVIS...",doubleyodtarot,-4,/r/wallstreetbets/comments/njtd5w/today_we_go_green_apes_spce/gz9gi6m/,0.0,1.0,0.0,0.0
103,PLTR," PLTR, AMC, MVIS...",doubleyodtarot,-4,/r/wallstreetbets/comments/njtd5w/today_we_go_green_apes_spce/gz9gi6m/,0.0,1.0,0.0,0.0
104,SPCE," &#x200B;

Always has been... https://iborrowdesk.com/report/SPCE",ShitFeeder,1,/r/wallstreetbets/comments/njtd5w/today_we_go_green_apes_spce/gzavgpv/,0.0,1.0,0.0,0.0
105,SPCE, Yeah SPCE is a pre-ape trade for sure. I think it was my last great trade before last March happened haha.,RhythmSectionJunky,2,/r/wallstreetbets/comments/njtd5w/today_we_go_green_apes_spce/gz9p3t8/,0.0,0.564,0.436,0.891
