,ticker,comment,username,score,permalink,neg,neu,pos,compound
126,CCS," This. ***ALL*** of the multinational big oils are investing in green energy, alt energy, CCS, etcetc. **It is literally part of the business.**

Trying to draw some conclusion that we can get some investment leverage via some assumed secret that we can pull by analyzing XOM's not-so secret plans because they are making investments in green energy is like say we can figure out which investments to make because big tobacco """"""knows"""""" some secret and we can draw from that by looking at which new addictive thing they are investing into be it addictive vaping, weed, alcohol, super-not-fentanyl, and/or addictive gambling/mobile games. 

We won't. Because they don't know some secret. Their actions are in the open. *And all the big oils are investing in green* ***because the alterative is to slowly decline and die.***

https://www.investopedia.com/articles/markets/030816/top-4-oil-companies-protect-environment-xom-sun.asp

* Shell has aimed to spend almost $2 billion a year on its ""New Energies"" division that it started in 2016. However, by 2020, it is falling slightly short of that target, with an estimated projection of total spending between $2 billion to $3 billion. Still, Shell is considered to be a leader in the clean energy sector.

* Prior to the terrible Gulf of Mexico oil spill in 2010, BP (BP), then called British Petroleum, was considered a very progressive company on climate change and alternative fuel research. BP has a long track record of operational transparency, and it routinely publishes sustainability reports. Even before its much-needed public relations campaign after the Gulf disaster, BP was championing its efforts to move ""Beyond Petroleum."" BP has pumped money into solar, wind, hydrogen, and other biofuel technologies. It's one of the largest renewable donors in the world. In its annual oil company rankings, activist group, Greenopia, placed BP in first place in 2008 and 2009. Greenopia is no longer active.

* Total is one of the largest oil companies in the world and owns a subsidiary by the name of Total Quadran. Formed in 2013 from a merger, Total Quadran's purpose is to provide access to renewable energy in the form of wind, solar, biomass, and hydropower. Total Quadran runs 11 wind farms and 35 solar plants. Total, with all of its subsidiaries, operates 300 renewable energy plants in France. It is committed to growing its renewable energy business, which can be seen through purchases of renewable firms, such as the Adani Group's solar portfolio for $510 million, and the development of new projects. Total is aiming for its renewable energy sector to account for 15% to 20% of sales by 2040.",zxc123zxc123,1,/r/investing/comments/olrlim/xom_what_does_exxon_know_that_we_dont_seem_to/h5jaluf/,0.025,0.9,0.075,0.9451
127,GDP," > You can just read the first page of the [Green New Deal](https://www.congress.gov/bill/116th-congress/house-resolution/109/text) to see what the expected economic and physical damages are from the top intergovernmental agencies:

#

> That's about a 2.5% GDP impact and one city's worth of real estate in 80 years if we overshoot the report's expectation by 50% and nothing else changes.

The people who wrote those projections are either incredibly stupid or lie on purpose to keep BAU going.

But you, a random redditor who isn't paid to write these reports and spread this propaganda (at least I hope you are not a paid bot/troll), are simply incredibly stupid for believing and spreading that bullshit.

Here is just a small hint on how stupid or criminally misleading these ""top intergovernmental agencies"" are https://www.youtube.com/watch?v=vwwvZ8g5eHE",UpAndDownArrows,-1,/r/investing/comments/olrlim/xom_what_does_exxon_know_that_we_dont_seem_to/h5ihrrt/,0.201,0.765,0.035,-0.98
128,GHG," At this point, I think we have to carbon capture the crisis away.

My off-the-cuff remark about the Arctic is a reference to a severe problem of the Arctic behaving more and more like the tropics each year.

Realize, the tropics are a steady approximately \~80deg F. Maybe 90deg F depending where you are.

Siberia hits the 80F range longer and longer each year...so does parts of Canada and Alaska.

You can see this by their seasonal NO2 productivity rate which dramatically starts increasing earlier in the years. Showing methanogenesis in full swing.  


Meaning it no longer matters if we cut all GHG emissions to zero.",DarthTrader357,0,/r/investing/comments/olrlim/xom_what_does_exxon_know_that_we_dont_seem_to/h5gfitn/,0.122,0.84,0.037,-0.8606
129,SOFI, So how does one apply this to stock trading? What should I be looking for exactly? Use SOFI as an example,LuxGang,0,/r/investing/comments/olz4j9/determining_real_bottoms_and_tops_and_nearterm/h5jcsam/,0.0,1.0,0.0,0.0
130,APD," It started out 4 funds (100% stock nearly 25 years), max out 401k, backdoor IRA and placed my bonus and deferred compensation in similar funds.  I also developed a series of blue chips using DRIPS (HON, KMB, APD, and a couple of utilities) - $100/month then move to $500/quarter.  Stop DRIPS contribution on retirement and still have not touch 401K, Roth and just recently tapped HON (my largest) to re-do kitchen.    

I lost a ton of money during dot-com boom (QCOM an others) - thought I was a ""f-ing genius"" that taught me slow and steady wins the race - too much trading and speculation will hurt you in the long run.  

I am not 100% a boglehead  and still have a number of speculative picks to keep my mind active - just so many pool/beach days and beers you can drink.",stickman07738,1,/r/investing/comments/olvvz1/beating_the_marketwhat_bogleheads_have_wrong/h5ihkye/,0.057,0.853,0.09,0.5719
131,HON," It started out 4 funds (100% stock nearly 25 years), max out 401k, backdoor IRA and placed my bonus and deferred compensation in similar funds.  I also developed a series of blue chips using DRIPS (HON, KMB, APD, and a couple of utilities) - $100/month then move to $500/quarter.  Stop DRIPS contribution on retirement and still have not touch 401K, Roth and just recently tapped HON (my largest) to re-do kitchen.    

I lost a ton of money during dot-com boom (QCOM an others) - thought I was a ""f-ing genius"" that taught me slow and steady wins the race - too much trading and speculation will hurt you in the long run.  

I am not 100% a boglehead  and still have a number of speculative picks to keep my mind active - just so many pool/beach days and beers you can drink.",stickman07738,1,/r/investing/comments/olvvz1/beating_the_marketwhat_bogleheads_have_wrong/h5ihkye/,0.057,0.853,0.09,0.5719
132,KMB," It started out 4 funds (100% stock nearly 25 years), max out 401k, backdoor IRA and placed my bonus and deferred compensation in similar funds.  I also developed a series of blue chips using DRIPS (HON, KMB, APD, and a couple of utilities) - $100/month then move to $500/quarter.  Stop DRIPS contribution on retirement and still have not touch 401K, Roth and just recently tapped HON (my largest) to re-do kitchen.    

I lost a ton of money during dot-com boom (QCOM an others) - thought I was a ""f-ing genius"" that taught me slow and steady wins the race - too much trading and speculation will hurt you in the long run.  

I am not 100% a boglehead  and still have a number of speculative picks to keep my mind active - just so many pool/beach days and beers you can drink.",stickman07738,1,/r/investing/comments/olvvz1/beating_the_marketwhat_bogleheads_have_wrong/h5ihkye/,0.057,0.853,0.09,0.5719
133,TV," Imagine due to technological advancements, automation and economies of scale the *real cost* of Manufacturing a TV today is half what it was 5 years ago.

Also imagine your savings from 5 years ago can buy a new TV today equivalent to what a new TV 5 years ago would have been.

The economist will tell you your savings from 5 years ago didn't lose value.

The goldbug will tell you your savings lost half their value.",snek-jazz,2,/r/investing/comments/olvvz1/beating_the_marketwhat_bogleheads_have_wrong/h5jywbw/,0.085,0.884,0.03,-0.4791
134,JPM," Drawing uptrend and downtrend, JPM could break up or down by late July. So the better play is to sell weekly cash secured put, I like the 147 strike for \~0.50 premium. Most will not make this trade, but I don't scoff at easy, free money. gl",RunningRainFireFlies,1,/r/investing/comments/olqh6t/jpm_next_run_outlook_week_of_july_19/h5gsrs1/,0.077,0.657,0.265,0.8612
135,JPM, For JPM to go below 147 it would have to be worse than it was during the Covid Crash.,DarthTrader357,1,/r/investing/comments/olqh6t/jpm_next_run_outlook_week_of_july_19/h5gukf3/,0.254,0.746,0.0,-0.7003
