,ticker,comment,username,score,permalink,neg,neu,pos,compound
184,SPCE, All the accounts supporting SPCE is 100 days old atleast with no activity. What the fuck happened,_Amberson_,25,/r/wallstreetbets/comments/njjj03/wsb_discussion_this_weekend/gz90a5j/,0.252,0.619,0.128,-0.4215
185,SPCE," As someone who knows his shit about SPCE, this is encouraging. Longest awaited catalyst for the stock ever was a huge success with many more to come in the next few months (I expect Branson to fly in July). 

Add to that that it’s dramatically oversold by people who didn’t do their research on Branson selling shares to keep Virgin Atlantic afloat, and Cathie Wood selling because she’s bleeding cash, with respectably high short interest and newfound confidence from institutions and buyers waiting to see that they still had what it takes?

Absolute rocket fuel, in my opinion. My cost average is around $9 for 1000 shares from the original COVID crash, and I have 15 $30 6/4c. I’ve held my shares for over a year through all of the ups and downs because I know the hype from Branson flying will be unlike anything we’ve ever seen before. 

It’s a literal spaceship ffs. I’m so hype for market open tomorrow",iannoyubadly,41,/r/wallstreetbets/comments/njjj03/wsb_discussion_this_weekend/gz81v9q/,0.062,0.787,0.151,0.9337
186,SPCE," SPCE is still so cheap, it's really a no-brainer. 🚀🚀🚀",Allinornothing89,12,/r/wallstreetbets/comments/njjj03/wsb_discussion_this_weekend/gz8h28w/,0.0,1.0,0.0,0.0
187,SPCE, Exactly what I love to see: SPCE right where it should be,Ballistic2021,15,/r/wallstreetbets/comments/njjj03/wsb_discussion_this_weekend/gz7ukhy/,0.0,0.704,0.296,0.6369
188,SPCE, Buy SPCE on Monday it is.  To the moon!,PatienceDefiant3905,18,/r/wallstreetbets/comments/njjj03/wsb_discussion_this_weekend/gz7v6tw/,0.0,1.0,0.0,0.0
189,OPEN, OPEN THE CASINOOOO 🚀,MoonrakerRocket,2,/r/wallstreetbets/comments/njjj03/wsb_discussion_this_weekend/gz8yc5l/,0.0,1.0,0.0,0.0
190,SPCE, SPCE to the moon! Loading up on Monday!,Terrible_Day1903,10,/r/wallstreetbets/comments/njjj03/wsb_discussion_this_weekend/gz8blbb/,0.0,1.0,0.0,0.0
191,AMC, The same hand full of stocks.... not a single Cannabis stock either. The whole sector is set for a squeeze like AMC and GME... Legalization right around the corner and no mention.,PencilVesterYo,4,/r/wallstreetbets/comments/njjj03/wsb_discussion_this_weekend/gz891nn/,0.063,0.774,0.163,0.5423
192,GME, The same hand full of stocks.... not a single Cannabis stock either. The whole sector is set for a squeeze like AMC and GME... Legalization right around the corner and no mention.,PencilVesterYo,4,/r/wallstreetbets/comments/njjj03/wsb_discussion_this_weekend/gz891nn/,0.063,0.774,0.163,0.5423
193,SPCE, PUTS on SPCE it is.,tommygunz007,4,/r/wallstreetbets/comments/njjj03/wsb_discussion_this_weekend/gz8byf2/,0.0,1.0,0.0,0.0
194,AMC, All i really took from this is that AMC is going to Andromeda,AMCMovieTheaters,3,/r/wallstreetbets/comments/njjj03/wsb_discussion_this_weekend/gz846gn/,0.0,1.0,0.0,0.0
195,GME, GME is the way! Can't wait for the market to open and buy more 💎,rrezonfrangu,4,/r/wallstreetbets/comments/njjj03/wsb_discussion_this_weekend/gz8637c/,0.0,1.0,0.0,0.0
196,GME, they shorted GME early,Le_Owl,1,/r/wallstreetbets/comments/njjj03/wsb_discussion_this_weekend/gz8awm9/,0.0,1.0,0.0,0.0
197,AMC, Can't believe how much this subreddit is still sleeping on AMC,PohakuPack,-4,/r/wallstreetbets/comments/njjj03/wsb_discussion_this_weekend/gz8bot0/,0.0,1.0,0.0,0.0
198,QS, Im feeling bullish on QS alreddy bounced of support and massive investments from Ford and VW $50+,FlipperDaddy69,1,/r/wallstreetbets/comments/njjj03/wsb_discussion_this_weekend/gz90o24/,0.0,0.781,0.219,0.4939
199,SPCE, I’m definitely going in long with SPCE let’s gooo,mousito1,1,/r/wallstreetbets/comments/njjj03/wsb_discussion_this_weekend/gz91vh4/,0.0,0.748,0.252,0.4019
200,SPCE, Does SPCE still have a higher short volume than GME?,DAFT-Life,1,/r/wallstreetbets/comments/njjj03/wsb_discussion_this_weekend/gz9atnq/,0.0,1.0,0.0,0.0
201,AMC," AMC is really a V12 with engine trouble, all it needs is a tune up and it’s ready to ROLLLLL",1ceUpSon,1,/r/wallstreetbets/comments/njjj03/wsb_discussion_this_weekend/gz9t40k/,0.127,0.755,0.118,-0.0516
202,API, Does Reddit have an API that easily allows this data to be collected?,P3zcore,1,/r/wallstreetbets/comments/njjj03/wsb_discussion_this_weekend/gza3a3r/,0.0,0.833,0.167,0.34
203,UWMC, Wtf happened to UWMC,Barrita323,1,/r/wallstreetbets/comments/njjj03/wsb_discussion_this_weekend/gzaotrp/,0.559,0.441,0.0,-0.5859
204,BB, where my BB apes at? This will be a good week. remember the ape army needs YOU to invest in BB stock and options!,moonordie69420,-3,/r/wallstreetbets/comments/njjj03/wsb_discussion_this_weekend/gz83sle/,0.0,0.873,0.127,0.4926
205,COIN, I’m in big on COIN. $250 was the reference price and everyone who bought pre IPO was selling when it went public. Now the markets own it and it is undervalued. My average is 285 and I’m looking for $600.,ReedB04,-1,/r/wallstreetbets/comments/njjj03/wsb_discussion_this_weekend/gz861jb/,0.0,1.0,0.0,0.0
206,BB, BB did me dirty this year hahaha,Mikeyyezzy,2,/r/wallstreetbets/comments/njjj03/wsb_discussion_this_weekend/gz9vfvk/,0.252,0.435,0.313,0.1779
207,RKT, Bag holding RKT. Fucking cursed stock. Bought at $17 a week ago and it hasn’t seen a green day since.,Mirikado,2,/r/wallstreetbets/comments/njjj03/wsb_discussion_this_weekend/gza97hd/,0.0,1.0,0.0,0.0
208,SPCE, SPCE has been a WSB autist endorsed stock since it was fucking conceived.,WhiskeyZuluMike,1,/r/wallstreetbets/comments/njjj03/wsb_discussion_this_weekend/gzbackm/,0.0,0.846,0.154,0.25
209,SPCE, I threw 1k at SPCE on friday. I am excited for tomorrow.,Enigmatic_Observer,8,/r/wallstreetbets/comments/njjj03/wsb_discussion_this_weekend/gz864va/,0.0,0.789,0.211,0.34
210,SPCE, Its so blatantly obvious when shit stocks are getting pushed look at all these low karma low age accounts pushing for SPCE to go to the moon lol,BearsGonnaCOPE,14,/r/wallstreetbets/comments/njjj03/wsb_discussion_this_weekend/gz820h1/,0.225,0.694,0.081,-0.6124
211,VG," I just look at how many crashes space x has had. They’ve got serious talent working there and still have so many accidents. That’s ultimately a good thing though cause it’s better to have them early in the R&D phase than later during actual missions. 

You just know VG is gonna end up having an incident but unlike space x, that’s it. They’re done if they have one single accident.",oneevilchicken,-2,/r/wallstreetbets/comments/njjj03/wsb_discussion_this_weekend/gz8j1pz/,0.096,0.826,0.078,-0.3158
212,GME," Ah, yes. 101 day old account with 0 activity whatsoever is 100% loading up on “the most talked about stock” on this subreddit. I bet.  GME to the fucking moon.",Tlix,7,/r/wallstreetbets/comments/njjj03/wsb_discussion_this_weekend/gz8m6j1/,0.0,0.909,0.091,0.4019
213,GME," There’s no way GME is still set for a short squeeze, is there ? I’m learning this stuff since I’m pretty new.

I thought GME sqoze back in January",Repulsive-Instance-6,-6,/r/wallstreetbets/comments/njjj03/wsb_discussion_this_weekend/gz8d4fn/,0.075,0.816,0.109,0.25
214,COIN, The underlying assets for COIN crashed by a ton today. Discussing the stocks is a proxy for discussion about [rule 4],cantadmittoposting,9,/r/wallstreetbets/comments/njjj03/wsb_discussion_this_weekend/gz7ql9e/,0.0,0.914,0.086,0.1779
215,SPCE, SPCE went to space on saturday for the first time. they are a space tourism company. this means they have an actual semblance of a product now. idk why this is so difficult for people to understand why its going to the moon monday,stepsword,8,/r/wallstreetbets/comments/njjj03/wsb_discussion_this_weekend/gz87n5a/,0.104,0.896,0.0,-0.5634
216,DD," It absolutely is still on, head to s u pe r s t o nk s and read the DD. They are a much nicer bunch there too I got to say",harambe_go_brrr,0,/r/wallstreetbets/comments/njjj03/wsb_discussion_this_weekend/gz907ye/,0.0,0.884,0.116,0.4404
217,FREE," Let me tell you why I will buy puts. 

The Theory of Robinhood and WallStreetBets.

• When people see something on WSB and they read all this dd, the first thing they might do, is buy, and chances are they will buy on RH as they are the dominant player in the retail WSB apes. 

• When you buy on RH, you are on a Margin Account which means you don't technically own the stock. You basically have an 'IOU' from RH and they take your money. 

• RH's goal is to fuck you out of your money. This means, if 10,000 people buy SPCE, they will take 10,000 and short. If they short and can drive the price down, of those 10,000 people who own IOU's half of them will sell back their IOU at the new short price (let's say 50%). This means RH just made 50% FREE MONEY on you AND they made money on the short & rebuy. So it's a win-win because retail sells and cries. They never really purchased SPCE, they just gave you an IOU for those shares. 

• So, when 10,000 apes drop 1,000,000 in cash, here is what happens. Due to ""payment for order flow"", Citadel sees that a million dollars of buys are coming. Price is $38. So, Citadel jumps that line, buying 1M also. So Citadel buys at $38, driving the price to $39, and retail buys drive the price at $39, pushing it to $40. This happens so fast, that retail doesn't get why they bought in at $38 but really paid $39. Then, Citadel sells at $40, making a $2 profit in SECONDS. and the price, literally SECONDS after you buy, at $39, which pushes it to $40, now drops back to $39 and sometimes even less. So you buy after Citadel buys and when you sell, you also sell after citadel, so you get fucked twice. You could hypothetically Buy at what you think is $38, and it processes at $39, and then the second later you sell, you think you are selling at $39 but because you are now BEHIND citadel in the sell too, you are selling at $38, effectively costing you to pay more, and sell less causing you to lose $1 within a second. But that doesn't really happen, so instead, they short. Shorting makes you sell because you panic, and they win. 

So, the news doesn't matter.

The only thing that matters is how much people from WSB buy. The more they buy, the more you bet against.",tommygunz007,6,/r/wallstreetbets/comments/njjj03/wsb_discussion_this_weekend/gz8fbjh/,0.051,0.897,0.052,-0.2161
218,RH," Let me tell you why I will buy puts. 

The Theory of Robinhood and WallStreetBets.

• When people see something on WSB and they read all this dd, the first thing they might do, is buy, and chances are they will buy on RH as they are the dominant player in the retail WSB apes. 

• When you buy on RH, you are on a Margin Account which means you don't technically own the stock. You basically have an 'IOU' from RH and they take your money. 

• RH's goal is to fuck you out of your money. This means, if 10,000 people buy SPCE, they will take 10,000 and short. If they short and can drive the price down, of those 10,000 people who own IOU's half of them will sell back their IOU at the new short price (let's say 50%). This means RH just made 50% FREE MONEY on you AND they made money on the short & rebuy. So it's a win-win because retail sells and cries. They never really purchased SPCE, they just gave you an IOU for those shares. 

• So, when 10,000 apes drop 1,000,000 in cash, here is what happens. Due to ""payment for order flow"", Citadel sees that a million dollars of buys are coming. Price is $38. So, Citadel jumps that line, buying 1M also. So Citadel buys at $38, driving the price to $39, and retail buys drive the price at $39, pushing it to $40. This happens so fast, that retail doesn't get why they bought in at $38 but really paid $39. Then, Citadel sells at $40, making a $2 profit in SECONDS. and the price, literally SECONDS after you buy, at $39, which pushes it to $40, now drops back to $39 and sometimes even less. So you buy after Citadel buys and when you sell, you also sell after citadel, so you get fucked twice. You could hypothetically Buy at what you think is $38, and it processes at $39, and then the second later you sell, you think you are selling at $39 but because you are now BEHIND citadel in the sell too, you are selling at $38, effectively costing you to pay more, and sell less causing you to lose $1 within a second. But that doesn't really happen, so instead, they short. Shorting makes you sell because you panic, and they win. 

So, the news doesn't matter.

The only thing that matters is how much people from WSB buy. The more they buy, the more you bet against.",tommygunz007,6,/r/wallstreetbets/comments/njjj03/wsb_discussion_this_weekend/gz8fbjh/,0.051,0.897,0.052,-0.2161
219,SPCE," Let me tell you why I will buy puts. 

The Theory of Robinhood and WallStreetBets.

• When people see something on WSB and they read all this dd, the first thing they might do, is buy, and chances are they will buy on RH as they are the dominant player in the retail WSB apes. 

• When you buy on RH, you are on a Margin Account which means you don't technically own the stock. You basically have an 'IOU' from RH and they take your money. 

• RH's goal is to fuck you out of your money. This means, if 10,000 people buy SPCE, they will take 10,000 and short. If they short and can drive the price down, of those 10,000 people who own IOU's half of them will sell back their IOU at the new short price (let's say 50%). This means RH just made 50% FREE MONEY on you AND they made money on the short & rebuy. So it's a win-win because retail sells and cries. They never really purchased SPCE, they just gave you an IOU for those shares. 

• So, when 10,000 apes drop 1,000,000 in cash, here is what happens. Due to ""payment for order flow"", Citadel sees that a million dollars of buys are coming. Price is $38. So, Citadel jumps that line, buying 1M also. So Citadel buys at $38, driving the price to $39, and retail buys drive the price at $39, pushing it to $40. This happens so fast, that retail doesn't get why they bought in at $38 but really paid $39. Then, Citadel sells at $40, making a $2 profit in SECONDS. and the price, literally SECONDS after you buy, at $39, which pushes it to $40, now drops back to $39 and sometimes even less. So you buy after Citadel buys and when you sell, you also sell after citadel, so you get fucked twice. You could hypothetically Buy at what you think is $38, and it processes at $39, and then the second later you sell, you think you are selling at $39 but because you are now BEHIND citadel in the sell too, you are selling at $38, effectively costing you to pay more, and sell less causing you to lose $1 within a second. But that doesn't really happen, so instead, they short. Shorting makes you sell because you panic, and they win. 

So, the news doesn't matter.

The only thing that matters is how much people from WSB buy. The more they buy, the more you bet against.",tommygunz007,6,/r/wallstreetbets/comments/njjj03/wsb_discussion_this_weekend/gz8fbjh/,0.051,0.897,0.052,-0.2161
220,LMAO, LMAO they have bots for this shit,_Amberson_,2,/r/wallstreetbets/comments/njjj03/wsb_discussion_this_weekend/gz9yx0i/,0.306,0.36,0.334,0.0984
221,RH, Pretty cool break down. Happened to me on a stop loss. Had it at 15$ RH sold it at 14.95.,ace_thebroker,1,/r/wallstreetbets/comments/njjj03/wsb_discussion_this_weekend/gz8glvi/,0.18,0.6,0.22,0.25
222,BB, BB has a market cap of $4.82 billion and 2020 revenue was $1.04 billion which is where I got he 4.63x valuation number from. I know that it’s a very simple way to value a company and there are a ton of other factors to consider but I feel like that’s a simple way to see if something is undervalued.,moneygrabber007,5,/r/wallstreetbets/comments/njjj03/wsb_discussion_this_weekend/gz8du05/,0.0,0.889,0.111,0.6249
223,GME," Stop losses are a bit different. 

So, let's say that a big whale sells GME on WeBull. Webull reports the new price at $14.95 from $15.95. RH wasn't there to actually see it decline as it was on another person's network, so when they get the information, it's already $14.95 and they weren't able to do anything. Now according to Matt Kohrs (youtuber) unless the price is ON robinhood, AND also HITS YOUR LIMIT EXACTLY it might not execute. Because it could go from $16 to $12 on the open market and by the time it's $12, RH can't react electronically to put you in there as it doesn't actually go step by step but one giant instant drop.",tommygunz007,3,/r/wallstreetbets/comments/njjj03/wsb_discussion_this_weekend/gz8hlly/,0.051,0.949,0.0,-0.6249
224,ON," Stop losses are a bit different. 

So, let's say that a big whale sells GME on WeBull. Webull reports the new price at $14.95 from $15.95. RH wasn't there to actually see it decline as it was on another person's network, so when they get the information, it's already $14.95 and they weren't able to do anything. Now according to Matt Kohrs (youtuber) unless the price is ON robinhood, AND also HITS YOUR LIMIT EXACTLY it might not execute. Because it could go from $16 to $12 on the open market and by the time it's $12, RH can't react electronically to put you in there as it doesn't actually go step by step but one giant instant drop.",tommygunz007,3,/r/wallstreetbets/comments/njjj03/wsb_discussion_this_weekend/gz8hlly/,0.051,0.949,0.0,-0.6249
225,RH," Stop losses are a bit different. 

So, let's say that a big whale sells GME on WeBull. Webull reports the new price at $14.95 from $15.95. RH wasn't there to actually see it decline as it was on another person's network, so when they get the information, it's already $14.95 and they weren't able to do anything. Now according to Matt Kohrs (youtuber) unless the price is ON robinhood, AND also HITS YOUR LIMIT EXACTLY it might not execute. Because it could go from $16 to $12 on the open market and by the time it's $12, RH can't react electronically to put you in there as it doesn't actually go step by step but one giant instant drop.",tommygunz007,3,/r/wallstreetbets/comments/njjj03/wsb_discussion_this_weekend/gz8hlly/,0.051,0.949,0.0,-0.6249
226,RH," I buy puts because the news doesn't matter. Only RH shorting matters. If 1M apes drop 1M in cash to push the price up, RH is going to take that M and instead, short. Maybe not today, but very very soon.",tommygunz007,6,/r/wallstreetbets/comments/njjj03/wsb_discussion_this_weekend/gz8fn3k/,0.065,0.908,0.026,-0.1373
227,GME, hey while we're talking did you get your conspiracy against GME check from Citadel yet this week? Todd in accounting said it should hit my account on Fridays but mine still hasn't come in,iannoyubadly,10,/r/wallstreetbets/comments/njjj03/wsb_discussion_this_weekend/gz85kqd/,0.062,0.937,0.0,-0.296
228,GME," A short squeeze is totally disconnected from any fundamental value. When you short a stock you have to return the shares. So all the buying pressure will be coming from the hedge funds when they are forced to buy back shares that they borrowed. The problem is you're a hedgefund and you shorted more stocks than are available because you've always been able to do whatever you've wanted to with no consequences. But now the only shares available are owned by apes who are not selling which drives the price to the moon. That's the situation in a nutshell. 

Other short squeezes have occured with 20% short interest but GME is at least 140% but with the way the numbers are being fudged and hidden, I'm thinking it's actually 200-500%. Based on what comparable situations we have, there's no way this isn't touching 100's of thousands per share and I'm betting it goes into the millions. It's not about money anymore, it's about justice for the 2008 crash and other thievery. Apes are dead set on holding until every hedgefund involved in this circus is liquidated. That's why this is on a completely different level than any other squeeze in history.",DavidoftheDoell,9,/r/wallstreetbets/comments/njx45g/apes_vs_msm_and_short_sellers/gzb3rau/,0.104,0.81,0.085,-0.6428
229,GME, short GME pussy,pimpek321,15,/r/wallstreetbets/comments/njx45g/apes_vs_msm_and_short_sellers/gza8x50/,0.0,1.0,0.0,0.0
230,GME, 🤟🏽😎 I am just trying to pick through all the hype and BS on GME and make a sound decision on if it is time to sell and get out or hold. I know all the “Diamond Hands” say hold but; some individuals would like to minimize losses and actually make a profit.,TheeEnemy7,-1,/r/wallstreetbets/comments/njx45g/apes_vs_msm_and_short_sellers/gzb5qy7/,0.063,0.812,0.125,0.5499
231,RH, Paper handed and still using RH.  Let’s try and get up to retard level.,Affectionate-Tree842,20,/r/wallstreetbets/comments/njz1pv/back_in_baby/gzb0trr/,0.207,0.793,0.0,-0.5267
232,GME," I am still diamond handing GME, but I don't ever see it getting out past 210+ anymore... to much built in day traders.",mbrzez2,-64,/r/wallstreetbets/comments/njz1pv/back_in_baby/gzav4l7/,0.0,0.922,0.078,0.1779
233,GME, I keep selling in the 170s-180s and going this is it for me for GME.  Take my profits and go invest in other places.  But then I keeping buying back in the 160s.  Love riding that volatility wave.  I’m sure I’ll get fucked on it one day soon,BillMahersPorkCigar,-33,/r/wallstreetbets/comments/njz1pv/back_in_baby/gzar4hn/,0.104,0.714,0.182,0.5574
234,GME, To force them to make GME trades even though they hate doing it.,Alternative_Spite_11,32,/r/wallstreetbets/comments/njz1pv/back_in_baby/gz9ypve/,0.236,0.764,0.0,-0.5719
235,GME, Ape no daytrade GME,justavibeO,23,/r/wallstreetbets/comments/njz1pv/back_in_baby/gzb9rv7/,0.423,0.577,0.0,-0.296
236,RH, The only thing RH hates is their servers working perfectly.,SendMeDogePls,40,/r/wallstreetbets/comments/njz1pv/back_in_baby/gza4mmc/,0.192,0.53,0.278,0.3182
237,GME, Why would it keep increasing? What is the target price for this? Last massive bump GME had is nowhere near target $ I see people throw around here - I don't understand where these numbers are coming from but I'll join the ride!,Badger00000,2,/r/wallstreetbets/comments/njz1pv/back_in_baby/gzb3get/,0.0,0.917,0.083,0.5349
238,RH," Yeah, little more than a month for my data and cost basis to get transfered. 3 days for my shares to go from RH to TD.",supersayanssj3,6,/r/wallstreetbets/comments/njz1pv/back_in_baby/gza54ft/,0.0,0.833,0.167,0.5267
239,TD," Yeah, little more than a month for my data and cost basis to get transfered. 3 days for my shares to go from RH to TD.",supersayanssj3,6,/r/wallstreetbets/comments/njz1pv/back_in_baby/gza54ft/,0.0,0.833,0.167,0.5267
240,SOL," SOL -   ReneSola Ltd -  Investors had bought $250 Million worth of SOL shares  at $25 before 3 months. Things have only got better in 3 months, so am hoping that SOL Goes up from 7.5 to 25 again very soon.  Preliminary results announced before 2 weeks look Excellent. Results tomorrow evening.",vkpar,1,/r/wallstreetbets/comments/njv8bt/ive_got_a_good_feeling_about_this_spce/gzab5ga/,0.0,0.753,0.247,0.9149
241,SPCE, !diamondhandsbot SPCE 6/18 $28 C,King_Tendie_69,1,/r/wallstreetbets/comments/njv8bt/ive_got_a_good_feeling_about_this_spce/gzbgm2i/,0.0,1.0,0.0,0.0
242,SPCE," I've still got high hopes. There's a lot of money being thrown against SPCE right now and it's actually weathering the storm decently. A lot of people made a lot of bets against this company and now they've got to get out of those bets without causing a squeeze. To do that, they need you to lose hope and sell to them.",fightingpillow,3,/r/wallstreetbets/comments/njv8bt/ive_got_a_good_feeling_about_this_spce/gz9z37z/,0.043,0.868,0.09,0.4588
243,EAST, I haven't been following EAST. Sorry. But it does look like they demolished all the earnings estimates!,fightingpillow,1,/r/wallstreetbets/comments/njv8bt/ive_got_a_good_feeling_about_this_spce/gza87oh/,0.062,0.749,0.189,0.5255
244,SPCE, Am i the only one that sees SPCE and always reads it as spice instead of space?  Starting to think my mom drank when she was pregnant,Gigidypaperhands,77,/r/wallstreetbets/comments/njubrl/daily_discussion_thread_for_may_24_2021/gz9pxwh/,0.0,1.0,0.0,0.0
245,GME, GME 🚀🚀🚀,jackm999rp,63,/r/wallstreetbets/comments/njubrl/daily_discussion_thread_for_may_24_2021/gza3viy/,0.0,1.0,0.0,0.0
246,COIN, CNBC Headline: Goldman Sachs confirmed COIN bag holder. Prays this headline will boost stock price 30%,Evander85,45,/r/wallstreetbets/comments/njubrl/daily_discussion_thread_for_may_24_2021/gz9gn73/,0.0,0.733,0.267,0.6249
247,SPCE," It’s seriously so inspiring to see SPCE doing good this morning. I met Sir Richard Branson when I was a young boy and he inspired me to pursue acting. Now I make minimum wage and live in a 200 sqr foot apartment in New York, follow your dreams.",binkyboy_,106,/r/wallstreetbets/comments/njubrl/daily_discussion_thread_for_may_24_2021/gz9jnbn/,0.033,0.729,0.238,0.8937
248,SPCE, Are you seriously buying SPCE at open after a 21% pre-market move?,derprondo,33,/r/wallstreetbets/comments/njubrl/daily_discussion_thread_for_may_24_2021/gz9qc1x/,0.145,0.855,0.0,-0.1779
249,SPCE, Stop scaring me away from SPCE and let me burn my money in peace,bigdaddi69420,24,/r/wallstreetbets/comments/njubrl/daily_discussion_thread_for_may_24_2021/gz9ponu/,0.26,0.561,0.179,-0.1531
250,SPCE, ARKX’s remaining 45 SPCE shares are printing. Lol,slammerbar,24,/r/wallstreetbets/comments/njubrl/daily_discussion_thread_for_may_24_2021/gz9c2b6/,0.0,0.545,0.455,0.6124
251,SPCE, SPCE 🚀🚀🚀🚀🚀🚀🚀🚀,Feisty_Tomatillo_938,23,/r/wallstreetbets/comments/njubrl/daily_discussion_thread_for_may_24_2021/gz9fyk1/,0.0,1.0,0.0,0.0
252,SPCE, Gonna be a whole lot of long term investors on SPCE,stonksupnoob,23,/r/wallstreetbets/comments/njubrl/daily_discussion_thread_for_may_24_2021/gz9lhzv/,0.0,1.0,0.0,0.0
