,ticker,comment,username,score,permalink,neg,neu,pos,compound
148,KOD, KOD up 40%.. And I don't know whether to sell or hold... smpf,Pomegranate_36,2,/r/pennystocks/comments/m632gx/daily_plays_march_16_2021/gr410uh/,0.0,1.0,0.0,0.0
149,PM, Does anyone know what's caused the PM jump for $CANF?,R1ch0C,2,/r/pennystocks/comments/m632gx/daily_plays_march_16_2021/gr48e9i/,0.0,1.0,0.0,0.0
150,ZOM, ZOM going brrr in March makes me happy because it means my research back in Jan is paying off big,LeoFireGod,2,/r/pennystocks/comments/m632gx/daily_plays_march_16_2021/gr4agip/,0.0,0.837,0.163,0.5719
151,DD," $HPNN

I know a lot of people have issues when they see HPNN mentioned, thinking it is a scam.  Definitely a risky, sub-penny play.  CEO has said on Twitter that he's releasing news today.  Supposedly Pink Compliant as of today.  Bid is creeping up above yesterday's close.  Could certainly be one to look at for quick movement.

There is a ton of other posts on HPNN.  Do your research here, and additional DD.  It could still be a scam.  But, the prospect of a press release gives more information on what is going on, and could be a short term catalyst to move the stock higher.",Yankeefan1970,2,/r/pennystocks/comments/m632gx/daily_plays_march_16_2021/gr4bbez/,0.084,0.828,0.088,-0.128
152,ZOM," Yesterday, I sold ZOM at 2.50, today I bought in at 2.55, yes it is down right now, ill hold till tomorrow morning. Plus it is it has a great track record for recovery.",Houghton1983,2,/r/pennystocks/comments/m632gx/daily_plays_march_16_2021/gr4d0w0/,0.074,0.745,0.181,0.6124
153,ZOM, ZOM always pretty volatile. Dont fear!,ConHerz,2,/r/pennystocks/comments/m632gx/daily_plays_march_16_2021/gr4dj13/,0.0,0.395,0.605,0.7286
154,SSY," got SSY @ 3.28$, shared it back when it was this price at premarket, doubled since then and then some..",DrFrostyBuds,2,/r/pennystocks/comments/m632gx/daily_plays_march_16_2021/gr4fs3b/,0.0,0.882,0.118,0.34
155,CTXR, I like CTXR,anrinator,2,/r/pennystocks/comments/m632gx/daily_plays_march_16_2021/gr4g58r/,0.0,0.286,0.714,0.3612
156,DNN, DNN will go back up!,yunggyett,2,/r/pennystocks/comments/m632gx/daily_plays_march_16_2021/gr4h6ey/,0.0,1.0,0.0,0.0
157,ZOM, ZOM is slowly going back up. My red is getting less and less.,Houghton1983,2,/r/pennystocks/comments/m632gx/daily_plays_march_16_2021/gr4h9rz/,0.0,1.0,0.0,0.0
158,ATNX, ATNX is best pharma play I can think of at the moment,Misha315,2,/r/pennystocks/comments/m632gx/daily_plays_march_16_2021/gr4o24c/,0.0,0.577,0.423,0.765
159,SNGX, Damn SNGX. Good start to the day is dying out.,ohmygodbeats7,2,/r/pennystocks/comments/m632gx/daily_plays_march_16_2021/gr5f8bb/,0.199,0.588,0.213,0.0516
160,TRCH, Also TRCH great buy at this price,TradewhileTeaching,2,/r/pennystocks/comments/m632gx/daily_plays_march_16_2021/gr5x73d/,0.0,0.594,0.406,0.6249
161,ASRT, Waiting for a microspike so that I can get out of ASRT with minor losses.,BogBogTheGreat,2,/r/pennystocks/comments/m632gx/daily_plays_march_16_2021/gr5z2ti/,0.184,0.816,0.0,-0.4019
162,ZOM, I think I’m selling ZOM at 3.10. I feel like there’s going to be a big sell off. I’m hoping it pulls back under $2 and I’ll re-enter.,DegenerativeSoldier,3,/r/pennystocks/comments/m632gx/daily_plays_march_16_2021/gr41glx/,0.0,0.813,0.187,0.6486
163,DNN, DNN to Infinity and Beyond.,ruck_my_life,2,/r/pennystocks/comments/m632gx/daily_plays_march_16_2021/gr47nc9/,0.0,1.0,0.0,0.0
164,BLU," Bought SOS, BLU, XSPA calls today. Hope they run tommorow.",777redditor,2,/r/pennystocks/comments/m632gx/daily_plays_march_16_2021/gr3l2ru/,0.0,0.756,0.244,0.4404
165,SOS," Bought SOS, BLU, XSPA calls today. Hope they run tommorow.",777redditor,2,/r/pennystocks/comments/m632gx/daily_plays_march_16_2021/gr3l2ru/,0.0,0.756,0.244,0.4404
166,XSPA," Bought SOS, BLU, XSPA calls today. Hope they run tommorow.",777redditor,2,/r/pennystocks/comments/m632gx/daily_plays_march_16_2021/gr3l2ru/,0.0,0.756,0.244,0.4404
167,DD," tbh I am putting a bunch into stuff that isn't pennies this week so not much I can talk about here, mostly I am just watching SHMP and NMGRF. If either go down much more I may increase my positions. 

The other two I'm keeping an eye on right now, MVMDF and AGNPF will hopefully just keep running at this point, they were up like 5-10% yesterday. I guess if they dip I might buy in one more time before the run up to catalysts but I've got decent sized positions in both already.

I was going to do some DD on a couple tickers I'm looking at opening positions in but I just haven't had time unfortunately.",Suspicious__Man,2,/r/pennystocks/comments/m632gx/daily_plays_march_16_2021/gr3qg68/,0.0,0.929,0.071,0.7134
168,SOS," Wishing I had sold at close yesterday. Why is everything down 5-10%??? SOS especially makes me sad, I thought it was finally time to shine!

Oh well, at least I have AABB today.",PsycheRevived,2,/r/pennystocks/comments/m632gx/daily_plays_march_16_2021/gr4i1yp/,0.096,0.767,0.137,-0.295
169,ZOM, Well ZOM ended fast. What a disappointment.,ssBurgy1484,1,/r/pennystocks/comments/m632gx/daily_plays_march_16_2021/gr4d9im/,0.351,0.426,0.223,-0.296
170,AGM," Might go into DSCR if my funds settle today. 

Watching all my others: RR (long hold), ETFM (tanking!), NVCN (bag holding), TLSS, NMGRF, AGM, EMH, 88E, KTRA (finally on the move, looking promising and with a 5-7 PT)",Phoolf,1,/r/pennystocks/comments/m632gx/daily_plays_march_16_2021/gr3lhh2/,0.0,0.923,0.077,0.4574
171,KTRA," Might go into DSCR if my funds settle today. 

Watching all my others: RR (long hold), ETFM (tanking!), NVCN (bag holding), TLSS, NMGRF, AGM, EMH, 88E, KTRA (finally on the move, looking promising and with a 5-7 PT)",Phoolf,1,/r/pennystocks/comments/m632gx/daily_plays_march_16_2021/gr3lhh2/,0.0,0.923,0.077,0.4574
172,NVCN," Might go into DSCR if my funds settle today. 

Watching all my others: RR (long hold), ETFM (tanking!), NVCN (bag holding), TLSS, NMGRF, AGM, EMH, 88E, KTRA (finally on the move, looking promising and with a 5-7 PT)",Phoolf,1,/r/pennystocks/comments/m632gx/daily_plays_march_16_2021/gr3lhh2/,0.0,0.923,0.077,0.4574
173,PDT," Does anyone know if there is a way to see your day trade history on Fidelity? On robinhood it shows you how close you are to being marked as a PDT, is there anything like that on Fidelity?",HonoraryFootStool,1,/r/pennystocks/comments/m632gx/daily_plays_march_16_2021/gr3xx1c/,0.0,0.924,0.076,0.4329
174,AM," Sector Update: Health Care Stocks Higher Pre-Bell Tuesday

3/16/21, 6:11 AM
09:11 AM EDT, 03/16/2021 (MT Newswires) -- Health care stocks were higher pre-bell Tuesday. The Health Care SPDR (XLV) was up 0.27% and the iShares NASDAQ Biotechnology Index (IBB) was gaining 0.59% recently.

Zomedica Pharmaceuticals (ZOM) was 6% higher after it reported the first veterinarian sale of its Truforma diagnostic platform and officially entered commercialization.

Moderna (MRNA) was up more than 3% after saying it has started dosing the first participants in the phase 2/3 study of mRNA-1273, its vaccine candidate against COVID-19, in children ages six months to under 12 years.

AstraZeneca (AZN) was gaining more than 2% after saying it will supply the US government an additional 500,000 doses of COVID-19 therapy AZD7442, extending a previous deal's value by $205 million.",Houghton1983,1,/r/pennystocks/comments/m632gx/daily_plays_march_16_2021/gr4hznt/,0.0,0.878,0.122,0.9485
175,ANCN, ANCN +40% for me. Damn feels nice seeing the same stocks I posted 5 hours ago while scanning premarket changes actually take off.,DrFrostyBuds,1,/r/pennystocks/comments/m632gx/daily_plays_march_16_2021/gr4i7n3/,0.11,0.776,0.114,0.0258
176,VBLT," Feeling bullish about VBLT. Earnings call tomorrow, got in 500 shares at 2.09",kazmir_yeet,1,/r/pennystocks/comments/m632gx/daily_plays_march_16_2021/gr4jbx1/,0.0,0.748,0.252,0.4019
177,UEC," Not sure what I put my money on exactly but noticed in on finvis UEC was mooning and got in with a small 10 shares at $2.92. It's sitting at $3.16 now.  Investing is fun when it's small money, right? Set a 10% trailing stop loss just in case though lol.

Edit: trailing stop set up to kick in at $3.29 now, officially a few dollars gain on the day. Probably too late to get in for anyone else.

Fin edit: sold @ $3.28, officially my first day trade.",JustMy2Centences,1,/r/pennystocks/comments/m632gx/daily_plays_march_16_2021/gr4llw1/,0.099,0.748,0.153,0.8186
178,TA," not good at TA whatsoever, still learning, but look at the 6 Month chart of $PONGF and the huge spike in volume these last few days. any insights ??  

edit; here’s the chart for reference https://i.imgur.com/9A6R63i.jpg",mmillyboi,1,/r/pennystocks/comments/m632gx/daily_plays_march_16_2021/gr4pu3y/,0.045,0.868,0.087,0.3832
179,ZOM, CLIS is my only penny that is up today.  But I did get into ZOM on the dip.,PoopSkipPotato,1,/r/pennystocks/comments/m632gx/daily_plays_march_16_2021/gr4sgzl/,0.0,1.0,0.0,0.0
180,MICT, MICT picking up some momentum. Excited to see this baby shine.,neontules,1,/r/pennystocks/comments/m632gx/daily_plays_march_16_2021/gr4tozj/,0.0,0.806,0.194,0.34
181,CANF, CANF jumped up great today,Cccourtooo,1,/r/pennystocks/comments/m632gx/daily_plays_march_16_2021/gr4zcy6/,0.0,0.494,0.506,0.6249
182,BKD, Ticker BKD,theman569007,1,/r/pennystocks/comments/m632gx/daily_plays_march_16_2021/gr5093w/,0.0,1.0,0.0,0.0
183,DD, What do we think about ILUS?  There was good DD write up on it yesterday but now I can’t find it,Shunt223,1,/r/pennystocks/comments/m632gx/daily_plays_march_16_2021/gr528r3/,0.0,0.907,0.093,0.2382
184,NAKD, What’s up with NAKD.. why is the talk of delisting going on??,dedox17,1,/r/pennystocks/comments/m632gx/daily_plays_march_16_2021/gr59v03/,0.0,1.0,0.0,0.0
185,TRCH," Holding TRCH, HITIF, CTRX",Carl_Wheezer20,1,/r/pennystocks/comments/m632gx/daily_plays_march_16_2021/gr5f8ud/,0.0,1.0,0.0,0.0
186,ASRT," ASRT is like a 12mo play now lol 

I dumped that shit after earnings call. It’s going nowhere",jab116,10,/r/pennystocks/comments/m632gx/daily_plays_march_16_2021/gr47io6/,0.252,0.44,0.308,0.1027
187,DNN," Same here, DNN did great yesterday 😁",Alternative_Weird_47,7,/r/pennystocks/comments/m632gx/daily_plays_march_16_2021/gr4b7vz/,0.0,0.549,0.451,0.6249
188,TBLT," Exactly. Just been scooping up more shares! AITX, HITIF, TBLT.",gatorjim5,1,/r/pennystocks/comments/m632gx/daily_plays_march_16_2021/gr4gg2l/,0.0,0.764,0.236,0.4186
189,ATNX, Had a look at ATNX. Wow. But this insane drop is highly unusual for the stock over time. What happened ?,lordsudbury,1,/r/pennystocks/comments/m632gx/daily_plays_march_16_2021/gr51g2h/,0.195,0.65,0.154,-0.0
190,ZOM," ZOM is down right now. But it is an amazing stock and company, with huge potential. But yes, I see ZOM in the 2-3 dollar range for a little while.",Houghton1983,1,/r/pennystocks/comments/m632gx/daily_plays_march_16_2021/gr4vmm8/,0.0,0.74,0.26,0.8316
191,NOK, So Pissed Off I Sold On Friday To Get In NOK,GetToIt247,3,/r/pennystocks/comments/m632gx/daily_plays_march_16_2021/gr3xo10/,0.333,0.667,0.0,-0.6697
192,ZOM, What you sitting at with ZOM,DegenerativeSoldier,2,/r/pennystocks/comments/m632gx/daily_plays_march_16_2021/gr4iyzf/,0.0,1.0,0.0,0.0
193,ASRT, You know ASRT will open up slightly but will close down!,FatCatLounge,1,/r/pennystocks/comments/m632gx/daily_plays_march_16_2021/gr4bdks/,0.0,1.0,0.0,0.0
194,KOD, Dip on LSE? Haven't noticed that.. All my stocks are fine.. RR.. KOD is up 40%.. Zinwald Lithium also up. No dip at all..,Pomegranate_36,1,/r/pennystocks/comments/m632gx/daily_plays_march_16_2021/gr41897/,0.087,0.913,0.0,-0.296
195,ASX," IBKR has the ASX and LSE tickers, but not the OTC one.",ReferenceBrief,1,/r/pennystocks/comments/m632gx/daily_plays_march_16_2021/gr4ikg8/,0.0,1.0,0.0,0.0
196,IBKR," IBKR has the ASX and LSE tickers, but not the OTC one.",ReferenceBrief,1,/r/pennystocks/comments/m632gx/daily_plays_march_16_2021/gr4ikg8/,0.0,1.0,0.0,0.0
197,IMO, I don’t think it is pumped and dumped. I think folks thought it was the next mdmp and got a little too excited thinking it was going to .50 next week. Doesn’t mean it is not a good investment IMO,HerbertSherbertYogi,2,/r/pennystocks/comments/m632gx/daily_plays_march_16_2021/gr57wri/,0.127,0.82,0.053,-0.456
198,SOS," Here's hoping. 

Also, I need to pick between a day trader mindset (see a good ROI, lock in profits regardless of overall price target) or a swing trader mindset (pick a price target, wait until the stock gets there to sell). Instead I keep holding things because I think they have future value and then regretting when they dip. 

SOS is one... I bought in at $8.15, and I keep thinking when I'm up even just a little bit I should sell and then I can buy the next dip, because I know it's going to happen. But I don't sell, because I feel like it will be $10+ soon, and then it dips $1.0 and I kick myself for not leveraging that to get profit or extra shares.",PsycheRevived,3,/r/pennystocks/comments/m632gx/daily_plays_march_16_2021/gr4si7m/,0.021,0.831,0.147,0.9313
199,INPX, I‘m hoping for INPX earnings play on 3/25,Cathi1995,1,/r/pennystocks/comments/m6c1ay/pennies_list_316/gr4vj9c/,0.0,0.536,0.464,0.6369
200,DD," Glad you like it. Takes a bit of effort but I enjoy sharing the information I'm already digging through on my own, if it benefits even just one DD.",Longjumping_College,11,/r/pennystocks/comments/m6c1ay/pennies_list_316/gr4xjoq/,0.0,0.592,0.408,0.9343
201,AVA," Ouch, got at peak huh? 

It's got a lot of good catalysts coming up with their new warehouse for quickship and financials. It slid hard though.

More info: 

10K in late April, and the Q1 10Q after that. Move into the new 130,000 sq ft. headquarters is on May 1st. That, combined with the “dramatically improved” 10K (Steve’s words) and the [new procurement system to get products out the door rapidly](https://finance.yahoo.com/news/robotic-assistance-devices-announces-quickship-140000220.html) in the new 130k sq ft. Headquarters. 

>Artificial Intelligence Technology Solutions, Inc., (OTCPK:AITX), today announced that its wholly-owned subsidiary Robotic Assistance Devices (RAD) has successfully launched its ‘QuickShip’ order turnaround process, utilizing the company’s enhanced procurement systems and new Irvine, California manufacturing facility.

> ""We introduced the concept of QuickShip back in early February, and it’s been very well received by our customers and prospects in the sales funnel,"" said Steve Reinharz, President and CEO of RAD. ""Two clients have taken immediate advantage of the program which has started with ROSA. These RAD solutions are deterring high-frequency security incidents the minute they’re installed. Who wouldn’t want to benefit from a reduction of incidents as quickly as possible, plus the added benefit of saving money right now?"" Reinharz affirmed.


Ties into the new facility well.

> RAD expects to confirm a move to a large-scale manufacturing expansion within the next few weeks. Demand for its high-volume, entry-level devices including ROSA and AVA, as well as requirements for ROAMEO production are driving this expansion. This broad expansion into a comprehensive assembly facility, likely located in Michigan, provides central access to RAD’s largest markets as well as easy access from RAD’s R&D center outside of Toronto, Canada.

&nbsp;

And their list of alliances [grows steadily for a really young startup](https://www.businesswire.com/news/home/20210311005251/en/Robotic-Assistance-Devices-Announces-Dealer-Agreement-with-DSI)

> HENDERSON, Nev.--(BUSINESS WIRE)--Artificial Intelligence Technology Solutions, Inc. (OTCPK:AITX) today announced that its wholly owned subsidiary Robotic Assistance Devices (RAD) has entered into an agreement with DSI Security Services, recently ranked by Security Magazine as one of the top security companies with over 4,500 employees, and more than $100 Million in Annual Revenue. Through this agreement, DSI will now make all of RAD’s autonomous remote security solutions available to their clients.


And [another one from January](https://www.businesswire.com/news/home/20210106005315/en/Artificial-Intelligence-Technology-Solutions-Robotic-Assistance-Devices-Announces-Dealer-Agreement-with-Protos-Security)

> HENDERSON, Nev.--(BUSINESS WIRE)--Artificial Intelligence Technology Solutions, Inc., (OTCPK:AITX), today announced that its wholly-owned subsidiary Robotic Assistance Devices (RAD) has signed Protos Security as a dealer for the entire suite of RAD products. Protos Security is a leader in nationwide security guard management, specializing in putting retail and commercial clients back in control of their security guard program by providing oversight to fulfill any assignment requested, reduce costs, increase incident reporting and ultimately deliver the peace of mind they expect.",Longjumping_College,1,/r/pennystocks/comments/m6c1ay/pennies_list_316/gr5ruuw/,0.006,0.802,0.192,0.9975
202,RAD," Ouch, got at peak huh? 

It's got a lot of good catalysts coming up with their new warehouse for quickship and financials. It slid hard though.

More info: 

10K in late April, and the Q1 10Q after that. Move into the new 130,000 sq ft. headquarters is on May 1st. That, combined with the “dramatically improved” 10K (Steve’s words) and the [new procurement system to get products out the door rapidly](https://finance.yahoo.com/news/robotic-assistance-devices-announces-quickship-140000220.html) in the new 130k sq ft. Headquarters. 

>Artificial Intelligence Technology Solutions, Inc., (OTCPK:AITX), today announced that its wholly-owned subsidiary Robotic Assistance Devices (RAD) has successfully launched its ‘QuickShip’ order turnaround process, utilizing the company’s enhanced procurement systems and new Irvine, California manufacturing facility.

> ""We introduced the concept of QuickShip back in early February, and it’s been very well received by our customers and prospects in the sales funnel,"" said Steve Reinharz, President and CEO of RAD. ""Two clients have taken immediate advantage of the program which has started with ROSA. These RAD solutions are deterring high-frequency security incidents the minute they’re installed. Who wouldn’t want to benefit from a reduction of incidents as quickly as possible, plus the added benefit of saving money right now?"" Reinharz affirmed.


Ties into the new facility well.

> RAD expects to confirm a move to a large-scale manufacturing expansion within the next few weeks. Demand for its high-volume, entry-level devices including ROSA and AVA, as well as requirements for ROAMEO production are driving this expansion. This broad expansion into a comprehensive assembly facility, likely located in Michigan, provides central access to RAD’s largest markets as well as easy access from RAD’s R&D center outside of Toronto, Canada.

&nbsp;

And their list of alliances [grows steadily for a really young startup](https://www.businesswire.com/news/home/20210311005251/en/Robotic-Assistance-Devices-Announces-Dealer-Agreement-with-DSI)

> HENDERSON, Nev.--(BUSINESS WIRE)--Artificial Intelligence Technology Solutions, Inc. (OTCPK:AITX) today announced that its wholly owned subsidiary Robotic Assistance Devices (RAD) has entered into an agreement with DSI Security Services, recently ranked by Security Magazine as one of the top security companies with over 4,500 employees, and more than $100 Million in Annual Revenue. Through this agreement, DSI will now make all of RAD’s autonomous remote security solutions available to their clients.


And [another one from January](https://www.businesswire.com/news/home/20210106005315/en/Artificial-Intelligence-Technology-Solutions-Robotic-Assistance-Devices-Announces-Dealer-Agreement-with-Protos-Security)

> HENDERSON, Nev.--(BUSINESS WIRE)--Artificial Intelligence Technology Solutions, Inc., (OTCPK:AITX), today announced that its wholly-owned subsidiary Robotic Assistance Devices (RAD) has signed Protos Security as a dealer for the entire suite of RAD products. Protos Security is a leader in nationwide security guard management, specializing in putting retail and commercial clients back in control of their security guard program by providing oversight to fulfill any assignment requested, reduce costs, increase incident reporting and ultimately deliver the peace of mind they expect.",Longjumping_College,1,/r/pennystocks/comments/m6c1ay/pennies_list_316/gr5ruuw/,0.006,0.802,0.192,0.9975
203,HPQ," [They just got uplisted today to OTCQX](https://www.prnewswire.com/news-releases/otc-markets-group-welcomes-hpq-silicon-resources-inc-to-otcqx-301248124.html)

And [this came out 2 weeks ago.](https://www.globenewswire.com/news-release/2021/03/04/2187563/0/en/HPQ-Well-funded-to-Advance-Its-Silicon-and-Nano-silicon-Materials-Initiatives-in-Both-Batteries-Hydrogen.html)

> “With access to over $19 M, HPQ has the necessary funds to continue its research and development to commercialization, of our PUREVAP™ family of processes. The funds available will also allow HPQ to investigate other potential game – changing opportunities. HPQ continues to look for synergistic opportunities in order to remain at the forefront of innovative processes for the storage and delivery of clean renewable energy,” said Bernard Tourillon, Chairman and CEO of HPQ Silicon Resources Inc. “HPQ’s Silicon R&D Consortium has the depth and flexibility to meet the challenges, as we strive to produce products for renewable energy storage participants and electric vehicle manufacturers, each of which is searching for cost-effective ways to increase the Silicon content of their batteries. We are very confident that the Silicon materials we are developing, with our expected low-cost scalable processes, will be in high demand for batteries, and by EV manufacturers and other participants in the ongoing renewable energy revolution.”


We just need the market to stop trading down and sideways",Longjumping_College,2,/r/pennystocks/comments/m6c1ay/pennies_list_316/gr605d8/,0.019,0.848,0.133,0.9623
204,PYR," I saw the uplisting but not the second part. That is great news. You’re probably right, it’s just a weird market right now. I don’t have any doubts about them or PYR",1HUNDREDtrap,2,/r/pennystocks/comments/m6c1ay/pennies_list_316/gr61vh4/,0.133,0.712,0.155,0.4215
205,BIO," This stock *seems* to be moving quite a bit on the news that is released lately.

If you look at the three month chart there is a massive drop in December 2020, which followed after the press release that the phase III trial on SGX942 was unsuccessfull.

Then in January 2021 news came out that Soligenix would host a webcast event on the commercialisation of  SGX301, which was followed by a small price increase.

Finally there was a small price surge around 18 February, just after news was made public that Soligenix would present at the 2021 BIO & CEO Investor Digital Conference (news was released Feb 11th, Conference was held Feb 16-18th).

Of course the news and the price changes could be completely unrelated, no way to prove or debunk this, but I personally do find it reassuring to myself that there seems to be a clarification for recent price fluctuations *and* I like it when a stock at least seems to respond to the news/cataclysts that it gets.

&#x200B;

List of news releases on Soligenix website for verification: [http://ir.soligenix.com/news-releases?l=100](http://ir.soligenix.com/news-releases?l=100)

&#x200B;

Edit: Spelling/layout",etrulzz,7,/r/pennystocks/comments/m67p7p/sngx_soligenix_a_rare_gem_in_a_rare_desease_world/gr4adsi/,0.018,0.933,0.049,0.7594
206,III," This stock *seems* to be moving quite a bit on the news that is released lately.

If you look at the three month chart there is a massive drop in December 2020, which followed after the press release that the phase III trial on SGX942 was unsuccessfull.

Then in January 2021 news came out that Soligenix would host a webcast event on the commercialisation of  SGX301, which was followed by a small price increase.

Finally there was a small price surge around 18 February, just after news was made public that Soligenix would present at the 2021 BIO & CEO Investor Digital Conference (news was released Feb 11th, Conference was held Feb 16-18th).

Of course the news and the price changes could be completely unrelated, no way to prove or debunk this, but I personally do find it reassuring to myself that there seems to be a clarification for recent price fluctuations *and* I like it when a stock at least seems to respond to the news/cataclysts that it gets.

&#x200B;

List of news releases on Soligenix website for verification: [http://ir.soligenix.com/news-releases?l=100](http://ir.soligenix.com/news-releases?l=100)

&#x200B;

Edit: Spelling/layout",etrulzz,7,/r/pennystocks/comments/m67p7p/sngx_soligenix_a_rare_gem_in_a_rare_desease_world/gr4adsi/,0.018,0.933,0.049,0.7594
207,SNGX," Haha your too kind

Always manage your risk, SNGX is a very fruit full and potentially safe stock

As is the case with SURGE also

RMLFF is just a high risk/binary play and should only constitute a very small portion of your portfolio :)",aimtitan,3,/r/pennystocks/comments/m67p7p/sngx_soligenix_a_rare_gem_in_a_rare_desease_world/gr45ije/,0.041,0.676,0.284,0.9118
208,SNGX," So once a New Drug Application (NDA) is filed to FDA, FastTrack approved drugs take up to 6months for approval.

The unique thinG about SNGX is its clinical trials included specialists which the FDA consults for approval. And given the very specific scope of the drug and a lack of any FDA approved drugs which are safe for this condition in the market, this by default supersedes existing options",aimtitan,5,/r/pennystocks/comments/m67p7p/sngx_soligenix_a_rare_gem_in_a_rare_desease_world/gr4939f/,0.029,0.782,0.188,0.9081
