,ticker,comment,username,score,permalink,neg,neu,pos,compound
54,DIDI," I'd give even odds DIDI will end up being delisted, and deservedly. I'm surprised it's not down 25% today. Yet. Some people just don't pay attention to their ""investments"" though. I moved about 25% of my portfolio into itm DIDI puts at open this morning.",TheseYoung6546,1,/r/investing/comments/opa3e5/daily_general_discussion_and_spitballin_thread/h64yxav/,0.0,0.929,0.071,0.2951
55,DD, Awesome. I’ll do some DD. Thanks,LilPeePee93,1,/r/investing/comments/opa3e5/daily_general_discussion_and_spitballin_thread/h65uxab/,0.0,0.364,0.636,0.7906
56,AAPL," Wait, I thought we are here to lose money?? ;)
At this stage, that would be a tough calculation for me (although I’d say if I could do it over I’d go stocks)... but I think the more helpful way to look at it is from your perspective. What is the total amount of money you are talking about and assess some plausible options. Let’s say you have 150k for a down payment (around here you might be able to get a condo and then would get enough rent to cover mortgage and HOA, hopefully property tax and insurance - but let’s keep it simple and say it covers expenses and you build equity until the house is paid off). What can that same 150k get you in theta gang land? Over a thousand shares of AAPL and selling covered calls would probably allow you to make more money and then you can via rent and you can continually reinvest and grow that. Sure taxes are higher, but paying taxes really is a privilege. I will say that the covered call route does require some discipline though - and it’s a good idea to set up a mechanical approach to it (eg every Monday I sell weekly calls at x% above price; if I get assigned so be it; I dick around too much sometimes trying to time a pop/ increased IV/ etc a long term I don’t think it has paid off and is too much time investment). Does aapl beat house value increases long term... Who knows!",4chonkybonk,1,/r/investing/comments/opa3e5/daily_general_discussion_and_spitballin_thread/h654t55/,0.03,0.852,0.118,0.9732
57,IMO," Not really. You could try doing research, reading articles about the company but really trying to play earnings reports is IMO not a very good idea and definitely not something I try to do. Additionally, stock could run up into earnings and get to a point where it's priced for ""great"" and goes down because earnings were merely good. 

Or earnings are good and the forward commentary isn't great so the stock goes down (people are concerned more with forward-looking statements vs the quarter that just happened.)  Or maybe the market is ""risk off"" broadly during a period and people are more demanding and what looks like a good quarter on the surface might get sold off.

So many people come on here and go ""WHY IS MY STOCK DOWN EARNINGS WERE GOOD!?!?!"" and they're just looking at the headline that their co beat earnings, they didn't read the commentary or look at the guidance. 

Personally, earnings for me are sometimes a chance to pick something up if I think a negative reaction to earnings is overdone and it's a time to basically check up on how a company I own is doing and listen to the conference call. It's not something that I try to bet on specifically. Like someone else said, if there was any predictable way to play earnings, we wouldn't be on here.",dvdmovie1,5,/r/investing/comments/opa3e5/daily_general_discussion_and_spitballin_thread/h64z4je/,0.119,0.803,0.078,-0.9074
58,IS," Not really. You could try doing research, reading articles about the company but really trying to play earnings reports is IMO not a very good idea and definitely not something I try to do. Additionally, stock could run up into earnings and get to a point where it's priced for ""great"" and goes down because earnings were merely good. 

Or earnings are good and the forward commentary isn't great so the stock goes down (people are concerned more with forward-looking statements vs the quarter that just happened.)  Or maybe the market is ""risk off"" broadly during a period and people are more demanding and what looks like a good quarter on the surface might get sold off.

So many people come on here and go ""WHY IS MY STOCK DOWN EARNINGS WERE GOOD!?!?!"" and they're just looking at the headline that their co beat earnings, they didn't read the commentary or look at the guidance. 

Personally, earnings for me are sometimes a chance to pick something up if I think a negative reaction to earnings is overdone and it's a time to basically check up on how a company I own is doing and listen to the conference call. It's not something that I try to bet on specifically. Like someone else said, if there was any predictable way to play earnings, we wouldn't be on here.",dvdmovie1,5,/r/investing/comments/opa3e5/daily_general_discussion_and_spitballin_thread/h64z4je/,0.119,0.803,0.078,-0.9074
59,CSCO," So what happened to you is called ""getting stopped out"" and it's a dumb risk that you never have to expose yourself to. I had fun in my last post but I'll explain more about what you ***probably should do.***

1. Buy 100 shares @ reasonable stock and price. If you like Amazon, CSCO may be reasonable alternative though it's in the 50s price range. Tech sector - strong - good dividend. Yatta yatta.
2. Sell a covered call @ strike price  you're willing to sell. Ideally put it in the expected move range. Delta = About 30. Or if you think the stock will go down (hence you want to sell out of it), sell a call at a strike somewhere in the money.
3. use the covered call to buy a put.
4. Using JPM as an example: Sell a covered call at $150 strike for $275 and buy a put for $117 dollars. You get paid $158 dollars to lock in a price between now and $149.
5. If the price is going to drop below $149 you simply buy back the covered call (Buy to Close) which will now be cheaper or if it falls out of the money you don't even need to worry about it, it expires worthless.
6. Exercise the put and sell your shares for $149, a price close to the top you wanted to sell out at anyway.

Voilla - a collar, in a nutshell.

You literally got paid to **EXIT** a stock when **YOU** wanted to.",DarthTrader357,1,/r/investing/comments/opgoea/i_have_a_question_regarding_trailing_limit_order/h65kdve/,0.078,0.811,0.112,0.8799
60,JPM," So what happened to you is called ""getting stopped out"" and it's a dumb risk that you never have to expose yourself to. I had fun in my last post but I'll explain more about what you ***probably should do.***

1. Buy 100 shares @ reasonable stock and price. If you like Amazon, CSCO may be reasonable alternative though it's in the 50s price range. Tech sector - strong - good dividend. Yatta yatta.
2. Sell a covered call @ strike price  you're willing to sell. Ideally put it in the expected move range. Delta = About 30. Or if you think the stock will go down (hence you want to sell out of it), sell a call at a strike somewhere in the money.
3. use the covered call to buy a put.
4. Using JPM as an example: Sell a covered call at $150 strike for $275 and buy a put for $117 dollars. You get paid $158 dollars to lock in a price between now and $149.
5. If the price is going to drop below $149 you simply buy back the covered call (Buy to Close) which will now be cheaper or if it falls out of the money you don't even need to worry about it, it expires worthless.
6. Exercise the put and sell your shares for $149, a price close to the top you wanted to sell out at anyway.

Voilla - a collar, in a nutshell.

You literally got paid to **EXIT** a stock when **YOU** wanted to.",DarthTrader357,1,/r/investing/comments/opgoea/i_have_a_question_regarding_trailing_limit_order/h65kdve/,0.078,0.811,0.112,0.8799
61,OUT," Why use a trailing limit order when you can use a put option? Sell a call at the price you want to sell at and the premium covers any down side as if a limit order is in place. Rinse and repeat if the price goes up by less than the strike at which you sold the call.

Collar it with a bought put order beneath a loss you can't afford, and roll-out and-up if price goes up.

You'll literally be punching money bags out of your stock and laughing the whole way to the bank at fools and their ""trailing limits"" while they sit and hope their stock does something and it just consolidates doing nothing for a month.

What's that you say? You don't have 100 shares? You're in the wrong stock buddy, pick something at a round lot and stop investing like a noob.

&#x200B;

Furthermore you get to choose WHEN to exercise a put, so you don't get STOPPED OUT.

&#x200B;

Second Edit - Not literally calling you a noob, I been there too and still have much to learn. But this one is a good example. You should hit the books on options and study them really well, because ""stop limits"" and all that junk just isn't useful to most trader's strategies.",DarthTrader357,0,/r/investing/comments/opgoea/i_have_a_question_regarding_trailing_limit_order/h65hgt8/,0.085,0.845,0.07,0.2412
62,AAPL, Hey man great idea. Thanks.. I can try this with AAPL,xxxmadness,1,/r/investing/comments/opgoea/i_have_a_question_regarding_trailing_limit_order/h65lor4/,0.0,0.687,0.313,0.6249
63,TDA," I checked it on Fidelity, until it stopped working just now.  ToS by TDA and Webull show it on the 1 minute chart.",delectablehermit,2,/r/investing/comments/opgoea/i_have_a_question_regarding_trailing_limit_order/h6574b5/,0.087,0.913,0.0,-0.2263
64,IT," Just forget all the bullshit and trade the moving averages on SPY

You can thank me later in also in IT",onequestion1168,26,/r/investing/comments/op0lpg/1_and_a_half_years_into_investing/h6298mc/,0.218,0.687,0.095,-0.4939
65,JPM," Good to know, I'm looking for anecdotes to build a baseline of expectation.

I just think ""time"" is the biggest risk now...and so ironically what I thought were the least risky trades, ""buying low selling high"" with long-buys and long-sells....turned out to be extremely risky.

I'm still stuck sitting on JPM waiting for it to turn around.

That doesn't mean I look at options like a gambler looks to a loan shark to dig himself out of a hole.

I just realized options were leveraging the most valuable commodity of all. **TIME**.

With options I could have been done with my JPM trade and on to the next one by now since it would have been fractional capital compared to the long-buy. etc.",DarthTrader357,2,/r/investing/comments/op0lpg/1_and_a_half_years_into_investing/h62clrm/,0.05,0.854,0.096,0.6982
66,NVDA," Yeah ever since I learned options I haven’t touched trading shares, just have a long position in NVDA and that’s it",EmbarrassedBag2631,1,/r/investing/comments/op0lpg/1_and_a_half_years_into_investing/h62ecl7/,0.0,0.784,0.216,0.5267
67,MA," These are awful MA to buy.

Backtest it. It performs awfully.

What a joke this guy is",PizzaPopcornPasta,3,/r/investing/comments/op0lpg/1_and_a_half_years_into_investing/h63xng8/,0.154,0.719,0.127,-0.1335
68,MA," If you are buying below the MA that implies markets are dropping. 

High vol. Those calls will be expensive.

Better off buying the underlying.",PizzaPopcornPasta,1,/r/investing/comments/op0lpg/1_and_a_half_years_into_investing/h63xkn0/,0.0,0.888,0.112,0.4404
69,CCIV," Depends on who you are talking about when you say equity holder. If you are the SPAC sponsor or a PIPE, you're golden essentially since your cost basis is fundamentally low enough. For regular folks buying it, it depends on the SPAC. Like CCIV had some insane structure where there were 3 tranches plus PIPE and sponsor.",EarbudScreen,1,/r/investing/comments/oph0bs/so_do_spacs_screw_over_equity_holders/h65im94/,0.081,0.877,0.042,-0.3182
70,ABNB," The main point of IPOs are for older investors to get out, newer investors to get in, and the company to get more money to expand/grow. SPACs generally serve the same function. It's not so much that SPACs are robs, but investors should do DD regardless of IPO or SPAC unless they want to feel ""screwed over"".

There area many IPO mechanics such as the pre-ipo stage investors getting lower prices, ipo dilution to fill up company coffers, and the post-ipo lock-up period which serve to create an artificial floor for the stock's valuation which is often new, volatile, and not as ""set"" when it's new. SPACs do that with different methods like pre-acquisition listing period, working the new dilution/numbers out so it stays around that mark, and having their own set of rules.

OFC things don't always go by the books, but that is what usually happens with IPOs/SPACs. DPOs are direct offerings where there's less banker/WS work so less dilution, but less/no investment into the company. Just the founders and early investors cashing out. See Coinbase DPO.

Back to SPACs. It really depends on the company. DFKG was a ""SPAC"" until it left that image behind. SPCE was a ""SPAC"" but can't seem to shake that image (imo because it's now a meme stock). You'd be up if you bought either early on. Doesn't mean there aren't SPACs like CLOV or the lordstown one which burned investors.

I think it's less about the way of going public but the company itself. The dilution and other factors are things to consider but that is something you do regardless of the way they go public. Those investor prospectus PDFs are readily accessible and exist for a reason. I didn't participate in either the ABNB IPO or the Sofi SPAC. I waited and bought ABNB after the lock-up period. Avoided Sofi because I read the prospectus and was concerned about the heavy dilution AND the number of early investors, Chamath, founders, early SPAC investors, and PIPE investors who all got in at or under $10. Avoided COIN despite liking the company because of their DPO wasn't reinvesting money back in, crypto was too hot, and COIN's valuation too bonkers. Others like DASH, I wouldn't buy regardless of IPO/DPO/SPAC/ICO/etc.",zxc123zxc123,3,/r/investing/comments/oph0bs/so_do_spacs_screw_over_equity_holders/h65ihvn/,0.047,0.91,0.044,-0.4784
71,CLOV," The main point of IPOs are for older investors to get out, newer investors to get in, and the company to get more money to expand/grow. SPACs generally serve the same function. It's not so much that SPACs are robs, but investors should do DD regardless of IPO or SPAC unless they want to feel ""screwed over"".

There area many IPO mechanics such as the pre-ipo stage investors getting lower prices, ipo dilution to fill up company coffers, and the post-ipo lock-up period which serve to create an artificial floor for the stock's valuation which is often new, volatile, and not as ""set"" when it's new. SPACs do that with different methods like pre-acquisition listing period, working the new dilution/numbers out so it stays around that mark, and having their own set of rules.

OFC things don't always go by the books, but that is what usually happens with IPOs/SPACs. DPOs are direct offerings where there's less banker/WS work so less dilution, but less/no investment into the company. Just the founders and early investors cashing out. See Coinbase DPO.

Back to SPACs. It really depends on the company. DFKG was a ""SPAC"" until it left that image behind. SPCE was a ""SPAC"" but can't seem to shake that image (imo because it's now a meme stock). You'd be up if you bought either early on. Doesn't mean there aren't SPACs like CLOV or the lordstown one which burned investors.

I think it's less about the way of going public but the company itself. The dilution and other factors are things to consider but that is something you do regardless of the way they go public. Those investor prospectus PDFs are readily accessible and exist for a reason. I didn't participate in either the ABNB IPO or the Sofi SPAC. I waited and bought ABNB after the lock-up period. Avoided Sofi because I read the prospectus and was concerned about the heavy dilution AND the number of early investors, Chamath, founders, early SPAC investors, and PIPE investors who all got in at or under $10. Avoided COIN despite liking the company because of their DPO wasn't reinvesting money back in, crypto was too hot, and COIN's valuation too bonkers. Others like DASH, I wouldn't buy regardless of IPO/DPO/SPAC/ICO/etc.",zxc123zxc123,3,/r/investing/comments/oph0bs/so_do_spacs_screw_over_equity_holders/h65ihvn/,0.047,0.91,0.044,-0.4784
72,COIN," The main point of IPOs are for older investors to get out, newer investors to get in, and the company to get more money to expand/grow. SPACs generally serve the same function. It's not so much that SPACs are robs, but investors should do DD regardless of IPO or SPAC unless they want to feel ""screwed over"".

There area many IPO mechanics such as the pre-ipo stage investors getting lower prices, ipo dilution to fill up company coffers, and the post-ipo lock-up period which serve to create an artificial floor for the stock's valuation which is often new, volatile, and not as ""set"" when it's new. SPACs do that with different methods like pre-acquisition listing period, working the new dilution/numbers out so it stays around that mark, and having their own set of rules.

OFC things don't always go by the books, but that is what usually happens with IPOs/SPACs. DPOs are direct offerings where there's less banker/WS work so less dilution, but less/no investment into the company. Just the founders and early investors cashing out. See Coinbase DPO.

Back to SPACs. It really depends on the company. DFKG was a ""SPAC"" until it left that image behind. SPCE was a ""SPAC"" but can't seem to shake that image (imo because it's now a meme stock). You'd be up if you bought either early on. Doesn't mean there aren't SPACs like CLOV or the lordstown one which burned investors.

I think it's less about the way of going public but the company itself. The dilution and other factors are things to consider but that is something you do regardless of the way they go public. Those investor prospectus PDFs are readily accessible and exist for a reason. I didn't participate in either the ABNB IPO or the Sofi SPAC. I waited and bought ABNB after the lock-up period. Avoided Sofi because I read the prospectus and was concerned about the heavy dilution AND the number of early investors, Chamath, founders, early SPAC investors, and PIPE investors who all got in at or under $10. Avoided COIN despite liking the company because of their DPO wasn't reinvesting money back in, crypto was too hot, and COIN's valuation too bonkers. Others like DASH, I wouldn't buy regardless of IPO/DPO/SPAC/ICO/etc.",zxc123zxc123,3,/r/investing/comments/oph0bs/so_do_spacs_screw_over_equity_holders/h65ihvn/,0.047,0.91,0.044,-0.4784
73,DASH," The main point of IPOs are for older investors to get out, newer investors to get in, and the company to get more money to expand/grow. SPACs generally serve the same function. It's not so much that SPACs are robs, but investors should do DD regardless of IPO or SPAC unless they want to feel ""screwed over"".

There area many IPO mechanics such as the pre-ipo stage investors getting lower prices, ipo dilution to fill up company coffers, and the post-ipo lock-up period which serve to create an artificial floor for the stock's valuation which is often new, volatile, and not as ""set"" when it's new. SPACs do that with different methods like pre-acquisition listing period, working the new dilution/numbers out so it stays around that mark, and having their own set of rules.

OFC things don't always go by the books, but that is what usually happens with IPOs/SPACs. DPOs are direct offerings where there's less banker/WS work so less dilution, but less/no investment into the company. Just the founders and early investors cashing out. See Coinbase DPO.

Back to SPACs. It really depends on the company. DFKG was a ""SPAC"" until it left that image behind. SPCE was a ""SPAC"" but can't seem to shake that image (imo because it's now a meme stock). You'd be up if you bought either early on. Doesn't mean there aren't SPACs like CLOV or the lordstown one which burned investors.

I think it's less about the way of going public but the company itself. The dilution and other factors are things to consider but that is something you do regardless of the way they go public. Those investor prospectus PDFs are readily accessible and exist for a reason. I didn't participate in either the ABNB IPO or the Sofi SPAC. I waited and bought ABNB after the lock-up period. Avoided Sofi because I read the prospectus and was concerned about the heavy dilution AND the number of early investors, Chamath, founders, early SPAC investors, and PIPE investors who all got in at or under $10. Avoided COIN despite liking the company because of their DPO wasn't reinvesting money back in, crypto was too hot, and COIN's valuation too bonkers. Others like DASH, I wouldn't buy regardless of IPO/DPO/SPAC/ICO/etc.",zxc123zxc123,3,/r/investing/comments/oph0bs/so_do_spacs_screw_over_equity_holders/h65ihvn/,0.047,0.91,0.044,-0.4784
74,DD," The main point of IPOs are for older investors to get out, newer investors to get in, and the company to get more money to expand/grow. SPACs generally serve the same function. It's not so much that SPACs are robs, but investors should do DD regardless of IPO or SPAC unless they want to feel ""screwed over"".

There area many IPO mechanics such as the pre-ipo stage investors getting lower prices, ipo dilution to fill up company coffers, and the post-ipo lock-up period which serve to create an artificial floor for the stock's valuation which is often new, volatile, and not as ""set"" when it's new. SPACs do that with different methods like pre-acquisition listing period, working the new dilution/numbers out so it stays around that mark, and having their own set of rules.

OFC things don't always go by the books, but that is what usually happens with IPOs/SPACs. DPOs are direct offerings where there's less banker/WS work so less dilution, but less/no investment into the company. Just the founders and early investors cashing out. See Coinbase DPO.

Back to SPACs. It really depends on the company. DFKG was a ""SPAC"" until it left that image behind. SPCE was a ""SPAC"" but can't seem to shake that image (imo because it's now a meme stock). You'd be up if you bought either early on. Doesn't mean there aren't SPACs like CLOV or the lordstown one which burned investors.

I think it's less about the way of going public but the company itself. The dilution and other factors are things to consider but that is something you do regardless of the way they go public. Those investor prospectus PDFs are readily accessible and exist for a reason. I didn't participate in either the ABNB IPO or the Sofi SPAC. I waited and bought ABNB after the lock-up period. Avoided Sofi because I read the prospectus and was concerned about the heavy dilution AND the number of early investors, Chamath, founders, early SPAC investors, and PIPE investors who all got in at or under $10. Avoided COIN despite liking the company because of their DPO wasn't reinvesting money back in, crypto was too hot, and COIN's valuation too bonkers. Others like DASH, I wouldn't buy regardless of IPO/DPO/SPAC/ICO/etc.",zxc123zxc123,3,/r/investing/comments/oph0bs/so_do_spacs_screw_over_equity_holders/h65ihvn/,0.047,0.91,0.044,-0.4784
75,OFC," The main point of IPOs are for older investors to get out, newer investors to get in, and the company to get more money to expand/grow. SPACs generally serve the same function. It's not so much that SPACs are robs, but investors should do DD regardless of IPO or SPAC unless they want to feel ""screwed over"".

There area many IPO mechanics such as the pre-ipo stage investors getting lower prices, ipo dilution to fill up company coffers, and the post-ipo lock-up period which serve to create an artificial floor for the stock's valuation which is often new, volatile, and not as ""set"" when it's new. SPACs do that with different methods like pre-acquisition listing period, working the new dilution/numbers out so it stays around that mark, and having their own set of rules.

OFC things don't always go by the books, but that is what usually happens with IPOs/SPACs. DPOs are direct offerings where there's less banker/WS work so less dilution, but less/no investment into the company. Just the founders and early investors cashing out. See Coinbase DPO.

Back to SPACs. It really depends on the company. DFKG was a ""SPAC"" until it left that image behind. SPCE was a ""SPAC"" but can't seem to shake that image (imo because it's now a meme stock). You'd be up if you bought either early on. Doesn't mean there aren't SPACs like CLOV or the lordstown one which burned investors.

I think it's less about the way of going public but the company itself. The dilution and other factors are things to consider but that is something you do regardless of the way they go public. Those investor prospectus PDFs are readily accessible and exist for a reason. I didn't participate in either the ABNB IPO or the Sofi SPAC. I waited and bought ABNB after the lock-up period. Avoided Sofi because I read the prospectus and was concerned about the heavy dilution AND the number of early investors, Chamath, founders, early SPAC investors, and PIPE investors who all got in at or under $10. Avoided COIN despite liking the company because of their DPO wasn't reinvesting money back in, crypto was too hot, and COIN's valuation too bonkers. Others like DASH, I wouldn't buy regardless of IPO/DPO/SPAC/ICO/etc.",zxc123zxc123,3,/r/investing/comments/oph0bs/so_do_spacs_screw_over_equity_holders/h65ihvn/,0.047,0.91,0.044,-0.4784
