,ticker,comment,username,score,permalink,neg,neu,pos,compound
0,IT," I saw this post, and among other things I started receiving marketing material for PPE in January/February, such as face masks etc.

One e-mail offered me an entire manufacturing line to make bulk face masks. I knew then that things were going to become very serious. The entire IT world was in DR prep mode because all the international companies with business continuity plans were buying up the available work-from-home hardware (laptops, docks, cell phones etc.)

International workers were reporting about new policies in China that would mitigate the spread of covid, like work-from-home policies and factory closures.

I sold 100% of my TFSA mutual funds to pay off some debt, thus locking in the pre-covid market prices. Then started a very very aggressive DCA back into my original savings position. The goal was to restore my savings in 1 year, which was reasonable since the debt payments were gone.

I didn't need to time the crash. I just averaged it out over the last 18 months and got excellent returns. All I need to do is beat the market over a few decades.",dinominant,1,/r/investing/comments/olvlki/proof_no_one_knows_anything_link_to_coronavirus/h5huk42/,0.069,0.874,0.057,-0.0424
1,TFSA," I saw this post, and among other things I started receiving marketing material for PPE in January/February, such as face masks etc.

One e-mail offered me an entire manufacturing line to make bulk face masks. I knew then that things were going to become very serious. The entire IT world was in DR prep mode because all the international companies with business continuity plans were buying up the available work-from-home hardware (laptops, docks, cell phones etc.)

International workers were reporting about new policies in China that would mitigate the spread of covid, like work-from-home policies and factory closures.

I sold 100% of my TFSA mutual funds to pay off some debt, thus locking in the pre-covid market prices. Then started a very very aggressive DCA back into my original savings position. The goal was to restore my savings in 1 year, which was reasonable since the debt payments were gone.

I didn't need to time the crash. I just averaged it out over the last 18 months and got excellent returns. All I need to do is beat the market over a few decades.",dinominant,1,/r/investing/comments/olvlki/proof_no_one_knows_anything_link_to_coronavirus/h5huk42/,0.069,0.874,0.057,-0.0424
2,APT, I remember reading that thread. I bought APT and profited. Wish I had more dry powder then to buy on the way down.,KernAlan,1,/r/investing/comments/olvlki/proof_no_one_knows_anything_link_to_coronavirus/h5hnev0/,0.0,0.783,0.217,0.6124
3,CZR," Interesting looking back. I didn’t buy puts on the way down, unfortunately, but I did buy CZR on March 20th for $8.96.",StrangeSatellite,1,/r/investing/comments/olvlki/proof_no_one_knows_anything_link_to_coronavirus/h5ifciw/,0.079,0.835,0.086,0.0387
4,SPCE," Those are probably the same people that still don't believe it's real now, and or the same people saying people are overreacting to the Delta Variant.

Not to mention that as long as it keeps spreading, it will keep mutating, and will keep this prolonged open/shutdown going. 

Add in inflation with wages stuck in the 90's - the middle class doesn't make enough to grow the economy, and when that happens, it's all downhill. The rich aren't growing the middle class anymore. 

Look at SPCE. They aren't even pretending this will ever be something that isn't solely for the ultra wealthy. I saw a headline that said, ""Virgin Galactic may have a use for normal people too"". Let me guess, jobs? Low paying jobs? Maybe serve them things while they wait to go up?

You look at the ape movement snd you can already see the tension rising between what has become a huge class system. And the middle class and the poor are getting angry that the system of wealth is not fair. People aren't angry cause they can't make money. Their angry cause the system is rigged. Their are different laws for the wealthy. 

People will take a lot of abuse. But everyone is becoming aware of how crooked this shit is, and that anger is growing... right as the financial system is about to collapse, and mutations are growing. 

It's about to get bad as the rich begin to hoard their wealth, thinking it will save them, keeping stocks down, crypto down, and falling, and in doing so will cause it to start sliding over the cliff.

There is only one thing that will save the economy - legalize weed... grow the economy, take money away from the cartels, add jobs, and have everyone chill the fuck out. Oh, and please do this before the next election, cause that's a tinder box waiting to go up. 

That's my 2 cents anyway...",Calcaniest,-1,/r/investing/comments/olvlki/proof_no_one_knows_anything_link_to_coronavirus/h5h6d69/,0.137,0.78,0.083,-0.944
5,GDP," Because it is.

Up until 2009 the Fed job was taming inflation, then it became propping up inflation because in their minds an erosion of people's savings would compel them to spend and invest opposed to hoarding dollars.

How is this different than a thief pointing a gun at your head and force you to do what they want?

Also leaving aside the morality of it...if you need to prop up inflation to show good economic metrics such as year over year GDP growth...is it really that different than China building bridges to nowhere just to make the numbers?

At least bridges might be useful sometime down the road.",AjaxFC1900,-2,/r/investing/comments/olvlki/proof_no_one_knows_anything_link_to_coronavirus/h5iq318/,0.05,0.885,0.065,0.168
6,DOW," DOW closed 28,700 in January of 2020.

34,700 today. 

They mistimed but they were correct to predict it would rebound. If you bought the incorrect dip, you would have been fine.",czarnick123,3,/r/investing/comments/olvlki/proof_no_one_knows_anything_link_to_coronavirus/h5ijamb/,0.0,0.932,0.068,0.296
7,GME, I started investing when they took away commissions. What an opportune time to get more investors in the market. I couldnt quite grasp the concept of doubling your investment in a month and understanding wheb to sell. I was buying NIO MRNA and all sorts of stocks in Feb and didnt understand why they doubled. I was happy with gains so I didnt regret it. In hindsight watching something go 10× in a year kind of jaded me. When the meme stocks hit and i was holding GME stock and NOK calls and my NOK calls went 10x in a day I didnt sell because I held that regret. I still got 2 years on my NOK calls but I dont think ill ever see the same rate of return in two years than I would have if i exercised that day. My best advice is know when your greed has its limits. To me its somewhere around a 5x return.,neverforgetreddit,-9,/r/investing/comments/olvlki/proof_no_one_knows_anything_link_to_coronavirus/h5h7xbe/,0.035,0.85,0.115,0.8959
8,NIO, I started investing when they took away commissions. What an opportune time to get more investors in the market. I couldnt quite grasp the concept of doubling your investment in a month and understanding wheb to sell. I was buying NIO MRNA and all sorts of stocks in Feb and didnt understand why they doubled. I was happy with gains so I didnt regret it. In hindsight watching something go 10× in a year kind of jaded me. When the meme stocks hit and i was holding GME stock and NOK calls and my NOK calls went 10x in a day I didnt sell because I held that regret. I still got 2 years on my NOK calls but I dont think ill ever see the same rate of return in two years than I would have if i exercised that day. My best advice is know when your greed has its limits. To me its somewhere around a 5x return.,neverforgetreddit,-9,/r/investing/comments/olvlki/proof_no_one_knows_anything_link_to_coronavirus/h5h7xbe/,0.035,0.85,0.115,0.8959
9,NOK, I started investing when they took away commissions. What an opportune time to get more investors in the market. I couldnt quite grasp the concept of doubling your investment in a month and understanding wheb to sell. I was buying NIO MRNA and all sorts of stocks in Feb and didnt understand why they doubled. I was happy with gains so I didnt regret it. In hindsight watching something go 10× in a year kind of jaded me. When the meme stocks hit and i was holding GME stock and NOK calls and my NOK calls went 10x in a day I didnt sell because I held that regret. I still got 2 years on my NOK calls but I dont think ill ever see the same rate of return in two years than I would have if i exercised that day. My best advice is know when your greed has its limits. To me its somewhere around a 5x return.,neverforgetreddit,-9,/r/investing/comments/olvlki/proof_no_one_knows_anything_link_to_coronavirus/h5h7xbe/,0.035,0.85,0.115,0.8959
10,AWK," AWK, NEE, and WM. Water, electricity, and getting rid of waste are needed regardless of what's going on in the world. Generally if you hold these together and reinvest dividends you're going to have a very robust and predictable portfolio that'll not be affected so much by crashes.

It's boring, but [likely to beat the S&P 500](https://www.portfoliovisualizer.com/backtest-portfolio?s=y&timePeriod=4&startYear=1985&firstMonth=1&endYear=2021&lastMonth=12&calendarAligned=true&includeYTD=true&initialAmount=10000&annualOperation=0&annualAdjustment=0&inflationAdjusted=true&annualPercentage=0.0&frequency=4&rebalanceType=1&absoluteDeviation=5.0&relativeDeviation=25.0&reinvestDividends=true&showYield=true&showFactors=false&factorModel=3&benchmark=VFINX&portfolioNames=false&portfolioName1=Portfolio+1&portfolioName2=Portfolio+2&portfolioName3=Portfolio+3&symbol1=AWK&allocation1_1=34&symbol2=NEE&allocation2_1=33&symbol3=WM&allocation3_1=33).",kerstverlichting,70,/r/investing/comments/om9772/what_are_your_underappreciated_offtheradar_picks/h5jk5pq/,0.061,0.887,0.052,-0.1234
11,NEE," AWK, NEE, and WM. Water, electricity, and getting rid of waste are needed regardless of what's going on in the world. Generally if you hold these together and reinvest dividends you're going to have a very robust and predictable portfolio that'll not be affected so much by crashes.

It's boring, but [likely to beat the S&P 500](https://www.portfoliovisualizer.com/backtest-portfolio?s=y&timePeriod=4&startYear=1985&firstMonth=1&endYear=2021&lastMonth=12&calendarAligned=true&includeYTD=true&initialAmount=10000&annualOperation=0&annualAdjustment=0&inflationAdjusted=true&annualPercentage=0.0&frequency=4&rebalanceType=1&absoluteDeviation=5.0&relativeDeviation=25.0&reinvestDividends=true&showYield=true&showFactors=false&factorModel=3&benchmark=VFINX&portfolioNames=false&portfolioName1=Portfolio+1&portfolioName2=Portfolio+2&portfolioName3=Portfolio+3&symbol1=AWK&allocation1_1=34&symbol2=NEE&allocation2_1=33&symbol3=WM&allocation3_1=33).",kerstverlichting,70,/r/investing/comments/om9772/what_are_your_underappreciated_offtheradar_picks/h5jk5pq/,0.061,0.887,0.052,-0.1234
12,WM," AWK, NEE, and WM. Water, electricity, and getting rid of waste are needed regardless of what's going on in the world. Generally if you hold these together and reinvest dividends you're going to have a very robust and predictable portfolio that'll not be affected so much by crashes.

It's boring, but [likely to beat the S&P 500](https://www.portfoliovisualizer.com/backtest-portfolio?s=y&timePeriod=4&startYear=1985&firstMonth=1&endYear=2021&lastMonth=12&calendarAligned=true&includeYTD=true&initialAmount=10000&annualOperation=0&annualAdjustment=0&inflationAdjusted=true&annualPercentage=0.0&frequency=4&rebalanceType=1&absoluteDeviation=5.0&relativeDeviation=25.0&reinvestDividends=true&showYield=true&showFactors=false&factorModel=3&benchmark=VFINX&portfolioNames=false&portfolioName1=Portfolio+1&portfolioName2=Portfolio+2&portfolioName3=Portfolio+3&symbol1=AWK&allocation1_1=34&symbol2=NEE&allocation2_1=33&symbol3=WM&allocation3_1=33).",kerstverlichting,70,/r/investing/comments/om9772/what_are_your_underappreciated_offtheradar_picks/h5jk5pq/,0.061,0.887,0.052,-0.1234
13,AR," U - unity software is growing their creative and gaming businesses above 40% YoY. Solid BS, and a huge market share in the growing mobile gaming market expected to increase 5fold by 2025 , as well as AR applications for other businesses. They will be able to generate massive fcf by 2030 due to high margins with lots of room to return capital to investors. Right now, however, they’re in growth mode",No-Owl-3202,29,/r/investing/comments/om9772/what_are_your_underappreciated_offtheradar_picks/h5jqvfs/,0.0,0.753,0.247,0.9371
14,MNMD," ZIP

Just IPO’d. Tools for job placement/recruiting. With the current job market, there’s a lot of need. I just hope they’re the ones that blow up. 

Also MNMD which I’ve seen on here a few times, so it may not be under the radar, but I’m definitely holding long term to see what happens.",hippiekyle,5,/r/investing/comments/om9772/what_are_your_underappreciated_offtheradar_picks/h5jo3hd/,0.0,0.899,0.101,0.6705
15,ZIP," ZIP

Just IPO’d. Tools for job placement/recruiting. With the current job market, there’s a lot of need. I just hope they’re the ones that blow up. 

Also MNMD which I’ve seen on here a few times, so it may not be under the radar, but I’m definitely holding long term to see what happens.",hippiekyle,5,/r/investing/comments/om9772/what_are_your_underappreciated_offtheradar_picks/h5jo3hd/,0.0,0.899,0.101,0.6705
16,PSTH, PSTH,mrpanda350,5,/r/investing/comments/om9772/what_are_your_underappreciated_offtheradar_picks/h5jx9d9/,0.0,1.0,0.0,0.0
17,AMZN," MELI - think AMZN of Brazil and broader LatAm. Has several hidden gems embedded within the core marketplace biz including PYPL (Pago), logistics (Envios), merchant acquiring, and asset management.

LatAm is a big ""market"" and MELI cant be pushed out by the big boys like AMZN bc of a 15 year head start and a very savvy mgmt team.",TwizzlyWizzle,3,/r/investing/comments/om9772/what_are_your_underappreciated_offtheradar_picks/h5jtuf5/,0.0,0.914,0.086,0.6124
18,MELI," MELI - think AMZN of Brazil and broader LatAm. Has several hidden gems embedded within the core marketplace biz including PYPL (Pago), logistics (Envios), merchant acquiring, and asset management.

LatAm is a big ""market"" and MELI cant be pushed out by the big boys like AMZN bc of a 15 year head start and a very savvy mgmt team.",TwizzlyWizzle,3,/r/investing/comments/om9772/what_are_your_underappreciated_offtheradar_picks/h5jtuf5/,0.0,0.914,0.086,0.6124
19,PYPL," MELI - think AMZN of Brazil and broader LatAm. Has several hidden gems embedded within the core marketplace biz including PYPL (Pago), logistics (Envios), merchant acquiring, and asset management.

LatAm is a big ""market"" and MELI cant be pushed out by the big boys like AMZN bc of a 15 year head start and a very savvy mgmt team.",TwizzlyWizzle,3,/r/investing/comments/om9772/what_are_your_underappreciated_offtheradar_picks/h5jtuf5/,0.0,0.914,0.086,0.6124
20,ASTS," ASTS trying to bring Internet to mobile devices out of traditional tower range as well as helping undeveloped countries the market is huge, the market is huge and the infrastructure costs of 5G Internet is huge you are looking at an estimated $3 Trillion, this could help governments hit their targets at a fraction of the cost. They have Deals with big telecom companies with a 50/50 revenue split 

Risks its not been fully tested yet, they need to launch 1.5 ton satellites, will need more funding eventually, still need full regulatory permissions, this is very much an all or nothing play, it could be $1000 in 10 years or $0 thats what numerous news articles and bank analysts have said as well",Tana1234,23,/r/investing/comments/om9772/what_are_your_underappreciated_offtheradar_picks/h5jjz2n/,0.031,0.848,0.121,0.8709
21,THCB," THCB

A SPAC merging with the vertically integrated battery manufacturer Microvast next week. Currently producing in China and Germany with a Tennessee factory on the way. Microvast is using the Tennessee plant to produce batteries for their “largest order to date” which will make them the “largest Lithium ion producer in America” 

Market cap is 3bn at $10, current share price is $11.17.

Bear case is Chinese interference with Chinese production.",CantDecide9402,14,/r/investing/comments/om9772/what_are_your_underappreciated_offtheradar_picks/h5jkobf/,0.0,0.969,0.031,0.296
22,NIO, NIO and STEM,Wizofsorts,3,/r/investing/comments/om9772/what_are_your_underappreciated_offtheradar_picks/h5k0tp5/,0.0,1.0,0.0,0.0
23,STEM, NIO and STEM,Wizofsorts,3,/r/investing/comments/om9772/what_are_your_underappreciated_offtheradar_picks/h5k0tp5/,0.0,1.0,0.0,0.0
24,PTRA, PTRA. Electric buses. It just went flat at 11$ but outlook is good looking 5+ years away.,macavity_is_a_dog,6,/r/investing/comments/om9772/what_are_your_underappreciated_offtheradar_picks/h5joenz/,0.0,0.806,0.194,0.5927
25,GTE," Verizon (**VZ**) - I used to work for them late 90's early 2K (I was there for the GTE / Bell Atlantic merger). Anyhow, they matched shares with your 401k so I was able to acquire a decent amount while I was young and working for the man.

I've been holding that stock ever since and damned if they aren't solid on dividends. It's a slow growth too, but steady, they don't jump on every crazy ass scheme like AT&T and end up burning themselves (and shareholders) time and time again. They stay focused on their core competencies.

I think it's great to have in a portfolio to add in some stability (look at their chart, even COVID didn't do much to their stock when everything else crashed in Mar 2020). And of course the regular dividends are great and if you have this in an IRA I suggest just let them re-invest and continue to grow.

Q1 showed Berkshire Hathaway has 146.7 million shares.",TheMadBeaker,6,/r/investing/comments/om9772/what_are_your_underappreciated_offtheradar_picks/h5jsekw/,0.061,0.804,0.135,0.9358
26,CAT," Definitely not under the radar, but if any form of infrastructure bill gets passed in the US, CAT is going to do very well over the next decade. And it’s trading at a major discount right now",Lite_It_Up,8,/r/investing/comments/om9772/what_are_your_underappreciated_offtheradar_picks/h5jk4zj/,0.0,0.873,0.127,0.6046
27,NCR," NCR. The more stores are in need to cut payrolls to keep costs as low as possible to keep up with online shopping, the more they are gonna use automated self checkout. NCR is the leader in that field.",Sharcbait,2,/r/investing/comments/om9772/what_are_your_underappreciated_offtheradar_picks/h5jpya4/,0.102,0.898,0.0,-0.4939
28,NTR, NTR (Nutrien) - Fertilizer / Agriculture,NotMyUsualOrder,2,/r/investing/comments/om9772/what_are_your_underappreciated_offtheradar_picks/h5jstr9/,0.0,1.0,0.0,0.0
29,UUUU, UUUU - uranium and REE,marky6045,2,/r/investing/comments/om9772/what_are_your_underappreciated_offtheradar_picks/h5jvejg/,0.0,1.0,0.0,0.0
30,KMI, KMI,rmax0001,2,/r/investing/comments/om9772/what_are_your_underappreciated_offtheradar_picks/h5jvyvi/,0.0,1.0,0.0,0.0
31,AI," STEM: Leader in AI storage in California.
ATVI: We all know about activision, but it’s only trading at a forward PE of 21 and I think they being a “Covid stock” is overblown.",BuytheFknDip69,2,/r/investing/comments/om9772/what_are_your_underappreciated_offtheradar_picks/h5jmlqc/,0.0,1.0,0.0,0.0
32,NIO," TM(Toyota) and VWAPY/POAHY. Everyone wants to get into the EV space, and that is great. Everyone is also investing in companies like Workhorse, NIO and Lucid. I’m going the other way and investing in the legacies. They have the economy of scale, plus Toyota has partnered with Tesla. It’s fun to that that NIO or Lucid could be the next Tesla. But, we sometimes forget that the old dogs have the advantage of brand loyalty and economy of scale.",Ok_Brilliant4181,3,/r/investing/comments/om9772/what_are_your_underappreciated_offtheradar_picks/h5jqyam/,0.026,0.82,0.154,0.8847
33,NIO, NIO,hdawne12,5,/r/investing/comments/om9772/what_are_your_underappreciated_offtheradar_picks/h5jtd5d/,0.0,1.0,0.0,0.0
34,UPS," $PACK - they produce renewable paper that is used by all sorts of packaging companies such as Amazon, UPS, Ebay and they are investing heavily in robotics. George Soros’ son has 30%+ of his fuck in Ranpak ($PACK)",Cantgetfooledagain1,1,/r/investing/comments/om9772/what_are_your_underappreciated_offtheradar_picks/h5jq1o9/,0.087,0.871,0.042,-0.4215
35,FVCB," FVCB
It underperforms other finance stock",otaku_wanna_bee,1,/r/investing/comments/om9772/what_are_your_underappreciated_offtheradar_picks/h5jq3vx/,0.0,1.0,0.0,0.0
36,NI," NI has a small investment in renewables just to appease the shareholders. Most of their money comes from natural gas distribution. If the government ever decides to force a move away from fossil fuels, they are fuct.",Corrupt_Rider,1,/r/investing/comments/om9772/what_are_your_underappreciated_offtheradar_picks/h5jq7hy/,0.0,0.878,0.122,0.5574
37,PLD, PLD. Loving this hold.,stonks_justgoup,1,/r/investing/comments/om9772/what_are_your_underappreciated_offtheradar_picks/h5jqf2e/,0.0,0.435,0.565,0.5994
38,VTGN, VTGN,8an5,1,/r/investing/comments/om9772/what_are_your_underappreciated_offtheradar_picks/h5jr9ru/,0.0,1.0,0.0,0.0
39,VRT, VRT,Its-The-Millz,1,/r/investing/comments/om9772/what_are_your_underappreciated_offtheradar_picks/h5jt1nh/,0.0,1.0,0.0,0.0
40,PCG," PCG. Yeah they're an evil mega corp utility.... BUT

1) it's the CPUC and NIMBYs that's to blame for recent issues

2) they cant fail

3) they're a highly ""regulated monopoly""  in California, basically a government run private business, they have *guaranteed returns by force of law*

4) once they can lay dividends again, price will return to 70-80s. Only reason it's down is no dividend not fire liability, see above 1) to 3) as to why

5) people complain about their utilities. But publicly owned are worse than ""**highly** *regulated private*"" like PCG/PG&E. Completely private are the absolute worst though and risk government oversight.

(Public utilities *usually* suck because they are governed by no one. No one cares about local politics. And local politics governs local utilities. At least highly regulated private utilities care about profit, and have an axe over their head.)",AFresh1984,1,/r/investing/comments/om9772/what_are_your_underappreciated_offtheradar_picks/h5jtz3a/,0.193,0.67,0.137,-0.8788
41,QSR," Viatris: No growth company with crappy management and a lot of debt, but it is a newer issue that a lot of people don't know about and is the cheapest pharma stock. and Pershing Square, discounted that has stakes in aforementioned QSR and has warrants on their spac that may well be undervalued but has high fees and bill ackman has a questionable reputation",Gimme_Karma_please,1,/r/investing/comments/om9772/what_are_your_underappreciated_offtheradar_picks/h5jubl6/,0.126,0.789,0.086,-0.4019
42,SI," $CLOV for both short term and longterm potential.  Short term due to popularity and squeeze potential (high SI, float, etc.) longterm as a medicare disruptor and they're already working with Walmart (WMT is starting a focus on medicare, cheap insulin, etc.)",supershwa,1,/r/investing/comments/om9772/what_are_your_underappreciated_offtheradar_picks/h5juhf1/,0.0,0.925,0.075,0.4767
43,CM," CM.com 

A european version of twilio but including the processing of transactions and ticketing for events. 

Bull case - the beginning of this year cm has opened asia and american offices to accelerate global growth. The guidance is a growth on the mediun term of 50% per annum. The software platform is very scalable and expands in functionality continously due to M&A activity. Ticket sales and transactions will increase with lockdowns ending, driving profits. Cm is trading at 6 times sales (no net profit) versus 33x sales for Twilio. Cm will also be the head sponsor of the F1 grand prix in The Netherlands which will drive global marketing.

Bear case - twilio could go on a even greater cashburn and develop the advantages of cm. The expansion outside of europe could also not work out and twilio could expand into core markets of cm. CM does not make a profit at the moment. Increased competition could delay the path to profitability and increased spend could be financed through dilution",Venhuizer,1,/r/investing/comments/om9772/what_are_your_underappreciated_offtheradar_picks/h5juq7r/,0.032,0.776,0.193,0.9833
44,LEV," LEV is quite under the radar, right?",danthescammyman,1,/r/investing/comments/om9772/what_are_your_underappreciated_offtheradar_picks/h5jvagw/,0.0,1.0,0.0,0.0
45,AMD," I believe AMD has already overtaken Intel from a technological standpoint. Most people still trust Intel still, but, in time, we should see AMD processors will become the new norm and AMD stock become more valuable.",aroach1995,1,/r/investing/comments/om9772/what_are_your_underappreciated_offtheradar_picks/h5jvpg9/,0.0,0.823,0.177,0.7828
46,DD," RTX, so many good DD on youtube from conservative, value investors. I keep selling puts on it to obtain at a lower price. Getting paid to ride it down, currently.",Pension2options,1,/r/investing/comments/om9772/what_are_your_underappreciated_offtheradar_picks/h5jvy5s/,0.067,0.763,0.17,0.5233
47,RTX," RTX, so many good DD on youtube from conservative, value investors. I keep selling puts on it to obtain at a lower price. Getting paid to ride it down, currently.",Pension2options,1,/r/investing/comments/om9772/what_are_your_underappreciated_offtheradar_picks/h5jvy5s/,0.067,0.763,0.17,0.5233
