,ticker,comment,username,score,permalink,neg,neu,pos,compound
106,DD," Major flag is someone with what looks like solid DD plugging those aforementioned tickers. I IMMEDIATELY assume it’s a bag holder! Most of the time there’s some or little action, they dump and recoup some money. 

I like to get confirmation bias from posts, but I also accept that, if I’m buying I need to read on my own before purchasing. Or at least verify their DD as much as possible and see if it feels right to me. 

Took some lessons learned to get there, but I’m much much more cautious!",Lord-of-Tresserhorn,1,/r/wallstreetbets/comments/oqngq7/manipulation_girls_do_it_shit_posters_do_it/h6daajm/,0.052,0.854,0.094,0.5962
107,DD," I don't know if you're serious (not too many people are in this sub), but the core issue is the manipulators have a boatload of people/bots that upvote their stuff and downvote those who challenge them. There's almost no opportunity for measured discussion if manipulators are running the discussion. When there is money at stake, motivated people are fine spending  money to buy coins so they can shower awards on their manipulative posts. 

Ironically, the reasoned DD topics cannot get enough upvotes/awards to rise up above the others. The whole nature of the system lends itself to manipulation because of the money at stake if people can trick millions of people into putting their actual money into a scheme.

So my advice is read for entertainment value only and do not make any moves based on what is said.",thatburghfan,1,/r/wallstreetbets/comments/oqngq7/manipulation_girls_do_it_shit_posters_do_it/h6ddtv9/,0.049,0.81,0.141,0.9444
108,PRPL, The trick to this place is getting into plays early. Everyone likes to cry about the PRPL debacle last year but the fact is if you got in when they were first starting to talk about it on this sub you'd have made a lot of money.,hideous_coffee,1,/r/wallstreetbets/comments/oqngq7/manipulation_girls_do_it_shit_posters_do_it/h6dfbql/,0.065,0.865,0.07,0.0644
109,DD," Love it. Going to use my play money to try this strategy. Hopefully it doesn't trade sideways. 

Maybe the strategy is to identify the DD which seems to have a lot of shills/bots, watch it rise, and short that shit. Get out for 5%-10% profit. Rinse repeat. Thanks man!",PayMe2Shill4U,1,/r/wallstreetbets/comments/oqngq7/manipulation_girls_do_it_shit_posters_do_it/h6dfdn3/,0.059,0.689,0.252,0.8955
110,FB," I’ve paper traded for learning in grad school (8yrs ago)and have speculated and watched the market until getting involved 2021. I saw the COVID crash and how quickly we recovered and I wanted in with real money now.
The only thing I can say is Jan of ‘19 until now and you didn’t lose money; you did pretty good if you were relying on Reddit.
Go ahead and follow “advice” from MSM, blogs, FB, your bank, and see how you make out.
My advice? Be your own financial advisor.",OkAdministration6754,1,/r/wallstreetbets/comments/oqngq7/manipulation_girls_do_it_shit_posters_do_it/h6dgdnz/,0.058,0.877,0.065,0.1779
111,MSM," I’ve paper traded for learning in grad school (8yrs ago)and have speculated and watched the market until getting involved 2021. I saw the COVID crash and how quickly we recovered and I wanted in with real money now.
The only thing I can say is Jan of ‘19 until now and you didn’t lose money; you did pretty good if you were relying on Reddit.
Go ahead and follow “advice” from MSM, blogs, FB, your bank, and see how you make out.
My advice? Be your own financial advisor.",OkAdministration6754,1,/r/wallstreetbets/comments/oqngq7/manipulation_girls_do_it_shit_posters_do_it/h6dgdnz/,0.058,0.877,0.065,0.1779
112,DD," For me, DD is only as good as the back and forth in the comments. I mostly read DD posts for the bear cases and counter-arguments, and then I go from there. The more it’s a knife fight, the better.",informal_requirement,1,/r/wallstreetbets/comments/oqngq7/manipulation_girls_do_it_shit_posters_do_it/h6djdz8/,0.067,0.797,0.136,0.4472
113,AMC," It is actually really easy, ask yourself has it already gone up >20%? Chances are it is a P&D. Also how did you lose money on PLTR, AMC, and AAL?",NuancedFlow,1,/r/wallstreetbets/comments/oqngq7/manipulation_girls_do_it_shit_posters_do_it/h6dkxa5/,0.079,0.764,0.157,0.3925
114,PLTR," It is actually really easy, ask yourself has it already gone up >20%? Chances are it is a P&D. Also how did you lose money on PLTR, AMC, and AAL?",NuancedFlow,1,/r/wallstreetbets/comments/oqngq7/manipulation_girls_do_it_shit_posters_do_it/h6dkxa5/,0.079,0.764,0.157,0.3925
115,DD," Counterpoint: There’s some genuine advice buried on WSB though. Never bet everything on someone’s DD here. I made money with smaller bets  through $WISH and $CLOV. The real successes come from sifting through the bullshit “advice” with your own research. I wouldn’t read some random slub’s DD and yolo my life savings.

The WSB of years ago was a smaller community and there were some really smart fucking people posting here often. You gotta sift more.",BlissfulThinkr,1,/r/wallstreetbets/comments/oqngq7/manipulation_girls_do_it_shit_posters_do_it/h6dlvrr/,0.047,0.847,0.107,0.5984
116,DD," Wait, did you just now realize that DD is designed to pump the price so the creator can sell higher?",rhomboidrex,1,/r/wallstreetbets/comments/oqngq7/manipulation_girls_do_it_shit_posters_do_it/h6dm7fk/,0.0,1.0,0.0,0.0
117,PLTR," PLTR is the way, buy any dip and hold couple years… shit will get exponentially in due time",SDBcop,1,/r/wallstreetbets/comments/oqngq7/manipulation_girls_do_it_shit_posters_do_it/h6dmmf7/,0.175,0.825,0.0,-0.5574
118,GME, Bitch include GME,Barbikan,1,/r/wallstreetbets/comments/oqngq7/manipulation_girls_do_it_shit_posters_do_it/h6domvq/,0.655,0.345,0.0,-0.5859
119,GOOD," \>So now that I have wizened myself to this treacherous game, I want to know. How do you identify the GOOD tips from the BAD tips. How do we know when a poster on here has the goods?

&#x200B;

As someone who makes a living of TA and has used it exclusively for creating trade plans for day trading, swing trading and long-term trend trading in over half a dozen different markets ranging from stocks to currencies ... 

I'd like to just tell you, most of the TA posted here is usually just bad analysis from people who have a lot to learn.  Nothing nefarious about it. It's been the same my whole trading life - but recently it's become popular to call it something else.",HoleyProfit,1,/r/wallstreetbets/comments/oqngq7/manipulation_girls_do_it_shit_posters_do_it/h6dq4a8/,0.038,0.879,0.083,0.5647
120,TA," \>So now that I have wizened myself to this treacherous game, I want to know. How do you identify the GOOD tips from the BAD tips. How do we know when a poster on here has the goods?

&#x200B;

As someone who makes a living of TA and has used it exclusively for creating trade plans for day trading, swing trading and long-term trend trading in over half a dozen different markets ranging from stocks to currencies ... 

I'd like to just tell you, most of the TA posted here is usually just bad analysis from people who have a lot to learn.  Nothing nefarious about it. It's been the same my whole trading life - but recently it's become popular to call it something else.",HoleyProfit,1,/r/wallstreetbets/comments/oqngq7/manipulation_girls_do_it_shit_posters_do_it/h6dq4a8/,0.038,0.879,0.083,0.5647
121,DD," Read what they say then fact check them on your own. I find it relatively simple. I COMPLETELY understand what you're saying but the real problem like you said is YOU! Everyone is looking for a lazy score and rather than doing your own DD, WHICH PEOPLE SAY TO DO DAMN NEAR ALL THE TIME, people just jump in. 

Then those same people are the paper handed bitches blaming everyone else bu themselves for NOT listening.",olddirtycanthearyouu,1,/r/wallstreetbets/comments/oqngq7/manipulation_girls_do_it_shit_posters_do_it/h6ds334/,0.233,0.731,0.035,-0.9645
122,DD," Most of the information on here is wishful thinking on the part of people who hope to be in on the next big GME play.  Odds are more than likely, that won't happen.  Options are incredibly risky and the majority of people who work with options lose money, they don't make it.  

Now, that being said, there are a few really knowledgeable people on here that occasionally post really, really good DD.  Its not often, but it does happen.  The majority of posts on here are shit posts, you have to learn to look beyond those and look for those few golden kernels that are really right on.  I would suggest joining some other subreddits on the stocks you are interested in as well.  There is good info out there that the people who are turned off by the theatrics in this subreddit share in those other places.  Read, read and read.  Do your own DD with outside sources other than someone on Reddit and then make your move.  The more rocket ships someone has on their post, the more I tend to look at their post with a jaundiced eye.",SilentContactee,1,/r/wallstreetbets/comments/oqngq7/manipulation_girls_do_it_shit_posters_do_it/h6ds8no/,0.04,0.864,0.096,0.8833
123,GME," Most of the information on here is wishful thinking on the part of people who hope to be in on the next big GME play.  Odds are more than likely, that won't happen.  Options are incredibly risky and the majority of people who work with options lose money, they don't make it.  

Now, that being said, there are a few really knowledgeable people on here that occasionally post really, really good DD.  Its not often, but it does happen.  The majority of posts on here are shit posts, you have to learn to look beyond those and look for those few golden kernels that are really right on.  I would suggest joining some other subreddits on the stocks you are interested in as well.  There is good info out there that the people who are turned off by the theatrics in this subreddit share in those other places.  Read, read and read.  Do your own DD with outside sources other than someone on Reddit and then make your move.  The more rocket ships someone has on their post, the more I tend to look at their post with a jaundiced eye.",SilentContactee,1,/r/wallstreetbets/comments/oqngq7/manipulation_girls_do_it_shit_posters_do_it/h6ds8no/,0.04,0.864,0.096,0.8833
124,GOOD," > How do you identify the GOOD tips from the BAD tips.

you don't; you make them.

same way the people you followed, made their's. 

clever writing, can be its own reward.  provided, your technical and precise about it.",paulgrant999,1,/r/wallstreetbets/comments/oqngq7/manipulation_girls_do_it_shit_posters_do_it/h6dsdyd/,0.087,0.7,0.213,0.7269
125,AVPT," I feel like I had to jump in and learn some lessons the hard way first and it sounds like you’ve done that at this point as well.

Out of my initial startup 100K capital I started playing with about 10% on 500 - 1000 dollar bets and I am bag holding on all of them. Most of them are down between 30 to 90% Most of my money is invested in real estate or in private businesses that I have a stake in But with the pandemic I decided to learn more about investing in stocks and options both for the excitement and for the possibility for rapid gains. But first I had to learn that it also means possibility of rapid losses. Cheering for a stock that you hold and are hoping to make money
 regardless of any actual underlying fundamentals is fun for me. I’m already holding the bag so I figure well at least get some thrill out of owning it. Like I paid hundreds of dollars for a good seat at the game.

I learned a lot from this about how to figure out when people are pumping something or making the DD fit their thesis. Often in the comments section I will get better hints and leads on ideas. I often find these commenters are the most reserved and brief.

Some of the DD would be someone who did not get a lot of upvotes or positive comments. Those he did I would look at their post history as well. I would look up the company they’re talking about and they’ve never really been mentioned here but the poster has a history of posting DD in advance of what turned out to be a good play and then got more buzz, as did their positive commenters. Of course more buzz only once it started printing and then from people with a much more checkered history.  AVPT is a recent example.

So now I feel like my moves started with reading maybe an hour a day or two of this place per Move to sifting through a much higher ratio to get one idea that I pursue. Trying to find decent videos on YouTube that are not hype but didactic / instructional. Doing some reading and studying to understand things beyond a superficial level. Compared to how I started, more recently I have at least broke even and some that have done very well by which I mean up 20 to 50% 2-6 weeks. 

Of course I would like to be able to or consistently get similar gains in a shorter timeframe and occasionally a big gain But my mindset has changed from somebody’s going to tip me off here to Seeing 10%, 20%, 15%, nice 30%, With a lower ratio of similar losses to at least once, woah! 1000% . I am up to 80% invested 20% still in cash but despite the early severe losses in my first option plays and bag holding some stock overall I’m up 24% since March. This is mostly due to spy calls and Apple calls being up so next week I might be down by that much.",SFLurkyWanderer,1,/r/wallstreetbets/comments/oqngq7/manipulation_girls_do_it_shit_posters_do_it/h6dtots/,0.032,0.806,0.162,0.9972
126,DD," I feel like I had to jump in and learn some lessons the hard way first and it sounds like you’ve done that at this point as well.

Out of my initial startup 100K capital I started playing with about 10% on 500 - 1000 dollar bets and I am bag holding on all of them. Most of them are down between 30 to 90% Most of my money is invested in real estate or in private businesses that I have a stake in But with the pandemic I decided to learn more about investing in stocks and options both for the excitement and for the possibility for rapid gains. But first I had to learn that it also means possibility of rapid losses. Cheering for a stock that you hold and are hoping to make money
 regardless of any actual underlying fundamentals is fun for me. I’m already holding the bag so I figure well at least get some thrill out of owning it. Like I paid hundreds of dollars for a good seat at the game.

I learned a lot from this about how to figure out when people are pumping something or making the DD fit their thesis. Often in the comments section I will get better hints and leads on ideas. I often find these commenters are the most reserved and brief.

Some of the DD would be someone who did not get a lot of upvotes or positive comments. Those he did I would look at their post history as well. I would look up the company they’re talking about and they’ve never really been mentioned here but the poster has a history of posting DD in advance of what turned out to be a good play and then got more buzz, as did their positive commenters. Of course more buzz only once it started printing and then from people with a much more checkered history.  AVPT is a recent example.

So now I feel like my moves started with reading maybe an hour a day or two of this place per Move to sifting through a much higher ratio to get one idea that I pursue. Trying to find decent videos on YouTube that are not hype but didactic / instructional. Doing some reading and studying to understand things beyond a superficial level. Compared to how I started, more recently I have at least broke even and some that have done very well by which I mean up 20 to 50% 2-6 weeks. 

Of course I would like to be able to or consistently get similar gains in a shorter timeframe and occasionally a big gain But my mindset has changed from somebody’s going to tip me off here to Seeing 10%, 20%, 15%, nice 30%, With a lower ratio of similar losses to at least once, woah! 1000% . I am up to 80% invested 20% still in cash but despite the early severe losses in my first option plays and bag holding some stock overall I’m up 24% since March. This is mostly due to spy calls and Apple calls being up so next week I might be down by that much.",SFLurkyWanderer,1,/r/wallstreetbets/comments/oqngq7/manipulation_girls_do_it_shit_posters_do_it/h6dtots/,0.032,0.806,0.162,0.9972
127,DD," Dude stop looking for good or bad tips on reddit, you need to gather information from multiple news sources, forums, articles, friends, and good old fashion DD. Also remember any get rich quick scheme is usually to good to be true. Their are amazing stocks out there that everyone knows about such as FAAMG stocks that have amazing returns.",External-Anywhere-70,1,/r/wallstreetbets/comments/oqngq7/manipulation_girls_do_it_shit_posters_do_it/h6dww5e/,0.071,0.609,0.32,0.9643
128,DD, None of them do! Just a bunch of shills that post ticker symbols… GameStop DD is interesting 🤔 but who knows?!?,momkiewilson1,1,/r/wallstreetbets/comments/oqngq7/manipulation_girls_do_it_shit_posters_do_it/h6dxcl8/,0.0,0.866,0.134,0.4203
129,GOOD," >So now that I have wizened myself to this treacherous game, I want to know. How do you identify the GOOD tips from the BAD tips. How do we know when a poster on here has the goods?

&#x200B;

If you still assume that you can understand if someone on the internet ""has the goods"" or if he would make them available for your benefit in a casino, then you haven't wizened up as much as you thought you did. 

Do your own reading. Make your own decisions according to your risk tolerance and own them. Stop blaming others for your bad gambling decisions.",East-Art1510,1,/r/wallstreetbets/comments/oqngq7/manipulation_girls_do_it_shit_posters_do_it/h6dxwq8/,0.131,0.782,0.087,-0.7269
130,DD," Here is my strategy: if someone posts a DD about it and everyone is talking about it… avoid or sell!

If I find something that looks good and have not seen anyone talk about it online… buy!",ZeekLTK,1,/r/wallstreetbets/comments/oqngq7/manipulation_girls_do_it_shit_posters_do_it/h6e1674/,0.057,0.853,0.09,0.3147
131,GME, This sub actually had decent advice/memes until the GME fiasco. Now every stock will apparently take you to the moon,ifyouhatepinacoladas,1,/r/wallstreetbets/comments/oqngq7/manipulation_girls_do_it_shit_posters_do_it/h6e2mym/,0.148,0.852,0.0,-0.5106
132,AMC," Without normal retail investors buying shares in things that are called out by the soooo called GOOD PEOPLE -- the stock would stay at it's regular market levels.

Example being AMC --- look back historically and see how even when times were great and box office was making BILLIONs per movie - AMC was not a stock going over $30.   

But now suddenly with Digital Distribution and the pandemic the AMC theatre chain is worth the m00n???  How so?  

It's all based on MOB mentality --- if enough people believe that it's worth more and keep putting their money into the POT then it makes the stock skyrocket.   Without the sheep that are using their funds and consistently buying said DIP waiting for the SHORT SQUEEZE to come, the stock would be worth it's normal market value.

Shorts have become somehow a BAD thing... it's odd because when a Business has a failing business model or is poorly managed it is really the Shorts that assist that Business in either restructuring or liquidating.

As for the whole movement that states that they saved jobs etc.   How many people are working at AMC as a CAREER move?   Because as we all know this job does not make enough to raise a family and buy a house etc.    The information being feed to people is a TWISTED TRUTH --- yes if AMC closed up people would lose their jobs.   But the movement is making it out like they have actually saved something of MEGA Value.

As for those people telling people to BUY THE DIP and HODL etc.   Below is examples of the kind hearted, genius day traders with brilliant plays with Tech and Scientific info...

Here is an example of why YouTubers who are looking for money to take their courses ETC are a major issue and causing huge problems for normal people.

[https://youtu.be/GqY0KbV5yhw?t=1786](https://youtu.be/GqY0KbV5yhw?t=1786)

Awesome how they view investing in the market as playing in a Casino.

Well if you're one of the people that have paid a sub fee to them - they actually are playing with FREE money with no consequences to themselves.   But when you're investing with YOUR money -- which can cause a HUGE financial problem if you lose it -- then beware.

Youtube recently terminated Matt Kohrs account due to it being HARMFUL and DANGEROUS.   Feel free to watch the talk with Matt [https://youtu.be/GqY0KbV5yhw?t=470](https://youtu.be/GqY0KbV5yhw?t=470)",yawn_zz,1,/r/wallstreetbets/comments/oqngq7/manipulation_girls_do_it_shit_posters_do_it/h6e2wkg/,0.076,0.751,0.173,0.992
133,FREE," Without normal retail investors buying shares in things that are called out by the soooo called GOOD PEOPLE -- the stock would stay at it's regular market levels.

Example being AMC --- look back historically and see how even when times were great and box office was making BILLIONs per movie - AMC was not a stock going over $30.   

But now suddenly with Digital Distribution and the pandemic the AMC theatre chain is worth the m00n???  How so?  

It's all based on MOB mentality --- if enough people believe that it's worth more and keep putting their money into the POT then it makes the stock skyrocket.   Without the sheep that are using their funds and consistently buying said DIP waiting for the SHORT SQUEEZE to come, the stock would be worth it's normal market value.

Shorts have become somehow a BAD thing... it's odd because when a Business has a failing business model or is poorly managed it is really the Shorts that assist that Business in either restructuring or liquidating.

As for the whole movement that states that they saved jobs etc.   How many people are working at AMC as a CAREER move?   Because as we all know this job does not make enough to raise a family and buy a house etc.    The information being feed to people is a TWISTED TRUTH --- yes if AMC closed up people would lose their jobs.   But the movement is making it out like they have actually saved something of MEGA Value.

As for those people telling people to BUY THE DIP and HODL etc.   Below is examples of the kind hearted, genius day traders with brilliant plays with Tech and Scientific info...

Here is an example of why YouTubers who are looking for money to take their courses ETC are a major issue and causing huge problems for normal people.

[https://youtu.be/GqY0KbV5yhw?t=1786](https://youtu.be/GqY0KbV5yhw?t=1786)

Awesome how they view investing in the market as playing in a Casino.

Well if you're one of the people that have paid a sub fee to them - they actually are playing with FREE money with no consequences to themselves.   But when you're investing with YOUR money -- which can cause a HUGE financial problem if you lose it -- then beware.

Youtube recently terminated Matt Kohrs account due to it being HARMFUL and DANGEROUS.   Feel free to watch the talk with Matt [https://youtu.be/GqY0KbV5yhw?t=470](https://youtu.be/GqY0KbV5yhw?t=470)",yawn_zz,1,/r/wallstreetbets/comments/oqngq7/manipulation_girls_do_it_shit_posters_do_it/h6e2wkg/,0.076,0.751,0.173,0.992
134,GOOD," Without normal retail investors buying shares in things that are called out by the soooo called GOOD PEOPLE -- the stock would stay at it's regular market levels.

Example being AMC --- look back historically and see how even when times were great and box office was making BILLIONs per movie - AMC was not a stock going over $30.   

But now suddenly with Digital Distribution and the pandemic the AMC theatre chain is worth the m00n???  How so?  

It's all based on MOB mentality --- if enough people believe that it's worth more and keep putting their money into the POT then it makes the stock skyrocket.   Without the sheep that are using their funds and consistently buying said DIP waiting for the SHORT SQUEEZE to come, the stock would be worth it's normal market value.

Shorts have become somehow a BAD thing... it's odd because when a Business has a failing business model or is poorly managed it is really the Shorts that assist that Business in either restructuring or liquidating.

As for the whole movement that states that they saved jobs etc.   How many people are working at AMC as a CAREER move?   Because as we all know this job does not make enough to raise a family and buy a house etc.    The information being feed to people is a TWISTED TRUTH --- yes if AMC closed up people would lose their jobs.   But the movement is making it out like they have actually saved something of MEGA Value.

As for those people telling people to BUY THE DIP and HODL etc.   Below is examples of the kind hearted, genius day traders with brilliant plays with Tech and Scientific info...

Here is an example of why YouTubers who are looking for money to take their courses ETC are a major issue and causing huge problems for normal people.

[https://youtu.be/GqY0KbV5yhw?t=1786](https://youtu.be/GqY0KbV5yhw?t=1786)

Awesome how they view investing in the market as playing in a Casino.

Well if you're one of the people that have paid a sub fee to them - they actually are playing with FREE money with no consequences to themselves.   But when you're investing with YOUR money -- which can cause a HUGE financial problem if you lose it -- then beware.

Youtube recently terminated Matt Kohrs account due to it being HARMFUL and DANGEROUS.   Feel free to watch the talk with Matt [https://youtu.be/GqY0KbV5yhw?t=470](https://youtu.be/GqY0KbV5yhw?t=470)",yawn_zz,1,/r/wallstreetbets/comments/oqngq7/manipulation_girls_do_it_shit_posters_do_it/h6e2wkg/,0.076,0.751,0.173,0.992
