,ticker,comment,neg,neu,pos,compound
165,EV,"In total market share of sales volume —- not gross sales. Tesla’s sales will accelerate but their share of the market will shrink. Those are two separate metrics. 

It’s expected, but I still believe that will shake out some investors in Tesla’s that bought in  because they think they’ll be the dominant or even the only player in an EV future.",0.032,0.872,0.096,0.4814
166,EV,"Yeah I think Tesla is a good long term hold. Most of my purchases were early 2020 so in the short term it could drop 25% or go up 25%. However in the long term I think Tesla has a significant lead and data advantage that will let them retain ~20% market share of an almost entirely EV market. They’re similar to Apple in terms of product+ecosystem with Amazon execution (reinvest in growth).

GM will likely do pretty well too. I think them, Hyundai, and VW are taking EVs pretty seriously but just because you have market share doesn’t necessarily mean you’re making much money (as Android manufacturers vs Apple have demonstrated).",0.025,0.82,0.155,0.8765
167,GM,"Yeah I think Tesla is a good long term hold. Most of my purchases were early 2020 so in the short term it could drop 25% or go up 25%. However in the long term I think Tesla has a significant lead and data advantage that will let them retain ~20% market share of an almost entirely EV market. They’re similar to Apple in terms of product+ecosystem with Amazon execution (reinvest in growth).

GM will likely do pretty well too. I think them, Hyundai, and VW are taking EVs pretty seriously but just because you have market share doesn’t necessarily mean you’re making much money (as Android manufacturers vs Apple have demonstrated).",0.025,0.82,0.155,0.8765
168,SF,I see their cars all the time here in SF.,0.0,1.0,0.0,0.0
169,FB,"From what I read FB is requiring everyone to link their Facebook account to their Oculus in order to continue using it, which hasn't gone over so well.

You can still use Oculus for now without linking it, but eventually in a year or two you have to.",0.0,0.96,0.04,0.2193
170,GM,"Considering that 2020 was the first time GM went went mainstream with Supercruise, I would guess not that many. However, Cadillac alone (GM's luxury brand which will be the first to integrate the sensors for Supercruise across its fleet), sold 390,000+ vehicles globally in 2019 (2020 sales figures are not out yet).

A few years down the line when the sensor tech trickles down to all of GM's brands, growth would be exponential. FYI, GM sold 7.7m vehicles globally in 2019, compared to 500k Tesla sold in 2020.",0.022,0.908,0.07,0.516
171,BB,r/wallstreetbets has been 🚀'ing $BB for weeks now. Definitely undervalued. 50 shares @ $14,0.0,0.692,0.308,0.5994
172,BB,BB to $20 by the end of this month and $50 by the end of this year. I have shares. They are undervalued and have a lot going for them,0.0,0.925,0.075,0.296
173,BB,My opinion on BB is 1k shares and bunch of call. 🚀🚀🚀,0.0,0.833,0.167,0.296
174,BB,"They're kind of interesting. They have a lot of patents so they can make money trolling, which is part of the recent jump since they settled with FB. The more recent news is the car sensor platform they're working on with Amazon. That along with their more serious moves into security by buying Cylance a few years back had me curious.

I've seen a mix of love and hate for Cylance so unless they can compete with Crowdstrike idk about their security offerings. If their car sensor system can take off that sounds pretty great. AWS is a powerhouse so if they're vouching for BB, stonks go up.

I got in at $9 so I'm on board for the ride for now",0.049,0.783,0.168,0.9434
175,FB,"They're kind of interesting. They have a lot of patents so they can make money trolling, which is part of the recent jump since they settled with FB. The more recent news is the car sensor platform they're working on with Amazon. That along with their more serious moves into security by buying Cylance a few years back had me curious.

I've seen a mix of love and hate for Cylance so unless they can compete with Crowdstrike idk about their security offerings. If their car sensor system can take off that sounds pretty great. AWS is a powerhouse so if they're vouching for BB, stonks go up.

I got in at $9 so I'm on board for the ride for now",0.049,0.783,0.168,0.9434
176,BB,"I said to my colleague on Saturday I invested in BB and his response was: you're gonna lose you money. 
Yeah sure. After one trading day I am up 14% and I bought at opening on Friday ($11.00)",0.071,0.812,0.118,0.2023
177,BB,BB All the way.  Changing the name could be a nice move  tho,0.0,0.797,0.203,0.4215
178,CEO,"CEO gets huge payouts at share price of $16, $20, and $30.  So he has a big incentive to stay and deliver results.

Have some shares long, can't say $20 by March is realistic, but in a year or two I think $16 is more likely than $6.",0.0,0.861,0.139,0.5574
179,BB,"The patent releases to Huawei signifies evidence that BB is shifting its business focus from hardware to software.  Add in the recent news also that Facebook has settled a patent dispute with in favour of BB, and it's good news for a downtrodden company.",0.057,0.821,0.122,0.4767
180,BB,I got shit for my BB stock but I bought in around 6.40...,0.187,0.813,0.0,-0.3182
181,BB,"Undervalued by its Valuation? No. It has an EPS of -$1.49. Is it undervalued by today’s new paradigm on valuation, yes. BB always had the best security and they have exploited that fact while creating operating systems for EV’s. They are licensing their brand for a future cell phone with the Blackberry name and tech. I’m bullish but waiting for a pull back for an entry point",0.051,0.839,0.11,0.4854
182,BB,"I've been in and out of Blackberry since it used to be called ""Research in Motion"".  Down at $5, it was probably undervalued.  But up here, I'm less sure.

All of the recent move has been with zero tangibly financial news.  By that I mean there's no sale, no order, no deal, no merger, no investment.

It's been solely driven by a name drop. 

And when you look into that name drop, it's a vague partnership with no dollars attached.  

People are ""discovering"" something that's been known for years: Blackberry writes car software now.  Blackberry owns QNX.  These are not news to anyone who has followed the,.

The name drop deal sounds like Amazon wants to the third (or fourth?) search engine name on car radio type systems.  Instead of apple or Google Car play, drivers can say "" hey Alexa"" to the car instead of through their phone.  I don't see that as revolutionary.  It seems more like akin to adding an Amazon icon to a desktop.   Are they even paying BB for that, and if so, how much?  

Prior the recent 100%+ mania, the main talk among BB investors was whether or not they should liquidate patents, and which ones. 

The in-car system markets that fresh new investors are assuming BB will be getting into... they're already in.  So the growth potential there might not be as big as some think since it's already captured.  

And from a macro perspective, when it comes to putting components into a vehicle, every manufacturer pinches their pennies like mad.  They go with the lowest bid supplier.  If Blackberry tries gouging too much for their in-car systems, they stand a chance of being bumped for someone else who will underbid them.  The car makers don't care.  It's not like a car buyer can select which system is in their Ford or Toyota.  They just buy the vehicle, and whatever screen shows the radio station and backup camera is basically a utility to them.",0.085,0.844,0.071,-0.5723
183,BB,BB has changed quite a bit by focusing on different sectors that should make it a lot of money.,0.0,1.0,0.0,0.0
184,BB,"BB, BBY, BBBY are all outdated brand names that have made a resurgence recently. I didn’t realize retro trends could take hold in the stonks world too. 

These gains brought to you by the letter B.",0.0,0.932,0.068,0.34
185,BBBY,"BB, BBY, BBBY are all outdated brand names that have made a resurgence recently. I didn’t realize retro trends could take hold in the stonks world too. 

These gains brought to you by the letter B.",0.0,0.932,0.068,0.34
186,BBY,"BB, BBY, BBBY are all outdated brand names that have made a resurgence recently. I didn’t realize retro trends could take hold in the stonks world too. 

These gains brought to you by the letter B.",0.0,0.932,0.068,0.34
187,BB,"In reality? No..

Their staff is looking at major lay-offs. BB is dead in the water and is currently looking at selling bits and peices off. Lots of their buildings are just empty and doing nothing. Their staff are very concerned for their jobs right now. My friend is one of their top engineers. Guy makes over 200k a year base salary and he is banking as much of it as he can because they are treading water with an open cut in shark infested waters.",0.088,0.858,0.054,-0.4939
188,BB,I did my DD on BB and believe it's good for my PP.. I'm all in. Undervalued and on the launch pad 🚀🚀🚀,0.0,0.879,0.121,0.4404
189,DD,I did my DD on BB and believe it's good for my PP.. I'm all in. Undervalued and on the launch pad 🚀🚀🚀,0.0,0.879,0.121,0.4404
190,CEO,They have been making a great profit during the pandemic. They also were consolidating there long term debt and buying back shares (covid killed this temporarily) ever since John Chen was put into the CEO position. Company is apart of the meme stocks right now but is a genuinely undervalued stock.,0.082,0.806,0.112,0.1531
191,BB,"I always liked BB since they started fetting into these profitable industries and now with WSB generating insane hype, I can see the next $GME in our hands so safe to say I'm going all in.",0.064,0.712,0.224,0.7745
192,GME,"I always liked BB since they started fetting into these profitable industries and now with WSB generating insane hype, I can see the next $GME in our hands so safe to say I'm going all in.",0.064,0.712,0.224,0.7745
193,BB,"If I was a mod my first decree would be Limit the fcuking rockets already.

That said.. BB is undervalued because it has revenue, growth projected thru patents and partnerships.. and has a functioning business network from being a company for so long. Price is cheap now.. WSB thinks it is the next rocket because its moving toward cyber security.. that is my thought as well.. and with the management.. they wont get strong armed by AWS.",0.035,0.931,0.034,-0.0263
194,BB,the valuation is criminal. BB is the next tesla,0.298,0.702,0.0,-0.5267
195,GME,Ya but they also think GME is worth $1000.   Not so sure why they think that blockbuster/ sears / Radio shack model is going to work somehow now.  GME was in trouble before covid and even did horrible when video games were selling the most because of covid.  Some nuts in that sub.,0.227,0.737,0.037,-0.9203
196,AI,"BB isn't undervalued by much right now imo but they have huge growth opportunity in the next 2 years. They've made some very smart investments and strategic decisions. Especially in automotive software, but it's too early to see how profitable their AI venture is going to be.",0.0,0.696,0.304,0.9577
197,BB,"BB isn't undervalued by much right now imo but they have huge growth opportunity in the next 2 years. They've made some very smart investments and strategic decisions. Especially in automotive software, but it's too early to see how profitable their AI venture is going to be.",0.0,0.696,0.304,0.9577
198,PT,Never thought of it this way before. This is actually a true eye-opener. I raised my personal PT to $20 too. Thank you!,0.0,0.773,0.227,0.68
199,BB,"Considering I have faith in BB, what would be a safe newbie call, just to gain some experience? I am ok with losing $100-200.",0.087,0.535,0.378,0.8271
200,BB,"Oh man, I remember RIM. I'm a Waterloo grad so I used to walk by their building everyday.

I think 80% of the recent ""investors"" in BB have no idea what they're doing, and are just following along because WSB is pumping it. Maybe it'll shoot to the moon in the short-term, but I'm not so sure about long term prospects.

Historically they've been horrible at innovation. I had lots of friends who worked there, and basically if you have innovative ideas and ambition you are shutdown at every corner. Granted, things may have changed in the last few years, but I dunno.

I guess time will tell, but I'll watch on the sidelines.",0.089,0.778,0.133,0.7536
201,EV,"Being honest it also took me quite a while before I started looking into what they're actually doing. Keeping it short: currently, especially their involvement and potential in EV attracts me alot and made me pull the trigger before the weekend.",0.0,0.86,0.14,0.7184
202,NOK,NOK has way too many shares to move though. Unless they start buybacks that dinosaur isn't moving anytime soon.,0.0,0.891,0.109,0.296
203,BB,"I've been buying $BB for a long time because I've already known all of this. It's the first stock I ever bought. I also live right near their head office and we hear about their moves in our media more often, but it was a surprise to me when I saw WSB choose $BB as their next meme stock. I'm here for it.",0.0,0.956,0.044,0.3919
204,BB,"It runs with EV and it runs with Tech. If PLTR is a 50Bn company, BB should be 100.",0.0,1.0,0.0,0.0
205,EV,"It runs with EV and it runs with Tech. If PLTR is a 50Bn company, BB should be 100.",0.0,1.0,0.0,0.0
206,PLTR,"It runs with EV and it runs with Tech. If PLTR is a 50Bn company, BB should be 100.",0.0,1.0,0.0,0.0
207,DD,Have you seen this [DD post](https://www.reddit.com/r/wallstreetbets/comments/l0a1p5/the_full_dd_on_bb_an_elon_muskjeff_bezos_sandwich/) from WSB? If you can read through the meme language it's a pretty good look at BB's latest software endeavors.,0.0,0.79,0.21,0.7269
208,AI,"What AI Venture?  
My opinion is:  The QNX is already installed in more than 150M cars. The subscription fees are something like 4 dollars per car. It was all priced in. Now they are going to be installed in almost all EV cars. It's going to be more advanced and work as an operating system.. Like Android. This is what I think is getting priced in now. Maybe they will generate income from third-party apps on the QNX.. They will have whatever Tesla does in its car software.",0.0,0.919,0.081,0.7425
209,EV,"What AI Venture?  
My opinion is:  The QNX is already installed in more than 150M cars. The subscription fees are something like 4 dollars per car. It was all priced in. Now they are going to be installed in almost all EV cars. It's going to be more advanced and work as an operating system.. Like Android. This is what I think is getting priced in now. Maybe they will generate income from third-party apps on the QNX.. They will have whatever Tesla does in its car software.",0.0,0.919,0.081,0.7425
210,PE,PE of the sector,0.0,1.0,0.0,0.0
211,BB,"I raised my personal PT for BB to $22 just now, in my head, sitting on my couch",0.0,1.0,0.0,0.0
212,PT,"I raised my personal PT for BB to $22 just now, in my head, sitting on my couch",0.0,1.0,0.0,0.0
213,ARE,A decade of humming and hawwing over it's direction and where investors believe its direction to be pointing is what you chose to be persnickety about?  Meanwhile the recent news related to Facebook and Huawei ARE very much news.,0.0,1.0,0.0,0.0
214,PE,"On who? Growth companies in this sector will not use price to earning as a valuation multiple as all dollars are spent distributed to growth. Cash flow positive yes but retained earnings and or building EPs unlikely for said growth companies. Not good metric to use.

Edit correction. You can not use a PE multiple in this sector.",0.048,0.761,0.191,0.7344
215,GME,Ya ya I know the story like the rest of the world. Is GME worth $40?,0.0,0.747,0.253,0.5267
216,AI,The AI thing is some AI machine learning cyber security thing,0.0,0.806,0.194,0.34
217,BB,Many promising cyber companies have a market cap of $25b with a few hovering around $50b with no connection to EV. If you can imagine BB at even a $25b valuation the stock can at the very least go up to $60,0.053,0.883,0.064,0.128
218,EV,Many promising cyber companies have a market cap of $25b with a few hovering around $50b with no connection to EV. If you can imagine BB at even a $25b valuation the stock can at the very least go up to $60,0.053,0.883,0.064,0.128
219,AI,"Yes, they acquired an up and coming cybersecurity company started by Stuart McClure based in Irvine, CA originally called Cylance. They specialize in AI and machine learning cybersecurity technology and were a direct competitor to the likes of CrowdStrike but haven't heard much since they were acquired.",0.0,0.921,0.079,0.4118
220,BB,"What was priced in is the QNX of existing clients, not the expanding EV. 
As for the financials, i am only comparing BB to similar companies. I don’t think the financials of any company in that sector justify their valuation.",0.0,1.0,0.0,0.0
221,EV,"What was priced in is the QNX of existing clients, not the expanding EV. 
As for the financials, i am only comparing BB to similar companies. I don’t think the financials of any company in that sector justify their valuation.",0.0,1.0,0.0,0.0
222,BB,IV on BB calls is almost 200%. You're paying a huge premium for that call so it's fairly high risk.,0.098,0.794,0.107,0.0516
223,BB,I have and loaded up on BB today and I will again tomorrow.,0.0,1.0,0.0,0.0
224,PM,"I will be messaging you in 6 months on [**2021-07-20 02:02:35 UTC**](http://www.wolframalpha.com/input/?i=2021-07-20%2002:02:35%20UTC%20To%20Local%20Time) to remind you of [**this link**](https://np.reddit.com/r/stocks/comments/l0ujm0/is_blackberry_bb_actually_undervalued/gjwejsd/?context=3)

[**1 OTHERS CLICKED THIS LINK**](https://np.reddit.com/message/compose/?to=RemindMeBot&subject=Reminder&message=%5Bhttps%3A%2F%2Fwww.reddit.com%2Fr%2Fstocks%2Fcomments%2Fl0ujm0%2Fis_blackberry_bb_actually_undervalued%2Fgjwejsd%2F%5D%0A%0ARemindMe%21%202021-07-20%2002%3A02%3A35%20UTC) to send a PM to also be reminded and to reduce spam.

^(Parent commenter can ) [^(delete this message to hide from others.)](https://np.reddit.com/message/compose/?to=RemindMeBot&subject=Delete%20Comment&message=Delete%21%20l0ujm0)

*****

|[^(Info)](https://np.reddit.com/r/RemindMeBot/comments/e1bko7/remindmebot_info_v21/)|[^(Custom)](https://np.reddit.com/message/compose/?to=RemindMeBot&subject=Reminder&message=%5BLink%20or%20message%20inside%20square%20brackets%5D%0A%0ARemindMe%21%20Time%20period%20here)|[^(Your Reminders)](https://np.reddit.com/message/compose/?to=RemindMeBot&subject=List%20Of%20Reminders&message=MyReminders%21)|[^(Feedback)](https://np.reddit.com/message/compose/?to=Watchful1&subject=RemindMeBot%20Feedback)|
|-|-|-|-|",0.105,0.895,0.0,-0.6322
225,BB,"Sure, just so we're on the same page: **BB doesn't have financials to justify anything close to $40 B valuation**.  Even if they magically found a way to stop losing $1.25 per share (!) their revenues aren't remotely compatible with $40 B",0.114,0.785,0.101,-0.1511
226,BB,"Let me know if you get an answer to this please. I work long hours but next time I have off I'll find a calculator or some examples, because they are not that expensive and I really want to try, either GME or BB.",0.0,0.911,0.089,0.4023
227,GME,"Let me know if you get an answer to this please. I work long hours but next time I have off I'll find a calculator or some examples, because they are not that expensive and I really want to try, either GME or BB.",0.0,0.911,0.089,0.4023
228,GME,"i do like Microcenter tho. if the experience is at all like that at GME spots, im sure people would consider going there.",0.0,0.722,0.278,0.743
229,DD,"Really need to do more DD. Look at the digital deals with Microsoft. Money isn't in console. Crap margin. PC hardward and accessories however is margin rich. RC is also an Ecommerce wizard, look at his history. Gaming has never been bigger and is still growing.",0.0,0.852,0.148,0.7568
230,RC,"Really need to do more DD. Look at the digital deals with Microsoft. Money isn't in console. Crap margin. PC hardward and accessories however is margin rich. RC is also an Ecommerce wizard, look at his history. Gaming has never been bigger and is still growing.",0.0,0.852,0.148,0.7568
231,DD,Hardware is not even close to as profitable as software is.  So a console (hardware) is not profitable but pc are? You are missing the value of the console. You own the buyer from every game he buys xbox live monthly subscriptions and guess what now you don't need a store to hand him the game. He just downloads it from the console you sold him. RC is not unique in the e-commerce field with who he is up against.  So all this valuation is on one dudes shoulders to change the whole market around?   You are telling me I need to do more DD when you are apparently blind.  Gamestop was shutting stores left and right not that long ago.   Sorry you have nothing here and you have said nothing as well.,0.07,0.849,0.081,0.3897
232,RC,Hardware is not even close to as profitable as software is.  So a console (hardware) is not profitable but pc are? You are missing the value of the console. You own the buyer from every game he buys xbox live monthly subscriptions and guess what now you don't need a store to hand him the game. He just downloads it from the console you sold him. RC is not unique in the e-commerce field with who he is up against.  So all this valuation is on one dudes shoulders to change the whole market around?   You are telling me I need to do more DD when you are apparently blind.  Gamestop was shutting stores left and right not that long ago.   Sorry you have nothing here and you have said nothing as well.,0.07,0.849,0.081,0.3897
233,GME,but GME ....,0.0,1.0,0.0,0.0
234,PLUG,"If you’re buying and planning to hold “long term,” make a realistic assessment of what the short term downside and volatility could look like and how much you’re willing to wait though, and decide before you purchase. 

Too many stories of people who believed in PLUG or something similar, got into it the wrong week and bailed after four days because they were down ten percent.",0.073,0.891,0.036,-0.3818
235,BABA,"I am not sure ideas like 5) are useful to beginners without further explanation. Which kind of probabilities shall Investors calculate, and on which data as foundation?

If I buy BABA because Reddit said so, it is gambling. If I buy BABA because I make some probabilities out of my mind such that the expected value of the trade is positive, it is also gambling.",0.059,0.812,0.129,0.703
236,TSLA,"I think your anecdote is wrong.  Take my case.  I bought $10,000 of TSLA in 2017.  Then bailed after losing 10% (exactly).  But it took me **15 days**.  Totally different scenario.",0.174,0.826,0.0,-0.6908
237,DD,You’re more likely to find quality DD on Reddit than other social media. But valid point.,0.0,1.0,0.0,0.0
238,NIO,OP used a lot of words to say PLTR NIO,0.0,1.0,0.0,0.0
239,PLTR,OP used a lot of words to say PLTR NIO,0.0,1.0,0.0,0.0
240,GME,GME,0.0,1.0,0.0,0.0
241,IMO,"I'm going in on CNBS before MSOS. It's an area with huge potential, but I'm not confident that Biden will make any big moves regarding legalization in the near future, so it's probably best not to focus exclusively on the US market IMO.",0.067,0.78,0.153,0.6601
242,DIS,"Consider DIS too. While they don’t have planes, I expect their hotels, cruises and parks to have a ton of demand. Their streaming service is crushing it but the price still has room to grow.",0.088,0.912,0.0,-0.25
243,VERY,"I looked into cruise.   


GOT VERY BAD NEWS.

&#x200B;

Under their own guidelines that they set most of the cruise wont be cruising in in 2021. The same feeling was shared by the premier of most of the cruise stop islands.",0.157,0.76,0.082,-0.6766
244,GME,"Actually, this is the point in time to invest in GME. Get in on the squeeze, then move your profits to these travel companies if you want.",0.0,0.856,0.144,0.4939
245,UAL,"I think you have already missed a lot of the potential gains of travel stocks. UAL is up 30%, Delta is up 27% and Luv 19% over the past 3 months. The cruise industry is mirroring this as well. The time to get in was when the vaccine was announced.

Obviously their is still growth for the industry that is yet unrealized so it better to get in now on some of the more solid performing companies.",0.027,0.826,0.148,0.839
246,RCL,"I bought travel back in march/April when it crashed. Planning to hold till spring/summer when travel season is back, and with the vaccine I'm hoping for a big uptick. Though I have already had a huge increase already. RCL alone I'm up 20%. I'd wait maybe for another dip (which will happen as travel is very volatile right now and goes up and down almost every week). But I still think there is room to grow.",0.026,0.877,0.097,0.6597
247,CZR,"You missed the majority of the run up. Expectations are built in. 

I’ve been invested in casinos since April. Up 560% on PENN and 450% on CZR. I also held WYNN for a while but trimmed the position since 50%+ of my portfolio ended up being casinos 😂",0.035,0.965,0.0,-0.1531
248,PENN,"You missed the majority of the run up. Expectations are built in. 

I’ve been invested in casinos since April. Up 560% on PENN and 450% on CZR. I also held WYNN for a while but trimmed the position since 50%+ of my portfolio ended up being casinos 😂",0.035,0.965,0.0,-0.1531
249,WYNN,"You missed the majority of the run up. Expectations are built in. 

I’ve been invested in casinos since April. Up 560% on PENN and 450% on CZR. I also held WYNN for a while but trimmed the position since 50%+ of my portfolio ended up being casinos 😂",0.035,0.965,0.0,-0.1531
