,ticker,comment,username,score,permalink,neg,neu,pos,compound
46,USA," How old are you? 24

What country do you live in? USA

Are you employed/making income?- Yes, 52k

What are your objectives with this money? (Buy a house? 
Retirement savings?) -Utilize some of it to buy a home down the line 3-5 years. 
-As well as maximize the 6k for Roth IRA account
-Rolling over a previous employer 401k (~6k) into another Roth IRA.

What is your time horizon? 3-5 years, + long term retirement 30-40 years


Do you need this money next month? -no 


Next 20yrs?

 -No unless pulling out for buying another investment property, my retirement accounts probably wouldn’t be touched except pulling out my contributions again if trying to buy real estate. 


What is your risk tolerance? (Do you mind risking it at blackjack or do you need to know its 100% safe?)

 —Prefer to be a passive investor in Index funds and leave 5-10% in high risk high reward 

What are you current holdings?

 —$2.7k in VTI for my Roth IRA

(Do you already have exposure to specific funds and sectors? 

Any other assets?) No, paid off car will not be used for any investment, running it into the ground. 

Any big debts (include interest rate) or expenses?
—$700 - no interest PayPal Credit
—$4000 - grace period of student loan (starts December 2021) *** BOTH WILL BE PAID OFF BY in 1-2 months as if 8/10/2021


And any other relevant financial information will be useful to give you a proper answer.

Making $1920 bi weekly for work.
Live at home (RENT FREE) 
I minimize spending on eating out by making home meals for work and breakfast/dinner. 
Bills: (monthly gas $100-150), phone bill $130 (pay for mom and grandma; mom in return pays my car insurance since it’s easier transaction)
I’m under LA county (solid benefits) until 26 years old so 1 year 3 months) left before having to have my income deducted for a medical/dental plan.



***Just set my auto invest in Vanguard $600 a month for my brokerage account + $100 for ROTH IRA (i plan on just throwing in $2-4k at random just to hit the 6k) 

Mainly want to know what’s the best tax/game plan for the brokerage account if i plan down the line to pull out some if needed for a down payment in a home. But I’m really trying to just maximize my income with a decent return via index funds***",CampinHiker,1,/r/investing/comments/p1lgbp/daily_advice_thread_all_basic_help_or_advice/h8es39o/,0.031,0.907,0.062,0.8948
47,USA," Through my current employer, I have a Roth 401(k) and an HSA with the ability to invest that money.  
Employer contributions:  
Roth 401(k): 100% of first 4% + 3.5% RAP  
HSA: $1000 annually + $75-$200 quarterly depending on health goals  
  
I'm 26. USA. Married. No kids, no plans for it. I'm making roughly $62k annually.  
My question: how would you divide your contributions between these two accounts? Obviously want to contribute at least 4% to the Roth 401(k) to get the match. But what about beyond that?",InterestedSwordfish,1,/r/investing/comments/p1lgbp/daily_advice_thread_all_basic_help_or_advice/h8ev5fi/,0.042,0.925,0.033,-0.1926
48,CLOV," Selling a loss or holding on.

Basically self-explanatory. Generally speaking, I'd say that I am an investor who takes a good look at his potential investing targets and has an idea about what could go wrong, what could go right and what's danger zone.

However, that's not true for all the stocks I've bought.

Some have been speculative plays, and I'm not proud of that. Some I've made decent money on (EUCAR; although I did look into them before I'd still say it was a big gamble I took)

Now I have one stock that's most certainly utter sh\*te, and that stock is CLOV.

Yes, you got me - I'm embarrassed to say it, but I did take a gamble when Memestocks were about, and of course it backfired. 

I put around $500 into CLOV and I am down about 51%. This means that my position is quite small, but it's not absolutely tiny.

And now I'm thinking - do I actually take the huge hit or should I stay in and hope?

I have since looked and CLOV, and truth be told, I don't really believe in it. I don't believe that CLOV's fair price on a fundamental basis will be above what I bought it ($18) within the next 2-3 years. (That said, I do have trouble valueing companies that are losing money, I find it much easier with profitable companies)

But, and that's where the gambling comes in: I also don't see CLOV going bancrupt anytime soon and, well, it's a memestock. It's not the biggest of memestocks, but somehow there may be the off-chance of it having a rennaissance and getting hyped and overvalued massively again.

That said, should I really wait for that to happen and bank on it when I don't have any conviction in the stock?",RoronoaZorro,1,/r/investing/comments/p1lgbp/daily_advice_thread_all_basic_help_or_advice/h8evbsg/,0.059,0.838,0.103,0.9269
49,NFLX, Have a small stake in NFLX...Have only gained 6% in over 14 months. I'm thinking of selling and redistributing those funds where I'm averaging 25-40% returns. My time frame is 15 years before retirement. I'm way behind saving for retirement and need big gains quickly. Thoughts?,worldaven,1,/r/investing/comments/p1lgbp/daily_advice_thread_all_basic_help_or_advice/h8fgzuu/,0.0,0.896,0.104,0.6124
50,BYD," Today, I read that Berkshire invested in Chinese EV maker BYD: [https://www.bloomberg.com/opinion/articles/2021-08-09/warren-buffet-and-berkshire-hathaway-call-it-right-on-ev-batteries](https://www.bloomberg.com/opinion/articles/2021-08-09/warren-buffet-and-berkshire-hathaway-call-it-right-on-ev-batteries)

&#x200B;

However, I cannot find BYD listed as an investment in Berkshire's most recent 13F report: [https://www.sec.gov/Archives/edgar/data/1067983/000095012321007024/xslForm13F\_X01/0000950123-21-007024-4471.xml](https://www.sec.gov/Archives/edgar/data/1067983/000095012321007024/xslForm13F_X01/0000950123-21-007024-4471.xml)

&#x200B;

Where else would Berkshire have to report this purchase if it's not in the 13F? Or is the original article wrong?",Chromosomaur,1,/r/investing/comments/p1lgbp/daily_advice_thread_all_basic_help_or_advice/h8g1i0v/,0.066,0.891,0.044,-0.2869
51,TFSA," I have 10-15k invested and available in a TFSA currently. 

The account has averaged about 7-8% return over the last 3 years through Questrade. As i use these funds off and on to pay for my tuition the amount in there has fluctuated quite a bit. I believe this year I can keep that 10-15k amount invested until at least next May while i finish up school. 

My question therefore is, does anyone have a better idea or advice of what to do with around 10k for a span of 10 months other than what I am currently? it must stay pretty liquid and of course it would have to beat at least 7-8% on average. 

Thanks in advance for the thoughts you guys come up with",Blubbnut,1,/r/investing/comments/p1lgbp/daily_advice_thread_all_basic_help_or_advice/h8g45f0/,0.011,0.915,0.074,0.8225
52,TA, I'm new to this. But I just discovered a TA pattern called the golden cross. Is this worth betting on? Is there a reason I haven't really heard this talked about?,Terakahn,1,/r/investing/comments/p1lgbp/daily_advice_thread_all_basic_help_or_advice/h8ghvyd/,0.0,0.895,0.105,0.4674
53,ONE," >I am an old, semi- retired, midwestern US wanting to occasionally trade some crypto and was looking for a forum similar to this but with that as it's focus.

>I found ONE that isn't full of crypto kiddies looking to get rich in a week.

/r/ethfinance is the best choice.",silent_johnn,2,/r/investing/comments/p1lgbp/daily_advice_thread_all_basic_help_or_advice/h8eb4ch/,0.0,0.811,0.189,0.9136
54,DCF," Big oil is a cyclical.  Just because stocks have gone up doesn't mean that they can't go up more, so Now is the best time for you to do some valuation math/target setting for XOM and all of your stocks.  You should come up with a one year price target of your own based on current projected earnings, DCF, whatever you want to use.

Compare that one year price target with where XOM is currently sitting.  if you see good appreciation available, stock is still a buy (for me that's 25% or more).  if stock is close or above your target, don't ask questions, just sell.  in between, up to you.  Given this sounds like a short term gain right now, there is a tax benefit if it is in the ""hold"" zone to hang on to it and sell it after it goes long term.  However, if you have better places to put the money, take your gains and move on to the next thing.",LiqCourage,2,/r/investing/comments/p1lgbp/daily_advice_thread_all_basic_help_or_advice/h8f2dbw/,0.0,0.854,0.146,0.9747
55,XOM," Big oil is a cyclical.  Just because stocks have gone up doesn't mean that they can't go up more, so Now is the best time for you to do some valuation math/target setting for XOM and all of your stocks.  You should come up with a one year price target of your own based on current projected earnings, DCF, whatever you want to use.

Compare that one year price target with where XOM is currently sitting.  if you see good appreciation available, stock is still a buy (for me that's 25% or more).  if stock is close or above your target, don't ask questions, just sell.  in between, up to you.  Given this sounds like a short term gain right now, there is a tax benefit if it is in the ""hold"" zone to hang on to it and sell it after it goes long term.  However, if you have better places to put the money, take your gains and move on to the next thing.",LiqCourage,2,/r/investing/comments/p1lgbp/daily_advice_thread_all_basic_help_or_advice/h8f2dbw/,0.0,0.854,0.146,0.9747
56,DNOW," I'd move out of XOM and more into stuff that burry bought in Q1 (e.g. SXC, DNOW, etc.). SXC price to book is 1.34 currently, I think. Other than that think of merging markets. XOM is overpriced and bad, look more on the small cap side. Solar will outdue any other energy investment by far / very far. The reason is that nuclear is green, but people have bad stories in their mind with Nuclear.",stvaccount,1,/r/investing/comments/p1lgbp/daily_advice_thread_all_basic_help_or_advice/h8fii8c/,0.089,0.891,0.02,-0.7543
57,SXC," I'd move out of XOM and more into stuff that burry bought in Q1 (e.g. SXC, DNOW, etc.). SXC price to book is 1.34 currently, I think. Other than that think of merging markets. XOM is overpriced and bad, look more on the small cap side. Solar will outdue any other energy investment by far / very far. The reason is that nuclear is green, but people have bad stories in their mind with Nuclear.",stvaccount,1,/r/investing/comments/p1lgbp/daily_advice_thread_all_basic_help_or_advice/h8fii8c/,0.089,0.891,0.02,-0.7543
58,XOM," I'd move out of XOM and more into stuff that burry bought in Q1 (e.g. SXC, DNOW, etc.). SXC price to book is 1.34 currently, I think. Other than that think of merging markets. XOM is overpriced and bad, look more on the small cap side. Solar will outdue any other energy investment by far / very far. The reason is that nuclear is green, but people have bad stories in their mind with Nuclear.",stvaccount,1,/r/investing/comments/p1lgbp/daily_advice_thread_all_basic_help_or_advice/h8fii8c/,0.089,0.891,0.02,-0.7543
59,GME," I am assuming you are talking GME but its not really all that shorted ; looks to be about 13-14% what is pretty typical of stocks

For example SPY short float is much higher at like 30% much higher than GME",SirGlass,1,/r/investing/comments/p1lgbp/daily_advice_thread_all_basic_help_or_advice/h8eu4se/,0.0,0.831,0.169,0.8201
60,CD," No capital gains after a year, yes. But investing 100% into the market for a year is risky. 

I recommend about 85% into a CD or 1 year T-bill, and 15% into a total market fund. And even that is risky.",exe_virus,0,/r/investing/comments/p1lgbp/daily_advice_thread_all_basic_help_or_advice/h8eew1u/,0.144,0.694,0.163,0.2023
61,BCH," Don’t do this. If you want minimal risk and very likely high return, just buy BTC and ETH. 

BCH, while not worthless, holds only a fraction of the potential of the 2 above and many other projects.",ColteesBigOleTits,1,/r/investing/comments/p1lgbp/daily_advice_thread_all_basic_help_or_advice/h8gsdaa/,0.056,0.846,0.098,0.1546
62,ETH," Don’t do this. If you want minimal risk and very likely high return, just buy BTC and ETH. 

BCH, while not worthless, holds only a fraction of the potential of the 2 above and many other projects.",ColteesBigOleTits,1,/r/investing/comments/p1lgbp/daily_advice_thread_all_basic_help_or_advice/h8gsdaa/,0.056,0.846,0.098,0.1546
63,GME," It's not GME, it's Nel Asa.",ApeWithCoconut,1,/r/investing/comments/p1lgbp/daily_advice_thread_all_basic_help_or_advice/h8fu8z6/,0.0,1.0,0.0,0.0
64,FSLR," Technically I like FSLR, but not as a long term hold. The energy market is eventually a race to the bottom, so it's not great to invest in the long term in.",exe_virus,1,/r/investing/comments/p1lgbp/daily_advice_thread_all_basic_help_or_advice/h8gk6ga/,0.137,0.738,0.125,-0.3478
65,HD," I think there's been a tremendous push into housing over the last year and I don't know that that's sustainable. There are going to be younger people who are buying houses, but I think there's going to be a lot of younger people who value mobility (and perhaps that will have more value in the next decade or two) who will rent.  I think there is some aspect of affordability that will also keep younger people out of buying.

I don't own apartment REITs and don't have any interest in homebuilders really, although in terms of the former I have owned NXRT at times - that's a smaller apartment REIT that I do like because it's a little unique in its approach, buying troubled/mismanaged properties, revamping them and often selling and moving on.  In terms of plays on housing long-term, I'd rather buy and forget HD than own homebuilders.",dvdmovie1,3,/r/investing/comments/p1sltz/pros_and_cons_of_investing_in_homebuilding_etfs/h8fl3eq/,0.038,0.882,0.08,0.7491
66,NXRT," I think there's been a tremendous push into housing over the last year and I don't know that that's sustainable. There are going to be younger people who are buying houses, but I think there's going to be a lot of younger people who value mobility (and perhaps that will have more value in the next decade or two) who will rent.  I think there is some aspect of affordability that will also keep younger people out of buying.

I don't own apartment REITs and don't have any interest in homebuilders really, although in terms of the former I have owned NXRT at times - that's a smaller apartment REIT that I do like because it's a little unique in its approach, buying troubled/mismanaged properties, revamping them and often selling and moving on.  In terms of plays on housing long-term, I'd rather buy and forget HD than own homebuilders.",dvdmovie1,3,/r/investing/comments/p1sltz/pros_and_cons_of_investing_in_homebuilding_etfs/h8fl3eq/,0.038,0.882,0.08,0.7491
67,HD," Is there an etf that focuses solely on home improvement? Like HD, Lowes, Sherwin Williams, Black and Decker?",r2002,1,/r/investing/comments/p1sltz/pros_and_cons_of_investing_in_homebuilding_etfs/h8g1k5a/,0.0,0.732,0.268,0.7059
68,APTS," Haha thanks. And I should also say, be careful with APTS, it got crushed with Covid and hasn’t come back. My VNQ has outperformed all of my other REITs.",NovaStubble,3,/r/investing/comments/p1sltz/pros_and_cons_of_investing_in_homebuilding_etfs/h8feko9/,0.082,0.7,0.219,0.5719
69,APTS," Why APTS?  There are other, higher quality, residential multifamily reits?   I don’t think APTS is even profitable as of this year.",BeginningOriginal0,1,/r/investing/comments/p1sltz/pros_and_cons_of_investing_in_homebuilding_etfs/h8fh0w7/,0.0,0.854,0.146,0.504
70,MF," This will be probably a temporary thing.

Right now vanguard has a patent that sort of marries ETF shares and MF shares to the same fund but different share classes

This is why vangaurd MF have the same tax efficiency as MF. However their patent expires in 2023; I would assume after this other MF (schwab/fidelity) will basically do the same thing",SirGlass,3,/r/investing/comments/p1igkk/tax_implications_of_high_turnover_etfs/h8eqw6t/,0.0,0.856,0.144,0.8047
71,CPA," Well I am not sure on this, a CPA cannot really do much about getting a capital gains distribution from an investment",SirGlass,1,/r/investing/comments/p1igkk/tax_implications_of_high_turnover_etfs/h8epd9h/,0.087,0.712,0.2,0.3691
72,CPA," He will use more money hiring a CPA rather than study. I never had a financial advisor, is not 1995 anymore. You can get more of your money studying and investing by yourself. The "" they study for that"" is a lie. A banker told me once "" where can you know in which date the bill was made, tell me if you know more than me"" I pointed the date on the US bill...he was shocked...and he was a managet on a branch. Universities are useless these days. Study and invest.",Distinct-Average-949,1,/r/investing/comments/p1igkk/tax_implications_of_high_turnover_etfs/h8fl7wc/,0.033,0.967,0.0,-0.4215
73,HUGE," I think this is too simplistic and it really depends on how much you have invested

I mean lets say you make 50k a year but you have invested a lot of money over the years and have 500k invested in taxable accounts (maybe you sold your home, you are up there in age)

I have seen MF pay out like a HUGE distribution of 30-40% some years; if you are making 50k and get hit with another 200k of taxable income you now may have a 30k tax bill coming do.

Now if this is in a tax sheltered account (401k/IRA) you don't worry. So being aware of taxes has its benefits",SirGlass,1,/r/investing/comments/p1igkk/tax_implications_of_high_turnover_etfs/h8ercdh/,0.014,0.866,0.12,0.9218
74,MF," I think this is too simplistic and it really depends on how much you have invested

I mean lets say you make 50k a year but you have invested a lot of money over the years and have 500k invested in taxable accounts (maybe you sold your home, you are up there in age)

I have seen MF pay out like a HUGE distribution of 30-40% some years; if you are making 50k and get hit with another 200k of taxable income you now may have a 30k tax bill coming do.

Now if this is in a tax sheltered account (401k/IRA) you don't worry. So being aware of taxes has its benefits",SirGlass,1,/r/investing/comments/p1igkk/tax_implications_of_high_turnover_etfs/h8ercdh/,0.014,0.866,0.12,0.9218
75,CPA," Thank you. In my experience a (good) CPA can looks across your portfolio and find ways to optimize that you wouldn’t ever think of. Some of the things I have found my cpa has surprised me with in past years are things like vehicle tax credits, Puerto Rican tax credits (and we got to support Puerto Rico after they got nailed by a hurricane which was awesome), etc. 

I highly recommend at least exploring the option. I love that I’m being downvoted for advising professional advice from tax professionals.

Have a great day.",Blarghnog,1,/r/investing/comments/p1igkk/tax_implications_of_high_turnover_etfs/h8g4oqr/,0.0,0.727,0.273,0.9796
76,CPA," Respectfully, that’s not true at all’s Tax advisory and optimization is one of the main jobs a CPA can do, and finding ways to offset crypto or other capgains across a portfolio is something I have done consistently with my cpa for years.

https://www.cpapracticeadvisor.com/accounting-audit/article/12411062/9-ways-to-manage-capital-gains",Blarghnog,1,/r/investing/comments/p1igkk/tax_implications_of_high_turnover_etfs/h8g0ktw/,0.051,0.833,0.116,0.453
77,HP," I have bought into Motley Fool 2 times. Their track record is long & verifiable, but the stocks they recommended were sooo expensive! (to me) $200-$300/share. I started with only $1000 to invest. So I bought cheap stocks. Goodyear. (Because tRUMPY had railed against them.) & HP. I made money, I moved on up. 😁",gardenoflia,1,/r/investing/comments/p1rlwi/how_can_i_see_the_holdings_of_wellestablished/h8g80q3/,0.04,0.908,0.051,0.1386
78,CCI, CCI  they own the towers,diatho,1,/r/investing/comments/p1wcz5/which_broadband_company_do_you_like_over_the_next/h8g97xb/,0.0,1.0,0.0,0.0
