,ticker,comment,username,score,permalink,neg,neu,pos,compound
62,BA," Look through a list of those 1000 companies. I bet there are quite a few you would not want to own.  The premise is the price of stocks in the major indexes have been bid up because of the predetermined mix they have to buy.  If there is a down turn those funds will indiscriminately sell the whole basket whether warranted based on financial fundamentals or not.

I would pick 10 individual stocks that are leaders in different industries. Examples Cost ((Wmt or Tgt), AMD(or Nvda, not Intc), BE (or CLNE), Amzn (Aapl and/or Msft), Adbe (or CRM), BA (or Dal), CS (on sale right now because of Archegos, or Sofi or Lmnd as an up and comers), Nflx, Dis (Viac is on sale),  etc because the industries tend to move like the leaders anyway and because those leaders are a disproportionate % of those indexes anyway.

Some like Nvda and Cost are at ath so watch for a pull back to buy (I think both wi drop 5 to 10% in next 2 weeks or so). Cash is a position and is sometimes a good position till you can buy the ones you want at a discount.

Time in market stuff is bullshit if you buy into ath and then watch it correct down 10%.

Those leaders drive a disproportionate % of the funds return so why have the underdeserving/under performers in your basket.",neothedreamer,-9,/r/investing/comments/nt3gjx/sp500_vs_russell1000_popularity_vs_stability/h0pz9jy/,0.036,0.929,0.034,0.1421
63,BE," Look through a list of those 1000 companies. I bet there are quite a few you would not want to own.  The premise is the price of stocks in the major indexes have been bid up because of the predetermined mix they have to buy.  If there is a down turn those funds will indiscriminately sell the whole basket whether warranted based on financial fundamentals or not.

I would pick 10 individual stocks that are leaders in different industries. Examples Cost ((Wmt or Tgt), AMD(or Nvda, not Intc), BE (or CLNE), Amzn (Aapl and/or Msft), Adbe (or CRM), BA (or Dal), CS (on sale right now because of Archegos, or Sofi or Lmnd as an up and comers), Nflx, Dis (Viac is on sale),  etc because the industries tend to move like the leaders anyway and because those leaders are a disproportionate % of those indexes anyway.

Some like Nvda and Cost are at ath so watch for a pull back to buy (I think both wi drop 5 to 10% in next 2 weeks or so). Cash is a position and is sometimes a good position till you can buy the ones you want at a discount.

Time in market stuff is bullshit if you buy into ath and then watch it correct down 10%.

Those leaders drive a disproportionate % of the funds return so why have the underdeserving/under performers in your basket.",neothedreamer,-9,/r/investing/comments/nt3gjx/sp500_vs_russell1000_popularity_vs_stability/h0pz9jy/,0.036,0.929,0.034,0.1421
64,CS," Look through a list of those 1000 companies. I bet there are quite a few you would not want to own.  The premise is the price of stocks in the major indexes have been bid up because of the predetermined mix they have to buy.  If there is a down turn those funds will indiscriminately sell the whole basket whether warranted based on financial fundamentals or not.

I would pick 10 individual stocks that are leaders in different industries. Examples Cost ((Wmt or Tgt), AMD(or Nvda, not Intc), BE (or CLNE), Amzn (Aapl and/or Msft), Adbe (or CRM), BA (or Dal), CS (on sale right now because of Archegos, or Sofi or Lmnd as an up and comers), Nflx, Dis (Viac is on sale),  etc because the industries tend to move like the leaders anyway and because those leaders are a disproportionate % of those indexes anyway.

Some like Nvda and Cost are at ath so watch for a pull back to buy (I think both wi drop 5 to 10% in next 2 weeks or so). Cash is a position and is sometimes a good position till you can buy the ones you want at a discount.

Time in market stuff is bullshit if you buy into ath and then watch it correct down 10%.

Those leaders drive a disproportionate % of the funds return so why have the underdeserving/under performers in your basket.",neothedreamer,-9,/r/investing/comments/nt3gjx/sp500_vs_russell1000_popularity_vs_stability/h0pz9jy/,0.036,0.929,0.034,0.1421
65,CRSR," Curious if someone could help me understand the difference in sentiment on LOGI and CRSR that I am seeing in the market.  CRSR has traded sideways for like 6 months on very good fundamentals based around the belief that post pandemic demand will dry up.  LOGI also has good fundamentals but has seen a lot of growth in valuation over the same time period, and the negative sentiment towards the future of the peripheral market doesn't seem to have hit it as hard.  CRSR is now sitting on a pretty massive short interest as well.

Whats odd to me is that while there are overlaps in their market, LOGI demand is much more related to home offices, which are very likely going to see a demand decline, while CRSR peripheral demand is much more tied to niche gamer markets, which im not 100% convinced is as likely to implode relative to the LOGI market.

TLDR: I feel like the post pandemic demand destruction in 2021 will hit LOGI much worse than CRSR, yet the market seems to have it in the other direction.  Regardless of whether you agree on which type of demand is more likely to break, what other reasons can folks think of for the much different sentiments we see on these two companies?  Only other thing I can think of is age/maturity of the company itself.",Hellkyte,2,/r/investing/comments/nsrkcr/daily_general_discussion_and_spitballin_thread/h0pvs2h/,0.121,0.763,0.116,-0.1012
66,LOGI," Curious if someone could help me understand the difference in sentiment on LOGI and CRSR that I am seeing in the market.  CRSR has traded sideways for like 6 months on very good fundamentals based around the belief that post pandemic demand will dry up.  LOGI also has good fundamentals but has seen a lot of growth in valuation over the same time period, and the negative sentiment towards the future of the peripheral market doesn't seem to have hit it as hard.  CRSR is now sitting on a pretty massive short interest as well.

Whats odd to me is that while there are overlaps in their market, LOGI demand is much more related to home offices, which are very likely going to see a demand decline, while CRSR peripheral demand is much more tied to niche gamer markets, which im not 100% convinced is as likely to implode relative to the LOGI market.

TLDR: I feel like the post pandemic demand destruction in 2021 will hit LOGI much worse than CRSR, yet the market seems to have it in the other direction.  Regardless of whether you agree on which type of demand is more likely to break, what other reasons can folks think of for the much different sentiments we see on these two companies?  Only other thing I can think of is age/maturity of the company itself.",Hellkyte,2,/r/investing/comments/nsrkcr/daily_general_discussion_and_spitballin_thread/h0pvs2h/,0.121,0.763,0.116,-0.1012
67,NUE, Is anyone else short on NUE or as a matter of fact the whole steel sector? My analysis is based on the fact that the run up is purely just a speculative bubble getting ready to burst with the troubles with steel futures in China as well as the make or break decision of Biden's infrastructure bill,merlinthegreat100,1,/r/investing/comments/nsrkcr/daily_general_discussion_and_spitballin_thread/h0pl3c7/,0.05,0.828,0.122,0.3353
68,CRSR," Check this video out. 

[https://www.youtube.com/watch?v=\_REoEZdCJeA&t=713s](https://www.fool.com/investing/2021/06/05/better-buy-corsair-vs-logitech-vs-turtle-beach/)

Logi had a better YoY growth compared to CRSR, even though its a more established company. 117% compared to 71.6%. If a more established company is growing faster than what many consider to be a growth company, I can see it as a big red flag.

Logi is a Swedish company, and their corporate tax rate is 14.93%. With Biden's corporate tax proposal of 28%, I can see taxes take a bigger toll on CRSR than on LOGI.

People are scared of inflation as well. When people have less buying power, they tend to avoid spending money on premium products; which is what CRSR is known for.

CRSR's CFO exercised some options and sold half the exercised shares (around 240K$)  close of business last thursday at 35$, which tanked the stock like 6%. 

I'm long on CRSR as well, 500 shares, an August $30 Call, and a 2023 35/40 Bullish Debit Spread, I think its extremely undervalued given the circumstances you mentioned. I honestly don't see Video game streaming and E-sports dying any time soon.",Busy_Investigator_82,3,/r/investing/comments/nsrkcr/daily_general_discussion_and_spitballin_thread/h0pzip3/,0.028,0.843,0.129,0.9413
69,LOGI," Check this video out. 

[https://www.youtube.com/watch?v=\_REoEZdCJeA&t=713s](https://www.fool.com/investing/2021/06/05/better-buy-corsair-vs-logitech-vs-turtle-beach/)

Logi had a better YoY growth compared to CRSR, even though its a more established company. 117% compared to 71.6%. If a more established company is growing faster than what many consider to be a growth company, I can see it as a big red flag.

Logi is a Swedish company, and their corporate tax rate is 14.93%. With Biden's corporate tax proposal of 28%, I can see taxes take a bigger toll on CRSR than on LOGI.

People are scared of inflation as well. When people have less buying power, they tend to avoid spending money on premium products; which is what CRSR is known for.

CRSR's CFO exercised some options and sold half the exercised shares (around 240K$)  close of business last thursday at 35$, which tanked the stock like 6%. 

I'm long on CRSR as well, 500 shares, an August $30 Call, and a 2023 35/40 Bullish Debit Spread, I think its extremely undervalued given the circumstances you mentioned. I honestly don't see Video game streaming and E-sports dying any time soon.",Busy_Investigator_82,3,/r/investing/comments/nsrkcr/daily_general_discussion_and_spitballin_thread/h0pzip3/,0.028,0.843,0.129,0.9413
70,RBC," TD and RBC are both swimming in cash. 

RBC has gone up 26% in the last 6 months and TD has gone up 31% in the last 6 months",SeaOfAwesome,3,/r/investing/comments/nsrkcr/daily_general_discussion_and_spitballin_thread/h0p57c1/,0.0,1.0,0.0,0.0
71,TD," TD and RBC are both swimming in cash. 

RBC has gone up 26% in the last 6 months and TD has gone up 31% in the last 6 months",SeaOfAwesome,3,/r/investing/comments/nsrkcr/daily_general_discussion_and_spitballin_thread/h0p57c1/,0.0,1.0,0.0,0.0
72,VERY," Royal Bank is the gold standard. But any of the “big 5” are worth considering. Canadian banks are rock solid and have paid dividends for 100+ years. For Royal Bank to fail, Canada as a country would have to fail. The banks are like it’s financial backbone. Canadian banks are VERY different than US banks in terms of having regulations to ensure they remain rock solid. I am Canadian, and my basic motto is when in doubt…buy more Royal Bank. You would typically hold bank stocks for life, however. They are usually not high flying, just decade after decade of tromping steadily in a generally upwards direction.",Sky-of-Blue,2,/r/investing/comments/nsrkcr/daily_general_discussion_and_spitballin_thread/h0ov3rw/,0.08,0.813,0.107,0.0772
73,SHOP," SHOP ship has sailed. If you're going to take significant risk in an investment then the expectation is a significant return, which becomes greatly diminished when you're looking at a 94 P/E and 42 P/S and $100+ billion market cap.

&#x200B;

Speaking as someone who strictly invests in the micro to small cap space, I only pay attention to Price/Sales, and watch for the revenue growth or expected growth. It's still significant risk but the return potential justifies that risk.",TheRiskable,-1,/r/investing/comments/nsrkcr/daily_general_discussion_and_spitballin_thread/h0piqzh/,0.084,0.822,0.094,-0.0387
74,CRSR," Thanks for the perspective. Makes sense.  The inflation one in particular makes sense that it would clip a younger company much harder.

The one thats interesting to me is that delta on YoY.  If the logi growth was primarily around home office builds it actually makes sense to me that it would have spiked more than CRSR as I doubt many non-gamers were buying their products for home office.  But that extra YoY pop they gained makes me think they may take a bigger nut punch in 2021.  

I'm fairly happy to be long on both at the moment though.",Hellkyte,1,/r/investing/comments/nsrkcr/daily_general_discussion_and_spitballin_thread/h0q0n7z/,0.016,0.852,0.132,0.9062
75,EDR," Crowdstrike is primarily known for endpoint protection which are software solutions to protect computers (workstations, laptops, servers) known as NGAV (next gen antivirus) and EDR (endpoint detect and response). They also offer a type of managed service known in the industry as MDR. Their customers will range across all industries and their solutions are appropriate for small to large enterprises. It's actually a pretty crowded market imo. There aren't a lot of comparables in the public market but you may be able to check out Sentinel 1 when they IPO. There are rumors of Cybereason IPO as well. 

Fireye has an EDR solution but I imagine it's a tiny part of their business. And no one really would bring up Fireeye when talking about endpoint protection. Fireeye/Mandiant is most known for their incident response and forensic products and services. They are usually on top of most people's list to call whenever there is a security breach. 

Both Palo Alto and Fortinet started off as security networking companies competing with traditional firewall companies like Netscreen and Cisco. In fact, the founders of both companies are former Netscreen execs iirc. Both companies have expanded their product and service offerings over the years to support security operations solutions. You tend to see Palo Alto and Fortinet used in larger enterprises who need holistic network security solutions. Normally, if a security team is looking at a Palo Alto solutions, they are probably also comparing it Fortinet and vice-versa. 

Generally speaking - cyber-security industry is very broad. You are not likely to find a single company that would cover the entire gamut of security needs for an enterprise. So if your interest is in broad industry exposure - an ETF is probably a better solution.",greytoc,5,/r/investing/comments/nsrkcr/daily_general_discussion_and_spitballin_thread/h0p3r3o/,0.009,0.81,0.181,0.9937
76,AMC, Like I said - only the misinformed and gullible retail investors that belief in conspiracy theories and continue to gamble on meme stocks like GME and AMC.,greytoc,2,/r/investing/comments/nsrkcr/daily_general_discussion_and_spitballin_thread/h0pvdua/,0.254,0.597,0.149,-0.5423
77,GME, Like I said - only the misinformed and gullible retail investors that belief in conspiracy theories and continue to gamble on meme stocks like GME and AMC.,greytoc,2,/r/investing/comments/nsrkcr/daily_general_discussion_and_spitballin_thread/h0pvdua/,0.254,0.597,0.149,-0.5423
78,AMC," Say what you want but both GME and AMC has gone up to pretty high prices, and have surprisingly sustained those prices for an extended period of time, despite most media outlets saying it's a bad idea.

Furthermore, I don't believe retail has the ability to drive shares of AMC from 30 to 60 on zero news in one day. 

Seems kinda weird to me.",Magistricide,1,/r/investing/comments/nsrkcr/daily_general_discussion_and_spitballin_thread/h0px1eu/,0.083,0.733,0.183,0.7677
79,GME," Say what you want but both GME and AMC has gone up to pretty high prices, and have surprisingly sustained those prices for an extended period of time, despite most media outlets saying it's a bad idea.

Furthermore, I don't believe retail has the ability to drive shares of AMC from 30 to 60 on zero news in one day. 

Seems kinda weird to me.",Magistricide,1,/r/investing/comments/nsrkcr/daily_general_discussion_and_spitballin_thread/h0px1eu/,0.083,0.733,0.183,0.7677
80,AMC," Just got SUPER lucky, need advice please and thank you, reader.

So I’ve been dabbling around with the stock market and other assets for a while now, started off when I was 18 and I had a spare $1,000 to lose, so I did. 

I’ve learned a lot over the years, and I also have a business finance background, so fundamentally I have a good grasp of things and I’ve also really honed my technical analysis as well, which is what helped me score the come up I’m about to address. 

I’ve had a lot of misses, and losses, and some small wins here and there. Over the years and after taking so many Ls, I began to realise some of the bad habits I had that were crippling me.

I can’t count how many times I’ve bought a stock and it’s tanked, or I bought and sold for a small profit, then the stock runs another 300% or buying short term calls without paying close attention to the over all market trends and getting screwed. 

Anyways, I got on Robinhood last year, and I threw in about $43k total since then. I immediately was down between 2k-to 5k and then at one point I hit $70k account value and I was over the moon, but I didn’t sell the small cap EV play that erased my losses and nearly doubled my investment. Instead I rode it down 60% while I lost money on other stocks. 

Most recently, I was in a bunch of SPACs, enjoying a steady stream of losses day after day. My account was at $29K or so, down $13k over all. 

I then looked at amc when it was around $9-$10 and I liked what I was hearing, so I liquidated my entire portfolio, took that $29k and bought over 1k shares and a TON of options, all expiring 2022 or later, some ITM, most way OTM ($40)

I saw my account go from $29k to about 500k in the span of a couple weeks, and when AMC was at $68 after hitting $70+ for the first time, I had to cash out all my options, I couldn’t believe the numbers I was looking at. 

So then I had $430k and a little over 1K AMC shares. I immediately sold a covered call 6/4 $73 for a quick $11k 

I already set aside enough for the taxes and all but my problem is, I want to build a legit long term portfolio and I don’t know if it’s the right time (indices at ATH) and I don’t know if I should buy stocks and sell covered calls on them at safe prices or if I should buy leaps for 2023. Not to mention I’m not sure my list is any good at all... I bought a ton of CHPT CCIV NNDM SKLZ WKHS and AONE. I’m looking to pick up 2023 calls on PLTR and also buy stock or calls on XPEV. 

I’ve never had this much to put into a portfolio and I’m still kind of young, I don’t want to lose it all, I feel like I’ve made enough to do some legit investing that will grow over time and I no longer have to do options yolos because of being down thousands and nervous about it. 

Anyone with experience who would be kind enough to share what they would do if they were me, please don’t hesitate. I’m grateful for any time you take responding!

Just to give some background, I’m in my 20s, I make over $150k from work yearly. I’m paying wayyyy too much for rent so I’m looking for a home soon, and my only real debt is $70k in student loans, thanks!",7maryneekek,2,/r/investing/comments/nsrjpg/daily_advice_thread_all_basic_help_or_advice/h0ofk8l/,0.064,0.834,0.102,0.9686
81,AONE," Just got SUPER lucky, need advice please and thank you, reader.

So I’ve been dabbling around with the stock market and other assets for a while now, started off when I was 18 and I had a spare $1,000 to lose, so I did. 

I’ve learned a lot over the years, and I also have a business finance background, so fundamentally I have a good grasp of things and I’ve also really honed my technical analysis as well, which is what helped me score the come up I’m about to address. 

I’ve had a lot of misses, and losses, and some small wins here and there. Over the years and after taking so many Ls, I began to realise some of the bad habits I had that were crippling me.

I can’t count how many times I’ve bought a stock and it’s tanked, or I bought and sold for a small profit, then the stock runs another 300% or buying short term calls without paying close attention to the over all market trends and getting screwed. 

Anyways, I got on Robinhood last year, and I threw in about $43k total since then. I immediately was down between 2k-to 5k and then at one point I hit $70k account value and I was over the moon, but I didn’t sell the small cap EV play that erased my losses and nearly doubled my investment. Instead I rode it down 60% while I lost money on other stocks. 

Most recently, I was in a bunch of SPACs, enjoying a steady stream of losses day after day. My account was at $29K or so, down $13k over all. 

I then looked at amc when it was around $9-$10 and I liked what I was hearing, so I liquidated my entire portfolio, took that $29k and bought over 1k shares and a TON of options, all expiring 2022 or later, some ITM, most way OTM ($40)

I saw my account go from $29k to about 500k in the span of a couple weeks, and when AMC was at $68 after hitting $70+ for the first time, I had to cash out all my options, I couldn’t believe the numbers I was looking at. 

So then I had $430k and a little over 1K AMC shares. I immediately sold a covered call 6/4 $73 for a quick $11k 

I already set aside enough for the taxes and all but my problem is, I want to build a legit long term portfolio and I don’t know if it’s the right time (indices at ATH) and I don’t know if I should buy stocks and sell covered calls on them at safe prices or if I should buy leaps for 2023. Not to mention I’m not sure my list is any good at all... I bought a ton of CHPT CCIV NNDM SKLZ WKHS and AONE. I’m looking to pick up 2023 calls on PLTR and also buy stock or calls on XPEV. 

I’ve never had this much to put into a portfolio and I’m still kind of young, I don’t want to lose it all, I feel like I’ve made enough to do some legit investing that will grow over time and I no longer have to do options yolos because of being down thousands and nervous about it. 

Anyone with experience who would be kind enough to share what they would do if they were me, please don’t hesitate. I’m grateful for any time you take responding!

Just to give some background, I’m in my 20s, I make over $150k from work yearly. I’m paying wayyyy too much for rent so I’m looking for a home soon, and my only real debt is $70k in student loans, thanks!",7maryneekek,2,/r/investing/comments/nsrjpg/daily_advice_thread_all_basic_help_or_advice/h0ofk8l/,0.064,0.834,0.102,0.9686
82,CHPT," Just got SUPER lucky, need advice please and thank you, reader.

So I’ve been dabbling around with the stock market and other assets for a while now, started off when I was 18 and I had a spare $1,000 to lose, so I did. 

I’ve learned a lot over the years, and I also have a business finance background, so fundamentally I have a good grasp of things and I’ve also really honed my technical analysis as well, which is what helped me score the come up I’m about to address. 

I’ve had a lot of misses, and losses, and some small wins here and there. Over the years and after taking so many Ls, I began to realise some of the bad habits I had that were crippling me.

I can’t count how many times I’ve bought a stock and it’s tanked, or I bought and sold for a small profit, then the stock runs another 300% or buying short term calls without paying close attention to the over all market trends and getting screwed. 

Anyways, I got on Robinhood last year, and I threw in about $43k total since then. I immediately was down between 2k-to 5k and then at one point I hit $70k account value and I was over the moon, but I didn’t sell the small cap EV play that erased my losses and nearly doubled my investment. Instead I rode it down 60% while I lost money on other stocks. 

Most recently, I was in a bunch of SPACs, enjoying a steady stream of losses day after day. My account was at $29K or so, down $13k over all. 

I then looked at amc when it was around $9-$10 and I liked what I was hearing, so I liquidated my entire portfolio, took that $29k and bought over 1k shares and a TON of options, all expiring 2022 or later, some ITM, most way OTM ($40)

I saw my account go from $29k to about 500k in the span of a couple weeks, and when AMC was at $68 after hitting $70+ for the first time, I had to cash out all my options, I couldn’t believe the numbers I was looking at. 

So then I had $430k and a little over 1K AMC shares. I immediately sold a covered call 6/4 $73 for a quick $11k 

I already set aside enough for the taxes and all but my problem is, I want to build a legit long term portfolio and I don’t know if it’s the right time (indices at ATH) and I don’t know if I should buy stocks and sell covered calls on them at safe prices or if I should buy leaps for 2023. Not to mention I’m not sure my list is any good at all... I bought a ton of CHPT CCIV NNDM SKLZ WKHS and AONE. I’m looking to pick up 2023 calls on PLTR and also buy stock or calls on XPEV. 

I’ve never had this much to put into a portfolio and I’m still kind of young, I don’t want to lose it all, I feel like I’ve made enough to do some legit investing that will grow over time and I no longer have to do options yolos because of being down thousands and nervous about it. 

Anyone with experience who would be kind enough to share what they would do if they were me, please don’t hesitate. I’m grateful for any time you take responding!

Just to give some background, I’m in my 20s, I make over $150k from work yearly. I’m paying wayyyy too much for rent so I’m looking for a home soon, and my only real debt is $70k in student loans, thanks!",7maryneekek,2,/r/investing/comments/nsrjpg/daily_advice_thread_all_basic_help_or_advice/h0ofk8l/,0.064,0.834,0.102,0.9686
