,ticker,comment,username,score,permalink,neg,neu,pos,compound
321,DKNG," DKNG - has fallen quite a bit from it's ATH a couple months ago, just like other hard hit stocks in similar sectors, but it didn't have any bad news and had relatively strong earnings when compared to other comps. I have a position in shares and LEAPs",SulkyVirus,8,/r/stocks/comments/nfgeit/what_are_your_current_underrated_stock_picks/gym2d6w/,0.056,0.702,0.242,0.8962
322,AMZN," AMZN price target just increased to $4,500-$6,000. As valuable as they are, they reviewed a number of fast growing business segments on their recent EC.",LeanTheFuckIn,11,/r/stocks/comments/nfgeit/what_are_your_current_underrated_stock_picks/gylgd4z/,0.0,0.709,0.291,0.7351
323,EC," AMZN price target just increased to $4,500-$6,000. As valuable as they are, they reviewed a number of fast growing business segments on their recent EC.",LeanTheFuckIn,11,/r/stocks/comments/nfgeit/what_are_your_current_underrated_stock_picks/gylgd4z/,0.0,0.709,0.291,0.7351
324,BABA," I'll echo the sentiment on BABA.  I think the dust is still clearing and people are waiting to see the financial impact of all the changes, but still an incredibly successful company trading at a very low valuation.

While it isn't undervalued I do think PINS is my most underappreciated stock.  The world is slowly catching on that it isn't just for women to scroll for hairstyles or decorating ideas.  I think they are in the very early stages of revolutionizing the whole social commerce space.",SirGasleak,6,/r/stocks/comments/nfgeit/what_are_your_current_underrated_stock_picks/gyljzd3/,0.035,0.902,0.064,0.5499
325,PINS," I'll echo the sentiment on BABA.  I think the dust is still clearing and people are waiting to see the financial impact of all the changes, but still an incredibly successful company trading at a very low valuation.

While it isn't undervalued I do think PINS is my most underappreciated stock.  The world is slowly catching on that it isn't just for women to scroll for hairstyles or decorating ideas.  I think they are in the very early stages of revolutionizing the whole social commerce space.",SirGasleak,6,/r/stocks/comments/nfgeit/what_are_your_current_underrated_stock_picks/gyljzd3/,0.035,0.902,0.064,0.5499
326,RGR, RGR. (Ruger) Crushing their sales and making earnings left and right. Plus they are quick to innovate and jump on market trends. Local stores sell out fast. The acquisition of marlin adds a potentially huge product line.,Forgotwhyimhere69,6,/r/stocks/comments/nfgeit/what_are_your_current_underrated_stock_picks/gyldh34/,0.061,0.805,0.134,0.4588
327,BEAM," I would caution you about over-extending yourself into young biotech companies exclusively studying gene-editing therapies (CRSP, BEAM, etc) simply because they largely have no drugs currently approved. It doesn’t mean they don’t have promising pipelines and won’t find success, but their current value is baked exclusively on those patents. It’s an investment with too much downside risk IMO. 

If you want some exposure in that field, I’d recommend a company like VRTX, which has strong pre-existing patents for CF drugs and is collaborating with CRSP for many of those early gene-editing therapies you’re interested in. Based on my DCF analysis, it’s also fairly-slightly undervalued.",donttazemebro4,5,/r/stocks/comments/nfgeit/what_are_your_current_underrated_stock_picks/gylfd13/,0.055,0.738,0.206,0.9545
328,CF," I would caution you about over-extending yourself into young biotech companies exclusively studying gene-editing therapies (CRSP, BEAM, etc) simply because they largely have no drugs currently approved. It doesn’t mean they don’t have promising pipelines and won’t find success, but their current value is baked exclusively on those patents. It’s an investment with too much downside risk IMO. 

If you want some exposure in that field, I’d recommend a company like VRTX, which has strong pre-existing patents for CF drugs and is collaborating with CRSP for many of those early gene-editing therapies you’re interested in. Based on my DCF analysis, it’s also fairly-slightly undervalued.",donttazemebro4,5,/r/stocks/comments/nfgeit/what_are_your_current_underrated_stock_picks/gylfd13/,0.055,0.738,0.206,0.9545
329,CRSP," I would caution you about over-extending yourself into young biotech companies exclusively studying gene-editing therapies (CRSP, BEAM, etc) simply because they largely have no drugs currently approved. It doesn’t mean they don’t have promising pipelines and won’t find success, but their current value is baked exclusively on those patents. It’s an investment with too much downside risk IMO. 

If you want some exposure in that field, I’d recommend a company like VRTX, which has strong pre-existing patents for CF drugs and is collaborating with CRSP for many of those early gene-editing therapies you’re interested in. Based on my DCF analysis, it’s also fairly-slightly undervalued.",donttazemebro4,5,/r/stocks/comments/nfgeit/what_are_your_current_underrated_stock_picks/gylfd13/,0.055,0.738,0.206,0.9545
330,DCF," I would caution you about over-extending yourself into young biotech companies exclusively studying gene-editing therapies (CRSP, BEAM, etc) simply because they largely have no drugs currently approved. It doesn’t mean they don’t have promising pipelines and won’t find success, but their current value is baked exclusively on those patents. It’s an investment with too much downside risk IMO. 

If you want some exposure in that field, I’d recommend a company like VRTX, which has strong pre-existing patents for CF drugs and is collaborating with CRSP for many of those early gene-editing therapies you’re interested in. Based on my DCF analysis, it’s also fairly-slightly undervalued.",donttazemebro4,5,/r/stocks/comments/nfgeit/what_are_your_current_underrated_stock_picks/gylfd13/,0.055,0.738,0.206,0.9545
331,IMO," I would caution you about over-extending yourself into young biotech companies exclusively studying gene-editing therapies (CRSP, BEAM, etc) simply because they largely have no drugs currently approved. It doesn’t mean they don’t have promising pipelines and won’t find success, but their current value is baked exclusively on those patents. It’s an investment with too much downside risk IMO. 

If you want some exposure in that field, I’d recommend a company like VRTX, which has strong pre-existing patents for CF drugs and is collaborating with CRSP for many of those early gene-editing therapies you’re interested in. Based on my DCF analysis, it’s also fairly-slightly undervalued.",donttazemebro4,5,/r/stocks/comments/nfgeit/what_are_your_current_underrated_stock_picks/gylfd13/,0.055,0.738,0.206,0.9545
332,VRTX," I would caution you about over-extending yourself into young biotech companies exclusively studying gene-editing therapies (CRSP, BEAM, etc) simply because they largely have no drugs currently approved. It doesn’t mean they don’t have promising pipelines and won’t find success, but their current value is baked exclusively on those patents. It’s an investment with too much downside risk IMO. 

If you want some exposure in that field, I’d recommend a company like VRTX, which has strong pre-existing patents for CF drugs and is collaborating with CRSP for many of those early gene-editing therapies you’re interested in. Based on my DCF analysis, it’s also fairly-slightly undervalued.",donttazemebro4,5,/r/stocks/comments/nfgeit/what_are_your_current_underrated_stock_picks/gylfd13/,0.055,0.738,0.206,0.9545
333,CACI, CACI,General_DD1811,2,/r/stocks/comments/nfgeit/what_are_your_current_underrated_stock_picks/gylmy7b/,0.0,1.0,0.0,0.0
334,ASTS," AST SpaceMobile (ASTS) -- company creating a satellite network for cellular service; will connect directly to phones anywhere in the world with no need for hardware; smart business plan to scale as an add-on service for existing phone companies rather than being a direct to consumer company; and basically no competitors at present and have a pretty decent head start on anyone entering the market (altho someone like Spire Global or Starlink could conceivably pivot to cellular).  ASTS is a long shot buy and hold bet... but I think it's totally underrated, especially after the recent correction.  The technology is exciting and their business model allows for super fast growth because they will be a service add-on to ATT/Verizon/Sprint rather than a competitor. I'm in the red on them now... but check back in 10 years.",MonkeyofMainSt,2,/r/stocks/comments/nfgeit/what_are_your_current_underrated_stock_picks/gylqg48/,0.022,0.836,0.142,0.9528
335,IMO," Personally I think Xiaomi. Sure, it's a Chinese stock and you actually buy a stock from the cayman islands, but the company IMO has potential. The products are great and they're cheap. If they manage to hit the American markets with success and proceed to grow in Europe, and then increase their price slightly to increase their margin, i can see them doing more than well",KittenOnHunt,2,/r/stocks/comments/nfgeit/what_are_your_current_underrated_stock_picks/gylqrrj/,0.0,0.724,0.276,0.9695
336,VRTX," > On a personal note, personally, I’m looking for more science/biotech/medical stocks, so any recommendations?

VRTX",fino_nyc,3,/r/stocks/comments/nfgeit/what_are_your_current_underrated_stock_picks/gyleti6/,0.0,1.0,0.0,0.0
337,ASML," ASML
ASMI",gertje69-420,4,/r/stocks/comments/nfgeit/what_are_your_current_underrated_stock_picks/gylhq2n/,0.0,1.0,0.0,0.0
338,HYLN, HYLN.,jupc,3,/r/stocks/comments/nfgeit/what_are_your_current_underrated_stock_picks/gylgach/,0.0,1.0,0.0,0.0
339,AMD," I have 3.

AMD i just don't get it... 

Black Berry was a meme but I think the case is solid do I don't get why it keeps dropping. 

Vestas VWS it's wind mills and they are good at that.",Sentraxx,2,/r/stocks/comments/nfgeit/what_are_your_current_underrated_stock_picks/gyln6at/,0.0,0.852,0.148,0.6956
340,MILE, MILE,Thewayshegoes0411,1,/r/stocks/comments/nfgeit/what_are_your_current_underrated_stock_picks/gyldj7s/,0.0,1.0,0.0,0.0
341,CPRX, CPRX or UWMC,InternalAuditor62,1,/r/stocks/comments/nfgeit/what_are_your_current_underrated_stock_picks/gyljq9k/,0.0,1.0,0.0,0.0
342,UWMC, CPRX or UWMC,InternalAuditor62,1,/r/stocks/comments/nfgeit/what_are_your_current_underrated_stock_picks/gyljq9k/,0.0,1.0,0.0,0.0
343,HGEN, HGEN,darkspherei,1,/r/stocks/comments/nfgeit/what_are_your_current_underrated_stock_picks/gyloikj/,0.0,1.0,0.0,0.0
344,AHT," AHT. I know it's not the industries that you listed, but it has huge potential as a re-opening stock. Take a look at their 52 week and 5 year charts. They're a REIT that is into up-scale hotels. That have a lovely portfolio. They're currently trading just above 3 dollars a share, way under valued. I'm planning on holding at least until the end of summer.",Auquaholic,1,/r/stocks/comments/nfgeit/what_are_your_current_underrated_stock_picks/gylqc4i/,0.0,0.785,0.215,0.9413
345,BHTG, BHTG the carnival order that just came in should give a nice boost.,kevbrow,1,/r/stocks/comments/nfgeit/what_are_your_current_underrated_stock_picks/gylrae9/,0.0,0.645,0.355,0.6705
346,RIDE, RIDE,lordhaber,1,/r/stocks/comments/nfgeit/what_are_your_current_underrated_stock_picks/gylri3p/,0.0,1.0,0.0,0.0
347,AHT," AHT 

With hospitality down, hospitality property investment is waaaay down. However, I see it as a solid long play considering it was $25 prepandemic and barely cracked $3 today.",JupiterTarts,1,/r/stocks/comments/nfgeit/what_are_your_current_underrated_stock_picks/gylrrfq/,0.0,0.862,0.138,0.4588
348,AFRM, AFRM,Illustrious-Bat3132,1,/r/stocks/comments/nfgeit/what_are_your_current_underrated_stock_picks/gym85q3/,0.0,1.0,0.0,0.0
349,SP," $VSTO long 1-2 years or until American ammunition shortage is resolved.

Up 24% since March and predictions are up to 50 SP, personally I think that is low.",FrankAmerica,1,/r/stocks/comments/nfgeit/what_are_your_current_underrated_stock_picks/gym8zy7/,0.138,0.805,0.057,-0.34
350,HEAR," HEAR.


Esports is big, peripherals are big. They don’t need a dominant market cap, just a ok one. And they have such a goodlooking balance sheet in a time of massively overvalued stocks.",no1rookie,1,/r/stocks/comments/nfgeit/what_are_your_current_underrated_stock_picks/gym9d97/,0.0,0.927,0.073,0.296
351,EAF," EAF .... a 'green' play to make steel

VRT.... demand for infrastructure for server farms isn't going anywhere w/ rise of cloud, big data, 5g etc. etc.",JhoLow_1MDB,1,/r/stocks/comments/nfgeit/what_are_your_current_underrated_stock_picks/gymagbl/,0.054,0.86,0.086,0.2263
352,VRT," EAF .... a 'green' play to make steel

VRT.... demand for infrastructure for server farms isn't going anywhere w/ rise of cloud, big data, 5g etc. etc.",JhoLow_1MDB,1,/r/stocks/comments/nfgeit/what_are_your_current_underrated_stock_picks/gymagbl/,0.054,0.86,0.086,0.2263
353,BABA," EVO/EVVTY

PRX/PROSY

FB

BABA",rollokolaa,1,/r/stocks/comments/nfgeit/what_are_your_current_underrated_stock_picks/gymaqxz/,0.0,1.0,0.0,0.0
354,FB," EVO/EVVTY

PRX/PROSY

FB

BABA",rollokolaa,1,/r/stocks/comments/nfgeit/what_are_your_current_underrated_stock_picks/gymaqxz/,0.0,1.0,0.0,0.0
355,BYND," BYND. It dropped quite a bit from it's ath, but I think it oversold. The vegan market is growing and the meat alternatives are starting to get really good.",Iquey,1,/r/stocks/comments/nfgeit/what_are_your_current_underrated_stock_picks/gymbizs/,0.0,0.798,0.202,0.7461
356,JKS, JKS JinkoSolar.,ini0n,1,/r/stocks/comments/nfgeit/what_are_your_current_underrated_stock_picks/gymbktg/,0.0,1.0,0.0,0.0
357,CVS," CVS is both underrated and undervalued--the cross-channel integration between Aetna and CVS stores/MinuteClinic is going to be insane, and is already starting to bare fruits. $100-$120 by EoY",syzygyz,1,/r/stocks/comments/nfgeit/what_are_your_current_underrated_stock_picks/gymcq4l/,0.091,0.909,0.0,-0.4019
358,PLUG, PLUG,Banksyskeet,-6,/r/stocks/comments/nfgeit/what_are_your_current_underrated_stock_picks/gylehof/,0.0,1.0,0.0,0.0
359,CBD," Next leaf solutions $OILS 

Canadian company. 

Produce CBD as well as THC distillate. 

Have numerous patents throughout the world.
(Over 70)

Recently acquired the rights to the well known ‘Glacial Gold’ brand

Their cannabis research licence allows them to conduct human trials.

Share price is sitting at $.23 as of now! I believe they are very undervalued",Clayjo21,-1,/r/stocks/comments/nfgeit/what_are_your_current_underrated_stock_picks/gyldubn/,0.0,0.861,0.139,0.75
360,THC," Next leaf solutions $OILS 

Canadian company. 

Produce CBD as well as THC distillate. 

Have numerous patents throughout the world.
(Over 70)

Recently acquired the rights to the well known ‘Glacial Gold’ brand

Their cannabis research licence allows them to conduct human trials.

Share price is sitting at $.23 as of now! I believe they are very undervalued",Clayjo21,-1,/r/stocks/comments/nfgeit/what_are_your_current_underrated_stock_picks/gyldubn/,0.0,0.861,0.139,0.75
361,IR," It my ""risky"" don't invest more than I comfortable loosing stock, UXIN. It a online car sale website in China. Got alot of red flags with poor IR and a non-impressive history, but may give a decent profit if it succeeds.

Normal stock, would be VRT, believe it will be a stock that beats the market average return. It provides services to cloud computing centers.",one8e4,0,/r/stocks/comments/nfgeit/what_are_your_current_underrated_stock_picks/gylfxum/,0.03,0.818,0.152,0.8552
362,UXIN," It my ""risky"" don't invest more than I comfortable loosing stock, UXIN. It a online car sale website in China. Got alot of red flags with poor IR and a non-impressive history, but may give a decent profit if it succeeds.

Normal stock, would be VRT, believe it will be a stock that beats the market average return. It provides services to cloud computing centers.",one8e4,0,/r/stocks/comments/nfgeit/what_are_your_current_underrated_stock_picks/gylfxum/,0.03,0.818,0.152,0.8552
363,VRT," It my ""risky"" don't invest more than I comfortable loosing stock, UXIN. It a online car sale website in China. Got alot of red flags with poor IR and a non-impressive history, but may give a decent profit if it succeeds.

Normal stock, would be VRT, believe it will be a stock that beats the market average return. It provides services to cloud computing centers.",one8e4,0,/r/stocks/comments/nfgeit/what_are_your_current_underrated_stock_picks/gylfxum/,0.03,0.818,0.152,0.8552
364,ASML," ASML, BABA, TWST, PSNL",TaxShield,0,/r/stocks/comments/nfgeit/what_are_your_current_underrated_stock_picks/gym1pe4/,0.0,1.0,0.0,0.0
365,BABA," ASML, BABA, TWST, PSNL",TaxShield,0,/r/stocks/comments/nfgeit/what_are_your_current_underrated_stock_picks/gym1pe4/,0.0,1.0,0.0,0.0
366,PSNL," ASML, BABA, TWST, PSNL",TaxShield,0,/r/stocks/comments/nfgeit/what_are_your_current_underrated_stock_picks/gym1pe4/,0.0,1.0,0.0,0.0
367,TWST," ASML, BABA, TWST, PSNL",TaxShield,0,/r/stocks/comments/nfgeit/what_are_your_current_underrated_stock_picks/gym1pe4/,0.0,1.0,0.0,0.0
368,TV," CBS All access, Paramount+, Pluto TV and most importantly CBS sports. Compared to other streaming services I do think VIAC is currently undervalued.",Cornwaliis,6,/r/stocks/comments/nfgeit/what_are_your_current_underrated_stock_picks/gylgjhx/,0.0,0.89,0.11,0.3804
369,VIAC," CBS All access, Paramount+, Pluto TV and most importantly CBS sports. Compared to other streaming services I do think VIAC is currently undervalued.",Cornwaliis,6,/r/stocks/comments/nfgeit/what_are_your_current_underrated_stock_picks/gylgjhx/,0.0,0.89,0.11,0.3804
370,BABA," BABA is an odd one, everyone acknowledges that it is the next Amazon, but every few months there's this massive sell-off due to politics/Chinese government action. I used to hold BABA but sold at break-even because I got tired of the extreme instability.     

Foreign investments are generally fine, but I'm staying out of Chinese companies because the Chinese government can make your investment worth $0 at the flick of a pen, and there's no legal recourse/compensation like in most Western countries.   

People who stay in BABA just have more risk tolerance than I do.",TimeRemove,18,/r/stocks/comments/nfgeit/what_are_your_current_underrated_stock_picks/gyldapd/,0.108,0.758,0.134,0.1847
371,THC," Great financials, rapidly expanding into prime markets, now part of the THC ETF, about to have a major catalyst this month with Nasdaq listing. What's not to like?",DiscDown4What,1,/r/stocks/comments/nfgeit/what_are_your_current_underrated_stock_picks/gylt7pr/,0.068,0.801,0.131,0.457
372,ASML," How exactly do you consider ASML ""underrated""? Enormous company with a moat that makes people consider them the general winner in the semis-space in the coming years, and they are valued as such.",rollokolaa,2,/r/stocks/comments/nfgeit/what_are_your_current_underrated_stock_picks/gymab6a/,0.0,0.817,0.183,0.7717
373,IPOE," IPOE has a cap of 2 billion, that makes IPOE overvalued. When they merge, it will automatically have a higher market cap, around 14 billion at current IPOE prices, so massively overvalued if SOFI is worth 8 billion.",Viscoden,2,/r/stocks/comments/nfgeit/what_are_your_current_underrated_stock_picks/gym841d/,0.0,0.946,0.054,0.2263
374,HUGE," I used to live in China.  
Alibaba is amazing. Obviously there are more scams, and shitty customer service, but it's so damn cheap and it's HUGE.  


Alibaba's customer base dwarfs that of Amazon",travellinglaowai,4,/r/stocks/comments/nfgeit/what_are_your_current_underrated_stock_picks/gylm7m6/,0.22,0.588,0.192,-0.2995
375,BABA, BABA is the OG cheap NBA jersey site I used to use. You could get rip off jerseys for like 20 USD. In college we would buy like 3 jerseys a piece lol,pharmacykiller33,2,/r/stocks/comments/nfgeit/what_are_your_current_underrated_stock_picks/gym7hex/,0.0,0.776,0.224,0.7783
376,NBA, BABA is the OG cheap NBA jersey site I used to use. You could get rip off jerseys for like 20 USD. In college we would buy like 3 jerseys a piece lol,pharmacykiller33,2,/r/stocks/comments/nfgeit/what_are_your_current_underrated_stock_picks/gym7hex/,0.0,0.776,0.224,0.7783
377,OG, BABA is the OG cheap NBA jersey site I used to use. You could get rip off jerseys for like 20 USD. In college we would buy like 3 jerseys a piece lol,pharmacykiller33,2,/r/stocks/comments/nfgeit/what_are_your_current_underrated_stock_picks/gym7hex/,0.0,0.776,0.224,0.7783
378,IPOE," IPOE + Private Equity (PIPE), plus previous private shareholders. 

Think about IPOE as a slice of the total, and we are buying a slice of that slice.",Viscoden,1,/r/stocks/comments/nfgeit/what_are_your_current_underrated_stock_picks/gymbd9b/,0.0,1.0,0.0,0.0
379,PRPL," I wouldn't have even thought about the mattress market, but I should've given that I've listened to podcasts a while back on 'why mattress stores are everywhere', even though it seems like the parking lots are always near empty... spoiler the margins are ridiculous.  

PRPL looks particularly interesting.  They're really building their name.  And just a quick glance shows that their current price matches analyst's average low, which is always good.  

I'll be delving further.",Karnes,5,/r/stocks/comments/nexs24/maybe_im_boring_but_mattress_companies/gyit1fn/,0.071,0.795,0.134,0.7343
380,DD," WS/B  called, they said they want their DD back. 


Lol, i dont know if you were around for the purple mattress drama, but this brings back memories.",Noah_Deez_Nutz,6,/r/stocks/comments/nexs24/maybe_im_boring_but_mattress_companies/gyiuxm8/,0.0,0.887,0.113,0.2617
381,PRPL," I'm long on PRPL. I like the technology moat (if you haven't tried it, I recommend doing so before investing) and the fact that they are vertically integrated (better margins), which are advantages over other companies. They also have been investing a lot of money into their production facilities lately, which will enable them to grow more. 

As far as the P/E....they just became profitable, so it is normal to have a high P/E, in my opinion. Not ever growth play has to be a world changing tech stock, sometimes a good mattress maker is a good counter balance.",creemeeseason,2,/r/stocks/comments/nexs24/maybe_im_boring_but_mattress_companies/gyjhogb/,0.061,0.807,0.132,0.8111
382,SNBR," So I bought SNBR on Feb 25 @ $137, now it’s down -22% to $108. I bought it cause Motley Fool Rule Breakers recommend it.

SNBR grew immensely during COVID, when I bought it it continued to grow a bit, but then It dropped hard cause it is considered a growth stock and all the growth stocks got beaten down recently. Recent earnings report was pretty decent. It beat earnings per share, but was a little below revenue targets because of some supply chain issues, apparently foam is harder to get cause of COVID. But supply chain issues will go away with time. They increased guidance on EPS as well. I think hopefully the beating down of growth stocks is over. If the market wasn’t freaking out the last few months it would have probably continued to grow.

So I think now is a good time to buy because of the recent dips, and long term it should do well.",DoctorStrawberry,1,/r/stocks/comments/nexs24/maybe_im_boring_but_mattress_companies/gyl0ixg/,0.082,0.731,0.188,0.961
383,BLUE," FUBO -36
MELI -37
TDOC -27
LMND -53 ouch!!!
BLUE +10 yay 


Yeah now I’m just gonna hold and pray I break even.  Lessons learned on so many levels.",boredpapa,1,/r/stocks/comments/nexs24/maybe_im_boring_but_mattress_companies/gylmnp5/,0.0,0.74,0.26,0.8306
384,FUBO," FUBO -36
MELI -37
TDOC -27
LMND -53 ouch!!!
BLUE +10 yay 


Yeah now I’m just gonna hold and pray I break even.  Lessons learned on so many levels.",boredpapa,1,/r/stocks/comments/nexs24/maybe_im_boring_but_mattress_companies/gylmnp5/,0.0,0.74,0.26,0.8306
385,LMND," FUBO -36
MELI -37
TDOC -27
LMND -53 ouch!!!
BLUE +10 yay 


Yeah now I’m just gonna hold and pray I break even.  Lessons learned on so many levels.",boredpapa,1,/r/stocks/comments/nexs24/maybe_im_boring_but_mattress_companies/gylmnp5/,0.0,0.74,0.26,0.8306
386,MELI," FUBO -36
MELI -37
TDOC -27
LMND -53 ouch!!!
BLUE +10 yay 


Yeah now I’m just gonna hold and pray I break even.  Lessons learned on so many levels.",boredpapa,1,/r/stocks/comments/nexs24/maybe_im_boring_but_mattress_companies/gylmnp5/,0.0,0.74,0.26,0.8306
387,TDOC," FUBO -36
MELI -37
TDOC -27
LMND -53 ouch!!!
BLUE +10 yay 


Yeah now I’m just gonna hold and pray I break even.  Lessons learned on so many levels.",boredpapa,1,/r/stocks/comments/nexs24/maybe_im_boring_but_mattress_companies/gylmnp5/,0.0,0.74,0.26,0.8306
388,WOOF, Im not invested in it but I like WOOF,that-manss,2,/r/stocks/comments/nexin2/stocks_on_my_watchlist/gyizytw/,0.0,0.683,0.317,0.5023
389,PTON, Big PTON fan,Drago0310,3,/r/stocks/comments/nexin2/stocks_on_my_watchlist/gyimjol/,0.0,0.465,0.535,0.3182
390,BYND," I have a few shares of BYND and added to my position today. Bagholding RIDE. I like them both still, but definitely in the red at the moment.",FuturesPassed,1,/r/stocks/comments/nexin2/stocks_on_my_watchlist/gyiuu34/,0.0,0.761,0.239,0.7096
391,RIDE," I have a few shares of BYND and added to my position today. Bagholding RIDE. I like them both still, but definitely in the red at the moment.",FuturesPassed,1,/r/stocks/comments/nexin2/stocks_on_my_watchlist/gyiuu34/,0.0,0.761,0.239,0.7096
