,ticker,comment,username,score,permalink,neg,neu,pos,compound
0,DD," A bit of DD on this DD - I just want to balance this out: 

Atos is up 25% pre market. It rallied 16.5% yesterday. There was no news to trigger this. 

It's current price is 2.91. That puts it just above it's first support point of 2.61 and just below it's first resistence point of 3.16. 

In terms of its products - they are not close to market. While the covid spray is promising now it has not entered 2nd phase trials yet. Phase three trials could be difficult to do if the vaccines drop the incidence of the disease in the real world. This is a risk.

There is only one stock analysis and it's also bullish, strong buy with a target of $5.00. Insiders haven't sold their positions for a long time. 

So imo:

Pros - it's a real company with a ten year history. 

It's science is pretty strong. 

It has a bit of buzz in the trading news. 

It has an analyst rating with a target of $5.00

Everything op said

Cons - is this information about their products already priced in?

Why is the stock doing so much movement without news?

By the time their product is ready for market, will there be any other nasal products? Will there be a high demand? 

This information isn't meant to sway anyone one way or another but to show the kind of thing I might look at before buying. Is anything fishy going on? Google it.  Doesn't seem to be anything strange. Just be careful buying today.",Kaiisim,217,/r/pennystocks/comments/m2hn23/atos_atossa_therapeutics_huge_upside_potential/gqk4q47/,0.038,0.9,0.062,0.7149
1,DD," Great DD, I’ve personally bought and sold $Atos a few times and although I fully believe in them as a company I’d suggest to be careful as it gets pumped up and dumped by day traders, it’s likely to hit $3.60 ish by Friday but I suggest setting a stop loss because it will drop back down, unless you’re holding long term as pennies won’t matter when it hits $6 eoy",CantsellWontSell,94,/r/pennystocks/comments/m2hn23/atos_atossa_therapeutics_huge_upside_potential/gqjfgv6/,0.138,0.795,0.067,-0.7391
2,DM, This is the best D&D I've ever read on /pennystocks. You have a future as a DM.,pifprowrestling,215,/r/pennystocks/comments/m2hn23/atos_atossa_therapeutics_huge_upside_potential/gqjb4yo/,0.0,0.769,0.231,0.6369
3,DD," Made 100% on 2$ a month back with $ATOS, i shall be forever grateful ![gif](emote|free_emotes_pack|joy)![gif](emote|free_emotes_pack|facepalm) All my money's tied up in OCGN, this DD looks very promising though, thank you for taking the time to write it, I may just have to jump in end of May time after my money matures over here",Bond007Junior,12,/r/pennystocks/comments/m2hn23/atos_atossa_therapeutics_huge_upside_potential/gqjpcg1/,0.0,0.837,0.163,0.8534
4,OCGN," Made 100% on 2$ a month back with $ATOS, i shall be forever grateful ![gif](emote|free_emotes_pack|joy)![gif](emote|free_emotes_pack|facepalm) All my money's tied up in OCGN, this DD looks very promising though, thank you for taking the time to write it, I may just have to jump in end of May time after my money matures over here",Bond007Junior,12,/r/pennystocks/comments/m2hn23/atos_atossa_therapeutics_huge_upside_potential/gqjpcg1/,0.0,0.837,0.163,0.8534
5,IP," I would be concerned about patent protection for a drug like that,  if it has been around as the metabolite of a well known treatment for a long time.  The IP situation of the company might not be ideal (that said i haven't looked for any of their patents on this to see how they might be intending to protect it). 

See what happened with terfenidine and it's acid metabolite with Merrel Dow for example,  which also had an active metabolite which wasn't  patentable.",stickytreefrog,8,/r/pennystocks/comments/m2hn23/atos_atossa_therapeutics_huge_upside_potential/gqjrs43/,0.032,0.854,0.114,0.7289
6,DD, Really good DD. Ive been looking at $ATOS for a while,nuggetofayard,6,/r/pennystocks/comments/m2hn23/atos_atossa_therapeutics_huge_upside_potential/gqjplzv/,0.0,0.738,0.262,0.4927
7,DD, Thanks for the DD. I have 50 shares at 3.30 average from right after that early February spike. If I waited a bit I could have bought for under $2 but oh well.,ZS196,3,/r/pennystocks/comments/m2hn23/atos_atossa_therapeutics_huge_upside_potential/gqjv97b/,0.0,0.807,0.193,0.6369
8,DD," I held Atossa for the same resons months ago and this DD is almost a 1to1 repost of it.
All this bullish bs may be true, just for me this one was a p&d.
Dont expect wonders, I sold and never regretted my decision.",CreatorOD,3,/r/pennystocks/comments/m2hn23/atos_atossa_therapeutics_huge_upside_potential/gqkmr6y/,0.0,0.884,0.116,0.6103
9,DD, This has definitely piqued my interest and I will take a deeper look at them and their research. Thank you for taking the time to do the massive amount of legwork on this. Your DD is pretty outstanding!,UnklVodka,2,/r/pennystocks/comments/m2hn23/atos_atossa_therapeutics_huge_upside_potential/gqjh0lv/,0.0,0.641,0.359,0.9412
10,DD, Great DD I will probably buy some 500 shares,d3hun13r,2,/r/pennystocks/comments/m2hn23/atos_atossa_therapeutics_huge_upside_potential/gqjp0cn/,0.0,0.488,0.512,0.743
11,ATOS, Have been in ATOS for a while now. Waiting for it to cross the $4 mark,Mahony0509,2,/r/pennystocks/comments/m2hn23/atos_atossa_therapeutics_huge_upside_potential/gqkav94/,0.0,1.0,0.0,0.0
12,DD," Thanks for the DD. Even though you said you avoided the TA aspect, the chart looks bullish with a good entry opportunity. Recent spike to $5.00 on good volume, a controlled pullback to the 50d on diminishing volume, the 50d about to cross above the 200d. Should be a great setup for a run back to $5.00 and beyond.",JagwarRocker,2,/r/pennystocks/comments/m2hn23/atos_atossa_therapeutics_huge_upside_potential/gqkghiu/,0.036,0.731,0.233,0.9217
13,TA," Thanks for the DD. Even though you said you avoided the TA aspect, the chart looks bullish with a good entry opportunity. Recent spike to $5.00 on good volume, a controlled pullback to the 50d on diminishing volume, the 50d about to cross above the 200d. Should be a great setup for a run back to $5.00 and beyond.",JagwarRocker,2,/r/pennystocks/comments/m2hn23/atos_atossa_therapeutics_huge_upside_potential/gqkghiu/,0.036,0.731,0.233,0.9217
14,MA," The recent run up is based off of zero news or catalysts.  Running on pure speculation.  I had a position from a month or so ago at $2.34.  Sold yesterday at $2.99, when I saw it pulling back.  With no news to drive volume, the stock doesn't have the power to test new highs.

I think Atossa has potential for a long term hold.  Short term, I fully expect the stock to retrace back around the 200 MA.  Looking to re-enter the stock around the same place I bought the first go around.

[https://stockcharts.com/h-sc/ui?s=ATOS](https://stockcharts.com/h-sc/ui?s=ATOS)",Yankeefan1970,2,/r/pennystocks/comments/m2hn23/atos_atossa_therapeutics_huge_upside_potential/gqklo1o/,0.029,0.971,0.0,-0.3736
15,ATOS," ATOS burned me last time after a similar uptrend idk. If people got in below 3 I'm happy for them, but gonna sit this one out.",DustinGoesWild,2,/r/pennystocks/comments/m2hn23/atos_atossa_therapeutics_huge_upside_potential/gqkzmbj/,0.047,0.861,0.092,0.2846
16,DD," I got intrigued by your DD and did some reading myself afterwards. The company has a lot of potential and very interesting project they are working on. They are debt free as well which is nice. However, they burn cash very fast ($11m in 2020 while they had $9.1m in cash in Sep20) and don't have any income at the moment. This worries me a lot.",Dyson04,2,/r/pennystocks/comments/m2hn23/atos_atossa_therapeutics_huge_upside_potential/gqk03u0/,0.072,0.776,0.152,0.7089
17,DD, I've been following this since some DD popped up here two months ago. It has netted me a 10% gain for my portfolio. Highly recommended!,Battlealvin2009,1,/r/pennystocks/comments/m2hn23/atos_atossa_therapeutics_huge_upside_potential/gqk3raa/,0.0,0.792,0.208,0.6989
18,DD," Nice DD, hope we can go above 4$ soon.  


I got in at 0,90$ a few weeks ago with 1000 shares, which quadrupled with the first pop a few days later. Sold 1/4 to get my initial investment back.

Now I'm still holding 750 shares of this at 0,90$ ""for free"" :)",EggCess,1,/r/pennystocks/comments/m2hn23/atos_atossa_therapeutics_huge_upside_potential/gqkaswe/,0.0,0.724,0.276,0.9371
19,DD," Great DD. This is my largest penny stock position, by far. Been holding and averaged down to bring it to 1.8. Holding till $10. Maybe sell half at 5.",rish62839,1,/r/pennystocks/comments/m2hn23/atos_atossa_therapeutics_huge_upside_potential/gqkdxdi/,0.0,0.872,0.128,0.6249
20,DD," You should see how much cash they have on hand. If you look at their chart history it looks as if they have done a reverse split with their stock. Its not uncommon for companies in this sector to hype up a product or treatment. So they can raise money to stay afloat. Also seeing how much insider an institutional invest is there as well, can help determine if it is going somewhere. Your DD looks good. There is just alot of nuance to the markets. We could be heading Into turbulent times. Michael Burry has put out a warning of hyper inflation. If that were to happen a lot of companies will decrease in value, as their cash on hand becomes less valuable. Just a warning that I think not enough people are paying attention too. Now might be the time to look for some good commodities play imo. Good luck with trading and investing.",Dorman_trades,1,/r/pennystocks/comments/m2hn23/atos_atossa_therapeutics_huge_upside_potential/gqkef93/,0.028,0.795,0.177,0.9742
21,DD, I like this company and I’m holding till 5 but I think it could be a little bit of wait time due to the market but thanks OP this DD makes me feel very validated in my choice !,highelf_420,1,/r/pennystocks/comments/m2hn23/atos_atossa_therapeutics_huge_upside_potential/gqkpvwo/,0.0,0.781,0.219,0.8263
22,NRZ, Just cashed out mine this morning moving to more conservative stocks such as NRZ with a nice dividend as well,PeanutPineAd,1,/r/pennystocks/comments/m2hn23/atos_atossa_therapeutics_huge_upside_potential/gqkxsjq/,0.0,0.776,0.224,0.5994
23,RH, been had this on my RH account... nice,AmericanMuscle4Ever,1,/r/pennystocks/comments/m2hn23/atos_atossa_therapeutics_huge_upside_potential/gqkzbnx/,0.0,0.714,0.286,0.4215
24,ATOS, ATOS has not performed well despite a lot of factors making it look like it should perform well.,kraz_drack,1,/r/pennystocks/comments/m2hn23/atos_atossa_therapeutics_huge_upside_potential/gql9x0c/,0.18,0.696,0.124,-0.033
25,DD," Great DD, I appreciate all the effort you went through with formatting, sources, etc. as well as I agree with your medium and long-term indicators; however, your short term catalysts are kind of a moot point imo because every penny stock therapeutics facility is producing some sort of COVID-19 nasal or patch type of thing and I really think it is taking away resources from their long-term goals.

SNGX, pretty sure SEEL, as well as others are all working on COVID things and every time I've seen news release of one of these companies working on something covid-related the stock tanks. lol

I am not an analyst, or anything like that by any means so not too sure; FWIW I do not hold any of those companies any more, I sold them at $2.60/$4.25.",MutaKingPrime,1,/r/pennystocks/comments/m2hn23/atos_atossa_therapeutics_huge_upside_potential/gqldi7v/,0.0,0.815,0.185,0.9738
26,SEEL," Great DD, I appreciate all the effort you went through with formatting, sources, etc. as well as I agree with your medium and long-term indicators; however, your short term catalysts are kind of a moot point imo because every penny stock therapeutics facility is producing some sort of COVID-19 nasal or patch type of thing and I really think it is taking away resources from their long-term goals.

SNGX, pretty sure SEEL, as well as others are all working on COVID things and every time I've seen news release of one of these companies working on something covid-related the stock tanks. lol

I am not an analyst, or anything like that by any means so not too sure; FWIW I do not hold any of those companies any more, I sold them at $2.60/$4.25.",MutaKingPrime,1,/r/pennystocks/comments/m2hn23/atos_atossa_therapeutics_huge_upside_potential/gqldi7v/,0.0,0.815,0.185,0.9738
27,SNGX," Great DD, I appreciate all the effort you went through with formatting, sources, etc. as well as I agree with your medium and long-term indicators; however, your short term catalysts are kind of a moot point imo because every penny stock therapeutics facility is producing some sort of COVID-19 nasal or patch type of thing and I really think it is taking away resources from their long-term goals.

SNGX, pretty sure SEEL, as well as others are all working on COVID things and every time I've seen news release of one of these companies working on something covid-related the stock tanks. lol

I am not an analyst, or anything like that by any means so not too sure; FWIW I do not hold any of those companies any more, I sold them at $2.60/$4.25.",MutaKingPrime,1,/r/pennystocks/comments/m2hn23/atos_atossa_therapeutics_huge_upside_potential/gqldi7v/,0.0,0.815,0.185,0.9738
28,DD," Nice DD, well done - invested for a while now!",GermanRocketMan_13,1,/r/pennystocks/comments/m2hn23/atos_atossa_therapeutics_huge_upside_potential/gqma0hb/,0.0,0.536,0.464,0.636
29,DD," I read a DD on this a few days ago and thought what the heck, I'll bite. Bought 100 shares. Surprisingly it didn't go down 20% that day, like most of my impulse buys. 

Today I was rewarded with this:

[https://www.globenewswire.com/news-release/2021/03/11/2191501/0/en/Atossa-Therapeutics-Announces-Receipt-of-FDA-Safe-to-Proceed-Letter-for-Treatment-of-an-Ovarian-Cancer-Patient-with-Oral-Endoxifen-Under-Expanded-Access-Pathway.html](https://www.globenewswire.com/news-release/2021/03/11/2191501/0/en/Atossa-Therapeutics-Announces-Receipt-of-FDA-Safe-to-Proceed-Letter-for-Treatment-of-an-Ovarian-Cancer-Patient-with-Oral-Endoxifen-Under-Expanded-Access-Pathway.html)

Would be an easy dump for a few bucks, but this is a good sign for future upside potential -- or a complete wipe out :-D Ask me again in a few weeks.",Arnold_Laynes_Hobby,1,/r/pennystocks/comments/m2hn23/atos_atossa_therapeutics_huge_upside_potential/gqmbjd3/,0.023,0.742,0.235,0.9393
30,IDE," If you want a compelling CANCER play— check out RDGL (Vivos Inc).... they didn’t get FDA Breakthrough Designation in Jan, but the FDA did advise they met certain criteria, which has prompted the company to prepare to file for an IDE in Q2. 

The price will likely jump if this is accepted, which seems to be a good chance. Long term, this stock is very compelling as they are working with Mayo Clinic and also will prepare for human trials",MAGS0330,0,/r/pennystocks/comments/m2hn23/atos_atossa_therapeutics_huge_upside_potential/gqke7zj/,0.034,0.781,0.185,0.8894
31,OEG," Oeg energy popping 

https://s26.q4cdn.com/304959637/files/doc_presentations/2021/OEG-Investor-Presentation-3.10.21.pdf

https://stocktwits.com/symbol/OEG",BestFail348,0,/r/pennystocks/comments/m2hn23/atos_atossa_therapeutics_huge_upside_potential/gqkmlso/,0.0,0.656,0.344,0.2732
32,DD," >This information isn't meant to sway anyone one way or another but to show the kind of thing I might look at before buying.

No, these are the type of comments we need. Too often, these DD posts have a lot of convincing info but from a pumper's POV. But there's always two sides of a coin. My logic is always: What is everyone else missing? If this is a high promise company, why isn't the price already higher?

The reasons usually vary but with biotechs, the answer is almost always: How are they going to pay for trials? And more often than not, the answer is dilution.",HowardTCoComp,21,/r/pennystocks/comments/m2hn23/atos_atossa_therapeutics_huge_upside_potential/gqkwg9y/,0.069,0.873,0.058,0.212
33,ATOS, I got in ATOS a few months ago. 8ts already dipped. Hop on brotha.,mdh579,9,/r/pennystocks/comments/m2hn23/atos_atossa_therapeutics_huge_upside_potential/gqkaj5y/,0.0,1.0,0.0,0.0
34,DD, This is a great comment! I will look for this information and update the DD. Thank very much.,JoacoFerna24,1,/r/pennystocks/comments/m2hn23/atos_atossa_therapeutics_huge_upside_potential/gqkbcg3/,0.0,0.67,0.33,0.784
35,IMO, I live outside the US too a good broker that you can us with very low fees IMO is AmeriTrade. Hope it helps,JoacoFerna24,2,/r/pennystocks/comments/m2hn23/atos_atossa_therapeutics_huge_upside_potential/gqkbs7m/,0.086,0.612,0.302,0.719
36,AM," I think it reverse split a couple times in the past, and investors weren’t too keen on that. Could’ve been other outliers - don’t quote me on that though at 3something AM",ImperialFists,3,/r/pennystocks/comments/m2hn23/atos_atossa_therapeutics_huge_upside_potential/gqk8b9n/,0.0,0.918,0.082,0.3612
37,DD," Hi there, I provided this link on the DD https://ascopubs.org/doi/10.1200/JCO.2017.73.3246 if you go into there you will finde many researches on the oral endoxifen",JoacoFerna24,1,/r/pennystocks/comments/m2hn23/atos_atossa_therapeutics_huge_upside_potential/gqkcnds/,0.0,1.0,0.0,0.0
38,JCO," Hi there, I provided this link on the DD https://ascopubs.org/doi/10.1200/JCO.2017.73.3246 if you go into there you will finde many researches on the oral endoxifen",JoacoFerna24,1,/r/pennystocks/comments/m2hn23/atos_atossa_therapeutics_huge_upside_potential/gqkcnds/,0.0,1.0,0.0,0.0
39,DD," Just FYI, he’s (lovingly) teasing you :). It is great DD! But pointing out it’s DD - due diligence - not D&D, dungeons and dragons.",Kwolf54,1,/r/pennystocks/comments/m2hn23/atos_atossa_therapeutics_huge_upside_potential/gqlbeya/,0.046,0.709,0.245,0.7667
40,JCO," The problem with endoxifen is getting it added to insurance formularies. It doesn’t matter if it gets FDA approved if it doesn’t become a tier drug. Tamoxifen is cheap, been around for decades, and is a part of most insurance formularies. It won’t get replaced by a drug made specifically for a population that is enzyme deficient

Theres a handful of alternative treatments for CYP2D6 deficient patients anyways. I don’t think this stock is a good investment. It’s most likely Pump and dump.

This is a good read if you have time https://ascopubs.org/doi/10.1200/JCO.19.03119",dangitgrotto,1,/r/pennystocks/comments/m2hn23/atos_atossa_therapeutics_huge_upside_potential/gqljbja/,0.056,0.84,0.103,0.5267
41,TY," TY for the post.  Did she say anything negative at all? This all sounds a little too good, to be frank.",ireallydontcare52,183,/r/pennystocks/comments/m2s6mp/a_nurses_perspective_on_ctxr_citius/gqkzrlj/,0.139,0.638,0.223,0.3082
42,CTXR, ICU physician and investor in CTXR here. There is a lot of inaccurate information above.,philosurpher,71,/r/pennystocks/comments/m2s6mp/a_nurses_perspective_on_ctxr_citius/gqljwp3/,0.0,1.0,0.0,0.0
43,CTXR," This poster has a strong history of posting.  Well posting exactly 2 things.  ""I am a nurse and not pumping CTXR but i am pumping CTXR"".  The only other history is a long history of ""please upvote this silly post so I can have more karma so I can pump CTXR more"".",45sfCA,124,/r/pennystocks/comments/m2s6mp/a_nurses_perspective_on_ctxr_citius/gql6qhx/,0.0,0.84,0.16,0.7003
44,CTXR," As always when CTXR is mentioned, it is entertaining.  

I didn’t realize there are so many nurses and doctors in this sub!",superman853,21,/r/pennystocks/comments/m2s6mp/a_nurses_perspective_on_ctxr_citius/gqllw9e/,0.0,0.862,0.138,0.4926
45,CTXR," Quite honestly, the vast majority of nurses are not trained appropriately to evaluate research findings. Neither are most of the people investing, of course, but I would want to see someone who has more training before considering their judgement.

Edit: This sounded more negative than I meant it, most nurses now have training in critically reading research. That level of knowledge is not nearly enough to be particularly useful at evaluating these sorts of studies, especially as a source for OTHER people to listen to. 

I am hopeful about CTXR as well, but there are much bigger questions about cost, efficacy and effectiveness that are extremely clinically relevant and unfortunately these comments don't really address them at the level that is needed, which makes it still fairly speculative as far as I can tell. Enough for me to be in, but I wouldn't try to suggest it to others at this point personally.",SpeculativeFantasm,66,/r/pennystocks/comments/m2s6mp/a_nurses_perspective_on_ctxr_citius/gql37fg/,0.052,0.847,0.101,0.7181
46,ADN," I’m also a nurse who’s hopeful about CTXR’s products, because they would be very helpful to my every day practice. Just wanna respond to the “nurses aren’t trained to evaluate research” comments, my 2.5 year BSN program required me to take an Evidenced Based Practice course each semester. The focus of these classes was literally centered around how to interpret medical journals, how to differentiate between high quality studies/articles vs low quality ones, etc. I then had to do a giant literature review over an assigned topic for my last semester and do my own EBP project. The focus on EBP is the main difference between a BSN and an ADN, and it’s why the majority of hospitals prefer to hire BSNs now and are pushing ADNs to get their BSN within so many years. So while not *every* nurse is able to interpret medical research, a lot of us are.",hkkensin,32,/r/pennystocks/comments/m2s6mp/a_nurses_perspective_on_ctxr_citius/gqla49t/,0.014,0.944,0.042,0.6478
47,BSN," I’m also a nurse who’s hopeful about CTXR’s products, because they would be very helpful to my every day practice. Just wanna respond to the “nurses aren’t trained to evaluate research” comments, my 2.5 year BSN program required me to take an Evidenced Based Practice course each semester. The focus of these classes was literally centered around how to interpret medical journals, how to differentiate between high quality studies/articles vs low quality ones, etc. I then had to do a giant literature review over an assigned topic for my last semester and do my own EBP project. The focus on EBP is the main difference between a BSN and an ADN, and it’s why the majority of hospitals prefer to hire BSNs now and are pushing ADNs to get their BSN within so many years. So while not *every* nurse is able to interpret medical research, a lot of us are.",hkkensin,32,/r/pennystocks/comments/m2s6mp/a_nurses_perspective_on_ctxr_citius/gqla49t/,0.014,0.944,0.042,0.6478
48,CTXR," Just got off the phone from Uncle Jack, he has 90 years of experience in **Aphthous stomatitis,** Borborygmi, Bradykinesia, etc. And he told me that we should all buy CTXR.  It's a good company but please stop using this I ask X and Y without any references, it sounds quite bullshit.",syd-slice,7,/r/pennystocks/comments/m2s6mp/a_nurses_perspective_on_ctxr_citius/gql306a/,0.15,0.763,0.087,-0.6746
49,CTXR," Reading these comments makes me realize how Ill informed people in general are about the medical field. Foley caths are a daily use item in every hospital. Meaning CTXR isnt some crazy company trying to revolutionize some ground breaking idea. They are literally creating a product that if successful will be purchased by just about every hospital across the country and possibly the world. They arent trying to cure cancer or revolutionize cellular medicine. They're trying to create better technology to manage foley caths. Not an insane idea. Like I said every hospital would need one.

""nuRSeS AreNT TrAInEd To AnaLyzE rEseaRCh""  
There's some truth to that. At the same time nurses, especially hospital nurses, can tell you what actually has potential to be a daily use item. Foley caths are a daily use item. If you've ever been close to anyone who works in a hospital you know damn well what a foley cath is and probably hear that term way more than youd like to.  


If anyone isnt qualified to analyze medical research its retail investors. Hospital staff nowadays is so buried under NDAs and HIPPA mainly to keep the general public in the dark. Catheters arent talked about but are one of the most commonly used items in a hospital. Obviously its embarrassing for the patient so you wont hear a lot about it unless you personally talk to medical staff daily.   


If you never hear the term foley cath before and you're sitting here telling nurses they cant analyze research thats just beyond embarrassingly ironic. What do you think nursing school is?  


I think a lot of people dont realize curing rare diseases is great but its not profitable because those diseases are rare and only hospitals that specialize in that would purchase those items. Whereas something that's a daily use item has potential for billion dollar revenue.",Fart_Huffer_,6,/r/pennystocks/comments/m2s6mp/a_nurses_perspective_on_ctxr_citius/gql7se6/,0.051,0.877,0.072,0.5529
50,CTXR," I iz internet expert, here me RAR. Look, it comes down to simple logic investment-wise for me. The two dude's privately funding & running Citius have a huge resume - one speaking completely for itself, they understand the full schematics of what they're doing with the FDA and are IMO vastly overqualified to even need to be pushing all these products with the commitment and investment they do. There's so much room to run here, it's barely even started. CTXR/Minolok will be triumphant, and the pres/CEO proved that by starting off with their own $20 mil.",Service-Fickle,1,/r/pennystocks/comments/m2s6mp/a_nurses_perspective_on_ctxr_citius/gqlvhrk/,0.0,0.915,0.085,0.8074
