,ticker,comment,username,score,permalink,neg,neu,pos,compound
269,PT," Yeah half my position was added on Mon and Wed noon when it was red. I trimmed some and took like 5-6k in gains but that's minor relative to position size. Some. All's are up 40% tho and it's hard to diamond hand them heh.

Difference also cuz I have OTM shit so it's harder to hold unless we break 3700 then my 3700c's will go ITM. 

Fwiw regardless of how ER go you should think of exit PT as Bezos almost always sell after ER in scheduled dump, putting selling pressure on the stock. Last time he sold billions worth for almost a week straight.

And if not him, Mackenzie also dumps too by those who's managing her $. But who knows maybe it's different this time^TM",freehouse_throwaway,1,/r/wallstreetbets/comments/oqilx4/most_anticipated_earnings_releases_for_the_week/h6ed9rb/,0.124,0.763,0.114,-0.5295
270,CRSR, CRSR is still up like 75% from it's IPO last year. Calm the F down.,dwpeterson21,14,/r/wallstreetbets/comments/oqilx4/most_anticipated_earnings_releases_for_the_week/h6chcax/,0.0,0.714,0.286,0.5859
271,BBQ, I do love BBQ chips,theinternetishere12,3,/r/wallstreetbets/comments/oqilx4/most_anticipated_earnings_releases_for_the_week/h6dlr9l/,0.0,0.417,0.583,0.6369
272,BBQ, Spicy Raisin BBQ chips,enleeten,1,/r/wallstreetbets/comments/oqilx4/most_anticipated_earnings_releases_for_the_week/h6e6oqb/,0.0,1.0,0.0,0.0
273,SBUX, Hopefully SBUX too,joeabauer,2,/r/wallstreetbets/comments/oqilx4/most_anticipated_earnings_releases_for_the_week/h6dm3pa/,0.0,0.426,0.574,0.4019
274,ASAN," SNOW, BIGC, FSTLY, ASAN",LePootPootJames,1,/r/wallstreetbets/comments/oqilx4/most_anticipated_earnings_releases_for_the_week/h6e7c2v/,0.0,1.0,0.0,0.0
275,BIGC," SNOW, BIGC, FSTLY, ASAN",LePootPootJames,1,/r/wallstreetbets/comments/oqilx4/most_anticipated_earnings_releases_for_the_week/h6e7c2v/,0.0,1.0,0.0,0.0
276,SNOW," SNOW, BIGC, FSTLY, ASAN",LePootPootJames,1,/r/wallstreetbets/comments/oqilx4/most_anticipated_earnings_releases_for_the_week/h6e7c2v/,0.0,1.0,0.0,0.0
277,TSLA," They're still at a P/E of +600 and a forward P/E of 100 or so. Trust me, there's *plenty* of room to tank more. Around 550 seems like a reasonable short term target if they do in fact drop. If TSLA breaks through that, the Tesla bears are gonna have field day would be my guess...",foundnoname,1,/r/wallstreetbets/comments/oqilx4/most_anticipated_earnings_releases_for_the_week/h6dsw0u/,0.036,0.85,0.115,0.685
278,AAPL," We use green apples (🍏) when talking about AAPL increasing.

Red apples bring losses.",WR810,15,/r/wallstreetbets/comments/oqilx4/most_anticipated_earnings_releases_for_the_week/h6c6ovq/,0.172,0.828,0.0,-0.4019
279,SNAP," Yeah lol, I thought that was a funny reaction. The sad thing is the night before I was going to buy SNAP calls but decided they cost too much. Oh well.",the5050bot,6,/r/wallstreetbets/comments/oqilx4/most_anticipated_earnings_releases_for_the_week/h6e099a/,0.062,0.694,0.244,0.6187
280,SRNE, Ah I see my SRNE call in the rubble there.,Abject-Mixture-8926,3,/r/wallstreetbets/comments/oqg4mv/whenever_i_try_to_squeeze_a_little_extra_out_of/h6df7p1/,0.0,1.0,0.0,0.0
281,QS, I think we will see a rally like QS soon with some production and delivery news🚀🚀👀👀,spackings007,3,/r/wallstreetbets/comments/oqpuk4/lucid_motors_will_trade_under_ticker_lcid/h6dm71c/,0.0,0.839,0.161,0.3612
282,ESS," Lucid is a buy and hold long-term for me. This isn't a quickie, it's an early retirement stock for me. They have a decent business model. Sell luxury  cars and be a tier1 for cheaper cars. Luxury market has less competition than economy market. Lucid will be a awesome tier1. They have been selling battery tech for decades. They even supply all the batteries for formula-E. 

The reason I want to hold long-term is because of their ESS division. Countries and states needs to stabilize their grids. The need for energy storage is huge. CA alone has 30B in the pipeline for stabilizing the grid and Energy storage plays a key part. This is going to be significant revenue for Lucid. 

Look at Tesla's stock chart.. it started at 3.84 and stayed below 100 for 10 years. Diamond hands on LCID is my strategy.",siddyarcher,17,/r/wallstreetbets/comments/oqpuk4/lucid_motors_will_trade_under_ticker_lcid/h6d7ynh/,0.014,0.864,0.122,0.9201
283,DD," This post will be removed. Give us some DD and your position. 

100 shares @22.43
100 warrants @ 10.67",ArthursOldMan,0,/r/wallstreetbets/comments/oqpuk4/lucid_motors_will_trade_under_ticker_lcid/h6d2dwj/,0.0,0.885,0.115,0.296
284,SP," This stock trades below $10 after lock up period expires.

Could be worth $5 billion at end of 2022… giving full credit for 10,000 vehicles made with $135,000 avg selling price for * 4. SP at around $4-5. If the EV stocks are still really frothy, could make it back to $10.",tech01x,-3,/r/wallstreetbets/comments/oqpuk4/lucid_motors_will_trade_under_ticker_lcid/h6dmivm/,0.0,0.874,0.126,0.7096
285,GM, I’m going to have to agree.  It’s a nice looking car but it’s a concept as far as I’m concerned.  Lots of companies out there like this so that’s a problem too. I hope it works out.  I see Ford and GM are making EV cars too. They’ll probably be shitty so there’s plenty of room for a good one.  I already heard that you shouldn’t charge your Chevy bolt unattended and don’t park it in your garage because they might start on fire.  What?  Lol.,datadog2018,71,/r/wallstreetbets/comments/oqpuk4/lucid_motors_will_trade_under_ticker_lcid/h6d405i/,0.119,0.698,0.183,0.6522
286,DD, LOL true blue collar DD status! XD,Crisn232,0,/r/wallstreetbets/comments/oqpuk4/lucid_motors_will_trade_under_ticker_lcid/h6dd2kj/,0.0,0.264,0.736,0.9034
287,ICE," I think another important factor for Lucid is that their CEO understand that this is a technology race. Car companies have been stagnant for decades. The industry needed a rich fanatical nut to come along and disrupt things and Elon Musk was kind enough to do that. He disrupted an established stagnant industry. Now Tesla can't keep up with demand. Traditional car makers are coming up with half-assed EVs so they can say ""we have an EV too"". But Toyota's infotainment is still shit. Their driving assist features are basic. Wireless Apple CarPlay has been out for almost a decade and no one but BMW bothered with it. Tesla is taking modern technology and putting it into cars. That's why Tesla is a threat to traditional car makers. And now Lucid is too. Lucid is a long way behind Tesla, but I think Tesla has gone a bit too far with their insanity. Tesla broke the ice, but they seem more focused on selling hype now. Fudging numbers. Making wild promises. They're over promising and under delivering now. But the momentum is there now for EVs to replace ICE vehicles. Tesla could fall behind and if so, Lucid is the next in line that understands this is about bringing modern technology into vehicles and not just about propelling your car with batteries.",matterball,2,/r/wallstreetbets/comments/oqpuk4/lucid_motors_will_trade_under_ticker_lcid/h6elhvh/,0.102,0.829,0.069,-0.8797
288,NKLA, Oh yeah just like NKLA and RIDE 👀,Contextual-Investor,8,/r/wallstreetbets/comments/oqpuk4/lucid_motors_will_trade_under_ticker_lcid/h6dczrb/,0.0,0.515,0.485,0.5719
289,RIDE, Oh yeah just like NKLA and RIDE 👀,Contextual-Investor,8,/r/wallstreetbets/comments/oqpuk4/lucid_motors_will_trade_under_ticker_lcid/h6dczrb/,0.0,0.515,0.485,0.5719
290,ARE, ARE THEY MAKING CARS YET?,WidepeepoHappysad,-2,/r/wallstreetbets/comments/oqpuk4/lucid_motors_will_trade_under_ticker_lcid/h6dmg5t/,0.0,1.0,0.0,0.0
291,CARS, ARE THEY MAKING CARS YET?,WidepeepoHappysad,-2,/r/wallstreetbets/comments/oqpuk4/lucid_motors_will_trade_under_ticker_lcid/h6dmg5t/,0.0,1.0,0.0,0.0
292,FUV," Yeah.. no. They’ll probably go bankrupt before they can even come close to competing with Tesla.

Among the other recent EV startups like Ride, NKLA, XPENG, FUV, this is probably the best one. I just wouldn’t bet your retirement on it.",Fun_Fan_9641,2,/r/wallstreetbets/comments/oqpuk4/lucid_motors_will_trade_under_ticker_lcid/h6dazku/,0.12,0.742,0.138,0.2263
293,NKLA," Yeah.. no. They’ll probably go bankrupt before they can even come close to competing with Tesla.

Among the other recent EV startups like Ride, NKLA, XPENG, FUV, this is probably the best one. I just wouldn’t bet your retirement on it.",Fun_Fan_9641,2,/r/wallstreetbets/comments/oqpuk4/lucid_motors_will_trade_under_ticker_lcid/h6dazku/,0.12,0.742,0.138,0.2263
294,ICE," What? All renewable energy sources will have to power something, just because the energy is coming from hydropower doesn’t mean it won’t be stored in a battery to power a car. The entire point of EVs and battery tech is that the whole carbon footprint, including production and eventual scrap of the battery, is ultimately less than the carbon footprint created by all aspects of an ICE car.",joeuk14,3,/r/wallstreetbets/comments/oqpuk4/lucid_motors_will_trade_under_ticker_lcid/h6eg5wj/,0.0,0.91,0.09,0.6369
295,GM," Ford is probably gonna be alright. They're not amazing, but they generally build decent cars. GM could come out with good stuff, but I really wouldn't bet on it. If Toyota gets into EVs thatd be something to watch out for, they've already got some experience with their hybrids and they build amazing cars that would likely be within reach of the average consumer.",danfay222,9,/r/wallstreetbets/comments/oqpuk4/lucid_motors_will_trade_under_ticker_lcid/h6ea3il/,0.087,0.821,0.092,-0.164
296,DD, The DD reveals a company that was founded just a few years after Tesla yet has never delivered a single car...,positive__vibes__,13,/r/wallstreetbets/comments/oqpuk4/lucid_motors_will_trade_under_ticker_lcid/h6dhlxb/,0.0,1.0,0.0,0.0
297,NKLA, Or you run the risk of it ending up like a RIDE or NKLA,Contextual-Investor,4,/r/wallstreetbets/comments/oqpuk4/lucid_motors_will_trade_under_ticker_lcid/h6da6x6/,0.135,0.705,0.16,0.1027
298,RIDE, Or you run the risk of it ending up like a RIDE or NKLA,Contextual-Investor,4,/r/wallstreetbets/comments/oqpuk4/lucid_motors_will_trade_under_ticker_lcid/h6da6x6/,0.135,0.705,0.16,0.1027
299,NIO," Oh hell ya, sales and production won’t be as booming as Tesla or NIO but you bet your a$$ that the millionaires are gonna be buying the shit out of these vehicles. Theirs vehicles outperform Telsas EV’s in some respects",TianObia,2,/r/wallstreetbets/comments/oqpuk4/lucid_motors_will_trade_under_ticker_lcid/h6ej45i/,0.058,0.767,0.175,0.7684
300,TSLA," This honestly sounds like what people were saying about TSLA a decade ago. 

You may be right, or not. Time will tell. But I'd treat a newer EV company as a much safer bet today than when Tesla was getting off the ground.",Firehed,2,/r/wallstreetbets/comments/oqpuk4/lucid_motors_will_trade_under_ticker_lcid/h6e3am9/,0.0,0.766,0.234,0.875
301,NKLA, Unless your NKLA,Stonkrates,5,/r/wallstreetbets/comments/oqpuk4/lucid_motors_will_trade_under_ticker_lcid/h6e1bbm/,0.0,1.0,0.0,0.0
302,NKLA," Was a NKLA joke I think.  Very versatile thought, could just mean you are too poor to live in LA.",General_Asleep,7,/r/wallstreetbets/comments/oqpuk4/lucid_motors_will_trade_under_ticker_lcid/h6dmyg7/,0.146,0.751,0.103,-0.2263
303,NKLA," They are at a better stage. I’m not saying they are like RIDE or NKLA (RIDE also had a fully staffed factory btw), but I think the major flaw with these companies is that they go public before they begin production and ask for a massive valuation on top of that. TSLA at least had delivered 1,000 cars by the time they went public to show at least some proof of concept to justify the investment",Contextual-Investor,15,/r/wallstreetbets/comments/oqpuk4/lucid_motors_will_trade_under_ticker_lcid/h6ddusb/,0.0,0.921,0.079,0.5994
304,RIDE," They are at a better stage. I’m not saying they are like RIDE or NKLA (RIDE also had a fully staffed factory btw), but I think the major flaw with these companies is that they go public before they begin production and ask for a massive valuation on top of that. TSLA at least had delivered 1,000 cars by the time they went public to show at least some proof of concept to justify the investment",Contextual-Investor,15,/r/wallstreetbets/comments/oqpuk4/lucid_motors_will_trade_under_ticker_lcid/h6ddusb/,0.0,0.921,0.079,0.5994
305,TSLA," They are at a better stage. I’m not saying they are like RIDE or NKLA (RIDE also had a fully staffed factory btw), but I think the major flaw with these companies is that they go public before they begin production and ask for a massive valuation on top of that. TSLA at least had delivered 1,000 cars by the time they went public to show at least some proof of concept to justify the investment",Contextual-Investor,15,/r/wallstreetbets/comments/oqpuk4/lucid_motors_will_trade_under_ticker_lcid/h6ddusb/,0.0,0.921,0.079,0.5994
306,GM," I would…that’s an insane valuation compared to legacy OEMs that appear to be catching up just fine in the EV race (check GM, Ford, Volvo, VW)",ElectricalGene6146,0,/r/wallstreetbets/comments/oqpuk4/lucid_motors_will_trade_under_ticker_lcid/h6dw9jh/,0.098,0.836,0.065,-0.2263
307,AC, Well I know two people who own one and they say the AC really pulls down the range. Just repeating what I hear from folks who own one. One just traded theirs in and the other is looking to trade theirs in at some point. 🤷🏼‍♂️,VoluptuousNate,1,/r/wallstreetbets/comments/oqpuk4/lucid_motors_will_trade_under_ticker_lcid/h6eew4d/,0.0,0.953,0.047,0.2732
308,DD," Woah, they have pre orders? Fuck thats enough DD for me",thebossphoenix,5,/r/wallstreetbets/comments/oqpuk4/lucid_motors_will_trade_under_ticker_lcid/h6dikt8/,0.259,0.741,0.0,-0.5423
309,CCIV," Very much so. I just don’t see much upside here. They already have a rich valuation, and future outlook would put them maybe at double their current valuation at full production in a few years if they are trading at an accurate multiple. So risking money for a potential 2x in the long term *if* they can even be successful just isn’t worth it to me

*Edit: holy shoot I was wrong, I was looking at the CCIV market cap and not the post merger one. This thing is INSANELY overvalued and there’s no shot this is a good investment right now",Contextual-Investor,3,/r/wallstreetbets/comments/oqpuk4/lucid_motors_will_trade_under_ticker_lcid/h6damfd/,0.094,0.795,0.111,0.4417
310,AC," Ummm... I think you've been reading too much fake FUD.

Standstill traffic is where EVs shine, they actually get MORE efficient.  80 mph highway is where EVs get less efficient (that and winter heating).

A/C consumes almost no power compared to what is required to actually move the car.  Usually 1 kWh per 4-5 miles whereas an AC system will use 2 kW for an entire hour of cooling time, so 2 kWh in total.

Meaning an entire hour of A/C is equivalent to 15 miles of driving.

The math doesn't add up with your anecdotal fearmongering.",jnads,12,/r/wallstreetbets/comments/oqpuk4/lucid_motors_will_trade_under_ticker_lcid/h6e2d7a/,0.076,0.85,0.074,0.2052
311,AC," Tesla Model 3 owner here, can confirm this.

They don't just drain power while sitting in traffic, that's utter nonsense. And the AC is suprisingly efficient. I only really notice faster battery drain when I have my AC cranked to level 10 (which I never do, becuase the AC itself cools the car very well).

The only time you see major battery power loss over idle times is in the winter when it's very cold (like under 10 degrees C). You might lose 1 or 2 % per night.",Limewire-,4,/r/wallstreetbets/comments/oqpuk4/lucid_motors_will_trade_under_ticker_lcid/h6e7ekq/,0.087,0.881,0.032,-0.5994
312,AC," Interesting. It’s not FUD. It’s what I was told by two different Tesla model 3 owners. I would have to assume they’d tell me the truth. 🤷🏼‍♂️ The information you’re presenting seems to not align with what they’ve told me. I don’t know if it matters but they’re in Texas and Florida and they might have the AC turned all the way up which I found someone else suggest pulls the battery down more. I dunno. Again, I don’t own one and was just repeating what I’ve heard from two Tesla owners which I assume to be accurate information. I’ll delete me comment so the accusations of spreading FUD stop which is unfair considering I own Tesla stock and like the cars. I was just pointing something out.",VoluptuousNate,1,/r/wallstreetbets/comments/oqpuk4/lucid_motors_will_trade_under_ticker_lcid/h6eh3n4/,0.078,0.827,0.095,-0.2034
313,DD, Based on lmfao? Nice DD,newtoinvesting123,-1,/r/wallstreetbets/comments/oqpuk4/lucid_motors_will_trade_under_ticker_lcid/h6dhc78/,0.0,0.323,0.677,0.743
314,ROKU," $1,000,000 is based on my $700 long term price target

> Here's my math. Global TV ad spending is approaching $180b a year. ROKU is currently in 10 percent of streamer homes. COVID has accelerated that money moving from traditional TV to streaming, so ROKU rev topping $15b a year is completely realistic. Whittle that down to $5b profit with a conservative one-third profit margin, it works out to $35 a share. Put a conservative 20x multiple on it, I feel really good about a $700 price target.",ihasanemail,16,/r/wallstreetbets/comments/oqq52z/roku_50000_to_750000_holding_for_1000000/h6d4cqp/,0.0,0.872,0.128,0.8805
315,TV," $1,000,000 is based on my $700 long term price target

> Here's my math. Global TV ad spending is approaching $180b a year. ROKU is currently in 10 percent of streamer homes. COVID has accelerated that money moving from traditional TV to streaming, so ROKU rev topping $15b a year is completely realistic. Whittle that down to $5b profit with a conservative one-third profit margin, it works out to $35 a share. Put a conservative 20x multiple on it, I feel really good about a $700 price target.",ihasanemail,16,/r/wallstreetbets/comments/oqq52z/roku_50000_to_750000_holding_for_1000000/h6d4cqp/,0.0,0.872,0.128,0.8805
316,OG, OG,OptionsScalper,1,/r/wallstreetbets/comments/oqq52z/roku_50000_to_750000_holding_for_1000000/h6e3grp/,0.0,1.0,0.0,0.0
317,OG, OG,OptionsScalper,1,/r/wallstreetbets/comments/oqq52z/roku_50000_to_750000_holding_for_1000000/h6e3hsb/,0.0,1.0,0.0,0.0
318,ROKU, Cathie sold ROKU on Friday.,Cayman987r,1,/r/wallstreetbets/comments/oqq52z/roku_50000_to_750000_holding_for_1000000/h6e8uxu/,0.0,1.0,0.0,0.0
319,ALL," Bro do us a solid and sell. I know you want a million, but you’ve already made an absolute shit ton of money, why risk it ALL for just some more. At least sell a large portion man. If you sell and it goes up more, it’s sucks, but it’s better than losing your money especially when you’ve already totally nailed this trade. I’d hate to see some loss porn on here.",FutureTycoon2000,1,/r/wallstreetbets/comments/oqq52z/roku_50000_to_750000_holding_for_1000000/h6ejatp/,0.257,0.671,0.072,-0.9602
320,ROKU," In 2020 I randomly decided to take a 5x leveraged position in ROKU. In Febuary.

After getting fucked and losing a lot, I still had most of my positions open (just threw cash at them until the margin call went away). By buying the dips until 36$ I managed to build a position that was low enough so that when I sold everything at \~70-80$ I made almost half the money I lost.

I don't even check the price nowadays.",tacky_pear,1,/r/wallstreetbets/comments/oqq52z/roku_50000_to_750000_holding_for_1000000/h6ekf9l/,0.147,0.853,0.0,-0.886
321,VIAC, Man this is highly pumped in comparison to VIAC..,Black_Raven__,0,/r/wallstreetbets/comments/oqq52z/roku_50000_to_750000_holding_for_1000000/h6e3otx/,0.0,1.0,0.0,0.0
322,ROKU," It has plunged 30-40 percent post-earnings at least four times since I bought this position, so correct. Holding ROKU is not for the weak.",ihasanemail,14,/r/wallstreetbets/comments/oqq52z/roku_50000_to_750000_holding_for_1000000/h6druaf/,0.0,0.901,0.099,0.3412
323,FA," Merrill fucked me over recently, I am still mad as hell about it. I asked them for a proof of funds letter for a private commercial real estate deal I want in on. They repeatedly promised me two business days at most. I kept calling when it was late and they said it was coming ASAP. It ultimately took them nine days to email it to me.

Because it took so long, the CRE deal became fully subscribed by other investors. Meaning my offer was voided by the CRE general partner. Unforgiveable incompetence. I asked the Merrill FA why it took him so long to get me the letter and he had no answer, he just apologized. I told him I'm leaving for JPMorgan.

I needed the letter to prove I am an accredited investor under SEC rules. You have to be accredited to invest in this kind of institutional CRE deal. Individuals with over $1,000,000 not counting their home and certain financial institutions qualify, but you have to prove it with documentation.",ihasanemail,2,/r/wallstreetbets/comments/oqq52z/roku_50000_to_750000_holding_for_1000000/h6eg96s/,0.066,0.898,0.036,-0.7391
324,TSLA," This. I paper handed TSLA at 800 pre-split. Sold 80%

I got in around 200 pre-split. Lost out on 5x upside.",baselganglia,2,/r/wallstreetbets/comments/oqq52z/roku_50000_to_750000_holding_for_1000000/h6e8efr/,0.113,0.887,0.0,-0.3182
325,ON," your ON the WRONG SUBREDDIT.

&#x200B;

&#x200B;

&#x200B;

THIS IS A CASINO",InItToWin_It,2,/r/wallstreetbets/comments/oqq52z/roku_50000_to_750000_holding_for_1000000/h6dxxhq/,0.277,0.723,0.0,-0.5904
326,ATH," Why? 

That's based on your risk tolerance and just based on the numbers in front of you. You could also look at ROKU and see they are still below ATH, MACD is just about to cross over upwards, volume chart indicates some green coming in, ROKU in an upward trend, with some of the analysts calling for a (high) target of $650, which still leaves almost 40% to the upside. 

It's sitting right at the median PT, and had a really hot day along with SPY, and could see some pullback near term, sure. Certainly some arguments can be made as to why it might at a near term high point.

But to just take half a mil off the table just because of some loose maybe's isn't a good way to trade. If your trade is a winning trade, and there isn't really a good reason for it to slow down, why exit? Especially when it's performing this well. 

**TL:DR Let those winners run baby. Being down $150k but up $550k overall is always better than being up $150k and walking away at $200k.**",lJustLurkingl,7,/r/wallstreetbets/comments/oqq52z/roku_50000_to_750000_holding_for_1000000/h6e4ley/,0.063,0.832,0.105,0.8557
327,PT," Why? 

That's based on your risk tolerance and just based on the numbers in front of you. You could also look at ROKU and see they are still below ATH, MACD is just about to cross over upwards, volume chart indicates some green coming in, ROKU in an upward trend, with some of the analysts calling for a (high) target of $650, which still leaves almost 40% to the upside. 

It's sitting right at the median PT, and had a really hot day along with SPY, and could see some pullback near term, sure. Certainly some arguments can be made as to why it might at a near term high point.

But to just take half a mil off the table just because of some loose maybe's isn't a good way to trade. If your trade is a winning trade, and there isn't really a good reason for it to slow down, why exit? Especially when it's performing this well. 

**TL:DR Let those winners run baby. Being down $150k but up $550k overall is always better than being up $150k and walking away at $200k.**",lJustLurkingl,7,/r/wallstreetbets/comments/oqq52z/roku_50000_to_750000_holding_for_1000000/h6e4ley/,0.063,0.832,0.105,0.8557
328,ROKU," Why? 

That's based on your risk tolerance and just based on the numbers in front of you. You could also look at ROKU and see they are still below ATH, MACD is just about to cross over upwards, volume chart indicates some green coming in, ROKU in an upward trend, with some of the analysts calling for a (high) target of $650, which still leaves almost 40% to the upside. 

It's sitting right at the median PT, and had a really hot day along with SPY, and could see some pullback near term, sure. Certainly some arguments can be made as to why it might at a near term high point.

But to just take half a mil off the table just because of some loose maybe's isn't a good way to trade. If your trade is a winning trade, and there isn't really a good reason for it to slow down, why exit? Especially when it's performing this well. 

**TL:DR Let those winners run baby. Being down $150k but up $550k overall is always better than being up $150k and walking away at $200k.**",lJustLurkingl,7,/r/wallstreetbets/comments/oqq52z/roku_50000_to_750000_holding_for_1000000/h6e4ley/,0.063,0.832,0.105,0.8557
329,ROKU," I'll post the loss porn. This guy probably lost $10,000,000+ on his ROKU calls when it cratered this spring. Disappointed he didn't post his loss porn.

https://old.reddit.com/r/wallstreetbets/comments/lgc9r5/biggest_roku_bull_yolo_option_trading_500000_to/",ihasanemail,2,/r/wallstreetbets/comments/oqq52z/roku_50000_to_750000_holding_for_1000000/h6efbac/,0.303,0.697,0.0,-0.8402
330,AMC, AMC been giving me heart attacks,freddiemack1,82,/r/wallstreetbets/comments/oqh754/amc_might_have_found_its_bottom_technical/h6bpb8h/,0.312,0.43,0.258,-0.128
331,AMC, AMC to the moon! England ape here holding for yall! Patience!💎🤘🚀🚀💎,Stockternity,15,/r/wallstreetbets/comments/oqh754/amc_might_have_found_its_bottom_technical/h6dqctn/,0.0,1.0,0.0,0.0
332,BB, I want to buy some may 2023 $20 calls for BB but i have never bought an option in my life lol,doubledoppelganger,8,/r/wallstreetbets/comments/oqh754/amc_might_have_found_its_bottom_technical/h6bpijl/,0.0,0.788,0.212,0.5927
333,AMC, AMC is a great swing trade stock,MASH12140,7,/r/wallstreetbets/comments/oqh754/amc_might_have_found_its_bottom_technical/h6bypx0/,0.0,0.549,0.451,0.6249
