,ticker,comment,username,score,permalink,neg,neu,pos,compound
62,REAL," I do get your point but I'm only giving you my own perspective on things as I see it as a Gen X..... Imagine how later generations view it who are piling into crypto with no thought at all for traditional stocks! 

The point I'm making is times and investing IS changing before our very eyes.... if you see it as only high risk, that is your right as well. After all its YOUR capital you are deploying, so its your choice where you put it! 

As for alternative income streams from crypto investments, of course there is. I can stake and receive an on going return with some projects and that return often FAR exceeds any dividend from traditional stocks. 

Yes there is high risk in crypto but like I said because its such an emerging space, as long as you pick good projects, good teams behind them and most importantly projects with real world applications, then be prepared to hold through any major downturns.... chances are good you will be profitable in the long run regardless of market manipulation! Not always but on the whole. 2018 I got hit hard in crypto and took a 75% loss on my initial capital invested. Instead of selling and realising the loss, I just held until 2021. As of last night I'm sitting at 625% increase on that initial investment and I don't have a single cent in Bitcoin. 

People have been saying since bitcoin first started it was a ""bubble"" (I was even 1 of those people!). Thing is, once I actually started looking into the space and researching projects, the value becomes apparent! There are projects that are fundamentally changing how we will do things in the future because of what they are delivering to the marketplace! It really is no different then I'm sure you sit down and assess traditional stocks and companies. To be honest, that's the way I view crypto tokens/coins as well. Im not just buying some coin in the hope it magically goes up in value, I buy it because I want exposure to the ""company"" and the project that it represents. Its a added bonus that it can also be used as a form of payment! 

I see the crypto space as very similar to the dot com period. EVERYONE wanted a piece of this new internet thing and if you were a company that claimed it was ""online"", chances are it got CRAZY valuations! 
Then we had the clean out that had to come (the bubble burst) and all the junk got cleaned out..... but what grew out of that was some of the BIGGEST companies in the world with truly staggering valuations! 

That's what I see happening long term with crypto as well. There will be projects that fundamentally change the way the world works, how money works, how commerce and trade works..... and those valuations will make Amazon, Google and the like look like they have training wheels on.  

There are a HEAP of empty coins that are just straight up scams..... I'm sure the same thing exists or used to exist in penny stocks? But there are still good penny stocks that grow to become major companies and have real value. Its no different in the crypto space! 

To my way of thinking, why would ANYONE invest in traditional stocks any more when the returns are so limited plus the deck is stacked against you by institutional market participants who have access to more information and somehow ""legally"" manipulate prices at will for their own gain at retails loss...... all that risk for say 4% dividend and whatever upside your lucky enough that they let you have.

I see traditional stocks as the nuclear option at this stage because of the blatant manipulation and a regulation framework that protects the institutional participants and their manipulation but will turn around and hold retail investors accountable! 

Ever since 2008 I've lost ALL trust in the traditional system. REAL inflation is sky rocketing, debt is increasing and the same actors are once again betting big knowing that when it all blows up, the government will step in and socialise their losses once again! 

Capitalism is about living and dyeing by the choices YOU make! By creating this concept of to big to fail, we have created a system that encourages stagnation! Out of death, innovative, agile new businesses should grow...... instead what we have is doubling down each time on a failed system that will eventually implode under its own debt load!
The current system is addicted to ever increasing DEBT! I don't believe that cycle can be broken now, its been doubled down on to many times to back out now. 

I see the crypto space AS the innovation that's needed to break away from the failed system, a generational ""reset"" so to speak. Is it going to get messy and a giant bubble pops along the way....... 100%! I actually think we will experience major corrections every few years that traditional investors would view as bubbles popping and market crashes if it happened in the stock market but in crypto it will just be a correction. But when the real bubble busts in crypto, I think its going to be something else all together! And then all that capital will funnel into the projects of substance!

That's just my opinion though but I know that opinion is felt more in each younger generation. Younger generations embrace crypto at a much higher rate. They are a lot more comfortable with the tech and the concepts being reached for and its just a more natural direction for them to gravitate to. 

I'm just relating my own perspective and the perspective that I hear repeated by younger generations. I'm not saying I am right or that anyone else has to listen to it.... but if enough people all have the same perspective, it doesn't take long to see that change can happen and a new reality exists. 

Only time will show if its incorrect...... or correct.",Still_Lobster_8428,-4,/r/investing/comments/mr2m8u/coinbase_deep_dive_diligence_part_1_of_2/gulbgvf/,0.076,0.796,0.129,0.9956
63,NDAQ," My point was not about NDAQ specifically, but you can’t start justifying higher valuation because a company might change its business model even though they have not expressed any inclination to do so.

At that point you can justify any valuation, and you will get burned.",bossOnothin,1,/r/investing/comments/mr2m8u/coinbase_deep_dive_diligence_part_1_of_2/gultv21/,0.0,1.0,0.0,0.0
64,GME, They hold almost 10 million GME shares. They know what they are doing. Trust me.,TheReal-Tonald-Drump,27,/r/investing/comments/mrc99m/blackrock_blk_now_has_over_9_trillion_assets/gulsyqs/,0.0,0.703,0.297,0.6705
65,BLK," I bought BLK in early 2017 and the dividend increases already have been pretty sweet, taking this one to the grave.",Cygopat,2,/r/investing/comments/mrc99m/blackrock_blk_now_has_over_9_trillion_assets/gulyqi3/,0.101,0.659,0.24,0.5574
66,GDP," Aside from the US and China, that's more than the annual GDP of any other country. Considerably more, since Japan in 3rd is $5tn",given2fly_,8,/r/investing/comments/mrc99m/blackrock_blk_now_has_over_9_trillion_assets/gulpnnr/,0.0,1.0,0.0,0.0
67,UK," I'm from the UK, and the last two companies I've worked for had mainly Blackrock funds as their options for Pensions. I've never seen Vanguard as an option.",given2fly_,2,/r/investing/comments/mrc99m/blackrock_blk_now_has_over_9_trillion_assets/gulp99u/,0.0,1.0,0.0,0.0
68,GDP," 10 tmes over. 

I believe 11 trillion would match the GDP of the EU.

Edit: Correction. GDP of the EU is 15 trillion. Still a fuck ton.",bifburger,15,/r/investing/comments/mrc99m/blackrock_blk_now_has_over_9_trillion_assets/gulrflx/,0.127,0.873,0.0,-0.5423
69,BGI," Hah - I forgot about that - I never realized it was comp related. Well... at least they parted friends or that was my impression. Didn't they have some other name for Blackrock before it was Blackrock? I can't seem to find the reference but I remember thinking it was funny.

I do sometimes wonder if Barclays regretted selling BGI to Blackrock to fund the Lehman acquisition.",greytoc,2,/r/investing/comments/mrc99m/blackrock_blk_now_has_over_9_trillion_assets/gulrhia/,0.051,0.839,0.11,0.4497
70,GDP, GDP is per year. So your calculations are way off.,Clementine500,17,/r/investing/comments/mrc99m/blackrock_blk_now_has_over_9_trillion_assets/gulspdo/,0.0,1.0,0.0,0.0
71,UK, The UK can buy into vanguard mutual funds?,JEDD_MASON,1,/r/investing/comments/mrc99m/blackrock_blk_now_has_over_9_trillion_assets/gulrqw2/,0.0,1.0,0.0,0.0
72,SP, Considering the SP is up 50% during that time... No supercomputer needed to make those numbers.,ADoIDo,29,/r/investing/comments/mrc99m/blackrock_blk_now_has_over_9_trillion_assets/gulyigy/,0.128,0.872,0.0,-0.296
73,BX," Oh yeah, they weren't at each other's throats or anything. It was an organic part of the Blackstone group. It was basically their hedge fund and asset management arm. Fink wanted to give more equity based comp to his people but BX didn't want to dilute their ownership. So they just parted ways.",TaxGuy_021,4,/r/investing/comments/mrc99m/blackrock_blk_now_has_over_9_trillion_assets/guls6ph/,0.024,0.914,0.061,0.254
74,GDP," Belgium’s GDP is 533b USD, that is a 16 times theoretical P/E for the country. That would be a good value deal on the market.",TechnoBacon55,12,/r/investing/comments/mrc99m/blackrock_blk_now_has_over_9_trillion_assets/gulubiw/,0.0,0.798,0.202,0.6486
75,WFC, How does WFC justify a 100 P/E ratio?,Foreign_Cattle278,14,/r/investing/comments/mqusy8/wfc_wells_fargo_posts_profits_of_474_billion_up/guicpp3/,0.0,1.0,0.0,0.0
76,WF, Wheres the guy that said WF literally couldn't go up?,willalt319,5,/r/investing/comments/mqusy8/wfc_wells_fargo_posts_profits_of_474_billion_up/guj9sf3/,0.0,1.0,0.0,0.0
77,WFC, Long WFC and looking forward to increased dividends and buybacks.,Empirical_Spirit,4,/r/investing/comments/mqusy8/wfc_wells_fargo_posts_profits_of_474_billion_up/gujibhb/,0.0,0.811,0.189,0.2732
78,NGL, NGL that episode on Dirty Money did it no favors lel,Uries_Frostmourne,1,/r/investing/comments/mqusy8/wfc_wells_fargo_posts_profits_of_474_billion_up/guktyi9/,0.338,0.53,0.132,-0.4767
79,WF, Looks like all those restrictions put on WF by the Federal Reserve are really holding them down.,aboutelleon,1,/r/investing/comments/mqusy8/wfc_wells_fargo_posts_profits_of_474_billion_up/gulb9g0/,0.0,0.865,0.135,0.3612
80,DD," I will post them here anyways, full disclosure, I’ve worked in the financial industry almost all of my life, specially in Wells Fargo, I don’t do DD on any other companies or sectors except Wells Fargo and banking, because I don’t know enough about other companies or sectors to give my opinion.

First one: 

https://www.reddit.com/r/investing/comments/ligccs/wfc_wells_fargo_dd_why_i_am_bullish_on_wells_fargo/

Stock is down from $48 before pandemic to $33, hasn’t gone back up while others banks have, trading below book value. Fake accounts CEO and people involved in it are long gone, banned from banking altogether even, stock undervalued by investors who don’t trust the bank even though it’s management has been completely revamped, but consumers forget faster, new CEO has a lot of experience, knows how a good bank works, worked with Visa and Chase. Priced in massive inefficiency which is decreasing thanks to the new CEO’s efforts and can only decrease. Regulators have been steadily removing restrictions, asset cap being the big one to watch out for, it has cost WFC around 4 billion dollars, the stock is gonna go up a lot once it does. You’re probablynot gonna get rich off of WFC but it’s as sure of a bet as you can get, while also not making peanuts, it has a lot of room to not only recover from pre-pandemic price, but to increase even more.

Second one: 

https://www.reddit.com/r/investing/comments/mmu949/why_im_bullish_on_wfc_wells_fargo_update/

Ever since my previous post a month, the stock has gone from $33 to $39, reaching $41 recently, a 20% increase, driven mostly by regulators accepting an asset cap lift plan, which will cause a big spike in the stock price once it gets completed and the asset cap lifted. Next week are earnings, which will reflect, even if not fully, the many efforts Wells Fargo new management has made to cut costs and increase margins. If you want to make a quick buck, I suggest buying and holding at least until the asset cap is lifted, but long term the bank still has a LOT of room to grow, since it already has a solid position, but it is still rebuilding its management and business plan. With the end of COVID in sight, which will restore consumer banking, a better structure, and a plan for its asset cap to be removed, WFC is in a better position than it was before the pandemic, yet its stock price doesn’t reveal that, and I believe it to be due to very frightened investors who still treat the company as having the previous, corrupt management, and as such it is a very valuable investment. Price target: $60",Tropink,10,/r/investing/comments/mqusy8/wfc_wells_fargo_posts_profits_of_474_billion_up/guitl97/,0.028,0.807,0.164,0.996
81,WFC," I will post them here anyways, full disclosure, I’ve worked in the financial industry almost all of my life, specially in Wells Fargo, I don’t do DD on any other companies or sectors except Wells Fargo and banking, because I don’t know enough about other companies or sectors to give my opinion.

First one: 

https://www.reddit.com/r/investing/comments/ligccs/wfc_wells_fargo_dd_why_i_am_bullish_on_wells_fargo/

Stock is down from $48 before pandemic to $33, hasn’t gone back up while others banks have, trading below book value. Fake accounts CEO and people involved in it are long gone, banned from banking altogether even, stock undervalued by investors who don’t trust the bank even though it’s management has been completely revamped, but consumers forget faster, new CEO has a lot of experience, knows how a good bank works, worked with Visa and Chase. Priced in massive inefficiency which is decreasing thanks to the new CEO’s efforts and can only decrease. Regulators have been steadily removing restrictions, asset cap being the big one to watch out for, it has cost WFC around 4 billion dollars, the stock is gonna go up a lot once it does. You’re probablynot gonna get rich off of WFC but it’s as sure of a bet as you can get, while also not making peanuts, it has a lot of room to not only recover from pre-pandemic price, but to increase even more.

Second one: 

https://www.reddit.com/r/investing/comments/mmu949/why_im_bullish_on_wfc_wells_fargo_update/

Ever since my previous post a month, the stock has gone from $33 to $39, reaching $41 recently, a 20% increase, driven mostly by regulators accepting an asset cap lift plan, which will cause a big spike in the stock price once it gets completed and the asset cap lifted. Next week are earnings, which will reflect, even if not fully, the many efforts Wells Fargo new management has made to cut costs and increase margins. If you want to make a quick buck, I suggest buying and holding at least until the asset cap is lifted, but long term the bank still has a LOT of room to grow, since it already has a solid position, but it is still rebuilding its management and business plan. With the end of COVID in sight, which will restore consumer banking, a better structure, and a plan for its asset cap to be removed, WFC is in a better position than it was before the pandemic, yet its stock price doesn’t reveal that, and I believe it to be due to very frightened investors who still treat the company as having the previous, corrupt management, and as such it is a very valuable investment. Price target: $60",Tropink,10,/r/investing/comments/mqusy8/wfc_wells_fargo_posts_profits_of_474_billion_up/guitl97/,0.028,0.807,0.164,0.996
82,WFC, I made some purchases of WFC in the 20's last year which is looking good now and moving forward.,ckal9,4,/r/investing/comments/mqusy8/wfc_wells_fargo_posts_profits_of_474_billion_up/guj2y5o/,0.0,0.854,0.146,0.4404
83,WFC, Nothing beat the feeling of listening to that song and having my portfolio 20% in WFC,Dogmaofnothing,1,/r/investing/comments/mqusy8/wfc_wells_fargo_posts_profits_of_474_billion_up/gujxqpd/,0.084,0.916,0.0,-0.0951
84,WFC," Very good question! That PE ratio is based on last earnings, today’s earnings would put them at around ~40 PE ratio, Wells Fargo has a higher than usual PE ratio because some investors, like me, see that Wells Fargo has a lot of potential, with a lot of assets but really high inefficiency. If WFC current management can reduce their inefficiency they have the potential to make a lot more profits. The new CEO so far has been cutting unnecessary costs and management, and these results prove that it’s working. That’s not to mention they already made a plan with the regulators to remove their asset cap, and so removing that will put them in an even better position. Other banks like Chase are already well positioned and making good profits, Wells Fargo has been really lacking for the past few years, from their position they can only improve.",Tropink,22,/r/investing/comments/mqusy8/wfc_wells_fargo_posts_profits_of_474_billion_up/guierzc/,0.01,0.752,0.237,0.9891
85,JPM," Well if that's true JPM did the exact same thing, with 5.7 billion instead.",hahdbdidndkdi,1,/r/investing/comments/mqusy8/wfc_wells_fargo_posts_profits_of_474_billion_up/guifnjr/,0.0,0.71,0.29,0.5994
86,WFC, Also bullish on WFC. What's the timeline on your target of $60?,schiffme1ster,3,/r/investing/comments/mqusy8/wfc_wells_fargo_posts_profits_of_474_billion_up/guj35m4/,0.0,1.0,0.0,0.0
87,DD," WFC doesnt get a lot of attention from retailers because it’s not sexy crypto or a startup EV in someones basement. 

It’s a boomer stock with great financials and lots of upward movement potential. 

I bought 100 shares at $38 and a $37.50 5/21 call. (I closed out the call today) 

Great DD.",diogenes_bull,1,/r/investing/comments/mqusy8/wfc_wells_fargo_posts_profits_of_474_billion_up/guja8h4/,0.049,0.77,0.182,0.8236
88,WFC," WFC doesnt get a lot of attention from retailers because it’s not sexy crypto or a startup EV in someones basement. 

It’s a boomer stock with great financials and lots of upward movement potential. 

I bought 100 shares at $38 and a $37.50 5/21 call. (I closed out the call today) 

Great DD.",diogenes_bull,1,/r/investing/comments/mqusy8/wfc_wells_fargo_posts_profits_of_474_billion_up/guja8h4/,0.049,0.77,0.182,0.8236
89,JPM," Yup, therefore they're already priced in, JPM went down in their earnings this quarter, for example.",CorneredSponge,3,/r/investing/comments/mqusy8/wfc_wells_fargo_posts_profits_of_474_billion_up/gukb8eb/,0.0,1.0,0.0,0.0
90,WFC," Ahh, right.  I saw the ""set aside billion**s** of dollars"" and apparently missed the previous clause, Wells Fargo -and other big banks-.  So, just $1Bn for WFC, yes?

Thanks for clarifying.",DeeDee_Z,0,/r/investing/comments/mqusy8/wfc_wells_fargo_posts_profits_of_474_billion_up/guigpj1/,0.061,0.726,0.212,0.6597
91,JPM, JPM most likely went down after earnings not because of the numbers being priced in but because a week earlier Jamie Dimon released a statement saying fintechs are a massive threat to traditional banking,Didntlikedefaultname,1,/r/investing/comments/mqusy8/wfc_wells_fargo_posts_profits_of_474_billion_up/guldjro/,0.133,0.867,0.0,-0.6808
92,WFC," JPM’s earnings dropped 19% YoY. 
WFC dropped 53% YoY.

Deferring mortgages and high loan loss provisions hurt WFC more.",TomatoCapt,-4,/r/investing/comments/mqusy8/wfc_wells_fargo_posts_profits_of_474_billion_up/gujps54/,0.316,0.684,0.0,-0.7506
93,AAPL," Ah I see, appreciate the response! Yea I knew after CHWY, AAPL and Wells were his only plays before GME.",budispro,0,/r/investing/comments/mqusy8/wfc_wells_fargo_posts_profits_of_474_billion_up/gukj7nb/,0.0,0.682,0.318,0.7177
94,CHWY," Ah I see, appreciate the response! Yea I knew after CHWY, AAPL and Wells were his only plays before GME.",budispro,0,/r/investing/comments/mqusy8/wfc_wells_fargo_posts_profits_of_474_billion_up/gukj7nb/,0.0,0.682,0.318,0.7177
95,GME," Ah I see, appreciate the response! Yea I knew after CHWY, AAPL and Wells were his only plays before GME.",budispro,0,/r/investing/comments/mqusy8/wfc_wells_fargo_posts_profits_of_474_billion_up/gukj7nb/,0.0,0.682,0.318,0.7177
96,IT, You'd be surprised how much money corporations are willing to spend on anything OTHER than a decent IT department.,Jetsbeefandpeppers,161,/r/investing/comments/mqu5r0/palantir_pltr_today_presentation_is_a_bit_weird/guir1q2/,0.0,0.899,0.101,0.2263
97,IT," > We don't need UI to prepare data from different sources, link the data, run IA models etc. We can do it in days or weeks not years like they are trying to sell you.  

Just a single (and possibly uninformed) perspective, but that has not been my experience working at a f100 financial services firm. We have multiple complex proprietary processing systems that we've spent tens of millions on, multiple large-scale data warehouse (each with thousands if not tens of thousands of tables), and a whole supporting cast of upstream, intermediate, and reporting systems. These systems are diverse, some proprietary, some purchased, and they have been stood up over decades. It takes our IT group many months to create or even modify integration between legacy systems. We have a small army of IT folks and have thrown an awful lot of cash at several top-tier consulting groups and none have had a magic bullet. Every RFP response promises nirvana, and all scale expectations once they open the hood understand the scale of our data issues.   

If these guys have a way to efficiently unify/link and homogenize diverse datasets, it is a very big deal and worth alot of money. Especially if they have found a way to structure unstructured data effectively, as they claim.   
   
Again, just my two cents. We have not looked closely at foundry, but it's on our radar. I dont have an opinion on the stock.",nihilite,169,/r/investing/comments/mqu5r0/palantir_pltr_today_presentation_is_a_bit_weird/guigrjb/,0.022,0.898,0.079,0.9336
98,RFP," > We don't need UI to prepare data from different sources, link the data, run IA models etc. We can do it in days or weeks not years like they are trying to sell you.  

Just a single (and possibly uninformed) perspective, but that has not been my experience working at a f100 financial services firm. We have multiple complex proprietary processing systems that we've spent tens of millions on, multiple large-scale data warehouse (each with thousands if not tens of thousands of tables), and a whole supporting cast of upstream, intermediate, and reporting systems. These systems are diverse, some proprietary, some purchased, and they have been stood up over decades. It takes our IT group many months to create or even modify integration between legacy systems. We have a small army of IT folks and have thrown an awful lot of cash at several top-tier consulting groups and none have had a magic bullet. Every RFP response promises nirvana, and all scale expectations once they open the hood understand the scale of our data issues.   

If these guys have a way to efficiently unify/link and homogenize diverse datasets, it is a very big deal and worth alot of money. Especially if they have found a way to structure unstructured data effectively, as they claim.   
   
Again, just my two cents. We have not looked closely at foundry, but it's on our radar. I dont have an opinion on the stock.",nihilite,169,/r/investing/comments/mqu5r0/palantir_pltr_today_presentation_is_a_bit_weird/guigrjb/,0.022,0.898,0.079,0.9336
99,UI," > We don't need UI to prepare data from different sources, link the data, run IA models etc. We can do it in days or weeks not years like they are trying to sell you.  

Just a single (and possibly uninformed) perspective, but that has not been my experience working at a f100 financial services firm. We have multiple complex proprietary processing systems that we've spent tens of millions on, multiple large-scale data warehouse (each with thousands if not tens of thousands of tables), and a whole supporting cast of upstream, intermediate, and reporting systems. These systems are diverse, some proprietary, some purchased, and they have been stood up over decades. It takes our IT group many months to create or even modify integration between legacy systems. We have a small army of IT folks and have thrown an awful lot of cash at several top-tier consulting groups and none have had a magic bullet. Every RFP response promises nirvana, and all scale expectations once they open the hood understand the scale of our data issues.   

If these guys have a way to efficiently unify/link and homogenize diverse datasets, it is a very big deal and worth alot of money. Especially if they have found a way to structure unstructured data effectively, as they claim.   
   
Again, just my two cents. We have not looked closely at foundry, but it's on our radar. I dont have an opinion on the stock.",nihilite,169,/r/investing/comments/mqu5r0/palantir_pltr_today_presentation_is_a_bit_weird/guigrjb/,0.022,0.898,0.079,0.9336
100,IT," never used their product so dont know deeper detail of their product, but presentation is aimed at the c-suite/management, not IT guys. People who decide what to spend money on is also the c-suite/management",Cedar_Wood_State,164,/r/investing/comments/mqu5r0/palantir_pltr_today_presentation_is_a_bit_weird/gui5hst/,0.0,1.0,0.0,0.0
101,UI," The UI is one of the big selling points though.

Most companies track all that data in individual spreadsheets and databases. Palantir software ties it all together in an UI that makes things manageable for a non-IT person.",GhostintheSchall,104,/r/investing/comments/mqu5r0/palantir_pltr_today_presentation_is_a_bit_weird/guiac15/,0.0,1.0,0.0,0.0
