,ticker,comment,username,score,permalink,neg,neu,pos,compound
48,BABA," Mine is YUMC, yum brands China. They have been consistently been on the rise since their IPO and have a dividend. Their dividend is very tiny, but they have been expanding rapidly in China. They have much more cash than  liabilities, it’s a little overvalued rn, and have been expanding the amount of restaurants and diversity between them all. China is growing very well and is a much safer chinese stock than other ones. I’m not gonna get too much into it rn but the only bear case I see is the delta variant of covid, the CCP fining them for breaking anti-trust laws like BABA did, and worst case scenario some new entity taking away their market share. KFC is also huge in China.",Ambipomsexual,1,/r/investing/comments/om9772/what_are_your_underappreciated_offtheradar_picks/h5jwq1f/,0.059,0.812,0.128,0.8222
49,YUMC," Mine is YUMC, yum brands China. They have been consistently been on the rise since their IPO and have a dividend. Their dividend is very tiny, but they have been expanding rapidly in China. They have much more cash than  liabilities, it’s a little overvalued rn, and have been expanding the amount of restaurants and diversity between them all. China is growing very well and is a much safer chinese stock than other ones. I’m not gonna get too much into it rn but the only bear case I see is the delta variant of covid, the CCP fining them for breaking anti-trust laws like BABA did, and worst case scenario some new entity taking away their market share. KFC is also huge in China.",Ambipomsexual,1,/r/investing/comments/om9772/what_are_your_underappreciated_offtheradar_picks/h5jwq1f/,0.059,0.812,0.128,0.8222
50,CRSR," HEAR

Everyone's paying attention to CRSR, but HEAR is slowly cornering the market on commercial peripherals. They keep acquiring companies with better brand recognition and higher reputations than their flagship Turtle Beach brand. Good P/E, solid cash flow, and they've openly stated they aren't wasting money on dividends so that they can keep acquiring new businesses.",sushiladyboner,1,/r/investing/comments/om9772/what_are_your_underappreciated_offtheradar_picks/h5jwsbd/,0.0,0.784,0.216,0.9199
51,HEAR," HEAR

Everyone's paying attention to CRSR, but HEAR is slowly cornering the market on commercial peripherals. They keep acquiring companies with better brand recognition and higher reputations than their flagship Turtle Beach brand. Good P/E, solid cash flow, and they've openly stated they aren't wasting money on dividends so that they can keep acquiring new businesses.",sushiladyboner,1,/r/investing/comments/om9772/what_are_your_underappreciated_offtheradar_picks/h5jwsbd/,0.0,0.784,0.216,0.9199
52,AXP, Not sure about long long term but I’m super happy about my AXP returns since the pandemic,ShadowOfAncalagon,1,/r/investing/comments/om9772/what_are_your_underappreciated_offtheradar_picks/h5jx9sn/,0.057,0.541,0.402,0.8983
53,WISH, WISH. undervalued for their future outlook in the e-commerce segment. Recently getting attention lately and I personally think it is bound for exponential growth in the coming years. Especially with bullish news as of late such as the on boarding of an ex-google executive,Navk77,1,/r/investing/comments/om9772/what_are_your_underappreciated_offtheradar_picks/h5jxwr7/,0.0,0.872,0.128,0.7213
54,BABA, FTCH - leading luxury fashion platform. Partnered with BABA. Explosive growth. Incredible product,lyleberrycrunch,1,/r/investing/comments/om9772/what_are_your_underappreciated_offtheradar_picks/h5jytww/,0.0,0.809,0.191,0.3818
55,FTCH, FTCH - leading luxury fashion platform. Partnered with BABA. Explosive growth. Incredible product,lyleberrycrunch,1,/r/investing/comments/om9772/what_are_your_underappreciated_offtheradar_picks/h5jytww/,0.0,0.809,0.191,0.3818
56,LNC, XRX UNM VRTX PRU LNC MOMO,Latter-Truth-5968,1,/r/investing/comments/om9772/what_are_your_underappreciated_offtheradar_picks/h5jzlen/,0.0,1.0,0.0,0.0
57,VRTX, XRX UNM VRTX PRU LNC MOMO,Latter-Truth-5968,1,/r/investing/comments/om9772/what_are_your_underappreciated_offtheradar_picks/h5jzlen/,0.0,1.0,0.0,0.0
58,XRX, XRX UNM VRTX PRU LNC MOMO,Latter-Truth-5968,1,/r/investing/comments/om9772/what_are_your_underappreciated_offtheradar_picks/h5jzlen/,0.0,1.0,0.0,0.0
59,CRSR, CRSR - Corsair Gaming is just being hammered down right now. Imo such a great hold for the next coming years!,supertoine123,1,/r/investing/comments/om9772/what_are_your_underappreciated_offtheradar_picks/h5k0poj/,0.0,0.804,0.196,0.6588
60,ASTS," ASTS is being backed by the world's largest telcoms to bring 5G connection anywhere on Earth via satellite.


I know that this is a technical challenge as its never been done before, but if it wasn't hard then it would already have been done before. The telcoms spending money and political influence on ASTS give me confidence in the tech.",godstriker8,1,/r/investing/comments/om9772/what_are_your_underappreciated_offtheradar_picks/h5k19f4/,0.0,0.87,0.13,0.7264
61,DD," NLST- Just won major patent cases (12 year cases) against major players like google. Should continue to rise every year. There is a subreddit for NLST, with plenty of DD explaining why the price will continue to rise (new licensing agreements from patent victory/settlements, immediate cash likely in the Billions, strong long term plans and leadership, etc.)",1011010110001010,1,/r/investing/comments/om9772/what_are_your_underappreciated_offtheradar_picks/h5k1jca/,0.0,0.818,0.182,0.891
62,MAPS," Psychedelic medicine.

Here is a post I made compiling all the recent research: [https://www.reddit.com/r/shroomstocks/comments/oj3vfy/all\_the\_recent\_psychedelic\_research\_i\_could\_find/](https://www.reddit.com/r/shroomstocks/comments/oj3vfy/all_the_recent_psychedelic_research_i_could_find/)

Compass Pathways completed dosing in the world's largest clinical trial for a psychedelic drug in history on June 28th 2021: Phase 2B Psilocybin for treatment resistant depression. 216 participants, 22 sites, 10 countries. Patients will be doing follow ups for up to 12 weeks. Results are due by the end of 2021, my guess is October or November 2021.

Once the results of that trial show clinical significance, the entire psychedelic medicine sector will explode.

We already have the stunning results of MAPS Phase 3 MDMA for PTSD trials, which yielded a clinically significant reduction in symptoms for 88% of the active group. 67% of the active group no longer met the criteria for a PTSD diagnosis after the therapy. [https://www.nature.com/articles/s41591-021-01336-3](https://www.nature.com/articles/s41591-021-01336-3)

In my opinion this whole sector is MASSIVELY overlooked. These new drug classes will revolutionize the field of psychiatry. The anecdotal evidence is overwhelming and the rigorous scientific evidence is rapidly mounting. Like I said, watch for this sector to explode late this year, but especially in the next 2-5 years.",AeonDisc,1,/r/investing/comments/om9772/what_are_your_underappreciated_offtheradar_picks/h5k1lci/,0.035,0.91,0.055,0.3919
63,ASTR, ASTR and soon RKLB,Hydra129,1,/r/investing/comments/om9772/what_are_your_underappreciated_offtheradar_picks/h5k2frv/,0.0,1.0,0.0,0.0
64,ABB, ABB,ipalush89,1,/r/investing/comments/om9772/what_are_your_underappreciated_offtheradar_picks/h5k2hvb/,0.0,1.0,0.0,0.0
65,UWMC," UWMC

Fringe meme stock, but the company is uniquely placed in a lucrative business with solid fundamentals and a decade plus of meteoric growth behind it.   It definitely carries risk, given the market it's in and the fact that the government is regularly changing rules, but there is still explosive potential.",Tojuro,1,/r/investing/comments/om9772/what_are_your_underappreciated_offtheradar_picks/h5k36jb/,0.047,0.796,0.157,0.7351
66,AI," Nvida. I know they are well known, but they have so much space to grow. They will be the next trillion company. 5G, AI, Cloud, car business, health etc. they have their finger everywhere. Buy them, hold them for at least 10 years.",wetbetwet,1,/r/investing/comments/om9772/what_are_your_underappreciated_offtheradar_picks/h5k3a4c/,0.0,0.964,0.036,0.1406
67,BLND," Blend, BLND",wetbetwet,1,/r/investing/comments/om9772/what_are_your_underappreciated_offtheradar_picks/h5k3kqr/,0.0,1.0,0.0,0.0
68,ID, Volkswagen. They go all in on EV and are cheaply valued. Their ID series is a huge success although the vehicles are kind of meh in my opinion.,D_is_for_Dante,1,/r/investing/comments/om9772/what_are_your_underappreciated_offtheradar_picks/h5k3mpf/,0.048,0.687,0.266,0.8078
69,OWL, OWL.  These guys are killing it and growing like mad.,Delicious-Winner-290,1,/r/investing/comments/om9772/what_are_your_underappreciated_offtheradar_picks/h5k4dse/,0.427,0.337,0.236,-0.6597
70,MAXR," MAXR, HMBL,CHPT 

Space tech/satellites 

Crypto distribution/ ease of access 

Company with the most EV charging stations in America",Atoptreetopz,1,/r/investing/comments/om9772/what_are_your_underappreciated_offtheradar_picks/h5k4iw4/,0.0,0.872,0.128,0.3612
71,ANVS, ANVS - It’s undervalued by half to a fifth compared to its peers (SAVA and AVXL) but it has a better AD candidate by far imo. I’m sitting on 300% gains and intend to hold until it’s drug is on the market in a couple years.,glanvill,1,/r/investing/comments/om9772/what_are_your_underappreciated_offtheradar_picks/h5k4ixl/,0.0,0.852,0.148,0.7876
72,POWW, POWW,SirBonkers1990,-1,/r/investing/comments/om9772/what_are_your_underappreciated_offtheradar_picks/h5jevo2/,0.0,1.0,0.0,0.0
73,VRT, VRT,one8e4,-1,/r/investing/comments/om9772/what_are_your_underappreciated_offtheradar_picks/h5jhtbg/,0.0,1.0,0.0,0.0
74,SF," I think the biggest competitor for them is epic, but the threat with epic is that they have a management team that is unparalleled in the gaming space. Sweeney is a literal incel, he understands gamers/game code/metaverse like nobody else. Worse yet, he's established his HQ in North Carolina, so his margins on developer costs are exponentially smaller than unity which is paying SF costs

Additionally, with the tencent stake, China is most likely going to adopt anything unreal",xxx69harambe69xxx,9,/r/investing/comments/om9772/what_are_your_underappreciated_offtheradar_picks/h5jvots/,0.102,0.837,0.062,-0.6652
75,INTC," Agreed. INTC is making strong moves to course correct. 

It’s undervalued now because of the mess that it’s last CEO made. I’m hopeful for 2023/2024 when their new chip factories come online.",Marston_vc,16,/r/investing/comments/om9772/what_are_your_underappreciated_offtheradar_picks/h5jr3ap/,0.064,0.714,0.222,0.7351
76,AMD," Yes!  I clicked this to add $INTC, for sure!  Its PE is hovering just above 12 (!) as a tech company, 2.5% starting dividend yield, and its getting US govt backing as part of national and supply chain security from the semi shortage.  Plus, INTC is planning to diversify into being more of a company-independent fab company (arguably similar to TSMC, just behind currently on manufacturing advances like 7nm and below).  If tariffs on China start going back up, it will have a more highly-protected competitive moat.  And, think about the possible huge revenue gains in future, with pent-up demand from semi shortages.  Looks pretty attractive, imo!  (PS: As a consumer, I am an AMD fanboy from circa 2006-2007 onward, if that tells you anything).  :)",getpsychosocial,5,/r/investing/comments/om9772/what_are_your_underappreciated_offtheradar_picks/h5jx0xq/,0.036,0.743,0.221,0.9753
77,INTC," Yes!  I clicked this to add $INTC, for sure!  Its PE is hovering just above 12 (!) as a tech company, 2.5% starting dividend yield, and its getting US govt backing as part of national and supply chain security from the semi shortage.  Plus, INTC is planning to diversify into being more of a company-independent fab company (arguably similar to TSMC, just behind currently on manufacturing advances like 7nm and below).  If tariffs on China start going back up, it will have a more highly-protected competitive moat.  And, think about the possible huge revenue gains in future, with pent-up demand from semi shortages.  Looks pretty attractive, imo!  (PS: As a consumer, I am an AMD fanboy from circa 2006-2007 onward, if that tells you anything).  :)",getpsychosocial,5,/r/investing/comments/om9772/what_are_your_underappreciated_offtheradar_picks/h5jx0xq/,0.036,0.743,0.221,0.9753
78,OSK," They are also partnered with OSK which was recently granted a contract with USPS to produce a new fleet of electrical delivery vehicles (only 10% of the fleet will be EV for now, but still).

Ticker change is this coming week (July 21) though for anyone interested. MVST will be the new ticker trading on the NASDAQ.",vacchagotta_on_fire,4,/r/investing/comments/om9772/what_are_your_underappreciated_offtheradar_picks/h5jtu6y/,0.0,0.913,0.087,0.6187
79,THCB, Been holding THCB a while now but I haven't heard of merger next week. Got a link?,PorkTacoSlut,1,/r/investing/comments/om9772/what_are_your_underappreciated_offtheradar_picks/h5jsia5/,0.0,1.0,0.0,0.0
80,BARK," my dog is short on it, he likes BARK and WOOF tho",haveyouseencyan,1,/r/investing/comments/om9772/what_are_your_underappreciated_offtheradar_picks/h5k2aco/,0.0,0.797,0.203,0.4215
81,WOOF," my dog is short on it, he likes BARK and WOOF tho",haveyouseencyan,1,/r/investing/comments/om9772/what_are_your_underappreciated_offtheradar_picks/h5k2aco/,0.0,0.797,0.203,0.4215
82,IEA, Didnt the IEA state that more than enough fields have been developed for the need till 2050?,Venhuizer,1,/r/investing/comments/om9772/what_are_your_underappreciated_offtheradar_picks/h5jy4ul/,0.0,1.0,0.0,0.0
83,HP," Im an oil bull also, take a look at PDS and compare them to HP",OilBerta,1,/r/investing/comments/om9772/what_are_your_underappreciated_offtheradar_picks/h5k3jzd/,0.0,1.0,0.0,0.0
84,PDS," Im an oil bull also, take a look at PDS and compare them to HP",OilBerta,1,/r/investing/comments/om9772/what_are_your_underappreciated_offtheradar_picks/h5k3jzd/,0.0,1.0,0.0,0.0
85,NEE," Actually, I know this seems unintuitive but that would be their bull case! Public utilities are not normal companies as they are regulated monopolies...they don't make money by normal supply/demand dynamics. 

Every year they need to negotiate a fair market rate of return with their municipality, this RoR is computed as some % against their ""asset base"". 

For a utility to grow, they need to increase their asset base...and this is done via capital expenditures. Renewable investment increases that base and is more profitable to them than sticking with the status quo. 

Most utilities would love to triple down on investments, but it's up to whether or not the local government clears hurdles along the way and approves them (note this means approving cost increases as well). You have states like California as well where ""not in my backward"" is a hindrance towards grid building. 

Investing in renewables is how NEE has done so well: they've been able to win the political battle to invest and raise their asset base. My thesis is that over the next 10 years you'll see a bunch of the straggler states catch up, and that will help utilities that are still mostly in dirty energy.",cr0ne,1,/r/investing/comments/om9772/what_are_your_underappreciated_offtheradar_picks/h5jsm0t/,0.045,0.731,0.224,0.9919
86,NYC," I've got an outsized % of my net worth in utilities...

My main concern with anything in the west coast is wildfire risk. I think things are going to get much much worse on that front.

Tech-Hub Californian politicians also don't have good relationship with utilities, in fact they make a good scapegoat. Ditto for NYC or other areas where utilities provide a small % of jobs relative to the total. 

This is unlike other states where utilities provide a good % of blue collar jobs and the state has a vested interest to prop up the utility company because they are a job maker.

Edit: Jesus christ I just realized I had left PCG in my wife's private account (didn't want to sell because of capital gains). It's still up 8% but what the hell happened? This is why I hate California...",cr0ne,1,/r/investing/comments/om9772/what_are_your_underappreciated_offtheradar_picks/h5jvr3x/,0.157,0.81,0.032,-0.9543
87,PCG," I've got an outsized % of my net worth in utilities...

My main concern with anything in the west coast is wildfire risk. I think things are going to get much much worse on that front.

Tech-Hub Californian politicians also don't have good relationship with utilities, in fact they make a good scapegoat. Ditto for NYC or other areas where utilities provide a small % of jobs relative to the total. 

This is unlike other states where utilities provide a good % of blue collar jobs and the state has a vested interest to prop up the utility company because they are a job maker.

Edit: Jesus christ I just realized I had left PCG in my wife's private account (didn't want to sell because of capital gains). It's still up 8% but what the hell happened? This is why I hate California...",cr0ne,1,/r/investing/comments/om9772/what_are_your_underappreciated_offtheradar_picks/h5jvr3x/,0.157,0.81,0.032,-0.9543
88,IT," Canada has Waste Connections (WCN). Very different from WM though. They focus on providing service to rural areas where margins are better. Low dividend too because they are still in growth mode.

As for utilities, TRP is very well managed. They might be the only utility company in the America's with an actual strong IT department.

Both these companies get a lot of revenue from the US. I don't know of Canadian pure-plays.",cr0ne,1,/r/investing/comments/om9772/what_are_your_underappreciated_offtheradar_picks/h5k0vjy/,0.06,0.802,0.138,0.7425
89,TRP," Canada has Waste Connections (WCN). Very different from WM though. They focus on providing service to rural areas where margins are better. Low dividend too because they are still in growth mode.

As for utilities, TRP is very well managed. They might be the only utility company in the America's with an actual strong IT department.

Both these companies get a lot of revenue from the US. I don't know of Canadian pure-plays.",cr0ne,1,/r/investing/comments/om9772/what_are_your_underappreciated_offtheradar_picks/h5k0vjy/,0.06,0.802,0.138,0.7425
90,WM," Canada has Waste Connections (WCN). Very different from WM though. They focus on providing service to rural areas where margins are better. Low dividend too because they are still in growth mode.

As for utilities, TRP is very well managed. They might be the only utility company in the America's with an actual strong IT department.

Both these companies get a lot of revenue from the US. I don't know of Canadian pure-plays.",cr0ne,1,/r/investing/comments/om9772/what_are_your_underappreciated_offtheradar_picks/h5k0vjy/,0.06,0.802,0.138,0.7425
91,AMD," Agreed, hold AMD until they drop a mainstream 10nm and jump.",Berserk_NOR,4,/r/investing/comments/om9772/what_are_your_underappreciated_offtheradar_picks/h5k11hr/,0.172,0.656,0.172,0.0
92,IEA," I dont know how much i trust the IEA, they give me a liberal sort of feeling. I might suppose they reach that conclusion based on the existing proven/probable reservers. Not taking into account the recoverable reserves. Little known fact, alot of the oil in deposits are unrecoverable.",OilBerta,1,/r/investing/comments/om9772/what_are_your_underappreciated_offtheradar_picks/h5k3dm6/,0.0,0.88,0.12,0.5584
93,DD," Have been holding over a year now, up 200%, have been telling friends and family and they’re also up about 100%. Told them this a long term hold. No need for you or them to invest in it, always do your own DD.",WalIstreet_Guru,2,/r/investing/comments/om9772/what_are_your_underappreciated_offtheradar_picks/h5jmqn3/,0.05,0.88,0.07,0.2263
94,NIO," NIO has just started and they will grow extremely, especially in their homemarket. The best thing is that NIO is cooperating with Nvidia. 

Tesla is just hyped and will soon face a lot of harsh competition.",wetbetwet,1,/r/investing/comments/om9772/what_are_your_underappreciated_offtheradar_picks/h5k42o0/,0.072,0.823,0.105,0.3182
95,GDP," The fed does not directly control the 10 year or 30 year treasury rate, it's a loose correlation at best. In many cases the market for these long duration treasuries has front ran and predicted fed policy shifts.

In this case the market seems to be saying what I also believe: inflation will be transitory due to the massive Keynesian fiscal stimulus we did, and we will settle back into the long term mature economy trajectory of sub 2% GDP growth and inflation.",vansterdam_city,24,/r/investing/comments/om7k2e/ft_strange_bond_reaction_to_us_inflation_data/h5jarsm/,0.025,0.828,0.147,0.875
96,UI," Long term inflation is a bad narrative with no real backing in the data anywhere.  


If people dont have more money in their pockets to spend, inflation will drop off. Stimulus is over and UI boosts end fully in September. Most companies are giving short term hiring bonuses and unions dont exist to make wage increases meaningful or lasting.  


The only reason inflation would run is if the government went to UBI or increased the min wage significantly.  


What is happening is that a lot of people are looking at \*only right this moment\*, panicking, saying inflation is going to be the end of the market and everything is gonna go down the tubes, while ignoring the underlying factors or long-term outlook entirely.  


Typical short-sighted monkey brain behavior coupled with the fear and panic that the threat of significant inflation hurting investments and the economy can induce. This has literally been a talking point every time a democrat has been elected going back to the early 90s. ""Government policy is gonna give more people more money and thats gonna cause inflation and we're gonna have to bail out the market and eventually full blown socialism/communism"" and yet every time, the democrat proves to be just another corporate crony who pushes the needle further in favor of large companies and the wealthy and everyone below the top 1% get a little poorer and worse off because of it.  


The ultra wealthy increased their fortunes by 40% during the pandemic and they dont spend money nearly enough to cause inflation, unless you're worried about the prices of luxury yachts and Planetary Escape Capsules™",EmojiKennesy,1,/r/investing/comments/om7k2e/ft_strange_bond_reaction_to_us_inflation_data/h5jybfc/,0.117,0.787,0.096,-0.8611
97,UI," The amount of government spending objectively is much less important to inflation than what happens with the money they spend. Unless those trillions are going directly into people's bank accounts like the stimmies did, it will not provide for lasting inflation. Even a government 'jobs program' is unlikely to create meaningful inflation because most of that money will get sucked up in supply costs, admin, and CEO pay for companies that already exist and have been working despite the pandemic.

The last time we had 'runaway' inflation was in the 70s which only ran so long because of wage inflation, i.e. more people broadly were making more money thus driving up the prices of all goods. In 2020, the stimulus money and UI checks together meant more people had more money broadly thus the price of things people buy went up, especially large purchases like cars and houses.

Increased UI is ending completely in September and, rather than a significant wage increase, we are seeing temporary and short-term hiring bonuses because companies know that as soon as people stop getting extra UI and their stim savings dry up, they'll be forced to come crawling back to low wage shit jobs because unions dont exist like they did in the 70s to make a meaningful wage increases possible.

Throw on top of this the fact that as supply chains continue to resolve, we will have an excess supply of goods precisely becauseof the short term inflation and supply chain backups. So by late 21/early 22 we're going to have a glut of goods finally making their way into an economy where people are close to or already out of all the stim money and returning to low wage jobs where they can barely squeak by and wont have excess wages to justify spending on all these new goods. The notable exception is in industries affected by the chip shortages (new cars, electronics) because those are at least somewhat unrelated to corona supply chain issues.

Long story short, we have to understand that inflation isnt purely driven by the government or governmental policy. Long term and continuous inflation is driven by a larger amount of people having a larger amount of spendable money after basic living costs are met, and inequality before, during, and dare I say after the pandemic is higher than its ever been.... and with the near total control of the government, media, and the destruction of unions by wealthy donors and lobbyists, the likelihood that inequality will be meaningfully addressed in order to put more excess money into more people's hands is, at least from where Im sitting, a very bad bet to put your money on",EmojiKennesy,1,/r/investing/comments/om7k2e/ft_strange_bond_reaction_to_us_inflation_data/h5jxdb0/,0.059,0.873,0.068,0.3213
98,GDP," As long as inflation is at or above the fed rates, then “kicking the can down the road” has no negative consequences because the real value of the debt stays exactly the same.

Plus, if the economy is running so hot that 5% interest rates are warranted, raising taxes a bit isn’t going to be a problem, see the mid to late 90’s which was the last time the federal revenue exceeded 20% of GDP (and remember that the 2001 recession was caused by the tech bubble crash, not by excessive taxes or overly tight monetary policy).",compounding,2,/r/investing/comments/om7k2e/ft_strange_bond_reaction_to_us_inflation_data/h5k00co/,0.152,0.798,0.05,-0.8807
