,ticker,comment,username,score,permalink,neg,neu,pos,compound
116,RSI," Newbie question on RSI if you don't mind me asking, is it worth looking at on any timescale or is it only really telling on say a daily chart ?",sebMarine,4,/r/pennystocks/comments/m2dx32/alpp_has_had_an_average_short_volume_of_44_the/gqk5sme/,0.0,0.934,0.066,0.2263
117,RSI," Depends what period you are trading over if you are a day trader then the 5min chart RSI is important to you, if you are a long term investor then the day or weekly chart might be more important",kerplunktard,2,/r/pennystocks/comments/m2dx32/alpp_has_had_an_average_short_volume_of_44_the/gqkfv6n/,0.0,0.907,0.093,0.3818
118,RSI," Some reasons would be thst a stock is overbought, over valued, or a scam. ALPP was overvalued at $9 and overbought. The RSI was extended past 90 and it was inevitable that shorts would push it down, but down $2 below the direct share offering is greed at its finest. They got a taste of blood and they got greedy, now they're going to have to cover their asses before the up listing.",kirkrikster,2,/r/pennystocks/comments/m2dx32/alpp_has_had_an_average_short_volume_of_44_the/gqivs5t/,0.113,0.827,0.06,-0.6249
119,ASRT," ASRT kept their place. Nothing happened with the price. Indeed it went down.

While I don't have data for NASDAQ listening, on avg people hugely overestimate siml. events. Like SP500 or so - most stocks lose some value.",aomt,24,/r/pennystocks/comments/m2dx32/alpp_has_had_an_average_short_volume_of_44_the/gqivox0/,0.079,0.802,0.119,0.1675
120,EH," We will see but I believe you are grossly undervaluing the company. 

17x as large as UAVS

2x as large as EH

Ill take $15 EOY but I think $40 is more likely",kirkrikster,1,/r/pennystocks/comments/m2dx32/alpp_has_had_an_average_short_volume_of_44_the/gql3p6s/,0.173,0.827,0.0,-0.7227
121,UAVS," We will see but I believe you are grossly undervaluing the company. 

17x as large as UAVS

2x as large as EH

Ill take $15 EOY but I think $40 is more likely",kirkrikster,1,/r/pennystocks/comments/m2dx32/alpp_has_had_an_average_short_volume_of_44_the/gql3p6s/,0.173,0.827,0.0,-0.7227
122,ASRT," ASRT is a dog shit company and I wouldn't touch it with a 10 foot pole. They were already listed and had to stay above a dollar to keep their listing. They are almost the opposite of ALPP...

You do realize what company we are talking about right? ALPP is 17x bigger than UAVS and 2x as large as EH.

Do your homework, this isn't some pie in the sky pharma play lol",kirkrikster,32,/r/pennystocks/comments/m2dx32/alpp_has_had_an_average_short_volume_of_44_the/gqixciw/,0.048,0.882,0.07,0.1531
123,EH," ASRT is a dog shit company and I wouldn't touch it with a 10 foot pole. They were already listed and had to stay above a dollar to keep their listing. They are almost the opposite of ALPP...

You do realize what company we are talking about right? ALPP is 17x bigger than UAVS and 2x as large as EH.

Do your homework, this isn't some pie in the sky pharma play lol",kirkrikster,32,/r/pennystocks/comments/m2dx32/alpp_has_had_an_average_short_volume_of_44_the/gqixciw/,0.048,0.882,0.07,0.1531
124,UAVS," ASRT is a dog shit company and I wouldn't touch it with a 10 foot pole. They were already listed and had to stay above a dollar to keep their listing. They are almost the opposite of ALPP...

You do realize what company we are talking about right? ALPP is 17x bigger than UAVS and 2x as large as EH.

Do your homework, this isn't some pie in the sky pharma play lol",kirkrikster,32,/r/pennystocks/comments/m2dx32/alpp_has_had_an_average_short_volume_of_44_the/gqixciw/,0.048,0.882,0.07,0.1531
125,ASRT, Why is ASRT dogshit?,Bathroomious,1,/r/pennystocks/comments/m2dx32/alpp_has_had_an_average_short_volume_of_44_the/gqkfbb9/,0.0,1.0,0.0,0.0
126,USA," Correction ""Get out of here every country on earth except USA, Liberia and Myanmar""",mr_melange,18,/r/pennystocks/comments/m2dx32/alpp_has_had_an_average_short_volume_of_44_the/gqj44mi/,0.0,1.0,0.0,0.0
127,USA, And one of those countries went to the moon. USA and the customary system baby!,Ah_Fiddle-sticks,-2,/r/pennystocks/comments/m2dx32/alpp_has_had_an_average_short_volume_of_44_the/gqj8yet/,0.0,1.0,0.0,0.0
128,IMO, News came out showing they have an estimated $1.4+ Billion in oil reserves. $1/share still only puts it at a $286M market cap. Still has massive potential even after running the 1100% it did today IMO.,jm0ck,79,/r/pennystocks/comments/m2c0qy/mdmp_what_caused_the_1100_increase_this_afternoon/gqicunc/,0.0,1.0,0.0,0.0
129,ST," saw some guy come up with calculations on ST. his numbers do check out with what i posted earlier. interested people can take a look:

[https://stocktwits.com/DuduDodo/message/302595261](https://stocktwits.com/DuduDodo/message/302595261)",Embarrassed-Today-22,4,/r/pennystocks/comments/m2c0qy/mdmp_what_caused_the_1100_increase_this_afternoon/gqld24o/,0.0,0.895,0.105,0.4019
130,PT, What’s everyone’s PT for this stock do you think it’ll reach 1 dollar?,Purgasus,1,/r/pennystocks/comments/m2c0qy/mdmp_what_caused_the_1100_increase_this_afternoon/gql6gh8/,0.0,0.909,0.091,0.0258
131,RSI," It will dip lower. That RSI is eye popping.


Edit: aaaaaand I was very very wrong. Much wow.",dudewheresmychocobo,19,/r/pennystocks/comments/m2c0qy/mdmp_what_caused_the_1100_increase_this_afternoon/gqj2c11/,0.245,0.585,0.17,-0.2041
132,TRGP," I dont know how mr sweatpants doesnt have more upvotes here.  I rushed to buy this one, personally, considering its not up 1,500% already.  Figured if im going to put some money on mdmp, why not a bit here too.  Another comment in this room pointed to TRGP.  I bought that one too.  I actually like how its not OTC, makes me think its less susceptible for fraud, and more established.",TheLastJewmurai,3,/r/pennystocks/comments/m2c0qy/mdmp_what_caused_the_1100_increase_this_afternoon/gqkx185/,0.05,0.914,0.036,-0.2585
133,TDA, TDA,Shmoopy65,4,/r/pennystocks/comments/m2c0qy/mdmp_what_caused_the_1100_increase_this_afternoon/gqis36t/,0.0,1.0,0.0,0.0
134,EOD," I think it hits a buck by EOD, then hopefully holds into tomorrow...as I don't want to daytrade it....",johnr42,3,/r/pennystocks/comments/m2c0qy/mdmp_what_caused_the_1100_increase_this_afternoon/gql6ui7/,0.068,0.781,0.151,0.3565
135,RSI, Semi new to technical analysis so this may be a basic question but wouldn’t RSI be irrelevant in this type of situation where there is apparently a massive catalyst that wasn’t known yesterday?,ffthrowaway5,19,/r/pennystocks/comments/m2c0qy/mdmp_what_caused_the_1100_increase_this_afternoon/gqj3wj1/,0.0,1.0,0.0,0.0
136,RSI," I don’t think there is a definitive answer to that question. But with a run over 1000% coupled with RSI over 90 I’d wager there will be a lot of sellers tomorrow. For me, judgment is really at; how many people got in today believe enough in the catalyst is solid enough to not take their gains. I’m not an optimist in this scenario.

I don’t know what will happen, nobody does. Just my 2 pennies.",dudewheresmychocobo,9,/r/pennystocks/comments/m2c0qy/mdmp_what_caused_the_1100_increase_this_afternoon/gqj6uoq/,0.066,0.913,0.022,-0.4959
137,RSI," The RSI is still a strong indicator for resistance and supports. If a stock is overbought (RSI 70+), it has to come back down due to reaching resistance. Depending on available price movement based on aggregate volume, a small/micro-cap penny stock can move up thousands of percents.

You are right in the sense that the RSI, to some extent, can't predict upward and downward movements. That's mostly due to its a lagging indicator nature. It's not forward looking so to speak. You can have general sense of price direction based on where the curve is pointing but gap ups or down may still happen regardless.",MrStealYourCookies,3,/r/pennystocks/comments/m2c0qy/mdmp_what_caused_the_1100_increase_this_afternoon/gqjchep/,0.015,0.934,0.051,0.4118
138,TDA," I’m so confused. Obviously what you linked is right, but TDA shows 41.5mil shares outstanding, which paints a much different picture than 280mil.",MrTurkle,4,/r/pennystocks/comments/m2c0qy/mdmp_what_caused_the_1100_increase_this_afternoon/gqiy7am/,0.062,0.653,0.285,0.8178
139,RSI," I don't really know if the RSI is a big concern because this stock is acting on big news right now. I think there will be a lot of sellers wanting to take their ridiculous gains yeah sure of course, but there will be buyers to instantly gobble up those shares up.",DJ780,6,/r/pennystocks/comments/m2c0qy/mdmp_what_caused_the_1100_increase_this_afternoon/gqjb61u/,0.033,0.819,0.148,0.6124
140,DNN," Yea I’ve had 1000 shares for a while, DNN is a long mans game. I follow them very closely because I work in the nuke industry. Keep your eyes out for the small modular reactors that are being built. They will be taking over the traditional model.",garbagedumpster37,44,/r/pennystocks/comments/m2cl4v/dnn_nuclear_power_and_the_green_new_deal/gqik7g9/,0.0,0.95,0.05,0.296
141,DD," I’ve been in DNN since October and believe uranium miners are gonna make me rich over the next few years. 

But every uranium post seems to be this one particular miner.  It makes me nervous because it has that pump and dump feel when mostly all the uranium posts I see happen to be DNN.  It may not be, but I just kinda get those vibes when this keeps being brought up as the only play for those bullish in uranium.

I’d caution heavily against choosing just one.  Any number of things can go wrong with a uranium mine.  I personally have mine spread amongst 5 different ones to play it a bit more safe.  

The pennies of the 5 are DNN, BNNLF, and URG.   There’s plenty of other though so if your bullish on uranium, I’d recommend doing some DD beyond just DNN and reading any of the posts by /u/3stmotivation

Edit: for clarity",M00nStonks,13,/r/pennystocks/comments/m2cl4v/dnn_nuclear_power_and_the_green_new_deal/gqjg5jp/,0.045,0.829,0.126,0.9265
142,DNN," I’ve been in DNN since October and believe uranium miners are gonna make me rich over the next few years. 

But every uranium post seems to be this one particular miner.  It makes me nervous because it has that pump and dump feel when mostly all the uranium posts I see happen to be DNN.  It may not be, but I just kinda get those vibes when this keeps being brought up as the only play for those bullish in uranium.

I’d caution heavily against choosing just one.  Any number of things can go wrong with a uranium mine.  I personally have mine spread amongst 5 different ones to play it a bit more safe.  

The pennies of the 5 are DNN, BNNLF, and URG.   There’s plenty of other though so if your bullish on uranium, I’d recommend doing some DD beyond just DNN and reading any of the posts by /u/3stmotivation

Edit: for clarity",M00nStonks,13,/r/pennystocks/comments/m2cl4v/dnn_nuclear_power_and_the_green_new_deal/gqjg5jp/,0.045,0.829,0.126,0.9265
143,URG," I’ve been in DNN since October and believe uranium miners are gonna make me rich over the next few years. 

But every uranium post seems to be this one particular miner.  It makes me nervous because it has that pump and dump feel when mostly all the uranium posts I see happen to be DNN.  It may not be, but I just kinda get those vibes when this keeps being brought up as the only play for those bullish in uranium.

I’d caution heavily against choosing just one.  Any number of things can go wrong with a uranium mine.  I personally have mine spread amongst 5 different ones to play it a bit more safe.  

The pennies of the 5 are DNN, BNNLF, and URG.   There’s plenty of other though so if your bullish on uranium, I’d recommend doing some DD beyond just DNN and reading any of the posts by /u/3stmotivation

Edit: for clarity",M00nStonks,13,/r/pennystocks/comments/m2cl4v/dnn_nuclear_power_and_the_green_new_deal/gqjg5jp/,0.045,0.829,0.126,0.9265
144,DNN, First I do own DNN but Until we solve the waste storage problem nuclear will not go anywhere in the US. We (the taxpayer) are already paying billions a year for storing waste because our government has promised storage it can't deliver.  My opinion is that it is unlikely to be supported in congress simply on a cost of storage basis.  If the storage problem is solved and as long as one of our ancient reactors don't have a serious issue in the meantime nuclear will take off.,TrappedonthisRock,4,/r/pennystocks/comments/m2cl4v/dnn_nuclear_power_and_the_green_new_deal/gqivtdm/,0.142,0.736,0.122,-0.627
145,DNN," So much more one can focus on with DNN but I guess this was more of a macro thesis overlook? I personally would have also focused in on their high grade uranium deposit in particular (Phoenix) as well as the all in cost for said deposit sitting at around US$9/lb. Also their ISR potentially being the first in Canada. Their freeze wall, etc etc. Anyways. I’m long DNN baby so any bullish post I salute 👏🏽💪🏽",SuccessF00L_Failure,3,/r/pennystocks/comments/m2cl4v/dnn_nuclear_power_and_the_green_new_deal/gqixw5x/,0.0,0.904,0.096,0.7469
146,ISR," So much more one can focus on with DNN but I guess this was more of a macro thesis overlook? I personally would have also focused in on their high grade uranium deposit in particular (Phoenix) as well as the all in cost for said deposit sitting at around US$9/lb. Also their ISR potentially being the first in Canada. Their freeze wall, etc etc. Anyways. I’m long DNN baby so any bullish post I salute 👏🏽💪🏽",SuccessF00L_Failure,3,/r/pennystocks/comments/m2cl4v/dnn_nuclear_power_and_the_green_new_deal/gqixw5x/,0.0,0.904,0.096,0.7469
147,DD," I love this DD. The only worry that you may have is the flow of capital from anti-development foundations and NGOs into Canadian Indigenous groups to oppose natural resources development. If the local Indigenous activists decide to cause a problem, this goes from a great investment to a good way to lose money. 

I can’t predict one way or the other, but it’s a legitimate risk.",King-of-Metal-,2,/r/pennystocks/comments/m2cl4v/dnn_nuclear_power_and_the_green_new_deal/gqkidek/,0.12,0.752,0.128,0.1406
148,VERY, I'll be VERY surprised if the environmental left allows us to build more nuke plants.,O3Chaos,2,/r/pennystocks/comments/m2cl4v/dnn_nuclear_power_and_the_green_new_deal/gqj55ng/,0.0,0.827,0.173,0.4453
149,DD," Great piece of DD, thanks. I did a far more limited review about 1 month ago.

Also big on DNN, been in them before, during and after their recent price action. Didn't sell at the top as I think they're super strong longer term.

I'm holding long, I have around 1500 shares @1.02

One of the only stocks I plan to hold long!
Mostly enjoy day trading or short plays, but if it's a resource, that we will need more of in the future and they're sitting on a ton of it...well, it's time to be patient on one for once.",steveinthecanal,1,/r/pennystocks/comments/m2cl4v/dnn_nuclear_power_and_the_green_new_deal/gqkvqaz/,0.016,0.827,0.157,0.8859
150,DNN," Great piece of DD, thanks. I did a far more limited review about 1 month ago.

Also big on DNN, been in them before, during and after their recent price action. Didn't sell at the top as I think they're super strong longer term.

I'm holding long, I have around 1500 shares @1.02

One of the only stocks I plan to hold long!
Mostly enjoy day trading or short plays, but if it's a resource, that we will need more of in the future and they're sitting on a ton of it...well, it's time to be patient on one for once.",steveinthecanal,1,/r/pennystocks/comments/m2cl4v/dnn_nuclear_power_and_the_green_new_deal/gqkvqaz/,0.016,0.827,0.157,0.8859
151,DD," > I've got around 1000 shares purchased at 1.00 USD

That is a lot of DD for a $1000 investment. Why not more?",BoatsMcFloats,1,/r/pennystocks/comments/m2cl4v/dnn_nuclear_power_and_the_green_new_deal/gqlorrz/,0.0,0.896,0.104,0.296
152,DNN," >...their next focus is on the green new deal.

based on? no seriously, ignore the rest of my calling you out and address that question...

IMHO, and I can be wrong, you're full of it on this point which you use to bolster everything you say as ""next"" or to give an idea of ""soon""

A quick glance at the Biden/Harris campaign's major promises shows (in order)

* Beat COVID-19
* Jobs and Economic Recovery Plan for Working Families
* Affordable Health Care

""Clean Energy"" and ""Climate Emergency"" are lesser points peppered about (sure, near the top) of 40+ other issues...

[Source being Joe's website](https://joebiden.com/joes-vision/)...

So why do you think ""green new deal,"" a term Biden distanced himself from and instead proposed a similar but different plan ([outlined here](https://joebiden.com/climate-plan/)), comes before health care? And why nuclear before all the other preceding bullet points?

>In short DNN, is a good long-term

Now that I won't argue with.",throwaway903-5768,1,/r/pennystocks/comments/m2cl4v/dnn_nuclear_power_and_the_green_new_deal/gqj8lun/,0.053,0.833,0.114,0.8999
153,DNN, May I know why DNN instead of URG?,Famous_Bicycle5179,6,/r/pennystocks/comments/m2cl4v/dnn_nuclear_power_and_the_green_new_deal/gqju54z/,0.0,1.0,0.0,0.0
154,DNN," Do you have any thoughts on where DNN might be headed in say a year?  I guess more than a dollar lol, but what do you think could realistically happen to the stock price",dragonfliesloveme,3,/r/pennystocks/comments/m2cl4v/dnn_nuclear_power_and_the_green_new_deal/gqirdl4/,0.0,0.937,0.063,0.2574
155,DNN," Cheers for the link!

As for DNN, I am also not a big fan of the euphoric call option driven 'pump and dump' we have seen over the past week, but to me that doesn't take away from the pure quality of this company. I believe it to be the best pure risk/reward propositions in the sector at these prices, given the potential their Phoenix deposit holds. Just for the record of course, as people might be scared away by the volatile recent movement in price. Again, cheers buddy!",3STmotivation,3,/r/pennystocks/comments/m2cl4v/dnn_nuclear_power_and_the_green_new_deal/gqjiuo4/,0.07,0.78,0.15,0.8765
156,DNN, Forgot to pay my respects to the man himself who got me deep into uranium. Highly recommend his posts to those of you interested in DNN or just Uranium in general! u/3STmotivation,SuccessF00L_Failure,3,/r/pennystocks/comments/m2cl4v/dnn_nuclear_power_and_the_green_new_deal/gqiyeqx/,0.037,0.747,0.216,0.7707
157,EPR," This is true for older models. Newer models such as the CANDU (60 months), EPR (48 months) and ESBWR (45 months) can be completed in around 4 years and 3 months on avg. 

The extra profit/demand that can arise from what's listed above is definitely contingent upon the urgency in Bidens bill. If they go full power ahead on this, we may see a handful of new plants built by 2025-26.

If the language prioritizes slow transitions from oil/petroleum then we are definitely seeing new plants by 2031-33 maybe longer.",rayrayrex,4,/r/pennystocks/comments/m2cl4v/dnn_nuclear_power_and_the_green_new_deal/gqigt9y/,0.0,0.911,0.089,0.802
158,DNN," Looking at competitors such as Cameco which are trading at $16 a share today. They have reserves with around 458 million pounds of Uranium in them. Their EPS is at -0.11 due to inefficiencies within their mining process.

DNN is mining nothing and has EPS at -0.02. This is due to capital injections as well as [IP's they hold for cheaper mining processes](https://www.denisonmines.com/news/denison-reports-a-year-of-significant-project-and-122727/). DNN has around 240 million pounds of Uranium in it's reserves.

Based on just reserves and ignoring technological ability, DNN would be evaluated at $8.2 a share if they had access to their deposits today. If we look at EPS growth, they can hit 1.7 EPS due to their tech. This gives us an adusted share price of $14 a share. 

My valuation factors in that Uranium prices are trading just above their lowest point in 10-years at $25/lb.

Given that the Green New Deal (and deals like it globally plan to cut out oil and gas completely) demand very well could reach beyond 2007 levels where Uranium futures traded for +$50/lb.

This doubling in price with no added additional costs could result in a $50 share price for Cameco (historically their share price was $54 in 2007) while DNN could hit $28 a share (2,800% in growth from the current price today). This does not factor in grants and initiatives by the US government where they will help subsidize these endeavors and aid in increasing the cost of shares.",rayrayrex,7,/r/pennystocks/comments/m2cl4v/dnn_nuclear_power_and_the_green_new_deal/gqism32/,0.048,0.816,0.136,0.959
159,BY," Okay no offense, but did you read anything aside from the titles on his page lol. Combating climate change is directly cited as a solution under the various categories 

E.g.

1. ""BUILD BACK BETTER: JOE BIDEN’S JOBS AND ECONOMIC RECOVERY PLAN FOR WORKING FAMILIES""

Biden is planning on creating a bunch of new jobs through what exactly? 

Well he says so right here:

""Mobilize American ingenuity to build a modern infrastructure and an equitable, clean energy future. We’ve seen the need for a more resilient economy for the long-term, and that means investing in a modern, sustainable infrastructure and sustainable engines of growth —  from roads and bridges, to energy grids and schools, to universal broadband. Biden will soon release updated proposals to meet the climate crisis, build a clean energy economy,  address environmental injustice, and create millions of good-paying union jobs.""

I.e. a bunch of these jobs he is going to create are going to be focused on building new green initiatives and infrastructure.

2. ""THE POWER OF AMERICA’S EXAMPLE: THE BIDEN PLAN FOR LEADING THE DEMOCRATIC WORLD TO MEET THE CHALLENGES OF THE 21ST CENTURY""

Well what could this mean?

Again he says so right here:
""In a Biden administration, America will lead by example and rally the world to meet our common challenges that no one nation can face on its own, from climate change to nuclear proliferation, from great power aggression to transnational terrorism, from cyberwarfare to mass migration.""

He goes on to mention a leadership summit (which is happening in April) - with the main focus being the climate catastrophe.

3. ""THE BIDEN PLAN TO ENSURE THE FUTURE IS “MADE IN ALL OF AMERICA” BY ALL OF AMERICA’S WORKERS""

Well how on Earth is he gonna boost American manufacturing?

By buying American as he says here:

""BUY AMERICAN. Make “Buy American” Real and Make a $400 billion Procurement Investment that together with the Biden clean energy and infrastructure plan will power new demand for American products, materials, and services and ensure that they are shipped on U.S.-flagged cargo carriers.""

Again this is paired with the Biden clean energy and infrastructure plan to accomplish this feat...


4. ""THE BIDEN PLAN FOR A CLEAN ENERGY REVOLUTION AND ENVIRONMENTAL JUSTICE""

Here he notes:

- Biden will make smart infrastructure investments to rebuild the nation and to ensure that our buildings, water, transportation, and energy infrastructure can withstand the impacts of climate change.  Every dollar spent toward rebuilding our roads, bridges, buildings, the electric grid, and our water infrastructure will be used to prevent, reduce, and withstand a changing climate (creating American jobs)
- Rally the rest of the world to meet the threat of climate change. Climate change is a global challenge that requires decisive action from every country around the world (American leadership)
- Vulnerable communities are disproportionately impacted by the climate emergency and pollution. The Biden Administration will take action against fossil fuel companies and other polluters who put profit over people and knowingly harm our environment and poison our communities’ air, land, and water, or conceal information regarding potential environmental and health risks (tackling racial inequality in the US)


5. ""THE BIDEN PLAN TO BUILD BACK BETTER BY ADVANCING RACIAL EQUITY ACROSS THE AMERICAN ECONOMY""
 
See above^

6. ""THE BIDEN PLAN TO BUILD A MODERN, SUSTAINABLE INFRASTRUCTURE AND AN EQUITABLE CLEAN ENERGY FUTURE""

See above^

And this trend continues.

---


In short, tackling climate change is engrained in a lot of the fixes he has planned. It would be inefficient at best to not address climate change while systematically restructuring the economy and America's role as a world leader as a whole

The reason I'm confident that climate change is next is because aside from COVID-19 and Medicare, literally everything else requires climate change to be addressed.",rayrayrex,2,/r/pennystocks/comments/m2cl4v/dnn_nuclear_power_and_the_green_new_deal/gqjeasz/,0.079,0.73,0.191,0.9978
