,ticker,comment,username,score,permalink,neg,neu,pos,compound
140,IBM," The only thing is that PowerBI's cost is marginal (if even that) for most organizations since they're all probably on the O365 platform. 

PowerBI is also relatively easy to get into for business user who've been working with Excel and may know a bit of SQL (though, not required). 

Overall, PowerBI's value is similar to Excel where as Foundry is really going to be competing with the IBM Cognos, Domo, OBIEE side of the market.",ExtinctLikeNdiaye,5,/r/investing/comments/mqu5r0/palantir_pltr_today_presentation_is_a_bit_weird/guk4eta/,0.0,0.861,0.139,0.8834
141,IBM," In big companies for sure, small ones I don't know.

Non technical people will don't know they are on Azure or AWS, their IT people will make web/mobile apps as frontend (that use Azure, AWS, IBM =>  data analysis, IA functions etc).

But for sure they seem to offer a good UI entry point to data management/analysis etc",drfloydch,1,/r/investing/comments/mqu5r0/palantir_pltr_today_presentation_is_a_bit_weird/guihoyg/,0.0,0.862,0.138,0.8151
142,IT," In big companies for sure, small ones I don't know.

Non technical people will don't know they are on Azure or AWS, their IT people will make web/mobile apps as frontend (that use Azure, AWS, IBM =>  data analysis, IA functions etc).

But for sure they seem to offer a good UI entry point to data management/analysis etc",drfloydch,1,/r/investing/comments/mqu5r0/palantir_pltr_today_presentation_is_a_bit_weird/guihoyg/,0.0,0.862,0.138,0.8151
143,UI," In big companies for sure, small ones I don't know.

Non technical people will don't know they are on Azure or AWS, their IT people will make web/mobile apps as frontend (that use Azure, AWS, IBM =>  data analysis, IA functions etc).

But for sure they seem to offer a good UI entry point to data management/analysis etc",drfloydch,1,/r/investing/comments/mqu5r0/palantir_pltr_today_presentation_is_a_bit_weird/guihoyg/,0.0,0.862,0.138,0.8151
144,IP," Absolutely.  

They may not be provisioning systems under a common billing account and working on the tear up, ramp down set up but they'll have no problem understanding K8s and a Docker container when a pretty front-end is put onto it.  Look at most web sites, running in some cloud / container environment.  The only thing that abstracts it out from the use is the IP address denoting if it's an internal application hosted in the companies own data center - or in some cloud (or hybrid cloud) environment.",Qs9bxNKZ,1,/r/investing/comments/mqu5r0/palantir_pltr_today_presentation_is_a_bit_weird/guje0gk/,0.069,0.884,0.047,-0.2617
145,NSA," Yes sure, and Sun in the past. It has been proven that all Sun Microsystem servers contained hardware backdoors for the NSA. They offered super prices for the installation and maintenance at the begining of Internet for strategic targets ;)",drfloydch,1,/r/investing/comments/mqu5r0/palantir_pltr_today_presentation_is_a_bit_weird/guletj7/,0.0,0.769,0.231,0.8689
146,IBM," exactly, where as SAP is far from ideal for those size of businesses. 
I could see PLTR having the same problem as IBM historically had / Has. great products from a technological standpoint, but boy do they suck at marketing and sales.",psykikk_streams,2,/r/investing/comments/mqu5r0/palantir_pltr_today_presentation_is_a_bit_weird/gul2kyd/,0.125,0.77,0.105,-0.2382
147,PLTR," exactly, where as SAP is far from ideal for those size of businesses. 
I could see PLTR having the same problem as IBM historically had / Has. great products from a technological standpoint, but boy do they suck at marketing and sales.",psykikk_streams,2,/r/investing/comments/mqu5r0/palantir_pltr_today_presentation_is_a_bit_weird/gul2kyd/,0.125,0.77,0.105,-0.2382
148,SAP," exactly, where as SAP is far from ideal for those size of businesses. 
I could see PLTR having the same problem as IBM historically had / Has. great products from a technological standpoint, but boy do they suck at marketing and sales.",psykikk_streams,2,/r/investing/comments/mqu5r0/palantir_pltr_today_presentation_is_a_bit_weird/gul2kyd/,0.125,0.77,0.105,-0.2382
149,IT, I agree with you. This whole thread screams of people who don't have experience in IT.,Baoty,2,/r/investing/comments/mqu5r0/palantir_pltr_today_presentation_is_a_bit_weird/guj64pb/,0.124,0.734,0.141,0.0772
150,IMO," Well I think there will be multiple large players in a developing industry, we won't really see this sector form until 2025-2030 IMO.",DBSkellan,1,/r/investing/comments/mqu5r0/palantir_pltr_today_presentation_is_a_bit_weird/guker6l/,0.0,0.905,0.095,0.2732
151,UI," Don't mix the final UI (data usage) with the system configuration UI. At the end, the ""normal"" user will only use the final UI, that can be connected to a AWS/Azure data api and you will never see the configuration tools used to present the cool info.",drfloydch,1,/r/investing/comments/mqu5r0/palantir_pltr_today_presentation_is_a_bit_weird/guksral/,0.0,0.951,0.049,0.3182
152,SAP," Yep, for now, I think you will put a lot of money on the table for the initial configuration contract you will have with Palantir. After that they will sale your use case to your competitors... Just like SAP ;)",drfloydch,0,/r/investing/comments/mqu5r0/palantir_pltr_today_presentation_is_a_bit_weird/guktt7l/,0.0,0.841,0.159,0.6808
153,IRR," I’ve been accumulating a small position in PSFE and believe it’s a good long term hold. However, the looming lockup expiration will likely continue to weight on shares. Additionally, Blackstone and CVC absolutely will sell the majority of their stakes sooner than later. “Remaining part of the team” likely means on the board of directors. 
How do I know they will sell? That’s what PE does and that’s what their investors want them to do. PE investors pay more attention to IRR (internal rate of return) than MOIC (multiple on invested capital), and they like getting money back. Getting $100 back today is more valuable than $115 back a year from now. Obviously there’s a crossing/ balance point. So maybe CVC and Blackstone don’t sell in 3 months if the stock is at $14. But $18? $20? At some price they’ll sell by doing a secondary. And until that happens it’s going to be hard for this stock to really appreciate. 
(Additionally big institutional investors like to wait until some of the PE/lockup overhang has cleared. In the long run it’s better for PFSE to have a stable equity investor base than two large PE firms controlling 40% of the stock)",Verb0182,4,/r/investing/comments/mquayi/updated_paysafe_dd_medium_to_long_term_hold/guk402k/,0.019,0.862,0.118,0.9619
154,PSFE," I’ve been accumulating a small position in PSFE and believe it’s a good long term hold. However, the looming lockup expiration will likely continue to weight on shares. Additionally, Blackstone and CVC absolutely will sell the majority of their stakes sooner than later. “Remaining part of the team” likely means on the board of directors. 
How do I know they will sell? That’s what PE does and that’s what their investors want them to do. PE investors pay more attention to IRR (internal rate of return) than MOIC (multiple on invested capital), and they like getting money back. Getting $100 back today is more valuable than $115 back a year from now. Obviously there’s a crossing/ balance point. So maybe CVC and Blackstone don’t sell in 3 months if the stock is at $14. But $18? $20? At some price they’ll sell by doing a secondary. And until that happens it’s going to be hard for this stock to really appreciate. 
(Additionally big institutional investors like to wait until some of the PE/lockup overhang has cleared. In the long run it’s better for PFSE to have a stable equity investor base than two large PE firms controlling 40% of the stock)",Verb0182,4,/r/investing/comments/mquayi/updated_paysafe_dd_medium_to_long_term_hold/guk402k/,0.019,0.862,0.118,0.9619
155,PSFE, Yeah a lot of people get confused with that.  It's from the SEC filing. FTAC refers to the Foley Trasemine Acquisition Corp.  The ticker for Paysafe is PSFE.,greensymbiote,3,/r/investing/comments/mquayi/updated_paysafe_dd_medium_to_long_term_hold/gui7eru/,0.078,0.847,0.075,-0.0258
156,PSFE, PSFE,greensymbiote,8,/r/investing/comments/mquayi/updated_paysafe_dd_medium_to_long_term_hold/gui73g2/,0.0,1.0,0.0,0.0
157,SFM, Love SFM. Been in it for about a year. This is a long-term hold for me.,Outrageous-Cycle-841,12,/r/investing/comments/mqutep/sprouts_farmers_market_sfm_dd/guiwsft/,0.0,0.756,0.244,0.6369
158,SFM," They can build a ton in Florida. I live about half a mile from the first one they opened in the state (Winter Park). I was excited to see the store built, having lived in CA before, most of Florida is a monopoly by Publix and hence their prices and quality stink.  SFM will do well in this state as they have better produce at better prices.",FloridaMan_5,7,/r/investing/comments/mqutep/sprouts_farmers_market_sfm_dd/guj35z5/,0.039,0.814,0.147,0.765
159,DD," Same sentiment here. I like the DD, but all I needed was the title. Didn't even know they were public.",Idyotec,5,/r/investing/comments/mqutep/sprouts_farmers_market_sfm_dd/guk8ytd/,0.0,0.907,0.093,0.1901
160,SFM," I’m seeing consistent double digit growth (https://www.zacks.com/stock/chart/SFM/fundamental/revenue-quarterly-yoy-growth), they’re reinvesting into opening more stores and buying back shares, priced at a good value (at the low of their P/E range, actually lower P/E than Kroger as one point of reference, and much stronger growth).",sunnbeta,2,/r/investing/comments/mqutep/sprouts_farmers_market_sfm_dd/guk184h/,0.083,0.673,0.244,0.8126
161,FL," Expanding to FL, TX.",Ouiju,2,/r/investing/comments/mqutep/sprouts_farmers_market_sfm_dd/guj852n/,0.0,0.481,0.519,0.4995
162,TX," Expanding to FL, TX.",Ouiju,2,/r/investing/comments/mqutep/sprouts_farmers_market_sfm_dd/guj852n/,0.0,0.481,0.519,0.4995
163,KR," Today I’d much rather own Sprouts. 

Kroger and Sprouts stock price 5 years ago were both about where they are now. Sure you haven’t gotten a dividend from Sprouts but KR is only 1.9% anyway, and Sprouts shouldn’t be paying a dividend, they should be investing back into the company which is what they’re doing. KR is like 10x bigger company, I think Sprouts has more room to grow and a more unique model than KR which is just kinda a generic grocer.",sunnbeta,1,/r/investing/comments/mqutep/sprouts_farmers_market_sfm_dd/gum0l4m/,0.0,0.939,0.061,0.5994
164,JD," Alibaba's holdings are convoluted, messy and opaque. But their fundamentals are solid. There is a reason why the recent Chinese government crackdown started with Alibaba ([now expanded to 12 other Chinese tech giants](https://www.caixinglobal.com/2021-04-14/meituan-bytedance-pledge-to-comply-with-chinas-antitrust-laws-101691303.html)). Chinese consumers from all walks of life interact with an Alibaba subsidiary in their daily life - Alibabacloud, Alipay, Taobao, Cainiao, ...

According to the article, the tech giants (PDD, Meituan, JD, Bytedance) have meekly fallen in line.",rienzian,13,/r/investing/comments/mr5ew4/unpopular_opinion_on_baba/guklwxs/,0.069,0.905,0.026,-0.4767
165,BABA," I don’t touch BABA because I can’t trust the numbers, and if the numbers are questionable how can you make a reasonable valuation.",ORCoast19,0,/r/investing/comments/mr5ew4/unpopular_opinion_on_baba/gukmgz9/,0.094,0.766,0.14,0.2732
166,BABA," >United Health is my favorite: 250,000 employees. Let that sink in...for insurance administration.

Yet somehow people still think this is a more efficient system then Medicare for all. Anyway, as for your topic, I'm long on BABA and JD. Sure I worry the government will interfere, but I don't see any incentive for the government to prevent their success. They both seem like the most obvious buys right now.",JuliusErrrrrring,18,/r/investing/comments/mr5ew4/unpopular_opinion_on_baba/gukc9dn/,0.059,0.746,0.195,0.8601
167,JD," >United Health is my favorite: 250,000 employees. Let that sink in...for insurance administration.

Yet somehow people still think this is a more efficient system then Medicare for all. Anyway, as for your topic, I'm long on BABA and JD. Sure I worry the government will interfere, but I don't see any incentive for the government to prevent their success. They both seem like the most obvious buys right now.",JuliusErrrrrring,18,/r/investing/comments/mr5ew4/unpopular_opinion_on_baba/gukc9dn/,0.059,0.746,0.195,0.8601
168,COIN, COIN proved that last night ...,MynameasGaeilge,4,/r/investing/comments/mr5ew4/unpopular_opinion_on_baba/gul295a/,0.0,1.0,0.0,0.0
169,PDD," These are the same two I went with. Only problem is it was based on growth and financials, I have zero insight into the Chinese consumer decision making process. Worried Tencent could/will go Judas on JD; also worried about about PDD granted it seems like they subsidize a lot of their orders via coupons.",Investing8675309,1,/r/investing/comments/mr5ew4/unpopular_opinion_on_baba/gul43su/,0.12,0.76,0.12,0.0
170,TSLA, Trying to forecast a valuation for TSLA is like trying to predict what a 3 year old is going to do next: you never know until they kick you in the balls. Then all you can do is lay on the ground wishing you wore a cup.,ButASpeckofDust,29,/r/investing/comments/mr23mr/my_attempt_at_ebitda_forecast_valuation_for_tesla/gujvs2h/,0.0,0.903,0.097,0.5267
171,TSLA," All of this is wild speculation.  You can’t do this with TSLA.  You either roll the dice and hop on board or you don’t.  Could win big, could explode.  This the price of gambling.",tripmcnealy223,6,/r/investing/comments/mr23mr/my_attempt_at_ebitda_forecast_valuation_for_tesla/guk9r8a/,0.0,0.897,0.103,0.5859
172,TSLA, TSLA is the emperor leading the parade with no clothes on but nobody is willing to say he is naked.  At today's market cap they should be selling 5-8 mm cars/year.  Now I happen to believe that may happen but if it does recognize that current shareholders will not earn a penny over cpi inflation going forward as it is already valued at the market cap that will bring.,Admirable_Nothing,6,/r/investing/comments/mr23mr/my_attempt_at_ebitda_forecast_valuation_for_tesla/guk19ju/,0.023,0.923,0.055,0.5023
173,AMD," I've been looking at large tech companies with comparable growth rates. Take Google for example. In 2011, 2012 and 2013 they were growing at 21-29% per year and their multiple was in the 12-19x range. They've averaged around 17x for the last decade. AMD was between 25-35x when they were growing in mid 20%s range and they have high margins. I'm not an expert at this but it definitely seems like it would be safe to assume that the TSLA multiple will come down a lot over the next decade. Investors are willing to pay a premium now",1-1-1-1-1-1-1-1-1-2,3,/r/investing/comments/mr23mr/my_attempt_at_ebitda_forecast_valuation_for_tesla/guknkea/,0.015,0.842,0.143,0.9109
174,TSLA," I've been looking at large tech companies with comparable growth rates. Take Google for example. In 2011, 2012 and 2013 they were growing at 21-29% per year and their multiple was in the 12-19x range. They've averaged around 17x for the last decade. AMD was between 25-35x when they were growing in mid 20%s range and they have high margins. I'm not an expert at this but it definitely seems like it would be safe to assume that the TSLA multiple will come down a lot over the next decade. Investors are willing to pay a premium now",1-1-1-1-1-1-1-1-1-2,3,/r/investing/comments/mr23mr/my_attempt_at_ebitda_forecast_valuation_for_tesla/guknkea/,0.015,0.842,0.143,0.9109
175,AI," ""Most experts believe that Tesla's approach of trying to achieve full self-driving by eschewing lidar and high-definition maps is not feasible. In a March 2020 study by Navigant Research, Tesla was ranked last for both strategy and execution in the autonomous driving sector. In March 2021, according to a letter that Tesla sent to the CA DMV about FSD’s capability, acquired by PlainSite via a public records request, Tesla stated that FSD is not capable of autonomous driving and is SAE Level 2 automation."" I just pulled this from Wikipedia. At this early stage, I guess it doesn't seem feasible to include it in a valuation. It's more like icing on the cake, like the possibility of asteroid mining with SpaceX but I wouldn't bet the farm on it.

I believe personally that there will be multiple companies that will either have autonomous driving capabilities built into the cars or will offer the AI software/hardware as a package like with comma.ai. That kind of IP is very hard to protect. I'm not saying it can't be profitable, I'd just imagine it'll be very competitive.",1-1-1-1-1-1-1-1-1-2,3,/r/investing/comments/mr23mr/my_attempt_at_ebitda_forecast_valuation_for_tesla/gukonfj/,0.036,0.89,0.074,0.7922
176,FSD," ""Most experts believe that Tesla's approach of trying to achieve full self-driving by eschewing lidar and high-definition maps is not feasible. In a March 2020 study by Navigant Research, Tesla was ranked last for both strategy and execution in the autonomous driving sector. In March 2021, according to a letter that Tesla sent to the CA DMV about FSD’s capability, acquired by PlainSite via a public records request, Tesla stated that FSD is not capable of autonomous driving and is SAE Level 2 automation."" I just pulled this from Wikipedia. At this early stage, I guess it doesn't seem feasible to include it in a valuation. It's more like icing on the cake, like the possibility of asteroid mining with SpaceX but I wouldn't bet the farm on it.

I believe personally that there will be multiple companies that will either have autonomous driving capabilities built into the cars or will offer the AI software/hardware as a package like with comma.ai. That kind of IP is very hard to protect. I'm not saying it can't be profitable, I'd just imagine it'll be very competitive.",1-1-1-1-1-1-1-1-1-2,3,/r/investing/comments/mr23mr/my_attempt_at_ebitda_forecast_valuation_for_tesla/gukonfj/,0.036,0.89,0.074,0.7922
177,IP," ""Most experts believe that Tesla's approach of trying to achieve full self-driving by eschewing lidar and high-definition maps is not feasible. In a March 2020 study by Navigant Research, Tesla was ranked last for both strategy and execution in the autonomous driving sector. In March 2021, according to a letter that Tesla sent to the CA DMV about FSD’s capability, acquired by PlainSite via a public records request, Tesla stated that FSD is not capable of autonomous driving and is SAE Level 2 automation."" I just pulled this from Wikipedia. At this early stage, I guess it doesn't seem feasible to include it in a valuation. It's more like icing on the cake, like the possibility of asteroid mining with SpaceX but I wouldn't bet the farm on it.

I believe personally that there will be multiple companies that will either have autonomous driving capabilities built into the cars or will offer the AI software/hardware as a package like with comma.ai. That kind of IP is very hard to protect. I'm not saying it can't be profitable, I'd just imagine it'll be very competitive.",1-1-1-1-1-1-1-1-1-2,3,/r/investing/comments/mr23mr/my_attempt_at_ebitda_forecast_valuation_for_tesla/gukonfj/,0.036,0.89,0.074,0.7922
178,AI," From what I hear, If you only consider the EV car component of Tesla (without robotaxis and autonomous driving), Tesla should be a $400 stock. The autonomous driving is much more than icing on the cake in everyone’s valuation. I know Elon doesn’t want to use lidar and instead wants to use cameras and AI. I wouldn’t have thought it was possible, but go on YouTube to see what Tesla cars sees. It’s amazing.  It looks like looking through the eyes of the terminator. It spots stop signs, ppl, etc, all very quickly.  My guess is that Elon is way ahead of others on autonomous driving.  There’s no substitute for big data.",MrMooola,1,/r/investing/comments/mr23mr/my_attempt_at_ebitda_forecast_valuation_for_tesla/gukpid0/,0.047,0.871,0.081,0.6124
179,FSD, There is a difference between what Tesla is testing internally and what they publicly disclose due to scrutiny from government entities. They were recently warned by California about testing FSD on Cali roads without permission.,Chromatischism,2,/r/investing/comments/mr23mr/my_attempt_at_ebitda_forecast_valuation_for_tesla/guktmaj/,0.06,0.94,0.0,-0.2732
180,PM," I will be messaging you in 4 years on [**2025-04-15 14:14:01 UTC**](http://www.wolframalpha.com/input/?i=2025-04-15%2014:14:01%20UTC%20To%20Local%20Time) to remind you of [**this link**](https://www.reddit.com/r/investing/comments/mr23mr/my_attempt_at_ebitda_forecast_valuation_for_tesla/gulujj1/?context=3)

[**CLICK THIS LINK**](https://www.reddit.com/message/compose/?to=RemindMeBot&subject=Reminder&message=%5Bhttps%3A%2F%2Fwww.reddit.com%2Fr%2Finvesting%2Fcomments%2Fmr23mr%2Fmy_attempt_at_ebitda_forecast_valuation_for_tesla%2Fgulujj1%2F%5D%0A%0ARemindMe%21%202025-04-15%2014%3A14%3A01%20UTC) to send a PM to also be reminded and to reduce spam.

^(Parent commenter can ) [^(delete this message to hide from others.)](https://www.reddit.com/message/compose/?to=RemindMeBot&subject=Delete%20Comment&message=Delete%21%20mr23mr)

*****

|[^(Info)](https://www.reddit.com/r/RemindMeBot/comments/e1bko7/remindmebot_info_v21/)|[^(Custom)](https://www.reddit.com/message/compose/?to=RemindMeBot&subject=Reminder&message=%5BLink%20or%20message%20inside%20square%20brackets%5D%0A%0ARemindMe%21%20Time%20period%20here)|[^(Your Reminders)](https://www.reddit.com/message/compose/?to=RemindMeBot&subject=List%20Of%20Reminders&message=MyReminders%21)|[^(Feedback)](https://www.reddit.com/message/compose/?to=Watchful1&subject=RemindMeBot%20Feedback)|
|-|-|-|-|",RemindMeBot,2,/r/investing/comments/mr23mr/my_attempt_at_ebitda_forecast_valuation_for_tesla/gulumzv/,0.109,0.891,0.0,-0.6322
181,AI," Guinea pigs they may be. But, it’s great for Tesla because of all they can learn from it, and that data is nationwide and tremendous. Plus, drivers are willing to pay $10k for it, so it’s even better for Tesla, lol. I think you’ll find that the AI that Elon is aiming for will be one that can navigate those hard to discern lane markings and how to react in various situations that require judgment.",MrMooola,1,/r/investing/comments/mr23mr/my_attempt_at_ebitda_forecast_valuation_for_tesla/gukupar/,0.037,0.804,0.158,0.9245
182,AI," Waymo has over 20 millions miles self driven, with a lot more sensors. At some point more data gives diminishing returns, especially since Tesla cars probably don't send back as much telemetry. (hopefully for owners)

> I think you’ll find that the AI that Elon is aiming for will be one that can navigate those hard to discern lane markings

That's the goal of over self driving company, it's a requirement to reach level 5. At this point it's still not clear if Tesla can ever reach level 3 or 4, especially without Lidar.",bitflag,2,/r/investing/comments/mr23mr/my_attempt_at_ebitda_forecast_valuation_for_tesla/gukxij4/,0.039,0.936,0.024,-0.3365
183,IP," It's amazing the things pre-merger SPAC targets get away with saying.  They effectively aren't liable for their claims before they're actually publicly traded.

5 EV startups projected they'll hit $10b in revenue faster than Google, the current record holder for fastest to $10b.

Canoo touted a subscription model, an engineering services business, and a partnership with Hyundai.  On their first earnings call, they announced the Hyundai deal was dead, they were transitioning to developing IP for their own products (ie engineering services is dead), and that their subscription model wasn't actually financially viable.  And their CFO left.  One analyst asked if their CEO was still employed in the Q&A (lol).

Lordstown got caught juicing pre-orders.  BREAKING:  Steve Burns is still a hack.  This one shouldn't have surprised anyone...

Multiplan gave projections out to 2025 in the first half of 2020, before they merged.  As a public company, they gave no guidance for 2021 in their Q4 earnings call.

The sum of the revenue projections from Lidar startups that SPAC'd gives $4.6B in 2025.  The projected Lidar TAM in 2025 is \~$3.8B, and these companies have virtually 0 market share today.

Never trust an investor presentation from a SPAC target.",thri54,14,/r/investing/comments/mre9dz/qs_quantumscape_report_suggests_a_fraud_scheme/gulse1w/,0.059,0.898,0.043,-0.2887
184,QS," ~~I'm long QS so I'm not panicking as long as~~ VW is still behind them.  Just two weeks ago:

[QuantumScape Meets Volkswagen Technical Milestone, Clearing Way for $100M Investment](https://www.businesswire.com/news/home/20210331005943/en/%C2%A0QuantumScape-Meets-Volkswagen-Technical-Milestone-Clearing-Way-for-100M-Investment)

So if QS is all BS (heh), they seem to have VW fooled as well.  (*Or* this is just some speculation/employees who aren't privy to inside info sounding off.  The PDF is taking ages to load for me but I'll read when I can.)

edit - TL;DR - Their CEO plays fast and loose with data, possibly to the point of intentionally misleading.  Good team of scientists but a giant technological hill to climb.

edit 2 - fuck this shit I'm out.  I didn't want to let to let a single PDF sway me on something I was originally long on, but *dayum*.",aMiracleAtJordanHare,3,/r/investing/comments/mre9dz/qs_quantumscape_report_suggests_a_fraud_scheme/gulnpc6/,0.142,0.79,0.068,-0.9104
185,NKLA," If this were true, it would be like NKLA.",ORS823,1,/r/investing/comments/mre9dz/qs_quantumscape_report_suggests_a_fraud_scheme/guly3k7/,0.0,0.569,0.431,0.6486
186,NKLA, You forgot to mention NKLA.,FinndBors,6,/r/investing/comments/mre9dz/qs_quantumscape_report_suggests_a_fraud_scheme/guly1kg/,0.0,1.0,0.0,0.0
