,ticker,comment,username,score,permalink,neg,neu,pos,compound
242,HD, Lol my main green today is Cruise stocks lol. SCHD is down. I assune because HD and the like are some reason red today despite good earninga,LanceX2,2,/r/stocks/comments/nf66zs/rstocks_daily_discussion_technicals_tuesday_may/gykw2fc/,0.074,0.677,0.249,0.6902
243,SQ," Been out of the loop lately, any news why SQ crashed so hard or was it just part of the tech plummet?",GOLDSPECTRE94,2,/r/stocks/comments/nf66zs/rstocks_daily_discussion_technicals_tuesday_may/gyl3a0s/,0.082,0.918,0.0,-0.2183
244,IMO," That was an impressively flat day: down $0.84 on the close.

VIAC is finally doing work though and a couple of things getting close to where I'd be comfortable averaging up some. Pretty good day, definitely good compared to the market.

We just need some good news out of India and/or Taiwan for things to take back off IMO.",Runningflame570,2,/r/stocks/comments/nf66zs/rstocks_daily_discussion_technicals_tuesday_may/gym6h61/,0.0,0.709,0.291,0.9633
245,VIAC," That was an impressively flat day: down $0.84 on the close.

VIAC is finally doing work though and a couple of things getting close to where I'd be comfortable averaging up some. Pretty good day, definitely good compared to the market.

We just need some good news out of India and/or Taiwan for things to take back off IMO.",Runningflame570,2,/r/stocks/comments/nf66zs/rstocks_daily_discussion_technicals_tuesday_may/gym6h61/,0.0,0.709,0.291,0.9633
246,BABA," Bought another 2k worth of BABA. 33% of my portfolio now.

Lowers my BEP from 252 to 243.

Wish I had gone in a couple days ago but ah well, still a good price.",FairCityIsGood,2,/r/stocks/comments/nf66zs/rstocks_daily_discussion_technicals_tuesday_may/gylkc1d/,0.034,0.702,0.265,0.8201
247,BEP," Bought another 2k worth of BABA. 33% of my portfolio now.

Lowers my BEP from 252 to 243.

Wish I had gone in a couple days ago but ah well, still a good price.",FairCityIsGood,2,/r/stocks/comments/nf66zs/rstocks_daily_discussion_technicals_tuesday_may/gylkc1d/,0.034,0.702,0.265,0.8201
248,INVZ," TD is showing INVZ up huge number pre-market .
Must be some mistake but why ?",NPRjunkieDC,1,/r/stocks/comments/nf66zs/rstocks_daily_discussion_technicals_tuesday_may/gyjzj0y/,0.11,0.71,0.181,0.0258
249,TD," TD is showing INVZ up huge number pre-market .
Must be some mistake but why ?",NPRjunkieDC,1,/r/stocks/comments/nf66zs/rstocks_daily_discussion_technicals_tuesday_may/gyjzj0y/,0.11,0.71,0.181,0.0258
250,TLS, Surprisngly I wouldn't have done too bad today if TLS didn't plummet ;_;,intentionally_blank_,1,/r/stocks/comments/nf66zs/rstocks_daily_discussion_technicals_tuesday_may/gym8a02/,0.241,0.759,0.0,-0.5423
251,GDP," Here's your probable reason for the late day dump:

&#x200B;

>On Tuesday, Treasury Secretary Janet Yellen spoke about the benefits of higher corporate taxes and unions to the Chamber of Commerce.  
>  
>  
>  
>""With corporate taxes at a historical low of 1% of GDP, we believe the corporate sector can contribute to this effort by bearing its fair share,"" the former Fed chairwoman told the Chamber's Global Forum on Economic Recovery.   
>  
>  
>  
>""We propose simply to return the corporate tax toward historical norms.""Yellen also said lower-wage earners in particular have not seen enough wage growth over the past several decades, even as productivity rose. She said unions are part of the answer to this problem.",TheKabillionare,1,/r/stocks/comments/nf66zs/rstocks_daily_discussion_technicals_tuesday_may/gymcjdx/,0.065,0.859,0.077,0.1217
252,AEO," I do not buy any of this Monday morning quarter backing about Yellens comments. I think there was some profit taking and inflation anxiety. I was up 7% at the beginning of the day and will end up down 1.5%. That’s honestly not out of the norm for the past few weeks.

Walmart cleaned up in earnings, which sets up Target, Gap, and AEO. Bought mid June calls on all 3 at end of day today when they were heading down. Anybody that can pass along price increases is a goldmine right now, not to mention all the real estate these companies often have.",lattiboy,1,/r/stocks/comments/nf66zs/rstocks_daily_discussion_technicals_tuesday_may/gymd9ko/,0.016,0.916,0.068,0.6486
253,IPOE," IPOE (Sofi) is likely to have Short squeeze in the run up to Shareholder approval vote next week. Currently following same pre-merger price pattern as IPOB...

IPOE (SoFi) shareholder merger approval vote is next week (Ticker symbol change 3 days later)... which led to some price movement yesterday.. but will pick up today and tomorrow.

**Catalyst- The run up to Merger/ Shareholder Vote**
IPOE is following same pre-merger path as IPOB... both ran up to $26, then pulled back to $15.. then IPOB ran up to $32 in the lead up to Vote & Ticker change. IPOE is at $15, about to start the run to leading up to Merger.  This is the Catalyst than will cause a squeeze.

**4 Million May Calls between $17.50 - $22.50**
will trigger $4 Million shares to be bought (not to mention future month $17.50 - $22.50 Calls which are even larger).

**Shorts are weakened**
Also- shorts a now vulnerable. when yesterday ended, around 2,000 total shares were in the sell lines of Level 2. And no resistance over $16.50. Today should be the tipping point.

**SoFi supports a larger valuation**
Also- SoFi supports a much larger valuation. It offers a full range of banking, investing, lending, insurance and has expanded internationally.  also owns Galileo a Baas company (Fintech software, platform.. worth over $2B.  It powers Robinhood, Chime and many others). Additionally, SoFi will be profitable next year and highs higher revenues than Robinhood.. and Sofi is just starting their expansion growth phase.

In preliminary work to go public later in the year.. Robinhood is being valued at $40B.  (compare this to SoFi's valuation at current price if $15 .. which is around $8Billion). Sofi has a lit if room to run.",SCModerate,-23,/r/stocks/comments/nf66zs/rstocks_daily_discussion_technicals_tuesday_may/gyk9g3z/,0.017,0.884,0.099,0.9735
254,MSFT, MSFT holders are going to buy lots of drugs and alcohol today. I sincerely hope that nobody overdoses because i know you will get through this and you will get a better chance in the future.,Fullyrecededhairline,-13,/r/stocks/comments/nf66zs/rstocks_daily_discussion_technicals_tuesday_may/gyjtvtw/,0.0,0.727,0.273,0.872
255,TSLA," Remember when TSLA rallies it rallies hard, its good there was some cooling down.",loosetingles,1,/r/stocks/comments/nf66zs/rstocks_daily_discussion_technicals_tuesday_may/gylb86p/,0.086,0.736,0.178,0.3612
256,AMD, Kinda sad I sold 33% but I put it in Amazon and AMD which I plan to hold for years,AeroEngineer56,1,/r/stocks/comments/nf66zs/rstocks_daily_discussion_technicals_tuesday_may/gykmect/,0.1,0.791,0.108,0.0378
257,ASO," All then IPO who had that lockup do pretty bad after it, it seems. Pltr, crsr, U all down big, but all are growth though. ASO only went up since the lockup though.
Edit: Was ment to post this on they guy above you",Delfitus,1,/r/stocks/comments/nf66zs/rstocks_daily_discussion_technicals_tuesday_may/gyjyv4s/,0.047,0.838,0.115,0.5023
258,ALL," I'm in the same boat, I bought some/want to buy some that are fairly valued, MMM, BBY, CMI, ORI, ALL.  But on sale? Anything that's on sale right now is on sale because they have issues.",oyveyanyday,2,/r/stocks/comments/nf66zs/rstocks_daily_discussion_technicals_tuesday_may/gym50pu/,0.0,0.946,0.054,0.2382
259,BBY," I'm in the same boat, I bought some/want to buy some that are fairly valued, MMM, BBY, CMI, ORI, ALL.  But on sale? Anything that's on sale right now is on sale because they have issues.",oyveyanyday,2,/r/stocks/comments/nf66zs/rstocks_daily_discussion_technicals_tuesday_may/gym50pu/,0.0,0.946,0.054,0.2382
260,CMI," I'm in the same boat, I bought some/want to buy some that are fairly valued, MMM, BBY, CMI, ORI, ALL.  But on sale? Anything that's on sale right now is on sale because they have issues.",oyveyanyday,2,/r/stocks/comments/nf66zs/rstocks_daily_discussion_technicals_tuesday_may/gym50pu/,0.0,0.946,0.054,0.2382
261,MMM," I'm in the same boat, I bought some/want to buy some that are fairly valued, MMM, BBY, CMI, ORI, ALL.  But on sale? Anything that's on sale right now is on sale because they have issues.",oyveyanyday,2,/r/stocks/comments/nf66zs/rstocks_daily_discussion_technicals_tuesday_may/gym50pu/,0.0,0.946,0.054,0.2382
262,ORI," I'm in the same boat, I bought some/want to buy some that are fairly valued, MMM, BBY, CMI, ORI, ALL.  But on sale? Anything that's on sale right now is on sale because they have issues.",oyveyanyday,2,/r/stocks/comments/nf66zs/rstocks_daily_discussion_technicals_tuesday_may/gym50pu/,0.0,0.946,0.054,0.2382
263,SNOW, SNOW,badgebruce,1,/r/stocks/comments/nf66zs/rstocks_daily_discussion_technicals_tuesday_may/gylvfvj/,0.0,1.0,0.0,0.0
264,USA," Yellen said she wants higher taxes!  Fair share, historic tax rates (for the USA anyway), blah blah blah.",oyveyanyday,3,/r/stocks/comments/nf66zs/rstocks_daily_discussion_technicals_tuesday_may/gym4mye/,0.191,0.591,0.218,0.3802
265,WTI, Not if you look at WTI price.,TexasLandman2021,1,/r/stocks/comments/nf66zs/rstocks_daily_discussion_technicals_tuesday_may/gyld4qw/,0.0,1.0,0.0,0.0
266,WTI, You can but WTI has a hard time staying above 67 so it will probably just go back down and go sideways together with oil etfs,Muboi,2,/r/stocks/comments/nf66zs/rstocks_daily_discussion_technicals_tuesday_may/gyk0uq2/,0.062,0.938,0.0,-0.1531
267,BP," I'm long BP and MRO for energy plays, neither has returned to pre-pandemic price levels and both have healthy and consistent dividends.",Butterfliesinmybrain,1,/r/stocks/comments/nf66zs/rstocks_daily_discussion_technicals_tuesday_may/gyk7rts/,0.0,0.736,0.264,0.7003
268,MRO," I'm long BP and MRO for energy plays, neither has returned to pre-pandemic price levels and both have healthy and consistent dividends.",Butterfliesinmybrain,1,/r/stocks/comments/nf66zs/rstocks_daily_discussion_technicals_tuesday_may/gyk7rts/,0.0,0.736,0.264,0.7003
269,AAPL," I hold AAPL, NVDA, SQ, and NET in my retirement account and don’t plan on selling for 5-20 years.",renotrex,3,/r/stocks/comments/nf66zs/rstocks_daily_discussion_technicals_tuesday_may/gymaxu1/,0.0,1.0,0.0,0.0
270,NET," I hold AAPL, NVDA, SQ, and NET in my retirement account and don’t plan on selling for 5-20 years.",renotrex,3,/r/stocks/comments/nf66zs/rstocks_daily_discussion_technicals_tuesday_may/gymaxu1/,0.0,1.0,0.0,0.0
271,NVDA," I hold AAPL, NVDA, SQ, and NET in my retirement account and don’t plan on selling for 5-20 years.",renotrex,3,/r/stocks/comments/nf66zs/rstocks_daily_discussion_technicals_tuesday_may/gymaxu1/,0.0,1.0,0.0,0.0
272,SQ," I hold AAPL, NVDA, SQ, and NET in my retirement account and don’t plan on selling for 5-20 years.",renotrex,3,/r/stocks/comments/nf66zs/rstocks_daily_discussion_technicals_tuesday_may/gymaxu1/,0.0,1.0,0.0,0.0
273,TWTR, Seriously?  TWTR is a disaster of a company.  WTF,oyveyanyday,1,/r/stocks/comments/nf66zs/rstocks_daily_discussion_technicals_tuesday_may/gym56n8/,0.721,0.279,0.0,-0.8842
274,AAPL," Small and mid-cap are doing well.
Back in the day MSFT + AAPL + GOOGL were S/M",NPRjunkieDC,2,/r/stocks/comments/nf66zs/rstocks_daily_discussion_technicals_tuesday_may/gykl1i8/,0.0,0.87,0.13,0.2732
275,GOOGL," Small and mid-cap are doing well.
Back in the day MSFT + AAPL + GOOGL were S/M",NPRjunkieDC,2,/r/stocks/comments/nf66zs/rstocks_daily_discussion_technicals_tuesday_may/gykl1i8/,0.0,0.87,0.13,0.2732
276,MSFT," Small and mid-cap are doing well.
Back in the day MSFT + AAPL + GOOGL were S/M",NPRjunkieDC,2,/r/stocks/comments/nf66zs/rstocks_daily_discussion_technicals_tuesday_may/gykl1i8/,0.0,0.87,0.13,0.2732
277,IMO, Trade one car company that starts with F for another. IMO,GeneEnvironmental925,3,/r/stocks/comments/nf66zs/rstocks_daily_discussion_technicals_tuesday_may/gylxfah/,0.0,1.0,0.0,0.0
278,FSR," I'm down 50% on FSR lol

Today's double digit bump was very nice though. If you want to get out now's the time...

But Sharp must be seeing something to want to partner up, right? <---- self delusion",semaphore-1842,2,/r/stocks/comments/nf66zs/rstocks_daily_discussion_technicals_tuesday_may/gylv3g8/,0.0,0.839,0.161,0.5494
279,AMD," If I can’t choose between two similar, good companies I’ll buy both and see how it works out.  Have done it with KO/PEP and AMD/NVDA.",GeneEnvironmental925,2,/r/stocks/comments/nf66zs/rstocks_daily_discussion_technicals_tuesday_may/gykebwc/,0.0,0.888,0.112,0.4404
280,KO," If I can’t choose between two similar, good companies I’ll buy both and see how it works out.  Have done it with KO/PEP and AMD/NVDA.",GeneEnvironmental925,2,/r/stocks/comments/nf66zs/rstocks_daily_discussion_technicals_tuesday_may/gykebwc/,0.0,0.888,0.112,0.4404
281,AAPL, AAPL is as safe a stock there is in this world.,greatnate1250,4,/r/stocks/comments/nf66zs/rstocks_daily_discussion_technicals_tuesday_may/gykupdx/,0.0,0.756,0.244,0.4404
282,VIAC, I wonder if it is like what happened with VIAC & Archegos.  I wouldn't touch it at these prices.,californianotter,2,/r/stocks/comments/nf66zs/rstocks_daily_discussion_technicals_tuesday_may/gyl6h8j/,0.0,0.857,0.143,0.3612
283,AMD," Now is a good time to either jump in on AMD, or increase your position",VMP85,4,/r/stocks/comments/nf66zs/rstocks_daily_discussion_technicals_tuesday_may/gykj1jh/,0.0,0.698,0.302,0.6369
284,IMO," Ha, I'm the same! 32 % of my portfolio currently. I feel great (since I bought recently), Most else is in ETF's, it is my only real pick. Your average is still pretty solid IMO.",bookswithletters,3,/r/stocks/comments/nf66zs/rstocks_daily_discussion_technicals_tuesday_may/gylmr89/,0.0,0.707,0.293,0.8908
285,MO," I love to buy high dividend stocks like XOM, T, and MO a week before EX-Div date, then sell it the day before. They often climb from all the dividend hop-scotchers picking them up to hold for the payout.",KGun-12,3,/r/stocks/comments/nf66zs/rstocks_daily_discussion_technicals_tuesday_may/gykny6j/,0.0,0.839,0.161,0.7717
286,XOM," I love to buy high dividend stocks like XOM, T, and MO a week before EX-Div date, then sell it the day before. They often climb from all the dividend hop-scotchers picking them up to hold for the payout.",KGun-12,3,/r/stocks/comments/nf66zs/rstocks_daily_discussion_technicals_tuesday_may/gykny6j/,0.0,0.839,0.161,0.7717
287,TD," I think TD is having issues this morning. Nasdaq shows a 295,000,000% increase on mine lol. And a few on my watchlist are off in the same way.",swingM8,1,/r/stocks/comments/nf66zs/rstocks_daily_discussion_technicals_tuesday_may/gykecdo/,0.0,0.819,0.181,0.6249
288,MRK," i see a stagnant stock.

i held MRK for the past few months and it didn't go anywhere.",pman6,1,/r/stocks/comments/nf66zs/rstocks_daily_discussion_technicals_tuesday_may/gymd2yu/,0.0,1.0,0.0,0.0
289,GM," Yes. GM, Ford, VW... I am not saying they will all be super profitable right away. But they will be big players just the way they are now. I don’t see Biden going to Canoo plant.",Dowdell2008,6,/r/stocks/comments/nf66zs/rstocks_daily_discussion_technicals_tuesday_may/gylfm18/,0.0,0.832,0.168,0.6428
290,AL," Earning release was good, this and next year look like it going boom China's stock market, many people are investing in China, China is one of the country that already no need to use mask. Bidu is the Google in China, they are investing heavily in AL and expanding their market in other segments.",BenWc,1,/r/stocks/comments/nf66zs/rstocks_daily_discussion_technicals_tuesday_may/gyk49jc/,0.038,0.87,0.092,0.4939
291,OKE," I hold some USOI( 80 ) but my main oil playbis OKE and thats primarily natural gas.

Oil will never go away. Even in 2040. Ii may sell my oil stocks well before then though haha.

Natural gas as well will never go away. Until every transportation vehicle is pure electric. Oil will stay king",LanceX2,3,/r/stocks/comments/nf66zs/rstocks_daily_discussion_technicals_tuesday_may/gylpmu9/,0.0,0.752,0.248,0.9413
292,SQ, I’m long on SQ too🚀,Popular_Abrocoma558,3,/r/stocks/comments/nf66zs/rstocks_daily_discussion_technicals_tuesday_may/gym7zsq/,0.0,1.0,0.0,0.0
293,IMO," All solid picks IMO, they should continue to grow and evolve as companies! all solid choices",SpiderStuff,1,/r/stocks/comments/nf66zs/rstocks_daily_discussion_technicals_tuesday_may/gymc53f/,0.0,0.8,0.2,0.3595
294,BABA, I have the same amount in BRK.B but there's no real other stocks I have the same conviction as BABA. Everything else just looks mad expensive,FairCityIsGood,1,/r/stocks/comments/nf66zs/rstocks_daily_discussion_technicals_tuesday_may/gylln9l/,0.244,0.756,0.0,-0.7964
295,ON, IMPORTANT ANNOUNCEMENT ON NUCLEAR DEAL EXPECTED TOMORROW: BBC,Muboi,2,/r/stocks/comments/nf66zs/rstocks_daily_discussion_technicals_tuesday_may/gyl1wfy/,0.0,0.795,0.205,0.2023
296,WTI," >What? I'm not looking to trade them, I'm just looking to find out why it dropped.

Also you,

>Wonder if its time to puy puts on oil

the answer is that it's WTI front month emphasis on front month. It has high volatility and it has been bid up a humongous amount the last two months. 

There's a lot of buzz around Iran and Russian (Ulyanov is right now negotiating JCPOA). So galaxy brains are evidently getting out of the market, perhaps with some extra shorting, because they think they can predict what happens. Flip a coin, 50% of the time it works every time

Edit: Ulyanov's statement https://twitter.com/Amb_Ulyanov/status/1394689825400307718",CommercialFindingNo9,2,/r/stocks/comments/nf66zs/rstocks_daily_discussion_technicals_tuesday_may/gyl4eqv/,0.0,1.0,0.0,0.0
297,GOOG," The only tech stocks I’m long on are GOOG, SQ, and NVDA",Jrie0,2,/r/stocks/comments/nf66zs/rstocks_daily_discussion_technicals_tuesday_may/gym82gi/,0.0,1.0,0.0,0.0
298,NVDA," The only tech stocks I’m long on are GOOG, SQ, and NVDA",Jrie0,2,/r/stocks/comments/nf66zs/rstocks_daily_discussion_technicals_tuesday_may/gym82gi/,0.0,1.0,0.0,0.0
299,SQ," The only tech stocks I’m long on are GOOG, SQ, and NVDA",Jrie0,2,/r/stocks/comments/nf66zs/rstocks_daily_discussion_technicals_tuesday_may/gym82gi/,0.0,1.0,0.0,0.0
300,TLS," 19$ is an amazing entry considering the price now, I think you got this on lockdown. I think TLS is a pretty good company, the valuation just abit insane rn for me",SirPalat,3,/r/stocks/comments/nf66zs/rstocks_daily_discussion_technicals_tuesday_may/gyl55i4/,0.072,0.665,0.263,0.802
301,AAPL," She uses stocks lime AAPL as a cash position iirc, not because she wants to invest in them.",Mike804,1,/r/stocks/comments/nf66zs/rstocks_daily_discussion_technicals_tuesday_may/gylul9z/,0.0,1.0,0.0,0.0
302,DOW," Pretty much. I think also comments have gone down because a lot of people have gotten smacked by the tech correction and that’s without adding that the general sentiment right now is starting to turn bearish around the SPY and DOW, which can mean further downside for tech",EscobarCocoPuff,2,/r/stocks/comments/nf66zs/rstocks_daily_discussion_technicals_tuesday_may/gym07ww/,0.041,0.894,0.065,0.296
303,AMD, AMD is adding fabs in the US.,VMP85,2,/r/stocks/comments/nf66zs/rstocks_daily_discussion_technicals_tuesday_may/gykjg9m/,0.0,1.0,0.0,0.0
304,DK," Pre-GME yes. Was up 300% all profit .
Now about 40% up .
I did buy PLTR + DK NG + FU BO last week pretty low .",NPRjunkieDC,1,/r/stocks/comments/nf66zs/rstocks_daily_discussion_technicals_tuesday_may/gykzzia/,0.226,0.51,0.264,0.0688
305,PLTR," Pre-GME yes. Was up 300% all profit .
Now about 40% up .
I did buy PLTR + DK NG + FU BO last week pretty low .",NPRjunkieDC,1,/r/stocks/comments/nf66zs/rstocks_daily_discussion_technicals_tuesday_may/gykzzia/,0.226,0.51,0.264,0.0688
306,WTI," So you went from you have no idea, then lied to me about your question, and now you have some explanation. 

Why do you even bother to post on here

If you were half right, which you aren't, you would've seen a crash through more than WTI. i.e., Saudi Arabia or UAE. We didn't. Even brent didn't crack more than a percent and change down. The reason is because WTI in particular is being buoyed by JCPOA because America is very anti-Iran oil, and a lot of futures traders are making it a self-fulfilling prophecy of sorts. 

Whether you realize it or not (you don't, for the record) you're just seeing some random daily futures contract because Google is tailoring search results to your location. They see American retail investor who knows jack shit, and they show him WTI front month. If you were in Canada maybe it'd be Guernsey Light Sweet or something. If you actually were in oil, to take a random example, maybe they'd show your local Wyoming Sweet. A tale as old as time. But WTI =/= the world's oil supply, or anything like that. I mean this: go back to your crayons

A 2.5% drop in a few minutes is an asterisk. Switch to candles. A smoothed/normalized line graph from whatever free daily futures chart you're looking at will inevitably smooth out all sorts of 2% drops throughout the month.",CommercialFindingNo9,1,/r/stocks/comments/nf66zs/rstocks_daily_discussion_technicals_tuesday_may/gyl9m35/,0.05,0.901,0.049,0.4215
307,IRS," No their isn't you are right, they are wrong. As long as you follow your day trade limit you are good... brokers restrict users with under 25k to 3 day trades per 5 business days. Stock buys/sales only effect TAXES in a negative manner on these types of trades.. you will pay higher taxes on short term profit from trades, and they will be ineligible for losses assistance on taxes. So if a trader bought/sold the same stock 3 times in a week for example and lost 500 bucks and tried to use this as a tax writeoff of some kind it wouldn't work... the IRS would label it a short term wash sale and say screw off thats your loss :) hope that helps.",7LyLa,2,/r/stocks/comments/new9vv/is_there_a_limit_to_how_many_times_you_can_trade/gyijx6y/,0.156,0.738,0.106,-0.5994
308,PDT, If you're not under PDT you can trade all you want. I traded one 6 times today. The last trade was a loss so it's on the shit list for 31 days.,Canyon-Breeze,2,/r/stocks/comments/new9vv/is_there_a_limit_to_how_many_times_you_can_trade/gyifzl6/,0.068,0.774,0.158,0.4588
309,MGM, What ticker is MGM studios? I only see the international listing,significantgains,5,/r/stocks/comments/nff0bs/amzn_is_considering_buying_mgm/gyl4sjs/,0.0,1.0,0.0,0.0
310,IMO," IMO MGM doesn't really have the best selection.

Disney has a lot of the good shows and movies.",WoodpeckerAlarmed239,-1,/r/stocks/comments/nff0bs/amzn_is_considering_buying_mgm/gylogfc/,0.0,0.671,0.329,0.8107
311,AMZN," If the rumors I've been reading are true, AMZN is sounding more and more like Ballmer's MS. Probably safe for the next 6 months but i wouldnt be long on amazon, especially with pandemic e-purchases slowing",grecks530,-7,/r/stocks/comments/nff0bs/amzn_is_considering_buying_mgm/gyl5nz4/,0.0,0.791,0.209,0.7121
312,MS," If the rumors I've been reading are true, AMZN is sounding more and more like Ballmer's MS. Probably safe for the next 6 months but i wouldnt be long on amazon, especially with pandemic e-purchases slowing",grecks530,-7,/r/stocks/comments/nff0bs/amzn_is_considering_buying_mgm/gyl5nz4/,0.0,0.791,0.209,0.7121
313,MSFT, What's wrong with Ballmer's MS? I bought MSFT while Ballmer was running the show and it's up 800% so far.,Mysterious-Kiwi-7289,1,/r/stocks/comments/nff0bs/amzn_is_considering_buying_mgm/gylbp8h/,0.147,0.853,0.0,-0.4767
314,AMC, AMC apes in shambles,covidtimecommenter,1,/r/stocks/comments/nff0bs/amzn_is_considering_buying_mgm/gym62fi/,0.0,1.0,0.0,0.0
315,LMAO, LMAO Ballmer msft from 2000-2014 went up like \~30%. The reason you are up 800% is because of Satya Nadella.,EchoooEchooEcho,2,/r/stocks/comments/nff0bs/amzn_is_considering_buying_mgm/gym4df6/,0.0,0.716,0.284,0.7983
316,GDP, That’s not how GDP works.,EdgarTheBrave,1,/r/stocks/comments/nff0bs/amzn_is_considering_buying_mgm/gylrlrv/,0.0,1.0,0.0,0.0
317,AMZN," Yea I think AMZN is trying to keep up with the Jonses by buying a production company.

It just so happens they are trying to buy one of the shittiest ones out there. Look at the list of these garbage movies.

[List of their best movies all time.](https://www.the-numbers.com/box-office-records/worldwide/all-movies/theatrical-distributors/mgm)

I'd buy DIS if you're looking for good content that people will always come back to. (Not amazon, but you buy it)",WoodpeckerAlarmed239,1,/r/stocks/comments/nff0bs/amzn_is_considering_buying_mgm/gym64lg/,0.037,0.882,0.081,0.296
318,DIS," Yea I think AMZN is trying to keep up with the Jonses by buying a production company.

It just so happens they are trying to buy one of the shittiest ones out there. Look at the list of these garbage movies.

[List of their best movies all time.](https://www.the-numbers.com/box-office-records/worldwide/all-movies/theatrical-distributors/mgm)

I'd buy DIS if you're looking for good content that people will always come back to. (Not amazon, but you buy it)",WoodpeckerAlarmed239,1,/r/stocks/comments/nff0bs/amzn_is_considering_buying_mgm/gym64lg/,0.037,0.882,0.081,0.296
319,GCP," How can they be a monopoly when they have legitimate competition in every sector they’re in?

Cloud: Microsoft/Azure and Google/GCP

Retail: Etsy, Walmart, Target

Grocery stores: A ton of chains lol

Broadcasting: YouTube/Google",BigBrianBrand,4,/r/stocks/comments/nff0bs/amzn_is_considering_buying_mgm/gylew0h/,0.0,0.915,0.085,0.4215
320,ATH," DKNG - has fallen quite a bit from it's ATH a couple months ago, just like other hard hit stocks in similar sectors, but it didn't have any bad news and had relatively strong earnings when compared to other comps. I have a position in shares and LEAPs",SulkyVirus,8,/r/stocks/comments/nfgeit/what_are_your_current_underrated_stock_picks/gym2d6w/,0.056,0.702,0.242,0.8962
