,ticker,comment,neg,neu,pos,compound
79,ALLY,"Not to mention, for their price point, Ford's vehicles from top to bottom (ESPECIALLY the Mach-E and Bronco) are some of the best price:performance ratios in their class. They cut alot of underperforming vehicles and focused on what sells and improved them.

The Mach E is a great rival to the Model Y and for a first foray into EVs, they really hit the right market. (~40-55k for a crossover)",0.027,0.767,0.205,0.9287
80,GM,"Good write up. I think I bought in when GM announced their plans for the Ultium production lines. Struck me as a smart play that if they can't be every car on the road, they can be ***in*** every car on the road.",0.043,0.783,0.174,0.7184
81,FSD,"No self-driving company has ever laid out a convincing plan for building a self-driving car that would meet EU regulations as discussed around 2014, IIRC. Really, just let any of these companies show me their plans for how to solve the problem. No vague road maps, but real engineering plans. They won't do that, because they don't know how. 

All of them try to convince regulators with ""data"" that their cars are so safe, which won't fly. The main reason is that self-driving cars *aren't* safer. They could be in some fairy tale universe with more computational power available, just not this one. For the price of a FSD package, one can buy ten cars, and then it still doesn't work. Self-driving is a fashion accessory that can kill you. 

I think building a self-driving car is possible; I don't think it's possible right now to build one economically. I have been saying that for 11 years now. 

The people that think that just because they trained their neural network to recognize traffic lights now that someday magically it will work are just ignorant. How many times has Tesla had to go back to the drawing board? I have seen FSD Beta 9 and 10 and if a human was behind the wheel. you would ask them to stop the vehicle.

I have credentials. Do you?",0.092,0.862,0.046,-0.8672
82,TSLA,"r/Investing and many analysts think TSLA is in a bubble.  

Part of this is because r/Investing and many analysts are traders.  They aren't long term investors.",0.0,1.0,0.0,0.0
83,EV,"Because making an EV isn't that hard*. The old car makers are not having difficulty putting EV together, they just have been slow in realizing the potential.

\* EV have less components than ICE, and many automakers already make hybrids which are EV with an added ICE. Putting a battery pack and an electric engine together isn't rocket science.",0.0,0.966,0.034,0.2584
84,ICE,"Because making an EV isn't that hard*. The old car makers are not having difficulty putting EV together, they just have been slow in realizing the potential.

\* EV have less components than ICE, and many automakers already make hybrids which are EV with an added ICE. Putting a battery pack and an electric engine together isn't rocket science.",0.0,0.966,0.034,0.2584
85,EV,"Yea the Mach E has been noted to be basically the first EV to go tit for tat with Tesla. As other big manufacturers come into play Tesla EVs will have to step it up (they will always be a player, but their market share will decrease).",0.0,0.905,0.095,0.5423
86,GM,"Sorry, I think 4680 honeycomb structural is going to beat the everloving snot out of Ultium if someone's got a choice.

Batteries as cargo vs batteries as part of the frame/chassis.

Not to mention that GM is targeting \~$100 / kwh and Tesla is targeting \~$60 / kwh. Point being, we're much more likely to see 'Tesla Inside' than 'GM Inside', ala Intel.",0.022,0.978,0.0,-0.0772
87,EV,"Some interesting points, but I’m not sure it’s that easy.

Firstly, you have manufacturing companies that build cars on licence from the big autos. You also have the risk that one of your competitors will snap up the good startups and integrate them into their existing manufacturing base.

Lastly, I think your assumption that EV company valuations will drop is probably quite unlikely.

Overall, if I was a big automaker, I’d be assessing which startups are a threat, and which would fill a hole in my existing capability, and snapping them all up.

A bit like a tech angel investor, I only need one of them to pay off and juice my product lineup.",0.113,0.784,0.103,-0.0369
88,EV,"I think 2021-2022 is when we'll see this nonsense about Tesla finally result in a crash.

&#x200B;

Why has no said a damn thing about VW EV sales beating Tesla in Europe when they've only been selling EV's for 1 year? This should be huge news for Tesla stock...Yet...

&#x200B;

It shows to me that really all Tesla has is first mover advantage.",0.196,0.743,0.061,-0.8564
89,EV,From what I read the big difference with an EV car compared to ICE is the amount of software needed. EV are mostly software and it isn’t something traditional automakers have done. I think have the resources and car knowledge to be able to transition.,0.0,1.0,0.0,0.0
90,ICE,From what I read the big difference with an EV car compared to ICE is the amount of software needed. EV are mostly software and it isn’t something traditional automakers have done. I think have the resources and car knowledge to be able to transition.,0.0,1.0,0.0,0.0
91,ICE,"""Believe"" as in ""I think this is true, but I'm not certain"". As in ""I believe we've met before"". I'm admitting my uncertainties because data on unit margins are a closely guarded secret. Because that's what adults do in a rational debate.

&#x200B;

On the other hand, we have your approach, which is to make a deliberate misunderstanding of grammar in order to try and undermine the other party. 

You also appear to have taken the gross margin of the global VW group, which produces mostly ICE vehicles. You must realize that's not the same as comparing the unit margin on their battery vehicles? Either you're deliberately misleading or not very good at this. 

&#x200B;

So are you actually interested in the economics of these two companies, or do you just want to try and score spurious points that don't hold up to scrutiny? What's the point in that?",0.124,0.789,0.086,-0.8188
92,EV,">Lastly, I think your assumption that EV company valuations will drop is probably quite unlikely.

Ok so you are saying that all the EV companies that are ipo'ing with $40 billion+ valuations are going to retain that or even appreciate in value?",0.045,0.793,0.162,0.6682
93,API,"An ICE vehicle actually needs more software: there is firmware for the engine, transmission, exhaust system, lube oil pumps 1-10, greasers, etc. However, all of this was done in-house or with suppliers who the OEM's had worked with for decades. I would argue that the total software/control theory system for a traditional ICE car is actually more advanced than the MechE aspect.

&#x200B;

EV development is something totally new - VW knew nothing about electric motors 5 years ago, ADAS chips? They sort of just let MobilEye build them a lane keep assist API and call it good without any real optimization. In car connectivity and a seamless UI? They never really cared.

&#x200B;

EV's are adding I would say an equal, but adjacent level of complexity to ICE vehicles that the traditional OEM's just have no experience working with. It will take them a while to get their processes re-aligned around this. Meanwhile Tesla and Rivian have been built from the ground up to engineer cars more like a software company than a manufacturer with rigid processes and procedures.",0.064,0.895,0.041,-0.3161
94,EV,"An ICE vehicle actually needs more software: there is firmware for the engine, transmission, exhaust system, lube oil pumps 1-10, greasers, etc. However, all of this was done in-house or with suppliers who the OEM's had worked with for decades. I would argue that the total software/control theory system for a traditional ICE car is actually more advanced than the MechE aspect.

&#x200B;

EV development is something totally new - VW knew nothing about electric motors 5 years ago, ADAS chips? They sort of just let MobilEye build them a lane keep assist API and call it good without any real optimization. In car connectivity and a seamless UI? They never really cared.

&#x200B;

EV's are adding I would say an equal, but adjacent level of complexity to ICE vehicles that the traditional OEM's just have no experience working with. It will take them a while to get their processes re-aligned around this. Meanwhile Tesla and Rivian have been built from the ground up to engineer cars more like a software company than a manufacturer with rigid processes and procedures.",0.064,0.895,0.041,-0.3161
95,ICE,"An ICE vehicle actually needs more software: there is firmware for the engine, transmission, exhaust system, lube oil pumps 1-10, greasers, etc. However, all of this was done in-house or with suppliers who the OEM's had worked with for decades. I would argue that the total software/control theory system for a traditional ICE car is actually more advanced than the MechE aspect.

&#x200B;

EV development is something totally new - VW knew nothing about electric motors 5 years ago, ADAS chips? They sort of just let MobilEye build them a lane keep assist API and call it good without any real optimization. In car connectivity and a seamless UI? They never really cared.

&#x200B;

EV's are adding I would say an equal, but adjacent level of complexity to ICE vehicles that the traditional OEM's just have no experience working with. It will take them a while to get their processes re-aligned around this. Meanwhile Tesla and Rivian have been built from the ground up to engineer cars more like a software company than a manufacturer with rigid processes and procedures.",0.064,0.895,0.041,-0.3161
96,EV,"EV software isn't any more complex than the one in a hybrid vehicle (which not only has to manage batteries and electric motor, but needs to do so while keeping an ICE engine at its most efficient and lowest usage and control the gearbox too, which many EV don't have).

Voice recognition, smart auto cruise, wireless software updates, etc. are all available in German cars.",0.052,0.842,0.106,0.5986
97,ICE,"EV software isn't any more complex than the one in a hybrid vehicle (which not only has to manage batteries and electric motor, but needs to do so while keeping an ICE engine at its most efficient and lowest usage and control the gearbox too, which many EV don't have).

Voice recognition, smart auto cruise, wireless software updates, etc. are all available in German cars.",0.052,0.842,0.106,0.5986
98,ICE,"EV's don't need software, we had EV's over a century ago before software was even a thing.

EV's AND ICE vehicles need software, because that's what consumers increasingly expect (thanks to smartphones, and Tesla who led the way in making consumers expect their vehicles to look and behave more like a smartphone). 

You could also argue software is related to self driving vehicles to. Any automaker who struggles to make good software for their vehicles is probably not going to make a level 4 or 5 self driving vehicle, since both require software expertise no matter what hardware you slap on it.",0.068,0.852,0.08,0.0754
99,EV,"THIS.

I'm a SWE and I was blown away the first time I got into a Tesla. I've been inside other EV cars, and their Tesla's software is just on an absolutely different level. Software is what's gonna make or break an EV vehicle, and these boomer companies like Ford, GM won't be able to catch up, because they don't properly value Software. To say nothing about the European car makers; Europe is litearally a black hole for talented SWEs.

Saying that companies like VW or Porsche can catch up to Tesla reminds me of people in 2008 saying that Nokia or Ericsson will eventually kill the iPhone. Their values in terms of tech is completely different.",0.054,0.857,0.089,0.5047
100,GM,"THIS.

I'm a SWE and I was blown away the first time I got into a Tesla. I've been inside other EV cars, and their Tesla's software is just on an absolutely different level. Software is what's gonna make or break an EV vehicle, and these boomer companies like Ford, GM won't be able to catch up, because they don't properly value Software. To say nothing about the European car makers; Europe is litearally a black hole for talented SWEs.

Saying that companies like VW or Porsche can catch up to Tesla reminds me of people in 2008 saying that Nokia or Ericsson will eventually kill the iPhone. Their values in terms of tech is completely different.",0.054,0.857,0.089,0.5047
101,LL,"No. Do you not understand that my wording of ""probably quite unlikely"" isn't an absolute statement? If I'd meant ""definitely very certain"", I'd have said that instead. 

Wanna know why I used words like ""probably"" and ""unlikely""? Because I don't know the future. I'm trying to have a nuanced discussion around future events, which means I'm making conditional statements. 

And then you could parachute in with ""aRe YoU sAyInG tHeY wIlL aLL dEfInAtElY ApPrEcIaTe?"".

No I'm not, jackass, that's why I used conditional words. Are you saying they'll all definitely depreciate? 

&#x200B;

So we can sit here all day and play stupid games, or you could re-read my post and interpret it correctly. 

My point is we're at the beginning of a new technology coming to market. Many new starters will fail, the successful ones will likely become much bigger in the future. 

So waiting on the sidelines to get a bargain is a risky tactic that has a significant probability of failure.",0.092,0.79,0.118,0.5562
102,EV,WSJ had an article earlier this week about VW and there initial struggle figuring out that EV require a ton more software. So I’ll trust VW,0.08,0.796,0.124,0.3134
103,EV,"Heh, nope. 

I want to use valid data to make a probabilistic prediction (with known risks and assumptions). 

I don't want to make an oversimplified, baseless conclusion like ""Tesla to the moon"".

And I don't want to use the wrong data set to come to a spurious conclusion like ""VW global margins are 20% so EV margins must be 20% too"".",0.165,0.756,0.079,-0.354
104,EV,"Like I said, I think we pretty much agree on this and perhaps I wasn’t clear enough.

My point is that there is no telling who has the better gross margin on EV. 

VW has an enormous advantage on sourcing all parts non-EV like tires, body etc but the car is also cheaper.",0.064,0.716,0.22,0.714
105,GOLD,$GOLD Made more money than $TSLA this year but for some reason the stock price isn’t even comparable.,0.0,1.0,0.0,0.0
106,TSLA,$GOLD Made more money than $TSLA this year but for some reason the stock price isn’t even comparable.,0.0,1.0,0.0,0.0
107,WPM,WPM my fav gold and silver stock.,0.0,0.667,0.333,0.4588
108,BTG,And the stock is currently in a long bear flag sitting at $5. Why post this stock is garbage. No one gives a F about BTG,0.091,0.909,0.0,-0.296
109,GOLD,GOLD needs Musk to do their PR,0.0,1.0,0.0,0.0
110,KO,"KO has been screwed the past year due to lack of restaurant sales, among other covid drops. When things re-open hopefully they are able to hit new highs.",0.166,0.753,0.081,-0.4215
111,KO,"This is something that concerns me about the market.  If it is true that the rise in equity prices is mainly attributable to low interest rates, then stocks like $PG, $KO and $VZ should be doing better than they are.  This price action makes sense if the bull market is driven by euphoria rather than fundamentals.",0.031,0.74,0.229,0.9246
112,PG,"This is something that concerns me about the market.  If it is true that the rise in equity prices is mainly attributable to low interest rates, then stocks like $PG, $KO and $VZ should be doing better than they are.  This price action makes sense if the bull market is driven by euphoria rather than fundamentals.",0.031,0.74,0.229,0.9246
113,VZ,"This is something that concerns me about the market.  If it is true that the rise in equity prices is mainly attributable to low interest rates, then stocks like $PG, $KO and $VZ should be doing better than they are.  This price action makes sense if the bull market is driven by euphoria rather than fundamentals.",0.031,0.74,0.229,0.9246
114,OVID,Like *how* recently? Many households staples began declining post-vaccine news as the presumption is that people will be less tied to home consumption. Their stock prices rose as COVID cases did and are now pulling back.,0.0,0.933,0.067,0.3612
115,MO,$XLP asleep. Still think $MO is cheap,0.0,1.0,0.0,0.0
116,ACI,Entered a few times cost basis=~$13.  Have Calls expiry in April about $1/s ahead. My Kroger stock is not doing as good.  I keep ACI because of the 2.14% dividend payout and upside potential to park my old CDs.,0.063,0.937,0.0,-0.3412
117,ACI,I have ACI too. At $13-$13.5 it was too good to pass on! I like the dividend too.,0.0,0.711,0.289,0.69
118,FTOC,"Can't believe it. I dipped my toes into a SPAC for the first time ever today by buying FTOC at 10.50 an hour before this news dropped.

I'd stayed away from SPACs untill now because they seemed so hyped. Finally decided buying something near NAV was atleast worth a try. Total dumb luck haha",0.057,0.808,0.136,0.5574
119,NAV,"Can't believe it. I dipped my toes into a SPAC for the first time ever today by buying FTOC at 10.50 an hour before this news dropped.

I'd stayed away from SPACs untill now because they seemed so hyped. Finally decided buying something near NAV was atleast worth a try. Total dumb luck haha",0.057,0.808,0.136,0.5574
120,FTOC,"4 reasons really. And keep in mind this position was not even 1% of my portfolio, just play money, so I was definitely speculating as opposed to investing.

1. Most importantly to me, it was close to NAV, aside from opportunity cost, the risk is/was minimal 

2. The fintech sector has a lot of positive sentiment and hype around it. Unless it turns out to be an absolutely terrible company it would likely shoot up a lot. I wagered it would be a decent aquisition target due to reason #3

3. Large war chest, meaning they might be able to nab a semi mature unicorn company that people would get excited about

4. It's been around for a little while so the time till aquisition was hopefully going to be less than something brand new.

Plus I did quite a bit of reading on a few different options on r/SPACs and liked what I heard about FTOC",0.07,0.782,0.148,0.9058
121,NAV,"4 reasons really. And keep in mind this position was not even 1% of my portfolio, just play money, so I was definitely speculating as opposed to investing.

1. Most importantly to me, it was close to NAV, aside from opportunity cost, the risk is/was minimal 

2. The fintech sector has a lot of positive sentiment and hype around it. Unless it turns out to be an absolutely terrible company it would likely shoot up a lot. I wagered it would be a decent aquisition target due to reason #3

3. Large war chest, meaning they might be able to nab a semi mature unicorn company that people would get excited about

4. It's been around for a little while so the time till aquisition was hopefully going to be less than something brand new.

Plus I did quite a bit of reading on a few different options on r/SPACs and liked what I heard about FTOC",0.07,0.782,0.148,0.9058
122,GME,"Don't feel bad.  A couple days ago I heard a panel of ""experts"" on CNBC talking about GME and this issue and they all agreed ""I didn't even know that was possible"".",0.0,0.845,0.155,0.6059
123,GME,Imagine a simple world where there are 100 shares of GME and you and I are the only people in the market. You are bullish on GME and I am bearish. You loan me all of the 100 shares that you own and I sell them back to you to go short. You loan me all of your shares again and then I sell them back to you to go short ... again. Repeat N times. Now I'm short 100N shares when only 100 shares exist.,0.0,0.872,0.128,0.8402
124,SI,No prob - some may argue that the initial sell to Broker C creates a “synthetic long” and therefore should be added to the total shares outstanding which would bring the SI % under 100. Depends how you want to look at it.,0.097,0.699,0.203,0.6124
125,QQQ,SPY or QQQ.,0.0,1.0,0.0,0.0
126,TSLA,"Someone who says ""I love trading TSLA to generate income"" has clearly never been through a significant economic downturn.  When you hit a 2 year bear market, you're going to lose your ass with that strategy.",0.183,0.656,0.162,0.0279
127,CEO,"I'm right there with you. This is my pick for a stock that could easily be $100 within a few years. They have no competition, IP, 1 billion in cash reserves, a new competent CEO, and seemingly limitless industries to tap into.",0.053,0.835,0.112,0.3612
128,IP,"I'm right there with you. This is my pick for a stock that could easily be $100 within a few years. They have no competition, IP, 1 billion in cash reserves, a new competent CEO, and seemingly limitless industries to tap into.",0.053,0.835,0.112,0.3612
129,SI,"I actually looked at this for my company and the resistivity of the traces is way higher so you need your traces to be much thicker. There were some other stuff that mafe it less attractive than it initially appeared but thats the one that stood out to me.

I think there was some SI issues as well",0.0,0.924,0.076,0.5351
130,NNDM,"What is the source for the claim that NNDM will be included in ARKX? Sure, I do personally consider space applications possible and ARKX inclusion could indicate that I was on the right track with [this post](https://www.reddit.com/r/pennystocks/comments/jcvg2k/the_recent_jump_of_nano_dimension_nndm/). But I was surprised to find ARKX linked to NNDM in multiple articles today, but none of them giving any evidence for this claim.",0.042,0.907,0.051,-0.1164
131,SI,This was sometime in 2019. They actually reached out to some of our senior engineers who kicked looking into down to me. They offered a prototype but we just weren't interested. Im in aerospace so tge thicker traces alone were a deal breaker. SI issues are the real killer though. I dont 100% remember the details but 3d printed materials end up with little gaps because of how the material settles. If thats in a trace well RIP to your high speed signals. It also means we wouldn't be able to space qaulify the boards regardless of where the gaps were.,0.106,0.858,0.036,-0.8586
132,ARE,"Bonds are a guaranteed store of value. If you bought bonds in 2008 and sold in 20111, vs all equities, you would have done very well. Additionally, large pension funds, IRA's, and other investments that need a caluclated risk purchase bonds since their value is less susceptible to short term volatility. Many investors like the stability over more potential growth. For example, if you had $1M, you could invest 800k in stocks and 200k in bonds, that would be a very common 80/20 split that provides good upside, with less volatility than 100% equities. You said ""bonds got crushed"" since march. I am assuming you mean bond yields got crushed, which is true since the Fed began massive bond purchasing since March, but bond yields are inverse to their price, so bonds actually became and ARE (still) very expensive relative to their norm, so if you purchased in late February, and sold in April, you would have dont much better than equities did at that time. 

You sound young when you say ""stocks gain value back quicker"". 2020 was an anomaly like never in history. Japans 90s stock market crash and deflationary spiral took nearly 20 year for stock prices to recover. They called the 90's the lost decade. The dot com bust took 7 years to recover, and the Great Financial Crisis in 2009 took 4 years to recover.

This current market is juiced by exceptionally low interest rates which has allowed companies to borrow money and issue debt at unprecdently low rates, allowing them to thrive. On top of that you have this incredibly investing momentum driver by low rates (people searching for return) that is self-feeding.

We are in a completely unprecedented time in which the US has unsustainable debt, the FED is ultimately ""printing money"" out of thin air, and at some point... the check will come due. It may be 2021, or 2025, or 2030, but the debt always comes due, and we will have repercussions, i am sure.

With that said, I'm still fully invested in the market, as the next correction, could be this year, or not for another 5. And i certainly cannot take the risk of missing out on the next 5 years of gains.",0.107,0.787,0.106,-0.2673
133,AVGO,"I, too, worship at the Church of AVGO.",0.0,0.761,0.239,0.296
134,XOM,"XOM pays a great dividend, but theres a MUCH MUCH higher risk that XOM goes bankrupt, before the US can't service its debt. That is the risk premium that reflects the spread between them. Even if XOM doesnt go bankrupt, you could easily see its share price cut in half. Bonds don't lose value like that, and in fact, as their yields decrease, their price goes up.",0.255,0.589,0.156,-0.874
135,KO,Oil stocks are trash. I’m talking about good companies here. Ex KO,0.0,0.791,0.209,0.4404
136,OVID,How was the crash intentional? Markets tank when there's uncertainty. Our future with COVID looked very uncertain in March,0.322,0.678,0.0,-0.7645
137,LUMN,LUMN is one of these companies as their wires are necessary for global 5G adoption.,0.0,1.0,0.0,0.0
138,LUMN,"Wow, does LUMN just act as a service provider and sell 5G plans, or do they lease their 5G infrastructure to other corporations? While impressive, if Verizon, T-Mobile, and AT&T are able to just build their own infrastructure LUMN does not have much of a moat (does not necessarily mean it is a bad company though).",0.058,0.825,0.117,0.5574
139,LUMN,"That is true. I will look into LUMN, thank you!",0.0,0.556,0.444,0.68
