,ticker,comment,username,score,permalink,neg,neu,pos,compound
0,TSLA, I tried shorting TSLA once. I’m homeless now. This hits hard.,Tobytime34,4237,/r/wallstreetbets/comments/mb08an/trying_to_time_a_tsla_trade/grve1cr/,0.135,0.865,0.0,-0.1027
1,TSLA," Hahaha. In the end, TSLA running into APEs hiding in the jungle",balkso,1001,/r/wallstreetbets/comments/mb08an/trying_to_time_a_tsla_trade/grv9nnd/,0.139,0.633,0.228,0.34
2,TSLA," Having traded TSLA for years (and following it obsessively to the exclusion of almost anything else), I've always done a ridiculously good job of buying the dips (most recently when it dropped and I snagged it at $560.. but also when it dipped to $198 within the past couple years, and again after the pandemic hit) -- in part because I was fully convinced that the FUD was transparent bullshit, and I felt that the difference between the FUD and the reality was easy to read..

HOWEVER, I screwed it up a lot by selling way too early a couple times. I got burned trying to time the PEAKS rather than trying to time the dips. So OP's point still stands.",NewFolgers,265,/r/wallstreetbets/comments/mb08an/trying_to_time_a_tsla_trade/grvgtgv/,0.16,0.767,0.073,-0.8936
3,TSLA, I sold TSLA at $390 before any split because I needed to pay rent. There's not many days that pass where I don't wonder what my CZ's barrel tastes like.,Colalbsmi,7,/r/wallstreetbets/comments/mb08an/trying_to_time_a_tsla_trade/grw8vhy/,0.048,0.865,0.087,0.2732
4,TSLA," I have never timed a TSLA call correctly. I have tried 4 times and lost all 4 times 100%. 

All 4 of the biggest drops in the last year.",Jesta23,7,/r/wallstreetbets/comments/mb08an/trying_to_time_a_tsla_trade/grvlnm8/,0.095,0.905,0.0,-0.3182
5,TSLA," TSLA is like a cruel mistress. You can love her, you can hate her, but you can never trust her.",borisjjjj,6,/r/wallstreetbets/comments/mb08an/trying_to_time_a_tsla_trade/grvsm2t/,0.312,0.525,0.163,-0.6063
6,TSLA," Looking at the 5y chart, has TSLA been a squeeze the whole time?",RaisedByMonsters,7,/r/wallstreetbets/comments/mb08an/trying_to_time_a_tsla_trade/grvw0z0/,0.0,1.0,0.0,0.0
7,TSLA, I once shorted TSLA and now I’m divorced,bdust2019,6,/r/wallstreetbets/comments/mb08an/trying_to_time_a_tsla_trade/grvwp6i/,0.0,1.0,0.0,0.0
8,TSLA, My trading strategy with TSLA options is never hold for more than 10 mins. I'm not joking. Anything longer and you're playing with fire. If it moves your way take the profit and thank Papa Elon for sparing  your account.,-rigga,5,/r/wallstreetbets/comments/mb08an/trying_to_time_a_tsla_trade/grvnsdv/,0.088,0.756,0.156,0.4826
9,TSLA," I will never sell my TSLA shares. I bought shares after the split. Worth it. The bears can never bring down TSLA. It may go down but it will rise up even higher. Advice, never short TSLA",Hyperiongame,24,/r/wallstreetbets/comments/mb08an/trying_to_time_a_tsla_trade/grvqr19/,0.0,0.873,0.127,0.3919
10,TSLA," Very funny, but in my opinion TSLA is the number 1 undervalued stock. Mark my words, if no reverse split happens again one day far from now it will be the new BRk.A",BudYzer308,10,/r/wallstreetbets/comments/mb08an/trying_to_time_a_tsla_trade/grvqzkg/,0.079,0.82,0.1,-0.0653
11,GME," It's not hard if you are long like I am.  When it's down a little bit, ignore it.  They have a really shitty day, buy some more shares.  Really good day, hold strong like it's GME.  Don't even think about selling.",BeerJunky,6,/r/wallstreetbets/comments/mb08an/trying_to_time_a_tsla_trade/grvzx0o/,0.118,0.581,0.301,0.8142
12,TSLA," TSLA is out of this world and now they got xxx (had to self censor,  this bot is a real retard) on the spaceship, highest volatility known to human kind of a SP500 stock incoming in ...",BenFueller,8,/r/wallstreetbets/comments/mb08an/trying_to_time_a_tsla_trade/grvif5l/,0.081,0.919,0.0,-0.4588
13,GME, I aspire to be in GME or TSLA.,ZippZappZippty,3,/r/wallstreetbets/comments/mb08an/trying_to_time_a_tsla_trade/grvplqe/,0.0,1.0,0.0,0.0
14,TSLA, I aspire to be in GME or TSLA.,ZippZappZippty,3,/r/wallstreetbets/comments/mb08an/trying_to_time_a_tsla_trade/grvplqe/,0.0,1.0,0.0,0.0
15,GME," After all the rush and drama with GME, I had completely forgotten that I was waiting to catch a couple bits of Tesla...

Next year I guess...",mythrilcrafter,3,/r/wallstreetbets/comments/mb08an/trying_to_time_a_tsla_trade/grwwe4c/,0.091,0.909,0.0,-0.2944
16,GME," Bring back good ol’ TSLA. Time for GME to retire, for now.",J0n73,7,/r/wallstreetbets/comments/mb08an/trying_to_time_a_tsla_trade/grwc5g1/,0.0,0.791,0.209,0.4404
17,TSLA," Bring back good ol’ TSLA. Time for GME to retire, for now.",J0n73,7,/r/wallstreetbets/comments/mb08an/trying_to_time_a_tsla_trade/grwc5g1/,0.0,0.791,0.209,0.4404
18,TSLA," https://www.tradingview.com/chart/TSLA/fRQnwYQW-TSLA/ nobody has timed a TSLA short better than this one, literally called the biggest drop in tesla history from top to bottom.... Go ahead press play and see for yourself!",sparechange09,2,/r/wallstreetbets/comments/mb08an/trying_to_time_a_tsla_trade/grvz8h3/,0.059,0.733,0.208,0.6476
19,TSLA, I have a whopping 1 share of TSLA. Big baller over here.,Dougdahead,2,/r/wallstreetbets/comments/mb08an/trying_to_time_a_tsla_trade/grvzjes/,0.0,0.784,0.216,0.296
20,TSLA, I was one of the lucky ones. Bought 10 shares at $710 before it split. It split and thus I have 50 shares and it went up to $900. Still holding those 50 shares. TSLA to the moon!,Claude9777,2,/r/wallstreetbets/comments/mb08an/trying_to_time_a_tsla_trade/grwyrjs/,0.0,0.768,0.232,0.8268
21,TSLA, Bought TSLA for the first time at the 570 dip. Me and my two shares are happy,GlacialFox,3,/r/wallstreetbets/comments/mb08an/trying_to_time_a_tsla_trade/grwplw2/,0.0,0.718,0.282,0.7096
22,GME, Wow a non GME meme on the WSB front page? Feels nice.,felixthecatmeow,2,/r/wallstreetbets/comments/mb08an/trying_to_time_a_tsla_trade/grw2g5t/,0.0,0.577,0.423,0.765
23,GME, 35k upvotes and not a single gold award. GME must be down today. Smh,RADIO02118,1,/r/wallstreetbets/comments/mb08an/trying_to_time_a_tsla_trade/grwffkj/,0.319,0.681,0.0,-0.631
24,TSLA, TSLA is over valued. Change my mind.,dan36920,-8,/r/wallstreetbets/comments/mb08an/trying_to_time_a_tsla_trade/grvci9f/,0.0,0.674,0.326,0.4404
25,TSLA, Now I've never lost a cent on TSLA.... But the amount of cash I've missed is just ridiculous.....,RidDlevVrathh,1,/r/wallstreetbets/comments/mb08an/trying_to_time_a_tsla_trade/grwp9yg/,0.115,0.783,0.102,-0.0613
26,GME, Tesla is like an expensive GME right now.,gdavis23,-1,/r/wallstreetbets/comments/mb08an/trying_to_time_a_tsla_trade/grwl8ac/,0.0,0.737,0.263,0.3612
27,TSLA, If you guys were to put in a buy limit order for TSLA what price would you set it at?,Spiritual-Pizza2021,1,/r/wallstreetbets/comments/mb08an/trying_to_time_a_tsla_trade/grvrd7b/,0.0,1.0,0.0,0.0
28,TSLA," There are two ways to make money on TSLA
1. Buy low sell high
2. Buy and hold",portfoliogoat,1,/r/wallstreetbets/comments/mb08an/trying_to_time_a_tsla_trade/grvxs5m/,0.11,0.89,0.0,-0.2732
29,TSLA, My first put was on TSLA and somehow I sold at the YTD low. I may have exhausted my luck for the year.,Merovingian_M,87,/r/wallstreetbets/comments/mb08an/trying_to_time_a_tsla_trade/grvkxmj/,0.18,0.703,0.117,-0.1531
30,GME," Which Wendy’s are you working behind, my wife has been at her boyfriends house lately due to GME and my hand is worn out",Biegzy4444,36,/r/wallstreetbets/comments/mb08an/trying_to_time_a_tsla_trade/grvqk6g/,0.08,0.803,0.117,0.25
31,GME," I made 600% on GME and successfully shorted (ok it was a call credit spread suck my left nut, I’m poor) TSLA. Accepting applications to allow people to be my clients as a money manager.

I mean we can ignore the three times I’ve blown my account up this year FOMOing wildly and gambling but fuck off I did two grail-tier plays and I’m satisfied with that.",DaFountain98,4,/r/wallstreetbets/comments/mb08an/trying_to_time_a_tsla_trade/grw946i/,0.113,0.709,0.178,0.4404
32,TSLA," I made 600% on GME and successfully shorted (ok it was a call credit spread suck my left nut, I’m poor) TSLA. Accepting applications to allow people to be my clients as a money manager.

I mean we can ignore the three times I’ve blown my account up this year FOMOing wildly and gambling but fuck off I did two grail-tier plays and I’m satisfied with that.",DaFountain98,4,/r/wallstreetbets/comments/mb08an/trying_to_time_a_tsla_trade/grw946i/,0.113,0.709,0.178,0.4404
33,FSD," Musk will OD and be hospitalized in June, but by July 1st he will have recovered and announced that while tripping he figured out how to make FSD actually work and it's going live in 24 hours.",HorseApple,19,/r/wallstreetbets/comments/mb08an/trying_to_time_a_tsla_trade/grvr8mg/,0.0,1.0,0.0,0.0
34,GME," Thought I was in a GME thread for a second. Did a double take, haha.",sorites,2,/r/wallstreetbets/comments/mb08an/trying_to_time_a_tsla_trade/grvrnsf/,0.0,0.769,0.231,0.4588
35,BYND," You should ask me about the peaks. I bought QS at 120, BYND at 210 and TSLA at 879.",v_snax,2,/r/wallstreetbets/comments/mb08an/trying_to_time_a_tsla_trade/grwgwya/,0.0,1.0,0.0,0.0
36,QS," You should ask me about the peaks. I bought QS at 120, BYND at 210 and TSLA at 879.",v_snax,2,/r/wallstreetbets/comments/mb08an/trying_to_time_a_tsla_trade/grwgwya/,0.0,1.0,0.0,0.0
37,TSLA," You should ask me about the peaks. I bought QS at 120, BYND at 210 and TSLA at 879.",v_snax,2,/r/wallstreetbets/comments/mb08an/trying_to_time_a_tsla_trade/grwgwya/,0.0,1.0,0.0,0.0
38,GME, I’m in on GME but I’m done with GME on this thread,ProfessionalExpert70,2,/r/wallstreetbets/comments/mb08an/trying_to_time_a_tsla_trade/grvz6ww/,0.0,1.0,0.0,0.0
39,TSLA," Definitely have some mad Stockholm Syndrome towards TSLA. Been making a killing off of them but man, when they fuck you they go deep.",thetrooper424,1,/r/wallstreetbets/comments/mb08an/trying_to_time_a_tsla_trade/grvs76e/,0.314,0.625,0.061,-0.8271
40,TSLA, China gave TSLA sooo many breaks worth billions to help build giga Shanghai. Tesla is not just an app like Uber. It now has serious manufacturing infrastructure in China. They’re not going anywhere imo.,RADIO02118,4,/r/wallstreetbets/comments/mb08an/trying_to_time_a_tsla_trade/gry685y/,0.034,0.781,0.185,0.7003
41,TSLA," Wait, you mean TSLA that was $80 a year ago? Overvalued at $700 you say? I don't know man. So while agree with you didn't Cathie Wood just go long on it?",jerkITwithRIGHTYnewb,9,/r/wallstreetbets/comments/mb08an/trying_to_time_a_tsla_trade/grvdpy4/,0.0,0.897,0.103,0.5136
42,TSLA, Cuz the video showed TSLA escaping the bears,justin_144,4,/r/wallstreetbets/comments/mb08an/trying_to_time_a_tsla_trade/grwdk41/,0.0,0.854,0.146,0.0516
43,TSLA," If I buy PUTs, TSLA hoes up. If bought calls, it goes down. Now I buy both call and put at the same strike, lose money on both most of the time.",tragicb0t,93,/r/wallstreetbets/comments/mb08an/trying_to_time_a_tsla_trade/grvqonx/,0.13,0.87,0.0,-0.4939
44,GME," I bought TSLA at 610 and sold GME at 300.  Which would be a respectable flex, if I wasn't down $9k on GME for a month and just now breaking even.",dllemmr2,5,/r/wallstreetbets/comments/mb08an/trying_to_time_a_tsla_trade/grwpsp4/,0.0,0.9,0.1,0.4404
45,TSLA," I bought TSLA at 610 and sold GME at 300.  Which would be a respectable flex, if I wasn't down $9k on GME for a month and just now breaking even.",dllemmr2,5,/r/wallstreetbets/comments/mb08an/trying_to_time_a_tsla_trade/grwpsp4/,0.0,0.9,0.1,0.4404
46,TSLA," The analyst who called the largest drop in TSLAs history called that price to come back and haunt elonk you must have seen it..... Both bear cases outlined in the chart actually point near low 400s..... (o.0) but point to the very strong trend for the long term
 https://www.tradingview.com/chart/TSLA/kpW80nmZ-TSLA-MAJOR-TECHNICAL-SCENARIOS-PICK-YOUR-HORSE/",sparechange09,2,/r/wallstreetbets/comments/mb08an/trying_to_time_a_tsla_trade/grw1w8h/,0.09,0.821,0.089,0.4478
47,FSD," I first read that as ""it's going TO live in 24 hours"" and I had to re read the whole thing over wondering what FSD was an acronym for",mcmulk98,2,/r/wallstreetbets/comments/mb08an/trying_to_time_a_tsla_trade/grwdfia/,0.0,1.0,0.0,0.0
48,GME," Well, if it means anything, i just imagined GME instead of TSLA",acesfullcoop,81,/r/wallstreetbets/comments/mb08an/trying_to_time_a_tsla_trade/grvia5x/,0.0,0.826,0.174,0.2732
49,TSLA," Well, if it means anything, i just imagined GME instead of TSLA",acesfullcoop,81,/r/wallstreetbets/comments/mb08an/trying_to_time_a_tsla_trade/grvia5x/,0.0,0.826,0.174,0.2732
50,TSLA," Yeah. I can understand the pain there. Even if you reduce risk and give yourself flexibility to time things by selling earlier prior to expiration, you're potentially missing out on a lot of gains.. and if you don't hold out for the big gains, then maybe you're not adequately compensating for your losses on bad bets.

Also, TSLA spent an awfully long time hovering around the (pre-split) $300 mark. I was there, and I didn't know when it was going to break out.. and after waiting so long, I'd become cynical and was incredulous that the rest of the market would jump on board and take it to where it belonged prior to seeing the actual returns (but they did, and I didn't anticipate the extent of it).",NewFolgers,7,/r/wallstreetbets/comments/mb08an/trying_to_time_a_tsla_trade/grvtxjb/,0.119,0.83,0.051,-0.8555
51,TSLA," For timing TSLA dips, it was mostly just that I hit a point where I really hit a ""Seriously? Wtf. This is sooo out of whack that I just can't even stand it anymore."" and then I buy. I suspect that other people hit that point at the same time for whatever reason. Importantly, I never waited to see any upward movement or trend. It was specifically because it had gone down beyond all reason, in my view.

Tbh, I haven't known what to make of Tesla's valuation post-split. Now I don't own as much of it as I used to (see? I screwed this part up!), but I have faith that it's a good long-term hold due to their vision, competence, machine learning prowess (underestimated by most in some respects).. and continued ability to to attract the best who are pursuing the best at a greater rate than others can match.",NewFolgers,20,/r/wallstreetbets/comments/mb08an/trying_to_time_a_tsla_trade/grvo84e/,0.038,0.759,0.203,0.9837
52,TSLA, This. TSLA $700 4/9 will priiiiint.,omertaproject,5,/r/wallstreetbets/comments/mb08an/trying_to_time_a_tsla_trade/grw7pa9/,0.0,1.0,0.0,0.0
53,TSLA," “Buying puts” would be a kindness compared to the pain I suffered straight shorting TSLA last year. I’m no bitch. A bitch buys puts. I wheel my nuts around in a wheelbarrow. And in that instance, those nuts got beemed up by papa Musk and taken straight to Mars.",Tobytime34,69,/r/wallstreetbets/comments/mb08an/trying_to_time_a_tsla_trade/grvnx27/,0.339,0.551,0.11,-0.9337
54,GME, Every ticker is reading GME for me,AnotherWhiteSheep,28,/r/wallstreetbets/comments/mb08an/trying_to_time_a_tsla_trade/grvjnsb/,0.0,1.0,0.0,0.0
55,TSLA, Hey. It’s TSLA. Anything can happen. Might get lucky and the market will price in good numbers early,RADIO02118,3,/r/wallstreetbets/comments/mb08an/trying_to_time_a_tsla_trade/grw3tu1/,0.0,0.737,0.263,0.6908
56,TSLA," I believe this is more of a TSLA thing. TSLA seems to be almost cyclical. It will go up 50 - 100 over a week, then back down to the original spot. Don't expect TSLA to keep going, just take the profits, wait for it to come back down, repeat",purplepeople321,78,/r/wallstreetbets/comments/mb08an/trying_to_time_a_tsla_trade/grviq51/,0.0,0.894,0.106,0.6369
57,HT," Lol thats just incorrect. Flip a coin twice and theres 4 outcomes; HH, HT, TH, TT. So the desired outcome is 1/4.",vincent3878,5,/r/wallstreetbets/comments/mb08an/trying_to_time_a_tsla_trade/grwi0ft/,0.0,0.777,0.223,0.6344
58,TH," Lol thats just incorrect. Flip a coin twice and theres 4 outcomes; HH, HT, TH, TT. So the desired outcome is 1/4.",vincent3878,5,/r/wallstreetbets/comments/mb08an/trying_to_time_a_tsla_trade/grwi0ft/,0.0,0.777,0.223,0.6344
59,TT," Lol thats just incorrect. Flip a coin twice and theres 4 outcomes; HH, HT, TH, TT. So the desired outcome is 1/4.",vincent3878,5,/r/wallstreetbets/comments/mb08an/trying_to_time_a_tsla_trade/grwi0ft/,0.0,0.777,0.223,0.6344
60,TSLA," It's funny because comments like this reminds me of Enron, then again I have 80% of my retirement money in TSLA on my boomer portfolio so I do hope it doesn't end up like Enron. Not again.",MUPleasFlyAgain,30,/r/wallstreetbets/comments/mb08an/trying_to_time_a_tsla_trade/grvj71o/,0.0,0.737,0.263,0.8773
61,TSLA," Yes what this guy said, cyclical. I just notice patterns and they work on TSLA. after it's been beat up for a bit throw calls at it. I day trade them because my risk tolerance is low at the moment. I always exited early this year. Last year I always exited too late. The main thing I aim for is to catch volume spikes either on red days or green days it doesn't matter because when the volume is there it's going to rip. So if it plummeted, it's almost certain there's going to be a rip later that day. I usually buy the call and look for it to go profitable ASAP so I can have cushion. Up 10%-20% in the first 15-20 minutes? I keep holding. If I'm hanging on for half an hour and it keeps dancing around negatives I just sell it. The rallies are strong and decisive the dips bleed you dry waiting for that rip. Then rinse and repeat. Also another rule: no puts. It's more likely for tsla to go up than down. So just time the calls. u/pm_me_secret_nudes",Butthole--pleasures,45,/r/wallstreetbets/comments/mb08an/trying_to_time_a_tsla_trade/grvo3dj/,0.04,0.881,0.079,0.8091
62,ICE," They would be hard pressed to build an EV that isn't safer than an ICE. It's going to inherently have the lowest rollover chance of any production truck because of the battery low center of gravity. 

They'd have to fuck up a lot of things for the rest of the crash test to not follow suit. Safety track record with their existing fleet has built my confidence in them pulling this off.

We will probably see a few thousand hit the road by end of year with the real production ramp in 2022",nowwhatnapster,1,/r/wallstreetbets/comments/mb08an/trying_to_time_a_tsla_trade/grvk7is/,0.163,0.786,0.051,-0.8646
63,TSLA," >Tesla isn’t just a car manufacturing company

Well they also do clean energy storage/production but that's it, let's be honest; people buy TSLA because it's Elon's only company that's on the market. You want Starlink/Boring/SpaceX? You can only buy TSLA. People will obviously diversify further as more of his companies go IPO/SPAC/direct listing, but now all you can buy is TSLA. The only way for TSLA to sustain its insane stock market growth is if **TSLA the company** owns shares in all of them, because their growth will affect TSLA too. Kinda like how Porsche is also affected by VW taking off. TSLA is priced in for at least the next 5-10 years, but bull market is permanent so reality and the f word don't matter.",MUPleasFlyAgain,1,/r/wallstreetbets/comments/mb08an/trying_to_time_a_tsla_trade/grvt3e3/,0.046,0.79,0.164,0.9403
64,TSLA," For me it was 2 cycles of buying at a top out and watching it drop down fairly quick. I was buying high, selling low thinking ""Oh I must have missed something"" I took time before entering again after exiting the 2nd time and saw it would go 650 -> 750 -> 650 -> 750. Seems like clockwork, and a decent bet. Of course news can affect the pricing, but it seems to still remain cyclical. Same pattern at a different price point. I've been watching TSLA for probably 8 months.",purplepeople321,12,/r/wallstreetbets/comments/mb08an/trying_to_time_a_tsla_trade/grvymq3/,0.055,0.909,0.037,-0.1406
65,AMZN," That is why you throw your ROTH IRA money fully into TSLA, AMZN, GOOGL and ignore it until you retire in 20 years time",MUPleasFlyAgain,14,/r/wallstreetbets/comments/mb08an/trying_to_time_a_tsla_trade/grvrhbk/,0.098,0.902,0.0,-0.3612
66,GOOGL," That is why you throw your ROTH IRA money fully into TSLA, AMZN, GOOGL and ignore it until you retire in 20 years time",MUPleasFlyAgain,14,/r/wallstreetbets/comments/mb08an/trying_to_time_a_tsla_trade/grvrhbk/,0.098,0.902,0.0,-0.3612
67,TSLA," That is why you throw your ROTH IRA money fully into TSLA, AMZN, GOOGL and ignore it until you retire in 20 years time",MUPleasFlyAgain,14,/r/wallstreetbets/comments/mb08an/trying_to_time_a_tsla_trade/grvrhbk/,0.098,0.902,0.0,-0.3612
68,TSLA," He said not 3 comments up that he 'straight shorted' TSLA, so not writing calls",bigd203,3,/r/wallstreetbets/comments/mb08an/trying_to_time_a_tsla_trade/grx6kis/,0.0,0.872,0.128,0.2263
69,MSFT," >Not holding MSFT

>ishygddt",Cantrmbrmyoldpass,1,/r/wallstreetbets/comments/mb08an/trying_to_time_a_tsla_trade/grvxg7o/,0.0,1.0,0.0,0.0
70,GME," Dearest Clementine, I’m writing you once again from the frontlines of GME. Our battalion had been fighting for months, morale is up but the constant early mornings of staring at a ticker have made my body grow tired and weary. Tell the kids I love them, and Daddy says “hodl”. We’re fighting the good fight.",broken_radio,809,/r/wallstreetbets/comments/mbdncf/gme_megathread_for_march_23_2021/grxexqx/,0.207,0.626,0.166,-0.2382
71,GME," Bruh I'm so sick of my one retarded friend who thinks he's hot stuff from buying GME at $40, **but can't stop fucking asking if he should sell when it dips barely a few dollars**. I know you're reading this Xander, shut the fuck up and turn off your app you dumb bitch.",MUPleasFlyAgain,2141,/r/wallstreetbets/comments/mbdncf/gme_megathread_for_march_23_2021/grxka5u/,0.274,0.651,0.075,-0.9377
72,LOVE," Lvl 2 data right now, I see 1 share for sale for 1,000,000.


LOVE it",fungusm,1044,/r/wallstreetbets/comments/mbdncf/gme_megathread_for_march_23_2021/grx8m79/,0.0,0.584,0.416,0.7983
73,GME, Mom says dad will come home if GME closes on $250 today,oldbutterface,1032,/r/wallstreetbets/comments/mbdncf/gme_megathread_for_march_23_2021/grxe3m1/,0.0,1.0,0.0,0.0
74,GME," GME down 12%

Me: This is fine, no big deal.

GME shows a single green candle

Me: IT IS HAPPENING!",N3dFl4nd3r5,192,/r/wallstreetbets/comments/mbdncf/gme_megathread_for_march_23_2021/grxlm37/,0.117,0.798,0.085,-0.1759
75,IT," GME down 12%

Me: This is fine, no big deal.

GME shows a single green candle

Me: IT IS HAPPENING!",N3dFl4nd3r5,192,/r/wallstreetbets/comments/mbdncf/gme_megathread_for_march_23_2021/grxlm37/,0.117,0.798,0.085,-0.1759
76,GME," Welcome to becoming a part of the historybooks.

1.	⁠Pressure makes diamonds.
2.	⁠It is not a sprint it is a marathon.

GME to the MOON

📈🚀🌕",BriskaN,156,/r/wallstreetbets/comments/mbdncf/gme_megathread_for_march_23_2021/grxxatv/,0.0,0.885,0.115,0.4588
77,GME," #CNBC: Reddit no more affects the direction of GME
You will regret this",kingofthecream,146,/r/wallstreetbets/comments/mbdncf/gme_megathread_for_march_23_2021/grxv2ay/,0.312,0.688,0.0,-0.6124
78,GME, My boss just brought me a roll of toilet paper for the one-year anniversary of the covid shut down at our office.  Told him to take that toilet paper and his paperhanded ass out of my office and go buy some damn GME instead of toilet paper,concert_junkie,130,/r/wallstreetbets/comments/mbdncf/gme_megathread_for_march_23_2021/grxi6lq/,0.124,0.876,0.0,-0.7351
79,HUGE," Posting again for anyone who didn't see it before, because to me **this is HUGE. AND BULLISH AF.**

Fidelity posted this article this morning:

[From pet food to video games: inside Ryan Cohen's GameStop obsession](https://www.fidelity.com/news/article/top-news/202103230704RTRSNEWSCOMBINED_KBN2BF1AS-OUSBS_1)

&#x200B;

Edit: Actually Reuters posted it and Fidelity crossposted (even better)",Sar7814,669,/r/wallstreetbets/comments/mbdncf/gme_megathread_for_march_23_2021/grxjz5d/,0.0,0.937,0.063,0.4648
80,GME, If GME hits 50k I'll deliver my letter of resignation via meatspin propulsion,Swathe88,1987,/r/wallstreetbets/comments/mbdncf/gme_megathread_for_march_23_2021/grxbtvr/,0.155,0.845,0.0,-0.296
81,ARE," THE LONGER THEY EDGE US THE BIGGER THE NUT!!!!!

IDK ABOUT YALL BUT MY NUTS ARE SWOLLEN💦💦",Pdawg0990,295,/r/wallstreetbets/comments/mbdncf/gme_megathread_for_march_23_2021/grx9655/,0.262,0.738,0.0,-0.6506
82,GME, 100% GME gang checking in to remind you to upvote the thread,robbb_24,231,/r/wallstreetbets/comments/mbdncf/gme_megathread_for_march_23_2021/grxe3nw/,0.0,1.0,0.0,0.0
83,BE," #TODAY GONNA BE ONE OF THOSE DAYS IT FUCKING SUCKS TO BE A HEDGE FUND WHO IS SHORT ON GME

#🚀🚀🚀🚀🚀🚀",G_Wash1776,459,/r/wallstreetbets/comments/mbdncf/gme_megathread_for_march_23_2021/grx74ou/,0.183,0.817,0.0,-0.6439
84,GME," #TODAY GONNA BE ONE OF THOSE DAYS IT FUCKING SUCKS TO BE A HEDGE FUND WHO IS SHORT ON GME

#🚀🚀🚀🚀🚀🚀",G_Wash1776,459,/r/wallstreetbets/comments/mbdncf/gme_megathread_for_march_23_2021/grx74ou/,0.183,0.817,0.0,-0.6439
85,IT," #TODAY GONNA BE ONE OF THOSE DAYS IT FUCKING SUCKS TO BE A HEDGE FUND WHO IS SHORT ON GME

#🚀🚀🚀🚀🚀🚀",G_Wash1776,459,/r/wallstreetbets/comments/mbdncf/gme_megathread_for_march_23_2021/grx74ou/,0.183,0.817,0.0,-0.6439
86,ONE," #TODAY GONNA BE ONE OF THOSE DAYS IT FUCKING SUCKS TO BE A HEDGE FUND WHO IS SHORT ON GME

#🚀🚀🚀🚀🚀🚀",G_Wash1776,459,/r/wallstreetbets/comments/mbdncf/gme_megathread_for_march_23_2021/grx74ou/,0.183,0.817,0.0,-0.6439
87,GME," Money for nothing, chicks for free. I WANT MY GME. 🚀",disneysinger,65,/r/wallstreetbets/comments/mbdncf/gme_megathread_for_march_23_2021/grxfvwr/,0.23,0.597,0.173,-0.1702
