,ticker,comment,username,score,permalink,neg,neu,pos,compound
390,PAVM," I'm in a bunch of risky Biotech stocks. I like MREO, PAVM, ONCT, SELB to name a few.",im-buster,1,/r/stocks/comments/mwzgik/does_anyone_in_this_sub_take_risks_or_is_everyone/gvlbehr/,0.104,0.751,0.145,0.1779
391,SELB," I'm in a bunch of risky Biotech stocks. I like MREO, PAVM, ONCT, SELB to name a few.",im-buster,1,/r/stocks/comments/mwzgik/does_anyone_in_this_sub_take_risks_or_is_everyone/gvlbehr/,0.104,0.751,0.145,0.1779
392,ORLA," I’ve got some ORLA. It’s a haunted goldmine or something. It goes up, it goes down. It’s kooky and it keeps everything else in perspective.
Down 23% today? That’s OK. Do your thing crazy stock.
I recommend it!",Draculasaurus13,1,/r/stocks/comments/mwzgik/does_anyone_in_this_sub_take_risks_or_is_everyone/gvlpms5/,0.134,0.74,0.126,-0.0923
393,AAPL, MSFT and AAPL seem quite overvalued by the P/S ratio when compared to their historical P/S averages.,Ahrideva,2,/r/stocks/comments/mwzgik/does_anyone_in_this_sub_take_risks_or_is_everyone/gvl8wgp/,0.0,1.0,0.0,0.0
394,MSFT, MSFT and AAPL seem quite overvalued by the P/S ratio when compared to their historical P/S averages.,Ahrideva,2,/r/stocks/comments/mwzgik/does_anyone_in_this_sub_take_risks_or_is_everyone/gvl8wgp/,0.0,1.0,0.0,0.0
395,DD," Most people on this sub say everything I'm invested in is a 'shill stock' that's why I made this post. I feel like people look at anything that isn't SPY and immediately come to the conclusion that it's a failed business model and will go to 0 with no other options, very pessimistic views.

If you wanna know why I'm invested in PLTR I'd just say do your own DD. I came to my own conclusion that at these prices, PLTR will likely do well.",Microtonal_Valley,1,/r/stocks/comments/mwzgik/does_anyone_in_this_sub_take_risks_or_is_everyone/gvlwbzm/,0.095,0.852,0.053,-0.5709
396,PLTR," Most people on this sub say everything I'm invested in is a 'shill stock' that's why I made this post. I feel like people look at anything that isn't SPY and immediately come to the conclusion that it's a failed business model and will go to 0 with no other options, very pessimistic views.

If you wanna know why I'm invested in PLTR I'd just say do your own DD. I came to my own conclusion that at these prices, PLTR will likely do well.",Microtonal_Valley,1,/r/stocks/comments/mwzgik/does_anyone_in_this_sub_take_risks_or_is_everyone/gvlwbzm/,0.095,0.852,0.053,-0.5709
397,COIN," I started in after a week of the ipo and I’ve been DCAing in slowly each day. Cost basis is a bit over 305. I’m very long term bullish on COIN so I really don’t care about price discovery. 

My goal is to get it to 100 shares fairly quickly. Wait a year, long term hold status, write calls use premium to buy more shares rinse and repeat.

I did this with Apple many years back and I’m up to over 1000 shares, want to try it with COIN.",AnonBoboAnon,3,/r/stocks/comments/mwzgik/does_anyone_in_this_sub_take_risks_or_is_everyone/gvl4xdr/,0.0,0.87,0.13,0.8639
398,MSFT, MSFT is also extremely diversified and have a near monopoly with Office 365,TuxSH,1,/r/stocks/comments/mwzgik/does_anyone_in_this_sub_take_risks_or_is_everyone/gvm1ikv/,0.0,1.0,0.0,0.0
399,MSFT, I think that is a great strategy. Hope it all works out well. I've never sold CCs and I want to look more into it. I almost did this with MSFT,Microtonal_Valley,1,/r/stocks/comments/mwzgik/does_anyone_in_this_sub_take_risks_or_is_everyone/gvl5a95/,0.0,0.689,0.311,0.8555
400,DD," That’s a personal choice my friend. Do your DD. Know your strategy and be consistent. There’s a lot of people on this sub that are wildly smarter than I and could go further in depth. 

Generic advice but important.",Oscarocket2,1,/r/stocks/comments/mwvomy/whats_a_realistic_timeline_on_the_ark_funds/gvkerwg/,0.0,0.84,0.16,0.6486
401,DD," From my limited experience they buy a ton.  Wait for it to cool down, pump it up to crazy heights through every penny forum, then sell and short it on the way down.  I’ve seen some good DD about how citadel did this to who knows how many pennies I’m January and February.  It’s easy money for them.  

If I see this I will buy, but sell on any type of down when it’s climbing fast.  Wait a few weeks and buy again if I like the company.  Because by then it’s usually back to where I originally bought.",Angry_Cupboard,-9,/r/stocks/comments/mwku6n/when_hedge_funds_purchase_into_a_stock/gvirwwm/,0.032,0.879,0.089,0.6858
402,GME," what does it mean that they

>buy both directions of every trade, hedging their bets

Are you saying that every ""hedge fund"" always buys both directions every time they trade a stock? (i.e. they buy GME long and GME short). How does that work?",HurryVegetable7915,-4,/r/stocks/comments/mwku6n/when_hedge_funds_purchase_into_a_stock/gvizjkf/,0.0,1.0,0.0,0.0
403,DD," Except the DD I read that I can’t find again that had 10 examples of them doing exactly this in a month.  3 million shares that go up 200% x however many pennies they did it to.  Plus the shorts on the way down.  All backed up by SEC filings. 

Wish I could find that DD but can’t cross link into this Reddit anyways.",Angry_Cupboard,1,/r/stocks/comments/mwku6n/when_hedge_funds_purchase_into_a_stock/gviubcm/,0.0,0.924,0.076,0.3612
404,LOVE," I LOVE WATCHING MY PORTFOLIO..... Lol. It's exciting, terrifying, I'm positive it's like having kids. Just without the poop and child support liability.",maxjosephwheeler,1,/r/stocks/comments/mx2ww6/checking_your_portfolio_multiple_times_a_day/gvlxmwr/,0.14,0.357,0.503,0.9353
405,AYX," I’ve used the product and it’s fine. But from people who use the latest and greatest, AYX is ancient. That’s not a good sign for them. Not to mention to run certain things within their instances can be super slow. I’d rather run code outside of AYX and bring in results than run the code within AYX.",lomoprince,4,/r/stocks/comments/mx1dxo/my_alteryx_ayx_dd_im_not_buying_this_dip/gvle0s3/,0.045,0.736,0.219,0.92
406,UI," Better tools in the market for data prep and simple modeling. Alteryx is clunky, the UI is meh.  Dataiku is better.",theta_gambler,2,/r/stocks/comments/mx1dxo/my_alteryx_ayx_dd_im_not_buying_this_dip/gvlk2if/,0.052,0.717,0.231,0.6705
407,AYX," I am recently long alteryx and have a different opinion.

1. Alteryx has just about the highest margins in the business - 90%+. Compare these to SNOW or PLTR or other data analysis companies, it’s not close.
2. I view Alteryx as a COVID recovery play. I don’t think companies have been recently eager to make big, transformational data analysis purchases
3. I think the possibility of a buyout is not unlikely 
4. While guidance has been soft in recent quarters, the company does consistently beat earnings expectations
5. Valuation. AYX has been profitable and can be so again. It’s currently trading at 10x revenues, which while not cheap, looks like a bargain compared to ~100x for SNOW or ~40x for PLTR, neither of which have shown profitability.",mcoclegendary,2,/r/stocks/comments/mx1dxo/my_alteryx_ayx_dd_im_not_buying_this_dip/gvlre6j/,0.017,0.891,0.092,0.822
408,PLTR," I am recently long alteryx and have a different opinion.

1. Alteryx has just about the highest margins in the business - 90%+. Compare these to SNOW or PLTR or other data analysis companies, it’s not close.
2. I view Alteryx as a COVID recovery play. I don’t think companies have been recently eager to make big, transformational data analysis purchases
3. I think the possibility of a buyout is not unlikely 
4. While guidance has been soft in recent quarters, the company does consistently beat earnings expectations
5. Valuation. AYX has been profitable and can be so again. It’s currently trading at 10x revenues, which while not cheap, looks like a bargain compared to ~100x for SNOW or ~40x for PLTR, neither of which have shown profitability.",mcoclegendary,2,/r/stocks/comments/mx1dxo/my_alteryx_ayx_dd_im_not_buying_this_dip/gvlre6j/,0.017,0.891,0.092,0.822
409,SNOW," I am recently long alteryx and have a different opinion.

1. Alteryx has just about the highest margins in the business - 90%+. Compare these to SNOW or PLTR or other data analysis companies, it’s not close.
2. I view Alteryx as a COVID recovery play. I don’t think companies have been recently eager to make big, transformational data analysis purchases
3. I think the possibility of a buyout is not unlikely 
4. While guidance has been soft in recent quarters, the company does consistently beat earnings expectations
5. Valuation. AYX has been profitable and can be so again. It’s currently trading at 10x revenues, which while not cheap, looks like a bargain compared to ~100x for SNOW or ~40x for PLTR, neither of which have shown profitability.",mcoclegendary,2,/r/stocks/comments/mx1dxo/my_alteryx_ayx_dd_im_not_buying_this_dip/gvlre6j/,0.017,0.891,0.092,0.822
410,IMO," I'm with you. I've used it, and it's ""okay."" Your thoughts on how ancient is feels is one of the key points of my hypothesis above, they don't spend nearly enough on R&D despite their huge margins. They're only focused on selling their existing ancient product.

Not good long term IMO.",Ouiju,2,/r/stocks/comments/mx1dxo/my_alteryx_ayx_dd_im_not_buying_this_dip/gvlecxt/,0.079,0.873,0.047,-0.1945
411,AYX," I’ve just found the use case isn’t that flexible. You have to find something you want to automate away and then spend time doing so with their platform. AYX is awful for ad hoc quick and dirty procedures, so I ended up using it for maybe 1 process? After trying to justify its use case for everything else I work on.",lomoprince,2,/r/stocks/comments/mx1dxo/my_alteryx_ayx_dd_im_not_buying_this_dip/gvlejjn/,0.094,0.856,0.051,-0.5719
412,MSCI," Just buy some MSCI world and emerging markets. Make it a 50/50 split and wait. It'll be a boring investment, but it'll do the job and not rob you of any time...",bmfb98,2,/r/stocks/comments/mwr7tt/what_to_do_to_set_my_2_year_old_nephew_and_niece/gvjse6v/,0.049,0.835,0.116,0.5
413,GME, I put it all in on GME at $360!,DS_Bridges_Road_Crew,2,/r/stocks/comments/mwr7tt/what_to_do_to_set_my_2_year_old_nephew_and_niece/gvl1msd/,0.0,1.0,0.0,0.0
414,IBM," I think would have come down considerably. UiPath is grossly overvalued at over 80 times sales. UK based RPA software company Blue Prism  is trading at $1.7B compared to UiPath $37B. Blue Prism has $200M revenues compared to UiPath $600M granted they have half the revenue growth rate over the last year. If you want to invest in RPA software consider looking at this foreign listing as the CEO is considering a US listing. Also they have many great customers, some are the same as UiPath. They include Google, Microsoft, KPMG, EY, Daimler, Seimens, 3M, EBay, IBM, Accenture, Fidelity & RBC.",Kashm11r,8,/r/stocks/comments/mwpvrl/ui_path_path_questions_on_ipos/gvjkcz6/,0.021,0.884,0.095,0.7806
415,RBC," I think would have come down considerably. UiPath is grossly overvalued at over 80 times sales. UK based RPA software company Blue Prism  is trading at $1.7B compared to UiPath $37B. Blue Prism has $200M revenues compared to UiPath $600M granted they have half the revenue growth rate over the last year. If you want to invest in RPA software consider looking at this foreign listing as the CEO is considering a US listing. Also they have many great customers, some are the same as UiPath. They include Google, Microsoft, KPMG, EY, Daimler, Seimens, 3M, EBay, IBM, Accenture, Fidelity & RBC.",Kashm11r,8,/r/stocks/comments/mwpvrl/ui_path_path_questions_on_ipos/gvjkcz6/,0.021,0.884,0.095,0.7806
416,UK," I think would have come down considerably. UiPath is grossly overvalued at over 80 times sales. UK based RPA software company Blue Prism  is trading at $1.7B compared to UiPath $37B. Blue Prism has $200M revenues compared to UiPath $600M granted they have half the revenue growth rate over the last year. If you want to invest in RPA software consider looking at this foreign listing as the CEO is considering a US listing. Also they have many great customers, some are the same as UiPath. They include Google, Microsoft, KPMG, EY, Daimler, Seimens, 3M, EBay, IBM, Accenture, Fidelity & RBC.",Kashm11r,8,/r/stocks/comments/mwpvrl/ui_path_path_questions_on_ipos/gvjkcz6/,0.021,0.884,0.095,0.7806
417,BP,"  
I third this, Blue Prism is also the pioneer of RPA. either UIPath is overvalued or Blue Prism in undervalued, probably because of low exposure to deep pocketed US investors. Given UIPath lofty valuation I'd say BP will list in US soon. They're trading OTC as of now $BPRMF.",solemnJoker,2,/r/stocks/comments/mwpvrl/ui_path_path_questions_on_ipos/gvjyonb/,0.043,0.957,0.0,-0.2732
418,MS," Automation Anywhere (yikes!).  
MS Power Automate",cariusQ,3,/r/stocks/comments/mwpvrl/ui_path_path_questions_on_ipos/gvkpzxq/,0.0,1.0,0.0,0.0
419,MSFT," Thanks, that’s helpful. I’ve read that Blue Prism has been losing a lot of steam lately and has lost its edge in large enterprise customers to UIPath and has had a lot of mgmt change to deal with it (time will tell if they can). Let’s not forget MSFT is pushing hard here. Is there any value of Blue Prism to potential acquirers or are they better of building something new?",legiondaryboom,1,/r/stocks/comments/mwpvrl/ui_path_path_questions_on_ipos/gvkg3y2/,0.079,0.763,0.158,0.7481
420,STPK, STPK merging with Stem which specialises in energy storage,icantbeassedman,3,/r/stocks/comments/mwv54g/corporate_funding_for_solar_surges_in_q1_but_vcs/gvkbu03/,0.0,0.792,0.208,0.2732
421,GNRC," I suspect that solar (EVP) and battery storage will both be strong going forward because not only are you protected from a power outage but also can store energy to sell back to your utility.  I expect such a tandem to impact nat gas generator companies like Generac and Kohler, although I'm still long GNRC.

Solar installers I've looked into offer Tesla and LG battery storage solutions but this is only anecdotal, not a comprehensive eval of what actually is being installed.

Forgot to add SPWR which  I'm long",iGotTheBlues_inBb,1,/r/stocks/comments/mwv54g/corporate_funding_for_solar_surges_in_q1_but_vcs/gvlq6br/,0.04,0.83,0.13,0.8095
422,SPWR," I suspect that solar (EVP) and battery storage will both be strong going forward because not only are you protected from a power outage but also can store energy to sell back to your utility.  I expect such a tandem to impact nat gas generator companies like Generac and Kohler, although I'm still long GNRC.

Solar installers I've looked into offer Tesla and LG battery storage solutions but this is only anecdotal, not a comprehensive eval of what actually is being installed.

Forgot to add SPWR which  I'm long",iGotTheBlues_inBb,1,/r/stocks/comments/mwv54g/corporate_funding_for_solar_surges_in_q1_but_vcs/gvlq6br/,0.04,0.83,0.13,0.8095
423,AC," NEOV. Neovolta. Micro cap that has some very good residential energy storage advantages. Safer battery chemistry, high capacity, works with all PV arrays and inverters, AC or DC. 

It’s speculative but interesting.",BlkCdr,1,/r/stocks/comments/mwv54g/corporate_funding_for_solar_surges_in_q1_but_vcs/gvlvxnf/,0.0,0.681,0.319,0.8473
424,PV," NEOV. Neovolta. Micro cap that has some very good residential energy storage advantages. Safer battery chemistry, high capacity, works with all PV arrays and inverters, AC or DC. 

It’s speculative but interesting.",BlkCdr,1,/r/stocks/comments/mwv54g/corporate_funding_for_solar_surges_in_q1_but_vcs/gvlvxnf/,0.0,0.681,0.319,0.8473
425,AMZN," I think keeping AMZN is a good idea. It’s stagnated in 2018-2019, and then suddenly surged, I think it’s gonna surge again in the next few months. My advice would be to hold it.
I have 3 shares of AMZN, I’m holding it.",Heraklion-Greece,16,/r/stocks/comments/mwfs6t/was_just_wondering_what_to_do_if_you_were_me/gvhvujn/,0.0,0.876,0.124,0.6249
426,AMZN," Amazon is increasing their infrastructure, hard as that is to believe, and pursuing likely profitable expansions like entering the pharmaceutical business.

There's every reason to believe AMZN will continue to increase in value and that belief is echoed by every analyst in existence. Numerous analysts recently upgraded AMZN to 3800-4200 price target territory in the mid-term.

I would hold Amazon.",dokka_doc,4,/r/stocks/comments/mwfs6t/was_just_wondering_what_to_do_if_you_were_me/gviej4k/,0.021,0.777,0.202,0.8779
427,AAPL," I also own AMZN, GOOG, MSFT and AAPL.  I'm assuming you maxed out your contributions to your Roth and that's why you're considering selling AMZN to fund the other purchases?

It's a tough call.  I still believe AMZN has a lot of room for growth in the 5-10 year timespan and I'm firmly holding onto my shares.

If Cathie Woods is to be believed, TSLA has a much larger potential gain based on her share price projection.  I'm hesitant to buy into TSLA right now because there are so many competitors coming into the EV market and new green tech companies are booming which could chip away at TSLA's other revenue streams.

NVDA is a stock that also has potential for growth but I haven't pulled the trigger on.  It just seems too volatile for my tastes.

TL;DR - I would hold AMZN for the time being if I were in your shoes.",turkeychicken,5,/r/stocks/comments/mwfs6t/was_just_wondering_what_to_do_if_you_were_me/gvhwisf/,0.019,0.92,0.061,0.6428
428,AMZN," I also own AMZN, GOOG, MSFT and AAPL.  I'm assuming you maxed out your contributions to your Roth and that's why you're considering selling AMZN to fund the other purchases?

It's a tough call.  I still believe AMZN has a lot of room for growth in the 5-10 year timespan and I'm firmly holding onto my shares.

If Cathie Woods is to be believed, TSLA has a much larger potential gain based on her share price projection.  I'm hesitant to buy into TSLA right now because there are so many competitors coming into the EV market and new green tech companies are booming which could chip away at TSLA's other revenue streams.

NVDA is a stock that also has potential for growth but I haven't pulled the trigger on.  It just seems too volatile for my tastes.

TL;DR - I would hold AMZN for the time being if I were in your shoes.",turkeychicken,5,/r/stocks/comments/mwfs6t/was_just_wondering_what_to_do_if_you_were_me/gvhwisf/,0.019,0.92,0.061,0.6428
429,GOOG," I also own AMZN, GOOG, MSFT and AAPL.  I'm assuming you maxed out your contributions to your Roth and that's why you're considering selling AMZN to fund the other purchases?

It's a tough call.  I still believe AMZN has a lot of room for growth in the 5-10 year timespan and I'm firmly holding onto my shares.

If Cathie Woods is to be believed, TSLA has a much larger potential gain based on her share price projection.  I'm hesitant to buy into TSLA right now because there are so many competitors coming into the EV market and new green tech companies are booming which could chip away at TSLA's other revenue streams.

NVDA is a stock that also has potential for growth but I haven't pulled the trigger on.  It just seems too volatile for my tastes.

TL;DR - I would hold AMZN for the time being if I were in your shoes.",turkeychicken,5,/r/stocks/comments/mwfs6t/was_just_wondering_what_to_do_if_you_were_me/gvhwisf/,0.019,0.92,0.061,0.6428
430,MSFT," I also own AMZN, GOOG, MSFT and AAPL.  I'm assuming you maxed out your contributions to your Roth and that's why you're considering selling AMZN to fund the other purchases?

It's a tough call.  I still believe AMZN has a lot of room for growth in the 5-10 year timespan and I'm firmly holding onto my shares.

If Cathie Woods is to be believed, TSLA has a much larger potential gain based on her share price projection.  I'm hesitant to buy into TSLA right now because there are so many competitors coming into the EV market and new green tech companies are booming which could chip away at TSLA's other revenue streams.

NVDA is a stock that also has potential for growth but I haven't pulled the trigger on.  It just seems too volatile for my tastes.

TL;DR - I would hold AMZN for the time being if I were in your shoes.",turkeychicken,5,/r/stocks/comments/mwfs6t/was_just_wondering_what_to_do_if_you_were_me/gvhwisf/,0.019,0.92,0.061,0.6428
431,NVDA," I also own AMZN, GOOG, MSFT and AAPL.  I'm assuming you maxed out your contributions to your Roth and that's why you're considering selling AMZN to fund the other purchases?

It's a tough call.  I still believe AMZN has a lot of room for growth in the 5-10 year timespan and I'm firmly holding onto my shares.

If Cathie Woods is to be believed, TSLA has a much larger potential gain based on her share price projection.  I'm hesitant to buy into TSLA right now because there are so many competitors coming into the EV market and new green tech companies are booming which could chip away at TSLA's other revenue streams.

NVDA is a stock that also has potential for growth but I haven't pulled the trigger on.  It just seems too volatile for my tastes.

TL;DR - I would hold AMZN for the time being if I were in your shoes.",turkeychicken,5,/r/stocks/comments/mwfs6t/was_just_wondering_what_to_do_if_you_were_me/gvhwisf/,0.019,0.92,0.061,0.6428
432,TSLA," I also own AMZN, GOOG, MSFT and AAPL.  I'm assuming you maxed out your contributions to your Roth and that's why you're considering selling AMZN to fund the other purchases?

It's a tough call.  I still believe AMZN has a lot of room for growth in the 5-10 year timespan and I'm firmly holding onto my shares.

If Cathie Woods is to be believed, TSLA has a much larger potential gain based on her share price projection.  I'm hesitant to buy into TSLA right now because there are so many competitors coming into the EV market and new green tech companies are booming which could chip away at TSLA's other revenue streams.

NVDA is a stock that also has potential for growth but I haven't pulled the trigger on.  It just seems too volatile for my tastes.

TL;DR - I would hold AMZN for the time being if I were in your shoes.",turkeychicken,5,/r/stocks/comments/mwfs6t/was_just_wondering_what_to_do_if_you_were_me/gvhwisf/,0.019,0.92,0.061,0.6428
433,AMZN," AMZN is a strong growth business, and is trading below value by many estimates. It would be foolish to sell it unless you are looking for high risk gambles.",xlynx,2,/r/stocks/comments/mwfs6t/was_just_wondering_what_to_do_if_you_were_me/gvk1atf/,0.118,0.648,0.234,0.6249
434,DD, Appreciate the DD. Thank you for your answer.,SeanEazy,2,/r/stocks/comments/mwfs6t/was_just_wondering_what_to_do_if_you_were_me/gvih6bj/,0.0,0.536,0.464,0.6369
435,GOOG," I'm actually adding more funds weekly. It's cool that we're identical.

I actually have 1 of each of Google. GOOG and GOOGL",SeanEazy,2,/r/stocks/comments/mwfs6t/was_just_wondering_what_to_do_if_you_were_me/gvhwvq8/,0.0,0.892,0.108,0.3182
436,GOOGL," I'm actually adding more funds weekly. It's cool that we're identical.

I actually have 1 of each of Google. GOOG and GOOGL",SeanEazy,2,/r/stocks/comments/mwfs6t/was_just_wondering_what_to_do_if_you_were_me/gvhwvq8/,0.0,0.892,0.108,0.3182
437,GOOG," From an investment point of view, what's the advantage of one versus the other between GOOG and GOOGL?",bread-meister,2,/r/stocks/comments/mwfs6t/was_just_wondering_what_to_do_if_you_were_me/gviprwr/,0.0,0.895,0.105,0.25
438,SPGI," I'm looking at/watching QQQ, VGT, SPYG mainly. Also possibly some FAN/TAN, even SPGI",SpaceFan13,2,/r/stocks/comments/mwfs6t/was_just_wondering_what_to_do_if_you_were_me/gvi828s/,0.0,1.0,0.0,0.0
439,NVDA," I think NVDA triples in the next 5 years and is posturing to be an industry leader in some absolutely massive markets (AI?). Market cap 380M

Amazon is solid but simply doesn't have as much growth potential. Market cap 1.7T

Seems glaringly obvious to me. Also I dislike Jeff Bezos",Grymninja,1,/r/stocks/comments/mwfs6t/was_just_wondering_what_to_do_if_you_were_me/gvivqw3/,0.065,0.82,0.115,0.1655
440,MSFT, MSFT to the moon!,LegendLarrynumero1,2,/r/stocks/comments/mwfs6t/was_just_wondering_what_to_do_if_you_were_me/gvi3apn/,0.0,1.0,0.0,0.0
441,NOW, HEY BITCH HOW DUMB THIS LOOK NOW.,MammothMethod8417,1,/r/stocks/comments/mwfs6t/was_just_wondering_what_to_do_if_you_were_me/gvlo2hv/,0.587,0.413,0.0,-0.7964
442,BOOM," Discord decided to go public on their own.

Microsoft is going to double their dividend instead.
 
BOOM",LegendLarrynumero1,3,/r/stocks/comments/mwfs6t/was_just_wondering_what_to_do_if_you_were_me/gvi3phx/,0.144,0.856,0.0,-0.4019
443,OR," There's a lot to go over here so I'll answer the easy questions. Yes, you can contribute $6K to your Roth IRA every year. Your money that you will contribute to it has already BEEN taxed (the way you wrote it makes it seem like you think you will specifically be taxed when you add it). Yes, you can pull out your contributions (but not the gains) without penalty.

Regarding order of contributions: Yes, it's great that you are getting the full employer match for the 401K. Yes, I would then max out the Roth IRA. And after that, you can either contribute more to your 401K for the tax advantage (but keep in mind that money cannot be touched until 60) OR you can put it in a taxable account instead (the advantage there is you can pull out the money whenever).",bigboybuckeyenuts,5,/r/stocks/comments/mwml9t/roth_ira_guidance/gvj3grj/,0.0,0.829,0.171,0.9744
