,ticker,comment,username,score,permalink,neg,neu,pos,compound
238,RESN, I purchased RESN this morning. I am small potatoes so only 20 shares @ 3.46. One of my first purchases on the recommendation of a TipRanks Analyst on Etrade. Rated a strong buy. Will see how it goes.,kyleharveybooks,1,/r/stocks/comments/mwrgv5/rstocks_daily_discussion_fundamentals_friday_apr/gvkfbo4/,0.0,0.843,0.157,0.6969
239,DD," Highly recommend looking at $PERI (Perion Networks) before their earnings on May 4th. Extremely good value, oversold and very undervalued. They are expecting a minimum 31% YoY growth, but if it’s like Q4, they will see > 50% YoY. Company should be valued around $2-3B if you consider the valuations of their competitors, but it’s sitting at $500M. Great hidden gem.

You can search some DD on this subreddit for more info, although it might be a bit outdated. 40% of my portfolio is in $PERI right now as I expect them to pop in the next week. Maybe even 2-5x in value by EoY.",Cyrusis,1,/r/stocks/comments/mwrgv5/rstocks_daily_discussion_fundamentals_friday_apr/gvkfke6/,0.0,0.796,0.204,0.9716
240,KKR, Thoughts on KKR or PATH?,Im-Yer-Huckleberry,1,/r/stocks/comments/mwrgv5/rstocks_daily_discussion_fundamentals_friday_apr/gvkk8n6/,0.0,1.0,0.0,0.0
241,EM," Liquidate everything! This is the big one! All investment is moving overseas! I’m buying gold, crypto, and EM funds! /s",notherday11,9,/r/stocks/comments/mwrgv5/rstocks_daily_discussion_fundamentals_friday_apr/gvkhrb5/,0.0,1.0,0.0,0.0
242,BAM," Yesterday also shows just how volatile the market is right now. We seemed to be in for a good day until that announcement and BAM market spirals down. There's a few positions I am bag holding that I want to get out of. Once I get out of them, I'm long for the rest and going to take a break for a while.",New_Hedgehog_8865,8,/r/stocks/comments/mwrgv5/rstocks_daily_discussion_fundamentals_friday_apr/gvkhu7f/,0.0,0.928,0.072,0.4939
243,AMD," Long term hold. I think the US will push for domestic production of chips and Intel is well geared for that. They did fall asleep at the steering wheel letting AMD and Apple get a good jump but they have a massive war chest, a new CEO and are probably R&D'ing like crazy atm. With the vertical integration of design+fab and massive undervaluation in terms of tech companies (P/E of barely 11-12) it's an absolute bargain. The risk is that they become the next IBM but I find that highly unlikely.

Currently 2% of my portfolio but I've been adding in all these dips and my target is 8-10% of my portfolio for a 5-10 year hold. It's seldom we see these bargains in tech.",Heggemony,2,/r/stocks/comments/mwrgv5/rstocks_daily_discussion_fundamentals_friday_apr/gvkgyra/,0.084,0.848,0.068,-0.631
244,IBM," Long term hold. I think the US will push for domestic production of chips and Intel is well geared for that. They did fall asleep at the steering wheel letting AMD and Apple get a good jump but they have a massive war chest, a new CEO and are probably R&D'ing like crazy atm. With the vertical integration of design+fab and massive undervaluation in terms of tech companies (P/E of barely 11-12) it's an absolute bargain. The risk is that they become the next IBM but I find that highly unlikely.

Currently 2% of my portfolio but I've been adding in all these dips and my target is 8-10% of my portfolio for a 5-10 year hold. It's seldom we see these bargains in tech.",Heggemony,2,/r/stocks/comments/mwrgv5/rstocks_daily_discussion_fundamentals_friday_apr/gvkgyra/,0.084,0.848,0.068,-0.631
245,AGTC," It's been dogshit lately, and you should never trust analyst reports. Sincerely - an AGTC bag holder.",Positive_Inevitable2,2,/r/stocks/comments/mwrgv5/rstocks_daily_discussion_fundamentals_friday_apr/gvkt7c4/,0.136,0.707,0.157,0.1022
246,SQ," SQ is down .1%

Edit: now everything I own is green for the day. Weird.",sad_balloon,2,/r/stocks/comments/mwrgv5/rstocks_daily_discussion_fundamentals_friday_apr/gvldcip/,0.116,0.884,0.0,-0.1779
247,AMD, AMD,PreppyGuyByDay,3,/r/stocks/comments/mwrgv5/rstocks_daily_discussion_fundamentals_friday_apr/gvk0m2v/,0.0,1.0,0.0,0.0
248,AMD, SQ and AMD,maz-o,5,/r/stocks/comments/mwrgv5/rstocks_daily_discussion_fundamentals_friday_apr/gvjzono/,0.0,1.0,0.0,0.0
249,SQ, SQ and AMD,maz-o,5,/r/stocks/comments/mwrgv5/rstocks_daily_discussion_fundamentals_friday_apr/gvjzono/,0.0,1.0,0.0,0.0
250,AMD, Buy all three. AMD doesn't seem like it is gonna go over $90 anytime soon so you probably have more time to load up on that compared to SQ and PYPL which can easily shoot up.,WickedSensitiveCrew,2,/r/stocks/comments/mwrgv5/rstocks_daily_discussion_fundamentals_friday_apr/gvk263t/,0.113,0.827,0.06,-0.2755
251,PYPL, Buy all three. AMD doesn't seem like it is gonna go over $90 anytime soon so you probably have more time to load up on that compared to SQ and PYPL which can easily shoot up.,WickedSensitiveCrew,2,/r/stocks/comments/mwrgv5/rstocks_daily_discussion_fundamentals_friday_apr/gvk263t/,0.113,0.827,0.06,-0.2755
252,SQ, Buy all three. AMD doesn't seem like it is gonna go over $90 anytime soon so you probably have more time to load up on that compared to SQ and PYPL which can easily shoot up.,WickedSensitiveCrew,2,/r/stocks/comments/mwrgv5/rstocks_daily_discussion_fundamentals_friday_apr/gvk263t/,0.113,0.827,0.06,-0.2755
253,IMO," Not financial advice but that's basically what I did with VTI and SCHG. IMO QQQ has a high ER for what it offers (.20%) but VOOG is .10% and SCHG is .04% for essentially the same exposure to large cap growth companies (FAANG+M, TSLA, etc). I think your combo is a good idea though and will help manage some risk from your ark positions (personally my IRA is 35% VTI, 25% SCHG, 15%ARK(f,g,x)). The amount of VTI basically determines the amount of risk you're willing to take with your portfolio. The etfs subreddit also has a lot of discussion on this topic.",hitmon_gg,3,/r/stocks/comments/mwrgv5/rstocks_daily_discussion_fundamentals_friday_apr/gvlaey6/,0.049,0.851,0.1,0.7579
254,TSLA," Not financial advice but that's basically what I did with VTI and SCHG. IMO QQQ has a high ER for what it offers (.20%) but VOOG is .10% and SCHG is .04% for essentially the same exposure to large cap growth companies (FAANG+M, TSLA, etc). I think your combo is a good idea though and will help manage some risk from your ark positions (personally my IRA is 35% VTI, 25% SCHG, 15%ARK(f,g,x)). The amount of VTI basically determines the amount of risk you're willing to take with your portfolio. The etfs subreddit also has a lot of discussion on this topic.",hitmon_gg,3,/r/stocks/comments/mwrgv5/rstocks_daily_discussion_fundamentals_friday_apr/gvlaey6/,0.049,0.851,0.1,0.7579
255,COIN, Wall street doesnt know how to value COIN. It could easily hit 200,Popular_Abrocoma558,5,/r/stocks/comments/mwrgv5/rstocks_daily_discussion_fundamentals_friday_apr/gvjya4s/,0.0,0.696,0.304,0.5859
256,ASML," ASML. Doesn't matter who makes the chips (TSMC, Intel, etc), they all have to use ASML's machines to do so.",svj1021,3,/r/stocks/comments/mwrgv5/rstocks_daily_discussion_fundamentals_friday_apr/gvkl5yl/,0.054,0.946,0.0,-0.0191
257,TSM, WTF. You thought TSM would drop to $15 within 24 hours?,WickedSensitiveCrew,3,/r/stocks/comments/mwrgv5/rstocks_daily_discussion_fundamentals_friday_apr/gvki8gl/,0.424,0.576,0.0,-0.7672
258,BLDP, ARVL+ OUST + BLDP + INVZ + GE/VO,NPRjunkieDC,2,/r/stocks/comments/mwrgv5/rstocks_daily_discussion_fundamentals_friday_apr/gvkluel/,0.0,1.0,0.0,0.0
259,GE, ARVL+ OUST + BLDP + INVZ + GE/VO,NPRjunkieDC,2,/r/stocks/comments/mwrgv5/rstocks_daily_discussion_fundamentals_friday_apr/gvkluel/,0.0,1.0,0.0,0.0
260,INVZ, ARVL+ OUST + BLDP + INVZ + GE/VO,NPRjunkieDC,2,/r/stocks/comments/mwrgv5/rstocks_daily_discussion_fundamentals_friday_apr/gvkluel/,0.0,1.0,0.0,0.0
261,OUST, ARVL+ OUST + BLDP + INVZ + GE/VO,NPRjunkieDC,2,/r/stocks/comments/mwrgv5/rstocks_daily_discussion_fundamentals_friday_apr/gvkluel/,0.0,1.0,0.0,0.0
262,ATH, ZM? Yes I know its labelled as a covid stock but hear me out. Subscription based which is the holy grail. Need for Zoom isn’t going anywhere post covid. Trading 44% from ATH. Signed a partnership with Formula1. The current YoY growth is ridiculous and not sustainable but it should still grow at 40% YoY. Operating margin of 25%. Forward EV of 25. Net dollar expansion rate above 130%. Ranked as one of the best places to work with a top CEO.,cdhollan,2,/r/stocks/comments/mwrgv5/rstocks_daily_discussion_fundamentals_friday_apr/gvkmego/,0.036,0.816,0.148,0.875
263,ATH, Really hope it starts to climb.  I bought close to the ATH...think that I should wait for it to possibly recover or should I cut my losses now??,Mitcht207,3,/r/stocks/comments/mwrgv5/rstocks_daily_discussion_fundamentals_friday_apr/gvknxka/,0.17,0.725,0.105,-0.2422
264,PINS," PINS is a 10 bagger, buy now.",SupaMut4nt,2,/r/stocks/comments/mwrgv5/rstocks_daily_discussion_fundamentals_friday_apr/gvkwqlh/,0.0,1.0,0.0,0.0
265,BY," Believe it or not CALX has been my best performance stock BY FAR. Mainly due to my luck in when I bought in. And because of that I've only bought more. 

But I would say NET is a safer bet and I do own some of that as well and also has been good to me.",IAMHideoKojimaAMA,2,/r/stocks/comments/mwrgv5/rstocks_daily_discussion_fundamentals_friday_apr/gvlx834/,0.0,0.761,0.239,0.93
266,CALX," Believe it or not CALX has been my best performance stock BY FAR. Mainly due to my luck in when I bought in. And because of that I've only bought more. 

But I would say NET is a safer bet and I do own some of that as well and also has been good to me.",IAMHideoKojimaAMA,2,/r/stocks/comments/mwrgv5/rstocks_daily_discussion_fundamentals_friday_apr/gvlx834/,0.0,0.761,0.239,0.93
267,NET," Believe it or not CALX has been my best performance stock BY FAR. Mainly due to my luck in when I bought in. And because of that I've only bought more. 

But I would say NET is a safer bet and I do own some of that as well and also has been good to me.",IAMHideoKojimaAMA,2,/r/stocks/comments/mwrgv5/rstocks_daily_discussion_fundamentals_friday_apr/gvlx834/,0.0,0.761,0.239,0.93
268,AMD," INTC probably has a two-year recovery ahead of them, assuming Pat Gelsinger can right the ship. The whiff on the 7nm chip hurt a lot and AMD blew past them in the process.",GeneEnvironmental925,2,/r/stocks/comments/mwrgv5/rstocks_daily_discussion_fundamentals_friday_apr/gvkkli3/,0.102,0.898,0.0,-0.5267
269,INTC," INTC probably has a two-year recovery ahead of them, assuming Pat Gelsinger can right the ship. The whiff on the 7nm chip hurt a lot and AMD blew past them in the process.",GeneEnvironmental925,2,/r/stocks/comments/mwrgv5/rstocks_daily_discussion_fundamentals_friday_apr/gvkkli3/,0.102,0.898,0.0,-0.5267
270,INTC," Dunno, but I called INTC falling off a cliff after earnings like a week ago. Just far too much negative sentiment on Wall Street, unless the earnings was a homerun in every way it was going to tank them. Closing in on 11 TTM P/E, which is absurdly low compared to the industry.",Peshhhh,2,/r/stocks/comments/mwrgv5/rstocks_daily_discussion_fundamentals_friday_apr/gvl0a62/,0.166,0.778,0.056,-0.7469
271,TTM," Dunno, but I called INTC falling off a cliff after earnings like a week ago. Just far too much negative sentiment on Wall Street, unless the earnings was a homerun in every way it was going to tank them. Closing in on 11 TTM P/E, which is absurdly low compared to the industry.",Peshhhh,2,/r/stocks/comments/mwrgv5/rstocks_daily_discussion_fundamentals_friday_apr/gvl0a62/,0.166,0.778,0.056,-0.7469
272,AI," If you can’t decide, ARKK is basically a mixture of all of them so I’d go with that. I think arkf and arkw have the most potential for short term (<5 years) returns as the “disruptive innovations” in these sectors are likely to make waves in the market sooner than the other sectors. One thing I like about arkw is it’s exposure to GBTC which I can’t buy on my own. Arkg and biotech in general are quite volatile. Arkq and arkx (especially x) are a little premature if you ask me and AI regulations are a consideration. One thing to consider is if you want a lot of, or any, exposure to Tesla, as that’s the largest holding in k, q and w. F and G don’t have any exposure to Tesla.

It’s important to know that all of ark’s investments are fairly volatile because the entire point is that they’re speculative. There’s been a lot of negative sentiment surrounding ark recently because they’re buying into a lot of stocks that are hyped up on Reddit and they haven’t been growing since the tech correction a couple of months ago.

But basically, take a look at the holdings in each fund, ask yourself if you want Tesla exposure, and decide from there.",carlyslayjedsen,2,/r/stocks/comments/mwrgv5/rstocks_daily_discussion_fundamentals_friday_apr/gvlahnn/,0.012,0.947,0.041,0.2382
273,AAPL," If AAPL went from $130 to $100, I could see converting shares to LEAP if the fundamentals are still the same.  It's like double downing on a stock when you believe it's undervalued.",jj2009128,5,/r/stocks/comments/mwrgv5/rstocks_daily_discussion_fundamentals_friday_apr/gvlfvmq/,0.0,0.861,0.139,0.5719
274,LEAP," If AAPL went from $130 to $100, I could see converting shares to LEAP if the fundamentals are still the same.  It's like double downing on a stock when you believe it's undervalued.",jj2009128,5,/r/stocks/comments/mwrgv5/rstocks_daily_discussion_fundamentals_friday_apr/gvlfvmq/,0.0,0.861,0.139,0.5719
275,AMD, Probably more TSM but it looks like it might be on the way up today. If AMD dips to like 77ish I'll  probably consider it. Also been thinking about getting into Draft Kings,redeemer47,4,/r/stocks/comments/mwrgv5/rstocks_daily_discussion_fundamentals_friday_apr/gvk3p1f/,0.0,0.827,0.173,0.7579
276,TSM, Probably more TSM but it looks like it might be on the way up today. If AMD dips to like 77ish I'll  probably consider it. Also been thinking about getting into Draft Kings,redeemer47,4,/r/stocks/comments/mwrgv5/rstocks_daily_discussion_fundamentals_friday_apr/gvk3p1f/,0.0,0.827,0.173,0.7579
277,COIN," I'd probably argue COIN might be the best. I do wonder if the market is not pricing it right especially with so much FUD and crypto having a sale-off. Personally, I do like PLTR of the bunch, but I have the mindset it might take years for the stock to pop. TDOC is fine, I think it might get boosted if we get better broadband to rural areas, but how they are fairing now with so much around the idea of everything re-opening, it kind of lumps TDOC into the ""stay at home"" bunch.",_hiddenscout,1,/r/stocks/comments/mwrgv5/rstocks_daily_discussion_fundamentals_friday_apr/gvlqyis/,0.038,0.825,0.137,0.8718
278,PLTR," I'd probably argue COIN might be the best. I do wonder if the market is not pricing it right especially with so much FUD and crypto having a sale-off. Personally, I do like PLTR of the bunch, but I have the mindset it might take years for the stock to pop. TDOC is fine, I think it might get boosted if we get better broadband to rural areas, but how they are fairing now with so much around the idea of everything re-opening, it kind of lumps TDOC into the ""stay at home"" bunch.",_hiddenscout,1,/r/stocks/comments/mwrgv5/rstocks_daily_discussion_fundamentals_friday_apr/gvlqyis/,0.038,0.825,0.137,0.8718
279,TDOC," I'd probably argue COIN might be the best. I do wonder if the market is not pricing it right especially with so much FUD and crypto having a sale-off. Personally, I do like PLTR of the bunch, but I have the mindset it might take years for the stock to pop. TDOC is fine, I think it might get boosted if we get better broadband to rural areas, but how they are fairing now with so much around the idea of everything re-opening, it kind of lumps TDOC into the ""stay at home"" bunch.",_hiddenscout,1,/r/stocks/comments/mwrgv5/rstocks_daily_discussion_fundamentals_friday_apr/gvlqyis/,0.038,0.825,0.137,0.8718
280,NIO," Volkswagen founded 1937

NIO founded 2014",GeneEnvironmental925,3,/r/stocks/comments/mwrgv5/rstocks_daily_discussion_fundamentals_friday_apr/gvlwmzw/,0.0,1.0,0.0,0.0
281,UAL, I bought a lot of UAL at $50.,Dowdell2008,3,/r/stocks/comments/mwrgv5/rstocks_daily_discussion_fundamentals_friday_apr/gvlwvoq/,0.0,1.0,0.0,0.0
282,ALL, Warren dumped ALL airline stocks last year. And I'm with him. So much better stuff out there.,maz-o,2,/r/stocks/comments/mwrgv5/rstocks_daily_discussion_fundamentals_friday_apr/gvlrd7y/,0.129,0.718,0.152,0.1226
283,DOW," VTI is a great all rounder that benefits more than most market ETFs from small caps doing well.

And you if you want to hedge against it and many market ETFs, you can get DIA. It tracks the DOW which tends to go positive even when tech and small caps get slammed and goes crazy on the best market days. 

And the best part is many of its stocks are non-tech so it makes a great venue of more targeted diversification while still tracking an index. I am very familiar with tech based stuff as an IT guy but know dirt about other sectors so DIA has helped a lot with my rebalancing.",OKJMaster44,1,/r/stocks/comments/mwrgv5/rstocks_daily_discussion_fundamentals_friday_apr/gvkgzhg/,0.04,0.819,0.141,0.8519
284,IT," VTI is a great all rounder that benefits more than most market ETFs from small caps doing well.

And you if you want to hedge against it and many market ETFs, you can get DIA. It tracks the DOW which tends to go positive even when tech and small caps get slammed and goes crazy on the best market days. 

And the best part is many of its stocks are non-tech so it makes a great venue of more targeted diversification while still tracking an index. I am very familiar with tech based stuff as an IT guy but know dirt about other sectors so DIA has helped a lot with my rebalancing.",OKJMaster44,1,/r/stocks/comments/mwrgv5/rstocks_daily_discussion_fundamentals_friday_apr/gvkgzhg/,0.04,0.819,0.141,0.8519
285,SQ, Wow i’m shocked that’s green today considering what BTC’s been doing this week. Seems like the bitcoin dip is keeping SQ down so I assumed the mining companies would be getting fucked,FalconsBlewA283Lead,1,/r/stocks/comments/mwrgv5/rstocks_daily_discussion_fundamentals_friday_apr/gvklrld/,0.168,0.675,0.158,-0.1027
286,AAPL," Look for some companies that are still on discounts that have upcoming earnings and that you feel good about. Here's a few of mine: AMD (4/27), AAPL (4/28), CRSR (5/4), ZNGA (5/5), PYPL (5/5), CSTL (5/10), OPEN (5/11), BMBL (5/12), DIS (5/13).",New_Hedgehog_8865,3,/r/stocks/comments/mwrgv5/rstocks_daily_discussion_fundamentals_friday_apr/gvkjx9a/,0.0,0.932,0.068,0.4404
287,AMD," Look for some companies that are still on discounts that have upcoming earnings and that you feel good about. Here's a few of mine: AMD (4/27), AAPL (4/28), CRSR (5/4), ZNGA (5/5), PYPL (5/5), CSTL (5/10), OPEN (5/11), BMBL (5/12), DIS (5/13).",New_Hedgehog_8865,3,/r/stocks/comments/mwrgv5/rstocks_daily_discussion_fundamentals_friday_apr/gvkjx9a/,0.0,0.932,0.068,0.4404
288,BMBL," Look for some companies that are still on discounts that have upcoming earnings and that you feel good about. Here's a few of mine: AMD (4/27), AAPL (4/28), CRSR (5/4), ZNGA (5/5), PYPL (5/5), CSTL (5/10), OPEN (5/11), BMBL (5/12), DIS (5/13).",New_Hedgehog_8865,3,/r/stocks/comments/mwrgv5/rstocks_daily_discussion_fundamentals_friday_apr/gvkjx9a/,0.0,0.932,0.068,0.4404
289,CRSR," Look for some companies that are still on discounts that have upcoming earnings and that you feel good about. Here's a few of mine: AMD (4/27), AAPL (4/28), CRSR (5/4), ZNGA (5/5), PYPL (5/5), CSTL (5/10), OPEN (5/11), BMBL (5/12), DIS (5/13).",New_Hedgehog_8865,3,/r/stocks/comments/mwrgv5/rstocks_daily_discussion_fundamentals_friday_apr/gvkjx9a/,0.0,0.932,0.068,0.4404
290,CSTL," Look for some companies that are still on discounts that have upcoming earnings and that you feel good about. Here's a few of mine: AMD (4/27), AAPL (4/28), CRSR (5/4), ZNGA (5/5), PYPL (5/5), CSTL (5/10), OPEN (5/11), BMBL (5/12), DIS (5/13).",New_Hedgehog_8865,3,/r/stocks/comments/mwrgv5/rstocks_daily_discussion_fundamentals_friday_apr/gvkjx9a/,0.0,0.932,0.068,0.4404
291,DIS," Look for some companies that are still on discounts that have upcoming earnings and that you feel good about. Here's a few of mine: AMD (4/27), AAPL (4/28), CRSR (5/4), ZNGA (5/5), PYPL (5/5), CSTL (5/10), OPEN (5/11), BMBL (5/12), DIS (5/13).",New_Hedgehog_8865,3,/r/stocks/comments/mwrgv5/rstocks_daily_discussion_fundamentals_friday_apr/gvkjx9a/,0.0,0.932,0.068,0.4404
292,OPEN," Look for some companies that are still on discounts that have upcoming earnings and that you feel good about. Here's a few of mine: AMD (4/27), AAPL (4/28), CRSR (5/4), ZNGA (5/5), PYPL (5/5), CSTL (5/10), OPEN (5/11), BMBL (5/12), DIS (5/13).",New_Hedgehog_8865,3,/r/stocks/comments/mwrgv5/rstocks_daily_discussion_fundamentals_friday_apr/gvkjx9a/,0.0,0.932,0.068,0.4404
293,PYPL," Look for some companies that are still on discounts that have upcoming earnings and that you feel good about. Here's a few of mine: AMD (4/27), AAPL (4/28), CRSR (5/4), ZNGA (5/5), PYPL (5/5), CSTL (5/10), OPEN (5/11), BMBL (5/12), DIS (5/13).",New_Hedgehog_8865,3,/r/stocks/comments/mwrgv5/rstocks_daily_discussion_fundamentals_friday_apr/gvkjx9a/,0.0,0.932,0.068,0.4404
294,ZNGA," Look for some companies that are still on discounts that have upcoming earnings and that you feel good about. Here's a few of mine: AMD (4/27), AAPL (4/28), CRSR (5/4), ZNGA (5/5), PYPL (5/5), CSTL (5/10), OPEN (5/11), BMBL (5/12), DIS (5/13).",New_Hedgehog_8865,3,/r/stocks/comments/mwrgv5/rstocks_daily_discussion_fundamentals_friday_apr/gvkjx9a/,0.0,0.932,0.068,0.4404
295,EBS," I have a risky suggestion for you.


EBS is badly oversold, now down to 10.95 PE Ratio. I believe its currently sitting at support, and the earning reports are coming on the 29. If earnings are good, i'd expect a lot of gains from it.


Be aware there are issues with it...",Floofyboy,1,/r/stocks/comments/mwrgv5/rstocks_daily_discussion_fundamentals_friday_apr/gvkjbr6/,0.088,0.769,0.143,0.4767
296,COIN, Agree. I  think it is becoming clear it will be pegged to bitcoin and carry the volatility. If as forecasted bitcoin is going down to 30-40K$ range in the short term COIN will probably hit 200$,ComprehensiveUsual13,2,/r/stocks/comments/mwrgv5/rstocks_daily_discussion_fundamentals_friday_apr/gvk0tot/,0.0,0.866,0.134,0.6249
297,AMD, I own AMD :),New_Hedgehog_8865,6,/r/stocks/comments/mwrgv5/rstocks_daily_discussion_fundamentals_friday_apr/gvkj9nk/,0.0,0.4,0.6,0.4588
298,TSM, ?? No I thought it would be going up today. Which is why I loaded up when it dropped to 114.70s yesterday. Which is how I averaged down to 115.02. My first sentence is unrelated to my second sentence. I was hoping for another firesale today but not necessarily in regards to TSM.,redeemer47,1,/r/stocks/comments/mwrgv5/rstocks_daily_discussion_fundamentals_friday_apr/gvkkpw4/,0.031,0.88,0.089,0.2406
299,ATH, I also bought near the ATH.  I'm holding and then will set a stop-loss once it reaches my cost basis.  I still feel like it has a potential for future gains and don't want to take it at a loss right now.,turkeychicken,3,/r/stocks/comments/mwrgv5/rstocks_daily_discussion_fundamentals_friday_apr/gvkpe9q/,0.085,0.769,0.147,0.3773
300,BAC," That’s a good one, save for the fact that the top six holdings are tech stocks (AAPL MSFT AMZN FB GOOG GOOGL).

For non-tech focused ETFs I own VYM. It’s JPM JNJ PG HD BAC etc.",crestonfunk,1,/r/stocks/comments/mwrgv5/rstocks_daily_discussion_fundamentals_friday_apr/gvkies0/,0.0,0.741,0.259,0.8591
301,FB," That’s a good one, save for the fact that the top six holdings are tech stocks (AAPL MSFT AMZN FB GOOG GOOGL).

For non-tech focused ETFs I own VYM. It’s JPM JNJ PG HD BAC etc.",crestonfunk,1,/r/stocks/comments/mwrgv5/rstocks_daily_discussion_fundamentals_friday_apr/gvkies0/,0.0,0.741,0.259,0.8591
302,JPM," That’s a good one, save for the fact that the top six holdings are tech stocks (AAPL MSFT AMZN FB GOOG GOOGL).

For non-tech focused ETFs I own VYM. It’s JPM JNJ PG HD BAC etc.",crestonfunk,1,/r/stocks/comments/mwrgv5/rstocks_daily_discussion_fundamentals_friday_apr/gvkies0/,0.0,0.741,0.259,0.8591
303,MSFT," That’s a good one, save for the fact that the top six holdings are tech stocks (AAPL MSFT AMZN FB GOOG GOOGL).

For non-tech focused ETFs I own VYM. It’s JPM JNJ PG HD BAC etc.",crestonfunk,1,/r/stocks/comments/mwrgv5/rstocks_daily_discussion_fundamentals_friday_apr/gvkies0/,0.0,0.741,0.259,0.8591
304,PG," That’s a good one, save for the fact that the top six holdings are tech stocks (AAPL MSFT AMZN FB GOOG GOOGL).

For non-tech focused ETFs I own VYM. It’s JPM JNJ PG HD BAC etc.",crestonfunk,1,/r/stocks/comments/mwrgv5/rstocks_daily_discussion_fundamentals_friday_apr/gvkies0/,0.0,0.741,0.259,0.8591
305,MU, I picked the wrong time to buy intel and MU option last week and they both tanked this week,projecks15,1,/r/stocks/comments/mwrgv5/rstocks_daily_discussion_fundamentals_friday_apr/gvkebxh/,0.154,0.846,0.0,-0.4767
306,AMD, Sorry I did not see AMD in your comment.,aapolitical,2,/r/stocks/comments/mwrgv5/rstocks_daily_discussion_fundamentals_friday_apr/gvk5a2y/,0.157,0.843,0.0,-0.0772
