,ticker,comment,neg,neu,pos,compound
255,FOR,"The only people that would care are the people shorting it, and instead of getting out at 20-30, decided to double down, and then double down again at 40 and 50 and 60. How fucking stupid can you be to not get out when you’re losing, you know the famous quotes like “cut your losses” or “get out while you’re ahead”? Yeah those apply to the shorts right now, and guess what they’re doing? Saying fuck you guys we’re right we’re gonna win this one. So if they lose, after having multiple opportunities to call it quits, why should anyone care? It’s like kicking a dog and it biting you, then kicking it again and it biting you harder. AND THEN KICKING IT AGAIN AND AGAIN AND AFTER GETTING BIT FOR THE FOURTH TIME GOING... “uhhh does no one care that I got bit?” Do you know how many times citron has been wrong? ALOT. The only difference here is people are being vocal as fuck about it en masse, and exposing them for the bullshit they are. They probably made billions and billions through market manipulation before they were on anybody’s radar. CITRON RESEARCH, I’ll repeat RESEARCH, literally said yeah game to 20 because Reddit users are buying and they’re dumb, and it didn’t happen, so its WSBs fault? That makes no sense. They have literally zero “research” stating why game should go under and provide them with billions in profits for shorting besides “they’re brick and mortar”, which is completely adjustable in today’s market, and “Reddit is buying”. How sad is that coming from a company that literally has “research” in its name.",0.132,0.779,0.089,-0.931
256,GAIN,"The only people that would care are the people shorting it, and instead of getting out at 20-30, decided to double down, and then double down again at 40 and 50 and 60. How fucking stupid can you be to not get out when you’re losing, you know the famous quotes like “cut your losses” or “get out while you’re ahead”? Yeah those apply to the shorts right now, and guess what they’re doing? Saying fuck you guys we’re right we’re gonna win this one. So if they lose, after having multiple opportunities to call it quits, why should anyone care? It’s like kicking a dog and it biting you, then kicking it again and it biting you harder. AND THEN KICKING IT AGAIN AND AGAIN AND AFTER GETTING BIT FOR THE FOURTH TIME GOING... “uhhh does no one care that I got bit?” Do you know how many times citron has been wrong? ALOT. The only difference here is people are being vocal as fuck about it en masse, and exposing them for the bullshit they are. They probably made billions and billions through market manipulation before they were on anybody’s radar. CITRON RESEARCH, I’ll repeat RESEARCH, literally said yeah game to 20 because Reddit users are buying and they’re dumb, and it didn’t happen, so its WSBs fault? That makes no sense. They have literally zero “research” stating why game should go under and provide them with billions in profits for shorting besides “they’re brick and mortar”, which is completely adjustable in today’s market, and “Reddit is buying”. How sad is that coming from a company that literally has “research” in its name.",0.132,0.779,0.089,-0.931
257,IT,"The only people that would care are the people shorting it, and instead of getting out at 20-30, decided to double down, and then double down again at 40 and 50 and 60. How fucking stupid can you be to not get out when you’re losing, you know the famous quotes like “cut your losses” or “get out while you’re ahead”? Yeah those apply to the shorts right now, and guess what they’re doing? Saying fuck you guys we’re right we’re gonna win this one. So if they lose, after having multiple opportunities to call it quits, why should anyone care? It’s like kicking a dog and it biting you, then kicking it again and it biting you harder. AND THEN KICKING IT AGAIN AND AGAIN AND AFTER GETTING BIT FOR THE FOURTH TIME GOING... “uhhh does no one care that I got bit?” Do you know how many times citron has been wrong? ALOT. The only difference here is people are being vocal as fuck about it en masse, and exposing them for the bullshit they are. They probably made billions and billions through market manipulation before they were on anybody’s radar. CITRON RESEARCH, I’ll repeat RESEARCH, literally said yeah game to 20 because Reddit users are buying and they’re dumb, and it didn’t happen, so its WSBs fault? That makes no sense. They have literally zero “research” stating why game should go under and provide them with billions in profits for shorting besides “they’re brick and mortar”, which is completely adjustable in today’s market, and “Reddit is buying”. How sad is that coming from a company that literally has “research” in its name.",0.132,0.779,0.089,-0.931
258,GME,"The reason it plummeted was because of fear and investors selling out their positions in a short time coupled with fund managers and brokerages taking advantage to cover the shorts. A short squeeze when allowed, the GME stock can go to $1,000,000,0000 per share only if we can find people to still buy it without fear. Then, the shorts will get really fucked! All their banks will be emptied to buy back the shares shorted. The key is to buy shares and hold them!!!!!!",0.145,0.766,0.089,-0.8106
259,GME,Once it is over. GME will be worth 10 dollar at least.,0.0,0.853,0.147,0.2263
260,GME,Lol that’s a website that’s called GMEDD and literally has no names attached to it. About us says “We are OG Long GME investors”.... seems legit.,0.079,0.821,0.1,0.1531
261,GME,"Read up on the yahoo finance articles about GME. One of the big guys pretty much admitted to planning on hopping in on monday.  
  
They know the power of WSB bow, they have to hedge way further up.",0.0,0.887,0.113,0.5574
262,BB,"Limit order doesn’t make buyers appear. If I put a limit order in right now on BB stock for $80/share, do you know what happens?

Nothing. Because no one is available to buy at that price. Your GME share will fly right past your limit order because there will be no buyers when the computer checks for them. Your limit order will go unfilled.",0.0,0.908,0.092,0.6093
263,GME,"Limit order doesn’t make buyers appear. If I put a limit order in right now on BB stock for $80/share, do you know what happens?

Nothing. Because no one is available to buy at that price. Your GME share will fly right past your limit order because there will be no buyers when the computer checks for them. Your limit order will go unfilled.",0.0,0.908,0.092,0.6093
264,GME,It was created by a guy called Rod Alzmann. You can find him on Twitter. He was on the Benzinga YouTube livestream yesterday to explain GME.,0.0,0.923,0.077,0.25
265,UK,"Netflix has pumped $1billion into the UK by shooting projects here and the article is written as if we should still be upset they didn't pay more to the gov? 

Where do you think the $1b goes? Local contractors, restaurants, hotels, extras, etc.... Pumped directly into the economy. Way better than the crown's pocket",0.045,0.877,0.078,0.2396
266,UK,"That's how tax works, revenue does not equal profit. Will always remain this way until wealthy counties including the UK completely change the tax system",0.086,0.824,0.09,0.0243
267,UK,"Yeah there's something called cost of doing business, and this cost is deducted from revenue which reduces tax liability. If they did owe any further amounts of money to the UK, best believe HMRC (UK's IRS) would be up Netflix' ass",0.109,0.76,0.131,0.2732
268,UK,Ok and they also sunk 1 billion directly into the UK economy filming stuff there. Of all the companies to go after for being scumbags were doing Netflix?,0.0,0.922,0.078,0.296
269,NET,"Wrong sub for this. Also, like people have said, NET PROFIT is what matters.",0.152,0.492,0.356,0.4824
270,UK,"Change it how exactly? 

Per the article, Netflix pulled in £940 million, but they only made £13 million in pre-tax profits. With a tax bill of £3.2 million, that’s an effective rate of 24%. That’s really not unreasonable considering the corporate main tax rate in the UK is 21%. Comparing tax payments to revenue, instead of comparing them to profits, doesn’t paint an accurate picture. If you were to change the basis of the tax rate, how exactly would that work? If you applied the tax rate to revenue in this case, that would work out to a tax bill of over £225 million. How are they going to pay that bill when they only profited £13 million?",0.013,0.868,0.12,0.9407
271,REAL,"Agreed, this shifting of profits needs to be closed.

There is no REAL reason you shift profits from UK to Netherlands or Luxembourg or wherever it is.

We all know the revenue was derived in the UK serviced by UK staff. Just because the ""license"" is held in the low tax jurisdiction they can shift profits there. Absolutely ridiculous 🙄",0.101,0.744,0.155,0.5729
272,UK,"Agreed, this shifting of profits needs to be closed.

There is no REAL reason you shift profits from UK to Netherlands or Luxembourg or wherever it is.

We all know the revenue was derived in the UK serviced by UK staff. Just because the ""license"" is held in the low tax jurisdiction they can shift profits there. Absolutely ridiculous 🙄",0.101,0.744,0.155,0.5729
273,UK,That's the dumbest shit I ever heard.  They spent more money than they earned in revenue creating content in the UK.  Where do you think that money goes?,0.208,0.725,0.066,-0.6908
274,SA,"/r/iam14andthisdeep 

https://imgur.com/a/hyPVgSA

etc",0.0,1.0,0.0,0.0
275,GME,"News sites and analysts are all bullshit, GME isn’t trading inline with it’s fundamentals. It will keep going up IMO",0.167,0.833,0.0,-0.5859
276,IMO,"News sites and analysts are all bullshit, GME isn’t trading inline with it’s fundamentals. It will keep going up IMO",0.167,0.833,0.0,-0.5859
277,GME,"Please please do not put all your life saving on GME if that’s what you mean. While I am one of the gambler on board GME train, and more buying will help me, I do not like the mentality of yoloing entire live saving their at WSB. For your own sake please cap and have stop limits if it’s your entire live saving.

Please do not consider anything above as investment advice. I don’t know what i am doing with my own money.",0.049,0.814,0.137,0.7817
278,GME,"This is what is called FUD. This stands for ""Fear, uncertainty, and doubt"", and all big websites use it. As Denzel Washington said, ""If you don't read the newspaper, you're uninformed. If you do read the newspaper, you're misinformed."" Most big websites have ulterior motives, and most often are connected to big MMs paying them off to say something. In reality, they're next to worthless to listen to verbatim. Perhaps they will allude to some truths, but you can bet that they are leaving other truths out.


GME has caught all attention in regards to the impending short-squeeze and has all of the tools to continue pushing the stock price upward. Big institutions are now in the game, and they are no doubt buying obscene numbers of call options and shares in order to make gains on this stock. It is VERY similar to Tesla's run up from last year so far. However, the main difference is that Tesla was only minorly assisted by short covering, whereas short covering for GME will likely end in an explosion--that is, the MOASS (the Mother Of All Short-Squeezes). GME's board / Cohen also have all the power to make an announcement when needed to catalyze a short-squeeze, which would be immensely profitable to both them as a company and to retail long investors. It is also in their best interest to help this short-squeeze happen sooner than later so that a fair market price can be established for GME so they can find some stability as a company and establish a fundamental value for their stock moving forward",0.057,0.824,0.119,0.9655
279,VERY,"This is what is called FUD. This stands for ""Fear, uncertainty, and doubt"", and all big websites use it. As Denzel Washington said, ""If you don't read the newspaper, you're uninformed. If you do read the newspaper, you're misinformed."" Most big websites have ulterior motives, and most often are connected to big MMs paying them off to say something. In reality, they're next to worthless to listen to verbatim. Perhaps they will allude to some truths, but you can bet that they are leaving other truths out.


GME has caught all attention in regards to the impending short-squeeze and has all of the tools to continue pushing the stock price upward. Big institutions are now in the game, and they are no doubt buying obscene numbers of call options and shares in order to make gains on this stock. It is VERY similar to Tesla's run up from last year so far. However, the main difference is that Tesla was only minorly assisted by short covering, whereas short covering for GME will likely end in an explosion--that is, the MOASS (the Mother Of All Short-Squeezes). GME's board / Cohen also have all the power to make an announcement when needed to catalyze a short-squeeze, which would be immensely profitable to both them as a company and to retail long investors. It is also in their best interest to help this short-squeeze happen sooner than later so that a fair market price can be established for GME so they can find some stability as a company and establish a fundamental value for their stock moving forward",0.057,0.824,0.119,0.9655
280,GME,Alot of these news sited were also saying something in regards to $tesla.  These are just hit pieces by the people that are heavily shorting this company. Upside looks great for $GME.,0.0,0.883,0.117,0.6249
281,GME,"I will not put my life savings into GME, everyone can breath out.",0.0,1.0,0.0,0.0
282,PLTR,Just do it on  PLTR....be in early for their squeeze,0.0,1.0,0.0,0.0
283,GME,"The experts who"" know more about about short float than You do""  had a target of 20$ last week. (CITRON)

Most analysts  r shit...or they have motives... also They're too biased to realize what is happening..  or they were just trying to manipulate our sentiment and get us too scared to buy.  $GME",0.093,0.907,0.0,-0.6124
284,GME,"In my case, I got in at 13$, so it is unlikely that I will take a loss even if I time my exit horribly. At this point, the best approach for me is to watch the spike. Next week will be the make or break. I have set controlled exits of a percentage of the position if the stock hits 100$ and 200$ and a complete liquidation at 284.30$ (when the net profits of the remaining position would be exactly 1M). If it comes down tanking, I will ride it until the ER in March and see what happens then. I think that the fair value for the business should stabilize around 40-60, so I should be able to eek a profit anyway. In any case, even if it was just a 10% position when I set it up, now GME is more than 60% of my account due to its explosive growth. It will soon be time to lock the gains and move on. I am not interested in GME as a long term investment.",0.044,0.846,0.11,0.8943
285,NKLA,"Remember when all the idiots on here were getting hyped about NKLA, RKT, and all the other stupid stocks? Greed makes people do dumb things and forget rationality.",0.32,0.68,0.0,-0.8834
286,RKT,"Remember when all the idiots on here were getting hyped about NKLA, RKT, and all the other stupid stocks? Greed makes people do dumb things and forget rationality.",0.32,0.68,0.0,-0.8834
287,GME,"GME is the biggest pyramid scheme there’s been in a long while. All the early investors heavily encouraging users into a stock with no clear future or fundamentals to back its already inflated evaluation. Wish people were not so sheeple, but that’s the markets!",0.035,0.831,0.134,0.5487
288,GME,"Well, it's been working out for me!

920 shares, 5x 4/16/21 25c GME",0.0,0.705,0.295,0.5562
289,EVER,"I'm so excited for GME, currently holding 20 shares @ 34. HOWEVER, my total stock buying power (mostly margin) is $12,674.04. I'm thinking about going all in. balls deep on shares in pre market, set a limit order for 194 shares @$65 - $70.. This would give me 200 ish shares total. Avg price per share would be around $63.00

If I set a stop loss at GME $45.00, My max loss is around $3500. An amount I'm willing to lose for this insane bullish bet. However, for every $50 gme moves, I would make 10k *actual* profit. 

So.. max loss is $3,500... but max gain is Almost 100k if I let GME hit $500. Am I missing something here? Seems like insane upside vs downside. Big concern being that my stop loss wouldn't trigger @ $45 because there would be no buyers. 

Would love to hear your thoughts on this plan. I want to help out best I can and buy more shares, and after crunching the numbers it's starting to seem more and more realistic. The FOMO on Monday is going to be insane. I want to capitalize on that. I don't mind owning GME for the long term... however 200 ish shares is a lot to hold for a ~$13k account like mine. 

Again this would mostly be on margin. Would love to hear your thoughs",0.117,0.687,0.196,0.9724
290,GME,"I'm so excited for GME, currently holding 20 shares @ 34. HOWEVER, my total stock buying power (mostly margin) is $12,674.04. I'm thinking about going all in. balls deep on shares in pre market, set a limit order for 194 shares @$65 - $70.. This would give me 200 ish shares total. Avg price per share would be around $63.00

If I set a stop loss at GME $45.00, My max loss is around $3500. An amount I'm willing to lose for this insane bullish bet. However, for every $50 gme moves, I would make 10k *actual* profit. 

So.. max loss is $3,500... but max gain is Almost 100k if I let GME hit $500. Am I missing something here? Seems like insane upside vs downside. Big concern being that my stop loss wouldn't trigger @ $45 because there would be no buyers. 

Would love to hear your thoughts on this plan. I want to help out best I can and buy more shares, and after crunching the numbers it's starting to seem more and more realistic. The FOMO on Monday is going to be insane. I want to capitalize on that. I don't mind owning GME for the long term... however 200 ish shares is a lot to hold for a ~$13k account like mine. 

Again this would mostly be on margin. Would love to hear your thoughs",0.117,0.687,0.196,0.9724
291,BB,Why not BB also?,0.0,1.0,0.0,0.0
292,CEO,"It is freaky, but its actual analysis. There's more upward than downward pressure, and the upward pressure is increasing. The only thing left to do once you know all the information available is to decide where you think it's heading, and where your exit price is. A lot of people so far have decided its heading up, and have factored in where these gamma or short-squeezes could land them. And well, the price points get freaky.

Usually I would say yes it is a game of poker. But you also know that since the market crash in 2020, this game of poker has shifted from gambling to something different. Everyone knows how inflated the stock market has become since March last year. Pick a random stock and there's a good chance it's up 30% or more since March lows. Pick a tech stock, and there's a good chance its up 100% since lows. For GME, I don't view it as gambling at all. I view it as evaluating a business' direction and future strategy and getting in early. If people knew who Ryan Cohen was, and his history and what he has been doing since Chewy, they would understand that he intends to take Gamestop and pivot the business around to become an e-commerce videogame giant in the industry. That's most people's guess, that is the only uncertainty, his exact business strategy, but its safe enough to bet that he has a good one.

My point in all this is that for GME, I don't think any of the people who had invested in December viewed this as a YOLO gamble. Maybe people are doing that now, not knowing much, but this started with a ton of research on fundamentals, the board and possibilities of how Cohen might navigate himself to a CEO or board director position, and how Gamestop would change their business strategies. They've actually already started to do this as early as 2019, when they started consolidating stores, paying off debts, creating a large free cash flow, and making board adjustments, adding Reggie Fils-Aime in 2020, and now Ryan and his Chewy CFO and COO in 2021.

I could talk about all of the DD and TA for many more paragraphs, but I don't suppose anyone is looking to hear that.

But even a simple 6 month, 1 month, or 1 week chart analysis is bullish, the 200MA has crossed the 50MA (golden cross), tons of candlestick patterns, cup and handle etc. A simple SOTP analysis shows GME on their current fundamentals alone has a suppressed stock price of 4x underevaluation (well that was back when GME was at 20, so around 70 or 80 for current balance sheet), but that doesn't even price in future value, that's for hitting like a P/E of 1",0.051,0.859,0.09,0.9683
293,CFO,"It is freaky, but its actual analysis. There's more upward than downward pressure, and the upward pressure is increasing. The only thing left to do once you know all the information available is to decide where you think it's heading, and where your exit price is. A lot of people so far have decided its heading up, and have factored in where these gamma or short-squeezes could land them. And well, the price points get freaky.

Usually I would say yes it is a game of poker. But you also know that since the market crash in 2020, this game of poker has shifted from gambling to something different. Everyone knows how inflated the stock market has become since March last year. Pick a random stock and there's a good chance it's up 30% or more since March lows. Pick a tech stock, and there's a good chance its up 100% since lows. For GME, I don't view it as gambling at all. I view it as evaluating a business' direction and future strategy and getting in early. If people knew who Ryan Cohen was, and his history and what he has been doing since Chewy, they would understand that he intends to take Gamestop and pivot the business around to become an e-commerce videogame giant in the industry. That's most people's guess, that is the only uncertainty, his exact business strategy, but its safe enough to bet that he has a good one.

My point in all this is that for GME, I don't think any of the people who had invested in December viewed this as a YOLO gamble. Maybe people are doing that now, not knowing much, but this started with a ton of research on fundamentals, the board and possibilities of how Cohen might navigate himself to a CEO or board director position, and how Gamestop would change their business strategies. They've actually already started to do this as early as 2019, when they started consolidating stores, paying off debts, creating a large free cash flow, and making board adjustments, adding Reggie Fils-Aime in 2020, and now Ryan and his Chewy CFO and COO in 2021.

I could talk about all of the DD and TA for many more paragraphs, but I don't suppose anyone is looking to hear that.

But even a simple 6 month, 1 month, or 1 week chart analysis is bullish, the 200MA has crossed the 50MA (golden cross), tons of candlestick patterns, cup and handle etc. A simple SOTP analysis shows GME on their current fundamentals alone has a suppressed stock price of 4x underevaluation (well that was back when GME was at 20, so around 70 or 80 for current balance sheet), but that doesn't even price in future value, that's for hitting like a P/E of 1",0.051,0.859,0.09,0.9683
