,ticker,comment,neg,neu,pos,compound
582,BYD,"Disclaimer: I am long TSLA. 
ok so $7000 pre-split = $1400 post split. currently TSLA has 947 million shares x $1400 =$1.325 trillion market cap.   Let's kinda' look what today's market is:  USA: Model 3 and Model Y...Model Y has overtaken model 3 in Q4 2020.. Model Y  AWD is $49.9 and RWD SR is $41.9K....Europe:  I don't know what the price will be.  China:  Model Y: $52K and Model 3 SR plus: (the vast majority sold is this): $37K or so.   USA market: looks like Model 3 has somewhat plateaued.  Fremont and Austin will make a lot of Y: but I can't imagine the ASP on Y and 3 will be $52K here: many people will opt for the SR RWD Model Y.  The market for Tesla here is still very strong: over 80% of BEV is Tesla.  Europe:  This is difficult to assess b/c Giga Berlin isn't up yet; and so I don't know the price; However saying that, Tesla does have some fierce competition from VAG, Renault-Nissan-Mitsubishi, Chinese Imports, Stellantis.  There are rumors that Tesla will produce $25K cars. However $25K cars will erode profits.  China:  The competition is even more fierce here b/c of BYD (they are able to raise capital like TSLA: recently about $3.9 billion), Nio, Xpeng, Li, Wuling.  This will lead to downward price pressure.  So this is on the automotive side.  The total market cap for all automakers minus Tesla is only $1.3 trillion or so.  At $1400 per share it will exceed ALL automakers: that means tesla have to sell every single car in the world.  What we sometimes forget is most of the world is not rich.  Not all countries can give €9000 (Germany) or $7500 (USA federal) tax incentive or NOT tax cars (Norway).  So on the automotive side: it is difficult to conceive on a fundamentally basis to give TSLA that value in 2024.  Ok, so the question is: can tesla make money on Energy and Robotaxi? This is the big question.  If Tesla can make money on Energy and Robotaxi then yes they can achieve that value..So far Energy hasn't done much; sales of solar peaked back in 2015 (MWH deployed).  Robotaxi hasn't come to fruition yet. So far Tesla has ZERO miles on the road without a driver.  Will it be in 2024?? maybe...I mean Ark predicted it will be there in 2021.  the $4000/share call back in 2019 predicated upon Tesla selling 3 million cars in 2023 and with robotaxi in 2021.  Is Cathie Woods lucky or good? maybe combination of both (I don't know what percentage is luck or skill)
https://ark-invest.com/articles/analyst-research/tesla-valuation-model/
-Tesla can get to $1400/share by 2024: but it is going to be due to FOMO in the market and not fundamentals.  
-Summary:  Tesla as automotive alone is NOT worth $1.3275 trillion in 2024.  Can be if Robotaxi and Energy takes off.",0.039,0.852,0.109,0.9877
583,SR,"Disclaimer: I am long TSLA. 
ok so $7000 pre-split = $1400 post split. currently TSLA has 947 million shares x $1400 =$1.325 trillion market cap.   Let's kinda' look what today's market is:  USA: Model 3 and Model Y...Model Y has overtaken model 3 in Q4 2020.. Model Y  AWD is $49.9 and RWD SR is $41.9K....Europe:  I don't know what the price will be.  China:  Model Y: $52K and Model 3 SR plus: (the vast majority sold is this): $37K or so.   USA market: looks like Model 3 has somewhat plateaued.  Fremont and Austin will make a lot of Y: but I can't imagine the ASP on Y and 3 will be $52K here: many people will opt for the SR RWD Model Y.  The market for Tesla here is still very strong: over 80% of BEV is Tesla.  Europe:  This is difficult to assess b/c Giga Berlin isn't up yet; and so I don't know the price; However saying that, Tesla does have some fierce competition from VAG, Renault-Nissan-Mitsubishi, Chinese Imports, Stellantis.  There are rumors that Tesla will produce $25K cars. However $25K cars will erode profits.  China:  The competition is even more fierce here b/c of BYD (they are able to raise capital like TSLA: recently about $3.9 billion), Nio, Xpeng, Li, Wuling.  This will lead to downward price pressure.  So this is on the automotive side.  The total market cap for all automakers minus Tesla is only $1.3 trillion or so.  At $1400 per share it will exceed ALL automakers: that means tesla have to sell every single car in the world.  What we sometimes forget is most of the world is not rich.  Not all countries can give €9000 (Germany) or $7500 (USA federal) tax incentive or NOT tax cars (Norway).  So on the automotive side: it is difficult to conceive on a fundamentally basis to give TSLA that value in 2024.  Ok, so the question is: can tesla make money on Energy and Robotaxi? This is the big question.  If Tesla can make money on Energy and Robotaxi then yes they can achieve that value..So far Energy hasn't done much; sales of solar peaked back in 2015 (MWH deployed).  Robotaxi hasn't come to fruition yet. So far Tesla has ZERO miles on the road without a driver.  Will it be in 2024?? maybe...I mean Ark predicted it will be there in 2021.  the $4000/share call back in 2019 predicated upon Tesla selling 3 million cars in 2023 and with robotaxi in 2021.  Is Cathie Woods lucky or good? maybe combination of both (I don't know what percentage is luck or skill)
https://ark-invest.com/articles/analyst-research/tesla-valuation-model/
-Tesla can get to $1400/share by 2024: but it is going to be due to FOMO in the market and not fundamentals.  
-Summary:  Tesla as automotive alone is NOT worth $1.3275 trillion in 2024.  Can be if Robotaxi and Energy takes off.",0.039,0.852,0.109,0.9877
584,TSLA,"Disclaimer: I am long TSLA. 
ok so $7000 pre-split = $1400 post split. currently TSLA has 947 million shares x $1400 =$1.325 trillion market cap.   Let's kinda' look what today's market is:  USA: Model 3 and Model Y...Model Y has overtaken model 3 in Q4 2020.. Model Y  AWD is $49.9 and RWD SR is $41.9K....Europe:  I don't know what the price will be.  China:  Model Y: $52K and Model 3 SR plus: (the vast majority sold is this): $37K or so.   USA market: looks like Model 3 has somewhat plateaued.  Fremont and Austin will make a lot of Y: but I can't imagine the ASP on Y and 3 will be $52K here: many people will opt for the SR RWD Model Y.  The market for Tesla here is still very strong: over 80% of BEV is Tesla.  Europe:  This is difficult to assess b/c Giga Berlin isn't up yet; and so I don't know the price; However saying that, Tesla does have some fierce competition from VAG, Renault-Nissan-Mitsubishi, Chinese Imports, Stellantis.  There are rumors that Tesla will produce $25K cars. However $25K cars will erode profits.  China:  The competition is even more fierce here b/c of BYD (they are able to raise capital like TSLA: recently about $3.9 billion), Nio, Xpeng, Li, Wuling.  This will lead to downward price pressure.  So this is on the automotive side.  The total market cap for all automakers minus Tesla is only $1.3 trillion or so.  At $1400 per share it will exceed ALL automakers: that means tesla have to sell every single car in the world.  What we sometimes forget is most of the world is not rich.  Not all countries can give €9000 (Germany) or $7500 (USA federal) tax incentive or NOT tax cars (Norway).  So on the automotive side: it is difficult to conceive on a fundamentally basis to give TSLA that value in 2024.  Ok, so the question is: can tesla make money on Energy and Robotaxi? This is the big question.  If Tesla can make money on Energy and Robotaxi then yes they can achieve that value..So far Energy hasn't done much; sales of solar peaked back in 2015 (MWH deployed).  Robotaxi hasn't come to fruition yet. So far Tesla has ZERO miles on the road without a driver.  Will it be in 2024?? maybe...I mean Ark predicted it will be there in 2021.  the $4000/share call back in 2019 predicated upon Tesla selling 3 million cars in 2023 and with robotaxi in 2021.  Is Cathie Woods lucky or good? maybe combination of both (I don't know what percentage is luck or skill)
https://ark-invest.com/articles/analyst-research/tesla-valuation-model/
-Tesla can get to $1400/share by 2024: but it is going to be due to FOMO in the market and not fundamentals.  
-Summary:  Tesla as automotive alone is NOT worth $1.3275 trillion in 2024.  Can be if Robotaxi and Energy takes off.",0.039,0.852,0.109,0.9877
585,USA,"Disclaimer: I am long TSLA. 
ok so $7000 pre-split = $1400 post split. currently TSLA has 947 million shares x $1400 =$1.325 trillion market cap.   Let's kinda' look what today's market is:  USA: Model 3 and Model Y...Model Y has overtaken model 3 in Q4 2020.. Model Y  AWD is $49.9 and RWD SR is $41.9K....Europe:  I don't know what the price will be.  China:  Model Y: $52K and Model 3 SR plus: (the vast majority sold is this): $37K or so.   USA market: looks like Model 3 has somewhat plateaued.  Fremont and Austin will make a lot of Y: but I can't imagine the ASP on Y and 3 will be $52K here: many people will opt for the SR RWD Model Y.  The market for Tesla here is still very strong: over 80% of BEV is Tesla.  Europe:  This is difficult to assess b/c Giga Berlin isn't up yet; and so I don't know the price; However saying that, Tesla does have some fierce competition from VAG, Renault-Nissan-Mitsubishi, Chinese Imports, Stellantis.  There are rumors that Tesla will produce $25K cars. However $25K cars will erode profits.  China:  The competition is even more fierce here b/c of BYD (they are able to raise capital like TSLA: recently about $3.9 billion), Nio, Xpeng, Li, Wuling.  This will lead to downward price pressure.  So this is on the automotive side.  The total market cap for all automakers minus Tesla is only $1.3 trillion or so.  At $1400 per share it will exceed ALL automakers: that means tesla have to sell every single car in the world.  What we sometimes forget is most of the world is not rich.  Not all countries can give €9000 (Germany) or $7500 (USA federal) tax incentive or NOT tax cars (Norway).  So on the automotive side: it is difficult to conceive on a fundamentally basis to give TSLA that value in 2024.  Ok, so the question is: can tesla make money on Energy and Robotaxi? This is the big question.  If Tesla can make money on Energy and Robotaxi then yes they can achieve that value..So far Energy hasn't done much; sales of solar peaked back in 2015 (MWH deployed).  Robotaxi hasn't come to fruition yet. So far Tesla has ZERO miles on the road without a driver.  Will it be in 2024?? maybe...I mean Ark predicted it will be there in 2021.  the $4000/share call back in 2019 predicated upon Tesla selling 3 million cars in 2023 and with robotaxi in 2021.  Is Cathie Woods lucky or good? maybe combination of both (I don't know what percentage is luck or skill)
https://ark-invest.com/articles/analyst-research/tesla-valuation-model/
-Tesla can get to $1400/share by 2024: but it is going to be due to FOMO in the market and not fundamentals.  
-Summary:  Tesla as automotive alone is NOT worth $1.3275 trillion in 2024.  Can be if Robotaxi and Energy takes off.",0.039,0.852,0.109,0.9877
586,TSLA,"Is that corrrect?

&#x200B;

TSLA is currently 850s

Ok so if we get their price target of 7000 and divide that by 5, that gets us 1400.

850 -> 1400 is a big jump by 2024. But I don't think that's the bullish case that they were presenting. Especially in the time frame.",0.0,0.958,0.042,0.296
587,TSLA,"Read the link posted, it lays out what benchmarks TSLA would need to hit to make it to 15000 very clearly.",0.0,0.87,0.13,0.4576
588,EV,"I think people might be giving the existing market leaders too much credit. The fact is as long as F-150's are driving sales, Ford's entire corporate structure will be focused on that and EV development will remain a side project. Same with GM. Same with Chrysler. Tesla has a huge head start, and their entire business is focused on one product, giving them a tremendous business advantage, IMO.",0.0,0.771,0.229,0.9313
589,GM,"I think people might be giving the existing market leaders too much credit. The fact is as long as F-150's are driving sales, Ford's entire corporate structure will be focused on that and EV development will remain a side project. Same with GM. Same with Chrysler. Tesla has a huge head start, and their entire business is focused on one product, giving them a tremendous business advantage, IMO.",0.0,0.771,0.229,0.9313
590,IMO,"I think people might be giving the existing market leaders too much credit. The fact is as long as F-150's are driving sales, Ford's entire corporate structure will be focused on that and EV development will remain a side project. Same with GM. Same with Chrysler. Tesla has a huge head start, and their entire business is focused on one product, giving them a tremendous business advantage, IMO.",0.0,0.771,0.229,0.9313
591,EV,"“Tesla isn’t bringing anything new or unique (yet).”

????

I don’t even know where to start with that. Let’s just start with their battery that is unparalleled by any other EV. They are years ahead of their time.

There’s a reason why specifically in energy tech we focus more on batteries than anything else. 

It’s not about automotive sales per say....",0.0,0.95,0.05,0.4696
592,PT,"Good find. But by when is their PT in the video?

Yeah, I got the 1400 when I just divided. So I guess, they are still sticking with their numbers",0.0,0.831,0.169,0.6249
593,TSLA,"I think that's a fair point but they do have some energy solutions like the Power Wall.

What really distinguishes TSLA from other EVs is the range of their battery, their core tech. Surely, you can agree with that?",0.0,0.65,0.35,0.9403
594,EV,"IMO, their core competency is data. They have a huuuuuge head start on gathering road data, processing it, and using it to improve performance. Let me put it this way, 4 years ago, I was interviewing with GM at my university where they were recruiting heavily for engineers to work on their EV development. 4 years later and... they don't even have a true, mass-market EV. In the meantime, Tesla has been pumping out models like crazy and improving their tech. From an engineering perspective, no one is going to come close to compete with Tesla on EV's in the near future. What we are seeing is the same as Blockbuster scrambling while Netflix is dominating streaming.",0.073,0.83,0.097,0.6083
595,GM,"IMO, their core competency is data. They have a huuuuuge head start on gathering road data, processing it, and using it to improve performance. Let me put it this way, 4 years ago, I was interviewing with GM at my university where they were recruiting heavily for engineers to work on their EV development. 4 years later and... they don't even have a true, mass-market EV. In the meantime, Tesla has been pumping out models like crazy and improving their tech. From an engineering perspective, no one is going to come close to compete with Tesla on EV's in the near future. What we are seeing is the same as Blockbuster scrambling while Netflix is dominating streaming.",0.073,0.83,0.097,0.6083
596,IMO,"IMO, their core competency is data. They have a huuuuuge head start on gathering road data, processing it, and using it to improve performance. Let me put it this way, 4 years ago, I was interviewing with GM at my university where they were recruiting heavily for engineers to work on their EV development. 4 years later and... they don't even have a true, mass-market EV. In the meantime, Tesla has been pumping out models like crazy and improving their tech. From an engineering perspective, no one is going to come close to compete with Tesla on EV's in the near future. What we are seeing is the same as Blockbuster scrambling while Netflix is dominating streaming.",0.073,0.83,0.097,0.6083
597,EV,"Definitely not. The longest range EV  currently on sale that is not from Tesla is the Mach-E RWD with the biggest battery ( ~88kwh, and it goes 300 miles). That’s the only car that can even reach 300 miles not from Tesla. The model y AWD LR reaches 326 miles and has a 74 kWh battery. Other car manufacturers are starting to reach Tesla’s lower end models, but they are typically doing it with a much bigger battery",0.021,0.912,0.067,0.1154
598,DD,"I actually wrote DD about it last night lol

https://www.reddit.com/r/stocks/comments/l31s4g/clover_health_clov_will_moon_soon/?utm_source=share&utm_medium=ios_app&utm_name=iossmf",0.0,0.741,0.259,0.4215
599,DD,Read your DD this morning. Part of the reason I posed this question. Well done!,0.0,0.845,0.155,0.3382
600,GME,1000 is a meme price. My personal opinion is that you can make more money with the 13 GME than the 1 tsla,0.0,1.0,0.0,0.0
601,GME,"I sold my 5 Tesla shares that have netted me +1200 in 3 months and put it towards GME. I am currently up over $12k. So. End of the day it's up to you, do your research and trust your gut. It has been lucrative for me, is all I can speak on.",0.0,0.893,0.107,0.6705
602,GME,I sold my pretty sizable position in NIO friday right before market close to add to my GME.,0.0,0.833,0.167,0.4939
603,NIO,I sold my pretty sizable position in NIO friday right before market close to add to my GME.,0.0,0.833,0.167,0.4939
604,GME,Big No. GME is a hype stock. It will make peeps fast money but its not a long term hold. This company has a lot of work to do before it raises from the ashes.,0.049,0.951,0.0,-0.1531
605,GME,GME is all hype.  The company fundamentally is horrible.,0.304,0.696,0.0,-0.5423
606,TSLA,"That’s what I’m seeing. I get that it’s a hype stock, but if I were to invest it would be to do just that - make absurds amount of money fast. Then rebuy TSLA with profit",0.0,0.89,0.11,0.5927
607,GME,You're in GME either for the short squeeze or the idea that Cohen and the chewy crew plus Reggie from Nintendo plus Michael Burry can turn the company around. Do y'all even look around at DDs?,0.0,1.0,0.0,0.0
608,GME,"The thing about GME is .... It's what's happening right now. Something historic and, based on the research this one nobody has done, very real. There are two pillars:

1. You believe in Cohen and the new fundamentals of Gamestop. Which a lot of people do. So, you are planning for the long term, as well as the gains the next week-a couple months

2. You recognize what is happening for what is happening, you get it and get up, and get out and back to long term investment planning. 

Personally, I'm in for moreso 2, but do honestly believe in 1. But, end of the day, this shit is bonkers and real.",0.049,0.892,0.06,-0.1593
609,DD,"I’ve looked at the DD posted on WSB since December. After digesting all of it, I took down multiple positions in my IRA’s and HSA and invested in 1600 shares of GME, watched it go from 16 to 65. I felt so strongly about the company I sold my position in SQ and got into another 480 shares at $46, but in my taxable brokerage account. I don’t want to pay 40% income tax so I’ll be holding those long term",0.02,0.899,0.081,0.4443
610,GME,"I’ve looked at the DD posted on WSB since December. After digesting all of it, I took down multiple positions in my IRA’s and HSA and invested in 1600 shares of GME, watched it go from 16 to 65. I felt so strongly about the company I sold my position in SQ and got into another 480 shares at $46, but in my taxable brokerage account. I don’t want to pay 40% income tax so I’ll be holding those long term",0.02,0.899,0.081,0.4443
611,SQ,"I’ve looked at the DD posted on WSB since December. After digesting all of it, I took down multiple positions in my IRA’s and HSA and invested in 1600 shares of GME, watched it go from 16 to 65. I felt so strongly about the company I sold my position in SQ and got into another 480 shares at $46, but in my taxable brokerage account. I don’t want to pay 40% income tax so I’ll be holding those long term",0.02,0.899,0.081,0.4443
612,GME,"Buy before the run not after.  There’s absolutely no way GME will hit $1,000/share.",0.161,0.839,0.0,-0.3597
613,GME,"I have a ton of longs in other stocks that I’m not willing to sell, and while I do believe in GME long term I’m not longing it. I would also be in it for the incoming short. TSLA’s been great to me, but if there’s money to be made in GME it might be time. Thoughts?",0.0,0.934,0.066,0.3792
614,GME,I was told that there was no way that GME would hit $100/share,0.167,0.833,0.0,-0.296
615,GME,How can you say that when you don’t know how high GME is going? Do you know OP’s age? You have more time to recover if you’re young. He’s risking maybe a paycheck worth of money.,0.071,0.879,0.051,-0.1926
616,DD,Thanks.   I have a lot of learning to do but maybe one day I will be there.   My friend made a sub called “ moon gang capital “.   Some good DD’s are thrown around there and is where I am currently learning most of the DD process.    Check it out!   You probably don’t need it nor care much but just thought I’d share.    JKHY is a stock we are all currently holding.   Earnings are on 2/2 I believe.,0.042,0.796,0.162,0.8674
617,JKHY,Thanks.   I have a lot of learning to do but maybe one day I will be there.   My friend made a sub called “ moon gang capital “.   Some good DD’s are thrown around there and is where I am currently learning most of the DD process.    Check it out!   You probably don’t need it nor care much but just thought I’d share.    JKHY is a stock we are all currently holding.   Earnings are on 2/2 I believe.,0.042,0.796,0.162,0.8674
618,BB,"Do not buy options with BB. If you want in, buy shares. This isn’t a squeeze and may not rise as quickly as all those retards think. Half of them apparently have no idea how to read a chart much less a gamma chart. $16 and up will be volume and news. Buy shares. Options can fuck you hard.

And if you’ve never played options, might as well burn your money in a fire pit. Understand how options actually work and study a chart. I love WSB but the big boys are the ones with the real money. BB was trading over 150 million in volume daily last week (they were averaging like 9 million prior) That’s not WSB. That’s billions in big dick institutions. Something is happening but we don’t exactly know what yet.

So buy shares. It’s much safer and ensures you a ride to the moon. I do believe in BB. Holding 2,000 shares at $9.65. Will buy more on dips. 

Good luck friend.",0.068,0.751,0.18,0.9677
619,BB,"You are correct.

There is a website that tracks WSB and the number of ticker symbol keywords per day.  If you look at the chart, WSB didn't start heavily talking about BB until AFTER the first day it spiked.

I think this is legit a case of the big boys knowing something about BB and WSB picking up on it the day after.

My guess is BB is an acquisition target... just a gut feeling... would not at all be surprised if news breaks they are being acquired in the next 1-3 months.",0.0,0.965,0.035,0.296
620,BB,Couldn’t agree more. Shares are the way on a sleeping giant stock like BB.,0.0,0.572,0.428,0.7574
621,BB,i disagree. buying LEAPS on deep ITM BB calls arent a bad idea,0.18,0.623,0.197,0.0644
622,BB,"Agree with this, I was debating between them too, biggest reason to grab shares is simply that there is an indefinite timeframe for whether or not BB will rise. Buying calls, means your limited to a window of time. This is only good if you expect a particular event to happen to change the stocks price, BB is more of a long gamble.",0.029,0.853,0.118,0.6908
623,BB,"And BB has a much higher market cap (more shares outstanding) so it'll be a lot harder for that other board to move the stock.  Also, not as many shares are locked up, nor do I believe BB is currently shorted as heavily as GME.  The other board is creating a ton of hype around it, and you're definitely right about it gaining the attention of the big money.",0.0,0.832,0.168,0.8779
624,GME,"And BB has a much higher market cap (more shares outstanding) so it'll be a lot harder for that other board to move the stock.  Also, not as many shares are locked up, nor do I believe BB is currently shorted as heavily as GME.  The other board is creating a ton of hype around it, and you're definitely right about it gaining the attention of the big money.",0.0,0.832,0.168,0.8779
625,LAC,"I’m going to get back into $LAC (Lithium Americas) this week probably.  Made some good money shorting it from the peak a while ago and it’s looking to fill the gap back up now.

What do you think?",0.0,0.925,0.075,0.4404
626,EV,Find companies that supply the materials for EV batteries,0.0,1.0,0.0,0.0
627,EV,"Yeah, it’s either a commodity bubble prime for shorting or a long shot company that might be worth grabbing a few leap calls on.  I can’t really decide right now.

EV-related anything is both arguably the future and a market bubble right now.  Reminds me a lot of the DotCom days when anything even remotely internet-related went parabolic, but then a lot of these companies devalued by 85% or more during the crash.  I still think we’ll see a lower low than March 2020 as everything so far has been a liquidity-driven rather than growth-driven climb so far, so when the time comes I know a few stocks I’ll be short on.

Cheers.  Let me know your thoughts if you find any other volatile stocks you like in the EV field.",0.082,0.839,0.079,-0.1143
628,TV,"Disclosure: Roku investor with $475 price target

There's still a lot of opportunity to:

- convert U.S. households to cord cutters (~31.2 million or ~24.1% of U.S. households in 2020 ➡️ 46.6 million households or 35.4% of U.S. households by 2024)

-  convert linear TV advertising spending to connected TV advertising spending (~$8.11 billion or 3.5% of total U.S. media ad spending ➡️ $18.29 billion or 5.4% of tota U.S.l media ad spending by 2024)

- international opportunity

After a couple of more paychecks, this will be my biggest position on a cost basis.",0.0,0.939,0.061,0.6808
