,ticker,comment,username,score,permalink,neg,neu,pos,compound
0,SPCE," Look man, I'm an investor but it's not hard to believe someone would legitimately think this is not going to be a successful company.

Do not fucking invest in SPCE if you seriously think this isn't a huge risk.",wryguy1987,5,/r/investing/comments/nsi8er/virgin_galactic_spce_has_successful_test_flight/h0nhdt0/,0.099,0.705,0.195,0.6566
1,SPCE, SPCE $0 by 2025,Yung_Elon,1,/r/investing/comments/nsi8er/virgin_galactic_spce_has_successful_test_flight/h0nusg6/,0.0,1.0,0.0,0.0
2,AMC, Same reason everyone is bashing AMC right now. To drive the stock down and short it. Greed. That’s it.,iOSh4cktiV8or,-12,/r/investing/comments/nsi8er/virgin_galactic_spce_has_successful_test_flight/h0msose/,0.13,0.87,0.0,-0.4019
3,GME, Cant wait till GME takes this whole failed system down,The_Peregrine_,-3,/r/investing/comments/nsi8er/virgin_galactic_spce_has_successful_test_flight/h0nrld7/,0.268,0.732,0.0,-0.5106
4,VG," To crush dreams of innovation by **shorting** the company for profit, like they've been doing for years.  
These people don't care or believe in what VG is doing...  
They care about **power**. And where does power come from?  
That's right, power comes from **money**.  
They get to control what companies live or die, and get paid to do it.  
Everyone else loses. That's how they stay on top and get to control the narrative.",Crazyfistz,-2,/r/investing/comments/nsi8er/virgin_galactic_spce_has_successful_test_flight/h0om4xt/,0.146,0.715,0.14,-0.1421
5,SPCE," LOL. Yeah, no, nobody is hankering to own SPCE. Sorry.",N_O_O_D_L_E,14,/r/investing/comments/nsi8er/virgin_galactic_spce_has_successful_test_flight/h0nvnto/,0.23,0.394,0.376,0.4995
6,GME," Is space tourism viable or not based on your research.

How many people do you think will want to pay that money, how much will the company be making after all the costs. Does this match the current valuation of the company? (How would you even valuate such a company?)

These are just things you should think about when deciding whether or not to let go of a position. Is this stock propped up on real numbers or just sentiment - which could go either way on the drop of a dime? 

After GME people seem to think all shorts just spread lies, but many are simply more fundamental investors like the (in)famous Michael Burry.",kunell,3,/r/investing/comments/nsi8er/virgin_galactic_spce_has_successful_test_flight/h0ovk5a/,0.04,0.914,0.046,0.3991
7,AMC, AMC is selling shares by the millions just to fund their operations. It's a mega hype bubble based on zero fundamentals from the underlying business.,TotesHittingOnY0u,26,/r/investing/comments/nsi8er/virgin_galactic_spce_has_successful_test_flight/h0n1yy5/,0.0,0.913,0.087,0.296
8,AMC, No one wants to get stuck owning AMC.,tiger5tiger5,17,/r/investing/comments/nsi8er/virgin_galactic_spce_has_successful_test_flight/h0mz3hh/,0.412,0.588,0.0,-0.4939
9,AMC," > everyone is bashing AMC

AMC is a sick company in decline.",cass1o,2,/r/investing/comments/nsi8er/virgin_galactic_spce_has_successful_test_flight/h0o6ek8/,0.268,0.732,0.0,-0.5106
10,AMC," They dont need to drive the price down, AMC will do it for them by diluting their shares and paying their board bonuses.",kunell,0,/r/investing/comments/nsi8er/virgin_galactic_spce_has_successful_test_flight/h0owzno/,0.0,0.784,0.216,0.7003
11,DD," There's a lot of factors. I'm I to SPCE for $150, so nothing practically, but here's my piece:

1. The Cramer thing

2. There's a few class action suits shaping up at the moment for Virgins Galactic regarding insider manipulation of stock prices. Please read for yourself, I saw 2 this week positively. To me, it seemed like a technical analysis arriving at the wrong conclusion which could have steered investors to believe the path was rosier. Google it. I found it in my eTrade app inside the SPCE/'your holdings' news.

3. What truly got me spooked on this stock was someone on reddit who'd done their own DD and *concluded for themselves* that it's far more a speculative venture (SPCE) due a path to profitability. 
I'm getting the years wrong, but they've been at this a dozen years? And their original timeline was to be up and running this year. Furthermore, he brought up how many flights by how many ships were required to launch daily/weekly at what price simply to strike even. Path to profitability is rocky. 

Don't believe me or anyone out here, fully. Use good tips as a start point for your own analysis. Sometimes the tips pan out, sometimes you're just wanting to YOLO some speculative stock. Just don't lie to yourself why you're in it, have an exit plan before you walk in and stick to it. The key is to eliminate emotion from all transactions.

Good luck",TheMadShatterP00P,33,/r/investing/comments/nsi8er/virgin_galactic_spce_has_successful_test_flight/h0o7ygu/,0.047,0.795,0.158,0.9834
12,SPCE," There's a lot of factors. I'm I to SPCE for $150, so nothing practically, but here's my piece:

1. The Cramer thing

2. There's a few class action suits shaping up at the moment for Virgins Galactic regarding insider manipulation of stock prices. Please read for yourself, I saw 2 this week positively. To me, it seemed like a technical analysis arriving at the wrong conclusion which could have steered investors to believe the path was rosier. Google it. I found it in my eTrade app inside the SPCE/'your holdings' news.

3. What truly got me spooked on this stock was someone on reddit who'd done their own DD and *concluded for themselves* that it's far more a speculative venture (SPCE) due a path to profitability. 
I'm getting the years wrong, but they've been at this a dozen years? And their original timeline was to be up and running this year. Furthermore, he brought up how many flights by how many ships were required to launch daily/weekly at what price simply to strike even. Path to profitability is rocky. 

Don't believe me or anyone out here, fully. Use good tips as a start point for your own analysis. Sometimes the tips pan out, sometimes you're just wanting to YOLO some speculative stock. Just don't lie to yourself why you're in it, have an exit plan before you walk in and stick to it. The key is to eliminate emotion from all transactions.

Good luck",TheMadShatterP00P,33,/r/investing/comments/nsi8er/virgin_galactic_spce_has_successful_test_flight/h0o7ygu/,0.047,0.795,0.158,0.9834
13,SPCE," How much demand is there that people can reasonably afford? Aircraft companies work due to economies of scale and they go bust a lot and are not renowned for profitability, how much do you think space travel will cost? What will happen when one of those aircrafts eventually go wrong and kills a ton of people? SPCE has a long way to go before it can turn a profit and even then its unlikely to ever be a decent one",Tana1234,5,/r/investing/comments/nsi8er/virgin_galactic_spce_has_successful_test_flight/h0oh5a2/,0.125,0.84,0.035,-0.7618
14,VG," * Company history shows it has shit execution over the last decade+ (wikipedia lays it out)
* Current system launches 6 people at a time with at least 3 pilots needed and ground crew with a solid rocket motor. Good luck getting margins high on that.
* Current mothership-launcher system is not scalable. Difficult to go into orbit with minimal payload. They plan on pivoting to point-to-point, but they need a bigger plane which means a ginormous mothership -- almost certainly bigger than stratolaunch's which is already the largest airplane.
* We can jerk around about the actual market size for 5 minute experiences costing 6 digit amounts. Just suffice to say it is a huge risk.
* Blue origin will compete with them now so available market will be smaller and margins will be compressed, and SpaceX's starship is likely going to demolish them when it comes out (years out, but VG has zero ability to compete)

They have huge execution risk, market risk and technical risk, not to mention competition -- and it isn't like you will get much upside for taking this risk. Why invest?",FinndBors,13,/r/investing/comments/nsi8er/virgin_galactic_spce_has_successful_test_flight/h0nsoja/,0.108,0.799,0.093,-0.6123
15,AMC, AMC has more liquidity than in its entire history. Movies aren’t going anywhere. Your DD is a cliche.,Boomslangalang,0,/r/investing/comments/nsi8er/virgin_galactic_spce_has_successful_test_flight/h0ourfr/,0.0,1.0,0.0,0.0
16,DD, AMC has more liquidity than in its entire history. Movies aren’t going anywhere. Your DD is a cliche.,Boomslangalang,0,/r/investing/comments/nsi8er/virgin_galactic_spce_has_successful_test_flight/h0ourfr/,0.0,1.0,0.0,0.0
17,VG," Since I wrote this comment elsewhere on VG, they have announced another scientific contract. VG also has over 600  reservations and will reopen sales after Branson's flight.


>There's ample opportunities for space flight contracts out there. Just like the 2018 & 2019 flights, Saturday's flight carried contracted experimental payloads from various universities, as will the next flight.

>The flight after Branson's is the India Air Force Flight with both payload experiments and personnel aboard for astronaut training. Plenty of Private Industry contracts out there to supplement commercial operations in addition to the NASA contracts they already signed.

>Speaking of the [flight schedule:](https://www.nasaspaceflight.com/2021/05/virgin-galactic-another-attempt-new-mexico/)
The second flight will not only have two pilots, but also four additional crew members as mission specialists. The vehicle will be fully equipped with the completed interior, as unveiled in 2020.

>The third flight will demonstrate the experience of a private astronaut, with founder Sir Richard Branson expected to fly to space.

>The fourth flight will be the introductory operational flight and will demonstrate microgravity research and professional astronaut training markets. The company expects to earn its first full revenue of $2 million, an equivalent of $500,000 per seat. Current pricing is estimated to be equivalent to $600,000 per seat.",shelfdog,4,/r/investing/comments/nsi8er/virgin_galactic_spce_has_successful_test_flight/h0nlf2y/,0.0,0.977,0.023,0.3818
18,LEO, virgin has plans and is already working towards more than tourism. hosting scientific experiments seems to be a big money play in LEO visits,coldhardcorndog,8,/r/investing/comments/nsi8er/virgin_galactic_spce_has_successful_test_flight/h0n1i7a/,0.0,0.902,0.098,0.34
19,VG," Blue Origin have been just as shitty if not more on execution as VG.

Space stuff is incredibly hard, and the scene is littered with the bodies of companies that tried.

The ONLY successful companies are SpaceX and RocketLab (1/2 the age of VG or BO).

Rocketlab has actual revenue and a real business plan, and even then it’s questionable whether they’ll be worth anything.",clocksfornipples,3,/r/investing/comments/nsi8er/virgin_galactic_spce_has_successful_test_flight/h0o7evj/,0.104,0.817,0.079,-0.2006
20,GME," Young investors get sucked in by glitter.  Rocket ships have that.  Besides, the long term prospects of a new company don't have to be considered for a short term investor.  GME will tank one day but a lot of people will have made a lot of money.  Of course, there are losers too, but in any case the stock price in five years is irrelevant.",Baybob1,6,/r/investing/comments/nsi8er/virgin_galactic_spce_has_successful_test_flight/h0nld3c/,0.1,0.876,0.024,-0.7184
21,DD," >Use the DD as a starting point for your own research

You missed the disclaimer.

Also, the multiple expert AMAs disagree with your sentiment.",ViperXAC,2,/r/investing/comments/nsi8er/virgin_galactic_spce_has_successful_test_flight/h0n7dvh/,0.186,0.814,0.0,-0.5859
22,SPCE," Might be a good thing you didn’t invest with them, their track record isn’t the best.

https://www.reddit.com/r/SPCE/comments/nsj631/for_those_wanting_to_know_about_kerrisdale/?utm_source=share&utm_medium=ios_app&utm_name=iossmf

Then again the average hedge fund can’t beat the S&P 500 index anyways",joey-tv-show,4,/r/investing/comments/nsi8er/virgin_galactic_spce_has_successful_test_flight/h0of9kz/,0.0,0.792,0.208,0.7964
23,SPCE," Dude, look at how hard you're trying to find reasons to prop up SPCE and knock down other arguments and ask yourself if you're being a neutral observer.

It's obvious to me that you're not, and no matter what the answer to your question is, it won't matter because you'll dismiss it if you don't like it.

The reality is that SPCE is positioning itself in a hyper-niche market and hoping that basically everyone who can afford it will want to do this many times. Their entire market is only ultra high net worth individuals (you basically have to be to find the cost acceptable), and there's only like 250k of them on the planet. (Reference: https://en.m.wikipedia.org/wiki/Ultra_high-net-worth_individual)

If only 10% decide this is totally awesome and they would rather do this than the other things you could do for $200k (and getting 10% of people to do any particular commercial thing recreationally is quite high - Disneyworld can probably claim that and not much else), they'll only ever make $5B in *revenue*. That's less than their current market cap. And yes, I know there's some shitty assumptions in there (some of the most retardedly rich people may go a few times or bring some friends, other people occasionally become ridiculously rich, etc) but the point remains that it's very plausible they're incredibly overvalued, so asking ""why would someone write all this?"" seems like you're discounting the very real possibility that this company is never going to be able to justify is valuation. I'm not saying it won't - I'm just trying to encourage you not to outright discount arguments that it will. It's not like you have to be crazy to think that SPCE could significantly underperform its valuation.",C4Diesel,34,/r/investing/comments/nsi8er/virgin_galactic_spce_has_successful_test_flight/h0odc3y/,0.078,0.85,0.071,-0.0531
24,IBKR," I was with Scottrade which got bought out by TDA for about 10+ years. I recently called and tried to negotiate with them on the margin rates offered because I really wanted to start using margin and leverage but TDA rates are jokes compared to IBKR pro & lite, M1 finance, and even ""kiddy tier"" Robinhood.

I wouldn't say I had a huge account, but it was well over 600k. I called noting my long customer record, account value, and specifically listed competitors and competitor rates. I clearly defined that what rate I wanted too.

So their rates are ridiculously high and only suitable for trading. I'm 98% LT investments, my buys are intended to be 1yr+, and even my shortest sales (2020 market means some things move up too quick too fast) will be months rather than days.

When you're working with long term margin rates like these won't cut it in a normal business environment. https://www.tdameritrade.com/pricing/margin-and-interest-rates.html

I asked for a reduced or flat tiered rate of 2-4%. They did comply and reduced my rates. However it was not flat, but tiered like the link I showed. Only my tiered rates were 7.1%/6.85/6.6/5.60/...../4.50%. The lowest being 4.50% if I was borrowing amounts over +$1M. IKBR lite charging 2.56% from $0. IBKR pro starts at 1.56% and drops even more if you're working big boy numbers.

It's not what I wanted so I just transferred 95% of my portfolio over to IBKR. It's a pain to adjust, but my only regret is showing any customer loyalty or trying work it out with TDA and **NOT** leaving **much MUCH sooner**. I still keep my TDA account open for the record of past trades with a few securities in it, but at this point I'm checked out just leaving a bridge unburnt. I wouldn't go back if they offered me the same margin rates. Craziest part in all this is TDA basically ***BOUGHT*** my account from Scottrade via acquisition. I assume they paid a hefty price only to let me go.

BTW, I don't think TDA is that bad. It's just not what I need anymore. Also back in the day Scottrade and TDA had physical offices with real people I knew there who I could contact for support/service. Those got closed. Also IBKR got a lot more enticing after releasing LITE and current margin rates being so low.",zxc123zxc123,13,/r/investing/comments/nsvgka/negotiating_brokerage_fees_and_commissions/h0pgltw/,0.066,0.865,0.069,0.0814
25,LITE," I was with Scottrade which got bought out by TDA for about 10+ years. I recently called and tried to negotiate with them on the margin rates offered because I really wanted to start using margin and leverage but TDA rates are jokes compared to IBKR pro & lite, M1 finance, and even ""kiddy tier"" Robinhood.

I wouldn't say I had a huge account, but it was well over 600k. I called noting my long customer record, account value, and specifically listed competitors and competitor rates. I clearly defined that what rate I wanted too.

So their rates are ridiculously high and only suitable for trading. I'm 98% LT investments, my buys are intended to be 1yr+, and even my shortest sales (2020 market means some things move up too quick too fast) will be months rather than days.

When you're working with long term margin rates like these won't cut it in a normal business environment. https://www.tdameritrade.com/pricing/margin-and-interest-rates.html

I asked for a reduced or flat tiered rate of 2-4%. They did comply and reduced my rates. However it was not flat, but tiered like the link I showed. Only my tiered rates were 7.1%/6.85/6.6/5.60/...../4.50%. The lowest being 4.50% if I was borrowing amounts over +$1M. IKBR lite charging 2.56% from $0. IBKR pro starts at 1.56% and drops even more if you're working big boy numbers.

It's not what I wanted so I just transferred 95% of my portfolio over to IBKR. It's a pain to adjust, but my only regret is showing any customer loyalty or trying work it out with TDA and **NOT** leaving **much MUCH sooner**. I still keep my TDA account open for the record of past trades with a few securities in it, but at this point I'm checked out just leaving a bridge unburnt. I wouldn't go back if they offered me the same margin rates. Craziest part in all this is TDA basically ***BOUGHT*** my account from Scottrade via acquisition. I assume they paid a hefty price only to let me go.

BTW, I don't think TDA is that bad. It's just not what I need anymore. Also back in the day Scottrade and TDA had physical offices with real people I knew there who I could contact for support/service. Those got closed. Also IBKR got a lot more enticing after releasing LITE and current margin rates being so low.",zxc123zxc123,13,/r/investing/comments/nsvgka/negotiating_brokerage_fees_and_commissions/h0pgltw/,0.066,0.865,0.069,0.0814
26,TDA," I was with Scottrade which got bought out by TDA for about 10+ years. I recently called and tried to negotiate with them on the margin rates offered because I really wanted to start using margin and leverage but TDA rates are jokes compared to IBKR pro & lite, M1 finance, and even ""kiddy tier"" Robinhood.

I wouldn't say I had a huge account, but it was well over 600k. I called noting my long customer record, account value, and specifically listed competitors and competitor rates. I clearly defined that what rate I wanted too.

So their rates are ridiculously high and only suitable for trading. I'm 98% LT investments, my buys are intended to be 1yr+, and even my shortest sales (2020 market means some things move up too quick too fast) will be months rather than days.

When you're working with long term margin rates like these won't cut it in a normal business environment. https://www.tdameritrade.com/pricing/margin-and-interest-rates.html

I asked for a reduced or flat tiered rate of 2-4%. They did comply and reduced my rates. However it was not flat, but tiered like the link I showed. Only my tiered rates were 7.1%/6.85/6.6/5.60/...../4.50%. The lowest being 4.50% if I was borrowing amounts over +$1M. IKBR lite charging 2.56% from $0. IBKR pro starts at 1.56% and drops even more if you're working big boy numbers.

It's not what I wanted so I just transferred 95% of my portfolio over to IBKR. It's a pain to adjust, but my only regret is showing any customer loyalty or trying work it out with TDA and **NOT** leaving **much MUCH sooner**. I still keep my TDA account open for the record of past trades with a few securities in it, but at this point I'm checked out just leaving a bridge unburnt. I wouldn't go back if they offered me the same margin rates. Craziest part in all this is TDA basically ***BOUGHT*** my account from Scottrade via acquisition. I assume they paid a hefty price only to let me go.

BTW, I don't think TDA is that bad. It's just not what I need anymore. Also back in the day Scottrade and TDA had physical offices with real people I knew there who I could contact for support/service. Those got closed. Also IBKR got a lot more enticing after releasing LITE and current margin rates being so low.",zxc123zxc123,13,/r/investing/comments/nsvgka/negotiating_brokerage_fees_and_commissions/h0pgltw/,0.066,0.865,0.069,0.0814
27,TD," I got $0 fixed, $0.10 per options contract from TD Ameritrade.",EdWilkinson,2,/r/investing/comments/nsvgka/negotiating_brokerage_fees_and_commissions/h0puegq/,0.0,1.0,0.0,0.0
28,TDA, Called TDA and asked nicely if they could lower my options contract pricing. They asked me a few questions including how many trades I do per month in my other account and what my net liquidating value if the other acct was,tonykony,2,/r/investing/comments/nsvgka/negotiating_brokerage_fees_and_commissions/h0p0pfp/,0.049,0.831,0.119,0.4767
29,TD," With TD Ameritrade, I rarely ever paid a commission because they gave me free trades any time I asked. One time the web site was down and I couldn't buy a stock I wanted so I complained and they gave me 25 free trades. And when they released their mobile app, it was so shitty that it was barely functional for years and I'd just complain that the app was fucking up (it was) and they'd just keep giving me more free trades.

Another time I had a position drop to nearly zero and it would have costed more in commission to sell than I'd get for selling them and I just wanted them gone from my account. They gave me 10 free trades and said to use one to unload that position. 

I'm not sure if they were that generous to everyone, but I had an ""Apex"" level account when that was a thing - you needed to maintain a certain portfolio size or a certain number of trades per year and you'd get prioritized customer support, access to more research and reports than standard accounts, lower commissions, etc.",irresponsible_owl,5,/r/investing/comments/nsvgka/negotiating_brokerage_fees_and_commissions/h0pixo6/,0.065,0.818,0.117,0.8448
30,TD," I was on TD Ameritrade and I only had like $750 in my account, sent a email and they lowered mine from $4.99 to $2.99. All I had to do was ask and state this would make me do a few more trades that would probably end up making them more money.",Tdech12,3,/r/investing/comments/nsvgka/negotiating_brokerage_fees_and_commissions/h0phjay/,0.031,0.918,0.051,0.25
31,PDT," Yup. Usually once you're over 25k (past the PDT requirements) they start to pay more attention to you. 6, 7, and 8 figure club progressively get even more attention.",truemeliorist,19,/r/investing/comments/nsvgka/negotiating_brokerage_fees_and_commissions/h0ooc68/,0.049,0.951,0.0,-0.1027
32,IBKR, Which broker are you using? I’m with IBKR..,doumination,4,/r/investing/comments/nsvgka/negotiating_brokerage_fees_and_commissions/h0p3cm5/,0.0,1.0,0.0,0.0
33,IBKR," Seems like the same price anyway? 1$ per contact is also what I get with IBKR, tho not sure if there's also the 10$ cap per leg.",skeptophilic,2,/r/investing/comments/nsvgka/negotiating_brokerage_fees_and_commissions/h0paj1h/,0.069,0.843,0.088,0.1376
34,RH," Yeah when im trading 800 contracts with RH, its free, I know, fill price etc etc but with TD i would be paying up the ass in fees, especially if im closing a losing trade, now im losing even more. They wouldnt lower my fees due to my account history. Im like well yeah Im not gonna go trade 5000 contracts at .65 buy x sell",LargeHotdog,-1,/r/investing/comments/nsvgka/negotiating_brokerage_fees_and_commissions/h0phhdh/,0.145,0.665,0.19,0.1599
35,TD," Yeah when im trading 800 contracts with RH, its free, I know, fill price etc etc but with TD i would be paying up the ass in fees, especially if im closing a losing trade, now im losing even more. They wouldnt lower my fees due to my account history. Im like well yeah Im not gonna go trade 5000 contracts at .65 buy x sell",LargeHotdog,-1,/r/investing/comments/nsvgka/negotiating_brokerage_fees_and_commissions/h0phhdh/,0.145,0.665,0.19,0.1599
36,TD," Ya I have like $1.44 in that account, I’m on Robinhood for gamble options and fidelity for real plays now. Slowly moved away from TD over the years. It’s not that they are a bad company I just wanted to try something new.",Tdech12,3,/r/investing/comments/nsvgka/negotiating_brokerage_fees_and_commissions/h0pjadi/,0.078,0.822,0.1,0.0
37,RH," The extra cost from RH is just hidden from you, friend",PercentageNegative98,13,/r/investing/comments/nsvgka/negotiating_brokerage_fees_and_commissions/h0pmnw1/,0.0,0.758,0.242,0.4939
38,TD," I prefer TD Ameritrade to Fidelity, but I opened the Fidelity account because TD was still charging a commission for OTC stocks.",lone_eagle54,2,/r/investing/comments/nsvgka/negotiating_brokerage_fees_and_commissions/h0pqec4/,0.0,1.0,0.0,0.0
