,ticker,comment,username,score,permalink,neg,neu,pos,compound
0,POW, POW when you're a short seller,Strangedreamest,1,/r/pennystocks/comments/lzc90g/its_all_a_matter_of_perception_bois_and_queens_if/gq1ej9h/,0.0,1.0,0.0,0.0
1,CTXR, CTXR is going to give me PTSD,anonymaus74,24,/r/pennystocks/comments/lzbsiw/guilty_of_charge/gq0w7ww/,0.0,1.0,0.0,0.0
2,DD, I swear I don’t do no fuccin DD at least not anymore ‼️‼️...still not selling down holding all till $10 🙏🏾🙏🏾,alwaysalvin_,3,/r/pennystocks/comments/lzbsiw/guilty_of_charge/gq1thf3/,0.167,0.833,0.0,-0.34
3,DD, At this point it in itself is information gathering and is now DD,BhinoTL,3,/r/pennystocks/comments/lzbsiw/guilty_of_charge/gq19kvs/,0.0,1.0,0.0,0.0
4,NEXT," SGMD ONLY DOWN 80%, NEXT STOP IS THE MOON",Over4All,5,/r/pennystocks/comments/lzbsiw/guilty_of_charge/gq1zqb6/,0.268,0.732,0.0,-0.4466
5,DD," A lot of people on here ""joke"" about picking their stocks based on no DD of their own, and just cherry picking pennies from the most viral stocks on here on a given day

THIS is why it's important to know what you have in your portfolio and why you have it. If you got a lot of weak speculative pump and dump garbage and you don't even understand what the company does, you will not feel comfortable buying dips.",napoelonDynaMighty,2,/r/pennystocks/comments/lzhnlr/chads_would_never/gq4tbbf/,0.123,0.839,0.038,-0.8021
6,OUT," Jesus christ, ILL KEEP MY EYES OUT FOR ""PATTERN"" THEN THANKS SKILLED TRADER!",Bullballs42069,7,/r/pennystocks/comments/lzhnlr/chads_would_never/gq44h5d/,0.191,0.596,0.213,0.1007
7,DD," I need to follow my ground rules. 10% total loss and cut the stock. I'm now sitting on some at 50% in the red and am debating whether or not just to hold indefinitely. 

I'm comfortable with my DD for the long haul but also realize I could just eventually reenter the position when things stabilize. Timing won't be perfect, do loss of some gains, but it doesn't seem we've reached a bottom on this correction.",ErrantVenture194,6,/r/pennystocks/comments/lziz5b/what_ive_learned_from_this_red_month/gq3kxzk/,0.14,0.797,0.063,-0.6532
8,DD," Spend more time looking at the graphs then, imo.  It is a clear visual to depict whether or not you are in fact buying high.  Even if I like a stock I rarely buy after it has had significant gains.  I go through 1d, 2, 5d , 10d, etc... to see the whole picture... Also, set your goals for your stocks and stick to them. If you are holding long term because you did DD than don't even look at the stock unless something obviously catastrophic happened.  The daily ups and downs should not be emotional if you have a positive outlook for the companies future.  Also, now is a rough time as things are dropping almost everyday.  So it might be a good time to take a break and see where the chips fall and how potential good stocks bottom out at hot dealt prices.",Hollowkrist,3,/r/pennystocks/comments/lziz5b/what_ive_learned_from_this_red_month/gq4jas6/,0.031,0.845,0.124,0.9194
9,BNGO," ALPP, TSNP, BNGO... all found here early early",CommonNo9892,10,/r/pennystocks/comments/lzszyo/what_stock_were_you_able_rode_to_exponential/gq46oik/,0.0,1.0,0.0,0.0
10,PENN," PENN. Got in at 4.52, sold half at 124, still riding the other half.",isorom19,13,/r/pennystocks/comments/lzszyo/what_stock_were_you_able_rode_to_exponential/gq45y4d/,0.0,1.0,0.0,0.0
11,BNGO," BNGO, MVIS, SOLO, OEG

Edit: I also got Ocgn at 69 cents and sold it at 3.40",peterprograms,10,/r/pennystocks/comments/lzszyo/what_stock_were_you_able_rode_to_exponential/gq3wni6/,0.0,1.0,0.0,0.0
12,MVIS," BNGO, MVIS, SOLO, OEG

Edit: I also got Ocgn at 69 cents and sold it at 3.40",peterprograms,10,/r/pennystocks/comments/lzszyo/what_stock_were_you_able_rode_to_exponential/gq3wni6/,0.0,1.0,0.0,0.0
13,OEG," BNGO, MVIS, SOLO, OEG

Edit: I also got Ocgn at 69 cents and sold it at 3.40",peterprograms,10,/r/pennystocks/comments/lzszyo/what_stock_were_you_able_rode_to_exponential/gq3wni6/,0.0,1.0,0.0,0.0
14,SOLO," BNGO, MVIS, SOLO, OEG

Edit: I also got Ocgn at 69 cents and sold it at 3.40",peterprograms,10,/r/pennystocks/comments/lzszyo/what_stock_were_you_able_rode_to_exponential/gq3wni6/,0.0,1.0,0.0,0.0
15,OCGN, Had OCGN at an average of 0.8 and panic sold at 1.7 even though I had planned to hold it all through the pandemic...,costelloart,6,/r/pennystocks/comments/lzszyo/what_stock_were_you_able_rode_to_exponential/gq48ib4/,0.13,0.87,0.0,-0.5106
16,PLUG, Got PLUG at $2 and sold it at $66 when I closed my Robinhood account.,superman853,4,/r/pennystocks/comments/lzszyo/what_stock_were_you_able_rode_to_exponential/gq4i1f0/,0.0,1.0,0.0,0.0
17,EYES," EYES was the most recent AND my most successful made me so happy to see it soar :,)",EkajEX,8,/r/pennystocks/comments/lzszyo/what_stock_were_you_able_rode_to_exponential/gq4ed5u/,0.0,0.644,0.356,0.87
18,VYGR, VYGR. Just look at their chart. Insane. I think I got out at $8.,probablynotyouruncle,3,/r/pennystocks/comments/lzszyo/what_stock_were_you_able_rode_to_exponential/gq4fbv5/,0.197,0.803,0.0,-0.4019
19,AMP," AMP Alternative medical products: Went nowhere in 2020 despite good news and all that. Than in Jan 2021 it took a good leap with +150% in less than a month even though no huge news where announced. Now dipped down 50% again and still dipping. But I'll hold as it's more of a long term play for me because they have a really low market cap and they will, at some point, start to pay dividends (still far in the distant future though). I'll lean back and watch what might unfold in the near future or even further.",asteriskLich,1,/r/pennystocks/comments/lzszyo/what_stock_were_you_able_rode_to_exponential/gq4tzgp/,0.105,0.849,0.046,-0.6255
20,UAVS," UAVS, bought in September for $2.68, sold way too soon January at $8.96. Kicked myself later, but still made out good.",ACP1934,1,/r/pennystocks/comments/lzszyo/what_stock_were_you_able_rode_to_exponential/gq54kb0/,0.0,0.839,0.161,0.5927
21,NVAX," Got in at 0.02, holding very long term!
Also rode NVAX from 2019 to 2020, very lucrative.",BlackKhajiit,13,/r/pennystocks/comments/lzszyo/what_stock_were_you_able_rode_to_exponential/gq3zr9y/,0.0,1.0,0.0,0.0
22,DD," Yeah man, I wish there were more serious discussion of things like that around here, as well as look scrutiny of the data. Even just being honest and saying ""I picked the random stocks that stuck out to me when I read the DD"" would be helpful--maybe investing is all a magic touch, maybe there's a systematic way of doing it everyone can copy. But we won't find out unless people seriously discuss results and DD instead of going ""In for 2000 at $0.04"" in the comments.",geodesuckmydick,3,/r/pennystocks/comments/lzszyo/what_stock_were_you_able_rode_to_exponential/gq4vowo/,0.057,0.806,0.137,0.818
23,BNGO," I got in BNGO as my very first buy. I read about it somewhere on Reddit (probably here) and the $0.88 price tag at that time seemed perfect for my purpose: just wanted to test my new trading app - make a buy, then turn around and sell it. Literally my first trade.

Ended up in at I think $0.91, maybe for like 50 shares or so - then couldn’t BELIEVE my luck when I got out - shortly thereafter around $1.10.

Yeah. Literally watched it soar over the course of the next 24hrs or so, lol.",tykogars,10,/r/pennystocks/comments/lzszyo/what_stock_were_you_able_rode_to_exponential/gq44bcn/,0.0,0.828,0.172,0.9452
24,BNGO," I remember being stupidly worried about BNGO at like 3 dollars during a dip, thinking i might lose my money lmao, luckily i held.",bluthscottgeorge,5,/r/pennystocks/comments/lzszyo/what_stock_were_you_able_rode_to_exponential/gq43xfw/,0.258,0.425,0.317,0.4215
25,SP," Really man... just following up on other people's suggestions and a little luck. I would say the biggest thing is looking for ""disruptors"" (sp?) that have a few things going for them and great leadership. It's hard to say. Don't be afraid to debate people if needed for some clarity on certain things as well. I really put up a fight w people who were hyping ALPP at .20-.30 cause I had no idea how the SP was still so low after several years of being in business, etc etc, a couple other things as well I was unsure about... but the biggest thing that put me at peace getting into it was being able to trust the leadership behind the company. A lot of P&D's are easy to identify by the leader/s or lack of pretty quickly...",Service-Fickle,5,/r/pennystocks/comments/lzszyo/what_stock_were_you_able_rode_to_exponential/gq4c6lq/,0.073,0.74,0.187,0.9596
26,SP, nice summary thanks the focus on leadership is sound advice imo thanks! just for clarification SP is share price?,Then_Firefighter1646,2,/r/pennystocks/comments/lzszyo/what_stock_were_you_able_rode_to_exponential/gq4f06w/,0.0,0.575,0.425,0.8777
27,AI," I am in AITX and have a tremendous feeling about it. I haven't dug in a *crazy* amount, but everything I've seen I am high on. AI is the future of tech, and finding a couple solid early entries are potential retirement plans.",Service-Fickle,2,/r/pennystocks/comments/lzszyo/what_stock_were_you_able_rode_to_exponential/gq4e8ux/,0.0,0.917,0.083,0.2846
28,HT," High Tide. It's my only penny stock lol, but I'm big on them.

Great team, actually profitable, not drowning in debt, they own quite a few well known brands like grasscity.com and the community is grounded and growing. HT can easily reverse split to qualify for nasdaq if they ever want to, but the stock should be able to get there naturally.

It's been very good to me❤",Aheuhue,16,/r/pennystocks/comments/lzh0dq/gun_to_your_head_what_one_stock_do_you_pick_and/gq3uwah/,0.0,0.646,0.354,0.9838
29,CTO," ABML.  

CTO is brilliant ex-Tesla and their recycling and extraction process is the best in the market.  With EVs on the rise and a huge projected increase in batteries to deal with, the market will explode.  They are still pre-revenue with multiple catalysts this year including finalizing permitting and starting construction on first plant, uplist to NASDAQ, and maybe some potential partnerships on the way.  80% margins and plans to build several absolutely massive plants with large capacity, revenue will explode once they get moving.  Go check out the DD, I’ve been in this a few months and I believe in it 100%, I’m all in.  This is 80% of my investment portfolio at the moment.  They’ve had a silent period over the past month due to S-3 requirements which has lowered the price from $4 to $2 so it’s an amazing time to buy in.  Some rumors of news and S-3 period ending this week so it could get fun shortly...",Electronic-Ad5067,17,/r/pennystocks/comments/lzh0dq/gun_to_your_head_what_one_stock_do_you_pick_and/gq37ghh/,0.009,0.876,0.116,0.961
30,DD," ABML.  

CTO is brilliant ex-Tesla and their recycling and extraction process is the best in the market.  With EVs on the rise and a huge projected increase in batteries to deal with, the market will explode.  They are still pre-revenue with multiple catalysts this year including finalizing permitting and starting construction on first plant, uplist to NASDAQ, and maybe some potential partnerships on the way.  80% margins and plans to build several absolutely massive plants with large capacity, revenue will explode once they get moving.  Go check out the DD, I’ve been in this a few months and I believe in it 100%, I’m all in.  This is 80% of my investment portfolio at the moment.  They’ve had a silent period over the past month due to S-3 requirements which has lowered the price from $4 to $2 so it’s an amazing time to buy in.  Some rumors of news and S-3 period ending this week so it could get fun shortly...",Electronic-Ad5067,17,/r/pennystocks/comments/lzh0dq/gun_to_your_head_what_one_stock_do_you_pick_and/gq37ghh/,0.009,0.876,0.116,0.961
31,FLT," FLT aka TAKOF  
Because it's a nascent company with solid management, plenty of cash, and an industry on the verge of a range of possibilities/opportunities. Also, because I understand the field intimately. There may be better picks, but I don't understand those enough to be as confident.",dr_one_stop,5,/r/pennystocks/comments/lzh0dq/gun_to_your_head_what_one_stock_do_you_pick_and/gq3o686/,0.0,0.841,0.159,0.7615
32,DNN, DNN uranium bull market is very convincing,ItsmeKIMOCHI4,3,/r/pennystocks/comments/lzh0dq/gun_to_your_head_what_one_stock_do_you_pick_and/gq2nqhp/,0.0,0.667,0.333,0.4576
33,UWMC, UWMC - $17B market cap and will be added to Russell 1000 and 3000 end of March,fino_nyc,3,/r/pennystocks/comments/lzh0dq/gun_to_your_head_what_one_stock_do_you_pick_and/gq3lyf5/,0.0,1.0,0.0,0.0
34,FLT, TAKOF or FLT.V,Jaloosk,7,/r/pennystocks/comments/lzh0dq/gun_to_your_head_what_one_stock_do_you_pick_and/gq2493c/,0.0,1.0,0.0,0.0
35,PLTR," PLTR, HITIF or ARKK",GrumpLife,6,/r/pennystocks/comments/lzh0dq/gun_to_your_head_what_one_stock_do_you_pick_and/gq2bblo/,0.0,1.0,0.0,0.0
36,SENS, SENS,daddydilf69,3,/r/pennystocks/comments/lzh0dq/gun_to_your_head_what_one_stock_do_you_pick_and/gq2p0l3/,0.0,1.0,0.0,0.0
37,OCGN, OCGN,Cognitive_Skyy,3,/r/pennystocks/comments/lzh0dq/gun_to_your_head_what_one_stock_do_you_pick_and/gq22gdn/,0.0,1.0,0.0,0.0
38,OBSV," OBSV.  

It currently has a New Drug Application in with the FDA for Yselty, which has the potential to be the best in class drug treatment for uterine fibroid.  They are running phase trials on it for treatment of endometriosis.  But are great catalysts for growth this year.  

They have other drugs in the pipeline too, which I expect to be smaller catalysts. 

Recent offering for 50 million should solve cash flow problems for more than a year.

Various analysts have buy ratings with price targets on them ranging from 10-28.",UMHB_Prof,2,/r/pennystocks/comments/lzh0dq/gun_to_your_head_what_one_stock_do_you_pick_and/gq3iwe3/,0.027,0.843,0.129,0.875
39,CTXR, AABB Mining and precious minerals should put them at 1 dollar alone. Also a new crypto coin and crypto wallet. Couldn’t decide between this and CTXR,spinning_leaves,3,/r/pennystocks/comments/lzh0dq/gun_to_your_head_what_one_stock_do_you_pick_and/gq2q2ad/,0.072,0.794,0.134,0.4019
40,HP," $Cwgyf 
Partnership with HP, and an award from microsoft. 
They are trying to tether little energy generators to the ocean floor that can predict how to move to protect themselves from the waves. Volume started picking up just before the market dipped. Bought in at .0025, and it was up to .008 for a moment there",baconbits2004,1,/r/pennystocks/comments/lzh0dq/gun_to_your_head_what_one_stock_do_you_pick_and/gq3kjvt/,0.0,0.868,0.132,0.785
41,DD, I am surprised no one mentioned RXMD - great DD posted here on reddit and in an excellent position.,luclinEQ,1,/r/pennystocks/comments/lzh0dq/gun_to_your_head_what_one_stock_do_you_pick_and/gq4i4sj/,0.088,0.522,0.39,0.8176
42,FLT, FLT Drone delivery Canada their in bed with air canada and I believe they have some contracts already,Comfortable-Face69,1,/r/pennystocks/comments/lzh0dq/gun_to_your_head_what_one_stock_do_you_pick_and/gq4o2i8/,0.0,1.0,0.0,0.0
43,GTE, I would say GTE. Oil is rising and their last call they talked of paying down debt,raths1,1,/r/pennystocks/comments/lzh0dq/gun_to_your_head_what_one_stock_do_you_pick_and/gq4t7mo/,0.143,0.857,0.0,-0.3612
44,GL," $NSPX.  They’re just coming out of the dark, they’re repositioning themselves for a buyout, they’re current and have a market cap of $2.2m with a first in class cancer drug.  I made my last buy on Friday morning.  I already set a calendar alert in my phone for 3/7/22. We’ll see if I’m as smart as I hope I am.  GL.",adudereadingthings,1,/r/pennystocks/comments/lzh0dq/gun_to_your_head_what_one_stock_do_you_pick_and/gq4va26/,0.07,0.759,0.171,0.6633
45,CC, $NSAV I know you said one BUT.. Although there has been some controversy and mixed emotions over this one there are a lot of good thing coming on the horizon. Do some DD instead of repeating the negatives that you may have read on some boards. I'm projecting 3x my original investment by eom then I may be out to pay off the rest of my CC debt (smarter to keep for a year though) idk yet just tired of these f'n bills. The other is $HITIF but I think that one is obvious.,simsimmie,1,/r/pennystocks/comments/lzh0dq/gun_to_your_head_what_one_stock_do_you_pick_and/gq3kcv8/,0.066,0.895,0.039,-0.128
46,DD, $NSAV I know you said one BUT.. Although there has been some controversy and mixed emotions over this one there are a lot of good thing coming on the horizon. Do some DD instead of repeating the negatives that you may have read on some boards. I'm projecting 3x my original investment by eom then I may be out to pay off the rest of my CC debt (smarter to keep for a year though) idk yet just tired of these f'n bills. The other is $HITIF but I think that one is obvious.,simsimmie,1,/r/pennystocks/comments/lzh0dq/gun_to_your_head_what_one_stock_do_you_pick_and/gq3kcv8/,0.066,0.895,0.039,-0.128
47,NAK," NAK this is the year, the year of NAK baby~

This year is fo sure the year. this time is different!",AdGdy7324,1,/r/pennystocks/comments/lzh0dq/gun_to_your_head_what_one_stock_do_you_pick_and/gq3rs5j/,0.0,0.885,0.115,0.3802
48,IDEX, IDEX. For 10 years.,SmoothCourage,-1,/r/pennystocks/comments/lzh0dq/gun_to_your_head_what_one_stock_do_you_pick_and/gq245y9/,0.0,1.0,0.0,0.0
49,CCIV, CCIV,BrainBomb_,-4,/r/pennystocks/comments/lzh0dq/gun_to_your_head_what_one_stock_do_you_pick_and/gq24nxw/,0.0,1.0,0.0,0.0
50,POWW, POWW,BettingTheFarm2021,0,/r/pennystocks/comments/lzh0dq/gun_to_your_head_what_one_stock_do_you_pick_and/gq2lusp/,0.0,1.0,0.0,0.0
51,ADN, ASX: ADN,SmrtMny,0,/r/pennystocks/comments/lzh0dq/gun_to_your_head_what_one_stock_do_you_pick_and/gq33ndb/,0.0,1.0,0.0,0.0
52,MSFT, MSFT,Dazzling_Buy_1934,-2,/r/pennystocks/comments/lzh0dq/gun_to_your_head_what_one_stock_do_you_pick_and/gq3744m/,0.0,1.0,0.0,0.0
53,OGEN, OGEN,brlcwbblondguy,-2,/r/pennystocks/comments/lzh0dq/gun_to_your_head_what_one_stock_do_you_pick_and/gq232zd/,0.0,1.0,0.0,0.0
54,EDIT, $PLTR hands down!  EDIT. Sorry penny stocks: $CWSFF.,dogberg144,-9,/r/pennystocks/comments/lzh0dq/gun_to_your_head_what_one_stock_do_you_pick_and/gq243h3/,0.185,0.815,0.0,-0.1511
55,CTXR, I’m long CTXR. Held through the past three weeks with flying colors. Their phase lll catheter study should be wrapping up within the next month. If they gain FDA approval it could easily become a $5+ stock by the end of year.,FiddleFacked,2,/r/pennystocks/comments/lzh0dq/gun_to_your_head_what_one_stock_do_you_pick_and/gq53o6w/,0.0,0.81,0.19,0.836
56,CMC, I agree with this. Hold for one year or more. I'm already in for 200k shares at 7 cents CDN on CMC.CN. Same compnyy on the Canadian exchange. Love what they're doing!!! Listen to Robett McWhirter on BNN Bloomberg talk about Cielo. That's why,dogberg144,1,/r/pennystocks/comments/lzh0dq/gun_to_your_head_what_one_stock_do_you_pick_and/gq24f1q/,0.0,0.8,0.2,0.8682
57,IMO, I’m with OP.  Literally YOLOed STHC. Party hasn’t started yet IMO.,powerfulSRE,6,/r/pennystocks/comments/lzh0dq/gun_to_your_head_what_one_stock_do_you_pick_and/gq3d9rr/,0.0,0.787,0.213,0.4019
58,NI, I think it can get to $2 for sure.  Lately thinking $5 isn’t as much a pipe dream I thought it was even a month ago.  Popped to 0.18 two weeks ago on basically nothing.  Pink current and RTO wraps up and she’ll run... anything of significance beyond the graphite in the NI and she’ll launch.,powerfulSRE,2,/r/pennystocks/comments/lzh0dq/gun_to_your_head_what_one_stock_do_you_pick_and/gq3imm7/,0.0,0.884,0.116,0.6597
59,CTXR, Same here. April should be a good catalyst and a good bump but im long on CTXR. I know its gonna keep going up over the years. Im liking all the products in the pipeline. One of the only stocks im not worried about.,Teegs59,1,/r/pennystocks/comments/lzh0dq/gun_to_your_head_what_one_stock_do_you_pick_and/gq554za/,0.0,0.791,0.209,0.8308
60,UK," Indeed, going bust is an possibility, like Intu (a similar one). it has survived this long, vaccine roll out it going well and the UK lock down lifts soon. Once shops open, it starts getting rent payments again, i am hoping it will rebound. As I mentioned, I would be well happy even if it only goes to a 10th of its previous price. 

I have 1,000 shares with average price of 27.23p. If I was 100% confident about it not going bust, I would have 2,000 shares. The risk vs potential pay off, I think it is worth a gamble.",MrMikeJJ,2,/r/pennystocks/comments/lzh0dq/gun_to_your_head_what_one_stock_do_you_pick_and/gq51t69/,0.032,0.731,0.237,0.9661
61,SP," Rough guess on a good day: AUD$0.13

*If* P90 prove to be 300m barrels
Say value is AUD$4 barrel in the ground
a)300m x 4 = 1.2bn
b)8.7bn shares issued 
a/b = AUD$0.13
SP currently AUD$0.01
So 13x

Open to having that pulled apart this one's more of a punt for me than HITI.V",xintiandi888,4,/r/pennystocks/comments/lzh0dq/gun_to_your_head_what_one_stock_do_you_pick_and/gq2t46a/,0.0,0.857,0.143,0.7579
62,PLTR, PLTR for the quarterly growth and the quality of the contracts. CWSFF due to the proven technology and the ability to turn this into cash money.,dogberg144,1,/r/pennystocks/comments/lzh0dq/gun_to_your_head_what_one_stock_do_you_pick_and/gq2eib4/,0.0,0.83,0.17,0.5994
63,TSLA," ""Fundmantals dont look great"" is a silly comment for a new company. Do you thin all companies start form Day 1 fully finished and make insane revenue. What was TSLA like from IPO day until like 1 year ago? Most penny stocks have limited revenue and are building. ABML is just starting, hence the cheap stock price. You either get in now when its cheap and still forming or you buy it at 10x or higher premium once its proved itself, its the same thing with all pennies man",DoktahJones,1,/r/pennystocks/comments/lzh0dq/gun_to_your_head_what_one_stock_do_you_pick_and/gq4u291/,0.085,0.85,0.066,-0.4203
64,DD, Great DD . Well rounded and full of info,collegeslavetrade,3,/r/pennystocks/comments/lzxxs5/rssv_thorough_dd_on_why_the_sleeping_giant_is/gq4yid2/,0.0,0.492,0.508,0.7351
65,DD," Great DD.  I did one of the first DD on  here.  Your analysis is spot one. As I have said from the beginning this is not an investment for the quick flip.  I would treat this as a invest and forget about  it investment for 2021.  Don't look back  until 2021 is done.  That can be frustrating since it may not do anything for long periods of time, but should eventually pay off.  An investment that has a good chance of 10x+ is nearly impossible to find and is worth it.",10xwannabe,1,/r/pennystocks/comments/lzxxs5/rssv_thorough_dd_on_why_the_sleeping_giant_is/gq54s6e/,0.052,0.812,0.136,0.8442
66,DD," I really don't get these DD posts. You say it's not a pump and dump. But you are 27% down on a penny stock in which you hold 50,000 shares. 

What exactly is it that you want to accomplish from posting this?",JagwarRocker,-13,/r/pennystocks/comments/lzxxs5/rssv_thorough_dd_on_why_the_sleeping_giant_is/gq4qve9/,0.0,0.805,0.195,0.7568
67,AAPL," Yeah never invest in stocks that go down at any point in time. 

""I invested in AAPL at 135 and now it's 120, I guess AAPL is a pump and dump then!!""",ripstep1,10,/r/pennystocks/comments/lzxxs5/rssv_thorough_dd_on_why_the_sleeping_giant_is/gq4wjw5/,0.095,0.839,0.066,-0.2462
68,DD, I love these DD posts. Don’t follow them all but enjoy the reads and prospect of hitting it.,SavageSnorkler600,2,/r/pennystocks/comments/lzxxs5/rssv_thorough_dd_on_why_the_sleeping_giant_is/gq4xbxd/,0.0,0.591,0.409,0.8658
69,DD," Awesome thank you for the response great DD, I’m watching it now might pull the trigger tomorrow!",gardenhairy,3,/r/pennystocks/comments/lzxxs5/rssv_thorough_dd_on_why_the_sleeping_giant_is/gq4xkxn/,0.0,0.56,0.44,0.8999
70,CFMS," Did the same, I like CFMS and I really believe it got a lot of potential but when it got around 1 (my entry was at 1.20) I sold it, no regrets. Got the money and waited for SENS to get around 2, I think it will pay off in few weeks, I really hope so. Good luck to all holders!",AlexTheKid2010,2,/r/pennystocks/comments/lzite0/cfms_high_level_dd_discussing_why_conformis_is_a/gq50h2x/,0.108,0.662,0.23,0.8935
71,SENS," Did the same, I like CFMS and I really believe it got a lot of potential but when it got around 1 (my entry was at 1.20) I sold it, no regrets. Got the money and waited for SENS to get around 2, I think it will pay off in few weeks, I really hope so. Good luck to all holders!",AlexTheKid2010,2,/r/pennystocks/comments/lzite0/cfms_high_level_dd_discussing_why_conformis_is_a/gq50h2x/,0.108,0.662,0.23,0.8935
72,HALO," ![gif](emote|free_emotes_pack|upvote)**Absolutly!** ![gif](emote|free_emotes_pack|upvote)

I buyed as well HALO Col. INC., also the Aspermont Stock. These 2 stocks are the coming big one's

About HALO - Now USA got Biden, and i know HALO is an canadian company, but the good thing is that Biden will try to make the THC great again. 

So, at this point i want to say, that i believe in HALO's work and the coming future for it. 

![gif](emote|free_emotes_pack|upvote)**If you think the same, give this post an hard up vote.**![gif](emote|free_emotes_pack|upvote)

&#x200B;

![gif](giphy|h26f7dQPNqXRjAb54O)",BanginTrade23,0,/r/pennystocks/comments/lzbhda/i_do_apologize_sir/gq1slud/,0.018,0.829,0.153,0.9196
73,THC," ![gif](emote|free_emotes_pack|upvote)**Absolutly!** ![gif](emote|free_emotes_pack|upvote)

I buyed as well HALO Col. INC., also the Aspermont Stock. These 2 stocks are the coming big one's

About HALO - Now USA got Biden, and i know HALO is an canadian company, but the good thing is that Biden will try to make the THC great again. 

So, at this point i want to say, that i believe in HALO's work and the coming future for it. 

![gif](emote|free_emotes_pack|upvote)**If you think the same, give this post an hard up vote.**![gif](emote|free_emotes_pack|upvote)

&#x200B;

![gif](giphy|h26f7dQPNqXRjAb54O)",BanginTrade23,0,/r/pennystocks/comments/lzbhda/i_do_apologize_sir/gq1slud/,0.018,0.829,0.153,0.9196
