,ticker,comment,neg,neu,pos,compound
66,DD,"Don't take my word for it, because I don't have a proper DD, but I'm guessing this is not even close to the end of the short squeeze.

There's a famous Redditor of [/r/wallstreetbets](https://www.reddit.com/r/wallstreetbets), /u/DeepFuckingValue, who saw the writing on the wall a year ago, and turned $56k into $11 mil, and he's still holding his options. According to his DD, this is just the start of the short squeeze, and GME can go triple digit.",0.0,1.0,0.0,0.0
67,GME,"Don't take my word for it, because I don't have a proper DD, but I'm guessing this is not even close to the end of the short squeeze.

There's a famous Redditor of [/r/wallstreetbets](https://www.reddit.com/r/wallstreetbets), /u/DeepFuckingValue, who saw the writing on the wall a year ago, and turned $56k into $11 mil, and he's still holding his options. According to his DD, this is just the start of the short squeeze, and GME can go triple digit.",0.0,1.0,0.0,0.0
68,BP,Getting calls on BP for monday then,0.0,1.0,0.0,0.0
69,BP,"Calls on OP's BP, puts on OP.",0.0,1.0,0.0,0.0
70,DD,"TLDR: Buy shares and calls of GME.


Seriously though great bit of DD.",0.094,0.556,0.35,0.6808
71,GME,"TLDR: Buy shares and calls of GME.


Seriously though great bit of DD.",0.094,0.556,0.35,0.6808
72,GME,So is GME still considered a meme stock? 1000000% returns should convince anyone to invest right now,0.0,0.882,0.118,0.25
73,GME,What is stopping GME to take advantage of this frenzy and raise $$$$ by selling massive number of stocks. They have golden opportunity to raise money at this time when they didn’t even dream that the stock will be this high.,0.083,0.745,0.172,0.4939
74,GME,"Nice post, thank you. I’m not in GME myself but it’s been interesting to see everything going on with it.",0.0,0.702,0.298,0.7351
75,GME,"This analysis is quite flawed. 

There are at least a few likely scenarios that ruin your trade if you are an individual investor banking on this:

1: GME themselves (or a massive insider) thinks the market has overpriced their company and issues more shares

2: A few large option holders decide they have made enough money on the trade, in which case the entire thing unravels as soon as the money flow turns in the other direction.  

3: The market operator halts trading and opens up new options contract that will be more liquid, and reprices everything to alleviate the gamma squeeze.

In al of these cases, whomever bought the call options last ends up holding the bag.",0.032,0.947,0.021,-0.3197
76,GME,"paging /u/unlucky-prize sorry for paging you again, but you are kinda my go to guy for gamma things now :D

do you agree with OP's assessment? ""Should millions of retail buy the January 29 70C or January 29 75C, and the infinite short squeeze continues. If the GME 70C or 75C is hit, GME share price enters a gamma squeeze.""",0.017,0.812,0.171,0.9091
77,GME,"That happened on Friday on GME puts - the February $20 contract jumped from $1 to $5 - nothing in between - a few mins before trading was halted.

My hope is that hedge funds are going to start rumors of new GME issue - or even better, GME announces an issuance this week - to pop this bubble.",0.0,0.898,0.102,0.7003
78,GME,"The market cap of GME even know is $4.5b.  Back when I was selling puts at $4 it was $300m.  Far less money is needed to create this effect.  On say a $30b company it would take at least 100x as much money and likely more like 300x as much since liquidity is non linear with market cap, one of the original reasons for the SP500 index of shares with lots of liquidity.",0.0,0.877,0.123,0.8122
79,GME,"> GME themselves (or a massive insider) thinks the market has overpriced their company and issues more shares

Why can't this be a bullish indicator?  So what, GME issues a couple million shares to bank on this crazy price, and now they would be flush with fresh capital to make the company even stronger long term (acquisitions, hiring expansion, etc.)  Unless they release a LOT of shares, I don't see it impacting a lot.

This is an argument I read elsewhere and it seems plausible without crunching the exact numbers myself.",0.056,0.812,0.132,0.7294
80,DD,"If i may add, it actually has some long term value to be made, if you factor Cohens plans and average multiples for the same field you go to 120/share, if you factor cohens chewie multiples (a f# dog food company pitched against amazon and what not) it goes through the roof. +There is massive free marketing being done because of the short, it will deeply burn GME on ppls minds better than any coca-cola ad (which no ones factoring).  


So even if you sleep heavily and loose all of the bonanza, you can still just hold it for a nice profit (there's rational good chance that ppl will just have to wait a bit more for some good viable gains, not uncommon in stock market)  


I cant cite the DD but i know its there, on WSB, and therefore, you could actually find it",0.022,0.857,0.121,0.8705
81,GME,"If i may add, it actually has some long term value to be made, if you factor Cohens plans and average multiples for the same field you go to 120/share, if you factor cohens chewie multiples (a f# dog food company pitched against amazon and what not) it goes through the roof. +There is massive free marketing being done because of the short, it will deeply burn GME on ppls minds better than any coca-cola ad (which no ones factoring).  


So even if you sleep heavily and loose all of the bonanza, you can still just hold it for a nice profit (there's rational good chance that ppl will just have to wait a bit more for some good viable gains, not uncommon in stock market)  


I cant cite the DD but i know its there, on WSB, and therefore, you could actually find it",0.022,0.857,0.121,0.8705
82,GME,"The vast majority of Tesla calls expire OTM and plenty of shares are available so market makers have a motivation to keep selling. MM is definitely winning on Tesla. 

Right now all the currently available GME options are ITM, float is being deteriorated and MM *knows* what's happening, so they have no reason to keep selling calls.",0.038,0.795,0.167,0.804
83,TSLA,Yep. TSLA is exhibit A,0.0,0.577,0.423,0.296
84,GME,"Plain and simple, BUY GME STOCK!",0.0,1.0,0.0,0.0
85,RC,"> Let's not forget they're in a dying industry

What do you mean?  Gaming as a dying industry?  Or their current retail presence?

> has companies like Amazon

This is part of the RC hype, who built up Chewy and sold it for 3B, and beating Amazon at the same game.",0.056,0.791,0.153,0.4777
86,GME,"Uh what would you be losing?

If you sell covered calls for 100 you just sell your shares at 100 if GME actually closes at 100 (more likely you get a sell off because of a bunch of people setting their sell orders).

You can then get back in if you want to.",0.048,0.887,0.065,-0.0258
87,GME,"MM have already created higher strike calls on the option chains.

They must continue to make a market.

Regarding your original, question about if the option change had not expanded, yes they arent required to write new 60C options but they are likely still unhedged, implying that should GME enter an infinite short squeeze MM would lose hundreds of million/billions until they can become market neutral.

However, should GME price fall below 60, say like 40 AND people start to sell their call options, MM can return to market neutral faster with few losses.

What's happening is retails are buying at any price realizing that MM and brokers are in a corner.  If this continues MM stand to lose more money.  If retails stop relentlessly buying shares, MM/brokers dont lose money.",0.135,0.802,0.063,-0.8929
88,GME,"And that's shares. Buy them, don't borrow them on margin. GME is revamping their business model, so holding shares for the long term is a better move than the short sellers want you to believe.",0.0,0.777,0.223,0.765
89,GME,"> GME is revamping their business model, so holding shares for the long term is a better move than the short sellers want you to believe.

It is of course *possible* that the current valuation is too high despite that.",0.0,0.84,0.16,0.6887
90,GME,"It’s really not that hard lol. It’s hard to get the exact bottom, easy to get near the bottom after confirmation of support. If you get it wrong, stop loss hits and it’s NBD because you secured profit earlier. 

Or are you saying a smart idea is to leave your money in GME for months to years so that one day maybe it’ll squeeze again? 

Or more likely GME hits you with a huge offering and the entire squeeze evaporates overnight",0.113,0.66,0.227,0.8812
91,LAND,"$LAND is an American REIT, somewhat stable returns and good dividend",0.0,0.652,0.348,0.5868
92,ADM,"I gave you a thumbs up for raising this. I didn't know about edible vaccines before but it certainly makes ""sense"" that pro-vaccine folks would want to do that and lo and behold it is indeed a thing.  That said from a money making perspective if you want to profit from that it would make a lot more sense to simply own the patents to the technology a la ADM. And if your motivation is seeing it done owning farm land doesn't help with that.",0.033,0.82,0.147,0.8427
93,DD,Watch out with this one. Take a look at their holdings and you'll see they're more of a 'speciality' farmland REIT. So definitely do your DD and make sure that you understand that before buying and assuming you're getting a bunch of potato or cornfields with $LAND,0.0,0.888,0.112,0.6478
94,LAND,Watch out with this one. Take a look at their holdings and you'll see they're more of a 'speciality' farmland REIT. So definitely do your DD and make sure that you understand that before buying and assuming you're getting a bunch of potato or cornfields with $LAND,0.0,0.888,0.112,0.6478
95,GME,Dude was buying GME FDs like crazy,0.242,0.505,0.253,0.0258
96,BB,"There's talk that $BB with their expertise in berry crops and genetic manipulation, are attempting a spinoff research project that will attempt to hybridize gourds and potatoes, potentially creating the most profitable crop ever.",0.059,0.798,0.143,0.4927
97,BB,"Yes, explains why the execs divested part of their earnings. Original question was about Prem Watsa, the largest institutional investor in BB. Wonder if he is just sitting and watching?",0.0,0.848,0.152,0.6124
98,BB,"Of course he is! He knows damn well that BB will still fly, Im all in so join up youll thank me later! ;)",0.085,0.6,0.314,0.7392
99,DD,Solid DD.,0.0,0.385,0.615,0.1531
100,GME,"You have to look at incremental short risk A) inclusive of current short interest as a percent of float and B) the company’s market cap.

Saying a company is good to short based on fundamentals without accounting for those factors is like saying a company is doing well therefore worth buying at any price without looking at its PE multiple or other valuation indicators.

Shorting a smaller market cap company that already has short interest > total float is like thinking that walking blindfolded across a 6 lane freeway during rush hour to pick up $20 you saw lying on the median is a good trade because it’s free money.

If you do that with a smaller market cap company that actually has a credible case for a higher re-rating based on fundamentals like GME arguably does, it’s like the scenario above but add in that the drivers are paid a bounty specifically to go after you.",0.034,0.831,0.135,0.872
101,TSLA,"Why would you short a meme stock that has been exploding? 

That's like trying to short TSLA. 

Yeah maybe you're right and it's overvalued but you're trying to cross the train tracks while the train is going full steam. If you're wrong on the timing you're going to get run over. 

Actually it's even worse than trying to short TSLA. TSLA is what it is. Gamestop is literally in the midst of a huge transformation of its business model. That just compounds the risk.",0.117,0.815,0.068,-0.7684
102,SP,"I’m certainly no expert but will give it a shot.

When you short shares you’ve borrowed shares and then sold them. In order to buy back later at a lower price and return the shares to the original owner and you bank the difference.

But this means you have a commitment you eventually need to resolve with the party you borrowed the shares from. Now if the SP started to go down after you shorted, the other party is not going to be worried about your commitment because you’re ahead. But if the stock moves upwards, you’re now going to be paying money in order to close out the position.

So as the stock goes higher and your liability increases, there is more risk for lending party that you won’t be able to cover your costs so they will require interest or margin based on the amount you are currently behind (this part someone else can give better details on, and correct me). If the stock continues to rise the margin calls the lender requires you to pay become higher and higher and in many cases I believe there is a limit to what liability they will allow you to owe before they require you to close out the position.

So a short squeeze is when people have identified some large short positions and they attempt to push the price up causing these margins/liabilities on the shorters side to increase to unmanageable levels where they will have to close out their positions as they can’t afford the margin call or they have reached their liability limits.

As I say someone who works in the industry can probably give a better description but this I think covers the basic concept.",0.056,0.775,0.169,0.9897
103,GME,"In the context of GME.  Imagine you subletted every single apartment in a condo building, but you have rented them at a variable rate.  Suddenly the rate you need to pay to the real owner has gone up and you aren't getting any more money from your tenants.  You need to cover the difference and every day you are hemorrhaging money.  But, none of the tenants you subletted to want to leave and none of the condo owners you are indebted to want to sell either.

You are Squeezed between these two parties you tried to take advantage of and need to either keep on paying an excruciating amount to maintain the status quo or a crippling amount to end it.

Edit: And I forgot to mention, the superintendent of the building (gamestop management), the condo owners (share lenders), and the tenants (buyers) all think you are an insufferable asshole and relish in your downfall.",0.055,0.89,0.055,-0.2263
104,GME,How high can GME realistically go then before they stop paying?,0.18,0.82,0.0,-0.296
105,GME,"In theory, infinity (as a share can keep going up ""forever""). I guess until they have to declare bankruptcy. 

In practice, who knows. GME has been special in that it was literally the most shorted stock on the market a few weeks ago. We are also living in 2021, with hyper connected legions of people with access to trading with no fees. Our closest example, I guess VW in 2008, did not have the reach that GME possibly has.",0.041,0.897,0.062,0.3871
106,GM,Buffett sold the airlines because the investment thesis changed. That's what smart investors do. He didn't just panic sell because they dropped. He bought them to be consistent dividend payers and overnight not only did that change but it also became very likely that some or all of them would go to zero the way GM did in the GFC (and they still might - impact of Covid is far from over).,0.0,0.949,0.051,0.4021
107,EV,">  Irony 1: He calls out SPACs 

He invested in Quantumscape several years ago and was pretty critical about that they went public via a SPAC and said that the IPO process isn't great and direct listings should be look at. So he it not really ironic here.

&#x200B;

> Irony 2: He is an advocated green energy investors. He has called out Tesla a bubble 

Well that is not really a contradiction. It is right that green energy stocks haven't gotten they attention they deserve -  but it is also true that Tesla and some other EV/Green Energy stock are near or at bubble levels. 

&#x200B;

> Even legendary investor Warren Buffet, who advocated ""Be greedy when  others are fearful,"" was very fearful just like every other human beings  during the COVID crash in February & March of 2020. Berkshire was  not executing its strategy and sold many of its holding at rock bottom.  If Buffet was brave at that moment like he did during the financial  crisis of 2008, I'm sure Berkshire's stock would outperform the market  by a large margin by now. 

Warren Buffet said that before he could look for deals the fed already stepped in. March wasn't a prolonged bear market where Warren could look through a lot and take advantage of the situation -  and that's what he likes to do. And by selling of some of it's holdings it actually was executing the Berkshire strategy. Warren favors businesses that are very predictable. Because of Covid airplane stocks aren't any more. Who knows if they stay at sustainable level, how influenced business travel will be, how long will it last? 

Warren Buffet sold Fanny Mae and Freddie Mac years before the financial crisis. Buffet might be a bit to premature with his airline stocks, but I assume he will turn out to  be right. 

&#x200B;

 

>Moral of the story: Listen to what people said, **but pay attention to what they actually DO.**  No one knows when the bubble may pop. If you're thinking long term,  just stay the course. You will ride through bubble pops and still come  up on tops in the end if you're investing in good companies.  
>  
>Fun  fact: Fidelity has done yearly studies of their clients' accounts  performance, for many years. The best performing portfolio? Well,  Fidelity found out those account holders were no longer living in this  world, so ""Hold-onto dare Life"" until your dick dries up.

Yes like a lot of hedge funds and GMO moving into commidites and Emerging Markets, like Warren Buffet selling unpredictable businesses.  Good companies does not equal great results. Both Microsoft and Cisco were great business in 1999. Yet you would not have gained your money back for Cisco and it would have taken you 15 years to gain back the money with Microsoft. It is all about the price you pay.",0.097,0.767,0.136,0.9651
108,OVID,">  Irony 1: He calls out SPACs 

He invested in Quantumscape several years ago and was pretty critical about that they went public via a SPAC and said that the IPO process isn't great and direct listings should be look at. So he it not really ironic here.

&#x200B;

> Irony 2: He is an advocated green energy investors. He has called out Tesla a bubble 

Well that is not really a contradiction. It is right that green energy stocks haven't gotten they attention they deserve -  but it is also true that Tesla and some other EV/Green Energy stock are near or at bubble levels. 

&#x200B;

> Even legendary investor Warren Buffet, who advocated ""Be greedy when  others are fearful,"" was very fearful just like every other human beings  during the COVID crash in February & March of 2020. Berkshire was  not executing its strategy and sold many of its holding at rock bottom.  If Buffet was brave at that moment like he did during the financial  crisis of 2008, I'm sure Berkshire's stock would outperform the market  by a large margin by now. 

Warren Buffet said that before he could look for deals the fed already stepped in. March wasn't a prolonged bear market where Warren could look through a lot and take advantage of the situation -  and that's what he likes to do. And by selling of some of it's holdings it actually was executing the Berkshire strategy. Warren favors businesses that are very predictable. Because of Covid airplane stocks aren't any more. Who knows if they stay at sustainable level, how influenced business travel will be, how long will it last? 

Warren Buffet sold Fanny Mae and Freddie Mac years before the financial crisis. Buffet might be a bit to premature with his airline stocks, but I assume he will turn out to  be right. 

&#x200B;

 

>Moral of the story: Listen to what people said, **but pay attention to what they actually DO.**  No one knows when the bubble may pop. If you're thinking long term,  just stay the course. You will ride through bubble pops and still come  up on tops in the end if you're investing in good companies.  
>  
>Fun  fact: Fidelity has done yearly studies of their clients' accounts  performance, for many years. The best performing portfolio? Well,  Fidelity found out those account holders were no longer living in this  world, so ""Hold-onto dare Life"" until your dick dries up.

Yes like a lot of hedge funds and GMO moving into commidites and Emerging Markets, like Warren Buffet selling unpredictable businesses.  Good companies does not equal great results. Both Microsoft and Cisco were great business in 1999. Yet you would not have gained your money back for Cisco and it would have taken you 15 years to gain back the money with Microsoft. It is all about the price you pay.",0.097,0.767,0.136,0.9651
109,USA,"Retail investors and penny stock trading students are having a moment. I would know I’m in college. And you are so right. These people don’t like to hear it. I say let them, they will eventually learn. If OP is a retail investor in the USA they will learn the hardest, as I know here we have very minimal insider trading, inflation, watering- down share value laws which protect the retail traders. Retail trading trends here get absolutely crushed by Wall Street. And some of them will deserve it. Especially the penny- stockers.",0.032,0.866,0.101,0.6815
110,BAC,"Buffet said in an interview that he he got offered a few deals, but the fed stepped in before he could look through them. The market just rebounced too fast. 

And he invested more in BAC selling other banks. Lets see what he does next",0.0,1.0,0.0,0.0
111,DASH,"If you look at the volume and price action on Friday, it was big institutional buying. Retail and small fry cannot drive that volume and continuous sustaining of the price with a close at the day high. 

The big boys that got in Friday would not let this tank back down so fast IMO. I think we at least gun to new IPO high (look at DASH and ABNB). 

You have Ark’s initial buy around $15s, and subsequent buy in the $25s. $27 had been the key and whoever was slapping it down at that level has switched sides. I think a PB would be at most to the $27 range. Whales that got in Friday will prob defend the $28-30.

IMO we may gap up Monday and gun even higher for demo day.",0.036,0.964,0.0,-0.5859
112,IMO,"If you look at the volume and price action on Friday, it was big institutional buying. Retail and small fry cannot drive that volume and continuous sustaining of the price with a close at the day high. 

The big boys that got in Friday would not let this tank back down so fast IMO. I think we at least gun to new IPO high (look at DASH and ABNB). 

You have Ark’s initial buy around $15s, and subsequent buy in the $25s. $27 had been the key and whoever was slapping it down at that level has switched sides. I think a PB would be at most to the $27 range. Whales that got in Friday will prob defend the $28-30.

IMO we may gap up Monday and gun even higher for demo day.",0.036,0.964,0.0,-0.5859
113,PB,"If you look at the volume and price action on Friday, it was big institutional buying. Retail and small fry cannot drive that volume and continuous sustaining of the price with a close at the day high. 

The big boys that got in Friday would not let this tank back down so fast IMO. I think we at least gun to new IPO high (look at DASH and ABNB). 

You have Ark’s initial buy around $15s, and subsequent buy in the $25s. $27 had been the key and whoever was slapping it down at that level has switched sides. I think a PB would be at most to the $27 range. Whales that got in Friday will prob defend the $28-30.

IMO we may gap up Monday and gun even higher for demo day.",0.036,0.964,0.0,-0.5859
114,PLTR,"That's a terrible entry point. Think about the level of volatility we've had with PLTR. How often has it been above $30? What happened to buy low and sell high? If you're talking about a stock that has been adopted by the WSB gang and is subject to manic buying and selling, why would a rarely hit price point be a good place to enter for a long term hold?",0.081,0.878,0.041,-0.4291
115,PLTR,"What is not speculation right now?  People are creating stories and spinning stories in positive ways to justify valuations and their positions. Analysts are doing the same. For reference, Lockheed Martin and Boeing got $5B worth of contracts this month and their stocks haven't moved a cent on that news. Now PLTR got a contract worth some millions and I saw that story 56 times on Reddit with huge moves in the stock. If you pump it enough, people will believe in it.",0.0,0.863,0.137,0.872
116,NIO,"I remember buying NIO at $16 when it wasn't often above $15 at the time. I had to sit on those shares for a while.

Now look at the stock price, cabron.",0.0,0.927,0.073,0.296
117,IR,"Thing is, you don't have to use IR website on google or amazon to know what they do.",0.0,0.909,0.091,0.1779
118,QQQJ,"Follow ARK, MOON, QQQJ, and similar ETFS and see what they’re adding.",0.0,1.0,0.0,0.0
119,IT,"On the research side, I like [https://www.sciencedaily.com](https://www.sciencedaily.com) though what you see there is usually going to be 5-infinity years from commercialization.  Useful though to spot when some company comes out trying to sell snake oil when you have read about how the tech was first developed and what problems it has at the basic science level.

I like [https://arstechnica.com](https://arstechnica.com) with a good view on a broad range of computers, IT, and a sprinkling of other science and technology.",0.033,0.834,0.133,0.7964
