,ticker,comment,username,score,permalink,neg,neu,pos,compound
26,IRS," There is a ton on information on the web about people purchasing LEGO sets for investment purposes. I just wanted to chime in with one often overlooked aspect of trying to beat traditional investments by doing this. 

You have to consider the cost of selling the sets and taxes. If you list them on eBay, take 20% off the selling price for listing fees, packing materials and payment processing. You have few seller protections on eBay if the buyer receives a damaged set or decides to scam you. Also, included in the CARES Act was a provision requiring all payment processors like PayPal, Square, etc to report sales of over $600 in a calendar year to the IRS starting in 2022, so you will have to pay taxes on any gains you make from the sale of the sets. No hiding from the tax man.

If you try to sell the sets on Facebook Marketplace or Craigslist for cash, the likelihood of receiving the same price as an online marketplace is slim. You are limited to your local market and in person, cash buyers are almost always looking for a discount over online prices. Selling on consignment through a dealer or auction is even more expensive than eBay, so the odds of making a profit are decreased by a substantial margin. 

The cost of storage is also often overlooked. You need a climate controlled area to store the sets in because collectors are obsessed with the condition of the original packaging. Sticking them in a basement or attic for 10+ years is not a good idea because of this issue and renting a climate controlled storage unit for years at a time is expensive.",respectfulskeptic,3,/r/investing/comments/p1hh9q/anyone_tried_investing_with_lego/h8f3j1g/,0.071,0.875,0.054,-0.2437
27,LEGO," There is a ton on information on the web about people purchasing LEGO sets for investment purposes. I just wanted to chime in with one often overlooked aspect of trying to beat traditional investments by doing this. 

You have to consider the cost of selling the sets and taxes. If you list them on eBay, take 20% off the selling price for listing fees, packing materials and payment processing. You have few seller protections on eBay if the buyer receives a damaged set or decides to scam you. Also, included in the CARES Act was a provision requiring all payment processors like PayPal, Square, etc to report sales of over $600 in a calendar year to the IRS starting in 2022, so you will have to pay taxes on any gains you make from the sale of the sets. No hiding from the tax man.

If you try to sell the sets on Facebook Marketplace or Craigslist for cash, the likelihood of receiving the same price as an online marketplace is slim. You are limited to your local market and in person, cash buyers are almost always looking for a discount over online prices. Selling on consignment through a dealer or auction is even more expensive than eBay, so the odds of making a profit are decreased by a substantial margin. 

The cost of storage is also often overlooked. You need a climate controlled area to store the sets in because collectors are obsessed with the condition of the original packaging. Sticking them in a basement or attic for 10+ years is not a good idea because of this issue and renting a climate controlled storage unit for years at a time is expensive.",respectfulskeptic,3,/r/investing/comments/p1hh9q/anyone_tried_investing_with_lego/h8f3j1g/,0.071,0.875,0.054,-0.2437
28,LEGO, You have more chance to flip Supreme merchandise  then LEGO,SlothInvesting1996,2,/r/investing/comments/p1hh9q/anyone_tried_investing_with_lego/h8dfsfm/,0.0,0.576,0.424,0.7089
29,LEGO," I've been buying LEGO on clearance and then storing for a few years, started in 2015, as a side hussle/investment. The hardest part is selling, lots of scammers on the usual e-commerce website. However Stock-X recently started selling LEGO so I haven't had to deal w/ customers.",Captain_Shen,1,/r/investing/comments/p1hh9q/anyone_tried_investing_with_lego/h8ejnu0/,0.0,1.0,0.0,0.0
30,HUGE," LEGO investing is tricky. I’ll list some pluses and minuses:

+ Excellent return. Stuff like old Pirates of the Caribbean sets aren’t even that old and already command massive returns.

+ Recognizable brand

+ Better return the more time you put in. Parting out a set (AKA selling individual pieces) on BrickLink can make your return back even faster

- HUGE space commitment. These boxes are big.

- Shipping orders is a hassle since boxes are so big.

- LEGO is more than willing to pump out and print more sets, devaluing ones you might think are good investments. See: Amelia Earthart gift with purchase. Those looked really good for a month and then LEGO absolutely flooded the market with them, making them more and more available.",JLikesStats,1,/r/investing/comments/p1hh9q/anyone_tried_investing_with_lego/h8fdq2n/,0.012,0.813,0.175,0.9676
31,LEGO," LEGO investing is tricky. I’ll list some pluses and minuses:

+ Excellent return. Stuff like old Pirates of the Caribbean sets aren’t even that old and already command massive returns.

+ Recognizable brand

+ Better return the more time you put in. Parting out a set (AKA selling individual pieces) on BrickLink can make your return back even faster

- HUGE space commitment. These boxes are big.

- Shipping orders is a hassle since boxes are so big.

- LEGO is more than willing to pump out and print more sets, devaluing ones you might think are good investments. See: Amelia Earthart gift with purchase. Those looked really good for a month and then LEGO absolutely flooded the market with them, making them more and more available.",JLikesStats,1,/r/investing/comments/p1hh9q/anyone_tried_investing_with_lego/h8fdq2n/,0.012,0.813,0.175,0.9676
32,IP," Which sets OP?


Do you know how many hundreds if not thousands of Lego sets have been made. Something tells me the majority aren't worth much simply because *the demand isn't there*. Now if it's a famous IP like Star Wars or similar it could take off, that is if said IP is still popular 20 years from now. Its a gamble...",KyivComrade,1,/r/investing/comments/p1hh9q/anyone_tried_investing_with_lego/h8gfiv3/,0.101,0.82,0.079,-0.1195
33,AMD," I currently have around 850$ invested (not much I know) buT I Have 500$ in nvda 250$  IN tsla and 100$ in HOOD

I am thinking about selling my hood shares and buying more tesla, but I was wondering abouts nvdas future should I sell half and buy AMD or maybe invest in a new sector.

BTW not an American an average job in Bulgaria brings about 5000$ usd so I am looking for jobs abroad",Hefty-Calendar-6313,3,/r/investing/comments/p1lgu7/daily_general_discussion_and_spitballin_thread/h8fhylx/,0.0,0.96,0.04,0.4215
34,HOOD," I currently have around 850$ invested (not much I know) buT I Have 500$ in nvda 250$  IN tsla and 100$ in HOOD

I am thinking about selling my hood shares and buying more tesla, but I was wondering abouts nvdas future should I sell half and buy AMD or maybe invest in a new sector.

BTW not an American an average job in Bulgaria brings about 5000$ usd so I am looking for jobs abroad",Hefty-Calendar-6313,3,/r/investing/comments/p1lgu7/daily_general_discussion_and_spitballin_thread/h8fhylx/,0.0,0.96,0.04,0.4215
35,USA," Quick beginner question. I searched online and didn't seem to get a clear answer.  
  
Is it dumb for my spouse and I to invest in the same fund in our own separate accounts? For example if I put $5,000 into QQQ and she also put the same, would it just be better for one of us to put $10,000 into QQQ instead? 

  
We are both early 30's USA, self-employed. IRA and 401k are maxed.. not sure how relevant all the other suggested information is.

  
TIA!",ohseven1098,3,/r/investing/comments/p1lgu7/daily_general_discussion_and_spitballin_thread/h8fs39m/,0.058,0.831,0.111,0.7116
36,BMO," Investment banking company have their analyst covering certain companies. I am thinking about Stiffel, Cannacord, BMO. Is it possible to sign up to a service and receive their analyses for certain companies by mail ?",TyLeo3,2,/r/investing/comments/p1lgu7/daily_general_discussion_and_spitballin_thread/h8eigdg/,0.0,0.877,0.123,0.4939
37,IS," > What is everyone doing to protect their portfolios from a possible downturn or crash? 

This question has been asked since the last significant drawdown (March 2020) and then since the one before that (Deccember 2018) and the one before that. If it's ""economically sunny"" for long enough this sub starts obsessing over whether the slightest cloud could be rain. It's been that way for more than half a decade. The opposite end is also true - when it is actually raining (December 2018, March 2020) often right before the sun comes back out part of this sub is *certain* that the storm is going to get much worse.

I invest what I'm comfortable with in companies I'm most long-term confident in. I lost a lot between the peak in Feb 2020 and the bottom in March 2020 and then went on to have an absolutely, very unexpectedly fantastic year. I got way more aggressive in March 2020 as the VIX got to levels higher than the worst of 2008 rather than selling or going more conservative. 

Purchases at low levels in 2018 and 2020 resulted in having a much lower cost basis on a number of things, quite a bit of which was sold last year and early this year because they had so far exceeded what I'd expected in a very brief period of time (but even though those things were sold because they far exceeded expectations, I just used the proceeds to buy a number of stocks, just different ones.)

 I own Sea (SE), which got to $288 earlier this year before it corrected back to the high $100's. If I bought Sea at $288 and it corrected, big bummer. If I bought SE on average much lower, bummer but far easier psychologically to deal with. The stock recently made new all time highs and making another one pre-market.

People have this view of ""market crash around every corner"" and I think the concern with that is that people are going to sell winners at the slightest hint of volatility because even the slightest hint of volatility is going to lead to people going, ""OMG IS THIS ANOTHER 2008!?!?!"" and then they sell their winners and when the market rebounds, they get frustrated. You don't have to react to every little bit of news. Let signs of a more concerning market environment come to you and build up a bit rather than constantly be straining to come up with reasons and selling at the first sign of any sort of volatility. What is a ""action-worthy"" drawdown? You shouldn't feel as if you need to avoid every 5-10% correction.

""commodities?""

No. If you think there's a downturn coming, you're also thinking that there's going to be less commodity usage. Additionally, a lot of commodity futures products are structured as master limited partnerships, which you don't want especially if it's for a trade.

""Are bonds a good bet with interest rates set to climb?""

Opposite.

People could find good alternative strategy funds but 1) there really aren't that many good alternative strategy funds available to retail investors and 2) the obsession with retail investors regarding fees would result in many retail investors wanting nothing to do with alternative strategies given that the nature of alternative strategies (long/short, etc) often results in higher fees. 

Additionally, if you are a young person there is sort of the question of  if you're frequently trying to hedge and having attempts at conservatism because of the perception of a market crash around every corner, are you investing with a long investing time horizon, do you have more money invested than comfortable with or some other issue (risk tolerance?)

There's going to be other 20-30% drawdowns in the future; I have no idea when the next one is but I choose not to invest as if they are potentially around every corner. The more people go through those kinds of periods, I think more people get somewhat used to them especially if they see success buying dips in the period after these sorts of declines. I don't think that they are ""around every corner"" and personally, I'd rather focus on finding new ideas. If the majority of your time related to investing is trying to determine when the next market crash might be I'd highly recommend trying to change - negative stories in financial media are going to easily sway you, you're going to sell winners at the slightest correction and events are going to be a potential ""sell everything"" (tons of ""i'm selling everything!"" posts before the election last year - the election happened, the market took off and then the vaccine news was not long after that.)",dvdmovie1,13,/r/investing/comments/p1lgu7/daily_general_discussion_and_spitballin_thread/h8e98bk/,0.07,0.85,0.08,0.9366
38,SE," > What is everyone doing to protect their portfolios from a possible downturn or crash? 

This question has been asked since the last significant drawdown (March 2020) and then since the one before that (Deccember 2018) and the one before that. If it's ""economically sunny"" for long enough this sub starts obsessing over whether the slightest cloud could be rain. It's been that way for more than half a decade. The opposite end is also true - when it is actually raining (December 2018, March 2020) often right before the sun comes back out part of this sub is *certain* that the storm is going to get much worse.

I invest what I'm comfortable with in companies I'm most long-term confident in. I lost a lot between the peak in Feb 2020 and the bottom in March 2020 and then went on to have an absolutely, very unexpectedly fantastic year. I got way more aggressive in March 2020 as the VIX got to levels higher than the worst of 2008 rather than selling or going more conservative. 

Purchases at low levels in 2018 and 2020 resulted in having a much lower cost basis on a number of things, quite a bit of which was sold last year and early this year because they had so far exceeded what I'd expected in a very brief period of time (but even though those things were sold because they far exceeded expectations, I just used the proceeds to buy a number of stocks, just different ones.)

 I own Sea (SE), which got to $288 earlier this year before it corrected back to the high $100's. If I bought Sea at $288 and it corrected, big bummer. If I bought SE on average much lower, bummer but far easier psychologically to deal with. The stock recently made new all time highs and making another one pre-market.

People have this view of ""market crash around every corner"" and I think the concern with that is that people are going to sell winners at the slightest hint of volatility because even the slightest hint of volatility is going to lead to people going, ""OMG IS THIS ANOTHER 2008!?!?!"" and then they sell their winners and when the market rebounds, they get frustrated. You don't have to react to every little bit of news. Let signs of a more concerning market environment come to you and build up a bit rather than constantly be straining to come up with reasons and selling at the first sign of any sort of volatility. What is a ""action-worthy"" drawdown? You shouldn't feel as if you need to avoid every 5-10% correction.

""commodities?""

No. If you think there's a downturn coming, you're also thinking that there's going to be less commodity usage. Additionally, a lot of commodity futures products are structured as master limited partnerships, which you don't want especially if it's for a trade.

""Are bonds a good bet with interest rates set to climb?""

Opposite.

People could find good alternative strategy funds but 1) there really aren't that many good alternative strategy funds available to retail investors and 2) the obsession with retail investors regarding fees would result in many retail investors wanting nothing to do with alternative strategies given that the nature of alternative strategies (long/short, etc) often results in higher fees. 

Additionally, if you are a young person there is sort of the question of  if you're frequently trying to hedge and having attempts at conservatism because of the perception of a market crash around every corner, are you investing with a long investing time horizon, do you have more money invested than comfortable with or some other issue (risk tolerance?)

There's going to be other 20-30% drawdowns in the future; I have no idea when the next one is but I choose not to invest as if they are potentially around every corner. The more people go through those kinds of periods, I think more people get somewhat used to them especially if they see success buying dips in the period after these sorts of declines. I don't think that they are ""around every corner"" and personally, I'd rather focus on finding new ideas. If the majority of your time related to investing is trying to determine when the next market crash might be I'd highly recommend trying to change - negative stories in financial media are going to easily sway you, you're going to sell winners at the slightest correction and events are going to be a potential ""sell everything"" (tons of ""i'm selling everything!"" posts before the election last year - the election happened, the market took off and then the vaccine news was not long after that.)",dvdmovie1,13,/r/investing/comments/p1lgu7/daily_general_discussion_and_spitballin_thread/h8e98bk/,0.07,0.85,0.08,0.9366
39,ELY," Without digging into ELY specifically, likely ""buy the rumor, sell the news"". It looks like it is up 31% YTD, outpacing the S&P500 by 12%. A positive report confirms the stocks sentiment and allows firms to start profit taking while volume is relatively high.",MGreymanN,5,/r/investing/comments/p1lgu7/daily_general_discussion_and_spitballin_thread/h8f3m93/,0.0,0.816,0.184,0.8402
40,FMC," I've held LTHM since it split from FMC, and for some reason it gained 12% today. Not sure why. I also hold TAN, and try to minimize exposure to fossil fuels in general via SPYX.

I bought COPX at $32.68 as a cyclical play, but I think I'm going to hold this one as well, since electrification is very copper intensive.

Anytime I'm making a play on clean energy, I'm planning on holding on for a minimum of 10 years. With the way climate estimates are trending, if those stocks and funds don't gain value, we won't have much of an economy left anyway.",HubcapMotors,1,/r/investing/comments/p1lgu7/daily_general_discussion_and_spitballin_thread/h8g8aeu/,0.069,0.794,0.138,0.7751
41,LTHM," I've held LTHM since it split from FMC, and for some reason it gained 12% today. Not sure why. I also hold TAN, and try to minimize exposure to fossil fuels in general via SPYX.

I bought COPX at $32.68 as a cyclical play, but I think I'm going to hold this one as well, since electrification is very copper intensive.

Anytime I'm making a play on clean energy, I'm planning on holding on for a minimum of 10 years. With the way climate estimates are trending, if those stocks and funds don't gain value, we won't have much of an economy left anyway.",HubcapMotors,1,/r/investing/comments/p1lgu7/daily_general_discussion_and_spitballin_thread/h8g8aeu/,0.069,0.794,0.138,0.7751
42,WEBR, Well I went in pretty deep with WEBR and still believe in the company long term.  But the last few days it pumped pretty hard so I was worried about a sharp turn down.  I'm basically just waiting at this point for options to become available so I can start slinging covered calls.,numbhallow,1,/r/investing/comments/p1lgu7/daily_general_discussion_and_spitballin_thread/h8g9we2/,0.085,0.775,0.14,0.4823
43,ONE," I am an old, semi- retired, midwestern US wanting to occasionally trade some crypto and was looking for a forum similar to this but with that as it's focus.

I found ONE that isn't full of crypto kiddies looking to get rich in a week.

I want to augment the money I have, put a little more back for my grandkids and kids, I don't have 20 years probably, but do have 15, or, a week, you never know. 

I own several junk cars, some string, several sets of plastic shelves, some are complete, a Chrysler Town and Country all terrain motorhome/offroader.  I have no debt on any of the the salvage cars.  I own them and some even have titles to prove it.  Oh!  I own almost 20 pocket knives handed down for generations, many with all the blades. I have a collection of plastic sacks, of different colors, no I won't sell them so you can weave them into a purse. 

Now, if you, or maybe your son or grandson know a calm, reasonable, realistic reddit or other forum where average joes can talk about crypto, holding it longer, or trading it when viable, I would love to know where.  (They tend to divide into camps and then just be mad if you talk about a competitor.  Some have jobs, though, and come out in daylight, even.  One has a girlfriend.)",Busy-Appearance-6077,2,/r/investing/comments/p1lgbp/daily_advice_thread_all_basic_help_or_advice/h8e86jh/,0.057,0.877,0.066,0.501
44,XOM, I purchased XOM near the end of last year and am up over 30 percent. Looking at historical range it doesn't have much upside potential and the main driver of keeping it is the dividend. Thinking of selling them and moving it into another position. If XOM recedes back to my starting amount it would take several years of dividends to just get back at the same point.,SaveTheAles,1,/r/investing/comments/p1lgbp/daily_advice_thread_all_basic_help_or_advice/h8eazlv/,0.0,1.0,0.0,0.0
45,BE," How old are you? 24

What country do you live in? USA

Are you employed/making income?- Yes, 52k

What are your objectives with this money? (Buy a house? 
Retirement savings?) -Utilize some of it to buy a home down the line 3-5 years. 
-As well as maximize the 6k for Roth IRA account
-Rolling over a previous employer 401k (~6k) into another Roth IRA.

What is your time horizon? 3-5 years, + long term retirement 30-40 years


Do you need this money next month? -no 


Next 20yrs?

 -No unless pulling out for buying another investment property, my retirement accounts probably wouldn’t be touched except pulling out my contributions again if trying to buy real estate. 


What is your risk tolerance? (Do you mind risking it at blackjack or do you need to know its 100% safe?)

 —Prefer to be a passive investor in Index funds and leave 5-10% in high risk high reward 

What are you current holdings?

 —$2.7k in VTI for my Roth IRA

(Do you already have exposure to specific funds and sectors? 

Any other assets?) No, paid off car will not be used for any investment, running it into the ground. 

Any big debts (include interest rate) or expenses?
—$700 - no interest PayPal Credit
—$4000 - grace period of student loan (starts December 2021) *** BOTH WILL BE PAID OFF BY in 1-2 months as if 8/10/2021


And any other relevant financial information will be useful to give you a proper answer.

Making $1920 bi weekly for work.
Live at home (RENT FREE) 
I minimize spending on eating out by making home meals for work and breakfast/dinner. 
Bills: (monthly gas $100-150), phone bill $130 (pay for mom and grandma; mom in return pays my car insurance since it’s easier transaction)
I’m under LA county (solid benefits) until 26 years old so 1 year 3 months) left before having to have my income deducted for a medical/dental plan.



***Just set my auto invest in Vanguard $600 a month for my brokerage account + $100 for ROTH IRA (i plan on just throwing in $2-4k at random just to hit the 6k) 

Mainly want to know what’s the best tax/game plan for the brokerage account if i plan down the line to pull out some if needed for a down payment in a home. But I’m really trying to just maximize my income with a decent return via index funds***",CampinHiker,1,/r/investing/comments/p1lgbp/daily_advice_thread_all_basic_help_or_advice/h8es39o/,0.031,0.907,0.062,0.8948
