,ticker,comment,username,score,permalink,neg,neu,pos,compound
0,SPRT, I am going to wager merger news (or lack of) is going to move SPRT more than anything else. Don't think anyone is in this stock for SPRT itself.,sadus671,5,/r/RobinHoodPennyStocks/comments/p20u33/penny_stock_unusual_option_activity_810/h8h1ajl/,0.078,0.922,0.0,-0.3182
1,KPLT, KPLT quarterly revenue rose 27% costs increased and basically said what 75% of CEO’s have said about guidance fir the rest of the year based on production delays and COViD uncertainty.,Erockddog,1,/r/RobinHoodPennyStocks/comments/p20u33/penny_stock_unusual_option_activity_810/h8h9r4n/,0.072,0.866,0.063,-0.0772
2,CTXR, Looks like a great day to add more CTXR to my bag. Nice sale this morning.,updownhold51,5,/r/RobinHoodPennyStocks/comments/p28l5q/daily_discussion_thread/h8jb1zd/,0.0,0.561,0.439,0.8555
3,CWBR, CWBR is going through the roof. Grab a hold while you can!,rcxheth,1,/r/RobinHoodPennyStocks/comments/p28l5q/daily_discussion_thread/h8ita39/,0.0,1.0,0.0,0.0
4,BTB, BTB is going to moon soon!!! I am all in at $1.01,daarnold1987,1,/r/RobinHoodPennyStocks/comments/p28l5q/daily_discussion_thread/h8kh8zu/,0.0,1.0,0.0,0.0
