,ticker,comment,username,score,permalink,neg,neu,pos,compound
0,EDIT," I briefly looked at their financials and would really have to dig into it to understand whats going on however there is a large difference between GAAP and nonGAPP earnings.

You would really have to dig through the filings to see the difference , I believe they have to report a reconciliation between the two that should spell it out.

However in some cases a company can have negative GAAP earnings but be cash flow positive due to some non-cash expenses.

Example lets say a company sold stock (or bonds) and raised a bunch of capital. It then invested the raised money in capital assets (buildings, equipment, software ect) .

In a few years now they have large deprecation expenses , now these are non-cash expenses when you deprecate a building for 1 million per year, you actually already paid for the building you are just writing it off as deprecation, you don't have to pay anyone that 1 million dollars.

So they can basically be cash flow positive but have to report a loss due to large non-cash expenses like deprecation. They may not be able to pay off debt as the debt may not be callable.

EDIT  
It looks like they sold a business unit and the proceeds of the sale will be paid out as a dividend",SirGlass,27,/r/investing/comments/p1r9mt/why_would_a_company_operating_at_a_loss_issue_a/h8f67gj/,0.052,0.853,0.094,0.8569
1,DD," So many bad ""didn't read, still commented as a non-expert"" comments here.  

A lot of y'all need to not answer when you don't actually know the story, I feel bad for the DD you don't perform.",MasterDave,5,/r/investing/comments/p1r9mt/why_would_a_company_operating_at_a_loss_issue_a/h8fnhat/,0.196,0.804,0.0,-0.8204
2,SP," Typical dividend trap. Attracting new investors and they expect people to talk about it on social medias which will boost the SP prior to the dividemds and introduce more people that never heard of this company to it. 

It could bounce back after the special dividend or just have trapped a bunch of people that will end up panic selling if they keep having net losses and cant substain their future non-special dividends.",PjjOnXbox,4,/r/investing/comments/p1r9mt/why_would_a_company_operating_at_a_loss_issue_a/h8f3wpi/,0.137,0.763,0.1,-0.4939
3,ECVT," This is incorrect - ECVT doesn't need to encourage outsiders to buy/hold their stock via heavy dividend payout. In fact, I'm guessing they don't give a shit about the remaining public shareholders since [Ecovyst is ~75% controlled by two private equity firms - INEOS and CCMP](https://www.bamsec.com/filing/170803521000005/1?cik=1708035&hl=213215:214701&hl_id=4k1vdrsks). 

**What is happening is a textbook example of a private equity approaching their exit horizon on a leveraged buyout and making moves to max out the returns they'll receive at exit.**

Since (a) the sponsors exercise complete control over ECVT and (b) private equity LBOs are evaluated largely by IRR and what MOIC (multiple on invested capital) you receive at exit, they went ahead and used the two mechanisms at their disposal to max out their returns: hammered down debt + issuing a massive dividend recap.",trill_collins__,2,/r/investing/comments/p1r9mt/why_would_a_company_operating_at_a_loss_issue_a/h8ghwnt/,0.04,0.937,0.023,-0.3134
4,FCF," FCF or Cash from operations is not a profitability measure. Net income is. 

Not sure what you are getting at. You may not like it but net income is the pre-eminent determination of profitability not cash flow. 

There is a reason the SEC doesn’t allow cash flow per share.",ofereverything,0,/r/investing/comments/p1r9mt/why_would_a_company_operating_at_a_loss_issue_a/h8g4qup/,0.12,0.722,0.157,0.6169
5,CPA," Thanks. I understand given that I am a CPA and a director of financial reporting for multiple F500 organizations over the past 15 years. 

My response was on “net income is not necessarily indicative of how…”",ofereverything,4,/r/investing/comments/p1r9mt/why_would_a_company_operating_at_a_loss_issue_a/h8fwfzz/,0.0,0.914,0.086,0.4404
6,CC," OK, think we need to learn you the difference between National Debt and traditional debt like you're probably thinking of. See below:

#Primer: Sovereign Debt vs CC Debt - Not the Same Thing

>It's not that kind of debt.

>If it were up to me, economists would invent an entirely new word for what we currently call ""sovereign debt."" Because what you think of as ""debt"" when you consider your personal finances — your upside-down mortgage, your monthly car payment, that credit card balance you've been chipping away at — operates under completely different principles and rules than those that govern sovereign debt.

>Sovereign debt is, put simply, how money is created.

>Have you ever wondered exactly why a dollar — not a dollar bill, but the intangible dollar itself — has value? A naive answer is that it has value simply because we all agree that it does, and while there are elements of that to it, that's not really the right answer.

>A dollar that exists today has value because it's backed by debt. No other reason.

>Imagine you wanted to start your own economy from scratch. I don't know, in Candyland or something, in a fantasy world completely isolated from the real one. How would you go about doing it?

>Well, first you'd need a government of some kind. That's obvious. You need to have a state — with universally recognized authority and power — for a lot of other, non-economic reasons anyway, so that's okay. The first thing you do is somehow establish your state.

>Since you've got a government, can you just decree some money into existence? Well, you could try, but because you've studied your economics, you know that won't actually work. A monetary unit you just invent out of nothing has no value; it's not backed by anything. So it doesn't work out in practice.

>Instead, you establish for yourself two institutions, one a part of the government and one entirely separate from it. The first institution is the treasury, which is a part of the government that has the legal authority (backed by the legitimacy of your government) to buy and sell things, and to issue securities called bonds.

>The other institution you create is a central bank. The central bank is established by (or with the sanction of, anyway) the government, and has a special power: It can create and destroy money. Literally out of nothing. The central bank is the one institution in your economy that can say ""Abracadabra, money now exists.""

>So now you have an institution that can buy and sell (the treasury) and an institution that can create money (the central bank) … but there's no actual money. None has been created. So you aren't done.

>The next step in the shake-and-bake-economy recipe is to have your treasury issue a series of bonds. A bond is a financial instrument that works under certain rules. The rules that matter here are that a bond is created on a certain date with a certain face value, sold for less than that face value, then redeemed on a specific future date at that face value. So we'll imagine you order your treasury to issue a bond today with a face value of $100, to offer it for sale for $90, and to give it a maturity date of one year from today.

>Of course … nobody can buy that bond, because nobody has $90, because nobody has any dollars; no dollars have been created yet. Which means that bond you're trying to sell just sits there … until the old white guy in the suit you appointed to run your central bank wakes up from his nap and realizes the he can buy it. He has the power to create money out of nothing. So he does. He fiats — as the term goes — $90 into existence, and gives it to you, taking your bond in return.

>Now your treasury has $90 in it, which means you can hire some of your impoverished citizens to start building a road or something.

>Impoverished Citizen #3 takes his first week's pay and deposits it into a bank, which now has a lending reserve, and lends it out thus creating more money, and et cetera et cetera, you can look up the details on how fractional reserve lending works if you want, 'cause it's off the topic right now.

>Thus have you started up your new economy. The central bank created a small amount of money (relatively) and bought your sovereign bonds with it, that money went into circulation, it spiraled around and around the fractional-reserve banking system creating more money, capital is now freely available, industry is booming, wealth is being created at a healthy rate, and everything's just fine.

>Except — gasp! — your government is in debt! Those bonds you sold to the central bank are coming due soon! You're going to have to buy them back — repaying the debt you took on when you started up the economy! And you have no money to do that with! Whatever do you do!?

>You issue a new round of bonds. You sell them just like you sold the last round: to anybody with money. Except last time the only entity in the whole economy that had any money was the central bank, while this time everybody has money. Some of the people with money want a way to store it for the long term, so they're more than happy to exchange their money for a bond, then sell that bond later to turn it back into spendable cash. So all you have to do is issue a new round of bonds, cash flows into the treasury, and when the central bank comes calling to have its bonds redeemed, you use your new cash to buy them back.

>Except now the central bank has money … which it does not need or want. The central bank has no need of money, and money sitting on account at the central bank isn't doing anything useful. So the central bank turns right back around and knocks on your door and says ""Hey, got any bonds you want to sell?""

>Which returns us to the normal condition again: The central bank holds bonds which back money, and the actual money those bonds back circulates throughout the economy, doing useful work.

>Does the government still technically carry debt on its books? Yes … technically. But that isn't like household debt; it's not like having a balance on your credit card. The government doesn't have to, and in fact shouldn't, work to wipe that debt out. Instead, that debt — again, only in the most technical sense of the word — backs all the money in the economy. Every dollar that exists in your whole economy can trace its ""family tree,"" if you will, back to a bond your government issued. That's where the money comes from. If the bonds disappeared, so would the money, because there'd be nothing backing it.

>So when people talk about the US public debt, do not, do not, do not think of that as a looming threat of bankruptcy. It isn't. Sovereign debt doesn't work like personal debt. When you get in debt, you want to get out of it as fast as you can … which is both sensible and wise. But debts held by governments are the very foundation of the economy.

>So the straight answer to your question — why is the US in so much debt — is this: Because the US economy is so huge. There are so many dollars in the world — nearly ten and a half trillion of 'em as of last week — the US dollar economy needs a great big foundation.

[Source](https://www.reddit.com/r/explainlikeimfive/comments/191r72/why_is_the_us_in_so_much_debt/c8k0cki/)",trill_collins__,3,/r/investing/comments/p1ilx3/are_there_any_studies_on_the_acceleration_of/h8ex9bm/,0.059,0.809,0.131,0.9981
7,USA," I don't think there are any studies like that. To begin with assumptions about national debt acceleration always having the same results is a bit far fetched. Simply from an economical perspective you can theorize about debt like that. However national debt is intrinsically linked to politics. 

This question ""how does national debt affect the economy of states?"" is too broad. To answer it we would first need to specify: What state? 

.. Or at least what category of states. 
What accelerating national debt means for the economy is tied to local national contexts. African 3rd world countries, Western Europe, Latin America, USA, China, Greece, Haiti, Japan and so on. Accelerated national debt would have vastly different effects for each of these countries and regions. Yes there is overlap but the more and bigger your sample pool of countries are, the harder it is to make any generalizations about the matter.",Apprehensive-Soil-47,1,/r/investing/comments/p1ilx3/are_there_any_studies_on_the_acceleration_of/h8gbtse/,0.069,0.889,0.042,-0.5204
8,USA," No, because the interest payments are backed by the tax revenue of the United States tax payers. Seems like trusting the good people of the USA to pay their income taxes is a fairly riskless asset base for the US Treasury to auction off the cash flows to.

Ponzi scheme returns are based on external capital funding, by convincing new investors that these ""guaranteed returns"" are being generated organically.",trill_collins__,17,/r/investing/comments/p1ilx3/are_there_any_studies_on_the_acceleration_of/h8exj1p/,0.043,0.667,0.29,0.9565
9,GDP," True, its not a 1:1 comparison, but counterpoint is that the US economy will, almost certainly continue to grow. 

If your house grew at the same rate of US GDP *AND* rates were as low as they are now, you would be a pretty dumb investor to not continuously refinance and use those funds for other GDP producing activity such as infrastructure etc...

Either way, its not even close to a ""ponzi scheme."" And anyone with a high school level of economic understanding could see that.",DankChase,3,/r/investing/comments/p1ilx3/are_there_any_studies_on_the_acceleration_of/h8fb02k/,0.076,0.828,0.095,0.1927
10,IT," Dude, it's the 21th century not the 19th. Foreign states have already done several successful attacks against the heart of America, infrastructure, via IT. Russian hacking groups (totally not tied to Putin) managed to stop the water supply in large areas for days and the American government, army, and *every single agency was unable to do shit about it*.




A simple D-DOS attack can cripple US harder then any fleet of aircraft carriers ever could. A true foreign attack will target critical infrastructure and will be IT-based, not by grunts walking the streets. It'll be Q-anon bullshit, conspiracies and turning the people against their own president and leaders/constitution (see January 2021).



As for military superiority the *best* of the US Navy were unable to detect a Swedish submarine harbouring New York waters for a good *2 weeks*. It was just a demonstration but imagine said submarine wasn't piloted by a friendly nation like Sweden, but a hostile one? Yeah, the US army is big and boastful yet lacks the defence necessary. It's all a smoke and mirrors show...the military is obviously not a decent enough defence.",KyivComrade,0,/r/investing/comments/p1ilx3/are_there_any_studies_on_the_acceleration_of/h8gap4n/,0.105,0.802,0.093,-0.5334
11,ICE, The crazy thing is that Coinbase is actually relatively cheap compared to traditional brokerages in forward sales multiples because how fast Coinbase is growing.      This reminds me of Tesla and how so many people were using ICE auto maker multiples b for realizing Tesla can sustain much higher margins.,RajivChaudrii,25,/r/investing/comments/p1x594/coinbase_beats_earnings_estimates_for_q2/h8gc238/,0.048,0.918,0.034,-0.1779
12,UI," As a Coinbase user.

The UI is terrible for both web and mobile.

The fees are high.

They sell you on rewards, that they then don't honor.

You have no control of limit pricing (buy or sell outside of Pro which jesus how to not get new users interested).

I do like their mainstream support to alt coins.

&#x200B;

My roughly 9-ish months of using them and because thats been my experience its why I haven't touched the stock. It was cheap lesson to drop a few bucks in just to see what they were selling.",Harrigan_Raen,0,/r/investing/comments/p1x594/coinbase_beats_earnings_estimates_for_q2/h8gny50/,0.097,0.823,0.08,-0.1847
13,COIN," Keep in mind, even though BTC has the highest volume in most exchanges out there, Coinbase does have alt coins where they can collect fees from, with that said, these alt coins are still not big enough to bring in the same amount compared to BTC....with that said, coinbase could be cyclical right now and maybe after this bigger bull run does out, expectations might be lowered due to decrease in demand. I could be wrong though and I hope I am because seeing how much more exposure crypto has all over the world right now, from television, ads, ads on the streets, crypto ATMs, sponsorship (like F1 having crypto.com ads), this might continue driving crypto awareness and higher prices and may expand the bull run even further. Am I still buying COIN and crypto? Yaaaa!!!",rudyae86,1,/r/investing/comments/p1x594/coinbase_beats_earnings_estimates_for_q2/h8grjdh/,0.05,0.913,0.037,0.2444
14,CB," How is UI terrible? Of all the exchanges I have used, crypto or not, CB is one of the best at it. Even CB Pro has a great UI",wannabe_engineer69,1,/r/investing/comments/p1x594/coinbase_beats_earnings_estimates_for_q2/h8gqh9c/,0.088,0.678,0.234,0.7351
15,UI," How is UI terrible? Of all the exchanges I have used, crypto or not, CB is one of the best at it. Even CB Pro has a great UI",wannabe_engineer69,1,/r/investing/comments/p1x594/coinbase_beats_earnings_estimates_for_q2/h8gqh9c/,0.088,0.678,0.234,0.7351
16,COIN," When you compare the the charts, they aren’t that strongly correlated. It’s especially evident in July where BTC was trending downwards while COIN maintained/rose",voneahhh,1,/r/investing/comments/p1x594/coinbase_beats_earnings_estimates_for_q2/h8goq3q/,0.0,0.916,0.084,0.2732
17,COIN," Crypto, like EV's are new business models and it may be decades before the technology curve flattens out and margins compress.  Remember, Autos used to be high margin, luxury products for decades before the Japanese commoditized and made everything dirt cheap.  And US banking used to be giant monopolies (JP morgan) before they were regulated and split decades later.

COIN is also a combination of exchange/broker/bank, which is subject to the whims of government regulations.  As we keep seeing Binance get banned everywhere, Coinbase with its board of Andreseen Horowitz and ex government crypto regulators, might be the best positioned for compliance.  And that makes institutional investors trust & flock to Coinbase, giving them a unique early mover advantage.  You may be right that margins eventually compress, but it may be after deacdes of explosive growth and cash printing.",RajivChaudrii,2,/r/investing/comments/p1x594/coinbase_beats_earnings_estimates_for_q2/h8glb1b/,0.026,0.884,0.09,0.8126
18,MS," Their current path towards profitability seems to involve asking small content creators to pay thousands of dollars so they can host their content on there. That, combined with the absolute dominance of Youtube makes me think that they have absolutely no chance with regular consumers and content creators. 

I'm less knowledgeable about them using businesses as customers. Is there any reason why a business would choose to host their content on Vimeo rather than other platforms? I can see why businesses shell out big money for MS Office or Adobe Premiere licenses, as those programs are clearly number one, but what is the upside to Vimeo in this regard?",ThrowawayLegalNL,9,/r/investing/comments/p1di9t/vimeo_thoughts_on_holding_or_selling/h8e6hit/,0.027,0.902,0.072,0.4593
19,SNAP," Vimeo is already worth >$5bn at today's prices. I really can't see any justification for it to be worth any more before becoming profitable, and as others have mentioned it doesn't look like there's a path to profitability.

You keep mentioning Youtube in other comments and saying that Vimeo should be worth more, but I think you're missing a key point: YouTube is not a standalone service. YT is worth more to google than it is to outside investors because there are significant shared core competencies in the ad market. It's way easier for Google to monetize and make YT profitable than it is for Vimeo management to do the same with them.

Maybe video streaming services are not viable standalone companies. Maybe there's a reason the market leader is a wholly owned subsidiary of an advertising giant. Maybe there's a reason that Vimeo's smaller business-focused competitors aren't public companies.

If I were you, I'd begin scaling out my position and using the proceeds to fund investments in more promising growth enterprises. No need to sell all at once, but no sense riding Vimeo down to $0.

One last thing: you never really propose WHY you think Vimeo is undervalued or how they can achieve profitability. If I were you I'd work through a timeline and see what that looks like. Do they need to optimize their current offerings & profit margins? Do they need to get more customers? Do they need to develop new products?

For example: TWTR is very hard to monetize, and it looks like they will need to develop new products to gain profitability. SNAP is much easier to monetize and they just needed to grow their userbase to support their current products.",dumpsterfire_account,6,/r/investing/comments/p1di9t/vimeo_thoughts_on_holding_or_selling/h8efo9j/,0.054,0.77,0.177,0.9905
20,TWTR," Vimeo is already worth >$5bn at today's prices. I really can't see any justification for it to be worth any more before becoming profitable, and as others have mentioned it doesn't look like there's a path to profitability.

You keep mentioning Youtube in other comments and saying that Vimeo should be worth more, but I think you're missing a key point: YouTube is not a standalone service. YT is worth more to google than it is to outside investors because there are significant shared core competencies in the ad market. It's way easier for Google to monetize and make YT profitable than it is for Vimeo management to do the same with them.

Maybe video streaming services are not viable standalone companies. Maybe there's a reason the market leader is a wholly owned subsidiary of an advertising giant. Maybe there's a reason that Vimeo's smaller business-focused competitors aren't public companies.

If I were you, I'd begin scaling out my position and using the proceeds to fund investments in more promising growth enterprises. No need to sell all at once, but no sense riding Vimeo down to $0.

One last thing: you never really propose WHY you think Vimeo is undervalued or how they can achieve profitability. If I were you I'd work through a timeline and see what that looks like. Do they need to optimize their current offerings & profit margins? Do they need to get more customers? Do they need to develop new products?

For example: TWTR is very hard to monetize, and it looks like they will need to develop new products to gain profitability. SNAP is much easier to monetize and they just needed to grow their userbase to support their current products.",dumpsterfire_account,6,/r/investing/comments/p1di9t/vimeo_thoughts_on_holding_or_selling/h8efo9j/,0.054,0.77,0.177,0.9905
21,IAC," Also for clarification, Vimeo is a recent spinoff from the holding company IAC (which has a pretty descent portfolio, suggest you look into IAC since they dipped after Vimeo IPO'd)",rgujjula-csdude,2,/r/investing/comments/p1di9t/vimeo_thoughts_on_holding_or_selling/h8d6338/,0.0,0.894,0.106,0.4939
22,IAC," Yup, I bought IAC beforehand solely bc of Vimeo and sold for a gain. Perhaps I'll go back in but need to look into what they have",BurnerBurnerBurns20,1,/r/investing/comments/p1di9t/vimeo_thoughts_on_holding_or_selling/h8d660n/,0.0,0.916,0.084,0.296
23,DD, Top tier DD,TheDazarooney,6,/r/investing/comments/p1di9t/vimeo_thoughts_on_holding_or_selling/h8f7lgh/,0.0,0.526,0.474,0.2023
24,IAC," I've used it before and liked it first hand, also had bought IAC bc of them solely and made a nice profit with them before the split off. 

I just think they have a huge marketshare over the video services for businesses that no one else is tapping into (YT and Vimeo are totally separate and barely even competitors). 

A lot of the reason for the initial sell off (pre earnings) was bc people didnt even know what it was and just sold it lol.",BurnerBurnerBurns20,1,/r/investing/comments/p1di9t/vimeo_thoughts_on_holding_or_selling/h8cvpg9/,0.024,0.796,0.181,0.9274
25,APPS," Nice, I hope it pops.  Great stock with awesome revenue and earnings growth.  I can't find another stock that is as good as APPS.",Exuberant-Investor,10,/r/investing/comments/p1mhw0/digital_turbine_reports_record_earnings_again/h8ejxd5/,0.0,0.452,0.548,0.9607
