,ticker,comment,username,score,permalink,neg,neu,pos,compound
607,CTXR," Just bought 5000 shares of HITIF, 5000 ARSMF, 2000 CTXR, and 1200 GTE.  


I don't really care how well they do because it's satisfying enough just to see that QTY lol.  


13,000 shares, or I could have bought like 17 TSLA shares.",ShortTermLongForm,6,/r/pennystocks/comments/lpezuc/the_lounge_thoughts_noob_stuff_low_effort_brokers/godaa1o/,0.055,0.614,0.331,0.9085
608,GTE," Just bought 5000 shares of HITIF, 5000 ARSMF, 2000 CTXR, and 1200 GTE.  


I don't really care how well they do because it's satisfying enough just to see that QTY lol.  


13,000 shares, or I could have bought like 17 TSLA shares.",ShortTermLongForm,6,/r/pennystocks/comments/lpezuc/the_lounge_thoughts_noob_stuff_low_effort_brokers/godaa1o/,0.055,0.614,0.331,0.9085
609,TSLA," Just bought 5000 shares of HITIF, 5000 ARSMF, 2000 CTXR, and 1200 GTE.  


I don't really care how well they do because it's satisfying enough just to see that QTY lol.  


13,000 shares, or I could have bought like 17 TSLA shares.",ShortTermLongForm,6,/r/pennystocks/comments/lpezuc/the_lounge_thoughts_noob_stuff_low_effort_brokers/godaa1o/,0.055,0.614,0.331,0.9085
610,CTRM," CTRM big jump this morning, bought in on dip, hoping it breaks opening price today",No_Low3754,4,/r/pennystocks/comments/lpezuc/the_lounge_thoughts_noob_stuff_low_effort_brokers/gocjn3v/,0.0,0.833,0.167,0.4215
611,HBIO, HBIO,ChoicePound5745,1,/r/pennystocks/comments/lpezuc/the_lounge_thoughts_noob_stuff_low_effort_brokers/gobd9x7/,0.0,1.0,0.0,0.0
612,ONTX, Looking forward for a solid day with ONTX and TRCH 🙂,AnAsianPrincess,1,/r/pennystocks/comments/lpezuc/the_lounge_thoughts_noob_stuff_low_effort_brokers/gobminz/,0.0,0.833,0.167,0.1531
613,TRCH, Looking forward for a solid day with ONTX and TRCH 🙂,AnAsianPrincess,1,/r/pennystocks/comments/lpezuc/the_lounge_thoughts_noob_stuff_low_effort_brokers/gobminz/,0.0,0.833,0.167,0.1531
614,ZSAN, ZSAN moves forward!!,Jtstockpics,1,/r/pennystocks/comments/lpezuc/the_lounge_thoughts_noob_stuff_low_effort_brokers/goch1jh/,0.0,1.0,0.0,0.0
615,UK, What account do you need at ibrk for UK users? Cash? Or margin? Or doesn't matter?,Severe-Pie-8148,1,/r/pennystocks/comments/lpezuc/the_lounge_thoughts_noob_stuff_low_effort_brokers/goclxvf/,0.119,0.881,0.0,-0.2579
616,PTN, Is PTN still long term or am I just bag holding lol,Baka1244,1,/r/pennystocks/comments/lpezuc/the_lounge_thoughts_noob_stuff_low_effort_brokers/god0o3z/,0.0,0.781,0.219,0.4215
617,CTXR, CTXR huge room for upward movement even at 2,U53RN4M3T4K3N,5,/r/pennystocks/comments/lpezuc/the_lounge_thoughts_noob_stuff_low_effort_brokers/gobmid9/,0.0,0.753,0.247,0.3182
618,NYC," Probably due to the announcement of NYC opening theaters back up. They're projected to have an abysmal Q4 upcoming though, so I wouldn't expect too much out of it.",DustinGoesWild,3,/r/pennystocks/comments/lpezuc/the_lounge_thoughts_noob_stuff_low_effort_brokers/godrtke/,0.0,1.0,0.0,0.0
619,DD," I am, I have a good feeling about it but not much DD to back that up. I just think they are in a hot product space",Dekuthegreat,1,/r/pennystocks/comments/lpezuc/the_lounge_thoughts_noob_stuff_low_effort_brokers/gobh1dk/,0.0,0.862,0.138,0.296
620,EOD, I'm strongly considering selling the $1 put if it looks to hold up by EOD.,belangrijke_muis,1,/r/pennystocks/comments/lpezuc/the_lounge_thoughts_noob_stuff_low_effort_brokers/gocpitr/,0.0,0.87,0.13,0.2732
621,PT," It had a direct offering it went down to 68c for institutions, Last week?

Expected PT is 3$.",DreamingGurl88,2,/r/pennystocks/comments/lpezuc/the_lounge_thoughts_noob_stuff_low_effort_brokers/god1047/,0.0,1.0,0.0,0.0
622,ZOM," You can definitely swing trade and hold for investing. The majority of my stocks are held for a week or less and a few I hold for a long time (ex ZOM, ABML) I’ve held those for months now.",Blunder3715,2,/r/pennystocks/comments/lpezuc/the_lounge_thoughts_noob_stuff_low_effort_brokers/godf1uh/,0.0,0.926,0.074,0.4019
623,PULM," Depends on the stock. Some penny stocks are better short term plays, but some are weeks to months (ALPP, PULM, etc.)",Dahki,2,/r/pennystocks/comments/lpezuc/the_lounge_thoughts_noob_stuff_low_effort_brokers/godfjvo/,0.0,0.846,0.154,0.3506
624,RH," Where can you trade AITX?
Webull and RH are no-go's.",Stormchazer90,2,/r/pennystocks/comments/lpezuc/the_lounge_thoughts_noob_stuff_low_effort_brokers/gocf70a/,0.0,1.0,0.0,0.0
625,IMO," With you on $AITX. They are legit, IMO. Good presence, good business.",afcolt,1,/r/pennystocks/comments/lpezuc/the_lounge_thoughts_noob_stuff_low_effort_brokers/goc72gl/,0.0,0.633,0.367,0.7003
626,TD, I have TD and the OTC fees suck. I’ve heard Schwab and fidelity were better,bamnewnan,2,/r/pennystocks/comments/lpezuc/the_lounge_thoughts_noob_stuff_low_effort_brokers/gob5rf5/,0.163,0.674,0.163,0.0
627,CEO," [Maybe you should find out why CEO of ALYI doesn't claim you on his linkedin](https://et.linkedin.com/public-profile/in/randy-torno-5615a04?trk=people-guest_people_search-card&challengeId=AQGU3W-T0Qh_XwAAAXfKRd32tQSh8QiAjcyL9alvGtOrp-SKK-peWLGXXBtjT-6BMiTlveMlL9XGN4K_p74Vnh38T9KIyA1kbw&submissionId=5f6a3a84-301a-6616-fa6e-9314df75c437) and see if he ever managed to leverage those connections in Africa to build the condom factory he promised [these shareholders](https://finance.yahoo.com/quote/ANCE/community?p=ANCE). (newest reaction is all the DD I need)

Maybe take some/all profits left on the table in that one until they manage to deliver the first 2000 bikes or disclose their mysterious manufacturing partners. I'm not a financial advisor or accusing Randy Torno of being a deep state actor, wrecking every life in his wake. The empire never ended, and I just don't like the stock, and if no one hears from ole FuzzyMizzet again you know why",FuzzyMizzet,1,/r/pennystocks/comments/lpezuc/the_lounge_thoughts_noob_stuff_low_effort_brokers/gockhgn/,0.055,0.899,0.046,0.1901
628,DD," [Maybe you should find out why CEO of ALYI doesn't claim you on his linkedin](https://et.linkedin.com/public-profile/in/randy-torno-5615a04?trk=people-guest_people_search-card&challengeId=AQGU3W-T0Qh_XwAAAXfKRd32tQSh8QiAjcyL9alvGtOrp-SKK-peWLGXXBtjT-6BMiTlveMlL9XGN4K_p74Vnh38T9KIyA1kbw&submissionId=5f6a3a84-301a-6616-fa6e-9314df75c437) and see if he ever managed to leverage those connections in Africa to build the condom factory he promised [these shareholders](https://finance.yahoo.com/quote/ANCE/community?p=ANCE). (newest reaction is all the DD I need)

Maybe take some/all profits left on the table in that one until they manage to deliver the first 2000 bikes or disclose their mysterious manufacturing partners. I'm not a financial advisor or accusing Randy Torno of being a deep state actor, wrecking every life in his wake. The empire never ended, and I just don't like the stock, and if no one hears from ole FuzzyMizzet again you know why",FuzzyMizzet,1,/r/pennystocks/comments/lpezuc/the_lounge_thoughts_noob_stuff_low_effort_brokers/gockhgn/,0.055,0.899,0.046,0.1901
629,TD, Wish TD Ameritrade would follow suit since Schwab bought them,bidoville,3,/r/pennystocks/comments/lpezuc/the_lounge_thoughts_noob_stuff_low_effort_brokers/god6o4q/,0.0,0.769,0.231,0.4019
630,DD," RGTI and BTSC. The first possibly has a lot of broken machines, which aren’t likely to be replaced soon. Its leadership is also incredibly sketchy based on past fraud. BTSC may be okay, but my DD into them has resulted in nothing. I can’t confirm leadership, location or really anything that would reassure me they are legit.",ripripitup,1,/r/pennystocks/comments/lpezuc/the_lounge_thoughts_noob_stuff_low_effort_brokers/gobx2kt/,0.074,0.85,0.076,0.0258
631,CS," no they don't.  from what I read CS is the only one that has all the OTC / penny / sub penny stocks and no fees.  Even Fidelity which is no fee I see people saying they can't get certain stocks on there.  I got TD for their think or swim platform and to do any trading of ""real"" stocks then Schwab for OTC / pennies.  I had an existing Vanguard account which is what I started on but they don't have a lot of the OTC / penny stocks.  So they are essentially out for me now bc they don't do anything others don't do and their UI / UX is pretty horrible.",Bats8711,2,/r/pennystocks/comments/lpezuc/the_lounge_thoughts_noob_stuff_low_effort_brokers/gocs5eo/,0.098,0.864,0.038,-0.5657
632,TD," no they don't.  from what I read CS is the only one that has all the OTC / penny / sub penny stocks and no fees.  Even Fidelity which is no fee I see people saying they can't get certain stocks on there.  I got TD for their think or swim platform and to do any trading of ""real"" stocks then Schwab for OTC / pennies.  I had an existing Vanguard account which is what I started on but they don't have a lot of the OTC / penny stocks.  So they are essentially out for me now bc they don't do anything others don't do and their UI / UX is pretty horrible.",Bats8711,2,/r/pennystocks/comments/lpezuc/the_lounge_thoughts_noob_stuff_low_effort_brokers/gocs5eo/,0.098,0.864,0.038,-0.5657
633,UI," no they don't.  from what I read CS is the only one that has all the OTC / penny / sub penny stocks and no fees.  Even Fidelity which is no fee I see people saying they can't get certain stocks on there.  I got TD for their think or swim platform and to do any trading of ""real"" stocks then Schwab for OTC / pennies.  I had an existing Vanguard account which is what I started on but they don't have a lot of the OTC / penny stocks.  So they are essentially out for me now bc they don't do anything others don't do and their UI / UX is pretty horrible.",Bats8711,2,/r/pennystocks/comments/lpezuc/the_lounge_thoughts_noob_stuff_low_effort_brokers/gocs5eo/,0.098,0.864,0.038,-0.5657
634,PULM, I sure hope so about PULM bc I'm down 11% atm. Keep telling myself it's a mid-long term play.,DustinGoesWild,2,/r/pennystocks/comments/lpezuc/the_lounge_thoughts_noob_stuff_low_effort_brokers/godir7h/,0.0,0.648,0.352,0.765
635,JPM, Good thing correct? JPM just bought a shit ton on Friday,ChoicePound5745,1,/r/pennystocks/comments/lpezuc/the_lounge_thoughts_noob_stuff_low_effort_brokers/gobqwpj/,0.248,0.552,0.2,-0.1779
636,ASRT," So here's the logic:

I like ASRT, but I'm not 100% sold on it. I sell the $1 put, which I can sell right now for $15. If the price of ASRT falls below $1, the option gets assigned and I am contractually obligated to buy 100 shares of ASRT at $1, no matter what the actual price is. So, as long as ASRT stays above $.85, I make a profit, and if the price is between $.85 and $1, I'm essentially buying ASRT at a discount. 

The hazard with this play is a sudden crash in price, which I doubt would happen. What really gives me pause (and the reason I haven't made the trade already) is earnings March 11, a week before option expiration. This year has proven exceptionally screwy for earnings reports (e.g. STMP dropped ~20% after beating estimates by 50%).",belangrijke_muis,3,/r/pennystocks/comments/lpezuc/the_lounge_thoughts_noob_stuff_low_effort_brokers/gocr772/,0.112,0.802,0.086,-0.7153
637,STMP," So here's the logic:

I like ASRT, but I'm not 100% sold on it. I sell the $1 put, which I can sell right now for $15. If the price of ASRT falls below $1, the option gets assigned and I am contractually obligated to buy 100 shares of ASRT at $1, no matter what the actual price is. So, as long as ASRT stays above $.85, I make a profit, and if the price is between $.85 and $1, I'm essentially buying ASRT at a discount. 

The hazard with this play is a sudden crash in price, which I doubt would happen. What really gives me pause (and the reason I haven't made the trade already) is earnings March 11, a week before option expiration. This year has proven exceptionally screwy for earnings reports (e.g. STMP dropped ~20% after beating estimates by 50%).",belangrijke_muis,3,/r/pennystocks/comments/lpezuc/the_lounge_thoughts_noob_stuff_low_effort_brokers/gocr772/,0.112,0.802,0.086,-0.7153
638,CRMD, Not psychic just most likely what it will hit maybe higher after phase 3. Lots of dd out there but it’s the only drug that can cure infections unlike CRMD which their drug prevents it but only 70ish percent effective. It’s super hyped because of this so who knows I’m ridding it out.,spinning_leaves,3,/r/pennystocks/comments/lpezuc/the_lounge_thoughts_noob_stuff_low_effort_brokers/gocibxj/,0.0,0.82,0.18,0.899
639,IMO," Yeah PULM is going to be at least a few month play. IMO got overhyped, with slight correction, going to moon anyway over the course of the year. This one's gonna be a test of my hands lol. I think I'm going to end up very tempted to sell at different points, but $10 feels like a floor for a year from now.",Dahki,3,/r/pennystocks/comments/lpezuc/the_lounge_thoughts_noob_stuff_low_effort_brokers/godj85s/,0.0,0.865,0.135,0.7543
640,PULM," Yeah PULM is going to be at least a few month play. IMO got overhyped, with slight correction, going to moon anyway over the course of the year. This one's gonna be a test of my hands lol. I think I'm going to end up very tempted to sell at different points, but $10 feels like a floor for a year from now.",Dahki,3,/r/pennystocks/comments/lpezuc/the_lounge_thoughts_noob_stuff_low_effort_brokers/godj85s/,0.0,0.865,0.135,0.7543
641,RH," I personally use fidelity because it is reliable in customer service, buys/sells, and pretty much everything else. 

A big downside of fidelity, as I'm sure you have seen, is its UI. It's quite lacking and looks very old. A bit hard to navigate. 

If for whatever reason you don't want to use fidelity, look into Vanguard. 

Don't use RH.",Fri3ndlyHeavy,2,/r/pennystocks/comments/lpezuc/the_lounge_thoughts_noob_stuff_low_effort_brokers/gobmf8w/,0.08,0.831,0.09,0.3847
642,UI," I personally use fidelity because it is reliable in customer service, buys/sells, and pretty much everything else. 

A big downside of fidelity, as I'm sure you have seen, is its UI. It's quite lacking and looks very old. A bit hard to navigate. 

If for whatever reason you don't want to use fidelity, look into Vanguard. 

Don't use RH.",Fri3ndlyHeavy,2,/r/pennystocks/comments/lpezuc/the_lounge_thoughts_noob_stuff_low_effort_brokers/gobmf8w/,0.08,0.831,0.09,0.3847
643,CEO," CEO in for 100,000 shares.

[https://finviz.com/insidertrading.ashx?oc=1031847&tc=7](https://finviz.com/insidertrading.ashx?oc=1031847&tc=7)

![gif](giphy|l0Ex6kAKAoFRsFh6M|downsized)

In for 1000 @ 4.10⬆️⬆️⬆️⬆️",Asleep-Ad6759,6,/r/pennystocks/comments/lpvmd4/crvs_corvus_pharmaceuticals_potential_200/godbera/,0.0,0.778,0.222,0.4314
644,CRVS," [https://www.marketbeat.com/stocks/NASDAQ/CRVS/price-target/](https://www.marketbeat.com/stocks/NASDAQ/CRVS/price-target/)

Three wall street analysts predict a high price target of 12$, a median of 8$ and a low of 4$. Personally, I don't think It'll go over 8$ long term but who knows.",jackboyyouknow,1,/r/pennystocks/comments/lpvmd4/crvs_corvus_pharmaceuticals_potential_200/godfan6/,0.051,0.949,0.0,-0.1406
645,SP," RNVA is the winner for me. Not pumped, stable floor just below current SP, has been as high as 3x in 3m. Looks like a good short-term ride",WickedSplitter49,2,/r/pennystocks/comments/lpl1eq/my_stock_screener/gocgy99/,0.055,0.675,0.27,0.808
646,API," Hey mate, where did you get the data from OTC? Can't find it in any API.",Reaqu,1,/r/pennystocks/comments/lpl1eq/my_stock_screener/gobxvb5/,0.0,1.0,0.0,0.0
647,ZKIN," ZKIN, Wednesday they are improving and launching a new blockchain for XSIGMA. This is huge news and has a lot of backers. Buy in today. Market is really bearish, and enjoy your gains by the end of the week ;)",Akgopewpew,1,/r/pennystocks/comments/lpl1eq/my_stock_screener/gocg3xp/,0.0,0.72,0.28,0.8971
648,PM," I will be messaging you in 1 day on [**2021-02-23 12:21:50 UTC**](http://www.wolframalpha.com/input/?i=2021-02-23%2012:21:50%20UTC%20To%20Local%20Time) to remind you of [**this link**](https://np.reddit.com/r/pennystocks/comments/lpl1eq/my_stock_screener/goc0e0j/?context=3)

[**1 OTHERS CLICKED THIS LINK**](https://np.reddit.com/message/compose/?to=RemindMeBot&subject=Reminder&message=%5Bhttps%3A%2F%2Fwww.reddit.com%2Fr%2Fpennystocks%2Fcomments%2Flpl1eq%2Fmy_stock_screener%2Fgoc0e0j%2F%5D%0A%0ARemindMe%21%202021-02-23%2012%3A21%3A50%20UTC) to send a PM to also be reminded and to reduce spam.

^(Parent commenter can ) [^(delete this message to hide from others.)](https://np.reddit.com/message/compose/?to=RemindMeBot&subject=Delete%20Comment&message=Delete%21%20lpl1eq)

*****

|[^(Info)](https://np.reddit.com/r/RemindMeBot/comments/e1bko7/remindmebot_info_v21/)|[^(Custom)](https://np.reddit.com/message/compose/?to=RemindMeBot&subject=Reminder&message=%5BLink%20or%20message%20inside%20square%20brackets%5D%0A%0ARemindMe%21%20Time%20period%20here)|[^(Your Reminders)](https://np.reddit.com/message/compose/?to=RemindMeBot&subject=List%20Of%20Reminders&message=MyReminders%21)|[^(Feedback)](https://np.reddit.com/message/compose/?to=Watchful1&subject=RemindMeBot%20Feedback)|
|-|-|-|-|",RemindMeBot,1,/r/pennystocks/comments/lpl1eq/my_stock_screener/goc0f3i/,0.105,0.895,0.0,-0.6322
649,DD," You wouldnt need to do it especially for my broker. I like TR but I think for pennystocks I will need to move to another one.  
Every DD on reddit first thing I do is to check if its on TR so I dont get too hyped only to realize I cant even trade it :)",Hoodyini,1,/r/pennystocks/comments/lpl1eq/my_stock_screener/goby8lc/,0.0,0.893,0.107,0.6956
650,TR," You wouldnt need to do it especially for my broker. I like TR but I think for pennystocks I will need to move to another one.  
Every DD on reddit first thing I do is to check if its on TR so I dont get too hyped only to realize I cant even trade it :)",Hoodyini,1,/r/pennystocks/comments/lpl1eq/my_stock_screener/goby8lc/,0.0,0.893,0.107,0.6956
651,DD, Hopefully this shows some of the people on here not to  fully rely on reddit even though most if not all posts tell people to do your own DD before investing. Sometimes I read comments that go all in on stocks then later down the road see that particular person getting stuck holding for a longer period than they initially thought.,MrPenby,1,/r/pennystocks/comments/lp743f/i_made_a_rocket_themed_visualisation_of_stocks/go9qzpq/,0.032,0.924,0.044,0.1779
652,DNN, Good work.  Still staying on DNN and ALPP.,RussianCrabMan,1,/r/pennystocks/comments/lp743f/i_made_a_rocket_themed_visualisation_of_stocks/goa4l5v/,0.0,0.707,0.293,0.4404
653,API," Yeah via the Reddit API. I used the Python library PRAW to scrape recent posts from Reddit, then I search for ticker symbols in those posts. Registering the app only takes a minute.",JoesStocksAccount,1,/r/pennystocks/comments/lp743f/i_made_a_rocket_themed_visualisation_of_stocks/gobllh6/,0.0,0.929,0.071,0.296
654,DD, Thanks for the DD. One thing I wonder: are there any actual plans to use this technology for other commodities like lithium? The market would be huge.,Kennzahl,6,/r/pennystocks/comments/lpx5ut/deep_dd_goldspot_discoveries_ticker_vspot_9001000/godpj8r/,0.0,0.749,0.251,0.7717
655,SPOT," > G.SPOT would’ve been so much easier.

Not in my experience.",ExtraLifeMan,6,/r/pennystocks/comments/lpx5ut/deep_dd_goldspot_discoveries_ticker_vspot_9001000/godqkyi/,0.0,0.745,0.255,0.4728
656,DD," Thanks for the DD op, other than the click-bait title, it was solid. This company looks like it has massive potential, and definitely still under the radar. You may have struck gold here *ba-dum-tss*

In for 645 shares. Let’s see where this goes",LiftMeSenpai,5,/r/pennystocks/comments/lpx5ut/deep_dd_goldspot_discoveries_ticker_vspot_9001000/godo865/,0.039,0.727,0.234,0.836
657,DD," Looks like a really nice find, and appreciate the thorough DD.

The stock's a bit hard to find but apparently available on E-Trade, TD Ameritrade, and Degiro under GDDCF (or SPOT under Canadian markets).

Am in for 3000!",baobabaloo,4,/r/pennystocks/comments/lpx5ut/deep_dd_goldspot_discoveries_ticker_vspot_9001000/godn2gu/,0.031,0.818,0.152,0.5773
658,SPOT," Looks like a really nice find, and appreciate the thorough DD.

The stock's a bit hard to find but apparently available on E-Trade, TD Ameritrade, and Degiro under GDDCF (or SPOT under Canadian markets).

Am in for 3000!",baobabaloo,4,/r/pennystocks/comments/lpx5ut/deep_dd_goldspot_discoveries_ticker_vspot_9001000/godn2gu/,0.031,0.818,0.152,0.5773
659,TD," Looks like a really nice find, and appreciate the thorough DD.

The stock's a bit hard to find but apparently available on E-Trade, TD Ameritrade, and Degiro under GDDCF (or SPOT under Canadian markets).

Am in for 3000!",baobabaloo,4,/r/pennystocks/comments/lpx5ut/deep_dd_goldspot_discoveries_ticker_vspot_9001000/godn2gu/,0.031,0.818,0.152,0.5773
660,AI, Have there been any claims of significant differences in gold yield by their clients? I want to know how much the AI actually helps,GlacialFox,3,/r/pennystocks/comments/lpx5ut/deep_dd_goldspot_discoveries_ticker_vspot_9001000/godtapx/,0.0,0.778,0.222,0.5719
661,TD," saying 1000% growth possible seems pretty click-baity. I checked it out and placed an order for 10 shares to see if it was even tradeable on TD, and lol.

in for 10 shares for now i guess 🤷‍♂️.",Demonknightx,10,/r/pennystocks/comments/lpx5ut/deep_dd_goldspot_discoveries_ticker_vspot_9001000/godgjd1/,0.0,0.705,0.295,0.9001
662,DD," In my quick DD I found out that they get fixed fees, quite a lot from royalties and they invest in junior mining companies like New Found Gold: 750k to 6.3million and NV Gold Corp: 500k to +- 2 million",Commercial-Zombie-71,3,/r/pennystocks/comments/lpx5ut/deep_dd_goldspot_discoveries_ticker_vspot_9001000/godv3rw/,0.0,0.935,0.065,0.3612
663,DD," I know it's in the DD, which is why I asked. I was wondering if there are concrete plans by management to do so.",Kennzahl,3,/r/pennystocks/comments/lpx5ut/deep_dd_goldspot_discoveries_ticker_vspot_9001000/godqnn8/,0.0,1.0,0.0,0.0
664,DD," If the clients are investing in the company then it’s a good sign. I’d invest in the company but the market just closed! Bad time to post DD 😩


*GOOD DD!",GlacialFox,5,/r/pennystocks/comments/lpx5ut/deep_dd_goldspot_discoveries_ticker_vspot_9001000/godvmf4/,0.156,0.788,0.057,-0.658
665,GTE, Stoked to see my GTE shares have some fun in the green next week. Have about 1k shares might go for more IDK,BuyTheDipAndHoldMony,2,/r/pennystocks/comments/lpb1lm/ready_for_upcoming_week/goaqu67/,0.083,0.652,0.264,0.6456
666,ASRT, Will be bitting my nails following ASRT ha,sherbertloins,1,/r/pennystocks/comments/lpb1lm/ready_for_upcoming_week/goblz4a/,0.0,0.745,0.255,0.34
667,CTRM," Right now I’m looking to expand my ZOM and GTE stocks, GTE is on a dip, ZOM is somewhat but either way right now it’s a steal, I just acquired some more divedend stocks so probably just adding to my current stock portfolio, maybe look take a look at CTRM again and a few others",DonDada2k,4,/r/pennystocks/comments/lpb1lm/ready_for_upcoming_week/goam7ny/,0.08,0.89,0.031,-0.5647
668,GTE," Right now I’m looking to expand my ZOM and GTE stocks, GTE is on a dip, ZOM is somewhat but either way right now it’s a steal, I just acquired some more divedend stocks so probably just adding to my current stock portfolio, maybe look take a look at CTRM again and a few others",DonDada2k,4,/r/pennystocks/comments/lpb1lm/ready_for_upcoming_week/goam7ny/,0.08,0.89,0.031,-0.5647
669,ZOM," Right now I’m looking to expand my ZOM and GTE stocks, GTE is on a dip, ZOM is somewhat but either way right now it’s a steal, I just acquired some more divedend stocks so probably just adding to my current stock portfolio, maybe look take a look at CTRM again and a few others",DonDada2k,4,/r/pennystocks/comments/lpb1lm/ready_for_upcoming_week/goam7ny/,0.08,0.89,0.031,-0.5647
670,AQMS," Take a look at OTTV on sale + INTV + UNQL + IQST + KAVL 
Mining stocks in Lithium + copper + nickel + cobalt + manganese + rare earth + silver are going to be in very high demand.  AMYZF + CYDVF + REZZF + REEMF + ABML + TLOFF + ILHMF + SXOOF + UAMY + FCSMF + MLLOF + HNCKF + TGB + AQMS are the ones I have .

On NASDAQ these are my favorite CIDM + FLNT + PERI + HIMX + RWLK + MGI",NPRjunkieDC,2,/r/pennystocks/comments/lpb1lm/ready_for_upcoming_week/goax2bn/,0.029,0.923,0.049,0.3008
671,CIDM," Take a look at OTTV on sale + INTV + UNQL + IQST + KAVL 
Mining stocks in Lithium + copper + nickel + cobalt + manganese + rare earth + silver are going to be in very high demand.  AMYZF + CYDVF + REZZF + REEMF + ABML + TLOFF + ILHMF + SXOOF + UAMY + FCSMF + MLLOF + HNCKF + TGB + AQMS are the ones I have .

On NASDAQ these are my favorite CIDM + FLNT + PERI + HIMX + RWLK + MGI",NPRjunkieDC,2,/r/pennystocks/comments/lpb1lm/ready_for_upcoming_week/goax2bn/,0.029,0.923,0.049,0.3008
672,FLNT," Take a look at OTTV on sale + INTV + UNQL + IQST + KAVL 
Mining stocks in Lithium + copper + nickel + cobalt + manganese + rare earth + silver are going to be in very high demand.  AMYZF + CYDVF + REZZF + REEMF + ABML + TLOFF + ILHMF + SXOOF + UAMY + FCSMF + MLLOF + HNCKF + TGB + AQMS are the ones I have .

On NASDAQ these are my favorite CIDM + FLNT + PERI + HIMX + RWLK + MGI",NPRjunkieDC,2,/r/pennystocks/comments/lpb1lm/ready_for_upcoming_week/goax2bn/,0.029,0.923,0.049,0.3008
673,HIMX," Take a look at OTTV on sale + INTV + UNQL + IQST + KAVL 
Mining stocks in Lithium + copper + nickel + cobalt + manganese + rare earth + silver are going to be in very high demand.  AMYZF + CYDVF + REZZF + REEMF + ABML + TLOFF + ILHMF + SXOOF + UAMY + FCSMF + MLLOF + HNCKF + TGB + AQMS are the ones I have .

On NASDAQ these are my favorite CIDM + FLNT + PERI + HIMX + RWLK + MGI",NPRjunkieDC,2,/r/pennystocks/comments/lpb1lm/ready_for_upcoming_week/goax2bn/,0.029,0.923,0.049,0.3008
