,ticker,comment,username,score,permalink,neg,neu,pos,compound
67,BIG, BIG ones. Ten percent minimum. My company has handed me over 20% in raises over the last 3 years and I didn't even ask for them. They just reacted to the targets necessary to not hemorrhage employees in turnover.,TheObservationalist,1,/r/wallstreetbets/comments/11uortm/pivot_already_started_jpow_will_have_to_explain/jcqjv4w/,0.0,1.0,0.0,0.0
68,NOW, My point still stands. The banks are getting par value NOW for the bonds that are supposed to mature later. Anything the banks get above the current market value of those bonds has the same effect as printing that amount (inflation). They'd have to make the banks pay back with a super high interest to destroy the excess money later. That's IF the banks can even pay back. Where exactly are they going to get the money to pay back?,jedivind,2,/r/wallstreetbets/comments/11uortm/pivot_already_started_jpow_will_have_to_explain/jcqa43f/,0.084,0.759,0.157,0.8316
69,USA," Iran 100% Israel will be the hand but USA will be the backup. It will be some bullshit about democratic freedom but mainly Israel NEEDS a reason any reason because iran might join Israel as having nukes oh wait Israel doesn’t have nuclear weapons 😉 

&#x200B;

do I want iran to have nuck weapons no, but at what point do we say it’s ok for us but we will invade and bomb you so we don’t meet on the same footing",This_Environment_883,2,/r/wallstreetbets/comments/11uortm/pivot_already_started_jpow_will_have_to_explain/jcqdqxj/,0.194,0.661,0.145,-0.7935
70,NC, Same here in NC except real estate and that's increased by 125% or more.,Responsible_Sport575,11,/r/wallstreetbets/comments/11uortm/pivot_already_started_jpow_will_have_to_explain/jcprhha/,0.0,0.861,0.139,0.2732
71,ANY," The 2 trillion Bank term funding program basically means no banks can fail due to liquidity issues. The fed is pulling out all stops to prevent ANY bank from failing.

[https://www.cnbc.com/2023/03/16/banks-take-advantage-of-fed-crisis-lending-programs-.html](https://www.cnbc.com/2023/03/16/banks-take-advantage-of-fed-crisis-lending-programs-.html)

As you can see from the article its already been used quite heavily, so a lot of banks needed that cash infusion.",hkboy3,13,/r/wallstreetbets/comments/11uortm/pivot_already_started_jpow_will_have_to_explain/jcp6zm2/,0.184,0.797,0.019,-0.8591
72,JPM," Wasn’t Powell the one that said there would be casualties once this tightening cycle is over?  Powell kept saying price stability price stability, do you think we have that today?  Who cares a few banks goes down?  If the big banks go down JPM, Goldman, Citibank, B of A, I would then be a little worried, yes, only a little.  $300b injected back on fed balance sheet just made Bitcoin and other crypto spike.  That’s exactly what the Feds don’t want to happen. People moving away from green back to crypto for safety?  Kinda sad if people think crypto holds more face value than USD.  Shows how much faith people have with this government now.",AW-408,15,/r/wallstreetbets/comments/11uortm/pivot_already_started_jpow_will_have_to_explain/jcp461j/,0.038,0.831,0.13,0.8819
73,AI," You could add anything that might happen to this list. COVID 2? Nuclear war? Civil war in America due to not trusting the outcome of next year's elections? Something something AI/skynet?

What specific reason do you **expect** any of the things you said to happen?",Annoyedatreddit1,2,/r/wallstreetbets/comments/11uortm/pivot_already_started_jpow_will_have_to_explain/jcq3c5g/,0.208,0.792,0.0,-0.9005
74,MA," Canada has a socialized healthcare system via a single payer public health insurance program. Canada pays 15% federal tax on the first 50k and 20% on the next 50k of income. This is roughly the same as what US citizens pay too - but our deductions and all are different so let’s look at some numbers:

A $100k income in British Columbia, Canada in 2022 meant you paid ~$25k in tax, with a ~25% effective tax rate. So your take home, with healthcare included, is ~$75k annually. 

A $100k income in MA, US in 2022 meant you paid ~$20k in income tax, with a ~20% effective tax rate. The average American household’s per-person healthcare cost in 2018 (using older year to remove Covid effects) was roughly  ~$5k annually. So the effective take home, adjusting for healthcare costs, is ~$75k annually.",OG-Pine,1,/r/wallstreetbets/comments/11uortm/pivot_already_started_jpow_will_have_to_explain/jcqfo11/,0.008,0.904,0.087,0.9224
75,ICU," 10% SO FAR…I was hospitalized for 11 day, ICU all 11 days, in a coma for 7, “itemized” was a couple hundred thousand. I’ve received a $12,750…a $1350…a few $500-$750…then co-pays! $60 each visit, if I need scripts up to $250-$300 for the day. Like I said, America is a FUCKIN joke!!!",Narrow_Finding3352,2,/r/wallstreetbets/comments/11uortm/pivot_already_started_jpow_will_have_to_explain/jcpxf7j/,0.0,0.882,0.118,0.7067
76,SO," 10% SO FAR…I was hospitalized for 11 day, ICU all 11 days, in a coma for 7, “itemized” was a couple hundred thousand. I’ve received a $12,750…a $1350…a few $500-$750…then co-pays! $60 each visit, if I need scripts up to $250-$300 for the day. Like I said, America is a FUCKIN joke!!!",Narrow_Finding3352,2,/r/wallstreetbets/comments/11uortm/pivot_already_started_jpow_will_have_to_explain/jcpxf7j/,0.0,0.882,0.118,0.7067
77,UBS, Now UBS gets all the STD's from Debit Suisse and dies from Aids too.,DidNotRedditMan,49,/r/wallstreetbets/comments/11uqd9i/accurate_swiss_negotiations/jcpo41n/,0.0,1.0,0.0,0.0
78,CS," So if I have calls on CS OTM right now, what happens if they merge? They just expire worthless?",hohmgrown,0,/r/wallstreetbets/comments/11uqd9i/accurate_swiss_negotiations/jcppfwt/,0.161,0.839,0.0,-0.504
79,UBS," 

I was told by an expert on Bloomberg that Swiss authorities don't have the ability to force this merger. I *think* the US Federal government used its authority to merge JP and Stearns. 

I'd say it's very similar but not wholly the same.

Edit: wanted to make sure I wasn't spreading bad information. 

>[To stamp out the crisis, Swiss regulators are encouraging UBS and Credit Suisse to merge but neither bank wants to do so. The regulators do not have the power to force the merger, sources told Reuters.](https://www.businesstoday.in/amp/latest/world/story/ubs-seeks-backstop-in-any-credit-suisse-deal-asks-swiss-govt-to-take-on-certain-losses-report-373934-2023-03-18)

Still looking to see if the US made JP Morgan buy Stearns.",WR810,11,/r/wallstreetbets/comments/11uqd9i/accurate_swiss_negotiations/jcq33lz/,0.061,0.76,0.179,0.9154
80,UBS," UBS doesn't look great on its own, having Debit Suisse's bag of shit shoveled onto them sounds like a terrible idea. WhAt CoUlD pOsSiBlY gO wRoNg?1!",ToothlessTrader,5,/r/wallstreetbets/comments/11uqd9i/accurate_swiss_negotiations/jcqmmn9/,0.304,0.622,0.074,-0.831
81,CS, They will announce a price at which CS shares concert to UBS,cloudgainz,3,/r/wallstreetbets/comments/11uqd9i/accurate_swiss_negotiations/jcq08h2/,0.0,0.82,0.18,0.296
82,UBS, They will announce a price at which CS shares concert to UBS,cloudgainz,3,/r/wallstreetbets/comments/11uqd9i/accurate_swiss_negotiations/jcq08h2/,0.0,0.82,0.18,0.296
83,JPM," Do you know what happens to Bear Stearns' shareholders? Is all equity wiped out or they got JPM shares instead ?

> Boomberg that Swiss authorities don't have the ability to force this merger. I think the US Federal government used its authority to merge JP and Stearns.
> I'd say it's very similar but not wholly the same.",314sn,2,/r/wallstreetbets/comments/11uqd9i/accurate_swiss_negotiations/jcqnne3/,0.026,0.889,0.085,0.339
84,FRC, If JPM thinks FRC is worth $62/share why doesn't it buy FRC straight out? Because they don't think it's worth $62 and they're trying to trick you.,BuySellHoldFinance,125,/r/wallstreetbets/comments/11usmpu/frc_when_jp_morgan_invests_billions_in_uninsured/jcpw8t7/,0.04,0.769,0.191,0.5423
85,JPM, If JPM thinks FRC is worth $62/share why doesn't it buy FRC straight out? Because they don't think it's worth $62 and they're trying to trick you.,BuySellHoldFinance,125,/r/wallstreetbets/comments/11usmpu/frc_when_jp_morgan_invests_billions_in_uninsured/jcpw8t7/,0.04,0.769,0.191,0.5423
86,OP, OP prolly has calls and is doomscrolling Fintwit praying for good news ![img](emote|t5_2th52|4271)![img](emote|t5_2th52|4271)![img](emote|t5_2th52|4271),tigerkingsam,3,/r/wallstreetbets/comments/11usmpu/frc_when_jp_morgan_invests_billions_in_uninsured/jcq3iav/,0.0,0.637,0.363,0.7412
87,FRC," If the NYT news is indeed true that FRC is talking about doing a private raise, then JPM is actually the shady entity here. The timing of this is an obvious attempt to raise the share price for more capital raise as JPM has an interest to not see this bank fail.",False_Secret1108,0,/r/wallstreetbets/comments/11usmpu/frc_when_jp_morgan_invests_billions_in_uninsured/jcqplq4/,0.06,0.803,0.137,0.5423
88,JPM," If the NYT news is indeed true that FRC is talking about doing a private raise, then JPM is actually the shady entity here. The timing of this is an obvious attempt to raise the share price for more capital raise as JPM has an interest to not see this bank fail.",False_Secret1108,0,/r/wallstreetbets/comments/11usmpu/frc_when_jp_morgan_invests_billions_in_uninsured/jcqplq4/,0.06,0.803,0.137,0.5423
89,NYT," If the NYT news is indeed true that FRC is talking about doing a private raise, then JPM is actually the shady entity here. The timing of this is an obvious attempt to raise the share price for more capital raise as JPM has an interest to not see this bank fail.",False_Secret1108,0,/r/wallstreetbets/comments/11usmpu/frc_when_jp_morgan_invests_billions_in_uninsured/jcqplq4/,0.06,0.803,0.137,0.5423
90,JPM," But he has Nick Timiraos hair, does the entire JPM bailout team all have Nick Timiraos hair?

I, for one, have been well trained by JPow to only trust people that have Nick Timiraos hair",Women_Ruined_Slavery,3,/r/wallstreetbets/comments/11usmpu/frc_when_jp_morgan_invests_billions_in_uninsured/jcqmx9t/,0.039,0.786,0.174,0.7579
91,FRC," Might happen though

How does high FRC share price benefit them, why are they trying to trick us?",That-Relation-5846,3,/r/wallstreetbets/comments/11usmpu/frc_when_jp_morgan_invests_billions_in_uninsured/jcpx17l/,0.056,0.701,0.243,0.6124
92,IMO," Art Cashin was talking about this on Friday I believe. He said this is the type of environment where rumor mongers come out with ulterior motives (paraphrasing him). With so much fear and uncertainty, it’s easy to tank the bank you’re shorting with fake news/downgrades/whatever. I wouldn’t be surprised if Wedbush is trying to save their short position or puts. In any case, better to stay out of the regional bank sector until the dust settles, IMO.",Friendship4Every1,5,/r/wallstreetbets/comments/11usmpu/frc_when_jp_morgan_invests_billions_in_uninsured/jcq3faz/,0.102,0.774,0.124,0.2315
93,FRC," They just deposited 3 billion into FRC, uninsured and locked for 120 days. Days after, stock cratered and I'm sure they're regretting what they did.",BuySellHoldFinance,6,/r/wallstreetbets/comments/11usmpu/frc_when_jp_morgan_invests_billions_in_uninsured/jcpxe9p/,0.1,0.815,0.085,-0.1027
94,IMO, IMO there is no way that happens unless the fed had privately assured them that the $30b would be covered in case of collapse just like the last 2 banks were.,MasterSith881,2,/r/wallstreetbets/comments/11usmpu/frc_when_jp_morgan_invests_billions_in_uninsured/jcpzt4f/,0.148,0.714,0.137,-0.1027
95,FRC," FRC is not an average bank, the service level is closer to private than regular retail, Marcus HYSA is not comparable at all (though yes, the yield is multiple times better)

Tons of anecdotal reports of excellent customer satisfaction and high levels of customer loyalty amongst FRC clientele, their deposits may be stickier than shorts think",That-Relation-5846,4,/r/wallstreetbets/comments/11usmpu/frc_when_jp_morgan_invests_billions_in_uninsured/jcpzcp9/,0.0,0.802,0.198,0.9153
96,OP, Please OP.. Fraud Republic Bank going to $0 not $5 Yellen can bail out the bail out. All part of the grand plan,mrbiscuits24,-4,/r/wallstreetbets/comments/11usmpu/frc_when_jp_morgan_invests_billions_in_uninsured/jcqlk3l/,0.131,0.687,0.182,0.128
97,BAC, Sorry. I’m not someone you should take advice from. I did buy some BAC at $28.50 but that was something I was always going to do in my investment portfolio. Does it go down to $18 or go up to $38 from here? I have no idea.,Friendship4Every1,1,/r/wallstreetbets/comments/11usmpu/frc_when_jp_morgan_invests_billions_in_uninsured/jcquslf/,0.086,0.914,0.0,-0.4497
98,FRC, I’m assuming in the deal JPM would have gotten some discounted equity and other senior securities from FRC for providing liquidity but I haven’t really looked into this,SeriousGarbage3990,1,/r/wallstreetbets/comments/11usmpu/frc_when_jp_morgan_invests_billions_in_uninsured/jcqexrg/,0.0,0.903,0.097,0.1779
99,JPM, I’m assuming in the deal JPM would have gotten some discounted equity and other senior securities from FRC for providing liquidity but I haven’t really looked into this,SeriousGarbage3990,1,/r/wallstreetbets/comments/11usmpu/frc_when_jp_morgan_invests_billions_in_uninsured/jcqexrg/,0.0,0.903,0.097,0.1779
100,IMO," All parties involved want to stabilize the market.  The market would see it as a sign of stability if those banks made those loans uninsured.  So, if they actually loaned them money uninsured they would shout it from every platform they could.  

On the flip side, if it was insured deposits they would not want to admit that as it would scare the market and be a sign that FRB is in even worse shape than publicly known.  

With that basic logic it is more likely that the money is insured than not and it would be on those claiming the money is uninsured to prove it IMO.",MasterSith881,1,/r/wallstreetbets/comments/11usmpu/frc_when_jp_morgan_invests_billions_in_uninsured/jcqklnd/,0.07,0.883,0.047,-0.5562
101,DD, Thanks girthy girth monster!!! This is stellar DD real house of cards doused in gasoline!,tastemybacon1,16,/r/wallstreetbets/comments/11ufsaj/private_funds_will_be_the_next_massive_problem/jco0lzb/,0.0,0.775,0.225,0.6209
102,ALL," (20+ years as IB/portfolio manager); Excellent post and link.  I don't think I saw it in the original post but one thing that compunds the loss is the fact that a lot of those Treasuries that a private fund owns are hypothecated - they are borrowed against and leveraged.  It effectively is a mini derivative.  

I hate to say this but investors who are in these funds signed a subscription agreement that specifically spelled out ALL of the possible risks - including macroeconomic risks.  Is the Federal government going to bail me out if I own Enron and they go bust bc of criminal management?  Did the 401k accounts of Enron employees get protected in anyway?  No - all those people lost it all.  

So, here we are today.  All of these private funds are made up of corporate or Accredited investors.  Accredited investors affirm that they are effectively ""experienced"" and ""sophisticated"" investors.  I am not saying I personally don't feel bad - I am saying they knew what they were doing - or at least attested to the fact that they did.

Since these funds can all prohibit withdrawals, the investors in these funds are effectively stuck and screwed.  The SEC, which governs these funds, is NOT going to find any of these funds guilty of anything - bc the investors all signed on the dotted line.

Finally, this whole issue is but a microcosm of the bigger problem in the investment community: easy returns due to loose money policies caused investors to believe that they would always make money if they just held.  Did the investment community take advantage of easy returns and market and sell more aggressively?  Sure.  There was demand and they filled it. That's capitalism.  Look at the attached chart.  And that's just hedge funds.  The growth is absolutely incredible in the last 10 years.  

The fault, imo, is entirely on the investors.  THEY signed a document that gave complete control of their money to an advisor.  THEY attested that they were accredited.  THEY did so in the pursuit of returns better than they could get in the market.  Those who say that Blackrock et al took advantage of the investors are merely passing the blame.

There is no difference between bailing out a private bank and bailing out a private fund - bailing either out effectively guarantees against losses.  That is exactly what the government did in 08 and as a result, we are where we are today, oversimplified of course.  

At some point, people, investors need to accept that they can lose money.  I am talking the entirety of investors.  But Private Fund investors believe they are getting access to managers that are sophisticated and ""better"" than the common folk get.  Hubris.  Investors in private funds are no different than Madoff's clients: they listened to the swan song of easy returns and now that those returns are over, they want their losses recouped.  Sorry - that's called investing.

TLDR: Investors in private funds should get no help from any regulatory agency to recover losses - even if those losses are 100%.

https://preview.redd.it/1pjh3dkc5joa1.png?width=1487&format=png&auto=webp&v=enabled&s=2b8c8052fdc2420ccdd71db6ccb5c20f625e054a",mrnotadvice,7,/r/wallstreetbets/comments/11ufsaj/private_funds_will_be_the_next_massive_problem/jcorebz/,0.135,0.742,0.123,-0.7056
103,OP," OP, 
Thanks for the post and I understand the risks but how much time is left until these bonds mature on these funds ? 
Just an average will do .
Would it be possible to borrow money and use these bonds as collateral in some manner ?",Fibocrypto,4,/r/wallstreetbets/comments/11ufsaj/private_funds_will_be_the_next_massive_problem/jco0bjk/,0.033,0.841,0.126,0.6662
104,OP," I guess OP will not be responding, but I do have a question if anyone else can answer it:

Let's say one of these funds is down 20%, and then someone wants to withdrawal their money... do the funds only have to pay out 80% (the current market value) or is it written in the contract that they can withdrawal the full amount of money that they contributed? 

Because if they only get the current market value, I don't really see an issue here. Ya, they lose money, and if these clients want to sell at a loss, go ahead. Yields on the long term bonds are already coming down, so the losses on the bonds are already getting reduced... but the stock market is going down again, so any stock losses are growing. But if it's just the bonds they're worried about, I'm not sure we'll see yields make a new high... we might see lower yields going forward. Not back to 2021 levels, but they might go lower than they are right now. 

But if they're able to get 100% of their money back, then the first customers who pull their money out will be fine, and the last ones to do it will get nothing. That becomes a much bigger problem as there becomes a huge incentive to get your money out first and not last.",NorthernLeaf,1,/r/wallstreetbets/comments/11ufsaj/private_funds_will_be_the_next_massive_problem/jcp47us/,0.121,0.81,0.069,-0.9444
105,OP," also Thank to OP for showing such courage.

WSB will remember you!!",InsiderTrader-,56,/r/wallstreetbets/comments/11ufsaj/private_funds_will_be_the_next_massive_problem/jco5ah9/,0.0,0.614,0.386,0.7418
106,OP," Lots of PE firms set their redemption periods for end of month or end of quarter. Given SVB failed during March, my guess is there are a lot of redemption requests pending and will go through end of this month. This is likely why OP is seeing so many inquiries on redemption provisions",Showmemohanson,11,/r/wallstreetbets/comments/11ufsaj/private_funds_will_be_the_next_massive_problem/jcp7qpc/,0.061,0.939,0.0,-0.5106
107,SEE," We get a doomer post about once every couple of weeks till one is finally correct years later, and says SEE I tried to warn you!!!!",Invest0rnoob1,2,/r/wallstreetbets/comments/11ufsaj/private_funds_will_be_the_next_massive_problem/jco9cfb/,0.1,0.9,0.0,-0.3753
108,IQ, Let me ask you… would you want to buy a bond yielding a negative rate right now while inflation is rampant? You would have to be ultra low IQ to do that.,tastemybacon1,3,/r/wallstreetbets/comments/11ufsaj/private_funds_will_be_the_next_massive_problem/jco5p8o/,0.17,0.792,0.038,-0.6705
109,ALL," Leverage. I buy a “stable” investment for $100. I collect interest of 5%. But that’s not good enough. So I borrow against the $100 say 3:1. Now I can collect the spread between the 15% (5% x 3) I’m getting and the 2% I’m paying on each of the 3 levered assets. 
All is good. I’m making 9%. 
But then, interest rates go up and this happens: 
The original $100 that yielded 5%?  Yeah, it’s not worth $100 in a 6% world. It’s worth say $80. But your not down only $20. Your down an  additional $40 on the other two levered $100 investments. 
So your original hundred is now worth $80 minus the $40 on the second two, resulting in a market value of $40 on an original investment of $100. Ooooops. 
And, to make it worse, all of your buddies did the same dang thing. In fact, you all borrowed and loaned to one another. Last one to sell gets fired. 
That’s a simplistic example of why these private funds are in trouble. 
Now for the really scary part: it’s exactly what caused the 2008 crisis. Except it was at magnitudes of 1000x. 
That’s not the scary part. 
The scary part is ALL of those derivatives from 2008?  Which are nuclear hypothecated bullshit products. They are still on every single money centers balance sheet. 
What happens if those are forced to be priced?
The criminal part, among many, is that when Goldman et al with their new brilliant derivatives product, went to the SEC to get them approved? guess what the SEC said?
They said we don’t understand these so you guys regulate them. Total dereliction of duty. 

I can tell you that maybe one of my hundreds of former clients ever read a prospectus. Or understood what the risks were. Worse, maybe 15% of the professional I work with could explain even part of the above. It’s not that I’m so smart. It’s that most people in the biz are NOT smart - they are SALES PEOPLE who either create or sell wonderfully complex products that few understand, purposely. 
They are drug dealers in nicer suits. 
Finally, how many people do you think actually read the quarterly fund updates?  Or question anything?  Why? Bc they talk to the manager and he says everything is fine blah blah blah. 
This is what I want to change. I want people to understand and take control of their money by teaching them to ask the right questions. If you don’t understand hypothecated assets or debt coverage, I bet you CAN tell when someone is lying to you. 
Here are two simple requests you can make from any advisor:
1. How much did you make over the last 3 years?  And provide income statements. 
2. Show me your investment account and 401k statements bc you’d better own what your recommending to me. 

I’d say 1 out of 50 will provide the above. If they do provide and their investment account is LESS than yours, run away. 
See how simple that is?  You just got rid of 90% of “pros” that are out there.  If I’m going to build a house I’m not going to hire a guy who doesn’t live in a house and never has built a house but says he can build a better house then anyone has ever built, almost guaranteed. 

I’m sorry for getting on my soapbox and rambling but I HATE the majority of people in the profession I retired from. 

Sorry if I didn’t answer your question. Feel free to let me know if I failed.",mrnotadvice,1,/r/wallstreetbets/comments/11ufsaj/private_funds_will_be_the_next_massive_problem/jcqlv9f/,0.133,0.762,0.105,-0.9708
