,ticker,comment,username,score,permalink,neg,neu,pos,compound
0,GLTA," $MIGI -- Bitcoin miner ($3.00) has been a good trading stock. With Bitcoin prices much better than 3 months ago, MIGI will show good revenue in their First Quarter numbers. GLTA",Marketspike,1,/r/RobinHoodPennyStocks/comments/124hf8j/daily_discussion_thread/jdzzryx/,0.0,0.749,0.251,0.8271
1,MIGI," $MIGI -- Bitcoin miner ($3.00) has been a good trading stock. With Bitcoin prices much better than 3 months ago, MIGI will show good revenue in their First Quarter numbers. GLTA",Marketspike,1,/r/RobinHoodPennyStocks/comments/124hf8j/daily_discussion_thread/jdzzryx/,0.0,0.749,0.251,0.8271
2,RSI," Macd is trending upward and RSI is at 46.
You sure it's no longer valid?",SpartacusTRector,1,/r/RobinHoodPennyStocks/comments/12469g2/wisa_my_1_and_only_alert_of_the_day_here_not_10/jdyor1x/,0.126,0.743,0.131,0.0258
3,SP," Quick update.
LimBuy kicked in at $2.50.
SP Temporarily slumped into $2.45~ +/-
Jumped up to $2.65+
LimSell kicked in at $2.65
Nice little 6% gain.

What else ya got?",SpartacusTRector,1,/r/RobinHoodPennyStocks/comments/12469g2/wisa_my_1_and_only_alert_of_the_day_here_not_10/je07efn/,0.0,0.825,0.175,0.7115
