,ticker,comment,username,score,permalink,neg,neu,pos,compound
210,TSLA, Yes then immediately reinvested most of it on TSLA shares. “Bro when the cyber truck comes out my 100k in shares will go to half a mil” is pretty much the direct quote.,Waitforsquirtle,26,/r/wallstreetbets/comments/1281ctq/homie_doesnt_know_how_to_take_a_screenshot/jejk9u4/,0.0,0.731,0.269,0.8519
211,OP, OP thought he was luring his “friend” into the wildy,93george,10,/r/wallstreetbets/comments/1281ctq/homie_doesnt_know_how_to_take_a_screenshot/jehrs94/,0.0,1.0,0.0,0.0
212,TSLA, So he expects TSLA to hit $3.3T market cap. Sounds very reasonable and realistic.,alwayslookingout,3,/r/wallstreetbets/comments/1281ctq/homie_doesnt_know_how_to_take_a_screenshot/jekvcod/,0.0,1.0,0.0,0.0
213,ZM, Reminds me of people buying ZOOM instead of ZM three years ago.,xTofik,49,/r/wallstreetbets/comments/128955j/republic_first_is_not_first_republic_sincerely/jehvyzm/,0.0,1.0,0.0,0.0
214,BBBY," This must be the efficient market at work, they clearly deserve it, the market is totally rational, it must be pricing something in, right? It can't just be actual idiots, right?

BBY and BBBY all over again",RepairThrowaway1,2,/r/wallstreetbets/comments/128955j/republic_first_is_not_first_republic_sincerely/jejqfo2/,0.0,0.857,0.143,0.7059
215,BBY," This must be the efficient market at work, they clearly deserve it, the market is totally rational, it must be pricing something in, right? It can't just be actual idiots, right?

BBY and BBBY all over again",RepairThrowaway1,2,/r/wallstreetbets/comments/128955j/republic_first_is_not_first_republic_sincerely/jejqfo2/,0.0,0.857,0.143,0.7059
216,BBY, I'm personally long BBY so I see absolutely nothing wrong with this.,aaronblkfox,2,/r/wallstreetbets/comments/128955j/republic_first_is_not_first_republic_sincerely/jejuuj0/,0.0,0.779,0.221,0.4277
217,COST," I predict that the stock price of SPY will increase to $406.00 by the expiration date of March 23, 2023. The price of COST will also increase to $501.00 by March 3, 2023. Lastly, FDX's stock price is predicted to decrease to $181.50 by March 17, 2023.",VisualMod,4,/r/wallstreetbets/comments/128wncl/i_lost_34k_in_a_month/jekplpm/,0.0,0.905,0.095,0.5574
218,DD," Wendy's dumpster, what a sight,
Filled with trash and grease delight.
A haven for Wallstreetbets, and stray hoes too,
And a smell that'll make you say ""pew!""

But don't be fooled by its unsavory scent,
For in that dumpster lies a treasure, heaven-sent.
For every once in a while, among the waste,
You might find DD, still fit for a taste.

So don't be afraid to take a dive,
Into Wendy's dumpster, and come alive.
For in its depths, a world unknown,
A place where regards still call home.",Whaleoilbefuked,8,/r/wallstreetbets/comments/128wncl/i_lost_34k_in_a_month/jekyb5g/,0.166,0.688,0.146,-0.242
219,TWO," TWO secrets for only $17,500! What a bargain!",ticapnews,2,/r/wallstreetbets/comments/128nyly/5_secret_investing_tools_that_will_make_you_a/jek9q16/,0.0,0.716,0.284,0.3365
220,IRS," Also, most folks are done with tax returns. 

Those with money back are not likely to leave it in bank for obvious reasons. So they put it into stocks.

Those who didn’t get money back feel more comfortable to bet on market even more since they either made money or at least know they don’t owe IRS anymore.",rain168,-1,/r/wallstreetbets/comments/128875u/why_is_the_market_not_crashing_check_out_the/jehqtjy/,0.0,0.922,0.078,0.5777
221,ANY," Before that very few people had ANY money in the market. Obly rich people did.

It made stocks available to ordinary people and gutted pensions.",eatmoremeatnow,1,/r/wallstreetbets/comments/128875u/why_is_the_market_not_crashing_check_out_the/jekuv57/,0.0,0.87,0.13,0.5574
222,PM," I will be messaging you in 2 years on [**2025-04-01 13:00:48 UTC**](http://www.wolframalpha.com/input/?i=2025-04-01%2013:00:48%20UTC%20To%20Local%20Time) to remind you of [**this link**](https://www.reddit.com/r/wallstreetbets/comments/128875u/why_is_the_market_not_crashing_check_out_the/jej5xh4/?context=3)

[**CLICK THIS LINK**](https://www.reddit.com/message/compose/?to=RemindMeBot&subject=Reminder&message=%5Bhttps%3A%2F%2Fwww.reddit.com%2Fr%2Fwallstreetbets%2Fcomments%2F128875u%2Fwhy_is_the_market_not_crashing_check_out_the%2Fjej5xh4%2F%5D%0A%0ARemindMe%21%202025-04-01%2013%3A00%3A48%20UTC) to send a PM to also be reminded and to reduce spam.

^(Parent commenter can ) [^(delete this message to hide from others.)](https://www.reddit.com/message/compose/?to=RemindMeBot&subject=Delete%20Comment&message=Delete%21%20128875u)

*****

|[^(Info)](https://www.reddit.com/r/RemindMeBot/comments/e1bko7/remindmebot_info_v21/)|[^(Custom)](https://www.reddit.com/message/compose/?to=RemindMeBot&subject=Reminder&message=%5BLink%20or%20message%20inside%20square%20brackets%5D%0A%0ARemindMe%21%20Time%20period%20here)|[^(Your Reminders)](https://www.reddit.com/message/compose/?to=RemindMeBot&subject=List%20Of%20Reminders&message=MyReminders%21)|[^(Feedback)](https://www.reddit.com/message/compose/?to=Watchful1&subject=RemindMeBot%20Feedback)|
|-|-|-|-|",RemindMeBot,1,/r/wallstreetbets/comments/128875u/why_is_the_market_not_crashing_check_out_the/jej5ypl/,0.109,0.891,0.0,-0.6322
223,AI, Going to be interesting having AI and robotics.,Invest0rnoob1,3,/r/wallstreetbets/comments/128875u/why_is_the_market_not_crashing_check_out_the/jek6s01/,0.0,0.722,0.278,0.4019
224,NVDA," For the record, I’ve never short NVDA during this crazy run, today is my first time buying the puts I think I have waited long enough.",HousingAggressive,4,/r/wallstreetbets/comments/128728a/bought_a_tad_too_early_but_oh_well_go_ahead_roast/jehkm8g/,0.107,0.893,0.0,-0.4118
225,NVDA," It doesn't matter, NVDA can go up and down like crazy, it can be $400 today and tomorrow is gonna be $60, but it will recover 

&#x200B;

that company makes my dick hard",BourboneAFCV,-1,/r/wallstreetbets/comments/128728a/bought_a_tad_too_early_but_oh_well_go_ahead_roast/jehiq4y/,0.228,0.727,0.045,-0.7216
226,IBKR, Questrade? Bro why not use IBKR for options being in Canada,zfromvan,1,/r/wallstreetbets/comments/128728a/bought_a_tad_too_early_but_oh_well_go_ahead_roast/jeicme5/,0.0,1.0,0.0,0.0
227,AI," Does anyone know where the buying is coming from? I'm wondering why NVDAs direction is so upward... I get the AI hype, but is retail FOMO'ing in? Or is buying coming from somewhere else?",jkos15,1,/r/wallstreetbets/comments/128728a/bought_a_tad_too_early_but_oh_well_go_ahead_roast/jek64e3/,0.0,1.0,0.0,0.0
228,AI, Trying to short NVDA while it’s on an AI run is highly regarded indeed.,ThunderTheMoney,1,/r/wallstreetbets/comments/128728a/bought_a_tad_too_early_but_oh_well_go_ahead_roast/jektxf3/,0.0,1.0,0.0,0.0
229,NVDA, Trying to short NVDA while it’s on an AI run is highly regarded indeed.,ThunderTheMoney,1,/r/wallstreetbets/comments/128728a/bought_a_tad_too_early_but_oh_well_go_ahead_roast/jektxf3/,0.0,1.0,0.0,0.0
230,NVDA, first rule of shorting NVDA is to wait way longer than you think you should before getting in short. there is almost no other ticker like NVDA that has the ability to just keep going parabolic without a single pullback for weeks,peeparty69,1,/r/wallstreetbets/comments/128728a/bought_a_tad_too_early_but_oh_well_go_ahead_roast/jel0je2/,0.043,0.85,0.107,0.4391
231,PPL, PPL STOP BUYING PUTS ON NVIDIA!!! YOU WILL GET STUNG LIKE A 🐝 https://giphy.com/gifs/season-20-the-simpsons-20x8-3oriePgy6N4MFmwkms,Worried-Ingenuity409,1,/r/wallstreetbets/comments/128728a/bought_a_tad_too_early_but_oh_well_go_ahead_roast/jel3tgo/,0.172,0.587,0.241,0.2905
232,YOU, PPL STOP BUYING PUTS ON NVIDIA!!! YOU WILL GET STUNG LIKE A 🐝 https://giphy.com/gifs/season-20-the-simpsons-20x8-3oriePgy6N4MFmwkms,Worried-Ingenuity409,1,/r/wallstreetbets/comments/128728a/bought_a_tad_too_early_but_oh_well_go_ahead_roast/jel3tgo/,0.172,0.587,0.241,0.2905
233,NVDA," Yes I don’t wanna go full regard mode buying something like 200 strike I won’t be able to sleep at night. Didn’t try to short tesla or other big techs either, NVDA is the only one I think has gone way too far.",HousingAggressive,1,/r/wallstreetbets/comments/128728a/bought_a_tad_too_early_but_oh_well_go_ahead_roast/jejjtus/,0.034,0.847,0.119,0.5719
234,IBKR," I been trading with Questrade for a very long time, tried IBKR before but I like Questrade more. Just sad we don’t have access to RH or WeBull like you bois in the states where you can trade options for free, these contracts cost me 200 bucks🥲",HousingAggressive,1,/r/wallstreetbets/comments/128728a/bought_a_tad_too_early_but_oh_well_go_ahead_roast/jeifixt/,0.082,0.72,0.197,0.7493
235,RH," I been trading with Questrade for a very long time, tried IBKR before but I like Questrade more. Just sad we don’t have access to RH or WeBull like you bois in the states where you can trade options for free, these contracts cost me 200 bucks🥲",HousingAggressive,1,/r/wallstreetbets/comments/128728a/bought_a_tad_too_early_but_oh_well_go_ahead_roast/jeifixt/,0.082,0.72,0.197,0.7493
236,IBKR," I'm also in Canada and have Questrade too for my boring buy and hold shit.

Everything options, I use IBKR. The platform takes a little while to get used to and isn't the most user friendly at first but man the fees are far better.",zfromvan,2,/r/wallstreetbets/comments/128728a/bought_a_tad_too_early_but_oh_well_go_ahead_roast/jejn66f/,0.081,0.795,0.124,0.4835
237,IBKR," Yeah IBKR is weird to me. I tried their trading platform but it all just looked like a bunch of mess, got a hard time even finding where to place orders LOL but I agree Questrade charge you ungodly obscene fees for options especially if you are doing large quantities",HousingAggressive,2,/r/wallstreetbets/comments/128728a/bought_a_tad_too_early_but_oh_well_go_ahead_roast/jejqnj9/,0.183,0.61,0.207,0.3611
238,AI," Of course I thought about these before I made the purchase, banked on calls on other stuff too this week. My theory is plain and simple,  everyone and their mom knows NVDA is grossly overvalued, hell even Tesla is applauding NVDA for how unreal their market cap sits compared to their revenue. This week has been incredible for bulls but I just thought that all the AI hype and good news for NVDA have all been baked in, couldn’t really find a reason for this thing to keep going, besides the quarter has ended there’s going to be profit taking from this ungodly bull run. Yes I might be wrong based on charts but to me charts have lost their meanings ever since start of this year.",HousingAggressive,1,/r/wallstreetbets/comments/128728a/bought_a_tad_too_early_but_oh_well_go_ahead_roast/jeig1l5/,0.082,0.822,0.096,0.4497
239,NVDA," Of course I thought about these before I made the purchase, banked on calls on other stuff too this week. My theory is plain and simple,  everyone and their mom knows NVDA is grossly overvalued, hell even Tesla is applauding NVDA for how unreal their market cap sits compared to their revenue. This week has been incredible for bulls but I just thought that all the AI hype and good news for NVDA have all been baked in, couldn’t really find a reason for this thing to keep going, besides the quarter has ended there’s going to be profit taking from this ungodly bull run. Yes I might be wrong based on charts but to me charts have lost their meanings ever since start of this year.",HousingAggressive,1,/r/wallstreetbets/comments/128728a/bought_a_tad_too_early_but_oh_well_go_ahead_roast/jeig1l5/,0.082,0.822,0.096,0.4497
240,NVDA," Famous words to go by. It’s been irrational for an entire quarter, I counted only 2 tiny red weeks for the past 3 months for NVDA, risk to reward profile here starts to make sense. Especially also after seeing how many people got burned buying puts all along the way here.",HousingAggressive,1,/r/wallstreetbets/comments/128728a/bought_a_tad_too_early_but_oh_well_go_ahead_roast/jejjkdf/,0.085,0.846,0.07,0.0516
241,NVDA," I don’t do complicated charts or patterns, I rely on simple indicators like MACD and RSI and that’s basically it. Oh and my own instinct too, everyone trades differently right? I know the hardest thing about shorting is not identifying a short but the timing, that’s why I skipped its earning, this morning’s PCE, JPow speech on NVDA, never made a play till today.",HousingAggressive,1,/r/wallstreetbets/comments/128728a/bought_a_tad_too_early_but_oh_well_go_ahead_roast/jeijkob/,0.042,0.929,0.029,-0.2033
242,RSI," I don’t do complicated charts or patterns, I rely on simple indicators like MACD and RSI and that’s basically it. Oh and my own instinct too, everyone trades differently right? I know the hardest thing about shorting is not identifying a short but the timing, that’s why I skipped its earning, this morning’s PCE, JPow speech on NVDA, never made a play till today.",HousingAggressive,1,/r/wallstreetbets/comments/128728a/bought_a_tad_too_early_but_oh_well_go_ahead_roast/jeijkob/,0.042,0.929,0.029,-0.2033
243,GOOG, Hmmm..GOOG is slgihtly overbought whereas the others are slightly overbought. Is this a sign?,80milesbad,1,/r/wallstreetbets/comments/128b9d9/options_expected_move_charts_for_the/jej1kww/,0.0,1.0,0.0,0.0
244,OP, OP discovers Elliot waves and confuses them for bubbles,pissflavorednoodles,0,/r/wallstreetbets/comments/1284y7e/spy_to_420_by_420/jehraau/,0.223,0.777,0.0,-0.3182
245,DD," Bulls are literally that dumb

""The line goes up, so the line always goes up"" is like 99% of bull DD",RepairThrowaway1,2,/r/wallstreetbets/comments/1284y7e/spy_to_420_by_420/jejqs12/,0.133,0.766,0.101,-0.2023
246,USA," Imagine thinking Japan in the 90s and the USA in 2023 have comparable regulatory, cultural, and socio economic systems that make loosely directional graphs from one as a predictor of another",Acoconutting,1,/r/wallstreetbets/comments/128mbng/nikkei_225_bear_market_vs_sp_500_bear_market/jekrak3/,0.0,1.0,0.0,0.0
247,USA, Lmao I was about to say. This guy is comparing the USA market 2023 to 1991 called the lost decade. Doom and gloom post again.,blazingdragon65,8,/r/wallstreetbets/comments/128mbng/nikkei_225_bear_market_vs_sp_500_bear_market/jejei1a/,0.265,0.615,0.12,-0.5719
248,OP," Nice colorful chart! Good job OP, all those devoured crayons have finally come into effect",nimama8011,1,/r/wallstreetbets/comments/12800ux/ndx_falling_wedge/jei5zpp/,0.0,0.684,0.316,0.7177
249,WISH," It looks like the stock you are watching, WISH, is up 12.40% today. If you were to sell your position now, you would make a profit of $33,873. However, if you wait and the price continues to go up, you could make even more money.",VisualMod,6,/r/wallstreetbets/comments/12869w9/wish_yolo_monthend_update_mar_2023/jehcxhi/,0.0,0.823,0.177,0.8331
250,YOU, YOU ARE THE MAN!!!!!,mrnotadvice,4,/r/wallstreetbets/comments/1285ws3/20230403_wrinkle_brain_plays_in_the_style_of/jehe9jv/,0.0,1.0,0.0,0.0
251,NVDA," Thank you for this post, I think the best MEME is going to be Baba. It’s funny people been Bash’s the  stock even on WallStreetBets and at the biggest bashing was when I was under 70 almost to 50 points swing almost 20% in the last week or so this could be the next NVDA just in this year alone. I’m glad you have this post listed here.",BaBaBuyey,1,/r/wallstreetbets/comments/1285ws3/20230403_wrinkle_brain_plays_in_the_style_of/jejavx3/,0.026,0.807,0.167,0.891
252,SF, Commercial real estate is a very broad category. Retail stores? Bear. Giant warehouses? Bull. Downtown SF office space? Bear. Strip malls with liquor stores and Wendy's? Bear.,Sweaty_Bird481,1,/r/wallstreetbets/comments/1285kdu/commercial_real_estate_is_doing_very_well_and_we/jejtu3r/,0.0,1.0,0.0,0.0
253,CS, >This is a great opportunity to get in on UBS at a discount. I would recommend investing in CS now and holding until the rollover happens.,VisualMod,1,/r/wallstreetbets/comments/1285x23/want_to_buy_ubs_at_a_6_discount/jehb8np/,0.0,0.68,0.32,0.8555
254,UBS, >This is a great opportunity to get in on UBS at a discount. I would recommend investing in CS now and holding until the rollover happens.,VisualMod,1,/r/wallstreetbets/comments/1285x23/want_to_buy_ubs_at_a_6_discount/jehb8np/,0.0,0.68,0.32,0.8555
255,UBS," ""CS shares will be rolled over to UBS shares sometime before 2023 - so biggest risk is a drop in UBS shares.""

Your timeline is suspect.",vegasoptions666,1,/r/wallstreetbets/comments/1285x23/want_to_buy_ubs_at_a_6_discount/jejiung/,0.222,0.632,0.146,-0.3134
256,PM," I will be messaging you in 2 days on [**2023-04-03 00:52:18 UTC**](http://www.wolframalpha.com/input/?i=2023-04-03%2000:52:18%20UTC%20To%20Local%20Time) to remind you of [**this link**](https://www.reddit.com/r/wallstreetbets/comments/1285x23/want_to_buy_ubs_at_a_6_discount/jehcd0i/?context=3)

[**2 OTHERS CLICKED THIS LINK**](https://www.reddit.com/message/compose/?to=RemindMeBot&subject=Reminder&message=%5Bhttps%3A%2F%2Fwww.reddit.com%2Fr%2Fwallstreetbets%2Fcomments%2F1285x23%2Fwant_to_buy_ubs_at_a_6_discount%2Fjehcd0i%2F%5D%0A%0ARemindMe%21%202023-04-03%2000%3A52%3A18%20UTC) to send a PM to also be reminded and to reduce spam.

^(Parent commenter can ) [^(delete this message to hide from others.)](https://www.reddit.com/message/compose/?to=RemindMeBot&subject=Delete%20Comment&message=Delete%21%201285x23)

*****

|[^(Info)](https://www.reddit.com/r/RemindMeBot/comments/e1bko7/remindmebot_info_v21/)|[^(Custom)](https://www.reddit.com/message/compose/?to=RemindMeBot&subject=Reminder&message=%5BLink%20or%20message%20inside%20square%20brackets%5D%0A%0ARemindMe%21%20Time%20period%20here)|[^(Your Reminders)](https://www.reddit.com/message/compose/?to=RemindMeBot&subject=List%20Of%20Reminders&message=MyReminders%21)|[^(Feedback)](https://www.reddit.com/message/compose/?to=Watchful1&subject=RemindMeBot%20Feedback)|
|-|-|-|-|",RemindMeBot,2,/r/wallstreetbets/comments/1285x23/want_to_buy_ubs_at_a_6_discount/jehcfgt/,0.105,0.895,0.0,-0.6322
257,CS," Not interested in investing in CS, its UBS I'm buying - via CS shares. Banking on UBS having acquired CS at a discount while the market is overreacting to bank run news. Risky for sure, we'll see.

At least its 1 post",CartographerDapper16,2,/r/wallstreetbets/comments/1285x23/want_to_buy_ubs_at_a_6_discount/jehxesm/,0.093,0.804,0.103,0.1134
258,UBS," Not interested in investing in CS, its UBS I'm buying - via CS shares. Banking on UBS having acquired CS at a discount while the market is overreacting to bank run news. Risky for sure, we'll see.

At least its 1 post",CartographerDapper16,2,/r/wallstreetbets/comments/1285x23/want_to_buy_ubs_at_a_6_discount/jehxesm/,0.093,0.804,0.103,0.1134
259,KC, >That is a very interesting point. I had not considered that possibility. Thank you for bringing it to my attention. I will be sure to do more research on KC before investing in it myself.,VisualMod,2,/r/wallstreetbets/comments/128tzcg/kc_kingsoft_cloud_holdings_ltd_is_suspicious_rally/jekc1ku/,0.0,0.788,0.212,0.7778
260,OP, OP I’m actually interested. I usually think long term TA is pointless nowadays with his sudden markets move but I would love to hear an explanation!,NotTarkovRedditor,2,/r/wallstreetbets/comments/12839yx/hahahaha_such_a_funny_meme_totally_not_a_solution/jeh7ym8/,0.0,0.735,0.265,0.8378
261,TA, OP I’m actually interested. I usually think long term TA is pointless nowadays with his sudden markets move but I would love to hear an explanation!,NotTarkovRedditor,2,/r/wallstreetbets/comments/12839yx/hahahaha_such_a_funny_meme_totally_not_a_solution/jeh7ym8/,0.0,0.735,0.265,0.8378
262,GS, You are lying about the GS connection. You are chasing retail spaghetti and WILL lose money with this nonsense.,thepathgame,6,/r/wallstreetbets/comments/12839yx/hahahaha_such_a_funny_meme_totally_not_a_solution/jei0o0m/,0.366,0.634,0.0,-0.8491
263,TV," They will not and they shall not.

Investors crying on TV for Fed to stop rising interest rates are out of touch with the rality of the majority of americans as all the whealty people are",webrunningbeer,13,/r/wallstreetbets/comments/128xm9s/four_straight_months_of_flat_or_rising_yoy_core/jekuqmc/,0.054,0.81,0.136,0.5194
264,FRC," That’s the most likely scenario and I’m positioned accordingly, the problem is that it’s impossible to correctly time the panic.
 
But this is WSB so FRC long all in max leverage is the obvious play.",lalananula,3,/r/wallstreetbets/comments/128xm9s/four_straight_months_of_flat_or_rising_yoy_core/jel1dfe/,0.102,0.818,0.079,0.0258
265,CS," SVB & CS save just proves they will print money to rescue any market collapse if billionaires are threatened. This works til it doesnt. the next event will cause an instant drop. so... the only question is, can you predict the next event. til then. bullish 1000%.",,2,/r/wallstreetbets/comments/1283ely/spx_to_5300_by_eoy/jeh6ep8/,0.149,0.735,0.116,-0.2023
266,PM," I will be messaging you in 1 year on [**2024-04-01 03:13:39 UTC**](http://www.wolframalpha.com/input/?i=2024-04-01%2003:13:39%20UTC%20To%20Local%20Time) to remind you of [**this link**](https://www.reddit.com/r/wallstreetbets/comments/1283ely/spx_to_5300_by_eoy/jehtivi/?context=3)

[**CLICK THIS LINK**](https://www.reddit.com/message/compose/?to=RemindMeBot&subject=Reminder&message=%5Bhttps%3A%2F%2Fwww.reddit.com%2Fr%2Fwallstreetbets%2Fcomments%2F1283ely%2Fspx_to_5300_by_eoy%2Fjehtivi%2F%5D%0A%0ARemindMe%21%202024-04-01%2003%3A13%3A39%20UTC) to send a PM to also be reminded and to reduce spam.

^(Parent commenter can ) [^(delete this message to hide from others.)](https://www.reddit.com/message/compose/?to=RemindMeBot&subject=Delete%20Comment&message=Delete%21%201283ely)

*****

|[^(Info)](https://www.reddit.com/r/RemindMeBot/comments/e1bko7/remindmebot_info_v21/)|[^(Custom)](https://www.reddit.com/message/compose/?to=RemindMeBot&subject=Reminder&message=%5BLink%20or%20message%20inside%20square%20brackets%5D%0A%0ARemindMe%21%20Time%20period%20here)|[^(Your Reminders)](https://www.reddit.com/message/compose/?to=RemindMeBot&subject=List%20Of%20Reminders&message=MyReminders%21)|[^(Feedback)](https://www.reddit.com/message/compose/?to=Watchful1&subject=RemindMeBot%20Feedback)|
|-|-|-|-|",RemindMeBot,1,/r/wallstreetbets/comments/1283ely/spx_to_5300_by_eoy/jehtkn3/,0.109,0.891,0.0,-0.6322
267,AAPL," LMAO. AAPL was one of the hardest hit companies in the 2008 crash.

The SPX is just the top 500 companies  listed on \*US\* exchanges. Many (eg NVDA) don't make a profit. Hundreds are grossly overpriced.  Many of the world largest companies are \*not\* listed on US exchanges and not part of the index.",That-Whereas3367,2,/r/wallstreetbets/comments/1283ely/spx_to_5300_by_eoy/jeirykp/,0.114,0.781,0.105,0.1096
268,CME," > 8.Only Crypto Allowed is BTC and ETH
> To avoid excessively shilly / low quality content, we restrict crypto discussion to only Bitcoin and Ethereum
> 
> These are the two products that the CME offers futures on. If CME expands their offering, this rule will expand in lockstep.
> 
> Passing mention of other cryptocurrencies is fine, but we kindly ask that you take purely crypto discussion (other than BTC/ETH) elsewhere.",jetah,1,/r/wallstreetbets/comments/128wrd8/the_deutsche_line_is_build_from_text_mining_12m/jekzcc6/,0.068,0.814,0.118,0.5574
269,IGMS," >There is no one definitive answer to this question. However, it is possible that IGMS may be releasing positive news or earning announcements around the 9th of each month, which could explain the stock price increases you are seeing. Alternatively, it could be simply due to investor optimism or speculation in general about the company's prospects. As always, do your own research before making any investment decisions.",VisualMod,1,/r/wallstreetbets/comments/1284stk/igms/jeh6n1t/,0.03,0.846,0.125,0.7964
270,SCHW," With all the volatility, the brokerages make a ton off people buying and selling. SCHW not going anywhere. Any securities bought through them are covered. Same way you can transfer your securities to a different platform. The panic wave is over.",Buy_lose_repeat,-1,/r/wallstreetbets/comments/128ylgx/schw_charles_schwab_is_going_to_survive_or_crash/jel2uz9/,0.076,0.824,0.101,0.0258
271,FRC, Don't talk about FRC like that. I ain't heard no bell.,HaruspicyEnjoyer,1,/r/wallstreetbets/comments/128ylgx/schw_charles_schwab_is_going_to_survive_or_crash/jel28rl/,0.0,0.646,0.354,0.5248
272,DD, As a BROKIE Instacart shopper I almost never get any of that trash for customers. That’s my DD.,Loose_Mail_786,7,/r/wallstreetbets/comments/1280o7z/beyond_meat/jegtjjm/,0.0,1.0,0.0,0.0
273,DD, Thanks for your DD soyboy,_penis-penis_,9,/r/wallstreetbets/comments/1280o7z/beyond_meat/jegoftc/,0.0,0.58,0.42,0.4404
274,BYND," I traded it straight after IPO, +200%, +70%, +110%, unfortunately with small sums, but I knew that it was overvalued, it's down about 90% since I sold. Tasted it a few times, it's not good enough and it's too expensive. I believe lab grown meat is the future. Unfortunately I think BYND is going to zero.",HighGroundException,1,/r/wallstreetbets/comments/1280o7z/beyond_meat/jeh8a09/,0.143,0.831,0.026,-0.755
275,HMC," ...every day's the same when you're unemployed I guess?

I suppose I should warn you of the macroeconomic headwinds facing the automotive market...slowing car sales, chip shortages, etc. but seems you've made your play already.  There are certainly worse companies than HMC to park your money, and Beyond is one of them.

Godspeed, fellow regard.",PresterJohnsKingdom,4,/r/wallstreetbets/comments/1280o7z/beyond_meat/jegxu89/,0.111,0.785,0.104,0.1406
276,BYND," Infinity and BYND...buying and more, watch out",ImpossibleCut4808,1,/r/wallstreetbets/comments/1280o7z/beyond_meat/jehzdz6/,0.0,1.0,0.0,0.0
