,ticker,comment,username,score,permalink,neg,neu,pos,compound
136,TA," STOP trying to predict where and when the market wants to go and just react to where we can see it going. Don't fight the trends, but do react to them when you see them and acknowledge their status. Learn TA and apply that understanding to relevant aggregate info and see if your thesis tracks. Never assume that because you were correct in your assertions yesterday, today you must be a master of reality. Change is constant, so don't remain stuck in an inflexible mindset.",optimaleverage,4,/r/wallstreetbets/comments/12822pa/markets_go_up/jeizyzy/,0.023,0.93,0.047,0.2803
137,OP," The psychology of market participants: when stocks go down, sell and stop buying. When stocks go up, panic buy. You make money because the OP of the original post is throwing money away due to fear.",TimujinTheTrader,8,/r/wallstreetbets/comments/12822pa/markets_go_up/jejg6tz/,0.202,0.744,0.053,-0.7506
138,NVDA, What’s up with the NVDA shorts on all these posts?,No_Zookeepergame_27,32,/r/wallstreetbets/comments/1287fcm/joining_the_lets_short_the_ai_craze_team_nvda/jehm1ww/,0.0,1.0,0.0,0.0
139,NVDA," It is unfortunate that you have lost money on your NVDA options strategies. However, I believe that the market will rebound and you will eventually see a profit from these investments.",VisualMod,20,/r/wallstreetbets/comments/1287fcm/joining_the_lets_short_the_ai_craze_team_nvda/jehj3cx/,0.155,0.76,0.085,-0.34
140,AI, Wait till closer to earnings and pray Papa Huang too sore throat to say AI.,lethalposter,3,/r/wallstreetbets/comments/1287fcm/joining_the_lets_short_the_ai_craze_team_nvda/jehpiss/,0.14,0.73,0.129,-0.0516
141,AI," Bearish on the whole ""muh AI takin all er jerbs"" thing. 

If the pandemic and the persistence of remote work has showed us anything, it's that half of all people have completely made up jobs. World class douche Elon fired almost everyone at Twitter except the 10 people that actually do shit over there. It's still working. Did he replace everyone else with AI? No. No he didn't. He just fired them and nothing happened because they didn't actually do shit. Most companies could do this. The only reason they don't is because the boss is either too lazy, doesn't care, or doesn't have the balls to do it. They aren't waiting for AI. They could just do it but don't.",Sweaty_Bird481,3,/r/wallstreetbets/comments/1287fcm/joining_the_lets_short_the_ai_craze_team_nvda/jei4jyq/,0.137,0.863,0.0,-0.9138
142,NVDA, Just bought more NVDA and will continue to buy more regardless of price. Love it when bears think they understand how this market works.,Fuzylogic,3,/r/wallstreetbets/comments/1287fcm/joining_the_lets_short_the_ai_craze_team_nvda/jeibfkx/,0.0,0.846,0.154,0.6369
143,GL, GL. Too many folks piling on NVDA way too early. Price came up way too strong and needs to take a step back.,ampliteer,2,/r/wallstreetbets/comments/1287fcm/joining_the_lets_short_the_ai_craze_team_nvda/jehw04i/,0.0,0.76,0.24,0.7456
144,NVDA, GL. Too many folks piling on NVDA way too early. Price came up way too strong and needs to take a step back.,ampliteer,2,/r/wallstreetbets/comments/1287fcm/joining_the_lets_short_the_ai_craze_team_nvda/jehw04i/,0.0,0.76,0.24,0.7456
145,NVDA," Bought NVDA at 170, I will sell just for you",rabbit_holeexplorer,2,/r/wallstreetbets/comments/1287fcm/joining_the_lets_short_the_ai_craze_team_nvda/jei4g28/,0.0,1.0,0.0,0.0
146,AI, I hope so. I just want them to drop the price of the damn 40 series . Never going to happen with this AI thing,Fatefire,2,/r/wallstreetbets/comments/1287fcm/joining_the_lets_short_the_ai_craze_team_nvda/jei748d/,0.176,0.66,0.164,-0.0828
147,NVDA," New to the thread
Why everyone one talking about shorting NVDA wants to know more so I can also join the army",DangerZombie34,2,/r/wallstreetbets/comments/1287fcm/joining_the_lets_short_the_ai_craze_team_nvda/jei7omn/,0.0,0.89,0.11,0.3535
148,NVDA, NVDA was a buy as soon as your maroons started shorting.,iriegypsy,2,/r/wallstreetbets/comments/1287fcm/joining_the_lets_short_the_ai_craze_team_nvda/jeias6c/,0.0,1.0,0.0,0.0
149,AI," AI is still a huge buzzword, it won’t die out until a few months at least",Spins13,2,/r/wallstreetbets/comments/1287fcm/joining_the_lets_short_the_ai_craze_team_nvda/jeiaymr/,0.214,0.659,0.126,-0.3818
150,NVDA, Everyone wants to short NVDA but it keeps going up,Awkward_Possible_610,2,/r/wallstreetbets/comments/1287fcm/joining_the_lets_short_the_ai_craze_team_nvda/jeiliki/,0.0,1.0,0.0,0.0
151,NVDA," https://preview.redd.it/tw3kcmo13cra1.png?width=2436&format=png&auto=webp&v=enabled&s=77c0e9dce888e2766d10a36a03eb92a9b0abc7ff

I bought NVDA at 137 and have protective puts at 250 to June just to help protect some gains in short term.  Long term this is a cash machine, but we can get overbought and pull back some especially if interest rates surprise on the upside or the FED.

Just to note I originally bought 5 puts at 23 a share at 265 and every 10 dollars up on NVDA adding an additional 5 puts to the total to lower my put basis. If we have a small dip I can roll them out or take risk off. If we move straight to 300 I still know my maximum gain and loss.",Apprehensive_Gas_902,0,/r/wallstreetbets/comments/1287fcm/joining_the_lets_short_the_ai_craze_team_nvda/jejq1gl/,0.068,0.753,0.179,0.9147
152,AI, Based on quantum computing simulations you are probably going to lose money if you short for the long term. But short term everyone has been laying off people in preparation for some big AI changes. Their graphic cards are still in high demand. Why short it?,LexVex02,1,/r/wallstreetbets/comments/1287fcm/joining_the_lets_short_the_ai_craze_team_nvda/jeie1v7/,0.076,0.924,0.0,-0.3818
153,AI, I day traded the hell out of AI today for a couple hours till I had to go to sleep. It’s bound to fall at some point.,Basic_Holiday_9502,1,/r/wallstreetbets/comments/1287fcm/joining_the_lets_short_the_ai_craze_team_nvda/jeimt34/,0.167,0.833,0.0,-0.6808
154,NVDA, NVDA and TSLA are OG meme.  No man is perpetually short on them and is alive.,optiontraderkyle,1,/r/wallstreetbets/comments/1287fcm/joining_the_lets_short_the_ai_craze_team_nvda/jeiwm74/,0.117,0.745,0.138,0.1027
155,TSLA, NVDA and TSLA are OG meme.  No man is perpetually short on them and is alive.,optiontraderkyle,1,/r/wallstreetbets/comments/1287fcm/joining_the_lets_short_the_ai_craze_team_nvda/jeiwm74/,0.117,0.745,0.138,0.1027
156,NVDA," Agree, ...and I dislike shorting hot individual tech stocks. I figure if NVDA rolls over, so too will the rest of the Qs, so I stacked some far out of the money calls on SQQQ. ...yes it's a gamble, ...and the nasdaq is way way overpriced imo. If the already priced in rate cuts don't materialize...and relatively fast, that thing will roll over imo.",Not_Sure_68,1,/r/wallstreetbets/comments/1287fcm/joining_the_lets_short_the_ai_craze_team_nvda/jejhfdi/,0.075,0.886,0.039,-0.3182
157,NVDA, Shit...I feel like NVDA puts are gonna make this sub broke,okokibuynok,1,/r/wallstreetbets/comments/1287fcm/joining_the_lets_short_the_ai_craze_team_nvda/jejynxu/,0.196,0.629,0.175,-0.0772
158,ML, ML isn't going anywhere lmao,SolarisBravo,1,/r/wallstreetbets/comments/1287fcm/joining_the_lets_short_the_ai_craze_team_nvda/jek6coq/,0.44,0.56,0.0,-0.4847
159,NVDA," NVDA is almost definitely going 300+, your graphs don’t mean shit to me cus I’m regarded. I look forward to the loss porn",MaintenanceReady,1,/r/wallstreetbets/comments/1287fcm/joining_the_lets_short_the_ai_craze_team_nvda/jeka4fd/,0.216,0.696,0.088,-0.5413
160,NVDA, As someone who's long on NVDA shares this post makes me very happy. I'm inversing WSB with a 2 year head wind. We take those. NVDA 🚀,Suprblakhawk,1,/r/wallstreetbets/comments/1287fcm/joining_the_lets_short_the_ai_craze_team_nvda/jekbtzd/,0.0,0.78,0.22,0.7346
161,AMD," I'll short the fuck out of it just before the 2nd quarter earning call , those new RTX cards are shit except the 4090 which is just too expensive for the wide gamer , small miner pools , plus seeing Nvidia already slashed the prices means the demand is nowhere where it was last year due the shortage and everyone becoming crypto mining multi billionaire , AMD long Nvidia Short 🐳🫡",Consistent_Hawk_3535,1,/r/wallstreetbets/comments/1287fcm/joining_the_lets_short_the_ai_craze_team_nvda/jekkudw/,0.168,0.832,0.0,-0.8885
162,RTX," I'll short the fuck out of it just before the 2nd quarter earning call , those new RTX cards are shit except the 4090 which is just too expensive for the wide gamer , small miner pools , plus seeing Nvidia already slashed the prices means the demand is nowhere where it was last year due the shortage and everyone becoming crypto mining multi billionaire , AMD long Nvidia Short 🐳🫡",Consistent_Hawk_3535,1,/r/wallstreetbets/comments/1287fcm/joining_the_lets_short_the_ai_craze_team_nvda/jekkudw/,0.168,0.832,0.0,-0.8885
163,NVDA," Very overextended, I think you got a decent entry. You’re smarter than the other guys when they were trying to short NVDA a couple weeks ago when it was clearly showing crazy strength lol",AC_here_to_read,1,/r/wallstreetbets/comments/1287fcm/joining_the_lets_short_the_ai_craze_team_nvda/jekqzn7/,0.06,0.648,0.292,0.8519
164,AI," Expect a crash if not only AI, but SEC+CFTC bar Binance , then nvidia gets dragged down good.",jayminho,1,/r/wallstreetbets/comments/1287fcm/joining_the_lets_short_the_ai_craze_team_nvda/jekusv4/,0.158,0.65,0.192,0.4019
165,AI, You guys go long bitcoin and short AI. No wonder you all lose everything,Intelligent-End968,1,/r/wallstreetbets/comments/1287fcm/joining_the_lets_short_the_ai_craze_team_nvda/jel1pir/,0.29,0.71,0.0,-0.5994
166,GL, GL brotha. It really is just overextended tbh.,themetamoose,40,/r/wallstreetbets/comments/1287fcm/joining_the_lets_short_the_ai_craze_team_nvda/jehkmlr/,0.0,0.698,0.302,0.4648
167,AI, AI is straight snake oil at this point,sonofnoob,1,/r/wallstreetbets/comments/1287fcm/joining_the_lets_short_the_ai_craze_team_nvda/jekzlnk/,0.0,0.787,0.213,0.2263
168,AI," I do love me some good toast for sure and true, AI has many functions that have yet to be realized by everyone. That being said, I think the run up for NVDA is a bit too premature.",themetamoose,3,/r/wallstreetbets/comments/1287fcm/joining_the_lets_short_the_ai_craze_team_nvda/jehvehl/,0.0,0.718,0.282,0.9042
169,NVDA," I do love me some good toast for sure and true, AI has many functions that have yet to be realized by everyone. That being said, I think the run up for NVDA is a bit too premature.",themetamoose,3,/r/wallstreetbets/comments/1287fcm/joining_the_lets_short_the_ai_craze_team_nvda/jehvehl/,0.0,0.718,0.282,0.9042
170,AI, Everyone’s trying to drop the AI word seriously.,themetamoose,2,/r/wallstreetbets/comments/1287fcm/joining_the_lets_short_the_ai_craze_team_nvda/jehuzwh/,0.388,0.612,0.0,-0.4215
171,NVDA, Jpow may have me by the balls for the July one but I’m definitely expecting my other NVDA holdings to flip to green.,themetamoose,1,/r/wallstreetbets/comments/1287fcm/joining_the_lets_short_the_ai_craze_team_nvda/jeht1jk/,0.0,0.861,0.139,0.5499
172,AI, Buy time. Seems scary since there’s so much AI hype propelling stocks upwards but NVDA has already front-ran by a LOT.,themetamoose,4,/r/wallstreetbets/comments/1287fcm/joining_the_lets_short_the_ai_craze_team_nvda/jehmj4z/,0.1,0.9,0.0,-0.2732
173,NVDA, Buy time. Seems scary since there’s so much AI hype propelling stocks upwards but NVDA has already front-ran by a LOT.,themetamoose,4,/r/wallstreetbets/comments/1287fcm/joining_the_lets_short_the_ai_craze_team_nvda/jehmj4z/,0.1,0.9,0.0,-0.2732
174,NVDA," Seeing you compare it to TSLA’s breakout momentum gave me goose bumps.. although CrazyInspection makes a point that valuation is already VERY high for NVDA. Plus it’s not like they had consistent earnings momentum in FY 2022. 

I do want to mention TSLA was very much powered by Elon’s being and his fanboys.",themetamoose,3,/r/wallstreetbets/comments/1287fcm/joining_the_lets_short_the_ai_craze_team_nvda/jehre7s/,0.04,0.935,0.025,-0.2047
175,TSLA," Seeing you compare it to TSLA’s breakout momentum gave me goose bumps.. although CrazyInspection makes a point that valuation is already VERY high for NVDA. Plus it’s not like they had consistent earnings momentum in FY 2022. 

I do want to mention TSLA was very much powered by Elon’s being and his fanboys.",themetamoose,3,/r/wallstreetbets/comments/1287fcm/joining_the_lets_short_the_ai_craze_team_nvda/jehre7s/,0.04,0.935,0.025,-0.2047
176,VERY," Seeing you compare it to TSLA’s breakout momentum gave me goose bumps.. although CrazyInspection makes a point that valuation is already VERY high for NVDA. Plus it’s not like they had consistent earnings momentum in FY 2022. 

I do want to mention TSLA was very much powered by Elon’s being and his fanboys.",themetamoose,3,/r/wallstreetbets/comments/1287fcm/joining_the_lets_short_the_ai_craze_team_nvda/jehre7s/,0.04,0.935,0.025,-0.2047
177,AI, If you understood AI models and the processing power required… You wouldn’t be that bullish. Yes they have great technology but it is already in place.,Rocky_The_Champion,1,/r/wallstreetbets/comments/1287fcm/joining_the_lets_short_the_ai_craze_team_nvda/jejw3nk/,0.0,0.845,0.155,0.5267
178,NVDA," Have short position on NVDA betting there will be paper handed bitches that will sell once this drops 3%, down to the earnings gap up",EverlastMadeInUSA,1,/r/wallstreetbets/comments/1287fcm/joining_the_lets_short_the_ai_craze_team_nvda/jehq5ze/,0.14,0.86,0.0,-0.5994
179,NVDA," Short I presume, it’s a bear NVDA leveraged etf",Shavenballz,1,/r/wallstreetbets/comments/1287fcm/joining_the_lets_short_the_ai_craze_team_nvda/jej7x0v/,0.0,1.0,0.0,0.0
180,GL," lol @ technical analysis, NVDA is majority by institutions and not retail investors. GL. Every time I see one of these threads I pick up some more shares.",slut,1,/r/wallstreetbets/comments/1287fcm/joining_the_lets_short_the_ai_craze_team_nvda/jehxpqk/,0.084,0.738,0.178,0.4193
181,NVDA," lol @ technical analysis, NVDA is majority by institutions and not retail investors. GL. Every time I see one of these threads I pick up some more shares.",slut,1,/r/wallstreetbets/comments/1287fcm/joining_the_lets_short_the_ai_craze_team_nvda/jehxpqk/,0.084,0.738,0.178,0.4193
182,AI," I just don’t see the signal yet, if they keep releasing news this thing can pump or stay near these levels for months. AI is not going away it’s not a hype play, it’s like the Microsoft play in the 90s. I hope you win. These are just my opinions. At least you got time.",mveltman84,1,/r/wallstreetbets/comments/1287fcm/joining_the_lets_short_the_ai_craze_team_nvda/jeiccho/,0.068,0.78,0.153,0.7293
183,AAPL," Also, w/ banking failures afoot, tech like NVDA, AAPL, MSFT are looking like ‘safe’ plays right now. If banking holds steady then maybe some money move out of these techs",80milesbad,1,/r/wallstreetbets/comments/1287fcm/joining_the_lets_short_the_ai_craze_team_nvda/jej330y/,0.083,0.722,0.194,0.4588
184,MSFT," Also, w/ banking failures afoot, tech like NVDA, AAPL, MSFT are looking like ‘safe’ plays right now. If banking holds steady then maybe some money move out of these techs",80milesbad,1,/r/wallstreetbets/comments/1287fcm/joining_the_lets_short_the_ai_craze_team_nvda/jej330y/,0.083,0.722,0.194,0.4588
185,NVDA," Also, w/ banking failures afoot, tech like NVDA, AAPL, MSFT are looking like ‘safe’ plays right now. If banking holds steady then maybe some money move out of these techs",80milesbad,1,/r/wallstreetbets/comments/1287fcm/joining_the_lets_short_the_ai_craze_team_nvda/jej330y/,0.083,0.722,0.194,0.4588
186,AI, Definitely looking for it to hit 240 for sure 💯. The AI craze pushed it ip way too fast. Might roll my July’s to Sept but bought time for NVDA to come back down. I don’t mind it going even higher but the price action theoretically needs to cool off.,themetamoose,7,/r/wallstreetbets/comments/1287fcm/joining_the_lets_short_the_ai_craze_team_nvda/jehphcq/,0.025,0.853,0.122,0.631
187,NVDA, Definitely looking for it to hit 240 for sure 💯. The AI craze pushed it ip way too fast. Might roll my July’s to Sept but bought time for NVDA to come back down. I don’t mind it going even higher but the price action theoretically needs to cool off.,themetamoose,7,/r/wallstreetbets/comments/1287fcm/joining_the_lets_short_the_ai_craze_team_nvda/jehphcq/,0.025,0.853,0.122,0.631
188,AI," No one is expecting NVDA to grow 4x in the next 5 years, but I think it will be a double in that time frame.  I have two relatives that are long term employees (10+ years) and they both say AI is in the top of the first inning in baseball parlance.  The opportunities for growth are endless.",SeniorDucklet,1,/r/wallstreetbets/comments/1287fcm/joining_the_lets_short_the_ai_craze_team_nvda/jek4kll/,0.026,0.825,0.149,0.8126
189,NVDA," No one is expecting NVDA to grow 4x in the next 5 years, but I think it will be a double in that time frame.  I have two relatives that are long term employees (10+ years) and they both say AI is in the top of the first inning in baseball parlance.  The opportunities for growth are endless.",SeniorDucklet,1,/r/wallstreetbets/comments/1287fcm/joining_the_lets_short_the_ai_craze_team_nvda/jek4kll/,0.026,0.825,0.149,0.8126
190,NVDA," I’m with you fam. NVDA could make it to all time highs, but it’s due for a retrace 100%.",themetamoose,1,/r/wallstreetbets/comments/1287fcm/joining_the_lets_short_the_ai_craze_team_nvda/jehsbqm/,0.0,1.0,0.0,0.0
191,NVDA," Yep, I’m definitely long NVDA. Just haven’t allocated any longs yet.",themetamoose,2,/r/wallstreetbets/comments/1287fcm/joining_the_lets_short_the_ai_craze_team_nvda/jehylh7/,0.0,0.647,0.353,0.5994
192,AI," I 100% believe that the whole stir on AI this past quarter is just the beginning. There’s a LOT of room for AI to grow in every capacity. 

Now when I think about whether I’m going to buy calls or puts, risk to reward tells me the one-way price action needs to cool off. I could see AI take NVDA to all time highs, but not right away from where we are.",themetamoose,5,/r/wallstreetbets/comments/1287fcm/joining_the_lets_short_the_ai_craze_team_nvda/jehursj/,0.022,0.921,0.057,0.3506
193,NVDA," I 100% believe that the whole stir on AI this past quarter is just the beginning. There’s a LOT of room for AI to grow in every capacity. 

Now when I think about whether I’m going to buy calls or puts, risk to reward tells me the one-way price action needs to cool off. I could see AI take NVDA to all time highs, but not right away from where we are.",themetamoose,5,/r/wallstreetbets/comments/1287fcm/joining_the_lets_short_the_ai_craze_team_nvda/jehursj/,0.022,0.921,0.057,0.3506
194,AI," The technology is already in place. Cloud computer investments like AWS were arguably more important. These chips are going to become less and less expensive, shrinking margins. If you truly understood what is going on you’d know. Stock could be at $400 in know time because the IPO market is frozen and there isn’t another way to play AI. This will not be bigger than MSFT at 2 Tril.",Rocky_The_Champion,1,/r/wallstreetbets/comments/1287fcm/joining_the_lets_short_the_ai_craze_team_nvda/jejwlg0/,0.027,0.841,0.132,0.7841
195,MSFT," The technology is already in place. Cloud computer investments like AWS were arguably more important. These chips are going to become less and less expensive, shrinking margins. If you truly understood what is going on you’d know. Stock could be at $400 in know time because the IPO market is frozen and there isn’t another way to play AI. This will not be bigger than MSFT at 2 Tril.",Rocky_The_Champion,1,/r/wallstreetbets/comments/1287fcm/joining_the_lets_short_the_ai_craze_team_nvda/jejwlg0/,0.027,0.841,0.132,0.7841
196,MSFT," Another fun fact, 15 companies (AAPL, MSFT,NVDA and others) account for 90%+ of the S&P rise this year, the 485 other are up 1% YTD.",EverlastMadeInUSA,2,/r/wallstreetbets/comments/1287fcm/joining_the_lets_short_the_ai_craze_team_nvda/jehtdch/,0.0,0.879,0.121,0.5106
197,NVDA, A man of culture I see. I like the play but I’ve gotten burned on NVDA puts enough times to be scared off. I really hope it works tho for you cuz I can’t stand this bloated meme.,sluttyseinfeld,23,/r/wallstreetbets/comments/1287fcm/joining_the_lets_short_the_ai_craze_team_nvda/jehy4k4/,0.095,0.714,0.191,0.4385
198,AI," For one, the gaming community is very mature…meaning that most gamers already have their rigs setup so any new cards will only give marginal upgrades. While the AI market is still very young and they can grow into it.",throwaway_tendies,4,/r/wallstreetbets/comments/1287fcm/joining_the_lets_short_the_ai_craze_team_nvda/jeilf91/,0.0,1.0,0.0,0.0
199,AI, I hear u. I’ll be the one to disrupt the meme like AI is disrupting the world.,themetamoose,7,/r/wallstreetbets/comments/1287fcm/joining_the_lets_short_the_ai_craze_team_nvda/jehzovt/,0.0,0.857,0.143,0.3612
200,AI," Currently, they have little infrastructures and no revenue/profit to capture off the AI market. They're just using the buzzwords to capture the stock price momentum like it's the dotcom bubble. They're literally using Chatgpt name like they own and making profit off it. Eventually people will realize this hypetrain will take more than 1-2 years for it to actually happen, if at all. 

They're supposed to be a chip manufacturer AND HAVE ALMOST NO AI SYSTEM OR PRODUCT. If AI market is so great, explain to me where is the revenue in Q1 for that? AI/ML have been around for years, they should be able to have some market right?",kuuui,4,/r/wallstreetbets/comments/1287fcm/joining_the_lets_short_the_ai_craze_team_nvda/jeirmod/,0.044,0.846,0.111,0.8478
201,OR," Currently, they have little infrastructures and no revenue/profit to capture off the AI market. They're just using the buzzwords to capture the stock price momentum like it's the dotcom bubble. They're literally using Chatgpt name like they own and making profit off it. Eventually people will realize this hypetrain will take more than 1-2 years for it to actually happen, if at all. 

They're supposed to be a chip manufacturer AND HAVE ALMOST NO AI SYSTEM OR PRODUCT. If AI market is so great, explain to me where is the revenue in Q1 for that? AI/ML have been around for years, they should be able to have some market right?",kuuui,4,/r/wallstreetbets/comments/1287fcm/joining_the_lets_short_the_ai_craze_team_nvda/jeirmod/,0.044,0.846,0.111,0.8478
202,TSLA," I may hedge with some 7/21 $400c’s. If enough people short combined with institutional money still gobbling up shares, it could squeeze similar to TSLA",JMSeaTown,2,/r/wallstreetbets/comments/1287fcm/joining_the_lets_short_the_ai_craze_team_nvda/jei0dib/,0.0,0.913,0.087,0.296
203,AI, It’s about future growth/revenue AI hardware segment is estimated to be value at $89bil by 2030.,throwaway_tendies,2,/r/wallstreetbets/comments/1287fcm/joining_the_lets_short_the_ai_craze_team_nvda/jeitdix/,0.0,0.862,0.138,0.34
204,TTD," My PC just asked me to update some Nvidia stuff. Kind of like TTD, they're just in so many random things it's easy to see why they've been consistent. But I've avoided buying calls or puts in nvda because it does seem overextended but who knows for how long.",Old-Illustrator-5675,3,/r/wallstreetbets/comments/1287fcm/joining_the_lets_short_the_ai_craze_team_nvda/jekdc0h/,0.059,0.871,0.07,-0.1027
205,NVDA," I did see some form of weakness when it rejected supply hard. Saw decent R:R for an entry but it blasted right back into the zone. I just start to wonder who’s trying to hoard NVDA at these levels.

https://preview.redd.it/639h623398ra1.jpeg?width=1135&format=pjpg&auto=webp&v=enabled&s=8549feb811cf072d4c0a7a01391d9d2df050714b",themetamoose,2,/r/wallstreetbets/comments/1287fcm/joining_the_lets_short_the_ai_craze_team_nvda/jehq9q9/,0.13,0.87,0.0,-0.5023
206,NVDA," If I’m not mistaken, the higher than average volume is general market sentiment pushing it higher and nothing specific that’s fueling NVDA again..",themetamoose,1,/r/wallstreetbets/comments/1287fcm/joining_the_lets_short_the_ai_craze_team_nvda/jehql2b/,0.0,0.912,0.088,0.2755
207,AM," I’ve been trading TSLA exclusively all year and told my buddy about it. He decided since I’ve made 15k like 500-1500 at a time he would just yolo it all this AM on 0DTE 200c. Somehow he didn’t sell any of them at 100,200,300 percent and tsla kept dildoing up. On the plus side he booked us a trip to Vegas this weekend.",Waitforsquirtle,104,/r/wallstreetbets/comments/1281ctq/homie_doesnt_know_how_to_take_a_screenshot/jegrd5t/,0.0,0.928,0.072,0.5574
208,TSLA," I’ve been trading TSLA exclusively all year and told my buddy about it. He decided since I’ve made 15k like 500-1500 at a time he would just yolo it all this AM on 0DTE 200c. Somehow he didn’t sell any of them at 100,200,300 percent and tsla kept dildoing up. On the plus side he booked us a trip to Vegas this weekend.",Waitforsquirtle,104,/r/wallstreetbets/comments/1281ctq/homie_doesnt_know_how_to_take_a_screenshot/jegrd5t/,0.0,0.928,0.072,0.5574
209,TSLA," There is no doubt that Tesla (TSLA) is a great company. They are innovators in the electric vehicle space and have created some of the most popular EVs on the market. Their stock has been on a tear lately, and I believe it still has room to run. That said, I would not recommend buying TSLA at this time as it is fairly expensive compared to other stocks in its sector.",VisualMod,-5,/r/wallstreetbets/comments/1281ctq/homie_doesnt_know_how_to_take_a_screenshot/jegr2fr/,0.088,0.792,0.119,0.524
