,ticker,comment,username,score,permalink,neg,neu,pos,compound
28,NSA," > there is legitimate data security concerns but this goes for all apps

Data security concerns from NSA vs CCP. A little different if you're an American / Western lawmaker.",ExperimentsWithNoo,5,/r/investing/comments/121qw3u/did_tiktok_ceo_really_suck_that_bad_compared_to/jdnh4fp/,0.0,0.839,0.161,0.5859
29,TC, People shitting on Meta here but also forget they are a huge driver for competitive pay. If they're gone these same people will be crying their TC will be dropping by 30%,69hailsatan,1,/r/investing/comments/121qw3u/did_tiktok_ceo_really_suck_that_bad_compared_to/jdnxmys/,0.25,0.625,0.125,-0.6124
30,AAPL," I got in at $230 last Feb., DCA all the way down to $89 in Nov. A few days ago, I sold all my under $200 lots for around $202 with surprisingly good gains (mostly STCG). 

Planning to liquidate all above $240, just trying to move away from non-div payers in my LT holdings. Even the tiny div I got from MSFT and AAPL felt...good.",Pension2options,1,/r/investing/comments/121qw3u/did_tiktok_ceo_really_suck_that_bad_compared_to/jdo3djr/,0.0,0.885,0.115,0.7579
31,MSFT," I got in at $230 last Feb., DCA all the way down to $89 in Nov. A few days ago, I sold all my under $200 lots for around $202 with surprisingly good gains (mostly STCG). 

Planning to liquidate all above $240, just trying to move away from non-div payers in my LT holdings. Even the tiny div I got from MSFT and AAPL felt...good.",Pension2options,1,/r/investing/comments/121qw3u/did_tiktok_ceo_really_suck_that_bad_compared_to/jdo3djr/,0.0,0.885,0.115,0.7579
32,USA," Really just Ban all social media.  It's bad for our mental well being, provides low value and is a back door to invasion of privacy from all countries.  Realistically an individual should be more worried about the USA having social media data then China",mgslee,0,/r/investing/comments/121qw3u/did_tiktok_ceo_really_suck_that_bad_compared_to/jdo2ml1/,0.224,0.692,0.084,-0.8162
33,STEM," What's wild is that in China they apparently push a LOT more educational material to the youth. Sure, lots of it may be political propaganda, but there's plenty of STEM in there. They're pushing good education on their kids, while in the US they push stupid dances and cultural aspersions.",Albert_Caboose,23,/r/investing/comments/121qw3u/did_tiktok_ceo_really_suck_that_bad_compared_to/jdncj02/,0.108,0.795,0.097,-0.1531
34,NYC," America's society did take a bit of a dump in the past few years, compared to other developed world, but the level of discontent amongst Gen Z is disproportionate. And none of what you say justifies the ""tankism"" that I see taking hold.

Re home ownership, the US is probably the easiest developed country to come into home ownership - try owning a home in London, Berlin or Toronto. That's one thing that America still does right compared to every other developed country, and for you to bring that as an argument... well, doesn't make you credible, will tell you that.

Finally, tinfoil you say? Internet psyops is a fact of life at this stage - a university research found that one third of Twitter accounts talking about a 2019 provincial election in Alberta, Canada were bots. That's the level of astroturfing that we are seeing, for a province that has a quarter of population of metropolitan NYC. You'd have to be blind to assume that China isn't taking full advantage of the success of TikTok. 

Coincidentally, the Economist just ran an article this week, commenting on TikTok's low monetization rate. Almost as if profit maximization is a secondary concern, eh?",Trick_Ad3016,-13,/r/investing/comments/121qw3u/did_tiktok_ceo_really_suck_that_bad_compared_to/jdnixtl/,0.049,0.877,0.074,0.7966
35,EU," American social media butts heads with the US government and pretty consistently keeps in line with the rules of other nations all the time without large issues.  The USA isn't China and does not have the same social/political environment. That makes US companies much less of a concern overall.

This is why EU companies wouldn't be a concern as well.",bioemerl,6,/r/investing/comments/121qw3u/did_tiktok_ceo_really_suck_that_bad_compared_to/jdnngnm/,0.0,0.914,0.086,0.6486
36,USA," American social media butts heads with the US government and pretty consistently keeps in line with the rules of other nations all the time without large issues.  The USA isn't China and does not have the same social/political environment. That makes US companies much less of a concern overall.

This is why EU companies wouldn't be a concern as well.",bioemerl,6,/r/investing/comments/121qw3u/did_tiktok_ceo_really_suck_that_bad_compared_to/jdnngnm/,0.0,0.914,0.086,0.6486
37,USA," >america should become one too

Banning a propaganda tool of an enemy state isn't dictatorship.  Tiktok ban is not being proposed on the back of their speech, it's being proposed the fact it's associated with and controlled by an enemy of the USA.

> Tiktok isn't a school telling american children to worship communism

Cool, but the threat is still very present and still very real.  Propaganda is rarely this obvious or stupidly run, and you won't know what they're doing with your data until it's far too late.",bioemerl,4,/r/investing/comments/121qw3u/did_tiktok_ceo_really_suck_that_bad_compared_to/jdnz4j7/,0.176,0.772,0.052,-0.9232
38,STEM," Where do you guys hear this propaganda? The most popular TikTok’s in China were crazy stunts for like 2-3years. Literally parkour on roofs and hanging off like 50 story apartments with 1 hand, etc. doing chin ups in VERY dangerous situations. It only stopped because the owners of several popular channels all ended up falling to their deaths.

I’ve never seen STEM in any douyin. It’s more or less all comedy skits that are ever featured.",somuchsoup,8,/r/investing/comments/121qw3u/did_tiktok_ceo_really_suck_that_bad_compared_to/jdnuno6/,0.132,0.689,0.179,0.6521
39,VERY," Where do you guys hear this propaganda? The most popular TikTok’s in China were crazy stunts for like 2-3years. Literally parkour on roofs and hanging off like 50 story apartments with 1 hand, etc. doing chin ups in VERY dangerous situations. It only stopped because the owners of several popular channels all ended up falling to their deaths.

I’ve never seen STEM in any douyin. It’s more or less all comedy skits that are ever featured.",somuchsoup,8,/r/investing/comments/121qw3u/did_tiktok_ceo_really_suck_that_bad_compared_to/jdnuno6/,0.132,0.689,0.179,0.6521
40,STEM," Yeah. If TikTok's algorithm was pushing stuff that we simply don't see on FB, Twitter, etc. then the argument of ""they're trying to manipulate us!"" would work for me. But it's the same shit we see on every other social media site. This is just what kids want. They don't want STEM educational content.

At *best* it shows that the Chinese government is forcing them to show STEM content to their own populace, not that they're somehow manipulating us any more than any other social media site.",Falcon4242,7,/r/investing/comments/121qw3u/did_tiktok_ceo_really_suck_that_bad_compared_to/jdnrny5/,0.107,0.846,0.047,-0.8268
41,OP," Yes, we should grant Mr. Chew his preferred style. Just pointing out that it’s not that big a faux pas. Perhaps OP Is Cantonese.",D4nCh0,5,/r/investing/comments/121qw3u/did_tiktok_ceo_really_suck_that_bad_compared_to/jdnwvqo/,0.0,0.802,0.198,0.6369
42,USA," > 'll paypal you $100 if you go on tiktok as a guest and find a video praising the chinese government within 10 minutes.

Where the heck did you read me running around saying ""TikTok is promoting videos that are pro CCP""?

If it ever gets to that point we've fucked up deeply.  You'll only see that sort of content when the people running that show are comfortable being that blatant.  Do you think we are talking about cartoon villains that will just go full ham and 100% screw their chances to use this tool right off the bat?

Every single country in the world right now is collecting a ""nuclear arsenal"" of technological ""ins"" to the other nations.  The US right now probably has hundreds of silent little hacked devices in China and Russia.  Same for both of those countries into devices in the USA.

Why?

Because that's what you do.  That's how you fight.  You either collect your opportunities or you fall behind and lose.  TikTok is one such tool, a social and data-oriented one.  It will remain dormant until it's needed, although they're probably using to collect data as we speak.

And as part of that - we'd be fucking absolute morons not to wipe it out and remove it from our borders.

> I've been using the app for months and

Oh man.  Four months of using TikTok - you're very qualified to give opinions on its national security implications.

> Reddit sells your data to chinese agencies. 

We should ban their ability to do that too.",bioemerl,2,/r/investing/comments/121qw3u/did_tiktok_ceo_really_suck_that_bad_compared_to/jdo39ai/,0.088,0.846,0.066,-0.8034
43,AI," “You can supress messages out on Tiktok“
Oh you mean like how the entire US gov and corporate messaging apparatus behaved during the pandemic to any different opinion?

“You as a user have no real control or knowledge of how you get delivered content on that app.” That’s literally how any AI weighting algo works for any social media.

When people post on social media that’s not data collection that’s called posting a public video of yourself.. the rest of your message is just rambling about how afraid you are of China and the CCP. Did you consider maybe we could work with them despite different political opinion? Or does country have to be fully subservient to American political interests to be left alone?",Frunk2,1,/r/investing/comments/121qw3u/did_tiktok_ceo_really_suck_that_bad_compared_to/jdo4vj0/,0.033,0.927,0.04,0.212
44,OP," no OP, this is not the best opportunity of a lifetime. The indexes haven't even fallen that much. Wait for the final and more severe leg down, which historically happens in the last 25% of a bear market when rates pause or reverse due to the expanding weight of economic damage.

Stocks aren't on sale yet. Look at P/E ratios.",FistEnergy,28,/r/investing/comments/121em53/is_this_a_this_time_is_different_situation/jdm9btn/,0.205,0.764,0.031,-0.8975
45,AAPL," Although there's fear, I don't see a wonderful buying opportunity at the S&P 500 level. Valuations are still very high. Look at a few of the largest weight stocks: AAPL, MSFT, and NVDA are at P/E ratios of 27, 31, and 154, respectively. AMZN and TSLA certainly don't help the situation. As Michael Burry put it, “Parabolas don't resolve sideways.”

I think many technology stocks are expensive and to be avoided. The amount of capital misallocation in that sector has been staggering over the past decade and we're due for many bankruptcies in unprofitable, VC-funded companies who are all customers of the large cap tech companies. Expectations are too high: cloud and ad spend will slow. 

If investing in index funds, look into an equal-weighted S&P 500 ETF like RSP or outside the US to international developed or emerging markets. Alternatively, focus on sectors you understand which sell at low valuations like tobacco, oil, and pharmaceuticals. More likely you'll see decent returns over the next decade.",CanYouPleaseChill,2,/r/investing/comments/121em53/is_this_a_this_time_is_different_situation/jdm8qzk/,0.085,0.845,0.07,-0.3695
46,AMZN," Although there's fear, I don't see a wonderful buying opportunity at the S&P 500 level. Valuations are still very high. Look at a few of the largest weight stocks: AAPL, MSFT, and NVDA are at P/E ratios of 27, 31, and 154, respectively. AMZN and TSLA certainly don't help the situation. As Michael Burry put it, “Parabolas don't resolve sideways.”

I think many technology stocks are expensive and to be avoided. The amount of capital misallocation in that sector has been staggering over the past decade and we're due for many bankruptcies in unprofitable, VC-funded companies who are all customers of the large cap tech companies. Expectations are too high: cloud and ad spend will slow. 

If investing in index funds, look into an equal-weighted S&P 500 ETF like RSP or outside the US to international developed or emerging markets. Alternatively, focus on sectors you understand which sell at low valuations like tobacco, oil, and pharmaceuticals. More likely you'll see decent returns over the next decade.",CanYouPleaseChill,2,/r/investing/comments/121em53/is_this_a_this_time_is_different_situation/jdm8qzk/,0.085,0.845,0.07,-0.3695
47,MSFT," Although there's fear, I don't see a wonderful buying opportunity at the S&P 500 level. Valuations are still very high. Look at a few of the largest weight stocks: AAPL, MSFT, and NVDA are at P/E ratios of 27, 31, and 154, respectively. AMZN and TSLA certainly don't help the situation. As Michael Burry put it, “Parabolas don't resolve sideways.”

I think many technology stocks are expensive and to be avoided. The amount of capital misallocation in that sector has been staggering over the past decade and we're due for many bankruptcies in unprofitable, VC-funded companies who are all customers of the large cap tech companies. Expectations are too high: cloud and ad spend will slow. 

If investing in index funds, look into an equal-weighted S&P 500 ETF like RSP or outside the US to international developed or emerging markets. Alternatively, focus on sectors you understand which sell at low valuations like tobacco, oil, and pharmaceuticals. More likely you'll see decent returns over the next decade.",CanYouPleaseChill,2,/r/investing/comments/121em53/is_this_a_this_time_is_different_situation/jdm8qzk/,0.085,0.845,0.07,-0.3695
48,NVDA," Although there's fear, I don't see a wonderful buying opportunity at the S&P 500 level. Valuations are still very high. Look at a few of the largest weight stocks: AAPL, MSFT, and NVDA are at P/E ratios of 27, 31, and 154, respectively. AMZN and TSLA certainly don't help the situation. As Michael Burry put it, “Parabolas don't resolve sideways.”

I think many technology stocks are expensive and to be avoided. The amount of capital misallocation in that sector has been staggering over the past decade and we're due for many bankruptcies in unprofitable, VC-funded companies who are all customers of the large cap tech companies. Expectations are too high: cloud and ad spend will slow. 

If investing in index funds, look into an equal-weighted S&P 500 ETF like RSP or outside the US to international developed or emerging markets. Alternatively, focus on sectors you understand which sell at low valuations like tobacco, oil, and pharmaceuticals. More likely you'll see decent returns over the next decade.",CanYouPleaseChill,2,/r/investing/comments/121em53/is_this_a_this_time_is_different_situation/jdm8qzk/,0.085,0.845,0.07,-0.3695
49,TSLA," Although there's fear, I don't see a wonderful buying opportunity at the S&P 500 level. Valuations are still very high. Look at a few of the largest weight stocks: AAPL, MSFT, and NVDA are at P/E ratios of 27, 31, and 154, respectively. AMZN and TSLA certainly don't help the situation. As Michael Burry put it, “Parabolas don't resolve sideways.”

I think many technology stocks are expensive and to be avoided. The amount of capital misallocation in that sector has been staggering over the past decade and we're due for many bankruptcies in unprofitable, VC-funded companies who are all customers of the large cap tech companies. Expectations are too high: cloud and ad spend will slow. 

If investing in index funds, look into an equal-weighted S&P 500 ETF like RSP or outside the US to international developed or emerging markets. Alternatively, focus on sectors you understand which sell at low valuations like tobacco, oil, and pharmaceuticals. More likely you'll see decent returns over the next decade.",CanYouPleaseChill,2,/r/investing/comments/121em53/is_this_a_this_time_is_different_situation/jdm8qzk/,0.085,0.845,0.07,-0.3695
50,ANY," op these people are being silly. You can pull a modest amount of money out, put it in a 3 month cd with 5% interest right now, and have that money back in an index before things start to pick back up. You shouldn't always try to time the market but when you have a guaranteed return presented to you it IS a bit different. Now if you're in the business of never assuming ANY risk and you know you're not going to need any of that money for the next 30 years, don't move anything. I'll accept my downvotes now.",blazin_paddles,1,/r/investing/comments/121em53/is_this_a_this_time_is_different_situation/jdnddkr/,0.0,0.914,0.086,0.7698
51,USA," as bad as it is, and how much worse it can get, the USA is STILL the safest economy to invest in.  its still where money is invested when everything looks bad.",2lovesFL,1,/r/investing/comments/121em53/is_this_a_this_time_is_different_situation/jdnpfxh/,0.248,0.686,0.066,-0.8126
52,AI," Tech moves at a different pace. While they may be considered overvalued compared to the norm, we’re approaching the forefront of AI. I’d expect those large weighted companies along with startups pushing the sector even further. 

No one knows the future but thanks to the age of subscriptions there are reasons why these companies continue to climb.",SeattleSeachicken,0,/r/investing/comments/121em53/is_this_a_this_time_is_different_situation/jdmg4y8/,0.027,0.908,0.065,0.5023
53,OP," Oh good point, this time is clearly different, just a minute while I liquidate my portfolio to buy gold, ammo, and MRE's /s

OP don't panic.  People lose money when they panic.  Just keep investing money in a well diversified portfolio or the long term and regularly rebalance to your target strategy.",polkawombat,77,/r/investing/comments/121em53/is_this_a_this_time_is_different_situation/jdmovy9/,0.0,0.737,0.263,0.924
54,GIC," >. I got into investing in the stock market in 2020.

Sweet Sweet summer child. Hang in there, you're not even cashing in your first GIC yet, this too shall pass.",S_204,10,/r/investing/comments/121em53/is_this_a_this_time_is_different_situation/jdmafzk/,0.0,0.824,0.176,0.7184
55,AI," People talking nominal numbers and returns are not giving the full picture. 

The SPY, when adjusted for inflation, has been flat for like 3 years. This correction hasn’t just been price (like the COVID crash), but also a time based correction, exasperated by inflation. The depths of this decline are masked by time and inflation.

The QQQ’s are poised to rip higher if rates fall, and the proliferation of AI LLMs sweep through tech and society at large. 

The risk-reward is highly in favor of QQQ going up over the next 2-3 years.",GoogleOfficial,2,/r/investing/comments/121em53/is_this_a_this_time_is_different_situation/jdnpmb5/,0.052,0.865,0.083,0.4587
56,PM," I will be messaging you in 6 months on [**2023-09-25 15:32:29 UTC**](http://www.wolframalpha.com/input/?i=2023-09-25%2015:32:29%20UTC%20To%20Local%20Time) to remind you of [**this link**](https://www.reddit.com/r/investing/comments/121em53/is_this_a_this_time_is_different_situation/jdmqbuc/?context=3)

[**CLICK THIS LINK**](https://www.reddit.com/message/compose/?to=RemindMeBot&subject=Reminder&message=%5Bhttps%3A%2F%2Fwww.reddit.com%2Fr%2Finvesting%2Fcomments%2F121em53%2Fis_this_a_this_time_is_different_situation%2Fjdmqbuc%2F%5D%0A%0ARemindMe%21%202023-09-25%2015%3A32%3A29%20UTC) to send a PM to also be reminded and to reduce spam.

^(Parent commenter can ) [^(delete this message to hide from others.)](https://www.reddit.com/message/compose/?to=RemindMeBot&subject=Delete%20Comment&message=Delete%21%20121em53)

*****

|[^(Info)](https://www.reddit.com/r/RemindMeBot/comments/e1bko7/remindmebot_info_v21/)|[^(Custom)](https://www.reddit.com/message/compose/?to=RemindMeBot&subject=Reminder&message=%5BLink%20or%20message%20inside%20square%20brackets%5D%0A%0ARemindMe%21%20Time%20period%20here)|[^(Your Reminders)](https://www.reddit.com/message/compose/?to=RemindMeBot&subject=List%20Of%20Reminders&message=MyReminders%21)|[^(Feedback)](https://www.reddit.com/message/compose/?to=Watchful1&subject=RemindMeBot%20Feedback)|
|-|-|-|-|",RemindMeBot,1,/r/investing/comments/121em53/is_this_a_this_time_is_different_situation/jdmqf2v/,0.109,0.891,0.0,-0.6322
57,STEM," I agree with you, except that the non-indexing portion done my mature investors, is not 100% gambling.  There are legitimate reasons to buy individual stocks if you know the company/industry/sector especially well and you know what they're up to.  Not insider information, just specialty knowledge.  It's not rocket science and there generally aren't many companies you as an individual would have insight into, but don't blow this off altogether.

For example, I'm up 25% in just three  months even in this turbulent market, by buying a bunch of shares in my previous employer when I learned what they are up to.  I know the leadership and how well they execute.  I understand the upside ramifications of what they are trying to accomplish.  Now the market is starting  to figure it out the implications.  I knew/suspected immediately, when I saw the very first press release in January.

Another example, STEM grad school research gives you a leg up on legitimate and exciting tech developments.  In biotech and back in the days when I went to grad school, in software as well.",CanWeTalkHere,-1,/r/investing/comments/121em53/is_this_a_this_time_is_different_situation/jdmue4l/,0.0,0.88,0.12,0.9653
58,TIL," TIL that the entire stock market is only made up of tech companies /s

Seriously, look at the history of interest rates and the history of each sector in the S&P 500.  Current interest rates are not abnormal.  Different sectors outperform and underperform every year.  Businesses (their employees) keep finding ways to provide value to their customers so they can make money.",polkawombat,15,/r/investing/comments/121em53/is_this_a_this_time_is_different_situation/jdmyiav/,0.025,0.852,0.123,0.7717
59,ALL," You do realize ALL of those can be invested via index investing. What you are referencing is ""asset allocation"" and has NOTHING to do with indexing or not.  

Indexing is a means to invest in any asset in a passive means thus avoiding active investing (security selection and market timing).  

Asset allocation is your % of different assets to come up with a risk level you are comfortable with since each asset class carries different risk levels and volatility.",10xwannabe,36,/r/investing/comments/121em53/is_this_a_this_time_is_different_situation/jdm6zo9/,0.073,0.71,0.216,0.8979
60,OP," I’ll let OP answer, but I’d guess that statement is even more true for the people you mentioned.",CommunityRegular9721,33,/r/investing/comments/121em53/is_this_a_this_time_is_different_situation/jdm7yli/,0.0,0.804,0.196,0.6297
61,ALL," Sorry that is NOT what the data shows.  I am really surprised the folks on Reddit (even the folks who do finance for a living) don't even know the peer review data on it.  If you want you can start by reading the seminal articles on the topic that put the final nail in that coffin of active management INCLUDING picking stocks (security selection):  BHB (beebower/ hood/ brinson) and its follow up study BSB (beebower/ singer/ brinson) published in JFA in circa early 1990's.  

Here is a brief overview of the study:  The took the topic pension fund managers in the country (top 100 or so).  Those are the ones that have access to the top money managers in whatever industries they wanted to invest in at that time.  They then looked at their returns.  They compared their returns to what their returns would have been if they invested in the same type of stocks using a index passive approach.  They found they LOST money with their security selection AND market timing techniques.

Of course this sent shock waves through the finance community.  No one believed it.   They repeated the study using the next 10 years of data and published those results as the BSB study.  Again same results.  So guess what Wall Street does?  Make sure NO ONE ever hears about these studies ever again.  

If this doesn't convince you just look at JPM private banking arm OWN study (link below).  Their OWN study in the end sees NO advantage of adding a concentrated portfolio on an index portfolio EVER.   No surprise since their data collecting shows over the last 35  years the MEDIAN stock return of ALL individual stock is a whopping -52%!!

[https://privatebank.jpmorgan.com/content/dam/jpm-wm-aem/global/pb/en/insights/eye-on-the-market/eotm-the-agony-and-the-ecstasy.pdf](https://privatebank.jpmorgan.com/content/dam/jpm-wm-aem/global/pb/en/insights/eye-on-the-market/eotm-the-agony-and-the-ecstasy.pdf)

I really don't think folks realize how hard it is to beat the index.  Considering only a minority do ex post and those that do have NO reproduceable way to do it shows it is more gambling then reproduceable skill.",10xwannabe,2,/r/investing/comments/121em53/is_this_a_this_time_is_different_situation/jdn4zgk/,0.07,0.876,0.054,-0.7402
