,ticker,comment,username,score,permalink,neg,neu,pos,compound
94,UK," Hello,

I have an account with Interactive Brokers UK (it's an ""ISA"" account) which I treat as ""buy-only"" (I put in money, buy stuff over time, forget about it). So my ""horizon"" is until ""I absolutely have to touch that money"" which may be 20 years or so...

I want to buy some gold and my preference would be for something that is focused on physical gold so [I did some research](https://www.google.com/search?q=gold+physical+etf) (i.e. googled it).

One thing I discovered was this piece of information:

>The diversification principles of the regulatory investment fund framework (UCITS) do not allow to launch a UCITS fund with only one constituent. Due to this fact, gold is mainly available as an exchange-traded commodity (ETC) in European countries. These products are certificates issued by a financial institution collateralised with physical gold. In contrast to the EU, Swiss regulation allows ETFs for single commodities like gold.

This made me pause, as I am not familiar with UCITS so I do not understand if it provides some form of ""protection"" that applies to ETFs, or it's just a technicality that ""you can't call this an ETF"" but has no other impact.

Either way, I have so many questions:

1. Since ETCs are basically **certificates issued by a financial institution collateralised with physical gold**, does that mean they are only as safe as the ""financial institution"" that issued them? Like if bank X issues an ETC and bank X goes bankrupt, you lose the money because the gold is not actually yours?
2. How do I find out who ""backs"" an ETC? For example [SGLN](https://www.ishares.com/uk/individual/en/products/258441/ishares-physical-gold-etc-fund) is one near the top results list.
3. How else do I compare ETCs? Clearly the ""backing institution"" is important as per (1) but is there anything else to look at?
4. What is UCITS and does it provide any extra ""protection"" due to its regulations? Would I be better off buying an ETF with part physical gold and part something else? Then what gold-heavy ETFs would you recommend that are UCITS-compliant?

Thank you all.

P.S. I was thinking of posting separately but I do not use r/investing often so I am not clear on the rules. Hopefully I will get some traction here but please let me know if I would be better off making a separate post.",akarypid,2,/r/investing/comments/121g2oo/daily_general_discussion_and_advice_thread_march/jdlvks0/,0.043,0.847,0.11,0.9756
95,USA," Which mutual/index fund to invest cash in my Roth IRA?

I saved money while working in a job without retirement benefits years ago. I didn’t realize that I never invested this portion of the money I had in the Roth IRA I opened. I recently switched from Vanguard to Charles Schwab so the other portion of my account is in VTTSX. I know that I could buy FZILX or another similar fund but I don’t really know which one as I am new to I investing. 

Some background: I am not planning on contributing to my new jobs Roth 401K until my emergency fund is full for 6 months of expenses at least.

* How old are you? What country do you live in?  
I am 26 and live in the USA

* Are you employed/making income? How much?

I make $90K/year + a variable bonus

* What are your objectives with this money? 

Do something other than just have it sit in my account. 

* What is your time horizon? Do you need this money next month? Next 20yrs?

I will need money for retirement but my emergency fund is my top priority at the moment.\*

 What is your risk tolerance?

I like safe risk.",ProblematicByProxy,2,/r/investing/comments/121g2oo/daily_general_discussion_and_advice_thread_march/jdngp81/,0.067,0.837,0.096,0.7916
96,DD, I have done some DD on a video game company that recently started trading. GDEV. I'd like to share my dd here but I cannot post. who can help me? I am happy to share the findings. cheers,AstroChicks,1,/r/investing/comments/121g2oo/daily_general_discussion_and_advice_thread_march/jdltfok/,0.0,0.597,0.403,0.9578
97,GDEV, I have done some DD on a video game company that recently started trading. GDEV. I'd like to share my dd here but I cannot post. who can help me? I am happy to share the findings. cheers,AstroChicks,1,/r/investing/comments/121g2oo/daily_general_discussion_and_advice_thread_march/jdltfok/,0.0,0.597,0.403,0.9578
98,USA," I am confused , A roth IRA is a retirement account, you probably do not want your emergency fund inside a Roth IRA

For a Roth IRA I would invest in broad market index funds like SWTSX (Broad market USA index) and if you want some foreign exposure SWISX what is a broad market foreign fund (however it only holds developed markets)

Now those fund are risky in the short term, they are not suitable for short term savings like an emergency fund , long term (20+ years) you could say they are safe. Meaning they could drop 50% tomorrow , but over 20+ years you should see good returns so again these are LONG TERM holds

For an emergency fund I would do something very safe like a money market mutual fund  SWVXX this fund shouldn't lose value and give a fair interest rate",SirGlass,1,/r/investing/comments/121g2oo/daily_general_discussion_and_advice_thread_march/jdnil8q/,0.06,0.733,0.207,0.9745
99,USA," For your Schwab Roth IRA, invest 80% into SWTSX & 20% into SWISX.  Total world diversity strategy.  Don't look back until you turn 50 years old.  

Another option is 100% SWTSX if you don't believe in international exposure.  SWTSX is a Total USA fund.",InvestingNerd2020,1,/r/investing/comments/121g2oo/daily_general_discussion_and_advice_thread_march/jdno0gn/,0.0,1.0,0.0,0.0
100,DD," Ok sorry when I read this for some reason I thought you wanted to post a DD video , like your youtube channel, I hadn't had my morning caffine so I was half asleep

I am guessing the medium link is catching the auto mod, since medium is basically a blog site anyone can use and lots of scammers/pumpers use medium it is on the list of blocked sites

EDIT never mind I do not see a medium link , but I do not see this post as removed from the sub",SirGlass,1,/r/investing/comments/121g2oo/daily_general_discussion_and_advice_thread_march/jdmmcso/,0.033,0.926,0.041,0.1655
101,EDIT," Ok sorry when I read this for some reason I thought you wanted to post a DD video , like your youtube channel, I hadn't had my morning caffine so I was half asleep

I am guessing the medium link is catching the auto mod, since medium is basically a blog site anyone can use and lots of scammers/pumpers use medium it is on the list of blocked sites

EDIT never mind I do not see a medium link , but I do not see this post as removed from the sub",SirGlass,1,/r/investing/comments/121g2oo/daily_general_discussion_and_advice_thread_march/jdmmcso/,0.033,0.926,0.041,0.1655
102,USA," VIIIX is Vanguard. It sounds like TRowe is just your 401k administrator.   From what little you have said it sounds like you are mostly USA large cap with a growth tilt.  You want more value, more international and more small. 100% stocks is not a problem at your age.",JeffB1517,2,/r/investing/comments/121e87s/roth_401k_in_t_rowe_price_and_would_appreciate/jdlz8hh/,0.0,0.747,0.253,0.8968
103,IMO," I'd prefer a little heavier holdings in mid/small. 

and I'd definitely add some international exposure. 

but otherwise you're fine. nothing wrong with your current portfolio. 

>I'm not quire sure if this is a solid strategy, mostly about the stock part.

there are different opinions on the subject. IMO there's a case for bonds in every portfolio. if you look at the long-term bonds vs. stocks returns, bonds will beat stocks about 1 year out of every 3 or 4, and bonds usually go up when stocks go down. not always, but more often than not. back in the dot com bubble, bonds beat stocks by over 10% a year 2000-2002. https://www.thebalancemoney.com/stocks-and-bonds-calendar-year-performance-417028 

this type of thing could happen again, so ~10-20% bonds could be a reasonable idea for a young person.",nostratic,2,/r/investing/comments/121e87s/roth_401k_in_t_rowe_price_and_would_appreciate/jdm95ee/,0.019,0.909,0.072,0.7039
104,USA," 2Y is short enough that I'd definitely consider CDs and Cash options.

I don't know what money markets are available in your area, its very country dependent. But a money market fund like SWVXX or VMFXX in the USA is going at basically the federal funds rate (4.5%, with expectations to reach 4.75% or so now that the FFR was upped this past week).

Do you know what the risk-free rate in your country is, and what the best way to invest into it is?

---------------

So a substantial portion of your savings _should_ be cash, because 2Y just isn't a very long time. Cash is always safest, but usually makes the least amount of money. The rest of your savings can be bonds or stocks.",dragontamer5788,2,/r/investing/comments/1211e5p/investing_to_buy_a_house_how/jdk2boe/,0.0,0.864,0.136,0.9534
105,CD," Two years is too short to do anything with equities. Too much risk. CD, Treasuries, HYSA.",1hotjava,2,/r/investing/comments/1211e5p/investing_to_buy_a_house_how/jdkss5d/,0.117,0.778,0.106,-0.0516
106,OP, Brokered CDs are ~5.25%. Money Markets are above 4.5%. OP can totes get decent returns if he really commits.,eaglewatch1945,1,/r/investing/comments/1211e5p/investing_to_buy_a_house_how/jdkbr0w/,0.0,0.928,0.072,0.101
107,IMO," I was only able to find one filing that still contained its financial data, the 2008 q3 10-Q:

[https://www.sec.gov/Archives/edgar/data/36995/000095014408007959/g16268qexv19.htm](https://www.sec.gov/Archives/edgar/data/36995/000095014408007959/g16268qexv19.htm)

I wasn't active then but just eyeballing that balance sheet now, this bank would not have look like a good investment to me... They got pretty lucky with that $7 per share buyout offer, IMO. What price was Ackman able to buy his shares at?",Oraterre,0,/r/investing/comments/121fkun/10k_of_companies_that_are_gone/jdm0i95/,0.057,0.713,0.23,0.9344
108,APD," Short-term treasury bonds and short-term treasury-backed money market funds like [SNSXX](https://www.schwabassetmanagement.com/products/snsxx) generate income and are much safer than stocks.  I’ve been using the latter to hold cash I’m not prepared to buy stocks with yet.  The main problem with low-growth, high-dividend stocks are tax losses from the dividends.  

Edit: I own MRK, AVGO and APD and all three generate capital appreciation and dividends.  It’s a matter of degree, more than absolutes.",Stephen_1984,1,/r/investing/comments/121rme2/how_should_a_small_business_owner_invest_in/jdn6r45/,0.089,0.767,0.145,0.5321
109,AVGO," Short-term treasury bonds and short-term treasury-backed money market funds like [SNSXX](https://www.schwabassetmanagement.com/products/snsxx) generate income and are much safer than stocks.  I’ve been using the latter to hold cash I’m not prepared to buy stocks with yet.  The main problem with low-growth, high-dividend stocks are tax losses from the dividends.  

Edit: I own MRK, AVGO and APD and all three generate capital appreciation and dividends.  It’s a matter of degree, more than absolutes.",Stephen_1984,1,/r/investing/comments/121rme2/how_should_a_small_business_owner_invest_in/jdn6r45/,0.089,0.767,0.145,0.5321
110,MRK," Short-term treasury bonds and short-term treasury-backed money market funds like [SNSXX](https://www.schwabassetmanagement.com/products/snsxx) generate income and are much safer than stocks.  I’ve been using the latter to hold cash I’m not prepared to buy stocks with yet.  The main problem with low-growth, high-dividend stocks are tax losses from the dividends.  

Edit: I own MRK, AVGO and APD and all three generate capital appreciation and dividends.  It’s a matter of degree, more than absolutes.",Stephen_1984,1,/r/investing/comments/121rme2/how_should_a_small_business_owner_invest_in/jdn6r45/,0.089,0.767,0.145,0.5321
111,TFSA, What if tax isn't a consideration? Would that change your reply? I live in Canada and so we have things like TFSA and RSP that can help with the tax side of things.,Melodic_Walk_,2,/r/investing/comments/121rme2/how_should_a_small_business_owner_invest_in/jdnb7xx/,0.0,0.839,0.161,0.6767
112,MSFT," Collecting a divided is a sale.

If you think you are a good stock picker then go ahead, it may or may not work out, beating the S&P500 is pretty hard to do over the long run but if you want to try your hand at stock picking that is up to you.

Edit

Also lots of the dividend aristocrats actually have a very low dividend rate, MSFT is under 1%, NOBLE a dividend aristocrats ETF dividend is under 2%",SirGlass,5,/r/investing/comments/121rme2/how_should_a_small_business_owner_invest_in/jdncmt7/,0.049,0.762,0.189,0.9072
113,CD," Well, that's not currently a very good rate for a CD.  You can get non callable CDs over 5% for a year.",NW_Runner,8,/r/investing/comments/121sz6t/why_do_cd_when_you_have_better_rates_on_the_money/jdn9mj3/,0.121,0.783,0.097,-0.1338
114,CD," The point is to lock in rates for longer duration.

In 1981, you can walk into Bank of America or Chase and get a 5 year CD for a cool 18% APY.

If 5 year is too short, on Oct 1st 1981, you can buy 30 year treasury with 15.21% coupon rate.",zerof3565,3,/r/investing/comments/121sz6t/why_do_cd_when_you_have_better_rates_on_the_money/jdngwkf/,0.0,0.918,0.082,0.4767
115,CD," Yes your VMFXX and other short term noOrLowPenaltyCDs/tBill/mmf/hysa/etfs/mf are the way to go right now as fed fund rate is expected to stay at least 5% through 2023.

In 2024 or 2025 when rates are expected to drop you might want to lock up longer durations; just before it occurs. (Change from MM to CD.)

The only reason you would consider mid or long right now is if you are not good at following the fed announcements, or if a particular long gets you a significant 1% higher return, etc.

EDIT:

A mid 2-3yr tnote/cd/bond means wasting 1yr of early lockup, worse it might then have to renew right in middle of a lower rates period.

But if game for 5-10yr durations and find a 5% offer by all means just pull the trigger now. As one year early won’t make a difference in the grand scheme of things; unless fed rate goes to 7% which is looking very unlikely - much more inclined to do something like hold at 5% for 3+ years instead of breaching past 6% - fed mentioned only doing one more increase this year.",Latter_Run_6763,2,/r/investing/comments/121sz6t/why_do_cd_when_you_have_better_rates_on_the_money/jdn8mz6/,0.045,0.877,0.078,0.8067
116,CD," Interest from CDs is subject to state / local taxes whereas US Treasuries (or related funds) are not. So, getting a slightly lower rate on Treasuries could be better than a higher CD rate given your tax situation.",sablerock7,2,/r/investing/comments/121sz6t/why_do_cd_when_you_have_better_rates_on_the_money/jdnqbjm/,0.052,0.716,0.232,0.76
117,CD," Are any no penalty for early withdrawals? My credit union offers a 4.5% for 13 months, no penalty. I’ve never purchased a CD before but am trying to compare",_slocal,1,/r/investing/comments/121sz6t/why_do_cd_when_you_have_better_rates_on_the_money/jdnefx7/,0.232,0.71,0.058,-0.5267
118,CD," Try googling <name> cd early withdrawal 
According to Schwab: “We'll help you sell the CD at the current market rate by requesting bids on your CD and contacting you with the highest one. If you decide to sell, you'll receive the bid price plus any accrued interest. There are no guarantees that you'll get what you originally paid for the CD.”

If you think you’ll need the cash sooner then select a shorter term like 3 months or a MM fund. Or find an online bank. 

Many people, like myself, haven’t done CDs until recently when rates shot up. They didn’t make sense. I’m kinda glad the FDIC didn’t offer “global insurance” on all deposits, then there would be no incentive for banks to offer decent interest on deposits 

Don’t forget about Series I bonds, but max is $10k / yr and you’ll need to hold for at least a year.",sablerock7,2,/r/investing/comments/121sz6t/why_do_cd_when_you_have_better_rates_on_the_money/jdng1uc/,0.03,0.878,0.092,0.7471
119,CD, Ally has 11 month 4.75% no penalty CD.,Stormy-Monday,2,/r/investing/comments/121sz6t/why_do_cd_when_you_have_better_rates_on_the_money/jdnm73f/,0.464,0.536,0.0,-0.6369
120,PDD," China- most of Chinese eCommerce stocks, Baba, PDD, tons of Chinese gov't owned stocks sanctioned or not sanctioned companies.  Oil

USA-Expect a 10-20% fall. Any US or international companies with much business in China. Apple is 20% China, Tesla, shipping, container, oil, raw materials.  US will take a hit hard.  Military may not greatly be affected.",Vast_Cricket,1,/r/investing/comments/121wfhd/where_to_invest_in_case_of_a_cold_war_between_the/jdnyekm/,0.025,0.945,0.03,0.0644
121,CD," S&P is based on largest market capilization comapnies. If borrowing interest is almost free cost of borrowing is so low companies can continue report stellar profits.  Currently top **6** of 500 stocks comprise of **19.4**% of total S&P 500 weight with Google company counted 4 times because it includes derivatives.

That is why these tech companies pulling the most weight realize to sustain they must reduce cost by letting go 10,000s, building closings to manage the cost structure to pay current borrowing rate from bonds issued.  Some of the heavy weighters like Tesla can be quickly be feather weight with the popularity of eVs.  During a decline these growth stocks fall miserably as -19% in 2022 return after interest hike.

The avg S&P return has been around +**7.6**% since its inception. During higher interest years often it returns negative.   So you can project (1+.076)\^(7)=1.605X not adjusted for inflation. This is just better than today's ibond or CD rate. Nothing spectacular.  Hope that clarifies the confusion.",Vast_Cricket,1,/r/investing/comments/121thud/would_investing_in_the_sp500_in_the_future/jdnn4d8/,0.081,0.763,0.155,0.9211
