,ticker,comment,username,score,permalink,neg,neu,pos,compound
0,DD," Do not use only the 1Y and 5Y for your DD, zoom out!!!

Derivatives are not infallible!",breatheb4thevoid,5,/r/investing/comments/121k81z/what_etf_can_i_use_to_short_nasdaq_or_sp500_but/jdmua98/,0.0,1.0,0.0,0.0
1,FSD," Please do if you have the same luck as me; as soon as you sell/short it total market bull run. Maybe if you YOLO it and all in on the short the war will end, supply chain resolved, inflation stops, climate change averted, Covid eradicated, cancer cured, herpes cured, Tesla FSD gets released, Apple actually releases a new innovative product, MetaVerse becomes all out success, Cramer says something right, etc.

C’mon, take one for the team!",beyonddisbelief,6,/r/investing/comments/121k81z/what_etf_can_i_use_to_short_nasdaq_or_sp500_but/jdmt3oo/,0.121,0.699,0.18,0.6731
2,OP," I think that's what OP wants, he's just using the term ""short"" to mean he wants to bet that the stock value decreases.",mcbarron,-2,/r/investing/comments/121k81z/what_etf_can_i_use_to_short_nasdaq_or_sp500_but/jdn7yqj/,0.0,0.897,0.103,0.34
3,OP, OP is artificially a knowledgeable investor,Dunder-MifflinPaper,10,/r/investing/comments/121k81z/what_etf_can_i_use_to_short_nasdaq_or_sp500_but/jdmyxcr/,0.0,1.0,0.0,0.0
4,ES, Also shorting via ES futures (or MES for 1/10 size) is the way.,ShadoFlameX,1,/r/investing/comments/121k81z/what_etf_can_i_use_to_short_nasdaq_or_sp500_but/jdmslvd/,0.0,1.0,0.0,0.0
5,PM," I will be messaging you in 1 month on [**2023-05-09 16:26:46 UTC**](http://www.wolframalpha.com/input/?i=2023-05-09%2016:26:46%20UTC%20To%20Local%20Time) to remind you of [**this link**](https://www.reddit.com/r/investing/comments/121k81z/what_etf_can_i_use_to_short_nasdaq_or_sp500_but/jdmxy37/?context=3)

[**1 OTHERS CLICKED THIS LINK**](https://www.reddit.com/message/compose/?to=RemindMeBot&subject=Reminder&message=%5Bhttps%3A%2F%2Fwww.reddit.com%2Fr%2Finvesting%2Fcomments%2F121k81z%2Fwhat_etf_can_i_use_to_short_nasdaq_or_sp500_but%2Fjdmxy37%2F%5D%0A%0ARemindMe%21%202023-05-09%2016%3A26%3A46%20UTC) to send a PM to also be reminded and to reduce spam.

^(Parent commenter can ) [^(delete this message to hide from others.)](https://www.reddit.com/message/compose/?to=RemindMeBot&subject=Delete%20Comment&message=Delete%21%20121k81z)

*****

|[^(Info)](https://www.reddit.com/r/RemindMeBot/comments/e1bko7/remindmebot_info_v21/)|[^(Custom)](https://www.reddit.com/message/compose/?to=RemindMeBot&subject=Reminder&message=%5BLink%20or%20message%20inside%20square%20brackets%5D%0A%0ARemindMe%21%20Time%20period%20here)|[^(Your Reminders)](https://www.reddit.com/message/compose/?to=RemindMeBot&subject=List%20Of%20Reminders&message=MyReminders%21)|[^(Feedback)](https://www.reddit.com/message/compose/?to=Watchful1&subject=RemindMeBot%20Feedback)|
|-|-|-|-|",RemindMeBot,1,/r/investing/comments/121k81z/what_etf_can_i_use_to_short_nasdaq_or_sp500_but/jdmy1tk/,0.105,0.895,0.0,-0.6322
6,FA," If that's true - why don't statisticians just look ahead, tell us when future bottoms will be - and we'll avoid them?

Just google any TA vs. FA analysis, they all reach the same conclusion. Technical Analysis is tea leaves, and nobody knows when the bottom or the top is.",Dgb_iii,3,/r/investing/comments/121k81z/what_etf_can_i_use_to_short_nasdaq_or_sp500_but/jdnmhbu/,0.042,0.848,0.11,0.3612
7,TA," If that's true - why don't statisticians just look ahead, tell us when future bottoms will be - and we'll avoid them?

Just google any TA vs. FA analysis, they all reach the same conclusion. Technical Analysis is tea leaves, and nobody knows when the bottom or the top is.",Dgb_iii,3,/r/investing/comments/121k81z/what_etf_can_i_use_to_short_nasdaq_or_sp500_but/jdnmhbu/,0.042,0.848,0.11,0.3612
8,OP," You didn't ask me a question- and I replied to a comment and not the OP, which is something you can do on a discussion board. There are far too many people who think they can get rich quick with derivatives and if I want to be derisive about it, certainly well past the point at which others have answered the OP, I will be. No amount of voting in either direction removes my education, nor will it remove your salt about lacking it.",retard-is-not-a-slur,-4,/r/investing/comments/121k81z/what_etf_can_i_use_to_short_nasdaq_or_sp500_but/jdnuhss/,0.026,0.863,0.111,0.7351
9,EU," i see,i never traded futures because i'm EU and so i trade CFD instead which are better than futures at least for short timeframe trading, but holding CFD for weeks or months its terrible because i get a overnight and a weekend fee if i keep trades open.

do you know if its the same for futures? or if you just pay commissions when you open and close the trade and basically get no ""maintenance"" fees? 

thanks",xErth_x,-5,/r/investing/comments/121k81z/what_etf_can_i_use_to_short_nasdaq_or_sp500_but/jdn0cl9/,0.11,0.818,0.072,-0.4784
10,OP, So is the answer for OP to literally short an ETF? There are no ETFs that do this for him?,mcbarron,1,/r/investing/comments/121k81z/what_etf_can_i_use_to_short_nasdaq_or_sp500_but/jdnhz62/,0.119,0.881,0.0,-0.3736
11,CD," If not doing a CD ladder, why not just buy an Ally no penalty CD.  That's currently offering 4.75% for an 11 month term and you can withdraw your funds after 6 days penalty free.",MusaEnsete,2,/r/investing/comments/121kwb5/should_i_put_my_50k_cash_saved_for_educational/jdnok9p/,0.202,0.716,0.081,-0.5994
12,SOFI, Just stick it in a SOFI 4% savings account...  Don't forget the .42% exp ratio when calculating SPAXX.,kingoftheoneliners,0,/r/investing/comments/121kwb5/should_i_put_my_50k_cash_saved_for_educational/jdn3o5l/,0.0,0.906,0.094,0.1695
13,CD, No penalty 11mo CD - 4.75% @ Ally,NewKi11ing1t,1,/r/investing/comments/121kwb5/should_i_put_my_50k_cash_saved_for_educational/jdnsc5g/,0.565,0.435,0.0,-0.6369
14,CD, Here's what I would do with $50k.  Buy 5 $10k CDs (or 10 $5k CDs) earning 5% or more from different banks on Fidelity.  If you need some cash for expenses you can close out 1 CD and pay the early withdraw penalty.,NoHelp4577,1,/r/investing/comments/121kwb5/should_i_put_my_50k_cash_saved_for_educational/jdo0rqs/,0.104,0.896,0.0,-0.5267
15,OP, Can you do that with an education investment account? I’m assuming OP has a Fidelity 529,JimmyTango,8,/r/investing/comments/121kwb5/should_i_put_my_50k_cash_saved_for_educational/jdn5w7j/,0.0,1.0,0.0,0.0
16,CD," But why?  If the yields drop in the money market account you just pull out and buy something else more desirable instead of locking up your money. After all, money markets are buying CD and bonds anyway.",-Mx-Life-,38,/r/investing/comments/121kwb5/should_i_put_my_50k_cash_saved_for_educational/jdmflpq/,0.065,0.853,0.083,0.1875
17,CD, Laddered CD or bonds would be the right choice.,Average_Squirrel,6,/r/investing/comments/121kwb5/should_i_put_my_50k_cash_saved_for_educational/jdmcbkq/,0.0,1.0,0.0,0.0
18,CD," ""Laddered"" CDs are just CDs that you buy in specific timings, you can do a CD ladder anywhere you can buy CDs.

That said, Schwab has a ladder builder tool that's useful.",Seref15,3,/r/investing/comments/121kwb5/should_i_put_my_50k_cash_saved_for_educational/jdnobrh/,0.0,0.909,0.091,0.4404
19,CD," It depends on the 401K plan, but they usually let you buy FDIC insured broker CDs and Treasuries in your brokerage account.  I just moved all my 401K brokerage account money market cash to broker CDs.  The CD rates are higher and they are FDIC insured.  You can even do just 1 month CD and Treasury terms if you want to keep things liquid.

ETA: SPAXX accounts are money market accounts - ""Money market funds invest in very short-term, high-quality securities and attempt to maintain a constant share price (value). However, an investment in a money market fund is not insured or guaranteed by the FDIC or any other government agency, and it is possible to lose money in a money market fund."", https://www.ici.org/faqs/faq/mfs/faqs_bond_funds",bob49877,5,/r/investing/comments/121kwb5/should_i_put_my_50k_cash_saved_for_educational/jdn0z12/,0.028,0.878,0.094,0.754
20,IRS," ""You can pick an investment portfolio but, due to IRS rules, you can't choose individual investments, mutual funds, or ETFs in a 529 plan.""

From fidelity's website

I think if your time horizon is 2+ years the 529 is a great option but the 5% interest rate is very tempting for a guaranteed return on funds you'll need sooner. 

Although this varies on state!!! Some states make 529 contributions deductable fron state income tax so if you do the math... The lowest risk profiles would probably be better for those with high state income tax.",Crrunk,6,/r/investing/comments/121kwb5/should_i_put_my_50k_cash_saved_for_educational/jdn6xm0/,0.057,0.808,0.135,0.8841
21,CD," One thing I forgot to add is to to keep your money safe if you buy CDs, is to get them through different banks, if you have more than $250K to invest.  The FDIC insurance is $250K for each CD issuing bank, not the brokerage holding the account.  If you are using an account at a brokerage like Fidelity or Schwab, look for FDIC coverage in the notes when you go to buy your CD and don't buy more than $250K worth of CDs from any single bank.",bob49877,1,/r/investing/comments/121kwb5/should_i_put_my_50k_cash_saved_for_educational/jdns7bq/,0.0,0.916,0.084,0.7624
22,USA," It is a no win situation, so unmitigated disaster is the starting expectation. You have China as a growing rival to the USA and Tiktok as one of the most prominent successful products from China. 

Over the past 5 years, I have seen a rhetorical shift towards viewing China and Chinese as a rival threat. Everyone is one-upping each other with hawkish positions. Resulting in de-globalization and antagonism. Chinese policy has contributed big time to this antagonism as well. It saddens me that we as a human race are moving towards antagonistic positions, but maybe this was an inevitable prisoners dilemma like situation.",taguscove,13,/r/investing/comments/121qw3u/did_tiktok_ceo_really_suck_that_bad_compared_to/jdn7we8/,0.181,0.707,0.112,-0.7785
23,AI," TL;DR  Mr. Chow is really a good man, he is true and sincere. But he has no power over those decisions and he cannot stop data access/manipulation/propagation from CCP to TikTok. Neither will Project Texas. This is not his fault, and it’s purely CCP’s fault.

As a Chinese super familiar with TikTok/Bytedance situation I want to clarify it since I see so many misunderstandings of it.

1. Yes, Tiltok CEO is a good man, he shows good class during testimony, and people love the way he talked. *But this is not enough*

2. In the real operation of TikTok, Mr. Chow, aka TikTok CEO has NO POWER or anything to make any big company decision. He must always yield to  Bytedance and even Douyin.

This is not a secret at company at all, everyone knows he is a puppet put there with no real power.

As you can see he keeps answering that he is Singaporean during testimony when they asked if he will follow China’s laws.

It’s hilarious because yeah you don’t need to follow China’s law cause you are Singaporean,  but what about your employees at China, what about those “super admin” backdoor?

3. Americans really don’t understand how TikTok operates. Bytedance is the parent company of both TikTok and Douyin (Chinese version). Another thing hilarious is TikTok is banned in China, because CCP doesn’t allow such foreign APP.

Most codes development, AI algorithm training of TikTok are completed in China at very beginning, even they hired lots of people in America now this doesn’t change anything. SWE at America need to work at China time zone because all PMs making decisions come from China. Similar to algorithm training, they still heavily depend on Employers in China to train the model.

Don’t tell me about Project Texas, it’s useless and didn’t solve any problem IMO. The project started like 2/3 years ago and now it’s still a mess. You can find lots of reports online but IMO the core issue is employers in China doesn’t follow the procedures at all and there is no consequence in China for it.

4. And this is the most scary and important thing I want to talk about. In China, employers won’t get punished if they didn’t follow correct procedures, laws and even constitutions (see what Xi did for his third term?). But there will be *consequences* if they didn’t follow CCP’s order.

The same thing happened to TikTok, Douyin and Bytedance. Yeah Mr. Chow has no consequences cause he is Singaporean, again, what about all of his employers at China?

On top of that, China published a few strict laws recently years, focusing on two things, 
(1), technology such as AI algorithm is national security and any such technology transfer to foreign companies need to be approved by Chinese government. Now you tell me even without using your brain that if they will allow TikTok to transfer technology to foreign.

(2) Every Chinese in mainland China has obligations to cooperate with government for any search, data access related to national security issues.
I want to highlight here (2) is written into a law. And the definition of national security purely depends on Chinese government and CCP alone. Don’t be silly if you think you can hire some lawyer to fight it in courts like America did. If you do so you will disappear in China, it’s that simple.

And now Mr. Chow, as a Singaporean and no real power CEO, you tell me, how do you prevent such direct data access and manipulation from CCP to TikTok algorithm/data, when your core engineers lie at mainland China and they will obey the Chinese law?

He has no answer, he cannot answer such question, but I as Chinese know the answer, and I think anyone with social experience will get the same conclusion as I do.

Not to mention that there already exists something called “super admin” in company that can be used by CCP to direct locate anyone they want to search. And in fact as an example they did it last year to locate a journalist which criticized Beijing.

Now just imagine what’s gonna happen on TikTok when China invaded Taiwan, (this is something Xi will definitely do, just a matter of time), it will become a perfect propaganda tool.

Even for now if you search on TikTok for Ukrainian war you can find a huge amount of negative information about Ukraine and praises of Russia. And IMO this does expose a huge national security to not America but whole world. I don’t want to live in a world where CCP controls everything.

In conclusion, Mr. Chow is really a good man, he is true and sincere. But he has no power over those decisions and he cannot stop data access/manipulation/propagation from CCP to TikTok. Neither will Project Texas. This is not his fault, and it’s purely CCP’s fault. But now we are facing this huge national security exposure, and I’m curious what’s gonna happen next.",daemondo,43,/r/investing/comments/121qw3u/did_tiktok_ceo_really_suck_that_bad_compared_to/jdn8jzn/,0.079,0.768,0.153,0.9961
24,APP," TL;DR  Mr. Chow is really a good man, he is true and sincere. But he has no power over those decisions and he cannot stop data access/manipulation/propagation from CCP to TikTok. Neither will Project Texas. This is not his fault, and it’s purely CCP’s fault.

As a Chinese super familiar with TikTok/Bytedance situation I want to clarify it since I see so many misunderstandings of it.

1. Yes, Tiltok CEO is a good man, he shows good class during testimony, and people love the way he talked. *But this is not enough*

2. In the real operation of TikTok, Mr. Chow, aka TikTok CEO has NO POWER or anything to make any big company decision. He must always yield to  Bytedance and even Douyin.

This is not a secret at company at all, everyone knows he is a puppet put there with no real power.

As you can see he keeps answering that he is Singaporean during testimony when they asked if he will follow China’s laws.

It’s hilarious because yeah you don’t need to follow China’s law cause you are Singaporean,  but what about your employees at China, what about those “super admin” backdoor?

3. Americans really don’t understand how TikTok operates. Bytedance is the parent company of both TikTok and Douyin (Chinese version). Another thing hilarious is TikTok is banned in China, because CCP doesn’t allow such foreign APP.

Most codes development, AI algorithm training of TikTok are completed in China at very beginning, even they hired lots of people in America now this doesn’t change anything. SWE at America need to work at China time zone because all PMs making decisions come from China. Similar to algorithm training, they still heavily depend on Employers in China to train the model.

Don’t tell me about Project Texas, it’s useless and didn’t solve any problem IMO. The project started like 2/3 years ago and now it’s still a mess. You can find lots of reports online but IMO the core issue is employers in China doesn’t follow the procedures at all and there is no consequence in China for it.

4. And this is the most scary and important thing I want to talk about. In China, employers won’t get punished if they didn’t follow correct procedures, laws and even constitutions (see what Xi did for his third term?). But there will be *consequences* if they didn’t follow CCP’s order.

The same thing happened to TikTok, Douyin and Bytedance. Yeah Mr. Chow has no consequences cause he is Singaporean, again, what about all of his employers at China?

On top of that, China published a few strict laws recently years, focusing on two things, 
(1), technology such as AI algorithm is national security and any such technology transfer to foreign companies need to be approved by Chinese government. Now you tell me even without using your brain that if they will allow TikTok to transfer technology to foreign.

(2) Every Chinese in mainland China has obligations to cooperate with government for any search, data access related to national security issues.
I want to highlight here (2) is written into a law. And the definition of national security purely depends on Chinese government and CCP alone. Don’t be silly if you think you can hire some lawyer to fight it in courts like America did. If you do so you will disappear in China, it’s that simple.

And now Mr. Chow, as a Singaporean and no real power CEO, you tell me, how do you prevent such direct data access and manipulation from CCP to TikTok algorithm/data, when your core engineers lie at mainland China and they will obey the Chinese law?

He has no answer, he cannot answer such question, but I as Chinese know the answer, and I think anyone with social experience will get the same conclusion as I do.

Not to mention that there already exists something called “super admin” in company that can be used by CCP to direct locate anyone they want to search. And in fact as an example they did it last year to locate a journalist which criticized Beijing.

Now just imagine what’s gonna happen on TikTok when China invaded Taiwan, (this is something Xi will definitely do, just a matter of time), it will become a perfect propaganda tool.

Even for now if you search on TikTok for Ukrainian war you can find a huge amount of negative information about Ukraine and praises of Russia. And IMO this does expose a huge national security to not America but whole world. I don’t want to live in a world where CCP controls everything.

In conclusion, Mr. Chow is really a good man, he is true and sincere. But he has no power over those decisions and he cannot stop data access/manipulation/propagation from CCP to TikTok. Neither will Project Texas. This is not his fault, and it’s purely CCP’s fault. But now we are facing this huge national security exposure, and I’m curious what’s gonna happen next.",daemondo,43,/r/investing/comments/121qw3u/did_tiktok_ceo_really_suck_that_bad_compared_to/jdn8jzn/,0.079,0.768,0.153,0.9961
25,IMO," TL;DR  Mr. Chow is really a good man, he is true and sincere. But he has no power over those decisions and he cannot stop data access/manipulation/propagation from CCP to TikTok. Neither will Project Texas. This is not his fault, and it’s purely CCP’s fault.

As a Chinese super familiar with TikTok/Bytedance situation I want to clarify it since I see so many misunderstandings of it.

1. Yes, Tiltok CEO is a good man, he shows good class during testimony, and people love the way he talked. *But this is not enough*

2. In the real operation of TikTok, Mr. Chow, aka TikTok CEO has NO POWER or anything to make any big company decision. He must always yield to  Bytedance and even Douyin.

This is not a secret at company at all, everyone knows he is a puppet put there with no real power.

As you can see he keeps answering that he is Singaporean during testimony when they asked if he will follow China’s laws.

It’s hilarious because yeah you don’t need to follow China’s law cause you are Singaporean,  but what about your employees at China, what about those “super admin” backdoor?

3. Americans really don’t understand how TikTok operates. Bytedance is the parent company of both TikTok and Douyin (Chinese version). Another thing hilarious is TikTok is banned in China, because CCP doesn’t allow such foreign APP.

Most codes development, AI algorithm training of TikTok are completed in China at very beginning, even they hired lots of people in America now this doesn’t change anything. SWE at America need to work at China time zone because all PMs making decisions come from China. Similar to algorithm training, they still heavily depend on Employers in China to train the model.

Don’t tell me about Project Texas, it’s useless and didn’t solve any problem IMO. The project started like 2/3 years ago and now it’s still a mess. You can find lots of reports online but IMO the core issue is employers in China doesn’t follow the procedures at all and there is no consequence in China for it.

4. And this is the most scary and important thing I want to talk about. In China, employers won’t get punished if they didn’t follow correct procedures, laws and even constitutions (see what Xi did for his third term?). But there will be *consequences* if they didn’t follow CCP’s order.

The same thing happened to TikTok, Douyin and Bytedance. Yeah Mr. Chow has no consequences cause he is Singaporean, again, what about all of his employers at China?

On top of that, China published a few strict laws recently years, focusing on two things, 
(1), technology such as AI algorithm is national security and any such technology transfer to foreign companies need to be approved by Chinese government. Now you tell me even without using your brain that if they will allow TikTok to transfer technology to foreign.

(2) Every Chinese in mainland China has obligations to cooperate with government for any search, data access related to national security issues.
I want to highlight here (2) is written into a law. And the definition of national security purely depends on Chinese government and CCP alone. Don’t be silly if you think you can hire some lawyer to fight it in courts like America did. If you do so you will disappear in China, it’s that simple.

And now Mr. Chow, as a Singaporean and no real power CEO, you tell me, how do you prevent such direct data access and manipulation from CCP to TikTok algorithm/data, when your core engineers lie at mainland China and they will obey the Chinese law?

He has no answer, he cannot answer such question, but I as Chinese know the answer, and I think anyone with social experience will get the same conclusion as I do.

Not to mention that there already exists something called “super admin” in company that can be used by CCP to direct locate anyone they want to search. And in fact as an example they did it last year to locate a journalist which criticized Beijing.

Now just imagine what’s gonna happen on TikTok when China invaded Taiwan, (this is something Xi will definitely do, just a matter of time), it will become a perfect propaganda tool.

Even for now if you search on TikTok for Ukrainian war you can find a huge amount of negative information about Ukraine and praises of Russia. And IMO this does expose a huge national security to not America but whole world. I don’t want to live in a world where CCP controls everything.

In conclusion, Mr. Chow is really a good man, he is true and sincere. But he has no power over those decisions and he cannot stop data access/manipulation/propagation from CCP to TikTok. Neither will Project Texas. This is not his fault, and it’s purely CCP’s fault. But now we are facing this huge national security exposure, and I’m curious what’s gonna happen next.",daemondo,43,/r/investing/comments/121qw3u/did_tiktok_ceo_really_suck_that_bad_compared_to/jdn8jzn/,0.079,0.768,0.153,0.9961
26,LOVE," Propaganda. The vibe and sentiment is anti tiktok. Fair enough. I have a sense they actually dont want to shut them down to avoid legal action, and want a lot of crying and shouting about it all over media to deter users. But it cant work. Teenagers dont care for these hearings, they dont even know they exist. They LOVE the product, every other tech company is struggling to compete with the simplicity of it. And they are a heavy bulk of their user base.",Famous_Variation4729,1,/r/investing/comments/121qw3u/did_tiktok_ceo_really_suck_that_bad_compared_to/jdntuqz/,0.168,0.729,0.102,-0.3323
27,META, I'm hoping for a complete ban of TikTok.  This will help my shares of FB...I mean META in theory.,JahMusicMan,-4,/r/investing/comments/121qw3u/did_tiktok_ceo_really_suck_that_bad_compared_to/jdnoy53/,0.142,0.553,0.304,0.4767
