,ticker,comment,username,score,permalink,neg,neu,pos,compound
65,NVDA," Everyone shitting on you in the comments, saying NVDA is a beast and won’t go down… you know what that means, hold.",EEBucks,1,/r/wallstreetbets/comments/12839rs/tired_and_more_scared_after_todays_rally_hold_or/jeipagn/,0.123,0.877,0.0,-0.4215
66,AI," You bought puts on NVDA, in the midst of an AI craze? You’re in the right place",Severe-Blackberry,1,/r/wallstreetbets/comments/12839rs/tired_and_more_scared_after_todays_rally_hold_or/jeivk5c/,0.091,0.909,0.0,-0.1531
67,NVDA," You bought puts on NVDA, in the midst of an AI craze? You’re in the right place",Severe-Blackberry,1,/r/wallstreetbets/comments/12839rs/tired_and_more_scared_after_todays_rally_hold_or/jeivk5c/,0.091,0.909,0.0,-0.1531
68,AI," EVERYONE in tech is talking about AI. We’re at year one of the AI growth. NVDA makes the cards used to power AI.  It’s basically the start of a second Bitcoin boom. 

So sure… buy puts. If you hate money. 

Personally, I sold some puts a few weeks ago. Closed them out yesterday hoping for a down week next week so I can sell them again at a better price.",foulpudding,1,/r/wallstreetbets/comments/12839rs/tired_and_more_scared_after_todays_rally_hold_or/jej963f/,0.051,0.833,0.115,0.5574
69,NVDA," EVERYONE in tech is talking about AI. We’re at year one of the AI growth. NVDA makes the cards used to power AI.  It’s basically the start of a second Bitcoin boom. 

So sure… buy puts. If you hate money. 

Personally, I sold some puts a few weeks ago. Closed them out yesterday hoping for a down week next week so I can sell them again at a better price.",foulpudding,1,/r/wallstreetbets/comments/12839rs/tired_and_more_scared_after_todays_rally_hold_or/jej963f/,0.051,0.833,0.115,0.5574
70,AI," AI going crazy, buys puts on Nvidia 🤡",SuperMoonRocket,552,/r/wallstreetbets/comments/12839rs/tired_and_more_scared_after_todays_rally_hold_or/jehax5o/,0.286,0.714,0.0,-0.34
71,MSFT," Agree about NVDA, although MSFT is much more diversified than just Bing - has consumer devices, packaged software, cloud to name a few.",Silly_Escape13,2,/r/wallstreetbets/comments/12839rs/tired_and_more_scared_after_todays_rally_hold_or/jehnm7a/,0.0,0.889,0.111,0.3612
72,NVDA," Agree about NVDA, although MSFT is much more diversified than just Bing - has consumer devices, packaged software, cloud to name a few.",Silly_Escape13,2,/r/wallstreetbets/comments/12839rs/tired_and_more_scared_after_todays_rally_hold_or/jehnm7a/,0.0,0.889,0.111,0.3612
73,AI," It is smart but maybe he's a little early or maybe not? NVDA is pumpin' purely because the last guidance mentioned AI 32 times.

There are a lot of stocks involved with AI that are trading at fractions of their 2021 price, NVDA isn't particularly special.",Matt6453,3,/r/wallstreetbets/comments/12839rs/tired_and_more_scared_after_todays_rally_hold_or/jeiowaz/,0.068,0.892,0.039,-0.3318
74,NVDA," It is smart but maybe he's a little early or maybe not? NVDA is pumpin' purely because the last guidance mentioned AI 32 times.

There are a lot of stocks involved with AI that are trading at fractions of their 2021 price, NVDA isn't particularly special.",Matt6453,3,/r/wallstreetbets/comments/12839rs/tired_and_more_scared_after_todays_rally_hold_or/jeiowaz/,0.068,0.892,0.039,-0.3318
75,AI, This. The Age of AI has arrived and this guy is shorting a processor company.,sol364,-1,/r/wallstreetbets/comments/12839rs/tired_and_more_scared_after_todays_rally_hold_or/jeij2pz/,0.0,1.0,0.0,0.0
76,NVDA, Lmaooooo eat shit loser. NVDA prints and you’re mad,NickAMD,-1,/r/wallstreetbets/comments/12839rs/tired_and_more_scared_after_todays_rally_hold_or/jeic5wg/,0.63,0.37,0.0,-0.8807
77,NVDA, Lol and Crypto mining is almost non existent. NVDA is due for a correction in a rational market,MindlessPotatoe,159,/r/wallstreetbets/comments/12839rs/tired_and_more_scared_after_todays_rally_hold_or/jeheje9/,0.0,0.843,0.157,0.4215
78,AI, Cramer is bullish on AI 🤡🤡🤡,FuccTheSuits,5,/r/wallstreetbets/comments/12839rs/tired_and_more_scared_after_todays_rally_hold_or/jeia7a7/,0.0,1.0,0.0,0.0
79,AI, Their products are literally trust me bro we will totally sell our hugely bloated inventory after a huge revenue drop this quarter by the way guys AI AI AI AI AI AI future profit gg. They have sold barely anything relevant to ai and by May you will see exactly that. Less than a few 100m in profit from it and continued decreasing margins and revenue. The company is trash and overvalued massively. They even did a fucking shelf offering after to ensure the bag holders. And then insiders will sell during this pump (some have already) then it will drop like a rock.,QuaintHeadspace,5,/r/wallstreetbets/comments/12839rs/tired_and_more_scared_after_todays_rally_hold_or/jeihodo/,0.037,0.799,0.164,0.926
80,OP," OP says average down on options. 

Inverse him immediately",AppropriatePlant6076,11,/r/wallstreetbets/comments/12839rs/tired_and_more_scared_after_todays_rally_hold_or/jehmb0c/,0.0,1.0,0.0,0.0
81,FA," Please sell it, call a FA and try to throw into a good spy run",jaypowwow,5,/r/wallstreetbets/comments/12839rs/tired_and_more_scared_after_todays_rally_hold_or/jehgvik/,0.0,0.679,0.321,0.6369
82,NVDA," No, you frickin regard! Do you understand that NVDA is going to power the current wave of our technological advancement. If you wanted to make money, you would be long NVDA. You’re a buffoon for buying more puts. Cut your losses and stop trying to spot a reversal that isn’t there. The stock is up 90% YTD for a reason. Sell on Monday, delete Robinhood, and then do some research before it’s too late. You’re on a fast track to losing all your money with ideas this dumb. You’re practically shorting pick axes during the gold rush.",DixieNormaz,-3,/r/wallstreetbets/comments/12839rs/tired_and_more_scared_after_todays_rally_hold_or/jehef5v/,0.157,0.843,0.0,-0.9354
83,NVDA," The effect is the same, OP is bearish on NVDA.",Silly_Escape13,20,/r/wallstreetbets/comments/12839rs/tired_and_more_scared_after_todays_rally_hold_or/jehn75o/,0.0,1.0,0.0,0.0
84,OP," The effect is the same, OP is bearish on NVDA.",Silly_Escape13,20,/r/wallstreetbets/comments/12839rs/tired_and_more_scared_after_todays_rally_hold_or/jehn75o/,0.0,1.0,0.0,0.0
85,AI," That’s what I mean about MSFT though, their stock is also moving above the market average like NVDA. They really shouldn’t be at their current price either, although not as bad as NVDA. All this AI hype about how BING is integrated with chatgpt, well guess a lot of other companies are “integrating” their own shit chat bots with chatgpt. MSFT isn’t a buy right now and certainly not NVDA. CDs and bonds are paying over 5% now so you pick. 100% chance you make 5% a year or risk your money in an overbought stock market? SPY 420 is when I’d short the market, closed at 409 today.",VentriTV,2,/r/wallstreetbets/comments/12839rs/tired_and_more_scared_after_todays_rally_hold_or/jei8e2i/,0.049,0.848,0.103,0.631
86,MSFT," That’s what I mean about MSFT though, their stock is also moving above the market average like NVDA. They really shouldn’t be at their current price either, although not as bad as NVDA. All this AI hype about how BING is integrated with chatgpt, well guess a lot of other companies are “integrating” their own shit chat bots with chatgpt. MSFT isn’t a buy right now and certainly not NVDA. CDs and bonds are paying over 5% now so you pick. 100% chance you make 5% a year or risk your money in an overbought stock market? SPY 420 is when I’d short the market, closed at 409 today.",VentriTV,2,/r/wallstreetbets/comments/12839rs/tired_and_more_scared_after_todays_rally_hold_or/jei8e2i/,0.049,0.848,0.103,0.631
87,NVDA," That’s what I mean about MSFT though, their stock is also moving above the market average like NVDA. They really shouldn’t be at their current price either, although not as bad as NVDA. All this AI hype about how BING is integrated with chatgpt, well guess a lot of other companies are “integrating” their own shit chat bots with chatgpt. MSFT isn’t a buy right now and certainly not NVDA. CDs and bonds are paying over 5% now so you pick. 100% chance you make 5% a year or risk your money in an overbought stock market? SPY 420 is when I’d short the market, closed at 409 today.",VentriTV,2,/r/wallstreetbets/comments/12839rs/tired_and_more_scared_after_todays_rally_hold_or/jei8e2i/,0.049,0.848,0.103,0.631
88,AI, Crypto mining been replaced with AI model training. Everyone wants to make their own porn with Stable Diffusion.,DonJohnsonBTFD,160,/r/wallstreetbets/comments/12839rs/tired_and_more_scared_after_todays_rally_hold_or/jehih1v/,0.0,0.885,0.115,0.296
89,AI, What the hell is wrong with your logic man the AI thing is much bigger than crypto ever was it's infinite demand from now until the computers kill us all.,Tashum,31,/r/wallstreetbets/comments/12839rs/tired_and_more_scared_after_todays_rally_hold_or/jei1111/,0.348,0.652,0.0,-0.9313
90,AI," What research justifies the current stock price? Nvidia is significantly overbought imo. It’s got a p/e ratio of 154 and yeah it profits off of AI, but it’s still reeling from the crash of crypto mining and I don’t think AI will increase their revenue this fast.",idkeverynameistaken9,33,/r/wallstreetbets/comments/12839rs/tired_and_more_scared_after_todays_rally_hold_or/jehfwmx/,0.07,0.803,0.127,0.2382
91,AI, NVDA won’t go down nearly as much as the rest of the market. Everyone knows their demand is going to be through the roof as long as AI is a theme(the foreseeable future). Shorting this stock is honesty one of the dumber moves I’ve seen…even on this sub.,DixieNormaz,5,/r/wallstreetbets/comments/12839rs/tired_and_more_scared_after_todays_rally_hold_or/jehelzy/,0.078,0.859,0.062,0.0516
92,NVDA, NVDA won’t go down nearly as much as the rest of the market. Everyone knows their demand is going to be through the roof as long as AI is a theme(the foreseeable future). Shorting this stock is honesty one of the dumber moves I’ve seen…even on this sub.,DixieNormaz,5,/r/wallstreetbets/comments/12839rs/tired_and_more_scared_after_todays_rally_hold_or/jehelzy/,0.078,0.859,0.062,0.0516
93,NVDA, The confirmation bias I needed to seriously consider shorting NVDA. It's gonna be a busy weekend.,Cutlercares,3,/r/wallstreetbets/comments/12839rs/tired_and_more_scared_after_todays_rally_hold_or/jejnzpj/,0.205,0.795,0.0,-0.2732
94,AI, This isn't true. Nvidia is not the only one to power these AI applications. ASICS will be a massive headwind as well as custom designs from customers. AMD is also a threat.,random-meme850,0,/r/wallstreetbets/comments/12839rs/tired_and_more_scared_after_todays_rally_hold_or/jekdq2e/,0.165,0.775,0.06,-0.5621
95,AMD, This isn't true. Nvidia is not the only one to power these AI applications. ASICS will be a massive headwind as well as custom designs from customers. AMD is also a threat.,random-meme850,0,/r/wallstreetbets/comments/12839rs/tired_and_more_scared_after_todays_rally_hold_or/jekdq2e/,0.165,0.775,0.06,-0.5621
96,AMD, Safe with no divy and a PE higher than TSLA? Companies are cutting back on these kind of infra purchases and AMD does much the same,Successful_Car1670,12,/r/wallstreetbets/comments/12839rs/tired_and_more_scared_after_todays_rally_hold_or/jehfhfj/,0.129,0.769,0.101,0.0516
97,AI," The one that incorporates ML in literally every discipline. It's used in finance, economics, business/marketing, all types of engineering, all types of social sciences all types of human/life sciences .. 🤷‍♀️ a lot of multidisciplinary fields have emerged in the past few years where grad students use AI and ML for the thesis. 

Yes it's currently mostly academic but it will get applied irl eventually too. The work is definitely being done.",fwds,8,/r/wallstreetbets/comments/12839rs/tired_and_more_scared_after_todays_rally_hold_or/jehzhhc/,0.0,0.927,0.073,0.6597
98,ML," The one that incorporates ML in literally every discipline. It's used in finance, economics, business/marketing, all types of engineering, all types of social sciences all types of human/life sciences .. 🤷‍♀️ a lot of multidisciplinary fields have emerged in the past few years where grad students use AI and ML for the thesis. 

Yes it's currently mostly academic but it will get applied irl eventually too. The work is definitely being done.",fwds,8,/r/wallstreetbets/comments/12839rs/tired_and_more_scared_after_todays_rally_hold_or/jehzhhc/,0.0,0.927,0.073,0.6597
99,AI," They will all need nvidia GPU's...

Bwhahahaha. Dedicated AI accelerators will destroy Nvidia GPU's, and some are even already shipping. The only question is if the software programmers will be willing to migrate over, but MS and Google will have a lot of sway in that department, and they also have teams working on dedicated hardware.",reneh01,7,/r/wallstreetbets/comments/12839rs/tired_and_more_scared_after_todays_rally_hold_or/jeho891/,0.037,0.863,0.1,0.5789
100,MS," They will all need nvidia GPU's...

Bwhahahaha. Dedicated AI accelerators will destroy Nvidia GPU's, and some are even already shipping. The only question is if the software programmers will be willing to migrate over, but MS and Google will have a lot of sway in that department, and they also have teams working on dedicated hardware.",reneh01,7,/r/wallstreetbets/comments/12839rs/tired_and_more_scared_after_todays_rally_hold_or/jeho891/,0.037,0.863,0.1,0.5789
101,NVDA, I come for the comedic relief. They literally buy companies on the verge of bankruptcy and short TSLA/AAPL/NVDA. It’s like they want to give away their money lol,DixieNormaz,13,/r/wallstreetbets/comments/12839rs/tired_and_more_scared_after_todays_rally_hold_or/jehnk6m/,0.0,0.64,0.36,0.886
102,TSLA, I come for the comedic relief. They literally buy companies on the verge of bankruptcy and short TSLA/AAPL/NVDA. It’s like they want to give away their money lol,DixieNormaz,13,/r/wallstreetbets/comments/12839rs/tired_and_more_scared_after_todays_rally_hold_or/jehnk6m/,0.0,0.64,0.36,0.886
103,OP, Getting called a Karen because I called someone a regard for saying that OP is NOT shorting this stock. Lmfao,AppropriatePlant6076,-5,/r/wallstreetbets/comments/12839rs/tired_and_more_scared_after_todays_rally_hold_or/jehueyw/,0.0,0.821,0.179,0.5423
104,AI," No they don’t. Neither are hardware manufacturers and have no interest in being.

They will outsource. And if only there were a hardware manufacturer with experience in building AI acceleration and already had hardware manufacturing facilities….",311987m,2,/r/wallstreetbets/comments/12839rs/tired_and_more_scared_after_todays_rally_hold_or/jei6yc6/,0.112,0.812,0.076,-0.1027
105,TSLA," Nope. They’re too busy joking about ppl losing their livelihoods. Like yea it’s funny to laugh at the regard who wouldn’t listen and shorted TSLA after a split, but at what point do these clowns stop downvoting truth and wake up? They get furious when you try to educate them. Lol whatever, these idiots are just liquidity.",DixieNormaz,5,/r/wallstreetbets/comments/12839rs/tired_and_more_scared_after_todays_rally_hold_or/jejhtjn/,0.136,0.646,0.218,0.4404
106,BA," The US dollar will be fine its only competitor.  Is the euro. Usa 6% inflation EU 20%. 

No other currency is even 10% of global transactions. China is at like 2-3%. The all the US dollar is fked posts need to show real
Numbers or be called BA",Careless-Pin-2852,1,/r/wallstreetbets/comments/128anht/germany_consumer_price_index_food_is_up_241_from/jekbqpo/,0.043,0.874,0.083,0.2732
107,EU," The US dollar will be fine its only competitor.  Is the euro. Usa 6% inflation EU 20%. 

No other currency is even 10% of global transactions. China is at like 2-3%. The all the US dollar is fked posts need to show real
Numbers or be called BA",Careless-Pin-2852,1,/r/wallstreetbets/comments/128anht/germany_consumer_price_index_food_is_up_241_from/jekbqpo/,0.043,0.874,0.083,0.2732
108,AKA," Ah The ol “emissions testing” scam…
AKA
“If your CEL is on then you fail so I can force you to go get milked by mechanics. 
Oh what’s that? You wanna fix it yourself?
HAHAHA too bad, our system won’t let you update our database in order to test again without a mechanics login doing it…forcing you to get one to at least inspect it”

(From my experience in IL, such a shithole state)",Superdank888,2,/r/wallstreetbets/comments/128anht/germany_consumer_price_index_food_is_up_241_from/jekqq50/,0.092,0.853,0.054,-0.4637
109,TSLA," It looks like your position in TSLA is doing well today, up 3.21%. However, it is still down 0.74% from when you purchased it. Your breakeven price is $251.36, so you are currently in the red by $8.52 per share.",VisualMod,110,/r/wallstreetbets/comments/1284b72/where_my_haters_at_youre_gonna_remember_me_i_will/jeh4gly/,0.0,0.845,0.155,0.7003
110,TSLA," Indeed, it's a very good call. TSLA might hit $220 by Tuesday/Wednesday. Once earnings comes around, that'll be the time to sell and buy for puts 🔥",Abhams30,2,/r/wallstreetbets/comments/1284b72/where_my_haters_at_youre_gonna_remember_me_i_will/jejt02d/,0.0,0.883,0.117,0.4927
111,IP, I have Tesla stock as a large holding (stock not options) because the IP and patients are worth $.,BobbyB90220,1,/r/wallstreetbets/comments/1284b72/where_my_haters_at_youre_gonna_remember_me_i_will/jehbqn7/,0.0,0.894,0.106,0.2263
112,TD, Bro was trying to join you but TD wouldn’t let me buy the option until my funds settle. Was able to pick up shares on Monday but that’s all.,Darkwolf22345,1,/r/wallstreetbets/comments/1284b72/where_my_haters_at_youre_gonna_remember_me_i_will/jehdi10/,0.0,0.86,0.14,0.5267
113,OP, So much anger in this lil OP lmao,NaNaNaNaNaNaNaNaNa65,1,/r/wallstreetbets/comments/1284b72/where_my_haters_at_youre_gonna_remember_me_i_will/jej03sp/,0.287,0.432,0.281,-0.0202
114,BABA," Buy BABA, your tesla has already made an 80% move and people than Bashin BABS under 75 ; TSLA and BABA will be same price soon, Tesla comes back down or BABA goes up",BaBaBuyey,1,/r/wallstreetbets/comments/1284b72/where_my_haters_at_youre_gonna_remember_me_i_will/jejfq3w/,0.0,1.0,0.0,0.0
115,TSLA," Buy BABA, your tesla has already made an 80% move and people than Bashin BABS under 75 ; TSLA and BABA will be same price soon, Tesla comes back down or BABA goes up",BaBaBuyey,1,/r/wallstreetbets/comments/1284b72/where_my_haters_at_youre_gonna_remember_me_i_will/jejfq3w/,0.0,1.0,0.0,0.0
116,OP, OP will be upset when he learns there was 175M$ worth of puts bought at the ask at close friday,Unsigned-Gaming,1,/r/wallstreetbets/comments/1284b72/where_my_haters_at_youre_gonna_remember_me_i_will/jejscr5/,0.116,0.8,0.084,-0.1779
117,TSLA, I'll be ya huckleberry. Puts on TSLA.,Fit_Ad_9987,1,/r/wallstreetbets/comments/1284b72/where_my_haters_at_youre_gonna_remember_me_i_will/jejshwt/,0.0,1.0,0.0,0.0
118,TSLA, Another fellow brother who has showed his trust in TSLA,Select_Substance_270,1,/r/wallstreetbets/comments/1284b72/where_my_haters_at_youre_gonna_remember_me_i_will/jek7ygx/,0.0,0.732,0.268,0.5106
119,VERY," I know very little about options and only a small amount of regarded math.  But this looks VERY not in your favor!      

From what I see: the only thing you can hope for is a ridiculously ~~compassionate~~   ..sympathetic and generous billionaire to buy those, out of pity, and bail you out.

*format",musetechnician,1,/r/wallstreetbets/comments/1284b72/where_my_haters_at_youre_gonna_remember_me_i_will/jekqyoq/,0.15,0.712,0.137,0.2035
120,TSLA, I remember when I believed in TSLA oh that was battery day and I lost everything,Strange-Pumpkin4024,1,/r/wallstreetbets/comments/1284b72/where_my_haters_at_youre_gonna_remember_me_i_will/jeks64y/,0.161,0.839,0.0,-0.3182
121,OP," Sure hope OP not that regarded, but this is WSB and OP sounds like an arrogant prick so I'll keep my mouth shut on this one.",zxc123zxc123,1,/r/wallstreetbets/comments/1284b72/where_my_haters_at_youre_gonna_remember_me_i_will/jek4vxh/,0.21,0.596,0.194,-0.3716
122,TSLA," For this guy to make 500K off those TSLA contracts, the stock needs to go up 48-50% in the next 28 days. 

Mental.",JoshuaB123,26,/r/wallstreetbets/comments/1284b72/where_my_haters_at_youre_gonna_remember_me_i_will/jei1ulg/,0.0,1.0,0.0,0.0
123,NEGG," O I know how this will end, he'll lose and cry how he had the one real play and it didn't come to fruition cuz no one followed him, just like NEGG meltdown few months ago.",Maybe_Awesome22,4,/r/wallstreetbets/comments/1284b72/where_my_haters_at_youre_gonna_remember_me_i_will/jeizwrx/,0.191,0.692,0.117,-0.4767
124,TSLA, Yeah that’s why I sold my spy and went back into TSLA,Mathguy100,-33,/r/wallstreetbets/comments/1284b72/where_my_haters_at_youre_gonna_remember_me_i_will/jeh8qhn/,0.0,0.82,0.18,0.296
125,PM," I will be messaging you in 7 days on [**2023-04-08 00:28:11 UTC**](http://www.wolframalpha.com/input/?i=2023-04-08%2000:28:11%20UTC%20To%20Local%20Time) to remind you of [**this link**](https://www.reddit.com/r/wallstreetbets/comments/1284b72/where_my_haters_at_youre_gonna_remember_me_i_will/jeh9a67/?context=3)

[**7 OTHERS CLICKED THIS LINK**](https://www.reddit.com/message/compose/?to=RemindMeBot&subject=Reminder&message=%5Bhttps%3A%2F%2Fwww.reddit.com%2Fr%2Fwallstreetbets%2Fcomments%2F1284b72%2Fwhere_my_haters_at_youre_gonna_remember_me_i_will%2Fjeh9a67%2F%5D%0A%0ARemindMe%21%202023-04-08%2000%3A28%3A11%20UTC) to send a PM to also be reminded and to reduce spam.

^(Parent commenter can ) [^(delete this message to hide from others.)](https://www.reddit.com/message/compose/?to=RemindMeBot&subject=Delete%20Comment&message=Delete%21%201284b72)

*****

|[^(Info)](https://www.reddit.com/r/RemindMeBot/comments/e1bko7/remindmebot_info_v21/)|[^(Custom)](https://www.reddit.com/message/compose/?to=RemindMeBot&subject=Reminder&message=%5BLink%20or%20message%20inside%20square%20brackets%5D%0A%0ARemindMe%21%20Time%20period%20here)|[^(Your Reminders)](https://www.reddit.com/message/compose/?to=RemindMeBot&subject=List%20Of%20Reminders&message=MyReminders%21)|[^(Feedback)](https://www.reddit.com/message/compose/?to=Watchful1&subject=RemindMeBot%20Feedback)|
|-|-|-|-|",RemindMeBot,1,/r/wallstreetbets/comments/1284b72/where_my_haters_at_youre_gonna_remember_me_i_will/jeh9dst/,0.105,0.895,0.0,-0.6322
126,TSLA," TSLA is still about 50% below it’s high, and believe it or not has no bearing on BABA’s price or market",Mathguy100,2,/r/wallstreetbets/comments/1284b72/where_my_haters_at_youre_gonna_remember_me_i_will/jek5c8c/,0.0,0.914,0.086,0.2235
127,TSLA, And TSLA will still make shit tons of profit at those lower prices.. try again,Mathguy100,1,/r/wallstreetbets/comments/1284b72/where_my_haters_at_youre_gonna_remember_me_i_will/jek58dw/,0.28,0.58,0.14,-0.4404
128,TSLA," Ask anyone about an EV, and they’ll say, oh you mean a Tesla?

It’s the name and notoriety not the car. 

It’s also the innovation and experimentation. All the other car companies are lazy and slow. 

Each one of them let TSLA dominate the market, and they’re just barely getting traction.

Also, Semi trucks. That’s huge.",Mathguy100,1,/r/wallstreetbets/comments/1284b72/where_my_haters_at_youre_gonna_remember_me_i_will/jek4y1n/,0.067,0.851,0.082,0.2263
129,TSLA," I did, and then rolled it into TSLA",Mathguy100,2,/r/wallstreetbets/comments/1284b72/where_my_haters_at_youre_gonna_remember_me_i_will/jek43pt/,0.0,1.0,0.0,0.0
130,TSLA," It looks like your position in TSLA is doing well today, up 3.21%. However, it is still down 0.74% from when you purchased it. Your breakeven price is $251.36, so you are currently in the red by $8.52 per share",Far_Masterpiece_70xx,66,/r/wallstreetbets/comments/1284b72/where_my_haters_at_youre_gonna_remember_me_i_will/jejjj6w/,0.0,0.845,0.155,0.7003
131,NVDA, Damn should I worry about my NVDA puts I bought today?,HousingAggressive,1,/r/wallstreetbets/comments/1284b72/where_my_haters_at_youre_gonna_remember_me_i_will/jeioocs/,0.444,0.556,0.0,-0.6808
132,TSLA," I’m not saying that $0.60 is ground breaking but for the average results of people posting TSLA YOLO’s on here claiming they’ll get $500,000 as if it’s some certainty, I’d say that this BODES as if their dreams may not come true…That’s all.",Eric_P_MT,-5,/r/wallstreetbets/comments/1284b72/where_my_haters_at_youre_gonna_remember_me_i_will/jej7med/,0.0,0.871,0.129,0.7227
133,BABA, I know that and understand that; BABA about 300% below its high I’m just saying the better choice percentage wise would be baba as you’re saying.,BaBaBuyey,1,/r/wallstreetbets/comments/1284b72/where_my_haters_at_youre_gonna_remember_me_i_will/jek8vg3/,0.0,0.793,0.207,0.7184
134,TA," ""Not the car"" I think you'll find it is the car. Outside of this subreddit of degenerate monkey's people takes the stock market seriously. Your TA is ""TeSlA iS iNnOvAtIvE"" you're in an obscenely good position, stop gambling, be happy with your profits, and sell.",Intelligent_Diet5769,1,/r/wallstreetbets/comments/1284b72/where_my_haters_at_youre_gonna_remember_me_i_will/jekv9u4/,0.072,0.7,0.228,0.8591
135,RH," I'm on an app that only shows the RH screenshot of $35k if there are more pictures I'd have to go on a different app or the website directly to see them, and that's way more work than I'm putting into this",kinglax,1,/r/wallstreetbets/comments/1284b72/where_my_haters_at_youre_gonna_remember_me_i_will/jek4zsu/,0.0,1.0,0.0,0.0
