,ticker,comment,username,score,permalink,neg,neu,pos,compound
0,OP, OP you have enough money to open a managed account with any big bank. They can beat inflation on their returns and net you an extra 3%. Do that. There is no happy ending for you here. The Gods have given you this one last opportunity to walk away before you lose your shirt.,sus-water,16,/r/wallstreetbets/comments/12831el/after_years_of_active_trading_and_thousands_of/jehc496/,0.081,0.811,0.108,0.3818
1,KO, kek look at at this rich bitch with 142k and 61k in reserve at the moment. Just selling weekly covered calls on KO like ol' man buffet will beat that.,Spiritual-Truck-7521,3,/r/wallstreetbets/comments/12831el/after_years_of_active_trading_and_thousands_of/jeh5wc4/,0.101,0.719,0.18,0.4497
2,GAINZ, GAINZ,MayOrMayNotBePie,3,/r/wallstreetbets/comments/12831el/after_years_of_active_trading_and_thousands_of/jeh8n93/,0.0,1.0,0.0,0.0
3,RH, I see you're making that sweet 1.5% from RH on $61K. Must be how you made all your money.,farmtechy,2,/r/wallstreetbets/comments/12831el/after_years_of_active_trading_and_thousands_of/jehdft5/,0.0,0.85,0.15,0.4588
4,IRS," Next, you get to show IRS who’s the boss too as you type in manually all those capital gains v loss entries.

Yelling “OORAH!” as you hit send to efile",rain168,2,/r/wallstreetbets/comments/12831el/after_years_of_active_trading_and_thousands_of/jehpbov/,0.072,0.844,0.084,0.1007
5,RH," The all-time RH is notoriously inaccurate and skewed by your deposits and withdrawals, look for old threads about this as RH has confirmed themselves.",deltama,2,/r/wallstreetbets/comments/12831el/after_years_of_active_trading_and_thousands_of/jej2tm2/,0.0,1.0,0.0,0.0
6,ALL," 4:04 5G ! Investing Refer friend $142,018.68 $57.36 (0.04%) All Time /E 1D 1W 1M 3M YTD 1Y ALL Buying power $61,101.50 > X Introducing Stock Lending 8mo Congrats! You now have access to a passive income opportunity",VisualMod,2,/r/wallstreetbets/comments/12831el/after_years_of_active_trading_and_thousands_of/jegymnz/,0.0,0.718,0.282,0.8953
7,CD, Maybe take that 60k and buy a CD at 5%.  Just think in a year you’ll have like 50x more than all that trading got you.,JJStray,1,/r/wallstreetbets/comments/12831el/after_years_of_active_trading_and_thousands_of/jehx8dg/,0.0,0.902,0.098,0.3612
8,ALL, Up $57 ALL TIME. Did you just get in?,Mr-All-Business2011,1,/r/wallstreetbets/comments/12831el/after_years_of_active_trading_and_thousands_of/jej9shb/,0.0,1.0,0.0,0.0
9,OP, OP has a rare opportunity here to realize that he sucks at this and walk away scot free.  He should just stick to bonds and CDs. But his dumbass won't listen to me,sus-water,183,/r/wallstreetbets/comments/12831el/after_years_of_active_trading_and_thousands_of/jeh9gdb/,0.172,0.724,0.105,-0.5574
10,OP," We will follow the legend to the ends of the earth!
OP, what is the next move o great one?",ImpossibleWar3757,7,/r/wallstreetbets/comments/12831el/after_years_of_active_trading_and_thousands_of/jeh7qar/,0.0,0.804,0.196,0.6588
11,DKNG," i bought $130,000 worth of DKNG @ ~ $45 and then after about a $15,000 loss, i bought 2500 shares of HOOD @ ~ $20",AndrewWKPartyParty2,2,/r/wallstreetbets/comments/12831el/after_years_of_active_trading_and_thousands_of/jehotrn/,0.107,0.701,0.192,0.2023
12,HOOD," i bought $130,000 worth of DKNG @ ~ $45 and then after about a $15,000 loss, i bought 2500 shares of HOOD @ ~ $20",AndrewWKPartyParty2,2,/r/wallstreetbets/comments/12831el/after_years_of_active_trading_and_thousands_of/jehotrn/,0.107,0.701,0.192,0.2023
13,OP," I think your assessment of the hobo benchmark is unfair. A hobo wouldn’t make the mistake of keeping 142k in cash, losing 7% per year due to inflation. A hobo would have spent the money immediately on an appreciating asset (meth). On a purchasing power basis, OP has underperformed the hobo",BobbyTables91,23,/r/wallstreetbets/comments/12831el/after_years_of_active_trading_and_thousands_of/jeic2yo/,0.146,0.757,0.097,-0.4019
14,BE, why would i listen to you when i’m very clearly making money and IT WILL BE DIFFERENT THIS TIME!!!,AndrewWKPartyParty2,234,/r/wallstreetbets/comments/12831el/after_years_of_active_trading_and_thousands_of/jehfxzt/,0.0,0.815,0.185,0.5952
15,IT, why would i listen to you when i’m very clearly making money and IT WILL BE DIFFERENT THIS TIME!!!,AndrewWKPartyParty2,234,/r/wallstreetbets/comments/12831el/after_years_of_active_trading_and_thousands_of/jehfxzt/,0.0,0.815,0.185,0.5952
16,RH," Coming from someone who will take two years of work to make what you have in you RH buying power, marching to the beat of your own drum is easier said than done. But good for you guy",iawsaiatm,0,/r/wallstreetbets/comments/12831el/after_years_of_active_trading_and_thousands_of/jehqcnd/,0.0,0.862,0.138,0.6956
17,AI, Quick! Call the AI ambulance.,grimkhor,2,/r/wallstreetbets/comments/12831el/after_years_of_active_trading_and_thousands_of/jeh0bpl/,0.0,1.0,0.0,0.0
18,RH, He would make almost $600 a month with just cash at RH if he cashed out.,Thencewasit,3,/r/wallstreetbets/comments/12831el/after_years_of_active_trading_and_thousands_of/jejdsw2/,0.0,1.0,0.0,0.0
19,WK, I doubt you’ve learned anything on your trading journey and prob just got back to break even by pure luck but Andrew WK rulez so I support you,sluttyseinfeld,13,/r/wallstreetbets/comments/12831el/after_years_of_active_trading_and_thousands_of/jehgt3w/,0.056,0.73,0.214,0.7173
20,AMC," Oh come on, we all know the people on this sub are all holding a couple hundred Ounces of Ag... myself included.  Once that didn't work, we bought AMC....",Spare_Candy_9772,2,/r/wallstreetbets/comments/12831el/after_years_of_active_trading_and_thousands_of/jek2qjc/,0.0,1.0,0.0,0.0
21,OP, Which is why he mentioned it. OP says that they are an active trader,NeoNeral,7,/r/wallstreetbets/comments/12831el/after_years_of_active_trading_and_thousands_of/jehlgn4/,0.0,0.828,0.172,0.4019
22,BJ, I’ll toss in a BJ too no homo,sluttyseinfeld,-1,/r/wallstreetbets/comments/12831el/after_years_of_active_trading_and_thousands_of/jehst48/,0.268,0.732,0.0,-0.296
23,AAPL," That’s incorrect. The things listed are already happened (or happening) today. 

So if anything, it’s the removal of said events (ie. End of war, more food supply, drop in food prices) that remains to happen and would likely pump the market further when they do. 

I agree though to invest in companies with strong balance sheet, like AAPL or value stocks at a cheap price now like GOOG",rain168,1,/r/wallstreetbets/comments/128ser1/a_difficult_path_for_the_bulls_in_2023/jel2il6/,0.08,0.752,0.168,0.7128
24,GOOG," That’s incorrect. The things listed are already happened (or happening) today. 

So if anything, it’s the removal of said events (ie. End of war, more food supply, drop in food prices) that remains to happen and would likely pump the market further when they do. 

I agree though to invest in companies with strong balance sheet, like AAPL or value stocks at a cheap price now like GOOG",rain168,1,/r/wallstreetbets/comments/128ser1/a_difficult_path_for_the_bulls_in_2023/jel2il6/,0.08,0.752,0.168,0.7128
25,AAPL," Surely if bread and milk are $999.99, then AAPL stock must be well above $999.99?

People don't seem to get that with inflation, stock can go *up* while being worth *less*. We've been flat for a while, and that already means going down in value... With high inflation, staying flat is crashing.",loulan,3,/r/wallstreetbets/comments/128ser1/a_difficult_path_for_the_bulls_in_2023/jekresl/,0.0,0.874,0.126,0.7096
26,EU," If US and EU keep supporting Ukraine, if that stop,  in some months it can be over",LowerDenominator,-1,/r/wallstreetbets/comments/128ser1/a_difficult_path_for_the_bulls_in_2023/jekdy7l/,0.109,0.746,0.144,0.1779
27,DD," The ones that control the market spend millions / billions on psychological manipulation. You have to combat that by sticking with your DD.

The stock market is not black and white -- not based purely on current and projected revs and earnings. It's also about manipulating people so they do things they later regret.

How many times have you heard people say that they sold right before the pop? Or bought right before the stock tanks?

ETA: Point made

[https://www.reddit.com/r/wallstreetbets/comments/127mo55/where\_i\_sold\_my\_calls\_on\_natural\_gas\_this\_week\_to/](https://www.reddit.com/r/wallstreetbets/comments/127mo55/where_i_sold_my_calls_on_natural_gas_this_week_to/)",scott_jr,13,/r/wallstreetbets/comments/12839rs/tired_and_more_scared_after_todays_rally_hold_or/jeh2cno/,0.12,0.88,0.0,-0.8504
28,DD," September is a LONG WAY away, and A LOT can happen in between now and then. You don't make money on these plays overnight, and Decay won't really factor in until later.  I am not going to try to give financial advice, but when you make a long play like this, checking on it everyday isn't going to help. Those are meant to sit back and wait for the market to go through it's next slump, and then this will look WAY different. You have to do what makes you feel safe and comfortable, it's your hard earned money and don't let any ""convince"" you how you should play it. Take a step back, look at the market LONG TERM, where do you see it going? What do you feel comfortable with? Personally I am super Bearish on NVDA as well. Sometimes we make the right play, but it's too early, and it makes us second guess our DD, but the market can be a fickle and cruel bitch that way sometimes.

Do more research, check P&E, check YoY growth, check RSI,  do the research; charts and research never lie, it just may take longer than expected to see the results, because NO ONE can time the market perfectly. 

What do I know, I'm just another schlep on here, not a financial advisor. Goodluck brother; I hope this turns around for you.",Mr-Java-,17,/r/wallstreetbets/comments/12839rs/tired_and_more_scared_after_todays_rally_hold_or/jehsn4k/,0.076,0.747,0.177,0.9827
29,NVDA," September is a LONG WAY away, and A LOT can happen in between now and then. You don't make money on these plays overnight, and Decay won't really factor in until later.  I am not going to try to give financial advice, but when you make a long play like this, checking on it everyday isn't going to help. Those are meant to sit back and wait for the market to go through it's next slump, and then this will look WAY different. You have to do what makes you feel safe and comfortable, it's your hard earned money and don't let any ""convince"" you how you should play it. Take a step back, look at the market LONG TERM, where do you see it going? What do you feel comfortable with? Personally I am super Bearish on NVDA as well. Sometimes we make the right play, but it's too early, and it makes us second guess our DD, but the market can be a fickle and cruel bitch that way sometimes.

Do more research, check P&E, check YoY growth, check RSI,  do the research; charts and research never lie, it just may take longer than expected to see the results, because NO ONE can time the market perfectly. 

What do I know, I'm just another schlep on here, not a financial advisor. Goodluck brother; I hope this turns around for you.",Mr-Java-,17,/r/wallstreetbets/comments/12839rs/tired_and_more_scared_after_todays_rally_hold_or/jehsn4k/,0.076,0.747,0.177,0.9827
30,RSI," September is a LONG WAY away, and A LOT can happen in between now and then. You don't make money on these plays overnight, and Decay won't really factor in until later.  I am not going to try to give financial advice, but when you make a long play like this, checking on it everyday isn't going to help. Those are meant to sit back and wait for the market to go through it's next slump, and then this will look WAY different. You have to do what makes you feel safe and comfortable, it's your hard earned money and don't let any ""convince"" you how you should play it. Take a step back, look at the market LONG TERM, where do you see it going? What do you feel comfortable with? Personally I am super Bearish on NVDA as well. Sometimes we make the right play, but it's too early, and it makes us second guess our DD, but the market can be a fickle and cruel bitch that way sometimes.

Do more research, check P&E, check YoY growth, check RSI,  do the research; charts and research never lie, it just may take longer than expected to see the results, because NO ONE can time the market perfectly. 

What do I know, I'm just another schlep on here, not a financial advisor. Goodluck brother; I hope this turns around for you.",Mr-Java-,17,/r/wallstreetbets/comments/12839rs/tired_and_more_scared_after_todays_rally_hold_or/jehsn4k/,0.076,0.747,0.177,0.9827
31,AI," You’ll be fine, I like NVDA but it’s overbought. I’m 100% not going to fomo into NVDA or MSFT just cause of AI hype. Nothing is going change fundamentally for both companies in the short term. NVDA still a GPU developer and MSFT still who they are with a bunch of failed products, BING is still shit, I still use google. Right now almost feels like NVDA is the new TSLA with 20 years of earnings priced into the stock.",VentriTV,21,/r/wallstreetbets/comments/12839rs/tired_and_more_scared_after_todays_rally_hold_or/jehcjgi/,0.108,0.818,0.074,-0.714
32,MSFT," You’ll be fine, I like NVDA but it’s overbought. I’m 100% not going to fomo into NVDA or MSFT just cause of AI hype. Nothing is going change fundamentally for both companies in the short term. NVDA still a GPU developer and MSFT still who they are with a bunch of failed products, BING is still shit, I still use google. Right now almost feels like NVDA is the new TSLA with 20 years of earnings priced into the stock.",VentriTV,21,/r/wallstreetbets/comments/12839rs/tired_and_more_scared_after_todays_rally_hold_or/jehcjgi/,0.108,0.818,0.074,-0.714
33,NVDA," You’ll be fine, I like NVDA but it’s overbought. I’m 100% not going to fomo into NVDA or MSFT just cause of AI hype. Nothing is going change fundamentally for both companies in the short term. NVDA still a GPU developer and MSFT still who they are with a bunch of failed products, BING is still shit, I still use google. Right now almost feels like NVDA is the new TSLA with 20 years of earnings priced into the stock.",VentriTV,21,/r/wallstreetbets/comments/12839rs/tired_and_more_scared_after_todays_rally_hold_or/jehcjgi/,0.108,0.818,0.074,-0.714
34,TSLA," You’ll be fine, I like NVDA but it’s overbought. I’m 100% not going to fomo into NVDA or MSFT just cause of AI hype. Nothing is going change fundamentally for both companies in the short term. NVDA still a GPU developer and MSFT still who they are with a bunch of failed products, BING is still shit, I still use google. Right now almost feels like NVDA is the new TSLA with 20 years of earnings priced into the stock.",VentriTV,21,/r/wallstreetbets/comments/12839rs/tired_and_more_scared_after_todays_rally_hold_or/jehcjgi/,0.108,0.818,0.074,-0.714
35,AI, Shorting into what is probably developing into a massive of AI bubble. Smart.,Curiousdude925,8,/r/wallstreetbets/comments/12839rs/tired_and_more_scared_after_todays_rally_hold_or/jeh3687/,0.0,0.803,0.197,0.4019
36,NVDA, NVDA is coming down soon - now that Q1 is over there’s going to be plenty of profit taking. May get up to like $280-285 but then it’s going to come down like a rock. Hang tight,vwxyzabcdef,5,/r/wallstreetbets/comments/12839rs/tired_and_more_scared_after_todays_rally_hold_or/jehdazk/,0.0,0.822,0.178,0.714
37,AI," Shorting NVDA is complicated, it's highly correlated with alternative ""investments"", like shitcoins. 

* If the stock market collapses, but shitcoins are up, it may still go up. 
* If something happens to Taiwan and China, this will create a shortage of chips and it can also go up. 
* GPU is often used to train AI, and AI is trending, so it can go up. 

Honestly, you'd be much safer shorting tech stocks or SPY.",artemiusgreat,9,/r/wallstreetbets/comments/12839rs/tired_and_more_scared_after_todays_rally_hold_or/jeh9pte/,0.05,0.8,0.149,0.8402
38,NVDA," Shorting NVDA is complicated, it's highly correlated with alternative ""investments"", like shitcoins. 

* If the stock market collapses, but shitcoins are up, it may still go up. 
* If something happens to Taiwan and China, this will create a shortage of chips and it can also go up. 
* GPU is often used to train AI, and AI is trending, so it can go up. 

Honestly, you'd be much safer shorting tech stocks or SPY.",artemiusgreat,9,/r/wallstreetbets/comments/12839rs/tired_and_more_scared_after_todays_rally_hold_or/jeh9pte/,0.05,0.8,0.149,0.8402
39,NVDA, The sub got bearish on NVDA at the absolutely worst time lmao,CockBlockingLawyer,2,/r/wallstreetbets/comments/12839rs/tired_and_more_scared_after_todays_rally_hold_or/jehbnwq/,0.237,0.539,0.224,-0.0591
40,NVDA, Next resistance is probs going to be psychologically the $300 level. You guys do a weird style of trading…like who tf shorts NVDA during a tech led market rally? Look at a chart of NVDA on any timeframe and tell me you want to short it and I’ll feed you my entire Crayola 128 pack(yes I’m balling).,DixieNormaz,2,/r/wallstreetbets/comments/12839rs/tired_and_more_scared_after_todays_rally_hold_or/jehdq4f/,0.031,0.945,0.024,-0.1027
41,NVDA, NVDA is overbought and overvalued so I bought calls,ztw2002,2,/r/wallstreetbets/comments/12839rs/tired_and_more_scared_after_todays_rally_hold_or/jehe7ax/,0.0,1.0,0.0,0.0
42,NVDA, *Sells puts* NVDA drops $40 the next minute. *Rebuys puts* NVDA Jumps $100.,modeststeve16,2,/r/wallstreetbets/comments/12839rs/tired_and_more_scared_after_todays_rally_hold_or/jek8jd1/,0.0,1.0,0.0,0.0
43,AMD," Brother in regard, consider trading AMD options. They trade in parallel with NVDA, just without the  ""regard-premium"" built into the IV.

&#x200B;

With that said, im balls deep in NVDA May 05 250p. We're bent over this table together...",ccz005,2,/r/wallstreetbets/comments/12839rs/tired_and_more_scared_after_todays_rally_hold_or/jeh9f43/,0.0,1.0,0.0,0.0
44,NVDA," Brother in regard, consider trading AMD options. They trade in parallel with NVDA, just without the  ""regard-premium"" built into the IV.

&#x200B;

With that said, im balls deep in NVDA May 05 250p. We're bent over this table together...",ccz005,2,/r/wallstreetbets/comments/12839rs/tired_and_more_scared_after_todays_rally_hold_or/jeh9f43/,0.0,1.0,0.0,0.0
45,AI," All the bulls saying sell and run you are an idiot and all the bears saying Nvidia will not be the only leader in the AI hardware space, trust me when I say Lisa Sue and others including Apple, Meta, Google, Intel, and hundreds of others will have their hands in the pot.  PE is higher than Ive ever seen for a large cap this includes tesla at its highs.  Company rides every hype train the past 5 years look it up clowns",McLovin-stocks,1,/r/wallstreetbets/comments/12839rs/tired_and_more_scared_after_todays_rally_hold_or/jei4f2s/,0.039,0.922,0.039,0.0
46,NVDA," First, it's not ""Loss"" because you haven't sold it yet.  
Second, the answer is ""sell"" , simply because you have no guts to hold.   
And the last but not least, everybody here is saying it's ""overbought"" , ""P/E is high"" etc, well, you'll be all crying fools when Jensen will do stock split. Stock split should be 'non-event' because nothing changes in fundamentals, or business model but nevertheless stock jumps and goes even higher and higher. It's ridiculous nonsense but it's market reality.    
Jensen will outfox all the doubters of NVDA.    
And you, in particular, will have a nightmare of illiquid options - you won't be able to roll them, or turn them into spreads , and because after the split only new options will be written and traded , you will have only one choice to sell and MMs know this and will make fun of you.",surrealskiller,0,/r/wallstreetbets/comments/12839rs/tired_and_more_scared_after_todays_rally_hold_or/jehkhcx/,0.123,0.833,0.044,-0.9136
47,AI," ngl i did not expect nvidia to break $270 and still keep going but that’s tech for ya. there’s a solid chance it’s gonna have a hard time breaking $277 though and still trending well above vwap so maybe. 

I kinda thought with the “tech leaders” calling for a halt on AI that it would slow this AI shit down but damn never mind that lol. I’m gonna see how monday goes and might buy some puts on nvidia from there we’ll see.",SynBeats,0,/r/wallstreetbets/comments/12839rs/tired_and_more_scared_after_todays_rally_hold_or/jehm387/,0.143,0.779,0.077,-0.7905
48,MU, Look at MU earnings report because it was shit. NVDA will be the same way. You have plenty of time but also down a lot. Preserve the capital if you really can’t afford to lose it.,BigBlue211,1,/r/wallstreetbets/comments/12839rs/tired_and_more_scared_after_todays_rally_hold_or/jehb124/,0.151,0.849,0.0,-0.705
49,NVDA, Look at MU earnings report because it was shit. NVDA will be the same way. You have plenty of time but also down a lot. Preserve the capital if you really can’t afford to lose it.,BigBlue211,1,/r/wallstreetbets/comments/12839rs/tired_and_more_scared_after_todays_rally_hold_or/jehb124/,0.151,0.849,0.0,-0.705
50,NVDA," definitely hold, NVDA will fall hard",siberianjaguar123,1,/r/wallstreetbets/comments/12839rs/tired_and_more_scared_after_todays_rally_hold_or/jehcw51/,0.173,0.494,0.333,0.3182
51,NVDA, I’ll buy some NVDA tomorrow that way you can prolly hit your pits in a week,berriesn-cream,1,/r/wallstreetbets/comments/12839rs/tired_and_more_scared_after_todays_rally_hold_or/jehew9a/,0.0,1.0,0.0,0.0
52,AI, you buying puts when legit the hype is AI right now lmaoooo,Substantial-Tax-8659,1,/r/wallstreetbets/comments/12839rs/tired_and_more_scared_after_todays_rally_hold_or/jehgpds/,0.0,1.0,0.0,0.0
53,NVDA," I sold my position in NVDA at 260 looking at the P/E but I’m not confident enough to buy a put. Also I’m kicking myself for not keeping half my position so I could have benefited from the run up. 

My guess was that SVB would lead to more bank issues, but the Fed discount window seems to have bailed out the shaky banks. This has happened twice in recent memory where the Fed rescued the market at the start of the pandemic and I sold before the Fed stepped in.",yelloworld1947,1,/r/wallstreetbets/comments/12839rs/tired_and_more_scared_after_todays_rally_hold_or/jehkirl/,0.062,0.898,0.04,-0.2714
54,AI," Meh 9/15, average down at the next top

I can draw you a picture if you want to see. 😂

Edit: AI has taken over my phone and will only allow me to talk text. Also, all hail AI!",VahallaViking,1,/r/wallstreetbets/comments/12839rs/tired_and_more_scared_after_todays_rally_hold_or/jehl5uu/,0.033,0.797,0.169,0.5093
55,NVDA," I have been burned by it but much smaller positions and closer expiry. The all time high was 330 in Nov 2021, it's around 18% away from that right now. So rally probably has some room to go (and your loss will likely increase) in the short term.

But the stock is definetly overpriced, and there is a lot of macro economic events coming in the summer that could jolt the market and NVDA might retrace atleast to August 2022 rally levels of 190. Also note that NVDA slide last year started in April and this year too there is some negative news coming from China (Micron). 

In 2022, Nvidia made almost 60% of its revenue from China and Taiwan. That's a big risk given that Biden administration is turning on the heat on China in terms of semiconductor leadership and in turn China wanting to support Chinese semiconductor companies (example Moore Threads).",Silly_Escape13,1,/r/wallstreetbets/comments/12839rs/tired_and_more_scared_after_todays_rally_hold_or/jehpe3o/,0.066,0.911,0.022,-0.7964
56,NVDA, Damn bro. You really went hard against NVDA,rjsheine,1,/r/wallstreetbets/comments/12839rs/tired_and_more_scared_after_todays_rally_hold_or/jehvbw9/,0.422,0.578,0.0,-0.5233
57,IMO," Don’t buy so many different strikes with the same expiration, IMO consolidate your trading plan, also makes sales and management of them easier",StarshipMars,1,/r/wallstreetbets/comments/12839rs/tired_and_more_scared_after_todays_rally_hold_or/jehvdvj/,0.104,0.791,0.105,0.0094
58,NVDA," ...Imagine if those puts were in blood bath and beyond....

You know.... a company on the brink of bankruptcy..... 

as opposed to NVDA.... a mega growth profitable successful company.....",Thick-Conclusion-499,1,/r/wallstreetbets/comments/12839rs/tired_and_more_scared_after_todays_rally_hold_or/jei1qwa/,0.0,0.721,0.279,0.8519
59,OP, Staying solvent I see. Capital preservation > hope. Ffs OP lost his mind and ass on this one.,dwoj206,1,/r/wallstreetbets/comments/12839rs/tired_and_more_scared_after_todays_rally_hold_or/jei1vdt/,0.392,0.49,0.118,-0.7717
60,AI, Seriously what kind of imbecile bets against Nvidia in this time. AI is red hot and they dominate the market for what powers it.,nukedkaltak,1,/r/wallstreetbets/comments/12839rs/tired_and_more_scared_after_todays_rally_hold_or/jei3jbp/,0.242,0.758,0.0,-0.6901
61,NVDA," Man I hate to say it, but even Cramer isn’t regarded enough to short NVDA.",Rich_Potato_2457,1,/r/wallstreetbets/comments/12839rs/tired_and_more_scared_after_todays_rally_hold_or/jei5o0g/,0.153,0.847,0.0,-0.3291
62,AI, Your post inspired me to share mine. Now both of our posts are now trending on WSB. 👀We’re spreading the good word on this AI craze 🫶,themetamoose,1,/r/wallstreetbets/comments/12839rs/tired_and_more_scared_after_todays_rally_hold_or/jei5qvz/,0.05,0.69,0.26,0.7717
63,AI, why would NVIDIA go down now? They are still in the hype phase of AI it will last at least a year,neutralpoliticsbot,1,/r/wallstreetbets/comments/12839rs/tired_and_more_scared_after_todays_rally_hold_or/jei7k54/,0.0,1.0,0.0,0.0
64,AI," Shorting nvda in the age of AI. Good luck, you belong here.",RandomWalk85,1,/r/wallstreetbets/comments/12839rs/tired_and_more_scared_after_todays_rally_hold_or/jeii0av/,0.0,0.629,0.371,0.7096
