,ticker,comment,username,score,permalink,neg,neu,pos,compound
0,AKA," If banks don't invest their money they lose on ""unrealized profit"". AKA opportunity cost. This is especially true in times of inflation, they would be losing money like the rest of us plebs. So they invest as much as possible, knowing that if lose they will just get bailouts. 

Who needs risk management when you can't lose?",Unlikely_Memery_2974,1,/r/wallstreetbets/comments/11u7jer/sums_it_up/jcpwpcr/,0.182,0.698,0.12,-0.5279
1,IT," the IT lord has spoken, those who have shall receive!",Creeyu,43,/r/wallstreetbets/comments/11u7jer/sums_it_up/jcogir2/,0.0,1.0,0.0,0.0
2,FRC, Listen man I bought FRC calls I'll yank tug pull on credit.,HummerGuy69,6,/r/wallstreetbets/comments/11u7jer/sums_it_up/jcmujuq/,0.0,0.794,0.206,0.3818
3,CC, You say this but the point of the application is to weed out people likely to default. The fact that the interest rate on CC are high is because of the default/collection costs.,eriverside,4,/r/wallstreetbets/comments/11u7jer/sums_it_up/jcoqwum/,0.0,0.889,0.111,0.6124
4,CC," I had a secured Discover card, and they upgraded it to a 2k limit (from 500) and I still got denied a CC months later by my own bank. Credit score 704. Only 8 months of credit history though.",Tigerscar123,9,/r/wallstreetbets/comments/11u7jer/sums_it_up/jcp3esv/,0.073,0.729,0.198,0.6124
5,OP, I hope OP also realizes that he is stealing air from Elon Musk too.  Luckily Elon is intelligent enough to let others share the air that is actually rightfully his.,jeffdanielsson,2,/r/wallstreetbets/comments/11u7jer/sums_it_up/jcpapat/,0.095,0.614,0.292,0.7717
6,CC," Yeah they'll just get more money with interests, it's 100% profitable to give young people a CC they can't really handle yet. I learned the hard way and still learning for a while...",tankred420caza,1,/r/wallstreetbets/comments/11u7jer/sums_it_up/jcpfwzm/,0.04,0.748,0.212,0.7152
7,CC, Most dealers won’t take anything over 5k on CC because of fees,Anxious_Possession_4,5,/r/wallstreetbets/comments/11u7jer/sums_it_up/jcop7hy/,0.0,1.0,0.0,0.0
8,AMT," Well, it's what the government does to people who have an AMT greater than zero, yes.",RedditAcctSchfifty5,1,/r/wallstreetbets/comments/11u7jer/sums_it_up/jcpcxgf/,0.0,0.64,0.36,0.743
9,CC," You likely can’t, and cash advance on a CC is a really high interest rate. 

Maybe ask your friends, like hey if you need to buy a MacBook/iPhone, computer etc you’d buy it for them so you get the points and cash.  Or ask them want they want on Amazon, you buy and ship it to them. 

Enough of these buys and you’ll have enough for a car. At 0% for 18 months",moldyjellybean,1,/r/wallstreetbets/comments/11u7jer/sums_it_up/jcorlhw/,0.0,0.827,0.173,0.8801
10,ARE," PUT YOUR HANDS UP LegitimateGift1792!!! POLICE ARE ENROUTE! PREPARE TO BE BOOKED FOR PROVIDING ILLEGAL FINANCIAL ADVICE!

*I am a bot, and this action was performed automatically. Please [contact the moderators of this subreddit](/message/compose/?to=/r/wallstreetbets) if you have any questions or concerns.*",AutoModerator,10,/r/wallstreetbets/comments/11u7jer/sums_it_up/jcox2oh/,0.12,0.83,0.05,-0.6371
11,FOR," PUT YOUR HANDS UP LegitimateGift1792!!! POLICE ARE ENROUTE! PREPARE TO BE BOOKED FOR PROVIDING ILLEGAL FINANCIAL ADVICE!

*I am a bot, and this action was performed automatically. Please [contact the moderators of this subreddit](/message/compose/?to=/r/wallstreetbets) if you have any questions or concerns.*",AutoModerator,10,/r/wallstreetbets/comments/11u7jer/sums_it_up/jcox2oh/,0.12,0.83,0.05,-0.6371
12,FRC, Save some room on there for FRC ![img](emote|t5_2th52|29093),Wedgtable,46,/r/wallstreetbets/comments/11ukpfj/bank_failures_20012023_inflation_adjusted/jcolj1w/,0.0,0.667,0.333,0.5411
13,VC," The biggest institution in this case SVB is #16 in the country and below $250bln, so this is nothing like what happened when all 10 of the biggest lenders were in trouble in 2009.

The issue was subprime with $1trln-$2trln, so it touched every institution in the system. Loans going bad to borrowers who should have never qualified, impacting all banks. Nothing close to this is happening today.

We’ve had aggressive expansion especially in the last 3 years and with that there’s naturally going to be some trash that needs to be taken out. The 2023 event impacts a few regional lenders, that’s not necessarily the sign of a broader systematic issue like 2009. 

It makes sense these lenders are the first to go down, they may not be the last, but they’re all related to tech, a capital intensive industry, especially when you consider newer start ups and research firms which these banks catered to. In other words, companies hoping to make money next year, or the year after that, because they’re not making money today. They don’t have to have any income and when capital costs rise these companies have issues and thus their banks also see issues.

Tech has has a boom since Covid when everyone including businesses bought softwares and various tech to work remotely and work from home and meet Covid restrictions. There should have been expectations for somewhat of a tech slowdown just because of this. 

Normally, bank runs or crashes are stemming from the loan side. There’s been a capital or liquidity crunch sure, but in the tech start up space, these kinds of companies don’t go get normal loans. They get financing from venture capital. VC has less capital to throw around, and these startups have to draw down their own cash so this is a deposit issue for the banks not a lending portfolio issue. At the end of the day these banks didn’t have enough operational cash to meet their needs.

Typically bank and financial industry meltdown exposure are fueled by loans. Loans that are sold from one institution to another, the secondary market, MBS, etc. this is not the case today so the overall exposure to the entire industry is low. 

Sure, any banks that continued to buy short term bonds in an aggressively rising rate environment would be in trouble. They’d also have to completely ignore best industry practices, ignore what rates have been doing for the last year, and have no asset liability management and insufficient portfolio and pipeline hedging. And they have $2trln “line” secured by bonds lent out at face value.  15% of that has been used (low advance rate) with 5% concentrated in SVB alone, which we know is in a liquidity tech related crunch. 

Bad for the tech industry and venture capital. Not as nightmare mode for the banks and financial companies.",UCACashFlow,38,/r/wallstreetbets/comments/11ukpfj/bank_failures_20012023_inflation_adjusted/jcp0om4/,0.073,0.877,0.05,-0.763
14,FRC," Next will be FRC, Silvergate, Credit Suisse. Just my opinion.",BuySellHoldFinance,13,/r/wallstreetbets/comments/11ukpfj/bank_failures_20012023_inflation_adjusted/jcoroct/,0.0,0.776,0.224,0.3818
15,OP," Nice work, OP. Illuminating and informative.",BirdEducational6226,2,/r/wallstreetbets/comments/11ukpfj/bank_failures_20012023_inflation_adjusted/jcp7wfx/,0.0,0.641,0.359,0.4215
16,GD," I’m loving all these bubble graphics, but just for fun can we get a longer timeline. Like how did GD 1928 compare or the flash crash in 62 or 87",magictie-,1,/r/wallstreetbets/comments/11ukpfj/bank_failures_20012023_inflation_adjusted/jcpkive/,0.092,0.646,0.262,0.765
17,PNC, Where would PNC be?,WTMCMaher,1,/r/wallstreetbets/comments/11ukpfj/bank_failures_20012023_inflation_adjusted/jcpmihh/,0.0,1.0,0.0,0.0
18,OP, OP missed Fraud Republic Bank wo the $30B bailout,mrbiscuits24,1,/r/wallstreetbets/comments/11ukpfj/bank_failures_20012023_inflation_adjusted/jcqfgk9/,0.552,0.448,0.0,-0.7506
19,UBS," Credit Suisse is trying, but UBS has other things in mind...",oganira,46,/r/wallstreetbets/comments/11ukpfj/bank_failures_20012023_inflation_adjusted/jcpo8os/,0.0,0.847,0.153,0.2023
20,FRC," Nah man, FRC will get their bailout, fed really can't afford another bank failure right now, they just won't call it a bailout and we won't know the terms",Wander21,37,/r/wallstreetbets/comments/11ukpfj/bank_failures_20012023_inflation_adjusted/jcolx6b/,0.238,0.762,0.0,-0.6705
21,FRC, I don’t understand. Why is FRC failing?,scooptyy,3,/r/wallstreetbets/comments/11ukpfj/bank_failures_20012023_inflation_adjusted/jcqgzmx/,0.398,0.602,0.0,-0.5106
22,CS," If frc and CS go under after their unsecured loans by the others we will have the greatest depression ever and inflation will go to 20%.

They’re going to pump federal money into it and lock in a sweet 8% inflation for the next 2-3 years and avoid it all",johnnyfitzbra,24,/r/wallstreetbets/comments/11ukpfj/bank_failures_20012023_inflation_adjusted/jcp0i0f/,0.142,0.737,0.121,-0.0772
23,CS, CS already has state backed liquidity.,mikebailey,6,/r/wallstreetbets/comments/11ukpfj/bank_failures_20012023_inflation_adjusted/jcpgsfv/,0.0,0.82,0.18,0.0258
24,OP, They mean OP has a bank fetish and chooses to ignore the entire rest of the financial sector because it would undermine his narrative,Women_Ruined_Slavery,5,/r/wallstreetbets/comments/11ukpfj/bank_failures_20012023_inflation_adjusted/jcqmi08/,0.183,0.817,0.0,-0.5719
25,STEP, STEP BANK!!! WHAT ARE YOU DOING?!?!?,hysys_whisperer,15,/r/wallstreetbets/comments/11ukpfj/bank_failures_20012023_inflation_adjusted/jcq4v37/,0.0,1.0,0.0,0.0
26,YOU, STEP BANK!!! WHAT ARE YOU DOING?!?!?,hysys_whisperer,15,/r/wallstreetbets/comments/11ukpfj/bank_failures_20012023_inflation_adjusted/jcq4v37/,0.0,1.0,0.0,0.0
27,TIL, TIL.  Bear Stearns too?,qwertylicious2003,27,/r/wallstreetbets/comments/11ukpfj/bank_failures_20012023_inflation_adjusted/jcpm29t/,0.0,1.0,0.0,0.0
28,MF, Was MF global a deposit taker?,FruxyFriday,2,/r/wallstreetbets/comments/11ukpfj/bank_failures_20012023_inflation_adjusted/jcq3ior/,0.0,1.0,0.0,0.0
29,JPM, Technically they are getting bailed out by JPM. Which if fine. Private businesses can bailout other private businesses. The problem is when taxpayers are forced to participate.,FruxyFriday,10,/r/wallstreetbets/comments/11ukpfj/bank_failures_20012023_inflation_adjusted/jcq3tbb/,0.223,0.721,0.056,-0.6486
30,VC," Not to equal extents across the board, no. Have loan rates and deposit and wealth management rates been impacted? Yes. But like I said the banks being impacted are in very tech/VC specific situations, not general or systematic situations. 

But banks also have the backstop of the Fed and fdic right now, and the top 5 banks are benefitting the most of all. They’re seeing large inflows of commercial and retail deposit relationships from smaller institutions due to their perceived stability. They would have never put such a low return deposit into first republic without all their deposits being fully covered by FDIC. So basically the top 5 banks have the backing of the government right now.",UCACashFlow,13,/r/wallstreetbets/comments/11ukpfj/bank_failures_20012023_inflation_adjusted/jcp3sep/,0.013,0.836,0.151,0.9351
31,FREE, This guy preaches “Lessons” - YOU belong here! The only lesson here is FREE CASH for Banks,jtwh20,1,/r/wallstreetbets/comments/11ukpfj/bank_failures_20012023_inflation_adjusted/jcp2mgm/,0.0,0.776,0.224,0.6514
32,YOU, This guy preaches “Lessons” - YOU belong here! The only lesson here is FREE CASH for Banks,jtwh20,1,/r/wallstreetbets/comments/11ukpfj/bank_failures_20012023_inflation_adjusted/jcp2mgm/,0.0,0.776,0.224,0.6514
33,STEP, MOTHER BANK!?! STEP BANK IS STUCK INSIDE OF ME!!!,oganira,9,/r/wallstreetbets/comments/11ukpfj/bank_failures_20012023_inflation_adjusted/jcq5ca2/,0.284,0.716,0.0,-0.4885
34,CS," CS has 500B+ in assets, and 1T+ in AUM. Market cap is tiny because it's not a great investment, but don't let it fool you that CS is still massive",arenalr,17,/r/wallstreetbets/comments/11ukpfj/bank_failures_20012023_inflation_adjusted/jcq3yh3/,0.066,0.797,0.137,0.3208
35,IQ," 30 years lol. These banks were buying 30 year bonds yielding 2% during hyper inflation. They were actually getting a LOWER yield than they could get buying 6 month bonds, because they were so convinced that 2% was a steal and yields would go lower soon.

We have people with an IQ of 50 (legally regarded) making all of our financial decisions. The system has to fail, so someone who is even average intelligence can survive and thrive.",__WallstreetRetard__,84,/r/wallstreetbets/comments/11ukpfj/bank_failures_20012023_inflation_adjusted/jcpkj9r/,0.133,0.762,0.105,-0.3489
36,CS," CS is the bank of oligarchs, corporate overlords and mob bosses.",realmastodon2,1,/r/wallstreetbets/comments/11ukpfj/bank_failures_20012023_inflation_adjusted/jcqa8xe/,0.0,1.0,0.0,0.0
37,DO," The fed: DO NOT BUY THIS
banks: but what if we do?",GodKingDingus,7,/r/wallstreetbets/comments/11ukpfj/bank_failures_20012023_inflation_adjusted/jcpsu2k/,0.0,1.0,0.0,0.0
38,LOVE," I love how people just gloss over “to a consumer” in your comment. 

I don’t give a single flying fuck whether a bank turns a profit or not. I want the USPS to offer banking services at cost, and I would LOVE to have banking be a low or no-profit industry. 

“But but but then they don’t have money for loans!” Our government literally prints money. Any bank that needs to be “bailed out” should be nationalized and turned into a vehicle for loan processing. 

Obviously more complex than all that, but good god. Fuck banks. With some imagination and willpower, we could live in a very different financial landscape.",ThePowellMemo1984,11,/r/wallstreetbets/comments/11ukpfj/bank_failures_20012023_inflation_adjusted/jcpwi8o/,0.085,0.79,0.126,0.6856
39,ML," I went to the comments for the same question as you; as someone who teaches Data Science/ML etc, I was perplexed by this insufficient graph.",stillworkin,3,/r/wallstreetbets/comments/11ukpfj/bank_failures_20012023_inflation_adjusted/jcq50p6/,0.095,0.905,0.0,-0.3182
40,LOVE," > I would LOVE to have banking be a low or no-profit industry.

Yup, exactly. It should cover expenses and then turn a small profit for the people running it. That's it. If that was the case, failed banks caused by bank runs would be a once in a *century+* event. Instead, this is twice in 10-15 years we're seeing massive banks fail and it's because these are publicly traded companies trying to maximize profits. They are taking risks that screw over *millions* of people when they're wrong for the sake of lining their own pockets.",LeSeanMcoy,5,/r/wallstreetbets/comments/11ukpfj/bank_failures_20012023_inflation_adjusted/jcpxbys/,0.145,0.755,0.1,-0.4151
41,IMO," But that being said, the premise of OP is generally still correct IMO.
The feds are trying to triage it’s goals - fighting hyperinflation, unemployment and to mitigate other negative impacts to the economy by allowing for a short term, backstop/capital infusion, which in turn does cause short term inflationary risks but long term net deflation (compared to the massive risk of widespread bank failures if they failed to act). It’s an opportunity cost.

Imagine the amount of “printed money” that would be required if first republic fails, and causes further ripple effects on other banking institutions that then force the feds to cover the losses.

It’s basically the same idea as preventative care coverage as a net profit drive to health insurance carriers. It’s much easier to keep you healthy with relatively smaller measures than spend a fortune later on terminal widespread care.",Simple-Truth-6590,1,/r/wallstreetbets/comments/11ukpfj/bank_failures_20012023_inflation_adjusted/jcq9ba4/,0.183,0.689,0.129,-0.8674
42,OP," But that being said, the premise of OP is generally still correct IMO.
The feds are trying to triage it’s goals - fighting hyperinflation, unemployment and to mitigate other negative impacts to the economy by allowing for a short term, backstop/capital infusion, which in turn does cause short term inflationary risks but long term net deflation (compared to the massive risk of widespread bank failures if they failed to act). It’s an opportunity cost.

Imagine the amount of “printed money” that would be required if first republic fails, and causes further ripple effects on other banking institutions that then force the feds to cover the losses.

It’s basically the same idea as preventative care coverage as a net profit drive to health insurance carriers. It’s much easier to keep you healthy with relatively smaller measures than spend a fortune later on terminal widespread care.",Simple-Truth-6590,1,/r/wallstreetbets/comments/11ukpfj/bank_failures_20012023_inflation_adjusted/jcq9ba4/,0.183,0.689,0.129,-0.8674
43,DFS, I can't time anything fucking right. Literally sold ethereum to buy DFS a while back. Fuck me.,Future_Ad_2632_,54,/r/wallstreetbets/comments/11uhcs7/btc_is_20_up_in_5_days_30_down_in_1_year/jcoik3a/,0.2,0.8,0.0,-0.5423
44,MSTR," Me buys MSTR call Wednesday for 1k, sell Thursday morning for 850, watches MSTR rally with bitcoin all the rest of Thursday. Checked today currently 2700 for the 250 3/24 call and is up 7 in the after hours. Thank god my Signature bank put went through and I was able to exercise Friday!!",LitThatFireTV,37,/r/wallstreetbets/comments/11uhcs7/btc_is_20_up_in_5_days_30_down_in_1_year/jcoe68b/,0.0,0.906,0.094,0.6351
45,VS, Wanna see the Dogecoin VS Credit Suisse 5Y chart...,the_great_red_panda,14,/r/wallstreetbets/comments/11uhcs7/btc_is_20_up_in_5_days_30_down_in_1_year/jcp5oau/,0.0,0.755,0.245,0.3818
46,DD, Go look at tether market cap - exploded this week with billion dollar buys. Go do any DD on tether and tell me that isn’t a house of cards built on a shit sandwich. Tether is a huge part of crypto liquidity. That shit is headed for trouble.,Monster_Grundle,33,/r/wallstreetbets/comments/11uhcs7/btc_is_20_up_in_5_days_30_down_in_1_year/jcp61by/,0.19,0.766,0.044,-0.8225
47,AAPL," I wonder if Bitcoin is too concentrated in a few owners so that it could be manipulated. 

You could have an entity with a several billion of btc, pump it by 5% to 20%, maybe a billion or so purchases, it rapidly goes up then slowly sell at the top price as people assume it will go to the moon and this is it, and then sell and dump, converting back to cash. People panic sell. They start accumulating again for the next pump. Buy low, sell high. Manipulate by parabolic moves up and down.

All of Bitcoin minus the first million is worth less than AAPL 400 billion? Given a lot of hodlers, I wonder if it would only take ten billion or twenty billion to pump it up and dump it in parabolic moves?",Dothemath2,-1,/r/wallstreetbets/comments/11uhcs7/btc_is_20_up_in_5_days_30_down_in_1_year/jcobil5/,0.097,0.877,0.026,-0.8708
48,ICE, Crypto is the future. Banks are the past. It’s just like the ICE car transition to EV’s. And also just like that the transaction will be slow & a lot of morons will fight it & cry about it the whole way. But it’s inevitable at this point.,ThePugz,1,/r/wallstreetbets/comments/11uhcs7/btc_is_20_up_in_5_days_30_down_in_1_year/jcql7el/,0.112,0.816,0.071,-0.25
49,AAPL," Hmmm, ok.  The parabolic moves are interesting, they go up and down with huge price movements, it looks like an asset or stock with less volume or liquidity like an obscure stock or a meme stock but not a GLD or SPY or larger stock like AAPL.",Dothemath2,1,/r/wallstreetbets/comments/11uhcs7/btc_is_20_up_in_5_days_30_down_in_1_year/jcod9te/,0.0,0.736,0.264,0.8625
50,PM," I will be messaging you in 6 months on [**2023-09-18 10:58:30 UTC**](http://www.wolframalpha.com/input/?i=2023-09-18%2010:58:30%20UTC%20To%20Local%20Time) to remind you of [**this link**](https://www.reddit.com/r/wallstreetbets/comments/11uhcs7/btc_is_20_up_in_5_days_30_down_in_1_year/jcolbej/?context=3)

[**3 OTHERS CLICKED THIS LINK**](https://www.reddit.com/message/compose/?to=RemindMeBot&subject=Reminder&message=%5Bhttps%3A%2F%2Fwww.reddit.com%2Fr%2Fwallstreetbets%2Fcomments%2F11uhcs7%2Fbtc_is_20_up_in_5_days_30_down_in_1_year%2Fjcolbej%2F%5D%0A%0ARemindMe%21%202023-09-18%2010%3A58%3A30%20UTC) to send a PM to also be reminded and to reduce spam.

^(Parent commenter can ) [^(delete this message to hide from others.)](https://www.reddit.com/message/compose/?to=RemindMeBot&subject=Delete%20Comment&message=Delete%21%2011uhcs7)

*****

|[^(Info)](https://www.reddit.com/r/RemindMeBot/comments/e1bko7/remindmebot_info_v21/)|[^(Custom)](https://www.reddit.com/message/compose/?to=RemindMeBot&subject=Reminder&message=%5BLink%20or%20message%20inside%20square%20brackets%5D%0A%0ARemindMe%21%20Time%20period%20here)|[^(Your Reminders)](https://www.reddit.com/message/compose/?to=RemindMeBot&subject=List%20Of%20Reminders&message=MyReminders%21)|[^(Feedback)](https://www.reddit.com/message/compose/?to=Watchful1&subject=RemindMeBot%20Feedback)|
|-|-|-|-|",RemindMeBot,4,/r/wallstreetbets/comments/11uhcs7/btc_is_20_up_in_5_days_30_down_in_1_year/jcolcnm/,0.105,0.895,0.0,-0.6322
51,COIN," Man, it's called U S DOLLAR COIN. The whole gig was it can be bought for and redeemed for a US DOLLAR. If it depegs because of a single bank default, then it didn't do it's job. Has nothing to do with the funny money being printed, except it's supposed to be exchangeable 1-1",Stupidflathalibut,6,/r/wallstreetbets/comments/11uhcs7/btc_is_20_up_in_5_days_30_down_in_1_year/jcqeqtz/,0.0,0.902,0.098,0.6369
52,AC, and that AC unit is the economy,SamCalagione,2,/r/wallstreetbets/comments/11u5mx0/banking_crisis_in_a_nut_shell/jcnqazg/,0.0,1.0,0.0,0.0
53,AC, The AC thats being fixed is a metaphor for capitalism,simp__king,1,/r/wallstreetbets/comments/11u5mx0/banking_crisis_in_a_nut_shell/jcmmvcx/,0.0,1.0,0.0,0.0
54,OR," QE officially started, and Powell cannot start QE without dropping interest rates.

**It's either QE with lower interest rates** OR **hiking interest rates to combat high inflation.**  It can't be both. Raise rates and banks will suffer more.",coding102,1,/r/wallstreetbets/comments/11uortm/pivot_already_started_jpow_will_have_to_explain/jcq5imn/,0.327,0.673,0.0,-0.9266
55,FRC, The deposits given back to FRC for 120 days were just deposits the other bigger banks had gained from clients who departed FRC and other regional banks. This wasn't new printed money.,Hosai87,1,/r/wallstreetbets/comments/11uortm/pivot_already_started_jpow_will_have_to_explain/jcqhmuk/,0.0,0.923,0.077,0.3818
56,HAS, Who says he HAS to do that? Lol,hightriedheadfried,1,/r/wallstreetbets/comments/11uortm/pivot_already_started_jpow_will_have_to_explain/jcqj0mw/,0.0,0.714,0.286,0.4215
57,FRC, All of that and FRC is still gonna go down. The Big Tank is coming. There’s no stopping it.,BlackBeard205,1,/r/wallstreetbets/comments/11uortm/pivot_already_started_jpow_will_have_to_explain/jcqsdkg/,0.183,0.817,0.0,-0.4215
58,AI, 👀 eventually you will be the AI that takes over the world,International_Tea446,1,/r/wallstreetbets/comments/11uortm/pivot_already_started_jpow_will_have_to_explain/jcpe9q2/,0.0,1.0,0.0,0.0
59,FRC, by not letting FRC collapse they basically restored faith (even though its very thin) in the financial system,hkboy3,-11,/r/wallstreetbets/comments/11uortm/pivot_already_started_jpow_will_have_to_explain/jcp1uxg/,0.0,0.657,0.343,0.78
60,OUT," Where does the cash go? The banks balance sheet. What does this mean? That banks have to come up with LESS RESERVES. What can they do now with all that free cash? LEND IT OUT. The fed has INDIRECTLY pumped money into the market.

[https://www.barrons.com/articles/bank-term-funding-program-btfp-bedb0367](https://www.barrons.com/articles/bank-term-funding-program-btfp-bedb0367)",hkboy3,1,/r/wallstreetbets/comments/11uortm/pivot_already_started_jpow_will_have_to_explain/jcqkqmj/,0.0,0.92,0.08,0.5913
61,OUT," Where does the cash go? The banks balance sheet. What does this mean? That banks have to come up with LESS RESERVES. What can they do now with all that free cash? LEND IT OUT. The fed has INDIRECTLY pumped money into the market.

[https://www.barrons.com/articles/bank-term-funding-program-btfp-bedb0367](https://www.barrons.com/articles/bank-term-funding-program-btfp-bedb0367)",hkboy3,1,/r/wallstreetbets/comments/11uortm/pivot_already_started_jpow_will_have_to_explain/jcqkoja/,0.0,0.92,0.08,0.5913
62,ARE," Ive been speaking the truth for over a year now. These prices ARE the new normal. Inflation is relative. They’re going to be lucky if they keep inflation at 2% of current prices. Everyone got raises in 2021, everyone.",Viewsoniks,7,/r/wallstreetbets/comments/11uortm/pivot_already_started_jpow_will_have_to_explain/jcpkrk2/,0.0,0.876,0.124,0.6249
63,AI," Our AI tracks our most intelligent users. After parsing your posts, we have concluded that you are within the 5th percentile of all WSB users.

*I am a bot, and this action was performed automatically. Please [contact the moderators of this subreddit](/message/compose/?to=/r/wallstreetbets) if you have any questions or concerns.*",AutoModerator,1,/r/wallstreetbets/comments/11uortm/pivot_already_started_jpow_will_have_to_explain/jcqifpl/,0.0,0.892,0.108,0.6801
64,FRC," You give way to much credit too FRC… SVB was a nothing burger in the banking system, FRC is an amoeba compared to Tier 1 and even Tier 2.",Daddy_Thick,1,/r/wallstreetbets/comments/11uortm/pivot_already_started_jpow_will_have_to_explain/jcpkwb9/,0.0,0.909,0.091,0.3818
65,FRC, Can someone please just tell me if I get a loan from FRC and deposit it into another account at FRC whether it’s a free money glitch when they go under? I wanna skim some rich money,robot_handjob,20,/r/wallstreetbets/comments/11uortm/pivot_already_started_jpow_will_have_to_explain/jcppr14/,0.0,0.765,0.235,0.8481
66,ALL," Well, yea.  Everything that is up 30, 40, 80% must be excluded and only the things that are up 6% included in the numbers.  It's how you stop people from realizing WE'RE ALL GUNNA FUCKING DIE",Ok_Manager3185,6,/r/wallstreetbets/comments/11uortm/pivot_already_started_jpow_will_have_to_explain/jcqkh85/,0.231,0.721,0.047,-0.8465
