,ticker,comment,username,score,permalink,neg,neu,pos,compound
62,BHB," Sorry that is NOT what the data shows.  I am really surprised the folks on Reddit (even the folks who do finance for a living) don't even know the peer review data on it.  If you want you can start by reading the seminal articles on the topic that put the final nail in that coffin of active management INCLUDING picking stocks (security selection):  BHB (beebower/ hood/ brinson) and its follow up study BSB (beebower/ singer/ brinson) published in JFA in circa early 1990's.  

Here is a brief overview of the study:  The took the topic pension fund managers in the country (top 100 or so).  Those are the ones that have access to the top money managers in whatever industries they wanted to invest in at that time.  They then looked at their returns.  They compared their returns to what their returns would have been if they invested in the same type of stocks using a index passive approach.  They found they LOST money with their security selection AND market timing techniques.

Of course this sent shock waves through the finance community.  No one believed it.   They repeated the study using the next 10 years of data and published those results as the BSB study.  Again same results.  So guess what Wall Street does?  Make sure NO ONE ever hears about these studies ever again.  

If this doesn't convince you just look at JPM private banking arm OWN study (link below).  Their OWN study in the end sees NO advantage of adding a concentrated portfolio on an index portfolio EVER.   No surprise since their data collecting shows over the last 35  years the MEDIAN stock return of ALL individual stock is a whopping -52%!!

[https://privatebank.jpmorgan.com/content/dam/jpm-wm-aem/global/pb/en/insights/eye-on-the-market/eotm-the-agony-and-the-ecstasy.pdf](https://privatebank.jpmorgan.com/content/dam/jpm-wm-aem/global/pb/en/insights/eye-on-the-market/eotm-the-agony-and-the-ecstasy.pdf)

I really don't think folks realize how hard it is to beat the index.  Considering only a minority do ex post and those that do have NO reproduceable way to do it shows it is more gambling then reproduceable skill.",10xwannabe,2,/r/investing/comments/121em53/is_this_a_this_time_is_different_situation/jdn4zgk/,0.07,0.876,0.054,-0.7402
63,EVER," Sorry that is NOT what the data shows.  I am really surprised the folks on Reddit (even the folks who do finance for a living) don't even know the peer review data on it.  If you want you can start by reading the seminal articles on the topic that put the final nail in that coffin of active management INCLUDING picking stocks (security selection):  BHB (beebower/ hood/ brinson) and its follow up study BSB (beebower/ singer/ brinson) published in JFA in circa early 1990's.  

Here is a brief overview of the study:  The took the topic pension fund managers in the country (top 100 or so).  Those are the ones that have access to the top money managers in whatever industries they wanted to invest in at that time.  They then looked at their returns.  They compared their returns to what their returns would have been if they invested in the same type of stocks using a index passive approach.  They found they LOST money with their security selection AND market timing techniques.

Of course this sent shock waves through the finance community.  No one believed it.   They repeated the study using the next 10 years of data and published those results as the BSB study.  Again same results.  So guess what Wall Street does?  Make sure NO ONE ever hears about these studies ever again.  

If this doesn't convince you just look at JPM private banking arm OWN study (link below).  Their OWN study in the end sees NO advantage of adding a concentrated portfolio on an index portfolio EVER.   No surprise since their data collecting shows over the last 35  years the MEDIAN stock return of ALL individual stock is a whopping -52%!!

[https://privatebank.jpmorgan.com/content/dam/jpm-wm-aem/global/pb/en/insights/eye-on-the-market/eotm-the-agony-and-the-ecstasy.pdf](https://privatebank.jpmorgan.com/content/dam/jpm-wm-aem/global/pb/en/insights/eye-on-the-market/eotm-the-agony-and-the-ecstasy.pdf)

I really don't think folks realize how hard it is to beat the index.  Considering only a minority do ex post and those that do have NO reproduceable way to do it shows it is more gambling then reproduceable skill.",10xwannabe,2,/r/investing/comments/121em53/is_this_a_this_time_is_different_situation/jdn4zgk/,0.07,0.876,0.054,-0.7402
64,JPM," Sorry that is NOT what the data shows.  I am really surprised the folks on Reddit (even the folks who do finance for a living) don't even know the peer review data on it.  If you want you can start by reading the seminal articles on the topic that put the final nail in that coffin of active management INCLUDING picking stocks (security selection):  BHB (beebower/ hood/ brinson) and its follow up study BSB (beebower/ singer/ brinson) published in JFA in circa early 1990's.  

Here is a brief overview of the study:  The took the topic pension fund managers in the country (top 100 or so).  Those are the ones that have access to the top money managers in whatever industries they wanted to invest in at that time.  They then looked at their returns.  They compared their returns to what their returns would have been if they invested in the same type of stocks using a index passive approach.  They found they LOST money with their security selection AND market timing techniques.

Of course this sent shock waves through the finance community.  No one believed it.   They repeated the study using the next 10 years of data and published those results as the BSB study.  Again same results.  So guess what Wall Street does?  Make sure NO ONE ever hears about these studies ever again.  

If this doesn't convince you just look at JPM private banking arm OWN study (link below).  Their OWN study in the end sees NO advantage of adding a concentrated portfolio on an index portfolio EVER.   No surprise since their data collecting shows over the last 35  years the MEDIAN stock return of ALL individual stock is a whopping -52%!!

[https://privatebank.jpmorgan.com/content/dam/jpm-wm-aem/global/pb/en/insights/eye-on-the-market/eotm-the-agony-and-the-ecstasy.pdf](https://privatebank.jpmorgan.com/content/dam/jpm-wm-aem/global/pb/en/insights/eye-on-the-market/eotm-the-agony-and-the-ecstasy.pdf)

I really don't think folks realize how hard it is to beat the index.  Considering only a minority do ex post and those that do have NO reproduceable way to do it shows it is more gambling then reproduceable skill.",10xwannabe,2,/r/investing/comments/121em53/is_this_a_this_time_is_different_situation/jdn4zgk/,0.07,0.876,0.054,-0.7402
65,STEM," >Another example, STEM grad school research gives you a leg up on legitimate and exciting tech developments. In biotech and back in the days when I went to grad school, in software as well.

But it doesn't give you a leg up on *investing*. 

You don't invest in ideas or development. You invest in companies. 

""STEM grad school research"" won't help you with that. 

And who says ""STEM grad school?"" anyway? Do you mean botany? Math? Soil science? Agricultural animal breeding?",thewimsey,0,/r/investing/comments/121em53/is_this_a_this_time_is_different_situation/jdmyuo0/,0.035,0.909,0.056,-0.2953
66,CS," Who do you think buys interesting IP coming out of MIT?   First they become startups.  Often they go public but make NO money.  Pharmas will buy the ones making progress towards FDA approval.  Just one example.

In the mid-90's we were using tech in CS grad school that Wall Street wasn't yet understanding the full ramifications of.  The companies were public but ignored, at first...",CanWeTalkHere,1,/r/investing/comments/121em53/is_this_a_this_time_is_different_situation/jdn6iso/,0.089,0.784,0.127,0.4311
67,IP," Who do you think buys interesting IP coming out of MIT?   First they become startups.  Often they go public but make NO money.  Pharmas will buy the ones making progress towards FDA approval.  Just one example.

In the mid-90's we were using tech in CS grad school that Wall Street wasn't yet understanding the full ramifications of.  The companies were public but ignored, at first...",CanWeTalkHere,1,/r/investing/comments/121em53/is_this_a_this_time_is_different_situation/jdn6iso/,0.089,0.784,0.127,0.4311
68,CCF," Okay good you do understand.  Your advice is still not good.  

As I mentioned the PURPOSE of asset allocation is  *""to come up with a risk level you are comfortable with since each asset class carries different risk levels and volatility.""*

So, WHY In the world would you add another risk that you can not control (single company risk or its similar version if you are talking about bonds) and are not even compensated for taking on by choosing an individual bond??  Just pick a index bond fund.  

Now, if you argued with me why choose to pay an expense ratio instead of buying gold direct and store it myself at home or whereever at a cheaper price that makes sense as passive vehicle there is no better then you buying it yourself.  

Commodities via a CCF is a completely different discussion as there is a reasonable argument if the current long only version investment vehicles can even capture the full  rollover return (backwardation).  So I'll give you that maybe a managed futures there is a better option if you want to play in that end of the pool.

For most investors what is great advice is:  Pick you asset alllocation (mix of stocks/bonds/ cash/ alternative investments).  Use index funds to mimic it.",10xwannabe,7,/r/investing/comments/121em53/is_this_a_this_time_is_different_situation/jdmbuw1/,0.073,0.781,0.146,0.9536
69,CD, 1) congrats you’re well ahead of the game at your age 2) something like a CD would be good with the situation you described. You are probably going to get eaten a bit if inflation stays high (or goes higher) so a short term would be a good idea to start out. Just remember that 5% is annualized so you won’t get 5% in 3 months you’ll get the prorated amount,ngram11,52,/r/investing/comments/1216x8i/18_and_first_time_investing_bank_agent_says_i/jdkntms/,0.0,0.816,0.184,0.9153
70,CD, CD and bonds are great short term investments.,Average_Squirrel,13,/r/investing/comments/1216x8i/18_and_first_time_investing_bank_agent_says_i/jdko0he/,0.0,0.631,0.369,0.6249
71,CD," annual max contribution into an IRA should be priority, after an employer 401k match.   If those are fulfilled, and you won’t need the cash for 2+ years as stated, yes, I would put 20k into a 12mo CD",cccory44,3,/r/investing/comments/1216x8i/18_and_first_time_investing_bank_agent_says_i/jdkvred/,0.0,0.861,0.139,0.6705
72,CD," You can put $10k into a CD with 4% interest rate.  Leave the other half in emergency savings account.  

Moving forward, open a Roth IRA with Merrill Edge and invest into SCHB.  Since you mention you have $800 of spare cash per month, devote $300 into that ETF.  

Facts about SCHB:

- It is an exchange traded fund (ETF) with over 2,500 stocks in the fund.

- It is a Total USA index ETF that tracks most of the USA stocks on the USA stock market.  The index it follows is the Dow Jones U.S. Broad Stock Market Index.

- It is priced less than $47 per share since it split a few years ago.  Incredibly low cost per share and great for brokers without fractional shares for ETFs.  

- Expense ratio is 0.03%.  The same as popular ETF VTI.",InvestingNerd2020,2,/r/investing/comments/1216x8i/18_and_first_time_investing_bank_agent_says_i/jdkql1c/,0.055,0.831,0.114,0.8631
73,USA," You can put $10k into a CD with 4% interest rate.  Leave the other half in emergency savings account.  

Moving forward, open a Roth IRA with Merrill Edge and invest into SCHB.  Since you mention you have $800 of spare cash per month, devote $300 into that ETF.  

Facts about SCHB:

- It is an exchange traded fund (ETF) with over 2,500 stocks in the fund.

- It is a Total USA index ETF that tracks most of the USA stocks on the USA stock market.  The index it follows is the Dow Jones U.S. Broad Stock Market Index.

- It is priced less than $47 per share since it split a few years ago.  Incredibly low cost per share and great for brokers without fractional shares for ETFs.  

- Expense ratio is 0.03%.  The same as popular ETF VTI.",InvestingNerd2020,2,/r/investing/comments/1216x8i/18_and_first_time_investing_bank_agent_says_i/jdkql1c/,0.055,0.831,0.114,0.8631
74,ARE," I think it's a great idea to buy a CD because all the media outlets are screaming ""take your money out of the banks!"" ""THERE'S A BANK RUN!""🤣 It's similar to when there's a stock market crash, the media screams ""STOCKS ARE CRASHING!"" Meanwhile, that is the best time to buy. That is why stocks always skyrocket during a stock crash. See 2020, 2018, 2008, 1929. The best time to buy is during a crash. Synonymously, the same goes for bank products. When the media makes you scared to put money in the banks, that is when you should put money in the banks.",Un-Scammable,1,/r/investing/comments/1216x8i/18_and_first_time_investing_bank_agent_says_i/jdko0ct/,0.142,0.751,0.107,-0.2905
75,CD," I think it's a great idea to buy a CD because all the media outlets are screaming ""take your money out of the banks!"" ""THERE'S A BANK RUN!""🤣 It's similar to when there's a stock market crash, the media screams ""STOCKS ARE CRASHING!"" Meanwhile, that is the best time to buy. That is why stocks always skyrocket during a stock crash. See 2020, 2018, 2008, 1929. The best time to buy is during a crash. Synonymously, the same goes for bank products. When the media makes you scared to put money in the banks, that is when you should put money in the banks.",Un-Scammable,1,/r/investing/comments/1216x8i/18_and_first_time_investing_bank_agent_says_i/jdko0ct/,0.142,0.751,0.107,-0.2905
76,CD," Actually that is what I am trying to get buy CD 14-18 month out for 5.4%. Selling soft my Tesla and Google stocks as they have a tendency to sink my portfolio.  3 months is fine.  The interest rate may go up 1/4 point in the future and it can be flat or going down hill.  Treasury Notes is now lower than CD started recently at 4.4%.

All the best.",Vast_Cricket,0,/r/investing/comments/1216x8i/18_and_first_time_investing_bank_agent_says_i/jdknv67/,0.029,0.827,0.144,0.8225
77,CD," 1. Ladder Treasury Notes through treasury direct. Lots of maturity options and only federal taxes no state 
2. HYSA, very liquid and can get great rates right now. Taxed state and federal 
3. CD, least liquid as your money is gone for a year. You’d be better buying $10k I Bills as their rate is 6.89% 

Those would be my personal recommendations. I suppose with I Bills listed a CD would be the 4th best option imo. Really depends on what you’re comfortable with",luvz2splooge_69,-1,/r/investing/comments/1216x8i/18_and_first_time_investing_bank_agent_says_i/jdmfxv9/,0.024,0.78,0.196,0.9423
78,OP," No state taxes on the T bills either.
OP could also just do treasury direct, I hear they're upgrading their UI",sephirothFFVII,4,/r/investing/comments/1216x8i/18_and_first_time_investing_bank_agent_says_i/jdl1g1x/,0.105,0.81,0.086,-0.1027
79,UI," No state taxes on the T bills either.
OP could also just do treasury direct, I hear they're upgrading their UI",sephirothFFVII,4,/r/investing/comments/1216x8i/18_and_first_time_investing_bank_agent_says_i/jdl1g1x/,0.105,0.81,0.086,-0.1027
80,CD, You can get over 5% annualized from a 3 month CD right now. I bought some today. Probably can't from BofA tho.,Stantron,1,/r/investing/comments/1216x8i/18_and_first_time_investing_bank_agent_says_i/jdlamnm/,0.0,1.0,0.0,0.0
81,OP, Other investments only outpace inflation over a long time. OP is not waiting 20 years to use this money.,InvisibleEar,1,/r/investing/comments/1216x8i/18_and_first_time_investing_bank_agent_says_i/jdnp2aq/,0.0,1.0,0.0,0.0
82,CD, If you think interest rates are going to drop rapidly in the future then a CD would be a better choice. But at any time of purchase the I Bond will be paying a better rate than the CD.,Chagrinnish,0,/r/investing/comments/1216x8i/18_and_first_time_investing_bank_agent_says_i/jdndp87/,0.038,0.768,0.193,0.7391
83,CD," FYI, At most banks you can remove your $$ from a CD at any point, you’ll just give up like the last 3 months of interest they gave you.",Anxious_Protection40,3,/r/investing/comments/1216x8i/18_and_first_time_investing_bank_agent_says_i/jdl6vn0/,0.0,0.749,0.251,0.7925
84,CD," It's always better to start investing earlier if you have savings to do so. The CD is about as safe as you can get, and your 3month CD would pay ~$40. It's extremely safe and nothing wrong with it. 

If you're willing to truly *invest* the money for years (decades, really) then a good choice would be an S&P500 index fund, such as VOO or SPY. 

You can cash it out any time you want - but it could be up 10% next year, or it could be down for two years. But over  the 100+ year history of the US stock market, the S&P500 on average returns ~7% per year over long time frames. This means a $2500 investment would be worth $5k a decade later and $10k after two. 

It's important to emphasize: this is NOT guaranteed and you can LOSE money with stocks, unlike the CD where the investment is insured and it will never go down in nominal dollar value). But, it does have a 100 year track record of steady returns when looking at 5+ year periods.",oarabbus,1,/r/investing/comments/1216x8i/18_and_first_time_investing_bank_agent_says_i/jdkxwo9/,0.031,0.878,0.091,0.7489
85,CD," Brokered CD purchases are pretty easy under the fixed income trading section of Merrill Edge, but BoA does not offer any savings accounts that are paying any significant interest.",invalidTypecast,2,/r/investing/comments/1216x8i/18_and_first_time_investing_bank_agent_says_i/jdlvva4/,0.0,0.709,0.291,0.85
86,CD," I have Bank of America for checking and direct deposits, Merrill Lynch for taxable investment, Vanguard for roll over Roth IRA, and Ally for savings and CDs. 

Choose the best option for you and mix and match if needed. Ally is 3.75% currently. There’s no minimum account balance, so when I started using Ally years ago I opened up multiple accounts. For example, I have 1 account for car insurance so I can get the 6 month full payment discount, but I “pay monthly” by transferring to that account. 

The Ally no penalty 11 month CD is currently at 4.75%. No minimum. After 6 days no penalty to withdraw.",JPINFV2,1,/r/investing/comments/1216x8i/18_and_first_time_investing_bank_agent_says_i/jdmlvzc/,0.158,0.819,0.023,-0.9371
87,MLM," It's like an MLM for insurance. This is stupid shit. If she calls you again, mark the call as spam.",beaverbait,50,/r/investing/comments/1213dj0/company_telling_me_that_an_iul_is_better_than_a/jdk7yoh/,0.419,0.498,0.083,-0.8788
88,CD," Since you mentioned Aegon, gonna take a wild guess and say she works for World Financial Group (WFG)?  If so, then yeah, they're an MLM that aims to recruit and have others in their downlines sell the insurance policies.  They push it to just anyone and everyone, whether it's a suitable fit for the person or not (come visit r/antimlm for more stories).  As others have said, block the lady, delete her on FB, and block the person who recommended her to you.

Life insurance has its time and place.  You mentioned you have no kids, so, yeah, it may not be as important for you.  If you're trying to save money for a house in a few years, go open a nonretirement/taxable brokerage account somewhere and put it into a money market fund, brokered CD, or US Treasury.  These investments aren't glamorous, but they provide principal protection and some growth, which fits your bill based on your info above.",immanewb,5,/r/investing/comments/1213dj0/company_telling_me_that_an_iul_is_better_than_a/jdkxuci/,0.065,0.853,0.082,0.4243
89,MLM," Since you mentioned Aegon, gonna take a wild guess and say she works for World Financial Group (WFG)?  If so, then yeah, they're an MLM that aims to recruit and have others in their downlines sell the insurance policies.  They push it to just anyone and everyone, whether it's a suitable fit for the person or not (come visit r/antimlm for more stories).  As others have said, block the lady, delete her on FB, and block the person who recommended her to you.

Life insurance has its time and place.  You mentioned you have no kids, so, yeah, it may not be as important for you.  If you're trying to save money for a house in a few years, go open a nonretirement/taxable brokerage account somewhere and put it into a money market fund, brokered CD, or US Treasury.  These investments aren't glamorous, but they provide principal protection and some growth, which fits your bill based on your info above.",immanewb,5,/r/investing/comments/1213dj0/company_telling_me_that_an_iul_is_better_than_a/jdkxuci/,0.065,0.853,0.082,0.4243
90,CD, If you're saving money for a house.. take advantage of the 5% CD rates now... Lock yourself into a the proper time frame for a decent yield without risk of losing your savings,Crrunk,1,/r/investing/comments/1213dj0/company_telling_me_that_an_iul_is_better_than_a/jdmsp4m/,0.0,0.818,0.182,0.6121
91,CD," Saving money for a house..you should only put in short term low risk like a HYSA, money market, CD, treasury.",b1gb0n312,1,/r/investing/comments/1213dj0/company_telling_me_that_an_iul_is_better_than_a/jdn55c4/,0.187,0.622,0.191,0.0258
92,EM," Case shiller is measuring single family house prices.  The five year period to June 2022 is probably the best period ever for this asset class, and June was the peak.  Blackstone reit invests in commercial real estate, some of which has done well over that period, like multi family and industrial, but some of which has not.  I’m not saying breit actually did really well here, I’m just saying Case-Shiller is not a perfect comparison.  A similar analogy would be if you were looking at an active emerging market mutual fund- you wouldn’t say it did bad because it underperformed the SPY.  You would want to see it vs the EM index.",DeepstateDilettante,2,/r/investing/comments/12121mu/analysis_is_blackstones_real_estate_fund_breit/jdkyowr/,0.07,0.806,0.124,0.4099
93,EU," Hello,

I have an account with Interactive Brokers UK (it's an ""ISA"" account) which I treat as ""buy-only"" (I put in money, buy stuff over time, forget about it). So my ""horizon"" is until ""I absolutely have to touch that money"" which may be 20 years or so...

I want to buy some gold and my preference would be for something that is focused on physical gold so [I did some research](https://www.google.com/search?q=gold+physical+etf) (i.e. googled it).

One thing I discovered was this piece of information:

>The diversification principles of the regulatory investment fund framework (UCITS) do not allow to launch a UCITS fund with only one constituent. Due to this fact, gold is mainly available as an exchange-traded commodity (ETC) in European countries. These products are certificates issued by a financial institution collateralised with physical gold. In contrast to the EU, Swiss regulation allows ETFs for single commodities like gold.

This made me pause, as I am not familiar with UCITS so I do not understand if it provides some form of ""protection"" that applies to ETFs, or it's just a technicality that ""you can't call this an ETF"" but has no other impact.

Either way, I have so many questions:

1. Since ETCs are basically **certificates issued by a financial institution collateralised with physical gold**, does that mean they are only as safe as the ""financial institution"" that issued them? Like if bank X issues an ETC and bank X goes bankrupt, you lose the money because the gold is not actually yours?
2. How do I find out who ""backs"" an ETC? For example [SGLN](https://www.ishares.com/uk/individual/en/products/258441/ishares-physical-gold-etc-fund) is one near the top results list.
3. How else do I compare ETCs? Clearly the ""backing institution"" is important as per (1) but is there anything else to look at?
4. What is UCITS and does it provide any extra ""protection"" due to its regulations? Would I be better off buying an ETF with part physical gold and part something else? Then what gold-heavy ETFs would you recommend that are UCITS-compliant?

Thank you all.

P.S. I was thinking of posting separately but I do not use r/investing often so I am not clear on the rules. Hopefully I will get some traction here but please let me know if I would be better off making a separate post.",akarypid,2,/r/investing/comments/121g2oo/daily_general_discussion_and_advice_thread_march/jdlvks0/,0.043,0.847,0.11,0.9756
