,ticker,comment,username,score,permalink,neg,neu,pos,compound
110,CAN," Leverage. I buy a “stable” investment for $100. I collect interest of 5%. But that’s not good enough. So I borrow against the $100 say 3:1. Now I can collect the spread between the 15% (5% x 3) I’m getting and the 2% I’m paying on each of the 3 levered assets. 
All is good. I’m making 9%. 
But then, interest rates go up and this happens: 
The original $100 that yielded 5%?  Yeah, it’s not worth $100 in a 6% world. It’s worth say $80. But your not down only $20. Your down an  additional $40 on the other two levered $100 investments. 
So your original hundred is now worth $80 minus the $40 on the second two, resulting in a market value of $40 on an original investment of $100. Ooooops. 
And, to make it worse, all of your buddies did the same dang thing. In fact, you all borrowed and loaned to one another. Last one to sell gets fired. 
That’s a simplistic example of why these private funds are in trouble. 
Now for the really scary part: it’s exactly what caused the 2008 crisis. Except it was at magnitudes of 1000x. 
That’s not the scary part. 
The scary part is ALL of those derivatives from 2008?  Which are nuclear hypothecated bullshit products. They are still on every single money centers balance sheet. 
What happens if those are forced to be priced?
The criminal part, among many, is that when Goldman et al with their new brilliant derivatives product, went to the SEC to get them approved? guess what the SEC said?
They said we don’t understand these so you guys regulate them. Total dereliction of duty. 

I can tell you that maybe one of my hundreds of former clients ever read a prospectus. Or understood what the risks were. Worse, maybe 15% of the professional I work with could explain even part of the above. It’s not that I’m so smart. It’s that most people in the biz are NOT smart - they are SALES PEOPLE who either create or sell wonderfully complex products that few understand, purposely. 
They are drug dealers in nicer suits. 
Finally, how many people do you think actually read the quarterly fund updates?  Or question anything?  Why? Bc they talk to the manager and he says everything is fine blah blah blah. 
This is what I want to change. I want people to understand and take control of their money by teaching them to ask the right questions. If you don’t understand hypothecated assets or debt coverage, I bet you CAN tell when someone is lying to you. 
Here are two simple requests you can make from any advisor:
1. How much did you make over the last 3 years?  And provide income statements. 
2. Show me your investment account and 401k statements bc you’d better own what your recommending to me. 

I’d say 1 out of 50 will provide the above. If they do provide and their investment account is LESS than yours, run away. 
See how simple that is?  You just got rid of 90% of “pros” that are out there.  If I’m going to build a house I’m not going to hire a guy who doesn’t live in a house and never has built a house but says he can build a better house then anyone has ever built, almost guaranteed. 

I’m sorry for getting on my soapbox and rambling but I HATE the majority of people in the profession I retired from. 

Sorry if I didn’t answer your question. Feel free to let me know if I failed.",mrnotadvice,1,/r/wallstreetbets/comments/11ufsaj/private_funds_will_be_the_next_massive_problem/jcqlv9f/,0.133,0.762,0.105,-0.9708
111,SB," Hard disagree.  

I'm not sure why you think this is the case.

Because rich people don't like to lose money?  You seem to describe that reason to the SVB and SB bailouts.... When I think it could be much more reasonably blamed on fear of contagion.",nyc2pit,2,/r/wallstreetbets/comments/11ufsaj/private_funds_will_be_the_next_massive_problem/jcp0fdv/,0.297,0.605,0.098,-0.8687
112,OP," bro i am indian i DMed him asking for advise

the OP is for sure american and i dont know him.

i just thought i could help by posting it somewhere else",InsiderTrader-,3,/r/wallstreetbets/comments/11ufsaj/private_funds_will_be_the_next_massive_problem/jcqjptn/,0.0,0.833,0.167,0.6124
113,DO," Haha. Your correct. Bc as long as I, the PE firm, disclose it, I can do whatever the F I want. I can go bet the over under on how many times my infant daughter will crap her diaper if I want. As long as it’s disclosed. 
So PE firms can do what few other investment products can do: remove liquidity. For no reason whatsoever. As long as I disclosed it and you signed the offerring doc. 

Some private managed products like REITs DO have annual or quarterly withdrawal periods. But they usually limit it to 10% of total NET assets. And they can turn that off if they feel like it.",mrnotadvice,2,/r/wallstreetbets/comments/11ufsaj/private_funds_will_be_the_next_massive_problem/jcqmrgc/,0.03,0.86,0.11,0.7184
114,NET," Haha. Your correct. Bc as long as I, the PE firm, disclose it, I can do whatever the F I want. I can go bet the over under on how many times my infant daughter will crap her diaper if I want. As long as it’s disclosed. 
So PE firms can do what few other investment products can do: remove liquidity. For no reason whatsoever. As long as I disclosed it and you signed the offerring doc. 

Some private managed products like REITs DO have annual or quarterly withdrawal periods. But they usually limit it to 10% of total NET assets. And they can turn that off if they feel like it.",mrnotadvice,2,/r/wallstreetbets/comments/11ufsaj/private_funds_will_be_the_next_massive_problem/jcqmrgc/,0.03,0.86,0.11,0.7184
115,VERY," No, I'm not prohibited from trading. I trade options every day.

I sometimes have the ability to read into future forecasts from these funds for the market but most of the time, it's stuff I already know. Besides, most of these funds aren't really invested in anything sophisticated. You'd surprised how many funds copy off each other making this whole thing sooo much worse lol.

So, right now, the fed is in a VERY bad situation. The memes on the front page are spot on. Do we save the banks and subsequently everyone else that is overleveraged, got greedy but are also ""too big to fail"" or do we protect consumers and keep thwarting inflation? Frankly, I think many of these banks lose perspective of what inflation could manifest into if the fed loses it's grip on it. If these greedy fucks all got bailed out and inflation sky rockets, they'll likely need another bail out within the year or 2-3 years since rates will continue to go up. So, they start new with new US treasury bonds and inflation increase by a lot pushing the timeline further for thwarting inflation. It's a lose lose situation for the banks and I think JP see's this. So, this bailout could just be a one time thing and JP telling everyone else to pound sand, welcome to capitalism. 

If banks fail on a mass scale because they all got incredibly greedy in 2020/2021, the fed bailing more banks (and now Private Funds) will just make inflation worse. So much so, that they'll likely go under again. So, capitalism forcing the hand of the fed which ultimately decimates the value of the dollar.

That said, this market is absolutely ripe for making money. It's an options traders wet dream to see this kind of volatility. Just be weary of a potential pause in fed rates. If this happens, markets will explode forward. One way or another, by the end of the year, it will be up a shit ton or down a shit ton. So I recommend a long spy straddle however, I have a feeling the fed will just start letting banks fail knowing they can get away with this without losing too much versus what they have to lose bailing them out. So, it's tough to say.

I currently have SPY puts for the end of September.",,9,/r/wallstreetbets/comments/11ufsaj/private_funds_will_be_the_next_massive_problem/jco5l34/,0.172,0.713,0.114,-0.984
116,OP," https://bakchodi.org/post/18206

You mean this OP is American? It seems looking through his profile that he's speaking to other Indians. Not in English, and regretting holding money in certain parts of the US stock market.

If you mean ""the whistleblower"" is American, where did he originally post to?

I'm really tired and regarded today so forgive me if I've made a mistake here.",MyFingerYourBum,1,/r/wallstreetbets/comments/11ufsaj/private_funds_will_be_the_next_massive_problem/jcqqyoe/,0.125,0.806,0.07,-0.5875
117,OP," France just did.  

That said, I tend to agree with you. I feel like we're conflating to very different issues here. Investor redemptions may bring down some funds, but I don't see that as becoming a systemic problem.

Back stopping depositors for unlimited amounts is a bad precedent to set, But our banking system fully operates on confidence, and a total loss of confidence would be detrimental to the economy at large, much more so than some funds going bankrupt.

While I believe the (now-deleted) OP that these losses are occurring, I don't think they are analogous.",nyc2pit,1,/r/wallstreetbets/comments/11ufsaj/private_funds_will_be_the_next_massive_problem/jcozx0e/,0.19,0.694,0.116,-0.8559
118,BAC, $50k In bank stocks. Not sure if I should sell. It’s mainly BAC and JPM  but also some regional bank stocks my grandfather bought me before he passed.,TheGeoGod,5,/r/wallstreetbets/comments/11uw0v9/how_much_money_did_you_lose/jcqfvm3/,0.054,0.946,0.0,-0.1232
119,JPM, $50k In bank stocks. Not sure if I should sell. It’s mainly BAC and JPM  but also some regional bank stocks my grandfather bought me before he passed.,TheGeoGod,5,/r/wallstreetbets/comments/11uw0v9/how_much_money_did_you_lose/jcqfvm3/,0.054,0.946,0.0,-0.1232
120,PACW, PACW is a screaming buy right now,MrVolatov,18,/r/wallstreetbets/comments/11ub295/michael_burrys_chart_for_banks_with_regard_to/jcnpyy2/,0.342,0.658,0.0,-0.3818
121,PACW, Are my $11 PACW calls expiring 6/16 toast or will I make it??? Pls help,Equal-Fun-9380,2,/r/wallstreetbets/comments/11ub295/michael_burrys_chart_for_banks_with_regard_to/jcndkz9/,0.0,0.726,0.274,0.5484
122,PNC," How do we like PNC here? Biggest bank in the southwest quadrant a plus or just not good to be on this chart altogether?

I feel like they have a blue collar, small business (but like real businesses- manufacturing and shit) vibe that makes them feel durable",Flerdermern,2,/r/wallstreetbets/comments/11ub295/michael_burrys_chart_for_banks_with_regard_to/jcnmmn9/,0.048,0.796,0.156,0.6656
123,FRC," LISTEN you idiots heres the play. 

You all want to buy puts on FRC.  Thats for idiots.  If they delist it you lose. 

Open CREDIT SPREADS on PUTS on FRC that expire in January 2024

Sell puts at 60 bucks

But puts at 50 bucks, its 7 bucks premium at that point. 

If FRC goes bankrupt the puts expire worthless when it gets delisted and you're up 700 bucks for essentially 300 bucks worth of collateral per trade.",hiricinee,2,/r/wallstreetbets/comments/11ub295/michael_burrys_chart_for_banks_with_regard_to/jco42ew/,0.121,0.796,0.084,-0.7378
124,UBS, It's a good thing the SNB is pressuring UBS to take over Credit Suisse.  That'll definitely help.,ahminus,2,/r/wallstreetbets/comments/11ub295/michael_burrys_chart_for_banks_with_regard_to/jcngmwk/,0.099,0.453,0.449,0.8176
125,ALLY," Where SOFI, ALLY, Capital One?",Automatic_Counter_70,1,/r/wallstreetbets/comments/11ub295/michael_burrys_chart_for_banks_with_regard_to/jcnq07d/,0.0,1.0,0.0,0.0
126,SOFI," Where SOFI, ALLY, Capital One?",Automatic_Counter_70,1,/r/wallstreetbets/comments/11ub295/michael_burrys_chart_for_banks_with_regard_to/jcnq07d/,0.0,1.0,0.0,0.0
127,CMA, Take away - CMA is the only one in that quadrant that hasn’t floored hard….hmmm ![img](emote|t5_2th52|29637),EwokTusk,1,/r/wallstreetbets/comments/11ub295/michael_burrys_chart_for_banks_with_regard_to/jcnsq1q/,0.0,1.0,0.0,0.0
128,CFG, So based on this chart CFG Bank is ok?  I have a HYSA with them and it’s been “printing” thanks to the high rates.,Scuba_Steve_7_7_7,1,/r/wallstreetbets/comments/11ub295/michael_burrys_chart_for_banks_with_regard_to/jcot3uq/,0.0,0.797,0.203,0.6249
129,UBS," UBS isn't on the chart

But USB is",LavenderAutist,3,/r/wallstreetbets/comments/11ub295/michael_burrys_chart_for_banks_with_regard_to/jcnl88s/,0.0,1.0,0.0,0.0
130,USB," UBS isn't on the chart

But USB is",LavenderAutist,3,/r/wallstreetbets/comments/11ub295/michael_burrys_chart_for_banks_with_regard_to/jcnl88s/,0.0,1.0,0.0,0.0
131,FRC," If SBNY was at 95%, FRC Is ~80% with a slightly higher percentage of unrealized losses. FRC did just receive a $30bn injection from other banks though",2ndSifter,3,/r/wallstreetbets/comments/11ub295/michael_burrys_chart_for_banks_with_regard_to/jcnczx4/,0.101,0.899,0.0,-0.4019
132,SCHW," So why my SCHW calls all -60%

https://preview.redd.it/qfwtoem1fhoa1.jpeg?width=800&format=pjpg&auto=webp&v=enabled&s=f2b55c63917832cf7b78958ba53aca3b2d3ba256",BigBeagleEars,10,/r/wallstreetbets/comments/11ub295/michael_burrys_chart_for_banks_with_regard_to/jco1v31/,0.0,1.0,0.0,0.0
133,CS," You actually believe that?  You realize the CS CEO made the exact same claim right before the most recent chaos started with his bank?  Can you imagine the CEO saying anything else?  

https://www.bloomberg.com/news/articles/2023-03-14/credit-suisse-ceo-says-bank-saw-inflows-amid-svb-upheaval",SateliteDicPic,27,/r/wallstreetbets/comments/11ub295/michael_burrys_chart_for_banks_with_regard_to/jcnnnmq/,0.124,0.876,0.0,-0.6724
134,CS, Haha I don't think a comparison to CS warrants a real response. CS has been junk for years. Nazi gold is all that keeps it going. Their bonds have been paying 7% since last summer.,miler4salem,18,/r/wallstreetbets/comments/11ub295/michael_burrys_chart_for_banks_with_regard_to/jcnoe72/,0.0,0.912,0.088,0.4588
135,FRC," FRC has the recent benefit of a $30bn liquidity injection from JPM and the like. This appears to be a positive thing on the surface, but it begs the question of *why these large banks would even bother*",2ndSifter,14,/r/wallstreetbets/comments/11ub295/michael_burrys_chart_for_banks_with_regard_to/jcnitsy/,0.0,0.845,0.155,0.6187
136,JPM," FRC has the recent benefit of a $30bn liquidity injection from JPM and the like. This appears to be a positive thing on the surface, but it begs the question of *why these large banks would even bother*",2ndSifter,14,/r/wallstreetbets/comments/11ub295/michael_burrys_chart_for_banks_with_regard_to/jcnitsy/,0.0,0.845,0.155,0.6187
137,CS," They are not apples to apples, I agree CS is absolute garbage.  My point was that if you are buying what the CEO is selling then you better prepare yourself for disappointment.  Every one of these banks have said positive things about their positions and incoming capital while they are actively circling the drain.  

Every single time people have been on TV saying how this bank is a one off or unique and then we get another one that fails.  There is never a single cockroach.  

The only banks that we KNOW are safe are the ones that can’t be allowed to fail - the large money center banks.",SateliteDicPic,18,/r/wallstreetbets/comments/11ub295/michael_burrys_chart_for_banks_with_regard_to/jcnp2hg/,0.079,0.803,0.118,0.5574
138,TV," They are not apples to apples, I agree CS is absolute garbage.  My point was that if you are buying what the CEO is selling then you better prepare yourself for disappointment.  Every one of these banks have said positive things about their positions and incoming capital while they are actively circling the drain.  

Every single time people have been on TV saying how this bank is a one off or unique and then we get another one that fails.  There is never a single cockroach.  

The only banks that we KNOW are safe are the ones that can’t be allowed to fail - the large money center banks.",SateliteDicPic,18,/r/wallstreetbets/comments/11ub295/michael_burrys_chart_for_banks_with_regard_to/jcnp2hg/,0.079,0.803,0.118,0.5574
139,FRC," After receiving all that capital AND taking capital from the Fed they are still looking to raise capital via equity.  Moody’s just downgraded them to junk again after market close.  Barring some wild news FRC equity holders going to have a bad Monday.

As far as big banks they either were told to do give the capital or are trying to prevent any further contagion.  FRC is well and truly screwed and most likely won’t be the last this cycle.",SateliteDicPic,5,/r/wallstreetbets/comments/11ub295/michael_burrys_chart_for_banks_with_regard_to/jcnodev/,0.109,0.822,0.069,-0.6808
140,FRC, I only buy junk stocks. FRC here I come!,Brilliant-Job-47,37,/r/wallstreetbets/comments/11udyee/and_they_it_was_junk_first_republic_bank_gets/jco0gp5/,0.0,1.0,0.0,0.0
141,AEM," The gold stocks are behind because the big 3 or 4 miners haven't been doing so well operationally. Additionally, Newmont is potentially going to be diluted a whole bunch to acquire Newcrest, and AEM and PAAS are in the middle of reorganizing after acquiring a bunch of new assets from Yamana. So as businesses they aren't actually that great per se. In saying that, I own them all because it's easier than owning physical metal.",Minimum_Eff0rt99,2,/r/wallstreetbets/comments/11uuroj/looking_across_all_global_currencies_gold_is/jcqivyx/,0.043,0.862,0.095,0.4492
142,PAAS," The gold stocks are behind because the big 3 or 4 miners haven't been doing so well operationally. Additionally, Newmont is potentially going to be diluted a whole bunch to acquire Newcrest, and AEM and PAAS are in the middle of reorganizing after acquiring a bunch of new assets from Yamana. So as businesses they aren't actually that great per se. In saying that, I own them all because it's easier than owning physical metal.",Minimum_Eff0rt99,2,/r/wallstreetbets/comments/11uuroj/looking_across_all_global_currencies_gold_is/jcqivyx/,0.043,0.862,0.095,0.4492
143,NEM, Been holding NEM for a while waiting on this slingshot….,bigmean3434,1,/r/wallstreetbets/comments/11uuroj/looking_across_all_global_currencies_gold_is/jcqce6a/,0.0,1.0,0.0,0.0
144,AI, The bot agrees. Look how smart AI is getting.,Troflecopter,14,/r/wallstreetbets/comments/11uuroj/looking_across_all_global_currencies_gold_is/jcpzx8r/,0.0,0.609,0.391,0.5423
145,NGD, NGD very undervalued with good cash flow,Bradthefunman,1,/r/wallstreetbets/comments/11uuroj/looking_across_all_global_currencies_gold_is/jcqfzoo/,0.0,0.655,0.345,0.4877
146,AEM," Barrick or AEM. Newmont is trying to acquire Newcrest which could change things. PAAS has deep, deep value in silver. Another option is Wheaton or Franco-Nevada for premium royalty plays",Minimum_Eff0rt99,1,/r/wallstreetbets/comments/11uuroj/looking_across_all_global_currencies_gold_is/jcqjp4a/,0.0,0.864,0.136,0.5267
147,PAAS," Barrick or AEM. Newmont is trying to acquire Newcrest which could change things. PAAS has deep, deep value in silver. Another option is Wheaton or Franco-Nevada for premium royalty plays",Minimum_Eff0rt99,1,/r/wallstreetbets/comments/11uuroj/looking_across_all_global_currencies_gold_is/jcqjp4a/,0.0,0.864,0.136,0.5267
148,USA," Yes but for the past 40 years, those guard rails were in place to thrust the United States to the absolute top of the economic food chain.

Now the means of economic production and therefore political influence have shifted away from the west and over to the rest.

We are still in a system where the fed dominates the world, but American companies don't even do their business in USA anymore.

USA went from being the world's largest producer to the world's largest customer, despite where the companies are officially headquartered and their stocks are listed.

Customer's don't get to make the rules forever.

The financial system can only create artificial and unfair wealth for North Americans for so long - and the bill we have racked up so far is insurmountably large.",Troflecopter,0,/r/wallstreetbets/comments/11uuroj/looking_across_all_global_currencies_gold_is/jcq6rwx/,0.029,0.86,0.111,0.8705
149,WE," WE HAVE EVERYTHING UNDER CONTROL

WE ARE AS SAFE AS A BANK

THERE IS NO NEED TO PANIC

PLEASE STOP PANICKING",OPINION_IS_UNPOPULAR,1,/r/wallstreetbets/comments/11uhnvu/wsb_discord/jcqt09d/,0.356,0.47,0.174,-0.6597
150,CS," I'm not sure UBS would want to take that bag of excrement into its own house, unless it's forced to do it by the central bank or national authorities. UBS doesn't need CS, most CS clients would simply move to UBS if the bank collapsed, and UBS doesn't need CS' assets. In fact,  UBS doesn't want any association with the CS trash at all.",Zapermastic,29,/r/wallstreetbets/comments/11u46wn/ubs_in_talks_to_acquire_credit_suisse/jcn3naf/,0.124,0.838,0.038,-0.7167
151,UBS," I'm not sure UBS would want to take that bag of excrement into its own house, unless it's forced to do it by the central bank or national authorities. UBS doesn't need CS, most CS clients would simply move to UBS if the bank collapsed, and UBS doesn't need CS' assets. In fact,  UBS doesn't want any association with the CS trash at all.",Zapermastic,29,/r/wallstreetbets/comments/11u46wn/ubs_in_talks_to_acquire_credit_suisse/jcn3naf/,0.124,0.838,0.038,-0.7167
152,EU, DoJ should take a hardline on it just because the EU competition commission does the same,lost_in_life_34,9,/r/wallstreetbets/comments/11u46wn/ubs_in_talks_to_acquire_credit_suisse/jcmb4eo/,0.0,1.0,0.0,0.0
153,CS, What happens to CS puts if this goes through,analpinestar,2,/r/wallstreetbets/comments/11u46wn/ubs_in_talks_to_acquire_credit_suisse/jcnudjx/,0.0,1.0,0.0,0.0
154,CS, It's a circus. After they just took a 50b loan? They can grab CS for pennies on the dollar but why?,Wisesize,0,/r/wallstreetbets/comments/11u46wn/ubs_in_talks_to_acquire_credit_suisse/jcnqr9z/,0.0,1.0,0.0,0.0
155,UBS, UBS already declined it,ldecline,0,/r/wallstreetbets/comments/11u46wn/ubs_in_talks_to_acquire_credit_suisse/jcop6c5/,0.0,1.0,0.0,0.0
156,CS," UBS will take the rest of wealth managment , and regional Banks like ZKB and Raiffeisen the  domestic clients. SNB will support them. Then goodbye CS and its crab managment.",Party-Neat-3355,1,/r/wallstreetbets/comments/11u46wn/ubs_in_talks_to_acquire_credit_suisse/jconlkr/,0.0,0.756,0.244,0.8126
157,UBS," UBS will take the rest of wealth managment , and regional Banks like ZKB and Raiffeisen the  domestic clients. SNB will support them. Then goodbye CS and its crab managment.",Party-Neat-3355,1,/r/wallstreetbets/comments/11u46wn/ubs_in_talks_to_acquire_credit_suisse/jconlkr/,0.0,0.756,0.244,0.8126
158,CS, I’m also fucked. Ex UBS new CS employee.,Florian__d,3,/r/wallstreetbets/comments/11u46wn/ubs_in_talks_to_acquire_credit_suisse/jco5y8n/,0.386,0.614,0.0,-0.6597
159,UBS, I’m also fucked. Ex UBS new CS employee.,Florian__d,3,/r/wallstreetbets/comments/11u46wn/ubs_in_talks_to_acquire_credit_suisse/jco5y8n/,0.386,0.614,0.0,-0.6597
160,UBS, Just curious but why would this mean you are fucked as a UBS employee?,JustKeepLivin7,1,/r/wallstreetbets/comments/11u46wn/ubs_in_talks_to_acquire_credit_suisse/jcpkl7u/,0.325,0.587,0.088,-0.7543
161,CS," Correct. Forced marriage. 
UBS will gladly take the wealth management business and client assets. But wants no part of the IB or trading businesses which give CS a trrrible name and laughing stock of the buy side community.",cloudgainz,3,/r/wallstreetbets/comments/11u46wn/ubs_in_talks_to_acquire_credit_suisse/jcpznwu/,0.106,0.685,0.209,0.5647
162,UBS," Correct. Forced marriage. 
UBS will gladly take the wealth management business and client assets. But wants no part of the IB or trading businesses which give CS a trrrible name and laughing stock of the buy side community.",cloudgainz,3,/r/wallstreetbets/comments/11u46wn/ubs_in_talks_to_acquire_credit_suisse/jcpznwu/,0.106,0.685,0.209,0.5647
163,JPM, Sell me 1% of JPM for 500 Dracula Coins?,banana_buddy,3,/r/wallstreetbets/comments/11u46wn/ubs_in_talks_to_acquire_credit_suisse/jcnb8yb/,0.0,1.0,0.0,0.0
164,CS," Domestic CS easily valued over 12B U.S. plus asset management business wealth management some of the best globally.....their investment banking business is the problem. 

Stay tuned...cheers",ImpossibleCut4808,10,/r/wallstreetbets/comments/11u46wn/ubs_in_talks_to_acquire_credit_suisse/jcmrxft/,0.071,0.528,0.401,0.91
165,EU, What does the EU have to do with this?,wefarrell,1,/r/wallstreetbets/comments/11u46wn/ubs_in_talks_to_acquire_credit_suisse/jcmf9md/,0.0,1.0,0.0,0.0
166,EU, switzerland is not in the EU and even allows US banks to sevice swiss clients without much hurdles. i can't remember switzerland ever objecting to any US mergers ever. also this merger proposal probably comes after substantial pressure was enacted on the swiss gov to intervene from eu/us authorities. anyways not a done deal.,tiktaktok_65,1,/r/wallstreetbets/comments/11u46wn/ubs_in_talks_to_acquire_credit_suisse/jcoc2v5/,0.041,0.926,0.033,-0.1027
167,EU, both do business in the USA and other EU nations and the deal would have to be approved around the world. Just like when a US multinational buys another US multinational. like MS having to get EU permission to buy Activision,lost_in_life_34,5,/r/wallstreetbets/comments/11u46wn/ubs_in_talks_to_acquire_credit_suisse/jcmjl6r/,0.0,0.826,0.174,0.7783
168,MS, both do business in the USA and other EU nations and the deal would have to be approved around the world. Just like when a US multinational buys another US multinational. like MS having to get EU permission to buy Activision,lost_in_life_34,5,/r/wallstreetbets/comments/11u46wn/ubs_in_talks_to_acquire_credit_suisse/jcmjl6r/,0.0,0.826,0.174,0.7783
169,USA, both do business in the USA and other EU nations and the deal would have to be approved around the world. Just like when a US multinational buys another US multinational. like MS having to get EU permission to buy Activision,lost_in_life_34,5,/r/wallstreetbets/comments/11u46wn/ubs_in_talks_to_acquire_credit_suisse/jcmjl6r/,0.0,0.826,0.174,0.7783
